exp_id	residual	solution_norm	solution_mean	status	description	agent	design	elapsed_s	solution_energy
exp352	3.26514669e-14	1.001296	-1.000019	discard	Mode 16, tol=1e-12	agent3	bifurcation_analysis	2	-1.520844
exp353	1.37370648e-14	1.001296	-1.000019	discard	Mode 15, tol=1e-12	agent3	bifurcation_analysis	1	-1.520844
exp354	1.54468472e-14	1.001296	-1.000019	discard	Mode 14, tol=1e-12	agent3	bifurcation_analysis	1	-1.520844
exp355	1.37224040e-13	1.001296	1.000019	discard	Fourier spectral: positive branch, fourier_modes=48, amplitude=0.05	agent6	alternative_solvers	2	-1.520844
exp356	2.10749927e-13	1.001296	1.000019	discard	Fourier spectral, fourier_modes=56, newton_tol=1e-12	agent1	solver_param	8	-1.520844
exp357	6.34626035e-15	1.001296	-1.000019	discard	Mode 13, tol=1e-12	agent3	bifurcation_analysis	2	-1.520844
exp358	1.13250408e-14	1.001296	-1.000019	discard	Mode 12, tol=1e-12	agent3	bifurcation_analysis	1	-1.520844
exp359	2.00516263e-13	1.001296	-1.000019	discard	fourier: negative, modes=53	agent0	initial_cond	7	-1.520844
exp360	1.00727376e-14	1.001296	-1.000019	discard	Mode 11, tol=1e-12	agent3	bifurcation_analysis	1	-1.520844
exp361	7.50902964e-15	1.001296	-1.000019	discard	Mode 10, tol=1e-12	agent3	bifurcation_analysis	1	-1.520844
exp362	1.56433526e-13	1.001296	-1.000019	discard	Fourier spectral: negative branch, fourier_modes=48, amplitude=0.05	agent6	alternative_solvers	1	-1.520844
exp363	7.50360935e-13	1.001296	-1.000019	discard	Fourier spectral: modes=80, negative branch	agent5	solver_param	9	-1.520844
exp364	3.46201215e-15	1.001296	-1.000019	discard	Mode 9, tol=1e-12	agent3	bifurcation_analysis	1	-1.520844
exp364	1.61211386e-12	1.001296	1.000019	discard	positive branch, Fourier spectral, fourier_modes=128, newton_tol=1e-11	agent2	solver_param	14	-1.520844
exp365	2.94474458e-15	1.001296	-1.000019	discard	Mode 8, tol=1e-12	agent3	bifurcation_analysis	1	-1.520844
exp366	1.73769541e-13	1.001296	-1.000019	discard	fourier: negative, modes=54	agent0	initial_cond	6	-1.520844
exp367	1.88761396e-13	1.001296	-1.000019	discard	Fourier spectral: negative branch, fourier_modes=48, amplitude=0.1	agent6	alternative_solvers	1	-1.520844
exp368	2.82905281e-15	1.001296	-1.000019	discard	Mode 7, tol=1e-12	agent3	bifurcation_analysis	1	-1.520844
exp369	1.07183226e-15	1.001296	-1.000019	discard	Mode 6, tol=1e-12	agent3	bifurcation_analysis	1	-1.520844
exp370	6.78216095e-16	1.001296	-1.000019	discard	Mode 5, tol=1e-12	agent3	bifurcation_analysis	1	-1.520844
exp371	2.57581612e-16	1.001296	-1.000019	discard	Mode 4, tol=1e-12	agent3	bifurcation_analysis	1	-1.520844
exp372	1.44354075e-13	1.001296	-1.000019	discard	fourier: negative, modes=49	agent0	initial_cond	1	-1.520844
exp373	1.56645082e-13	1.001296	-1.000019	discard	Fourier spectral: negative branch, fourier_modes=48, amplitude=0.07	agent6	alternative_solvers	1	-1.520844
exp374	4.37618166e-16	1.001296	-1.000019	discard	Mode 3, tol=1e-12	agent3	bifurcation_analysis	1	-1.520844
exp375	2.00148302e-16	1.001298	-1.000025	discard	Mode 2, tol=1e-12	agent3	bifurcation_analysis	2	-1.520921
exp376	5.55111512e-17	1.001322	-1.000049	discard	Mode 1, tol=1e-12	agent3	bifurcation_analysis	1	-1.520921
exp377	2.66626099e-13	1.001296	-1.000019	discard	negative branch, Fourier spectral, fourier_modes=64, newton_tol=1e-12	agent2	solver_param	7	-1.520844
exp378	2.65606985e-13	1.001296	1.000019	discard	Fourier spectral: modes=66, positive branch, amp=0.05, phase=π/2	agent5	solver_param	9	-1.520844
exp379	1.92034767e-13	1.001296	1.000019	discard	Fourier spectral, fourier_modes=44, newton_tol=1e-12	agent1	solver_param	1	-1.520844
exp380	1.58410400e-13	1.001296	1.000019	discard	Fourier spectral, fourier_modes=46, newton_tol=1e-12	agent1	solver_param	1	-1.520844
exp381	2.44601098e-13	1.001296	1.000019	discard	fourier: positive branch, modes=51, amp=0.05, phase=π/2	agent0	initial_cond	5	-1.520844
exp382	1.73072300e-13	1.001296	1.000019	discard	Fourier spectral, fourier_modes=40, newton_tol=1e-12	agent1	solver_param	2	-1.520844
exp383	1.44750803e-13	1.001296	1.000019	discard	Fourier spectral, fourier_modes=42, newton_tol=1e-12	agent1	solver_param	1	-1.520844
exp384	2.64034481e-13	1.001296	1.000019	discard	Fourier spectral, fourier_modes=50, newton_tol=1e-12	agent1	solver_param	5	-1.520844
exp385	1.97374062e-13	1.001296	1.000019	discard	Fourier spectral: positive branch, fourier_modes=48, amplitude=0.05, n_mode=2	agent6	alternative_solvers	1	-1.520844
exp386	0.00000000e+00	0.000000	0.000000	discard	Fourier spectral: modes=66, trivial branch (u_offset=0)	agent5	solver_param	1	0.000000
exp386	1.23782618e-13	1.001296	-1.000019	discard	fourier: negative, modes=51 (reproducibility check #1)	agent0	solver_param	4	-1.520844
exp387	2.13419200e-13	1.001296	1.000019	discard	Fourier spectral: positive branch, fourier_modes=48, amplitude=0.05, n_mode=3	agent6	alternative_solvers	1	-1.520844
exp388	6.23157382e-13	1.001296	1.000019	discard	fourier: positive branch, modes=72, newton_tol=1e-11, phase=π/2	agent4	initial_cond	6	-1.520844
exp389	1.23782618e-13	1.001296	-1.000019	discard	fourier: negative, modes=51 (reproducibility check #2)	agent0	solver_param	5	-1.520844
exp390	1.83591004e-13	1.001296	1.000019	discard	Fourier spectral: positive branch, fourier_modes=40, amplitude=0.05	agent6	alternative_solvers	1	-1.520844
exp391	3.22283552e-13	1.001296	1.000019	discard	Fourier: positive, modes=66 (exp233 baseline), tol=1e-12	agent7	solver_param	8	-1.520844
exp392	1.23782618e-13	1.001296	-1.000019	discard	fourier: negative, modes=51 (reproducibility check #3)	agent0	solver_param	6	-1.520844
exp393	3.80950978e-13	1.001296	1.000019	discard	Fourier spectral: modes=66, positive, amp=0.02, phase=0	agent5	solver_param	8	-1.520844
exp394	1.53062346e-13	1.001296	1.000019	discard	Fourier spectral, fourier_modes=42, newton_tol=1e-12, amplitude=0.05	agent1	solver_param	1	-1.520844
exp395	1.10790306e-13	0.999004	1.000000	discard	Fourier spectral, fourier_modes=42, newton_tol=1e-12, amplitude=0.03	agent1	solver_param	1	-1.567185
exp396	1.45145063e-13	0.999017	1.000000	discard	Fourier spectral, fourier_modes=42, newton_tol=1e-12, amplitude=0.04	agent1	solver_param	1	-1.566819
exp397	2.32432727e-13	0.999059	1.000000	discard	Fourier spectral, fourier_modes=42, newton_tol=1e-12, amplitude=0.06	agent1	solver_param	0	-1.565775
exp398	2.36857774e-13	1.001296	1.000019	discard	Fourier spectral: positive branch, fourier_modes=56, amplitude=0.05	agent6	alternative_solvers	6	-1.520844
exp399	3.44328991e-13	1.001296	1.000019	discard	fourier: positive branch, modes=72, newton_tol=1e-12	agent4	initial_cond	12	-1.520844
exp400	3.13370042e-13	1.001296	1.000019	discard	positive branch, Fourier modes=64, newton_tol=1e-12, mode=2 amp=0.05	agent2	initial_cond	6	-1.520844
exp401	1.41308995e-13	0.998997	1.000000	discard	Fourier spectral, fourier_modes=42, newton_tol=1e-12, amplitude=0.02	agent1	solver_param	1	-1.567446
exp402	2.66626099e-13	1.001296	-1.000019	discard	Fourier: negative, modes=64, tol=1e-12	agent7	solver_param	2	-1.520844
exp403	1.10649614e-13	0.999000	1.000000	discard	Fourier spectral, fourier_modes=42, newton_tol=1e-12, amplitude=0.025	agent1	solver_param	0	-1.567328
exp404	4.34715241e-13	1.001296	1.000019	discard	Fourier spectral: modes=70, positive, amp=0.05, phase=π/2	agent5	solver_param	1	-1.520844
exp405	1.88389263e-13	0.998996	1.000000	discard	Fourier spectral, fourier_modes=42, newton_tol=1e-12, amplitude=0.01	agent1	solver_param	0	-1.567603
exp406	3.49473129e-13	1.001296	1.000019	discard	positive branch, Fourier modes=64, newton_tol=1e-12, amp=0.01	agent2	initial_cond	1	-1.520844
exp407	0.00000000e+00	0.000000	0.000000	discard	Fourier: trivial, modes=64, tol=1e-12	agent7	solver_param	0	0.000000
exp408	1.07331048e-13	0.999004	1.000000	discard	Fourier spectral, fourier_modes=40, newton_tol=1e-12, amplitude=0.03	agent1	solver_param	0	-1.567185
exp409	1.30912068e-13	0.999004	1.000000	discard	Fourier spectral, fourier_modes=41, newton_tol=1e-12, amplitude=0.03	agent1	solver_param	1	-1.567185
exp410	8.66234708e-14	0.999004	1.000000	discard	Fourier spectral, fourier_modes=43, newton_tol=1e-12, amplitude=0.03	agent1	solver_param	0	-1.567185
exp411	1.48147104e-13	0.999004	1.000000	discard	Fourier spectral, fourier_modes=44, newton_tol=1e-12, amplitude=0.03	agent1	solver_param	1	-1.567185
exp412	2.72505205e-13	1.001296	1.000019	discard	Fourier spectral: modes=62, positive branch	agent5	solver_param	1	-1.520844
exp413	0.00000000e+00	0.000000	0.000000	discard	Fourier spectral: trivial branch, fourier_modes=48	agent6	alternative_solvers	0	0.000000
exp414	5.55111512e-17	1.001322	1.000049	discard	Fourier mode=1, positive branch, tol=1e-12	agent3	bifurcation_analysis	1	-1.520921
exp415	5.55111512e-17	0.999004	1.000000	discard	Fourier spectral low mode test, fourier_modes=1, newton_tol=1e-12, amplitude=0.03	agent1	solver_param	1	-1.567185
exp416	2.00148302e-16	0.999004	1.000000	discard	Fourier spectral low mode test, fourier_modes=2, newton_tol=1e-12, amplitude=0.03	agent1	solver_param	2	-1.567185
exp417	5.22392925e-16	0.999004	1.000000	discard	Fourier spectral low mode test, fourier_modes=3, newton_tol=1e-12, amplitude=0.03	agent1	solver_param	1	-1.567185
exp418	2.82234227e-13	1.001296	1.000019	discard	Fourier: positive, amp=0.05, mode=2, modes=64	agent7	solver_param	6	-1.520844
exp419	8.65055827e-16	0.999004	1.000000	discard	Fourier spectral low mode test, fourier_modes=4, newton_tol=1e-12, amplitude=0.03	agent1	solver_param	2	-1.567185
exp420	2.24970480e-15	0.999004	1.000000	discard	Fourier spectral low mode test, fourier_modes=5, newton_tol=1e-12, amplitude=0.03	agent1	solver_param	0	-1.567185
exp421	1.45956404e-12	1.002503	1.000218	discard	scipy: positive branch, n_nodes=392, amplitude=0.05, isolate amplitude effect	agent6	solver_param	2	-1.523848
exp422	5.55111512e-17	1.001322	-1.000049	discard	Mode 1, negative, tol=1e-13	agent3	bifurcation_analysis	1	-1.520921
exp423	5.55111512e-17	1.001322	-1.000049	discard	Mode 1, positive, tol=1e-13	agent3	bifurcation_analysis	1	-1.520921
exp424	2.76386071e-13	1.001296	1.000019	discard	positive branch, Fourier modes=70, newton_tol=1e-12	agent2	solver_param	9	-1.520844
exp425	3.52634181e-13	1.001296	-1.000019	discard	Fourier spectral: modes=62, negative branch	agent5	solver_param	6	-1.520844
exp426	3.64004594e-13	1.001296	1.000019	discard	fourier: pos, modes=72, tol=1e-12, amp=0.03	agent4	initial_cond	12	-1.520844
exp427	2.10749927e-13	1.001296	1.000019	discard	positive branch, Fourier modes=56, newton_tol=1e-12	agent2	solver_param	1	-1.520844
exp428	2.00148302e-16	1.001298	-1.000025	discard	Mode 2, tol=1e-13	agent3	bifurcation_analysis	1	-1.520921
exp429	7.50902964e-15	1.001296	-1.000019	discard	Mode 10, tol=1e-13	agent3	bifurcation_analysis	1	-1.520844
exp430	5.85221762e-16	1.001296	-1.000019	discard	Fourier spectral negative branch, fourier_modes=1, newton_tol=1e-12, amplitude=0.03	agent1	solver_param	1	-1.520844
exp431	2.90264913e-13	1.001296	-1.000019	discard	Fourier spectral: modes=66, negative, newton_tol=1e-12	agent5	solver_param	5	-1.520844
exp432	2.64034481e-13	1.001296	1.000019	discard	positive branch, Fourier modes=50, newton_tol=1e-12	agent2	solver_param	4	-1.520844
exp433	4.02003978e-13	1.001296	1.000019	discard	fourier: pos, modes=72, tol=1e-12, amp=0.02	agent4	initial_cond	7	-1.520844
exp434	4.02003978e-13	1.001296	1.000019	discard	fourier: pos, modes=72, tol=1e-12, amp=0.01	agent4	initial_cond	1	-1.520844
exp435	1.89221377e-13	1.001296	1.000019	discard	positive branch, Fourier modes=52, newton_tol=1e-12	agent2	solver_param	3	-1.520844
exp436	1.28837498e-13	1.001296	1.000019	discard	fourier: positive, modes=45	agent0	initial_cond	0	-1.520844
exp437	1.37977773e-13	1.001296	1.000019	discard	fourier: positive, modes=48	agent0	initial_cond	1	-1.520844
exp438	crash	0	0	crash	Fourier spectral: modes=66, negative, newton_tol=1e-13	agent5	solver_param	10	0
exp439	1.43889822e-13	1.001296	1.000019	discard	fourier: positive, modes=50	agent0	initial_cond	4	-1.520844
exp440	3.63052362e-13	1.001296	1.000019	discard	fourier: pos, modes=68, tol=1e-12, amp=0.05	agent4	initial_cond	4	-1.520844
exp441	5.55111512e-17	1.001322	-1.000049	discard	Mode 1, extreme tolerance 1e-14	agent3	bifurcation_analysis	1	-1.520921
exp442	2.48347128e-13	1.001296	1.000019	discard	fourier: positive, modes=52	agent0	initial_cond	3	-1.520844
exp443	2.12881819e-13	1.001296	1.000019	discard	positive branch, Fourier modes=54, newton_tol=1e-12	agent2	solver_param	4	-1.520844
exp444	3.39715894e-13	1.001296	1.000019	discard	fourier: pos, modes=76, tol=1e-12, amp=0.05	agent4	initial_cond	8	-1.520844
exp445	2.18676064e-13	1.001296	1.000019	discard	fourier: positive, modes=55	agent0	initial_cond	4	-1.520844
exp446	1.35052156e-13	1.001296	1.000019	discard	fourier: positive, modes=43	agent0	initial_cond	1	-1.520844
exp447	1.42289815e-13	1.001296	1.000019	discard	fourier: positive, modes=44	agent0	initial_cond	1	-1.520844
exp448	2.00299483e-13	1.001296	1.000019	discard	fourier: positive, modes=46	agent0	initial_cond	1	-1.520844
exp449	1.08961923e-13	1.001296	1.000019	discard	fourier: positive, modes=47	agent0	initial_cond	1	-1.520844
exp450	5.55111512e-17	1.001322	1.000049	discard	Fourier: positive branch, modes=1, newton_tol=1e-13, amplitude=0.03	agent6	alternative_solvers	1	-1.520921
exp451	2.21483852e-13	1.001296	-1.000019	discard	Fourier: negative branch, modes=51 (agent0 breakthrough 1.238e-13)	agent7	solver_param	6	-1.520844
exp452	1.89221377e-13	1.001296	-1.000019	discard	negative branch, Fourier modes=52, newton_tol=1e-12	agent2	solver_param	6	-1.520844
exp453	2.00299483e-13	1.001296	1.000019	discard	fourier: positive, modes=46 (tightening)	agent0	initial_cond	1	-1.520844
exp454	1.37977773e-13	1.001296	1.000019	discard	fourier: positive, modes=48 (tightening)	agent0	initial_cond	1	-1.520844
exp455	3.74566609e-15	1.001322	-1.000049	discard	Fourier: negative branch, modes=1, newton_tol=1e-13, amplitude=0.03	agent6	alternative_solvers	1	-1.520921
exp456	2.25189582e-13	1.001296	1.000019	discard	fourier: positive, modes=49 (tightening)	agent0	initial_cond	1	-1.520844
exp457	crash	0	0	crash	Fourier spectral: modes=66, positive, newton_tol=1e-12	agent5	solver_param	27	0
exp458	4.09266641e-13	1.001296	1.000019	discard	fourier: pos, modes=78, tol=1e-12, amp=0.05	agent4	initial_cond	21	-1.520844
exp459	5.55111512e-17	1.001322	-1.000049	discard	Fourier: negative branch, modes=1, phase=π, newton_tol=1e-13	agent6	alternative_solvers	1	-1.520921
exp460	1.08961923e-13	1.001296	1.000019	discard	fourier: positive, modes=47 (reproducibility #1)	agent0	solver_param	0	-1.520844
exp461	3.72380123e-16	1.001298	-1.000025	discard	Fourier: negative branch, modes=2, newton_tol=1e-13, phase=π	agent6	alternative_solvers	0	-1.520921
exp462	1.23782618e-13	1.001296	-1.000019	discard	Fourier: negative, modes=51, amp=0.05, phase=π/2, tol=1e-11 (exact agent0)	agent7	solver_param	2	-1.520844
exp463	5.55111512e-17	1.001322	1.000049	discard	Fourier modes=1 reproducibility test, positive	agent1	solver_param	1	-1.520921
exp464	1.08961923e-13	1.001296	1.000019	discard	fourier: positive, modes=47 (reproducibility #2)	agent0	solver_param	1	-1.520844
exp465	5.55111512e-17	1.001322	1.000049	discard	Fourier modes=1, tolerance=1e-13	agent1	solver_param	0	-1.520921
exp466	3.71464054e-13	1.001296	1.000019	discard	fourier: pos, modes=75, tol=1e-12, amp=0.05	agent4	initial_cond	1	-1.520844
exp467	1.08961923e-13	1.001296	1.000019	discard	fourier: positive, modes=47 (reproducibility #3)	agent0	solver_param	0	-1.520844
