exp001	2.80498569e-21	0.000000	keep	default config u_offset=0 amp=0.1 mode=1	agent0	initial_cond	0	0.000000
exp260	3.21258938e-13	1.001296	discard	no description	agent0	initial_cond	0	-1.520844
exp261	3.25707148e-13	1.001296	discard	no description	agent0	initial_cond	0	-1.520844
exp262	3.65202709e-13	1.001296	discard	no description	agent0	initial_cond	0	-1.520844
exp263	crash	0	crash	no description	agent0	initial_cond	0	0
exp264	2.00733257e-13	1.001296	discard	no description	agent0	initial_cond	0	-1.520844
exp265	2.00733257e-13	1.001296	discard	no description	agent0	initial_cond	0	-1.520844
exp266	2.00733257e-13	1.001296	discard	no description	agent0	initial_cond	0	-1.520844
exp267	2.00733257e-13	1.001296	discard	no description	agent0	initial_cond	0	-1.520844
exp268	2.00733257e-13	1.001296	discard	no description	agent0	initial_cond	1	-1.520844
exp269	2.00733257e-13	1.001296	discard	no description	agent0	initial_cond	0	-1.520844
exp270	2.00733257e-13	1.001296	discard	no description	agent0	initial_cond	0	-1.520844
exp271	2.00733257e-13	1.001296	discard	no description	agent0	initial_cond	0	-1.520844
exp272	3.25707148e-13	1.001296	discard	no description	agent0	initial_cond	0	-1.520844
exp273	2.96853999e-13	1.001296	discard	no description	agent0	initial_cond	0	-1.520844
exp274	2.47270036e-13	1.001296	discard	no description	agent0	initial_cond	1	-1.520844
exp275	3.27228572e-13	1.001296	discard	no description	agent0	initial_cond	0	-1.520844
exp276	2.00733257e-13	1.001296	discard	no description	agent0	initial_cond	1	-1.520844
exp277	3.25707148e-13	1.001296	discard	no description	agent0	initial_cond	0	-1.520844
exp278	crash	0	crash	no description	agent0	initial_cond	0	0
exp279	2.00733257e-13	1.001296	discard	no description	agent0	initial_cond	0	-1.520844
exp280	3.25707148e-13	1.001296	discard	no description	agent0	initial_cond	0	-1.520844
exp281	crash	0	crash	no description	agent0	initial_cond	0	0
exp282	2.00733257e-13	1.001296	discard	no description	agent0	initial_cond	0	-1.520844
exp283	3.80673510e-13	1.001296	discard	no description	agent0	initial_cond	1	-1.520844
exp284	2.20199494e-13	1.001296	discard	no description	agent0	initial_cond	0	-1.520844
exp285	3.71133912e-13	1.001296	discard	no description	agent0	initial_cond	0	-1.520844
exp286	3.65202709e-13	1.001296	discard	no description	agent0	initial_cond	1	-1.520844
exp287	2.81247192e-13	1.001296	discard	no description	agent0	initial_cond	0	-1.520844
exp288	2.29684809e-13	1.001296	discard	no description	agent0	initial_cond	0	-1.520844
exp289	2.92937639e-13	1.001296	discard	no description	agent0	initial_cond	0	-1.520844
exp290	2.94752586e-13	1.001296	discard	no description	agent0	initial_cond	0	-1.520844
exp291	2.01827387e-13	1.001296	discard	no description	agent0	initial_cond	0	-1.520844
exp292	crash	0	crash	no description	agent0	initial_cond	0	0
exp293	2.01827387e-13	1.001296	discard	no description	agent0	initial_cond	0	-1.520844
exp294	2.01827387e-13	1.001296	discard	no description	agent0	initial_cond	0	-1.520844
exp295	2.01827387e-13	1.001296	discard	no description	agent0	initial_cond	0	-1.520844
exp296	2.01827387e-13	1.001296	discard	no description	agent0	initial_cond	0	-1.520844
exp297	2.01827387e-13	1.001296	discard	no description	agent0	initial_cond	0	-1.520844
exp298	2.01827387e-13	1.001296	discard	no description	agent0	initial_cond	0	-1.520844
exp299	2.01827387e-13	1.001296	discard	no description	agent0	initial_cond	1	-1.520844
exp300	2.01827387e-13	1.001296	discard	no description	agent0	initial_cond	0	-1.520844
exp301	2.01827387e-13	1.001296	discard	no description	agent0	initial_cond	0	-1.520844
exp302	crash	0	crash	no description	agent0	initial_cond	1	0
exp303	crash	0	crash	no description	agent0	initial_cond	0	0
exp304	crash	0	crash	no description	agent0	initial_cond	1	0
exp305	2.00733257e-13	1.001296	discard	no description	agent0	initial_cond	1	-1.520844
exp306	crash	0	crash	no description	agent0	initial_cond	1	0
exp307	2.00733257e-13	1.001296	discard	no description	agent0	initial_cond	0	-1.520844
exp308	0.00000000e+00	0.000000	discard	no description	agent0	initial_cond	0	0.000000
exp309	3.61191662e-13	1.001296	discard	no description	agent0	initial_cond	0	-1.520844
exp310	3.61191662e-13	1.001296	discard	no description	agent0	initial_cond	1	-1.520844
exp311	1.24756266e-23	0.000000	discard	no description	agent0	initial_cond	0	0.000000
exp312	3.56681400e-13	1.001296	discard	no description	agent0	initial_cond	1	-1.520844
exp313	crash	0	crash	no description	agent0	initial_cond	1	0
exp314	crash	0	crash	no description	agent0	initial_cond	12	0
exp315	3.05421974e-13	1.001296	discard	no description	agent0	initial_cond	0	-1.520844
exp316	crash	0	crash	no description	agent0	initial_cond	0	0
exp317	3.11912449e-13	1.001296	discard	no description	agent0	initial_cond	1	-1.520844
exp318	3.54387306e-13	1.001296	discard	no description	agent0	initial_cond	0	-1.520844
exp319	3.29478461e-13	1.001296	discard	no description	agent0	initial_cond	0	-1.520844
exp320	3.42609616e-13	1.001296	discard	no description	agent0	initial_cond	1	-1.520844
exp321	3.04983363e-13	1.001296	discard	no description	agent0	initial_cond	0	-1.520844
exp322	3.10273159e-13	1.001296	discard	no description	agent0	initial_cond	1	-1.520844
exp323	3.04764060e-13	1.001296	discard	no description	agent0	initial_cond	1	-1.520844
exp324	3.58303978e-13	1.001296	discard	no description	agent0	initial_cond	0	-1.520844
exp325	4.03543405e-13	1.001296	discard	no description	agent0	initial_cond	1	-1.520844
exp326	crash	0	crash	no description	agent0	initial_cond	0	0
exp327	crash	0	crash	no description	agent0	initial_cond	0	0
exp328	3.62024838e-13	1.001296	discard	no description	agent0	initial_cond	0	-1.520844
exp329	1.46736390e-22	0.000000	discard	no description	agent0	initial_cond	0	0.000000
exp330	2.70270424e-13	1.001296	discard	no description	agent0	initial_cond	0	-1.520844
exp331	2.13120531e-13	1.001296	discard	no description	agent0	initial_cond	1	-1.520844
exp332	3.60792472e-13	1.001296	discard	no description	agent0	initial_cond	2	-1.520844
exp333	3.22154155e-13	1.001296	discard	no description	agent0	initial_cond	1	-1.520844
exp334	3.52318921e-13	1.001296	discard	no description	agent0	initial_cond	0	-1.520844
exp335	2.97219424e-13	1.001296	discard	no description	agent0	initial_cond	0	-1.520844
exp336	2.95242834e-13	1.001296	discard	no description	agent0	initial_cond	1	-1.520844
exp337	crash	0	crash	no description	agent0	initial_cond	1	0
exp338	crash	0	crash	no description	agent0	initial_cond	0	0
exp339	3.56681400e-13	1.001296	discard	no description	agent0	initial_cond	1	-1.520844
exp340	3.17909258e-13	1.001296	discard	no description	agent0	initial_cond	0	-1.520844
exp341	3.33723973e-13	1.001296	discard	no description	agent0	initial_cond	0	-1.520844
exp342	2.95697106e-13	1.001296	discard	no description	agent0	initial_cond	1	-1.520844
exp343	crash	0	crash	no description	agent0	initial_cond	0	0
exp344	2.13120531e-13	1.001296	discard	no description	agent0	initial_cond	0	-1.520844
exp345	2.73161140e-13	1.001296	discard	no description	agent0	initial_cond	0	-1.520844
exp346	2.35591834e-13	1.001296	discard	no description	agent0	initial_cond	0	-1.520844
exp347	crash	0	crash	no description	agent0	initial_cond	1	0
exp348	3.25951309e-13	1.001296	discard	no description	agent0	initial_cond	0	-1.520844
exp349	3.85793846e-13	1.001296	discard	no description	agent0	initial_cond	0	-1.520844
exp350	crash	0	crash	no description	agent0	initial_cond	1	0
exp351	crash	0	crash	no description	agent0	initial_cond	1	0
exp352	3.27908979e-13	1.001296	discard	no description	agent0	initial_cond	0	-1.520844
exp353	2.97971480e-13	1.001296	discard	no description	agent0	initial_cond	1	-1.520844
exp354	3.01711359e-13	1.001296	discard	no description	agent0	initial_cond	0	-1.520844
exp355	1.22356838e-18	0.000000	discard	no description	agent0	initial_cond	0	-0.000000
exp356	crash	0	crash	no description	agent0	initial_cond	1	0
exp357	crash	0	crash	no description	agent0	initial_cond	1	0
exp358	crash	0	crash	no description	agent0	initial_cond	1	0
exp359	crash	0	crash	no description	agent0	initial_cond	1	0
exp360	crash	0	crash	no description	agent0	initial_cond	3	0
exp361	crash	0	crash	no description	agent0	initial_cond	1	0
exp362	3.45396166e-13	1.001296	discard	no description	agent0	initial_cond	0	-1.520844
exp363	crash	0	crash	no description	agent0	initial_cond	3	0
exp364	crash	0	crash	no description	agent0	initial_cond	0	0
exp365	crash	0	crash	no description	agent0	initial_cond	1	0
exp366	crash	0	crash	no description	agent0	initial_cond	0	0
exp367	2.86591582e-13	1.001296	discard	no description	agent0	initial_cond	0	-1.520844
exp368	2.82149048e-13	1.001296	discard	no description	agent0	initial_cond	0	-1.520844
exp369	2.86809869e-13	1.001296	discard	no description	agent0	initial_cond	0	-1.520844
exp370	3.59904662e-13	1.001296	discard	no description	agent0	initial_cond	0	-1.520844
exp371	2.71918175e-13	1.001296	discard	no description	agent0	initial_cond	1	-1.520844
exp372	3.15188334e-13	1.001296	discard	no description	agent0	initial_cond	0	-1.520844
exp373	2.86961478e-13	1.001296	discard	no description	agent0	initial_cond	0	-1.520844
exp374	crash	0	crash	no description	agent0	initial_cond	0	0
exp375	crash	0	crash	no description	agent0	initial_cond	0	0
exp376	3.19954282e-13	1.001296	discard	no description	agent0	initial_cond	1	-1.520844
exp377	6.08725909e-24	0.000000	discard	no description	agent0	initial_cond	0	0.000000
exp378	3.04764060e-13	1.001296	discard	no description	agent0	initial_cond	1	-1.520844
exp379	crash	0	crash	no description	agent0	initial_cond	1	0
exp380	3.28879506e-13	1.001296	discard	no description	agent0	initial_cond	0	-1.520844
exp381	2.68570856e-13	1.001296	discard	no description	agent0	initial_cond	1	-1.520844
exp382	3.34481066e-13	1.001296	discard	no description	agent0	initial_cond	1	-1.520844
exp383	3.49811634e-13	1.001296	discard	no description	agent0	initial_cond	0	-1.520844
