exp_id	score	vram	status	description	agent	design	train_min
exp001	1.171181	11701.0	keep	SDPA baseline depth=8 AR=64 batch=2^17	manual	hyperparam	5
exp002	1.171318	11701.0	discard	TOTAL_BATCH_SIZE=2^16 for more steps in 5min	agent0	hyperparam	5
exp003	1.106267	11549.0	keep	halve TOTAL_BATCH_SIZE from 2^17 to 2^16 — doubles optimizer steps	agent1	hyperparam	5
exp004	1.101996	11549.0	keep	TOTAL_BATCH_SIZE=2^16 grad_accum=1 for max steps	agent0	hyperparam	5
exp005	1.107461	11549.0	discard	batch 2^16 + matrix_lr=0.06 (from 0.04)	agent1	optimizer	5
exp006	1.112306	11549.0	discard	batch2^16+rope200k+warmup0.03	agent0	hyperparam	5
exp007	1.107387	11549.0	discard	MLP ratio 3x (from 4x) — fewer params, faster steps, more optimization	agent0	architecture	5
exp008	1.113040	11549.0	discard	matrix_lr=0.08 (from 0.06), all else same as best	agent1	optimizer	5
exp009	1.105093	11549.0	discard	WARMDOWN_RATIO=0.67 (from 0.5) — longer gradual LR decay	agent0	schedule	5
exp010	1.113548	11549.0	discard	WARMDOWN_RATIO=0.3 (from 0.5) — more time at peak LR	agent1	schedule	5
exp011	1.108498	11549.0	discard	EMBEDDING_LR=1.0 (from 0.6) — faster embedding learning	agent0	optimizer	5
exp012	1.124755	5997.2	discard	DEVICE_BATCH_SIZE=16 TOTAL_BATCH_SIZE=2^15 — double steps to ~2400	agent1	hyperparam	5
exp013	1.102547	11549.0	discard	WEIGHT_DECAY=0.0 (from 0.2) — remove regularization at short training	agent0	regularization	5
exp014	1.112268	11549.0	discard	softcap=30 (from 15) — less aggressive logit clamping	agent1	architecture	5
exp015	1.101255	11549.0	keep	MATRIX_LR=0.04 (revert from 0.06) with RoPE 200K — test if lower Muon LR is better	agent0	optimizer	5
exp016	1.110463	11549.0	discard	UNEMBEDDING_LR=0.008 (from 0.004) — faster lm_head learning	agent1	optimizer	5
exp017	1.103183	11549.0	discard	EMBEDDING_LR=0.4 (from 0.6) — lower embedding LR consistent with lower matrix_lr win	agent0	optimizer	5
exp018	1.103549	11549.0	discard	EMBEDDING_LR=0.4 (from 0.6) — slightly lower embedding LR, from new best config with matrix_lr=0.04	agent1	optimizer	5
exp019	crash		crash	depth=10 AR=64 (640-dim, 5 heads) — more capacity, may OOM	agent0	architecture	0
exp020	crash		crash	Remove value embeddings — VE ablation, frees 16.8M params (33% of model)	agent1	ablation	0
exp021	1.114496	11195.0	discard	Remove value embeddings — VE ablation v2 (also disables VE gates)	agent1	ablation	5
exp022	1.214665	9393.4	discard	depth=10 devbatch=16 batch2^16 — more capacity, 2x grad_accum, ~600 steps	agent0	architecture	6
exp023	crash		crash	GQA with n_kv_head=2 (from 4) — halve KV heads, save params for potential depth increase	agent1	architecture	0
exp024	1.109210	11549.0	discard	GQA n_kv_head=2 v2 (with KV head expansion fix in SDPA)	agent1	architecture	5
exp025	1.111218	11092.0	discard	remove softcap entirely — test if QK-norm makes it redundant	agent0	architecture	5
exp026	1.101116	11549.0	keep	FINAL_LR_FRAC=0.05 (from 0.0) — non-zero final LR	agent1	schedule	5
exp027	1.100641	11549.0	keep	MATRIX_LR=0.02 (from 0.04) — test if even lower Muon LR helps	agent0	optimizer	5
exp028	1.099750	11549.0	keep	FINAL_LR_FRAC=0.03 (calibration says sometimes better than 0.05)	agent1	schedule	5
exp029	1.099400	11549.0	keep	MATRIX_LR=0.02 + FINAL_LR_FRAC=0.05 — combine two additive improvements	agent0	optimizer	5
exp030	1.099741	11549.0	discard	MATRIX_LR=0.02 + FINAL_LR_FRAC=0.03 — combining two wins	agent1	optimizer	5
exp031	1.099829	11549.0	discard	MATRIX_LR=0.02 + FINAL_LR_FRAC=0.03 — test 0.03 vs 0.05 at matrix_lr=0.02	agent0	optimizer	5
exp032	1.108755	11549.0	discard	MATRIX_LR=0.01 + FINAL_LR_FRAC=0.05 — push matrix LR even lower	agent1	optimizer	5
exp033	1.103438	11549.0	discard	SCALAR_LR=1.0 (from 0.5) — faster per-layer scalar learning	agent0	optimizer	5
exp034	1.102206	11549.0	discard	MATRIX_LR=0.015 — fine grid between 0.01 (too low) and 0.02 (best)	agent1	optimizer	5
exp035	1.424567	13589.5	discard	label_smoothing=0.1 in cross_entropy — regularization via softer targets	agent1	regularization	5
exp036	1.102057	11549.0	discard	ADAM_BETAS=(0.9, 0.95) — slower beta1 for embeddings	agent1	optimizer	5
exp037	1.096144	11549.9	keep	WINDOW_PATTERN=S all-short windows at optimal config (1190 steps)	agent0	architecture	5
exp038	1.095829	11549.9	keep	softcap=10 (from 15) — tighter logit capping for stronger regularization, on best config (mlr=0.02+flr=0.05+batch2^16+rope200k)	agent1	architecture	5
exp039	1.106415	11572.5	discard	WINDOW_PATTERN=S with optimal config (batch2^16 mlr0.02 flr0.05 rope200k)	agent0	architecture	5
exp040	1.105760	11572.5	discard	z-loss regularization (1e-4 * logsumexp^2) on best config (windowS+mlr0.02+flr0.05)	agent1	regularization	5
exp041	1.096594	11549.9	discard	HEAD_DIM=64 (8 heads vs 4 at 512-dim) — more attention diversity	agent0	architecture	5
exp042	1.098621	11688.1	discard	softcap=8 (from 10) — continue lower-softcap trend, best config otherwise	agent1	architecture	5
exp043	1.096293	11549.9	discard	buffer_size=5000 (from 1000) — better best-fit packing, data pipeline change, clean config (softcap=10+HEAD_DIM=128+no_zloss)	agent0	hyperparam	5
exp044	1.101672	11549.9	discard	ns_steps=3 (from 5) — fewer Muon polar express iterations, faster steps, more total steps	agent1	optimizer	5
exp045	1.098148	11549.9	discard	cosine warmdown schedule (from linear) — smoother LR decay, more time at moderate LR, clean config	agent0	schedule	5
exp046	1.090281	6953.0	keep	depth=6 (from 8) — smaller model for 50% more optimizer steps, throughput play	agent1	architecture	5
exp047	crash		crash	weight tying (lm_head.weight = wte.weight) — saves 4.2M params (8%), shared embedding/output representation, clean config	agent0	architecture	0
exp048	crash		crash	depth=4 (from 6/8) — ultra shallow for max throughput, test capacity floor	agent1	architecture	0
exp049	1.089782	6952.6	keep	depth=6 + weight tying — saves 48% params (12.6M), test regularization effect at small scale	agent0	architecture	5
exp050	1.089305	10299.4	keep	depth=7 (512-dim, 4 heads, 7 layers) — bracket depth optimum between 6 and 8	agent1	architecture	5
exp051	1.090932	6952.6	discard	depth=6 + weight tying + mlr=0.03 (from 0.02) — LR retune for 384-dim regime + optimizer bugfix (value_embeds/resid/x0 groups were missing)	agent0	optimizer	5
exp052	1.090674	6952.6	discard	depth=6 + weight tying + matrix_lr=0.03 (from 0.02) — LR retune at 384-dim with 2x more steps	agent1	optimizer	5
exp053	1.089072	10299.4	keep	depth=7 + weight tying (512-dim, 4 heads, ~27M unique params) — combine best depth with regularization	agent1	architecture	5
exp054	1.094260	5357.4	discard	depth=7 + TOTAL_BATCH_SIZE=2^15 + DEVICE_BATCH_SIZE=16 — batch halving for more steps at depth=7, test if step count wins overcome gradient noise	agent0	hyperparam	5
exp055	1.088910	10299.4	keep	depth=7 + weight tying + EMBEDDING_LR=0.4 (from 0.6) — lower embedding LR for weight-tied config where embedding also serves as output projection	agent0	optimizer	5
exp056	crash		crash	sequence_len=1024 training (eval stays at 2048) — halve attention cost, more steps at full depth=7+wt capacity, orthogonal throughput lever	agent0	architecture	0
exp057	1.145403	5495.7	discard	TRAIN_SEQ_LEN=1024 (from 2048) — halve training context for faster attention, orthogonal throughput lever, depth=7+wt best config	agent1	architecture	5
exp058	1.144892	5496.7	discard	sequence_len=1024 training v2 (contiguous fix) — halve attention cost, more steps at depth=7+wt capacity	agent0	architecture	5
exp059	1.090145	10299.4	discard	softcap=15 (from 10) at depth=7+wt — retune softcap at new operating point (1430 steps vs 1240 at depth=8)	agent1	hyperparam	5
exp060	1.091679	10299.4	discard	EMBEDDING_LR=0.3 (from 0.4) at depth=7+wt — continue lower-embedding-LR trend for weight-tied config	agent0	optimizer	5
exp061	1.093252	10299.4	discard	WEIGHT_DECAY=0.0 (from 0.2) at depth=7+wt — test if weight tying makes explicit weight decay redundant	agent1	hyperparam	5
exp062	1.100354	9141.4	discard	HEAD_DIM=64 (8 heads vs 4) at depth=7+wt — more attention diversity, orthogonal architecture axis flagged by gardener	agent0	architecture	5
exp063	1.089107	10299.4	discard	FINAL_LR_FRAC=0.03 (from 0.05) at depth=7+wt — test if lower final LR helps at weight-tied operating point	agent1	schedule	5
exp064	1.089878	10299.4	discard	WARMDOWN_RATIO=0.4 (from 0.5) at depth=7+wt — shorter warmdown, more peak LR time, testing at 1389-step operating point	agent1	schedule	5
exp065	1.096017	11233.2	discard	MLP ratio 5x (from 4x) at depth=7+wt — more MLP capacity if model is attention-bound, testing free capacity hypothesis	agent1	architecture	5
exp066	1.090943	10299.4	discard	constant Muon momentum=0.95 (skip 0.85->0.95 ramp over 300 steps) at depth=7+wt — 21% of training at suboptimal momentum, test if eliminating ramp helps	agent1	optimizer	5
exp067	1.085047	10299.4	keep	short_window=512 (seq_len//4 vs seq_len//2=1024) at depth=7+wt — tighter local attention for layers 0-5, last layer keeps full 2048, TinyStories docs are short enough for 512-token windows	agent1	architecture	5
exp068	1.105318	10235.4	discard	freeze value embeddings at init — selective param freezing as regularization, depth=7+wt best config	agent0	architecture	5
exp069	1.083949	10299.4	keep	short_window=256 (seq_len//8) at depth=7+wt — push tighter local attention, bracket window size optimum	agent0	architecture	5
exp070	1.083842	10299.4	keep	short_window=128 (seq_len//16) at depth=7+wt — push tighter local attention, window bracket {1024=1.089, 512=1.085, 256=1.084}	agent0	architecture	5
exp071	1.083695	10299.4	keep	short_window=128 (seq_len//16) at depth=7+wt — continue tighter window trend, bracket window optimum	agent1	architecture	5
exp072	1.084054	10299.4	discard	short_window=64 (seq_len//32) at depth=7+wt — ultra-tight local attention, bracket window size floor	agent0	architecture	5
exp073	1.084182	10299.4	discard	Muon beta2=0.99 (from 0.95) — more stable NorMuon second momentum, untested optimizer axis	agent1	optimizer	5
exp074	1.085638	10299.4	discard	graduated windows (128/128/128/256/256/256/2048) at depth=7+wt — hierarchical attention: tight early, wider late	agent0	architecture	5
exp075	1.088946	10299.4	discard	constant WEIGHT_DECAY=0.2 (no linear decay) — model overfits at depth=7+wt, keep regularization through warmdown	agent1	optimizer	5
exp076	1.088087	10299.4	discard	x0_lambda init=0.2 (from 0.1) at depth=7+wt+window128 — stronger skip-to-input connection, never swept	agent0	architecture	5
exp077	1.087547	6952.6	discard	depth=6+wt+window128 — combine throughput advantage (2358 steps) with window improvement, test if additive	agent1	architecture	5
exp078	1.085770	10299.4	discard	Adam beta1=0.9 (from 0.8) for embeddings — slower momentum for weight-tied config, completely untested	agent1	optimizer	5
exp079	1.130037	10299.4	discard	ALL layers use 128 window (no full-context final layer) at depth=7+wt — test if global context is needed at all	agent0	architecture	5
exp080	1.087187	10747.4	discard	residual dropout=0.02 — light regularization at depth=7+wt, model sees 3.4 epochs so may overfit	agent1	regularization	5
exp081	1.087090	10747.4	discard	residual dropout=0.02 in Block.forward (attn+MLP) — activation-level regularization, genuinely new axis, depth=7+wt+window128	agent1	regularization	5
exp082	1.083849	10299.4	discard	gradient clipping max_norm=1.0 before optimizer.step() at depth=7+wt+window128 — stabilize training from gradient spikes	agent0	optimizer	5
exp083	1.086134	10299.4	discard	gradient clipping max_norm=1.0 before optimizer.step() — stabilize early gradient spikes	agent0	optimizer	5
exp084	1.084483	10299.4	discard	warmup=0.02 + embedding_std=0.5 + Muon ramp 150 steps — multi-variable early training dynamics combo	agent0	optimizer	5
exp085	1.084022	10299.4	discard	WARMUP_RATIO=0.02 (from 0.0) at depth=7+wt+window128 — never tested at this operating point, 30 steps warmup to stabilize early Muon	agent1	schedule	5
exp086	1.533772	10299.4	discard	GELU activation (from ReLU²) at depth=7+wt+window128 — smoother gradient flow, genuinely untested activation	agent1	architecture	5
exp087	1.533855	10299.4	discard	zero attention Q/K/V init — start as pure MLP network, let attention learn from scratch	agent0	architecture	5
exp088	1.085151	10299.4	discard	WEIGHT_DECAY=0.3 (from 0.2) at depth=7+wt+window128 — only {0.0, 0.2} tested, extrapolate monotonic improvement	agent1	hyperparam	5
exp089	1.083550	10299.4	keep	SCALAR_LR=0.25 (from 0.5) at depth=7+wt+window128 — slower per-layer lambda tuning, untested at this operating point	agent1	optimizer	5
exp090	1.083462	10299.4	keep	softcap=12 (from 10) at depth=7+wt+window128 — bracket was {8,10,15} at depth=8, 12 never tested	agent1	architecture	5
exp091	1.085494	10299.4	discard	SCALAR_LR=0.25 + softcap=12 combo — stack two independent breakthroughs	agent1	optimizer	5
exp092	1.086321	10299.4	discard	SCALAR_LR=0.1 (from 0.5) at depth=7+wt+softcap12+window128 — continue SCALAR_LR bracket, 0.25 was breakthrough	agent0	optimizer	5
exp093	1.083791	10299.4	discard	FINAL_LR_FRAC=0.07 (from 0.05) at depth=7+wt+softcap12+window128 — push final LR bracket higher	agent1	schedule	5
exp094	1.084164	10299.4	discard	FINAL_LR_FRAC=0.1 (from 0.05) at depth=7+wt+softcap12+window128 — monotonic trend {0.0,0.03,0.05}, extending to 0.1	agent0	schedule	5
exp095	1.085206	10299.4	discard	Muon momentum target=0.97 (from 0.95) at depth=7+wt+softcap12+window128 — higher final momentum, never tested	agent1	optimizer	5
exp096	1.083475	10299.4	discard	softcap=11 (from 12) at depth=7+wt+window128 — fine-grain between 10 and 12, both good	agent0	architecture	5
exp097	1.084591	10299.4	discard	resid_lambda LR multiplier=0.1 (from 0.01) at depth=7+wt+softcap12+window128 — 10x faster per-layer residual scaling, completely untested	agent1	optimizer	5
exp098	1.086957	10299.4	discard	position-weighted loss (0.5+0.5*t/T) at depth=7+wt+softcap12+window128 — focus on later tokens, never tested	agent1	hyperparam	5
exp099	1.083339	10299.4	keep	Muon momentum target=0.93 (from 0.95) at depth=7+wt+softcap12+window128 — lower momentum for sharper convergence	agent1	optimizer	5
exp100	1.083962	10299.4	discard	Muon momentum target=0.91 (from 0.93) — continue momentum bracket, 0.93 was new best	agent1	optimizer	5
exp101	1.083230	10299.4	keep	Muon momentum ramp period=150 (from 300) — faster ramp to optimal 0.93 momentum	agent1	optimizer	5
exp102	1.093390	8473.1	discard	MLP ratio 3x (from 4x) at depth=7+wt+softcap12+window128+momentum0.93 — fewer MLP params, faster steps, more training steps	agent0	architecture	5
exp103	1.093475	9401.7	discard	PaLM-style parallel attn+MLP — both sublayers read from same norm(x) instead of sequential	agent1	architecture	5
exp104	1.084825	10299.4	discard	z-loss regularization (alpha=1e-4) at depth=7+wt+softcap12+window128+mom0.93 — penalize large logit magnitudes	agent0	architecture	5
