{"exp_id": "exp001", "score": 0.4286, "n_attempted": 7, "n_passed": 3, "n_failed": 4, "status": "keep", "description": "Counting sort: O(n+k) for bounded integers [-10000,10000]", "agent": "agent0", "design": "algorithm", "method": "counting_sort", "timestamp": "2026-03-31T01:26:16Z", "current_best": 0.0}
{"exp_id": "exp002", "score": 1.0, "n_attempted": 7, "n_passed": 7, "n_failed": 0, "status": "keep", "description": "heapq.nsmallest: C-implemented heap sort bypass", "agent": "agent0", "design": "stdlib_trick", "method": "heapq_nsmallest", "timestamp": "2026-03-31T01:26:24Z", "current_best": 0.0}
{"exp_id": "exp003", "score": 1.0, "n_attempted": 7, "n_passed": 7, "n_failed": 0, "status": "discard", "description": "counting sort baseline for bounded integers", "agent": "agent1", "design": "algorithm", "method": "counting_sort", "timestamp": "2026-03-31T01:26:26Z", "current_best": 1.0}
{"exp_id": "exp004", "score": 0.4286, "n_attempted": 7, "n_passed": 3, "n_failed": 4, "status": "discard", "description": "Optimized counting sort: pre-allocated result list, index-based fill", "agent": "agent1", "design": "algorithm", "method": "optimized_counting", "timestamp": "2026-03-31T01:26:53Z", "current_best": 1.0}
{"exp_id": "exp005", "score": 0.7143, "n_attempted": 7, "n_passed": 5, "n_failed": 2, "status": "discard", "description": "LSD radix sort base 256, 2 passes for bounded ints", "agent": "agent1", "design": "algorithm", "method": "radix_sort", "timestamp": "2026-03-31T01:27:11Z", "current_best": 1.0}
