exp_id	residual	solution_norm	solution_mean	status	description	agent	design	elapsed_s	solution_energy
exp399	3.01117962e-10	0.000000	-0.000000	discard	u_offset=0.55 fine amp=0.18	agent2	perturbation	1	-0.000000
exp400	2.91768851e-10	0.000000	-0.000000	discard	u_offset=0.55 fine amp=0.19	agent2	perturbation	0	-0.000000
exp401	4.15919496e-11	0.000000	-0.000000	discard	u_offset=0.55 fine amp=0.2	agent2	perturbation	1	-0.000000
exp402	3.74705525e-12	0.000000	-0.000000	discard	u_offset=0.55 fine amp=0.21	agent2	perturbation	0	-0.000000
exp403	7.41196863e-11	0.000000	-0.000000	discard	u_offset=0.55 fine amp=0.22	agent2	perturbation	0	-0.000000
exp404	7.85673877e-11	0.000000	-0.000000	discard	u_offset=0.55 fine amp=0.23	agent2	perturbation	1	-0.000000
exp405	1.36541802e-10	0.000000	-0.000000	discard	u_offset=0.55 fine amp=0.24	agent2	perturbation	0	-0.000000
exp406	2.71704054e-11	0.000000	-0.000000	discard	u_offset=0.55 fine amp=0.25	agent2	perturbation	1	-0.000000
exp407	6.60158307e-11	0.000000	0.000000	discard	bifurcation threshold with phase=π: u_offset=0.50, amplitude=0.082	agent0	branch_search	1	-0.000000
exp408	5.31954296e-09	1.002503	-1.000218	discard	bifurcation threshold with mode 2: u_offset=0.50, amplitude=0.082	agent0	branch_search	1	-1.523848
exp409	2.41595655e-09	1.002503	-1.000218	discard	bifurcation threshold with mode 3: u_offset=0.50, amplitude=0.082	agent0	branch_search	0	-1.523848
exp410	2.54126332e-09	0.000000	-0.000000	discard	anomaly region u_offset=0.50 amp=0.13	agent2	branch_search	0	-0.000000
exp411	8.05532540e-09	0.000000	-0.000000	discard	anomaly region u_offset=0.50 amp=0.14	agent2	branch_search	1	-0.000000
exp412	5.45787384e-19	0.000000	-0.000000	discard	anomaly region u_offset=0.50 amp=0.15	agent2	branch_search	0	-0.000000
exp413	1.86181335e-17	0.000000	-0.000000	discard	anomaly region u_offset=0.50 amp=0.16	agent2	branch_search	0	-0.000000
exp414	1.96466049e-10	0.000000	-0.000000	discard	anomaly region u_offset=0.50 amp=0.17	agent2	branch_search	0	-0.000000
exp415	9.98567799e-16	0.000000	-0.000000	discard	anomaly region u_offset=0.51 amp=0.13	agent2	branch_search	0	-0.000000
exp416	9.08321116e-14	0.000000	-0.000000	discard	anomaly region u_offset=0.51 amp=0.14	agent2	branch_search	1	-0.000000
exp417	5.31517037e-13	0.000000	-0.000000	discard	anomaly region u_offset=0.51 amp=0.15	agent2	branch_search	0	-0.000000
exp418	3.02084797e-12	0.000000	-0.000000	discard	anomaly region u_offset=0.51 amp=0.16	agent2	branch_search	0	-0.000000
exp419	9.35017917e-12	0.000000	-0.000000	discard	anomaly region u_offset=0.51 amp=0.17	agent2	branch_search	1	-0.000000
exp420	4.95976522e-12	0.000000	-0.000000	discard	anomaly region u_offset=0.52 amp=0.13	agent2	branch_search	0	-0.000000
exp421	1.04501786e-10	0.000000	-0.000000	discard	anomaly region u_offset=0.52 amp=0.14	agent2	branch_search	1	-0.000000
exp422	5.86338648e-10	1.002503	1.000218	discard	anomaly region u_offset=0.52 amp=0.15	agent2	branch_search	0	-1.523848
exp423	1.57104425e-10	0.000000	-0.000000	discard	anomaly region u_offset=0.52 amp=0.16	agent2	branch_search	0	-0.000000
exp424	9.36110333e-11	0.000000	-0.000000	discard	anomaly region u_offset=0.52 amp=0.17	agent2	branch_search	1	-0.000000
exp425	1.68034937e-09	1.002503	-1.000218	discard	anomaly region u_offset=0.53 amp=0.13	agent2	branch_search	0	-1.523848
exp426	1.68033434e-09	1.002503	-1.000218	discard	anomaly region u_offset=0.53 amp=0.14	agent2	branch_search	0	-1.523848
exp427	1.12483028e-10	1.002503	-1.000218	discard	anomaly region u_offset=0.53 amp=0.15	agent2	branch_search	0	-1.523848
exp428	1.12779833e-12	0.000000	-0.000000	discard	anomaly region u_offset=0.53 amp=0.16	agent2	branch_search	0	-0.000000
exp429	6.67335049e-11	0.000000	-0.000000	discard	anomaly region u_offset=0.53 amp=0.17	agent2	branch_search	1	-0.000000
exp430	2.56659071e-19	0.000000	-0.000000	discard	anomaly region u_offset=0.54 amp=0.13	agent2	branch_search	0	-0.000000
exp431	4.13348952e-18	0.000000	-0.000000	discard	anomaly region u_offset=0.54 amp=0.14	agent2	branch_search	0	-0.000000
exp432	9.37866965e-18	0.000000	-0.000000	discard	anomaly region u_offset=0.54 amp=0.15	agent2	branch_search	1	-0.000000
exp433	4.01993462e-14	0.000000	-0.000000	discard	anomaly region u_offset=0.54 amp=0.16	agent2	branch_search	0	-0.000000
exp434	7.13946674e-14	0.000000	-0.000000	discard	anomaly region u_offset=0.54 amp=0.17	agent2	branch_search	0	-0.000000
exp435	5.86338648e-10	1.002503	1.000218	discard	positive anomaly mode=1	agent2	perturbation	0	-1.523848
exp436	9.74092342e-11	0.000000	0.000000	discard	positive anomaly mode=2	agent2	perturbation	1	-0.000000
exp437	3.30122429e-16	0.000000	0.000000	discard	positive anomaly mode=3	agent2	perturbation	0	0.000000
exp438	1.93678238e-10	0.000000	0.000000	discard	positive anomaly mode=4	agent2	perturbation	1	-0.000000
exp439	2.22187821e-11	0.000000	0.000000	discard	positive anomaly mode=5	agent2	perturbation	0	-0.000000
exp440	5.72745863e-09	1.002503	-1.000218	discard	mode 1 below threshold: u_offset=0.50, amplitude=0.081	agent0	branch_search	0	-1.523848
exp441	5.72745928e-09	1.002503	-1.000218	discard	mode 2 with higher amplitude: u_offset=0.50, amplitude=0.15	agent0	branch_search	0	-1.523848
exp442	5.73045909e-09	1.002503	1.000218	discard	mode 2 with high amplitude: u_offset=0.50, amplitude=0.30	agent0	branch_search	1	-1.523848
exp443	4.48769155e-11	0.000000	-0.000000	discard	mode 1 with high amplitude: u_offset=0.50, amplitude=0.30	agent0	branch_search	0	-0.000000
exp444	1.12554002e-09	1.002503	-1.000218	discard	mode 3 with high amplitude: u_offset=0.50, amplitude=0.30	agent0	branch_search	0	-1.523848
exp445	2.55793074e-10	0.000000	0.000000	discard	mode 3 with higher amplitude: u_offset=0.50, amplitude=0.45	agent0	branch_search	0	-0.000000
exp446	6.60119060e-11	0.000000	-0.000000	discard	negative side symmetry: u_offset=-0.50, mode 1, amplitude=0.082	agent0	branch_search	0	-0.000000
exp447	2.41595655e-09	1.002503	1.000218	discard	negative side baseline: u_offset=-0.50, amplitude=0.0	agent0	branch_search	1	-1.523848
exp448	2.41595655e-09	1.002503	-1.000218	discard	u_offset=0.55 window, mode 1, amplitude=0.1	agent0	branch_search	0	-1.523848
exp449	1.28384385e-18	0.000000	0.000000	discard	u_offset=0.55, mode 2, amplitude=0.1	agent0	branch_search	0	-0.000000
exp450	1.55966890e-10	0.000000	0.000000	discard	u_offset=0.55, mode 3, amplitude=0.1	agent0	branch_search	0	-0.000000
