exp_id	residual	solution_norm	solution_mean	status	description	agent	design	elapsed_s	solution_energy
exp203	2.41595655e-09	1.002503	1.000218	discard	u_offset=0.61	agent1	branch_search	0	-1.523848
exp204	5.17266803e-11	0.000000	-0.000000	discard	tri-pos boundary 0.50	agent2	branch_search	1	-0.000000
exp205	4.13728926e-11	0.000000	-0.000000	discard	u_offset=-0.58	agent1	branch_search	0	-0.000000
exp206	5.66994262e-09	1.002503	-1.000218	discard	tri-pos boundary 0.55	agent2	branch_search	0	-1.523848
exp207	5.69266279e-19	0.000000	-0.000000	discard	u_offset=-0.62	agent1	branch_search	0	-0.000000
exp208	1.69033798e-09	1.002503	1.000218	discard	tri-pos boundary 0.60	agent2	branch_search	1	-1.523848
exp209	1.13941343e-10	0.000000	-0.000000	discard	explore transition at u_offset=-0.45	agent3	initial_cond	1	-0.000000
exp210	2.41595655e-09	1.002503	-1.000218	discard	bifurcation with phase=π: u_offset=0.50	agent0	branch_search	0	-1.523848
exp211	5.66994262e-09	1.002503	-1.000218	discard	anomaly test u_offset=0.55 run1	agent2	branch_search	0	-1.523848
exp212	5.66994262e-09	1.002503	-1.000218	discard	anomaly test u_offset=0.55 run2	agent2	branch_search	0	-1.523848
exp213	5.66994262e-09	1.002503	-1.000218	discard	anomaly test u_offset=0.55 run3	agent2	branch_search	0	-1.523848
exp214	1.58715069e-10	0.000000	-0.000000	discard	fine bound 0.48	agent2	branch_search	0	-0.000000
exp215	5.17266803e-11	0.000000	-0.000000	discard	fine bound 0.50	agent2	branch_search	1	-0.000000
exp216	1.07040248e-11	0.000000	-0.000000	discard	fine bound 0.52	agent2	branch_search	0	-0.000000
exp217	1.30917164e-11	0.000000	0.000000	discard	bifurcation with amp=0.1, phase=π: u_offset=0.50	agent0	branch_search	0	-0.000000
exp218	7.42744610e-11	0.000000	-0.000000	discard	fine bound 0.54	agent2	branch_search	0	-0.000000
exp219	5.66994262e-09	1.002503	-1.000218	discard	fine bound 0.55	agent2	branch_search	1	-1.523848
exp220	1.07768227e-11	0.000000	-0.000000	discard	fine bound 0.56	agent2	branch_search	0	-0.000000
exp221	1.68330869e-09	1.002503	1.000218	discard	fine bound 0.58	agent2	branch_search	0	-1.523848
exp222	1.69033798e-09	1.002503	1.000218	discard	fine bound 0.60	agent2	branch_search	1	-1.523848
exp223	1.68033438e-09	1.002503	1.000218	discard	fine bound 0.62	agent2	branch_search	0	-1.523848
exp224	5.17243862e-11	0.000000	-0.000000	discard	bifurcation with amp=0.1, phase=0: u_offset=0.50	agent0	branch_search	0	-0.000000
exp225	4.53301231e-08	1.002503	-1.000218	discard	u_offset=0.55 tol=1.0e-6	agent2	solver_param	0	-1.523848
exp226	4.53301231e-08	1.002503	-1.000218	discard	u_offset=0.55 tol=1.0e-7	agent2	solver_param	1	-1.523848
exp227	5.66994262e-09	1.002503	-1.000218	discard	u_offset=0.55 tol=1.0e-8	agent2	solver_param	0	-1.523848
exp228	7.08851550e-10	1.002503	-1.000218	discard	u_offset=0.55 tol=1.0e-9	agent2	solver_param	0	-1.523848
exp229	2.62635931e-11	1.002503	-1.000218	discard	u_offset=0.55 tol=1.0e-10	agent2	solver_param	1	-1.523848
exp230	1.30917111e-11	0.000000	0.000000	discard	bifurcation with amplitude=-0.1: u_offset=0.50	agent0	branch_search	1	-0.000000
exp231	5.66994269e-09	1.002503	-1.000218	discard	u_offset=0.55 amplitude=0.0	agent2	perturbation	0	-1.523848
exp232	5.66994262e-09	1.002503	-1.000218	discard	u_offset=0.55 amplitude=0.1	agent2	perturbation	1	-1.523848
exp233	4.15919496e-11	0.000000	-0.000000	discard	u_offset=0.55 amplitude=0.2	agent2	perturbation	0	-0.000000
exp234	1.26113045e-15	0.000000	-0.000000	discard	u_offset=0.55 amplitude=0.3	agent2	perturbation	0	-0.000000
exp235	9.67598948e-12	0.000000	-0.000000	discard	u_offset=0.55 amplitude=0.4	agent2	perturbation	0	-0.000000
exp236	1.74226254e-10	0.000000	-0.000000	discard	u_offset=0.55 amplitude=0.5	agent2	perturbation	0	-0.000000
exp237	2.41595655e-09	1.002503	1.000218	discard	positive branch with phase=π	agent3	perturbation	0	-1.523848
exp238	5.73029223e-09	1.002503	1.000218	discard	away from bifurcation: u_offset=0.60 with amplitude=0.1	agent0	branch_search	0	-1.523848
exp239	5.66994262e-09	1.002503	-1.000218	discard	u_offset=0.55 n_mode=1	agent2	perturbation	1	-1.523848
exp240	1.28580576e-18	0.000000	0.000000	discard	u_offset=0.55 n_mode=2	agent2	perturbation	0	-0.000000
exp241	1.55962632e-10	0.000000	0.000000	discard	u_offset=0.55 n_mode=3	agent2	perturbation	0	-0.000000
exp242	2.89133588e-10	0.000000	0.000000	discard	u_offset=0.55 n_mode=4	agent2	perturbation	0	-0.000000
exp243	2.50193429e-10	0.000000	0.000000	discard	u_offset=0.55 n_mode=5	agent2	perturbation	0	-0.000000
exp244	1.61305694e-10	0.000000	0.000000	discard	u_offset=0.55 n_mode=6	agent2	perturbation	1	-0.000000
exp245	5.72745893e-09	1.002503	-1.000218	discard	negative branch with phase=π	agent3	perturbation	0	-1.523848
exp246	2.60019368e-11	1.002503	1.000218	discard	tri-pos boundary refined: u_offset=0.6 (n300, tol1e10)	agent1	branch_search	0	-1.523848
exp247	5.66994270e-09	1.002503	1.000218	discard	u_offset=-0.55 amp=0.0 mode=1	agent2	perturbation	0	-1.523848
exp248	9.96673836e-09	0.070536	0.000000	discard	trivial branch with phase=π/2	agent3	perturbation	0	0.000175
exp249	5.66994270e-09	1.002503	1.000218	discard	u_offset=-0.55 amp=0.0 mode=2	agent2	perturbation	1	-1.523848
exp250	9.93785274e-13	0.000000	-0.000000	discard	u_offset=-0.55 amp=0.1 mode=1	agent2	perturbation	0	-0.000000
exp251	1.68033420e-09	1.002503	1.000218	discard	u_offset=-0.55 amp=0.1 mode=2	agent2	perturbation	0	-1.523848
exp252	8.06794049e-11	0.000000	-0.000000	discard	boundary test: u_offset=0.495, amplitude=0.0	agent0	branch_search	0	-0.000000
exp253	6.22596062e-11	1.002503	1.000218	discard	u_offset=-0.55 amp=0.2 mode=1	agent2	perturbation	1	-1.523848
exp254	2.84302116e-11	0.000000	-0.000000	discard	u_offset=-0.55 amp=0.2 mode=2	agent2	perturbation	0	-0.000000
exp255	5.65378080e-11	0.000000	0.000000	discard	trivial branch with phase=π	agent3	perturbation	0	-0.000000
exp256	1.13900752e-14	0.000000	-0.000000	discard	scan window at 0.10	agent2	branch_search	0	-0.000000
exp257	5.54854357e-11	0.000000	-0.000000	discard	boundary test: u_offset=0.4975	agent0	branch_search	1	-0.000000
exp258	2.40076834e-10	0.000000	-0.000000	discard	scan window at 0.15	agent2	branch_search	1	-0.000000
exp259	3.30759739e-12	0.000000	-0.000000	discard	scan window at 0.25	agent2	branch_search	0	-0.000000
exp260	2.54334539e-12	0.000000	-0.000000	discard	scan window at 0.35	agent2	branch_search	1	-0.000000
exp261	9.43899426e-12	0.000000	-0.000000	discard	scan window at 0.45	agent2	branch_search	0	-0.000000
exp262	5.66994262e-09	1.002503	1.000218	discard	scan window at 0.65	agent2	branch_search	0	-1.523848
exp263	5.66994262e-09	1.002503	1.000218	discard	scan window at 0.75	agent2	branch_search	1	-1.523848
exp264	1.69636019e-09	1.002503	1.000218	discard	scan window at 0.85	agent2	branch_search	0	-1.523848
exp265	5.72745877e-09	1.002503	1.000218	discard	u_offset=0.5950	agent1	branch_search	1	-1.523848
exp266	5.72745738e-09	1.002503	1.000218	discard	u_offset=0.5980	agent1	branch_search	0	-1.523848
exp267	5.72745868e-09	1.002503	1.000218	discard	u_offset=0.5990	agent1	branch_search	0	-1.523848
exp268	5.72745853e-09	1.002503	1.000218	discard	u_offset=0.5995	agent1	branch_search	0	-1.523848
exp269	5.72749232e-09	1.002503	1.000218	discard	u_offset=0.6010	agent1	branch_search	0	-1.523848
exp270	2.41595655e-09	1.002503	1.000218	discard	u_offset=0.6050	agent1	branch_search	1	-1.523848
exp271	3.48047313e-12	0.000000	-0.000000	discard	u_offset=-0.5950	agent1	branch_search	0	-0.000000
exp272	2.47475744e-19	0.000000	-0.000000	discard	u_offset=-0.5980	agent1	branch_search	0	-0.000000
exp273	2.38724121e-10	0.000000	-0.000000	discard	u_offset=-0.5990	agent1	branch_search	1	-0.000000
exp274	crash	0	0	crash	u_offset=-0.5995	agent1	branch_search	0	0
exp275	2.16602401e-10	1.002503	1.000218	discard	u_offset=-0.6010	agent1	branch_search	0	-1.523848
exp276	7.10697142e-11	0.000000	-0.000000	discard	u_offset=-0.6050	agent1	branch_search	1	-0.000000
exp277	6.20276601e-10	1.002503	1.000218	discard	verify u_offset=-0.6005	agent1	branch_search	0	-1.523848
exp278	2.16602401e-10	1.002503	1.000218	discard	verify u_offset=-0.6010	agent1	branch_search	0	-1.523848
exp279	6.48012430e-10	1.002503	1.000218	discard	verify u_offset=-0.6015	agent1	branch_search	0	-1.523848
exp280	1.44600904e-10	0.000000	-0.000000	discard	verify u_offset=-0.6020	agent1	branch_search	0	-0.000000
exp281	5.66994262e-09	1.002503	-1.000218	discard	systematic scan u_offset=-0.80	agent2	branch_search	0	-1.523848
exp282	6.59228892e-11	0.000000	-0.000000	discard	systematic scan u_offset=-0.40	agent2	branch_search	0	-0.000000
exp283	7.92766962e-11	0.000000	-0.000000	discard	systematic scan u_offset=-0.20	agent2	branch_search	0	-0.000000
exp284	1.04770898e-11	0.000000	-0.000000	discard	systematic scan u_offset=0.20	agent2	branch_search	1	-0.000000
exp285	1.44600904e-10	0.000000	-0.000000	discard	u_offset=-0.6020	agent1	branch_search	1	-0.000000
exp286	3.90097578e-11	0.000000	0.000000	discard	systematic scan u_offset=0.40	agent2	branch_search	0	-0.000000
exp287	7.86136665e-12	1.002503	1.000218	discard	u_offset=-0.6019	agent1	branch_search	0	-1.523848
exp288	5.66994259e-09	1.002503	1.000218	discard	systematic scan u_offset=0.70	agent2	branch_search	0	-1.523848
exp289	1.02516770e-10	1.002503	1.000218	discard	u_offset=-0.6018	agent1	branch_search	1	-1.523848
exp290	1.68033427e-09	1.002503	1.000218	discard	systematic scan u_offset=0.90	agent2	branch_search	1	-1.523848
exp291	7.11194054e-10	1.002503	1.000218	discard	u_offset=-0.6017	agent1	branch_search	0	-1.523848
exp292	crash	0	0	crash	u_offset=-0.6016	agent1	branch_search	0	0
exp293	6.48012430e-10	1.002503	1.000218	discard	u_offset=-0.6015	agent1	branch_search	1	-1.523848
exp294	3.15525141e-11	1.002503	1.000218	discard	u_offset=-0.6014	agent1	branch_search	0	-1.523848
exp295	2.13840511e-10	1.002503	1.000218	discard	u_offset=-0.6013	agent1	branch_search	0	-1.523848
exp296	7.86140055e-12	1.002503	1.000218	discard	u_offset=-0.6012	agent1	branch_search	1	-1.523848
exp297	2.13162601e-10	1.002503	1.000218	discard	u_offset=-0.6011	agent1	branch_search	0	-1.523848
exp298	2.16602401e-10	1.002503	1.000218	discard	u_offset=-0.6010	agent1	branch_search	1	-1.523848
exp299	7.92068779e-12	1.002503	-1.000218	discard	u_offset=-0.6009	agent1	branch_search	0	-1.523848
exp300	2.12155889e-10	1.002503	1.000218	discard	u_offset=-0.6008	agent1	branch_search	0	-1.523848
exp301	7.64659524e-12	1.002503	-1.000218	discard	u_offset=-0.6007	agent1	branch_search	1	-1.523848
exp302	2.19387834e-10	1.002503	1.000218	discard	u_offset=-0.6006	agent1	branch_search	0	-1.523848
exp303	5.66994269e-09	1.002503	-1.000218	discard	u_offset=0.55 amp=0.00 fine	agent2	perturbation	0	-1.523848
exp304	6.20276601e-10	1.002503	1.000218	discard	u_offset=-0.6005	agent1	branch_search	0	-1.523848
exp305	6.78861752e-12	0.000000	0.000000	discard	u_offset=0.55 amp=0.02 fine	agent2	perturbation	1	-0.000000
exp306	2.12237752e-10	1.002503	-1.000218	discard	u_offset=-0.6004	agent1	branch_search	1	-1.523848
exp307	2.25833453e-11	0.000000	0.000000	discard	u_offset=0.55 amp=0.04 fine	agent2	perturbation	0	-0.000000
exp308	crash	0	0	crash	u_offset=-0.6003	agent1	branch_search	0	0
exp309	4.24749973e-11	0.000000	-0.000000	discard	u_offset=0.55 amp=0.06 fine	agent2	perturbation	0	-0.000000
exp310	4.39146168e-14	0.000000	-0.000000	discard	u_offset=-0.6002	agent1	branch_search	0	-0.000000
exp311	2.92962860e-14	0.000000	-0.000000	discard	u_offset=0.55 amp=0.08 fine	agent2	perturbation	1	-0.000000
exp312	4.67717598e-12	0.000000	-0.000000	discard	u_offset=-0.6001	agent1	branch_search	0	-0.000000
exp313	5.66994262e-09	1.002503	-1.000218	discard	u_offset=0.55 amp=0.10 fine	agent2	perturbation	0	-1.523848
exp314	1.68046185e-09	1.002503	-1.000218	discard	u_offset=0.55 amp=0.12 fine	agent2	perturbation	0	-1.523848
exp315	1.85083273e-11	0.000000	-0.000000	discard	u_offset=0.55 amp=0.14 fine	agent2	perturbation	1	-0.000000
exp316	1.36934790e-11	0.000000	-0.000000	discard	u_offset=0.55 amp=0.16 fine	agent2	perturbation	0	-0.000000
exp317	3.01117962e-10	0.000000	-0.000000	discard	u_offset=0.55 amp=0.18 fine	agent2	perturbation	0	-0.000000
exp318	4.15919496e-11	0.000000	-0.000000	discard	u_offset=0.55 amp=0.20 fine	agent2	perturbation	0	-0.000000
exp319	3.01997858e-12	0.000000	-0.000000	discard	trivial branch, amplitude=0.3, mode=3	agent3	initial_cond	0	-0.000000
exp320	2.98530289e-16	0.000000	-0.000000	discard	u_offset=-0.6020 (n200,tol1e9)	agent1	branch_search	0	-0.000000
exp321	7.97890159e-11	1.002503	1.000218	discard	u_offset=-0.6015 (n200,tol1e9)	agent1	branch_search	1	-1.523848
exp322	6.10764467e-11	1.002503	1.000218	discard	u_offset=-0.6010 (n200,tol1e9)	agent1	branch_search	0	-1.523848
exp323	2.61332015e-11	1.002503	1.000218	discard	u_offset=-0.6005 (n200,tol1e9)	agent1	branch_search	0	-1.523848
exp324	crash	0	0	crash	u_offset=-0.6000 (n200,tol1e9)	agent1	branch_search	0	0
exp325	9.99977750e-12	1.002503	-1.000218	discard	negative branch, amplitude=0.2, tight tolerance	agent3	solver_param	0	-1.523848
exp326	9.99977750e-12	1.002503	-1.000218	discard	negative branch, mode=2, tight tolerance	agent3	initial_cond	1	-1.523848
exp327	2.98157327e-13	0.000000	-0.000000	discard	best reference: trivial branch	agent1	solver_param	0	-0.000000
exp328	3.25175165e-12	1.002503	1.000218	discard	best reference: positive branch	agent1	solver_param	0	-1.523848
exp329	3.25175165e-12	1.002503	-1.000218	discard	best reference: negative branch	agent1	solver_param	1	-1.523848
exp330	9.99977750e-12	1.002503	1.000218	discard	positive branch, mode=2, tight tolerance	agent3	initial_cond	1	-1.523848
exp331	2.41595655e-09	1.002503	-1.000218	discard	bifurcation at u_offset=0.50, amplitude=0.05	agent3	branch_search	1	-1.523848
exp332	5.72745857e-09	1.002503	-1.000218	discard	bifurcation at u_offset=0.50, amplitude=0.08	agent3	branch_search	0	-1.523848
exp333	2.60677494e-11	0.000000	-0.000000	discard	bifurcation at u_offset=0.50, amplitude=0.09	agent3	branch_search	0	-0.000000
exp334	8.18243231e-11	0.000000	-0.000000	discard	bifurcation at u_offset=0.50, amplitude=0.085	agent3	branch_search	0	-0.000000
exp335	2.41595655e-09	1.002503	-1.000218	discard	amplitude threshold: u_offset=0.50, amplitude=0.02	agent0	branch_search	0	-1.523848
exp336	5.72745872e-09	1.002503	-1.000218	discard	amplitude threshold: u_offset=0.50, amplitude=0.04	agent0	branch_search	0	-1.523848
exp337	8.05483496e-12	0.000000	-0.000000	discard	bifurcation at u_offset=0.50, amplitude=0.082	agent3	branch_search	0	-0.000000
exp338	5.72745857e-09	1.002503	-1.000218	discard	amplitude threshold: u_offset=0.50, amplitude=0.08	agent0	branch_search	1	-1.523848
exp339	5.72745863e-09	1.002503	-1.000218	discard	bifurcation at u_offset=0.50, amplitude=0.081	agent3	branch_search	0	-1.523848
exp340	5.66994262e-09	1.002503	-1.000218	discard	bifurcation map: u_offset=0.50, amp=0.05	agent2	branch_search	0	-1.523848
exp341	2.41215200e-12	0.000000	0.000000	discard	bifurcation map: u_offset=0.51, amp=0.05	agent2	branch_search	1	-0.000000
exp342	2.68100585e-11	0.000000	0.000000	discard	bifurcation map: u_offset=0.52, amp=0.05	agent2	branch_search	0	-0.000000
exp343	2.11305188e-17	0.000000	0.000000	discard	bifurcation map: u_offset=0.53, amp=0.05	agent2	branch_search	1	-0.000000
exp344	5.66994257e-09	1.002503	-1.000218	discard	bifurcation map: u_offset=0.54, amp=0.05	agent2	branch_search	0	-1.523848
exp345	4.16372150e-09	0.000000	0.000000	discard	bifurcation map: u_offset=0.55, amp=0.05	agent2	branch_search	0	-0.000000
exp346	2.60677494e-11	0.000000	-0.000000	discard	amplitude threshold: u_offset=0.50, amplitude=0.09	agent0	branch_search	0	-0.000000
exp347	5.66994265e-09	1.002503	-1.000218	discard	bifurcation map: u_offset=0.56, amp=0.05	agent2	branch_search	1	-1.523848
exp348	5.26419793e-09	1.002503	-1.000218	discard	bifurcation map: u_offset=0.57, amp=0.05	agent2	branch_search	0	-1.523848
exp349	3.04606584e-10	1.002503	1.000218	discard	bifurcation map: u_offset=0.58, amp=0.05	agent2	branch_search	0	-1.523848
exp350	2.41595655e-09	1.002503	1.000218	discard	bifurcation at u_offset=-0.50, amplitude=0.0	agent3	branch_search	1	-1.523848
exp351	1.68051631e-09	1.002503	1.000218	discard	bifurcation map: u_offset=0.59, amp=0.05	agent2	branch_search	0	-1.523848
exp352	1.69225420e-09	1.002503	1.000218	discard	bifurcation map: u_offset=0.60, amp=0.05	agent2	branch_search	0	-1.523848
exp353	8.18243231e-11	0.000000	-0.000000	discard	amplitude threshold: u_offset=0.50, amplitude=0.085	agent0	branch_search	1	-0.000000
exp354	1.30911985e-11	0.000000	-0.000000	discard	bifurcation at u_offset=-0.50, amplitude=0.1	agent3	branch_search	0	-0.000000
exp355	5.17266803e-11	0.000000	-0.000000	discard	bifurcation map: u_offset=0.50, amp=0.10	agent2	branch_search	0	-0.000000
exp356	7.40382242e-11	0.000000	-0.000000	discard	bifurcation map: u_offset=0.51, amp=0.10	agent2	branch_search	1	-0.000000
exp357	1.07040248e-11	0.000000	-0.000000	discard	bifurcation map: u_offset=0.52, amp=0.10	agent2	branch_search	0	-0.000000
exp358	5.66994263e-09	1.002503	-1.000218	discard	bifurcation map: u_offset=0.53, amp=0.10	agent2	branch_search	0	-1.523848
exp359	7.42744610e-11	0.000000	-0.000000	discard	bifurcation map: u_offset=0.54, amp=0.10	agent2	branch_search	0	-0.000000
exp360	5.66994262e-09	1.002503	-1.000218	discard	bifurcation map: u_offset=0.55, amp=0.10	agent2	branch_search	0	-1.523848
exp361	1.07768227e-11	0.000000	-0.000000	discard	bifurcation map: u_offset=0.56, amp=0.10	agent2	branch_search	1	-0.000000
exp362	1.68301252e-09	1.002503	-1.000218	discard	bifurcation map: u_offset=0.57, amp=0.10	agent2	branch_search	0	-1.523848
exp363	1.68330869e-09	1.002503	1.000218	discard	bifurcation map: u_offset=0.58, amp=0.10	agent2	branch_search	0	-1.523848
exp364	5.66994262e-09	1.002503	1.000218	discard	bifurcation map: u_offset=0.59, amp=0.10	agent2	branch_search	1	-1.523848
exp365	1.69033798e-09	1.002503	1.000218	discard	bifurcation map: u_offset=0.60, amp=0.10	agent2	branch_search	0	-1.523848
exp366	8.05483496e-12	0.000000	-0.000000	discard	amplitude threshold: u_offset=0.50, amplitude=0.082	agent0	branch_search	1	-0.000000
exp367	5.45787384e-19	0.000000	-0.000000	discard	bifurcation map: u_offset=0.50, amp=0.15	agent2	branch_search	0	-0.000000
exp368	5.31517037e-13	0.000000	-0.000000	discard	bifurcation map: u_offset=0.51, amp=0.15	agent2	branch_search	1	-0.000000
exp369	5.86338648e-10	1.002503	1.000218	discard	bifurcation map: u_offset=0.52, amp=0.15	agent2	branch_search	0	-1.523848
exp370	1.12483028e-10	1.002503	-1.000218	discard	bifurcation map: u_offset=0.53, amp=0.15	agent2	branch_search	1	-1.523848
exp371	9.37866965e-18	0.000000	-0.000000	discard	bifurcation map: u_offset=0.54, amp=0.15	agent2	branch_search	0	-0.000000
exp372	7.33077401e-11	0.000000	-0.000000	discard	bifurcation map: u_offset=0.55, amp=0.15	agent2	branch_search	0	-0.000000
exp373	3.33607537e-14	0.000000	-0.000000	discard	bifurcation map: u_offset=0.56, amp=0.15	agent2	branch_search	1	-0.000000
exp374	5.72745863e-09	1.002503	-1.000218	discard	amplitude threshold: u_offset=0.50, amplitude=0.081	agent0	branch_search	0	-1.523848
exp375	1.68034069e-09	1.002503	-1.000218	discard	bifurcation map: u_offset=0.57, amp=0.15	agent2	branch_search	0	-1.523848
exp376	1.68033436e-09	1.002503	1.000218	discard	bifurcation map: u_offset=0.58, amp=0.15	agent2	branch_search	1	-1.523848
exp377	5.66994268e-09	1.002503	1.000218	discard	bifurcation map: u_offset=0.59, amp=0.15	agent2	branch_search	0	-1.523848
exp378	1.68083004e-09	1.002503	1.000218	discard	bifurcation map: u_offset=0.60, amp=0.15	agent2	branch_search	0	-1.523848
exp379	5.33445105e-09	1.002503	-1.000218	discard	bifurcation window at u_offset=0.55, amplitude=0.0	agent3	branch_search	0	-1.523848
exp380	2.41595655e-09	1.002503	-1.000218	discard	bifurcation window at u_offset=0.55, amplitude=0.1	agent3	branch_search	0	-1.523848
exp381	5.66994269e-09	1.002503	-1.000218	discard	u_offset=0.55 fine amp=0	agent2	perturbation	1	-1.523848
exp382	1.68033541e-09	1.002503	-1.000218	discard	u_offset=0.55 fine amp=0.01	agent2	perturbation	0	-1.523848
exp383	6.78861752e-12	0.000000	0.000000	discard	u_offset=0.55 fine amp=0.02	agent2	perturbation	1	-0.000000
exp384	4.63938718e-13	0.000000	0.000000	discard	u_offset=0.55 fine amp=0.03	agent2	perturbation	0	-0.000000
exp385	2.25833453e-11	0.000000	0.000000	discard	u_offset=0.55 fine amp=0.04	agent2	perturbation	0	-0.000000
exp386	4.16372150e-09	0.000000	0.000000	discard	u_offset=0.55 fine amp=0.05	agent2	perturbation	1	-0.000000
exp387	4.24749973e-11	0.000000	-0.000000	discard	u_offset=0.55 fine amp=0.06	agent2	perturbation	0	-0.000000
exp388	6.71525102e-10	0.000000	-0.000000	discard	u_offset=0.55 fine amp=0.07	agent2	perturbation	0	-0.000000
exp389	2.92962860e-14	0.000000	-0.000000	discard	u_offset=0.55 fine amp=0.08	agent2	perturbation	0	-0.000000
exp390	5.64773643e-09	1.002503	-1.000218	discard	u_offset=0.55 fine amp=0.09	agent2	perturbation	0	-1.523848
exp391	5.66994262e-09	1.002503	-1.000218	discard	u_offset=0.55 fine amp=0.1	agent2	perturbation	1	-1.523848
exp392	1.68033538e-09	1.002503	-1.000218	discard	u_offset=0.55 fine amp=0.11	agent2	perturbation	0	-1.523848
exp393	1.68046185e-09	1.002503	-1.000218	discard	u_offset=0.55 fine amp=0.12	agent2	perturbation	0	-1.523848
exp394	7.33075826e-11	0.000000	-0.000000	discard	bifurcation window at u_offset=0.55, amplitude=0.15	agent3	branch_search	0	-0.000000
exp394	6.76573539e-11	0.000000	-0.000000	discard	u_offset=0.55 fine amp=0.13	agent2	perturbation	0	-0.000000
exp395	1.85083273e-11	0.000000	-0.000000	discard	u_offset=0.55 fine amp=0.14	agent2	perturbation	0	-0.000000
exp396	7.33077401e-11	0.000000	-0.000000	discard	u_offset=0.55 fine amp=0.15	agent2	perturbation	1	-0.000000
exp397	1.36934790e-11	0.000000	-0.000000	discard	u_offset=0.55 fine amp=0.16	agent2	perturbation	0	-0.000000
exp398	5.48627102e-09	0.000000	-0.000000	discard	u_offset=0.55 fine amp=0.17	agent2	perturbation	0	-0.000000
