exp_id	residual	solution_norm	solution_mean	status	description	agent	design	elapsed_s	solution_energy
exp2877	3.22245147e-29	0.000000	0.000000	discard	cycle 10 u=0.0990	agent0	initial_cond	0	0.000000
exp2878	9.32013160e-27	0.000000	0.000000	discard	PHASE_FINE phase=2.9	agent1	memory	0	-0.000000
exp2878	3.22245147e-29	0.000000	0.000000	discard	cycle 10 u=0.0990	agent0	initial_cond	0	0.000000
exp2879	9.32013160e-27	0.000000	0.000000	discard	PHASE_FINE phase=2.9	agent1	memory	0	-0.000000
exp2880	4.50941488e-29	0.000000	-0.000000	discard	cycle 10 u=0.0990	agent0	initial_cond	0	0.000000
exp2881	9.32013160e-27	0.000000	0.000000	discard	PHASE_FINE phase=2.9	agent1	memory	1	-0.000000
exp2881	4.50941488e-29	0.000000	-0.000000	discard	cycle 10 u=0.0990	agent0	initial_cond	1	0.000000
exp2882	5.16987883e-26	0.000000	0.000000	discard	PHASE_FINE phase=2.95	agent1	memory	0	-0.000000
exp2882	4.50941488e-29	0.000000	-0.000000	discard	cycle 10 u=0.0990	agent0	initial_cond	0	0.000000
exp2883	5.16987883e-26	0.000000	0.000000	discard	PHASE_FINE phase=2.95	agent1	memory	0	-0.000000
exp2884	4.88330883e-29	0.000000	-0.000000	discard	cycle 10 u=0.0990	agent0	initial_cond	0	0.000000
exp2885	5.16987883e-26	0.000000	0.000000	discard	PHASE_FINE phase=2.95	agent1	memory	1	-0.000000
exp2885	4.88330883e-29	0.000000	-0.000000	discard	cycle 10 u=0.0990	agent0	initial_cond	0	0.000000
exp2886	3.26971847e-26	0.000000	-0.000000	discard	PHASE_FINE phase=3.0	agent1	memory	0	-0.000000
exp2886	4.88330883e-29	0.000000	-0.000000	discard	cycle 10 u=0.0990	agent0	initial_cond	0	0.000000
exp2887	3.26971847e-26	0.000000	-0.000000	discard	PHASE_FINE phase=3.0	agent1	memory	1	-0.000000
exp2887	4.83027541e-14	1.001296	-1.000019	discard	cycle 10 u=0.0995	agent0	initial_cond	1	-1.520844
exp2888	5.74085541e-29	0.000000	-0.000000	discard	Fourier u=0.5 modes=32 maxiter=200	agent0	branch_search	1	0.000000
exp2889	3.26971847e-26	0.000000	-0.000000	discard	PHASE_FINE phase=3.0	agent1	memory	0	-0.000000
exp2889	5.79431248e-13	1.001296	1.000019	discard	cycle 10 u=0.0995	agent0	initial_cond	0	-1.520844
exp2890	5.74085541e-29	0.000000	-0.000000	discard	Fourier u=0.9 modes=32 maxiter=200	agent0	branch_search	0	0.000000
exp2891	6.53943693e-26	0.000000	0.000000	discard	PHASE_FINE phase=3.05	agent1	memory	0	-0.000000
exp2891	9.78363144e-14	1.001296	1.000019	discard	cycle 10 u=0.0995	agent0	initial_cond	0	-1.520844
exp2892	1.54984578e-28	0.000000	0.000000	discard	Fourier u=1.0 modes=32 maxiter=200	agent0	branch_search	1	-0.000000
exp2893	6.53943693e-26	0.000000	0.000000	discard	PHASE_FINE phase=3.05	agent1	memory	1	-0.000000
exp2893	8.76702342e-14	1.001296	1.000019	discard	cycle 10 u=0.0995	agent0	initial_cond	1	-1.520844
exp2894	1.54984578e-28	0.000000	0.000000	discard	Fourier u=1.1 modes=32 maxiter=200	agent0	branch_search	0	-0.000000
exp2895	6.53943693e-26	0.000000	0.000000	discard	PHASE_FINE phase=3.05	agent1	memory	0	-0.000000
exp2895	7.55131987e-14	1.001296	1.000019	discard	cycle 10 u=0.0995	agent0	initial_cond	0	-1.520844
exp2896	1.54984578e-28	0.000000	0.000000	discard	Fourier u=2.0 modes=32 maxiter=200	agent0	branch_search	0	-0.000000
exp2897	2.61577477e-25	0.000000	0.000000	discard	PHASE_FINE phase=3.1	agent1	memory	1	-0.000000
exp2897	1.54984578e-28	0.000000	0.000000	discard	cycle 10 u=0.0995	agent0	initial_cond	1	-0.000000
exp2898	2.61577477e-25	0.000000	0.000000	discard	PHASE_FINE phase=3.1	agent1	memory	0	-0.000000
exp2898	1.60328418e-29	0.000000	-0.000000	discard	cycle 10 u=0.0995	agent0	initial_cond	0	-0.000000
exp2899	2.61577477e-25	0.000000	0.000000	discard	PHASE_FINE phase=3.1	agent1	memory	0	-0.000000
exp2899	1.60328418e-29	0.000000	-0.000000	discard	cycle 10 u=0.0995	agent0	initial_cond	0	-0.000000
exp2900	2.41162518e-25	0.000000	0.000000	discard	PHASE_FINE phase=3.14	agent1	memory	1	-0.000000
exp2900	1.60328418e-29	0.000000	-0.000000	discard	cycle 10 u=0.0995	agent0	initial_cond	1	-0.000000
exp2901	2.41162518e-25	0.000000	0.000000	discard	PHASE_FINE phase=3.14	agent1	memory	0	-0.000000
exp2901	7.34590618e-29	0.000000	0.000000	discard	cycle 10 u=0.0995	agent0	initial_cond	0	0.000000
exp2902	2.41162518e-25	0.000000	0.000000	discard	PHASE_FINE phase=3.14	agent1	memory	0	-0.000000
exp2902	7.34590618e-29	0.000000	0.000000	discard	cycle 10 u=0.0995	agent0	initial_cond	1	0.000000
exp2903	4.00039732e-26	0.000000	0.000000	discard	PHASE_ULTRA phase=2.98	agent1	memory	0	-0.000000
exp2903	7.34590618e-29	0.000000	0.000000	discard	cycle 10 u=0.0995	agent0	initial_cond	0	0.000000
exp2904	6.53943693e-26	0.000000	-0.000000	discard	PHASE_ULTRA phase=2.99	agent1	memory	0	-0.000000
exp2904	4.46546993e-29	0.000000	0.000000	discard	cycle 10 u=0.1000	agent0	initial_cond	0	-0.000000
exp2905	4.46546993e-29	0.000000	0.000000	discard	cycle 10 u=0.1000	agent0	initial_cond	1	-0.000000
exp2905	3.26971847e-26	0.000000	-0.000000	discard	PHASE_ULTRA phase=3.00	agent1	memory	1	-0.000000
exp2906	4.46546993e-29	0.000000	0.000000	discard	cycle 10 u=0.1000	agent0	initial_cond	0	-0.000000
exp2906	9.80915540e-26	0.000000	-0.000000	discard	PHASE_ULTRA phase=3.01	agent1	memory	0	-0.000000
exp2907	7.59813910e-26	0.000000	0.000000	discard	PHASE_ULTRA phase=3.02	agent1	memory	0	0.000000
exp2907	4.08106752e-29	0.000000	0.000000	discard	cycle 10 u=0.1000	agent0	initial_cond	0	-0.000000
exp2908	4.08106752e-29	0.000000	0.000000	discard	cycle 10 u=0.1000	agent0	initial_cond	0	-0.000000
exp2908	3.26971847e-26	0.000000	-0.000000	discard	ULTIMATE_FINAL trial=1	agent1	memory	0	-0.000000
exp2909	4.08106752e-29	0.000000	0.000000	discard	cycle 10 u=0.1000	agent0	initial_cond	0	-0.000000
exp2909	3.26971847e-26	0.000000	-0.000000	discard	ULTIMATE_FINAL trial=2	agent1	memory	0	-0.000000
exp2910	3.26971847e-26	0.000000	-0.000000	discard	ULTIMATE_FINAL trial=3	agent1	memory	1	-0.000000
exp2910	4.58623706e-29	0.000000	0.000000	discard	cycle 10 u=0.1000	agent0	initial_cond	1	-0.000000
exp2911	3.26971847e-26	0.000000	-0.000000	discard	ULTIMATE_FINAL trial=4	agent1	memory	0	-0.000000
exp2911	4.58623706e-29	0.000000	0.000000	discard	cycle 10 u=0.1000	agent0	initial_cond	0	-0.000000
exp2912	4.58623706e-29	0.000000	0.000000	discard	cycle 10 u=0.1000	agent0	initial_cond	0	-0.000000
exp2912	3.26971847e-26	0.000000	-0.000000	discard	ULTIMATE_FINAL trial=5	agent1	memory	0	-0.000000
exp2913	4.39794337e-29	0.000000	0.000000	discard	cycle 10 u=0.1000	agent0	initial_cond	0	-0.000000
exp2913	3.26971847e-26	0.000000	-0.000000	discard	ULTIMATE_FINAL trial=6	agent1	memory	0	-0.000000
exp2914	3.26971847e-26	0.000000	-0.000000	discard	ULTIMATE_FINAL trial=7	agent1	memory	0	-0.000000
exp2914	4.39794337e-29	0.000000	0.000000	discard	cycle 10 u=0.1000	agent0	initial_cond	0	-0.000000
exp2915	4.39794337e-29	0.000000	0.000000	discard	cycle 10 u=0.1000	agent0	initial_cond	1	-0.000000
exp2915	3.26971847e-26	0.000000	-0.000000	discard	ULTIMATE_FINAL trial=8	agent1	memory	1	-0.000000
exp2916	1.36727475e-28	0.000000	0.000000	discard	cycle 10 u=0.1050	agent0	initial_cond	0	-0.000000
exp2916	3.26971847e-26	0.000000	-0.000000	discard	ULTIMATE_FINAL trial=9	agent1	memory	0	-0.000000
exp2917	3.26971847e-26	0.000000	-0.000000	discard	ULTIMATE_FINAL trial=10	agent1	memory	0	-0.000000
exp2917	1.36727475e-28	0.000000	0.000000	discard	cycle 10 u=0.1050	agent0	initial_cond	0	-0.000000
exp2918	1.36727475e-28	0.000000	0.000000	discard	cycle 10 u=0.1050	agent0	initial_cond	1	-0.000000
exp2919	6.14461376e-29	0.000000	0.000000	discard	cycle 10 u=0.1050	agent0	initial_cond	0	-0.000000
exp2920	6.14461376e-29	0.000000	0.000000	discard	cycle 10 u=0.1050	agent0	initial_cond	1	-0.000000
exp2921	6.14461376e-29	0.000000	0.000000	discard	cycle 10 u=0.1050	agent0	initial_cond	0	-0.000000
exp2922	6.04747797e-14	1.001296	1.000019	discard	cycle 10 u=0.1050	agent0	initial_cond	0	-1.520844
exp2923	6.04747797e-14	1.001296	1.000019	discard	Fourier amp=0.5 modes=32	agent0	branch_search	0	-1.520844
exp2924	2.33285406e-13	1.001296	1.000019	discard	cycle 10 u=0.1050	agent0	initial_cond	1	-1.520844
exp2924	2.22512184e-15	0.070536	-0.000000	discard	hunt 5th branch mode=2 phase=1.5708 8modes	agent1_mem	branch_search	1	0.000099
exp2925	2.33285406e-13	1.001296	1.000019	discard	Fourier amp=0.8 modes=32	agent0	branch_search	1	-1.520844
exp2926	6.96412219e-14	1.001296	1.000019	discard	cycle 10 u=0.1050	agent0	initial_cond	0	-1.520844
exp2926	4.15184999e-25	0.000000	0.000000	discard	hunt 5th branch mode=3 phase=1.5708 8modes	agent1_mem	branch_search	0	0.000000
exp2927	6.96412219e-14	1.001296	1.000019	discard	Fourier amp=1.0 modes=32	agent0	branch_search	0	-1.520844
exp2928	1.30537439e-13	1.001296	1.000019	discard	cycle 10 u=0.1050	agent0	initial_cond	0	-1.520844
exp2928	5.54442494e-19	0.000000	-0.000000	discard	hunt 5th branch mode=2 phase=1.0 8modes	agent1_mem	branch_search	1	0.000000
exp2929	1.30537439e-13	1.001296	1.000019	discard	Fourier amp=1.5 modes=32	agent0	branch_search	1	-1.520844
exp2930	1.11257917e-28	0.000000	0.000000	discard	cycle 10 u=0.1050	agent0	initial_cond	0	-0.000000
exp2930	1.22746823e-15	0.070536	0.000000	discard	hunt 5th branch mode=2 phase=1.0 6modes	agent1_mem	branch_search	0	0.000099
exp2931	1.11257917e-28	0.000000	0.000000	discard	cycle 10 u=0.1050	agent0	initial_cond	0	-0.000000
exp2931	8.62575958e-14	0.070536	-0.000000	discard	hunt 5th branch mode=1 phase=0.5 6modes	agent1_mem	branch_search	0	0.000099
exp2932	8.58580947e-29	0.000000	0.000000	discard	cycle 11 u=0.0975	agent0	initial_cond	1	0.000000
exp2933	8.58580947e-29	0.000000	0.000000	discard	cycle 11 u=0.0975	agent0	initial_cond	0	0.000000
exp2934	8.58580947e-29	0.000000	0.000000	discard	cycle 11 u=0.0975	agent0	initial_cond	0	0.000000
exp2935	5.23962023e-29	0.000000	0.000000	discard	cycle 11 u=0.0975	agent0	initial_cond	0	0.000000
exp2936	5.23962023e-29	0.000000	0.000000	discard	cycle 11 u=0.0975	agent0	initial_cond	0	0.000000
exp2937	5.23962023e-29	0.000000	0.000000	discard	cycle 11 u=0.0975	agent0	initial_cond	1	0.000000
exp2938	4.03266298e-29	0.000000	0.000000	discard	cycle 11 u=0.0975	agent0	initial_cond	0	0.000000
exp2939	4.03266298e-29	0.000000	0.000000	discard	cycle 11 u=0.0975	agent0	initial_cond	0	0.000000
exp2940	4.03266298e-29	0.000000	0.000000	discard	cycle 11 u=0.0975	agent0	initial_cond	1	0.000000
exp2941	4.80015937e-29	0.000000	0.000000	discard	cycle 11 u=0.0975	agent0	initial_cond	0	0.000000
exp2942	4.80015937e-29	0.000000	0.000000	discard	cycle 11 u=0.0975	agent0	initial_cond	0	0.000000
exp2943	4.80015937e-29	0.000000	0.000000	discard	cycle 11 u=0.0975	agent0	initial_cond	0	0.000000
exp2944	2.68824537e-29	0.000000	0.000000	discard	cycle 11 u=0.0980	agent0	initial_cond	0	-0.000000
exp2945	2.68824537e-29	0.000000	0.000000	discard	cycle 11 u=0.0980	agent0	initial_cond	1	-0.000000
exp2946	2.68824537e-29	0.000000	0.000000	discard	cycle 11 u=0.0980	agent0	initial_cond	0	-0.000000
exp2947	6.16758073e-29	0.000000	0.000000	discard	cycle 11 u=0.0980	agent0	initial_cond	0	-0.000000
exp2948	6.16758073e-29	0.000000	0.000000	discard	cycle 11 u=0.0980	agent0	initial_cond	1	-0.000000
exp2949	6.16758073e-29	0.000000	0.000000	discard	cycle 11 u=0.0980	agent0	initial_cond	0	-0.000000
exp2950	2.01926478e-29	0.000000	0.000000	discard	cycle 11 u=0.0980	agent0	initial_cond	0	0.000000
exp2951	2.01926478e-29	0.000000	0.000000	discard	cycle 11 u=0.0980	agent0	initial_cond	0	0.000000
exp2952	2.01926478e-29	0.000000	0.000000	discard	cycle 11 u=0.0980	agent0	initial_cond	0	0.000000
exp2953	1.30310780e-28	0.000000	0.000000	discard	cycle 11 u=0.0980	agent0	initial_cond	1	-0.000000
exp2954	1.30310780e-28	0.000000	0.000000	discard	cycle 11 u=0.0980	agent0	initial_cond	0	-0.000000
exp2955	1.30310780e-28	0.000000	0.000000	discard	Fourier pos modes=16	agent0	solver_param	0	-0.000000
exp2955	1.30310780e-28	0.000000	0.000000	discard	cycle 11 u=0.0980	agent0	initial_cond	0	-0.000000
exp2956	crash	0	0	crash	cycle 11 u=0.0982	agent0	initial_cond	1	0
exp2956	crash	0	0	crash	Fourier pos modes=32	agent0	solver_param	1	0
exp2957	crash	0	0	crash	cycle 11 u=0.0982	agent0	initial_cond	0	0
exp2958	crash	0	0	crash	Fourier pos modes=48	agent0	solver_param	0	0
exp2959	3.83815075e-16	1.001296	-1.000019	discard	4th branch at boundary u=0.462 amp=0.5 phase=1.0	agent1_mem	perturbation	0	-1.520844
exp2960	3.89825392e-13	0.000000	0.000000	discard	ULTRA_FINE phase=2.80	agent1	memory	1	-0.000000
exp2961	crash	0	0	crash	cycle 11 u=0.0982	agent0	initial_cond	1	0
exp2962	crash	0	0	crash	Fourier pos modes=64	agent0	solver_param	1	0
exp2963	2.99461411e-12	0.000000	0.000000	discard	ULTRA_FINE phase=2.85	agent1	memory	0	-0.000000
exp2964	crash	0	0	crash	cycle 11 u=0.0982	agent0	initial_cond	0	0
exp2965	crash	0	0	crash	Fourier pos modes=96	agent0	solver_param	0	0
exp2964	4.08714808e-27	0.000000	-0.000000	discard	ULTRA_FINE phase=2.88	agent1	memory	0	-0.000000
exp2966	0.00000000e+00	0.000000	0.000000	discard	ULTRA_FINE phase=2.89	agent1	memory	1	0.000000
exp2967	crash	0	0	crash	cycle 11 u=0.0982	agent0	initial_cond	1	0
exp2968	crash	0	0	crash	Fourier pos modes=128	agent0	solver_param	1	0
exp2969	9.32013160e-27	0.000000	0.000000	discard	ULTRA_FINE phase=2.90	agent1	memory	0	-0.000000
exp2970	1.23429977e-28	0.000000	0.000000	discard	cycle 11 u=0.0982	agent0	initial_cond	0	0.000000
exp2971	8.17429616e-27	0.000000	0.000000	discard	ULTRA_FINE phase=2.91	agent1	memory	0	-0.000000
exp2972	1.88036672e-29	0.000000	0.000000	discard	cycle 11 u=0.0982	agent0	initial_cond	1	0.000000
exp2973	4.08714808e-27	0.000000	0.000000	discard	ULTRA_FINE phase=2.92	agent1	memory	0	-0.000000
exp2974	1.88036672e-29	0.000000	0.000000	discard	cycle 11 u=0.0982	agent0	initial_cond	0	0.000000
exp2975	5.16987883e-26	0.000000	0.000000	discard	ULTRA_FINE phase=2.95	agent1	memory	0	-0.000000
exp2976	1.88036672e-29	0.000000	0.000000	discard	cycle 11 u=0.0982	agent0	initial_cond	0	0.000000
exp2977	1.83242480e-17	0.000000	0.000000	discard	AMP_BEST amp=0.45	agent1	memory	1	-0.000000
exp2978	1.91190259e-29	0.000000	-0.000000	discard	cycle 11 u=0.0982	agent0	initial_cond	0	0.000000
exp2979	9.93125683e-14	0.000000	0.000000	discard	AMP_BEST amp=0.48	agent1	memory	0	-0.000000
exp2980	1.91190259e-29	0.000000	-0.000000	discard	cycle 11 u=0.0982	agent0	initial_cond	0	0.000000
exp2981	9.32013160e-27	0.000000	0.000000	discard	AMP_BEST amp=0.50	agent1	memory	0	-0.000000
exp2982	1.91190259e-29	0.000000	-0.000000	discard	cycle 11 u=0.0982	agent0	initial_cond	1	0.000000
exp2983	1.31352531e-23	0.000000	0.000000	discard	AMP_BEST amp=0.52	agent1	memory	1	-0.000000
exp2984	6.13049994e-29	0.000000	0.000000	discard	cycle 11 u=0.0985	agent0	initial_cond	0	0.000000
exp2985	8.44721904e-15	0.000000	0.000000	discard	AMP_BEST amp=0.55	agent1	memory	0	-0.000000
exp2986	6.13049994e-29	0.000000	0.000000	discard	cycle 11 u=0.0985	agent0	initial_cond	0	0.000000
exp2987	9.32013160e-27	0.000000	0.000000	discard	BEST_FINAL phase=2.90 amp=0.5 trial=1	agent1	memory	1	-0.000000
exp2988	6.13049994e-29	0.000000	0.000000	discard	cycle 11 u=0.0985	agent0	initial_cond	1	0.000000
exp2989	9.32013160e-27	0.000000	0.000000	discard	BEST_FINAL phase=2.90 amp=0.5 trial=2	agent1	memory	0	-0.000000
exp2990	5.49750971e-29	0.000000	0.000000	discard	cycle 11 u=0.0985	agent0	initial_cond	0	0.000000
exp2991	9.32013160e-27	0.000000	0.000000	discard	BEST_FINAL phase=2.90 amp=0.5 trial=3	agent1	memory	0	-0.000000
exp2992	5.49750971e-29	0.000000	0.000000	discard	cycle 11 u=0.0985	agent0	initial_cond	1	0.000000
exp2993	9.32013160e-27	0.000000	0.000000	discard	BEST_FINAL phase=2.90 amp=0.5 trial=4	agent1	memory	1	-0.000000
exp2994	5.49750971e-29	0.000000	0.000000	discard	cycle 11 u=0.0985	agent0	initial_cond	0	0.000000
exp2995	9.32013160e-27	0.000000	0.000000	discard	BEST_FINAL phase=2.90 amp=0.5 trial=5	agent1	memory	0	-0.000000
exp2996	4.15642452e-29	0.000000	0.000000	discard	cycle 11 u=0.0985	agent0	initial_cond	0	0.000000
exp2997	4.15642452e-29	0.000000	0.000000	discard	cycle 11 u=0.0985	agent0	initial_cond	1	0.000000
exp2998	4.15642452e-29	0.000000	0.000000	discard	cycle 11 u=0.0985	agent0	initial_cond	0	0.000000
exp2999	2.19292611e-29	0.000000	0.000000	discard	cycle 11 u=0.0985	agent0	initial_cond	1	-0.000000
exp3000	2.19292611e-29	0.000000	0.000000	discard	cycle 11 u=0.0985	agent0	initial_cond	0	-0.000000
exp3001	2.19292611e-29	0.000000	0.000000	discard	cycle 11 u=0.0985	agent0	initial_cond	0	-0.000000
exp3002	4.22491788e-29	0.000000	0.000000	discard	cycle 11 u=0.0990	agent0	initial_cond	1	-0.000000
exp3003	1.15589045e-14	1.001296	1.000019	discard	cycle 11 u=0.0990	agent0	initial_cond	0	-1.520844
exp3003	1.15589045e-14	1.001296	1.000019	discard	Fourier pos modes=16 tol=1e-12	agent0	solver_param	0	-1.520844
exp3004	6.04747797e-14	1.001296	1.000019	discard	cycle 11 u=0.0990	agent0	initial_cond	0	-1.520844
exp3005	6.04747797e-14	1.001296	1.000019	discard	Fourier pos modes=32 tol=1e-12	agent0	solver_param	0	-1.520844
exp3006	1.48482526e-13	1.001296	1.000019	discard	cycle 11 u=0.0990	agent0	initial_cond	0	-1.520844
exp3007	1.48482526e-13	1.001296	1.000019	discard	Fourier pos modes=48 tol=1e-12	agent0	solver_param	0	-1.520844
exp3008	3.77813934e-13	1.001296	1.000019	discard	cycle 11 u=0.0990	agent0	initial_cond	0	-1.520844
exp3009	3.77813934e-13	1.001296	1.000019	discard	Fourier pos modes=64 tol=1e-12	agent0	solver_param	0	-1.520844
exp3010	crash	0	0	crash	cycle 11 u=0.0990	agent0	initial_cond	1	0
exp3011	crash	0	0	crash	Fourier pos modes=96 tol=1e-12	agent0	solver_param	1	0
exp3012	crash	0	0	crash	cycle 11 u=0.0990	agent0	initial_cond	0	0
exp3013	crash	0	0	crash	Fourier pos modes=128 tol=1e-12	agent0	solver_param	1	0
exp3014	0.00000000e+00	0.000000	0.000000	discard	energy measurement trivial branch	agent1_mem	ablation	1	0.000000
exp3015	1.33162036e-12	0.070535	-0.000000	discard	energy measurement 4th branch	agent1_mem	ablation	0	0.000099
exp3016	1.86448479e-16	1.001296	1.000019	discard	energy measurement positive branch	agent1_mem	ablation	1	-1.520844
exp3017	crash	0	0	crash	cycle 11 u=0.0990	agent0	initial_cond	1	0
exp3018	crash	0	0	crash	Fourier pos modes=256 tol=1e-12	agent0	solver_param	1	0
exp3019	1.86448479e-16	1.001296	-1.000019	discard	energy measurement negative branch	agent1_mem	ablation	0	-1.520844
exp3020	4.50941488e-29	0.000000	-0.000000	discard	cycle 11 u=0.0990	agent0	initial_cond	0	0.000000
exp3021	4.88330883e-29	0.000000	-0.000000	discard	cycle 11 u=0.0990	agent0	initial_cond	1	0.000000
exp3022	4.88330883e-29	0.000000	-0.000000	discard	cycle 11 u=0.0990	agent0	initial_cond	0	0.000000
exp3023	4.88330883e-29	0.000000	-0.000000	discard	cycle 11 u=0.0990	agent0	initial_cond	0	0.000000
exp3024	5.74085541e-29	0.000000	-0.000000	discard	cycle 11 u=0.0995	agent0	initial_cond	1	0.000000
exp3025	5.74085541e-29	0.000000	-0.000000	discard	cycle 11 u=0.0995	agent0	initial_cond	0	0.000000
exp3026	5.74085541e-29	0.000000	-0.000000	discard	cycle 11 u=0.0995	agent0	initial_cond	1	0.000000
exp3027	1.54984578e-28	0.000000	0.000000	discard	cycle 11 u=0.0995	agent0	initial_cond	0	-0.000000
exp3028	1.54984578e-28	0.000000	0.000000	discard	cycle 11 u=0.0995	agent0	initial_cond	0	-0.000000
exp3029	1.54984578e-28	0.000000	0.000000	discard	cycle 11 u=0.0995	agent0	initial_cond	1	-0.000000
exp3030	1.60328418e-29	0.000000	-0.000000	discard	cycle 11 u=0.0995	agent0	initial_cond	0	-0.000000
exp3031	1.60328418e-29	0.000000	-0.000000	discard	cycle 11 u=0.0995	agent0	initial_cond	0	-0.000000
exp3032	1.60328418e-29	0.000000	-0.000000	discard	cycle 11 u=0.0995	agent0	initial_cond	0	-0.000000
exp3033	7.34590618e-29	0.000000	0.000000	discard	cycle 11 u=0.0995	agent0	initial_cond	0	0.000000
exp3034	7.34590618e-29	0.000000	0.000000	discard	cycle 11 u=0.0995	agent0	initial_cond	1	0.000000
exp3035	0.00000000e+00	0.000000	0.000000	discard	PHASE_2_89_VERIFY trial=1	agent1	memory	1	0.000000
exp3036	7.34590618e-29	0.000000	0.000000	discard	cycle 11 u=0.0995	agent0	initial_cond	0	0.000000
exp3037	0.00000000e+00	0.000000	0.000000	discard	PHASE_2_89_VERIFY trial=1	agent1	memory	0	0.000000
exp3038	4.46546993e-29	0.000000	0.000000	discard	cycle 11 u=0.1000	agent0	initial_cond	0	-0.000000
exp3039	0.00000000e+00	0.000000	0.000000	discard	PHASE_2_89_VERIFY trial=1	agent1	memory	0	0.000000
exp3040	4.46546993e-29	0.000000	0.000000	discard	cycle 11 u=0.1000	agent0	initial_cond	1	-0.000000
exp3041	0.00000000e+00	0.000000	0.000000	discard	PHASE_2_89_VERIFY trial=2	agent1	memory	0	0.000000
exp3042	4.46546993e-29	0.000000	0.000000	discard	cycle 11 u=0.1000	agent0	initial_cond	0	-0.000000
exp3043	0.00000000e+00	0.000000	0.000000	discard	PHASE_2_89_VERIFY trial=2	agent1	memory	0	0.000000
exp3044	4.08106752e-29	0.000000	0.000000	discard	cycle 11 u=0.1000	agent0	initial_cond	1	-0.000000
exp3045	0.00000000e+00	0.000000	0.000000	discard	PHASE_2_89_VERIFY trial=2	agent1	memory	1	0.000000
exp3046	4.08106752e-29	0.000000	0.000000	discard	cycle 11 u=0.1000	agent0	initial_cond	0	-0.000000
exp3047	0.00000000e+00	0.000000	0.000000	discard	PHASE_2_89_VERIFY trial=3	agent1	memory	0	0.000000
exp3048	4.08106752e-29	0.000000	0.000000	discard	cycle 11 u=0.1000	agent0	initial_cond	0	-0.000000
exp3049	0.00000000e+00	0.000000	0.000000	discard	PHASE_2_89_VERIFY trial=3	agent1	memory	0	0.000000
exp3050	4.58623706e-29	0.000000	0.000000	discard	cycle 11 u=0.1000	agent0	initial_cond	1	-0.000000
exp3051	0.00000000e+00	0.000000	0.000000	discard	PHASE_2_89_VERIFY trial=3	agent1	memory	1	0.000000
exp3052	2.06774381e-16	1.001296	1.000019	discard	cycle 11 u=0.1000	agent0	initial_cond	0	-1.520844
exp3053	0.00000000e+00	0.000000	0.000000	discard	PHASE_2_89_VERIFY trial=4	agent1	memory	0	0.000000
exp3054	4.58623706e-29	0.000000	0.000000	discard	Fourier pos modes=4	agent0	solver_param	0	-0.000000
exp3055	2.64830595e-15	1.001296	1.000019	discard	cycle 11 u=0.1000	agent0	initial_cond	0	-1.520844
exp3056	0.00000000e+00	0.000000	0.000000	discard	PHASE_2_89_VERIFY trial=4	agent1	memory	1	0.000000
exp3057	4.39794337e-29	0.000000	0.000000	discard	Fourier pos modes=6	agent0	solver_param	1	-0.000000
exp3058	2.27731282e-15	1.001296	1.000019	discard	cycle 11 u=0.1000	agent0	initial_cond	0	-1.520844
