exp_id	residual	solution_norm	solution_mean	status	description	agent	design	elapsed_s	solution_energy
exp12023	1.30310780e-28	0.000000	0.000000	discard	cycle 89 u=0.0980	agent0	initial_cond	0	-0.000000
exp12024	1.30310780e-28	0.000000	0.000000	discard	cycle 89 u=0.0980	agent0	initial_cond	0	-0.000000
exp12025	1.30310780e-28	0.000000	0.000000	discard	cycle 89 u=0.0980	agent0	initial_cond	1	-0.000000
exp12026	5.45343271e-29	0.000000	0.000000	discard	cycle 89 u=0.0982	agent0	initial_cond	0	-0.000000
exp12027	5.45343271e-29	0.000000	0.000000	discard	cycle 89 u=0.0982	agent0	initial_cond	1	-0.000000
exp12028	5.45343271e-29	0.000000	0.000000	discard	cycle 89 u=0.0982	agent0	initial_cond	0	-0.000000
exp12029	1.23429977e-28	0.000000	0.000000	discard	cycle 89 u=0.0982	agent0	initial_cond	0	0.000000
exp12030	1.23429977e-28	0.000000	0.000000	discard	cycle 89 u=0.0982	agent0	initial_cond	1	0.000000
exp12031	1.23429977e-28	0.000000	0.000000	discard	cycle 89 u=0.0982	agent0	initial_cond	0	0.000000
exp12032	1.88036672e-29	0.000000	0.000000	discard	cycle 89 u=0.0982	agent0	initial_cond	1	0.000000
exp12033	1.88036672e-29	0.000000	0.000000	discard	cycle 89 u=0.0982	agent0	initial_cond	0	0.000000
exp12034	1.88036672e-29	0.000000	0.000000	discard	cycle 89 u=0.0982	agent0	initial_cond	0	0.000000
exp12035	1.91190259e-29	0.000000	-0.000000	discard	cycle 89 u=0.0982	agent0	initial_cond	1	0.000000
exp12036	1.91190259e-29	0.000000	-0.000000	discard	cycle 89 u=0.0982	agent0	initial_cond	0	0.000000
exp12037	1.91190259e-29	0.000000	-0.000000	discard	cycle 89 u=0.0982	agent0	initial_cond	1	0.000000
exp12038	6.13049994e-29	0.000000	0.000000	discard	cycle 89 u=0.0985	agent0	initial_cond	0	0.000000
exp12039	6.13049994e-29	0.000000	0.000000	discard	cycle 89 u=0.0985	agent0	initial_cond	0	0.000000
exp12040	6.13049994e-29	0.000000	0.000000	discard	cycle 89 u=0.0985	agent0	initial_cond	1	0.000000
exp12041	5.49750971e-29	0.000000	0.000000	discard	cycle 89 u=0.0985	agent0	initial_cond	0	0.000000
exp12042	5.49750971e-29	0.000000	0.000000	discard	cycle 89 u=0.0985	agent0	initial_cond	1	0.000000
exp12043	5.49750971e-29	0.000000	0.000000	discard	cycle 89 u=0.0985	agent0	initial_cond	0	0.000000
exp12044	4.15642452e-29	0.000000	0.000000	discard	cycle 89 u=0.0985	agent0	initial_cond	0	0.000000
exp12045	4.15642452e-29	0.000000	0.000000	discard	cycle 89 u=0.0985	agent0	initial_cond	1	0.000000
exp12046	4.15642452e-29	0.000000	0.000000	discard	cycle 89 u=0.0985	agent0	initial_cond	0	0.000000
exp12047	2.19292611e-29	0.000000	0.000000	discard	cycle 89 u=0.0985	agent0	initial_cond	1	-0.000000
exp12048	2.19292611e-29	0.000000	0.000000	discard	cycle 89 u=0.0985	agent0	initial_cond	0	-0.000000
exp12049	2.19292611e-29	0.000000	0.000000	discard	cycle 89 u=0.0985	agent0	initial_cond	0	-0.000000
exp12050	4.22491788e-29	0.000000	0.000000	discard	cycle 89 u=0.0990	agent0	initial_cond	0	-0.000000
exp12051	4.22491788e-29	0.000000	0.000000	discard	cycle 89 u=0.0990	agent0	initial_cond	0	-0.000000
exp12052	4.22491788e-29	0.000000	0.000000	discard	cycle 89 u=0.0990	agent0	initial_cond	1	-0.000000
exp12053	3.22245147e-29	0.000000	0.000000	discard	cycle 89 u=0.0990	agent0	initial_cond	0	0.000000
exp12054	3.22245147e-29	0.000000	0.000000	discard	cycle 89 u=0.0990	agent0	initial_cond	0	0.000000
exp12055	3.22245147e-29	0.000000	0.000000	discard	cycle 89 u=0.0990	agent0	initial_cond	0	0.000000
exp12056	4.50941488e-29	0.000000	-0.000000	discard	cycle 89 u=0.0990	agent0	initial_cond	0	0.000000
exp12057	4.50941488e-29	0.000000	-0.000000	discard	cycle 89 u=0.0990	agent0	initial_cond	1	0.000000
exp12058	4.50941488e-29	0.000000	-0.000000	discard	cycle 89 u=0.0990	agent0	initial_cond	0	0.000000
exp12059	4.88330883e-29	0.000000	-0.000000	discard	cycle 89 u=0.0990	agent0	initial_cond	0	0.000000
exp12060	4.88330883e-29	0.000000	-0.000000	discard	cycle 89 u=0.0990	agent0	initial_cond	0	0.000000
exp12061	4.88330883e-29	0.000000	-0.000000	discard	cycle 89 u=0.0990	agent0	initial_cond	0	0.000000
exp12062	5.74085541e-29	0.000000	-0.000000	discard	cycle 89 u=0.0995	agent0	initial_cond	1	0.000000
exp12063	5.74085541e-29	0.000000	-0.000000	discard	cycle 89 u=0.0995	agent0	initial_cond	0	0.000000
exp12064	5.74085541e-29	0.000000	-0.000000	discard	cycle 89 u=0.0995	agent0	initial_cond	0	0.000000
exp12065	1.54984578e-28	0.000000	0.000000	discard	cycle 89 u=0.0995	agent0	initial_cond	0	-0.000000
exp12066	1.54984578e-28	0.000000	0.000000	discard	cycle 89 u=0.0995	agent0	initial_cond	0	-0.000000
exp12067	1.54984578e-28	0.000000	0.000000	discard	cycle 89 u=0.0995	agent0	initial_cond	1	-0.000000
exp12068	1.60328418e-29	0.000000	-0.000000	discard	cycle 89 u=0.0995	agent0	initial_cond	0	-0.000000
exp12069	1.60328418e-29	0.000000	-0.000000	discard	cycle 89 u=0.0995	agent0	initial_cond	0	-0.000000
exp12070	1.60328418e-29	0.000000	-0.000000	discard	cycle 89 u=0.0995	agent0	initial_cond	0	-0.000000
exp12071	7.34590618e-29	0.000000	0.000000	discard	cycle 89 u=0.0995	agent0	initial_cond	0	0.000000
exp12072	7.34590618e-29	0.000000	0.000000	discard	cycle 89 u=0.0995	agent0	initial_cond	1	0.000000
exp12073	7.34590618e-29	0.000000	0.000000	discard	cycle 89 u=0.0995	agent0	initial_cond	0	0.000000
exp12074	4.46546993e-29	0.000000	0.000000	discard	cycle 89 u=0.1000	agent0	initial_cond	0	-0.000000
exp12075	4.46546993e-29	0.000000	0.000000	discard	cycle 89 u=0.1000	agent0	initial_cond	0	-0.000000
exp12076	4.46546993e-29	0.000000	0.000000	discard	cycle 89 u=0.1000	agent0	initial_cond	0	-0.000000
exp12077	4.08106752e-29	0.000000	0.000000	discard	cycle 89 u=0.1000	agent0	initial_cond	1	-0.000000
exp12078	4.08106752e-29	0.000000	0.000000	discard	cycle 89 u=0.1000	agent0	initial_cond	0	-0.000000
exp12079	4.08106752e-29	0.000000	0.000000	discard	cycle 89 u=0.1000	agent0	initial_cond	0	-0.000000
exp12080	4.58623706e-29	0.000000	0.000000	discard	cycle 89 u=0.1000	agent0	initial_cond	0	-0.000000
exp12081	4.58623706e-29	0.000000	0.000000	discard	cycle 89 u=0.1000	agent0	initial_cond	0	-0.000000
exp12082	4.58623706e-29	0.000000	0.000000	discard	cycle 89 u=0.1000	agent0	initial_cond	1	-0.000000
exp12083	4.39794337e-29	0.000000	0.000000	discard	cycle 89 u=0.1000	agent0	initial_cond	0	-0.000000
exp12084	4.39794337e-29	0.000000	0.000000	discard	cycle 89 u=0.1000	agent0	initial_cond	0	-0.000000
exp12085	4.39794337e-29	0.000000	0.000000	discard	cycle 89 u=0.1000	agent0	initial_cond	0	-0.000000
exp12086	1.36727475e-28	0.000000	0.000000	discard	cycle 89 u=0.1050	agent0	initial_cond	0	-0.000000
exp12087	1.36727475e-28	0.000000	0.000000	discard	cycle 89 u=0.1050	agent0	initial_cond	1	-0.000000
exp12088	1.36727475e-28	0.000000	0.000000	discard	cycle 89 u=0.1050	agent0	initial_cond	0	-0.000000
exp12089	6.14461376e-29	0.000000	0.000000	discard	cycle 89 u=0.1050	agent0	initial_cond	1	-0.000000
exp12090	6.14461376e-29	0.000000	0.000000	discard	cycle 89 u=0.1050	agent0	initial_cond	0	-0.000000
exp12091	6.14461376e-29	0.000000	0.000000	discard	cycle 89 u=0.1050	agent0	initial_cond	0	-0.000000
exp12092	1.75906666e-28	0.000000	0.000000	discard	cycle 89 u=0.1050	agent0	initial_cond	1	-0.000000
exp12093	1.75906666e-28	0.000000	0.000000	discard	cycle 89 u=0.1050	agent0	initial_cond	0	-0.000000
exp12094	1.75906666e-28	0.000000	0.000000	discard	cycle 89 u=0.1050	agent0	initial_cond	1	-0.000000
exp12095	1.11257917e-28	0.000000	0.000000	discard	cycle 89 u=0.1050	agent0	initial_cond	0	-0.000000
exp12096	1.11257917e-28	0.000000	0.000000	discard	cycle 89 u=0.1050	agent0	initial_cond	0	-0.000000
exp12097	1.11257917e-28	0.000000	0.000000	discard	cycle 89 u=0.1050	agent0	initial_cond	1	-0.000000
exp12098	8.58580947e-29	0.000000	0.000000	discard	cycle 90 u=0.0975	agent0	initial_cond	0	0.000000
exp12099	8.58580947e-29	0.000000	0.000000	discard	cycle 90 u=0.0975	agent0	initial_cond	0	0.000000
exp12100	8.58580947e-29	0.000000	0.000000	discard	cycle 90 u=0.0975	agent0	initial_cond	0	0.000000
exp12101	5.23962023e-29	0.000000	0.000000	discard	cycle 90 u=0.0975	agent0	initial_cond	0	0.000000
exp12102	5.23962023e-29	0.000000	0.000000	discard	cycle 90 u=0.0975	agent0	initial_cond	1	0.000000
exp12103	5.23962023e-29	0.000000	0.000000	discard	cycle 90 u=0.0975	agent0	initial_cond	0	0.000000
exp12104	4.03266298e-29	0.000000	0.000000	discard	cycle 90 u=0.0975	agent0	initial_cond	1	0.000000
exp12105	4.03266298e-29	0.000000	0.000000	discard	cycle 90 u=0.0975	agent0	initial_cond	0	0.000000
exp12106	4.03266298e-29	0.000000	0.000000	discard	cycle 90 u=0.0975	agent0	initial_cond	0	0.000000
exp12107	4.80015937e-29	0.000000	0.000000	discard	cycle 90 u=0.0975	agent0	initial_cond	1	0.000000
exp12108	4.80015937e-29	0.000000	0.000000	discard	cycle 90 u=0.0975	agent0	initial_cond	0	0.000000
exp12109	4.80015937e-29	0.000000	0.000000	discard	cycle 90 u=0.0975	agent0	initial_cond	1	0.000000
exp12110	2.68824537e-29	0.000000	0.000000	discard	cycle 90 u=0.0980	agent0	initial_cond	0	-0.000000
exp12111	2.68824537e-29	0.000000	0.000000	discard	cycle 90 u=0.0980	agent0	initial_cond	0	-0.000000
exp12112	2.68824537e-29	0.000000	0.000000	discard	cycle 90 u=0.0980	agent0	initial_cond	1	-0.000000
exp12113	6.16758073e-29	0.000000	0.000000	discard	cycle 90 u=0.0980	agent0	initial_cond	0	-0.000000
exp12114	6.16758073e-29	0.000000	0.000000	discard	cycle 90 u=0.0980	agent0	initial_cond	1	-0.000000
exp12115	6.16758073e-29	0.000000	0.000000	discard	cycle 90 u=0.0980	agent0	initial_cond	0	-0.000000
exp12116	2.01926478e-29	0.000000	0.000000	discard	cycle 90 u=0.0980	agent0	initial_cond	0	0.000000
exp12117	2.01926478e-29	0.000000	0.000000	discard	cycle 90 u=0.0980	agent0	initial_cond	1	0.000000
exp12118	2.01926478e-29	0.000000	0.000000	discard	cycle 90 u=0.0980	agent0	initial_cond	0	0.000000
exp12119	1.30310780e-28	0.000000	0.000000	discard	cycle 90 u=0.0980	agent0	initial_cond	1	-0.000000
exp12120	1.30310780e-28	0.000000	0.000000	discard	cycle 90 u=0.0980	agent0	initial_cond	0	-0.000000
exp12121	1.30310780e-28	0.000000	0.000000	discard	cycle 90 u=0.0980	agent0	initial_cond	0	-0.000000
exp12122	5.45343271e-29	0.000000	0.000000	discard	cycle 90 u=0.0982	agent0	initial_cond	1	-0.000000
exp12123	5.45343271e-29	0.000000	0.000000	discard	cycle 90 u=0.0982	agent0	initial_cond	0	-0.000000
exp12124	5.45343271e-29	0.000000	0.000000	discard	cycle 90 u=0.0982	agent0	initial_cond	1	-0.000000
exp12125	1.23429977e-28	0.000000	0.000000	discard	cycle 90 u=0.0982	agent0	initial_cond	0	0.000000
exp12126	1.23429977e-28	0.000000	0.000000	discard	cycle 90 u=0.0982	agent0	initial_cond	0	0.000000
exp12127	1.23429977e-28	0.000000	0.000000	discard	cycle 90 u=0.0982	agent0	initial_cond	1	0.000000
exp12128	1.88036672e-29	0.000000	0.000000	discard	cycle 90 u=0.0982	agent0	initial_cond	0	0.000000
exp12129	1.88036672e-29	0.000000	0.000000	discard	cycle 90 u=0.0982	agent0	initial_cond	1	0.000000
exp12130	1.88036672e-29	0.000000	0.000000	discard	cycle 90 u=0.0982	agent0	initial_cond	0	0.000000
exp12131	1.91190259e-29	0.000000	-0.000000	discard	cycle 90 u=0.0982	agent0	initial_cond	0	0.000000
exp12132	1.91190259e-29	0.000000	-0.000000	discard	cycle 90 u=0.0982	agent0	initial_cond	0	0.000000
exp12133	1.91190259e-29	0.000000	-0.000000	discard	cycle 90 u=0.0982	agent0	initial_cond	0	0.000000
exp12134	6.13049994e-29	0.000000	0.000000	discard	cycle 90 u=0.0985	agent0	initial_cond	1	0.000000
exp12135	6.13049994e-29	0.000000	0.000000	discard	cycle 90 u=0.0985	agent0	initial_cond	0	0.000000
exp12136	6.13049994e-29	0.000000	0.000000	discard	cycle 90 u=0.0985	agent0	initial_cond	0	0.000000
exp12137	5.49750971e-29	0.000000	0.000000	discard	cycle 90 u=0.0985	agent0	initial_cond	0	0.000000
exp12138	5.49750971e-29	0.000000	0.000000	discard	cycle 90 u=0.0985	agent0	initial_cond	0	0.000000
exp12139	5.49750971e-29	0.000000	0.000000	discard	cycle 90 u=0.0985	agent0	initial_cond	1	0.000000
exp12140	4.15642452e-29	0.000000	0.000000	discard	cycle 90 u=0.0985	agent0	initial_cond	0	0.000000
exp12141	4.15642452e-29	0.000000	0.000000	discard	cycle 90 u=0.0985	agent0	initial_cond	0	0.000000
exp12142	4.15642452e-29	0.000000	0.000000	discard	cycle 90 u=0.0985	agent0	initial_cond	0	0.000000
exp12143	2.19292611e-29	0.000000	0.000000	discard	cycle 90 u=0.0985	agent0	initial_cond	0	-0.000000
exp12144	2.19292611e-29	0.000000	0.000000	discard	cycle 90 u=0.0985	agent0	initial_cond	1	-0.000000
exp12145	2.19292611e-29	0.000000	0.000000	discard	cycle 90 u=0.0985	agent0	initial_cond	0	-0.000000
exp12146	4.22491788e-29	0.000000	0.000000	discard	cycle 90 u=0.0990	agent0	initial_cond	0	-0.000000
exp12147	4.22491788e-29	0.000000	0.000000	discard	cycle 90 u=0.0990	agent0	initial_cond	0	-0.000000
exp12148	4.22491788e-29	0.000000	0.000000	discard	cycle 90 u=0.0990	agent0	initial_cond	0	-0.000000
exp12149	3.22245147e-29	0.000000	0.000000	discard	cycle 90 u=0.0990	agent0	initial_cond	1	0.000000
exp12150	3.22245147e-29	0.000000	0.000000	discard	cycle 90 u=0.0990	agent0	initial_cond	0	0.000000
exp12151	3.22245147e-29	0.000000	0.000000	discard	cycle 90 u=0.0990	agent0	initial_cond	1	0.000000
exp12152	4.50941488e-29	0.000000	-0.000000	discard	cycle 90 u=0.0990	agent0	initial_cond	0	0.000000
exp12153	4.50941488e-29	0.000000	-0.000000	discard	cycle 90 u=0.0990	agent0	initial_cond	0	0.000000
exp12154	4.50941488e-29	0.000000	-0.000000	discard	cycle 90 u=0.0990	agent0	initial_cond	1	0.000000
exp12155	4.88330883e-29	0.000000	-0.000000	discard	cycle 90 u=0.0990	agent0	initial_cond	0	0.000000
exp12156	4.88330883e-29	0.000000	-0.000000	discard	cycle 90 u=0.0990	agent0	initial_cond	1	0.000000
exp12157	4.88330883e-29	0.000000	-0.000000	discard	cycle 90 u=0.0990	agent0	initial_cond	0	0.000000
exp12158	5.74085541e-29	0.000000	-0.000000	discard	cycle 90 u=0.0995	agent0	initial_cond	0	0.000000
exp12159	5.74085541e-29	0.000000	-0.000000	discard	cycle 90 u=0.0995	agent0	initial_cond	1	0.000000
exp12160	5.74085541e-29	0.000000	-0.000000	discard	cycle 90 u=0.0995	agent0	initial_cond	0	0.000000
exp12161	1.54984578e-28	0.000000	0.000000	discard	cycle 90 u=0.0995	agent0	initial_cond	1	-0.000000
exp12162	1.54984578e-28	0.000000	0.000000	discard	cycle 90 u=0.0995	agent0	initial_cond	0	-0.000000
exp12163	1.54984578e-28	0.000000	0.000000	discard	cycle 90 u=0.0995	agent0	initial_cond	0	-0.000000
exp12164	1.60328418e-29	0.000000	-0.000000	discard	cycle 90 u=0.0995	agent0	initial_cond	1	-0.000000
exp12165	1.60328418e-29	0.000000	-0.000000	discard	cycle 90 u=0.0995	agent0	initial_cond	0	-0.000000
exp12166	1.60328418e-29	0.000000	-0.000000	discard	cycle 90 u=0.0995	agent0	initial_cond	1	-0.000000
exp12167	7.34590618e-29	0.000000	0.000000	discard	cycle 90 u=0.0995	agent0	initial_cond	0	0.000000
exp12168	7.34590618e-29	0.000000	0.000000	discard	cycle 90 u=0.0995	agent0	initial_cond	0	0.000000
exp12169	7.34590618e-29	0.000000	0.000000	discard	cycle 90 u=0.0995	agent0	initial_cond	0	0.000000
exp12170	4.46546993e-29	0.000000	0.000000	discard	cycle 90 u=0.1000	agent0	initial_cond	0	-0.000000
exp12171	4.46546993e-29	0.000000	0.000000	discard	cycle 90 u=0.1000	agent0	initial_cond	1	-0.000000
exp12172	4.46546993e-29	0.000000	0.000000	discard	cycle 90 u=0.1000	agent0	initial_cond	0	-0.000000
exp12173	4.08106752e-29	0.000000	0.000000	discard	cycle 90 u=0.1000	agent0	initial_cond	0	-0.000000
exp12174	4.08106752e-29	0.000000	0.000000	discard	cycle 90 u=0.1000	agent0	initial_cond	0	-0.000000
exp12175	4.08106752e-29	0.000000	0.000000	discard	cycle 90 u=0.1000	agent0	initial_cond	0	-0.000000
exp12176	4.58623706e-29	0.000000	0.000000	discard	cycle 90 u=0.1000	agent0	initial_cond	1	-0.000000
exp12177	4.58623706e-29	0.000000	0.000000	discard	cycle 90 u=0.1000	agent0	initial_cond	0	-0.000000
exp12178	4.58623706e-29	0.000000	0.000000	discard	cycle 90 u=0.1000	agent0	initial_cond	0	-0.000000
exp12179	4.39794337e-29	0.000000	0.000000	discard	cycle 90 u=0.1000	agent0	initial_cond	0	-0.000000
exp12180	4.39794337e-29	0.000000	0.000000	discard	cycle 90 u=0.1000	agent0	initial_cond	0	-0.000000
exp12181	4.39794337e-29	0.000000	0.000000	discard	cycle 90 u=0.1000	agent0	initial_cond	1	-0.000000
exp12182	1.36727475e-28	0.000000	0.000000	discard	cycle 90 u=0.1050	agent0	initial_cond	0	-0.000000
exp12183	1.36727475e-28	0.000000	0.000000	discard	cycle 90 u=0.1050	agent0	initial_cond	0	-0.000000
exp12184	1.36727475e-28	0.000000	0.000000	discard	cycle 90 u=0.1050	agent0	initial_cond	0	-0.000000
exp12185	6.14461376e-29	0.000000	0.000000	discard	cycle 90 u=0.1050	agent0	initial_cond	0	-0.000000
exp12186	6.14461376e-29	0.000000	0.000000	discard	cycle 90 u=0.1050	agent0	initial_cond	1	-0.000000
exp12187	6.14461376e-29	0.000000	0.000000	discard	cycle 90 u=0.1050	agent0	initial_cond	0	-0.000000
exp12188	1.75906666e-28	0.000000	0.000000	discard	cycle 90 u=0.1050	agent0	initial_cond	0	-0.000000
exp12189	1.75906666e-28	0.000000	0.000000	discard	cycle 90 u=0.1050	agent0	initial_cond	0	-0.000000
exp12190	1.75906666e-28	0.000000	0.000000	discard	cycle 90 u=0.1050	agent0	initial_cond	0	-0.000000
exp12191	1.11257917e-28	0.000000	0.000000	discard	cycle 90 u=0.1050	agent0	initial_cond	1	-0.000000
exp12192	1.11257917e-28	0.000000	0.000000	discard	cycle 90 u=0.1050	agent0	initial_cond	0	-0.000000
exp12193	1.11257917e-28	0.000000	0.000000	discard	cycle 90 u=0.1050	agent0	initial_cond	0	-0.000000
exp12194	8.58580947e-29	0.000000	0.000000	discard	cycle 91 u=0.0975	agent0	initial_cond	0	0.000000
exp12195	8.58580947e-29	0.000000	0.000000	discard	cycle 91 u=0.0975	agent0	initial_cond	0	0.000000
exp12196	8.58580947e-29	0.000000	0.000000	discard	cycle 91 u=0.0975	agent0	initial_cond	1	0.000000
exp12197	5.23962023e-29	0.000000	0.000000	discard	cycle 91 u=0.0975	agent0	initial_cond	0	0.000000
exp12198	5.23962023e-29	0.000000	0.000000	discard	cycle 91 u=0.0975	agent0	initial_cond	0	0.000000
exp12199	5.23962023e-29	0.000000	0.000000	discard	cycle 91 u=0.0975	agent0	initial_cond	0	0.000000
exp12200	4.03266298e-29	0.000000	0.000000	discard	cycle 91 u=0.0975	agent0	initial_cond	0	0.000000
exp12201	4.03266298e-29	0.000000	0.000000	discard	cycle 91 u=0.0975	agent0	initial_cond	1	0.000000
exp12202	4.03266298e-29	0.000000	0.000000	discard	cycle 91 u=0.0975	agent0	initial_cond	0	0.000000
exp12203	4.80015937e-29	0.000000	0.000000	discard	cycle 91 u=0.0975	agent0	initial_cond	0	0.000000
exp12204	4.80015937e-29	0.000000	0.000000	discard	cycle 91 u=0.0975	agent0	initial_cond	0	0.000000
exp12205	4.80015937e-29	0.000000	0.000000	discard	cycle 91 u=0.0975	agent0	initial_cond	0	0.000000
exp12206	2.68824537e-29	0.000000	0.000000	discard	cycle 91 u=0.0980	agent0	initial_cond	1	-0.000000
exp12207	2.68824537e-29	0.000000	0.000000	discard	cycle 91 u=0.0980	agent0	initial_cond	0	-0.000000
exp12208	2.68824537e-29	0.000000	0.000000	discard	cycle 91 u=0.0980	agent0	initial_cond	0	-0.000000
exp12209	6.16758073e-29	0.000000	0.000000	discard	cycle 91 u=0.0980	agent0	initial_cond	0	-0.000000
exp12210	6.16758073e-29	0.000000	0.000000	discard	cycle 91 u=0.0980	agent0	initial_cond	0	-0.000000
exp12211	6.16758073e-29	0.000000	0.000000	discard	cycle 91 u=0.0980	agent0	initial_cond	1	-0.000000
exp12212	2.01926478e-29	0.000000	0.000000	discard	cycle 91 u=0.0980	agent0	initial_cond	0	0.000000
exp12213	2.01926478e-29	0.000000	0.000000	discard	cycle 91 u=0.0980	agent0	initial_cond	0	0.000000
exp12214	2.01926478e-29	0.000000	0.000000	discard	cycle 91 u=0.0980	agent0	initial_cond	0	0.000000
exp12215	1.30310780e-28	0.000000	0.000000	discard	cycle 91 u=0.0980	agent0	initial_cond	0	-0.000000
exp12216	1.30310780e-28	0.000000	0.000000	discard	cycle 91 u=0.0980	agent0	initial_cond	1	-0.000000
exp12217	1.30310780e-28	0.000000	0.000000	discard	cycle 91 u=0.0980	agent0	initial_cond	0	-0.000000
exp12218	5.45343271e-29	0.000000	0.000000	discard	cycle 91 u=0.0982	agent0	initial_cond	0	-0.000000
exp12219	5.45343271e-29	0.000000	0.000000	discard	cycle 91 u=0.0982	agent0	initial_cond	0	-0.000000
exp12220	5.45343271e-29	0.000000	0.000000	discard	cycle 91 u=0.0982	agent0	initial_cond	0	-0.000000
exp12221	1.23429977e-28	0.000000	0.000000	discard	cycle 91 u=0.0982	agent0	initial_cond	1	0.000000
exp12222	1.23429977e-28	0.000000	0.000000	discard	cycle 91 u=0.0982	agent0	initial_cond	0	0.000000
exp12223	1.23429977e-28	0.000000	0.000000	discard	cycle 91 u=0.0982	agent0	initial_cond	0	0.000000
exp12224	1.88036672e-29	0.000000	0.000000	discard	cycle 91 u=0.0982	agent0	initial_cond	0	0.000000
exp12225	1.88036672e-29	0.000000	0.000000	discard	cycle 91 u=0.0982	agent0	initial_cond	0	0.000000
exp12226	1.88036672e-29	0.000000	0.000000	discard	cycle 91 u=0.0982	agent0	initial_cond	1	0.000000
exp12227	1.91190259e-29	0.000000	-0.000000	discard	cycle 91 u=0.0982	agent0	initial_cond	0	0.000000
exp12228	1.91190259e-29	0.000000	-0.000000	discard	cycle 91 u=0.0982	agent0	initial_cond	0	0.000000
exp12229	1.91190259e-29	0.000000	-0.000000	discard	cycle 91 u=0.0982	agent0	initial_cond	0	0.000000
exp12230	6.13049994e-29	0.000000	0.000000	discard	cycle 91 u=0.0985	agent0	initial_cond	0	0.000000
exp12231	6.13049994e-29	0.000000	0.000000	discard	cycle 91 u=0.0985	agent0	initial_cond	1	0.000000
exp12232	6.13049994e-29	0.000000	0.000000	discard	cycle 91 u=0.0985	agent0	initial_cond	0	0.000000
exp12233	5.49750971e-29	0.000000	0.000000	discard	cycle 91 u=0.0985	agent0	initial_cond	0	0.000000
exp12234	5.49750971e-29	0.000000	0.000000	discard	cycle 91 u=0.0985	agent0	initial_cond	0	0.000000
exp12235	5.49750971e-29	0.000000	0.000000	discard	cycle 91 u=0.0985	agent0	initial_cond	0	0.000000
exp12236	4.15642452e-29	0.000000	0.000000	discard	cycle 91 u=0.0985	agent0	initial_cond	1	0.000000
exp12237	4.15642452e-29	0.000000	0.000000	discard	cycle 91 u=0.0985	agent0	initial_cond	0	0.000000
exp12238	4.15642452e-29	0.000000	0.000000	discard	cycle 91 u=0.0985	agent0	initial_cond	0	0.000000
exp12239	2.19292611e-29	0.000000	0.000000	discard	cycle 91 u=0.0985	agent0	initial_cond	0	-0.000000
exp12240	2.19292611e-29	0.000000	0.000000	discard	cycle 91 u=0.0985	agent0	initial_cond	0	-0.000000
exp12241	2.19292611e-29	0.000000	0.000000	discard	cycle 91 u=0.0985	agent0	initial_cond	1	-0.000000
