exp_id	residual	solution_norm	solution_mean	status	description	agent	design	elapsed_s	solution_energy
exp12917	6.18472616e-18	0.011783	-0.000000	discard	Round 9 verify: K=0.05	agent1	branch_search	1	-0.000002
exp12918	1.88036672e-29	0.000000	0.000000	discard	cycle 97 u=0.0982	agent0	initial_cond	0	0.000000
exp12919	6.91159813e-18	0.070278	-0.000000	discard	Round 9 verify: K=0.30	agent1	branch_search	0	0.000097
exp12920	1.91190259e-29	0.000000	-0.000000	discard	cycle 97 u=0.0982	agent0	initial_cond	0	0.000000
exp12921	4.02461359e-17	0.170672	-0.000000	discard	Round 9 verify: K=0.75	agent1	branch_search	0	0.005386
exp12922	1.91190259e-29	0.000000	-0.000000	discard	cycle 97 u=0.0982	agent0	initial_cond	1	0.000000
exp12923	1.77784626e-16	0.222365	0.000000	discard	Round 9 verify: K=1.0	agent1	branch_search	0	0.015962
exp12924	1.91190259e-29	0.000000	-0.000000	discard	cycle 97 u=0.0982	agent0	initial_cond	0	0.000000
exp12925	6.13049994e-29	0.000000	0.000000	discard	cycle 97 u=0.0985	agent0	initial_cond	0	0.000000
exp12926	6.13049994e-29	0.000000	0.000000	discard	cycle 97 u=0.0985	agent0	initial_cond	0	0.000000
exp12927	6.13049994e-29	0.000000	0.000000	discard	cycle 97 u=0.0985	agent0	initial_cond	0	0.000000
exp12928	5.49750971e-29	0.000000	0.000000	discard	cycle 97 u=0.0985	agent0	initial_cond	1	0.000000
exp12929	5.49750971e-29	0.000000	0.000000	discard	cycle 97 u=0.0985	agent0	initial_cond	0	0.000000
exp12930	5.49750971e-29	0.000000	0.000000	discard	cycle 97 u=0.0985	agent0	initial_cond	0	0.000000
exp12931	4.15642452e-29	0.000000	0.000000	discard	cycle 97 u=0.0985	agent0	initial_cond	0	0.000000
exp12932	4.15642452e-29	0.000000	0.000000	discard	cycle 97 u=0.0985	agent0	initial_cond	0	0.000000
exp12933	4.15642452e-29	0.000000	0.000000	discard	cycle 97 u=0.0985	agent0	initial_cond	1	0.000000
exp12934	2.19292611e-29	0.000000	0.000000	discard	cycle 97 u=0.0985	agent0	initial_cond	0	-0.000000
exp12935	2.19292611e-29	0.000000	0.000000	discard	cycle 97 u=0.0985	agent0	initial_cond	0	-0.000000
exp12936	2.19292611e-29	0.000000	0.000000	discard	cycle 97 u=0.0985	agent0	initial_cond	0	-0.000000
exp12937	4.22491788e-29	0.000000	0.000000	discard	cycle 97 u=0.0990	agent0	initial_cond	0	-0.000000
exp12938	4.22491788e-29	0.000000	0.000000	discard	cycle 97 u=0.0990	agent0	initial_cond	1	-0.000000
exp12939	4.22491788e-29	0.000000	0.000000	discard	cycle 97 u=0.0990	agent0	initial_cond	0	-0.000000
exp12940	3.22245147e-29	0.000000	0.000000	discard	cycle 97 u=0.0990	agent0	initial_cond	1	0.000000
exp12941	3.22245147e-29	0.000000	0.000000	discard	cycle 97 u=0.0990	agent0	initial_cond	0	0.000000
exp12942	3.22245147e-29	0.000000	0.000000	discard	cycle 97 u=0.0990	agent0	initial_cond	0	0.000000
exp12943	4.50941488e-29	0.000000	-0.000000	discard	cycle 97 u=0.0990	agent0	initial_cond	1	0.000000
exp12944	4.50941488e-29	0.000000	-0.000000	discard	cycle 97 u=0.0990	agent0	initial_cond	0	0.000000
exp12945	4.50941488e-29	0.000000	-0.000000	discard	cycle 97 u=0.0990	agent0	initial_cond	1	0.000000
exp12946	6.12999068e-15	0.002357	-0.000000	discard	Round 9: Complete bifurcation K=0.01	agent1	branch_search	0	-0.000000
exp12946	4.88330883e-29	0.000000	-0.000000	discard	cycle 97 u=0.0990	agent0	initial_cond	0	0.000000
exp12947	3.65164686e-18	0.004714	-0.000000	discard	Round 9: Complete bifurcation K=0.02	agent1	branch_search	0	-0.000000
exp12947	4.88330883e-29	0.000000	-0.000000	discard	cycle 97 u=0.0990	agent0	initial_cond	0	0.000000
exp12948	1.29653480e-17	0.007071	-0.000000	discard	Round 9: Complete bifurcation K=0.03	agent1	branch_search	1	-0.000001
exp12948	4.88330883e-29	0.000000	-0.000000	discard	cycle 97 u=0.0990	agent0	initial_cond	1	0.000000
exp12949	2.88403669e-15	0.009427	-0.000000	discard	Round 9: Complete bifurcation K=0.04	agent1	branch_search	0	-0.000001
exp12949	5.74085541e-29	0.000000	-0.000000	discard	cycle 97 u=0.0995	agent0	initial_cond	0	0.000000
exp12950	6.18472616e-18	0.011783	-0.000000	discard	Round 9: Complete bifurcation K=0.05	agent1	branch_search	1	-0.000002
exp12950	5.74085541e-29	0.000000	-0.000000	discard	cycle 97 u=0.0995	agent0	initial_cond	1	0.000000
exp12951	5.74085541e-29	0.000000	-0.000000	discard	cycle 97 u=0.0995	agent0	initial_cond	0	0.000000
exp12951	5.96730526e-18	0.014139	-0.000000	discard	Round 9: Complete bifurcation K=0.06	agent1	branch_search	0	-0.000002
exp12952	1.54984578e-28	0.000000	0.000000	discard	cycle 97 u=0.0995	agent0	initial_cond	0	-0.000000
exp12952	5.28063005e-17	0.016494	-0.000000	discard	Round 9: Complete bifurcation K=0.07	agent1	branch_search	0	-0.000003
exp12953	1.54984578e-28	0.000000	0.000000	discard	cycle 97 u=0.0995	agent0	initial_cond	0	-0.000000
exp12953	1.61347764e-17	0.018848	-0.000000	discard	Round 9: Complete bifurcation K=0.08	agent1	branch_search	0	-0.000004
exp12954	1.54984578e-28	0.000000	0.000000	discard	cycle 97 u=0.0995	agent0	initial_cond	0	-0.000000
exp12954	9.38346552e-18	0.021201	-0.000000	discard	Round 9: Complete bifurcation K=0.09	agent1	branch_search	0	-0.000005
exp12955	1.60328418e-29	0.000000	-0.000000	discard	cycle 97 u=0.0995	agent0	initial_cond	1	-0.000000
exp12955	1.40197541e-15	0.023554	-0.000000	discard	Round 9: Complete bifurcation K=0.10	agent1	branch_search	1	-0.000005
exp12956	1.60328418e-29	0.000000	-0.000000	discard	cycle 97 u=0.0995	agent0	initial_cond	0	-0.000000
exp12956	7.04401156e-15	0.035300	-0.000000	discard	Round 9: Complete bifurcation K=0.15	agent1	branch_search	0	-0.000006
exp12957	1.60328418e-29	0.000000	-0.000000	discard	cycle 97 u=0.0995	agent0	initial_cond	0	-0.000000
exp12957	3.14649469e-17	0.047011	-0.000000	discard	Round 9: Complete bifurcation K=0.20	agent1	branch_search	0	0.000003
exp12958	7.34590618e-29	0.000000	0.000000	discard	cycle 97 u=0.0995	agent0	initial_cond	0	0.000000
exp12958	6.91159813e-18	0.070278	-0.000000	discard	Round 9: Complete bifurcation K=0.30	agent1	branch_search	0	0.000097
exp12959	7.34590618e-29	0.000000	0.000000	discard	cycle 97 u=0.0995	agent0	initial_cond	0	0.000000
exp12959	3.10977055e-16	0.093272	0.000000	discard	Round 9: Complete bifurcation K=0.40	agent1	branch_search	0	0.000394
exp12960	7.34590618e-29	0.000000	0.000000	discard	cycle 97 u=0.0995	agent0	initial_cond	1	0.000000
exp12960	2.63855766e-17	0.115920	-0.000000	discard	Round 9: Complete bifurcation K=0.50	agent1	branch_search	1	0.001044
exp12961	4.46546993e-29	0.000000	0.000000	discard	cycle 97 u=0.1000	agent0	initial_cond	0	-0.000000
exp12961	4.02461359e-17	0.170672	-0.000000	discard	Round 9: Complete bifurcation K=0.75	agent1	branch_search	0	0.005386
exp12962	4.46546993e-29	0.000000	0.000000	discard	cycle 97 u=0.1000	agent0	initial_cond	0	-0.000000
exp12962	1.77784626e-16	0.222365	0.000000	discard	Round 9: Complete bifurcation K=1.00	agent1	branch_search	1	0.015962
exp12963	4.46546993e-29	0.000000	0.000000	discard	cycle 97 u=0.1000	agent0	initial_cond	0	-0.000000
exp12963	8.11360092e-17	0.316271	-0.000000	discard	Round 9: Complete bifurcation K=1.50	agent1	branch_search	0	0.066008
exp12964	4.08106752e-29	0.000000	0.000000	discard	cycle 97 u=0.1000	agent0	initial_cond	0	-0.000000
exp12965	4.08106752e-29	0.000000	0.000000	discard	cycle 97 u=0.1000	agent0	initial_cond	1	-0.000000
exp12966	4.08106752e-29	0.000000	0.000000	discard	cycle 97 u=0.1000	agent0	initial_cond	0	-0.000000
exp12967	4.58623706e-29	0.000000	0.000000	discard	cycle 97 u=0.1000	agent0	initial_cond	1	-0.000000
exp12968	4.58623706e-29	0.000000	0.000000	discard	cycle 97 u=0.1000	agent0	initial_cond	0	-0.000000
exp12969	4.58623706e-29	0.000000	0.000000	discard	cycle 97 u=0.1000	agent0	initial_cond	0	-0.000000
exp12970	4.39794337e-29	0.000000	0.000000	discard	cycle 97 u=0.1000	agent0	initial_cond	1	-0.000000
exp12971	4.39794337e-29	0.000000	0.000000	discard	cycle 97 u=0.1000	agent0	initial_cond	0	-0.000000
exp12972	4.39794337e-29	0.000000	0.000000	discard	cycle 97 u=0.1000	agent0	initial_cond	1	-0.000000
exp12973	1.36727475e-28	0.000000	0.000000	discard	cycle 97 u=0.1050	agent0	initial_cond	0	-0.000000
exp12974	1.36727475e-28	0.000000	0.000000	discard	cycle 97 u=0.1050	agent0	initial_cond	0	-0.000000
exp12975	1.36727475e-28	0.000000	0.000000	discard	cycle 97 u=0.1050	agent0	initial_cond	0	-0.000000
exp12976	6.14461376e-29	0.000000	0.000000	discard	cycle 97 u=0.1050	agent0	initial_cond	0	-0.000000
exp12977	6.14461376e-29	0.000000	0.000000	discard	cycle 97 u=0.1050	agent0	initial_cond	1	-0.000000
exp12978	6.14461376e-29	0.000000	0.000000	discard	cycle 97 u=0.1050	agent0	initial_cond	0	-0.000000
exp12979	1.75906666e-28	0.000000	0.000000	discard	cycle 97 u=0.1050	agent0	initial_cond	0	-0.000000
exp12980	1.75906666e-28	0.000000	0.000000	discard	cycle 97 u=0.1050	agent0	initial_cond	0	-0.000000
exp12981	1.75906666e-28	0.000000	0.000000	discard	cycle 97 u=0.1050	agent0	initial_cond	0	-0.000000
exp12982	1.11257917e-28	0.000000	0.000000	discard	cycle 97 u=0.1050	agent0	initial_cond	1	-0.000000
exp12983	1.74886520e-18	0.003535	-0.000000	discard	Round 9: Fine K around 0.02 (K=0.015)	agent1	branch_search	1	-0.000000
exp12984	1.11257917e-28	0.000000	0.000000	discard	cycle 97 u=0.1050	agent0	initial_cond	0	-0.000000
exp12985	4.39929945e-15	0.003771	-0.000000	discard	Round 9: Fine K around 0.02 (K=0.016)	agent1	branch_search	0	-0.000000
exp12986	1.11257917e-28	0.000000	0.000000	discard	cycle 97 u=0.1050	agent0	initial_cond	0	-0.000000
exp12987	8.29870503e-16	0.004007	-0.000000	discard	Round 9: Fine K around 0.02 (K=0.017)	agent1	branch_search	1	-0.000000
exp12988	8.58580947e-29	0.000000	0.000000	discard	cycle 98 u=0.0975	agent0	initial_cond	0	0.000000
exp12989	1.43973211e-16	0.004243	-0.000000	discard	Round 9: Fine K around 0.02 (K=0.018)	agent1	branch_search	0	-0.000000
exp12990	8.58580947e-29	0.000000	0.000000	discard	cycle 98 u=0.0975	agent0	initial_cond	0	0.000000
exp12991	2.33634735e-17	0.004478	-0.000000	discard	Round 9: Fine K around 0.02 (K=0.019)	agent1	branch_search	0	-0.000000
exp12992	8.58580947e-29	0.000000	0.000000	discard	cycle 98 u=0.0975	agent0	initial_cond	1	0.000000
exp12993	3.65164686e-18	0.004714	-0.000000	discard	Round 9: Fine K around 0.02 (K=0.020)	agent1	branch_search	0	-0.000000
exp12994	5.23962023e-29	0.000000	0.000000	discard	cycle 98 u=0.0975	agent0	initial_cond	0	0.000000
exp12995	1.74559942e-18	0.004950	-0.000000	discard	Round 9: Fine K around 0.02 (K=0.021)	agent1	branch_search	0	-0.000000
exp12996	5.23962023e-29	0.000000	0.000000	discard	cycle 98 u=0.0975	agent0	initial_cond	1	0.000000
exp12997	1.95110970e-18	0.005185	-0.000000	discard	Round 9: Fine K around 0.02 (K=0.022)	agent1	branch_search	1	-0.000000
exp12998	5.23962023e-29	0.000000	0.000000	discard	cycle 98 u=0.0975	agent0	initial_cond	0	0.000000
exp12999	1.02571623e-18	0.005421	-0.000000	discard	Round 9: Fine K around 0.02 (K=0.023)	agent1	branch_search	0	-0.000000
exp13000	4.03266298e-29	0.000000	0.000000	discard	cycle 98 u=0.0975	agent0	initial_cond	0	0.000000
exp13001	1.03694843e-18	0.005657	-0.000000	discard	Round 9: Fine K around 0.02 (K=0.024)	agent1	branch_search	0	-0.000000
exp13002	4.03266298e-29	0.000000	0.000000	discard	cycle 98 u=0.0975	agent0	initial_cond	1	0.000000
exp13003	5.22709784e-15	0.005892	-0.000000	discard	Round 9: Fine K around 0.02 (K=0.025)	agent1	branch_search	0	-0.000000
exp13004	4.03266298e-29	0.000000	0.000000	discard	cycle 98 u=0.0975	agent0	initial_cond	0	0.000000
exp13005	4.80015937e-29	0.000000	0.000000	discard	cycle 98 u=0.0975	agent0	initial_cond	1	0.000000
exp13006	4.80015937e-29	0.000000	0.000000	discard	cycle 98 u=0.0975	agent0	initial_cond	0	0.000000
exp13007	4.80015937e-29	0.000000	0.000000	discard	cycle 98 u=0.0975	agent0	initial_cond	0	0.000000
exp13008	2.68824537e-29	0.000000	0.000000	discard	cycle 98 u=0.0980	agent0	initial_cond	0	-0.000000
exp13009	2.68824537e-29	0.000000	0.000000	discard	cycle 98 u=0.0980	agent0	initial_cond	0	-0.000000
exp13010	2.68824537e-29	0.000000	0.000000	discard	cycle 98 u=0.0980	agent0	initial_cond	1	-0.000000
exp13011	6.16758073e-29	0.000000	0.000000	discard	cycle 98 u=0.0980	agent0	initial_cond	0	-0.000000
exp13012	6.16758073e-29	0.000000	0.000000	discard	cycle 98 u=0.0980	agent0	initial_cond	0	-0.000000
exp13013	6.16758073e-29	0.000000	0.000000	discard	cycle 98 u=0.0980	agent0	initial_cond	0	-0.000000
exp13014	2.01926478e-29	0.000000	0.000000	discard	cycle 98 u=0.0980	agent0	initial_cond	0	0.000000
exp13015	2.01926478e-29	0.000000	0.000000	discard	cycle 98 u=0.0980	agent0	initial_cond	1	0.000000
exp13016	2.01926478e-29	0.000000	0.000000	discard	cycle 98 u=0.0980	agent0	initial_cond	0	0.000000
exp13017	1.30310780e-28	0.000000	0.000000	discard	cycle 98 u=0.0980	agent0	initial_cond	0	-0.000000
exp13018	1.30310780e-28	0.000000	0.000000	discard	cycle 98 u=0.0980	agent0	initial_cond	0	-0.000000
exp13019	1.72621154e-18	0.005303	-0.000000	discard	Round 9: Ultra-fine K=0.0225	agent1	branch_search	0	-0.000000
exp13019	1.30310780e-28	0.000000	0.000000	discard	cycle 98 u=0.0980	agent0	initial_cond	0	-0.000000
exp13020	1.02571623e-18	0.005421	-0.000000	discard	Round 9: Ultra-fine K=0.0230	agent1	branch_search	1	-0.000000
exp13020	5.45343271e-29	0.000000	0.000000	discard	cycle 98 u=0.0982	agent0	initial_cond	1	-0.000000
exp13021	2.33026091e-18	0.005445	-0.000000	discard	Round 9: Ultra-fine K=0.0231	agent1	branch_search	0	-0.000000
exp13021	5.45343271e-29	0.000000	0.000000	discard	cycle 98 u=0.0982	agent0	initial_cond	0	-0.000000
exp13022	6.49953037e-18	0.005468	-0.000000	discard	Round 9: Ultra-fine K=0.0232	agent1	branch_search	0	-0.000000
exp13022	5.45343271e-29	0.000000	0.000000	discard	cycle 98 u=0.0982	agent0	initial_cond	0	-0.000000
exp13023	1.80180839e-18	0.005492	-0.000000	discard	Round 9: Ultra-fine K=0.0233	agent1	branch_search	0	-0.000000
exp13023	1.23429977e-28	0.000000	0.000000	discard	cycle 98 u=0.0982	agent0	initial_cond	0	0.000000
exp13024	3.23389995e-18	0.005515	-0.000000	discard	Round 9: Ultra-fine K=0.0234	agent1	branch_search	0	-0.000000
exp13024	1.23429977e-28	0.000000	0.000000	discard	cycle 98 u=0.0982	agent0	initial_cond	0	0.000000
exp13025	4.28637216e-18	0.005539	-0.000000	discard	Round 9: Ultra-fine K=0.0235	agent1	branch_search	1	-0.000000
exp13025	1.23429977e-28	0.000000	0.000000	discard	cycle 98 u=0.0982	agent0	initial_cond	1	0.000000
exp13026	1.88036672e-29	0.000000	0.000000	discard	cycle 98 u=0.0982	agent0	initial_cond	0	0.000000
exp13026	1.03694843e-18	0.005657	-0.000000	discard	Round 9: Ultra-fine K=0.0240	agent1	branch_search	0	-0.000000
exp13027	1.88036672e-29	0.000000	0.000000	discard	cycle 98 u=0.0982	agent0	initial_cond	1	0.000000
exp13027	3.36865402e-18	0.005774	-0.000000	discard	Round 9: Ultra-fine K=0.0245	agent1	branch_search	1	-0.000000
exp13028	1.88036672e-29	0.000000	0.000000	discard	cycle 98 u=0.0982	agent0	initial_cond	0	0.000000
exp13028	5.22709784e-15	0.005892	-0.000000	discard	Round 9: Ultra-fine K=0.0250	agent1	branch_search	0	-0.000000
exp13029	1.91190259e-29	0.000000	-0.000000	discard	cycle 98 u=0.0982	agent0	initial_cond	0	0.000000
exp13030	1.91190259e-29	0.000000	-0.000000	discard	cycle 98 u=0.0982	agent0	initial_cond	1	0.000000
exp13031	1.91190259e-29	0.000000	-0.000000	discard	cycle 98 u=0.0982	agent0	initial_cond	0	0.000000
exp13032	6.13049994e-29	0.000000	0.000000	discard	cycle 98 u=0.0985	agent0	initial_cond	1	0.000000
exp13033	6.13049994e-29	0.000000	0.000000	discard	cycle 98 u=0.0985	agent0	initial_cond	0	0.000000
exp13034	6.13049994e-29	0.000000	0.000000	discard	cycle 98 u=0.0985	agent0	initial_cond	0	0.000000
exp13035	5.49750971e-29	0.000000	0.000000	discard	cycle 98 u=0.0985	agent0	initial_cond	1	0.000000
exp13036	5.49750971e-29	0.000000	0.000000	discard	cycle 98 u=0.0985	agent0	initial_cond	0	0.000000
exp13037	5.49750971e-29	0.000000	0.000000	discard	cycle 98 u=0.0985	agent0	initial_cond	1	0.000000
exp13038	4.15642452e-29	0.000000	0.000000	discard	cycle 98 u=0.0985	agent0	initial_cond	0	0.000000
exp13039	4.15642452e-29	0.000000	0.000000	discard	cycle 98 u=0.0985	agent0	initial_cond	0	0.000000
exp13040	4.15642452e-29	0.000000	0.000000	discard	cycle 98 u=0.0985	agent0	initial_cond	0	0.000000
exp13041	2.19292611e-29	0.000000	0.000000	discard	cycle 98 u=0.0985	agent0	initial_cond	0	-0.000000
exp13042	2.19292611e-29	0.000000	0.000000	discard	cycle 98 u=0.0985	agent0	initial_cond	1	-0.000000
exp13043	2.19292611e-29	0.000000	0.000000	discard	cycle 98 u=0.0985	agent0	initial_cond	0	-0.000000
exp13044	4.22491788e-29	0.000000	0.000000	discard	cycle 98 u=0.0990	agent0	initial_cond	0	-0.000000
exp13045	4.22491788e-29	0.000000	0.000000	discard	cycle 98 u=0.0990	agent0	initial_cond	0	-0.000000
exp13045	1.02571623e-18	0.005421	-0.000000	discard	Round 9: Verify new SOTA K=0.023	agent1	branch_search	0	-0.000000
exp13046	4.22491788e-29	0.000000	0.000000	discard	cycle 98 u=0.0990	agent0	initial_cond	0	-0.000000
exp13047	3.22245147e-29	0.000000	0.000000	discard	cycle 98 u=0.0990	agent0	initial_cond	1	0.000000
exp13048	3.22245147e-29	0.000000	0.000000	discard	cycle 98 u=0.0990	agent0	initial_cond	0	0.000000
exp13049	3.22245147e-29	0.000000	0.000000	discard	cycle 98 u=0.0990	agent0	initial_cond	0	0.000000
exp13050	4.50941488e-29	0.000000	-0.000000	discard	cycle 98 u=0.0990	agent0	initial_cond	0	0.000000
exp13051	4.50941488e-29	0.000000	-0.000000	discard	cycle 98 u=0.0990	agent0	initial_cond	0	0.000000
exp13052	4.50941488e-29	0.000000	-0.000000	discard	cycle 98 u=0.0990	agent0	initial_cond	1	0.000000
exp13053	4.88330883e-29	0.000000	-0.000000	discard	cycle 98 u=0.0990	agent0	initial_cond	0	0.000000
exp13054	4.88330883e-29	0.000000	-0.000000	discard	cycle 98 u=0.0990	agent0	initial_cond	0	0.000000
exp13055	4.88330883e-29	0.000000	-0.000000	discard	cycle 98 u=0.0990	agent0	initial_cond	0	0.000000
exp13056	5.74085541e-29	0.000000	-0.000000	discard	cycle 98 u=0.0995	agent0	initial_cond	0	0.000000
exp13057	5.74085541e-29	0.000000	-0.000000	discard	cycle 98 u=0.0995	agent0	initial_cond	1	0.000000
exp13058	5.74085541e-29	0.000000	-0.000000	discard	cycle 98 u=0.0995	agent0	initial_cond	0	0.000000
exp13059	1.54984578e-28	0.000000	0.000000	discard	cycle 98 u=0.0995	agent0	initial_cond	0	-0.000000
exp13060	1.54984578e-28	0.000000	0.000000	discard	cycle 98 u=0.0995	agent0	initial_cond	0	-0.000000
exp13061	1.54984578e-28	0.000000	0.000000	discard	cycle 98 u=0.0995	agent0	initial_cond	0	-0.000000
exp13062	1.60328418e-29	0.000000	-0.000000	discard	cycle 98 u=0.0995	agent0	initial_cond	1	-0.000000
exp13063	1.60328418e-29	0.000000	-0.000000	discard	cycle 98 u=0.0995	agent0	initial_cond	0	-0.000000
exp13064	1.60328418e-29	0.000000	-0.000000	discard	cycle 98 u=0.0995	agent0	initial_cond	1	-0.000000
exp13065	7.34590618e-29	0.000000	0.000000	discard	cycle 98 u=0.0995	agent0	initial_cond	0	0.000000
exp13066	7.34590618e-29	0.000000	0.000000	discard	cycle 98 u=0.0995	agent0	initial_cond	0	0.000000
exp13067	7.34590618e-29	0.000000	0.000000	discard	cycle 98 u=0.0995	agent0	initial_cond	1	0.000000
exp13068	4.46546993e-29	0.000000	0.000000	discard	cycle 98 u=0.1000	agent0	initial_cond	0	-0.000000
exp13069	4.46546993e-29	0.000000	0.000000	discard	cycle 98 u=0.1000	agent0	initial_cond	1	-0.000000
exp13070	4.46546993e-29	0.000000	0.000000	discard	cycle 98 u=0.1000	agent0	initial_cond	0	-0.000000
exp13071	4.08106752e-29	0.000000	0.000000	discard	cycle 98 u=0.1000	agent0	initial_cond	0	-0.000000
exp13072	4.08106752e-29	0.000000	0.000000	discard	cycle 98 u=0.1000	agent0	initial_cond	1	-0.000000
exp13073	4.08106752e-29	0.000000	0.000000	discard	cycle 98 u=0.1000	agent0	initial_cond	0	-0.000000
exp13074	4.58623706e-29	0.000000	0.000000	discard	cycle 98 u=0.1000	agent0	initial_cond	1	-0.000000
exp13075	4.58623706e-29	0.000000	0.000000	discard	cycle 98 u=0.1000	agent0	initial_cond	0	-0.000000
exp13076	4.58623706e-29	0.000000	0.000000	discard	cycle 98 u=0.1000	agent0	initial_cond	0	-0.000000
exp13077	4.39794337e-29	0.000000	0.000000	discard	cycle 98 u=0.1000	agent0	initial_cond	0	-0.000000
exp13078	4.39794337e-29	0.000000	0.000000	discard	cycle 98 u=0.1000	agent0	initial_cond	0	-0.000000
exp13079	4.39794337e-29	0.000000	0.000000	discard	cycle 98 u=0.1000	agent0	initial_cond	1	-0.000000
exp13080	1.36727475e-28	0.000000	0.000000	discard	cycle 98 u=0.1050	agent0	initial_cond	0	-0.000000
exp13081	1.36727475e-28	0.000000	0.000000	discard	cycle 98 u=0.1050	agent0	initial_cond	0	-0.000000
exp13082	1.36727475e-28	0.000000	0.000000	discard	cycle 98 u=0.1050	agent0	initial_cond	0	-0.000000
exp13083	6.14461376e-29	0.000000	0.000000	discard	cycle 98 u=0.1050	agent0	initial_cond	0	-0.000000
exp13084	6.14461376e-29	0.000000	0.000000	discard	cycle 98 u=0.1050	agent0	initial_cond	1	-0.000000
exp13085	6.14461376e-29	0.000000	0.000000	discard	cycle 98 u=0.1050	agent0	initial_cond	0	-0.000000
exp13086	1.75906666e-28	0.000000	0.000000	discard	cycle 98 u=0.1050	agent0	initial_cond	0	-0.000000
exp13087	1.75906666e-28	0.000000	0.000000	discard	cycle 98 u=0.1050	agent0	initial_cond	0	-0.000000
exp13088	1.75906666e-28	0.000000	0.000000	discard	cycle 98 u=0.1050	agent0	initial_cond	0	-0.000000
exp13089	1.11257917e-28	0.000000	0.000000	discard	cycle 98 u=0.1050	agent0	initial_cond	1	-0.000000
exp13090	1.11257917e-28	0.000000	0.000000	discard	cycle 98 u=0.1050	agent0	initial_cond	0	-0.000000
exp13091	1.11257917e-28	0.000000	0.000000	discard	cycle 98 u=0.1050	agent0	initial_cond	1	-0.000000
exp13092	8.58580947e-29	0.000000	0.000000	discard	cycle 99 u=0.0975	agent0	initial_cond	0	0.000000
exp13093	8.58580947e-29	0.000000	0.000000	discard	cycle 99 u=0.0975	agent0	initial_cond	0	0.000000
exp13094	8.58580947e-29	0.000000	0.000000	discard	cycle 99 u=0.0975	agent0	initial_cond	1	0.000000
exp13095	5.23962023e-29	0.000000	0.000000	discard	cycle 99 u=0.0975	agent0	initial_cond	0	0.000000
exp13096	5.23962023e-29	0.000000	0.000000	discard	cycle 99 u=0.0975	agent0	initial_cond	1	0.000000
exp13097	5.23962023e-29	0.000000	0.000000	discard	cycle 99 u=0.0975	agent0	initial_cond	0	0.000000
exp13098	4.03266298e-29	0.000000	0.000000	discard	cycle 99 u=0.0975	agent0	initial_cond	0	0.000000
