exp_id	residual	solution_norm	solution_mean	status	description	agent	design	elapsed_s	solution_energy
exp001	5.63598005e-11	0.000000	-0.000000	keep	trivial branch u_offset=0.0 scipy baseline	agent1	initial_cond	0	-0.000000
exp002	5.63598005e-11	0.000000	-0.000000	discard	trivial branch u_offset=0.0 baseline	agent0	initial_cond	0	-0.000000
exp003	2.41595655e-09	1.002503	1.000218	discard	positive branch u_offset=1.0 amp=0.1 nodes=100 tol=1e-8	agent0	branch_search	1	-1.523848
exp004	5.63598005e-11	0.000000	-0.000000	discard	positive branch u_offset=0.9	manual	initial_cond	0	-0.000000
exp005	8.81934684e-11	1.002503	1.000218	discard	positive branch u_offset=0.9	agent0	initial_cond	0	-1.523848
exp006	8.81934684e-11	1.002503	1.000218	discard	positive branch u_offset=1.0 amp=0.1 nodes=200 tol=1e-10	agent0	solver_param	0	-1.523848
exp007	8.81934684e-11	1.002503	1.000218	discard	negative branch u_offset=-0.9	agent0	initial_cond	0	-1.523848
exp008	5.72745888e-09	1.002503	1.000218	discard	positive branch u_offset=0.9 scipy	agent1	branch_search	0	-1.523848
exp009	5.62802405e-12	1.002503	1.000218	keep	negative branch u_offset=-0.9	agent0	initial_cond	0	-1.523848
exp010	5.62802405e-12	1.002503	1.000218	discard	positive branch nodes=250 tol=1e-11	agent0	solver_param	1	-1.523848
exp011	5.72745881e-09	1.002503	-1.000218	discard	strong negative u_offset=-1.2	agent0	initial_cond	0	-1.523848
exp012	2.41595655e-09	1.002503	-1.000218	discard	negative branch u_offset=-0.9 scipy	agent1	branch_search	1	-1.523848
exp013	5.62802405e-12	1.002503	-1.000218	discard	negative branch u_offset=-1.0 nodes=250 tol=1e-11	agent0	branch_search	0	-1.523848
exp014	5.72745859e-09	1.002503	-1.000218	discard	negative branch u_offset=-1.0	agent0	initial_cond	0	-1.523848
exp015	2.41595655e-09	1.002503	-1.000218	discard	negative branch u_offset=-0.95	agent0	initial_cond	1	-1.523848
exp016	5.72745878e-09	1.002503	-1.000218	discard	negative branch u_offset=-1.1	agent0	initial_cond	0	-1.523848
exp017	crash	0	0	crash	positive branch nodes=250 tol=1e-12	agent0	solver_param	1	0
exp018	7.08851550e-10	1.002503	-1.000218	discard	negative branch tight tol=1.0e-9	agent0	initial_cond	0	-1.523848
exp019	5.63598005e-11	0.000000	-0.000000	discard	positive branch u_offset=0.9 scipy n=300 tol=1e-11 amp=0	manual	initial_cond	0	-0.000000
exp020	2.62635931e-11	1.002503	-1.000218	discard	negative branch tight tol=1.0e-10	agent0	initial_cond	0	-1.523848
exp021	9.99977750e-12	1.002503	-1.000218	discard	negative branch ultra-tight	agent0	initial_cond	1	-1.523848
exp022	crash	0	0	crash	positive branch nodes=200 tol=1e-12	agent0	solver_param	0	0
exp023	2.41595655e-09	1.002503	-1.000218	discard	positive branch u_offset=0.9 scipy n=300 tol=1e-11 amp=0	agent1	initial_cond	0	-1.523848
exp024	7.05432259e-10	1.002503	1.000218	discard	positive branch tol=1.0e-9	agent0	initial_cond	0	-1.523848
exp025	8.81934684e-11	1.002503	1.000218	discard	positive branch tol=1.0e-10	agent0	initial_cond	0	-1.523848
exp026	9.99977750e-12	1.002503	1.000218	discard	positive branch tol=1.0e-11	agent0	initial_cond	1	-1.523848
exp027	5.62802405e-12	1.002503	1.000218	discard	positive branch u_offset=1.05 amp=0.05 nodes=250 tol=1e-11	agent0	perturbation	1	-1.523848
exp028	0.00000000e+00	0.000000	0.000000	keep	Fourier spectral trivial branch 64 modes	agent1	solver_param	1	0.000000
exp029	0.00000000e+00	0.000000	0.000000	discard	trivial branch nodes=50 tol=1e-12	agent0	solver_param	0	0.000000
exp030	crash	0	0	crash	positive branch u_offset=1.0 scipy n=300 tol=1e-11 amp=0	agent1	initial_cond	0	0
exp031	2.62635931e-11	1.002503	1.000218	discard	positive u=0.85	agent0	initial_cond	0	-1.523848
exp032	2.62635931e-11	1.002503	1.000218	discard	positive u=0.88	agent0	initial_cond	0	-1.523848
exp033	2.62635931e-11	1.002503	1.000218	discard	positive u=0.92	agent0	initial_cond	1	-1.523848
exp034	2.62635931e-11	1.002503	1.000218	discard	positive u=0.95	agent0	initial_cond	0	-1.523848
exp035	crash	0	0	crash	Fourier spectral positive branch u_offset=0.9 64 modes	agent1	branch_search	0	0
exp036	2.62635931e-11	1.002503	1.000218	discard	positive u=0.98	agent0	initial_cond	1	-1.523848
exp037	crash	0	0	crash	positive branch u_offset=0.95 scipy n=300 tol=1e-11 amp=0	agent1	initial_cond	1	0
exp038	2.62635931e-11	1.002503	-1.000218	discard	negative u=-0.85	agent0	initial_cond	1	-1.523848
exp039	2.62635931e-11	1.002503	-1.000218	discard	negative u=-0.90	agent0	initial_cond	0	-1.523848
exp040	2.62635931e-11	1.002503	-1.000218	discard	negative u=-0.95	agent0	initial_cond	1	-1.523848
exp041	2.62635931e-11	1.002503	-1.000218	discard	negative u=-1.0	agent0	initial_cond	0	-1.523848
exp042	2.62635931e-11	1.002503	-1.000218	discard	negative u=-1.05	agent0	initial_cond	0	-1.523848
exp043	crash	0	0	crash	positive ultra-tight tol=1.0e-12	agent0	initial_cond	0	0
exp044	crash	0	0	crash	positive ultra-tight tol=1.0e-13	agent0	initial_cond	1	0
exp045	crash	0	0	crash	positive ultra-tight tol=1.0e-14	agent0	initial_cond	0	0
exp046	crash	0	0	crash	Fourier positive u_offset=1.0 amp=0.05 64modes	agent1	branch_search	0	0
exp047	8.95295950e-11	1.002503	1.000218	discard	positive nodes=100	agent0	initial_cond	0	-1.523848
exp048	2.62635931e-11	1.002503	1.000218	discard	positive nodes=150	agent0	initial_cond	0	-1.523848
exp049	8.81934684e-11	1.002503	1.000218	discard	positive nodes=200	agent0	initial_cond	1	-1.523848
exp050	4.50208716e-11	1.002503	1.000218	discard	positive nodes=250	agent0	initial_cond	0	-1.523848
exp051	2.60019365e-11	1.002503	1.000218	discard	positive nodes=300	agent0	initial_cond	0	-1.523848
exp052	crash	0	0	crash	positive branch u_offset=0.98 scipy n=300 tol=1e-10 amp=0	agent1	initial_cond	0	0
exp053	2.62635931e-11	1.002503	1.000218	discard	positive mode=1 amp=0.05	agent0	initial_cond	0	-1.523848
exp054	2.62635931e-11	1.002503	1.000218	discard	positive mode=1 amp=0.1	agent0	initial_cond	1	-1.523848
exp055	5.62802405e-12	1.002503	1.000218	discard	positive mode=1 amp=0.2	agent0	initial_cond	0	-1.523848
exp056	2.62635931e-11	1.002503	1.000218	discard	positive branch mode=2 amp=0.2 nodes=250 tol=1e-11	agent0	perturbation	0	-1.523848
exp057	2.62635931e-11	1.002503	1.000218	discard	positive mode=2 amp=0.05	agent0	initial_cond	0	-1.523848
exp058	2.62635931e-11	1.002503	1.000218	discard	positive mode=2 amp=0.1	agent0	initial_cond	1	-1.523848
exp059	2.62635931e-11	1.002503	1.000218	discard	positive mode=2 amp=0.2	agent0	initial_cond	0	-1.523848
exp060	2.62635931e-11	1.002503	1.000218	discard	positive mode=3 amp=0.05	agent0	initial_cond	0	-1.523848
exp061	2.62635931e-11	1.002503	1.000218	discard	positive mode=3 amp=0.1	agent0	initial_cond	0	-1.523848
exp062	2.62635931e-11	1.002503	1.000218	discard	positive mode=3 amp=0.2	agent0	initial_cond	0	-1.523848
exp063	5.62802405e-12	1.002503	1.000218	discard	positive branch phase=pi/2 amp=0.3 nodes=250 tol=1e-11	agent0	perturbation	0	-1.523848
exp064	2.62635931e-11	1.002503	1.000218	discard	positive mode=1 amp=0.15	agent0	initial_cond	0	-1.523848
exp065	2.62635931e-11	1.002503	1.000218	discard	positive mode=1 amp=0.20	agent0	initial_cond	0	-1.523848
exp066	2.62635931e-11	1.002503	1.000218	discard	positive mode=1 amp=0.25	agent0	initial_cond	1	-1.523848
exp067	2.62635931e-11	1.002503	1.000218	discard	positive mode=2 amp=0.15	agent0	initial_cond	0	-1.523848
exp068	crash	0	0	crash	positive branch u_offset=0.98 scipy n=300 tol=1e-8 amp=0	agent1	initial_cond	0	0
exp069	2.62635931e-11	1.002503	1.000218	discard	positive mode=2 amp=0.20	agent0	initial_cond	1	-1.523848
exp070	2.62635931e-11	1.002503	1.000218	discard	positive mode=2 amp=0.25	agent0	initial_cond	0	-1.523848
exp071	crash	0	0	crash	scipy positive branch n_nodes=300 tol=1e-12	agent1	solver_param	0	0
exp072	5.02615202e-22	0.000000	-0.000000	discard	super-convergence zone u_offset=0.460 nodes=250 tol=1e-11	agent0	branch_search	0	0.000000
exp073	4.62029040e-17	0.000000	0.000000	discard	super-convergence u_offset=0.450 nodes=250 tol=1e-11	agent0	branch_search	0	-0.000000
exp074	1.24233898e-15	0.000000	0.000000	discard	super-convergence u_offset=0.455 nodes=250 tol=1e-11	agent0	branch_search	0	-0.000000
exp075	6.84224145e-15	0.000000	0.000000	discard	super-convergence u_offset=0.460 nodes=250 tol=1e-11	agent0	branch_search	1	-0.000000
exp076	6.84224145e-15	0.000000	0.000000	discard	super-convergence zone u=0.40	agent0	initial_cond	1	-0.000000
exp077	3.00919398e-15	0.000000	-0.000000	discard	super-convergence u_offset=0.465 nodes=250 tol=1e-11	agent0	branch_search	0	-0.000000
exp078	3.00919398e-15	0.000000	-0.000000	discard	super-convergence zone u=0.45	agent0	initial_cond	0	-0.000000
exp079	5.08021333e-15	0.000000	-0.000000	discard	super-convergence u_offset=0.470 nodes=250 tol=1e-11	agent0	branch_search	0	-0.000000
exp080	5.08021333e-15	0.000000	-0.000000	discard	super-convergence zone u=0.46	agent0	initial_cond	0	-0.000000
exp081	5.08021333e-15	0.000000	-0.000000	discard	super-convergence u_offset=-0.460 nodes=250 tol=1e-11	agent0	branch_search	1	-0.000000
exp082	5.08021333e-15	0.000000	-0.000000	discard	super-convergence zone u=0.460	agent0	initial_cond	0	-0.000000
exp083	2.29751179e-15	0.000000	-0.000000	discard	super-convergence zone u=0.465	agent0	initial_cond	0	-0.000000
exp084	3.59698226e-13	0.000000	-0.000000	discard	super-convergence zone u=0.47	agent0	initial_cond	1	-0.000000
exp085	6.31837332e-14	0.000000	-0.000000	discard	super-convergence zone u=0.50	agent0	initial_cond	0	-0.000000
exp086	2.60019365e-11	1.002503	1.000218	discard	scipy positive n_nodes=300 tol=1e-10	agent1	solver_param	1	-1.523848
exp087	2.60019365e-11	1.002503	1.000218	discard	positive branch replica u_offset=1.0 amp=0.3 phase=Ď€/2 n=250 tol=1e-11	agent1	initial_cond	1	-1.523848
exp088	5.08021333e-15	0.000000	-0.000000	discard	super-convergence u=0.460	agent0	initial_cond	0	-0.000000
exp089	2.97782233e-14	0.000000	-0.000000	discard	super-convergence u=0.462	agent0	initial_cond	0	-0.000000
exp090	1.71031031e-13	0.000000	-0.000000	discard	super-convergence u=0.464	agent0	initial_cond	1	-0.000000
exp091	2.29751179e-15	0.000000	-0.000000	discard	super-convergence u=0.465	agent0	initial_cond	0	-0.000000
exp092	6.50971561e-15	0.000000	-0.000000	discard	super-convergence u=0.466	agent0	initial_cond	0	-0.000000
exp093	5.00478702e-14	0.000000	-0.000000	discard	super-convergence u=0.468	agent0	initial_cond	1	-0.000000
exp094	3.59698226e-13	0.000000	-0.000000	discard	super-convergence u=0.470	agent0	initial_cond	0	-0.000000
exp095	9.56650805e-16	0.000000	0.000000	discard	fine sweep u_offset=0.462 nodes=250 tol=1e-11	agent0	branch_search	0	-0.000000
exp096	8.58922841e-11	1.002503	-1.000218	discard	scipy negative n_nodes=300 tol=1e-10	agent1	solver_param	0	-1.523848
exp097	2.19641992e-17	0.000000	0.000000	discard	fine sweep u_offset=0.463 nodes=250 tol=1e-11	agent0	branch_search	0	-0.000000
exp098	2.57350425e-17	0.000000	0.000000	discard	fine sweep u_offset=0.464 nodes=250 tol=1e-11	agent0	branch_search	1	-0.000000
exp099	3.64904017e-13	0.000000	-0.000000	discard	fine sweep u_offset=0.465 nodes=250 tol=1e-11	agent0	branch_search	0	-0.000000
exp100	4.22821758e-17	0.000000	0.000000	discard	super-convergence neg u=-0.40	agent0	initial_cond	0	-0.000000
exp101	8.90773688e-16	0.000000	-0.000000	discard	fine sweep u_offset=0.466 nodes=250 tol=1e-11	agent0	branch_search	1	-0.000000
exp102	5.85450881e-17	0.000000	0.000000	discard	super-convergence neg u=-0.45	agent0	initial_cond	1	-0.000000
exp103	4.93214377e-14	0.000000	-0.000000	discard	fine sweep u_offset=0.467 nodes=250 tol=1e-11	agent0	branch_search	0	-0.000000
exp104	8.48660090e-17	0.000000	0.000000	discard	super-convergence neg u=-0.460	agent0	initial_cond	0	-0.000000
exp105	3.30734925e-17	0.000000	-0.000000	discard	fine sweep u_offset=0.468 nodes=250 tol=1e-11	agent0	branch_search	0	-0.000000
exp106	3.30734925e-17	0.000000	-0.000000	discard	super-convergence neg u=-0.465	agent0	initial_cond	0	-0.000000
exp107	5.08869344e-21	0.000000	-0.000000	discard	super-convergence neg u=-0.47	agent0	initial_cond	1	0.000000
exp108	1.60426613e-13	0.000000	-0.000000	discard	super-convergence neg u=-0.50	agent0	initial_cond	0	-0.000000
exp109	5.79834068e-20	0.000000	-0.000000	discard	negative super u=-0.468	agent0	initial_cond	0	-0.000000
exp110	1.42038445e-20	0.000000	-0.000000	discard	negative super u=-0.469	agent0	initial_cond	1	-0.000000
exp111	1.24011737e-15	0.000000	0.000000	discard	negative super u=-0.4695	agent0	initial_cond	0	-0.000000
exp112	5.08869344e-21	0.000000	-0.000000	discard	ultra-fine sweep u_offset=0.4625 nodes=250 tol=1e-11	agent0	branch_search	0	0.000000
exp113	2.19641992e-17	0.000000	0.000000	discard	negative super u=-0.470	agent0	initial_cond	0	-0.000000
exp114	3.03116864e-21	0.000000	-0.000000	discard	ultra-fine sweep u_offset=0.4630 nodes=250 tol=1e-11	agent0	branch_search	1	0.000000
exp115	2.34564342e-17	0.000000	0.000000	discard	negative super u=-0.4705	agent0	initial_cond	0	-0.000000
exp116	1.81676596e-21	0.000000	-0.000000	discard	ultra-fine sweep u_offset=0.4635 nodes=250 tol=1e-11	agent0	branch_search	0	-0.000000
exp117	2.57350425e-17	0.000000	0.000000	discard	negative super u=-0.471	agent0	initial_cond	0	-0.000000
exp118	4.52061151e-22	0.000000	-0.000000	discard	ultra-fine sweep u_offset=0.4640 nodes=250 tol=1e-11	agent0	branch_search	0	0.000000
exp119	7.09043403e-16	0.000000	0.000000	discard	negative super u=-0.472	agent0	initial_cond	1	-0.000000
exp120	7.09043403e-16	0.000000	0.000000	discard	ultra-fine sweep u_offset=0.4628 nodes=250 tol=1e-11	agent0	branch_search	0	-0.000000
exp121	2.16073194e-17	0.000000	0.000000	discard	ultra-fine sweep u_offset=0.4632 nodes=250 tol=1e-11	agent0	branch_search	0	-0.000000
exp122	5.49126601e-20	0.000000	-0.000000	discard	negative u=-0.4688	agent0	initial_cond	1	-0.000000
exp123	2.11200356e-20	0.000000	-0.000000	discard	negative u=-0.4689	agent0	initial_cond	0	-0.000000
exp124	2.27358147e-20	0.000000	-0.000000	discard	negative u=-0.46895	agent0	initial_cond	0	-0.000000
exp125	1.42038445e-20	0.000000	-0.000000	discard	negative u=-0.4690	agent0	initial_cond	1	-0.000000
exp126	crash	0	0	crash	Fourier 128modes positive u_offset=1.0 amp=0.15 maxit=100	agent1	branch_search	1	0
exp127	4.66322745e-21	0.000000	-0.000000	discard	negative u=-0.46905	agent0	initial_cond	0	-0.000000
exp128	4.00976976e-21	0.000000	-0.000000	discard	negative u=-0.4691	agent0	initial_cond	0	-0.000000
exp129	1.09974189e-20	0.000000	-0.000000	discard	negative u=-0.4692	agent0	initial_cond	1	-0.000000
exp130	crash	0	0	crash	negative branch replica u_offset=-1.0 amp=0.3 phase=Ď€ n=250 tol=1e-11	agent1	initial_cond	0	0
exp131	2.57350425e-17	0.000000	0.000000	discard	zoom sweep u_offset=0.4640	agent0	branch_search	0	-0.000000
exp132	2.58513961e-17	0.000000	0.000000	discard	zoom sweep u_offset=0.4641	agent0	branch_search	0	-0.000000
exp133	2.63413260e-17	0.000000	0.000000	discard	zoom sweep u_offset=0.4642	agent0	branch_search	0	-0.000000
exp134	2.69226738e-17	0.000000	0.000000	discard	zoom sweep u_offset=0.4643	agent0	branch_search	1	-0.000000
exp135	2.75896800e-17	0.000000	0.000000	discard	zoom sweep u_offset=0.4644	agent0	branch_search	0	-0.000000
exp136	2.83883076e-17	0.000000	0.000000	discard	zoom sweep u_offset=0.4645	agent0	branch_search	0	-0.000000
exp137	7.00819828e-21	0.000000	-0.000000	discard	zoom sweep u_offset=0.4646	agent0	branch_search	1	-0.000000
exp138	7.00819828e-21	0.000000	-0.000000	discard	negative u=-0.4691 tol=1.0e-12	agent0	initial_cond	1	-0.000000
exp139	2.78965180e-20	0.000000	-0.000000	discard	zoom sweep u_offset=0.4648	agent0	branch_search	0	-0.000000
exp140	2.78965180e-20	0.000000	-0.000000	discard	negative u=-0.4691 tol=1.0e-13	agent0	initial_cond	0	-0.000000
exp141	3.21090638e-17	0.000000	0.000000	discard	zoom sweep u_offset=0.4650	agent0	branch_search	0	-0.000000
exp142	crash	0	0	crash	negative branch replica u_offset=-1.0 amp=0.3 phase=Ď€/2 n=250 tol=1e-11	agent1	initial_cond	1	0
exp143	6.04197920e-21	0.000000	-0.000000	discard	negative nodes=200	agent0	initial_cond	1	-0.000000
exp144	4.00976976e-21	0.000000	-0.000000	discard	negative nodes=250	agent0	initial_cond	0	-0.000000
exp145	3.97276561e-20	0.000000	-0.000000	discard	negative nodes=300	agent0	initial_cond	0	-0.000000
exp146	1.38755655e-20	0.000000	-0.000000	discard	negative nodes=350	agent0	initial_cond	1	-0.000000
exp147	5.08021333e-15	0.000000	-0.000000	discard	positive super u=0.460	agent0	initial_cond	1	-0.000000
exp148	5.08021333e-15	0.000000	-0.000000	discard	positive super u=0.460	agent0	initial_cond	0	-0.000000
exp149	2.29751179e-15	0.000000	-0.000000	discard	positive super u=0.465	agent0	initial_cond	0	-0.000000
exp150	2.29751179e-15	0.000000	-0.000000	discard	positive super u=0.465	agent0	initial_cond	1	-0.000000
exp151	1.45781502e-12	1.001296	1.000019	discard	Fourier 128modes positive newton_tol=1e-10	agent1	branch_search	0	-1.520844
exp152	1.49418921e-13	0.000000	-0.000000	discard	positive super u=0.4691	agent0	initial_cond	0	-0.000000
exp153	1.45781502e-12	1.001296	1.000019	discard	negative branch u_offset=-0.9 scipy n=300 tol=1e-11 amp=0	agent1	initial_cond	0	-1.520844
exp154	1.49418921e-13	0.000000	-0.000000	discard	positive super u=0.4691	agent0	initial_cond	0	-0.000000
exp155	1.35396869e-13	0.000000	-0.000000	discard	positive super u=0.469	agent0	initial_cond	1	-0.000000
exp156	1.35396869e-13	0.000000	-0.000000	discard	positive super u=0.469	agent0	initial_cond	0	-0.000000
exp157	3.59698226e-13	0.000000	-0.000000	discard	positive super u=0.47	agent0	initial_cond	1	-0.000000
exp158	5.62802405e-12	1.002503	-1.000218	discard	positive super u=0.47	agent0	initial_cond	0	-1.523848
exp159	5.62802405e-12	1.002503	-1.000218	discard	branch boundary u_offset=0.50	agent0	branch_search	0	-1.523848
exp160	5.62802405e-12	1.002503	-1.000218	discard	branch boundary u_offset=0.55	agent0	branch_search	0	-1.523848
exp161	5.62802405e-12	1.002503	1.000218	discard	branch boundary u_offset=0.60	agent0	branch_search	0	-1.523848
exp162	5.62802405e-12	1.002503	1.000218	discard	branch boundary u_offset=0.65	agent0	branch_search	0	-1.523848
exp163	5.62802405e-12	1.002503	1.000218	discard	branch boundary u_offset=0.70	agent0	branch_search	1	-1.523848
exp164	5.62802405e-12	1.002503	1.000218	discard	branch boundary u_offset=0.75	agent0	branch_search	0	-1.523848
exp165	5.62802405e-12	1.002503	1.000218	discard	branch boundary u_offset=0.80	agent0	branch_search	0	-1.523848
exp166	1.52504759e-12	1.001296	-1.000019	discard	negative branch u_offset=-1.2 scipy n=300 tol=1e-11 amp=0	agent1	initial_cond	0	-1.520844
exp167	5.62802405e-12	1.002503	1.000218	discard	positive u=0.80	agent0	initial_cond	1	-1.523848
exp168	5.62802405e-12	1.002503	1.000218	discard	positive u=0.80	agent0	initial_cond	0	-1.523848
exp169	5.62802405e-12	1.002503	1.000218	discard	positive u=0.85	agent0	initial_cond	0	-1.523848
exp170	5.62802405e-12	1.002503	1.000218	discard	positive u=0.85	agent0	initial_cond	1	-1.523848
exp171	5.62802405e-12	1.002503	1.000218	discard	positive u=0.90	agent0	initial_cond	0	-1.523848
exp172	5.62802405e-12	1.002503	1.000218	discard	positive u=0.90	agent0	initial_cond	0	-1.523848
exp173	5.62802405e-12	1.002503	1.000218	discard	positive u=0.95	agent0	initial_cond	0	-1.523848
exp174	5.62802405e-12	1.002503	1.000218	discard	positive u=0.95	agent0	initial_cond	0	-1.523848
exp175	5.62802405e-12	1.002503	1.000218	discard	positive u=0.99	agent0	initial_cond	1	-1.523848
exp176	1.52504759e-12	1.001296	-1.000019	discard	Fourier 128modes negative u_offset=-1.0	agent1	branch_search	1	-1.520844
exp177	5.62802405e-12	1.002503	1.000218	discard	positive u=0.99	agent0	initial_cond	0	-1.523848
exp178	crash	0	0	crash	pos branch nodes=150 tol=5.0e-12	agent0	solver_param	0	0
exp179	5.79834068e-20	0.000000	-0.000000	discard	pos branch nodes=150 tol=2.0e-11	agent0	solver_param	0	-0.000000
exp180	2.62635931e-11	1.002503	1.000218	discard	negative u=-0.4680	agent0	initial_cond	1	-1.523848
exp181	2.75832194e-20	0.000000	-0.000000	discard	pos branch nodes=150 tol=5.0e-11	agent0	solver_param	1	-0.000000
exp182	4.88705558e-12	1.002503	1.000218	discard	negative u=-0.4685	agent0	initial_cond	0	-1.523848
exp183	5.49126601e-20	0.000000	-0.000000	discard	pos branch nodes=175 tol=5.0e-12	agent0	solver_param	0	-0.000000
exp184	1.64921451e-11	1.002503	1.000218	discard	negative u=-0.4688	agent0	initial_cond	0	-1.523848
exp185	2.27358147e-20	0.000000	-0.000000	discard	pos branch nodes=175 tol=2.0e-11	agent0	solver_param	0	-0.000000
exp186	1.64921451e-11	1.002503	1.000218	discard	negative u=-0.46895	agent0	initial_cond	1	-1.523848
exp187	1.42038445e-20	0.000000	-0.000000	discard	pos branch nodes=175 tol=5.0e-11	agent0	solver_param	1	-0.000000
exp188	3.26698952e-12	1.002503	1.000218	discard	negative u=-0.4690	agent0	initial_cond	0	-1.523848
exp189	4.66322745e-21	0.000000	-0.000000	discard	pos branch nodes=200 tol=5.0e-12	agent0	solver_param	0	-0.000000
exp190	1.10247370e-11	1.002503	1.000218	discard	negative u=-0.46905	agent0	initial_cond	0	-1.523848
exp191	4.00976976e-21	0.000000	-0.000000	discard	pos branch nodes=200 tol=2.0e-11	agent0	solver_param	0	-0.000000
exp192	1.10247370e-11	1.002503	1.000218	discard	negative u=-0.4691	agent0	initial_cond	1	-1.523848
exp193	1.10247370e-11	1.002503	1.000218	discard	pos branch nodes=200 tol=5.0e-11	agent0	solver_param	0	-1.523848
exp194	crash	0	0	crash	negative u=-0.46915	agent0	initial_cond	0	0
exp195	1.09974189e-20	0.000000	-0.000000	discard	pos branch nodes=225 tol=5.0e-12	agent0	solver_param	0	-0.000000
exp196	7.73044210e-12	1.002503	1.000218	discard	negative u=-0.4692	agent0	initial_cond	0	-1.523848
exp197	5.54323975e-21	0.000000	-0.000000	discard	pos branch nodes=225 tol=2.0e-11	agent0	solver_param	1	-0.000000
exp198	7.73044210e-12	1.002503	1.000218	discard	negative u=-0.4695	agent0	initial_cond	0	-1.523848
exp199	7.73044210e-12	1.002503	1.000218	discard	pos branch nodes=225 tol=5.0e-11	agent0	solver_param	0	-1.523848
