exp_id	residual	solution_norm	solution_mean	status	description	agent	design	elapsed_s	solution_energy
exp8525	4.50941488e-29	0.000000	-0.000000	discard	cycle 59 u=0.0990	agent0	initial_cond	0	0.000000
exp8526	4.50941488e-29	0.000000	-0.000000	discard	cycle 59 u=0.0990	agent0	initial_cond	1	0.000000
exp8527	4.88330883e-29	0.000000	-0.000000	discard	cycle 59 u=0.0990	agent0	initial_cond	0	0.000000
exp8528	4.88330883e-29	0.000000	-0.000000	discard	cycle 59 u=0.0990	agent0	initial_cond	0	0.000000
exp8529	4.88330883e-29	0.000000	-0.000000	discard	cycle 59 u=0.0990	agent0	initial_cond	1	0.000000
exp8530	5.74085541e-29	0.000000	-0.000000	discard	cycle 59 u=0.0995	agent0	initial_cond	0	0.000000
exp8531	5.74085541e-29	0.000000	-0.000000	discard	cycle 59 u=0.0995	agent0	initial_cond	0	0.000000
exp8532	5.74085541e-29	0.000000	-0.000000	discard	cycle 59 u=0.0995	agent0	initial_cond	0	0.000000
exp8533	1.54984578e-28	0.000000	0.000000	discard	cycle 59 u=0.0995	agent0	initial_cond	0	-0.000000
exp8534	1.54984578e-28	0.000000	0.000000	discard	cycle 59 u=0.0995	agent0	initial_cond	1	-0.000000
exp8535	1.54984578e-28	0.000000	0.000000	discard	cycle 59 u=0.0995	agent0	initial_cond	0	-0.000000
exp8536	1.60328418e-29	0.000000	-0.000000	discard	cycle 59 u=0.0995	agent0	initial_cond	0	-0.000000
exp8537	1.60328418e-29	0.000000	-0.000000	discard	cycle 59 u=0.0995	agent0	initial_cond	1	-0.000000
exp8538	1.60328418e-29	0.000000	-0.000000	discard	cycle 59 u=0.0995	agent0	initial_cond	0	-0.000000
exp8539	7.34590618e-29	0.000000	0.000000	discard	cycle 59 u=0.0995	agent0	initial_cond	1	0.000000
exp8540	7.34590618e-29	0.000000	0.000000	discard	cycle 59 u=0.0995	agent0	initial_cond	0	0.000000
exp8541	7.34590618e-29	0.000000	0.000000	discard	cycle 59 u=0.0995	agent0	initial_cond	0	0.000000
exp8542	4.46546993e-29	0.000000	0.000000	discard	cycle 59 u=0.1000	agent0	initial_cond	1	-0.000000
exp8543	4.46546993e-29	0.000000	0.000000	discard	cycle 59 u=0.1000	agent0	initial_cond	0	-0.000000
exp8544	4.46546993e-29	0.000000	0.000000	discard	cycle 59 u=0.1000	agent0	initial_cond	0	-0.000000
exp8545	4.08106752e-29	0.000000	0.000000	discard	cycle 59 u=0.1000	agent0	initial_cond	0	-0.000000
exp8546	4.08106752e-29	0.000000	0.000000	discard	cycle 59 u=0.1000	agent0	initial_cond	0	-0.000000
exp8547	4.08106752e-29	0.000000	0.000000	discard	cycle 59 u=0.1000	agent0	initial_cond	1	-0.000000
exp8548	4.58623706e-29	0.000000	0.000000	discard	cycle 59 u=0.1000	agent0	initial_cond	0	-0.000000
exp8549	4.58623706e-29	0.000000	0.000000	discard	cycle 59 u=0.1000	agent0	initial_cond	0	-0.000000
exp8550	4.58623706e-29	0.000000	0.000000	discard	cycle 59 u=0.1000	agent0	initial_cond	1	-0.000000
exp8551	4.39794337e-29	0.000000	0.000000	discard	cycle 59 u=0.1000	agent0	initial_cond	0	-0.000000
exp8552	4.39794337e-29	0.000000	0.000000	discard	cycle 59 u=0.1000	agent0	initial_cond	0	-0.000000
exp8553	4.39794337e-29	0.000000	0.000000	discard	cycle 59 u=0.1000	agent0	initial_cond	0	-0.000000
exp8554	1.36727475e-28	0.000000	0.000000	discard	cycle 59 u=0.1050	agent0	initial_cond	0	-0.000000
exp8555	1.36727475e-28	0.000000	0.000000	discard	cycle 59 u=0.1050	agent0	initial_cond	1	-0.000000
exp8556	1.36727475e-28	0.000000	0.000000	discard	cycle 59 u=0.1050	agent0	initial_cond	0	-0.000000
exp8557	6.14461376e-29	0.000000	0.000000	discard	cycle 59 u=0.1050	agent0	initial_cond	0	-0.000000
exp8558	6.14461376e-29	0.000000	0.000000	discard	cycle 59 u=0.1050	agent0	initial_cond	0	-0.000000
exp8559	6.14461376e-29	0.000000	0.000000	discard	cycle 59 u=0.1050	agent0	initial_cond	0	-0.000000
exp8560	1.75906666e-28	0.000000	0.000000	discard	cycle 59 u=0.1050	agent0	initial_cond	1	-0.000000
exp8561	1.75906666e-28	0.000000	0.000000	discard	cycle 59 u=0.1050	agent0	initial_cond	0	-0.000000
exp8562	1.75906666e-28	0.000000	0.000000	discard	cycle 59 u=0.1050	agent0	initial_cond	0	-0.000000
exp8563	1.11257917e-28	0.000000	0.000000	discard	cycle 59 u=0.1050	agent0	initial_cond	1	-0.000000
exp8564	1.11257917e-28	0.000000	0.000000	discard	cycle 59 u=0.1050	agent0	initial_cond	0	-0.000000
exp8565	1.11257917e-28	0.000000	0.000000	discard	cycle 59 u=0.1050	agent0	initial_cond	0	-0.000000
exp8566	8.58580947e-29	0.000000	0.000000	discard	cycle 60 u=0.0975	agent0	initial_cond	0	0.000000
exp8567	8.58580947e-29	0.000000	0.000000	discard	cycle 60 u=0.0975	agent0	initial_cond	0	0.000000
exp8568	8.58580947e-29	0.000000	0.000000	discard	cycle 60 u=0.0975	agent0	initial_cond	1	0.000000
exp8569	5.23962023e-29	0.000000	0.000000	discard	cycle 60 u=0.0975	agent0	initial_cond	0	0.000000
exp8570	5.23962023e-29	0.000000	0.000000	discard	cycle 60 u=0.0975	agent0	initial_cond	0	0.000000
exp8571	5.23962023e-29	0.000000	0.000000	discard	cycle 60 u=0.0975	agent0	initial_cond	1	0.000000
exp8572	4.03266298e-29	0.000000	0.000000	discard	cycle 60 u=0.0975	agent0	initial_cond	0	0.000000
exp8573	4.03266298e-29	0.000000	0.000000	discard	cycle 60 u=0.0975	agent0	initial_cond	1	0.000000
exp8574	4.03266298e-29	0.000000	0.000000	discard	cycle 60 u=0.0975	agent0	initial_cond	0	0.000000
exp8575	4.80015937e-29	0.000000	0.000000	discard	cycle 60 u=0.0975	agent0	initial_cond	0	0.000000
exp8576	4.80015937e-29	0.000000	0.000000	discard	cycle 60 u=0.0975	agent0	initial_cond	1	0.000000
exp8577	4.80015937e-29	0.000000	0.000000	discard	cycle 60 u=0.0975	agent0	initial_cond	0	0.000000
exp8578	2.68824537e-29	0.000000	0.000000	discard	cycle 60 u=0.0980	agent0	initial_cond	0	-0.000000
exp8579	2.68824537e-29	0.000000	0.000000	discard	cycle 60 u=0.0980	agent0	initial_cond	0	-0.000000
exp8580	2.68824537e-29	0.000000	0.000000	discard	cycle 60 u=0.0980	agent0	initial_cond	0	-0.000000
exp8581	6.16758073e-29	0.000000	0.000000	discard	cycle 60 u=0.0980	agent0	initial_cond	1	-0.000000
exp8582	6.16758073e-29	0.000000	0.000000	discard	cycle 60 u=0.0980	agent0	initial_cond	0	-0.000000
exp8583	6.16758073e-29	0.000000	0.000000	discard	cycle 60 u=0.0980	agent0	initial_cond	0	-0.000000
exp8584	2.01926478e-29	0.000000	0.000000	discard	cycle 60 u=0.0980	agent0	initial_cond	1	0.000000
exp8585	2.01926478e-29	0.000000	0.000000	discard	cycle 60 u=0.0980	agent0	initial_cond	0	0.000000
exp8586	2.01926478e-29	0.000000	0.000000	discard	cycle 60 u=0.0980	agent0	initial_cond	1	0.000000
exp8587	1.30310780e-28	0.000000	0.000000	discard	cycle 60 u=0.0980	agent0	initial_cond	0	-0.000000
exp8588	1.30310780e-28	0.000000	0.000000	discard	cycle 60 u=0.0980	agent0	initial_cond	0	-0.000000
exp8589	1.30310780e-28	0.000000	0.000000	discard	cycle 60 u=0.0980	agent0	initial_cond	1	-0.000000
exp8590	5.45343271e-29	0.000000	0.000000	discard	cycle 60 u=0.0982	agent0	initial_cond	0	-0.000000
exp8591	5.45343271e-29	0.000000	0.000000	discard	cycle 60 u=0.0982	agent0	initial_cond	0	-0.000000
exp8592	5.45343271e-29	0.000000	0.000000	discard	cycle 60 u=0.0982	agent0	initial_cond	0	-0.000000
exp8593	1.23429977e-28	0.000000	0.000000	discard	cycle 60 u=0.0982	agent0	initial_cond	0	0.000000
exp8594	1.23429977e-28	0.000000	0.000000	discard	cycle 60 u=0.0982	agent0	initial_cond	1	0.000000
exp8595	1.23429977e-28	0.000000	0.000000	discard	cycle 60 u=0.0982	agent0	initial_cond	0	0.000000
exp8596	1.88036672e-29	0.000000	0.000000	discard	cycle 60 u=0.0982	agent0	initial_cond	0	0.000000
exp8597	1.88036672e-29	0.000000	0.000000	discard	cycle 60 u=0.0982	agent0	initial_cond	1	0.000000
exp8598	1.88036672e-29	0.000000	0.000000	discard	cycle 60 u=0.0982	agent0	initial_cond	0	0.000000
exp8599	1.91190259e-29	0.000000	-0.000000	discard	cycle 60 u=0.0982	agent0	initial_cond	1	0.000000
exp8600	1.91190259e-29	0.000000	-0.000000	discard	cycle 60 u=0.0982	agent0	initial_cond	0	0.000000
exp8601	1.91190259e-29	0.000000	-0.000000	discard	cycle 60 u=0.0982	agent0	initial_cond	0	0.000000
exp8602	6.13049994e-29	0.000000	0.000000	discard	cycle 60 u=0.0985	agent0	initial_cond	1	0.000000
exp8603	6.13049994e-29	0.000000	0.000000	discard	cycle 60 u=0.0985	agent0	initial_cond	0	0.000000
exp8604	6.13049994e-29	0.000000	0.000000	discard	cycle 60 u=0.0985	agent0	initial_cond	0	0.000000
exp8605	5.49750971e-29	0.000000	0.000000	discard	cycle 60 u=0.0985	agent0	initial_cond	0	0.000000
exp8606	5.49750971e-29	0.000000	0.000000	discard	cycle 60 u=0.0985	agent0	initial_cond	0	0.000000
exp8607	5.49750971e-29	0.000000	0.000000	discard	cycle 60 u=0.0985	agent0	initial_cond	1	0.000000
exp8608	4.15642452e-29	0.000000	0.000000	discard	cycle 60 u=0.0985	agent0	initial_cond	0	0.000000
exp8609	4.15642452e-29	0.000000	0.000000	discard	cycle 60 u=0.0985	agent0	initial_cond	0	0.000000
exp8610	4.15642452e-29	0.000000	0.000000	discard	cycle 60 u=0.0985	agent0	initial_cond	1	0.000000
exp8611	2.19292611e-29	0.000000	0.000000	discard	cycle 60 u=0.0985	agent0	initial_cond	0	-0.000000
exp8612	2.19292611e-29	0.000000	0.000000	discard	cycle 60 u=0.0985	agent0	initial_cond	0	-0.000000
exp8613	2.19292611e-29	0.000000	0.000000	discard	cycle 60 u=0.0985	agent0	initial_cond	0	-0.000000
exp8614	4.22491788e-29	0.000000	0.000000	discard	cycle 60 u=0.0990	agent0	initial_cond	0	-0.000000
exp8615	4.22491788e-29	0.000000	0.000000	discard	cycle 60 u=0.0990	agent0	initial_cond	1	-0.000000
exp8616	4.22491788e-29	0.000000	0.000000	discard	cycle 60 u=0.0990	agent0	initial_cond	0	-0.000000
exp8617	3.22245147e-29	0.000000	0.000000	discard	cycle 60 u=0.0990	agent0	initial_cond	0	0.000000
exp8618	3.22245147e-29	0.000000	0.000000	discard	cycle 60 u=0.0990	agent0	initial_cond	0	0.000000
exp8619	3.22245147e-29	0.000000	0.000000	discard	cycle 60 u=0.0990	agent0	initial_cond	0	0.000000
exp8620	4.50941488e-29	0.000000	-0.000000	discard	cycle 60 u=0.0990	agent0	initial_cond	1	0.000000
exp8621	4.50941488e-29	0.000000	-0.000000	discard	cycle 60 u=0.0990	agent0	initial_cond	0	0.000000
exp8622	4.50941488e-29	0.000000	-0.000000	discard	cycle 60 u=0.0990	agent0	initial_cond	0	0.000000
exp8623	4.88330883e-29	0.000000	-0.000000	discard	cycle 60 u=0.0990	agent0	initial_cond	1	0.000000
exp8624	4.88330883e-29	0.000000	-0.000000	discard	cycle 60 u=0.0990	agent0	initial_cond	0	0.000000
exp8625	4.88330883e-29	0.000000	-0.000000	discard	cycle 60 u=0.0990	agent0	initial_cond	1	0.000000
exp8626	5.74085541e-29	0.000000	-0.000000	discard	cycle 60 u=0.0995	agent0	initial_cond	0	0.000000
exp8627	5.74085541e-29	0.000000	-0.000000	discard	cycle 60 u=0.0995	agent0	initial_cond	0	0.000000
exp8628	5.74085541e-29	0.000000	-0.000000	discard	cycle 60 u=0.0995	agent0	initial_cond	1	0.000000
exp8629	1.54984578e-28	0.000000	0.000000	discard	cycle 60 u=0.0995	agent0	initial_cond	0	-0.000000
exp8630	1.54984578e-28	0.000000	0.000000	discard	cycle 60 u=0.0995	agent0	initial_cond	0	-0.000000
exp8631	1.54984578e-28	0.000000	0.000000	discard	cycle 60 u=0.0995	agent0	initial_cond	0	-0.000000
exp8632	1.60328418e-29	0.000000	-0.000000	discard	cycle 60 u=0.0995	agent0	initial_cond	0	-0.000000
exp8633	1.60328418e-29	0.000000	-0.000000	discard	cycle 60 u=0.0995	agent0	initial_cond	1	-0.000000
exp8634	1.60328418e-29	0.000000	-0.000000	discard	cycle 60 u=0.0995	agent0	initial_cond	0	-0.000000
exp8635	7.34590618e-29	0.000000	0.000000	discard	cycle 60 u=0.0995	agent0	initial_cond	0	0.000000
exp8636	7.34590618e-29	0.000000	0.000000	discard	cycle 60 u=0.0995	agent0	initial_cond	1	0.000000
exp8637	7.34590618e-29	0.000000	0.000000	discard	cycle 60 u=0.0995	agent0	initial_cond	0	0.000000
exp8638	4.46546993e-29	0.000000	0.000000	discard	cycle 60 u=0.1000	agent0	initial_cond	1	-0.000000
exp8639	4.46546993e-29	0.000000	0.000000	discard	cycle 60 u=0.1000	agent0	initial_cond	0	-0.000000
exp8640	4.46546993e-29	0.000000	0.000000	discard	cycle 60 u=0.1000	agent0	initial_cond	0	-0.000000
exp8641	4.08106752e-29	0.000000	0.000000	discard	cycle 60 u=0.1000	agent0	initial_cond	1	-0.000000
exp8642	4.08106752e-29	0.000000	0.000000	discard	cycle 60 u=0.1000	agent0	initial_cond	0	-0.000000
exp8643	5.24531103e-17	0.070278	-0.000000	discard	3D phase u=0.238 amp=0.44 phase=0.8	manual	memory	0	0.000097
exp8644	4.08106752e-29	0.000000	0.000000	discard	cycle 60 u=0.1000	agent0	initial_cond	0	-0.000000
exp8645	2.96820601e-17	0.070278	-0.000000	discard	3D phase u=0.238 amp=0.45 phase=0.8	manual	memory	1	0.000097
exp8646	4.58623706e-29	0.000000	0.000000	discard	cycle 60 u=0.1000	agent0	initial_cond	0	-0.000000
exp8647	2.14221646e-17	0.070278	-0.000000	discard	3D phase u=0.238 amp=0.46 phase=0.8	manual	memory	0	0.000097
exp8647	4.58623706e-29	0.000000	0.000000	discard	cycle 60 u=0.1000	agent0	initial_cond	0	-0.000000
exp8648	4.58623706e-29	0.000000	0.000000	discard	cycle 60 u=0.1000	agent0	initial_cond	1	-0.000000
exp8649	3.85200085e-17	0.070278	-0.000000	discard	3D phase u=0.239 amp=0.44 phase=0.8	manual	memory	1	0.000097
exp8650	4.39794337e-29	0.000000	0.000000	discard	cycle 60 u=0.1000	agent0	initial_cond	0	-0.000000
exp8651	3.66181970e-17	0.070278	-0.000000	discard	3D phase u=0.239 amp=0.45 phase=0.8	manual	memory	0	0.000097
exp8652	4.39794337e-29	0.000000	0.000000	discard	cycle 60 u=0.1000	agent0	initial_cond	0	-0.000000
exp8653	7.29561844e-17	0.070278	-0.000000	discard	3D phase u=0.239 amp=0.46 phase=0.8	manual	memory	1	0.000097
exp8654	4.39794337e-29	0.000000	0.000000	discard	cycle 60 u=0.1000	agent0	initial_cond	0	-0.000000
exp8655	2.54950867e-17	0.070278	-0.000000	discard	3D phase u=0.240 amp=0.44 phase=0.8	manual	memory	0	0.000097
exp8655	1.36727475e-28	0.000000	0.000000	discard	cycle 60 u=0.1050	agent0	initial_cond	0	-0.000000
exp8656	1.36727475e-28	0.000000	0.000000	discard	cycle 60 u=0.1050	agent0	initial_cond	1	-0.000000
exp8657	3.72132296e-17	0.070278	0.000000	discard	3D phase u=0.240 amp=0.45 phase=0.8	manual	memory	1	0.000097
exp8658	1.36727475e-28	0.000000	0.000000	discard	cycle 60 u=0.1050	agent0	initial_cond	0	-0.000000
exp8659	4.83704644e-17	0.070278	-0.000000	discard	3D phase u=0.240 amp=0.46 phase=0.8	manual	memory	0	0.000097
exp8660	6.14461376e-29	0.000000	0.000000	discard	cycle 60 u=0.1050	agent0	initial_cond	0	-0.000000
exp8661	1.31271533e-17	0.070278	-0.000000	discard	3D phase u=0.241 amp=0.44 phase=0.8	manual	memory	1	0.000097
exp8662	6.14461376e-29	0.000000	0.000000	discard	cycle 60 u=0.1050	agent0	initial_cond	1	-0.000000
exp8663	2.60058098e-17	0.070278	-0.000000	discard	3D phase u=0.241 amp=0.45 phase=0.8	manual	memory	0	0.000097
exp8663	6.14461376e-29	0.000000	0.000000	discard	cycle 60 u=0.1050	agent0	initial_cond	0	-0.000000
exp8664	1.75906666e-28	0.000000	0.000000	discard	cycle 60 u=0.1050	agent0	initial_cond	1	-0.000000
exp8665	6.56506662e-18	0.070278	-0.000000	discard	3D phase u=0.241 amp=0.46 phase=0.8	manual	memory	1	0.000097
exp8666	1.75906666e-28	0.000000	0.000000	discard	cycle 60 u=0.1050	agent0	initial_cond	0	-0.000000
exp8667	2.38440053e-17	0.070278	-0.000000	discard	3D phase u=0.242 amp=0.44 phase=0.8	manual	memory	0	0.000097
exp8668	1.75906666e-28	0.000000	0.000000	discard	cycle 60 u=0.1050	agent0	initial_cond	0	-0.000000
exp8669	4.61959057e-17	0.070278	-0.000000	discard	3D phase u=0.242 amp=0.45 phase=0.8	manual	memory	1	0.000097
exp8670	1.11257917e-28	0.000000	0.000000	discard	cycle 60 u=0.1050	agent0	initial_cond	1	-0.000000
exp8671	2.57699914e-17	0.070278	-0.000000	discard	3D phase u=0.242 amp=0.46 phase=0.8	manual	memory	0	0.000097
exp8671	1.11257917e-28	0.000000	0.000000	discard	cycle 60 u=0.1050	agent0	initial_cond	0	-0.000000
exp8672	1.11257917e-28	0.000000	0.000000	discard	cycle 60 u=0.1050	agent0	initial_cond	0	-0.000000
exp8673	4.66356587e-17	0.070278	-0.000000	discard	3D phase u=0.238 amp=0.44 phase=0.9	manual	memory	1	0.000097
exp8674	8.58580947e-29	0.000000	0.000000	discard	cycle 61 u=0.0975	agent0	initial_cond	0	0.000000
exp8675	8.63620460e-17	0.070278	-0.000000	discard	3D phase u=0.238 amp=0.45 phase=0.9	manual	memory	0	0.000097
exp8676	8.58580947e-29	0.000000	0.000000	discard	cycle 61 u=0.0975	agent0	initial_cond	0	0.000000
exp8677	5.97243974e-17	0.070278	-0.000000	discard	3D phase u=0.238 amp=0.46 phase=0.9	manual	memory	1	0.000097
exp8678	8.58580947e-29	0.000000	0.000000	discard	cycle 61 u=0.0975	agent0	initial_cond	1	0.000000
exp8679	5.76243618e-17	0.070278	-0.000000	discard	3D phase u=0.239 amp=0.44 phase=0.9	manual	memory	0	0.000097
exp8679	5.23962023e-29	0.000000	0.000000	discard	cycle 61 u=0.0975	agent0	initial_cond	0	0.000000
exp8680	5.23962023e-29	0.000000	0.000000	discard	cycle 61 u=0.0975	agent0	initial_cond	0	0.000000
exp8681	1.49489395e-17	0.070278	-0.000000	discard	3D phase u=0.239 amp=0.45 phase=0.9	manual	memory	0	0.000097
exp8682	5.23962023e-29	0.000000	0.000000	discard	cycle 61 u=0.0975	agent0	initial_cond	0	0.000000
exp8683	2.66150426e-17	0.070278	-0.000000	discard	3D phase u=0.239 amp=0.46 phase=0.9	manual	memory	0	0.000097
exp8684	4.03266298e-29	0.000000	0.000000	discard	cycle 61 u=0.0975	agent0	initial_cond	0	0.000000
exp8685	3.04806155e-17	0.070278	-0.000000	discard	3D phase u=0.240 amp=0.44 phase=0.9	manual	memory	0	0.000097
exp8686	4.03266298e-29	0.000000	0.000000	discard	cycle 61 u=0.0975	agent0	initial_cond	1	0.000000
exp8687	2.13795160e-17	0.070278	-0.000000	discard	3D phase u=0.240 amp=0.45 phase=0.9	manual	memory	0	0.000097
exp8687	4.03266298e-29	0.000000	0.000000	discard	cycle 61 u=0.0975	agent0	initial_cond	0	0.000000
exp8688	4.80015937e-29	0.000000	0.000000	discard	cycle 61 u=0.0975	agent0	initial_cond	0	0.000000
exp8688	4.43878892e-17	0.070278	-0.000000	discard	3D phase u=0.240 amp=0.46 phase=0.9	manual	memory	0	0.000097
exp8689	4.80015937e-29	0.000000	0.000000	discard	cycle 61 u=0.0975	agent0	initial_cond	1	0.000000
exp8690	5.43334117e-17	0.070278	-0.000000	discard	3D phase u=0.241 amp=0.44 phase=0.9	manual	memory	0	0.000097
exp8691	4.80015937e-29	0.000000	0.000000	discard	cycle 61 u=0.0975	agent0	initial_cond	0	0.000000
exp8692	2.06439742e-17	0.070278	-0.000000	discard	3D phase u=0.241 amp=0.45 phase=0.9	manual	memory	0	0.000097
exp8693	2.68824537e-29	0.000000	0.000000	discard	cycle 61 u=0.0980	agent0	initial_cond	1	-0.000000
exp8694	1.92915833e-17	0.070278	-0.000000	discard	3D phase u=0.241 amp=0.46 phase=0.9	manual	memory	0	0.000097
exp8694	2.68824537e-29	0.000000	0.000000	discard	cycle 61 u=0.0980	agent0	initial_cond	0	-0.000000
exp8695	2.68824537e-29	0.000000	0.000000	discard	cycle 61 u=0.0980	agent0	initial_cond	0	-0.000000
exp8695	1.41106006e-17	0.070278	-0.000000	discard	3D phase u=0.242 amp=0.44 phase=0.9	manual	memory	0	0.000097
exp8696	6.16758073e-29	0.000000	0.000000	discard	cycle 61 u=0.0980	agent0	initial_cond	1	-0.000000
exp8697	4.32992578e-17	0.070278	-0.000000	discard	3D phase u=0.242 amp=0.45 phase=0.9	manual	memory	0	0.000097
exp8698	6.16758073e-29	0.000000	0.000000	discard	cycle 61 u=0.0980	agent0	initial_cond	0	-0.000000
exp8699	5.81247306e-17	0.070278	-0.000000	discard	3D phase u=0.242 amp=0.46 phase=0.9	manual	memory	0	0.000097
exp8700	6.16758073e-29	0.000000	0.000000	discard	cycle 61 u=0.0980	agent0	initial_cond	1	-0.000000
exp8701	1.35631076e-17	0.070278	-0.000000	discard	3D phase u=0.238 amp=0.44 phase=1.0	manual	memory	0	0.000097
exp8702	2.01926478e-29	0.000000	0.000000	discard	cycle 61 u=0.0980	agent0	initial_cond	0	0.000000
exp8703	2.01926478e-29	0.000000	0.000000	discard	cycle 61 u=0.0980	agent0	initial_cond	0	0.000000
exp8703	2.46050759e-17	0.070278	-0.000000	discard	3D phase u=0.238 amp=0.45 phase=1.0	manual	memory	0	0.000097
exp8704	2.01926478e-29	0.000000	0.000000	discard	cycle 61 u=0.0980	agent0	initial_cond	1	0.000000
exp8705	1.63336183e-17	0.070278	-0.000000	discard	3D phase u=0.238 amp=0.46 phase=1.0	manual	memory	1	0.000097
exp8706	1.30310780e-28	0.000000	0.000000	discard	cycle 61 u=0.0980	agent0	initial_cond	0	-0.000000
exp8707	4.39909554e-17	0.070278	-0.000000	discard	3D phase u=0.239 amp=0.44 phase=1.0	manual	memory	0	0.000097
exp8708	1.30310780e-28	0.000000	0.000000	discard	cycle 61 u=0.0980	agent0	initial_cond	0	-0.000000
exp8709	2.27964180e-17	0.070278	-0.000000	discard	3D phase u=0.239 amp=0.45 phase=1.0	manual	memory	1	0.000097
exp8710	1.30310780e-28	0.000000	0.000000	discard	cycle 61 u=0.0980	agent0	initial_cond	0	-0.000000
exp8711	2.37060241e-17	0.070278	-0.000000	discard	3D phase u=0.239 amp=0.46 phase=1.0	manual	memory	0	0.000097
exp8711	5.45343271e-29	0.000000	0.000000	discard	cycle 61 u=0.0982	agent0	initial_cond	0	-0.000000
exp8712	5.45343271e-29	0.000000	0.000000	discard	cycle 61 u=0.0982	agent0	initial_cond	1	-0.000000
exp8713	3.59691331e-17	0.070278	-0.000000	discard	3D phase u=0.240 amp=0.44 phase=1.0	manual	memory	1	0.000097
exp8714	5.45343271e-29	0.000000	0.000000	discard	cycle 61 u=0.0982	agent0	initial_cond	0	-0.000000
exp8715	8.61780663e-18	0.070278	-0.000000	discard	3D phase u=0.240 amp=0.45 phase=1.0	manual	memory	0	0.000097
exp8716	1.23429977e-28	0.000000	0.000000	discard	cycle 61 u=0.0982	agent0	initial_cond	0	0.000000
exp8717	2.96268871e-17	0.070278	-0.000000	discard	3D phase u=0.240 amp=0.46 phase=1.0	manual	memory	1	0.000097
exp8718	1.23429977e-28	0.000000	0.000000	discard	cycle 61 u=0.0982	agent0	initial_cond	0	0.000000
exp8719	1.16698172e-17	0.070278	-0.000000	discard	3D phase u=0.241 amp=0.44 phase=1.0	manual	memory	0	0.000097
exp8719	1.23429977e-28	0.000000	0.000000	discard	cycle 61 u=0.0982	agent0	initial_cond	0	0.000000
exp8720	1.88036672e-29	0.000000	0.000000	discard	cycle 61 u=0.0982	agent0	initial_cond	1	0.000000
exp8720	2.25096546e-17	0.070278	-0.000000	discard	3D phase u=0.241 amp=0.45 phase=1.0	manual	memory	1	0.000097
exp8721	1.88036672e-29	0.000000	0.000000	discard	cycle 61 u=0.0982	agent0	initial_cond	0	0.000000
exp8722	6.22574085e-17	0.070278	-0.000000	discard	3D phase u=0.241 amp=0.46 phase=1.0	manual	memory	0	0.000097
exp8723	1.88036672e-29	0.000000	0.000000	discard	cycle 61 u=0.0982	agent0	initial_cond	0	0.000000
exp8724	3.19957656e-17	0.070278	-0.000000	discard	3D phase u=0.242 amp=0.44 phase=1.0	manual	memory	1	0.000097
exp8725	1.91190259e-29	0.000000	-0.000000	discard	cycle 61 u=0.0982	agent0	initial_cond	1	0.000000
exp8726	4.05235948e-17	0.070278	-0.000000	discard	3D phase u=0.242 amp=0.45 phase=1.0	manual	memory	0	0.000097
exp8726	1.91190259e-29	0.000000	-0.000000	discard	cycle 61 u=0.0982	agent0	initial_cond	0	0.000000
