exp_id	residual	solution_norm	solution_mean	status	description	agent	design	elapsed_s	solution_energy
exp15206	2.27089434e-16	0.998996	1.000000	discard	R10: Grid u=0.6 K=0.01 a=0.1	agent1	initial_cond	0	-1.567603
exp15207	5.23962023e-29	0.000000	0.000000	discard	cycle 119 u=0.0975	agent0	initial_cond	1	0.000000
exp15207	5.07212195e-16	0.998996	1.000000	discard	R10: Grid u=0.6 K=0.01 a=0.3	agent1	initial_cond	1	-1.567603
exp15208	6.10110026e-16	0.998996	-1.000000	discard	R10: Grid u=0.6 K=0.01 a=0.5	agent1	initial_cond	0	-1.567603
exp15208	5.23962023e-29	0.000000	0.000000	discard	cycle 119 u=0.0975	agent0	initial_cond	0	0.000000
exp15209	4.03266298e-29	0.000000	0.000000	discard	cycle 119 u=0.0975	agent0	initial_cond	1	0.000000
exp15209	6.39971521e-16	0.999035	1.000000	discard	R10: Grid u=0.6 K=0.05 a=0.1	agent1	initial_cond	1	-1.566349
exp15210	4.03266298e-29	0.000000	0.000000	discard	cycle 119 u=0.0975	agent0	initial_cond	0	0.000000
exp15210	6.50844653e-16	0.999035	1.000000	discard	R10: Grid u=0.6 K=0.05 a=0.3	agent1	initial_cond	0	-1.566349
exp15211	4.03266298e-29	0.000000	0.000000	discard	cycle 119 u=0.0975	agent0	initial_cond	0	0.000000
exp15211	6.50844653e-16	0.999035	-1.000000	discard	R10: Grid u=0.6 K=0.05 a=0.5	agent1	initial_cond	0	-1.566349
exp15212	4.80015937e-29	0.000000	0.000000	discard	cycle 119 u=0.0975	agent0	initial_cond	0	0.000000
exp15212	4.95827548e-16	0.999210	1.000000	discard	R10: Grid u=0.6 K=0.1 a=0.1	agent1	initial_cond	0	-1.562435
exp15213	4.80015937e-29	0.000000	0.000000	discard	cycle 119 u=0.0975	agent0	initial_cond	0	0.000000
exp15213	9.79923780e-16	0.999210	1.000000	discard	R10: Grid u=0.6 K=0.1 a=0.3	agent1	initial_cond	0	-1.562435
exp15214	4.80015937e-29	0.000000	0.000000	discard	cycle 119 u=0.0975	agent0	initial_cond	1	0.000000
exp15214	5.21774140e-16	0.999210	-1.000000	discard	R10: Grid u=0.6 K=0.1 a=0.5	agent1	initial_cond	1	-1.562435
exp15215	2.68824537e-29	0.000000	0.000000	discard	cycle 119 u=0.0980	agent0	initial_cond	0	-0.000000
exp15215	7.81891528e-16	1.001296	1.000019	discard	R10: Grid u=0.6 K=0.3 a=0.1	agent1	initial_cond	0	-1.520844
exp15216	2.68824537e-29	0.000000	0.000000	discard	cycle 119 u=0.0980	agent0	initial_cond	1	-0.000000
exp15216	8.17887319e-16	1.001296	1.000019	discard	R10: Grid u=0.6 K=0.3 a=0.3	agent1	initial_cond	1	-1.520844
exp15217	2.68824537e-29	0.000000	0.000000	discard	cycle 119 u=0.0980	agent0	initial_cond	0	-0.000000
exp15217	4.42586856e-16	1.001296	-1.000019	discard	R10: Grid u=0.6 K=0.3 a=0.5	agent1	initial_cond	0	-1.520844
exp15218	3.15649768e-16	1.005614	-1.000140	discard	R10: Grid u=0.6 K=0.5 a=0.1	agent1	initial_cond	0	-1.438489
exp15218	6.16758073e-29	0.000000	0.000000	discard	cycle 119 u=0.0980	agent0	initial_cond	0	-0.000000
exp15219	6.16758073e-29	0.000000	0.000000	discard	cycle 119 u=0.0980	agent0	initial_cond	0	-0.000000
exp15219	2.97213706e-16	1.005614	1.000140	discard	R10: Grid u=0.6 K=0.5 a=0.3	agent1	initial_cond	0	-1.438489
exp15220	3.37566075e-16	1.005614	-1.000140	discard	R10: Grid u=0.6 K=0.5 a=0.5	agent1	initial_cond	0	-1.438489
exp15220	6.16758073e-29	0.000000	0.000000	discard	cycle 119 u=0.0980	agent0	initial_cond	0	-0.000000
exp15221	3.44198805e-16	0.998996	1.000000	discard	R10: Grid u=0.8 K=0.01 a=0.1	agent1	initial_cond	1	-1.567603
exp15221	2.01926478e-29	0.000000	0.000000	discard	cycle 119 u=0.0980	agent0	initial_cond	1	0.000000
exp15222	2.01926478e-29	0.000000	0.000000	discard	cycle 119 u=0.0980	agent0	initial_cond	0	0.000000
exp15222	9.84608746e-16	0.998996	1.000000	discard	R10: Grid u=0.8 K=0.01 a=0.3	agent1	initial_cond	0	-1.567603
exp15223	2.01926478e-29	0.000000	0.000000	discard	cycle 119 u=0.0980	agent0	initial_cond	1	0.000000
exp15223	2.27089434e-16	0.998996	1.000000	discard	R10: Grid u=0.8 K=0.01 a=0.5	agent1	initial_cond	1	-1.567603
exp15224	1.30310780e-28	0.000000	0.000000	discard	cycle 119 u=0.0980	agent0	initial_cond	0	-0.000000
exp15224	6.39971521e-16	0.999035	1.000000	discard	R10: Grid u=0.8 K=0.05 a=0.1	agent1	initial_cond	0	-1.566349
exp15225	1.30310780e-28	0.000000	0.000000	discard	cycle 119 u=0.0980	agent0	initial_cond	0	-0.000000
exp15225	6.52748346e-16	0.999035	1.000000	discard	R10: Grid u=0.8 K=0.05 a=0.3	agent1	initial_cond	0	-1.566349
exp15226	1.30310780e-28	0.000000	0.000000	discard	cycle 119 u=0.0980	agent0	initial_cond	0	-0.000000
exp15226	2.86380903e-16	0.999035	1.000000	discard	R10: Grid u=0.8 K=0.05 a=0.5	agent1	initial_cond	0	-1.566349
exp15227	5.45343271e-29	0.000000	0.000000	discard	cycle 119 u=0.0982	agent0	initial_cond	0	-0.000000
exp15227	4.79767355e-16	0.999210	1.000000	discard	R10: Grid u=0.8 K=0.1 a=0.1	agent1	initial_cond	0	-1.562435
exp15228	5.45343271e-29	0.000000	0.000000	discard	cycle 119 u=0.0982	agent0	initial_cond	1	-0.000000
exp15228	6.24179124e-16	0.999210	1.000000	discard	R10: Grid u=0.8 K=0.1 a=0.3	agent1	initial_cond	1	-1.562435
exp15229	5.45343271e-29	0.000000	0.000000	discard	cycle 119 u=0.0982	agent0	initial_cond	0	-0.000000
exp15229	6.01939881e-16	0.999210	1.000000	discard	R10: Grid u=0.8 K=0.1 a=0.5	agent1	initial_cond	0	-1.562435
exp15230	1.23429977e-28	0.000000	0.000000	discard	cycle 119 u=0.0982	agent0	initial_cond	1	0.000000
exp15230	3.37042680e-16	1.001296	1.000019	discard	R10: Grid u=0.8 K=0.3 a=0.1	agent1	initial_cond	1	-1.520844
exp15231	1.23429977e-28	0.000000	0.000000	discard	cycle 119 u=0.0982	agent0	initial_cond	0	0.000000
exp15231	6.30262704e-16	1.001296	1.000019	discard	R10: Grid u=0.8 K=0.3 a=0.3	agent1	initial_cond	0	-1.520844
exp15232	1.23429977e-28	0.000000	0.000000	discard	cycle 119 u=0.0982	agent0	initial_cond	0	0.000000
exp15232	4.42586856e-16	1.001296	1.000019	discard	R10: Grid u=0.8 K=0.3 a=0.5	agent1	initial_cond	0	-1.520844
exp15233	1.88036672e-29	0.000000	0.000000	discard	cycle 119 u=0.0982	agent0	initial_cond	0	0.000000
exp15233	6.99051232e-16	1.005614	1.000140	discard	R10: Grid u=0.8 K=0.5 a=0.1	agent1	initial_cond	0	-1.438489
exp15234	1.88036672e-29	0.000000	0.000000	discard	cycle 119 u=0.0982	agent0	initial_cond	0	0.000000
exp15234	1.59443643e-16	1.005614	1.000140	discard	R10: Grid u=0.8 K=0.5 a=0.3	agent1	initial_cond	0	-1.438489
exp15235	1.88036672e-29	0.000000	0.000000	discard	cycle 119 u=0.0982	agent0	initial_cond	1	0.000000
exp15235	8.13341771e-16	1.005614	1.000140	discard	R10: Grid u=0.8 K=0.5 a=0.5	agent1	initial_cond	1	-1.438489
exp15236	1.91190259e-29	0.000000	-0.000000	discard	cycle 119 u=0.0982	agent0	initial_cond	0	0.000000
exp15236	7.42929105e-16	0.998996	1.000000	discard	R10: Grid u=1.0 K=0.01 a=0.1	agent1	initial_cond	0	-1.567603
exp15237	1.91190259e-29	0.000000	-0.000000	discard	cycle 119 u=0.0982	agent0	initial_cond	1	0.000000
exp15237	2.53594262e-16	0.998996	1.000000	discard	R10: Grid u=1.0 K=0.01 a=0.3	agent1	initial_cond	1	-1.567603
exp15238	1.91190259e-29	0.000000	-0.000000	discard	cycle 119 u=0.0982	agent0	initial_cond	0	0.000000
exp15238	2.53594262e-16	0.998996	1.000000	discard	R10: Grid u=1.0 K=0.01 a=0.5	agent1	initial_cond	0	-1.567603
exp15239	6.13049994e-29	0.000000	0.000000	discard	cycle 119 u=0.0985	agent0	initial_cond	0	0.000000
exp15239	5.69236057e-16	0.999035	1.000000	discard	R10: Grid u=1.0 K=0.05 a=0.1	agent1	initial_cond	0	-1.566349
exp15240	6.13049994e-29	0.000000	0.000000	discard	cycle 119 u=0.0985	agent0	initial_cond	1	0.000000
exp15240	5.13124929e-16	0.999035	1.000000	discard	R10: Grid u=1.0 K=0.05 a=0.3	agent1	initial_cond	0	-1.566349
exp15241	6.13049994e-29	0.000000	0.000000	discard	cycle 119 u=0.0985	agent0	initial_cond	0	0.000000
exp15241	5.53337815e-16	0.999035	1.000000	discard	R10: Grid u=1.0 K=0.05 a=0.5	agent1	initial_cond	0	-1.566349
exp15242	5.49750971e-29	0.000000	0.000000	discard	cycle 119 u=0.0985	agent0	initial_cond	1	0.000000
exp15242	6.25086449e-16	0.999210	1.000000	discard	R10: Grid u=1.0 K=0.1 a=0.1	agent1	initial_cond	1	-1.562435
exp15243	3.55533936e-15	0.999210	1.000000	discard	R10: Grid u=1.0 K=0.1 a=0.3	agent1	initial_cond	0	-1.562435
exp15243	5.49750971e-29	0.000000	0.000000	discard	cycle 119 u=0.0985	agent0	initial_cond	0	0.000000
exp15244	5.59345438e-16	0.999210	1.000000	discard	R10: Grid u=1.0 K=0.1 a=0.5	agent1	initial_cond	0	-1.562435
exp15244	5.49750971e-29	0.000000	0.000000	discard	cycle 119 u=0.0985	agent0	initial_cond	0	0.000000
exp15245	4.15642452e-29	0.000000	0.000000	discard	cycle 119 u=0.0985	agent0	initial_cond	0	0.000000
exp15245	4.42586856e-16	1.001296	1.000019	discard	R10: Grid u=1.0 K=0.3 a=0.1	agent1	initial_cond	0	-1.520844
exp15246	1.22481142e-15	1.001296	1.000019	discard	R10: Grid u=1.0 K=0.3 a=0.3	agent1	initial_cond	0	-1.520844
exp15246	4.15642452e-29	0.000000	0.000000	discard	cycle 119 u=0.0985	agent0	initial_cond	0	0.000000
exp15247	4.15642452e-29	0.000000	0.000000	discard	cycle 119 u=0.0985	agent0	initial_cond	1	0.000000
exp15247	1.90514448e-16	1.001296	1.000019	discard	R10: Grid u=1.0 K=0.3 a=0.5	agent1	initial_cond	1	-1.520844
exp15248	2.19292611e-29	0.000000	0.000000	discard	cycle 119 u=0.0985	agent0	initial_cond	0	-0.000000
exp15248	3.20744069e-16	1.005614	1.000140	discard	R10: Grid u=1.0 K=0.5 a=0.1	agent1	initial_cond	0	-1.438489
exp15249	2.19292611e-29	0.000000	0.000000	discard	cycle 119 u=0.0985	agent0	initial_cond	1	-0.000000
exp15249	3.01734193e-15	1.005614	1.000140	discard	R10: Grid u=1.0 K=0.5 a=0.3	agent1	initial_cond	1	-1.438489
exp15250	2.19292611e-29	0.000000	0.000000	discard	cycle 119 u=0.0985	agent0	initial_cond	0	-0.000000
exp15250	2.86322228e-16	1.005614	1.000140	discard	R10: Grid u=1.0 K=0.5 a=0.5	agent1	initial_cond	0	-1.438489
exp15251	4.22491788e-29	0.000000	0.000000	discard	cycle 119 u=0.0990	agent0	initial_cond	0	-0.000000
exp15252	4.22491788e-29	0.000000	0.000000	discard	cycle 119 u=0.0990	agent0	initial_cond	0	-0.000000
exp15253	4.22491788e-29	0.000000	0.000000	discard	cycle 119 u=0.0990	agent0	initial_cond	0	-0.000000
exp15254	3.22245147e-29	0.000000	0.000000	discard	cycle 119 u=0.0990	agent0	initial_cond	1	0.000000
exp15255	3.22245147e-29	0.000000	0.000000	discard	cycle 119 u=0.0990	agent0	initial_cond	0	0.000000
exp15256	3.22245147e-29	0.000000	0.000000	discard	cycle 119 u=0.0990	agent0	initial_cond	1	0.000000
exp15257	4.50941488e-29	0.000000	-0.000000	discard	cycle 119 u=0.0990	agent0	initial_cond	0	0.000000
exp15258	4.50941488e-29	0.000000	-0.000000	discard	cycle 119 u=0.0990	agent0	initial_cond	0	0.000000
exp15259	4.50941488e-29	0.000000	-0.000000	discard	cycle 119 u=0.0990	agent0	initial_cond	0	0.000000
exp15260	4.88330883e-29	0.000000	-0.000000	discard	cycle 119 u=0.0990	agent0	initial_cond	0	0.000000
exp15261	4.88330883e-29	0.000000	-0.000000	discard	cycle 119 u=0.0990	agent0	initial_cond	1	0.000000
exp15262	4.88330883e-29	0.000000	-0.000000	discard	cycle 119 u=0.0990	agent0	initial_cond	0	0.000000
exp15263	5.74085541e-29	0.000000	-0.000000	discard	cycle 119 u=0.0995	agent0	initial_cond	0	0.000000
exp15264	5.74085541e-29	0.000000	-0.000000	discard	cycle 119 u=0.0995	agent0	initial_cond	0	0.000000
exp15265	5.74085541e-29	0.000000	-0.000000	discard	cycle 119 u=0.0995	agent0	initial_cond	0	0.000000
exp15266	1.54984578e-28	0.000000	0.000000	discard	cycle 119 u=0.0995	agent0	initial_cond	1	-0.000000
exp15267	1.54984578e-28	0.000000	0.000000	discard	cycle 119 u=0.0995	agent0	initial_cond	0	-0.000000
exp15268	1.54984578e-28	0.000000	0.000000	discard	cycle 119 u=0.0995	agent0	initial_cond	1	-0.000000
exp15269	1.60328418e-29	0.000000	-0.000000	discard	cycle 119 u=0.0995	agent0	initial_cond	0	-0.000000
exp15270	1.60328418e-29	0.000000	-0.000000	discard	cycle 119 u=0.0995	agent0	initial_cond	0	-0.000000
exp15271	1.60328418e-29	0.000000	-0.000000	discard	cycle 119 u=0.0995	agent0	initial_cond	0	-0.000000
exp15272	7.34590618e-29	0.000000	0.000000	discard	cycle 119 u=0.0995	agent0	initial_cond	0	0.000000
exp15273	7.34590618e-29	0.000000	0.000000	discard	cycle 119 u=0.0995	agent0	initial_cond	1	0.000000
exp15274	7.34590618e-29	0.000000	0.000000	discard	cycle 119 u=0.0995	agent0	initial_cond	0	0.000000
exp15275	4.46546993e-29	0.000000	0.000000	discard	cycle 119 u=0.1000	agent0	initial_cond	0	-0.000000
exp15276	2.24503783e-17	0.001886	0.000000	discard	R10 fine: u=0.0 K=0.008 amp=0.1	agent1	branch_search	1	-0.000000
exp15277	4.46546993e-29	0.000000	0.000000	discard	cycle 119 u=0.1000	agent0	initial_cond	0	-0.000000
exp15278	5.43924810e-19	0.002121	-0.000000	discard	R10 fine: u=0.0 K=0.009 amp=0.1	agent1	branch_search	0	-0.000000
exp15279	4.46546993e-29	0.000000	0.000000	discard	cycle 119 u=0.1000	agent0	initial_cond	0	-0.000000
exp15280	1.01321687e-18	0.002239	0.000000	discard	R10 fine: u=0.0 K=0.0095 amp=0.1	agent1	branch_search	0	-0.000000
exp15281	4.08106752e-29	0.000000	0.000000	discard	cycle 119 u=0.1000	agent0	initial_cond	1	-0.000000
exp15282	9.75152120e-19	0.002357	-0.000000	discard	R10 fine: u=0.0 K=0.01 amp=0.1	agent1	branch_search	0	-0.000000
exp15283	4.08106752e-29	0.000000	0.000000	discard	cycle 119 u=0.1000	agent0	initial_cond	0	-0.000000
exp15284	3.12913205e-15	0.002475	-0.000000	discard	R10 fine: u=0.0 K=0.0105 amp=0.1	agent1	branch_search	0	-0.000000
exp15285	4.08106752e-29	0.000000	0.000000	discard	cycle 119 u=0.1000	agent0	initial_cond	1	-0.000000
exp15286	9.49087809e-16	0.002593	-0.000000	discard	R10 fine: u=0.0 K=0.011 amp=0.1	agent1	branch_search	1	-0.000000
exp15287	4.58623706e-29	0.000000	0.000000	discard	cycle 119 u=0.1000	agent0	initial_cond	0	-0.000000
exp15288	7.55269319e-17	0.002828	-0.000000	discard	R10 fine: u=0.0 K=0.012 amp=0.1	agent1	branch_search	0	-0.000000
exp15289	4.58623706e-29	0.000000	0.000000	discard	cycle 119 u=0.1000	agent0	initial_cond	0	-0.000000
exp15290	1.03357330e-18	0.002357	-0.000000	discard	R10: K=0.01 amp=0.01	agent1	perturbation	1	-0.000000
exp15291	4.58623706e-29	0.000000	0.000000	discard	cycle 119 u=0.1000	agent0	initial_cond	0	-0.000000
exp15292	2.14160556e-18	0.002357	-0.000000	discard	R10: K=0.01 amp=0.05	agent1	perturbation	0	-0.000000
exp15293	4.39794337e-29	0.000000	0.000000	discard	cycle 119 u=0.1000	agent0	initial_cond	0	-0.000000
exp15294	9.75152120e-19	0.002357	-0.000000	discard	R10: K=0.01 amp=0.1	agent1	perturbation	0	-0.000000
exp15295	4.39794337e-29	0.000000	0.000000	discard	cycle 119 u=0.1000	agent0	initial_cond	1	-0.000000
exp15296	7.39274570e-19	0.002357	-0.000000	discard	R10: K=0.01 amp=0.15	agent1	perturbation	0	-0.000000
exp15297	4.39794337e-29	0.000000	0.000000	discard	cycle 119 u=0.1000	agent0	initial_cond	0	-0.000000
exp15298	3.62515843e-16	0.002357	-0.000000	discard	R10: K=0.01 amp=0.2	agent1	perturbation	0	-0.000000
exp15299	1.36727475e-28	0.000000	0.000000	discard	cycle 119 u=0.1050	agent0	initial_cond	1	-0.000000
exp15300	3.63042873e-16	0.002357	-0.000000	discard	R10: K=0.01 amp=0.3	agent1	perturbation	1	-0.000000
exp15301	1.36727475e-28	0.000000	0.000000	discard	cycle 119 u=0.1050	agent0	initial_cond	0	-0.000000
exp15302	7.16945898e-15	0.002357	-0.000000	discard	R10: K=0.01 amp=0.5	agent1	perturbation	0	-0.000000
exp15303	1.36727475e-28	0.000000	0.000000	discard	cycle 119 u=0.1050	agent0	initial_cond	0	-0.000000
exp15304	6.14461376e-29	0.000000	0.000000	discard	cycle 119 u=0.1050	agent0	initial_cond	0	-0.000000
exp15305	6.14461376e-29	0.000000	0.000000	discard	cycle 119 u=0.1050	agent0	initial_cond	0	-0.000000
exp15306	6.14461376e-29	0.000000	0.000000	discard	cycle 119 u=0.1050	agent0	initial_cond	1	-0.000000
exp15307	1.75906666e-28	0.000000	0.000000	discard	cycle 119 u=0.1050	agent0	initial_cond	0	-0.000000
exp15308	1.75906666e-28	0.000000	0.000000	discard	cycle 119 u=0.1050	agent0	initial_cond	0	-0.000000
exp15309	1.75906666e-28	0.000000	0.000000	discard	cycle 119 u=0.1050	agent0	initial_cond	0	-0.000000
exp15310	1.11257917e-28	0.000000	0.000000	discard	cycle 119 u=0.1050	agent0	initial_cond	0	-0.000000
exp15311	1.11257917e-28	0.000000	0.000000	discard	cycle 119 u=0.1050	agent0	initial_cond	1	-0.000000
exp15312	1.11257917e-28	0.000000	0.000000	discard	cycle 119 u=0.1050	agent0	initial_cond	0	-0.000000
exp15313	8.58580947e-29	0.000000	0.000000	discard	cycle 120 u=0.0975	agent0	initial_cond	1	0.000000
exp15314	8.58580947e-29	0.000000	0.000000	discard	cycle 120 u=0.0975	agent0	initial_cond	0	0.000000
exp15315	8.58580947e-29	0.000000	0.000000	discard	cycle 120 u=0.0975	agent0	initial_cond	0	0.000000
exp15316	5.23962023e-29	0.000000	0.000000	discard	cycle 120 u=0.0975	agent0	initial_cond	0	0.000000
exp15317	5.23962023e-29	0.000000	0.000000	discard	cycle 120 u=0.0975	agent0	initial_cond	0	0.000000
exp15318	5.23962023e-29	0.000000	0.000000	discard	cycle 120 u=0.0975	agent0	initial_cond	1	0.000000
exp15319	4.03266298e-29	0.000000	0.000000	discard	cycle 120 u=0.0975	agent0	initial_cond	0	0.000000
exp15320	3.25020026e-18	0.002003	-0.000000	discard	R10: K=0.0085 (around 0.009)	agent1	branch_search	1	-0.000000
exp15320	4.03266298e-29	0.000000	0.000000	discard	cycle 120 u=0.0975	agent0	initial_cond	1	0.000000
exp15321	4.03266298e-29	0.000000	0.000000	discard	cycle 120 u=0.0975	agent0	initial_cond	0	0.000000
exp15321	2.63514292e-18	0.002051	-0.000000	discard	R10: K=0.0087 (around 0.009)	agent1	branch_search	0	-0.000000
exp15322	2.69271821e-18	0.002098	-0.000000	discard	R10: K=0.0089 (around 0.009)	agent1	branch_search	0	-0.000000
exp15322	4.80015937e-29	0.000000	0.000000	discard	cycle 120 u=0.0975	agent0	initial_cond	0	0.000000
exp15323	4.80015937e-29	0.000000	0.000000	discard	cycle 120 u=0.0975	agent0	initial_cond	0	0.000000
exp15323	5.43924810e-19	0.002121	-0.000000	discard	R10: K=0.0090 (around 0.009)	agent1	branch_search	0	-0.000000
exp15324	4.80015937e-29	0.000000	0.000000	discard	cycle 120 u=0.0975	agent0	initial_cond	0	0.000000
exp15324	1.85120982e-18	0.002145	-0.000000	discard	R10: K=0.0091 (around 0.009)	agent1	branch_search	0	-0.000000
exp15325	2.68824537e-29	0.000000	0.000000	discard	cycle 120 u=0.0980	agent0	initial_cond	1	-0.000000
exp15325	5.16860359e-19	0.002192	-0.000000	discard	R10: K=0.0093 (around 0.009)	agent1	branch_search	1	-0.000000
exp15326	2.68824537e-29	0.000000	0.000000	discard	cycle 120 u=0.0980	agent0	initial_cond	0	-0.000000
exp15326	1.01321687e-18	0.002239	0.000000	discard	R10: K=0.0095 (around 0.009)	agent1	branch_search	0	-0.000000
exp15327	2.68824537e-29	0.000000	0.000000	discard	cycle 120 u=0.0980	agent0	initial_cond	1	-0.000000
exp15327	3.16050361e-17	0.002121	-0.000000	discard	R10: K=0.009 amp=0.05	agent1	perturbation	1	-0.000000
exp15328	6.16758073e-29	0.000000	0.000000	discard	cycle 120 u=0.0980	agent0	initial_cond	0	-0.000000
exp15328	5.43924810e-19	0.002121	-0.000000	discard	R10: K=0.009 amp=0.1	agent1	perturbation	0	-0.000000
exp15329	6.16758073e-29	0.000000	0.000000	discard	cycle 120 u=0.0980	agent0	initial_cond	0	-0.000000
exp15329	2.05770693e-18	0.002121	-0.000000	discard	R10: K=0.009 amp=0.15	agent1	perturbation	0	-0.000000
exp15330	6.16758073e-29	0.000000	0.000000	discard	cycle 120 u=0.0980	agent0	initial_cond	0	-0.000000
exp15330	5.22214165e-15	0.002121	-0.000000	discard	R10: K=0.009 amp=0.2	agent1	perturbation	0	-0.000000
exp15331	2.01926478e-29	0.000000	0.000000	discard	cycle 120 u=0.0980	agent0	initial_cond	0	0.000000
exp15331	2.08119200e-17	0.002121	-0.000000	discard	R10: K=0.009 amp=0.25	agent1	perturbation	0	-0.000000
exp15332	2.01926478e-29	0.000000	0.000000	discard	cycle 120 u=0.0980	agent0	initial_cond	1	0.000000
exp15333	2.01926478e-29	0.000000	0.000000	discard	cycle 120 u=0.0980	agent0	initial_cond	0	0.000000
exp15334	1.30310780e-28	0.000000	0.000000	discard	cycle 120 u=0.0980	agent0	initial_cond	1	-0.000000
exp15335	1.30310780e-28	0.000000	0.000000	discard	cycle 120 u=0.0980	agent0	initial_cond	0	-0.000000
exp15336	1.30310780e-28	0.000000	0.000000	discard	cycle 120 u=0.0980	agent0	initial_cond	0	-0.000000
exp15337	5.45343271e-29	0.000000	0.000000	discard	cycle 120 u=0.0982	agent0	initial_cond	0	-0.000000
exp15338	5.45343271e-29	0.000000	0.000000	discard	cycle 120 u=0.0982	agent0	initial_cond	0	-0.000000
exp15339	5.45343271e-29	0.000000	0.000000	discard	cycle 120 u=0.0982	agent0	initial_cond	1	-0.000000
exp15340	1.23429977e-28	0.000000	0.000000	discard	cycle 120 u=0.0982	agent0	initial_cond	0	0.000000
exp15341	1.23429977e-28	0.000000	0.000000	discard	cycle 120 u=0.0982	agent0	initial_cond	0	0.000000
exp15342	1.23429977e-28	0.000000	0.000000	discard	cycle 120 u=0.0982	agent0	initial_cond	0	0.000000
exp15343	1.88036672e-29	0.000000	0.000000	discard	cycle 120 u=0.0982	agent0	initial_cond	0	0.000000
exp15344	1.88036672e-29	0.000000	0.000000	discard	cycle 120 u=0.0982	agent0	initial_cond	1	0.000000
exp15345	1.88036672e-29	0.000000	0.000000	discard	cycle 120 u=0.0982	agent0	initial_cond	0	0.000000
exp15346	7.15245492e-19	0.001438	-0.000000	discard	Check: K=0.0061 u=0.0 amp=0.1	agent1	initial_cond	0	-0.000000
exp15347	1.91190259e-29	0.000000	-0.000000	discard	cycle 120 u=0.0982	agent0	initial_cond	1	0.000000
exp15348	1.05464738e-15	0.001438	-0.000000	discard	Check: K=0.0061 u=0.0 amp=0.2	agent1	initial_cond	0	-0.000000
exp15349	1.91190259e-29	0.000000	-0.000000	discard	cycle 120 u=0.0982	agent0	initial_cond	0	0.000000
exp15350	1.05508878e-15	0.001438	-0.000000	discard	Check: K=0.0061 u=0.0 amp=0.3	agent1	initial_cond	0	-0.000000
exp15351	1.91190259e-29	0.000000	-0.000000	discard	cycle 120 u=0.0982	agent0	initial_cond	0	0.000000
exp15352	5.74003335e-16	0.001438	-0.000000	discard	Check: K=0.0061 u=0.0 amp=0.44	agent1	initial_cond	1	-0.000000
exp15353	6.13049994e-29	0.000000	0.000000	discard	cycle 120 u=0.0985	agent0	initial_cond	0	0.000000
exp15354	3.64659294e-19	0.001438	-0.000000	discard	Check: K=0.0061 u=0.0 amp=0.5	agent1	initial_cond	0	-0.000000
exp15355	6.13049994e-29	0.000000	0.000000	discard	cycle 120 u=0.0985	agent0	initial_cond	0	0.000000
exp15356	6.13049994e-29	0.000000	0.000000	discard	cycle 120 u=0.0985	agent0	initial_cond	1	0.000000
exp15357	5.49750971e-29	0.000000	0.000000	discard	cycle 120 u=0.0985	agent0	initial_cond	0	0.000000
exp15358	5.49750971e-29	0.000000	0.000000	discard	cycle 120 u=0.0985	agent0	initial_cond	1	0.000000
exp15359	5.49750971e-29	0.000000	0.000000	discard	cycle 120 u=0.0985	agent0	initial_cond	0	0.000000
