exp_id	residual	solution_norm	solution_mean	status	description	agent	design	elapsed_s	solution_energy
exp2463	6.13049994e-29	0.000000	0.000000	discard	cycle 7 u=0.0985	agent0	initial_cond	1	0.000000
exp2464	6.13049994e-29	0.000000	0.000000	discard	cycle 7 u=0.0985	agent0	initial_cond	0	0.000000
exp2465	6.13049994e-29	0.000000	0.000000	discard	cycle 7 u=0.0985	agent0	initial_cond	0	0.000000
exp2466	5.49750971e-29	0.000000	0.000000	discard	cycle 7 u=0.0985	agent0	initial_cond	0	0.000000
exp2467	5.49750971e-29	0.000000	0.000000	discard	cycle 7 u=0.0985	agent0	initial_cond	0	0.000000
exp2468	5.49750971e-29	0.000000	0.000000	discard	cycle 7 u=0.0985	agent0	initial_cond	1	0.000000
exp2469	2.57581612e-16	1.001296	1.000019	discard	hunt branches u=0.5 amp=0.5 phase=1.0	agent1_mem	branch_search	1	-1.520844
exp2470	4.15642452e-29	0.000000	0.000000	discard	cycle 7 u=0.0985	agent0	initial_cond	0	0.000000
exp2471	2.71504491e-13	0.070535	-0.000000	discard	hunt branches u=-0.5 amp=0.5 phase=1.0	agent1_mem	branch_search	0	0.000099
exp2472	4.15642452e-29	0.000000	0.000000	discard	cycle 7 u=0.0985	agent0	initial_cond	0	0.000000
exp2472	8.12018975e-17	0.070535	0.000000	discard	hunt branches u=0.07 amp=0.5 phase=1.0	agent1_mem	branch_search	0	0.000099
exp2473	4.15642452e-29	0.000000	0.000000	discard	cycle 7 u=0.0985	agent0	initial_cond	0	0.000000
exp2473	3.23816494e-12	0.070535	-0.000000	discard	hunt branches u=-0.07 amp=0.5 phase=1.0	agent1_mem	branch_search	0	0.000099
exp2474	2.19292611e-29	0.000000	0.000000	discard	cycle 7 u=0.0985	agent0	initial_cond	0	-0.000000
exp2474	4.49695535e-16	0.070535	-0.000000	discard	hunt branches u=0.1 amp=0.5 phase=1.0	agent1_mem	branch_search	0	0.000099
exp2475	2.19292611e-29	0.000000	0.000000	discard	cycle 7 u=0.0985	agent0	initial_cond	1	-0.000000
exp2476	2.19292611e-29	0.000000	0.000000	discard	cycle 7 u=0.0985	agent0	initial_cond	0	-0.000000
exp2477	4.22491788e-29	0.000000	0.000000	discard	cycle 7 u=0.0990	agent0	initial_cond	0	-0.000000
exp2478	4.22491788e-29	0.000000	0.000000	discard	cycle 7 u=0.0990	agent0	initial_cond	1	-0.000000
exp2479	4.22491788e-29	0.000000	0.000000	discard	cycle 7 u=0.0990	agent0	initial_cond	0	-0.000000
exp2480	3.22245147e-29	0.000000	0.000000	discard	cycle 7 u=0.0990	agent0	initial_cond	1	0.000000
exp2481	3.22245147e-29	0.000000	0.000000	discard	cycle 7 u=0.0990	agent0	initial_cond	0	0.000000
exp2482	3.22245147e-29	0.000000	0.000000	discard	cycle 7 u=0.0990	agent0	initial_cond	0	0.000000
exp2483	4.50941488e-29	0.000000	-0.000000	discard	cycle 7 u=0.0990	agent0	initial_cond	1	0.000000
exp2484	4.50941488e-29	0.000000	-0.000000	discard	cycle 7 u=0.0990	agent0	initial_cond	0	0.000000
exp2485	4.50941488e-29	0.000000	-0.000000	discard	cycle 7 u=0.0990	agent0	initial_cond	1	0.000000
exp2486	4.88330883e-29	0.000000	-0.000000	discard	cycle 7 u=0.0990	agent0	initial_cond	0	0.000000
exp2487	4.88330883e-29	0.000000	-0.000000	discard	cycle 7 u=0.0990	agent0	initial_cond	0	0.000000
exp2488	4.88330883e-29	0.000000	-0.000000	discard	cycle 7 u=0.0990	agent0	initial_cond	1	0.000000
exp2489	5.74085541e-29	0.000000	-0.000000	discard	cycle 7 u=0.0995	agent0	initial_cond	0	0.000000
exp2490	5.74085541e-29	0.000000	-0.000000	discard	cycle 7 u=0.0995	agent0	initial_cond	0	0.000000
exp2491	5.74085541e-29	0.000000	-0.000000	discard	cycle 7 u=0.0995	agent0	initial_cond	0	0.000000
exp2492	1.54984578e-28	0.000000	0.000000	discard	cycle 7 u=0.0995	agent0	initial_cond	0	-0.000000
exp2493	1.54984578e-28	0.000000	0.000000	discard	cycle 7 u=0.0995	agent0	initial_cond	1	-0.000000
exp2494	1.54984578e-28	0.000000	0.000000	discard	cycle 7 u=0.0995	agent0	initial_cond	0	-0.000000
exp2495	1.60328418e-29	0.000000	-0.000000	discard	cycle 7 u=0.0995	agent0	initial_cond	0	-0.000000
exp2496	1.60328418e-29	0.000000	-0.000000	discard	cycle 7 u=0.0995	agent0	initial_cond	0	-0.000000
exp2497	1.60328418e-29	0.000000	-0.000000	discard	cycle 7 u=0.0995	agent0	initial_cond	0	-0.000000
exp2498	6.36660251e-25	0.000000	-0.000000	discard	4th branch test cos perturbation phase=0	agent1_mem	branch_search	1	0.000000
exp2499	7.34590618e-29	0.000000	0.000000	discard	cycle 7 u=0.0995	agent0	initial_cond	1	0.000000
exp2500	7.34590618e-29	0.000000	0.000000	discard	cycle 7 u=0.0995	agent0	initial_cond	0	0.000000
exp2501	7.34590618e-29	0.000000	0.000000	discard	cycle 7 u=0.0995	agent0	initial_cond	0	0.000000
exp2502	4.46546993e-29	0.000000	0.000000	discard	cycle 7 u=0.1000	agent0	initial_cond	0	-0.000000
exp2503	4.46546993e-29	0.000000	0.000000	discard	cycle 7 u=0.1000	agent0	initial_cond	0	-0.000000
exp2504	4.46546993e-29	0.000000	0.000000	discard	cycle 7 u=0.1000	agent0	initial_cond	1	-0.000000
exp2505	3.61068707e-11	1.002503	1.000218	discard	cycle 7 u=0.1000	agent0	initial_cond	0	-1.523848
exp2506	3.61068707e-11	1.002503	1.000218	discard	collapse zone 1 tol=7.0e-11	agent0	solver_param	0	-1.523848
exp2507	3.61068707e-11	1.002503	1.000218	discard	cycle 7 u=0.1000	agent0	initial_cond	0	-1.523848
exp2508	4.08106752e-29	0.000000	0.000000	discard	collapse zone 1 tol=6.0e-11	agent0	solver_param	1	-0.000000
exp2509	3.61068707e-11	1.002503	1.000218	discard	cycle 7 u=0.1000	agent0	initial_cond	0	-1.523848
exp2510	3.61068707e-11	1.002503	1.000218	discard	collapse zone 1 tol=5.5e-11	agent0	solver_param	0	-1.523848
exp2511	3.61068707e-11	1.002503	1.000218	discard	cycle 7 u=0.1000	agent0	initial_cond	0	-1.523848
exp2512	3.61068707e-11	1.002503	1.000218	discard	collapse zone 1 tol=5.0e-11	agent0	solver_param	0	-1.523848
exp2513	3.61068707e-11	1.002503	1.000218	discard	cycle 7 u=0.1000	agent0	initial_cond	1	-1.523848
exp2514	4.58623706e-29	0.000000	0.000000	discard	collapse zone 1 tol=4.5e-11	agent0	solver_param	1	-0.000000
exp2515	3.61068707e-11	1.002503	1.000218	discard	cycle 7 u=0.1000	agent0	initial_cond	0	-1.523848
exp2516	3.49958627e-11	1.002503	1.000218	discard	cycle 7 u=0.1000	agent0	initial_cond	1	-1.523848
exp2516	3.49958627e-11	1.002503	1.000218	discard	collapse zone 1 tol=3.5e-11	agent0	solver_param	1	-1.523848
exp2517	4.51432576e-12	1.002503	1.000218	discard	cycle 7 u=0.1000	agent0	initial_cond	0	-1.523848
exp2518	4.51432576e-12	1.002503	1.000218	discard	collapse zone 1 tol=3.0e-11	agent0	solver_param	0	-1.523848
exp2519	4.39794337e-29	0.000000	0.000000	discard	cycle 7 u=0.1000	agent0	initial_cond	0	-0.000000
exp2520	1.36727475e-28	0.000000	0.000000	discard	cycle 7 u=0.1050	agent0	initial_cond	1	-0.000000
exp2521	1.36727475e-28	0.000000	0.000000	discard	cycle 7 u=0.1050	agent0	initial_cond	0	-0.000000
exp2522	5.55111512e-17	1.001322	-1.000049	discard	PHASE_SWEEP mode=1 amp=0.10 phase=0.0 u=-1.03	agent1	memory	0	-1.520921
exp2522	1.36727475e-28	0.000000	0.000000	discard	cycle 7 u=0.1050	agent0	initial_cond	0	-0.000000
exp2523	5.55111512e-17	1.001322	-1.000049	discard	PHASE_SWEEP mode=1 amp=0.10 phase=0.1 u=-1.03	agent1	memory	0	-1.520921
exp2523	6.14461376e-29	0.000000	0.000000	discard	cycle 7 u=0.1050	agent0	initial_cond	0	-0.000000
exp2524	5.55111512e-17	1.001322	-1.000049	discard	PHASE_SWEEP mode=1 amp=0.10 phase=0.2 u=-1.03	agent1	memory	0	-1.520921
exp2524	6.14461376e-29	0.000000	0.000000	discard	cycle 7 u=0.1050	agent0	initial_cond	0	-0.000000
exp2525	5.55111512e-17	1.001322	-1.000049	discard	PHASE_SWEEP mode=1 amp=0.10 phase=0.3 u=-1.03	agent1	memory	1	-1.520921
exp2525	6.14461376e-29	0.000000	0.000000	discard	cycle 7 u=0.1050	agent0	initial_cond	1	-0.000000
exp2526	5.55111512e-17	1.001322	-1.000049	discard	PHASE_SWEEP mode=1 amp=0.10 phase=0.5 u=-1.03	agent1	memory	0	-1.520921
exp2526	1.75906666e-28	0.000000	0.000000	discard	cycle 7 u=0.1050	agent0	initial_cond	0	-0.000000
exp2527	5.55111512e-17	1.001322	-1.000049	discard	PHASE_SWEEP mode=1 amp=0.10 phase=1.0 u=-1.03	agent1	memory	0	-1.520921
exp2527	1.75906666e-28	0.000000	0.000000	discard	cycle 7 u=0.1050	agent0	initial_cond	0	-0.000000
exp2528	1.26176444e-13	1.001322	-1.000049	discard	PHASE_SWEEP mode=1 amp=0.10 phase=1.57 u=-1.03	agent1	memory	0	-1.520921
exp2528	1.75906666e-28	0.000000	0.000000	discard	cycle 7 u=0.1050	agent0	initial_cond	0	-0.000000
exp2529	1.14220180e-17	0.070278	-0.000000	discard	ultimate 4th branch 3modes tol=1e-16 maxit=1000	agent1_mem	solver_param	0	0.000097
exp2530	5.55111512e-17	1.001322	-1.000049	discard	PHASE_SWEEP mode=1 amp=0.10 phase=3.14 u=-1.03	agent1	memory	0	-1.520921
exp2530	1.11257917e-28	0.000000	0.000000	discard	cycle 7 u=0.1050	agent0	initial_cond	0	-0.000000
exp2531	7.85046229e-17	0.999980	-1.000010	discard	K_AMP_SWEEP mode=1 k_amp=0.2 u=-1.03	agent1	memory	1	-1.546820
exp2531	1.11257917e-28	0.000000	0.000000	discard	cycle 7 u=0.1050	agent0	initial_cond	1	-0.000000
exp2532	5.55111512e-17	1.001322	-1.000049	discard	K_AMP_SWEEP mode=1 k_amp=0.3 u=-1.03	agent1	memory	0	-1.520921
exp2532	1.11257917e-28	0.000000	0.000000	discard	cycle 7 u=0.1050	agent0	initial_cond	0	-0.000000
exp2533	7.21644966e-16	1.003257	-1.000154	discard	K_AMP_SWEEP mode=1 k_amp=0.4 u=-1.03	agent1	memory	1	-1.484921
exp2533	8.58580947e-29	0.000000	0.000000	discard	cycle 8 u=0.0975	agent0	initial_cond	1	0.000000
exp2534	9.06426646e-14	1.005811	-1.000371	discard	K_AMP_SWEEP mode=1 k_amp=0.5 u=-1.03	agent1	memory	0	-1.439065
exp2534	8.58580947e-29	0.000000	0.000000	discard	cycle 8 u=0.0975	agent0	initial_cond	0	0.000000
exp2535	5.55111512e-17	1.001322	-1.000049	discard	GRID i=1 u=-1.01 amp=.105	agent1	memory	0	-1.520921
exp2535	8.58580947e-29	0.000000	0.000000	discard	cycle 8 u=0.0975	agent0	initial_cond	0	0.000000
exp2536	4.77524979e-16	1.001322	-1.000049	discard	GRID i=2 u=-1.02 amp=.110	agent1	memory	1	-1.520921
exp2536	5.23962023e-29	0.000000	0.000000	discard	cycle 8 u=0.0975	agent0	initial_cond	1	0.000000
exp2537	5.55111512e-17	1.001322	-1.000049	discard	GRID i=3 u=-1.03 amp=.115	agent1	memory	0	-1.520921
exp2537	5.23962023e-29	0.000000	0.000000	discard	cycle 8 u=0.0975	agent0	initial_cond	0	0.000000
exp2538	5.23962023e-29	0.000000	0.000000	discard	cycle 8 u=0.0975	agent0	initial_cond	1	0.000000
exp2538	1.75541673e-16	1.001322	-1.000049	discard	GRID i=4 u=-1.04 amp=.120	agent1	memory	1	-1.520921
exp2539	4.77524979e-16	1.001322	-1.000049	discard	GRID i=5 u=-1.05 amp=.125	agent1	memory	0	-1.520921
exp2539	4.03266298e-29	0.000000	0.000000	discard	cycle 8 u=0.0975	agent0	initial_cond	0	0.000000
exp2540	1.75541673e-16	1.001322	-1.000049	discard	GRID i=6 u=-1.06 amp=.130	agent1	memory	0	-1.520921
exp2540	4.03266298e-29	0.000000	0.000000	discard	cycle 8 u=0.0975	agent0	initial_cond	0	0.000000
exp2541	crash	0	0	crash	cycle 8 u=0.0975	agent0	initial_cond	0	0
exp2541	1.75541673e-16	1.001322	-1.000049	discard	GRID i=7 u=-1.07 amp=.135	agent1	memory	0	-1.520921
exp2542	4.80015937e-29	0.000000	0.000000	discard	collapse zone 2 tol=4.0e-12	agent0	solver_param	0	0.000000
exp2543	crash	0	0	crash	cycle 8 u=0.0975	agent0	initial_cond	0	0
exp2543	6.13140706e-16	1.001322	-1.000049	discard	GRID i=8 u=-1.08 amp=.140	agent1	memory	0	-1.520921
exp2544	4.80015937e-29	0.000000	0.000000	discard	collapse zone 2 tol=3.8e-12	agent0	solver_param	0	0.000000
exp2545	crash	0	0	crash	cycle 8 u=0.0975	agent0	initial_cond	1	0
exp2546	1.20088981e-15	1.001322	-1.000049	discard	GRID i=9 u=-1.09 amp=.145	agent1	memory	1	-1.520921
exp2547	4.80015937e-29	0.000000	0.000000	discard	collapse zone 2 tol=3.5e-12	agent0	solver_param	1	0.000000
exp2548	crash	0	0	crash	cycle 8 u=0.0975	agent0	initial_cond	0	0
exp2549	2.51704969e-15	1.001322	-1.000049	discard	GRID i=10 u=-1.10 amp=.150	agent1	memory	0	-1.520921
exp2550	2.68824537e-29	0.000000	0.000000	discard	collapse zone 2 tol=3.3e-12	agent0	solver_param	0	-0.000000
exp2551	crash	0	0	crash	cycle 8 u=0.0980	agent0	initial_cond	0	0
exp2552	2.68824537e-29	0.000000	0.000000	discard	collapse zone 2 tol=3.1e-12	agent0	solver_param	1	-0.000000
exp2553	crash	0	0	crash	cycle 8 u=0.0980	agent0	initial_cond	1	0
exp2554	2.68824537e-29	0.000000	0.000000	discard	collapse zone 2 tol=3.0e-12	agent0	solver_param	0	-0.000000
exp2555	crash	0	0	crash	cycle 8 u=0.0980	agent0	initial_cond	0	0
exp2556	6.16758073e-29	0.000000	0.000000	discard	collapse zone 2 tol=2.9e-12	agent0	solver_param	0	-0.000000
exp2557	crash	0	0	crash	cycle 8 u=0.0980	agent0	initial_cond	1	0
exp2558	6.16758073e-29	0.000000	0.000000	discard	collapse zone 2 tol=2.8e-12	agent0	solver_param	1	-0.000000
exp2559	crash	0	0	crash	cycle 8 u=0.0980	agent0	initial_cond	0	0
exp2560	6.16758073e-29	0.000000	0.000000	discard	collapse zone 2 tol=2.7e-12	agent0	solver_param	0	-0.000000
exp2561	crash	0	0	crash	cycle 8 u=0.0980	agent0	initial_cond	0	0
exp2562	2.01926478e-29	0.000000	0.000000	discard	collapse zone 2 tol=2.6e-12	agent0	solver_param	1	0.000000
exp2563	1.34357540e-12	1.002503	1.000218	discard	cycle 8 u=0.0980	agent0	initial_cond	1	-1.523848
exp2564	2.01926478e-29	0.000000	0.000000	discard	collapse zone 2 tol=2.5e-12	agent0	solver_param	0	0.000000
exp2565	2.01926478e-29	0.000000	0.000000	discard	cycle 8 u=0.0980	agent0	initial_cond	0	0.000000
exp2566	2.01926478e-29	0.000000	0.000000	discard	cycle 8 u=0.0980	agent0	initial_cond	1	0.000000
exp2567	1.30310780e-28	0.000000	0.000000	discard	cycle 8 u=0.0980	agent0	initial_cond	0	-0.000000
exp2568	1.30310780e-28	0.000000	0.000000	discard	cycle 8 u=0.0980	agent0	initial_cond	0	-0.000000
exp2569	1.30310780e-28	0.000000	0.000000	discard	cycle 8 u=0.0980	agent0	initial_cond	0	-0.000000
exp2570	5.45343271e-29	0.000000	0.000000	discard	cycle 8 u=0.0982	agent0	initial_cond	0	-0.000000
exp2571	5.45343271e-29	0.000000	0.000000	discard	cycle 8 u=0.0982	agent0	initial_cond	1	-0.000000
exp2572	5.45343271e-29	0.000000	0.000000	discard	cycle 8 u=0.0982	agent0	initial_cond	0	-0.000000
exp2573	1.23429977e-28	0.000000	0.000000	discard	cycle 8 u=0.0982	agent0	initial_cond	0	0.000000
exp2574	1.23429977e-28	0.000000	0.000000	discard	cycle 8 u=0.0982	agent0	initial_cond	1	0.000000
exp2575	1.23429977e-28	0.000000	0.000000	discard	cycle 8 u=0.0982	agent0	initial_cond	0	0.000000
exp2576	1.88036672e-29	0.000000	0.000000	discard	cycle 8 u=0.0982	agent0	initial_cond	1	0.000000
exp2577	1.88036672e-29	0.000000	0.000000	discard	cycle 8 u=0.0982	agent0	initial_cond	0	0.000000
exp2578	1.88036672e-29	0.000000	0.000000	discard	cycle 8 u=0.0982	agent0	initial_cond	0	0.000000
exp2579	1.91190259e-29	0.000000	-0.000000	discard	cycle 8 u=0.0982	agent0	initial_cond	1	0.000000
exp2580	1.91190259e-29	0.000000	-0.000000	discard	cycle 8 u=0.0982	agent0	initial_cond	0	0.000000
exp2581	1.91190259e-29	0.000000	-0.000000	discard	cycle 8 u=0.0982	agent0	initial_cond	0	0.000000
exp2582	6.13049994e-29	0.000000	0.000000	discard	cycle 8 u=0.0985	agent0	initial_cond	0	0.000000
exp2583	6.13049994e-29	0.000000	0.000000	discard	cycle 8 u=0.0985	agent0	initial_cond	0	0.000000
exp2584	6.13049994e-29	0.000000	0.000000	discard	cycle 8 u=0.0985	agent0	initial_cond	1	0.000000
exp2585	5.49750971e-29	0.000000	0.000000	discard	cycle 8 u=0.0985	agent0	initial_cond	0	0.000000
exp2586	5.49750971e-29	0.000000	0.000000	discard	cycle 8 u=0.0985	agent0	initial_cond	0	0.000000
exp2587	5.49750971e-29	0.000000	0.000000	discard	cycle 8 u=0.0985	agent0	initial_cond	1	0.000000
exp2588	4.15642452e-29	0.000000	0.000000	discard	verify positive r=1	agent0	solver_param	0	0.000000
exp2589	4.15642452e-29	0.000000	0.000000	discard	cycle 8 u=0.0985	agent0	initial_cond	0	0.000000
exp2590	4.15642452e-29	0.000000	0.000000	discard	verify positive r=2	agent0	solver_param	0	0.000000
exp2591	4.15642452e-29	0.000000	0.000000	discard	cycle 8 u=0.0985	agent0	initial_cond	1	0.000000
exp2592	4.15642452e-29	0.000000	0.000000	discard	verify positive r=3	agent0	solver_param	0	0.000000
exp2593	4.15642452e-29	0.000000	0.000000	discard	cycle 8 u=0.0985	agent0	initial_cond	0	0.000000
exp2594	2.19292611e-29	0.000000	0.000000	discard	cycle 8 u=0.0985	agent0	initial_cond	0	-0.000000
exp2595	1.24126708e-16	0.999525	-1.000003	discard	K_AMP_FINE k_amp=0.15	agent1	memory	0	-1.555923
exp2596	2.19292611e-29	0.000000	0.000000	discard	cycle 8 u=0.0985	agent0	initial_cond	1	-0.000000
exp2597	2.77555756e-16	0.999781	-1.000006	discard	K_AMP_FINE k_amp=0.18	agent1	memory	0	-1.550771
exp2598	2.19292611e-29	0.000000	0.000000	discard	cycle 8 u=0.0985	agent0	initial_cond	0	-0.000000
exp2599	1.75541673e-16	0.999878	-1.000008	discard	K_AMP_FINE k_amp=0.19	agent1	memory	0	-1.548847
exp2600	4.22491788e-29	0.000000	0.000000	discard	cycle 8 u=0.0990	agent0	initial_cond	0	-0.000000
exp2601	7.85046229e-17	0.999980	-1.000010	discard	K_AMP_FINE k_amp=0.20	agent1	memory	1	-1.546820
exp2602	4.22491788e-29	0.000000	0.000000	discard	cycle 8 u=0.0990	agent0	initial_cond	0	-0.000000
exp2603	7.85046229e-17	1.000088	-1.000012	discard	K_AMP_FINE k_amp=0.21	agent1	memory	0	-1.544691
exp2604	4.22491788e-29	0.000000	0.000000	discard	cycle 8 u=0.0990	agent0	initial_cond	0	-0.000000
exp2605	1.11022302e-16	1.000202	-1.000014	discard	K_AMP_FINE k_amp=0.22	agent1	memory	0	-1.542458
exp2606	3.22245147e-29	0.000000	0.000000	discard	cycle 8 u=0.0990	agent0	initial_cond	1	0.000000
exp2607	5.55111512e-17	1.000579	-1.000024	discard	K_AMP_FINE k_amp=0.25	agent1	memory	0	-1.535146
exp2608	3.22245147e-29	0.000000	0.000000	discard	cycle 8 u=0.0990	agent0	initial_cond	0	0.000000
exp2609	7.85046229e-17	0.999980	-1.000010	discard	K_AMP=0.2 mode=1 u=-1.03	agent1	memory	0	-1.546820
exp2610	3.22245147e-29	0.000000	0.000000	discard	cycle 8 u=0.0990	agent0	initial_cond	0	0.000000
exp2611	1.89231512e-12	0.999975	-1.000005	discard	K_AMP=0.2 mode=2 u=-1.03	agent1	memory	1	-1.546820
exp2612	4.50941488e-29	0.000000	-0.000000	discard	cycle 8 u=0.0990	agent0	initial_cond	1	0.000000
exp2613	1.50000166e-12	0.999975	-1.000004	discard	K_AMP=0.2 mode=3 u=-1.03	agent1	memory	0	-1.546805
exp2614	4.50941488e-29	0.000000	-0.000000	discard	cycle 8 u=0.0990	agent0	initial_cond	0	0.000000
exp2615	7.85046229e-17	0.999980	-1.000010	discard	ULTIMATE_BEST trial=1	agent1	memory	0	-1.546820
exp2616	4.50941488e-29	0.000000	-0.000000	discard	cycle 8 u=0.0990	agent0	initial_cond	1	0.000000
exp2617	7.85046229e-17	0.999980	-1.000010	discard	ULTIMATE_BEST trial=2	agent1	memory	1	-1.546820
exp2618	4.88330883e-29	0.000000	-0.000000	discard	cycle 8 u=0.0990	agent0	initial_cond	0	0.000000
exp2619	7.85046229e-17	0.999980	-1.000010	discard	ULTIMATE_BEST trial=3	agent1	memory	0	-1.546820
exp2620	4.88330883e-29	0.000000	-0.000000	discard	cycle 8 u=0.0990	agent0	initial_cond	0	0.000000
exp2621	7.85046229e-17	0.999980	-1.000010	discard	ULTIMATE_BEST trial=4	agent1	memory	0	-1.546820
exp2622	4.88330883e-29	0.000000	-0.000000	discard	cycle 8 u=0.0990	agent0	initial_cond	1	0.000000
exp2623	7.85046229e-17	0.999980	-1.000010	discard	ULTIMATE_BEST trial=5	agent1	memory	0	-1.546820
exp2624	5.74085541e-29	0.000000	-0.000000	discard	cycle 8 u=0.0995	agent0	initial_cond	0	0.000000
exp2625	5.74085541e-29	0.000000	-0.000000	discard	cycle 8 u=0.0995	agent0	initial_cond	0	0.000000
exp2626	5.74085541e-29	0.000000	-0.000000	discard	cycle 8 u=0.0995	agent0	initial_cond	0	0.000000
exp2627	1.54984578e-28	0.000000	0.000000	discard	cycle 8 u=0.0995	agent0	initial_cond	0	-0.000000
exp2628	1.54984578e-28	0.000000	0.000000	discard	cycle 8 u=0.0995	agent0	initial_cond	1	-0.000000
exp2629	1.54984578e-28	0.000000	0.000000	discard	cycle 8 u=0.0995	agent0	initial_cond	0	-0.000000
exp2630	1.60328418e-29	0.000000	-0.000000	discard	cycle 8 u=0.0995	agent0	initial_cond	0	-0.000000
exp2631	1.60328418e-29	0.000000	-0.000000	discard	cycle 8 u=0.0995	agent0	initial_cond	1	-0.000000
exp2632	1.60328418e-29	0.000000	-0.000000	discard	cycle 8 u=0.0995	agent0	initial_cond	0	-0.000000
exp2633	7.34590618e-29	0.000000	0.000000	discard	cycle 8 u=0.0995	agent0	initial_cond	1	0.000000
exp2634	7.34590618e-29	0.000000	0.000000	discard	cycle 8 u=0.0995	agent0	initial_cond	0	0.000000
exp2635	5.90447763e-09	1.002503	1.000218	discard	cycle 8 u=0.0995	agent0	initial_cond	0	-1.523848
exp2636	5.90447763e-09	1.002503	1.000218	discard	recover positive n=50 tol=1e-8	agent0	branch_search	0	-1.523848
exp2637	4.46546993e-29	0.000000	0.000000	discard	cycle 8 u=0.1000	agent0	initial_cond	1	-0.000000
exp2638	4.46546993e-29	0.000000	0.000000	discard	cycle 8 u=0.1000	agent0	initial_cond	0	-0.000000
exp2639	4.46546993e-29	0.000000	0.000000	discard	cycle 8 u=0.1000	agent0	initial_cond	0	-0.000000
exp2640	4.08106752e-29	0.000000	0.000000	discard	cycle 8 u=0.1000	agent0	initial_cond	0	-0.000000
exp2641	4.08106752e-29	0.000000	0.000000	discard	cycle 8 u=0.1000	agent0	initial_cond	0	-0.000000
exp2642	4.08106752e-29	0.000000	0.000000	discard	cycle 8 u=0.1000	agent0	initial_cond	1	-0.000000
exp2643	4.58623706e-29	0.000000	0.000000	discard	cycle 8 u=0.1000	agent0	initial_cond	0	-0.000000
exp2644	4.58623706e-29	0.000000	0.000000	discard	cycle 8 u=0.1000	agent0	initial_cond	0	-0.000000
exp2645	4.58623706e-29	0.000000	0.000000	discard	cycle 8 u=0.1000	agent0	initial_cond	0	-0.000000
exp2646	4.39794337e-29	0.000000	0.000000	discard	cycle 8 u=0.1000	agent0	initial_cond	0	-0.000000
exp2647	4.39794337e-29	0.000000	0.000000	discard	cycle 8 u=0.1000	agent0	initial_cond	1	-0.000000
exp2648	4.39794337e-29	0.000000	0.000000	discard	cycle 8 u=0.1000	agent0	initial_cond	0	-0.000000
exp2649	1.36727475e-28	0.000000	0.000000	discard	cycle 8 u=0.1050	agent0	initial_cond	0	-0.000000
exp2650	1.36727475e-28	0.000000	0.000000	discard	cycle 8 u=0.1050	agent0	initial_cond	1	-0.000000
exp2651	1.36727475e-28	0.000000	0.000000	discard	cycle 8 u=0.1050	agent0	initial_cond	0	-0.000000
exp2652	6.14461376e-29	0.000000	0.000000	discard	cycle 8 u=0.1050	agent0	initial_cond	1	-0.000000
exp2653	6.14461376e-29	0.000000	0.000000	discard	cycle 8 u=0.1050	agent0	initial_cond	0	-0.000000
exp2654	6.14461376e-29	0.000000	0.000000	discard	cycle 8 u=0.1050	agent0	initial_cond	0	-0.000000
exp2655	1.75906666e-28	0.000000	0.000000	discard	cycle 8 u=0.1050	agent0	initial_cond	1	-0.000000
exp2656	1.75906666e-28	0.000000	0.000000	discard	cycle 8 u=0.1050	agent0	initial_cond	0	-0.000000
exp2657	1.75906666e-28	0.000000	0.000000	discard	cycle 8 u=0.1050	agent0	initial_cond	0	-0.000000
