exp_id	residual	solution_norm	solution_mean	status	description	agent	design	elapsed_s	solution_energy
exp8727	1.91190259e-29	0.000000	-0.000000	discard	cycle 61 u=0.0982	agent0	initial_cond	1	0.000000
exp8727	4.70823918e-17	0.070278	-0.000000	discard	3D phase u=0.242 amp=0.46 phase=1.0	manual	memory	1	0.000097
exp8728	6.13049994e-29	0.000000	0.000000	discard	cycle 61 u=0.0985	agent0	initial_cond	0	0.000000
exp8729	2.70557003e-17	0.070278	-0.000000	discard	3D phase u=0.238 amp=0.44 phase=1.1	manual	memory	0	0.000097
exp8730	6.13049994e-29	0.000000	0.000000	discard	cycle 61 u=0.0985	agent0	initial_cond	0	0.000000
exp8731	2.21493602e-17	0.070278	-0.000000	discard	3D phase u=0.238 amp=0.45 phase=1.1	manual	memory	1	0.000097
exp8732	6.13049994e-29	0.000000	0.000000	discard	cycle 61 u=0.0985	agent0	initial_cond	1	0.000000
exp8733	4.14693429e-17	0.070278	-0.000000	discard	3D phase u=0.238 amp=0.46 phase=1.1	manual	memory	0	0.000097
exp8733	5.49750971e-29	0.000000	0.000000	discard	cycle 61 u=0.0985	agent0	initial_cond	0	0.000000
exp8734	5.49750971e-29	0.000000	0.000000	discard	cycle 61 u=0.0985	agent0	initial_cond	0	0.000000
exp8734	5.58970903e-17	0.070278	-0.000000	discard	3D phase u=0.239 amp=0.44 phase=1.1	manual	memory	0	0.000097
exp8735	5.49750971e-29	0.000000	0.000000	discard	cycle 61 u=0.0985	agent0	initial_cond	0	0.000000
exp8736	1.61698577e-17	0.070278	-0.000000	discard	3D phase u=0.239 amp=0.45 phase=1.1	manual	memory	0	0.000097
exp8737	4.15642452e-29	0.000000	0.000000	discard	cycle 61 u=0.0985	agent0	initial_cond	0	0.000000
exp8738	2.43412907e-17	0.070278	-0.000000	discard	3D phase u=0.239 amp=0.46 phase=1.1	manual	memory	0	0.000097
exp8739	4.15642452e-29	0.000000	0.000000	discard	cycle 61 u=0.0985	agent0	initial_cond	1	0.000000
exp8740	2.52915795e-17	0.070278	-0.000000	discard	3D phase u=0.240 amp=0.44 phase=1.1	manual	memory	0	0.000097
exp8741	4.15642452e-29	0.000000	0.000000	discard	cycle 61 u=0.0985	agent0	initial_cond	0	0.000000
exp8742	3.04548422e-17	0.070278	-0.000000	discard	3D phase u=0.240 amp=0.45 phase=1.1	manual	memory	0	0.000097
exp8742	2.19292611e-29	0.000000	0.000000	discard	cycle 61 u=0.0985	agent0	initial_cond	0	-0.000000
exp8743	2.19292611e-29	0.000000	0.000000	discard	cycle 61 u=0.0985	agent0	initial_cond	0	-0.000000
exp8744	2.35374840e-17	0.070278	-0.000000	discard	3D phase u=0.240 amp=0.46 phase=1.1	manual	memory	0	0.000097
exp8745	2.19292611e-29	0.000000	0.000000	discard	cycle 61 u=0.0985	agent0	initial_cond	0	-0.000000
exp8746	4.31390923e-17	0.070278	-0.000000	discard	3D phase u=0.241 amp=0.44 phase=1.1	manual	memory	0	0.000097
exp8747	4.22491788e-29	0.000000	0.000000	discard	cycle 61 u=0.0990	agent0	initial_cond	1	-0.000000
exp8748	2.56901335e-17	0.070278	-0.000000	discard	3D phase u=0.241 amp=0.45 phase=1.1	manual	memory	0	0.000097
exp8749	4.22491788e-29	0.000000	0.000000	discard	cycle 61 u=0.0990	agent0	initial_cond	0	-0.000000
exp8750	5.89393814e-17	0.070278	-0.000000	discard	3D phase u=0.241 amp=0.46 phase=1.1	manual	memory	0	0.000097
exp8750	4.22491788e-29	0.000000	0.000000	discard	cycle 61 u=0.0990	agent0	initial_cond	0	-0.000000
exp8751	3.22245147e-29	0.000000	0.000000	discard	cycle 61 u=0.0990	agent0	initial_cond	1	0.000000
exp8751	3.78227330e-17	0.070278	-0.000000	discard	3D phase u=0.242 amp=0.44 phase=1.1	manual	memory	0	0.000097
exp8752	3.22245147e-29	0.000000	0.000000	discard	cycle 61 u=0.0990	agent0	initial_cond	0	0.000000
exp8753	3.99019737e-17	0.070278	-0.000000	discard	3D phase u=0.242 amp=0.45 phase=1.1	manual	memory	0	0.000097
exp8754	3.22245147e-29	0.000000	0.000000	discard	cycle 61 u=0.0990	agent0	initial_cond	1	0.000000
exp8755	1.81368447e-17	0.070278	-0.000000	discard	3D phase u=0.242 amp=0.46 phase=1.1	manual	memory	1	0.000097
exp8756	4.50941488e-29	0.000000	-0.000000	discard	cycle 61 u=0.0990	agent0	initial_cond	0	0.000000
exp8757	4.47270536e-17	0.070278	-0.000000	discard	3D phase u=0.238 amp=0.44 phase=1.2	manual	memory	0	0.000097
exp8757	4.50941488e-29	0.000000	-0.000000	discard	cycle 61 u=0.0990	agent0	initial_cond	0	0.000000
exp8758	4.50941488e-29	0.000000	-0.000000	discard	cycle 61 u=0.0990	agent0	initial_cond	1	0.000000
exp8758	3.20961567e-17	0.070278	0.000000	discard	3D phase u=0.238 amp=0.45 phase=1.2	manual	memory	1	0.000097
exp8759	4.88330883e-29	0.000000	-0.000000	discard	cycle 61 u=0.0990	agent0	initial_cond	0	0.000000
exp8760	3.76619022e-17	0.070278	-0.000000	discard	3D phase u=0.238 amp=0.46 phase=1.2	manual	memory	0	0.000097
exp8761	4.88330883e-29	0.000000	-0.000000	discard	cycle 61 u=0.0990	agent0	initial_cond	0	0.000000
exp8762	2.63449220e-17	0.070278	-0.000000	discard	3D phase u=0.239 amp=0.44 phase=1.2	manual	memory	1	0.000097
exp8763	4.88330883e-29	0.000000	-0.000000	discard	cycle 61 u=0.0990	agent0	initial_cond	0	0.000000
exp8764	1.50350097e-17	0.070278	-0.000000	discard	3D phase u=0.239 amp=0.45 phase=1.2	manual	memory	0	0.000097
exp8765	5.74085541e-29	0.000000	-0.000000	discard	cycle 61 u=0.0995	agent0	initial_cond	0	0.000000
exp8766	5.74085541e-29	0.000000	-0.000000	discard	cycle 61 u=0.0995	agent0	initial_cond	1	0.000000
exp8766	3.55165445e-17	0.070278	-0.000000	discard	3D phase u=0.239 amp=0.46 phase=1.2	manual	memory	1	0.000097
exp8767	5.74085541e-29	0.000000	-0.000000	discard	cycle 61 u=0.0995	agent0	initial_cond	0	0.000000
exp8768	1.01222764e-17	0.070278	-0.000000	discard	3D phase u=0.240 amp=0.44 phase=1.2	manual	memory	0	0.000097
exp8769	1.54984578e-28	0.000000	0.000000	discard	cycle 61 u=0.0995	agent0	initial_cond	0	-0.000000
exp8770	2.67856147e-17	0.070278	-0.000000	discard	3D phase u=0.240 amp=0.45 phase=1.2	manual	memory	1	0.000097
exp8771	1.54984578e-28	0.000000	0.000000	discard	cycle 61 u=0.0995	agent0	initial_cond	0	-0.000000
exp8772	2.56982081e-17	0.070278	-0.000000	discard	3D phase u=0.240 amp=0.46 phase=1.2	manual	memory	0	0.000097
exp8773	1.54984578e-28	0.000000	0.000000	discard	cycle 61 u=0.0995	agent0	initial_cond	0	-0.000000
exp8774	9.36536466e-17	0.070278	-0.000000	discard	3D phase u=0.241 amp=0.44 phase=1.2	manual	memory	1	0.000097
exp8774	1.60328418e-29	0.000000	-0.000000	discard	cycle 61 u=0.0995	agent0	initial_cond	1	-0.000000
exp8775	1.60328418e-29	0.000000	-0.000000	discard	cycle 61 u=0.0995	agent0	initial_cond	0	-0.000000
exp8775	2.07979355e-17	0.070278	-0.000000	discard	3D phase u=0.241 amp=0.45 phase=1.2	manual	memory	0	0.000097
exp8776	1.60328418e-29	0.000000	-0.000000	discard	cycle 61 u=0.0995	agent0	initial_cond	0	-0.000000
exp8777	2.09682030e-17	0.070278	-0.000000	discard	3D phase u=0.241 amp=0.46 phase=1.2	manual	memory	1	0.000097
exp8778	7.34590618e-29	0.000000	0.000000	discard	cycle 61 u=0.0995	agent0	initial_cond	1	0.000000
exp8779	3.22381434e-17	0.070278	-0.000000	discard	3D phase u=0.242 amp=0.44 phase=1.2	manual	memory	0	0.000097
exp8780	7.34590618e-29	0.000000	0.000000	discard	cycle 61 u=0.0995	agent0	initial_cond	0	0.000000
exp8781	7.15119071e-18	0.070278	-0.000000	discard	3D phase u=0.242 amp=0.45 phase=1.2	manual	memory	0	0.000097
exp8781	7.34590618e-29	0.000000	0.000000	discard	cycle 61 u=0.0995	agent0	initial_cond	1	0.000000
exp8782	4.46546993e-29	0.000000	0.000000	discard	cycle 61 u=0.1000	agent0	initial_cond	0	-0.000000
exp8782	4.93137771e-17	0.070278	-0.000000	discard	3D phase u=0.242 amp=0.46 phase=1.2	manual	memory	0	0.000097
exp8783	4.46546993e-29	0.000000	0.000000	discard	cycle 61 u=0.1000	agent0	initial_cond	0	-0.000000
exp8784	4.46546993e-29	0.000000	0.000000	discard	cycle 61 u=0.1000	agent0	initial_cond	1	-0.000000
exp8785	4.08106752e-29	0.000000	0.000000	discard	cycle 61 u=0.1000	agent0	initial_cond	0	-0.000000
exp8786	4.08106752e-29	0.000000	0.000000	discard	cycle 61 u=0.1000	agent0	initial_cond	0	-0.000000
exp8787	4.08106752e-29	0.000000	0.000000	discard	cycle 61 u=0.1000	agent0	initial_cond	0	-0.000000
exp8788	4.58623706e-29	0.000000	0.000000	discard	cycle 61 u=0.1000	agent0	initial_cond	0	-0.000000
exp8789	4.58623706e-29	0.000000	0.000000	discard	cycle 61 u=0.1000	agent0	initial_cond	1	-0.000000
exp8790	4.58623706e-29	0.000000	0.000000	discard	cycle 61 u=0.1000	agent0	initial_cond	0	-0.000000
exp8791	4.39794337e-29	0.000000	0.000000	discard	cycle 61 u=0.1000	agent0	initial_cond	0	-0.000000
exp8792	4.39794337e-29	0.000000	0.000000	discard	cycle 61 u=0.1000	agent0	initial_cond	1	-0.000000
exp8793	4.39794337e-29	0.000000	0.000000	discard	cycle 61 u=0.1000	agent0	initial_cond	0	-0.000000
exp8794	1.36727475e-28	0.000000	0.000000	discard	cycle 61 u=0.1050	agent0	initial_cond	1	-0.000000
exp8795	1.36727475e-28	0.000000	0.000000	discard	cycle 61 u=0.1050	agent0	initial_cond	0	-0.000000
exp8796	1.36727475e-28	0.000000	0.000000	discard	cycle 61 u=0.1050	agent0	initial_cond	0	-0.000000
exp8797	6.14461376e-29	0.000000	0.000000	discard	cycle 61 u=0.1050	agent0	initial_cond	1	-0.000000
exp8798	6.14461376e-29	0.000000	0.000000	discard	cycle 61 u=0.1050	agent0	initial_cond	0	-0.000000
exp8799	6.14461376e-29	0.000000	0.000000	discard	cycle 61 u=0.1050	agent0	initial_cond	0	-0.000000
exp8800	1.75906666e-28	0.000000	0.000000	discard	cycle 61 u=0.1050	agent0	initial_cond	0	-0.000000
exp8801	1.75906666e-28	0.000000	0.000000	discard	cycle 61 u=0.1050	agent0	initial_cond	0	-0.000000
exp8802	1.75906666e-28	0.000000	0.000000	discard	cycle 61 u=0.1050	agent0	initial_cond	1	-0.000000
exp8803	1.11257917e-28	0.000000	0.000000	discard	cycle 61 u=0.1050	agent0	initial_cond	0	-0.000000
exp8804	1.11257917e-28	0.000000	0.000000	discard	cycle 61 u=0.1050	agent0	initial_cond	0	-0.000000
exp8805	1.11257917e-28	0.000000	0.000000	discard	cycle 61 u=0.1050	agent0	initial_cond	0	-0.000000
exp8806	8.58580947e-29	0.000000	0.000000	discard	cycle 62 u=0.0975	agent0	initial_cond	0	0.000000
exp8807	7.36488554e-17	0.070278	0.000000	discard	3D fine u=0.240 amp=0.44 phase=1.15	manual	memory	1	0.000097
exp8807	8.58580947e-29	0.000000	0.000000	discard	cycle 62 u=0.0975	agent0	initial_cond	1	0.000000
exp8808	8.58580947e-29	0.000000	0.000000	discard	cycle 62 u=0.0975	agent0	initial_cond	0	0.000000
exp8808	5.50874358e-17	0.070278	-0.000000	discard	3D fine u=0.240 amp=0.44 phase=1.17	manual	memory	0	0.000097
exp8809	5.23962023e-29	0.000000	0.000000	discard	cycle 62 u=0.0975	agent0	initial_cond	0	0.000000
exp8810	1.01222764e-17	0.070278	-0.000000	discard	3D fine u=0.240 amp=0.44 phase=1.20	manual	memory	1	0.000097
exp8811	5.23962023e-29	0.000000	0.000000	discard	cycle 62 u=0.0975	agent0	initial_cond	1	0.000000
exp8812	6.85940427e-17	0.070278	0.000000	discard	3D fine u=0.240 amp=0.44 phase=1.23	manual	memory	0	0.000097
exp8813	5.23962023e-29	0.000000	0.000000	discard	cycle 62 u=0.0975	agent0	initial_cond	0	0.000000
exp8814	4.03266298e-29	0.000000	0.000000	discard	cycle 62 u=0.0975	agent0	initial_cond	1	0.000000
exp8814	3.62338692e-17	0.070278	-0.000000	discard	3D fine u=0.240 amp=0.44 phase=1.25	manual	memory	1	0.000097
exp8815	4.03266298e-29	0.000000	0.000000	discard	cycle 62 u=0.0975	agent0	initial_cond	0	0.000000
exp8816	2.21638820e-17	0.070278	-0.000000	discard	3D fine u=0.240 amp=0.45 phase=1.15	manual	memory	0	0.000097
exp8817	4.03266298e-29	0.000000	0.000000	discard	cycle 62 u=0.0975	agent0	initial_cond	0	0.000000
exp8818	4.45718157e-17	0.070278	-0.000000	discard	3D fine u=0.240 amp=0.45 phase=1.17	manual	memory	1	0.000097
exp8819	4.80015937e-29	0.000000	0.000000	discard	cycle 62 u=0.0975	agent0	initial_cond	1	0.000000
exp8820	2.67856147e-17	0.070278	-0.000000	discard	3D fine u=0.240 amp=0.45 phase=1.20	manual	memory	0	0.000097
exp8820	4.80015937e-29	0.000000	0.000000	discard	cycle 62 u=0.0975	agent0	initial_cond	0	0.000000
exp8821	4.80015937e-29	0.000000	0.000000	discard	cycle 62 u=0.0975	agent0	initial_cond	0	0.000000
exp8822	2.29905112e-17	0.070278	-0.000000	discard	3D fine u=0.240 amp=0.45 phase=1.23	manual	memory	1	0.000097
exp8823	2.68824537e-29	0.000000	0.000000	discard	cycle 62 u=0.0980	agent0	initial_cond	0	-0.000000
exp8824	3.42443899e-17	0.070278	-0.000000	discard	3D fine u=0.240 amp=0.45 phase=1.25	manual	memory	0	0.000097
exp8825	2.68824537e-29	0.000000	0.000000	discard	cycle 62 u=0.0980	agent0	initial_cond	0	-0.000000
exp8826	9.16708844e-18	0.070278	-0.000000	discard	3D fine u=0.240 amp=0.46 phase=1.15	manual	memory	1	0.000097
exp8827	2.68824537e-29	0.000000	0.000000	discard	cycle 62 u=0.0980	agent0	initial_cond	1	-0.000000
exp8828	6.16758073e-29	0.000000	0.000000	discard	cycle 62 u=0.0980	agent0	initial_cond	0	-0.000000
exp8828	1.36073949e-17	0.070278	-0.000000	discard	3D fine u=0.240 amp=0.46 phase=1.17	manual	memory	0	0.000097
exp8829	6.16758073e-29	0.000000	0.000000	discard	cycle 62 u=0.0980	agent0	initial_cond	0	-0.000000
exp8830	2.56982081e-17	0.070278	-0.000000	discard	3D fine u=0.240 amp=0.46 phase=1.20	manual	memory	1	0.000097
exp8831	6.16758073e-29	0.000000	0.000000	discard	cycle 62 u=0.0980	agent0	initial_cond	1	-0.000000
exp8832	2.27762580e-17	0.070278	-0.000000	discard	3D fine u=0.240 amp=0.46 phase=1.23	manual	memory	0	0.000097
exp8833	2.01926478e-29	0.000000	0.000000	discard	cycle 62 u=0.0980	agent0	initial_cond	0	0.000000
exp8834	2.72334887e-17	0.070278	-0.000000	discard	3D fine u=0.240 amp=0.46 phase=1.25	manual	memory	0	0.000097
exp8834	2.01926478e-29	0.000000	0.000000	discard	cycle 62 u=0.0980	agent0	initial_cond	1	0.000000
exp8835	2.01926478e-29	0.000000	0.000000	discard	cycle 62 u=0.0980	agent0	initial_cond	0	0.000000
exp8836	2.36910350e-17	0.070278	-0.000000	discard	3D fine u=0.241 amp=0.44 phase=1.15	manual	memory	0	0.000097
exp8837	1.30310780e-28	0.000000	0.000000	discard	cycle 62 u=0.0980	agent0	initial_cond	0	-0.000000
exp8838	2.41909943e-17	0.070278	-0.000000	discard	3D fine u=0.241 amp=0.44 phase=1.17	manual	memory	1	0.000097
exp8839	1.30310780e-28	0.000000	0.000000	discard	cycle 62 u=0.0980	agent0	initial_cond	1	-0.000000
exp8840	9.36536466e-17	0.070278	-0.000000	discard	3D fine u=0.241 amp=0.44 phase=1.20	manual	memory	0	0.000097
exp8841	1.30310780e-28	0.000000	0.000000	discard	cycle 62 u=0.0980	agent0	initial_cond	0	-0.000000
exp8842	5.45343271e-29	0.000000	0.000000	discard	cycle 62 u=0.0982	agent0	initial_cond	0	-0.000000
exp8842	1.55766537e-17	0.070278	-0.000000	discard	3D fine u=0.241 amp=0.44 phase=1.23	manual	memory	0	0.000097
exp8843	5.45343271e-29	0.000000	0.000000	discard	cycle 62 u=0.0982	agent0	initial_cond	0	-0.000000
exp8844	3.99987561e-17	0.070278	-0.000000	discard	3D fine u=0.241 amp=0.44 phase=1.25	manual	memory	0	0.000097
exp8845	5.45343271e-29	0.000000	0.000000	discard	cycle 62 u=0.0982	agent0	initial_cond	0	-0.000000
exp8846	2.40137961e-17	0.070278	-0.000000	discard	3D fine u=0.241 amp=0.45 phase=1.15	manual	memory	1	0.000097
exp8847	1.23429977e-28	0.000000	0.000000	discard	cycle 62 u=0.0982	agent0	initial_cond	1	0.000000
exp8848	1.23429977e-28	0.000000	0.000000	discard	cycle 62 u=0.0982	agent0	initial_cond	0	0.000000
exp8848	1.82697659e-17	0.070278	-0.000000	discard	3D fine u=0.241 amp=0.45 phase=1.17	manual	memory	0	0.000097
exp8849	1.23429977e-28	0.000000	0.000000	discard	cycle 62 u=0.0982	agent0	initial_cond	0	0.000000
exp8850	2.07979355e-17	0.070278	-0.000000	discard	3D fine u=0.241 amp=0.45 phase=1.20	manual	memory	1	0.000097
exp8851	1.88036672e-29	0.000000	0.000000	discard	cycle 62 u=0.0982	agent0	initial_cond	0	0.000000
exp8852	3.67610927e-17	0.070278	-0.000000	discard	3D fine u=0.241 amp=0.45 phase=1.23	manual	memory	0	0.000097
exp8853	1.88036672e-29	0.000000	0.000000	discard	cycle 62 u=0.0982	agent0	initial_cond	0	0.000000
exp8854	1.00697485e-16	0.070278	-0.000000	discard	3D fine u=0.241 amp=0.45 phase=1.25	manual	memory	1	0.000097
exp8854	1.88036672e-29	0.000000	0.000000	discard	cycle 62 u=0.0982	agent0	initial_cond	1	0.000000
exp8855	1.91190259e-29	0.000000	-0.000000	discard	cycle 62 u=0.0982	agent0	initial_cond	0	0.000000
exp8855	3.00433234e-17	0.070278	-0.000000	discard	3D fine u=0.241 amp=0.46 phase=1.15	manual	memory	0	0.000097
exp8856	1.91190259e-29	0.000000	-0.000000	discard	cycle 62 u=0.0982	agent0	initial_cond	0	0.000000
exp8857	3.40707193e-17	0.070278	-0.000000	discard	3D fine u=0.241 amp=0.46 phase=1.17	manual	memory	1	0.000097
exp8858	1.91190259e-29	0.000000	-0.000000	discard	cycle 62 u=0.0982	agent0	initial_cond	1	0.000000
exp8859	2.09682030e-17	0.070278	-0.000000	discard	3D fine u=0.241 amp=0.46 phase=1.20	manual	memory	0	0.000097
exp8860	6.13049994e-29	0.000000	0.000000	discard	cycle 62 u=0.0985	agent0	initial_cond	0	0.000000
exp8861	6.13049994e-29	0.000000	0.000000	discard	cycle 62 u=0.0985	agent0	initial_cond	0	0.000000
exp8861	7.31934032e-17	0.070278	-0.000000	discard	3D fine u=0.241 amp=0.46 phase=1.23	manual	memory	0	0.000097
exp8862	6.13049994e-29	0.000000	0.000000	discard	cycle 62 u=0.0985	agent0	initial_cond	0	0.000000
exp8863	5.88722808e-17	0.070278	-0.000000	discard	3D fine u=0.241 amp=0.46 phase=1.25	manual	memory	0	0.000097
exp8864	5.49750971e-29	0.000000	0.000000	discard	cycle 62 u=0.0985	agent0	initial_cond	0	0.000000
exp8865	4.99357719e-17	0.070278	-0.000000	discard	3D fine u=0.242 amp=0.44 phase=1.15	manual	memory	1	0.000097
exp8866	5.49750971e-29	0.000000	0.000000	discard	cycle 62 u=0.0985	agent0	initial_cond	1	0.000000
exp8867	2.03808181e-17	0.070278	-0.000000	discard	3D fine u=0.242 amp=0.44 phase=1.17	manual	memory	0	0.000097
exp8867	5.49750971e-29	0.000000	0.000000	discard	cycle 62 u=0.0985	agent0	initial_cond	0	0.000000
exp8868	4.15642452e-29	0.000000	0.000000	discard	cycle 62 u=0.0985	agent0	initial_cond	0	0.000000
exp8869	3.22381434e-17	0.070278	-0.000000	discard	3D fine u=0.242 amp=0.44 phase=1.20	manual	memory	0	0.000097
exp8870	4.15642452e-29	0.000000	0.000000	discard	cycle 62 u=0.0985	agent0	initial_cond	0	0.000000
exp8871	4.46364432e-17	0.070278	-0.000000	discard	3D fine u=0.242 amp=0.44 phase=1.23	manual	memory	0	0.000097
exp8872	4.15642452e-29	0.000000	0.000000	discard	cycle 62 u=0.0985	agent0	initial_cond	0	0.000000
exp8873	5.61030385e-17	0.070278	-0.000000	discard	3D fine u=0.242 amp=0.44 phase=1.25	manual	memory	0	0.000097
exp8874	2.19292611e-29	0.000000	0.000000	discard	cycle 62 u=0.0985	agent0	initial_cond	1	-0.000000
exp8875	2.19292611e-29	0.000000	0.000000	discard	cycle 62 u=0.0985	agent0	initial_cond	0	-0.000000
exp8875	1.72563120e-17	0.070278	-0.000000	discard	3D fine u=0.242 amp=0.45 phase=1.15	manual	memory	0	0.000097
exp8876	2.19292611e-29	0.000000	0.000000	discard	cycle 62 u=0.0985	agent0	initial_cond	0	-0.000000
exp8877	1.07231095e-17	0.070278	-0.000000	discard	3D fine u=0.242 amp=0.45 phase=1.17	manual	memory	0	0.000097
exp8878	4.22491788e-29	0.000000	0.000000	discard	cycle 62 u=0.0990	agent0	initial_cond	1	-0.000000
exp8879	7.15119071e-18	0.070278	-0.000000	discard	3D fine u=0.242 amp=0.45 phase=1.20	manual	memory	0	0.000097
exp8880	4.22491788e-29	0.000000	0.000000	discard	cycle 62 u=0.0990	agent0	initial_cond	0	-0.000000
exp8881	3.41616978e-17	0.070278	-0.000000	discard	3D fine u=0.242 amp=0.45 phase=1.23	manual	memory	0	0.000097
exp8881	4.22491788e-29	0.000000	0.000000	discard	cycle 62 u=0.0990	agent0	initial_cond	1	-0.000000
exp8882	3.22245147e-29	0.000000	0.000000	discard	cycle 62 u=0.0990	agent0	initial_cond	0	0.000000
exp8883	9.39503008e-18	0.070278	-0.000000	discard	3D fine u=0.242 amp=0.45 phase=1.25	manual	memory	0	0.000097
exp8884	3.22245147e-29	0.000000	0.000000	discard	cycle 62 u=0.0990	agent0	initial_cond	0	0.000000
exp8885	2.40005510e-17	0.070278	-0.000000	discard	3D fine u=0.242 amp=0.46 phase=1.15	manual	memory	0	0.000097
exp8886	3.22245147e-29	0.000000	0.000000	discard	cycle 62 u=0.0990	agent0	initial_cond	1	0.000000
exp8887	4.71063958e-17	0.070278	-0.000000	discard	3D fine u=0.242 amp=0.46 phase=1.17	manual	memory	0	0.000097
exp8888	4.50941488e-29	0.000000	-0.000000	discard	cycle 62 u=0.0990	agent0	initial_cond	0	0.000000
exp8889	4.50941488e-29	0.000000	-0.000000	discard	cycle 62 u=0.0990	agent0	initial_cond	0	0.000000
exp8889	4.93137771e-17	0.070278	-0.000000	discard	3D fine u=0.242 amp=0.46 phase=1.20	manual	memory	1	0.000097
exp8890	4.50941488e-29	0.000000	-0.000000	discard	cycle 62 u=0.0990	agent0	initial_cond	0	0.000000
exp8891	2.66359892e-17	0.070278	-0.000000	discard	3D fine u=0.242 amp=0.46 phase=1.23	manual	memory	0	0.000097
exp8892	4.88330883e-29	0.000000	-0.000000	discard	cycle 62 u=0.0990	agent0	initial_cond	0	0.000000
exp8893	3.08781402e-17	0.070278	-0.000000	discard	3D fine u=0.242 amp=0.46 phase=1.25	manual	memory	1	0.000097
exp8894	4.88330883e-29	0.000000	-0.000000	discard	cycle 62 u=0.0990	agent0	initial_cond	1	0.000000
exp8895	9.59016994e-17	0.070278	-0.000000	discard	3D fine u=0.243 amp=0.44 phase=1.15	manual	memory	0	0.000097
exp8895	4.88330883e-29	0.000000	-0.000000	discard	cycle 62 u=0.0990	agent0	initial_cond	0	0.000000
exp8896	5.74085541e-29	0.000000	-0.000000	discard	cycle 62 u=0.0995	agent0	initial_cond	0	0.000000
exp8897	1.12059465e-17	0.070278	-0.000000	discard	3D fine u=0.243 amp=0.44 phase=1.17	manual	memory	1	0.000097
exp8898	5.74085541e-29	0.000000	-0.000000	discard	cycle 62 u=0.0995	agent0	initial_cond	0	0.000000
exp8899	1.19441616e-17	0.070278	-0.000000	discard	3D fine u=0.243 amp=0.44 phase=1.20	manual	memory	0	0.000097
exp8900	5.74085541e-29	0.000000	-0.000000	discard	cycle 62 u=0.0995	agent0	initial_cond	0	0.000000
exp8901	2.12287778e-17	0.070278	-0.000000	discard	3D fine u=0.243 amp=0.44 phase=1.23	manual	memory	1	0.000097
exp8901	1.54984578e-28	0.000000	0.000000	discard	cycle 62 u=0.0995	agent0	initial_cond	1	-0.000000
exp8902	1.54984578e-28	0.000000	0.000000	discard	cycle 62 u=0.0995	agent0	initial_cond	0	-0.000000
exp8902	4.61062128e-17	0.070278	-0.000000	discard	3D fine u=0.243 amp=0.44 phase=1.25	manual	memory	0	0.000097
exp8903	1.54984578e-28	0.000000	0.000000	discard	cycle 62 u=0.0995	agent0	initial_cond	0	-0.000000
exp8904	1.42613823e-17	0.070278	-0.000000	discard	3D fine u=0.243 amp=0.45 phase=1.15	manual	memory	1	0.000097
exp8905	1.60328418e-29	0.000000	-0.000000	discard	cycle 62 u=0.0995	agent0	initial_cond	1	-0.000000
exp8906	4.27436339e-17	0.070278	-0.000000	discard	3D fine u=0.243 amp=0.45 phase=1.17	manual	memory	0	0.000097
