exp_id	residual	solution_norm	solution_mean	status	description	agent	design	elapsed_s	solution_energy
r9_phase1.460_fine	9.01696441e-19	0.0	0.0	keep	Phase4 phase=1.460 fine	agent1	memory	0	0.0
exp15934	1.30310780e-28	0.000000	0.000000	discard	cycle 126 u=0.0980	agent0	initial_cond	1	-0.000000
r9_phase1.470_fine	9.35055433e-19	0.0	0.0	keep	Phase4 phase=1.470 fine	agent1	memory	0	0.0
exp15935	5.45343271e-29	0.000000	0.000000	discard	cycle 126 u=0.0982	agent0	initial_cond	0	-0.000000
exp15936	5.45343271e-29	0.000000	0.000000	discard	cycle 126 u=0.0982	agent0	initial_cond	1	-0.000000
exp15937	5.45343271e-29	0.000000	0.000000	discard	cycle 126 u=0.0982	agent0	initial_cond	0	-0.000000
exp15938	1.23429977e-28	0.000000	0.000000	discard	cycle 126 u=0.0982	agent0	initial_cond	0	0.000000
exp15939	1.23429977e-28	0.000000	0.000000	discard	cycle 126 u=0.0982	agent0	initial_cond	1	0.000000
exp15940	1.23429977e-28	0.000000	0.000000	discard	cycle 126 u=0.0982	agent0	initial_cond	0	0.000000
exp15941	1.88036672e-29	0.000000	0.000000	discard	cycle 126 u=0.0982	agent0	initial_cond	1	0.000000
exp15942	1.88036672e-29	0.000000	0.000000	discard	cycle 126 u=0.0982	agent0	initial_cond	0	0.000000
exp15943	1.88036672e-29	0.000000	0.000000	discard	cycle 126 u=0.0982	agent0	initial_cond	0	0.000000
exp15944	1.91190259e-29	0.000000	-0.000000	discard	cycle 126 u=0.0982	agent0	initial_cond	0	0.000000
exp15945	1.91190259e-29	0.000000	-0.000000	discard	cycle 126 u=0.0982	agent0	initial_cond	0	0.000000
r9_u0.240_a0.42	6.24673679e-15	0.0	0.0	keep	Phase5 u=0.240 a=0.42	agent1	memory	0	0.0
exp15946	1.91190259e-29	0.000000	-0.000000	discard	cycle 126 u=0.0982	agent0	initial_cond	1	0.000000
r9_u0.240_a0.43	1.65807325e-19	0.0	0.0	keep	Phase5 u=0.240 a=0.43	agent1	memory	0	0.0
exp15947	6.13049994e-29	0.000000	0.000000	discard	cycle 126 u=0.0985	agent0	initial_cond	0	0.000000
r9_u0.240_a0.44	2.81724287e-19	0.0	0.0	keep	Phase5 u=0.240 a=0.44	agent1	memory	0	0.0
exp15948	6.13049994e-29	0.000000	0.000000	discard	cycle 126 u=0.0985	agent0	initial_cond	1	0.000000
r9_u0.240_a0.45	4.98691031e-19	0.0	0.0	keep	Phase5 u=0.240 a=0.45	agent1	memory	0	0.0
r9_u0.240_a0.46	2.71985007e-19	0.0	0.0	keep	Phase5 u=0.240 a=0.46	agent1	memory	0	0.0
exp15949	6.13049994e-29	0.000000	0.000000	discard	cycle 126 u=0.0985	agent0	initial_cond	0	0.000000
r9_u0.242_a0.42	6.96007233e-15	0.0	0.0	keep	Phase5 u=0.242 a=0.42	agent1	memory	0	0.0
exp15950	5.49750971e-29	0.000000	0.000000	discard	cycle 126 u=0.0985	agent0	initial_cond	0	0.000000
r9_u0.242_a0.43	3.00936771e-19	0.0	0.0	keep	Phase5 u=0.242 a=0.43	agent1	memory	0	0.0
r9_u0.242_a0.44	1.72827741e-19	0.0	0.0	keep	Phase5 u=0.242 a=0.44	agent1	memory	0	0.0
exp15951	5.49750971e-29	0.000000	0.000000	discard	cycle 126 u=0.0985	agent0	initial_cond	0	0.000000
r9_u0.242_a0.45	8.34506197e-19	0.0	0.0	keep	Phase5 u=0.242 a=0.45	agent1	memory	0	0.0
exp15952	5.49750971e-29	0.000000	0.000000	discard	cycle 126 u=0.0985	agent0	initial_cond	0	0.000000
r9_u0.242_a0.46	3.08883093e-19	0.0	0.0	keep	Phase5 u=0.242 a=0.46	agent1	memory	0	0.0
r9_u0.244_a0.42	7.74480328e-15	0.0	0.0	keep	Phase5 u=0.244 a=0.42	agent1	memory	0	0.0
exp15953	4.15642452e-29	0.000000	0.000000	discard	cycle 126 u=0.0985	agent0	initial_cond	1	0.000000
r9_u0.244_a0.43	4.20986634e-19	0.0	0.0	keep	Phase5 u=0.244 a=0.43	agent1	memory	0	0.0
exp15954	4.15642452e-29	0.000000	0.000000	discard	cycle 126 u=0.0985	agent0	initial_cond	0	0.000000
r9_u0.244_a0.44	1.94352691e-19	0.0	0.0	keep	Phase5 u=0.244 a=0.44	agent1	memory	0	0.0
r9_u0.244_a0.45	1.36393498e-18	0.0	0.0	keep	Phase5 u=0.244 a=0.45	agent1	memory	0	0.0
exp15955	4.15642452e-29	0.000000	0.000000	discard	cycle 126 u=0.0985	agent0	initial_cond	1	0.000000
r9_u0.244_a0.46	2.94947064e-19	0.0	0.0	keep	Phase5 u=0.244 a=0.46	agent1	memory	0	0.0
exp15956	2.19292611e-29	0.000000	0.000000	discard	cycle 126 u=0.0985	agent0	initial_cond	0	-0.000000
r9_u0.246_a0.42	4.74173811e-19	0.0	0.0	keep	Phase5 u=0.246 a=0.42	agent1	memory	0	0.0
r9_u0.246_a0.43	1.13817423e-18	0.0	0.0	keep	Phase5 u=0.246 a=0.43	agent1	memory	0	0.0
exp15957	2.19292611e-29	0.000000	0.000000	discard	cycle 126 u=0.0985	agent0	initial_cond	0	-0.000000
r9_u0.246_a0.44	3.50363079e-19	0.0	0.0	keep	Phase5 u=0.246 a=0.44	agent1	memory	0	0.0
exp15958	2.19292611e-29	0.000000	0.000000	discard	cycle 126 u=0.0985	agent0	initial_cond	0	-0.000000
r9_u0.246_a0.45	4.87430314e-19	0.0	0.0	keep	Phase5 u=0.246 a=0.45	agent1	memory	0	0.0
r9_u0.246_a0.46	7.83210019e-19	0.0	0.0	keep	Phase5 u=0.246 a=0.46	agent1	memory	0	0.0
exp15959	4.22491788e-29	0.000000	0.000000	discard	cycle 126 u=0.0990	agent0	initial_cond	0	-0.000000
r9_u0.248_a0.42	7.32261499e-19	0.0	0.0	keep	Phase5 u=0.248 a=0.42	agent1	memory	0	0.0
exp15960	4.22491788e-29	0.000000	0.000000	discard	cycle 126 u=0.0990	agent0	initial_cond	1	-0.000000
r9_u0.248_a0.43	8.66409945e-19	0.0	0.0	keep	Phase5 u=0.248 a=0.43	agent1	memory	0	0.0
r9_u0.248_a0.44	1.99127686e-18	0.0	0.0	keep	Phase5 u=0.248 a=0.44	agent1	memory	0	0.0
exp15961	4.22491788e-29	0.000000	0.000000	discard	cycle 126 u=0.0990	agent0	initial_cond	0	-0.000000
r9_u0.248_a0.45	4.00785961e-19	0.0	0.0	keep	Phase5 u=0.248 a=0.45	agent1	memory	0	0.0
exp15962	3.22245147e-29	0.000000	0.000000	discard	cycle 126 u=0.0990	agent0	initial_cond	1	0.000000
r9_u0.248_a0.46	6.98283803e-19	0.0	0.0	keep	Phase5 u=0.248 a=0.46	agent1	memory	0	0.0
exp15963	3.22245147e-29	0.000000	0.000000	discard	cycle 126 u=0.0990	agent0	initial_cond	0	0.000000
exp15964	3.22245147e-29	0.000000	0.000000	discard	cycle 126 u=0.0990	agent0	initial_cond	0	0.000000
exp15965	4.50941488e-29	0.000000	-0.000000	discard	cycle 126 u=0.0990	agent0	initial_cond	0	0.000000
exp15966	4.50941488e-29	0.000000	-0.000000	discard	cycle 126 u=0.0990	agent0	initial_cond	0	0.000000
exp15967	4.50941488e-29	0.000000	-0.000000	discard	cycle 126 u=0.0990	agent0	initial_cond	1	0.000000
exp15968	4.88330883e-29	0.000000	-0.000000	discard	cycle 126 u=0.0990	agent0	initial_cond	0	0.000000
exp15969	4.88330883e-29	0.000000	-0.000000	discard	cycle 126 u=0.0990	agent0	initial_cond	0	0.000000
exp15970	4.88330883e-29	0.000000	-0.000000	discard	cycle 126 u=0.0990	agent0	initial_cond	0	0.000000
exp15971	5.74085541e-29	0.000000	-0.000000	discard	cycle 126 u=0.0995	agent0	initial_cond	0	0.000000
exp15972	5.74085541e-29	0.000000	-0.000000	discard	cycle 126 u=0.0995	agent0	initial_cond	1	0.000000
exp15973	5.74085541e-29	0.000000	-0.000000	discard	cycle 126 u=0.0995	agent0	initial_cond	0	0.000000
r9_kfreq1	1.94352691e-19	0.0	0.0	keep	Phase6 K_freq=1	agent1	memory	0	0.0
r9_kfreq2	2.76106369e-17	0.0	0.0	keep	Phase6 K_freq=2	agent1	memory	0	0.0
exp15974	1.54984578e-28	0.000000	0.000000	discard	cycle 126 u=0.0995	agent0	initial_cond	1	-0.000000
r9_kfreq3	1.55823290e-15	0.0	0.0	keep	Phase6 K_freq=3	agent1	memory	0	0.0
exp15975	1.54984578e-28	0.000000	0.000000	discard	cycle 126 u=0.0995	agent0	initial_cond	0	-0.000000
r9_kfreq4	2.76106369e-17	0.0	0.0	keep	Phase6 K_freq=4	agent1	memory	0	0.0
exp15976	1.54984578e-28	0.000000	0.000000	discard	cycle 126 u=0.0995	agent0	initial_cond	0	-0.000000
r9_kfreq5	1.45919821e-18	0.0	0.0	keep	Phase6 K_freq=5	agent1	memory	0	0.0
exp15977	1.60328418e-29	0.000000	-0.000000	discard	cycle 126 u=0.0995	agent0	initial_cond	0	-0.000000
exp15978	1.60328418e-29	0.000000	-0.000000	discard	cycle 126 u=0.0995	agent0	initial_cond	0	-0.000000
exp15979	1.60328418e-29	0.000000	-0.000000	discard	cycle 126 u=0.0995	agent0	initial_cond	1	-0.000000
exp15980	7.34590618e-29	0.000000	0.000000	discard	cycle 126 u=0.0995	agent0	initial_cond	0	0.000000
exp15981	7.34590618e-29	0.000000	0.000000	discard	cycle 126 u=0.0995	agent0	initial_cond	1	0.000000
exp15982	7.34590618e-29	0.000000	0.000000	discard	cycle 126 u=0.0995	agent0	initial_cond	0	0.000000
exp15983	4.46546993e-29	0.000000	0.000000	discard	cycle 126 u=0.1000	agent0	initial_cond	0	-0.000000
exp15984	4.46546993e-29	0.000000	0.000000	discard	cycle 126 u=0.1000	agent0	initial_cond	0	-0.000000
exp15985	4.46546993e-29	0.000000	0.000000	discard	cycle 126 u=0.1000	agent0	initial_cond	0	-0.000000
r9_kmode_cosine	1.94352691e-19	0.0	0.0	keep	Phase7 K_mode=cosine	agent1	memory	0	0.0
exp15986	4.08106752e-29	0.000000	0.000000	discard	cycle 126 u=0.1000	agent0	initial_cond	1	-0.000000
r9_kmode_sine	2.67504412e-17	0.0	0.0	keep	Phase7 K_mode=sine	agent1	memory	0	0.0
r9_kmode_multipole	2.96360135e-18	0.0	0.0	keep	Phase7 K_mode=multipole	agent1	memory	0	0.0
exp15987	4.08106752e-29	0.000000	0.000000	discard	cycle 126 u=0.1000	agent0	initial_cond	0	-0.000000
exp15988	4.08106752e-29	0.000000	0.000000	discard	cycle 126 u=0.1000	agent0	initial_cond	1	-0.000000
exp15989	4.58623706e-29	0.000000	0.000000	discard	cycle 126 u=0.1000	agent0	initial_cond	0	-0.000000
exp15990	4.58623706e-29	0.000000	0.000000	discard	cycle 126 u=0.1000	agent0	initial_cond	0	-0.000000
exp15991	4.58623706e-29	0.000000	0.000000	discard	cycle 126 u=0.1000	agent0	initial_cond	0	-0.000000
exp15992	4.39794337e-29	0.000000	0.000000	discard	cycle 126 u=0.1000	agent0	initial_cond	0	-0.000000
exp15993	4.39794337e-29	0.000000	0.000000	discard	cycle 126 u=0.1000	agent0	initial_cond	1	-0.000000
exp15994	4.39794337e-29	0.000000	0.000000	discard	cycle 126 u=0.1000	agent0	initial_cond	0	-0.000000
exp15995	1.36727475e-28	0.000000	0.000000	discard	cycle 126 u=0.1050	agent0	initial_cond	0	-0.000000
exp15996	1.36727475e-28	0.000000	0.000000	discard	cycle 126 u=0.1050	agent0	initial_cond	0	-0.000000
exp15997	1.36727475e-28	0.000000	0.000000	discard	cycle 126 u=0.1050	agent0	initial_cond	0	-0.000000
r9_modes1	6.01114748e-24	0.0	0.0	keep	Phase8 modes=1	agent1	memory	0	0.0
exp15998	6.14461376e-29	0.000000	0.000000	discard	cycle 126 u=0.1050	agent0	initial_cond	1	-0.000000
r9_modes2	4.44726964e-15	0.0	0.0	keep	Phase8 modes=2	agent1	memory	0	0.0
exp15999	6.14461376e-29	0.000000	0.000000	discard	cycle 126 u=0.1050	agent0	initial_cond	0	-0.000000
r9_modes3	1.94352691e-19	0.0	0.0	keep	Phase8 modes=3	agent1	memory	0	0.0
r9_modes4	2.07919683e-18	0.0	0.0	keep	Phase8 modes=4	agent1	memory	0	0.0
exp16000	6.14461376e-29	0.000000	0.000000	discard	cycle 126 u=0.1050	agent0	initial_cond	1	-0.000000
r9_modes5	9.56027386e-19	0.0	0.0	keep	Phase8 modes=5	agent1	memory	0	0.0
exp16001	1.75906666e-28	0.000000	0.000000	discard	cycle 126 u=0.1050	agent0	initial_cond	0	-0.000000
r9_modes8	3.00897785e-18	0.0	0.0	keep	Phase8 modes=8	agent1	memory	0	0.0
r9_modes16	2.38017622e-17	0.0	0.0	keep	Phase8 modes=16	agent1	memory	0	0.0
exp16002	1.75906666e-28	0.000000	0.000000	discard	cycle 126 u=0.1050	agent0	initial_cond	0	-0.000000
r9_modes32	8.14659627e-17	0.0	0.0	keep	Phase8 modes=32	agent1	memory	0	0.0
exp16003	1.75906666e-28	0.000000	0.000000	discard	cycle 126 u=0.1050	agent0	initial_cond	0	-0.000000
exp16004	1.11257917e-28	0.000000	0.000000	discard	cycle 126 u=0.1050	agent0	initial_cond	0	-0.000000
exp16005	1.11257917e-28	0.000000	0.000000	discard	cycle 126 u=0.1050	agent0	initial_cond	1	-0.000000
exp16006	1.11257917e-28	0.000000	0.000000	discard	cycle 126 u=0.1050	agent0	initial_cond	0	-0.000000
exp16007	8.58580947e-29	0.000000	0.000000	discard	cycle 127 u=0.0975	agent0	initial_cond	0	0.000000
exp16008	8.58580947e-29	0.000000	0.000000	discard	cycle 127 u=0.0975	agent0	initial_cond	0	0.000000
exp16009	8.58580947e-29	0.000000	0.000000	discard	cycle 127 u=0.0975	agent0	initial_cond	0	0.000000
exp16010	5.23962023e-29	0.000000	0.000000	discard	cycle 127 u=0.0975	agent0	initial_cond	1	0.000000
exp16011	5.23962023e-29	0.000000	0.000000	discard	cycle 127 u=0.0975	agent0	initial_cond	0	0.000000
exp16012	5.23962023e-29	0.000000	0.000000	discard	cycle 127 u=0.0975	agent0	initial_cond	1	0.000000
exp16013	4.03266298e-29	0.000000	0.000000	discard	cycle 127 u=0.0975	agent0	initial_cond	0	0.000000
exp16014	4.03266298e-29	0.000000	0.000000	discard	cycle 127 u=0.0975	agent0	initial_cond	0	0.000000
exp16015	4.03266298e-29	0.000000	0.000000	discard	cycle 127 u=0.0975	agent0	initial_cond	0	0.000000
exp16016	4.80015937e-29	0.000000	0.000000	discard	cycle 127 u=0.0975	agent0	initial_cond	0	0.000000
exp16017	4.80015937e-29	0.000000	0.000000	discard	cycle 127 u=0.0975	agent0	initial_cond	1	0.000000
r9_m1_p1.40_u0.24	3.09358094e-17	0.0	0.0	keep	Phase9 modes1 p=1.40 u=0.24	agent1	memory	0	0.0
exp16018	4.80015937e-29	0.000000	0.000000	discard	cycle 127 u=0.0975	agent0	initial_cond	0	0.000000
r9_m1_p1.40_u0.244	6.38457236e-17	0.0	0.0	keep	Phase9 modes1 p=1.40 u=0.244	agent1	memory	0	0.0
exp16019	2.68824537e-29	0.000000	0.000000	discard	cycle 127 u=0.0980	agent0	initial_cond	1	-0.000000
r9_m1_p1.40_u0.248	1.32878145e-16	0.0	0.0	keep	Phase9 modes1 p=1.40 u=0.248	agent1	memory	0	0.0
r9_m1_p1.43_u0.24	1.91200562e-21	0.0	0.0	keep	Phase9 modes1 p=1.43 u=0.24	agent1	memory	0	0.0
exp16020	2.68824537e-29	0.000000	0.000000	discard	cycle 127 u=0.0980	agent0	initial_cond	0	-0.000000
r9_m1_p1.43_u0.244	6.67631240e-21	0.0	0.0	keep	Phase9 modes1 p=1.43 u=0.244	agent1	memory	0	0.0
exp16021	2.68824537e-29	0.000000	0.000000	discard	cycle 127 u=0.0980	agent0	initial_cond	0	-0.000000
r9_m1_p1.43_u0.248	2.34661065e-20	0.0	0.0	keep	Phase9 modes1 p=1.43 u=0.248	agent1	memory	0	0.0
r9_m1_p1.445_u0.24	2.13950118e-24	0.0	0.0	keep	Phase9 modes1 p=1.445 u=0.24	agent1	memory	0	0.0
exp16022	6.16758073e-29	0.000000	0.000000	discard	cycle 127 u=0.0980	agent0	initial_cond	0	-0.000000
r9_m1_p1.445_u0.244	6.01114748e-24	0.0	0.0	keep	Phase9 modes1 p=1.445 u=0.244	agent1	memory	0	0.0
exp16023	6.16758073e-29	0.000000	0.000000	discard	cycle 127 u=0.0980	agent0	initial_cond	0	-0.000000
r9_m1_p1.445_u0.248	3.59520399e-23	0.0	0.0	keep	Phase9 modes1 p=1.445 u=0.248	agent1	memory	0	0.0
r9_m1_p1.45_u0.24	1.58232011e-25	0.0	0.0	keep	Phase9 modes1 p=1.45 u=0.24	agent1	memory	0	0.0
exp16024	6.16758073e-29	0.000000	0.000000	discard	cycle 127 u=0.0980	agent0	initial_cond	1	-0.000000
r9_m1_p1.45_u0.244	4.70228905e-25	0.0	0.0	keep	Phase9 modes1 p=1.45 u=0.244	agent1	memory	0	0.0
exp16025	2.01926478e-29	0.000000	0.000000	discard	cycle 127 u=0.0980	agent0	initial_cond	0	0.000000
r9_m1_p1.45_u0.248	2.06268784e-24	0.0	0.0	keep	Phase9 modes1 p=1.45 u=0.248	agent1	memory	0	0.0
r9_m1_p1.46_u0.24	1.54630393e-26	0.0	0.0	keep	Phase9 modes1 p=1.46 u=0.24	agent1	memory	0	0.0
exp16026	2.01926478e-29	0.000000	0.000000	discard	cycle 127 u=0.0980	agent0	initial_cond	0	0.000000
r9_m1_p1.46_u0.244	3.55307271e-26	0.0	0.0	keep	Phase9 modes1 p=1.46 u=0.244	agent1	memory	0	0.0
exp16027	2.01926478e-29	0.000000	0.000000	discard	cycle 127 u=0.0980	agent0	initial_cond	0	0.000000
r9_m1_p1.46_u0.248	2.68817950e-26	0.0	0.0	keep	Phase9 modes1 p=1.46 u=0.248	agent1	memory	0	0.0
r9_m1_p1.50_u0.24	3.96711562e-22	0.0	0.0	keep	Phase9 modes1 p=1.50 u=0.24	agent1	memory	0	0.0
exp16028	1.30310780e-28	0.000000	0.000000	discard	cycle 127 u=0.0980	agent0	initial_cond	0	-0.000000
r9_m1_p1.50_u0.244	4.55327389e-21	0.0	0.0	keep	Phase9 modes1 p=1.50 u=0.244	agent1	memory	0	0.0
exp16029	1.30310780e-28	0.000000	0.000000	discard	cycle 127 u=0.0980	agent0	initial_cond	1	-0.000000
r9_m1_p1.50_u0.248	4.63691607e-20	0.0	0.0	keep	Phase9 modes1 p=1.50 u=0.248	agent1	memory	0	0.0
exp16030	1.30310780e-28	0.000000	0.000000	discard	cycle 127 u=0.0980	agent0	initial_cond	0	-0.000000
exp16031	5.45343271e-29	0.000000	0.000000	discard	cycle 127 u=0.0982	agent0	initial_cond	1	-0.000000
exp16032	5.45343271e-29	0.000000	0.000000	discard	cycle 127 u=0.0982	agent0	initial_cond	0	-0.000000
exp16033	5.45343271e-29	0.000000	0.000000	discard	cycle 127 u=0.0982	agent0	initial_cond	0	-0.000000
exp16034	1.23429977e-28	0.000000	0.000000	discard	cycle 127 u=0.0982	agent0	initial_cond	0	0.000000
exp16035	1.23429977e-28	0.000000	0.000000	discard	cycle 127 u=0.0982	agent0	initial_cond	0	0.000000
exp16036	1.23429977e-28	0.000000	0.000000	discard	cycle 127 u=0.0982	agent0	initial_cond	1	0.000000
exp16037	1.88036672e-29	0.000000	0.000000	discard	cycle 127 u=0.0982	agent0	initial_cond	0	0.000000
exp16038	1.88036672e-29	0.000000	0.000000	discard	cycle 127 u=0.0982	agent0	initial_cond	1	0.000000
exp16039	1.88036672e-29	0.000000	0.000000	discard	cycle 127 u=0.0982	agent0	initial_cond	0	0.000000
exp16040	1.91190259e-29	0.000000	-0.000000	discard	cycle 127 u=0.0982	agent0	initial_cond	0	0.000000
exp16041	1.91190259e-29	0.000000	-0.000000	discard	cycle 127 u=0.0982	agent0	initial_cond	0	0.000000
exp16042	1.91190259e-29	0.000000	-0.000000	discard	cycle 127 u=0.0982	agent0	initial_cond	0	0.000000
exp16043	6.13049994e-29	0.000000	0.000000	discard	cycle 127 u=0.0985	agent0	initial_cond	1	0.000000
exp16044	6.13049994e-29	0.000000	0.000000	discard	cycle 127 u=0.0985	agent0	initial_cond	0	0.000000
r9_ultra_p1.455	5.15153001e-26	0.0	0.0	keep	Phase10 ultra p=1.455	agent1	memory	0	0.0
exp16045	6.13049994e-29	0.000000	0.000000	discard	cycle 127 u=0.0985	agent0	initial_cond	1	0.000000
r9_ultra_p1.456	2.31743242e-27	0.0	0.0	keep	Phase10 ultra p=1.456	agent1	memory	0	0.0
r9_ultra_p1.457	6.96820272e-27	0.0	0.0	keep	Phase10 ultra p=1.457	agent1	memory	0	0.0
exp16046	5.49750971e-29	0.000000	0.000000	discard	cycle 127 u=0.0985	agent0	initial_cond	0	0.000000
r9_ultra_p1.458	1.13292654e-26	0.0	0.0	keep	Phase10 ultra p=1.458	agent1	memory	0	0.0
exp16047	5.49750971e-29	0.000000	0.000000	discard	cycle 127 u=0.0985	agent0	initial_cond	0	0.000000
r9_ultra_p1.459	1.99755933e-26	0.0	0.0	keep	Phase10 ultra p=1.459	agent1	memory	0	0.0
r9_ultra_p1.460	1.54630393e-26	0.0	0.0	keep	Phase10 ultra p=1.460	agent1	memory	0	0.0
exp16048	5.49750971e-29	0.000000	0.000000	discard	cycle 127 u=0.0985	agent0	initial_cond	1	0.000000
r9_ultra_p1.461	8.41687210e-15	0.0	0.0	keep	Phase10 ultra p=1.461	agent1	memory	0	0.0
exp16049	4.15642452e-29	0.000000	0.000000	discard	cycle 127 u=0.0985	agent0	initial_cond	0	0.000000
r9_ultra_p1.462	6.42467589e-15	0.0	0.0	keep	Phase10 ultra p=1.462	agent1	memory	0	0.0
r9_ultra_p1.463	4.87473620e-15	0.0	0.0	keep	Phase10 ultra p=1.463	agent1	memory	0	0.0
exp16050	4.15642452e-29	0.000000	0.000000	discard	cycle 127 u=0.0985	agent0	initial_cond	1	0.000000
exp16051	4.15642452e-29	0.000000	0.000000	discard	cycle 127 u=0.0985	agent0	initial_cond	0	0.000000
exp16052	2.19292611e-29	0.000000	0.000000	discard	cycle 127 u=0.0985	agent0	initial_cond	0	-0.000000
exp16053	2.19292611e-29	0.000000	0.000000	discard	cycle 127 u=0.0985	agent0	initial_cond	0	-0.000000
exp16054	2.19292611e-29	0.000000	0.000000	discard	cycle 127 u=0.0985	agent0	initial_cond	0	-0.000000
exp16055	4.22491788e-29	0.000000	0.000000	discard	cycle 127 u=0.0990	agent0	initial_cond	1	-0.000000
exp16056	4.22491788e-29	0.000000	0.000000	discard	cycle 127 u=0.0990	agent0	initial_cond	0	-0.000000
exp16057	4.22491788e-29	0.000000	0.000000	discard	cycle 127 u=0.0990	agent0	initial_cond	1	-0.000000
exp16058	3.22245147e-29	0.000000	0.000000	discard	cycle 127 u=0.0990	agent0	initial_cond	0	0.000000
exp16059	3.22245147e-29	0.000000	0.000000	discard	cycle 127 u=0.0990	agent0	initial_cond	0	0.000000
exp16060	3.22245147e-29	0.000000	0.000000	discard	cycle 127 u=0.0990	agent0	initial_cond	0	0.000000
exp16061	4.50941488e-29	0.000000	-0.000000	discard	cycle 127 u=0.0990	agent0	initial_cond	0	0.000000
exp16062	4.50941488e-29	0.000000	-0.000000	discard	cycle 127 u=0.0990	agent0	initial_cond	1	0.000000
exp16063	4.50941488e-29	0.000000	-0.000000	discard	cycle 127 u=0.0990	agent0	initial_cond	0	0.000000
exp16064	4.88330883e-29	0.000000	-0.000000	discard	cycle 127 u=0.0990	agent0	initial_cond	1	0.000000
exp16065	4.88330883e-29	0.000000	-0.000000	discard	cycle 127 u=0.0990	agent0	initial_cond	0	0.000000
exp16066	4.88330883e-29	0.000000	-0.000000	discard	cycle 127 u=0.0990	agent0	initial_cond	0	0.000000
exp16067	5.74085541e-29	0.000000	-0.000000	discard	cycle 127 u=0.0995	agent0	initial_cond	1	0.000000
exp16068	5.74085541e-29	0.000000	-0.000000	discard	cycle 127 u=0.0995	agent0	initial_cond	0	0.000000
exp16069	5.74085541e-29	0.000000	-0.000000	discard	cycle 127 u=0.0995	agent0	initial_cond	1	0.000000
exp16070	1.54984578e-28	0.000000	0.000000	discard	cycle 127 u=0.0995	agent0	initial_cond	0	-0.000000
exp16071	1.54984578e-28	0.000000	0.000000	discard	cycle 127 u=0.0995	agent0	initial_cond	0	-0.000000
exp16072	1.54984578e-28	0.000000	0.000000	discard	cycle 127 u=0.0995	agent0	initial_cond	0	-0.000000
exp16073	1.60328418e-29	0.000000	-0.000000	discard	cycle 127 u=0.0995	agent0	initial_cond	0	-0.000000
exp16074	1.60328418e-29	0.000000	-0.000000	discard	cycle 127 u=0.0995	agent0	initial_cond	1	-0.000000
exp16075	1.60328418e-29	0.000000	-0.000000	discard	cycle 127 u=0.0995	agent0	initial_cond	0	-0.000000
r9_win_p1.4560_a0.43	2.80082956e-26	0.0	0.0	keep	Phase11 window p=1.4560 a=0.43	agent1	memory	0	0.0
r9_win_p1.4560_a0.44	2.31743242e-27	0.0	0.0	keep	Phase11 window p=1.4560 a=0.44	agent1	memory	0	0.0
exp16076	7.34590618e-29	0.000000	0.000000	discard	cycle 127 u=0.0995	agent0	initial_cond	1	0.000000
r9_win_p1.4560_a0.45	1.26821494e-25	0.0	0.0	keep	Phase11 window p=1.4560 a=0.45	agent1	memory	0	0.0
exp16077	7.34590618e-29	0.000000	0.000000	discard	cycle 127 u=0.0995	agent0	initial_cond	0	0.000000
r9_win_p1.4561_a0.43	1.56720475e-26	0.0	0.0	keep	Phase11 window p=1.4561 a=0.43	agent1	memory	0	0.0
r9_win_p1.4561_a0.44	2.17587935e-26	0.0	0.0	keep	Phase11 window p=1.4561 a=0.44	agent1	memory	0	0.0
exp16078	7.34590618e-29	0.000000	0.000000	discard	cycle 127 u=0.0995	agent0	initial_cond	0	0.000000
r9_win_p1.4561_a0.45	7.16227393e-26	0.0	0.0	keep	Phase11 window p=1.4561 a=0.45	agent1	memory	0	0.0
exp16079	4.46546993e-29	0.000000	0.000000	discard	cycle 127 u=0.1000	agent0	initial_cond	0	-0.000000
r9_win_p1.4562_a0.43	1.01606238e-26	0.0	0.0	keep	Phase11 window p=1.4562 a=0.43	agent1	memory	0	0.0
r9_win_p1.4562_a0.44	3.48717007e-26	0.0	0.0	keep	Phase11 window p=1.4562 a=0.44	agent1	memory	0	0.0
exp16080	4.46546993e-29	0.000000	0.000000	discard	cycle 127 u=0.1000	agent0	initial_cond	0	-0.000000
r9_win_p1.4562_a0.45	7.42417482e-26	0.0	0.0	keep	Phase11 window p=1.4562 a=0.45	agent1	memory	0	0.0
exp16081	4.46546993e-29	0.000000	0.000000	discard	cycle 127 u=0.1000	agent0	initial_cond	1	-0.000000
