exp_id	residual	solution_norm	solution_mean	status	description	agent	design	elapsed_s	solution_energy
exp11436	2.34295211e-17	0.081814	0.000000	discard	n_mode exploration	manual	n_mode_sweep	0	0.000212
exp11436	4.03266298e-29	0.000000	0.000000	discard	cycle 84 u=0.0975	agent0	initial_cond	0	0.000000
exp11437	4.03266298e-29	0.000000	0.000000	discard	cycle 84 u=0.0975	agent0	initial_cond	0	0.000000
exp11438	5.02104461e-17	0.102376	0.000000	discard	n_mode exploration	manual	n_mode_sweep	1	0.000602
exp11439	4.03266298e-29	0.000000	0.000000	discard	cycle 84 u=0.0975	agent0	initial_cond	1	0.000000
exp11440	4.80015937e-29	0.000000	0.000000	discard	cycle 84 u=0.0975	agent0	initial_cond	0	0.000000
exp11441	3.06532879e-16	0.127095	0.000000	discard	n_mode exploration	manual	n_mode_sweep	0	0.001555
exp11442	4.80015937e-29	0.000000	0.000000	discard	cycle 84 u=0.0975	agent0	initial_cond	0	0.000000
exp11443	4.80015937e-29	0.000000	0.000000	discard	cycle 84 u=0.0975	agent0	initial_cond	0	0.000000
exp11444	1.44851412e-16	0.081814	0.000000	discard	n_mode exploration	manual	n_mode_sweep	0	0.000212
exp11445	2.68824537e-29	0.000000	0.000000	discard	cycle 84 u=0.0980	agent0	initial_cond	0	-0.000000
exp11446	2.68824537e-29	0.000000	0.000000	discard	cycle 84 u=0.0980	agent0	initial_cond	1	-0.000000
exp11446	6.20357490e-17	0.102376	0.000000	discard	n_mode exploration	manual	n_mode_sweep	1	0.000602
exp11447	2.68824537e-29	0.000000	0.000000	discard	cycle 84 u=0.0980	agent0	initial_cond	0	-0.000000
exp11448	2.21055422e-17	0.127095	0.000000	discard	n_mode exploration	manual	n_mode_sweep	0	0.001555
exp11448	6.16758073e-29	0.000000	0.000000	discard	cycle 84 u=0.0980	agent0	initial_cond	0	-0.000000
exp11449	6.16758073e-29	0.000000	0.000000	discard	cycle 84 u=0.0980	agent0	initial_cond	0	-0.000000
exp11450	6.16758073e-29	0.000000	0.000000	discard	cycle 84 u=0.0980	agent0	initial_cond	0	-0.000000
exp11451	2.01926478e-29	0.000000	0.000000	discard	cycle 84 u=0.0980	agent0	initial_cond	1	0.000000
exp11452	2.01926478e-29	0.000000	0.000000	discard	cycle 84 u=0.0980	agent0	initial_cond	0	0.000000
exp11453	2.01926478e-29	0.000000	0.000000	discard	cycle 84 u=0.0980	agent0	initial_cond	0	0.000000
exp11454	1.30310780e-28	0.000000	0.000000	discard	cycle 84 u=0.0980	agent0	initial_cond	0	-0.000000
exp11455	1.30310780e-28	0.000000	0.000000	discard	cycle 84 u=0.0980	agent0	initial_cond	0	-0.000000
exp11456	1.30310780e-28	0.000000	0.000000	discard	cycle 84 u=0.0980	agent0	initial_cond	1	-0.000000
exp11457	5.45343271e-29	0.000000	0.000000	discard	cycle 84 u=0.0982	agent0	initial_cond	0	-0.000000
exp11458	5.45343271e-29	0.000000	0.000000	discard	cycle 84 u=0.0982	agent0	initial_cond	0	-0.000000
exp11459	5.45343271e-29	0.000000	0.000000	discard	cycle 84 u=0.0982	agent0	initial_cond	0	-0.000000
exp11460	1.23429977e-28	0.000000	0.000000	discard	cycle 84 u=0.0982	agent0	initial_cond	0	0.000000
exp11461	1.23429977e-28	0.000000	0.000000	discard	cycle 84 u=0.0982	agent0	initial_cond	1	0.000000
exp11462	1.23429977e-28	0.000000	0.000000	discard	cycle 84 u=0.0982	agent0	initial_cond	0	0.000000
exp11463	1.88036672e-29	0.000000	0.000000	discard	cycle 84 u=0.0982	agent0	initial_cond	0	0.000000
exp11464	1.88036672e-29	0.000000	0.000000	discard	cycle 84 u=0.0982	agent0	initial_cond	0	0.000000
exp11465	1.88036672e-29	0.000000	0.000000	discard	cycle 84 u=0.0982	agent0	initial_cond	0	0.000000
exp11466	1.91190259e-29	0.000000	-0.000000	discard	cycle 84 u=0.0982	agent0	initial_cond	1	0.000000
exp11467	1.91190259e-29	0.000000	-0.000000	discard	cycle 84 u=0.0982	agent0	initial_cond	0	0.000000
exp11468	1.91190259e-29	0.000000	-0.000000	discard	cycle 84 u=0.0982	agent0	initial_cond	0	0.000000
exp11469	6.13049994e-29	0.000000	0.000000	discard	cycle 84 u=0.0985	agent0	initial_cond	0	0.000000
exp11470	6.13049994e-29	0.000000	0.000000	discard	cycle 84 u=0.0985	agent0	initial_cond	0	0.000000
exp11471	6.13049994e-29	0.000000	0.000000	discard	cycle 84 u=0.0985	agent0	initial_cond	1	0.000000
exp11472	5.49750971e-29	0.000000	0.000000	discard	cycle 84 u=0.0985	agent0	initial_cond	0	0.000000
exp11473	5.49750971e-29	0.000000	0.000000	discard	cycle 84 u=0.0985	agent0	initial_cond	0	0.000000
exp11474	5.49750971e-29	0.000000	0.000000	discard	cycle 84 u=0.0985	agent0	initial_cond	0	0.000000
exp11475	4.15642452e-29	0.000000	0.000000	discard	cycle 84 u=0.0985	agent0	initial_cond	0	0.000000
exp11476	4.15642452e-29	0.000000	0.000000	discard	cycle 84 u=0.0985	agent0	initial_cond	1	0.000000
exp11477	4.15642452e-29	0.000000	0.000000	discard	cycle 84 u=0.0985	agent0	initial_cond	0	0.000000
exp11478	2.19292611e-29	0.000000	0.000000	discard	cycle 84 u=0.0985	agent0	initial_cond	0	-0.000000
exp11479	2.19292611e-29	0.000000	0.000000	discard	cycle 84 u=0.0985	agent0	initial_cond	0	-0.000000
exp11480	2.19292611e-29	0.000000	0.000000	discard	cycle 84 u=0.0985	agent0	initial_cond	0	-0.000000
exp11481	4.22491788e-29	0.000000	0.000000	discard	cycle 84 u=0.0990	agent0	initial_cond	1	-0.000000
exp11482	4.22491788e-29	0.000000	0.000000	discard	cycle 84 u=0.0990	agent0	initial_cond	0	-0.000000
exp11483	2.42745501e-17	0.102376	-0.000000	discard	Solver tolerance sweep	manual	tol_sweep	0	0.000602
exp11483	4.22491788e-29	0.000000	0.000000	discard	cycle 84 u=0.0990	agent0	initial_cond	0	-0.000000
exp11484	3.22245147e-29	0.000000	0.000000	discard	cycle 84 u=0.0990	agent0	initial_cond	1	0.000000
exp11485	3.22245147e-29	0.000000	0.000000	discard	cycle 84 u=0.0990	agent0	initial_cond	0	0.000000
exp11485	2.42745501e-17	0.102376	-0.000000	discard	Solver tolerance sweep	manual	tol_sweep	0	0.000602
exp11486	3.22245147e-29	0.000000	0.000000	discard	cycle 84 u=0.0990	agent0	initial_cond	1	0.000000
exp11487	4.50941488e-29	0.000000	-0.000000	discard	cycle 84 u=0.0990	agent0	initial_cond	0	0.000000
exp11488	2.42745501e-17	0.102376	-0.000000	discard	Solver tolerance sweep	manual	tol_sweep	0	0.000602
exp11489	4.50941488e-29	0.000000	-0.000000	discard	cycle 84 u=0.0990	agent0	initial_cond	0	0.000000
exp11490	4.50941488e-29	0.000000	-0.000000	discard	cycle 84 u=0.0990	agent0	initial_cond	1	0.000000
exp11491	4.88330883e-29	0.000000	-0.000000	discard	cycle 84 u=0.0990	agent0	initial_cond	0	0.000000
exp11492	4.88330883e-29	0.000000	-0.000000	discard	cycle 84 u=0.0990	agent0	initial_cond	1	0.000000
exp11493	4.88330883e-29	0.000000	-0.000000	discard	cycle 84 u=0.0990	agent0	initial_cond	0	0.000000
exp11494	5.74085541e-29	0.000000	-0.000000	discard	cycle 84 u=0.0995	agent0	initial_cond	0	0.000000
exp11495	5.74085541e-29	0.000000	-0.000000	discard	cycle 84 u=0.0995	agent0	initial_cond	1	0.000000
exp11496	5.74085541e-29	0.000000	-0.000000	discard	cycle 84 u=0.0995	agent0	initial_cond	0	0.000000
exp11497	1.54984578e-28	0.000000	0.000000	discard	cycle 84 u=0.0995	agent0	initial_cond	1	-0.000000
exp11498	1.54984578e-28	0.000000	0.000000	discard	cycle 84 u=0.0995	agent0	initial_cond	0	-0.000000
exp11499	1.54984578e-28	0.000000	0.000000	discard	cycle 84 u=0.0995	agent0	initial_cond	0	-0.000000
exp11500	1.60328418e-29	0.000000	-0.000000	discard	cycle 84 u=0.0995	agent0	initial_cond	1	-0.000000
exp11501	1.60328418e-29	0.000000	-0.000000	discard	cycle 84 u=0.0995	agent0	initial_cond	0	-0.000000
exp11502	1.60328418e-29	0.000000	-0.000000	discard	cycle 84 u=0.0995	agent0	initial_cond	1	-0.000000
exp11503	7.34590618e-29	0.000000	0.000000	discard	cycle 84 u=0.0995	agent0	initial_cond	0	0.000000
exp11504	7.34590618e-29	0.000000	0.000000	discard	cycle 84 u=0.0995	agent0	initial_cond	0	0.000000
exp11505	7.34590618e-29	0.000000	0.000000	discard	cycle 84 u=0.0995	agent0	initial_cond	1	0.000000
exp11506	4.46546993e-29	0.000000	0.000000	discard	cycle 84 u=0.1000	agent0	initial_cond	0	-0.000000
exp11507	4.46546993e-29	0.000000	0.000000	discard	cycle 84 u=0.1000	agent0	initial_cond	1	-0.000000
exp11508	4.46546993e-29	0.000000	0.000000	discard	cycle 84 u=0.1000	agent0	initial_cond	0	-0.000000
exp11509	4.08106752e-29	0.000000	0.000000	discard	cycle 84 u=0.1000	agent0	initial_cond	0	-0.000000
exp11510	4.08106752e-29	0.000000	0.000000	discard	cycle 84 u=0.1000	agent0	initial_cond	1	-0.000000
exp11511	4.08106752e-29	0.000000	0.000000	discard	cycle 84 u=0.1000	agent0	initial_cond	0	-0.000000
exp11512	4.58623706e-29	0.000000	0.000000	discard	cycle 84 u=0.1000	agent0	initial_cond	1	-0.000000
exp11513	4.58623706e-29	0.000000	0.000000	discard	cycle 84 u=0.1000	agent0	initial_cond	0	-0.000000
exp11514	4.58623706e-29	0.000000	0.000000	discard	cycle 84 u=0.1000	agent0	initial_cond	0	-0.000000
exp11515	4.39794337e-29	0.000000	0.000000	discard	cycle 84 u=0.1000	agent0	initial_cond	1	-0.000000
exp11516	4.39794337e-29	0.000000	0.000000	discard	cycle 84 u=0.1000	agent0	initial_cond	0	-0.000000
exp11517	4.39794337e-29	0.000000	0.000000	discard	cycle 84 u=0.1000	agent0	initial_cond	1	-0.000000
exp11518	1.36727475e-28	0.000000	0.000000	discard	cycle 84 u=0.1050	agent0	initial_cond	0	-0.000000
exp11519	1.36727475e-28	0.000000	0.000000	discard	cycle 84 u=0.1050	agent0	initial_cond	0	-0.000000
exp11520	1.36727475e-28	0.000000	0.000000	discard	cycle 84 u=0.1050	agent0	initial_cond	1	-0.000000
exp11521	6.14461376e-29	0.000000	0.000000	discard	cycle 84 u=0.1050	agent0	initial_cond	0	-0.000000
exp11522	6.14461376e-29	0.000000	0.000000	discard	cycle 84 u=0.1050	agent0	initial_cond	1	-0.000000
exp11523	6.14461376e-29	0.000000	0.000000	discard	cycle 84 u=0.1050	agent0	initial_cond	0	-0.000000
exp11524	1.75906666e-28	0.000000	0.000000	discard	cycle 84 u=0.1050	agent0	initial_cond	0	-0.000000
exp11525	1.75906666e-28	0.000000	0.000000	discard	cycle 84 u=0.1050	agent0	initial_cond	1	-0.000000
exp11526	1.75906666e-28	0.000000	0.000000	discard	cycle 84 u=0.1050	agent0	initial_cond	0	-0.000000
exp11527	1.11257917e-28	0.000000	0.000000	discard	cycle 84 u=0.1050	agent0	initial_cond	0	-0.000000
exp11528	1.11257917e-28	0.000000	0.000000	discard	cycle 84 u=0.1050	agent0	initial_cond	0	-0.000000
exp11529	1.11257917e-28	0.000000	0.000000	discard	cycle 84 u=0.1050	agent0	initial_cond	0	-0.000000
exp11530	8.58580947e-29	0.000000	0.000000	discard	cycle 85 u=0.0975	agent0	initial_cond	1	0.000000
exp11531	8.58580947e-29	0.000000	0.000000	discard	cycle 85 u=0.0975	agent0	initial_cond	0	0.000000
exp11531	6.91159813e-18	0.070278	-0.000000	discard	Final SOTA verify	manual	final_check	0	0.000097
exp11532	8.58580947e-29	0.000000	0.000000	discard	cycle 85 u=0.0975	agent0	initial_cond	0	0.000000
exp11533	5.23962023e-29	0.000000	0.000000	discard	cycle 85 u=0.0975	agent0	initial_cond	0	0.000000
exp11534	5.23962023e-29	0.000000	0.000000	discard	cycle 85 u=0.0975	agent0	initial_cond	0	0.000000
exp11535	5.23962023e-29	0.000000	0.000000	discard	cycle 85 u=0.0975	agent0	initial_cond	1	0.000000
exp11536	4.03266298e-29	0.000000	0.000000	discard	cycle 85 u=0.0975	agent0	initial_cond	0	0.000000
exp11537	4.03266298e-29	0.000000	0.000000	discard	cycle 85 u=0.0975	agent0	initial_cond	0	0.000000
exp11538	4.03266298e-29	0.000000	0.000000	discard	cycle 85 u=0.0975	agent0	initial_cond	0	0.000000
exp11539	4.80015937e-29	0.000000	0.000000	discard	cycle 85 u=0.0975	agent0	initial_cond	0	0.000000
exp11540	4.80015937e-29	0.000000	0.000000	discard	cycle 85 u=0.0975	agent0	initial_cond	1	0.000000
exp11541	4.80015937e-29	0.000000	0.000000	discard	cycle 85 u=0.0975	agent0	initial_cond	0	0.000000
exp11542	2.68824537e-29	0.000000	0.000000	discard	cycle 85 u=0.0980	agent0	initial_cond	0	-0.000000
exp11543	2.68824537e-29	0.000000	0.000000	discard	cycle 85 u=0.0980	agent0	initial_cond	0	-0.000000
exp11544	6.12999068e-15	0.002357	-0.000000	discard	Extreme K_amplitude bifurcation	manual	extreme_bifurc	0	-0.000000
exp11545	2.68824537e-29	0.000000	0.000000	discard	cycle 85 u=0.0980	agent0	initial_cond	0	-0.000000
exp11546	6.16758073e-29	0.000000	0.000000	discard	cycle 85 u=0.0980	agent0	initial_cond	1	-0.000000
exp11546	6.18472616e-18	0.011783	-0.000000	discard	Extreme K_amplitude bifurcation	manual	extreme_bifurc	1	-0.000002
exp11547	6.16758073e-29	0.000000	0.000000	discard	cycle 85 u=0.0980	agent0	initial_cond	0	-0.000000
exp11548	1.61347764e-17	0.018848	-0.000000	discard	Extreme K_amplitude bifurcation	manual	extreme_bifurc	0	-0.000004
exp11549	6.16758073e-29	0.000000	0.000000	discard	cycle 85 u=0.0980	agent0	initial_cond	0	-0.000000
exp11550	2.01926478e-29	0.000000	0.000000	discard	cycle 85 u=0.0980	agent0	initial_cond	0	0.000000
exp11551	1.40197541e-15	0.023554	-0.000000	discard	Extreme K_amplitude bifurcation	manual	extreme_bifurc	0	-0.000005
exp11552	2.01926478e-29	0.000000	0.000000	discard	cycle 85 u=0.0980	agent0	initial_cond	0	0.000000
exp11553	2.01926478e-29	0.000000	0.000000	discard	cycle 85 u=0.0980	agent0	initial_cond	1	0.000000
exp11554	7.04401156e-15	0.035300	-0.000000	discard	Extreme K_amplitude bifurcation	manual	extreme_bifurc	0	-0.000006
exp11555	1.30310780e-28	0.000000	0.000000	discard	cycle 85 u=0.0980	agent0	initial_cond	0	-0.000000
exp11556	1.30310780e-28	0.000000	0.000000	discard	cycle 85 u=0.0980	agent0	initial_cond	0	-0.000000
exp11556	2.63855766e-17	0.115920	-0.000000	discard	Extreme K_amplitude bifurcation	manual	extreme_bifurc	1	0.001044
exp11557	1.30310780e-28	0.000000	0.000000	discard	cycle 85 u=0.0980	agent0	initial_cond	0	-0.000000
exp11558	5.47401746e-17	0.181265	-0.000000	discard	Extreme K_amplitude bifurcation	manual	extreme_bifurc	0	0.006910
exp11558	5.45343271e-29	0.000000	0.000000	discard	cycle 85 u=0.0982	agent0	initial_cond	0	-0.000000
exp11559	5.45343271e-29	0.000000	0.000000	discard	cycle 85 u=0.0982	agent0	initial_cond	1	-0.000000
exp11560	1.77784626e-16	0.222365	0.000000	discard	Extreme K_amplitude bifurcation	manual	extreme_bifurc	0	0.015962
exp11561	5.45343271e-29	0.000000	0.000000	discard	cycle 85 u=0.0982	agent0	initial_cond	0	-0.000000
exp11562	1.23429977e-28	0.000000	0.000000	discard	cycle 85 u=0.0982	agent0	initial_cond	0	0.000000
exp11563	8.63549880e-17	0.261410	-0.000000	discard	Extreme K_amplitude bifurcation	manual	extreme_bifurc	1	0.030737
exp11564	1.23429977e-28	0.000000	0.000000	discard	cycle 85 u=0.0982	agent0	initial_cond	0	0.000000
exp11565	1.23429977e-28	0.000000	0.000000	discard	cycle 85 u=0.0982	agent0	initial_cond	0	0.000000
exp11566	8.11360092e-17	0.316271	-0.000000	discard	Extreme K_amplitude bifurcation	manual	extreme_bifurc	0	0.066008
exp11567	1.88036672e-29	0.000000	0.000000	discard	cycle 85 u=0.0982	agent0	initial_cond	1	0.000000
exp11568	1.88036672e-29	0.000000	0.000000	discard	cycle 85 u=0.0982	agent0	initial_cond	0	0.000000
exp11569	1.88036672e-29	0.000000	0.000000	discard	cycle 85 u=0.0982	agent0	initial_cond	0	0.000000
exp11570	1.91190259e-29	0.000000	-0.000000	discard	cycle 85 u=0.0982	agent0	initial_cond	0	0.000000
exp11571	1.91190259e-29	0.000000	-0.000000	discard	cycle 85 u=0.0982	agent0	initial_cond	0	0.000000
exp11572	1.91190259e-29	0.000000	-0.000000	discard	cycle 85 u=0.0982	agent0	initial_cond	1	0.000000
exp11573	6.13049994e-29	0.000000	0.000000	discard	cycle 85 u=0.0985	agent0	initial_cond	0	0.000000
exp11574	6.13049994e-29	0.000000	0.000000	discard	cycle 85 u=0.0985	agent0	initial_cond	0	0.000000
exp11575	6.13049994e-29	0.000000	0.000000	discard	cycle 85 u=0.0985	agent0	initial_cond	0	0.000000
exp11576	5.49750971e-29	0.000000	0.000000	discard	cycle 85 u=0.0985	agent0	initial_cond	0	0.000000
exp11577	5.49750971e-29	0.000000	0.000000	discard	cycle 85 u=0.0985	agent0	initial_cond	1	0.000000
exp11578	5.49750971e-29	0.000000	0.000000	discard	cycle 85 u=0.0985	agent0	initial_cond	0	0.000000
exp11579	4.15642452e-29	0.000000	0.000000	discard	cycle 85 u=0.0985	agent0	initial_cond	0	0.000000
exp11580	4.15642452e-29	0.000000	0.000000	discard	cycle 85 u=0.0985	agent0	initial_cond	0	0.000000
exp11581	4.15642452e-29	0.000000	0.000000	discard	cycle 85 u=0.0985	agent0	initial_cond	0	0.000000
exp11582	2.19292611e-29	0.000000	0.000000	discard	cycle 85 u=0.0985	agent0	initial_cond	1	-0.000000
exp11583	3.79064414e-17	0.081814	-0.000000	discard	Optimize around K=0.05	manual	k005_optimize	0	0.000212
exp11584	2.19292611e-29	0.000000	0.000000	discard	cycle 85 u=0.0985	agent0	initial_cond	0	-0.000000
exp11585	2.19292611e-29	0.000000	0.000000	discard	cycle 85 u=0.0985	agent0	initial_cond	0	-0.000000
exp11585	3.61254610e-17	0.093272	-0.000000	discard	Optimize around K=0.05	manual	k005_optimize	0	0.000394
exp11586	4.22491788e-29	0.000000	0.000000	discard	cycle 85 u=0.0990	agent0	initial_cond	0	-0.000000
exp11587	3.03977357e-17	0.102376	-0.000000	discard	Optimize around K=0.05	manual	k005_optimize	0	0.000602
exp11588	4.22491788e-29	0.000000	0.000000	discard	cycle 85 u=0.0990	agent0	initial_cond	0	-0.000000
exp11589	4.22491788e-29	0.000000	0.000000	discard	cycle 85 u=0.0990	agent0	initial_cond	1	-0.000000
exp11590	7.11256678e-17	0.115920	-0.000000	discard	Optimize around K=0.05	manual	k005_optimize	1	0.001044
exp11591	3.22245147e-29	0.000000	0.000000	discard	cycle 85 u=0.0990	agent0	initial_cond	0	0.000000
exp11592	9.26109708e-17	0.081814	-0.000000	discard	Optimize around K=0.05	manual	k005_optimize	0	0.000212
exp11593	3.22245147e-29	0.000000	0.000000	discard	cycle 85 u=0.0990	agent0	initial_cond	0	0.000000
exp11594	3.22245147e-29	0.000000	0.000000	discard	cycle 85 u=0.0990	agent0	initial_cond	0	0.000000
exp11595	3.22017674e-17	0.093272	0.000000	discard	Optimize around K=0.05	manual	k005_optimize	0	0.000394
exp11596	4.50941488e-29	0.000000	-0.000000	discard	cycle 85 u=0.0990	agent0	initial_cond	0	0.000000
exp11597	5.24367656e-17	0.102376	-0.000000	discard	Optimize around K=0.05	manual	k005_optimize	1	0.000602
exp11597	4.50941488e-29	0.000000	-0.000000	discard	cycle 85 u=0.0990	agent0	initial_cond	1	0.000000
exp11598	4.50941488e-29	0.000000	-0.000000	discard	cycle 85 u=0.0990	agent0	initial_cond	0	0.000000
exp11599	1.02951648e-16	0.115920	-0.000000	discard	Optimize around K=0.05	manual	k005_optimize	0	0.001044
exp11600	4.88330883e-29	0.000000	-0.000000	discard	cycle 85 u=0.0990	agent0	initial_cond	0	0.000000
exp11601	1.99375429e-17	0.081814	-0.000000	discard	Optimize around K=0.05	manual	k005_optimize	1	0.000212
exp11601	4.88330883e-29	0.000000	-0.000000	discard	cycle 85 u=0.0990	agent0	initial_cond	0	0.000000
exp11602	4.88330883e-29	0.000000	-0.000000	discard	cycle 85 u=0.0990	agent0	initial_cond	0	0.000000
exp11603	1.11152579e-15	0.093272	-0.000000	discard	Optimize around K=0.05	manual	k005_optimize	0	0.000394
exp11604	5.74085541e-29	0.000000	-0.000000	discard	cycle 85 u=0.0995	agent0	initial_cond	1	0.000000
exp11605	5.74085541e-29	0.000000	-0.000000	discard	cycle 85 u=0.0995	agent0	initial_cond	0	0.000000
exp11605	2.84094980e-16	0.102376	-0.000000	discard	Optimize around K=0.05	manual	k005_optimize	0	0.000602
exp11606	5.74085541e-29	0.000000	-0.000000	discard	cycle 85 u=0.0995	agent0	initial_cond	0	0.000000
exp11607	8.49879005e-17	0.115920	-0.000000	discard	Optimize around K=0.05	manual	k005_optimize	1	0.001044
exp11608	1.54984578e-28	0.000000	0.000000	discard	cycle 85 u=0.0995	agent0	initial_cond	0	-0.000000
exp11609	1.54984578e-28	0.000000	0.000000	discard	cycle 85 u=0.0995	agent0	initial_cond	0	-0.000000
exp11609	2.12214037e-17	0.081814	-0.000000	discard	Optimize around K=0.05	manual	k005_optimize	0	0.000212
exp11610	1.54984578e-28	0.000000	0.000000	discard	cycle 85 u=0.0995	agent0	initial_cond	1	-0.000000
exp11611	4.21562135e-17	0.093272	-0.000000	discard	Optimize around K=0.05	manual	k005_optimize	0	0.000394
exp11612	1.60328418e-29	0.000000	-0.000000	discard	cycle 85 u=0.0995	agent0	initial_cond	0	-0.000000
exp11613	1.60328418e-29	0.000000	-0.000000	discard	cycle 85 u=0.0995	agent0	initial_cond	0	-0.000000
exp11613	1.35951281e-17	0.102376	0.000000	discard	Optimize around K=0.05	manual	k005_optimize	0	0.000602
exp11614	1.60328418e-29	0.000000	-0.000000	discard	cycle 85 u=0.0995	agent0	initial_cond	0	-0.000000
exp11615	5.19691675e-17	0.115920	-0.000000	discard	Optimize around K=0.05	manual	k005_optimize	0	0.001044
exp11616	7.34590618e-29	0.000000	0.000000	discard	cycle 85 u=0.0995	agent0	initial_cond	0	0.000000
exp11617	7.34590618e-29	0.000000	0.000000	discard	cycle 85 u=0.0995	agent0	initial_cond	1	0.000000
exp11618	3.79064414e-17	0.081814	-0.000000	discard	Optimize around K=0.05	manual	k005_optimize	1	0.000212
exp11619	7.34590618e-29	0.000000	0.000000	discard	cycle 85 u=0.0995	agent0	initial_cond	0	0.000000
exp11620	3.61254610e-17	0.093272	-0.000000	discard	Optimize around K=0.05	manual	k005_optimize	0	0.000394
exp11621	4.46546993e-29	0.000000	0.000000	discard	cycle 85 u=0.1000	agent0	initial_cond	0	-0.000000
exp11622	4.46546993e-29	0.000000	0.000000	discard	cycle 85 u=0.1000	agent0	initial_cond	0	-0.000000
exp11623	3.03977357e-17	0.102376	-0.000000	discard	Optimize around K=0.05	manual	k005_optimize	0	0.000602
exp11624	4.46546993e-29	0.000000	0.000000	discard	cycle 85 u=0.1000	agent0	initial_cond	0	-0.000000
exp11625	7.11256678e-17	0.115920	-0.000000	discard	Optimize around K=0.05	manual	k005_optimize	1	0.001044
exp11625	4.08106752e-29	0.000000	0.000000	discard	cycle 85 u=0.1000	agent0	initial_cond	1	-0.000000
exp11626	4.08106752e-29	0.000000	0.000000	discard	cycle 85 u=0.1000	agent0	initial_cond	0	-0.000000
exp11627	9.26109708e-17	0.081814	-0.000000	discard	Optimize around K=0.05	manual	k005_optimize	0	0.000212
exp11628	4.08106752e-29	0.000000	0.000000	discard	cycle 85 u=0.1000	agent0	initial_cond	0	-0.000000
exp11629	4.58623706e-29	0.000000	0.000000	discard	cycle 85 u=0.1000	agent0	initial_cond	0	-0.000000
exp11629	3.22017674e-17	0.093272	0.000000	discard	Optimize around K=0.05	manual	k005_optimize	0	0.000394
exp11630	4.58623706e-29	0.000000	0.000000	discard	cycle 85 u=0.1000	agent0	initial_cond	0	-0.000000
exp11631	5.24367656e-17	0.102376	-0.000000	discard	Optimize around K=0.05	manual	k005_optimize	0	0.000602
exp11632	4.58623706e-29	0.000000	0.000000	discard	cycle 85 u=0.1000	agent0	initial_cond	1	-0.000000
exp11633	4.39794337e-29	0.000000	0.000000	discard	cycle 85 u=0.1000	agent0	initial_cond	0	-0.000000
exp11633	1.02951648e-16	0.115920	-0.000000	discard	Optimize around K=0.05	manual	k005_optimize	0	0.001044
