exp_id	residual	solution_norm	solution_mean	status	description	agent	design	elapsed_s	solution_energy
exp11033	2.42745501e-17	0.102376	-0.000000	discard	Fine K_amplitude sweep	manual	fine_bifurc	1	0.000602
exp11034	4.50941488e-29	0.000000	-0.000000	discard	cycle 80 u=0.0990	agent0	initial_cond	0	0.000000
exp11035	4.50941488e-29	0.000000	-0.000000	discard	cycle 80 u=0.0990	agent0	initial_cond	0	0.000000
exp11036	2.42745501e-17	0.102376	-0.000000	discard	Fine K_amplitude sweep	manual	fine_bifurc	1	0.000602
exp11037	4.50941488e-29	0.000000	-0.000000	discard	cycle 80 u=0.0990	agent0	initial_cond	0	0.000000
exp11038	4.88330883e-29	0.000000	-0.000000	discard	cycle 80 u=0.0990	agent0	initial_cond	0	0.000000
exp11039	2.42745501e-17	0.102376	-0.000000	discard	Fine K_amplitude sweep	manual	fine_bifurc	1	0.000602
exp11040	4.88330883e-29	0.000000	-0.000000	discard	cycle 80 u=0.0990	agent0	initial_cond	1	0.000000
exp11041	4.88330883e-29	0.000000	-0.000000	discard	cycle 80 u=0.0990	agent0	initial_cond	0	0.000000
exp11042	2.42745501e-17	0.102376	-0.000000	discard	Fine K_amplitude sweep	manual	fine_bifurc	0	0.000602
exp11042	5.74085541e-29	0.000000	-0.000000	discard	cycle 80 u=0.0995	agent0	initial_cond	0	0.000000
exp11043	5.74085541e-29	0.000000	-0.000000	discard	cycle 80 u=0.0995	agent0	initial_cond	0	0.000000
exp11044	5.74085541e-29	0.000000	-0.000000	discard	cycle 80 u=0.0995	agent0	initial_cond	0	0.000000
exp11045	2.42745501e-17	0.102376	-0.000000	discard	Fine K_amplitude sweep	manual	fine_bifurc	0	0.000602
exp11046	1.54984578e-28	0.000000	0.000000	discard	cycle 80 u=0.0995	agent0	initial_cond	1	-0.000000
exp11047	1.54984578e-28	0.000000	0.000000	discard	cycle 80 u=0.0995	agent0	initial_cond	0	-0.000000
exp11048	2.42745501e-17	0.102376	-0.000000	discard	Fine K_amplitude sweep	manual	fine_bifurc	0	0.000602
exp11049	1.54984578e-28	0.000000	0.000000	discard	cycle 80 u=0.0995	agent0	initial_cond	0	-0.000000
exp11050	1.60328418e-29	0.000000	-0.000000	discard	cycle 80 u=0.0995	agent0	initial_cond	0	-0.000000
exp11051	2.42745501e-17	0.102376	-0.000000	discard	Fine K_amplitude sweep	manual	fine_bifurc	0	0.000602
exp11052	1.60328418e-29	0.000000	-0.000000	discard	cycle 80 u=0.0995	agent0	initial_cond	0	-0.000000
exp11053	1.60328418e-29	0.000000	-0.000000	discard	cycle 80 u=0.0995	agent0	initial_cond	1	-0.000000
exp11054	7.34590618e-29	0.000000	0.000000	discard	cycle 80 u=0.0995	agent0	initial_cond	0	0.000000
exp11054	2.42745501e-17	0.102376	-0.000000	discard	Fine K_amplitude sweep	manual	fine_bifurc	0	0.000602
exp11055	7.34590618e-29	0.000000	0.000000	discard	cycle 80 u=0.0995	agent0	initial_cond	0	0.000000
exp11056	7.34590618e-29	0.000000	0.000000	discard	cycle 80 u=0.0995	agent0	initial_cond	0	0.000000
exp11057	4.46546993e-29	0.000000	0.000000	discard	cycle 80 u=0.1000	agent0	initial_cond	0	-0.000000
exp11058	4.46546993e-29	0.000000	0.000000	discard	cycle 80 u=0.1000	agent0	initial_cond	1	-0.000000
exp11059	4.46546993e-29	0.000000	0.000000	discard	cycle 80 u=0.1000	agent0	initial_cond	0	-0.000000
exp11060	4.08106752e-29	0.000000	0.000000	discard	cycle 80 u=0.1000	agent0	initial_cond	0	-0.000000
exp11061	4.08106752e-29	0.000000	0.000000	discard	cycle 80 u=0.1000	agent0	initial_cond	0	-0.000000
exp11062	4.08106752e-29	0.000000	0.000000	discard	cycle 80 u=0.1000	agent0	initial_cond	0	-0.000000
exp11063	4.58623706e-29	0.000000	0.000000	discard	cycle 80 u=0.1000	agent0	initial_cond	1	-0.000000
exp11064	4.58623706e-29	0.000000	0.000000	discard	cycle 80 u=0.1000	agent0	initial_cond	0	-0.000000
exp11065	4.58623706e-29	0.000000	0.000000	discard	cycle 80 u=0.1000	agent0	initial_cond	0	-0.000000
exp11066	4.39794337e-29	0.000000	0.000000	discard	cycle 80 u=0.1000	agent0	initial_cond	0	-0.000000
exp11067	4.39794337e-29	0.000000	0.000000	discard	cycle 80 u=0.1000	agent0	initial_cond	0	-0.000000
exp11068	4.39794337e-29	0.000000	0.000000	discard	cycle 80 u=0.1000	agent0	initial_cond	1	-0.000000
exp11069	1.36727475e-28	0.000000	0.000000	discard	cycle 80 u=0.1050	agent0	initial_cond	0	-0.000000
exp11070	1.36727475e-28	0.000000	0.000000	discard	cycle 80 u=0.1050	agent0	initial_cond	0	-0.000000
exp11071	1.36727475e-28	0.000000	0.000000	discard	cycle 80 u=0.1050	agent0	initial_cond	0	-0.000000
exp11071	2.42745501e-17	0.102376	-0.000000	discard	Final SOTA verification with phase	manual	verify_final	0	0.000602
exp11072	6.14461376e-29	0.000000	0.000000	discard	cycle 80 u=0.1050	agent0	initial_cond	0	-0.000000
exp11073	6.14461376e-29	0.000000	0.000000	discard	cycle 80 u=0.1050	agent0	initial_cond	1	-0.000000
exp11074	6.14461376e-29	0.000000	0.000000	discard	cycle 80 u=0.1050	agent0	initial_cond	0	-0.000000
exp11075	1.75906666e-28	0.000000	0.000000	discard	cycle 80 u=0.1050	agent0	initial_cond	0	-0.000000
exp11076	1.75906666e-28	0.000000	0.000000	discard	cycle 80 u=0.1050	agent0	initial_cond	1	-0.000000
exp11077	1.75906666e-28	0.000000	0.000000	discard	cycle 80 u=0.1050	agent0	initial_cond	0	-0.000000
exp11078	1.11257917e-28	0.000000	0.000000	discard	cycle 80 u=0.1050	agent0	initial_cond	1	-0.000000
exp11079	1.11257917e-28	0.000000	0.000000	discard	cycle 80 u=0.1050	agent0	initial_cond	0	-0.000000
exp11080	1.11257917e-28	0.000000	0.000000	discard	cycle 80 u=0.1050	agent0	initial_cond	0	-0.000000
exp11081	8.58580947e-29	0.000000	0.000000	discard	cycle 81 u=0.0975	agent0	initial_cond	1	0.000000
exp11082	8.58580947e-29	0.000000	0.000000	discard	cycle 81 u=0.0975	agent0	initial_cond	0	0.000000
exp11083	8.58580947e-29	0.000000	0.000000	discard	cycle 81 u=0.0975	agent0	initial_cond	1	0.000000
exp11084	5.23962023e-29	0.000000	0.000000	discard	cycle 81 u=0.0975	agent0	initial_cond	0	0.000000
exp11085	5.23962023e-29	0.000000	0.000000	discard	cycle 81 u=0.0975	agent0	initial_cond	0	0.000000
exp11086	5.23962023e-29	0.000000	0.000000	discard	cycle 81 u=0.0975	agent0	initial_cond	1	0.000000
exp11087	4.03266298e-29	0.000000	0.000000	discard	cycle 81 u=0.0975	agent0	initial_cond	0	0.000000
exp11088	4.03266298e-29	0.000000	0.000000	discard	cycle 81 u=0.0975	agent0	initial_cond	1	0.000000
exp11089	4.03266298e-29	0.000000	0.000000	discard	cycle 81 u=0.0975	agent0	initial_cond	0	0.000000
exp11090	4.80015937e-29	0.000000	0.000000	discard	cycle 81 u=0.0975	agent0	initial_cond	0	0.000000
exp11091	6.91159813e-18	0.070278	-0.000000	discard	Correct SOTA with K=0.30	manual	correct_sota	1	0.000097
exp11091	4.80015937e-29	0.000000	0.000000	discard	cycle 81 u=0.0975	agent0	initial_cond	1	0.000000
exp11092	4.80015937e-29	0.000000	0.000000	discard	cycle 81 u=0.0975	agent0	initial_cond	0	0.000000
exp11093	2.68824537e-29	0.000000	0.000000	discard	cycle 81 u=0.0980	agent0	initial_cond	1	-0.000000
exp11094	2.68824537e-29	0.000000	0.000000	discard	cycle 81 u=0.0980	agent0	initial_cond	0	-0.000000
exp11095	2.68824537e-29	0.000000	0.000000	discard	cycle 81 u=0.0980	agent0	initial_cond	0	-0.000000
exp11096	6.16758073e-29	0.000000	0.000000	discard	cycle 81 u=0.0980	agent0	initial_cond	1	-0.000000
exp11097	6.16758073e-29	0.000000	0.000000	discard	cycle 81 u=0.0980	agent0	initial_cond	0	-0.000000
exp11098	6.16758073e-29	0.000000	0.000000	discard	cycle 81 u=0.0980	agent0	initial_cond	1	-0.000000
exp11099	2.01926478e-29	0.000000	0.000000	discard	cycle 81 u=0.0980	agent0	initial_cond	0	0.000000
exp11100	2.01926478e-29	0.000000	0.000000	discard	cycle 81 u=0.0980	agent0	initial_cond	0	0.000000
exp11101	2.01926478e-29	0.000000	0.000000	discard	cycle 81 u=0.0980	agent0	initial_cond	1	0.000000
exp11102	1.30310780e-28	0.000000	0.000000	discard	cycle 81 u=0.0980	agent0	initial_cond	0	-0.000000
exp11103	1.30310780e-28	0.000000	0.000000	discard	cycle 81 u=0.0980	agent0	initial_cond	0	-0.000000
exp11104	1.30310780e-28	0.000000	0.000000	discard	cycle 81 u=0.0980	agent0	initial_cond	0	-0.000000
exp11105	5.45343271e-29	0.000000	0.000000	discard	cycle 81 u=0.0982	agent0	initial_cond	0	-0.000000
exp11106	5.45343271e-29	0.000000	0.000000	discard	cycle 81 u=0.0982	agent0	initial_cond	1	-0.000000
exp11107	5.45343271e-29	0.000000	0.000000	discard	cycle 81 u=0.0982	agent0	initial_cond	0	-0.000000
exp11108	1.23429977e-28	0.000000	0.000000	discard	cycle 81 u=0.0982	agent0	initial_cond	0	0.000000
exp11109	1.23429977e-28	0.000000	0.000000	discard	cycle 81 u=0.0982	agent0	initial_cond	0	0.000000
exp11110	1.23429977e-28	0.000000	0.000000	discard	cycle 81 u=0.0982	agent0	initial_cond	0	0.000000
exp11111	1.88036672e-29	0.000000	0.000000	discard	cycle 81 u=0.0982	agent0	initial_cond	1	0.000000
exp11112	1.88036672e-29	0.000000	0.000000	discard	cycle 81 u=0.0982	agent0	initial_cond	0	0.000000
exp11113	1.88036672e-29	0.000000	0.000000	discard	cycle 81 u=0.0982	agent0	initial_cond	0	0.000000
exp11114	1.91190259e-29	0.000000	-0.000000	discard	cycle 81 u=0.0982	agent0	initial_cond	0	0.000000
exp11115	1.91190259e-29	0.000000	-0.000000	discard	cycle 81 u=0.0982	agent0	initial_cond	0	0.000000
exp11116	7.87547131e-17	0.097831	-0.000000	discard	3D fine grid around SOTA	manual	3d_grid	0	0.000490
exp11117	1.91190259e-29	0.000000	-0.000000	discard	cycle 81 u=0.0982	agent0	initial_cond	1	0.000000
exp11118	6.13049994e-29	0.000000	0.000000	discard	cycle 81 u=0.0985	agent0	initial_cond	0	0.000000
exp11119	7.09286322e-17	0.100106	-0.000000	discard	3D fine grid around SOTA	manual	3d_grid	0	0.000544
exp11120	6.13049994e-29	0.000000	0.000000	discard	cycle 81 u=0.0985	agent0	initial_cond	0	0.000000
exp11121	6.13049994e-29	0.000000	0.000000	discard	cycle 81 u=0.0985	agent0	initial_cond	0	0.000000
exp11121	5.24367656e-17	0.102376	-0.000000	discard	3D fine grid around SOTA	manual	3d_grid	0	0.000602
exp11122	5.49750971e-29	0.000000	0.000000	discard	cycle 81 u=0.0985	agent0	initial_cond	0	0.000000
exp11123	2.10227642e-17	0.104643	-0.000000	discard	3D fine grid around SOTA	manual	3d_grid	1	0.000664
exp11124	5.49750971e-29	0.000000	0.000000	discard	cycle 81 u=0.0985	agent0	initial_cond	1	0.000000
exp11125	5.49750971e-29	0.000000	0.000000	discard	cycle 81 u=0.0985	agent0	initial_cond	0	0.000000
exp11126	6.81542365e-17	0.106907	-0.000000	discard	3D fine grid around SOTA	manual	3d_grid	0	0.000731
exp11127	4.15642452e-29	0.000000	0.000000	discard	cycle 81 u=0.0985	agent0	initial_cond	0	0.000000
exp11128	4.15642452e-29	0.000000	0.000000	discard	cycle 81 u=0.0985	agent0	initial_cond	0	0.000000
exp11129	2.95188736e-17	0.097831	-0.000000	discard	3D fine grid around SOTA	manual	3d_grid	0	0.000490
exp11130	4.15642452e-29	0.000000	0.000000	discard	cycle 81 u=0.0985	agent0	initial_cond	0	0.000000
exp11131	2.19292611e-29	0.000000	0.000000	discard	cycle 81 u=0.0985	agent0	initial_cond	1	-0.000000
exp11132	2.30785610e-17	0.100106	-0.000000	discard	3D fine grid around SOTA	manual	3d_grid	1	0.000544
exp11133	2.19292611e-29	0.000000	0.000000	discard	cycle 81 u=0.0985	agent0	initial_cond	0	-0.000000
exp11134	2.19292611e-29	0.000000	0.000000	discard	cycle 81 u=0.0985	agent0	initial_cond	0	-0.000000
exp11134	4.02434142e-17	0.102376	0.000000	discard	3D fine grid around SOTA	manual	3d_grid	0	0.000602
exp11135	4.22491788e-29	0.000000	0.000000	discard	cycle 81 u=0.0990	agent0	initial_cond	0	-0.000000
exp11136	1.92476550e-17	0.104643	-0.000000	discard	3D fine grid around SOTA	manual	3d_grid	0	0.000664
exp11137	4.22491788e-29	0.000000	0.000000	discard	cycle 81 u=0.0990	agent0	initial_cond	0	-0.000000
exp11138	4.22491788e-29	0.000000	0.000000	discard	cycle 81 u=0.0990	agent0	initial_cond	1	-0.000000
exp11139	2.98067223e-17	0.106907	-0.000000	discard	3D fine grid around SOTA	manual	3d_grid	0	0.000731
exp11140	3.22245147e-29	0.000000	0.000000	discard	cycle 81 u=0.0990	agent0	initial_cond	0	0.000000
exp11141	3.22245147e-29	0.000000	0.000000	discard	cycle 81 u=0.0990	agent0	initial_cond	0	0.000000
exp11142	4.20732633e-17	0.097831	-0.000000	discard	3D fine grid around SOTA	manual	3d_grid	1	0.000490
exp11143	3.22245147e-29	0.000000	0.000000	discard	cycle 81 u=0.0990	agent0	initial_cond	0	0.000000
exp11144	4.50941488e-29	0.000000	-0.000000	discard	cycle 81 u=0.0990	agent0	initial_cond	0	0.000000
exp11145	5.25454391e-17	0.100106	-0.000000	discard	3D fine grid around SOTA	manual	3d_grid	0	0.000544
exp11146	4.50941488e-29	0.000000	-0.000000	discard	cycle 81 u=0.0990	agent0	initial_cond	1	0.000000
exp11147	4.50941488e-29	0.000000	-0.000000	discard	cycle 81 u=0.0990	agent0	initial_cond	0	0.000000
exp11147	2.42745501e-17	0.102376	-0.000000	discard	3D fine grid around SOTA	manual	3d_grid	0	0.000602
exp11148	4.88330883e-29	0.000000	-0.000000	discard	cycle 81 u=0.0990	agent0	initial_cond	0	0.000000
exp11149	3.34853091e-17	0.104643	-0.000000	discard	3D fine grid around SOTA	manual	3d_grid	1	0.000664
exp11150	4.88330883e-29	0.000000	-0.000000	discard	cycle 81 u=0.0990	agent0	initial_cond	0	0.000000
exp11151	4.88330883e-29	0.000000	-0.000000	discard	cycle 81 u=0.0990	agent0	initial_cond	0	0.000000
exp11152	4.58626662e-17	0.106907	-0.000000	discard	3D fine grid around SOTA	manual	3d_grid	0	0.000731
exp11153	5.74085541e-29	0.000000	-0.000000	discard	cycle 81 u=0.0995	agent0	initial_cond	1	0.000000
exp11154	5.74085541e-29	0.000000	-0.000000	discard	cycle 81 u=0.0995	agent0	initial_cond	0	0.000000
exp11155	4.60502485e-17	0.097831	-0.000000	discard	3D fine grid around SOTA	manual	3d_grid	0	0.000490
exp11156	5.74085541e-29	0.000000	-0.000000	discard	cycle 81 u=0.0995	agent0	initial_cond	0	0.000000
exp11157	1.54984578e-28	0.000000	0.000000	discard	cycle 81 u=0.0995	agent0	initial_cond	0	-0.000000
exp11158	6.01129668e-17	0.100106	-0.000000	discard	3D fine grid around SOTA	manual	3d_grid	0	0.000544
exp11159	1.54984578e-28	0.000000	0.000000	discard	cycle 81 u=0.0995	agent0	initial_cond	0	-0.000000
exp11160	5.30407136e-17	0.102376	0.000000	discard	3D fine grid around SOTA	manual	3d_grid	1	0.000602
exp11160	1.54984578e-28	0.000000	0.000000	discard	cycle 81 u=0.0995	agent0	initial_cond	1	-0.000000
exp11161	1.60328418e-29	0.000000	-0.000000	discard	cycle 81 u=0.0995	agent0	initial_cond	0	-0.000000
exp11162	2.62695658e-17	0.104643	-0.000000	discard	3D fine grid around SOTA	manual	3d_grid	0	0.000664
exp11163	1.60328418e-29	0.000000	-0.000000	discard	cycle 81 u=0.0995	agent0	initial_cond	0	-0.000000
exp11164	1.60328418e-29	0.000000	-0.000000	discard	cycle 81 u=0.0995	agent0	initial_cond	0	-0.000000
exp11165	1.28530972e-16	0.106907	-0.000000	discard	3D fine grid around SOTA	manual	3d_grid	0	0.000731
exp11166	7.34590618e-29	0.000000	0.000000	discard	cycle 81 u=0.0995	agent0	initial_cond	0	0.000000
exp11167	7.34590618e-29	0.000000	0.000000	discard	cycle 81 u=0.0995	agent0	initial_cond	1	0.000000
exp11168	1.17609436e-17	0.097831	-0.000000	discard	3D fine grid around SOTA	manual	3d_grid	1	0.000490
exp11169	7.34590618e-29	0.000000	0.000000	discard	cycle 81 u=0.0995	agent0	initial_cond	0	0.000000
exp11170	4.46546993e-29	0.000000	0.000000	discard	cycle 81 u=0.1000	agent0	initial_cond	0	-0.000000
exp11171	2.64113498e-17	0.100106	-0.000000	discard	3D fine grid around SOTA	manual	3d_grid	0	0.000544
exp11172	4.46546993e-29	0.000000	0.000000	discard	cycle 81 u=0.1000	agent0	initial_cond	0	-0.000000
exp11173	3.99233561e-17	0.102376	-0.000000	discard	3D fine grid around SOTA	manual	3d_grid	0	0.000602
exp11173	4.46546993e-29	0.000000	0.000000	discard	cycle 81 u=0.1000	agent0	initial_cond	0	-0.000000
exp11174	4.08106752e-29	0.000000	0.000000	discard	cycle 81 u=0.1000	agent0	initial_cond	1	-0.000000
exp11175	4.14734287e-17	0.104643	-0.000000	discard	3D fine grid around SOTA	manual	3d_grid	0	0.000664
exp11176	4.08106752e-29	0.000000	0.000000	discard	cycle 81 u=0.1000	agent0	initial_cond	0	-0.000000
exp11177	4.08106752e-29	0.000000	0.000000	discard	cycle 81 u=0.1000	agent0	initial_cond	0	-0.000000
exp11178	3.05403469e-17	0.106907	-0.000000	discard	3D fine grid around SOTA	manual	3d_grid	1	0.000731
exp11179	4.58623706e-29	0.000000	0.000000	discard	cycle 81 u=0.1000	agent0	initial_cond	1	-0.000000
exp11180	4.58623706e-29	0.000000	0.000000	discard	cycle 81 u=0.1000	agent0	initial_cond	0	-0.000000
exp11181	7.87547131e-17	0.097831	-0.000000	discard	3D fine grid around SOTA	manual	3d_grid	0	0.000490
exp11182	4.58623706e-29	0.000000	0.000000	discard	cycle 81 u=0.1000	agent0	initial_cond	1	-0.000000
exp11183	4.39794337e-29	0.000000	0.000000	discard	cycle 81 u=0.1000	agent0	initial_cond	0	-0.000000
exp11183	7.09286322e-17	0.100106	-0.000000	discard	3D fine grid around SOTA	manual	3d_grid	0	0.000544
exp11184	4.39794337e-29	0.000000	0.000000	discard	cycle 81 u=0.1000	agent0	initial_cond	0	-0.000000
exp11185	5.24367656e-17	0.102376	-0.000000	discard	3D fine grid around SOTA	manual	3d_grid	1	0.000602
exp11185	4.39794337e-29	0.000000	0.000000	discard	cycle 81 u=0.1000	agent0	initial_cond	1	-0.000000
exp11186	1.36727475e-28	0.000000	0.000000	discard	cycle 81 u=0.1050	agent0	initial_cond	0	-0.000000
exp11187	2.10227642e-17	0.104643	-0.000000	discard	3D fine grid around SOTA	manual	3d_grid	0	0.000664
exp11188	1.36727475e-28	0.000000	0.000000	discard	cycle 81 u=0.1050	agent0	initial_cond	1	-0.000000
exp11189	1.36727475e-28	0.000000	0.000000	discard	cycle 81 u=0.1050	agent0	initial_cond	0	-0.000000
exp11190	6.81542365e-17	0.106907	-0.000000	discard	3D fine grid around SOTA	manual	3d_grid	0	0.000731
exp11191	6.14461376e-29	0.000000	0.000000	discard	cycle 81 u=0.1050	agent0	initial_cond	0	-0.000000
exp11192	6.14461376e-29	0.000000	0.000000	discard	cycle 81 u=0.1050	agent0	initial_cond	1	-0.000000
exp11193	2.95188736e-17	0.097831	-0.000000	discard	3D fine grid around SOTA	manual	3d_grid	0	0.000490
exp11194	6.14461376e-29	0.000000	0.000000	discard	cycle 81 u=0.1050	agent0	initial_cond	0	-0.000000
exp11195	1.75906666e-28	0.000000	0.000000	discard	cycle 81 u=0.1050	agent0	initial_cond	1	-0.000000
exp11195	2.30785610e-17	0.100106	-0.000000	discard	3D fine grid around SOTA	manual	3d_grid	1	0.000544
exp11196	1.75906666e-28	0.000000	0.000000	discard	cycle 81 u=0.1050	agent0	initial_cond	0	-0.000000
exp11197	4.02434142e-17	0.102376	0.000000	discard	3D fine grid around SOTA	manual	3d_grid	0	0.000602
exp11197	1.75906666e-28	0.000000	0.000000	discard	cycle 81 u=0.1050	agent0	initial_cond	0	-0.000000
exp11198	1.11257917e-28	0.000000	0.000000	discard	cycle 81 u=0.1050	agent0	initial_cond	1	-0.000000
exp11199	1.92476550e-17	0.104643	-0.000000	discard	3D fine grid around SOTA	manual	3d_grid	0	0.000664
exp11200	1.11257917e-28	0.000000	0.000000	discard	cycle 81 u=0.1050	agent0	initial_cond	0	-0.000000
exp11201	1.11257917e-28	0.000000	0.000000	discard	cycle 81 u=0.1050	agent0	initial_cond	1	-0.000000
exp11202	2.98067223e-17	0.106907	-0.000000	discard	3D fine grid around SOTA	manual	3d_grid	1	0.000731
exp11203	8.58580947e-29	0.000000	0.000000	discard	cycle 82 u=0.0975	agent0	initial_cond	0	0.000000
exp11204	8.58580947e-29	0.000000	0.000000	discard	cycle 82 u=0.0975	agent0	initial_cond	0	0.000000
exp11205	4.20732633e-17	0.097831	-0.000000	discard	3D fine grid around SOTA	manual	3d_grid	0	0.000490
exp11206	8.58580947e-29	0.000000	0.000000	discard	cycle 82 u=0.0975	agent0	initial_cond	1	0.000000
exp11207	5.23962023e-29	0.000000	0.000000	discard	cycle 82 u=0.0975	agent0	initial_cond	0	0.000000
exp11207	5.25454391e-17	0.100106	-0.000000	discard	3D fine grid around SOTA	manual	3d_grid	0	0.000544
exp11208	5.23962023e-29	0.000000	0.000000	discard	cycle 82 u=0.0975	agent0	initial_cond	1	0.000000
exp11209	2.42745501e-17	0.102376	-0.000000	discard	3D fine grid around SOTA	manual	3d_grid	0	0.000602
exp11209	5.23962023e-29	0.000000	0.000000	discard	cycle 82 u=0.0975	agent0	initial_cond	0	0.000000
exp11210	4.03266298e-29	0.000000	0.000000	discard	cycle 82 u=0.0975	agent0	initial_cond	0	0.000000
exp11211	3.34853091e-17	0.104643	-0.000000	discard	3D fine grid around SOTA	manual	3d_grid	1	0.000664
exp11212	4.03266298e-29	0.000000	0.000000	discard	cycle 82 u=0.0975	agent0	initial_cond	1	0.000000
exp11213	4.03266298e-29	0.000000	0.000000	discard	cycle 82 u=0.0975	agent0	initial_cond	0	0.000000
exp11214	4.58626662e-17	0.106907	-0.000000	discard	3D fine grid around SOTA	manual	3d_grid	0	0.000731
exp11215	4.80015937e-29	0.000000	0.000000	discard	cycle 82 u=0.0975	agent0	initial_cond	1	0.000000
exp11216	4.80015937e-29	0.000000	0.000000	discard	cycle 82 u=0.0975	agent0	initial_cond	0	0.000000
exp11217	4.60502485e-17	0.097831	-0.000000	discard	3D fine grid around SOTA	manual	3d_grid	0	0.000490
exp11218	4.80015937e-29	0.000000	0.000000	discard	cycle 82 u=0.0975	agent0	initial_cond	0	0.000000
exp11219	2.68824537e-29	0.000000	0.000000	discard	cycle 82 u=0.0980	agent0	initial_cond	1	-0.000000
exp11219	6.01129668e-17	0.100106	-0.000000	discard	3D fine grid around SOTA	manual	3d_grid	0	0.000544
exp11220	2.68824537e-29	0.000000	0.000000	discard	cycle 82 u=0.0980	agent0	initial_cond	0	-0.000000
exp11221	5.30407136e-17	0.102376	0.000000	discard	3D fine grid around SOTA	manual	3d_grid	0	0.000602
exp11221	2.68824537e-29	0.000000	0.000000	discard	cycle 82 u=0.0980	agent0	initial_cond	1	-0.000000
exp11222	6.16758073e-29	0.000000	0.000000	discard	cycle 82 u=0.0980	agent0	initial_cond	0	-0.000000
exp11223	2.62695658e-17	0.104643	-0.000000	discard	3D fine grid around SOTA	manual	3d_grid	0	0.000664
exp11224	6.16758073e-29	0.000000	0.000000	discard	cycle 82 u=0.0980	agent0	initial_cond	0	-0.000000
exp11225	6.16758073e-29	0.000000	0.000000	discard	cycle 82 u=0.0980	agent0	initial_cond	1	-0.000000
exp11226	1.28530972e-16	0.106907	-0.000000	discard	3D fine grid around SOTA	manual	3d_grid	0	0.000731
exp11227	2.01926478e-29	0.000000	0.000000	discard	cycle 82 u=0.0980	agent0	initial_cond	0	0.000000
exp11228	2.01926478e-29	0.000000	0.000000	discard	cycle 82 u=0.0980	agent0	initial_cond	1	0.000000
exp11229	1.17609436e-17	0.097831	-0.000000	discard	3D fine grid around SOTA	manual	3d_grid	1	0.000490
exp11230	2.01926478e-29	0.000000	0.000000	discard	cycle 82 u=0.0980	agent0	initial_cond	0	0.000000
exp11231	1.30310780e-28	0.000000	0.000000	discard	cycle 82 u=0.0980	agent0	initial_cond	0	-0.000000
exp11231	2.64113498e-17	0.100106	-0.000000	discard	3D fine grid around SOTA	manual	3d_grid	0	0.000544
exp11232	1.30310780e-28	0.000000	0.000000	discard	cycle 82 u=0.0980	agent0	initial_cond	1	-0.000000
