exp_id	residual	solution_norm	solution_mean	status	description	agent	design	elapsed_s	solution_energy
exp6655	6.14461376e-29	0.000000	0.000000	discard	cycle 41 u=0.1050	agent0	initial_cond	0	-0.000000
exp6655	4.69281155e-17	0.070278	-0.000000	discard	4th branch u=0.21 amp=0.5 phase=1.0	manual	memory	0	0.000097
exp6656	1.75906666e-28	0.000000	0.000000	discard	cycle 41 u=0.1050	agent0	initial_cond	0	-0.000000
exp6657	1.75906666e-28	0.000000	0.000000	discard	cycle 41 u=0.1050	agent0	initial_cond	1	-0.000000
exp6658	1.75906666e-28	0.000000	0.000000	discard	cycle 41 u=0.1050	agent0	initial_cond	0	-0.000000
exp6659	1.11257917e-28	0.000000	0.000000	discard	cycle 41 u=0.1050	agent0	initial_cond	0	-0.000000
exp6660	1.11257917e-28	0.000000	0.000000	discard	cycle 41 u=0.1050	agent0	initial_cond	1	-0.000000
exp6661	1.11257917e-28	0.000000	0.000000	discard	cycle 41 u=0.1050	agent0	initial_cond	0	-0.000000
exp6662	8.58580947e-29	0.000000	0.000000	discard	cycle 42 u=0.0975	agent0	initial_cond	0	0.000000
exp6663	8.58580947e-29	0.000000	0.000000	discard	cycle 42 u=0.0975	agent0	initial_cond	0	0.000000
exp6664	8.58580947e-29	0.000000	0.000000	discard	cycle 42 u=0.0975	agent0	initial_cond	0	0.000000
exp6665	5.23962023e-29	0.000000	0.000000	discard	cycle 42 u=0.0975	agent0	initial_cond	1	0.000000
exp6666	5.23962023e-29	0.000000	0.000000	discard	cycle 42 u=0.0975	agent0	initial_cond	0	0.000000
exp6667	5.23962023e-29	0.000000	0.000000	discard	cycle 42 u=0.0975	agent0	initial_cond	0	0.000000
exp6668	4.03266298e-29	0.000000	0.000000	discard	cycle 42 u=0.0975	agent0	initial_cond	1	0.000000
exp6669	4.03266298e-29	0.000000	0.000000	discard	cycle 42 u=0.0975	agent0	initial_cond	0	0.000000
exp6670	4.03266298e-29	0.000000	0.000000	discard	cycle 42 u=0.0975	agent0	initial_cond	0	0.000000
exp6671	4.80015937e-29	0.000000	0.000000	discard	cycle 42 u=0.0975	agent0	initial_cond	0	0.000000
exp6672	4.80015937e-29	0.000000	0.000000	discard	cycle 42 u=0.0975	agent0	initial_cond	0	0.000000
exp6673	1.64580528e-17	0.070278	-0.000000	discard	4th branch u=0.205 amp=0.5 phase=1.0	manual	memory	0	0.000097
exp6674	4.80015937e-29	0.000000	0.000000	discard	cycle 42 u=0.0975	agent0	initial_cond	1	0.000000
exp6675	2.68824537e-29	0.000000	0.000000	discard	cycle 42 u=0.0980	agent0	initial_cond	0	-0.000000
exp6676	2.68824537e-29	0.000000	0.000000	discard	cycle 42 u=0.0980	agent0	initial_cond	0	-0.000000
exp6677	2.68824537e-29	0.000000	0.000000	discard	cycle 42 u=0.0980	agent0	initial_cond	1	-0.000000
exp6678	6.16758073e-29	0.000000	0.000000	discard	cycle 42 u=0.0980	agent0	initial_cond	0	-0.000000
exp6679	6.16758073e-29	0.000000	0.000000	discard	cycle 42 u=0.0980	agent0	initial_cond	1	-0.000000
exp6680	6.16758073e-29	0.000000	0.000000	discard	cycle 42 u=0.0980	agent0	initial_cond	0	-0.000000
exp6681	2.01926478e-29	0.000000	0.000000	discard	cycle 42 u=0.0980	agent0	initial_cond	0	0.000000
exp6682	2.01926478e-29	0.000000	0.000000	discard	cycle 42 u=0.0980	agent0	initial_cond	1	0.000000
exp6683	2.01926478e-29	0.000000	0.000000	discard	cycle 42 u=0.0980	agent0	initial_cond	0	0.000000
exp6684	1.30310780e-28	0.000000	0.000000	discard	cycle 42 u=0.0980	agent0	initial_cond	0	-0.000000
exp6685	1.30310780e-28	0.000000	0.000000	discard	cycle 42 u=0.0980	agent0	initial_cond	1	-0.000000
exp6686	1.30310780e-28	0.000000	0.000000	discard	cycle 42 u=0.0980	agent0	initial_cond	0	-0.000000
exp6687	5.45343271e-29	0.000000	0.000000	discard	cycle 42 u=0.0982	agent0	initial_cond	1	-0.000000
exp6688	5.45343271e-29	0.000000	0.000000	discard	cycle 42 u=0.0982	agent0	initial_cond	0	-0.000000
exp6689	5.45343271e-29	0.000000	0.000000	discard	cycle 42 u=0.0982	agent0	initial_cond	0	-0.000000
exp6690	1.23429977e-28	0.000000	0.000000	discard	cycle 42 u=0.0982	agent0	initial_cond	1	0.000000
exp6691	1.23429977e-28	0.000000	0.000000	discard	cycle 42 u=0.0982	agent0	initial_cond	0	0.000000
exp6692	1.23429977e-28	0.000000	0.000000	discard	cycle 42 u=0.0982	agent0	initial_cond	0	0.000000
exp6693	1.88036672e-29	0.000000	0.000000	discard	cycle 42 u=0.0982	agent0	initial_cond	0	0.000000
exp6694	1.88036672e-29	0.000000	0.000000	discard	cycle 42 u=0.0982	agent0	initial_cond	0	0.000000
exp6695	1.88036672e-29	0.000000	0.000000	discard	cycle 42 u=0.0982	agent0	initial_cond	1	0.000000
exp6696	1.11312227e-17	0.070278	-0.000000	discard	4th branch u=0.200 amp=0.5 phase=1.0	manual	memory	1	0.000097
exp6697	1.91190259e-29	0.000000	-0.000000	discard	cycle 42 u=0.0982	agent0	initial_cond	0	0.000000
exp6698	1.91190259e-29	0.000000	-0.000000	discard	cycle 42 u=0.0982	agent0	initial_cond	0	0.000000
exp6699	1.91190259e-29	0.000000	-0.000000	discard	cycle 42 u=0.0982	agent0	initial_cond	1	0.000000
exp6700	6.13049994e-29	0.000000	0.000000	discard	cycle 42 u=0.0985	agent0	initial_cond	0	0.000000
exp6701	6.13049994e-29	0.000000	0.000000	discard	cycle 42 u=0.0985	agent0	initial_cond	0	0.000000
exp6702	6.13049994e-29	0.000000	0.000000	discard	cycle 42 u=0.0985	agent0	initial_cond	0	0.000000
exp6703	5.49750971e-29	0.000000	0.000000	discard	cycle 42 u=0.0985	agent0	initial_cond	0	0.000000
exp6704	5.49750971e-29	0.000000	0.000000	discard	cycle 42 u=0.0985	agent0	initial_cond	1	0.000000
exp6705	5.49750971e-29	0.000000	0.000000	discard	cycle 42 u=0.0985	agent0	initial_cond	0	0.000000
exp6706	4.15642452e-29	0.000000	0.000000	discard	cycle 42 u=0.0985	agent0	initial_cond	0	0.000000
exp6707	4.15642452e-29	0.000000	0.000000	discard	cycle 42 u=0.0985	agent0	initial_cond	1	0.000000
exp6708	4.15642452e-29	0.000000	0.000000	discard	cycle 42 u=0.0985	agent0	initial_cond	0	0.000000
exp6709	2.19292611e-29	0.000000	0.000000	discard	cycle 42 u=0.0985	agent0	initial_cond	0	-0.000000
exp6710	2.19292611e-29	0.000000	0.000000	discard	cycle 42 u=0.0985	agent0	initial_cond	0	-0.000000
exp6711	2.19292611e-29	0.000000	0.000000	discard	cycle 42 u=0.0985	agent0	initial_cond	0	-0.000000
exp6712	4.22491788e-29	0.000000	0.000000	discard	cycle 42 u=0.0990	agent0	initial_cond	1	-0.000000
exp6713	3.03780319e-17	0.070278	-0.000000	discard	4th branch u=0.2025 amp=0.5 phase=1.0	manual	memory	0	0.000097
exp6714	4.22491788e-29	0.000000	0.000000	discard	cycle 42 u=0.0990	agent0	initial_cond	0	-0.000000
exp6715	4.22491788e-29	0.000000	0.000000	discard	cycle 42 u=0.0990	agent0	initial_cond	0	-0.000000
exp6716	3.22245147e-29	0.000000	0.000000	discard	cycle 42 u=0.0990	agent0	initial_cond	1	0.000000
exp6717	3.22245147e-29	0.000000	0.000000	discard	cycle 42 u=0.0990	agent0	initial_cond	0	0.000000
exp6718	3.22245147e-29	0.000000	0.000000	discard	cycle 42 u=0.0990	agent0	initial_cond	0	0.000000
exp6719	4.50941488e-29	0.000000	-0.000000	discard	cycle 42 u=0.0990	agent0	initial_cond	0	0.000000
exp6720	4.50941488e-29	0.000000	-0.000000	discard	cycle 42 u=0.0990	agent0	initial_cond	0	0.000000
exp6721	4.50941488e-29	0.000000	-0.000000	discard	cycle 42 u=0.0990	agent0	initial_cond	1	0.000000
exp6722	4.88330883e-29	0.000000	-0.000000	discard	cycle 42 u=0.0990	agent0	initial_cond	0	0.000000
exp6723	4.88330883e-29	0.000000	-0.000000	discard	cycle 42 u=0.0990	agent0	initial_cond	0	0.000000
exp6724	4.88330883e-29	0.000000	-0.000000	discard	cycle 42 u=0.0990	agent0	initial_cond	1	0.000000
exp6725	5.74085541e-29	0.000000	-0.000000	discard	cycle 42 u=0.0995	agent0	initial_cond	0	0.000000
exp6726	5.74085541e-29	0.000000	-0.000000	discard	cycle 42 u=0.0995	agent0	initial_cond	1	0.000000
exp6727	5.74085541e-29	0.000000	-0.000000	discard	cycle 42 u=0.0995	agent0	initial_cond	0	0.000000
exp6728	1.54984578e-28	0.000000	0.000000	discard	cycle 42 u=0.0995	agent0	initial_cond	0	-0.000000
exp6729	1.54984578e-28	0.000000	0.000000	discard	cycle 42 u=0.0995	agent0	initial_cond	1	-0.000000
exp6730	4.69281155e-17	0.070278	-0.000000	discard	4th branch u=0.210 amp=0.5 phase=1.0	manual	memory	0	0.000097
exp6731	1.54984578e-28	0.000000	0.000000	discard	cycle 42 u=0.0995	agent0	initial_cond	0	-0.000000
exp6732	1.60328418e-29	0.000000	-0.000000	discard	cycle 42 u=0.0995	agent0	initial_cond	0	-0.000000
exp6733	1.60328418e-29	0.000000	-0.000000	discard	cycle 42 u=0.0995	agent0	initial_cond	1	-0.000000
exp6734	1.60328418e-29	0.000000	-0.000000	discard	cycle 42 u=0.0995	agent0	initial_cond	0	-0.000000
exp6735	7.34590618e-29	0.000000	0.000000	discard	cycle 42 u=0.0995	agent0	initial_cond	1	0.000000
exp6736	7.34590618e-29	0.000000	0.000000	discard	cycle 42 u=0.0995	agent0	initial_cond	0	0.000000
exp6737	7.34590618e-29	0.000000	0.000000	discard	cycle 42 u=0.0995	agent0	initial_cond	0	0.000000
exp6738	4.46546993e-29	0.000000	0.000000	discard	cycle 42 u=0.1000	agent0	initial_cond	1	-0.000000
exp6739	4.46546993e-29	0.000000	0.000000	discard	cycle 42 u=0.1000	agent0	initial_cond	0	-0.000000
exp6740	4.46546993e-29	0.000000	0.000000	discard	cycle 42 u=0.1000	agent0	initial_cond	0	-0.000000
exp6741	4.08106752e-29	0.000000	0.000000	discard	cycle 42 u=0.1000	agent0	initial_cond	0	-0.000000
exp6742	4.08106752e-29	0.000000	0.000000	discard	cycle 42 u=0.1000	agent0	initial_cond	0	-0.000000
exp6743	4.08106752e-29	0.000000	0.000000	discard	cycle 42 u=0.1000	agent0	initial_cond	1	-0.000000
exp6744	4.58623706e-29	0.000000	0.000000	discard	cycle 42 u=0.1000	agent0	initial_cond	0	-0.000000
exp6745	4.58623706e-29	0.000000	0.000000	discard	cycle 42 u=0.1000	agent0	initial_cond	0	-0.000000
exp6746	4.58623706e-29	0.000000	0.000000	discard	cycle 42 u=0.1000	agent0	initial_cond	1	-0.000000
exp6747	4.39794337e-29	0.000000	0.000000	discard	cycle 42 u=0.1000	agent0	initial_cond	0	-0.000000
exp6748	4.39794337e-29	0.000000	0.000000	discard	cycle 42 u=0.1000	agent0	initial_cond	0	-0.000000
exp6749	4.39794337e-29	0.000000	0.000000	discard	cycle 42 u=0.1000	agent0	initial_cond	0	-0.000000
exp6750	2.22270012e-17	0.070278	-0.000000	discard	4th branch u=0.204 amp=0.5 phase=1.0	manual	memory	0	0.000097
exp6751	1.36727475e-28	0.000000	0.000000	discard	cycle 42 u=0.1050	agent0	initial_cond	0	-0.000000
exp6752	1.36727475e-28	0.000000	0.000000	discard	cycle 42 u=0.1050	agent0	initial_cond	1	-0.000000
exp6753	1.36727475e-28	0.000000	0.000000	discard	cycle 42 u=0.1050	agent0	initial_cond	0	-0.000000
exp6754	6.14461376e-29	0.000000	0.000000	discard	cycle 42 u=0.1050	agent0	initial_cond	0	-0.000000
exp6755	6.14461376e-29	0.000000	0.000000	discard	cycle 42 u=0.1050	agent0	initial_cond	1	-0.000000
exp6756	6.14461376e-29	0.000000	0.000000	discard	cycle 42 u=0.1050	agent0	initial_cond	0	-0.000000
exp6757	1.75906666e-28	0.000000	0.000000	discard	cycle 42 u=0.1050	agent0	initial_cond	0	-0.000000
exp6758	1.75906666e-28	0.000000	0.000000	discard	cycle 42 u=0.1050	agent0	initial_cond	0	-0.000000
exp6759	1.75906666e-28	0.000000	0.000000	discard	cycle 42 u=0.1050	agent0	initial_cond	0	-0.000000
exp6760	1.11257917e-28	0.000000	0.000000	discard	cycle 42 u=0.1050	agent0	initial_cond	1	-0.000000
exp6761	1.11257917e-28	0.000000	0.000000	discard	cycle 42 u=0.1050	agent0	initial_cond	0	-0.000000
exp6762	1.11257917e-28	0.000000	0.000000	discard	cycle 42 u=0.1050	agent0	initial_cond	0	-0.000000
exp6763	8.58580947e-29	0.000000	0.000000	discard	cycle 43 u=0.0975	agent0	initial_cond	1	0.000000
exp6764	8.58580947e-29	0.000000	0.000000	discard	cycle 43 u=0.0975	agent0	initial_cond	0	0.000000
exp6765	8.58580947e-29	0.000000	0.000000	discard	cycle 43 u=0.0975	agent0	initial_cond	1	0.000000
exp6766	5.23962023e-29	0.000000	0.000000	discard	cycle 43 u=0.0975	agent0	initial_cond	0	0.000000
exp6767	5.23962023e-29	0.000000	0.000000	discard	cycle 43 u=0.0975	agent0	initial_cond	0	0.000000
exp6768	5.23962023e-29	0.000000	0.000000	discard	cycle 43 u=0.0975	agent0	initial_cond	1	0.000000
exp6769	4.03266298e-29	0.000000	0.000000	discard	cycle 43 u=0.0975	agent0	initial_cond	0	0.000000
exp6770	4.03266298e-29	0.000000	0.000000	discard	cycle 43 u=0.0975	agent0	initial_cond	0	0.000000
exp6771	4.03266298e-29	0.000000	0.000000	discard	cycle 43 u=0.0975	agent0	initial_cond	0	0.000000
exp6772	4.80015937e-29	0.000000	0.000000	discard	cycle 43 u=0.0975	agent0	initial_cond	0	0.000000
exp6773	4.80015937e-29	0.000000	0.000000	discard	cycle 43 u=0.0975	agent0	initial_cond	1	0.000000
exp6774	4.80015937e-29	0.000000	0.000000	discard	cycle 43 u=0.0975	agent0	initial_cond	0	0.000000
exp6775	2.68824537e-29	0.000000	0.000000	discard	cycle 43 u=0.0980	agent0	initial_cond	0	-0.000000
exp6776	2.68824537e-29	0.000000	0.000000	discard	cycle 43 u=0.0980	agent0	initial_cond	1	-0.000000
exp6777	2.68824537e-29	0.000000	0.000000	discard	cycle 43 u=0.0980	agent0	initial_cond	0	-0.000000
exp6778	6.16758073e-29	0.000000	0.000000	discard	cycle 43 u=0.0980	agent0	initial_cond	0	-0.000000
exp6779	6.16758073e-29	0.000000	0.000000	discard	cycle 43 u=0.0980	agent0	initial_cond	0	-0.000000
exp6780	6.16758073e-29	0.000000	0.000000	discard	cycle 43 u=0.0980	agent0	initial_cond	0	-0.000000
exp6781	2.01926478e-29	0.000000	0.000000	discard	cycle 43 u=0.0980	agent0	initial_cond	1	0.000000
exp6782	2.01926478e-29	0.000000	0.000000	discard	cycle 43 u=0.0980	agent0	initial_cond	0	0.000000
exp6783	2.01926478e-29	0.000000	0.000000	discard	cycle 43 u=0.0980	agent0	initial_cond	0	0.000000
exp6784	1.30310780e-28	0.000000	0.000000	discard	cycle 43 u=0.0980	agent0	initial_cond	1	-0.000000
exp6785	1.30310780e-28	0.000000	0.000000	discard	cycle 43 u=0.0980	agent0	initial_cond	0	-0.000000
exp6786	1.30310780e-28	0.000000	0.000000	discard	cycle 43 u=0.0980	agent0	initial_cond	0	-0.000000
exp6787	5.45343271e-29	0.000000	0.000000	discard	cycle 43 u=0.0982	agent0	initial_cond	0	-0.000000
exp6788	5.45343271e-29	0.000000	0.000000	discard	cycle 43 u=0.0982	agent0	initial_cond	0	-0.000000
exp6789	5.45343271e-29	0.000000	0.000000	discard	cycle 43 u=0.0982	agent0	initial_cond	1	-0.000000
exp6790	1.23429977e-28	0.000000	0.000000	discard	cycle 43 u=0.0982	agent0	initial_cond	0	0.000000
exp6791	1.23429977e-28	0.000000	0.000000	discard	cycle 43 u=0.0982	agent0	initial_cond	0	0.000000
exp6792	1.23429977e-28	0.000000	0.000000	discard	cycle 43 u=0.0982	agent0	initial_cond	1	0.000000
exp6793	1.88036672e-29	0.000000	0.000000	discard	cycle 43 u=0.0982	agent0	initial_cond	0	0.000000
exp6794	1.88036672e-29	0.000000	0.000000	discard	cycle 43 u=0.0982	agent0	initial_cond	1	0.000000
exp6795	1.88036672e-29	0.000000	0.000000	discard	cycle 43 u=0.0982	agent0	initial_cond	0	0.000000
exp6796	1.91190259e-29	0.000000	-0.000000	discard	cycle 43 u=0.0982	agent0	initial_cond	0	0.000000
exp6797	1.91190259e-29	0.000000	-0.000000	discard	cycle 43 u=0.0982	agent0	initial_cond	1	0.000000
exp6798	1.91190259e-29	0.000000	-0.000000	discard	cycle 43 u=0.0982	agent0	initial_cond	0	0.000000
exp6799	6.13049994e-29	0.000000	0.000000	discard	cycle 43 u=0.0985	agent0	initial_cond	0	0.000000
exp6800	6.13049994e-29	0.000000	0.000000	discard	cycle 43 u=0.0985	agent0	initial_cond	0	0.000000
exp6801	6.13049994e-29	0.000000	0.000000	discard	cycle 43 u=0.0985	agent0	initial_cond	0	0.000000
exp6802	5.49750971e-29	0.000000	0.000000	discard	cycle 43 u=0.0985	agent0	initial_cond	1	0.000000
exp6803	5.49750971e-29	0.000000	0.000000	discard	cycle 43 u=0.0985	agent0	initial_cond	0	0.000000
exp6804	5.49750971e-29	0.000000	0.000000	discard	cycle 43 u=0.0985	agent0	initial_cond	0	0.000000
exp6805	4.15642452e-29	0.000000	0.000000	discard	cycle 43 u=0.0985	agent0	initial_cond	1	0.000000
exp6806	4.15642452e-29	0.000000	0.000000	discard	cycle 43 u=0.0985	agent0	initial_cond	0	0.000000
exp6807	4.15642452e-29	0.000000	0.000000	discard	cycle 43 u=0.0985	agent0	initial_cond	0	0.000000
exp6808	2.19292611e-29	0.000000	0.000000	discard	cycle 43 u=0.0985	agent0	initial_cond	0	-0.000000
exp6809	2.19292611e-29	0.000000	0.000000	discard	cycle 43 u=0.0985	agent0	initial_cond	0	-0.000000
exp6810	2.19292611e-29	0.000000	0.000000	discard	cycle 43 u=0.0985	agent0	initial_cond	1	-0.000000
exp6811	4.22491788e-29	0.000000	0.000000	discard	cycle 43 u=0.0990	agent0	initial_cond	0	-0.000000
exp6812	4.22491788e-29	0.000000	0.000000	discard	cycle 43 u=0.0990	agent0	initial_cond	0	-0.000000
exp6813	4.22491788e-29	0.000000	0.000000	discard	cycle 43 u=0.0990	agent0	initial_cond	1	-0.000000
exp6814	3.22245147e-29	0.000000	0.000000	discard	cycle 43 u=0.0990	agent0	initial_cond	0	0.000000
exp6815	3.22245147e-29	0.000000	0.000000	discard	cycle 43 u=0.0990	agent0	initial_cond	0	0.000000
exp6816	3.22245147e-29	0.000000	0.000000	discard	cycle 43 u=0.0990	agent0	initial_cond	0	0.000000
exp6817	4.50941488e-29	0.000000	-0.000000	discard	cycle 43 u=0.0990	agent0	initial_cond	0	0.000000
exp6818	4.50941488e-29	0.000000	-0.000000	discard	cycle 43 u=0.0990	agent0	initial_cond	1	0.000000
exp6819	4.50941488e-29	0.000000	-0.000000	discard	cycle 43 u=0.0990	agent0	initial_cond	0	0.000000
exp6820	4.88330883e-29	0.000000	-0.000000	discard	cycle 43 u=0.0990	agent0	initial_cond	0	0.000000
exp6821	4.88330883e-29	0.000000	-0.000000	discard	cycle 43 u=0.0990	agent0	initial_cond	1	0.000000
exp6822	4.88330883e-29	0.000000	-0.000000	discard	cycle 43 u=0.0990	agent0	initial_cond	0	0.000000
exp6823	5.74085541e-29	0.000000	-0.000000	discard	cycle 43 u=0.0995	agent0	initial_cond	0	0.000000
exp6824	5.74085541e-29	0.000000	-0.000000	discard	cycle 43 u=0.0995	agent0	initial_cond	0	0.000000
exp6825	5.74085541e-29	0.000000	-0.000000	discard	cycle 43 u=0.0995	agent0	initial_cond	0	0.000000
exp6826	1.54984578e-28	0.000000	0.000000	discard	cycle 43 u=0.0995	agent0	initial_cond	1	-0.000000
exp6827	1.54984578e-28	0.000000	0.000000	discard	cycle 43 u=0.0995	agent0	initial_cond	0	-0.000000
exp6828	1.54984578e-28	0.000000	0.000000	discard	cycle 43 u=0.0995	agent0	initial_cond	0	-0.000000
exp6829	1.60328418e-29	0.000000	-0.000000	discard	cycle 43 u=0.0995	agent0	initial_cond	1	-0.000000
exp6830	1.60328418e-29	0.000000	-0.000000	discard	cycle 43 u=0.0995	agent0	initial_cond	0	-0.000000
exp6831	1.60328418e-29	0.000000	-0.000000	discard	cycle 43 u=0.0995	agent0	initial_cond	0	-0.000000
exp6832	7.34590618e-29	0.000000	0.000000	discard	cycle 43 u=0.0995	agent0	initial_cond	0	0.000000
exp6833	7.34590618e-29	0.000000	0.000000	discard	cycle 43 u=0.0995	agent0	initial_cond	0	0.000000
exp6834	7.34590618e-29	0.000000	0.000000	discard	cycle 43 u=0.0995	agent0	initial_cond	1	0.000000
exp6835	4.46546993e-29	0.000000	0.000000	discard	cycle 43 u=0.1000	agent0	initial_cond	0	-0.000000
exp6836	4.46546993e-29	0.000000	0.000000	discard	cycle 43 u=0.1000	agent0	initial_cond	0	-0.000000
exp6837	4.46546993e-29	0.000000	0.000000	discard	cycle 43 u=0.1000	agent0	initial_cond	1	-0.000000
exp6838	4.08106752e-29	0.000000	0.000000	discard	cycle 43 u=0.1000	agent0	initial_cond	0	-0.000000
exp6839	4.08106752e-29	0.000000	0.000000	discard	cycle 43 u=0.1000	agent0	initial_cond	0	-0.000000
exp6840	4.08106752e-29	0.000000	0.000000	discard	cycle 43 u=0.1000	agent0	initial_cond	0	-0.000000
exp6841	4.58623706e-29	0.000000	0.000000	discard	cycle 43 u=0.1000	agent0	initial_cond	0	-0.000000
exp6842	4.58623706e-29	0.000000	0.000000	discard	cycle 43 u=0.1000	agent0	initial_cond	1	-0.000000
exp6843	4.58623706e-29	0.000000	0.000000	discard	cycle 43 u=0.1000	agent0	initial_cond	0	-0.000000
exp6844	4.39794337e-29	0.000000	0.000000	discard	cycle 43 u=0.1000	agent0	initial_cond	0	-0.000000
exp6845	4.39794337e-29	0.000000	0.000000	discard	cycle 43 u=0.1000	agent0	initial_cond	1	-0.000000
exp6846	4.39794337e-29	0.000000	0.000000	discard	cycle 43 u=0.1000	agent0	initial_cond	0	-0.000000
exp6847	1.36727475e-28	0.000000	0.000000	discard	cycle 43 u=0.1050	agent0	initial_cond	1	-0.000000
exp6848	1.36727475e-28	0.000000	0.000000	discard	cycle 43 u=0.1050	agent0	initial_cond	0	-0.000000
exp6849	1.36727475e-28	0.000000	0.000000	discard	cycle 43 u=0.1050	agent0	initial_cond	0	-0.000000
exp6850	6.14461376e-29	0.000000	0.000000	discard	cycle 43 u=0.1050	agent0	initial_cond	1	-0.000000
exp6851	6.14461376e-29	0.000000	0.000000	discard	cycle 43 u=0.1050	agent0	initial_cond	0	-0.000000
exp6852	6.14461376e-29	0.000000	0.000000	discard	cycle 43 u=0.1050	agent0	initial_cond	0	-0.000000
exp6853	1.75906666e-28	0.000000	0.000000	discard	cycle 43 u=0.1050	agent0	initial_cond	1	-0.000000
exp6854	1.75906666e-28	0.000000	0.000000	discard	cycle 43 u=0.1050	agent0	initial_cond	0	-0.000000
exp6855	1.75906666e-28	0.000000	0.000000	discard	cycle 43 u=0.1050	agent0	initial_cond	1	-0.000000
exp6856	1.11257917e-28	0.000000	0.000000	discard	cycle 43 u=0.1050	agent0	initial_cond	0	-0.000000
exp6857	1.11257917e-28	0.000000	0.000000	discard	cycle 43 u=0.1050	agent0	initial_cond	0	-0.000000
exp6858	1.11257917e-28	0.000000	0.000000	discard	cycle 43 u=0.1050	agent0	initial_cond	1	-0.000000
exp6859	8.58580947e-29	0.000000	0.000000	discard	cycle 44 u=0.0975	agent0	initial_cond	0	0.000000
exp6860	8.58580947e-29	0.000000	0.000000	discard	cycle 44 u=0.0975	agent0	initial_cond	0	0.000000
exp6861	8.58580947e-29	0.000000	0.000000	discard	cycle 44 u=0.0975	agent0	initial_cond	0	0.000000
exp6862	5.23962023e-29	0.000000	0.000000	discard	cycle 44 u=0.0975	agent0	initial_cond	0	0.000000
exp6863	5.23962023e-29	0.000000	0.000000	discard	cycle 44 u=0.0975	agent0	initial_cond	1	0.000000
exp6864	5.23962023e-29	0.000000	0.000000	discard	cycle 44 u=0.0975	agent0	initial_cond	0	0.000000
exp6865	4.03266298e-29	0.000000	0.000000	discard	cycle 44 u=0.0975	agent0	initial_cond	0	0.000000
exp6866	4.03266298e-29	0.000000	0.000000	discard	cycle 44 u=0.0975	agent0	initial_cond	1	0.000000
exp6867	3.43989710e-17	0.070278	0.000000	discard	4th branch u=-0.205 amp=0.5 phase=-1.0	manual	memory	0	0.000097
exp6868	4.03266298e-29	0.000000	0.000000	discard	cycle 44 u=0.0975	agent0	initial_cond	0	0.000000
exp6869	4.80015937e-29	0.000000	0.000000	discard	cycle 44 u=0.0975	agent0	initial_cond	0	0.000000
exp6870	4.80015937e-29	0.000000	0.000000	discard	cycle 44 u=0.0975	agent0	initial_cond	0	0.000000
exp6871	4.80015937e-29	0.000000	0.000000	discard	cycle 44 u=0.0975	agent0	initial_cond	0	0.000000
exp6872	2.68824537e-29	0.000000	0.000000	discard	cycle 44 u=0.0980	agent0	initial_cond	1	-0.000000
exp6873	2.68824537e-29	0.000000	0.000000	discard	cycle 44 u=0.0980	agent0	initial_cond	0	-0.000000
exp6874	2.68824537e-29	0.000000	0.000000	discard	cycle 44 u=0.0980	agent0	initial_cond	0	-0.000000
