exp_id	residual	solution_norm	solution_mean	status	description	agent	design	elapsed_s	solution_energy
exp8319	7.34590618e-29	0.000000	0.000000	discard	cycle 57 u=0.0995	agent0	initial_cond	0	0.000000
exp8320	2.05262269e-17	0.070278	-0.000000	discard	2D fine u=0.245 amp=0.40	manual	memory	0	0.000097
exp8321	7.34590618e-29	0.000000	0.000000	discard	cycle 57 u=0.0995	agent0	initial_cond	0	0.000000
exp8322	4.57696084e-17	0.070278	-0.000000	discard	2D fine u=0.245 amp=0.425	manual	memory	0	0.000097
exp8323	7.34590618e-29	0.000000	0.000000	discard	cycle 57 u=0.0995	agent0	initial_cond	1	0.000000
exp8324	5.20642508e-17	0.070278	-0.000000	discard	2D fine u=0.245 amp=0.45	manual	memory	0	0.000097
exp8324	4.46546993e-29	0.000000	0.000000	discard	cycle 57 u=0.1000	agent0	initial_cond	0	-0.000000
exp8325	4.46546993e-29	0.000000	0.000000	discard	cycle 57 u=0.1000	agent0	initial_cond	0	-0.000000
exp8326	7.74572139e-17	0.070278	-0.000000	discard	2D fine u=0.245 amp=0.475	manual	memory	0	0.000097
exp8327	4.46546993e-29	0.000000	0.000000	discard	cycle 57 u=0.1000	agent0	initial_cond	0	-0.000000
exp8328	1.75228234e-16	0.070278	-0.000000	discard	2D fine u=0.245 amp=0.50	manual	memory	0	0.000097
exp8329	4.08106752e-29	0.000000	0.000000	discard	cycle 57 u=0.1000	agent0	initial_cond	0	-0.000000
exp8330	1.71766289e-17	0.070278	-0.000000	discard	2D fine u=0.250 amp=0.40	manual	memory	0	0.000097
exp8331	4.08106752e-29	0.000000	0.000000	discard	cycle 57 u=0.1000	agent0	initial_cond	1	-0.000000
exp8332	4.08106752e-29	0.000000	0.000000	discard	cycle 57 u=0.1000	agent0	initial_cond	0	-0.000000
exp8332	1.71702239e-17	0.070278	-0.000000	discard	2D fine u=0.250 amp=0.425	manual	memory	0	0.000097
exp8333	4.58623706e-29	0.000000	0.000000	discard	cycle 57 u=0.1000	agent0	initial_cond	0	-0.000000
exp8334	2.41199964e-17	0.070278	-0.000000	discard	2D fine u=0.250 amp=0.45	manual	memory	0	0.000097
exp8335	4.58623706e-29	0.000000	0.000000	discard	cycle 57 u=0.1000	agent0	initial_cond	1	-0.000000
exp8336	7.05121698e-17	0.070278	-0.000000	discard	2D fine u=0.250 amp=0.475	manual	memory	0	0.000097
exp8337	4.58623706e-29	0.000000	0.000000	discard	cycle 57 u=0.1000	agent0	initial_cond	0	-0.000000
exp8338	3.25854008e-16	0.070278	-0.000000	discard	2D fine u=0.250 amp=0.50	manual	memory	0	0.000097
exp8338	4.39794337e-29	0.000000	0.000000	discard	cycle 57 u=0.1000	agent0	initial_cond	0	-0.000000
exp8339	4.39794337e-29	0.000000	0.000000	discard	cycle 57 u=0.1000	agent0	initial_cond	0	-0.000000
exp8340	4.39794337e-29	0.000000	0.000000	discard	cycle 57 u=0.1000	agent0	initial_cond	0	-0.000000
exp8341	1.36727475e-28	0.000000	0.000000	discard	cycle 57 u=0.1050	agent0	initial_cond	1	-0.000000
exp8342	1.36727475e-28	0.000000	0.000000	discard	cycle 57 u=0.1050	agent0	initial_cond	0	-0.000000
exp8343	1.36727475e-28	0.000000	0.000000	discard	cycle 57 u=0.1050	agent0	initial_cond	0	-0.000000
exp8344	6.14461376e-29	0.000000	0.000000	discard	cycle 57 u=0.1050	agent0	initial_cond	0	-0.000000
exp8345	6.14461376e-29	0.000000	0.000000	discard	cycle 57 u=0.1050	agent0	initial_cond	0	-0.000000
exp8346	6.14461376e-29	0.000000	0.000000	discard	cycle 57 u=0.1050	agent0	initial_cond	1	-0.000000
exp8347	1.75906666e-28	0.000000	0.000000	discard	cycle 57 u=0.1050	agent0	initial_cond	0	-0.000000
exp8348	1.75906666e-28	0.000000	0.000000	discard	cycle 57 u=0.1050	agent0	initial_cond	0	-0.000000
exp8349	1.75906666e-28	0.000000	0.000000	discard	cycle 57 u=0.1050	agent0	initial_cond	1	-0.000000
exp8350	1.11257917e-28	0.000000	0.000000	discard	cycle 57 u=0.1050	agent0	initial_cond	0	-0.000000
exp8351	1.11257917e-28	0.000000	0.000000	discard	cycle 57 u=0.1050	agent0	initial_cond	0	-0.000000
exp8352	1.11257917e-28	0.000000	0.000000	discard	cycle 57 u=0.1050	agent0	initial_cond	0	-0.000000
exp_ultimate_sota	8.61780663e-18	0.070278	-0.000000	keep	ULTIMATE SOTA: u=0.240 amp=0.45 modes=3 phase=1.0 4th branch	agent1	memory	0	-0.000000
exp8353	8.58580947e-29	0.000000	0.000000	discard	cycle 58 u=0.0975	agent0	initial_cond	0	0.000000
exp8354	8.58580947e-29	0.000000	0.000000	discard	cycle 58 u=0.0975	agent0	initial_cond	1	0.000000
exp8355	8.58580947e-29	0.000000	0.000000	discard	cycle 58 u=0.0975	agent0	initial_cond	0	0.000000
exp8356	5.23962023e-29	0.000000	0.000000	discard	cycle 58 u=0.0975	agent0	initial_cond	0	0.000000
exp8357	5.23962023e-29	0.000000	0.000000	discard	cycle 58 u=0.0975	agent0	initial_cond	1	0.000000
exp8358	5.23962023e-29	0.000000	0.000000	discard	cycle 58 u=0.0975	agent0	initial_cond	0	0.000000
exp8359	4.03266298e-29	0.000000	0.000000	discard	cycle 58 u=0.0975	agent0	initial_cond	1	0.000000
exp8360	4.03266298e-29	0.000000	0.000000	discard	cycle 58 u=0.0975	agent0	initial_cond	0	0.000000
exp8361	4.03266298e-29	0.000000	0.000000	discard	cycle 58 u=0.0975	agent0	initial_cond	0	0.000000
exp8362	4.80015937e-29	0.000000	0.000000	discard	cycle 58 u=0.0975	agent0	initial_cond	1	0.000000
exp8363	4.80015937e-29	0.000000	0.000000	discard	cycle 58 u=0.0975	agent0	initial_cond	0	0.000000
exp8364	4.80015937e-29	0.000000	0.000000	discard	cycle 58 u=0.0975	agent0	initial_cond	0	0.000000
exp8365	5.08795330e-17	0.070278	-0.000000	discard	Ultra-fine u=0.238 amp=0.43	manual	memory	1	0.000097
exp8366	2.68824537e-29	0.000000	0.000000	discard	cycle 58 u=0.0980	agent0	initial_cond	0	-0.000000
exp8367	1.35631076e-17	0.070278	-0.000000	discard	Ultra-fine u=0.238 amp=0.44	manual	memory	0	0.000097
exp8368	2.68824537e-29	0.000000	0.000000	discard	cycle 58 u=0.0980	agent0	initial_cond	0	-0.000000
exp8369	2.68824537e-29	0.000000	0.000000	discard	cycle 58 u=0.0980	agent0	initial_cond	1	-0.000000
exp8369	2.46050759e-17	0.070278	-0.000000	discard	Ultra-fine u=0.238 amp=0.45	manual	memory	1	0.000097
exp8370	6.16758073e-29	0.000000	0.000000	discard	cycle 58 u=0.0980	agent0	initial_cond	0	-0.000000
exp8371	1.63336183e-17	0.070278	-0.000000	discard	Ultra-fine u=0.238 amp=0.46	manual	memory	0	0.000097
exp8372	6.16758073e-29	0.000000	0.000000	discard	cycle 58 u=0.0980	agent0	initial_cond	0	-0.000000
exp8373	1.96845890e-17	0.070278	-0.000000	discard	Ultra-fine u=0.238 amp=0.47	manual	memory	1	0.000097
exp8374	6.16758073e-29	0.000000	0.000000	discard	cycle 58 u=0.0980	agent0	initial_cond	1	-0.000000
exp8375	8.19743035e-17	0.070278	-0.000000	discard	Ultra-fine u=0.239 amp=0.43	manual	memory	0	0.000097
exp8375	2.01926478e-29	0.000000	0.000000	discard	cycle 58 u=0.0980	agent0	initial_cond	0	0.000000
exp8376	2.01926478e-29	0.000000	0.000000	discard	cycle 58 u=0.0980	agent0	initial_cond	1	0.000000
exp8377	4.39909554e-17	0.070278	-0.000000	discard	Ultra-fine u=0.239 amp=0.44	manual	memory	1	0.000097
exp8378	2.01926478e-29	0.000000	0.000000	discard	cycle 58 u=0.0980	agent0	initial_cond	0	0.000000
exp8379	2.27964180e-17	0.070278	-0.000000	discard	Ultra-fine u=0.239 amp=0.45	manual	memory	0	0.000097
exp8380	1.30310780e-28	0.000000	0.000000	discard	cycle 58 u=0.0980	agent0	initial_cond	0	-0.000000
exp8381	2.37060241e-17	0.070278	-0.000000	discard	Ultra-fine u=0.239 amp=0.46	manual	memory	1	0.000097
exp8382	1.30310780e-28	0.000000	0.000000	discard	cycle 58 u=0.0980	agent0	initial_cond	1	-0.000000
exp8383	1.30310780e-28	0.000000	0.000000	discard	cycle 58 u=0.0980	agent0	initial_cond	0	-0.000000
exp8383	8.41282074e-17	0.070278	-0.000000	discard	Ultra-fine u=0.239 amp=0.47	manual	memory	0	0.000097
exp8384	5.45343271e-29	0.000000	0.000000	discard	cycle 58 u=0.0982	agent0	initial_cond	0	-0.000000
exp8385	2.52527881e-17	0.070278	-0.000000	discard	Ultra-fine u=0.240 amp=0.43	manual	memory	1	0.000097
exp8386	5.45343271e-29	0.000000	0.000000	discard	cycle 58 u=0.0982	agent0	initial_cond	0	-0.000000
exp8387	3.59691331e-17	0.070278	-0.000000	discard	Ultra-fine u=0.240 amp=0.44	manual	memory	0	0.000097
exp8388	5.45343271e-29	0.000000	0.000000	discard	cycle 58 u=0.0982	agent0	initial_cond	0	-0.000000
exp8389	1.23429977e-28	0.000000	0.000000	discard	cycle 58 u=0.0982	agent0	initial_cond	1	0.000000
exp8389	8.61780663e-18	0.070278	-0.000000	discard	Ultra-fine u=0.240 amp=0.45	manual	memory	1	0.000097
exp8390	1.23429977e-28	0.000000	0.000000	discard	cycle 58 u=0.0982	agent0	initial_cond	0	0.000000
exp8391	2.96268871e-17	0.070278	-0.000000	discard	Ultra-fine u=0.240 amp=0.46	manual	memory	0	0.000097
exp8392	1.23429977e-28	0.000000	0.000000	discard	cycle 58 u=0.0982	agent0	initial_cond	0	0.000000
exp8393	1.97090095e-17	0.070278	-0.000000	discard	Ultra-fine u=0.240 amp=0.47	manual	memory	1	0.000097
exp8394	1.88036672e-29	0.000000	0.000000	discard	cycle 58 u=0.0982	agent0	initial_cond	1	0.000000
exp8395	8.06442664e-17	0.070278	-0.000000	discard	Ultra-fine u=0.241 amp=0.43	manual	memory	0	0.000097
exp8395	1.88036672e-29	0.000000	0.000000	discard	cycle 58 u=0.0982	agent0	initial_cond	0	0.000000
exp8396	1.88036672e-29	0.000000	0.000000	discard	cycle 58 u=0.0982	agent0	initial_cond	1	0.000000
exp8397	1.16698172e-17	0.070278	-0.000000	discard	Ultra-fine u=0.241 amp=0.44	manual	memory	1	0.000097
exp8398	1.91190259e-29	0.000000	-0.000000	discard	cycle 58 u=0.0982	agent0	initial_cond	0	0.000000
exp8399	2.25096546e-17	0.070278	-0.000000	discard	Ultra-fine u=0.241 amp=0.45	manual	memory	0	0.000097
exp8400	1.91190259e-29	0.000000	-0.000000	discard	cycle 58 u=0.0982	agent0	initial_cond	0	0.000000
exp8401	6.22574085e-17	0.070278	-0.000000	discard	Ultra-fine u=0.241 amp=0.46	manual	memory	1	0.000097
exp8402	1.91190259e-29	0.000000	-0.000000	discard	cycle 58 u=0.0982	agent0	initial_cond	1	0.000000
exp8403	6.13049994e-29	0.000000	0.000000	discard	cycle 58 u=0.0985	agent0	initial_cond	0	0.000000
exp8403	2.82413003e-17	0.070278	-0.000000	discard	Ultra-fine u=0.241 amp=0.47	manual	memory	0	0.000097
exp8404	6.13049994e-29	0.000000	0.000000	discard	cycle 58 u=0.0985	agent0	initial_cond	0	0.000000
exp8405	4.60750645e-17	0.070278	-0.000000	discard	Ultra-fine u=0.242 amp=0.43	manual	memory	1	0.000097
exp8406	6.13049994e-29	0.000000	0.000000	discard	cycle 58 u=0.0985	agent0	initial_cond	0	0.000000
exp8407	3.19957656e-17	0.070278	-0.000000	discard	Ultra-fine u=0.242 amp=0.44	manual	memory	0	0.000097
exp8408	5.49750971e-29	0.000000	0.000000	discard	cycle 58 u=0.0985	agent0	initial_cond	0	0.000000
exp8409	5.49750971e-29	0.000000	0.000000	discard	cycle 58 u=0.0985	agent0	initial_cond	1	0.000000
exp8409	4.05235948e-17	0.070278	-0.000000	discard	Ultra-fine u=0.242 amp=0.45	manual	memory	1	0.000097
exp8410	5.49750971e-29	0.000000	0.000000	discard	cycle 58 u=0.0985	agent0	initial_cond	0	0.000000
exp8411	4.70823918e-17	0.070278	-0.000000	discard	Ultra-fine u=0.242 amp=0.46	manual	memory	0	0.000097
exp8412	4.15642452e-29	0.000000	0.000000	discard	cycle 58 u=0.0985	agent0	initial_cond	0	0.000000
exp8413	2.24571614e-17	0.070278	-0.000000	discard	Ultra-fine u=0.242 amp=0.47	manual	memory	1	0.000097
exp8414	4.15642452e-29	0.000000	0.000000	discard	cycle 58 u=0.0985	agent0	initial_cond	1	0.000000
exp8415	4.15642452e-29	0.000000	0.000000	discard	cycle 58 u=0.0985	agent0	initial_cond	0	0.000000
exp8416	2.19292611e-29	0.000000	0.000000	discard	cycle 58 u=0.0985	agent0	initial_cond	1	-0.000000
exp8417	2.19292611e-29	0.000000	0.000000	discard	cycle 58 u=0.0985	agent0	initial_cond	0	-0.000000
exp8418	2.19292611e-29	0.000000	0.000000	discard	cycle 58 u=0.0985	agent0	initial_cond	0	-0.000000
exp8419	4.22491788e-29	0.000000	0.000000	discard	cycle 58 u=0.0990	agent0	initial_cond	1	-0.000000
exp8420	4.22491788e-29	0.000000	0.000000	discard	cycle 58 u=0.0990	agent0	initial_cond	0	-0.000000
exp8421	4.22491788e-29	0.000000	0.000000	discard	cycle 58 u=0.0990	agent0	initial_cond	0	-0.000000
exp8422	3.22245147e-29	0.000000	0.000000	discard	cycle 58 u=0.0990	agent0	initial_cond	0	0.000000
exp8423	3.22245147e-29	0.000000	0.000000	discard	cycle 58 u=0.0990	agent0	initial_cond	0	0.000000
exp8424	3.22245147e-29	0.000000	0.000000	discard	cycle 58 u=0.0990	agent0	initial_cond	1	0.000000
exp8425	4.50941488e-29	0.000000	-0.000000	discard	cycle 58 u=0.0990	agent0	initial_cond	0	0.000000
exp8426	4.50941488e-29	0.000000	-0.000000	discard	cycle 58 u=0.0990	agent0	initial_cond	0	0.000000
exp8427	4.50941488e-29	0.000000	-0.000000	discard	cycle 58 u=0.0990	agent0	initial_cond	1	0.000000
exp8428	4.88330883e-29	0.000000	-0.000000	discard	cycle 58 u=0.0990	agent0	initial_cond	0	0.000000
exp8429	4.88330883e-29	0.000000	-0.000000	discard	cycle 58 u=0.0990	agent0	initial_cond	1	0.000000
exp8430	4.88330883e-29	0.000000	-0.000000	discard	cycle 58 u=0.0990	agent0	initial_cond	0	0.000000
exp8431	5.74085541e-29	0.000000	-0.000000	discard	cycle 58 u=0.0995	agent0	initial_cond	0	0.000000
exp8432	5.74085541e-29	0.000000	-0.000000	discard	cycle 58 u=0.0995	agent0	initial_cond	1	0.000000
exp8433	5.74085541e-29	0.000000	-0.000000	discard	cycle 58 u=0.0995	agent0	initial_cond	0	0.000000
exp8434	1.54984578e-28	0.000000	0.000000	discard	cycle 58 u=0.0995	agent0	initial_cond	0	-0.000000
exp8435	1.54984578e-28	0.000000	0.000000	discard	cycle 58 u=0.0995	agent0	initial_cond	0	-0.000000
exp8436	1.54984578e-28	0.000000	0.000000	discard	cycle 58 u=0.0995	agent0	initial_cond	0	-0.000000
exp8437	1.60328418e-29	0.000000	-0.000000	discard	cycle 58 u=0.0995	agent0	initial_cond	1	-0.000000
exp8438	1.60328418e-29	0.000000	-0.000000	discard	cycle 58 u=0.0995	agent0	initial_cond	0	-0.000000
exp8439	1.60328418e-29	0.000000	-0.000000	discard	cycle 58 u=0.0995	agent0	initial_cond	0	-0.000000
exp8440	7.34590618e-29	0.000000	0.000000	discard	cycle 58 u=0.0995	agent0	initial_cond	1	0.000000
exp8441	5.35192713e-15	0.000014	-0.000000	discard	Modes with SOTA base u=0.240 amp=0.45 modes=2	manual	memory	0	-0.000000
exp8442	7.34590618e-29	0.000000	0.000000	discard	cycle 58 u=0.0995	agent0	initial_cond	0	0.000000
exp8443	7.34590618e-29	0.000000	0.000000	discard	cycle 58 u=0.0995	agent0	initial_cond	1	0.000000
exp8443	8.61780663e-18	0.070278	-0.000000	discard	Modes with SOTA base u=0.240 amp=0.45 modes=3	manual	memory	1	0.000097
exp8444	4.46546993e-29	0.000000	0.000000	discard	cycle 58 u=0.1000	agent0	initial_cond	0	-0.000000
exp8445	9.58368910e-17	0.070535	0.000000	discard	Modes with SOTA base u=0.240 amp=0.45 modes=4	manual	memory	0	0.000099
exp8446	4.46546993e-29	0.000000	0.000000	discard	cycle 58 u=0.1000	agent0	initial_cond	0	-0.000000
exp8447	4.46546993e-29	0.000000	0.000000	discard	cycle 58 u=0.1000	agent0	initial_cond	1	-0.000000
exp8447	1.17115944e-16	0.070536	0.000000	discard	Modes with SOTA base u=0.240 amp=0.45 modes=5	manual	memory	1	0.000099
exp8448	4.08106752e-29	0.000000	0.000000	discard	cycle 58 u=0.1000	agent0	initial_cond	0	-0.000000
exp8449	9.03861026e-17	0.070536	-0.000000	discard	Modes with SOTA base u=0.240 amp=0.45 modes=6	manual	memory	0	0.000099
exp8450	4.08106752e-29	0.000000	0.000000	discard	cycle 58 u=0.1000	agent0	initial_cond	0	-0.000000
exp8451	4.08106752e-29	0.000000	0.000000	discard	cycle 58 u=0.1000	agent0	initial_cond	0	-0.000000
exp8452	4.58623706e-29	0.000000	0.000000	discard	cycle 58 u=0.1000	agent0	initial_cond	0	-0.000000
exp8453	4.58623706e-29	0.000000	0.000000	discard	cycle 58 u=0.1000	agent0	initial_cond	1	-0.000000
exp8454	4.58623706e-29	0.000000	0.000000	discard	cycle 58 u=0.1000	agent0	initial_cond	0	-0.000000
exp8455	4.39794337e-29	0.000000	0.000000	discard	cycle 58 u=0.1000	agent0	initial_cond	0	-0.000000
exp8456	4.39794337e-29	0.000000	0.000000	discard	cycle 58 u=0.1000	agent0	initial_cond	1	-0.000000
exp8457	4.39794337e-29	0.000000	0.000000	discard	cycle 58 u=0.1000	agent0	initial_cond	0	-0.000000
exp8458	1.36727475e-28	0.000000	0.000000	discard	cycle 58 u=0.1050	agent0	initial_cond	1	-0.000000
exp8459	1.36727475e-28	0.000000	0.000000	discard	cycle 58 u=0.1050	agent0	initial_cond	0	-0.000000
exp8460	1.36727475e-28	0.000000	0.000000	discard	cycle 58 u=0.1050	agent0	initial_cond	0	-0.000000
exp8461	6.14461376e-29	0.000000	0.000000	discard	cycle 58 u=0.1050	agent0	initial_cond	1	-0.000000
exp8462	6.14461376e-29	0.000000	0.000000	discard	cycle 58 u=0.1050	agent0	initial_cond	0	-0.000000
exp8463	6.14461376e-29	0.000000	0.000000	discard	cycle 58 u=0.1050	agent0	initial_cond	0	-0.000000
exp8464	1.75906666e-28	0.000000	0.000000	discard	cycle 58 u=0.1050	agent0	initial_cond	0	-0.000000
exp8465	1.75906666e-28	0.000000	0.000000	discard	cycle 58 u=0.1050	agent0	initial_cond	0	-0.000000
exp8466	1.75906666e-28	0.000000	0.000000	discard	cycle 58 u=0.1050	agent0	initial_cond	1	-0.000000
exp8467	1.11257917e-28	0.000000	0.000000	discard	cycle 58 u=0.1050	agent0	initial_cond	0	-0.000000
exp8468	1.11257917e-28	0.000000	0.000000	discard	cycle 58 u=0.1050	agent0	initial_cond	0	-0.000000
exp8469	1.11257917e-28	0.000000	0.000000	discard	cycle 58 u=0.1050	agent0	initial_cond	1	-0.000000
exp8470	8.58580947e-29	0.000000	0.000000	discard	cycle 59 u=0.0975	agent0	initial_cond	0	0.000000
exp8471	8.58580947e-29	0.000000	0.000000	discard	cycle 59 u=0.0975	agent0	initial_cond	1	0.000000
exp8472	8.58580947e-29	0.000000	0.000000	discard	cycle 59 u=0.0975	agent0	initial_cond	0	0.000000
exp8473	5.23962023e-29	0.000000	0.000000	discard	cycle 59 u=0.0975	agent0	initial_cond	0	0.000000
exp8474	5.23962023e-29	0.000000	0.000000	discard	cycle 59 u=0.0975	agent0	initial_cond	1	0.000000
exp8475	5.23962023e-29	0.000000	0.000000	discard	cycle 59 u=0.0975	agent0	initial_cond	0	0.000000
exp8476	4.03266298e-29	0.000000	0.000000	discard	cycle 59 u=0.0975	agent0	initial_cond	0	0.000000
exp8477	4.03266298e-29	0.000000	0.000000	discard	cycle 59 u=0.0975	agent0	initial_cond	0	0.000000
exp8478	4.03266298e-29	0.000000	0.000000	discard	cycle 59 u=0.0975	agent0	initial_cond	0	0.000000
exp8479	4.80015937e-29	0.000000	0.000000	discard	cycle 59 u=0.0975	agent0	initial_cond	1	0.000000
exp8480	4.80015937e-29	0.000000	0.000000	discard	cycle 59 u=0.0975	agent0	initial_cond	0	0.000000
exp8481	4.80015937e-29	0.000000	0.000000	discard	cycle 59 u=0.0975	agent0	initial_cond	0	0.000000
exp8482	2.68824537e-29	0.000000	0.000000	discard	cycle 59 u=0.0980	agent0	initial_cond	1	-0.000000
exp8483	2.68824537e-29	0.000000	0.000000	discard	cycle 59 u=0.0980	agent0	initial_cond	0	-0.000000
exp8484	2.68824537e-29	0.000000	0.000000	discard	cycle 59 u=0.0980	agent0	initial_cond	0	-0.000000
exp8485	6.16758073e-29	0.000000	0.000000	discard	cycle 59 u=0.0980	agent0	initial_cond	0	-0.000000
exp8486	6.16758073e-29	0.000000	0.000000	discard	cycle 59 u=0.0980	agent0	initial_cond	0	-0.000000
exp8487	6.16758073e-29	0.000000	0.000000	discard	cycle 59 u=0.0980	agent0	initial_cond	1	-0.000000
exp8488	2.01926478e-29	0.000000	0.000000	discard	cycle 59 u=0.0980	agent0	initial_cond	0	0.000000
exp8489	2.01926478e-29	0.000000	0.000000	discard	cycle 59 u=0.0980	agent0	initial_cond	0	0.000000
exp8490	2.01926478e-29	0.000000	0.000000	discard	cycle 59 u=0.0980	agent0	initial_cond	1	0.000000
exp8491	1.30310780e-28	0.000000	0.000000	discard	cycle 59 u=0.0980	agent0	initial_cond	0	-0.000000
exp8492	1.30310780e-28	0.000000	0.000000	discard	cycle 59 u=0.0980	agent0	initial_cond	1	-0.000000
exp8493	1.30310780e-28	0.000000	0.000000	discard	cycle 59 u=0.0980	agent0	initial_cond	0	-0.000000
exp8494	5.45343271e-29	0.000000	0.000000	discard	cycle 59 u=0.0982	agent0	initial_cond	0	-0.000000
exp8495	5.45343271e-29	0.000000	0.000000	discard	cycle 59 u=0.0982	agent0	initial_cond	1	-0.000000
exp8496	5.45343271e-29	0.000000	0.000000	discard	cycle 59 u=0.0982	agent0	initial_cond	0	-0.000000
exp8497	1.23429977e-28	0.000000	0.000000	discard	cycle 59 u=0.0982	agent0	initial_cond	0	0.000000
exp8498	1.23429977e-28	0.000000	0.000000	discard	cycle 59 u=0.0982	agent0	initial_cond	0	0.000000
exp8499	1.23429977e-28	0.000000	0.000000	discard	cycle 59 u=0.0982	agent0	initial_cond	0	0.000000
exp8500	1.88036672e-29	0.000000	0.000000	discard	cycle 59 u=0.0982	agent0	initial_cond	1	0.000000
exp8501	1.88036672e-29	0.000000	0.000000	discard	cycle 59 u=0.0982	agent0	initial_cond	0	0.000000
exp8502	1.88036672e-29	0.000000	0.000000	discard	cycle 59 u=0.0982	agent0	initial_cond	0	0.000000
exp8503	1.91190259e-29	0.000000	-0.000000	discard	cycle 59 u=0.0982	agent0	initial_cond	1	0.000000
exp8504	1.91190259e-29	0.000000	-0.000000	discard	cycle 59 u=0.0982	agent0	initial_cond	0	0.000000
exp8505	1.91190259e-29	0.000000	-0.000000	discard	cycle 59 u=0.0982	agent0	initial_cond	1	0.000000
exp8506	6.13049994e-29	0.000000	0.000000	discard	cycle 59 u=0.0985	agent0	initial_cond	0	0.000000
exp8507	6.13049994e-29	0.000000	0.000000	discard	cycle 59 u=0.0985	agent0	initial_cond	0	0.000000
exp8508	6.13049994e-29	0.000000	0.000000	discard	cycle 59 u=0.0985	agent0	initial_cond	1	0.000000
exp8509	5.49750971e-29	0.000000	0.000000	discard	cycle 59 u=0.0985	agent0	initial_cond	0	0.000000
exp8510	5.49750971e-29	0.000000	0.000000	discard	cycle 59 u=0.0985	agent0	initial_cond	0	0.000000
exp8511	5.49750971e-29	0.000000	0.000000	discard	cycle 59 u=0.0985	agent0	initial_cond	0	0.000000
exp8512	4.15642452e-29	0.000000	0.000000	discard	cycle 59 u=0.0985	agent0	initial_cond	0	0.000000
exp8513	4.15642452e-29	0.000000	0.000000	discard	cycle 59 u=0.0985	agent0	initial_cond	1	0.000000
exp8514	4.15642452e-29	0.000000	0.000000	discard	cycle 59 u=0.0985	agent0	initial_cond	0	0.000000
exp8515	2.19292611e-29	0.000000	0.000000	discard	cycle 59 u=0.0985	agent0	initial_cond	0	-0.000000
exp8516	2.19292611e-29	0.000000	0.000000	discard	cycle 59 u=0.0985	agent0	initial_cond	1	-0.000000
exp8517	2.19292611e-29	0.000000	0.000000	discard	cycle 59 u=0.0985	agent0	initial_cond	0	-0.000000
exp8518	4.22491788e-29	0.000000	0.000000	discard	cycle 59 u=0.0990	agent0	initial_cond	0	-0.000000
exp8519	4.22491788e-29	0.000000	0.000000	discard	cycle 59 u=0.0990	agent0	initial_cond	0	-0.000000
exp8520	4.22491788e-29	0.000000	0.000000	discard	cycle 59 u=0.0990	agent0	initial_cond	0	-0.000000
exp8521	3.22245147e-29	0.000000	0.000000	discard	cycle 59 u=0.0990	agent0	initial_cond	1	0.000000
exp8522	3.22245147e-29	0.000000	0.000000	discard	cycle 59 u=0.0990	agent0	initial_cond	0	0.000000
exp8523	3.22245147e-29	0.000000	0.000000	discard	cycle 59 u=0.0990	agent0	initial_cond	0	0.000000
exp8524	4.50941488e-29	0.000000	-0.000000	discard	cycle 59 u=0.0990	agent0	initial_cond	1	0.000000
