exp_id	residual	solution_norm	solution_mean	status	description	agent	design	elapsed_s	solution_energy
exp10010	8.58580947e-29	0.000000	0.000000	discard	cycle 71 u=0.0975	agent0	initial_cond	1	0.000000
exp10010	4.77026482e-17	0.070278	-0.000000	discard	Alternative optimum u=0.21 amp=0.46 p=1.3	manual	memory	1	0.000097
exp10011	5.23962023e-29	0.000000	0.000000	discard	cycle 71 u=0.0975	agent0	initial_cond	0	0.000000
exp10012	1.17964585e-17	0.070278	-0.000000	discard	Alternative optimum u=0.21 amp=0.48 p=1.1	manual	memory	0	0.000097
exp10013	5.23962023e-29	0.000000	0.000000	discard	cycle 71 u=0.0975	agent0	initial_cond	0	0.000000
exp10014	5.46096643e-17	0.070278	-0.000000	discard	Alternative optimum u=0.21 amp=0.48 p=1.15	manual	memory	1	0.000097
exp10015	5.23962023e-29	0.000000	0.000000	discard	cycle 71 u=0.0975	agent0	initial_cond	0	0.000000
exp10016	5.13143909e-17	0.070278	-0.000000	discard	Alternative optimum u=0.21 amp=0.48 p=1.2	manual	memory	0	0.000097
exp10016	4.03266298e-29	0.000000	0.000000	discard	cycle 71 u=0.0975	agent0	initial_cond	0	0.000000
exp10017	4.03266298e-29	0.000000	0.000000	discard	cycle 71 u=0.0975	agent0	initial_cond	1	0.000000
exp10017	1.54180318e-17	0.070278	-0.000000	discard	Alternative optimum u=0.21 amp=0.48 p=1.25	manual	memory	1	0.000097
exp10018	4.03266298e-29	0.000000	0.000000	discard	cycle 71 u=0.0975	agent0	initial_cond	0	0.000000
exp10019	1.63618986e-17	0.070278	-0.000000	discard	Alternative optimum u=0.21 amp=0.48 p=1.3	manual	memory	0	0.000097
exp10020	4.80015937e-29	0.000000	0.000000	discard	cycle 71 u=0.0975	agent0	initial_cond	0	0.000000
exp10021	4.80015937e-29	0.000000	0.000000	discard	cycle 71 u=0.0975	agent0	initial_cond	0	0.000000
exp10022	4.80015937e-29	0.000000	0.000000	discard	cycle 71 u=0.0975	agent0	initial_cond	0	0.000000
exp10023	2.68824537e-29	0.000000	0.000000	discard	cycle 71 u=0.0980	agent0	initial_cond	1	-0.000000
exp10024	2.68824537e-29	0.000000	0.000000	discard	cycle 71 u=0.0980	agent0	initial_cond	0	-0.000000
exp10025	2.68824537e-29	0.000000	0.000000	discard	cycle 71 u=0.0980	agent0	initial_cond	0	-0.000000
exp10026	6.16758073e-29	0.000000	0.000000	discard	cycle 71 u=0.0980	agent0	initial_cond	0	-0.000000
exp10027	6.16758073e-29	0.000000	0.000000	discard	cycle 71 u=0.0980	agent0	initial_cond	0	-0.000000
exp10028	6.16758073e-29	0.000000	0.000000	discard	cycle 71 u=0.0980	agent0	initial_cond	1	-0.000000
exp10029	2.01926478e-29	0.000000	0.000000	discard	cycle 71 u=0.0980	agent0	initial_cond	0	0.000000
exp10030	2.01926478e-29	0.000000	0.000000	discard	cycle 71 u=0.0980	agent0	initial_cond	0	0.000000
exp10031	2.01926478e-29	0.000000	0.000000	discard	cycle 71 u=0.0980	agent0	initial_cond	1	0.000000
exp10032	1.30310780e-28	0.000000	0.000000	discard	cycle 71 u=0.0980	agent0	initial_cond	0	-0.000000
exp10033	1.30310780e-28	0.000000	0.000000	discard	cycle 71 u=0.0980	agent0	initial_cond	1	-0.000000
exp10034	1.30310780e-28	0.000000	0.000000	discard	cycle 71 u=0.0980	agent0	initial_cond	0	-0.000000
exp10035	5.45343271e-29	0.000000	0.000000	discard	cycle 71 u=0.0982	agent0	initial_cond	0	-0.000000
exp10036	5.45343271e-29	0.000000	0.000000	discard	cycle 71 u=0.0982	agent0	initial_cond	1	-0.000000
exp10037	5.45343271e-29	0.000000	0.000000	discard	cycle 71 u=0.0982	agent0	initial_cond	0	-0.000000
exp10038	1.23429977e-28	0.000000	0.000000	discard	cycle 71 u=0.0982	agent0	initial_cond	0	0.000000
exp10039	1.23429977e-28	0.000000	0.000000	discard	cycle 71 u=0.0982	agent0	initial_cond	0	0.000000
exp10040	1.23429977e-28	0.000000	0.000000	discard	cycle 71 u=0.0982	agent0	initial_cond	0	0.000000
exp10041	1.88036672e-29	0.000000	0.000000	discard	cycle 71 u=0.0982	agent0	initial_cond	1	0.000000
exp10042	1.88036672e-29	0.000000	0.000000	discard	cycle 71 u=0.0982	agent0	initial_cond	0	0.000000
exp10043	3.66691513e-17	0.070278	-0.000000	discard	Refine alt u=0.205 a=0.42 p=1.10	manual	memory	0	0.000097
exp10044	1.88036672e-29	0.000000	0.000000	discard	cycle 71 u=0.0982	agent0	initial_cond	0	0.000000
exp10045	1.43618888e-17	0.070278	-0.000000	discard	Refine alt u=0.205 a=0.42 p=1.12	manual	memory	1	0.000097
exp10046	1.91190259e-29	0.000000	-0.000000	discard	cycle 71 u=0.0982	agent0	initial_cond	0	0.000000
exp10047	1.91190259e-29	0.000000	-0.000000	discard	cycle 71 u=0.0982	agent0	initial_cond	0	0.000000
exp10047	2.46638422e-17	0.070278	-0.000000	discard	Refine alt u=0.205 a=0.42 p=1.15	manual	memory	0	0.000097
exp10048	1.91190259e-29	0.000000	-0.000000	discard	cycle 71 u=0.0982	agent0	initial_cond	1	0.000000
exp10049	6.78090255e-17	0.070278	-0.000000	discard	Refine alt u=0.205 a=0.42 p=1.18	manual	memory	1	0.000097
exp10050	6.13049994e-29	0.000000	0.000000	discard	cycle 71 u=0.0985	agent0	initial_cond	0	0.000000
exp10051	4.60040934e-17	0.070278	-0.000000	discard	Refine alt u=0.205 a=0.42 p=1.20	manual	memory	0	0.000097
exp10052	6.13049994e-29	0.000000	0.000000	discard	cycle 71 u=0.0985	agent0	initial_cond	0	0.000000
exp10053	5.59598776e-17	0.070278	-0.000000	discard	Refine alt u=0.205 a=0.43 p=1.10	manual	memory	1	0.000097
exp10054	6.13049994e-29	0.000000	0.000000	discard	cycle 71 u=0.0985	agent0	initial_cond	0	0.000000
exp10055	5.36727161e-17	0.070278	-0.000000	discard	Refine alt u=0.205 a=0.43 p=1.12	manual	memory	0	0.000097
exp10055	5.49750971e-29	0.000000	0.000000	discard	cycle 71 u=0.0985	agent0	initial_cond	0	0.000000
exp10056	5.49750971e-29	0.000000	0.000000	discard	cycle 71 u=0.0985	agent0	initial_cond	1	0.000000
exp10057	1.25976057e-17	0.070278	-0.000000	discard	Refine alt u=0.205 a=0.43 p=1.15	manual	memory	1	0.000097
exp10058	5.49750971e-29	0.000000	0.000000	discard	cycle 71 u=0.0985	agent0	initial_cond	0	0.000000
exp10059	5.28574026e-17	0.070278	-0.000000	discard	Refine alt u=0.205 a=0.43 p=1.18	manual	memory	0	0.000097
exp10060	4.15642452e-29	0.000000	0.000000	discard	cycle 71 u=0.0985	agent0	initial_cond	0	0.000000
exp10061	2.02177694e-17	0.070278	-0.000000	discard	Refine alt u=0.205 a=0.43 p=1.20	manual	memory	1	0.000097
exp10062	4.15642452e-29	0.000000	0.000000	discard	cycle 71 u=0.0985	agent0	initial_cond	1	0.000000
exp10063	4.15642452e-29	0.000000	0.000000	discard	cycle 71 u=0.0985	agent0	initial_cond	0	0.000000
exp10063	3.34426869e-17	0.070278	-0.000000	discard	Refine alt u=0.205 a=0.44 p=1.10	manual	memory	0	0.000097
exp10064	2.19292611e-29	0.000000	0.000000	discard	cycle 71 u=0.0985	agent0	initial_cond	1	-0.000000
exp10065	1.31578146e-17	0.070278	-0.000000	discard	Refine alt u=0.205 a=0.44 p=1.12	manual	memory	1	0.000097
exp10066	2.19292611e-29	0.000000	0.000000	discard	cycle 71 u=0.0985	agent0	initial_cond	0	-0.000000
exp10067	3.47488136e-17	0.070278	-0.000000	discard	Refine alt u=0.205 a=0.44 p=1.15	manual	memory	0	0.000097
exp10068	2.19292611e-29	0.000000	0.000000	discard	cycle 71 u=0.0985	agent0	initial_cond	0	-0.000000
exp10069	5.16436620e-17	0.070278	-0.000000	discard	Refine alt u=0.205 a=0.44 p=1.18	manual	memory	1	0.000097
exp10070	4.22491788e-29	0.000000	0.000000	discard	cycle 71 u=0.0990	agent0	initial_cond	1	-0.000000
exp10071	4.22491788e-29	0.000000	0.000000	discard	cycle 71 u=0.0990	agent0	initial_cond	0	-0.000000
exp10071	2.50061140e-17	0.070278	-0.000000	discard	Refine alt u=0.205 a=0.44 p=1.20	manual	memory	0	0.000097
exp10072	4.22491788e-29	0.000000	0.000000	discard	cycle 71 u=0.0990	agent0	initial_cond	1	-0.000000
exp10073	1.65586740e-17	0.070278	-0.000000	discard	Refine alt u=0.205 a=0.45 p=1.10	manual	memory	1	0.000097
exp10074	3.22245147e-29	0.000000	0.000000	discard	cycle 71 u=0.0990	agent0	initial_cond	0	0.000000
exp10075	3.10246404e-17	0.070278	-0.000000	discard	Refine alt u=0.205 a=0.45 p=1.12	manual	memory	0	0.000097
exp10076	3.22245147e-29	0.000000	0.000000	discard	cycle 71 u=0.0990	agent0	initial_cond	0	0.000000
exp10077	1.01312703e-16	0.070278	-0.000000	discard	Refine alt u=0.205 a=0.45 p=1.15	manual	memory	1	0.000097
exp10078	3.22245147e-29	0.000000	0.000000	discard	cycle 71 u=0.0990	agent0	initial_cond	1	0.000000
exp10079	4.50941488e-29	0.000000	-0.000000	discard	cycle 71 u=0.0990	agent0	initial_cond	0	0.000000
exp10079	3.11616156e-17	0.070278	-0.000000	discard	Refine alt u=0.205 a=0.45 p=1.18	manual	memory	0	0.000097
exp10080	4.50941488e-29	0.000000	-0.000000	discard	cycle 71 u=0.0990	agent0	initial_cond	1	0.000000
exp10081	5.22314066e-17	0.070278	-0.000000	discard	Refine alt u=0.205 a=0.45 p=1.20	manual	memory	1	0.000097
exp10082	4.50941488e-29	0.000000	-0.000000	discard	cycle 71 u=0.0990	agent0	initial_cond	0	0.000000
exp10083	5.36650949e-17	0.070278	-0.000000	discard	Refine alt u=0.205 a=0.46 p=1.10	manual	memory	0	0.000097
exp10084	4.88330883e-29	0.000000	-0.000000	discard	cycle 71 u=0.0990	agent0	initial_cond	0	0.000000
exp10085	2.96019292e-17	0.070278	-0.000000	discard	Refine alt u=0.205 a=0.46 p=1.12	manual	memory	1	0.000097
exp10086	4.88330883e-29	0.000000	-0.000000	discard	cycle 71 u=0.0990	agent0	initial_cond	1	0.000000
exp10087	2.15041247e-17	0.070278	-0.000000	discard	Refine alt u=0.205 a=0.46 p=1.15	manual	memory	0	0.000097
exp10087	4.88330883e-29	0.000000	-0.000000	discard	cycle 71 u=0.0990	agent0	initial_cond	0	0.000000
exp10088	5.74085541e-29	0.000000	-0.000000	discard	cycle 71 u=0.0995	agent0	initial_cond	0	0.000000
exp10089	7.66511523e-17	0.070278	-0.000000	discard	Refine alt u=0.205 a=0.46 p=1.18	manual	memory	1	0.000097
exp10090	5.74085541e-29	0.000000	-0.000000	discard	cycle 71 u=0.0995	agent0	initial_cond	0	0.000000
exp10091	1.30828568e-17	0.070278	-0.000000	discard	Refine alt u=0.205 a=0.46 p=1.20	manual	memory	0	0.000097
exp10092	5.74085541e-29	0.000000	-0.000000	discard	cycle 71 u=0.0995	agent0	initial_cond	0	0.000000
exp10093	2.46712505e-17	0.070278	-0.000000	discard	Refine alt u=0.210 a=0.42 p=1.10	manual	memory	1	0.000097
exp10094	1.54984578e-28	0.000000	0.000000	discard	cycle 71 u=0.0995	agent0	initial_cond	1	-0.000000
exp10095	4.13533027e-17	0.070278	-0.000000	discard	Refine alt u=0.210 a=0.42 p=1.12	manual	memory	0	0.000097
exp10095	1.54984578e-28	0.000000	0.000000	discard	cycle 71 u=0.0995	agent0	initial_cond	0	-0.000000
exp10096	1.54984578e-28	0.000000	0.000000	discard	cycle 71 u=0.0995	agent0	initial_cond	0	-0.000000
exp10097	2.63307579e-17	0.070278	-0.000000	discard	Refine alt u=0.210 a=0.42 p=1.15	manual	memory	1	0.000097
exp10098	1.60328418e-29	0.000000	-0.000000	discard	cycle 71 u=0.0995	agent0	initial_cond	0	-0.000000
exp10099	2.63677926e-17	0.070278	-0.000000	discard	Refine alt u=0.210 a=0.42 p=1.18	manual	memory	0	0.000097
exp10100	1.60328418e-29	0.000000	-0.000000	discard	cycle 71 u=0.0995	agent0	initial_cond	0	-0.000000
exp10101	1.08500284e-16	0.070278	-0.000000	discard	Refine alt u=0.210 a=0.42 p=1.20	manual	memory	0	0.000097
exp10102	1.60328418e-29	0.000000	-0.000000	discard	cycle 71 u=0.0995	agent0	initial_cond	1	-0.000000
exp10103	5.54230003e-17	0.070278	-0.000000	discard	Refine alt u=0.210 a=0.43 p=1.10	manual	memory	0	0.000097
exp10103	7.34590618e-29	0.000000	0.000000	discard	cycle 71 u=0.0995	agent0	initial_cond	0	0.000000
exp10104	7.34590618e-29	0.000000	0.000000	discard	cycle 71 u=0.0995	agent0	initial_cond	0	0.000000
exp10105	2.43351256e-17	0.070278	-0.000000	discard	Refine alt u=0.210 a=0.43 p=1.12	manual	memory	0	0.000097
exp10106	7.34590618e-29	0.000000	0.000000	discard	cycle 71 u=0.0995	agent0	initial_cond	0	0.000000
exp10107	1.66180670e-17	0.070278	-0.000000	discard	Refine alt u=0.210 a=0.43 p=1.15	manual	memory	0	0.000097
exp10108	4.46546993e-29	0.000000	0.000000	discard	cycle 71 u=0.1000	agent0	initial_cond	0	-0.000000
exp10109	3.81657617e-17	0.070278	-0.000000	discard	Refine alt u=0.210 a=0.43 p=1.18	manual	memory	0	0.000097
exp10110	4.46546993e-29	0.000000	0.000000	discard	cycle 71 u=0.1000	agent0	initial_cond	1	-0.000000
exp10111	4.54567917e-17	0.070278	-0.000000	discard	Refine alt u=0.210 a=0.43 p=1.20	manual	memory	0	0.000097
exp10111	4.46546993e-29	0.000000	0.000000	discard	cycle 71 u=0.1000	agent0	initial_cond	0	-0.000000
exp10112	4.08106752e-29	0.000000	0.000000	discard	cycle 71 u=0.1000	agent0	initial_cond	0	-0.000000
exp10113	8.47445764e-17	0.070278	-0.000000	discard	Refine alt u=0.210 a=0.44 p=1.10	manual	memory	0	0.000097
exp10114	4.08106752e-29	0.000000	0.000000	discard	cycle 71 u=0.1000	agent0	initial_cond	1	-0.000000
exp10115	1.34027393e-17	0.070278	-0.000000	discard	Refine alt u=0.210 a=0.44 p=1.12	manual	memory	0	0.000097
exp10116	4.08106752e-29	0.000000	0.000000	discard	cycle 71 u=0.1000	agent0	initial_cond	0	-0.000000
exp10117	7.00026089e-18	0.070278	-0.000000	discard	Refine alt u=0.210 a=0.44 p=1.15	manual	memory	0	0.000097
exp10118	4.58623706e-29	0.000000	0.000000	discard	cycle 71 u=0.1000	agent0	initial_cond	1	-0.000000
exp10119	3.23468686e-17	0.070278	-0.000000	discard	Refine alt u=0.210 a=0.44 p=1.18	manual	memory	0	0.000097
exp10119	4.58623706e-29	0.000000	0.000000	discard	cycle 71 u=0.1000	agent0	initial_cond	0	-0.000000
exp10120	4.58623706e-29	0.000000	0.000000	discard	cycle 71 u=0.1000	agent0	initial_cond	0	-0.000000
exp10121	3.17755652e-17	0.070278	-0.000000	discard	Refine alt u=0.210 a=0.44 p=1.20	manual	memory	0	0.000097
exp10122	4.39794337e-29	0.000000	0.000000	discard	cycle 71 u=0.1000	agent0	initial_cond	1	-0.000000
exp10123	2.96636853e-17	0.070278	-0.000000	discard	Refine alt u=0.210 a=0.45 p=1.10	manual	memory	0	0.000097
exp10124	4.39794337e-29	0.000000	0.000000	discard	cycle 71 u=0.1000	agent0	initial_cond	0	-0.000000
exp10125	2.30706174e-17	0.070278	-0.000000	discard	Refine alt u=0.210 a=0.45 p=1.12	manual	memory	0	0.000097
exp10126	4.39794337e-29	0.000000	0.000000	discard	cycle 71 u=0.1000	agent0	initial_cond	1	-0.000000
exp10127	2.06272218e-17	0.070278	-0.000000	discard	Refine alt u=0.210 a=0.45 p=1.15	manual	memory	0	0.000097
exp10127	1.36727475e-28	0.000000	0.000000	discard	cycle 71 u=0.1050	agent0	initial_cond	0	-0.000000
exp10128	1.36727475e-28	0.000000	0.000000	discard	cycle 71 u=0.1050	agent0	initial_cond	0	-0.000000
exp10128	1.88409900e-17	0.070278	-0.000000	discard	Refine alt u=0.210 a=0.45 p=1.18	manual	memory	0	0.000097
exp10129	1.36727475e-28	0.000000	0.000000	discard	cycle 71 u=0.1050	agent0	initial_cond	1	-0.000000
exp10130	3.36387747e-17	0.070278	-0.000000	discard	Refine alt u=0.210 a=0.45 p=1.20	manual	memory	0	0.000097
exp10131	6.14461376e-29	0.000000	0.000000	discard	cycle 71 u=0.1050	agent0	initial_cond	0	-0.000000
exp10132	9.11999937e-17	0.070278	-0.000000	discard	Refine alt u=0.210 a=0.46 p=1.10	manual	memory	0	0.000097
exp10133	6.14461376e-29	0.000000	0.000000	discard	cycle 71 u=0.1050	agent0	initial_cond	0	-0.000000
exp10134	2.76846176e-17	0.070278	-0.000000	discard	Refine alt u=0.210 a=0.46 p=1.12	manual	memory	0	0.000097
exp10134	6.14461376e-29	0.000000	0.000000	discard	cycle 71 u=0.1050	agent0	initial_cond	0	-0.000000
exp10135	1.75906666e-28	0.000000	0.000000	discard	cycle 71 u=0.1050	agent0	initial_cond	0	-0.000000
exp10135	6.86365127e-17	0.070278	0.000000	discard	Refine alt u=0.210 a=0.46 p=1.15	manual	memory	0	0.000097
exp10136	1.75906666e-28	0.000000	0.000000	discard	cycle 71 u=0.1050	agent0	initial_cond	1	-0.000000
exp10137	2.55262857e-17	0.070278	-0.000000	discard	Refine alt u=0.210 a=0.46 p=1.18	manual	memory	0	0.000097
exp10138	1.75906666e-28	0.000000	0.000000	discard	cycle 71 u=0.1050	agent0	initial_cond	0	-0.000000
exp10139	1.81018024e-17	0.070278	-0.000000	discard	Refine alt u=0.210 a=0.46 p=1.20	manual	memory	0	0.000097
exp10140	1.11257917e-28	0.000000	0.000000	discard	cycle 71 u=0.1050	agent0	initial_cond	0	-0.000000
exp10141	5.67236266e-17	0.070278	-0.000000	discard	Refine alt u=0.215 a=0.42 p=1.10	manual	memory	0	0.000097
exp10141	1.11257917e-28	0.000000	0.000000	discard	cycle 71 u=0.1050	agent0	initial_cond	0	-0.000000
exp10142	1.11257917e-28	0.000000	0.000000	discard	cycle 71 u=0.1050	agent0	initial_cond	0	-0.000000
exp10142	8.78945004e-17	0.070278	-0.000000	discard	Refine alt u=0.215 a=0.42 p=1.12	manual	memory	0	0.000097
exp10143	8.58580947e-29	0.000000	0.000000	discard	cycle 72 u=0.0975	agent0	initial_cond	1	0.000000
exp10144	7.05042290e-17	0.070278	-0.000000	discard	Refine alt u=0.215 a=0.42 p=1.15	manual	memory	1	0.000097
exp10145	8.58580947e-29	0.000000	0.000000	discard	cycle 72 u=0.0975	agent0	initial_cond	0	0.000000
exp10146	6.80451461e-17	0.070278	0.000000	discard	Refine alt u=0.215 a=0.42 p=1.18	manual	memory	0	0.000097
exp10147	8.58580947e-29	0.000000	0.000000	discard	cycle 72 u=0.0975	agent0	initial_cond	0	0.000000
exp10148	9.16113498e-18	0.070278	-0.000000	discard	Refine alt u=0.215 a=0.42 p=1.20	manual	memory	1	0.000097
exp10148	5.23962023e-29	0.000000	0.000000	discard	cycle 72 u=0.0975	agent0	initial_cond	0	0.000000
exp10149	5.23962023e-29	0.000000	0.000000	discard	cycle 72 u=0.0975	agent0	initial_cond	0	0.000000
exp10149	1.44145273e-17	0.070278	-0.000000	discard	Refine alt u=0.215 a=0.43 p=1.10	manual	memory	0	0.000097
exp10150	5.23962023e-29	0.000000	0.000000	discard	cycle 72 u=0.0975	agent0	initial_cond	1	0.000000
exp10151	2.51584292e-17	0.070278	-0.000000	discard	Refine alt u=0.215 a=0.43 p=1.12	manual	memory	1	0.000097
exp10152	4.03266298e-29	0.000000	0.000000	discard	cycle 72 u=0.0975	agent0	initial_cond	0	0.000000
exp10153	4.97623071e-17	0.070278	-0.000000	discard	Refine alt u=0.215 a=0.43 p=1.15	manual	memory	0	0.000097
exp10154	4.03266298e-29	0.000000	0.000000	discard	cycle 72 u=0.0975	agent0	initial_cond	0	0.000000
exp10155	2.38198617e-17	0.070278	-0.000000	discard	Refine alt u=0.215 a=0.43 p=1.18	manual	memory	1	0.000097
exp10155	4.03266298e-29	0.000000	0.000000	discard	cycle 72 u=0.0975	agent0	initial_cond	1	0.000000
exp10156	4.80015937e-29	0.000000	0.000000	discard	cycle 72 u=0.0975	agent0	initial_cond	0	0.000000
exp10156	1.89586843e-17	0.070278	-0.000000	discard	Refine alt u=0.215 a=0.43 p=1.20	manual	memory	0	0.000097
exp10157	4.80015937e-29	0.000000	0.000000	discard	cycle 72 u=0.0975	agent0	initial_cond	1	0.000000
exp10158	1.19624515e-17	0.070278	-0.000000	discard	Refine alt u=0.215 a=0.44 p=1.10	manual	memory	1	0.000097
exp10159	4.80015937e-29	0.000000	0.000000	discard	cycle 72 u=0.0975	agent0	initial_cond	0	0.000000
exp10160	2.02104812e-17	0.070278	-0.000000	discard	Refine alt u=0.215 a=0.44 p=1.12	manual	memory	0	0.000097
exp10161	2.68824537e-29	0.000000	0.000000	discard	cycle 72 u=0.0980	agent0	initial_cond	0	-0.000000
exp10162	5.48179599e-17	0.070278	-0.000000	discard	Refine alt u=0.215 a=0.44 p=1.15	manual	memory	1	0.000097
exp10162	2.68824537e-29	0.000000	0.000000	discard	cycle 72 u=0.0980	agent0	initial_cond	1	-0.000000
exp10163	2.68824537e-29	0.000000	0.000000	discard	cycle 72 u=0.0980	agent0	initial_cond	0	-0.000000
exp10163	3.80230316e-17	0.070278	-0.000000	discard	Refine alt u=0.215 a=0.44 p=1.18	manual	memory	0	0.000097
exp10164	6.16758073e-29	0.000000	0.000000	discard	cycle 72 u=0.0980	agent0	initial_cond	1	-0.000000
exp10165	2.96359226e-17	0.070278	-0.000000	discard	Refine alt u=0.215 a=0.44 p=1.20	manual	memory	1	0.000097
exp10166	6.16758073e-29	0.000000	0.000000	discard	cycle 72 u=0.0980	agent0	initial_cond	0	-0.000000
exp10167	4.22252574e-17	0.070278	-0.000000	discard	Refine alt u=0.215 a=0.45 p=1.10	manual	memory	0	0.000097
exp10168	6.16758073e-29	0.000000	0.000000	discard	cycle 72 u=0.0980	agent0	initial_cond	0	-0.000000
exp10169	2.69397416e-17	0.070278	-0.000000	discard	Refine alt u=0.215 a=0.45 p=1.12	manual	memory	1	0.000097
exp10169	2.01926478e-29	0.000000	0.000000	discard	cycle 72 u=0.0980	agent0	initial_cond	1	0.000000
exp10170	2.01926478e-29	0.000000	0.000000	discard	cycle 72 u=0.0980	agent0	initial_cond	0	0.000000
exp10170	2.28186426e-17	0.070278	-0.000000	discard	Refine alt u=0.215 a=0.45 p=1.15	manual	memory	0	0.000097
exp10171	2.01926478e-29	0.000000	0.000000	discard	cycle 72 u=0.0980	agent0	initial_cond	0	0.000000
exp10172	3.96633270e-17	0.070278	-0.000000	discard	Refine alt u=0.215 a=0.45 p=1.18	manual	memory	1	0.000097
exp10173	1.30310780e-28	0.000000	0.000000	discard	cycle 72 u=0.0980	agent0	initial_cond	0	-0.000000
exp10174	3.81530401e-17	0.070278	-0.000000	discard	Refine alt u=0.215 a=0.45 p=1.20	manual	memory	0	0.000097
exp10175	1.30310780e-28	0.000000	0.000000	discard	cycle 72 u=0.0980	agent0	initial_cond	0	-0.000000
exp10176	7.68976387e-17	0.070278	-0.000000	discard	Refine alt u=0.215 a=0.46 p=1.10	manual	memory	1	0.000097
exp10176	1.30310780e-28	0.000000	0.000000	discard	cycle 72 u=0.0980	agent0	initial_cond	1	-0.000000
exp10177	5.45343271e-29	0.000000	0.000000	discard	cycle 72 u=0.0982	agent0	initial_cond	0	-0.000000
exp10177	2.46640462e-17	0.070278	-0.000000	discard	Refine alt u=0.215 a=0.46 p=1.12	manual	memory	0	0.000097
exp10178	5.45343271e-29	0.000000	0.000000	discard	cycle 72 u=0.0982	agent0	initial_cond	0	-0.000000
exp10179	1.77605346e-17	0.070278	-0.000000	discard	Refine alt u=0.215 a=0.46 p=1.15	manual	memory	1	0.000097
exp10180	5.45343271e-29	0.000000	0.000000	discard	cycle 72 u=0.0982	agent0	initial_cond	0	-0.000000
exp10181	5.54927753e-17	0.070278	-0.000000	discard	Refine alt u=0.215 a=0.46 p=1.18	manual	memory	0	0.000097
exp10182	1.23429977e-28	0.000000	0.000000	discard	cycle 72 u=0.0982	agent0	initial_cond	0	0.000000
exp10183	1.92818042e-17	0.070278	-0.000000	discard	Refine alt u=0.215 a=0.46 p=1.20	manual	memory	1	0.000097
exp10184	1.23429977e-28	0.000000	0.000000	discard	cycle 72 u=0.0982	agent0	initial_cond	1	0.000000
exp10185	1.23429977e-28	0.000000	0.000000	discard	cycle 72 u=0.0982	agent0	initial_cond	0	0.000000
exp10185	1.32066655e-17	0.070278	-0.000000	discard	Refine alt u=0.220 a=0.42 p=1.10	manual	memory	0	0.000097
exp10186	1.88036672e-29	0.000000	0.000000	discard	cycle 72 u=0.0982	agent0	initial_cond	0	0.000000
exp10187	1.59594848e-17	0.070278	-0.000000	discard	Refine alt u=0.220 a=0.42 p=1.12	manual	memory	1	0.000097
exp10188	1.88036672e-29	0.000000	0.000000	discard	cycle 72 u=0.0982	agent0	initial_cond	0	0.000000
exp10189	2.21515733e-17	0.070278	-0.000000	discard	Refine alt u=0.220 a=0.42 p=1.15	manual	memory	0	0.000097
exp10190	1.88036672e-29	0.000000	0.000000	discard	cycle 72 u=0.0982	agent0	initial_cond	0	0.000000
