exp_id	residual	solution_norm	solution_mean	status	description	agent	design	elapsed_s	solution_energy
exp6220	4.22491788e-29	0.000000	0.000000	discard	cycle 37 u=0.0990	agent0	initial_cond	0	-0.000000
exp6221	3.45503867e-17	0.070278	0.000000	discard	4th branch (symmetric) u=-0.35 amp=0.5 phase=-1.0	manual	memory	0	0.000097
exp6222	4.22491788e-29	0.000000	0.000000	discard	cycle 37 u=0.0990	agent0	initial_cond	1	-0.000000
exp6223	3.22245147e-29	0.000000	0.000000	discard	cycle 37 u=0.0990	agent0	initial_cond	0	0.000000
exp6224	3.22245147e-29	0.000000	0.000000	discard	cycle 37 u=0.0990	agent0	initial_cond	0	0.000000
exp6225	3.22245147e-29	0.000000	0.000000	discard	cycle 37 u=0.0990	agent0	initial_cond	0	0.000000
exp6226	4.50941488e-29	0.000000	-0.000000	discard	cycle 37 u=0.0990	agent0	initial_cond	0	0.000000
exp6227	4.50941488e-29	0.000000	-0.000000	discard	cycle 37 u=0.0990	agent0	initial_cond	1	0.000000
exp6228	4.50941488e-29	0.000000	-0.000000	discard	cycle 37 u=0.0990	agent0	initial_cond	0	0.000000
exp6229	4.88330883e-29	0.000000	-0.000000	discard	cycle 37 u=0.0990	agent0	initial_cond	0	0.000000
exp6230	4.88330883e-29	0.000000	-0.000000	discard	cycle 37 u=0.0990	agent0	initial_cond	1	0.000000
exp6231	4.88330883e-29	0.000000	-0.000000	discard	cycle 37 u=0.0990	agent0	initial_cond	0	0.000000
exp6232	5.74085541e-29	0.000000	-0.000000	discard	cycle 37 u=0.0995	agent0	initial_cond	1	0.000000
exp6233	5.74085541e-29	0.000000	-0.000000	discard	cycle 37 u=0.0995	agent0	initial_cond	0	0.000000
exp6234	5.74085541e-29	0.000000	-0.000000	discard	cycle 37 u=0.0995	agent0	initial_cond	0	0.000000
exp6235	1.54984578e-28	0.000000	0.000000	discard	cycle 37 u=0.0995	agent0	initial_cond	1	-0.000000
exp6236	1.54984578e-28	0.000000	0.000000	discard	cycle 37 u=0.0995	agent0	initial_cond	0	-0.000000
exp6237	1.15813307e-16	0.070278	-0.000000	discard	4th branch u=-0.36 amp=0.5 phase=1.0	manual	memory	0	0.000097
exp6238	1.54984578e-28	0.000000	0.000000	discard	cycle 37 u=0.0995	agent0	initial_cond	0	-0.000000
exp6239	1.60328418e-29	0.000000	-0.000000	discard	cycle 37 u=0.0995	agent0	initial_cond	1	-0.000000
exp6240	1.60328418e-29	0.000000	-0.000000	discard	cycle 37 u=0.0995	agent0	initial_cond	0	-0.000000
exp6241	1.60328418e-29	0.000000	-0.000000	discard	cycle 37 u=0.0995	agent0	initial_cond	1	-0.000000
exp6242	7.34590618e-29	0.000000	0.000000	discard	cycle 37 u=0.0995	agent0	initial_cond	0	0.000000
exp6243	7.34590618e-29	0.000000	0.000000	discard	cycle 37 u=0.0995	agent0	initial_cond	0	0.000000
exp6244	7.34590618e-29	0.000000	0.000000	discard	cycle 37 u=0.0995	agent0	initial_cond	1	0.000000
exp6245	4.46546993e-29	0.000000	0.000000	discard	cycle 37 u=0.1000	agent0	initial_cond	0	-0.000000
exp6246	4.46546993e-29	0.000000	0.000000	discard	cycle 37 u=0.1000	agent0	initial_cond	0	-0.000000
exp6247	4.46546993e-29	0.000000	0.000000	discard	cycle 37 u=0.1000	agent0	initial_cond	1	-0.000000
exp6248	4.08106752e-29	0.000000	0.000000	discard	cycle 37 u=0.1000	agent0	initial_cond	0	-0.000000
exp6249	4.08106752e-29	0.000000	0.000000	discard	cycle 37 u=0.1000	agent0	initial_cond	1	-0.000000
exp6250	4.08106752e-29	0.000000	0.000000	discard	cycle 37 u=0.1000	agent0	initial_cond	0	-0.000000
exp6251	4.58623706e-29	0.000000	0.000000	discard	cycle 37 u=0.1000	agent0	initial_cond	0	-0.000000
exp6252	4.58623706e-29	0.000000	0.000000	discard	cycle 37 u=0.1000	agent0	initial_cond	1	-0.000000
exp6253	4.58623706e-29	0.000000	0.000000	discard	cycle 37 u=0.1000	agent0	initial_cond	0	-0.000000
exp6254	4.39794337e-29	0.000000	0.000000	discard	cycle 37 u=0.1000	agent0	initial_cond	0	-0.000000
exp6255	4.39794337e-29	0.000000	0.000000	discard	cycle 37 u=0.1000	agent0	initial_cond	1	-0.000000
exp6256	4.39794337e-29	0.000000	0.000000	discard	cycle 37 u=0.1000	agent0	initial_cond	0	-0.000000
exp6257	1.36727475e-28	0.000000	0.000000	discard	cycle 37 u=0.1050	agent0	initial_cond	0	-0.000000
exp6258	1.36727475e-28	0.000000	0.000000	discard	cycle 37 u=0.1050	agent0	initial_cond	0	-0.000000
exp6259	1.36727475e-28	0.000000	0.000000	discard	cycle 37 u=0.1050	agent0	initial_cond	0	-0.000000
exp6259	4.31272301e-17	0.070278	0.000000	discard	4th branch u=-0.30 amp=0.5 phase=-1.0	manual	memory	0	0.000097
exp6260	6.14461376e-29	0.000000	0.000000	discard	cycle 37 u=0.1050	agent0	initial_cond	1	-0.000000
exp6261	6.14461376e-29	0.000000	0.000000	discard	cycle 37 u=0.1050	agent0	initial_cond	0	-0.000000
exp6262	6.14461376e-29	0.000000	0.000000	discard	cycle 37 u=0.1050	agent0	initial_cond	0	-0.000000
exp6263	1.75906666e-28	0.000000	0.000000	discard	cycle 37 u=0.1050	agent0	initial_cond	1	-0.000000
exp6264	1.75906666e-28	0.000000	0.000000	discard	cycle 37 u=0.1050	agent0	initial_cond	0	-0.000000
exp6265	1.75906666e-28	0.000000	0.000000	discard	cycle 37 u=0.1050	agent0	initial_cond	1	-0.000000
exp6266	1.11257917e-28	0.000000	0.000000	discard	cycle 37 u=0.1050	agent0	initial_cond	0	-0.000000
exp6267	1.11257917e-28	0.000000	0.000000	discard	cycle 37 u=0.1050	agent0	initial_cond	0	-0.000000
exp6268	1.11257917e-28	0.000000	0.000000	discard	cycle 37 u=0.1050	agent0	initial_cond	1	-0.000000
exp6269	8.58580947e-29	0.000000	0.000000	discard	cycle 38 u=0.0975	agent0	initial_cond	0	0.000000
exp6270	8.58580947e-29	0.000000	0.000000	discard	cycle 38 u=0.0975	agent0	initial_cond	0	0.000000
exp6271	8.58580947e-29	0.000000	0.000000	discard	cycle 38 u=0.0975	agent0	initial_cond	1	0.000000
exp6272	5.23962023e-29	0.000000	0.000000	discard	cycle 38 u=0.0975	agent0	initial_cond	0	0.000000
exp6273	5.23962023e-29	0.000000	0.000000	discard	cycle 38 u=0.0975	agent0	initial_cond	0	0.000000
exp6274	5.23962023e-29	0.000000	0.000000	discard	cycle 38 u=0.0975	agent0	initial_cond	0	0.000000
exp6275	4.03266298e-29	0.000000	0.000000	discard	cycle 38 u=0.0975	agent0	initial_cond	0	0.000000
exp6276	4.03266298e-29	0.000000	0.000000	discard	cycle 38 u=0.0975	agent0	initial_cond	1	0.000000
exp6277	4.03266298e-29	0.000000	0.000000	discard	cycle 38 u=0.0975	agent0	initial_cond	0	0.000000
exp6278	4.80015937e-29	0.000000	0.000000	discard	cycle 38 u=0.0975	agent0	initial_cond	0	0.000000
exp6279	4.80015937e-29	0.000000	0.000000	discard	cycle 38 u=0.0975	agent0	initial_cond	1	0.000000
exp6280	4.80015937e-29	0.000000	0.000000	discard	cycle 38 u=0.0975	agent0	initial_cond	0	0.000000
exp6281	2.68824537e-29	0.000000	0.000000	discard	cycle 38 u=0.0980	agent0	initial_cond	0	-0.000000
exp6282	2.68824537e-29	0.000000	0.000000	discard	cycle 38 u=0.0980	agent0	initial_cond	0	-0.000000
exp6283	2.68824537e-29	0.000000	0.000000	discard	cycle 38 u=0.0980	agent0	initial_cond	0	-0.000000
exp6284	2.14663825e-17	0.070278	0.000000	discard	4th branch u_offset=0.345 amp=0.5 phase=1.0	manual	memory	0	0.000097
exp6285	6.16758073e-29	0.000000	0.000000	discard	cycle 38 u=0.0980	agent0	initial_cond	1	-0.000000
exp6286	6.16758073e-29	0.000000	0.000000	discard	cycle 38 u=0.0980	agent0	initial_cond	0	-0.000000
exp6287	6.16758073e-29	0.000000	0.000000	discard	cycle 38 u=0.0980	agent0	initial_cond	0	-0.000000
exp6288	2.01926478e-29	0.000000	0.000000	discard	cycle 38 u=0.0980	agent0	initial_cond	1	0.000000
exp6289	2.01926478e-29	0.000000	0.000000	discard	cycle 38 u=0.0980	agent0	initial_cond	0	0.000000
exp6290	2.01926478e-29	0.000000	0.000000	discard	cycle 38 u=0.0980	agent0	initial_cond	0	0.000000
exp6291	1.30310780e-28	0.000000	0.000000	discard	cycle 38 u=0.0980	agent0	initial_cond	0	-0.000000
exp6292	1.30310780e-28	0.000000	0.000000	discard	cycle 38 u=0.0980	agent0	initial_cond	0	-0.000000
exp6293	1.30310780e-28	0.000000	0.000000	discard	cycle 38 u=0.0980	agent0	initial_cond	1	-0.000000
exp6294	5.45343271e-29	0.000000	0.000000	discard	cycle 38 u=0.0982	agent0	initial_cond	0	-0.000000
exp6295	5.45343271e-29	0.000000	0.000000	discard	cycle 38 u=0.0982	agent0	initial_cond	0	-0.000000
exp6296	5.45343271e-29	0.000000	0.000000	discard	cycle 38 u=0.0982	agent0	initial_cond	1	-0.000000
exp6297	1.23429977e-28	0.000000	0.000000	discard	cycle 38 u=0.0982	agent0	initial_cond	0	0.000000
exp6298	1.23429977e-28	0.000000	0.000000	discard	cycle 38 u=0.0982	agent0	initial_cond	0	0.000000
exp6299	1.23429977e-28	0.000000	0.000000	discard	cycle 38 u=0.0982	agent0	initial_cond	0	0.000000
exp6300	1.88036672e-29	0.000000	0.000000	discard	cycle 38 u=0.0982	agent0	initial_cond	0	0.000000
exp6301	1.88036672e-29	0.000000	0.000000	discard	cycle 38 u=0.0982	agent0	initial_cond	1	0.000000
exp6302	1.88036672e-29	0.000000	0.000000	discard	cycle 38 u=0.0982	agent0	initial_cond	0	0.000000
exp6303	1.91190259e-29	0.000000	-0.000000	discard	cycle 38 u=0.0982	agent0	initial_cond	0	0.000000
exp6303	2.21238560e-17	0.070278	-0.000000	discard	4th branch u_offset=0.362 amp=0.5 phase=1.0	manual	memory	0	0.000097
exp6304	1.91190259e-29	0.000000	-0.000000	discard	cycle 38 u=0.0982	agent0	initial_cond	1	0.000000
exp6305	1.91190259e-29	0.000000	-0.000000	discard	cycle 38 u=0.0982	agent0	initial_cond	0	0.000000
exp6306	6.13049994e-29	0.000000	0.000000	discard	cycle 38 u=0.0985	agent0	initial_cond	0	0.000000
exp6307	6.13049994e-29	0.000000	0.000000	discard	cycle 38 u=0.0985	agent0	initial_cond	0	0.000000
exp6308	6.13049994e-29	0.000000	0.000000	discard	cycle 38 u=0.0985	agent0	initial_cond	0	0.000000
exp6309	5.49750971e-29	0.000000	0.000000	discard	cycle 38 u=0.0985	agent0	initial_cond	1	0.000000
exp6310	5.49750971e-29	0.000000	0.000000	discard	cycle 38 u=0.0985	agent0	initial_cond	0	0.000000
exp6311	5.49750971e-29	0.000000	0.000000	discard	cycle 38 u=0.0985	agent0	initial_cond	0	0.000000
exp6312	4.15642452e-29	0.000000	0.000000	discard	cycle 38 u=0.0985	agent0	initial_cond	1	0.000000
exp6313	4.15642452e-29	0.000000	0.000000	discard	cycle 38 u=0.0985	agent0	initial_cond	0	0.000000
exp6314	4.15642452e-29	0.000000	0.000000	discard	cycle 38 u=0.0985	agent0	initial_cond	0	0.000000
exp6315	2.19292611e-29	0.000000	0.000000	discard	cycle 38 u=0.0985	agent0	initial_cond	0	-0.000000
exp6316	2.19292611e-29	0.000000	0.000000	discard	cycle 38 u=0.0985	agent0	initial_cond	0	-0.000000
exp6317	2.19292611e-29	0.000000	0.000000	discard	cycle 38 u=0.0985	agent0	initial_cond	1	-0.000000
exp6317	1.76957053e-17	0.070278	-0.000000	discard	4th branch u_offset=0.360 amp=0.5 phase=1.0	manual	memory	1	0.000097
exp6318	4.22491788e-29	0.000000	0.000000	discard	cycle 38 u=0.0990	agent0	initial_cond	0	-0.000000
exp6319	4.22491788e-29	0.000000	0.000000	discard	cycle 38 u=0.0990	agent0	initial_cond	0	-0.000000
exp6320	4.22491788e-29	0.000000	0.000000	discard	cycle 38 u=0.0990	agent0	initial_cond	1	-0.000000
exp6321	3.22245147e-29	0.000000	0.000000	discard	cycle 38 u=0.0990	agent0	initial_cond	0	0.000000
exp6322	3.22245147e-29	0.000000	0.000000	discard	cycle 38 u=0.0990	agent0	initial_cond	0	0.000000
exp6323	3.22245147e-29	0.000000	0.000000	discard	cycle 38 u=0.0990	agent0	initial_cond	0	0.000000
exp6324	4.50941488e-29	0.000000	-0.000000	discard	cycle 38 u=0.0990	agent0	initial_cond	0	0.000000
exp6325	4.50941488e-29	0.000000	-0.000000	discard	cycle 38 u=0.0990	agent0	initial_cond	1	0.000000
exp6326	4.50941488e-29	0.000000	-0.000000	discard	cycle 38 u=0.0990	agent0	initial_cond	0	0.000000
exp6327	4.88330883e-29	0.000000	-0.000000	discard	cycle 38 u=0.0990	agent0	initial_cond	0	0.000000
exp6328	4.88330883e-29	0.000000	-0.000000	discard	cycle 38 u=0.0990	agent0	initial_cond	1	0.000000
exp6329	4.88330883e-29	0.000000	-0.000000	discard	cycle 38 u=0.0990	agent0	initial_cond	0	0.000000
exp6330	5.74085541e-29	0.000000	-0.000000	discard	cycle 38 u=0.0995	agent0	initial_cond	1	0.000000
exp6331	5.74085541e-29	0.000000	-0.000000	discard	cycle 38 u=0.0995	agent0	initial_cond	0	0.000000
exp6332	5.74085541e-29	0.000000	-0.000000	discard	cycle 38 u=0.0995	agent0	initial_cond	0	0.000000
exp6333	1.54984578e-28	0.000000	0.000000	discard	cycle 38 u=0.0995	agent0	initial_cond	1	-0.000000
exp6334	1.54984578e-28	0.000000	0.000000	discard	cycle 38 u=0.0995	agent0	initial_cond	0	-0.000000
exp6335	1.54984578e-28	0.000000	0.000000	discard	cycle 38 u=0.0995	agent0	initial_cond	0	-0.000000
exp6336	1.60328418e-29	0.000000	-0.000000	discard	cycle 38 u=0.0995	agent0	initial_cond	1	-0.000000
exp6337	1.60328418e-29	0.000000	-0.000000	discard	cycle 38 u=0.0995	agent0	initial_cond	0	-0.000000
exp6338	1.60328418e-29	0.000000	-0.000000	discard	cycle 38 u=0.0995	agent0	initial_cond	1	-0.000000
exp6339	7.34590618e-29	0.000000	0.000000	discard	cycle 38 u=0.0995	agent0	initial_cond	0	0.000000
exp6340	7.34590618e-29	0.000000	0.000000	discard	cycle 38 u=0.0995	agent0	initial_cond	0	0.000000
exp6341	7.34590618e-29	0.000000	0.000000	discard	cycle 38 u=0.0995	agent0	initial_cond	1	0.000000
exp6342	4.46546993e-29	0.000000	0.000000	discard	cycle 38 u=0.1000	agent0	initial_cond	0	-0.000000
exp6343	4.46546993e-29	0.000000	0.000000	discard	cycle 38 u=0.1000	agent0	initial_cond	0	-0.000000
exp6344	4.46546993e-29	0.000000	0.000000	discard	cycle 38 u=0.1000	agent0	initial_cond	1	-0.000000
exp6345	4.08106752e-29	0.000000	0.000000	discard	cycle 38 u=0.1000	agent0	initial_cond	0	-0.000000
exp6346	4.08106752e-29	0.000000	0.000000	discard	cycle 38 u=0.1000	agent0	initial_cond	1	-0.000000
exp6347	4.08106752e-29	0.000000	0.000000	discard	cycle 38 u=0.1000	agent0	initial_cond	0	-0.000000
exp6348	4.58623706e-29	0.000000	0.000000	discard	cycle 38 u=0.1000	agent0	initial_cond	0	-0.000000
exp6349	4.58623706e-29	0.000000	0.000000	discard	cycle 38 u=0.1000	agent0	initial_cond	1	-0.000000
exp6350	4.58623706e-29	0.000000	0.000000	discard	cycle 38 u=0.1000	agent0	initial_cond	0	-0.000000
exp6351	4.39794337e-29	0.000000	0.000000	discard	cycle 38 u=0.1000	agent0	initial_cond	0	-0.000000
exp6352	4.39794337e-29	0.000000	0.000000	discard	cycle 38 u=0.1000	agent0	initial_cond	1	-0.000000
exp6353	4.39794337e-29	0.000000	0.000000	discard	cycle 38 u=0.1000	agent0	initial_cond	0	-0.000000
exp6354	1.36727475e-28	0.000000	0.000000	discard	cycle 38 u=0.1050	agent0	initial_cond	0	-0.000000
exp6355	1.36727475e-28	0.000000	0.000000	discard	cycle 38 u=0.1050	agent0	initial_cond	0	-0.000000
exp6356	1.36727475e-28	0.000000	0.000000	discard	cycle 38 u=0.1050	agent0	initial_cond	0	-0.000000
exp6357	6.14461376e-29	0.000000	0.000000	discard	cycle 38 u=0.1050	agent0	initial_cond	1	-0.000000
exp6358	6.14461376e-29	0.000000	0.000000	discard	cycle 38 u=0.1050	agent0	initial_cond	0	-0.000000
exp6359	6.14461376e-29	0.000000	0.000000	discard	cycle 38 u=0.1050	agent0	initial_cond	0	-0.000000
exp6360	1.75906666e-28	0.000000	0.000000	discard	cycle 38 u=0.1050	agent0	initial_cond	1	-0.000000
exp6361	1.75906666e-28	0.000000	0.000000	discard	cycle 38 u=0.1050	agent0	initial_cond	0	-0.000000
exp6362	1.75906666e-28	0.000000	0.000000	discard	cycle 38 u=0.1050	agent0	initial_cond	0	-0.000000
exp6363	1.11257917e-28	0.000000	0.000000	discard	cycle 38 u=0.1050	agent0	initial_cond	0	-0.000000
exp6364	1.11257917e-28	0.000000	0.000000	discard	cycle 38 u=0.1050	agent0	initial_cond	0	-0.000000
exp6365	1.11257917e-28	0.000000	0.000000	discard	cycle 38 u=0.1050	agent0	initial_cond	1	-0.000000
exp6366	8.58580947e-29	0.000000	0.000000	discard	cycle 39 u=0.0975	agent0	initial_cond	0	0.000000
exp6367	8.58580947e-29	0.000000	0.000000	discard	cycle 39 u=0.0975	agent0	initial_cond	0	0.000000
exp6368	8.58580947e-29	0.000000	0.000000	discard	cycle 39 u=0.0975	agent0	initial_cond	1	0.000000
exp6369	5.23962023e-29	0.000000	0.000000	discard	cycle 39 u=0.0975	agent0	initial_cond	0	0.000000
exp6370	5.23962023e-29	0.000000	0.000000	discard	cycle 39 u=0.0975	agent0	initial_cond	0	0.000000
exp6371	5.23962023e-29	0.000000	0.000000	discard	cycle 39 u=0.0975	agent0	initial_cond	0	0.000000
exp6372	4.03266298e-29	0.000000	0.000000	discard	cycle 39 u=0.0975	agent0	initial_cond	0	0.000000
exp6373	4.03266298e-29	0.000000	0.000000	discard	cycle 39 u=0.0975	agent0	initial_cond	1	0.000000
exp6374	4.03266298e-29	0.000000	0.000000	discard	cycle 39 u=0.0975	agent0	initial_cond	0	0.000000
exp6375	4.80015937e-29	0.000000	0.000000	discard	cycle 39 u=0.0975	agent0	initial_cond	0	0.000000
exp6376	4.80015937e-29	0.000000	0.000000	discard	cycle 39 u=0.0975	agent0	initial_cond	1	0.000000
exp6377	4.80015937e-29	0.000000	0.000000	discard	cycle 39 u=0.0975	agent0	initial_cond	0	0.000000
exp6378	2.68824537e-29	0.000000	0.000000	discard	cycle 39 u=0.0980	agent0	initial_cond	1	-0.000000
exp6379	2.68824537e-29	0.000000	0.000000	discard	cycle 39 u=0.0980	agent0	initial_cond	0	-0.000000
exp6380	2.68824537e-29	0.000000	0.000000	discard	cycle 39 u=0.0980	agent0	initial_cond	0	-0.000000
exp6381	6.16758073e-29	0.000000	0.000000	discard	cycle 39 u=0.0980	agent0	initial_cond	1	-0.000000
exp6382	6.16758073e-29	0.000000	0.000000	discard	cycle 39 u=0.0980	agent0	initial_cond	0	-0.000000
exp6383	6.16758073e-29	0.000000	0.000000	discard	cycle 39 u=0.0980	agent0	initial_cond	0	-0.000000
exp6384	2.01926478e-29	0.000000	0.000000	discard	cycle 39 u=0.0980	agent0	initial_cond	1	0.000000
exp6385	2.01926478e-29	0.000000	0.000000	discard	cycle 39 u=0.0980	agent0	initial_cond	0	0.000000
exp6386	2.01926478e-29	0.000000	0.000000	discard	cycle 39 u=0.0980	agent0	initial_cond	1	0.000000
exp6387	1.30310780e-28	0.000000	0.000000	discard	cycle 39 u=0.0980	agent0	initial_cond	0	-0.000000
exp6388	1.30310780e-28	0.000000	0.000000	discard	cycle 39 u=0.0980	agent0	initial_cond	0	-0.000000
exp6389	1.30310780e-28	0.000000	0.000000	discard	cycle 39 u=0.0980	agent0	initial_cond	1	-0.000000
exp6390	5.45343271e-29	0.000000	0.000000	discard	cycle 39 u=0.0982	agent0	initial_cond	0	-0.000000
exp6391	5.45343271e-29	0.000000	0.000000	discard	cycle 39 u=0.0982	agent0	initial_cond	0	-0.000000
exp6392	5.45343271e-29	0.000000	0.000000	discard	cycle 39 u=0.0982	agent0	initial_cond	1	-0.000000
exp6393	1.23429977e-28	0.000000	0.000000	discard	cycle 39 u=0.0982	agent0	initial_cond	0	0.000000
exp6394	1.23429977e-28	0.000000	0.000000	discard	cycle 39 u=0.0982	agent0	initial_cond	1	0.000000
exp6395	1.23429977e-28	0.000000	0.000000	discard	cycle 39 u=0.0982	agent0	initial_cond	0	0.000000
exp6396	1.88036672e-29	0.000000	0.000000	discard	cycle 39 u=0.0982	agent0	initial_cond	0	0.000000
exp6397	1.88036672e-29	0.000000	0.000000	discard	cycle 39 u=0.0982	agent0	initial_cond	1	0.000000
exp6398	1.88036672e-29	0.000000	0.000000	discard	cycle 39 u=0.0982	agent0	initial_cond	0	0.000000
exp6399	1.91190259e-29	0.000000	-0.000000	discard	cycle 39 u=0.0982	agent0	initial_cond	0	0.000000
exp6400	1.91190259e-29	0.000000	-0.000000	discard	cycle 39 u=0.0982	agent0	initial_cond	1	0.000000
exp6401	1.91190259e-29	0.000000	-0.000000	discard	cycle 39 u=0.0982	agent0	initial_cond	0	0.000000
exp6402	6.13049994e-29	0.000000	0.000000	discard	cycle 39 u=0.0985	agent0	initial_cond	0	0.000000
exp6403	6.13049994e-29	0.000000	0.000000	discard	cycle 39 u=0.0985	agent0	initial_cond	0	0.000000
exp6404	6.13049994e-29	0.000000	0.000000	discard	cycle 39 u=0.0985	agent0	initial_cond	0	0.000000
exp6405	5.49750971e-29	0.000000	0.000000	discard	cycle 39 u=0.0985	agent0	initial_cond	1	0.000000
exp6406	5.49750971e-29	0.000000	0.000000	discard	cycle 39 u=0.0985	agent0	initial_cond	0	0.000000
exp6407	5.49750971e-29	0.000000	0.000000	discard	cycle 39 u=0.0985	agent0	initial_cond	0	0.000000
exp6408	4.15642452e-29	0.000000	0.000000	discard	cycle 39 u=0.0985	agent0	initial_cond	1	0.000000
exp6409	4.15642452e-29	0.000000	0.000000	discard	cycle 39 u=0.0985	agent0	initial_cond	0	0.000000
exp6410	4.15642452e-29	0.000000	0.000000	discard	cycle 39 u=0.0985	agent0	initial_cond	0	0.000000
exp6411	2.19292611e-29	0.000000	0.000000	discard	cycle 39 u=0.0985	agent0	initial_cond	0	-0.000000
exp6412	2.19292611e-29	0.000000	0.000000	discard	cycle 39 u=0.0985	agent0	initial_cond	0	-0.000000
exp6413	2.19292611e-29	0.000000	0.000000	discard	cycle 39 u=0.0985	agent0	initial_cond	1	-0.000000
exp6414	4.22491788e-29	0.000000	0.000000	discard	cycle 39 u=0.0990	agent0	initial_cond	0	-0.000000
exp6415	4.22491788e-29	0.000000	0.000000	discard	cycle 39 u=0.0990	agent0	initial_cond	0	-0.000000
exp6416	4.22491788e-29	0.000000	0.000000	discard	cycle 39 u=0.0990	agent0	initial_cond	1	-0.000000
exp6417	3.22245147e-29	0.000000	0.000000	discard	cycle 39 u=0.0990	agent0	initial_cond	0	0.000000
exp6418	3.22245147e-29	0.000000	0.000000	discard	cycle 39 u=0.0990	agent0	initial_cond	1	0.000000
exp6419	3.22245147e-29	0.000000	0.000000	discard	cycle 39 u=0.0990	agent0	initial_cond	0	0.000000
exp6420	4.50941488e-29	0.000000	-0.000000	discard	cycle 39 u=0.0990	agent0	initial_cond	0	0.000000
exp6421	4.50941488e-29	0.000000	-0.000000	discard	cycle 39 u=0.0990	agent0	initial_cond	1	0.000000
exp6422	4.50941488e-29	0.000000	-0.000000	discard	cycle 39 u=0.0990	agent0	initial_cond	0	0.000000
exp6423	4.88330883e-29	0.000000	-0.000000	discard	cycle 39 u=0.0990	agent0	initial_cond	0	0.000000
exp6424	4.88330883e-29	0.000000	-0.000000	discard	cycle 39 u=0.0990	agent0	initial_cond	1	0.000000
exp6425	4.88330883e-29	0.000000	-0.000000	discard	cycle 39 u=0.0990	agent0	initial_cond	0	0.000000
exp6426	5.74085541e-29	0.000000	-0.000000	discard	cycle 39 u=0.0995	agent0	initial_cond	1	0.000000
exp6427	5.74085541e-29	0.000000	-0.000000	discard	cycle 39 u=0.0995	agent0	initial_cond	0	0.000000
exp6428	5.74085541e-29	0.000000	-0.000000	discard	cycle 39 u=0.0995	agent0	initial_cond	0	0.000000
exp6429	1.54984578e-28	0.000000	0.000000	discard	cycle 39 u=0.0995	agent0	initial_cond	1	-0.000000
exp6430	1.54984578e-28	0.000000	0.000000	discard	cycle 39 u=0.0995	agent0	initial_cond	0	-0.000000
exp6431	1.54984578e-28	0.000000	0.000000	discard	cycle 39 u=0.0995	agent0	initial_cond	0	-0.000000
exp6432	1.60328418e-29	0.000000	-0.000000	discard	cycle 39 u=0.0995	agent0	initial_cond	1	-0.000000
exp6433	1.60328418e-29	0.000000	-0.000000	discard	cycle 39 u=0.0995	agent0	initial_cond	0	-0.000000
exp6434	1.60328418e-29	0.000000	-0.000000	discard	cycle 39 u=0.0995	agent0	initial_cond	1	-0.000000
exp6435	7.34590618e-29	0.000000	0.000000	discard	cycle 39 u=0.0995	agent0	initial_cond	0	0.000000
exp6436	7.34590618e-29	0.000000	0.000000	discard	cycle 39 u=0.0995	agent0	initial_cond	0	0.000000
