exp_id	residual	solution_norm	solution_mean	status	description	agent	design	elapsed_s	solution_energy
exp3853	4.22769823e-16	1.001296	1.000019	discard	cycle 18 u=0.0980	agent0	initial_cond	0	-1.520844
exp3854	4.22769823e-16	1.001296	1.000019	discard	Fourier opt m=3 u=1.0 a=0.5	agent0	solver_param	0	-1.520844
exp3855	4.22769823e-16	1.001296	1.000019	discard	cycle 18 u=0.0980	agent0	initial_cond	1	-1.520844
exp3856	2.68824537e-29	0.000000	0.000000	discard	Fourier opt m=3 u=1.0 a=0.5	agent0	solver_param	1	-0.000000
exp3857	4.17680684e-16	1.001296	1.000019	discard	cycle 18 u=0.0980	agent0	initial_cond	0	-1.520844
exp3858	6.16758073e-29	0.000000	0.000000	discard	Fourier opt m=3 u=1.0 a=0.8	agent0	solver_param	0	-0.000000
exp3859	4.17680684e-16	1.001296	1.000019	discard	cycle 18 u=0.0980	agent0	initial_cond	0	-1.520844
exp3860	6.16758073e-29	0.000000	0.000000	discard	Fourier opt m=3 u=1.0 a=0.8	agent0	solver_param	1	-0.000000
exp3861	7.46725604e-14	1.001296	1.000019	discard	cycle 18 u=0.0980	agent0	initial_cond	1	-1.520844
exp3862	6.16758073e-29	0.000000	0.000000	discard	Fourier opt m=4 u=0.9 a=0.3	agent0	solver_param	0	-0.000000
exp3863	6.16758073e-29	0.000000	0.000000	discard	cycle 18 u=0.0980	agent0	initial_cond	0	-0.000000
exp3864	2.01926478e-29	0.000000	0.000000	discard	Fourier opt m=4 u=0.9 a=0.3	agent0	solver_param	0	0.000000
exp3865	2.01926478e-29	0.000000	0.000000	discard	cycle 18 u=0.0980	agent0	initial_cond	0	0.000000
exp3866	2.01926478e-29	0.000000	0.000000	discard	Fourier opt m=4 u=0.9 a=0.5	agent0	solver_param	0	0.000000
exp3866	2.01926478e-29	0.000000	0.000000	discard	cycle 18 u=0.0980	agent0	initial_cond	0	0.000000
exp3867	3.84592606e-16	1.001296	1.000019	discard	cycle 18 u=0.0980	agent0	initial_cond	0	-1.520844
exp3867	3.84592606e-16	1.001296	1.000019	discard	Fourier opt m=4 u=0.9 a=0.5	agent0	solver_param	0	-1.520844
exp3868	2.06774381e-16	1.001296	1.000019	discard	cycle 18 u=0.0980	agent0	initial_cond	1	-1.520844
exp3869	2.06774381e-16	1.001296	1.000019	discard	Fourier opt m=4 u=0.9 a=0.8	agent0	solver_param	1	-1.520844
exp3870	6.28503740e-13	1.001296	1.000019	discard	cycle 18 u=0.0980	agent0	initial_cond	0	-1.520844
exp3871	1.30310780e-28	0.000000	0.000000	discard	Fourier opt m=4 u=0.9 a=0.8	agent0	solver_param	0	-0.000000
exp3872	2.06774381e-16	1.001296	1.000019	discard	cycle 18 u=0.0980	agent0	initial_cond	0	-1.520844
exp3873	5.45343271e-29	0.000000	0.000000	discard	Fourier opt m=4 u=1.0 a=0.3	agent0	solver_param	0	-0.000000
exp3874	2.06774381e-16	1.001296	1.000019	discard	cycle 18 u=0.0982	agent0	initial_cond	1	-1.520844
exp3875	5.45343271e-29	0.000000	0.000000	discard	Fourier opt m=4 u=1.0 a=0.3	agent0	solver_param	0	-0.000000
exp3876	2.06774381e-16	1.001296	1.000019	discard	cycle 18 u=0.0982	agent0	initial_cond	0	-1.520844
exp3877	5.45343271e-29	0.000000	0.000000	discard	Fourier opt m=4 u=1.0 a=0.5	agent0	solver_param	0	-0.000000
exp3878	5.45343271e-29	0.000000	0.000000	discard	cycle 18 u=0.0982	agent0	initial_cond	0	-0.000000
exp3879	1.23429977e-28	0.000000	0.000000	discard	Fourier opt m=4 u=1.0 a=0.5	agent0	solver_param	1	0.000000
exp3880	1.23429977e-28	0.000000	0.000000	discard	cycle 18 u=0.0982	agent0	initial_cond	0	0.000000
exp3881	1.23429977e-28	0.000000	0.000000	discard	Fourier opt m=4 u=1.0 a=0.8	agent0	solver_param	0	0.000000
exp3881	1.23429977e-28	0.000000	0.000000	discard	cycle 18 u=0.0982	agent0	initial_cond	0	0.000000
exp3882	7.29343438e-16	1.001296	1.000019	discard	cycle 18 u=0.0982	agent0	initial_cond	1	-1.520844
exp3882	7.29343438e-16	1.001296	1.000019	discard	Fourier opt m=4 u=1.0 a=0.8	agent0	solver_param	1	-1.520844
exp3883	1.88036672e-29	0.000000	0.000000	discard	cycle 18 u=0.0982	agent0	initial_cond	0	0.000000
exp3884	1.88036672e-29	0.000000	0.000000	discard	cycle 18 u=0.0982	agent0	initial_cond	0	0.000000
exp3885	1.88036672e-29	0.000000	0.000000	discard	cycle 18 u=0.0982	agent0	initial_cond	1	0.000000
exp3886	1.91190259e-29	0.000000	-0.000000	discard	cycle 18 u=0.0982	agent0	initial_cond	0	0.000000
exp3887	1.91190259e-29	0.000000	-0.000000	discard	cycle 18 u=0.0982	agent0	initial_cond	0	0.000000
exp3888	1.91190259e-29	0.000000	-0.000000	discard	cycle 18 u=0.0982	agent0	initial_cond	1	0.000000
exp3889	6.13049994e-29	0.000000	0.000000	discard	cycle 18 u=0.0985	agent0	initial_cond	0	0.000000
exp3890	6.13049994e-29	0.000000	0.000000	discard	cycle 18 u=0.0985	agent0	initial_cond	0	0.000000
exp3891	6.13049994e-29	0.000000	0.000000	discard	cycle 18 u=0.0985	agent0	initial_cond	0	0.000000
exp3892	5.49750971e-29	0.000000	0.000000	discard	cycle 18 u=0.0985	agent0	initial_cond	0	0.000000
exp3893	5.49750971e-29	0.000000	0.000000	discard	cycle 18 u=0.0985	agent0	initial_cond	1	0.000000
exp3894	5.49750971e-29	0.000000	0.000000	discard	cycle 18 u=0.0985	agent0	initial_cond	0	0.000000
exp3895	4.15642452e-29	0.000000	0.000000	discard	cycle 18 u=0.0985	agent0	initial_cond	0	0.000000
exp3896	4.15642452e-29	0.000000	0.000000	discard	cycle 18 u=0.0985	agent0	initial_cond	1	0.000000
exp3897	4.15642452e-29	0.000000	0.000000	discard	cycle 18 u=0.0985	agent0	initial_cond	0	0.000000
exp3898	2.19292611e-29	0.000000	0.000000	discard	cycle 18 u=0.0985	agent0	initial_cond	0	-0.000000
exp3899	2.19292611e-29	0.000000	0.000000	discard	cycle 18 u=0.0985	agent0	initial_cond	1	-0.000000
exp3900	2.19292611e-29	0.000000	0.000000	discard	cycle 18 u=0.0985	agent0	initial_cond	0	-0.000000
exp3901	4.22491788e-29	0.000000	0.000000	discard	cycle 18 u=0.0990	agent0	initial_cond	1	-0.000000
exp3902	4.22491788e-29	0.000000	0.000000	discard	cycle 18 u=0.0990	agent0	initial_cond	0	-0.000000
exp3903	4.22491788e-29	0.000000	0.000000	discard	cycle 18 u=0.0990	agent0	initial_cond	0	-0.000000
exp3904	3.22245147e-29	0.000000	0.000000	discard	cycle 18 u=0.0990	agent0	initial_cond	1	0.000000
exp3905	3.22245147e-29	0.000000	0.000000	discard	cycle 18 u=0.0990	agent0	initial_cond	0	0.000000
exp3906	3.22245147e-29	0.000000	0.000000	discard	cycle 18 u=0.0990	agent0	initial_cond	0	0.000000
exp3907	4.50941488e-29	0.000000	-0.000000	discard	cycle 18 u=0.0990	agent0	initial_cond	1	0.000000
exp3908	0.00000000e+00	0.998999	1.000000	discard	K_amplitude=0.1 boundary	agent1	solver_param	1	-1.567655
exp3909	4.50941488e-29	0.000000	-0.000000	discard	cycle 18 u=0.0990	agent0	initial_cond	0	0.000000
exp3910	0.00000000e+00	0.998999	1.000000	discard	K_amplitude=0.2 boundary	agent1	solver_param	0	-1.567655
exp3911	4.50941488e-29	0.000000	-0.000000	discard	cycle 18 u=0.0990	agent0	initial_cond	0	0.000000
exp3912	0.00000000e+00	0.998999	1.000000	discard	K_amplitude=0.3 boundary	agent1	solver_param	1	-1.567655
exp3913	4.88330883e-29	0.000000	-0.000000	discard	cycle 18 u=0.0990	agent0	initial_cond	0	0.000000
exp3914	0.00000000e+00	0.998999	1.000000	discard	K_amplitude=0.4 boundary	agent1	solver_param	0	-1.567655
exp3915	4.88330883e-29	0.000000	-0.000000	discard	cycle 18 u=0.0990	agent0	initial_cond	0	0.000000
exp3916	0.00000000e+00	0.998999	1.000000	discard	K_amplitude=0.5 boundary	agent1	solver_param	0	-1.567655
exp3917	4.88330883e-29	0.000000	-0.000000	discard	cycle 18 u=0.0990	agent0	initial_cond	1	0.000000
exp3918	0.00000000e+00	0.998999	1.000000	discard	n_nodes=50 boundary	agent1	solver_param	1	-1.567655
exp3919	5.74085541e-29	0.000000	-0.000000	discard	cycle 18 u=0.0995	agent0	initial_cond	0	0.000000
exp3920	0.00000000e+00	0.998999	1.000000	discard	n_nodes=100 boundary	agent1	solver_param	0	-1.567655
exp3921	5.74085541e-29	0.000000	-0.000000	discard	cycle 18 u=0.0995	agent0	initial_cond	0	0.000000
exp3922	0.00000000e+00	0.998999	1.000000	discard	n_nodes=150 boundary	agent1	solver_param	0	-1.567655
exp3923	5.74085541e-29	0.000000	-0.000000	discard	cycle 18 u=0.0995	agent0	initial_cond	1	0.000000
exp3924	0.00000000e+00	0.998999	1.000000	discard	n_nodes=200 boundary	agent1	solver_param	1	-1.567655
exp3925	1.54984578e-28	0.000000	0.000000	discard	cycle 18 u=0.0995	agent0	initial_cond	0	-0.000000
exp3926	0.00000000e+00	0.998999	1.000000	discard	n_nodes=250 boundary	agent1	solver_param	0	-1.567655
exp3927	1.54984578e-28	0.000000	0.000000	discard	cycle 18 u=0.0995	agent0	initial_cond	0	-0.000000
exp3928	0.00000000e+00	0.998999	1.000000	discard	n_nodes=300 boundary	agent1	solver_param	1	-1.567655
exp3929	1.54984578e-28	0.000000	0.000000	discard	cycle 18 u=0.0995	agent0	initial_cond	0	-0.000000
exp3930	0.00000000e+00	0.998999	1.000000	discard	n_nodes=350 boundary	agent1	solver_param	0	-1.567655
exp3931	1.60328418e-29	0.000000	-0.000000	discard	cycle 18 u=0.0995	agent0	initial_cond	0	-0.000000
exp3932	0.00000000e+00	0.998999	-1.000000	discard	negative_boundary u=-0.462	agent1	branch_search	0	-1.567655
exp3933	1.60328418e-29	0.000000	-0.000000	discard	cycle 18 u=0.0995	agent0	initial_cond	1	-0.000000
exp3934	0.00000000e+00	0.998999	-1.000000	discard	negative_boundary u=-0.4630	agent1	branch_search	1	-1.567655
exp3935	1.60328418e-29	0.000000	-0.000000	discard	cycle 18 u=0.0995	agent0	initial_cond	0	-0.000000
exp3936	0.00000000e+00	0.998999	-1.000000	discard	negative_boundary u=-0.465	agent1	branch_search	0	-1.567655
exp3937	7.34590618e-29	0.000000	0.000000	discard	cycle 18 u=0.0995	agent0	initial_cond	0	0.000000
exp3938	1.36217862e-24	0.000000	0.000000	discard	extended_phase phase=0	agent1	branch_search	0	0.000000
exp3939	7.34590618e-29	0.000000	0.000000	discard	cycle 18 u=0.0995	agent0	initial_cond	1	0.000000
exp3940	5.97483795e-17	0.117042	0.000000	discard	extended_phase phase=.31415	agent1	branch_search	0	0.001086
exp3941	7.34590618e-29	0.000000	0.000000	discard	cycle 18 u=0.0995	agent0	initial_cond	0	0.000000
exp3942	6.39070983e-17	0.117042	0.000000	discard	extended_phase phase=.62831	agent1	branch_search	0	0.001086
exp3943	4.46546993e-29	0.000000	0.000000	discard	cycle 18 u=0.1000	agent0	initial_cond	0	-0.000000
exp3944	8.12841842e-17	0.117042	-0.000000	discard	extended_phase phase=.94247	agent1	branch_search	1	0.001086
exp3945	4.46546993e-29	0.000000	0.000000	discard	cycle 18 u=0.1000	agent0	initial_cond	1	-0.000000
exp3946	1.55389715e-16	0.117042	-0.000000	discard	extended_phase phase=1.25663	agent1	branch_search	0	0.001086
exp3947	4.46546993e-29	0.000000	0.000000	discard	cycle 18 u=0.1000	agent0	initial_cond	0	-0.000000
exp3948	8.76678699e-17	0.117042	0.000000	discard	extended_phase phase=1.57079	agent1	branch_search	0	0.001086
exp3949	4.08106752e-29	0.000000	0.000000	discard	cycle 18 u=0.1000	agent0	initial_cond	0	-0.000000
exp3950	4.19651315e-17	0.117042	0.000000	discard	extended_phase phase=1.88495	agent1	branch_search	1	0.001086
exp3951	4.08106752e-29	0.000000	0.000000	discard	cycle 18 u=0.1000	agent0	initial_cond	0	-0.000000
exp3952	4.67757890e-17	0.117042	0.000000	discard	extended_phase phase=2.19911	agent1	branch_search	0	0.001086
exp3953	4.08106752e-29	0.000000	0.000000	discard	cycle 18 u=0.1000	agent0	initial_cond	0	-0.000000
exp3954	5.84541837e-17	0.117042	-0.000000	discard	extended_phase phase=2.51327	agent1	branch_search	0	0.001086
exp3955	4.58623706e-29	0.000000	0.000000	discard	cycle 18 u=0.1000	agent0	initial_cond	1	-0.000000
exp3956	7.61460087e-17	0.117042	-0.000000	discard	extended_phase phase=2.82743	agent1	branch_search	0	0.001086
exp3957	4.58623706e-29	0.000000	0.000000	discard	cycle 18 u=0.1000	agent0	initial_cond	0	-0.000000
exp3958	1.59767884e-24	0.000000	-0.000000	discard	extended_phase phase=3.14159	agent1	branch_search	0	0.000000
exp3959	4.58623706e-29	0.000000	0.000000	discard	cycle 18 u=0.1000	agent0	initial_cond	0	-0.000000
exp3960	6.46378689e-17	0.117042	0.000000	discard	extended_phase phase=3.45574	agent1	branch_search	1	0.001086
exp3961	4.39794337e-29	0.000000	0.000000	discard	cycle 18 u=0.1000	agent0	initial_cond	1	-0.000000
exp3962	4.84307057e-17	0.117042	0.000000	discard	extended_phase phase=3.76990	agent1	branch_search	0	0.001086
exp3962	4.39794337e-29	0.000000	0.000000	discard	Fourier 1 mode positive	agent0	solver_param	0	-0.000000
exp3963	4.39794337e-29	0.000000	0.000000	discard	cycle 18 u=0.1000	agent0	initial_cond	0	-0.000000
exp3964	6.07236964e-17	0.117042	0.000000	discard	extended_phase phase=4.08406	agent1	branch_search	0	0.001086
exp3964	4.39794337e-29	0.000000	0.000000	discard	cycle 18 u=0.1000	agent0	initial_cond	0	-0.000000
exp3965	6.04605041e-17	0.117042	0.000000	discard	extended_phase phase=4.39822	agent1	branch_search	1	0.001086
exp3965	1.36727475e-28	0.000000	0.000000	discard	cycle 18 u=0.1050	agent0	initial_cond	0	-0.000000
exp3966	6.36923194e-17	0.117042	0.000000	discard	extended_phase phase=4.71238	agent1	branch_search	0	0.001086
exp3966	1.36727475e-28	0.000000	0.000000	discard	cycle 18 u=0.1050	agent0	initial_cond	0	-0.000000
exp3967	6.80423499e-17	0.117042	0.000000	discard	extended_phase phase=5.02654	agent1	branch_search	1	0.001086
exp3967	1.36727475e-28	0.000000	0.000000	discard	cycle 18 u=0.1050	agent0	initial_cond	1	-0.000000
exp3968	6.14461376e-29	0.000000	0.000000	discard	cycle 18 u=0.1050	agent0	initial_cond	0	-0.000000
exp3968	5.82932206e-17	0.117042	0.000000	discard	extended_phase phase=5.34070	agent1	branch_search	0	0.001086
exp3969	6.14461376e-29	0.000000	0.000000	discard	cycle 18 u=0.1050	agent0	initial_cond	0	-0.000000
exp3969	1.34284147e-16	0.117042	0.000000	discard	extended_phase phase=5.65486	agent1	branch_search	0	0.001086
exp3970	6.14461376e-29	0.000000	0.000000	discard	cycle 18 u=0.1050	agent0	initial_cond	1	-0.000000
exp3970	1.34049851e-16	0.117042	0.000000	discard	extended_phase phase=5.96902	agent1	branch_search	1	0.001086
exp3971	1.75906666e-28	0.000000	0.000000	discard	cycle 18 u=0.1050	agent0	initial_cond	0	-0.000000
exp3972	1.75906666e-28	0.000000	0.000000	discard	cycle 18 u=0.1050	agent0	initial_cond	0	-0.000000
exp3973	1.75906666e-28	0.000000	0.000000	discard	cycle 18 u=0.1050	agent0	initial_cond	1	-0.000000
exp3974	1.11257917e-28	0.000000	0.000000	discard	cycle 18 u=0.1050	agent0	initial_cond	0	-0.000000
exp3975	1.11257917e-28	0.000000	0.000000	discard	cycle 18 u=0.1050	agent0	initial_cond	0	-0.000000
exp3976	1.11257917e-28	0.000000	0.000000	discard	cycle 18 u=0.1050	agent0	initial_cond	0	-0.000000
exp3977	8.58580947e-29	0.000000	0.000000	discard	cycle 19 u=0.0975	agent0	initial_cond	0	0.000000
exp3978	8.58580947e-29	0.000000	0.000000	discard	cycle 19 u=0.0975	agent0	initial_cond	1	0.000000
exp3979	8.58580947e-29	0.000000	0.000000	discard	cycle 19 u=0.0975	agent0	initial_cond	0	0.000000
exp3980	5.23962023e-29	0.000000	0.000000	discard	cycle 19 u=0.0975	agent0	initial_cond	0	0.000000
exp3981	5.23962023e-29	0.000000	0.000000	discard	cycle 19 u=0.0975	agent0	initial_cond	1	0.000000
exp3982	5.23962023e-29	0.000000	0.000000	discard	cycle 19 u=0.0975	agent0	initial_cond	0	0.000000
exp3983	4.03266298e-29	0.000000	0.000000	discard	cycle 19 u=0.0975	agent0	initial_cond	0	0.000000
exp3984	4.03266298e-29	0.000000	0.000000	discard	cycle 19 u=0.0975	agent0	initial_cond	1	0.000000
exp3985	4.03266298e-29	0.000000	0.000000	discard	cycle 19 u=0.0975	agent0	initial_cond	0	0.000000
exp3986	4.80015937e-29	0.000000	0.000000	discard	cycle 19 u=0.0975	agent0	initial_cond	0	0.000000
exp3987	4.80015937e-29	0.000000	0.000000	discard	cycle 19 u=0.0975	agent0	initial_cond	0	0.000000
exp3988	4.80015937e-29	0.000000	0.000000	discard	cycle 19 u=0.0975	agent0	initial_cond	0	0.000000
exp3989	2.68824537e-29	0.000000	0.000000	discard	cycle 19 u=0.0980	agent0	initial_cond	1	-0.000000
exp3990	2.68824537e-29	0.000000	0.000000	discard	cycle 19 u=0.0980	agent0	initial_cond	0	-0.000000
exp3991	2.68824537e-29	0.000000	0.000000	discard	cycle 19 u=0.0980	agent0	initial_cond	0	-0.000000
exp3992	6.16758073e-29	0.000000	0.000000	discard	cycle 19 u=0.0980	agent0	initial_cond	1	-0.000000
exp3993	2.81345170e-14	1.001298	1.000025	discard	cycle 19 u=0.0980	agent0	initial_cond	0	-1.520921
exp3994	6.16758073e-29	0.000000	0.000000	discard	Fourier 2 amp=0.1	agent0	perturbation	0	-0.000000
exp3995	6.16758073e-29	0.000000	0.000000	discard	cycle 19 u=0.0980	agent0	initial_cond	0	-0.000000
exp3996	2.01926478e-29	0.000000	0.000000	discard	Fourier 2 amp=0.2	agent0	perturbation	1	0.000000
exp3997	2.01926478e-29	0.000000	0.000000	discard	cycle 19 u=0.0980	agent0	initial_cond	1	0.000000
exp3998	2.01926478e-29	0.000000	0.000000	discard	Fourier 2 amp=0.3	agent0	perturbation	0	0.000000
exp3998	2.01926478e-29	0.000000	0.000000	discard	cycle 19 u=0.0980	agent0	initial_cond	0	0.000000
exp3999	1.18940333e-14	1.001298	1.000025	discard	cycle 19 u=0.0980	agent0	initial_cond	1	-1.520921
exp3999	1.18940333e-14	1.001298	1.000025	discard	Fourier 2 amp=0.4	agent0	perturbation	1	-1.520921
exp4000	2.00148302e-16	1.001298	1.000025	discard	cycle 19 u=0.0980	agent0	initial_cond	0	-1.520921
exp4001	2.00148302e-16	1.001298	1.000025	discard	Fourier 2 amp=0.5	agent0	perturbation	0	-1.520921
exp4002	3.00316257e-13	1.001298	1.000025	discard	cycle 19 u=0.0980	agent0	initial_cond	0	-1.520921
exp4003	3.00316257e-13	1.001298	1.000025	discard	Fourier 2 amp=0.6	agent0	perturbation	0	-1.520921
exp4004	2.51337427e-16	1.001298	1.000025	discard	cycle 19 u=0.0980	agent0	initial_cond	1	-1.520921
exp4005	5.45343271e-29	0.000000	0.000000	discard	Fourier 2 amp=0.7	agent0	perturbation	1	-0.000000
exp4006	2.00148302e-16	1.001298	1.000025	discard	cycle 19 u=0.0982	agent0	initial_cond	0	-1.520921
exp4007	5.45343271e-29	0.000000	0.000000	discard	Fourier 2 amp=0.8	agent0	perturbation	0	-0.000000
exp4008	5.09754703e-14	1.001298	1.000025	discard	cycle 19 u=0.0982	agent0	initial_cond	0	-1.520921
exp4009	5.45343271e-29	0.000000	0.000000	discard	Fourier 2 amp=0.9	agent0	perturbation	1	-0.000000
exp4010	4.85182944e-12	1.001298	1.000025	discard	cycle 19 u=0.0982	agent0	initial_cond	1	-1.520921
exp4011	1.23429977e-28	0.000000	0.000000	discard	Fourier 2 amp=1.0	agent0	perturbation	0	0.000000
exp4012	1.23429977e-28	0.000000	0.000000	discard	cycle 19 u=0.0982	agent0	initial_cond	0	0.000000
exp4013	1.23429977e-28	0.000000	0.000000	discard	cycle 19 u=0.0982	agent0	initial_cond	0	0.000000
exp4014	1.23429977e-28	0.000000	0.000000	discard	cycle 19 u=0.0982	agent0	initial_cond	0	0.000000
exp4015	1.88036672e-29	0.000000	0.000000	discard	cycle 19 u=0.0982	agent0	initial_cond	0	0.000000
exp4016	1.88036672e-29	0.000000	0.000000	discard	cycle 19 u=0.0982	agent0	initial_cond	1	0.000000
exp4017	1.88036672e-29	0.000000	0.000000	discard	cycle 19 u=0.0982	agent0	initial_cond	0	0.000000
exp4018	1.91190259e-29	0.000000	-0.000000	discard	cycle 19 u=0.0982	agent0	initial_cond	0	0.000000
exp4019	1.91190259e-29	0.000000	-0.000000	discard	cycle 19 u=0.0982	agent0	initial_cond	1	0.000000
exp4020	1.91190259e-29	0.000000	-0.000000	discard	cycle 19 u=0.0982	agent0	initial_cond	0	0.000000
exp4021	6.13049994e-29	0.000000	0.000000	discard	cycle 19 u=0.0985	agent0	initial_cond	0	0.000000
exp4022	6.13049994e-29	0.000000	0.000000	discard	cycle 19 u=0.0985	agent0	initial_cond	1	0.000000
exp4023	6.13049994e-29	0.000000	0.000000	discard	cycle 19 u=0.0985	agent0	initial_cond	0	0.000000
exp4024	5.49750971e-29	0.000000	0.000000	discard	cycle 19 u=0.0985	agent0	initial_cond	0	0.000000
exp4025	5.49750971e-29	0.000000	0.000000	discard	cycle 19 u=0.0985	agent0	initial_cond	0	0.000000
exp4026	5.49750971e-29	0.000000	0.000000	discard	cycle 19 u=0.0985	agent0	initial_cond	0	0.000000
exp4027	4.15642452e-29	0.000000	0.000000	discard	cycle 19 u=0.0985	agent0	initial_cond	1	0.000000
exp4028	4.15642452e-29	0.000000	0.000000	discard	cycle 19 u=0.0985	agent0	initial_cond	0	0.000000
exp4029	4.15642452e-29	0.000000	0.000000	discard	cycle 19 u=0.0985	agent0	initial_cond	0	0.000000
exp4030	2.19292611e-29	0.000000	0.000000	discard	cycle 19 u=0.0985	agent0	initial_cond	1	-0.000000
exp4031	2.19292611e-29	0.000000	0.000000	discard	cycle 19 u=0.0985	agent0	initial_cond	0	-0.000000
exp4032	2.19292611e-29	0.000000	0.000000	discard	cycle 19 u=0.0985	agent0	initial_cond	0	-0.000000
exp4033	4.22491788e-29	0.000000	0.000000	discard	cycle 19 u=0.0990	agent0	initial_cond	1	-0.000000
exp4034	4.22491788e-29	0.000000	0.000000	discard	cycle 19 u=0.0990	agent0	initial_cond	0	-0.000000
exp4035	4.22491788e-29	0.000000	0.000000	discard	cycle 19 u=0.0990	agent0	initial_cond	0	-0.000000
exp4036	3.22245147e-29	0.000000	0.000000	discard	cycle 19 u=0.0990	agent0	initial_cond	0	0.000000
exp4037	2.86642839e-12	1.001298	1.000025	discard	cycle 19 u=0.0990	agent0	initial_cond	0	-1.520921
exp4038	3.22245147e-29	0.000000	0.000000	discard	Fourier 2 fine amp=0.45	agent0	perturbation	0	0.000000
exp4039	2.00148302e-16	1.001298	1.000025	discard	cycle 19 u=0.0990	agent0	initial_cond	1	-1.520921
exp4040	4.50941488e-29	0.000000	-0.000000	discard	Fourier 2 fine amp=0.48	agent0	perturbation	1	0.000000
exp4041	2.00148302e-16	1.001298	1.000025	discard	cycle 19 u=0.0990	agent0	initial_cond	0	-1.520921
exp4042	4.50941488e-29	0.000000	-0.000000	discard	Fourier 2 fine amp=0.50	agent0	perturbation	0	0.000000
exp4043	2.00148302e-16	1.001298	1.000025	discard	cycle 19 u=0.0990	agent0	initial_cond	0	-1.520921
exp4044	4.50941488e-29	0.000000	-0.000000	discard	Fourier 2 fine amp=0.52	agent0	perturbation	1	0.000000
exp4045	4.50941488e-29	0.000000	-0.000000	discard	cycle 19 u=0.0990	agent0	initial_cond	1	0.000000
exp4046	4.88330883e-29	0.000000	-0.000000	discard	Fourier 2 fine amp=0.55	agent0	perturbation	0	0.000000
exp4047	4.88330883e-29	0.000000	-0.000000	discard	cycle 19 u=0.0990	agent0	initial_cond	0	0.000000
exp4048	4.88330883e-29	0.000000	-0.000000	discard	cycle 19 u=0.0990	agent0	initial_cond	0	0.000000
exp4049	4.88330883e-29	0.000000	-0.000000	discard	cycle 19 u=0.0990	agent0	initial_cond	0	0.000000
exp4050	5.74085541e-29	0.000000	-0.000000	discard	cycle 19 u=0.0995	agent0	initial_cond	0	0.000000
exp4051	5.74085541e-29	0.000000	-0.000000	discard	cycle 19 u=0.0995	agent0	initial_cond	1	0.000000
exp4052	5.74085541e-29	0.000000	-0.000000	discard	cycle 19 u=0.0995	agent0	initial_cond	0	0.000000
exp4053	1.54984578e-28	0.000000	0.000000	discard	cycle 19 u=0.0995	agent0	initial_cond	0	-0.000000
exp4054	1.54984578e-28	0.000000	0.000000	discard	cycle 19 u=0.0995	agent0	initial_cond	1	-0.000000
