exp_id	residual	solution_norm	solution_mean	status	description	agent	design	elapsed_s	solution_energy
exp9276	4.98493354e-17	0.070278	-0.000000	discard	Extreme u=0.2450 amp=0.435 p=1.225	manual	memory	1	0.000097
exp9277	5.49750971e-29	0.000000	0.000000	discard	cycle 65 u=0.0985	agent0	initial_cond	0	0.000000
exp9278	4.15642452e-29	0.000000	0.000000	discard	cycle 65 u=0.0985	agent0	initial_cond	0	0.000000
exp9278	1.30045584e-17	0.070278	-0.000000	discard	Extreme u=0.2450 amp=0.435 p=1.230	manual	memory	0	0.000097
exp9279	4.15642452e-29	0.000000	0.000000	discard	cycle 65 u=0.0985	agent0	initial_cond	1	0.000000
exp9280	6.17347326e-17	0.070278	-0.000000	discard	Extreme u=0.2450 amp=0.435 p=1.235	manual	memory	1	0.000097
exp9281	4.15642452e-29	0.000000	0.000000	discard	cycle 65 u=0.0985	agent0	initial_cond	0	0.000000
exp9282	1.24666070e-17	0.070278	-0.000000	discard	Extreme u=0.2450 amp=0.435 p=1.240	manual	memory	0	0.000097
exp9283	2.19292611e-29	0.000000	0.000000	discard	cycle 65 u=0.0985	agent0	initial_cond	0	-0.000000
exp9284	2.48986937e-17	0.070278	-0.000000	discard	Extreme u=0.2450 amp=0.440 p=1.220	manual	memory	1	0.000097
exp9285	2.19292611e-29	0.000000	0.000000	discard	cycle 65 u=0.0985	agent0	initial_cond	1	-0.000000
exp9286	6.65175815e-17	0.070278	-0.000000	discard	Extreme u=0.2450 amp=0.440 p=1.225	manual	memory	0	0.000097
exp9286	2.19292611e-29	0.000000	0.000000	discard	cycle 65 u=0.0985	agent0	initial_cond	0	-0.000000
exp9287	4.22491788e-29	0.000000	0.000000	discard	cycle 65 u=0.0990	agent0	initial_cond	1	-0.000000
exp9288	2.66200809e-17	0.070278	-0.000000	discard	Extreme u=0.2450 amp=0.440 p=1.230	manual	memory	1	0.000097
exp9289	4.22491788e-29	0.000000	0.000000	discard	cycle 65 u=0.0990	agent0	initial_cond	0	-0.000000
exp9290	3.58652726e-17	0.070278	-0.000000	discard	Extreme u=0.2450 amp=0.440 p=1.235	manual	memory	0	0.000097
exp9291	4.22491788e-29	0.000000	0.000000	discard	cycle 65 u=0.0990	agent0	initial_cond	0	-0.000000
exp9292	3.62604279e-17	0.070278	-0.000000	discard	Extreme u=0.2450 amp=0.440 p=1.240	manual	memory	1	0.000097
exp9293	3.22245147e-29	0.000000	0.000000	discard	cycle 65 u=0.0990	agent0	initial_cond	1	0.000000
exp9294	5.81212684e-17	0.070278	-0.000000	discard	Extreme u=0.2450 amp=0.445 p=1.220	manual	memory	0	0.000097
exp9294	3.22245147e-29	0.000000	0.000000	discard	cycle 65 u=0.0990	agent0	initial_cond	0	0.000000
exp9295	3.22245147e-29	0.000000	0.000000	discard	cycle 65 u=0.0990	agent0	initial_cond	0	0.000000
exp9295	1.28433691e-17	0.070278	-0.000000	discard	Extreme u=0.2450 amp=0.445 p=1.225	manual	memory	1	0.000097
exp9296	4.50941488e-29	0.000000	-0.000000	discard	cycle 65 u=0.0990	agent0	initial_cond	0	0.000000
exp9297	4.96651047e-17	0.070278	-0.000000	discard	Extreme u=0.2450 amp=0.445 p=1.230	manual	memory	0	0.000097
exp9298	4.50941488e-29	0.000000	-0.000000	discard	cycle 65 u=0.0990	agent0	initial_cond	0	0.000000
exp9299	2.19858791e-17	0.070278	-0.000000	discard	Extreme u=0.2450 amp=0.445 p=1.235	manual	memory	1	0.000097
exp9300	4.50941488e-29	0.000000	-0.000000	discard	cycle 65 u=0.0990	agent0	initial_cond	1	0.000000
exp9301	2.66111562e-17	0.070278	-0.000000	discard	Extreme u=0.2450 amp=0.445 p=1.240	manual	memory	0	0.000097
exp9301	4.88330883e-29	0.000000	-0.000000	discard	cycle 65 u=0.0990	agent0	initial_cond	0	0.000000
exp9302	4.88330883e-29	0.000000	-0.000000	discard	cycle 65 u=0.0990	agent0	initial_cond	0	0.000000
exp9302	4.90618890e-17	0.070278	-0.000000	discard	Extreme u=0.2455 amp=0.435 p=1.220	manual	memory	0	0.000097
exp9303	4.88330883e-29	0.000000	-0.000000	discard	cycle 65 u=0.0990	agent0	initial_cond	0	0.000000
exp9304	2.47926655e-17	0.070278	-0.000000	discard	Extreme u=0.2455 amp=0.435 p=1.225	manual	memory	0	0.000097
exp9305	5.74085541e-29	0.000000	-0.000000	discard	cycle 65 u=0.0995	agent0	initial_cond	0	0.000000
exp9306	3.86322615e-17	0.070278	-0.000000	discard	Extreme u=0.2455 amp=0.435 p=1.230	manual	memory	0	0.000097
exp9307	5.74085541e-29	0.000000	-0.000000	discard	cycle 65 u=0.0995	agent0	initial_cond	1	0.000000
exp9308	2.12335517e-17	0.070278	-0.000000	discard	Extreme u=0.2455 amp=0.435 p=1.235	manual	memory	0	0.000097
exp9308	5.74085541e-29	0.000000	-0.000000	discard	cycle 65 u=0.0995	agent0	initial_cond	0	0.000000
exp9309	1.54984578e-28	0.000000	0.000000	discard	cycle 65 u=0.0995	agent0	initial_cond	0	-0.000000
exp9309	7.58821485e-18	0.070278	-0.000000	discard	Extreme u=0.2455 amp=0.435 p=1.240	manual	memory	0	0.000097
exp9310	1.54984578e-28	0.000000	0.000000	discard	cycle 65 u=0.0995	agent0	initial_cond	1	-0.000000
exp9311	4.78101137e-17	0.070278	-0.000000	discard	Extreme u=0.2455 amp=0.440 p=1.220	manual	memory	0	0.000097
exp9312	1.54984578e-28	0.000000	0.000000	discard	cycle 65 u=0.0995	agent0	initial_cond	0	-0.000000
exp9313	4.77880002e-17	0.070278	-0.000000	discard	Extreme u=0.2455 amp=0.440 p=1.225	manual	memory	0	0.000097
exp9314	1.60328418e-29	0.000000	-0.000000	discard	cycle 65 u=0.0995	agent0	initial_cond	1	-0.000000
exp9315	5.10531628e-17	0.070278	-0.000000	discard	Extreme u=0.2455 amp=0.440 p=1.230	manual	memory	0	0.000097
exp9316	1.60328418e-29	0.000000	-0.000000	discard	cycle 65 u=0.0995	agent0	initial_cond	0	-0.000000
exp9317	1.60328418e-29	0.000000	-0.000000	discard	cycle 65 u=0.0995	agent0	initial_cond	0	-0.000000
exp9317	1.35993503e-17	0.070278	-0.000000	discard	Extreme u=0.2455 amp=0.440 p=1.235	manual	memory	0	0.000097
exp9318	7.34590618e-29	0.000000	0.000000	discard	cycle 65 u=0.0995	agent0	initial_cond	1	0.000000
exp9319	5.15092480e-17	0.070278	-0.000000	discard	Extreme u=0.2455 amp=0.440 p=1.240	manual	memory	0	0.000097
exp9320	7.34590618e-29	0.000000	0.000000	discard	cycle 65 u=0.0995	agent0	initial_cond	0	0.000000
exp9321	4.92551438e-17	0.070278	-0.000000	discard	Extreme u=0.2455 amp=0.445 p=1.220	manual	memory	0	0.000097
exp9322	7.34590618e-29	0.000000	0.000000	discard	cycle 65 u=0.0995	agent0	initial_cond	0	0.000000
exp9323	7.28596963e-17	0.070278	-0.000000	discard	Extreme u=0.2455 amp=0.445 p=1.225	manual	memory	0	0.000097
exp9324	4.46546993e-29	0.000000	0.000000	discard	cycle 65 u=0.1000	agent0	initial_cond	0	-0.000000
exp9325	4.46546993e-29	0.000000	0.000000	discard	cycle 65 u=0.1000	agent0	initial_cond	0	-0.000000
exp9325	4.90276230e-17	0.070278	-0.000000	discard	Extreme u=0.2455 amp=0.445 p=1.230	manual	memory	0	0.000097
exp9326	4.46546993e-29	0.000000	0.000000	discard	cycle 65 u=0.1000	agent0	initial_cond	1	-0.000000
exp9327	1.94754772e-17	0.070278	-0.000000	discard	Extreme u=0.2455 amp=0.445 p=1.235	manual	memory	1	0.000097
exp9328	4.08106752e-29	0.000000	0.000000	discard	cycle 65 u=0.1000	agent0	initial_cond	0	-0.000000
exp9329	1.04788469e-17	0.070278	-0.000000	discard	Extreme u=0.2455 amp=0.445 p=1.240	manual	memory	0	0.000097
exp9330	4.08106752e-29	0.000000	0.000000	discard	cycle 65 u=0.1000	agent0	initial_cond	0	-0.000000
exp9331	4.08106752e-29	0.000000	0.000000	discard	cycle 65 u=0.1000	agent0	initial_cond	0	-0.000000
exp9332	4.58623706e-29	0.000000	0.000000	discard	cycle 65 u=0.1000	agent0	initial_cond	0	-0.000000
exp9333	4.58623706e-29	0.000000	0.000000	discard	cycle 65 u=0.1000	agent0	initial_cond	1	-0.000000
exp9334	4.58623706e-29	0.000000	0.000000	discard	cycle 65 u=0.1000	agent0	initial_cond	0	-0.000000
exp9335	4.39794337e-29	0.000000	0.000000	discard	cycle 65 u=0.1000	agent0	initial_cond	0	-0.000000
exp9336	4.39794337e-29	0.000000	0.000000	discard	cycle 65 u=0.1000	agent0	initial_cond	1	-0.000000
exp9337	4.39794337e-29	0.000000	0.000000	discard	cycle 65 u=0.1000	agent0	initial_cond	0	-0.000000
exp9338	1.36727475e-28	0.000000	0.000000	discard	cycle 65 u=0.1050	agent0	initial_cond	1	-0.000000
exp9339	1.36727475e-28	0.000000	0.000000	discard	cycle 65 u=0.1050	agent0	initial_cond	0	-0.000000
exp9340	1.36727475e-28	0.000000	0.000000	discard	cycle 65 u=0.1050	agent0	initial_cond	0	-0.000000
exp9341	6.14461376e-29	0.000000	0.000000	discard	cycle 65 u=0.1050	agent0	initial_cond	1	-0.000000
exp9342	6.14461376e-29	0.000000	0.000000	discard	cycle 65 u=0.1050	agent0	initial_cond	0	-0.000000
exp9343	6.14461376e-29	0.000000	0.000000	discard	cycle 65 u=0.1050	agent0	initial_cond	0	-0.000000
exp9344	1.75906666e-28	0.000000	0.000000	discard	cycle 65 u=0.1050	agent0	initial_cond	0	-0.000000
exp9345	1.75906666e-28	0.000000	0.000000	discard	cycle 65 u=0.1050	agent0	initial_cond	0	-0.000000
exp9346	1.75906666e-28	0.000000	0.000000	discard	cycle 65 u=0.1050	agent0	initial_cond	1	-0.000000
exp9347	1.11257917e-28	0.000000	0.000000	discard	cycle 65 u=0.1050	agent0	initial_cond	0	-0.000000
exp9348	1.11257917e-28	0.000000	0.000000	discard	cycle 65 u=0.1050	agent0	initial_cond	0	-0.000000
exp9349	1.11257917e-28	0.000000	0.000000	discard	cycle 65 u=0.1050	agent0	initial_cond	0	-0.000000
exp9350	8.58580947e-29	0.000000	0.000000	discard	cycle 66 u=0.0975	agent0	initial_cond	0	0.000000
exp9351	8.58580947e-29	0.000000	0.000000	discard	cycle 66 u=0.0975	agent0	initial_cond	1	0.000000
exp9352	8.58580947e-29	0.000000	0.000000	discard	cycle 66 u=0.0975	agent0	initial_cond	0	0.000000
exp9353	5.23962023e-29	0.000000	0.000000	discard	cycle 66 u=0.0975	agent0	initial_cond	0	0.000000
exp9354	5.23962023e-29	0.000000	0.000000	discard	cycle 66 u=0.0975	agent0	initial_cond	1	0.000000
exp9355	5.23962023e-29	0.000000	0.000000	discard	cycle 66 u=0.0975	agent0	initial_cond	0	0.000000
exp9356	4.03266298e-29	0.000000	0.000000	discard	cycle 66 u=0.0975	agent0	initial_cond	1	0.000000
exp9357	4.03266298e-29	0.000000	0.000000	discard	cycle 66 u=0.0975	agent0	initial_cond	0	0.000000
exp9358	4.03266298e-29	0.000000	0.000000	discard	cycle 66 u=0.0975	agent0	initial_cond	0	0.000000
exp9359	4.80015937e-29	0.000000	0.000000	discard	cycle 66 u=0.0975	agent0	initial_cond	1	0.000000
exp9360	4.80015937e-29	0.000000	0.000000	discard	cycle 66 u=0.0975	agent0	initial_cond	0	0.000000
exp9361	4.80015937e-29	0.000000	0.000000	discard	cycle 66 u=0.0975	agent0	initial_cond	0	0.000000
exp9362	2.68824537e-29	0.000000	0.000000	discard	cycle 66 u=0.0980	agent0	initial_cond	0	-0.000000
exp9363	2.68824537e-29	0.000000	0.000000	discard	cycle 66 u=0.0980	agent0	initial_cond	0	-0.000000
exp9364	2.68824537e-29	0.000000	0.000000	discard	cycle 66 u=0.0980	agent0	initial_cond	1	-0.000000
exp9365	6.16758073e-29	0.000000	0.000000	discard	cycle 66 u=0.0980	agent0	initial_cond	0	-0.000000
exp9366	6.16758073e-29	0.000000	0.000000	discard	cycle 66 u=0.0980	agent0	initial_cond	0	-0.000000
exp9367	6.91159813e-18	0.070278	-0.000000	discard	n_nodes exploration nodes=150 at SOTA	manual	memory	1	0.000097
exp9367	6.16758073e-29	0.000000	0.000000	discard	cycle 66 u=0.0980	agent0	initial_cond	1	-0.000000
exp9368	2.01926478e-29	0.000000	0.000000	discard	cycle 66 u=0.0980	agent0	initial_cond	0	0.000000
exp9369	6.91159813e-18	0.070278	-0.000000	discard	n_nodes exploration nodes=200 at SOTA	manual	memory	0	0.000097
exp9370	2.01926478e-29	0.000000	0.000000	discard	cycle 66 u=0.0980	agent0	initial_cond	1	0.000000
exp9371	6.91159813e-18	0.070278	-0.000000	discard	n_nodes exploration nodes=250 at SOTA	manual	memory	0	0.000097
exp9371	2.01926478e-29	0.000000	0.000000	discard	cycle 66 u=0.0980	agent0	initial_cond	0	0.000000
exp9372	1.30310780e-28	0.000000	0.000000	discard	cycle 66 u=0.0980	agent0	initial_cond	0	-0.000000
exp9373	6.91159813e-18	0.070278	-0.000000	discard	n_nodes exploration nodes=300 at SOTA	manual	memory	1	0.000097
exp9374	1.30310780e-28	0.000000	0.000000	discard	cycle 66 u=0.0980	agent0	initial_cond	1	-0.000000
exp9375	1.30310780e-28	0.000000	0.000000	discard	cycle 66 u=0.0980	agent0	initial_cond	0	-0.000000
exp9375	6.91159813e-18	0.070278	-0.000000	discard	n_nodes exploration nodes=350 at SOTA	manual	memory	0	0.000097
exp9376	5.45343271e-29	0.000000	0.000000	discard	cycle 66 u=0.0982	agent0	initial_cond	0	-0.000000
exp9377	6.91159813e-18	0.070278	-0.000000	discard	n_nodes exploration nodes=400 at SOTA	manual	memory	1	0.000097
exp9378	5.45343271e-29	0.000000	0.000000	discard	cycle 66 u=0.0982	agent0	initial_cond	0	-0.000000
exp9379	5.45343271e-29	0.000000	0.000000	discard	cycle 66 u=0.0982	agent0	initial_cond	0	-0.000000
exp9379	6.91159813e-18	0.070278	-0.000000	discard	n_nodes exploration nodes=500 at SOTA	manual	memory	0	0.000097
exp9380	1.23429977e-28	0.000000	0.000000	discard	cycle 66 u=0.0982	agent0	initial_cond	1	0.000000
exp9381	6.91159813e-18	0.070278	-0.000000	discard	n_nodes exploration nodes=600 at SOTA	manual	memory	0	0.000097
exp9382	1.23429977e-28	0.000000	0.000000	discard	cycle 66 u=0.0982	agent0	initial_cond	0	0.000000
exp9383	1.23429977e-28	0.000000	0.000000	discard	cycle 66 u=0.0982	agent0	initial_cond	0	0.000000
exp9384	1.88036672e-29	0.000000	0.000000	discard	cycle 66 u=0.0982	agent0	initial_cond	0	0.000000
exp9385	1.88036672e-29	0.000000	0.000000	discard	cycle 66 u=0.0982	agent0	initial_cond	0	0.000000
exp9386	1.88036672e-29	0.000000	0.000000	discard	cycle 66 u=0.0982	agent0	initial_cond	1	0.000000
exp9387	1.91190259e-29	0.000000	-0.000000	discard	cycle 66 u=0.0982	agent0	initial_cond	0	0.000000
exp9388	1.91190259e-29	0.000000	-0.000000	discard	cycle 66 u=0.0982	agent0	initial_cond	0	0.000000
exp9389	1.91190259e-29	0.000000	-0.000000	discard	cycle 66 u=0.0982	agent0	initial_cond	1	0.000000
exp9390	6.13049994e-29	0.000000	0.000000	discard	cycle 66 u=0.0985	agent0	initial_cond	0	0.000000
exp9391	6.13049994e-29	0.000000	0.000000	discard	cycle 66 u=0.0985	agent0	initial_cond	1	0.000000
exp9392	6.13049994e-29	0.000000	0.000000	discard	cycle 66 u=0.0985	agent0	initial_cond	0	0.000000
exp9393	5.49750971e-29	0.000000	0.000000	discard	cycle 66 u=0.0985	agent0	initial_cond	0	0.000000
exp9394	5.49750971e-29	0.000000	0.000000	discard	cycle 66 u=0.0985	agent0	initial_cond	1	0.000000
exp9395	4.17592883e-20	0.000000	0.000000	discard	n_mode exploration n_mode=-3 at SOTA u=0.244 amp=0.44 p=1.23	manual	memory	0	-0.000000
exp9396	5.49750971e-29	0.000000	0.000000	discard	cycle 66 u=0.0985	agent0	initial_cond	0	0.000000
exp9397	4.15642452e-29	0.000000	0.000000	discard	cycle 66 u=0.0985	agent0	initial_cond	0	0.000000
exp9397	4.17600997e-17	0.070278	0.000000	discard	n_mode exploration n_mode=-2 at SOTA u=0.244 amp=0.44 p=1.23	manual	memory	0	0.000097
exp9398	4.15642452e-29	0.000000	0.000000	discard	cycle 66 u=0.0985	agent0	initial_cond	0	0.000000
exp9399	2.02533243e-17	0.070278	0.000000	discard	n_mode exploration n_mode=-1 at SOTA u=0.244 amp=0.44 p=1.23	manual	memory	0	0.000097
exp9400	4.15642452e-29	0.000000	0.000000	discard	cycle 66 u=0.0985	agent0	initial_cond	0	0.000000
exp9401	2.19292611e-29	0.000000	0.000000	discard	cycle 66 u=0.0985	agent0	initial_cond	1	-0.000000
exp9401	4.10994698e-26	0.000000	0.000000	discard	n_mode exploration n_mode=0 at SOTA u=0.244 amp=0.44 p=1.23	manual	memory	1	-0.000000
exp9402	2.19292611e-29	0.000000	0.000000	discard	cycle 66 u=0.0985	agent0	initial_cond	0	-0.000000
exp9403	6.91159813e-18	0.070278	-0.000000	discard	n_mode exploration n_mode=1 at SOTA u=0.244 amp=0.44 p=1.23	manual	memory	0	0.000097
exp9404	2.19292611e-29	0.000000	0.000000	discard	cycle 66 u=0.0985	agent0	initial_cond	0	-0.000000
exp9405	4.22491788e-29	0.000000	0.000000	discard	cycle 66 u=0.0990	agent0	initial_cond	0	-0.000000
exp9405	1.32103920e-17	0.070278	-0.000000	discard	n_mode exploration n_mode=2 at SOTA u=0.244 amp=0.44 p=1.23	manual	memory	0	0.000097
exp9406	4.22491788e-29	0.000000	0.000000	discard	cycle 66 u=0.0990	agent0	initial_cond	0	-0.000000
exp9407	4.17828232e-20	0.000000	0.000000	discard	n_mode exploration n_mode=3 at SOTA u=0.244 amp=0.44 p=1.23	manual	memory	0	-0.000000
exp9408	4.22491788e-29	0.000000	0.000000	discard	cycle 66 u=0.0990	agent0	initial_cond	1	-0.000000
exp9409	3.22245147e-29	0.000000	0.000000	discard	cycle 66 u=0.0990	agent0	initial_cond	0	0.000000
exp9410	4.21701067e-17	0.070278	0.000000	discard	n_mode exploration n_mode=4 at SOTA u=0.244 amp=0.44 p=1.23	manual	memory	0	0.000097
exp9411	3.22245147e-29	0.000000	0.000000	discard	cycle 66 u=0.0990	agent0	initial_cond	0	0.000000
exp9412	1.60088290e-17	0.070278	0.000000	discard	n_mode exploration n_mode=5 at SOTA u=0.244 amp=0.44 p=1.23	manual	memory	1	0.000097
exp9413	3.22245147e-29	0.000000	0.000000	discard	cycle 66 u=0.0990	agent0	initial_cond	1	0.000000
exp9414	4.50941488e-29	0.000000	-0.000000	discard	cycle 66 u=0.0990	agent0	initial_cond	0	0.000000
exp9415	4.50941488e-29	0.000000	-0.000000	discard	cycle 66 u=0.0990	agent0	initial_cond	1	0.000000
exp9416	4.50941488e-29	0.000000	-0.000000	discard	cycle 66 u=0.0990	agent0	initial_cond	0	0.000000
exp9417	4.88330883e-29	0.000000	-0.000000	discard	cycle 66 u=0.0990	agent0	initial_cond	0	0.000000
exp9418	4.88330883e-29	0.000000	-0.000000	discard	cycle 66 u=0.0990	agent0	initial_cond	1	0.000000
exp9419	4.88330883e-29	0.000000	-0.000000	discard	cycle 66 u=0.0990	agent0	initial_cond	0	0.000000
exp9420	5.74085541e-29	0.000000	-0.000000	discard	cycle 66 u=0.0995	agent0	initial_cond	0	0.000000
exp9421	5.74085541e-29	0.000000	-0.000000	discard	cycle 66 u=0.0995	agent0	initial_cond	0	0.000000
exp9422	5.74085541e-29	0.000000	-0.000000	discard	cycle 66 u=0.0995	agent0	initial_cond	0	0.000000
exp9423	1.54984578e-28	0.000000	0.000000	discard	cycle 66 u=0.0995	agent0	initial_cond	1	-0.000000
exp9424	1.54984578e-28	0.000000	0.000000	discard	cycle 66 u=0.0995	agent0	initial_cond	0	-0.000000
exp9425	1.54984578e-28	0.000000	0.000000	discard	cycle 66 u=0.0995	agent0	initial_cond	0	-0.000000
exp9426	1.60328418e-29	0.000000	-0.000000	discard	cycle 66 u=0.0995	agent0	initial_cond	0	-0.000000
exp9427	1.60328418e-29	0.000000	-0.000000	discard	cycle 66 u=0.0995	agent0	initial_cond	0	-0.000000
exp9428	1.60328418e-29	0.000000	-0.000000	discard	cycle 66 u=0.0995	agent0	initial_cond	1	-0.000000
exp9429	7.34590618e-29	0.000000	0.000000	discard	cycle 66 u=0.0995	agent0	initial_cond	0	0.000000
exp9430	7.34590618e-29	0.000000	0.000000	discard	cycle 66 u=0.0995	agent0	initial_cond	0	0.000000
exp9430	8.14988367e-12	0.070278	-0.000000	discard	Newton tolerance exploration tol=1e-10 at SOTA	manual	memory	0	0.000097
exp9431	7.34590618e-29	0.000000	0.000000	discard	cycle 66 u=0.0995	agent0	initial_cond	1	0.000000
exp9432	6.91159813e-18	0.070278	-0.000000	discard	Newton tolerance exploration tol=1e-12 at SOTA	manual	memory	0	0.000097
exp9433	4.46546993e-29	0.000000	0.000000	discard	cycle 66 u=0.1000	agent0	initial_cond	0	-0.000000
exp9434	4.46546993e-29	0.000000	0.000000	discard	cycle 66 u=0.1000	agent0	initial_cond	1	-0.000000
exp9434	6.91159813e-18	0.070278	-0.000000	discard	Newton tolerance exploration tol=1e-14 at SOTA	manual	memory	1	0.000097
exp9435	4.46546993e-29	0.000000	0.000000	discard	cycle 66 u=0.1000	agent0	initial_cond	0	-0.000000
exp9436	6.91159813e-18	0.070278	-0.000000	discard	Newton tolerance exploration tol=1e-15 at SOTA	manual	memory	0	0.000097
exp9437	4.08106752e-29	0.000000	0.000000	discard	cycle 66 u=0.1000	agent0	initial_cond	0	-0.000000
exp9438	4.08106752e-29	0.000000	0.000000	discard	cycle 66 u=0.1000	agent0	initial_cond	1	-0.000000
exp9439	6.91159813e-18	0.070278	-0.000000	discard	Newton tolerance exploration tol=1e-16 at SOTA	manual	memory	1	0.000097
exp9440	4.08106752e-29	0.000000	0.000000	discard	cycle 66 u=0.1000	agent0	initial_cond	0	-0.000000
exp9441	4.58623706e-29	0.000000	0.000000	discard	cycle 66 u=0.1000	agent0	initial_cond	0	-0.000000
exp9442	4.58623706e-29	0.000000	0.000000	discard	cycle 66 u=0.1000	agent0	initial_cond	0	-0.000000
exp9443	4.58623706e-29	0.000000	0.000000	discard	cycle 66 u=0.1000	agent0	initial_cond	0	-0.000000
exp9444	4.39794337e-29	0.000000	0.000000	discard	cycle 66 u=0.1000	agent0	initial_cond	1	-0.000000
exp9445	4.39794337e-29	0.000000	0.000000	discard	cycle 66 u=0.1000	agent0	initial_cond	0	-0.000000
exp9446	4.39794337e-29	0.000000	0.000000	discard	cycle 66 u=0.1000	agent0	initial_cond	0	-0.000000
exp9447	1.36727475e-28	0.000000	0.000000	discard	cycle 66 u=0.1050	agent0	initial_cond	0	-0.000000
exp9448	1.36727475e-28	0.000000	0.000000	discard	cycle 66 u=0.1050	agent0	initial_cond	0	-0.000000
exp9449	1.36727475e-28	0.000000	0.000000	discard	cycle 66 u=0.1050	agent0	initial_cond	1	-0.000000
exp9450	6.14461376e-29	0.000000	0.000000	discard	cycle 66 u=0.1050	agent0	initial_cond	0	-0.000000
exp9451	6.14461376e-29	0.000000	0.000000	discard	cycle 66 u=0.1050	agent0	initial_cond	0	-0.000000
exp9452	6.14461376e-29	0.000000	0.000000	discard	cycle 66 u=0.1050	agent0	initial_cond	1	-0.000000
exp9453	1.75906666e-28	0.000000	0.000000	discard	cycle 66 u=0.1050	agent0	initial_cond	0	-0.000000
exp9454	1.75906666e-28	0.000000	0.000000	discard	cycle 66 u=0.1050	agent0	initial_cond	1	-0.000000
exp9455	1.75906666e-28	0.000000	0.000000	discard	cycle 66 u=0.1050	agent0	initial_cond	0	-0.000000
exp9456	1.11257917e-28	0.000000	0.000000	discard	cycle 66 u=0.1050	agent0	initial_cond	0	-0.000000
exp9457	1.11257917e-28	0.000000	0.000000	discard	cycle 66 u=0.1050	agent0	initial_cond	1	-0.000000
exp9458	4.37915776e-23	0.000000	-0.000000	discard	3D grid u=0.15 amp=0.35 p=0.0	manual	memory	0	-0.000000
exp9459	1.11257917e-28	0.000000	0.000000	discard	cycle 66 u=0.1050	agent0	initial_cond	0	-0.000000
exp9460	3.22797136e-17	0.070278	-0.000000	discard	3D grid u=0.15 amp=0.35 p=0.6	manual	memory	0	0.000097
exp9461	8.58580947e-29	0.000000	0.000000	discard	cycle 67 u=0.0975	agent0	initial_cond	0	0.000000
exp9462	1.91935119e-17	0.070278	-0.000000	discard	3D grid u=0.15 amp=0.35 p=1.2	manual	memory	1	0.000097
exp9462	8.58580947e-29	0.000000	0.000000	discard	cycle 67 u=0.0975	agent0	initial_cond	0	0.000000
exp9463	8.58580947e-29	0.000000	0.000000	discard	cycle 67 u=0.0975	agent0	initial_cond	0	0.000000
exp9463	1.47223630e-17	0.070278	-0.000000	discard	3D grid u=0.15 amp=0.35 p=1.8	manual	memory	0	0.000097
exp9464	5.23962023e-29	0.000000	0.000000	discard	cycle 67 u=0.0975	agent0	initial_cond	1	0.000000
exp9465	3.41224553e-17	0.070278	-0.000000	discard	3D grid u=0.15 amp=0.35 p=2.4	manual	memory	1	0.000097
exp9466	5.23962023e-29	0.000000	0.000000	discard	cycle 67 u=0.0975	agent0	initial_cond	0	0.000000
