exp_id	residual	solution_norm	solution_mean	status	description	agent	design	elapsed_s	solution_energy
exp7721	5.49750971e-29	0.000000	0.000000	discard	cycle 52 u=0.0985	agent0	initial_cond	0	0.000000
exp7722	4.15642452e-29	0.000000	0.000000	discard	cycle 52 u=0.0985	agent0	initial_cond	1	0.000000
exp7723	4.15642452e-29	0.000000	0.000000	discard	cycle 52 u=0.0985	agent0	initial_cond	0	0.000000
exp7724	4.15642452e-29	0.000000	0.000000	discard	cycle 52 u=0.0985	agent0	initial_cond	0	0.000000
exp7725	2.19292611e-29	0.000000	0.000000	discard	cycle 52 u=0.0985	agent0	initial_cond	1	-0.000000
exp7726	2.19292611e-29	0.000000	0.000000	discard	cycle 52 u=0.0985	agent0	initial_cond	0	-0.000000
exp7727	2.19292611e-29	0.000000	0.000000	discard	cycle 52 u=0.0985	agent0	initial_cond	0	-0.000000
exp7728	4.22491788e-29	0.000000	0.000000	discard	cycle 52 u=0.0990	agent0	initial_cond	0	-0.000000
exp7729	4.22491788e-29	0.000000	0.000000	discard	cycle 52 u=0.0990	agent0	initial_cond	0	-0.000000
exp7730	4.22491788e-29	0.000000	0.000000	discard	cycle 52 u=0.0990	agent0	initial_cond	1	-0.000000
exp7731	3.22245147e-29	0.000000	0.000000	discard	cycle 52 u=0.0990	agent0	initial_cond	0	0.000000
exp7732	3.22245147e-29	0.000000	0.000000	discard	cycle 52 u=0.0990	agent0	initial_cond	0	0.000000
exp7733	3.22245147e-29	0.000000	0.000000	discard	cycle 52 u=0.0990	agent0	initial_cond	1	0.000000
exp7734	4.50941488e-29	0.000000	-0.000000	discard	cycle 52 u=0.0990	agent0	initial_cond	0	0.000000
exp7735	4.50941488e-29	0.000000	-0.000000	discard	cycle 52 u=0.0990	agent0	initial_cond	0	0.000000
exp7736	4.50941488e-29	0.000000	-0.000000	discard	cycle 52 u=0.0990	agent0	initial_cond	0	0.000000
exp7737	4.88330883e-29	0.000000	-0.000000	discard	cycle 52 u=0.0990	agent0	initial_cond	0	0.000000
exp7738	4.88330883e-29	0.000000	-0.000000	discard	cycle 52 u=0.0990	agent0	initial_cond	1	0.000000
exp7739	4.88330883e-29	0.000000	-0.000000	discard	cycle 52 u=0.0990	agent0	initial_cond	0	0.000000
exp7740	5.74085541e-29	0.000000	-0.000000	discard	cycle 52 u=0.0995	agent0	initial_cond	0	0.000000
exp7741	5.74085541e-29	0.000000	-0.000000	discard	cycle 52 u=0.0995	agent0	initial_cond	1	0.000000
exp7742	5.74085541e-29	0.000000	-0.000000	discard	cycle 52 u=0.0995	agent0	initial_cond	0	0.000000
exp7743	1.54984578e-28	0.000000	0.000000	discard	cycle 52 u=0.0995	agent0	initial_cond	0	-0.000000
exp7744	1.54984578e-28	0.000000	0.000000	discard	cycle 52 u=0.0995	agent0	initial_cond	0	-0.000000
exp7745	1.54984578e-28	0.000000	0.000000	discard	cycle 52 u=0.0995	agent0	initial_cond	0	-0.000000
exp7746	1.60328418e-29	0.000000	-0.000000	discard	cycle 52 u=0.0995	agent0	initial_cond	1	-0.000000
exp7747	1.60328418e-29	0.000000	-0.000000	discard	cycle 52 u=0.0995	agent0	initial_cond	0	-0.000000
exp7748	1.60328418e-29	0.000000	-0.000000	discard	cycle 52 u=0.0995	agent0	initial_cond	0	-0.000000
exp7749	7.34590618e-29	0.000000	0.000000	discard	cycle 52 u=0.0995	agent0	initial_cond	1	0.000000
exp7750	7.34590618e-29	0.000000	0.000000	discard	cycle 52 u=0.0995	agent0	initial_cond	0	0.000000
exp7751	7.34590618e-29	0.000000	0.000000	discard	cycle 52 u=0.0995	agent0	initial_cond	1	0.000000
exp7752	4.46546993e-29	0.000000	0.000000	discard	cycle 52 u=0.1000	agent0	initial_cond	0	-0.000000
exp7753	4.46546993e-29	0.000000	0.000000	discard	cycle 52 u=0.1000	agent0	initial_cond	0	-0.000000
exp7754	4.46546993e-29	0.000000	0.000000	discard	cycle 52 u=0.1000	agent0	initial_cond	1	-0.000000
exp7755	4.08106752e-29	0.000000	0.000000	discard	cycle 52 u=0.1000	agent0	initial_cond	0	-0.000000
exp7756	4.08106752e-29	0.000000	0.000000	discard	cycle 52 u=0.1000	agent0	initial_cond	0	-0.000000
exp7757	4.08106752e-29	0.000000	0.000000	discard	cycle 52 u=0.1000	agent0	initial_cond	0	-0.000000
exp7758	4.58623706e-29	0.000000	0.000000	discard	cycle 52 u=0.1000	agent0	initial_cond	0	-0.000000
exp7759	4.58623706e-29	0.000000	0.000000	discard	cycle 52 u=0.1000	agent0	initial_cond	1	-0.000000
exp7760	4.58623706e-29	0.000000	0.000000	discard	cycle 52 u=0.1000	agent0	initial_cond	0	-0.000000
exp7761	4.39794337e-29	0.000000	0.000000	discard	cycle 52 u=0.1000	agent0	initial_cond	0	-0.000000
exp7762	4.39794337e-29	0.000000	0.000000	discard	cycle 52 u=0.1000	agent0	initial_cond	1	-0.000000
exp7763	4.39794337e-29	0.000000	0.000000	discard	cycle 52 u=0.1000	agent0	initial_cond	0	-0.000000
exp7764	1.36727475e-28	0.000000	0.000000	discard	cycle 52 u=0.1050	agent0	initial_cond	0	-0.000000
exp7765	1.36727475e-28	0.000000	0.000000	discard	cycle 52 u=0.1050	agent0	initial_cond	0	-0.000000
exp7766	1.36727475e-28	0.000000	0.000000	discard	cycle 52 u=0.1050	agent0	initial_cond	0	-0.000000
exp7767	6.14461376e-29	0.000000	0.000000	discard	cycle 52 u=0.1050	agent0	initial_cond	1	-0.000000
exp7768	6.14461376e-29	0.000000	0.000000	discard	cycle 52 u=0.1050	agent0	initial_cond	0	-0.000000
exp7769	6.14461376e-29	0.000000	0.000000	discard	cycle 52 u=0.1050	agent0	initial_cond	0	-0.000000
exp7770	1.75906666e-28	0.000000	0.000000	discard	cycle 52 u=0.1050	agent0	initial_cond	1	-0.000000
exp7771	1.75906666e-28	0.000000	0.000000	discard	cycle 52 u=0.1050	agent0	initial_cond	0	-0.000000
exp7772	1.75906666e-28	0.000000	0.000000	discard	cycle 52 u=0.1050	agent0	initial_cond	0	-0.000000
exp7773	1.11257917e-28	0.000000	0.000000	discard	cycle 52 u=0.1050	agent0	initial_cond	0	-0.000000
exp7774	1.11257917e-28	0.000000	0.000000	discard	cycle 52 u=0.1050	agent0	initial_cond	0	-0.000000
exp7775	1.11257917e-28	0.000000	0.000000	discard	cycle 52 u=0.1050	agent0	initial_cond	1	-0.000000
exp7776	8.58580947e-29	0.000000	0.000000	discard	cycle 53 u=0.0975	agent0	initial_cond	0	0.000000
exp7777	8.58580947e-29	0.000000	0.000000	discard	cycle 53 u=0.0975	agent0	initial_cond	0	0.000000
exp7778	8.58580947e-29	0.000000	0.000000	discard	cycle 53 u=0.0975	agent0	initial_cond	1	0.000000
exp_sota_r6	1.06327351e-17	0.070278	-0.000000	keep	SOTA Round 6: u=0.2080 modes=3 amp=0.5 phase=1.0 4th branch	agent1	memory	0	-0.000000
exp7779	5.23962023e-29	0.000000	0.000000	discard	cycle 53 u=0.0975	agent0	initial_cond	0	0.000000
exp7780	5.23962023e-29	0.000000	0.000000	discard	cycle 53 u=0.0975	agent0	initial_cond	1	0.000000
exp7781	5.23962023e-29	0.000000	0.000000	discard	cycle 53 u=0.0975	agent0	initial_cond	0	0.000000
exp7782	4.03266298e-29	0.000000	0.000000	discard	cycle 53 u=0.0975	agent0	initial_cond	0	0.000000
exp7783	4.03266298e-29	0.000000	0.000000	discard	cycle 53 u=0.0975	agent0	initial_cond	1	0.000000
exp7784	4.03266298e-29	0.000000	0.000000	discard	cycle 53 u=0.0975	agent0	initial_cond	0	0.000000
exp7785	4.80015937e-29	0.000000	0.000000	discard	cycle 53 u=0.0975	agent0	initial_cond	0	0.000000
exp7786	4.80015937e-29	0.000000	0.000000	discard	cycle 53 u=0.0975	agent0	initial_cond	0	0.000000
exp7787	4.80015937e-29	0.000000	0.000000	discard	cycle 53 u=0.0975	agent0	initial_cond	0	0.000000
exp7788	2.68824537e-29	0.000000	0.000000	discard	cycle 53 u=0.0980	agent0	initial_cond	1	-0.000000
exp7789	2.68824537e-29	0.000000	0.000000	discard	cycle 53 u=0.0980	agent0	initial_cond	0	-0.000000
exp7790	2.68824537e-29	0.000000	0.000000	discard	cycle 53 u=0.0980	agent0	initial_cond	0	-0.000000
exp7791	6.16758073e-29	0.000000	0.000000	discard	cycle 53 u=0.0980	agent0	initial_cond	1	-0.000000
exp7792	4.42154684e-15	0.000014	0.000000	discard	K_amplitude bifurcation tracking k_amp=0.0 u=0.2080	manual	memory	0	-0.000000
exp7792	6.16758073e-29	0.000000	0.000000	discard	cycle 53 u=0.0980	agent0	initial_cond	0	-0.000000
exp7793	6.16758073e-29	0.000000	0.000000	discard	cycle 53 u=0.0980	agent0	initial_cond	0	-0.000000
exp7794	2.10468973e-15	0.023554	-0.000000	discard	K_amplitude bifurcation tracking k_amp=0.1 u=0.2080	manual	memory	1	-0.000005
exp7795	2.01926478e-29	0.000000	0.000000	discard	cycle 53 u=0.0980	agent0	initial_cond	0	0.000000
exp7796	2.01926478e-29	0.000000	0.000000	discard	cycle 53 u=0.0980	agent0	initial_cond	0	0.000000
exp7797	2.19756009e-17	0.047011	-0.000000	discard	K_amplitude bifurcation tracking k_amp=0.2 u=0.2080	manual	memory	0	0.000003
exp7798	2.01926478e-29	0.000000	0.000000	discard	cycle 53 u=0.0980	agent0	initial_cond	1	0.000000
exp7799	1.30310780e-28	0.000000	0.000000	discard	cycle 53 u=0.0980	agent0	initial_cond	0	-0.000000
exp7800	3.99011519e-15	0.058674	-0.000000	discard	K_amplitude bifurcation tracking k_amp=0.25 u=0.2080	manual	memory	0	0.000033
exp7801	1.30310780e-28	0.000000	0.000000	discard	cycle 53 u=0.0980	agent0	initial_cond	0	-0.000000
exp7802	1.30310780e-28	0.000000	0.000000	discard	cycle 53 u=0.0980	agent0	initial_cond	1	-0.000000
exp7802	7.67593559e-17	0.070278	-0.000000	discard	K_amplitude bifurcation tracking k_amp=0.3 u=0.2080	manual	memory	0	0.000097
exp7803	5.45343271e-29	0.000000	0.000000	discard	cycle 53 u=0.0982	agent0	initial_cond	0	-0.000000
exp7804	6.12719943e-17	0.081814	-0.000000	discard	K_amplitude bifurcation tracking k_amp=0.35 u=0.2080	manual	memory	1	0.000212
exp7804	5.45343271e-29	0.000000	0.000000	discard	cycle 53 u=0.0982	agent0	initial_cond	1	-0.000000
exp7805	5.45343271e-29	0.000000	0.000000	discard	cycle 53 u=0.0982	agent0	initial_cond	0	-0.000000
exp7806	6.14512450e-15	0.093272	-0.000000	discard	K_amplitude bifurcation tracking k_amp=0.4 u=0.2080	manual	memory	0	0.000394
exp7807	1.23429977e-28	0.000000	0.000000	discard	cycle 53 u=0.0982	agent0	initial_cond	0	0.000000
exp7808	1.23429977e-28	0.000000	0.000000	discard	cycle 53 u=0.0982	agent0	initial_cond	1	0.000000
exp7809	2.78720222e-17	0.115920	-0.000000	discard	K_amplitude bifurcation tracking k_amp=0.5 u=0.2080	manual	memory	0	0.001044
exp7810	1.23429977e-28	0.000000	0.000000	discard	cycle 53 u=0.0982	agent0	initial_cond	0	0.000000
exp7811	1.88036672e-29	0.000000	0.000000	discard	cycle 53 u=0.0982	agent0	initial_cond	0	0.000000
exp7812	1.88036672e-29	0.000000	0.000000	discard	cycle 53 u=0.0982	agent0	initial_cond	0	0.000000
exp7813	1.88036672e-29	0.000000	0.000000	discard	cycle 53 u=0.0982	agent0	initial_cond	0	0.000000
exp7814	1.91190259e-29	0.000000	-0.000000	discard	cycle 53 u=0.0982	agent0	initial_cond	1	0.000000
exp7815	1.91190259e-29	0.000000	-0.000000	discard	cycle 53 u=0.0982	agent0	initial_cond	0	0.000000
exp7816	1.91190259e-29	0.000000	-0.000000	discard	cycle 53 u=0.0982	agent0	initial_cond	0	0.000000
exp7817	6.13049994e-29	0.000000	0.000000	discard	cycle 53 u=0.0985	agent0	initial_cond	1	0.000000
exp7818	6.13049994e-29	0.000000	0.000000	discard	cycle 53 u=0.0985	agent0	initial_cond	0	0.000000
exp7819	6.13049994e-29	0.000000	0.000000	discard	cycle 53 u=0.0985	agent0	initial_cond	0	0.000000
exp7820	5.49750971e-29	0.000000	0.000000	discard	cycle 53 u=0.0985	agent0	initial_cond	0	0.000000
exp7821	5.49750971e-29	0.000000	0.000000	discard	cycle 53 u=0.0985	agent0	initial_cond	0	0.000000
exp7822	5.49750971e-29	0.000000	0.000000	discard	cycle 53 u=0.0985	agent0	initial_cond	1	0.000000
exp7823	4.15642452e-29	0.000000	0.000000	discard	cycle 53 u=0.0985	agent0	initial_cond	0	0.000000
exp7824	4.15642452e-29	0.000000	0.000000	discard	cycle 53 u=0.0985	agent0	initial_cond	0	0.000000
exp7825	4.15642452e-29	0.000000	0.000000	discard	cycle 53 u=0.0985	agent0	initial_cond	1	0.000000
exp7826	2.19292611e-29	0.000000	0.000000	discard	cycle 53 u=0.0985	agent0	initial_cond	0	-0.000000
exp7827	2.19292611e-29	0.000000	0.000000	discard	cycle 53 u=0.0985	agent0	initial_cond	1	-0.000000
exp7828	2.19292611e-29	0.000000	0.000000	discard	cycle 53 u=0.0985	agent0	initial_cond	0	-0.000000
exp7829	4.22491788e-29	0.000000	0.000000	discard	cycle 53 u=0.0990	agent0	initial_cond	0	-0.000000
exp7830	4.22491788e-29	0.000000	0.000000	discard	cycle 53 u=0.0990	agent0	initial_cond	1	-0.000000
exp7831	5.98652480e-17	0.104643	-0.000000	discard	K_amplitude fine-tune k_amp=0.45 u=0.2080	manual	memory	0	0.000664
exp7832	4.22491788e-29	0.000000	0.000000	discard	cycle 53 u=0.0990	agent0	initial_cond	0	-0.000000
exp7833	1.85358463e-17	0.110294	-0.000000	discard	K_amplitude fine-tune k_amp=0.475 u=0.2080	manual	memory	0	0.000839
exp7833	3.22245147e-29	0.000000	0.000000	discard	cycle 53 u=0.0990	agent0	initial_cond	0	0.000000
exp7834	3.22245147e-29	0.000000	0.000000	discard	cycle 53 u=0.0990	agent0	initial_cond	0	0.000000
exp7835	1.07503818e-16	0.113110	-0.000000	discard	K_amplitude fine-tune k_amp=0.4875 u=0.2080	manual	memory	0	0.000937
exp7836	3.22245147e-29	0.000000	0.000000	discard	cycle 53 u=0.0990	agent0	initial_cond	0	0.000000
exp7837	4.50941488e-29	0.000000	-0.000000	discard	cycle 53 u=0.0990	agent0	initial_cond	1	0.000000
exp7837	2.84767710e-17	0.113673	-0.000000	discard	K_amplitude fine-tune k_amp=0.49 u=0.2080	manual	memory	1	0.000958
exp7838	4.50941488e-29	0.000000	-0.000000	discard	cycle 53 u=0.0990	agent0	initial_cond	0	0.000000
exp7839	8.11912729e-17	0.114797	-0.000000	discard	K_amplitude fine-tune k_amp=0.495 u=0.2080	manual	memory	0	0.001000
exp7840	4.50941488e-29	0.000000	-0.000000	discard	cycle 53 u=0.0990	agent0	initial_cond	0	0.000000
exp7841	4.88330883e-29	0.000000	-0.000000	discard	cycle 53 u=0.0990	agent0	initial_cond	1	0.000000
exp7842	2.78720222e-17	0.115920	-0.000000	discard	K_amplitude fine-tune k_amp=0.50 u=0.2080	manual	memory	0	0.001044
exp7843	4.88330883e-29	0.000000	-0.000000	discard	cycle 53 u=0.0990	agent0	initial_cond	0	0.000000
exp7844	2.64964896e-17	0.117042	-0.000000	discard	K_amplitude fine-tune k_amp=0.505 u=0.2080	manual	memory	0	0.001088
exp7845	4.88330883e-29	0.000000	-0.000000	discard	cycle 53 u=0.0990	agent0	initial_cond	0	0.000000
exp7846	5.74085541e-29	0.000000	-0.000000	discard	cycle 53 u=0.0995	agent0	initial_cond	0	0.000000
exp7847	9.17427659e-17	0.118164	-0.000000	discard	K_amplitude fine-tune k_amp=0.51 u=0.2080	manual	memory	0	0.001135
exp7848	5.74085541e-29	0.000000	-0.000000	discard	cycle 53 u=0.0995	agent0	initial_cond	0	0.000000
exp7849	5.63495876e-17	0.119284	-0.000000	discard	K_amplitude fine-tune k_amp=0.515 u=0.2080	manual	memory	1	0.001182
exp7849	5.74085541e-29	0.000000	-0.000000	discard	cycle 53 u=0.0995	agent0	initial_cond	1	0.000000
exp7850	1.54984578e-28	0.000000	0.000000	discard	cycle 53 u=0.0995	agent0	initial_cond	0	-0.000000
exp7851	5.56107320e-17	0.120403	-0.000000	discard	K_amplitude fine-tune k_amp=0.52 u=0.2080	manual	memory	0	0.001231
exp7852	1.54984578e-28	0.000000	0.000000	discard	cycle 53 u=0.0995	agent0	initial_cond	0	-0.000000
exp7853	1.54984578e-28	0.000000	0.000000	discard	cycle 53 u=0.0995	agent0	initial_cond	1	-0.000000
exp7853	4.22129637e-17	0.121521	-0.000000	discard	K_amplitude fine-tune k_amp=0.525 u=0.2080	manual	memory	1	0.001281
exp7854	1.60328418e-29	0.000000	-0.000000	discard	cycle 53 u=0.0995	agent0	initial_cond	0	-0.000000
exp7855	4.09208525e-17	0.127095	-0.000000	discard	K_amplitude fine-tune k_amp=0.55 u=0.2080	manual	memory	0	0.001555
exp7856	1.60328418e-29	0.000000	-0.000000	discard	cycle 53 u=0.0995	agent0	initial_cond	1	-0.000000
exp7857	1.60328418e-29	0.000000	-0.000000	discard	cycle 53 u=0.0995	agent0	initial_cond	0	-0.000000
exp7858	7.34590618e-29	0.000000	0.000000	discard	cycle 53 u=0.0995	agent0	initial_cond	0	0.000000
exp7859	7.34590618e-29	0.000000	0.000000	discard	cycle 53 u=0.0995	agent0	initial_cond	1	0.000000
exp7860	7.34590618e-29	0.000000	0.000000	discard	cycle 53 u=0.0995	agent0	initial_cond	0	0.000000
exp7861	4.46546993e-29	0.000000	0.000000	discard	cycle 53 u=0.1000	agent0	initial_cond	0	-0.000000
exp7862	4.46546993e-29	0.000000	0.000000	discard	cycle 53 u=0.1000	agent0	initial_cond	0	-0.000000
exp7863	4.46546993e-29	0.000000	0.000000	discard	cycle 53 u=0.1000	agent0	initial_cond	0	-0.000000
exp7864	4.08106752e-29	0.000000	0.000000	discard	cycle 53 u=0.1000	agent0	initial_cond	1	-0.000000
exp7865	4.08106752e-29	0.000000	0.000000	discard	cycle 53 u=0.1000	agent0	initial_cond	0	-0.000000
exp7866	4.08106752e-29	0.000000	0.000000	discard	cycle 53 u=0.1000	agent0	initial_cond	0	-0.000000
exp7867	4.58623706e-29	0.000000	0.000000	discard	cycle 53 u=0.1000	agent0	initial_cond	1	-0.000000
exp7868	4.58623706e-29	0.000000	0.000000	discard	cycle 53 u=0.1000	agent0	initial_cond	0	-0.000000
exp7869	6.89677525e-17	0.109166	-0.000000	discard	K_amplitude ultra-fine k_amp=0.470	manual	memory	0	0.000802
exp7870	4.58623706e-29	0.000000	0.000000	discard	cycle 53 u=0.1000	agent0	initial_cond	0	-0.000000
exp7871	4.39794337e-29	0.000000	0.000000	discard	cycle 53 u=0.1000	agent0	initial_cond	0	-0.000000
exp7871	4.88180585e-17	0.109617	-0.000000	discard	K_amplitude ultra-fine k_amp=0.472	manual	memory	0	0.000816
exp7872	4.39794337e-29	0.000000	0.000000	discard	cycle 53 u=0.1000	agent0	initial_cond	0	-0.000000
exp7873	2.41757867e-17	0.110068	-0.000000	discard	K_amplitude ultra-fine k_amp=0.474	manual	memory	0	0.000831
exp7874	4.39794337e-29	0.000000	0.000000	discard	cycle 53 u=0.1000	agent0	initial_cond	1	-0.000000
exp7875	1.36727475e-28	0.000000	0.000000	discard	cycle 53 u=0.1050	agent0	initial_cond	0	-0.000000
exp7876	1.85358463e-17	0.110294	-0.000000	discard	K_amplitude ultra-fine k_amp=0.475	manual	memory	0	0.000839
exp7877	1.36727475e-28	0.000000	0.000000	discard	cycle 53 u=0.1050	agent0	initial_cond	0	-0.000000
exp7878	5.70334527e-17	0.110520	-0.000000	discard	K_amplitude ultra-fine k_amp=0.476	manual	memory	1	0.000847
exp7879	1.36727475e-28	0.000000	0.000000	discard	cycle 53 u=0.1050	agent0	initial_cond	1	-0.000000
exp7880	6.14461376e-29	0.000000	0.000000	discard	cycle 53 u=0.1050	agent0	initial_cond	0	-0.000000
exp7881	4.91759675e-17	0.110745	-0.000000	discard	K_amplitude ultra-fine k_amp=0.477	manual	memory	0	0.000854
exp7882	6.14461376e-29	0.000000	0.000000	discard	cycle 53 u=0.1050	agent0	initial_cond	1	-0.000000
exp7883	5.96608619e-17	0.110970	-0.000000	discard	K_amplitude ultra-fine k_amp=0.478	manual	memory	0	0.000862
exp7883	6.14461376e-29	0.000000	0.000000	discard	cycle 53 u=0.1050	agent0	initial_cond	0	-0.000000
exp7884	1.75906666e-28	0.000000	0.000000	discard	cycle 53 u=0.1050	agent0	initial_cond	0	-0.000000
exp7885	3.39141227e-17	0.111421	-0.000000	discard	K_amplitude ultra-fine k_amp=0.480	manual	memory	0	0.000877
exp7886	1.75906666e-28	0.000000	0.000000	discard	cycle 53 u=0.1050	agent0	initial_cond	1	-0.000000
exp7887	1.75906666e-28	0.000000	0.000000	discard	cycle 53 u=0.1050	agent0	initial_cond	0	-0.000000
exp7888	1.11257917e-28	0.000000	0.000000	discard	cycle 53 u=0.1050	agent0	initial_cond	0	-0.000000
exp7889	1.11257917e-28	0.000000	0.000000	discard	cycle 53 u=0.1050	agent0	initial_cond	0	-0.000000
exp7890	1.11257917e-28	0.000000	0.000000	discard	cycle 53 u=0.1050	agent0	initial_cond	0	-0.000000
exp7891	8.58580947e-29	0.000000	0.000000	discard	cycle 54 u=0.0975	agent0	initial_cond	1	0.000000
exp7892	8.58580947e-29	0.000000	0.000000	discard	cycle 54 u=0.0975	agent0	initial_cond	0	0.000000
exp7893	8.58580947e-29	0.000000	0.000000	discard	cycle 54 u=0.0975	agent0	initial_cond	0	0.000000
exp7894	5.23962023e-29	0.000000	0.000000	discard	cycle 54 u=0.0975	agent0	initial_cond	1	0.000000
exp7895	5.23962023e-29	0.000000	0.000000	discard	cycle 54 u=0.0975	agent0	initial_cond	0	0.000000
exp7896	5.23962023e-29	0.000000	0.000000	discard	cycle 54 u=0.0975	agent0	initial_cond	0	0.000000
exp7897	4.03266298e-29	0.000000	0.000000	discard	cycle 54 u=0.0975	agent0	initial_cond	0	0.000000
exp7898	4.03266298e-29	0.000000	0.000000	discard	cycle 54 u=0.0975	agent0	initial_cond	0	0.000000
exp7899	4.03266298e-29	0.000000	0.000000	discard	cycle 54 u=0.0975	agent0	initial_cond	1	0.000000
exp7900	4.80015937e-29	0.000000	0.000000	discard	cycle 54 u=0.0975	agent0	initial_cond	0	0.000000
exp7901	4.80015937e-29	0.000000	0.000000	discard	cycle 54 u=0.0975	agent0	initial_cond	0	0.000000
exp7902	4.80015937e-29	0.000000	0.000000	discard	cycle 54 u=0.0975	agent0	initial_cond	1	0.000000
exp7903	2.68824537e-29	0.000000	0.000000	discard	cycle 54 u=0.0980	agent0	initial_cond	0	-0.000000
exp7904	2.68824537e-29	0.000000	0.000000	discard	cycle 54 u=0.0980	agent0	initial_cond	1	-0.000000
exp7905	2.68824537e-29	0.000000	0.000000	discard	cycle 54 u=0.0980	agent0	initial_cond	0	-0.000000
exp7906	6.16758073e-29	0.000000	0.000000	discard	cycle 54 u=0.0980	agent0	initial_cond	0	-0.000000
exp7907	6.16758073e-29	0.000000	0.000000	discard	cycle 54 u=0.0980	agent0	initial_cond	1	-0.000000
exp7908	5.49608370e-17	0.070278	-0.000000	discard	n_mode exploration n_mode=2 k_amp=0.3 u=0.2080	manual	memory	0	0.000097
exp7909	6.16758073e-29	0.000000	0.000000	discard	cycle 54 u=0.0980	agent0	initial_cond	0	-0.000000
exp7910	2.01926478e-29	0.000000	0.000000	discard	cycle 54 u=0.0980	agent0	initial_cond	0	0.000000
exp7911	2.81831287e-18	0.000000	0.000000	discard	n_mode exploration n_mode=3 k_amp=0.3 u=0.2080	manual	memory	1	-0.000000
exp7912	2.01926478e-29	0.000000	0.000000	discard	cycle 54 u=0.0980	agent0	initial_cond	0	0.000000
exp7913	7.67448753e-17	0.070278	0.000000	discard	n_mode exploration n_mode=4 k_amp=0.3 u=0.2080	manual	memory	0	0.000097
exp7913	2.01926478e-29	0.000000	0.000000	discard	cycle 54 u=0.0980	agent0	initial_cond	0	0.000000
exp7914	1.30310780e-28	0.000000	0.000000	discard	cycle 54 u=0.0980	agent0	initial_cond	1	-0.000000
exp7915	8.26433202e-17	0.070278	0.000000	discard	n_mode exploration n_mode=5 k_amp=0.3 u=0.2080	manual	memory	1	0.000097
exp7916	1.30310780e-28	0.000000	0.000000	discard	cycle 54 u=0.0980	agent0	initial_cond	0	-0.000000
exp7917	1.30310780e-28	0.000000	0.000000	discard	cycle 54 u=0.0980	agent0	initial_cond	0	-0.000000
exp7918	5.45343271e-29	0.000000	0.000000	discard	cycle 54 u=0.0982	agent0	initial_cond	1	-0.000000
exp7919	5.45343271e-29	0.000000	0.000000	discard	cycle 54 u=0.0982	agent0	initial_cond	0	-0.000000
exp7920	5.45343271e-29	0.000000	0.000000	discard	cycle 54 u=0.0982	agent0	initial_cond	1	-0.000000
exp7921	1.23429977e-28	0.000000	0.000000	discard	cycle 54 u=0.0982	agent0	initial_cond	0	0.000000
exp7922	1.23429977e-28	0.000000	0.000000	discard	cycle 54 u=0.0982	agent0	initial_cond	0	0.000000
exp7923	1.23429977e-28	0.000000	0.000000	discard	cycle 54 u=0.0982	agent0	initial_cond	1	0.000000
exp7924	1.88036672e-29	0.000000	0.000000	discard	cycle 54 u=0.0982	agent0	initial_cond	0	0.000000
