exp_id	residual	solution_norm	solution_mean	status	description	agent	design	elapsed_s	solution_energy
exp9841	4.33562227e-17	0.070278	-0.000000	discard	Alternative optimum u=0.195 amp=0.40 p=1.25	manual	memory	0	0.000097
exp9841	4.39794337e-29	0.000000	0.000000	discard	cycle 69 u=0.1000	agent0	initial_cond	0	-0.000000
exp9842	4.39794337e-29	0.000000	0.000000	discard	cycle 69 u=0.1000	agent0	initial_cond	1	-0.000000
exp9843	6.06389441e-15	0.070278	-0.000000	discard	Alternative optimum u=0.195 amp=0.40 p=1.3	manual	memory	1	0.000097
exp9844	4.39794337e-29	0.000000	0.000000	discard	cycle 69 u=0.1000	agent0	initial_cond	0	-0.000000
exp9845	3.33760502e-17	0.070278	-0.000000	discard	Alternative optimum u=0.195 amp=0.42 p=1.1	manual	memory	0	0.000097
exp9846	1.36727475e-28	0.000000	0.000000	discard	cycle 69 u=0.1050	agent0	initial_cond	0	-0.000000
exp9847	2.66818136e-17	0.070278	-0.000000	discard	Alternative optimum u=0.195 amp=0.42 p=1.15	manual	memory	1	0.000097
exp9848	1.36727475e-28	0.000000	0.000000	discard	cycle 69 u=0.1050	agent0	initial_cond	1	-0.000000
exp9849	2.02889298e-17	0.070278	-0.000000	discard	Alternative optimum u=0.195 amp=0.42 p=1.2	manual	memory	0	0.000097
exp9849	1.36727475e-28	0.000000	0.000000	discard	cycle 69 u=0.1050	agent0	initial_cond	0	-0.000000
exp9850	6.14461376e-29	0.000000	0.000000	discard	cycle 69 u=0.1050	agent0	initial_cond	1	-0.000000
exp9850	8.31578287e-18	0.070278	-0.000000	discard	Alternative optimum u=0.195 amp=0.42 p=1.25	manual	memory	1	0.000097
exp9851	6.14461376e-29	0.000000	0.000000	discard	cycle 69 u=0.1050	agent0	initial_cond	0	-0.000000
exp9852	2.17672237e-17	0.070278	-0.000000	discard	Alternative optimum u=0.195 amp=0.42 p=1.3	manual	memory	0	0.000097
exp9853	6.14461376e-29	0.000000	0.000000	discard	cycle 69 u=0.1050	agent0	initial_cond	0	-0.000000
exp9854	2.20101526e-17	0.070278	-0.000000	discard	Alternative optimum u=0.195 amp=0.44 p=1.1	manual	memory	1	0.000097
exp9855	1.75906666e-28	0.000000	0.000000	discard	cycle 69 u=0.1050	agent0	initial_cond	1	-0.000000
exp9856	1.84698100e-17	0.070278	-0.000000	discard	Alternative optimum u=0.195 amp=0.44 p=1.15	manual	memory	0	0.000097
exp9856	1.75906666e-28	0.000000	0.000000	discard	cycle 69 u=0.1050	agent0	initial_cond	0	-0.000000
exp9857	1.75906666e-28	0.000000	0.000000	discard	cycle 69 u=0.1050	agent0	initial_cond	0	-0.000000
exp9857	3.66938947e-17	0.070278	-0.000000	discard	Alternative optimum u=0.195 amp=0.44 p=1.2	manual	memory	1	0.000097
exp9858	1.11257917e-28	0.000000	0.000000	discard	cycle 69 u=0.1050	agent0	initial_cond	0	-0.000000
exp9859	8.32067193e-17	0.070278	0.000000	discard	Alternative optimum u=0.195 amp=0.44 p=1.25	manual	memory	0	0.000097
exp9860	1.11257917e-28	0.000000	0.000000	discard	cycle 69 u=0.1050	agent0	initial_cond	0	-0.000000
exp9861	1.24159372e-17	0.070278	-0.000000	discard	Alternative optimum u=0.195 amp=0.44 p=1.3	manual	memory	1	0.000097
exp9862	1.11257917e-28	0.000000	0.000000	discard	cycle 69 u=0.1050	agent0	initial_cond	1	-0.000000
exp9863	1.34016546e-17	0.070278	-0.000000	discard	Alternative optimum u=0.195 amp=0.46 p=1.1	manual	memory	0	0.000097
exp9863	8.58580947e-29	0.000000	0.000000	discard	cycle 70 u=0.0975	agent0	initial_cond	0	0.000000
exp9864	8.58580947e-29	0.000000	0.000000	discard	cycle 70 u=0.0975	agent0	initial_cond	0	0.000000
exp9864	1.92879346e-17	0.070278	-0.000000	discard	Alternative optimum u=0.195 amp=0.46 p=1.15	manual	memory	0	0.000097
exp9865	8.58580947e-29	0.000000	0.000000	discard	cycle 70 u=0.0975	agent0	initial_cond	0	0.000000
exp9866	2.56520331e-17	0.070278	-0.000000	discard	Alternative optimum u=0.195 amp=0.46 p=1.2	manual	memory	0	0.000097
exp9867	5.23962023e-29	0.000000	0.000000	discard	cycle 70 u=0.0975	agent0	initial_cond	0	0.000000
exp9868	3.85183408e-17	0.070278	-0.000000	discard	Alternative optimum u=0.195 amp=0.46 p=1.25	manual	memory	0	0.000097
exp9869	5.23962023e-29	0.000000	0.000000	discard	cycle 70 u=0.0975	agent0	initial_cond	1	0.000000
exp9870	3.41771385e-17	0.070278	-0.000000	discard	Alternative optimum u=0.195 amp=0.46 p=1.3	manual	memory	0	0.000097
exp9871	5.23962023e-29	0.000000	0.000000	discard	cycle 70 u=0.0975	agent0	initial_cond	0	0.000000
exp9872	4.03266298e-29	0.000000	0.000000	discard	cycle 70 u=0.0975	agent0	initial_cond	0	0.000000
exp9872	2.53921321e-17	0.070278	-0.000000	discard	Alternative optimum u=0.195 amp=0.48 p=1.1	manual	memory	0	0.000097
exp9873	4.03266298e-29	0.000000	0.000000	discard	cycle 70 u=0.0975	agent0	initial_cond	0	0.000000
exp9874	9.57048530e-17	0.070278	-0.000000	discard	Alternative optimum u=0.195 amp=0.48 p=1.15	manual	memory	0	0.000097
exp9875	4.03266298e-29	0.000000	0.000000	discard	cycle 70 u=0.0975	agent0	initial_cond	0	0.000000
exp9876	6.06696935e-17	0.070278	-0.000000	discard	Alternative optimum u=0.195 amp=0.48 p=1.2	manual	memory	0	0.000097
exp9877	4.80015937e-29	0.000000	0.000000	discard	cycle 70 u=0.0975	agent0	initial_cond	1	0.000000
exp9878	1.31098218e-16	0.070278	-0.000000	discard	Alternative optimum u=0.195 amp=0.48 p=1.25	manual	memory	0	0.000097
exp9879	4.80015937e-29	0.000000	0.000000	discard	cycle 70 u=0.0975	agent0	initial_cond	0	0.000000
exp9880	4.80015937e-29	0.000000	0.000000	discard	cycle 70 u=0.0975	agent0	initial_cond	0	0.000000
exp9880	6.89710236e-17	0.070278	-0.000000	discard	Alternative optimum u=0.195 amp=0.48 p=1.3	manual	memory	0	0.000097
exp9881	2.68824537e-29	0.000000	0.000000	discard	cycle 70 u=0.0980	agent0	initial_cond	0	-0.000000
exp9882	6.24407573e-17	0.070278	-0.000000	discard	Alternative optimum u=0.20 amp=0.40 p=1.1	manual	memory	0	0.000097
exp9883	2.68824537e-29	0.000000	0.000000	discard	cycle 70 u=0.0980	agent0	initial_cond	0	-0.000000
exp9884	3.52518340e-17	0.070278	-0.000000	discard	Alternative optimum u=0.20 amp=0.40 p=1.15	manual	memory	0	0.000097
exp9885	2.68824537e-29	0.000000	0.000000	discard	cycle 70 u=0.0980	agent0	initial_cond	1	-0.000000
exp9886	1.75198449e-17	0.070278	-0.000000	discard	Alternative optimum u=0.20 amp=0.40 p=1.2	manual	memory	0	0.000097
exp9887	6.16758073e-29	0.000000	0.000000	discard	cycle 70 u=0.0980	agent0	initial_cond	0	-0.000000
exp9888	3.78270148e-17	0.070278	-0.000000	discard	Alternative optimum u=0.20 amp=0.40 p=1.25	manual	memory	0	0.000097
exp9888	6.16758073e-29	0.000000	0.000000	discard	cycle 70 u=0.0980	agent0	initial_cond	0	-0.000000
exp9889	6.16758073e-29	0.000000	0.000000	discard	cycle 70 u=0.0980	agent0	initial_cond	1	-0.000000
exp9890	1.78421536e-17	0.070278	-0.000000	discard	Alternative optimum u=0.20 amp=0.40 p=1.3	manual	memory	0	0.000097
exp9891	2.01926478e-29	0.000000	0.000000	discard	cycle 70 u=0.0980	agent0	initial_cond	0	0.000000
exp9892	3.76470739e-17	0.070278	-0.000000	discard	Alternative optimum u=0.20 amp=0.42 p=1.1	manual	memory	0	0.000097
exp9893	2.01926478e-29	0.000000	0.000000	discard	cycle 70 u=0.0980	agent0	initial_cond	1	0.000000
exp9894	2.36364510e-17	0.070278	-0.000000	discard	Alternative optimum u=0.20 amp=0.42 p=1.15	manual	memory	0	0.000097
exp9895	2.01926478e-29	0.000000	0.000000	discard	cycle 70 u=0.0980	agent0	initial_cond	0	0.000000
exp9896	7.32750961e-17	0.070278	-0.000000	discard	Alternative optimum u=0.20 amp=0.42 p=1.2	manual	memory	0	0.000097
exp9896	1.30310780e-28	0.000000	0.000000	discard	cycle 70 u=0.0980	agent0	initial_cond	0	-0.000000
exp9897	1.30310780e-28	0.000000	0.000000	discard	cycle 70 u=0.0980	agent0	initial_cond	1	-0.000000
exp9898	9.88420749e-17	0.070278	-0.000000	discard	Alternative optimum u=0.20 amp=0.42 p=1.25	manual	memory	0	0.000097
exp9899	1.30310780e-28	0.000000	0.000000	discard	cycle 70 u=0.0980	agent0	initial_cond	0	-0.000000
exp9900	3.52415133e-17	0.070278	-0.000000	discard	Alternative optimum u=0.20 amp=0.42 p=1.3	manual	memory	0	0.000097
exp9901	5.45343271e-29	0.000000	0.000000	discard	cycle 70 u=0.0982	agent0	initial_cond	1	-0.000000
exp9902	1.88242514e-17	0.070278	-0.000000	discard	Alternative optimum u=0.20 amp=0.44 p=1.1	manual	memory	0	0.000097
exp9903	5.45343271e-29	0.000000	0.000000	discard	cycle 70 u=0.0982	agent0	initial_cond	0	-0.000000
exp9904	2.72081424e-17	0.070278	-0.000000	discard	Alternative optimum u=0.20 amp=0.44 p=1.15	manual	memory	0	0.000097
exp9904	5.45343271e-29	0.000000	0.000000	discard	cycle 70 u=0.0982	agent0	initial_cond	0	-0.000000
exp9905	1.23429977e-28	0.000000	0.000000	discard	cycle 70 u=0.0982	agent0	initial_cond	1	0.000000
exp9905	5.17807282e-17	0.070278	-0.000000	discard	Alternative optimum u=0.20 amp=0.44 p=1.2	manual	memory	1	0.000097
exp9906	1.23429977e-28	0.000000	0.000000	discard	cycle 70 u=0.0982	agent0	initial_cond	0	0.000000
exp9907	3.29434835e-17	0.070278	-0.000000	discard	Alternative optimum u=0.20 amp=0.44 p=1.25	manual	memory	0	0.000097
exp9908	1.23429977e-28	0.000000	0.000000	discard	cycle 70 u=0.0982	agent0	initial_cond	0	0.000000
exp9909	6.16497419e-17	0.070278	-0.000000	discard	Alternative optimum u=0.20 amp=0.44 p=1.3	manual	memory	1	0.000097
exp9910	1.88036672e-29	0.000000	0.000000	discard	cycle 70 u=0.0982	agent0	initial_cond	0	0.000000
exp9911	3.40359919e-17	0.070278	-0.000000	discard	Alternative optimum u=0.20 amp=0.46 p=1.1	manual	memory	0	0.000097
exp9911	1.88036672e-29	0.000000	0.000000	discard	cycle 70 u=0.0982	agent0	initial_cond	0	0.000000
exp9912	1.88036672e-29	0.000000	0.000000	discard	cycle 70 u=0.0982	agent0	initial_cond	1	0.000000
exp9912	3.75562064e-17	0.070278	-0.000000	discard	Alternative optimum u=0.20 amp=0.46 p=1.15	manual	memory	1	0.000097
exp9913	1.91190259e-29	0.000000	-0.000000	discard	cycle 70 u=0.0982	agent0	initial_cond	0	0.000000
exp9914	1.10924411e-17	0.070278	-0.000000	discard	Alternative optimum u=0.20 amp=0.46 p=1.2	manual	memory	0	0.000097
exp9915	1.91190259e-29	0.000000	-0.000000	discard	cycle 70 u=0.0982	agent0	initial_cond	0	0.000000
exp9916	5.96433810e-17	0.070278	-0.000000	discard	Alternative optimum u=0.20 amp=0.46 p=1.25	manual	memory	1	0.000097
exp9917	1.91190259e-29	0.000000	-0.000000	discard	cycle 70 u=0.0982	agent0	initial_cond	0	0.000000
exp9918	5.09798316e-17	0.070278	-0.000000	discard	Alternative optimum u=0.20 amp=0.46 p=1.3	manual	memory	0	0.000097
exp9918	6.13049994e-29	0.000000	0.000000	discard	cycle 70 u=0.0985	agent0	initial_cond	0	0.000000
exp9919	6.13049994e-29	0.000000	0.000000	discard	cycle 70 u=0.0985	agent0	initial_cond	1	0.000000
exp9919	7.34375097e-17	0.070278	-0.000000	discard	Alternative optimum u=0.20 amp=0.48 p=1.1	manual	memory	1	0.000097
exp9920	6.13049994e-29	0.000000	0.000000	discard	cycle 70 u=0.0985	agent0	initial_cond	0	0.000000
exp9921	4.64137853e-17	0.070278	-0.000000	discard	Alternative optimum u=0.20 amp=0.48 p=1.15	manual	memory	0	0.000097
exp9922	5.49750971e-29	0.000000	0.000000	discard	cycle 70 u=0.0985	agent0	initial_cond	0	0.000000
exp9923	7.94111002e-17	0.070278	0.000000	discard	Alternative optimum u=0.20 amp=0.48 p=1.2	manual	memory	1	0.000097
exp9924	5.49750971e-29	0.000000	0.000000	discard	cycle 70 u=0.0985	agent0	initial_cond	0	0.000000
exp9925	1.92416682e-17	0.070278	-0.000000	discard	Alternative optimum u=0.20 amp=0.48 p=1.25	manual	memory	0	0.000097
exp9925	5.49750971e-29	0.000000	0.000000	discard	cycle 70 u=0.0985	agent0	initial_cond	0	0.000000
exp9926	4.15642452e-29	0.000000	0.000000	discard	cycle 70 u=0.0985	agent0	initial_cond	1	0.000000
exp9926	8.81912888e-17	0.070278	-0.000000	discard	Alternative optimum u=0.20 amp=0.48 p=1.3	manual	memory	1	0.000097
exp9927	4.15642452e-29	0.000000	0.000000	discard	cycle 70 u=0.0985	agent0	initial_cond	0	0.000000
exp9928	5.50788085e-17	0.070278	-0.000000	discard	Alternative optimum u=0.205 amp=0.40 p=1.1	manual	memory	0	0.000097
exp9929	4.15642452e-29	0.000000	0.000000	discard	cycle 70 u=0.0985	agent0	initial_cond	0	0.000000
exp9930	6.03881745e-17	0.070278	-0.000000	discard	Alternative optimum u=0.205 amp=0.40 p=1.15	manual	memory	1	0.000097
exp9931	2.19292611e-29	0.000000	0.000000	discard	cycle 70 u=0.0985	agent0	initial_cond	1	-0.000000
exp9932	1.75159216e-17	0.070278	-0.000000	discard	Alternative optimum u=0.205 amp=0.40 p=1.2	manual	memory	0	0.000097
exp9932	2.19292611e-29	0.000000	0.000000	discard	cycle 70 u=0.0985	agent0	initial_cond	0	-0.000000
exp9933	2.19292611e-29	0.000000	0.000000	discard	cycle 70 u=0.0985	agent0	initial_cond	1	-0.000000
exp9933	1.53838694e-17	0.070278	-0.000000	discard	Alternative optimum u=0.205 amp=0.40 p=1.25	manual	memory	1	0.000097
exp9934	4.22491788e-29	0.000000	0.000000	discard	cycle 70 u=0.0990	agent0	initial_cond	0	-0.000000
exp9935	1.68909129e-17	0.070278	-0.000000	discard	Alternative optimum u=0.205 amp=0.40 p=1.3	manual	memory	0	0.000097
exp9936	4.22491788e-29	0.000000	0.000000	discard	cycle 70 u=0.0990	agent0	initial_cond	0	-0.000000
exp9937	3.66691513e-17	0.070278	-0.000000	discard	Alternative optimum u=0.205 amp=0.42 p=1.1	manual	memory	1	0.000097
exp9938	4.22491788e-29	0.000000	0.000000	discard	cycle 70 u=0.0990	agent0	initial_cond	1	-0.000000
exp9939	2.46638422e-17	0.070278	-0.000000	discard	Alternative optimum u=0.205 amp=0.42 p=1.15	manual	memory	0	0.000097
exp9939	3.22245147e-29	0.000000	0.000000	discard	cycle 70 u=0.0990	agent0	initial_cond	0	0.000000
exp9940	3.22245147e-29	0.000000	0.000000	discard	cycle 70 u=0.0990	agent0	initial_cond	1	0.000000
exp9940	4.60040934e-17	0.070278	-0.000000	discard	Alternative optimum u=0.205 amp=0.42 p=1.2	manual	memory	1	0.000097
exp9941	3.22245147e-29	0.000000	0.000000	discard	cycle 70 u=0.0990	agent0	initial_cond	0	0.000000
exp9942	3.23669348e-17	0.070278	-0.000000	discard	Alternative optimum u=0.205 amp=0.42 p=1.25	manual	memory	0	0.000097
exp9943	4.50941488e-29	0.000000	-0.000000	discard	cycle 70 u=0.0990	agent0	initial_cond	0	0.000000
exp9944	3.00822032e-17	0.070278	-0.000000	discard	Alternative optimum u=0.205 amp=0.42 p=1.3	manual	memory	1	0.000097
exp9945	4.50941488e-29	0.000000	-0.000000	discard	cycle 70 u=0.0990	agent0	initial_cond	1	0.000000
exp9946	3.34426869e-17	0.070278	-0.000000	discard	Alternative optimum u=0.205 amp=0.44 p=1.1	manual	memory	0	0.000097
exp9947	4.50941488e-29	0.000000	-0.000000	discard	cycle 70 u=0.0990	agent0	initial_cond	0	0.000000
exp9948	4.88330883e-29	0.000000	-0.000000	discard	cycle 70 u=0.0990	agent0	initial_cond	0	0.000000
exp9948	3.47488136e-17	0.070278	-0.000000	discard	Alternative optimum u=0.205 amp=0.44 p=1.15	manual	memory	1	0.000097
exp9949	4.88330883e-29	0.000000	-0.000000	discard	cycle 70 u=0.0990	agent0	initial_cond	0	0.000000
exp9950	2.50061140e-17	0.070278	-0.000000	discard	Alternative optimum u=0.205 amp=0.44 p=1.2	manual	memory	0	0.000097
exp9951	4.88330883e-29	0.000000	-0.000000	discard	cycle 70 u=0.0990	agent0	initial_cond	0	0.000000
exp9952	2.59936383e-17	0.070278	-0.000000	discard	Alternative optimum u=0.205 amp=0.44 p=1.25	manual	memory	0	0.000097
exp9953	5.74085541e-29	0.000000	-0.000000	discard	cycle 70 u=0.0995	agent0	initial_cond	1	0.000000
exp9954	3.60000540e-17	0.070278	-0.000000	discard	Alternative optimum u=0.205 amp=0.44 p=1.3	manual	memory	0	0.000097
exp9955	5.74085541e-29	0.000000	-0.000000	discard	cycle 70 u=0.0995	agent0	initial_cond	0	0.000000
exp9956	5.36650949e-17	0.070278	-0.000000	discard	Alternative optimum u=0.205 amp=0.46 p=1.1	manual	memory	0	0.000097
exp9956	5.74085541e-29	0.000000	-0.000000	discard	cycle 70 u=0.0995	agent0	initial_cond	1	0.000000
exp9957	1.54984578e-28	0.000000	0.000000	discard	cycle 70 u=0.0995	agent0	initial_cond	0	-0.000000
exp9958	2.15041247e-17	0.070278	-0.000000	discard	Alternative optimum u=0.205 amp=0.46 p=1.15	manual	memory	0	0.000097
exp9959	1.54984578e-28	0.000000	0.000000	discard	cycle 70 u=0.0995	agent0	initial_cond	0	-0.000000
exp9960	1.30828568e-17	0.070278	-0.000000	discard	Alternative optimum u=0.205 amp=0.46 p=1.2	manual	memory	0	0.000097
exp9961	1.54984578e-28	0.000000	0.000000	discard	cycle 70 u=0.0995	agent0	initial_cond	1	-0.000000
exp9962	4.20366415e-17	0.070278	-0.000000	discard	Alternative optimum u=0.205 amp=0.46 p=1.25	manual	memory	0	0.000097
exp9963	1.60328418e-29	0.000000	-0.000000	discard	cycle 70 u=0.0995	agent0	initial_cond	0	-0.000000
exp9964	3.64214924e-17	0.070278	-0.000000	discard	Alternative optimum u=0.205 amp=0.46 p=1.3	manual	memory	0	0.000097
exp9964	1.60328418e-29	0.000000	-0.000000	discard	cycle 70 u=0.0995	agent0	initial_cond	0	-0.000000
exp9965	1.60328418e-29	0.000000	-0.000000	discard	cycle 70 u=0.0995	agent0	initial_cond	0	-0.000000
exp9966	1.50627783e-17	0.070278	-0.000000	discard	Alternative optimum u=0.205 amp=0.48 p=1.1	manual	memory	0	0.000097
exp9967	7.34590618e-29	0.000000	0.000000	discard	cycle 70 u=0.0995	agent0	initial_cond	0	0.000000
exp9968	1.41366958e-17	0.070278	-0.000000	discard	Alternative optimum u=0.205 amp=0.48 p=1.15	manual	memory	0	0.000097
exp9969	7.34590618e-29	0.000000	0.000000	discard	cycle 70 u=0.0995	agent0	initial_cond	1	0.000000
exp9970	5.99905849e-17	0.070278	-0.000000	discard	Alternative optimum u=0.205 amp=0.48 p=1.2	manual	memory	0	0.000097
exp9971	7.34590618e-29	0.000000	0.000000	discard	cycle 70 u=0.0995	agent0	initial_cond	0	0.000000
exp9972	4.60697874e-17	0.070278	-0.000000	discard	Alternative optimum u=0.205 amp=0.48 p=1.25	manual	memory	0	0.000097
exp9972	4.46546993e-29	0.000000	0.000000	discard	cycle 70 u=0.1000	agent0	initial_cond	0	-0.000000
exp9973	4.46546993e-29	0.000000	0.000000	discard	cycle 70 u=0.1000	agent0	initial_cond	0	-0.000000
exp9973	4.65514990e-17	0.070278	-0.000000	discard	Alternative optimum u=0.205 amp=0.48 p=1.3	manual	memory	0	0.000097
exp9974	4.46546993e-29	0.000000	0.000000	discard	cycle 70 u=0.1000	agent0	initial_cond	0	-0.000000
exp9975	7.27373793e-17	0.070278	-0.000000	discard	Alternative optimum u=0.21 amp=0.40 p=1.1	manual	memory	0	0.000097
exp9976	4.08106752e-29	0.000000	0.000000	discard	cycle 70 u=0.1000	agent0	initial_cond	1	-0.000000
exp9977	4.17852268e-17	0.070278	-0.000000	discard	Alternative optimum u=0.21 amp=0.40 p=1.15	manual	memory	0	0.000097
exp9978	4.08106752e-29	0.000000	0.000000	discard	cycle 70 u=0.1000	agent0	initial_cond	0	-0.000000
exp9979	5.07532912e-17	0.070278	-0.000000	discard	Alternative optimum u=0.21 amp=0.40 p=1.2	manual	memory	0	0.000097
exp9979	4.08106752e-29	0.000000	0.000000	discard	cycle 70 u=0.1000	agent0	initial_cond	0	-0.000000
exp9980	4.58623706e-29	0.000000	0.000000	discard	cycle 70 u=0.1000	agent0	initial_cond	0	-0.000000
exp9981	2.24929869e-17	0.070278	-0.000000	discard	Alternative optimum u=0.21 amp=0.40 p=1.25	manual	memory	0	0.000097
exp9982	4.58623706e-29	0.000000	0.000000	discard	cycle 70 u=0.1000	agent0	initial_cond	0	-0.000000
exp9983	2.37386288e-17	0.070278	-0.000000	discard	Alternative optimum u=0.21 amp=0.40 p=1.3	manual	memory	0	0.000097
exp9984	4.58623706e-29	0.000000	0.000000	discard	cycle 70 u=0.1000	agent0	initial_cond	1	-0.000000
exp9985	2.46712505e-17	0.070278	-0.000000	discard	Alternative optimum u=0.21 amp=0.42 p=1.1	manual	memory	0	0.000097
exp9986	4.39794337e-29	0.000000	0.000000	discard	cycle 70 u=0.1000	agent0	initial_cond	0	-0.000000
exp9987	2.63307579e-17	0.070278	-0.000000	discard	Alternative optimum u=0.21 amp=0.42 p=1.15	manual	memory	0	0.000097
exp9987	4.39794337e-29	0.000000	0.000000	discard	cycle 70 u=0.1000	agent0	initial_cond	0	-0.000000
exp9988	4.39794337e-29	0.000000	0.000000	discard	cycle 70 u=0.1000	agent0	initial_cond	1	-0.000000
exp9989	1.08500284e-16	0.070278	-0.000000	discard	Alternative optimum u=0.21 amp=0.42 p=1.2	manual	memory	0	0.000097
exp9990	1.36727475e-28	0.000000	0.000000	discard	cycle 70 u=0.1050	agent0	initial_cond	0	-0.000000
exp9991	4.93782379e-17	0.070278	-0.000000	discard	Alternative optimum u=0.21 amp=0.42 p=1.25	manual	memory	0	0.000097
exp9992	1.36727475e-28	0.000000	0.000000	discard	cycle 70 u=0.1050	agent0	initial_cond	1	-0.000000
exp9993	4.45087221e-17	0.070278	-0.000000	discard	Alternative optimum u=0.21 amp=0.42 p=1.3	manual	memory	0	0.000097
exp9994	1.36727475e-28	0.000000	0.000000	discard	cycle 70 u=0.1050	agent0	initial_cond	0	-0.000000
exp9995	8.47445764e-17	0.070278	-0.000000	discard	Alternative optimum u=0.21 amp=0.44 p=1.1	manual	memory	0	0.000097
exp9995	6.14461376e-29	0.000000	0.000000	discard	cycle 70 u=0.1050	agent0	initial_cond	0	-0.000000
exp9996	6.14461376e-29	0.000000	0.000000	discard	cycle 70 u=0.1050	agent0	initial_cond	1	-0.000000
exp9996	7.00026089e-18	0.070278	-0.000000	discard	Alternative optimum u=0.21 amp=0.44 p=1.15	manual	memory	0	0.000097
exp9997	6.14461376e-29	0.000000	0.000000	discard	cycle 70 u=0.1050	agent0	initial_cond	0	-0.000000
exp9998	3.17755652e-17	0.070278	-0.000000	discard	Alternative optimum u=0.21 amp=0.44 p=1.2	manual	memory	0	0.000097
exp9999	1.75906666e-28	0.000000	0.000000	discard	cycle 70 u=0.1050	agent0	initial_cond	1	-0.000000
exp10000	3.71264646e-17	0.070278	-0.000000	discard	Alternative optimum u=0.21 amp=0.44 p=1.25	manual	memory	0	0.000097
exp10001	1.75906666e-28	0.000000	0.000000	discard	cycle 70 u=0.1050	agent0	initial_cond	0	-0.000000
exp10002	4.11620533e-17	0.070278	-0.000000	discard	Alternative optimum u=0.21 amp=0.44 p=1.3	manual	memory	0	0.000097
exp10002	1.75906666e-28	0.000000	0.000000	discard	cycle 70 u=0.1050	agent0	initial_cond	0	-0.000000
exp10003	1.11257917e-28	0.000000	0.000000	discard	cycle 70 u=0.1050	agent0	initial_cond	1	-0.000000
exp10003	9.11999937e-17	0.070278	-0.000000	discard	Alternative optimum u=0.21 amp=0.46 p=1.1	manual	memory	1	0.000097
exp10004	1.11257917e-28	0.000000	0.000000	discard	cycle 70 u=0.1050	agent0	initial_cond	0	-0.000000
exp10005	6.86365127e-17	0.070278	0.000000	discard	Alternative optimum u=0.21 amp=0.46 p=1.15	manual	memory	0	0.000097
exp10006	1.11257917e-28	0.000000	0.000000	discard	cycle 70 u=0.1050	agent0	initial_cond	1	-0.000000
exp10007	1.81018024e-17	0.070278	-0.000000	discard	Alternative optimum u=0.21 amp=0.46 p=1.2	manual	memory	1	0.000097
exp10008	8.58580947e-29	0.000000	0.000000	discard	cycle 71 u=0.0975	agent0	initial_cond	0	0.000000
exp10009	2.38707226e-17	0.070278	-0.000000	discard	Alternative optimum u=0.21 amp=0.46 p=1.25	manual	memory	0	0.000097
exp10009	8.58580947e-29	0.000000	0.000000	discard	cycle 71 u=0.0975	agent0	initial_cond	0	0.000000
