exp_id	residual	solution_norm	solution_mean	status	description	agent	design	elapsed_s	solution_energy
exp14661	1.75906666e-28	0.000000	0.000000	discard	cycle 113 u=0.1050	agent0	initial_cond	1	-0.000000
exp14661	2.10002123e-19	0.001438	-0.000000	discard	Round 8: fourier_modes=3 n_mode=1	agent1	solver_param	1	-0.000000
exp14662	1.75906666e-28	0.000000	0.000000	discard	cycle 113 u=0.1050	agent0	initial_cond	0	-0.000000
exp14662	2.10002123e-19	0.001438	-0.000000	discard	Round 8: fourier_modes=4 n_mode=1	agent1	solver_param	0	-0.000000
exp14663	1.11257917e-28	0.000000	0.000000	discard	cycle 113 u=0.1050	agent0	initial_cond	0	-0.000000
exp14663	2.10002123e-19	0.001438	-0.000000	discard	Round 8: fourier_modes=5 n_mode=1	agent1	solver_param	1	-0.000000
exp14664	1.11257917e-28	0.000000	0.000000	discard	cycle 113 u=0.1050	agent0	initial_cond	0	-0.000000
exp14664	2.10002123e-19	0.001438	-0.000000	discard	Round 8: fourier_modes=6 n_mode=1	agent1	solver_param	0	-0.000000
exp14665	1.11257917e-28	0.000000	0.000000	discard	cycle 113 u=0.1050	agent0	initial_cond	0	-0.000000
exp14665	2.10002123e-19	0.001438	-0.000000	discard	Round 8: fourier_modes=8 n_mode=1	agent1	solver_param	0	-0.000000
exp14666	8.58580947e-29	0.000000	0.000000	discard	cycle 114 u=0.0975	agent0	initial_cond	1	0.000000
exp14666	2.10002123e-19	0.001438	-0.000000	discard	Round 8: fourier_modes=10 n_mode=1	agent1	solver_param	0	-0.000000
exp14667	8.58580947e-29	0.000000	0.000000	discard	cycle 114 u=0.0975	agent0	initial_cond	0	0.000000
exp14667	1.79901697e-16	0.000000	0.000000	discard	Round 8: fourier_modes=6 n_mode=6	agent1	solver_param	0	0.000000
exp14668	8.58580947e-29	0.000000	0.000000	discard	cycle 114 u=0.0975	agent0	initial_cond	1	0.000000
exp14669	6.54179942e-19	0.001438	-0.000000	discard	Round 8: fourier_modes=6 n_mode=7	agent1	solver_param	1	-0.000000
exp14670	5.23962023e-29	0.000000	0.000000	discard	cycle 114 u=0.0975	agent0	initial_cond	0	0.000000
exp14671	1.79901697e-16	0.000000	0.000000	discard	Round 8: fourier_modes=8 n_mode=6	agent1	solver_param	0	0.000000
exp14672	5.23962023e-29	0.000000	0.000000	discard	cycle 114 u=0.0975	agent0	initial_cond	0	0.000000
exp14673	6.54179942e-19	0.001438	-0.000000	discard	Round 8: fourier_modes=8 n_mode=7	agent1	solver_param	0	-0.000000
exp14674	5.23962023e-29	0.000000	0.000000	discard	cycle 114 u=0.0975	agent0	initial_cond	0	0.000000
exp14675	1.79901697e-16	0.000000	0.000000	discard	Round 8: fourier_modes=10 n_mode=6	agent1	solver_param	0	0.000000
exp14676	4.03266298e-29	0.000000	0.000000	discard	cycle 114 u=0.0975	agent0	initial_cond	0	0.000000
exp14677	6.54179942e-19	0.001438	-0.000000	discard	Round 8: fourier_modes=10 n_mode=7	agent1	solver_param	0	-0.000000
exp14678	4.03266298e-29	0.000000	0.000000	discard	cycle 114 u=0.0975	agent0	initial_cond	1	0.000000
exp14679	1.79901697e-16	0.000000	0.000000	discard	Round 8: fourier_modes=12 n_mode=6	agent1	solver_param	1	0.000000
exp14680	4.03266298e-29	0.000000	0.000000	discard	cycle 114 u=0.0975	agent0	initial_cond	0	0.000000
exp14681	6.54179942e-19	0.001438	-0.000000	discard	Round 8: fourier_modes=12 n_mode=7	agent1	solver_param	0	-0.000000
exp14682	4.80015937e-29	0.000000	0.000000	discard	cycle 114 u=0.0975	agent0	initial_cond	0	0.000000
exp14683	4.80015937e-29	0.000000	0.000000	discard	cycle 114 u=0.0975	agent0	initial_cond	0	0.000000
exp14684	4.80015937e-29	0.000000	0.000000	discard	cycle 114 u=0.0975	agent0	initial_cond	0	0.000000
exp14685	2.68824537e-29	0.000000	0.000000	discard	cycle 114 u=0.0980	agent0	initial_cond	1	-0.000000
exp14686	2.68824537e-29	0.000000	0.000000	discard	cycle 114 u=0.0980	agent0	initial_cond	0	-0.000000
exp14687	2.68824537e-29	0.000000	0.000000	discard	cycle 114 u=0.0980	agent0	initial_cond	1	-0.000000
exp14688	6.16758073e-29	0.000000	0.000000	discard	cycle 114 u=0.0980	agent0	initial_cond	0	-0.000000
exp14689	6.16758073e-29	0.000000	0.000000	discard	cycle 114 u=0.0980	agent0	initial_cond	0	-0.000000
exp14690	6.16758073e-29	0.000000	0.000000	discard	cycle 114 u=0.0980	agent0	initial_cond	0	-0.000000
exp14691	2.01926478e-29	0.000000	0.000000	discard	cycle 114 u=0.0980	agent0	initial_cond	0	0.000000
exp14692	2.01926478e-29	0.000000	0.000000	discard	cycle 114 u=0.0980	agent0	initial_cond	1	0.000000
exp14693	2.01926478e-29	0.000000	0.000000	discard	cycle 114 u=0.0980	agent0	initial_cond	0	0.000000
exp14694	1.30310780e-28	0.000000	0.000000	discard	cycle 114 u=0.0980	agent0	initial_cond	0	-0.000000
exp14695	1.30310780e-28	0.000000	0.000000	discard	cycle 114 u=0.0980	agent0	initial_cond	0	-0.000000
exp14696	1.30310780e-28	0.000000	0.000000	discard	cycle 114 u=0.0980	agent0	initial_cond	0	-0.000000
exp14697	5.45343271e-29	0.000000	0.000000	discard	cycle 114 u=0.0982	agent0	initial_cond	1	-0.000000
exp14698	5.45343271e-29	0.000000	0.000000	discard	cycle 114 u=0.0982	agent0	initial_cond	0	-0.000000
exp14699	5.45343271e-29	0.000000	0.000000	discard	cycle 114 u=0.0982	agent0	initial_cond	1	-0.000000
exp14700	1.23429977e-28	0.000000	0.000000	discard	cycle 114 u=0.0982	agent0	initial_cond	0	0.000000
exp14701	1.44695671e-15	0.000024	-0.000000	discard	Round 8: Global K=0.0001	agent1	branch_search	0	-0.000000
exp14701	1.23429977e-28	0.000000	0.000000	discard	cycle 114 u=0.0982	agent0	initial_cond	0	0.000000
exp14702	1.23429977e-28	0.000000	0.000000	discard	cycle 114 u=0.0982	agent0	initial_cond	1	0.000000
exp14702	1.82727678e-15	0.000236	-0.000000	discard	Round 8: Global K=0.001	agent1	branch_search	1	-0.000000
exp14703	1.88036672e-29	0.000000	0.000000	discard	cycle 114 u=0.0982	agent0	initial_cond	0	0.000000
exp14703	6.12999068e-15	0.002357	-0.000000	discard	Round 8: Global K=0.01	agent1	branch_search	0	-0.000000
exp14704	1.88036672e-29	0.000000	0.000000	discard	cycle 114 u=0.0982	agent0	initial_cond	1	0.000000
exp14704	6.18472616e-18	0.011783	-0.000000	discard	Round 8: Global K=0.05	agent1	branch_search	1	-0.000002
exp14705	1.88036672e-29	0.000000	0.000000	discard	cycle 114 u=0.0982	agent0	initial_cond	0	0.000000
exp14705	1.40197541e-15	0.023554	-0.000000	discard	Round 8: Global K=0.1	agent1	branch_search	0	-0.000005
exp14706	1.91190259e-29	0.000000	-0.000000	discard	cycle 114 u=0.0982	agent0	initial_cond	0	0.000000
exp14706	3.14649469e-17	0.047011	-0.000000	discard	Round 8: Global K=0.2	agent1	branch_search	0	0.000003
exp14707	1.91190259e-29	0.000000	-0.000000	discard	cycle 114 u=0.0982	agent0	initial_cond	0	0.000000
exp14707	6.91159813e-18	0.070278	-0.000000	discard	Round 8: Global K=0.3	agent1	branch_search	0	0.000097
exp14708	1.91190259e-29	0.000000	-0.000000	discard	cycle 114 u=0.0982	agent0	initial_cond	0	0.000000
exp14708	3.10977055e-16	0.093272	0.000000	discard	Round 8: Global K=0.4	agent1	branch_search	0	0.000394
exp14709	6.13049994e-29	0.000000	0.000000	discard	cycle 114 u=0.0985	agent0	initial_cond	1	0.000000
exp14709	2.63855766e-17	0.115920	-0.000000	discard	Round 8: Global K=0.5	agent1	branch_search	1	0.001044
exp14710	6.13049994e-29	0.000000	0.000000	discard	cycle 114 u=0.0985	agent0	initial_cond	0	0.000000
exp14710	1.65966921e-15	0.138163	-0.000000	discard	Round 8: Global K=0.6	agent1	branch_search	0	0.002221
exp14711	1.01350765e-16	0.159956	0.000000	discard	Round 8: Global K=0.7	agent1	branch_search	1	0.004112
exp14711	6.13049994e-29	0.000000	0.000000	discard	cycle 114 u=0.0985	agent0	initial_cond	1	0.000000
exp14712	5.49750971e-29	0.000000	0.000000	discard	cycle 114 u=0.0985	agent0	initial_cond	0	0.000000
exp14712	5.47401746e-17	0.181265	-0.000000	discard	Round 8: Global K=0.8	agent1	branch_search	0	0.006910
exp14713	5.49750971e-29	0.000000	0.000000	discard	cycle 114 u=0.0985	agent0	initial_cond	0	0.000000
exp14713	4.83644093e-17	0.202072	-0.000000	discard	Round 8: Global K=0.9	agent1	branch_search	0	0.010801
exp14714	1.77784626e-16	0.222365	0.000000	discard	Round 8: Global K=1.0	agent1	branch_search	0	0.015962
exp14714	5.49750971e-29	0.000000	0.000000	discard	cycle 114 u=0.0985	agent0	initial_cond	0	0.000000
exp14715	4.15642452e-29	0.000000	0.000000	discard	cycle 114 u=0.0985	agent0	initial_cond	0	0.000000
exp14716	4.15642452e-29	0.000000	0.000000	discard	cycle 114 u=0.0985	agent0	initial_cond	1	0.000000
exp14717	4.15642452e-29	0.000000	0.000000	discard	cycle 114 u=0.0985	agent0	initial_cond	0	0.000000
exp14718	2.19292611e-29	0.000000	0.000000	discard	cycle 114 u=0.0985	agent0	initial_cond	1	-0.000000
exp14719	2.19292611e-29	0.000000	0.000000	discard	cycle 114 u=0.0985	agent0	initial_cond	0	-0.000000
exp14720	2.19292611e-29	0.000000	0.000000	discard	cycle 114 u=0.0985	agent0	initial_cond	0	-0.000000
exp14721	4.22491788e-29	0.000000	0.000000	discard	cycle 114 u=0.0990	agent0	initial_cond	0	-0.000000
exp14722	4.22491788e-29	0.000000	0.000000	discard	cycle 114 u=0.0990	agent0	initial_cond	0	-0.000000
exp14723	4.22491788e-29	0.000000	0.000000	discard	cycle 114 u=0.0990	agent0	initial_cond	1	-0.000000
exp14724	3.22245147e-29	0.000000	0.000000	discard	cycle 114 u=0.0990	agent0	initial_cond	0	0.000000
exp14725	3.22245147e-29	0.000000	0.000000	discard	cycle 114 u=0.0990	agent0	initial_cond	0	0.000000
exp14726	3.22245147e-29	0.000000	0.000000	discard	cycle 114 u=0.0990	agent0	initial_cond	0	0.000000
exp14727	4.50941488e-29	0.000000	-0.000000	discard	cycle 114 u=0.0990	agent0	initial_cond	0	0.000000
exp14728	4.50941488e-29	0.000000	-0.000000	discard	cycle 114 u=0.0990	agent0	initial_cond	1	0.000000
exp14729	4.50941488e-29	0.000000	-0.000000	discard	cycle 114 u=0.0990	agent0	initial_cond	0	0.000000
exp14730	4.88330883e-29	0.000000	-0.000000	discard	cycle 114 u=0.0990	agent0	initial_cond	1	0.000000
exp14731	4.88330883e-29	0.000000	-0.000000	discard	cycle 114 u=0.0990	agent0	initial_cond	0	0.000000
exp14732	4.88330883e-29	0.000000	-0.000000	discard	cycle 114 u=0.0990	agent0	initial_cond	0	0.000000
exp14733	5.74085541e-29	0.000000	-0.000000	discard	cycle 114 u=0.0995	agent0	initial_cond	1	0.000000
exp14734	5.74085541e-29	0.000000	-0.000000	discard	cycle 114 u=0.0995	agent0	initial_cond	0	0.000000
exp14735	5.74085541e-29	0.000000	-0.000000	discard	cycle 114 u=0.0995	agent0	initial_cond	1	0.000000
exp14736	1.54984578e-28	0.000000	0.000000	discard	cycle 114 u=0.0995	agent0	initial_cond	0	-0.000000
exp14737	1.54984578e-28	0.000000	0.000000	discard	cycle 114 u=0.0995	agent0	initial_cond	0	-0.000000
exp14738	1.54984578e-28	0.000000	0.000000	discard	cycle 114 u=0.0995	agent0	initial_cond	0	-0.000000
exp14739	1.60328418e-29	0.000000	-0.000000	discard	cycle 114 u=0.0995	agent0	initial_cond	0	-0.000000
exp14740	1.60328418e-29	0.000000	-0.000000	discard	cycle 114 u=0.0995	agent0	initial_cond	1	-0.000000
exp14741	1.60328418e-29	0.000000	-0.000000	discard	cycle 114 u=0.0995	agent0	initial_cond	0	-0.000000
exp14742	7.34590618e-29	0.000000	0.000000	discard	cycle 114 u=0.0995	agent0	initial_cond	0	0.000000
exp14743	7.34590618e-29	0.000000	0.000000	discard	cycle 114 u=0.0995	agent0	initial_cond	0	0.000000
exp14744	7.34590618e-29	0.000000	0.000000	discard	cycle 114 u=0.0995	agent0	initial_cond	0	0.000000
exp14745	4.46546993e-29	0.000000	0.000000	discard	cycle 114 u=0.1000	agent0	initial_cond	1	-0.000000
exp14746	4.46546993e-29	0.000000	0.000000	discard	cycle 114 u=0.1000	agent0	initial_cond	0	-0.000000
exp14747	4.46546993e-29	0.000000	0.000000	discard	cycle 114 u=0.1000	agent0	initial_cond	1	-0.000000
exp14748	4.08106752e-29	0.000000	0.000000	discard	cycle 114 u=0.1000	agent0	initial_cond	0	-0.000000
exp14749	4.08106752e-29	0.000000	0.000000	discard	cycle 114 u=0.1000	agent0	initial_cond	0	-0.000000
exp14750	4.08106752e-29	0.000000	0.000000	discard	cycle 114 u=0.1000	agent0	initial_cond	1	-0.000000
exp14751	4.58623706e-29	0.000000	0.000000	discard	cycle 114 u=0.1000	agent0	initial_cond	0	-0.000000
exp14752	4.58623706e-29	0.000000	0.000000	discard	cycle 114 u=0.1000	agent0	initial_cond	1	-0.000000
exp14753	4.58623706e-29	0.000000	0.000000	discard	cycle 114 u=0.1000	agent0	initial_cond	0	-0.000000
exp14754	1.82727678e-15	0.000236	-0.000000	discard	Round 8: Systematic K=0.001	agent1	branch_search	0	-0.000000
exp14755	4.39794337e-29	0.000000	0.000000	discard	cycle 114 u=0.1000	agent0	initial_cond	0	-0.000000
exp14756	3.37527863e-17	0.000471	-0.000000	discard	Round 8: Systematic K=0.002	agent1	branch_search	1	-0.000000
exp14757	4.39794337e-29	0.000000	0.000000	discard	cycle 114 u=0.1000	agent0	initial_cond	0	-0.000000
exp14758	1.14265570e-16	0.000707	-0.000000	discard	Round 8: Systematic K=0.003	agent1	branch_search	0	-0.000000
exp14759	4.39794337e-29	0.000000	0.000000	discard	cycle 114 u=0.1000	agent0	initial_cond	0	-0.000000
exp14760	4.71658759e-15	0.000943	-0.000000	discard	Round 8: Systematic K=0.004	agent1	branch_search	0	-0.000000
exp14761	1.36727475e-28	0.000000	0.000000	discard	cycle 114 u=0.1050	agent0	initial_cond	1	-0.000000
exp14762	2.46662739e-17	0.001179	-0.000000	discard	Round 8: Systematic K=0.005	agent1	branch_search	0	-0.000000
exp14763	1.36727475e-28	0.000000	0.000000	discard	cycle 114 u=0.1050	agent0	initial_cond	0	-0.000000
exp14764	2.37680703e-19	0.001414	-0.000000	discard	Round 8: Systematic K=0.006	agent1	branch_search	0	-0.000000
exp14765	1.36727475e-28	0.000000	0.000000	discard	cycle 114 u=0.1050	agent0	initial_cond	1	-0.000000
exp14766	5.46379294e-16	0.001650	-0.000000	discard	Round 8: Systematic K=0.007	agent1	branch_search	1	-0.000000
exp14767	6.14461376e-29	0.000000	0.000000	discard	cycle 114 u=0.1050	agent0	initial_cond	0	-0.000000
exp14768	1.16808904e-17	0.001886	-0.000000	discard	Round 8: Systematic K=0.008	agent1	branch_search	0	-0.000000
exp14769	6.14461376e-29	0.000000	0.000000	discard	cycle 114 u=0.1050	agent0	initial_cond	0	-0.000000
exp14770	1.07970327e-18	0.002121	0.000000	discard	Round 8: Systematic K=0.009	agent1	branch_search	0	-0.000000
exp14771	6.14461376e-29	0.000000	0.000000	discard	cycle 114 u=0.1050	agent0	initial_cond	1	-0.000000
exp14772	6.12999068e-15	0.002357	-0.000000	discard	Round 8: Systematic K=0.010	agent1	branch_search	0	-0.000000
exp14773	1.75906666e-28	0.000000	0.000000	discard	cycle 114 u=0.1050	agent0	initial_cond	0	-0.000000
exp14774	1.74886520e-18	0.003535	-0.000000	discard	Round 8: Systematic K=0.015	agent1	branch_search	0	-0.000000
exp14775	1.75906666e-28	0.000000	0.000000	discard	cycle 114 u=0.1050	agent0	initial_cond	1	-0.000000
exp14776	3.65164686e-18	0.004714	-0.000000	discard	Round 8: Systematic K=0.020	agent1	branch_search	1	-0.000000
exp14777	1.75906666e-28	0.000000	0.000000	discard	cycle 114 u=0.1050	agent0	initial_cond	0	-0.000000
exp14778	5.22709784e-15	0.005892	-0.000000	discard	Round 8: Systematic K=0.025	agent1	branch_search	0	-0.000000
exp14779	1.11257917e-28	0.000000	0.000000	discard	cycle 114 u=0.1050	agent0	initial_cond	0	-0.000000
exp14780	1.29653480e-17	0.007071	-0.000000	discard	Round 8: Systematic K=0.030	agent1	branch_search	1	-0.000001
exp14781	1.11257917e-28	0.000000	0.000000	discard	cycle 114 u=0.1050	agent0	initial_cond	0	-0.000000
exp14782	2.88403669e-15	0.009427	-0.000000	discard	Round 8: Systematic K=0.040	agent1	branch_search	0	-0.000001
exp14783	1.11257917e-28	0.000000	0.000000	discard	cycle 114 u=0.1050	agent0	initial_cond	0	-0.000000
exp14784	6.18472616e-18	0.011783	-0.000000	discard	Round 8: Systematic K=0.050	agent1	branch_search	0	-0.000002
exp14785	8.58580947e-29	0.000000	0.000000	discard	cycle 115 u=0.0975	agent0	initial_cond	1	0.000000
exp14786	5.96730526e-18	0.014139	-0.000000	discard	Round 8: Systematic K=0.060	agent1	branch_search	0	-0.000002
exp14787	8.58580947e-29	0.000000	0.000000	discard	cycle 115 u=0.0975	agent0	initial_cond	0	0.000000
exp14788	5.28063005e-17	0.016494	-0.000000	discard	Round 8: Systematic K=0.070	agent1	branch_search	0	-0.000003
exp14789	8.58580947e-29	0.000000	0.000000	discard	cycle 115 u=0.0975	agent0	initial_cond	1	0.000000
exp14790	1.61347764e-17	0.018848	-0.000000	discard	Round 8: Systematic K=0.080	agent1	branch_search	1	-0.000004
exp14791	5.23962023e-29	0.000000	0.000000	discard	cycle 115 u=0.0975	agent0	initial_cond	0	0.000000
exp14792	9.38346552e-18	0.021201	-0.000000	discard	Round 8: Systematic K=0.090	agent1	branch_search	0	-0.000005
exp14793	5.23962023e-29	0.000000	0.000000	discard	cycle 115 u=0.0975	agent0	initial_cond	0	0.000000
exp14794	1.40197541e-15	0.023554	-0.000000	discard	Round 8: Systematic K=0.100	agent1	branch_search	0	-0.000005
exp14795	5.23962023e-29	0.000000	0.000000	discard	cycle 115 u=0.0975	agent0	initial_cond	1	0.000000
exp14796	4.03266298e-29	0.000000	0.000000	discard	cycle 115 u=0.0975	agent0	initial_cond	0	0.000000
exp14797	4.03266298e-29	0.000000	0.000000	discard	cycle 115 u=0.0975	agent0	initial_cond	1	0.000000
exp14798	4.03266298e-29	0.000000	0.000000	discard	cycle 115 u=0.0975	agent0	initial_cond	0	0.000000
exp14799	4.80015937e-29	0.000000	0.000000	discard	cycle 115 u=0.0975	agent0	initial_cond	0	0.000000
exp14800	4.80015937e-29	0.000000	0.000000	discard	cycle 115 u=0.0975	agent0	initial_cond	0	0.000000
exp14801	4.80015937e-29	0.000000	0.000000	discard	cycle 115 u=0.0975	agent0	initial_cond	0	0.000000
exp14802	2.68824537e-29	0.000000	0.000000	discard	cycle 115 u=0.0980	agent0	initial_cond	1	-0.000000
exp14803	2.68824537e-29	0.000000	0.000000	discard	cycle 115 u=0.0980	agent0	initial_cond	0	-0.000000
exp14804	2.68824537e-29	0.000000	0.000000	discard	cycle 115 u=0.0980	agent0	initial_cond	1	-0.000000
exp14805	6.16758073e-29	0.000000	0.000000	discard	cycle 115 u=0.0980	agent0	initial_cond	0	-0.000000
exp14806	6.16758073e-29	0.000000	0.000000	discard	cycle 115 u=0.0980	agent0	initial_cond	0	-0.000000
exp14807	6.16758073e-29	0.000000	0.000000	discard	cycle 115 u=0.0980	agent0	initial_cond	1	-0.000000
exp14808	2.01926478e-29	0.000000	0.000000	discard	cycle 115 u=0.0980	agent0	initial_cond	0	0.000000
exp14808	2.37680703e-19	0.001414	-0.000000	discard	Round 8: Fine K=0.0060	agent1	branch_search	0	-0.000000
exp14809	2.01926478e-29	0.000000	0.000000	discard	cycle 115 u=0.0980	agent0	initial_cond	1	0.000000
exp14809	7.44070442e-19	0.001426	0.000000	discard	Round 8: Fine K=0.00605	agent1	branch_search	1	-0.000000
exp14810	2.01926478e-29	0.000000	0.000000	discard	cycle 115 u=0.0980	agent0	initial_cond	0	0.000000
exp14810	2.10002123e-19	0.001438	-0.000000	discard	Round 8: Fine K=0.0061	agent1	branch_search	0	-0.000000
exp14811	1.30310780e-28	0.000000	0.000000	discard	cycle 115 u=0.0980	agent0	initial_cond	0	-0.000000
exp14811	1.41914800e-18	0.001450	-0.000000	discard	Round 8: Fine K=0.00615	agent1	branch_search	0	-0.000000
exp14812	4.37882228e-19	0.001461	-0.000000	discard	Round 8: Fine K=0.0062	agent1	branch_search	0	-0.000000
exp14812	1.30310780e-28	0.000000	0.000000	discard	cycle 115 u=0.0980	agent0	initial_cond	0	-0.000000
exp14813	1.30310780e-28	0.000000	0.000000	discard	cycle 115 u=0.0980	agent0	initial_cond	0	-0.000000
exp14814	5.45343271e-29	0.000000	0.000000	discard	cycle 115 u=0.0982	agent0	initial_cond	1	-0.000000
exp14815	5.45343271e-29	0.000000	0.000000	discard	cycle 115 u=0.0982	agent0	initial_cond	0	-0.000000
exp14816	5.45343271e-29	0.000000	0.000000	discard	cycle 115 u=0.0982	agent0	initial_cond	1	-0.000000
exp14817	1.23429977e-28	0.000000	0.000000	discard	cycle 115 u=0.0982	agent0	initial_cond	0	0.000000
exp14818	1.23429977e-28	0.000000	0.000000	discard	cycle 115 u=0.0982	agent0	initial_cond	0	0.000000
exp14819	1.23429977e-28	0.000000	0.000000	discard	cycle 115 u=0.0982	agent0	initial_cond	0	0.000000
exp14820	1.88036672e-29	0.000000	0.000000	discard	cycle 115 u=0.0982	agent0	initial_cond	0	0.000000
exp14821	1.88036672e-29	0.000000	0.000000	discard	cycle 115 u=0.0982	agent0	initial_cond	1	0.000000
exp14822	1.88036672e-29	0.000000	0.000000	discard	cycle 115 u=0.0982	agent0	initial_cond	0	0.000000
exp14823	1.91190259e-29	0.000000	-0.000000	discard	cycle 115 u=0.0982	agent0	initial_cond	0	0.000000
exp14824	1.91190259e-29	0.000000	-0.000000	discard	cycle 115 u=0.0982	agent0	initial_cond	0	0.000000
exp14825	1.91190259e-29	0.000000	-0.000000	discard	cycle 115 u=0.0982	agent0	initial_cond	0	0.000000
exp14826	6.13049994e-29	0.000000	0.000000	discard	cycle 115 u=0.0985	agent0	initial_cond	1	0.000000
exp14827	6.13049994e-29	0.000000	0.000000	discard	cycle 115 u=0.0985	agent0	initial_cond	0	0.000000
exp14828	6.13049994e-29	0.000000	0.000000	discard	cycle 115 u=0.0985	agent0	initial_cond	1	0.000000
exp14829	5.49750971e-29	0.000000	0.000000	discard	cycle 115 u=0.0985	agent0	initial_cond	0	0.000000
exp14830	5.49750971e-29	0.000000	0.000000	discard	cycle 115 u=0.0985	agent0	initial_cond	0	0.000000
exp14831	5.49750971e-29	0.000000	0.000000	discard	cycle 115 u=0.0985	agent0	initial_cond	0	0.000000
exp14832	4.15642452e-29	0.000000	0.000000	discard	cycle 115 u=0.0985	agent0	initial_cond	0	0.000000
exp14833	4.15642452e-29	0.000000	0.000000	discard	cycle 115 u=0.0985	agent0	initial_cond	1	0.000000
exp14834	4.15642452e-29	0.000000	0.000000	discard	cycle 115 u=0.0985	agent0	initial_cond	0	0.000000
exp14835	2.19292611e-29	0.000000	0.000000	discard	cycle 115 u=0.0985	agent0	initial_cond	0	-0.000000
exp14836	2.19292611e-29	0.000000	0.000000	discard	cycle 115 u=0.0985	agent0	initial_cond	0	-0.000000
exp14837	2.19292611e-29	0.000000	0.000000	discard	cycle 115 u=0.0985	agent0	initial_cond	0	-0.000000
exp14838	4.22491788e-29	0.000000	0.000000	discard	cycle 115 u=0.0990	agent0	initial_cond	1	-0.000000
exp14839	4.22491788e-29	0.000000	0.000000	discard	cycle 115 u=0.0990	agent0	initial_cond	0	-0.000000
exp14840	4.22491788e-29	0.000000	0.000000	discard	cycle 115 u=0.0990	agent0	initial_cond	1	-0.000000
exp14841	3.22245147e-29	0.000000	0.000000	discard	cycle 115 u=0.0990	agent0	initial_cond	0	0.000000
exp14842	3.22245147e-29	0.000000	0.000000	discard	cycle 115 u=0.0990	agent0	initial_cond	0	0.000000
exp14843	3.22245147e-29	0.000000	0.000000	discard	cycle 115 u=0.0990	agent0	initial_cond	1	0.000000
exp14844	4.50941488e-29	0.000000	-0.000000	discard	cycle 115 u=0.0990	agent0	initial_cond	0	0.000000
exp14845	4.50941488e-29	0.000000	-0.000000	discard	cycle 115 u=0.0990	agent0	initial_cond	1	0.000000
exp14846	4.50941488e-29	0.000000	-0.000000	discard	cycle 115 u=0.0990	agent0	initial_cond	0	0.000000
