exp_id	residual	solution_norm	solution_mean	status	description	agent	design	elapsed_s	solution_energy
exp15755	6.13049994e-29	0.000000	0.000000	discard	cycle 124 u=0.0985	agent0	initial_cond	0	0.000000
exp15756	6.13049994e-29	0.000000	0.000000	discard	cycle 124 u=0.0985	agent0	initial_cond	1	0.000000
exp15757	6.13049994e-29	0.000000	0.000000	discard	cycle 124 u=0.0985	agent0	initial_cond	0	0.000000
exp15758	5.49750971e-29	0.000000	0.000000	discard	cycle 124 u=0.0985	agent0	initial_cond	0	0.000000
exp15759	5.49750971e-29	0.000000	0.000000	discard	cycle 124 u=0.0985	agent0	initial_cond	0	0.000000
exp15760	5.49750971e-29	0.000000	0.000000	discard	cycle 124 u=0.0985	agent0	initial_cond	0	0.000000
exp15761	4.15642452e-29	0.000000	0.000000	discard	cycle 124 u=0.0985	agent0	initial_cond	1	0.000000
exp15762	4.15642452e-29	0.000000	0.000000	discard	cycle 124 u=0.0985	agent0	initial_cond	0	0.000000
exp15763	4.15642452e-29	0.000000	0.000000	discard	cycle 124 u=0.0985	agent0	initial_cond	1	0.000000
exp15764	2.19292611e-29	0.000000	0.000000	discard	cycle 124 u=0.0985	agent0	initial_cond	0	-0.000000
exp15765	2.19292611e-29	0.000000	0.000000	discard	cycle 124 u=0.0985	agent0	initial_cond	0	-0.000000
exp15766	2.19292611e-29	0.000000	0.000000	discard	cycle 124 u=0.0985	agent0	initial_cond	0	-0.000000
exp15767	4.22491788e-29	0.000000	0.000000	discard	cycle 124 u=0.0990	agent0	initial_cond	0	-0.000000
exp15768	4.22491788e-29	0.000000	0.000000	discard	cycle 124 u=0.0990	agent0	initial_cond	1	-0.000000
exp15769	4.22491788e-29	0.000000	0.000000	discard	cycle 124 u=0.0990	agent0	initial_cond	0	-0.000000
exp15770	3.22245147e-29	0.000000	0.000000	discard	cycle 124 u=0.0990	agent0	initial_cond	0	0.000000
exp15771	3.22245147e-29	0.000000	0.000000	discard	cycle 124 u=0.0990	agent0	initial_cond	0	0.000000
exp15772	3.22245147e-29	0.000000	0.000000	discard	cycle 124 u=0.0990	agent0	initial_cond	0	0.000000
exp15773	4.50941488e-29	0.000000	-0.000000	discard	cycle 124 u=0.0990	agent0	initial_cond	1	0.000000
exp15774	4.50941488e-29	0.000000	-0.000000	discard	cycle 124 u=0.0990	agent0	initial_cond	0	0.000000
exp15775	4.50941488e-29	0.000000	-0.000000	discard	cycle 124 u=0.0990	agent0	initial_cond	1	0.000000
exp15776	4.88330883e-29	0.000000	-0.000000	discard	cycle 124 u=0.0990	agent0	initial_cond	0	0.000000
exp15777	4.88330883e-29	0.000000	-0.000000	discard	cycle 124 u=0.0990	agent0	initial_cond	0	0.000000
exp15778	4.88330883e-29	0.000000	-0.000000	discard	cycle 124 u=0.0990	agent0	initial_cond	0	0.000000
exp15779	5.74085541e-29	0.000000	-0.000000	discard	cycle 124 u=0.0995	agent0	initial_cond	0	0.000000
exp15780	5.74085541e-29	0.000000	-0.000000	discard	cycle 124 u=0.0995	agent0	initial_cond	1	0.000000
exp15781	5.74085541e-29	0.000000	-0.000000	discard	cycle 124 u=0.0995	agent0	initial_cond	0	0.000000
exp15782	1.54984578e-28	0.000000	0.000000	discard	cycle 124 u=0.0995	agent0	initial_cond	1	-0.000000
exp15783	1.54984578e-28	0.000000	0.000000	discard	cycle 124 u=0.0995	agent0	initial_cond	0	-0.000000
exp15784	1.54984578e-28	0.000000	0.000000	discard	cycle 124 u=0.0995	agent0	initial_cond	0	-0.000000
exp15785	1.60328418e-29	0.000000	-0.000000	discard	cycle 124 u=0.0995	agent0	initial_cond	1	-0.000000
exp15786	1.60328418e-29	0.000000	-0.000000	discard	cycle 124 u=0.0995	agent0	initial_cond	0	-0.000000
exp15787	1.60328418e-29	0.000000	-0.000000	discard	cycle 124 u=0.0995	agent0	initial_cond	1	-0.000000
exp15788	7.34590618e-29	0.000000	0.000000	discard	cycle 124 u=0.0995	agent0	initial_cond	0	0.000000
exp15789	7.34590618e-29	0.000000	0.000000	discard	cycle 124 u=0.0995	agent0	initial_cond	0	0.000000
exp15790	7.34590618e-29	0.000000	0.000000	discard	cycle 124 u=0.0995	agent0	initial_cond	0	0.000000
exp15791	4.46546993e-29	0.000000	0.000000	discard	cycle 124 u=0.1000	agent0	initial_cond	0	-0.000000
exp15792	4.46546993e-29	0.000000	0.000000	discard	cycle 124 u=0.1000	agent0	initial_cond	1	-0.000000
exp15793	4.46546993e-29	0.000000	0.000000	discard	cycle 124 u=0.1000	agent0	initial_cond	0	-0.000000
exp15794	4.08106752e-29	0.000000	0.000000	discard	cycle 124 u=0.1000	agent0	initial_cond	1	-0.000000
exp15795	4.08106752e-29	0.000000	0.000000	discard	cycle 124 u=0.1000	agent0	initial_cond	0	-0.000000
exp15796	4.08106752e-29	0.000000	0.000000	discard	cycle 124 u=0.1000	agent0	initial_cond	0	-0.000000
exp15797	4.58623706e-29	0.000000	0.000000	discard	cycle 124 u=0.1000	agent0	initial_cond	0	-0.000000
exp15798	4.58623706e-29	0.000000	0.000000	discard	cycle 124 u=0.1000	agent0	initial_cond	0	-0.000000
exp15799	4.58623706e-29	0.000000	0.000000	discard	cycle 124 u=0.1000	agent0	initial_cond	1	-0.000000
exp15800	4.39794337e-29	0.000000	0.000000	discard	cycle 124 u=0.1000	agent0	initial_cond	0	-0.000000
exp15801	4.39794337e-29	0.000000	0.000000	discard	cycle 124 u=0.1000	agent0	initial_cond	1	-0.000000
exp15802	4.39794337e-29	0.000000	0.000000	discard	cycle 124 u=0.1000	agent0	initial_cond	0	-0.000000
exp15803	1.36727475e-28	0.000000	0.000000	discard	cycle 124 u=0.1050	agent0	initial_cond	0	-0.000000
exp15804	1.36727475e-28	0.000000	0.000000	discard	cycle 124 u=0.1050	agent0	initial_cond	0	-0.000000
exp15805	1.36727475e-28	0.000000	0.000000	discard	cycle 124 u=0.1050	agent0	initial_cond	0	-0.000000
exp15806	6.14461376e-29	0.000000	0.000000	discard	cycle 124 u=0.1050	agent0	initial_cond	1	-0.000000
exp15807	6.14461376e-29	0.000000	0.000000	discard	cycle 124 u=0.1050	agent0	initial_cond	0	-0.000000
exp15808	6.14461376e-29	0.000000	0.000000	discard	cycle 124 u=0.1050	agent0	initial_cond	1	-0.000000
exp15809	1.75906666e-28	0.000000	0.000000	discard	cycle 124 u=0.1050	agent0	initial_cond	0	-0.000000
exp15810	1.75906666e-28	0.000000	0.000000	discard	cycle 124 u=0.1050	agent0	initial_cond	0	-0.000000
exp15811	1.75906666e-28	0.000000	0.000000	discard	cycle 124 u=0.1050	agent0	initial_cond	1	-0.000000
exp15812	1.11257917e-28	0.000000	0.000000	discard	cycle 124 u=0.1050	agent0	initial_cond	0	-0.000000
exp15813	1.11257917e-28	0.000000	0.000000	discard	cycle 124 u=0.1050	agent0	initial_cond	1	-0.000000
exp15814	1.11257917e-28	0.000000	0.000000	discard	cycle 124 u=0.1050	agent0	initial_cond	0	-0.000000
exp15815	8.58580947e-29	0.000000	0.000000	discard	cycle 125 u=0.0975	agent0	initial_cond	0	0.000000
exp15816	8.58580947e-29	0.000000	0.000000	discard	cycle 125 u=0.0975	agent0	initial_cond	0	0.000000
exp15817	8.58580947e-29	0.000000	0.000000	discard	cycle 125 u=0.0975	agent0	initial_cond	0	0.000000
exp15818	5.23962023e-29	0.000000	0.000000	discard	cycle 125 u=0.0975	agent0	initial_cond	1	0.000000
exp15819	5.23962023e-29	0.000000	0.000000	discard	cycle 125 u=0.0975	agent0	initial_cond	0	0.000000
exp15820	5.23962023e-29	0.000000	0.000000	discard	cycle 125 u=0.0975	agent0	initial_cond	1	0.000000
exp15821	4.03266298e-29	0.000000	0.000000	discard	cycle 125 u=0.0975	agent0	initial_cond	0	0.000000
exp15822	4.03266298e-29	0.000000	0.000000	discard	cycle 125 u=0.0975	agent0	initial_cond	0	0.000000
exp15823	4.03266298e-29	0.000000	0.000000	discard	cycle 125 u=0.0975	agent0	initial_cond	0	0.000000
exp15824	4.80015937e-29	0.000000	0.000000	discard	cycle 125 u=0.0975	agent0	initial_cond	0	0.000000
exp15825	4.80015937e-29	0.000000	0.000000	discard	cycle 125 u=0.0975	agent0	initial_cond	1	0.000000
exp15826	4.80015937e-29	0.000000	0.000000	discard	cycle 125 u=0.0975	agent0	initial_cond	0	0.000000
exp15827	2.68824537e-29	0.000000	0.000000	discard	cycle 125 u=0.0980	agent0	initial_cond	1	-0.000000
exp15828	2.68824537e-29	0.000000	0.000000	discard	cycle 125 u=0.0980	agent0	initial_cond	0	-0.000000
exp15829	2.68824537e-29	0.000000	0.000000	discard	cycle 125 u=0.0980	agent0	initial_cond	0	-0.000000
exp15830	6.16758073e-29	0.000000	0.000000	discard	cycle 125 u=0.0980	agent0	initial_cond	0	-0.000000
exp15831	6.16758073e-29	0.000000	0.000000	discard	cycle 125 u=0.0980	agent0	initial_cond	0	-0.000000
exp15832	6.16758073e-29	0.000000	0.000000	discard	cycle 125 u=0.0980	agent0	initial_cond	1	-0.000000
exp15833	2.01926478e-29	0.000000	0.000000	discard	cycle 125 u=0.0980	agent0	initial_cond	0	0.000000
exp15834	2.01926478e-29	0.000000	0.000000	discard	cycle 125 u=0.0980	agent0	initial_cond	0	0.000000
exp15835	2.01926478e-29	0.000000	0.000000	discard	cycle 125 u=0.0980	agent0	initial_cond	0	0.000000
exp15836	1.30310780e-28	0.000000	0.000000	discard	cycle 125 u=0.0980	agent0	initial_cond	0	-0.000000
exp15837	1.30310780e-28	0.000000	0.000000	discard	cycle 125 u=0.0980	agent0	initial_cond	1	-0.000000
exp15838	1.30310780e-28	0.000000	0.000000	discard	cycle 125 u=0.0980	agent0	initial_cond	0	-0.000000
exp15839	5.45343271e-29	0.000000	0.000000	discard	cycle 125 u=0.0982	agent0	initial_cond	1	-0.000000
exp15840	5.45343271e-29	0.000000	0.000000	discard	cycle 125 u=0.0982	agent0	initial_cond	0	-0.000000
exp15841	5.45343271e-29	0.000000	0.000000	discard	cycle 125 u=0.0982	agent0	initial_cond	0	-0.000000
exp15842	1.23429977e-28	0.000000	0.000000	discard	cycle 125 u=0.0982	agent0	initial_cond	0	0.000000
exp15843	1.23429977e-28	0.000000	0.000000	discard	cycle 125 u=0.0982	agent0	initial_cond	0	0.000000
exp15844	1.23429977e-28	0.000000	0.000000	discard	cycle 125 u=0.0982	agent0	initial_cond	1	0.000000
exp15845	1.88036672e-29	0.000000	0.000000	discard	cycle 125 u=0.0982	agent0	initial_cond	0	0.000000
exp15846	1.88036672e-29	0.000000	0.000000	discard	cycle 125 u=0.0982	agent0	initial_cond	1	0.000000
exp15847	1.88036672e-29	0.000000	0.000000	discard	cycle 125 u=0.0982	agent0	initial_cond	0	0.000000
exp15848	1.91190259e-29	0.000000	-0.000000	discard	cycle 125 u=0.0982	agent0	initial_cond	0	0.000000
exp15849	1.91190259e-29	0.000000	-0.000000	discard	cycle 125 u=0.0982	agent0	initial_cond	1	0.000000
exp15850	1.91190259e-29	0.000000	-0.000000	discard	cycle 125 u=0.0982	agent0	initial_cond	0	0.000000
exp15851	6.13049994e-29	0.000000	0.000000	discard	cycle 125 u=0.0985	agent0	initial_cond	1	0.000000
exp15852	6.13049994e-29	0.000000	0.000000	discard	cycle 125 u=0.0985	agent0	initial_cond	0	0.000000
exp15853	6.13049994e-29	0.000000	0.000000	discard	cycle 125 u=0.0985	agent0	initial_cond	0	0.000000
exp15854	5.49750971e-29	0.000000	0.000000	discard	cycle 125 u=0.0985	agent0	initial_cond	0	0.000000
exp15855	5.49750971e-29	0.000000	0.000000	discard	cycle 125 u=0.0985	agent0	initial_cond	0	0.000000
exp15856	5.49750971e-29	0.000000	0.000000	discard	cycle 125 u=0.0985	agent0	initial_cond	1	0.000000
r9_k0.0050_base	2.46662739e-17	0.0	0.0	keep	Phase1 K=0.0050 base	agent1	memory	0	0.0
exp15857	4.15642452e-29	0.000000	0.000000	discard	cycle 125 u=0.0985	agent0	initial_cond	0	0.000000
r9_k0.0052_base	7.44091628e-18	0.0	0.0	keep	Phase1 K=0.0052 base	agent1	memory	0	0.0
r9_k0.0054_base	2.18520129e-18	0.0	0.0	keep	Phase1 K=0.0054 base	agent1	memory	0	0.0
exp15858	4.15642452e-29	0.000000	0.000000	discard	cycle 125 u=0.0985	agent0	initial_cond	1	0.000000
r9_k0.0056_base	9.95840341e-19	0.0	0.0	keep	Phase1 K=0.0056 base	agent1	memory	0	0.0
exp15859	4.15642452e-29	0.000000	0.000000	discard	cycle 125 u=0.0985	agent0	initial_cond	0	0.000000
r9_k0.0058_base	8.91428825e-19	0.0	0.0	keep	Phase1 K=0.0058 base	agent1	memory	0	0.0
r9_k0.0060_base	2.37680703e-19	0.0	0.0	keep	Phase1 K=0.0060 base	agent1	memory	0	0.0
exp15860	2.19292611e-29	0.000000	0.000000	discard	cycle 125 u=0.0985	agent0	initial_cond	0	-0.000000
r9_k0.0061_base	2.10002123e-19	0.0	0.0	keep	Phase1 K=0.0061 base	agent1	memory	0	0.0
exp15861	2.19292611e-29	0.000000	0.000000	discard	cycle 125 u=0.0985	agent0	initial_cond	0	-0.000000
r9_k0.0062_base	4.37882228e-19	0.0	0.0	keep	Phase1 K=0.0062 base	agent1	memory	0	0.0
r9_k0.0063_base	6.13800807e-15	0.0	0.0	keep	Phase1 K=0.0063 base	agent1	memory	0	0.0
exp15862	2.19292611e-29	0.000000	0.000000	discard	cycle 125 u=0.0985	agent0	initial_cond	0	-0.000000
r9_k0.0064_base	4.40857337e-15	0.0	0.0	keep	Phase1 K=0.0064 base	agent1	memory	0	0.0
exp15863	4.22491788e-29	0.000000	0.000000	discard	cycle 125 u=0.0990	agent0	initial_cond	1	-0.000000
r9_k0.0066_base	2.24075825e-15	0.0	0.0	keep	Phase1 K=0.0066 base	agent1	memory	0	0.0
exp15864	4.22491788e-29	0.000000	0.000000	discard	cycle 125 u=0.0990	agent0	initial_cond	0	-0.000000
r9_k0.0068_base	1.11745586e-15	0.0	0.0	keep	Phase1 K=0.0068 base	agent1	memory	0	0.0
r9_k0.0070_base	5.46379294e-16	0.0	0.0	keep	Phase1 K=0.0070 base	agent1	memory	0	0.0
exp15865	4.22491788e-29	0.000000	0.000000	discard	cycle 125 u=0.0990	agent0	initial_cond	1	-0.000000
r9_k0.0072_base	2.62566270e-16	0.0	0.0	keep	Phase1 K=0.0072 base	agent1	memory	0	0.0
exp15866	3.22245147e-29	0.000000	0.000000	discard	cycle 125 u=0.0990	agent0	initial_cond	0	0.000000
r9_k0.0074_base	1.23586061e-16	0.0	0.0	keep	Phase1 K=0.0074 base	agent1	memory	0	0.0
exp15867	3.22245147e-29	0.000000	0.000000	discard	cycle 125 u=0.0990	agent0	initial_cond	0	0.000000
exp15868	3.22245147e-29	0.000000	0.000000	discard	cycle 125 u=0.0990	agent0	initial_cond	0	0.000000
exp15869	4.50941488e-29	0.000000	-0.000000	discard	cycle 125 u=0.0990	agent0	initial_cond	0	0.000000
exp15870	4.50941488e-29	0.000000	-0.000000	discard	cycle 125 u=0.0990	agent0	initial_cond	1	0.000000
exp15871	4.50941488e-29	0.000000	-0.000000	discard	cycle 125 u=0.0990	agent0	initial_cond	0	0.000000
exp15872	4.88330883e-29	0.000000	-0.000000	discard	cycle 125 u=0.0990	agent0	initial_cond	1	0.000000
exp15873	4.88330883e-29	0.000000	-0.000000	discard	cycle 125 u=0.0990	agent0	initial_cond	0	0.000000
exp15874	4.88330883e-29	0.000000	-0.000000	discard	cycle 125 u=0.0990	agent0	initial_cond	0	0.000000
exp15875	5.74085541e-29	0.000000	-0.000000	discard	cycle 125 u=0.0995	agent0	initial_cond	1	0.000000
exp15876	5.74085541e-29	0.000000	-0.000000	discard	cycle 125 u=0.0995	agent0	initial_cond	0	0.000000
exp15877	5.74085541e-29	0.000000	-0.000000	discard	cycle 125 u=0.0995	agent0	initial_cond	1	0.000000
exp15878	1.54984578e-28	0.000000	0.000000	discard	cycle 125 u=0.0995	agent0	initial_cond	0	-0.000000
exp15879	1.54984578e-28	0.000000	0.000000	discard	cycle 125 u=0.0995	agent0	initial_cond	0	-0.000000
exp15880	1.54984578e-28	0.000000	0.000000	discard	cycle 125 u=0.0995	agent0	initial_cond	0	-0.000000
exp15881	1.60328418e-29	0.000000	-0.000000	discard	cycle 125 u=0.0995	agent0	initial_cond	0	-0.000000
exp15882	1.60328418e-29	0.000000	-0.000000	discard	cycle 125 u=0.0995	agent0	initial_cond	1	-0.000000
exp15883	1.60328418e-29	0.000000	-0.000000	discard	cycle 125 u=0.0995	agent0	initial_cond	0	-0.000000
exp15884	7.34590618e-29	0.000000	0.000000	discard	cycle 125 u=0.0995	agent0	initial_cond	1	0.000000
exp15885	7.34590618e-29	0.000000	0.000000	discard	cycle 125 u=0.0995	agent0	initial_cond	0	0.000000
exp15886	7.34590618e-29	0.000000	0.000000	discard	cycle 125 u=0.0995	agent0	initial_cond	0	0.000000
exp15887	4.46546993e-29	0.000000	0.000000	discard	cycle 125 u=0.1000	agent0	initial_cond	0	-0.000000
exp15888	4.46546993e-29	0.000000	0.000000	discard	cycle 125 u=0.1000	agent0	initial_cond	0	-0.000000
exp15889	4.46546993e-29	0.000000	0.000000	discard	cycle 125 u=0.1000	agent0	initial_cond	1	-0.000000
r9_k0.006050_fine	7.44070442e-19	0.0	0.0	keep	Phase2 K=0.006050 fine	agent1	memory	0	0.0
exp15890	4.08106752e-29	0.000000	0.000000	discard	cycle 125 u=0.1000	agent0	initial_cond	0	-0.000000
r9_k0.006055_fine	4.67175979e-19	0.0	0.0	keep	Phase2 K=0.006055 fine	agent1	memory	0	0.0
exp15891	4.08106752e-29	0.000000	0.000000	discard	cycle 125 u=0.1000	agent0	initial_cond	1	-0.000000
r9_k0.006058_fine	4.74155429e-19	0.0	0.0	keep	Phase2 K=0.006058 fine	agent1	memory	0	0.0
r9_k0.006059_fine	6.98883308e-19	0.0	0.0	keep	Phase2 K=0.006059 fine	agent1	memory	0	0.0
exp15892	4.08106752e-29	0.000000	0.000000	discard	cycle 125 u=0.1000	agent0	initial_cond	0	-0.000000
r9_k0.006060_fine	2.39954457e-19	0.0	0.0	keep	Phase2 K=0.006060 fine	agent1	memory	0	0.0
exp15893	4.58623706e-29	0.000000	0.000000	discard	cycle 125 u=0.1000	agent0	initial_cond	0	-0.000000
r9_k0.006061_fine	8.25020419e-19	0.0	0.0	keep	Phase2 K=0.006061 fine	agent1	memory	0	0.0
r9_k0.006062_fine	5.37190850e-19	0.0	0.0	keep	Phase2 K=0.006062 fine	agent1	memory	0	0.0
exp15894	4.58623706e-29	0.000000	0.000000	discard	cycle 125 u=0.1000	agent0	initial_cond	0	-0.000000
r9_k0.006063_fine	1.17162864e-19	0.0	0.0	keep	Phase2 K=0.006063 fine	agent1	memory	0	0.0
exp15895	4.58623706e-29	0.000000	0.000000	discard	cycle 125 u=0.1000	agent0	initial_cond	0	-0.000000
r9_k0.006065_fine	1.01669378e-18	0.0	0.0	keep	Phase2 K=0.006065 fine	agent1	memory	0	0.0
r9_k0.006070_fine	5.06214063e-19	0.0	0.0	keep	Phase2 K=0.006070 fine	agent1	memory	0	0.0
exp15896	4.39794337e-29	0.000000	0.000000	discard	cycle 125 u=0.1000	agent0	initial_cond	1	-0.000000
exp15897	4.39794337e-29	0.000000	0.000000	discard	cycle 125 u=0.1000	agent0	initial_cond	0	-0.000000
exp15898	4.39794337e-29	0.000000	0.000000	discard	cycle 125 u=0.1000	agent0	initial_cond	0	-0.000000
exp15899	1.36727475e-28	0.000000	0.000000	discard	cycle 125 u=0.1050	agent0	initial_cond	0	-0.000000
exp15900	1.36727475e-28	0.000000	0.000000	discard	cycle 125 u=0.1050	agent0	initial_cond	0	-0.000000
exp15901	1.36727475e-28	0.000000	0.000000	discard	cycle 125 u=0.1050	agent0	initial_cond	1	-0.000000
exp15902	6.14461376e-29	0.000000	0.000000	discard	cycle 125 u=0.1050	agent0	initial_cond	0	-0.000000
exp15903	6.14461376e-29	0.000000	0.000000	discard	cycle 125 u=0.1050	agent0	initial_cond	1	-0.000000
exp15904	6.14461376e-29	0.000000	0.000000	discard	cycle 125 u=0.1050	agent0	initial_cond	0	-0.000000
exp15905	1.75906666e-28	0.000000	0.000000	discard	cycle 125 u=0.1050	agent0	initial_cond	0	-0.000000
exp15906	1.75906666e-28	0.000000	0.000000	discard	cycle 125 u=0.1050	agent0	initial_cond	0	-0.000000
exp15907	1.75906666e-28	0.000000	0.000000	discard	cycle 125 u=0.1050	agent0	initial_cond	0	-0.000000
exp15908	1.11257917e-28	0.000000	0.000000	discard	cycle 125 u=0.1050	agent0	initial_cond	1	-0.000000
exp15909	1.11257917e-28	0.000000	0.000000	discard	cycle 125 u=0.1050	agent0	initial_cond	0	-0.000000
r9_phase1.00	6.99088621e-15	0.0	0.0	keep	Phase3 phase=1.00	agent1	memory	0	0.0
r9_phase1.05	8.00803564e-15	0.0	0.0	keep	Phase3 phase=1.05	agent1	memory	0	0.0
exp15910	1.11257917e-28	0.000000	0.000000	discard	cycle 125 u=0.1050	agent0	initial_cond	1	-0.000000
r9_phase1.10	3.49889551e-19	0.0	0.0	keep	Phase3 phase=1.10	agent1	memory	0	0.0
exp15911	8.58580947e-29	0.000000	0.000000	discard	cycle 126 u=0.0975	agent0	initial_cond	0	0.000000
r9_phase1.15	1.23148421e-18	0.0	0.0	keep	Phase3 phase=1.15	agent1	memory	0	0.0
r9_phase1.20	4.96651625e-19	0.0	0.0	keep	Phase3 phase=1.20	agent1	memory	0	0.0
exp15912	8.58580947e-29	0.000000	0.000000	discard	cycle 126 u=0.0975	agent0	initial_cond	0	0.000000
r9_phase1.23	2.10002123e-19	0.0	0.0	keep	Phase3 phase=1.23	agent1	memory	0	0.0
exp15913	8.58580947e-29	0.000000	0.000000	discard	cycle 126 u=0.0975	agent0	initial_cond	0	0.000000
r9_phase1.25	7.17785745e-19	0.0	0.0	keep	Phase3 phase=1.25	agent1	memory	0	0.0
r9_phase1.30	7.22394145e-19	0.0	0.0	keep	Phase3 phase=1.30	agent1	memory	0	0.0
exp15914	5.23962023e-29	0.000000	0.000000	discard	cycle 126 u=0.0975	agent0	initial_cond	0	0.000000
r9_phase1.35	5.54287704e-19	0.0	0.0	keep	Phase3 phase=1.35	agent1	memory	0	0.0
exp15915	5.23962023e-29	0.000000	0.000000	discard	cycle 126 u=0.0975	agent0	initial_cond	1	0.000000
r9_phase1.40	3.30639101e-19	0.0	0.0	keep	Phase3 phase=1.40	agent1	memory	0	0.0
r9_phase1.45	2.05443879e-19	0.0	0.0	keep	Phase3 phase=1.45	agent1	memory	0	0.0
exp15916	5.23962023e-29	0.000000	0.000000	discard	cycle 126 u=0.0975	agent0	initial_cond	0	0.000000
r9_phase1.50	3.45624220e-19	0.0	0.0	keep	Phase3 phase=1.50	agent1	memory	0	0.0
exp15917	4.03266298e-29	0.000000	0.000000	discard	cycle 126 u=0.0975	agent0	initial_cond	1	0.000000
exp15918	4.03266298e-29	0.000000	0.000000	discard	cycle 126 u=0.0975	agent0	initial_cond	0	0.000000
exp15919	4.03266298e-29	0.000000	0.000000	discard	cycle 126 u=0.0975	agent0	initial_cond	0	0.000000
exp15920	4.80015937e-29	0.000000	0.000000	discard	cycle 126 u=0.0975	agent0	initial_cond	1	0.000000
exp15921	4.80015937e-29	0.000000	0.000000	discard	cycle 126 u=0.0975	agent0	initial_cond	0	0.000000
exp15922	4.80015937e-29	0.000000	0.000000	discard	cycle 126 u=0.0975	agent0	initial_cond	1	0.000000
exp15923	2.68824537e-29	0.000000	0.000000	discard	cycle 126 u=0.0980	agent0	initial_cond	0	-0.000000
exp15924	2.68824537e-29	0.000000	0.000000	discard	cycle 126 u=0.0980	agent0	initial_cond	0	-0.000000
exp15925	2.68824537e-29	0.000000	0.000000	discard	cycle 126 u=0.0980	agent0	initial_cond	0	-0.000000
exp15926	6.16758073e-29	0.000000	0.000000	discard	cycle 126 u=0.0980	agent0	initial_cond	0	-0.000000
exp15927	6.16758073e-29	0.000000	0.000000	discard	cycle 126 u=0.0980	agent0	initial_cond	1	-0.000000
exp15928	6.16758073e-29	0.000000	0.000000	discard	cycle 126 u=0.0980	agent0	initial_cond	0	-0.000000
r9_phase1.400_fine	3.30639101e-19	0.0	0.0	keep	Phase4 phase=1.400 fine	agent1	memory	0	0.0
exp15929	2.01926478e-29	0.000000	0.000000	discard	cycle 126 u=0.0980	agent0	initial_cond	1	0.000000
r9_phase1.410_fine	2.04934808e-19	0.0	0.0	keep	Phase4 phase=1.410 fine	agent1	memory	0	0.0
r9_phase1.420_fine	1.14542557e-18	0.0	0.0	keep	Phase4 phase=1.420 fine	agent1	memory	0	0.0
exp15930	2.01926478e-29	0.000000	0.000000	discard	cycle 126 u=0.0980	agent0	initial_cond	0	0.000000
r9_phase1.430_fine	3.24001881e-19	0.0	0.0	keep	Phase4 phase=1.430 fine	agent1	memory	0	0.0
exp15931	2.01926478e-29	0.000000	0.000000	discard	cycle 126 u=0.0980	agent0	initial_cond	0	0.000000
r9_phase1.440_fine	5.00864375e-19	0.0	0.0	keep	Phase4 phase=1.440 fine	agent1	memory	0	0.0
r9_phase1.445_fine	1.94352691e-19	0.0	0.0	keep	Phase4 phase=1.445 fine	agent1	memory	0	0.0
exp15932	1.30310780e-28	0.000000	0.000000	discard	cycle 126 u=0.0980	agent0	initial_cond	0	-0.000000
r9_phase1.450_fine	2.05443879e-19	0.0	0.0	keep	Phase4 phase=1.450 fine	agent1	memory	0	0.0
exp15933	1.30310780e-28	0.000000	0.000000	discard	cycle 126 u=0.0980	agent0	initial_cond	0	-0.000000
r9_phase1.455_fine	6.46678819e-19	0.0	0.0	keep	Phase4 phase=1.455 fine	agent1	memory	0	0.0
