exp_id	residual	solution_norm	solution_mean	status	description	agent	design	elapsed_s	solution_energy
exp13864	5.23962023e-29	0.000000	0.000000	discard	cycle 106 u=0.0975	agent0	initial_cond	0	0.000000
exp13865	4.03266298e-29	0.000000	0.000000	discard	cycle 106 u=0.0975	agent0	initial_cond	0	0.000000
exp13866	4.03266298e-29	0.000000	0.000000	discard	cycle 106 u=0.0975	agent0	initial_cond	0	0.000000
exp13867	4.03266298e-29	0.000000	0.000000	discard	cycle 106 u=0.0975	agent0	initial_cond	1	0.000000
exp13868	4.80015937e-29	0.000000	0.000000	discard	cycle 106 u=0.0975	agent0	initial_cond	0	0.000000
exp13869	4.80015937e-29	0.000000	0.000000	discard	cycle 106 u=0.0975	agent0	initial_cond	0	0.000000
exp13870	4.80015937e-29	0.000000	0.000000	discard	cycle 106 u=0.0975	agent0	initial_cond	0	0.000000
exp13871	2.68824537e-29	0.000000	0.000000	discard	cycle 106 u=0.0980	agent0	initial_cond	0	-0.000000
exp13872	2.68824537e-29	0.000000	0.000000	discard	cycle 106 u=0.0980	agent0	initial_cond	1	-0.000000
exp13873	2.68824537e-29	0.000000	0.000000	discard	cycle 106 u=0.0980	agent0	initial_cond	0	-0.000000
exp13874	6.16758073e-29	0.000000	0.000000	discard	cycle 106 u=0.0980	agent0	initial_cond	1	-0.000000
exp13875	6.16758073e-29	0.000000	0.000000	discard	cycle 106 u=0.0980	agent0	initial_cond	0	-0.000000
exp13876	6.16758073e-29	0.000000	0.000000	discard	cycle 106 u=0.0980	agent0	initial_cond	0	-0.000000
exp13877	2.01926478e-29	0.000000	0.000000	discard	cycle 106 u=0.0980	agent0	initial_cond	0	0.000000
exp13878	2.01926478e-29	0.000000	0.000000	discard	cycle 106 u=0.0980	agent0	initial_cond	0	0.000000
exp13879	2.01926478e-29	0.000000	0.000000	discard	cycle 106 u=0.0980	agent0	initial_cond	1	0.000000
exp13880	1.30310780e-28	0.000000	0.000000	discard	cycle 106 u=0.0980	agent0	initial_cond	0	-0.000000
exp13881	1.30310780e-28	0.000000	0.000000	discard	cycle 106 u=0.0980	agent0	initial_cond	0	-0.000000
exp13882	1.30310780e-28	0.000000	0.000000	discard	cycle 106 u=0.0980	agent0	initial_cond	0	-0.000000
exp13883	5.45343271e-29	0.000000	0.000000	discard	cycle 106 u=0.0982	agent0	initial_cond	0	-0.000000
exp13884	5.45343271e-29	0.000000	0.000000	discard	cycle 106 u=0.0982	agent0	initial_cond	1	-0.000000
exp13885	5.45343271e-29	0.000000	0.000000	discard	cycle 106 u=0.0982	agent0	initial_cond	0	-0.000000
exp13886	1.23429977e-28	0.000000	0.000000	discard	cycle 106 u=0.0982	agent0	initial_cond	0	0.000000
exp13887	1.23429977e-28	0.000000	0.000000	discard	cycle 106 u=0.0982	agent0	initial_cond	0	0.000000
exp13888	1.23429977e-28	0.000000	0.000000	discard	cycle 106 u=0.0982	agent0	initial_cond	0	0.000000
exp13889	1.88036672e-29	0.000000	0.000000	discard	cycle 106 u=0.0982	agent0	initial_cond	1	0.000000
exp13890	1.88036672e-29	0.000000	0.000000	discard	cycle 106 u=0.0982	agent0	initial_cond	0	0.000000
exp13891	1.88036672e-29	0.000000	0.000000	discard	cycle 106 u=0.0982	agent0	initial_cond	1	0.000000
exp13892	1.91190259e-29	0.000000	-0.000000	discard	cycle 106 u=0.0982	agent0	initial_cond	0	0.000000
exp13893	1.91190259e-29	0.000000	-0.000000	discard	cycle 106 u=0.0982	agent0	initial_cond	0	0.000000
exp13894	1.91190259e-29	0.000000	-0.000000	discard	cycle 106 u=0.0982	agent0	initial_cond	1	0.000000
exp13895	6.13049994e-29	0.000000	0.000000	discard	cycle 106 u=0.0985	agent0	initial_cond	0	0.000000
exp13896	6.13049994e-29	0.000000	0.000000	discard	cycle 106 u=0.0985	agent0	initial_cond	1	0.000000
exp13897	6.13049994e-29	0.000000	0.000000	discard	cycle 106 u=0.0985	agent0	initial_cond	0	0.000000
exp13898	5.49750971e-29	0.000000	0.000000	discard	cycle 106 u=0.0985	agent0	initial_cond	0	0.000000
exp13899	5.49750971e-29	0.000000	0.000000	discard	cycle 106 u=0.0985	agent0	initial_cond	0	0.000000
exp13900	5.49750971e-29	0.000000	0.000000	discard	cycle 106 u=0.0985	agent0	initial_cond	0	0.000000
exp13901	4.15642452e-29	0.000000	0.000000	discard	cycle 106 u=0.0985	agent0	initial_cond	1	0.000000
exp13902	4.15642452e-29	0.000000	0.000000	discard	cycle 106 u=0.0985	agent0	initial_cond	0	0.000000
exp13903	4.15642452e-29	0.000000	0.000000	discard	cycle 106 u=0.0985	agent0	initial_cond	0	0.000000
exp13904	2.19292611e-29	0.000000	0.000000	discard	cycle 106 u=0.0985	agent0	initial_cond	0	-0.000000
exp13905	2.19292611e-29	0.000000	0.000000	discard	cycle 106 u=0.0985	agent0	initial_cond	0	-0.000000
exp13906	2.19292611e-29	0.000000	0.000000	discard	cycle 106 u=0.0985	agent0	initial_cond	1	-0.000000
exp13907	4.22491788e-29	0.000000	0.000000	discard	cycle 106 u=0.0990	agent0	initial_cond	0	-0.000000
exp13908	4.22491788e-29	0.000000	0.000000	discard	cycle 106 u=0.0990	agent0	initial_cond	1	-0.000000
exp13909	4.22491788e-29	0.000000	0.000000	discard	cycle 106 u=0.0990	agent0	initial_cond	0	-0.000000
exp13910	3.22245147e-29	0.000000	0.000000	discard	cycle 106 u=0.0990	agent0	initial_cond	0	0.000000
exp13911	3.22245147e-29	0.000000	0.000000	discard	cycle 106 u=0.0990	agent0	initial_cond	1	0.000000
exp13912	3.22245147e-29	0.000000	0.000000	discard	cycle 106 u=0.0990	agent0	initial_cond	0	0.000000
exp13913	4.50941488e-29	0.000000	-0.000000	discard	cycle 106 u=0.0990	agent0	initial_cond	1	0.000000
exp13914	4.50941488e-29	0.000000	-0.000000	discard	cycle 106 u=0.0990	agent0	initial_cond	0	0.000000
exp13915	4.50941488e-29	0.000000	-0.000000	discard	cycle 106 u=0.0990	agent0	initial_cond	0	0.000000
exp13916	4.88330883e-29	0.000000	-0.000000	discard	cycle 106 u=0.0990	agent0	initial_cond	0	0.000000
exp13917	4.88330883e-29	0.000000	-0.000000	discard	cycle 106 u=0.0990	agent0	initial_cond	0	0.000000
exp13918	4.88330883e-29	0.000000	-0.000000	discard	cycle 106 u=0.0990	agent0	initial_cond	1	0.000000
exp13919	5.74085541e-29	0.000000	-0.000000	discard	cycle 106 u=0.0995	agent0	initial_cond	0	0.000000
exp13920	5.74085541e-29	0.000000	-0.000000	discard	cycle 106 u=0.0995	agent0	initial_cond	0	0.000000
exp13921	5.74085541e-29	0.000000	-0.000000	discard	cycle 106 u=0.0995	agent0	initial_cond	0	0.000000
exp13922	1.54984578e-28	0.000000	0.000000	discard	cycle 106 u=0.0995	agent0	initial_cond	0	-0.000000
exp13923	1.54984578e-28	0.000000	0.000000	discard	cycle 106 u=0.0995	agent0	initial_cond	1	-0.000000
exp13924	1.54984578e-28	0.000000	0.000000	discard	cycle 106 u=0.0995	agent0	initial_cond	0	-0.000000
exp13925	1.60328418e-29	0.000000	-0.000000	discard	cycle 106 u=0.0995	agent0	initial_cond	1	-0.000000
exp13926	1.60328418e-29	0.000000	-0.000000	discard	cycle 106 u=0.0995	agent0	initial_cond	0	-0.000000
exp13927	1.60328418e-29	0.000000	-0.000000	discard	cycle 106 u=0.0995	agent0	initial_cond	0	-0.000000
exp13928	7.34590618e-29	0.000000	0.000000	discard	cycle 106 u=0.0995	agent0	initial_cond	1	0.000000
exp13929	7.34590618e-29	0.000000	0.000000	discard	cycle 106 u=0.0995	agent0	initial_cond	0	0.000000
exp13930	7.34590618e-29	0.000000	0.000000	discard	cycle 106 u=0.0995	agent0	initial_cond	1	0.000000
exp13931	4.46546993e-29	0.000000	0.000000	discard	cycle 106 u=0.1000	agent0	initial_cond	0	-0.000000
exp13932	4.46546993e-29	0.000000	0.000000	discard	cycle 106 u=0.1000	agent0	initial_cond	0	-0.000000
exp13933	4.46546993e-29	0.000000	0.000000	discard	cycle 106 u=0.1000	agent0	initial_cond	0	-0.000000
exp13934	4.08106752e-29	0.000000	0.000000	discard	cycle 106 u=0.1000	agent0	initial_cond	0	-0.000000
exp13935	4.08106752e-29	0.000000	0.000000	discard	cycle 106 u=0.1000	agent0	initial_cond	1	-0.000000
exp13936	4.08106752e-29	0.000000	0.000000	discard	cycle 106 u=0.1000	agent0	initial_cond	0	-0.000000
exp13937	4.58623706e-29	0.000000	0.000000	discard	cycle 106 u=0.1000	agent0	initial_cond	0	-0.000000
exp13938	4.58623706e-29	0.000000	0.000000	discard	cycle 106 u=0.1000	agent0	initial_cond	0	-0.000000
exp13939	4.58623706e-29	0.000000	0.000000	discard	cycle 106 u=0.1000	agent0	initial_cond	0	-0.000000
exp13940	4.39794337e-29	0.000000	0.000000	discard	cycle 106 u=0.1000	agent0	initial_cond	1	-0.000000
exp13941	4.39794337e-29	0.000000	0.000000	discard	cycle 106 u=0.1000	agent0	initial_cond	0	-0.000000
exp13942	4.39794337e-29	0.000000	0.000000	discard	cycle 106 u=0.1000	agent0	initial_cond	0	-0.000000
exp13943	1.36727475e-28	0.000000	0.000000	discard	cycle 106 u=0.1050	agent0	initial_cond	0	-0.000000
exp13944	1.36727475e-28	0.000000	0.000000	discard	cycle 106 u=0.1050	agent0	initial_cond	0	-0.000000
exp13945	1.36727475e-28	0.000000	0.000000	discard	cycle 106 u=0.1050	agent0	initial_cond	1	-0.000000
exp13946	6.14461376e-29	0.000000	0.000000	discard	cycle 106 u=0.1050	agent0	initial_cond	0	-0.000000
exp13947	6.14461376e-29	0.000000	0.000000	discard	cycle 106 u=0.1050	agent0	initial_cond	1	-0.000000
exp13948	6.14461376e-29	0.000000	0.000000	discard	cycle 106 u=0.1050	agent0	initial_cond	0	-0.000000
exp13949	1.75906666e-28	0.000000	0.000000	discard	cycle 106 u=0.1050	agent0	initial_cond	0	-0.000000
exp13950	1.75906666e-28	0.000000	0.000000	discard	cycle 106 u=0.1050	agent0	initial_cond	0	-0.000000
exp13951	1.75906666e-28	0.000000	0.000000	discard	cycle 106 u=0.1050	agent0	initial_cond	0	-0.000000
exp13952	1.11257917e-28	0.000000	0.000000	discard	cycle 106 u=0.1050	agent0	initial_cond	1	-0.000000
exp13953	1.11257917e-28	0.000000	0.000000	discard	cycle 106 u=0.1050	agent0	initial_cond	0	-0.000000
exp13954	1.11257917e-28	0.000000	0.000000	discard	cycle 106 u=0.1050	agent0	initial_cond	0	-0.000000
exp13955	8.58580947e-29	0.000000	0.000000	discard	cycle 107 u=0.0975	agent0	initial_cond	0	0.000000
exp13956	8.58580947e-29	0.000000	0.000000	discard	cycle 107 u=0.0975	agent0	initial_cond	0	0.000000
exp13957	8.58580947e-29	0.000000	0.000000	discard	cycle 107 u=0.0975	agent0	initial_cond	1	0.000000
exp13958	5.23962023e-29	0.000000	0.000000	discard	cycle 107 u=0.0975	agent0	initial_cond	0	0.000000
exp13959	5.23962023e-29	0.000000	0.000000	discard	cycle 107 u=0.0975	agent0	initial_cond	1	0.000000
exp13960	5.23962023e-29	0.000000	0.000000	discard	cycle 107 u=0.0975	agent0	initial_cond	0	0.000000
exp13961	4.03266298e-29	0.000000	0.000000	discard	cycle 107 u=0.0975	agent0	initial_cond	0	0.000000
exp13962	4.03266298e-29	0.000000	0.000000	discard	cycle 107 u=0.0975	agent0	initial_cond	1	0.000000
exp13963	4.03266298e-29	0.000000	0.000000	discard	cycle 107 u=0.0975	agent0	initial_cond	0	0.000000
exp13964	4.80015937e-29	0.000000	0.000000	discard	cycle 107 u=0.0975	agent0	initial_cond	1	0.000000
exp13965	4.80015937e-29	0.000000	0.000000	discard	cycle 107 u=0.0975	agent0	initial_cond	0	0.000000
exp13966	4.80015937e-29	0.000000	0.000000	discard	cycle 107 u=0.0975	agent0	initial_cond	0	0.000000
exp13967	2.68824537e-29	0.000000	0.000000	discard	cycle 107 u=0.0980	agent0	initial_cond	0	-0.000000
exp13968	2.68824537e-29	0.000000	0.000000	discard	cycle 107 u=0.0980	agent0	initial_cond	0	-0.000000
exp13969	2.68824537e-29	0.000000	0.000000	discard	cycle 107 u=0.0980	agent0	initial_cond	1	-0.000000
exp13970	6.16758073e-29	0.000000	0.000000	discard	cycle 107 u=0.0980	agent0	initial_cond	0	-0.000000
exp13971	6.16758073e-29	0.000000	0.000000	discard	cycle 107 u=0.0980	agent0	initial_cond	0	-0.000000
exp13972	6.16758073e-29	0.000000	0.000000	discard	cycle 107 u=0.0980	agent0	initial_cond	0	-0.000000
exp13973	2.01926478e-29	0.000000	0.000000	discard	cycle 107 u=0.0980	agent0	initial_cond	0	0.000000
exp13974	2.01926478e-29	0.000000	0.000000	discard	cycle 107 u=0.0980	agent0	initial_cond	1	0.000000
exp13975	2.01926478e-29	0.000000	0.000000	discard	cycle 107 u=0.0980	agent0	initial_cond	0	0.000000
exp13976	1.30310780e-28	0.000000	0.000000	discard	cycle 107 u=0.0980	agent0	initial_cond	0	-0.000000
exp13977	1.30310780e-28	0.000000	0.000000	discard	cycle 107 u=0.0980	agent0	initial_cond	0	-0.000000
exp13978	1.30310780e-28	0.000000	0.000000	discard	cycle 107 u=0.0980	agent0	initial_cond	0	-0.000000
exp13979	5.45343271e-29	0.000000	0.000000	discard	cycle 107 u=0.0982	agent0	initial_cond	1	-0.000000
exp13980	5.45343271e-29	0.000000	0.000000	discard	cycle 107 u=0.0982	agent0	initial_cond	0	-0.000000
exp13981	5.45343271e-29	0.000000	0.000000	discard	cycle 107 u=0.0982	agent0	initial_cond	1	-0.000000
exp13982	1.23429977e-28	0.000000	0.000000	discard	cycle 107 u=0.0982	agent0	initial_cond	0	0.000000
exp13983	1.23429977e-28	0.000000	0.000000	discard	cycle 107 u=0.0982	agent0	initial_cond	0	0.000000
exp13984	1.23429977e-28	0.000000	0.000000	discard	cycle 107 u=0.0982	agent0	initial_cond	0	0.000000
exp13985	1.88036672e-29	0.000000	0.000000	discard	cycle 107 u=0.0982	agent0	initial_cond	0	0.000000
exp13986	1.88036672e-29	0.000000	0.000000	discard	cycle 107 u=0.0982	agent0	initial_cond	1	0.000000
exp13987	1.88036672e-29	0.000000	0.000000	discard	cycle 107 u=0.0982	agent0	initial_cond	0	0.000000
exp13988	1.91190259e-29	0.000000	-0.000000	discard	cycle 107 u=0.0982	agent0	initial_cond	0	0.000000
exp13989	1.91190259e-29	0.000000	-0.000000	discard	cycle 107 u=0.0982	agent0	initial_cond	0	0.000000
exp13990	1.91190259e-29	0.000000	-0.000000	discard	cycle 107 u=0.0982	agent0	initial_cond	0	0.000000
exp13991	6.13049994e-29	0.000000	0.000000	discard	cycle 107 u=0.0985	agent0	initial_cond	1	0.000000
exp13992	6.13049994e-29	0.000000	0.000000	discard	cycle 107 u=0.0985	agent0	initial_cond	0	0.000000
exp13993	6.13049994e-29	0.000000	0.000000	discard	cycle 107 u=0.0985	agent0	initial_cond	0	0.000000
exp13994	5.49750971e-29	0.000000	0.000000	discard	cycle 107 u=0.0985	agent0	initial_cond	0	0.000000
exp13995	5.49750971e-29	0.000000	0.000000	discard	cycle 107 u=0.0985	agent0	initial_cond	0	0.000000
exp13996	5.49750971e-29	0.000000	0.000000	discard	cycle 107 u=0.0985	agent0	initial_cond	1	0.000000
exp13997	4.15642452e-29	0.000000	0.000000	discard	cycle 107 u=0.0985	agent0	initial_cond	0	0.000000
exp13998	4.15642452e-29	0.000000	0.000000	discard	cycle 107 u=0.0985	agent0	initial_cond	1	0.000000
exp13999	4.15642452e-29	0.000000	0.000000	discard	cycle 107 u=0.0985	agent0	initial_cond	0	0.000000
exp14000	2.19292611e-29	0.000000	0.000000	discard	cycle 107 u=0.0985	agent0	initial_cond	0	-0.000000
exp14001	2.19292611e-29	0.000000	0.000000	discard	cycle 107 u=0.0985	agent0	initial_cond	0	-0.000000
exp14002	2.19292611e-29	0.000000	0.000000	discard	cycle 107 u=0.0985	agent0	initial_cond	0	-0.000000
exp14003	4.22491788e-29	0.000000	0.000000	discard	cycle 107 u=0.0990	agent0	initial_cond	1	-0.000000
exp14004	4.22491788e-29	0.000000	0.000000	discard	cycle 107 u=0.0990	agent0	initial_cond	0	-0.000000
exp14005	4.22491788e-29	0.000000	0.000000	discard	cycle 107 u=0.0990	agent0	initial_cond	0	-0.000000
exp14006	3.22245147e-29	0.000000	0.000000	discard	cycle 107 u=0.0990	agent0	initial_cond	0	0.000000
exp14007	3.22245147e-29	0.000000	0.000000	discard	cycle 107 u=0.0990	agent0	initial_cond	0	0.000000
exp14008	3.22245147e-29	0.000000	0.000000	discard	cycle 107 u=0.0990	agent0	initial_cond	1	0.000000
exp14009	4.50941488e-29	0.000000	-0.000000	discard	cycle 107 u=0.0990	agent0	initial_cond	0	0.000000
exp14010	4.50941488e-29	0.000000	-0.000000	discard	cycle 107 u=0.0990	agent0	initial_cond	1	0.000000
exp14011	4.50941488e-29	0.000000	-0.000000	discard	cycle 107 u=0.0990	agent0	initial_cond	0	0.000000
exp14012	4.88330883e-29	0.000000	-0.000000	discard	cycle 107 u=0.0990	agent0	initial_cond	0	0.000000
exp14013	4.88330883e-29	0.000000	-0.000000	discard	cycle 107 u=0.0990	agent0	initial_cond	1	0.000000
exp14014	4.88330883e-29	0.000000	-0.000000	discard	cycle 107 u=0.0990	agent0	initial_cond	0	0.000000
exp14015	5.74085541e-29	0.000000	-0.000000	discard	cycle 107 u=0.0995	agent0	initial_cond	1	0.000000
exp14016	5.74085541e-29	0.000000	-0.000000	discard	cycle 107 u=0.0995	agent0	initial_cond	0	0.000000
exp14017	5.74085541e-29	0.000000	-0.000000	discard	cycle 107 u=0.0995	agent0	initial_cond	0	0.000000
exp14018	1.54984578e-28	0.000000	0.000000	discard	cycle 107 u=0.0995	agent0	initial_cond	0	-0.000000
exp14019	1.54984578e-28	0.000000	0.000000	discard	cycle 107 u=0.0995	agent0	initial_cond	0	-0.000000
exp14020	1.54984578e-28	0.000000	0.000000	discard	cycle 107 u=0.0995	agent0	initial_cond	1	-0.000000
exp14021	1.60328418e-29	0.000000	-0.000000	discard	cycle 107 u=0.0995	agent0	initial_cond	0	-0.000000
exp14022	1.60328418e-29	0.000000	-0.000000	discard	cycle 107 u=0.0995	agent0	initial_cond	0	-0.000000
exp14023	1.60328418e-29	0.000000	-0.000000	discard	cycle 107 u=0.0995	agent0	initial_cond	0	-0.000000
exp14024	7.34590618e-29	0.000000	0.000000	discard	cycle 107 u=0.0995	agent0	initial_cond	0	0.000000
exp14025	7.34590618e-29	0.000000	0.000000	discard	cycle 107 u=0.0995	agent0	initial_cond	1	0.000000
exp14026	7.34590618e-29	0.000000	0.000000	discard	cycle 107 u=0.0995	agent0	initial_cond	0	0.000000
exp14027	4.46546993e-29	0.000000	0.000000	discard	cycle 107 u=0.1000	agent0	initial_cond	1	-0.000000
exp14028	4.46546993e-29	0.000000	0.000000	discard	cycle 107 u=0.1000	agent0	initial_cond	0	-0.000000
exp14029	4.46546993e-29	0.000000	0.000000	discard	cycle 107 u=0.1000	agent0	initial_cond	0	-0.000000
exp14030	4.08106752e-29	0.000000	0.000000	discard	cycle 107 u=0.1000	agent0	initial_cond	0	-0.000000
exp14031	4.08106752e-29	0.000000	0.000000	discard	cycle 107 u=0.1000	agent0	initial_cond	0	-0.000000
exp14032	4.08106752e-29	0.000000	0.000000	discard	cycle 107 u=0.1000	agent0	initial_cond	1	-0.000000
exp14033	4.58623706e-29	0.000000	0.000000	discard	cycle 107 u=0.1000	agent0	initial_cond	0	-0.000000
exp14034	4.58623706e-29	0.000000	0.000000	discard	cycle 107 u=0.1000	agent0	initial_cond	0	-0.000000
exp14035	4.58623706e-29	0.000000	0.000000	discard	cycle 107 u=0.1000	agent0	initial_cond	0	-0.000000
exp14036	4.39794337e-29	0.000000	0.000000	discard	cycle 107 u=0.1000	agent0	initial_cond	0	-0.000000
exp14037	4.39794337e-29	0.000000	0.000000	discard	cycle 107 u=0.1000	agent0	initial_cond	1	-0.000000
exp14038	4.39794337e-29	0.000000	0.000000	discard	cycle 107 u=0.1000	agent0	initial_cond	0	-0.000000
exp14039	1.36727475e-28	0.000000	0.000000	discard	cycle 107 u=0.1050	agent0	initial_cond	1	-0.000000
exp14040	1.36727475e-28	0.000000	0.000000	discard	cycle 107 u=0.1050	agent0	initial_cond	0	-0.000000
exp14041	1.36727475e-28	0.000000	0.000000	discard	cycle 107 u=0.1050	agent0	initial_cond	0	-0.000000
exp14042	6.14461376e-29	0.000000	0.000000	discard	cycle 107 u=0.1050	agent0	initial_cond	1	-0.000000
exp14043	6.14461376e-29	0.000000	0.000000	discard	cycle 107 u=0.1050	agent0	initial_cond	0	-0.000000
exp14044	6.14461376e-29	0.000000	0.000000	discard	cycle 107 u=0.1050	agent0	initial_cond	1	-0.000000
exp14045	1.75906666e-28	0.000000	0.000000	discard	cycle 107 u=0.1050	agent0	initial_cond	0	-0.000000
exp14046	1.75906666e-28	0.000000	0.000000	discard	cycle 107 u=0.1050	agent0	initial_cond	0	-0.000000
exp14047	1.75906666e-28	0.000000	0.000000	discard	cycle 107 u=0.1050	agent0	initial_cond	0	-0.000000
exp14048	1.11257917e-28	0.000000	0.000000	discard	cycle 107 u=0.1050	agent0	initial_cond	0	-0.000000
exp14049	1.11257917e-28	0.000000	0.000000	discard	cycle 107 u=0.1050	agent0	initial_cond	1	-0.000000
exp14050	1.11257917e-28	0.000000	0.000000	discard	cycle 107 u=0.1050	agent0	initial_cond	0	-0.000000
exp14051	8.58580947e-29	0.000000	0.000000	discard	cycle 108 u=0.0975	agent0	initial_cond	0	0.000000
exp14052	8.58580947e-29	0.000000	0.000000	discard	cycle 108 u=0.0975	agent0	initial_cond	0	0.000000
exp14053	8.58580947e-29	0.000000	0.000000	discard	cycle 108 u=0.0975	agent0	initial_cond	0	0.000000
exp14054	5.23962023e-29	0.000000	0.000000	discard	cycle 108 u=0.0975	agent0	initial_cond	1	0.000000
exp14055	5.23962023e-29	0.000000	0.000000	discard	cycle 108 u=0.0975	agent0	initial_cond	0	0.000000
exp14056	5.23962023e-29	0.000000	0.000000	discard	cycle 108 u=0.0975	agent0	initial_cond	1	0.000000
exp14057	4.03266298e-29	0.000000	0.000000	discard	cycle 108 u=0.0975	agent0	initial_cond	0	0.000000
exp14058	4.03266298e-29	0.000000	0.000000	discard	cycle 108 u=0.0975	agent0	initial_cond	0	0.000000
exp14059	4.03266298e-29	0.000000	0.000000	discard	cycle 108 u=0.0975	agent0	initial_cond	1	0.000000
exp14060	4.80015937e-29	0.000000	0.000000	discard	cycle 108 u=0.0975	agent0	initial_cond	0	0.000000
exp14061	4.80015937e-29	0.000000	0.000000	discard	cycle 108 u=0.0975	agent0	initial_cond	1	0.000000
exp14062	4.80015937e-29	0.000000	0.000000	discard	cycle 108 u=0.0975	agent0	initial_cond	0	0.000000
exp14063	2.68824537e-29	0.000000	0.000000	discard	cycle 108 u=0.0980	agent0	initial_cond	0	-0.000000
exp14064	2.68824537e-29	0.000000	0.000000	discard	cycle 108 u=0.0980	agent0	initial_cond	0	-0.000000
exp14065	2.68824537e-29	0.000000	0.000000	discard	cycle 108 u=0.0980	agent0	initial_cond	0	-0.000000
exp14066	6.16758073e-29	0.000000	0.000000	discard	cycle 108 u=0.0980	agent0	initial_cond	1	-0.000000
exp14067	6.16758073e-29	0.000000	0.000000	discard	cycle 108 u=0.0980	agent0	initial_cond	0	-0.000000
exp14068	6.16758073e-29	0.000000	0.000000	discard	cycle 108 u=0.0980	agent0	initial_cond	1	-0.000000
exp14069	2.01926478e-29	0.000000	0.000000	discard	cycle 108 u=0.0980	agent0	initial_cond	0	0.000000
exp14070	2.01926478e-29	0.000000	0.000000	discard	cycle 108 u=0.0980	agent0	initial_cond	0	0.000000
exp14071	2.01926478e-29	0.000000	0.000000	discard	cycle 108 u=0.0980	agent0	initial_cond	1	0.000000
exp14072	1.30310780e-28	0.000000	0.000000	discard	cycle 108 u=0.0980	agent0	initial_cond	0	-0.000000
exp14073	1.30310780e-28	0.000000	0.000000	discard	cycle 108 u=0.0980	agent0	initial_cond	1	-0.000000
exp14074	1.30310780e-28	0.000000	0.000000	discard	cycle 108 u=0.0980	agent0	initial_cond	0	-0.000000
exp14075	5.45343271e-29	0.000000	0.000000	discard	cycle 108 u=0.0982	agent0	initial_cond	0	-0.000000
exp14076	5.45343271e-29	0.000000	0.000000	discard	cycle 108 u=0.0982	agent0	initial_cond	0	-0.000000
exp14077	5.45343271e-29	0.000000	0.000000	discard	cycle 108 u=0.0982	agent0	initial_cond	0	-0.000000
exp14078	1.23429977e-28	0.000000	0.000000	discard	cycle 108 u=0.0982	agent0	initial_cond	1	0.000000
exp14079	1.23429977e-28	0.000000	0.000000	discard	cycle 108 u=0.0982	agent0	initial_cond	0	0.000000
exp14080	1.23429977e-28	0.000000	0.000000	discard	cycle 108 u=0.0982	agent0	initial_cond	0	0.000000
