exp_id	residual	solution_norm	solution_mean	status	description	agent	design	elapsed_s	solution_energy
exp12242	4.22491788e-29	0.000000	0.000000	discard	cycle 91 u=0.0990	agent0	initial_cond	0	-0.000000
exp12243	4.22491788e-29	0.000000	0.000000	discard	cycle 91 u=0.0990	agent0	initial_cond	0	-0.000000
exp12244	4.22491788e-29	0.000000	0.000000	discard	cycle 91 u=0.0990	agent0	initial_cond	0	-0.000000
exp12245	3.22245147e-29	0.000000	0.000000	discard	cycle 91 u=0.0990	agent0	initial_cond	0	0.000000
exp12246	3.22245147e-29	0.000000	0.000000	discard	cycle 91 u=0.0990	agent0	initial_cond	1	0.000000
exp12247	3.22245147e-29	0.000000	0.000000	discard	cycle 91 u=0.0990	agent0	initial_cond	0	0.000000
exp12248	4.50941488e-29	0.000000	-0.000000	discard	cycle 91 u=0.0990	agent0	initial_cond	1	0.000000
exp12249	4.50941488e-29	0.000000	-0.000000	discard	cycle 91 u=0.0990	agent0	initial_cond	0	0.000000
exp12250	4.50941488e-29	0.000000	-0.000000	discard	cycle 91 u=0.0990	agent0	initial_cond	0	0.000000
exp12251	4.88330883e-29	0.000000	-0.000000	discard	cycle 91 u=0.0990	agent0	initial_cond	1	0.000000
exp12252	4.88330883e-29	0.000000	-0.000000	discard	cycle 91 u=0.0990	agent0	initial_cond	0	0.000000
exp12253	4.88330883e-29	0.000000	-0.000000	discard	cycle 91 u=0.0990	agent0	initial_cond	1	0.000000
exp12254	5.74085541e-29	0.000000	-0.000000	discard	cycle 91 u=0.0995	agent0	initial_cond	0	0.000000
exp12255	5.74085541e-29	0.000000	-0.000000	discard	cycle 91 u=0.0995	agent0	initial_cond	0	0.000000
exp12256	5.74085541e-29	0.000000	-0.000000	discard	cycle 91 u=0.0995	agent0	initial_cond	1	0.000000
exp12257	1.54984578e-28	0.000000	0.000000	discard	cycle 91 u=0.0995	agent0	initial_cond	0	-0.000000
exp12258	1.54984578e-28	0.000000	0.000000	discard	cycle 91 u=0.0995	agent0	initial_cond	1	-0.000000
exp12259	1.54984578e-28	0.000000	0.000000	discard	cycle 91 u=0.0995	agent0	initial_cond	0	-0.000000
exp12260	1.60328418e-29	0.000000	-0.000000	discard	cycle 91 u=0.0995	agent0	initial_cond	0	-0.000000
exp12261	1.60328418e-29	0.000000	-0.000000	discard	cycle 91 u=0.0995	agent0	initial_cond	1	-0.000000
exp12262	1.60328418e-29	0.000000	-0.000000	discard	cycle 91 u=0.0995	agent0	initial_cond	0	-0.000000
exp12263	7.34590618e-29	0.000000	0.000000	discard	cycle 91 u=0.0995	agent0	initial_cond	1	0.000000
exp12264	7.34590618e-29	0.000000	0.000000	discard	cycle 91 u=0.0995	agent0	initial_cond	0	0.000000
exp12265	7.34590618e-29	0.000000	0.000000	discard	cycle 91 u=0.0995	agent0	initial_cond	0	0.000000
exp12266	4.46546993e-29	0.000000	0.000000	discard	cycle 91 u=0.1000	agent0	initial_cond	1	-0.000000
exp12267	4.46546993e-29	0.000000	0.000000	discard	cycle 91 u=0.1000	agent0	initial_cond	0	-0.000000
exp12268	4.46546993e-29	0.000000	0.000000	discard	cycle 91 u=0.1000	agent0	initial_cond	1	-0.000000
exp12269	4.08106752e-29	0.000000	0.000000	discard	cycle 91 u=0.1000	agent0	initial_cond	0	-0.000000
exp12270	4.08106752e-29	0.000000	0.000000	discard	cycle 91 u=0.1000	agent0	initial_cond	0	-0.000000
exp12271	4.08106752e-29	0.000000	0.000000	discard	cycle 91 u=0.1000	agent0	initial_cond	0	-0.000000
exp12272	4.58623706e-29	0.000000	0.000000	discard	cycle 91 u=0.1000	agent0	initial_cond	0	-0.000000
exp12273	4.58623706e-29	0.000000	0.000000	discard	cycle 91 u=0.1000	agent0	initial_cond	1	-0.000000
exp12274	6.18472616e-18	0.011783	-0.000000	discard	Round 8: K_amplitude=0.030 fine sweep	manual	branch_search	0	-0.000002
exp12275	4.58623706e-29	0.000000	0.000000	discard	cycle 91 u=0.1000	agent0	initial_cond	0	-0.000000
exp12276	6.18472616e-18	0.011783	-0.000000	discard	Round 8: K_amplitude=0.032 fine sweep	manual	branch_search	0	-0.000002
exp12277	4.39794337e-29	0.000000	0.000000	discard	cycle 91 u=0.1000	agent0	initial_cond	0	-0.000000
exp12278	6.18472616e-18	0.011783	-0.000000	discard	Round 8: K_amplitude=0.034 fine sweep	manual	branch_search	1	-0.000002
exp12279	4.39794337e-29	0.000000	0.000000	discard	cycle 91 u=0.1000	agent0	initial_cond	0	-0.000000
exp12280	6.18472616e-18	0.011783	-0.000000	discard	Round 8: K_amplitude=0.036 fine sweep	manual	branch_search	0	-0.000002
exp12281	4.39794337e-29	0.000000	0.000000	discard	cycle 91 u=0.1000	agent0	initial_cond	0	-0.000000
exp12282	6.18472616e-18	0.011783	-0.000000	discard	Round 8: K_amplitude=0.038 fine sweep	manual	branch_search	1	-0.000002
exp12283	1.36727475e-28	0.000000	0.000000	discard	cycle 91 u=0.1050	agent0	initial_cond	1	-0.000000
exp12284	6.18472616e-18	0.011783	-0.000000	discard	Round 8: K_amplitude=0.040 fine sweep	manual	branch_search	0	-0.000002
exp12285	1.36727475e-28	0.000000	0.000000	discard	cycle 91 u=0.1050	agent0	initial_cond	0	-0.000000
exp12286	6.18472616e-18	0.011783	-0.000000	discard	Round 8: K_amplitude=0.042 fine sweep	manual	branch_search	0	-0.000002
exp12287	1.36727475e-28	0.000000	0.000000	discard	cycle 91 u=0.1050	agent0	initial_cond	0	-0.000000
exp12288	6.18472616e-18	0.011783	-0.000000	discard	Round 8: K_amplitude=0.044 fine sweep	manual	branch_search	1	-0.000002
exp12289	6.14461376e-29	0.000000	0.000000	discard	cycle 91 u=0.1050	agent0	initial_cond	0	-0.000000
exp12290	6.18472616e-18	0.011783	-0.000000	discard	Round 8: K_amplitude=0.046 fine sweep	manual	branch_search	0	-0.000002
exp12291	6.14461376e-29	0.000000	0.000000	discard	cycle 91 u=0.1050	agent0	initial_cond	0	-0.000000
exp12292	6.18472616e-18	0.011783	-0.000000	discard	Round 8: K_amplitude=0.048 fine sweep	manual	branch_search	1	-0.000002
exp12293	6.14461376e-29	0.000000	0.000000	discard	cycle 91 u=0.1050	agent0	initial_cond	1	-0.000000
exp12294	6.18472616e-18	0.011783	-0.000000	discard	Round 8: K_amplitude=0.050 fine sweep	manual	branch_search	0	-0.000002
exp12295	1.75906666e-28	0.000000	0.000000	discard	cycle 91 u=0.1050	agent0	initial_cond	0	-0.000000
exp12296	6.18472616e-18	0.011783	-0.000000	discard	Round 8: K_amplitude=0.052 fine sweep	manual	branch_search	0	-0.000002
exp12297	1.75906666e-28	0.000000	0.000000	discard	cycle 91 u=0.1050	agent0	initial_cond	0	-0.000000
exp12298	6.18472616e-18	0.011783	-0.000000	discard	Round 8: K_amplitude=0.054 fine sweep	manual	branch_search	0	-0.000002
exp12299	1.75906666e-28	0.000000	0.000000	discard	cycle 91 u=0.1050	agent0	initial_cond	0	-0.000000
exp12300	6.18472616e-18	0.011783	-0.000000	discard	Round 8: K_amplitude=0.056 fine sweep	manual	branch_search	0	-0.000002
exp12301	1.11257917e-28	0.000000	0.000000	discard	cycle 91 u=0.1050	agent0	initial_cond	0	-0.000000
exp12302	6.18472616e-18	0.011783	-0.000000	discard	Round 8: K_amplitude=0.058 fine sweep	manual	branch_search	1	-0.000002
exp12303	1.11257917e-28	0.000000	0.000000	discard	cycle 91 u=0.1050	agent0	initial_cond	1	-0.000000
exp12304	6.18472616e-18	0.011783	-0.000000	discard	Round 8: K_amplitude=0.060 fine sweep	manual	branch_search	0	-0.000002
exp12305	1.11257917e-28	0.000000	0.000000	discard	cycle 91 u=0.1050	agent0	initial_cond	0	-0.000000
exp12306	6.18472616e-18	0.011783	-0.000000	discard	Round 8: K_amplitude=0.062 fine sweep	manual	branch_search	0	-0.000002
exp12307	8.58580947e-29	0.000000	0.000000	discard	cycle 92 u=0.0975	agent0	initial_cond	1	0.000000
exp12308	6.18472616e-18	0.011783	-0.000000	discard	Round 8: K_amplitude=0.064 fine sweep	manual	branch_search	0	-0.000002
exp12309	8.58580947e-29	0.000000	0.000000	discard	cycle 92 u=0.0975	agent0	initial_cond	0	0.000000
exp12310	6.18472616e-18	0.011783	-0.000000	discard	Round 8: K_amplitude=0.066 fine sweep	manual	branch_search	0	-0.000002
exp12311	8.58580947e-29	0.000000	0.000000	discard	cycle 92 u=0.0975	agent0	initial_cond	0	0.000000
exp12312	6.18472616e-18	0.011783	-0.000000	discard	Round 8: K_amplitude=0.068 fine sweep	manual	branch_search	1	-0.000002
exp12313	5.23962023e-29	0.000000	0.000000	discard	cycle 92 u=0.0975	agent0	initial_cond	1	0.000000
exp12314	6.18472616e-18	0.011783	-0.000000	discard	Round 8: K_amplitude=0.070 fine sweep	manual	branch_search	0	-0.000002
exp12315	5.23962023e-29	0.000000	0.000000	discard	cycle 92 u=0.0975	agent0	initial_cond	0	0.000000
exp12316	5.23962023e-29	0.000000	0.000000	discard	cycle 92 u=0.0975	agent0	initial_cond	1	0.000000
exp12317	4.03266298e-29	0.000000	0.000000	discard	cycle 92 u=0.0975	agent0	initial_cond	0	0.000000
exp12318	4.03266298e-29	0.000000	0.000000	discard	cycle 92 u=0.0975	agent0	initial_cond	0	0.000000
exp12319	4.03266298e-29	0.000000	0.000000	discard	cycle 92 u=0.0975	agent0	initial_cond	1	0.000000
exp12320	4.80015937e-29	0.000000	0.000000	discard	cycle 92 u=0.0975	agent0	initial_cond	0	0.000000
exp12321	4.80015937e-29	0.000000	0.000000	discard	cycle 92 u=0.0975	agent0	initial_cond	1	0.000000
exp12322	4.80015937e-29	0.000000	0.000000	discard	cycle 92 u=0.0975	agent0	initial_cond	0	0.000000
exp12323	2.68824537e-29	0.000000	0.000000	discard	cycle 92 u=0.0980	agent0	initial_cond	0	-0.000000
exp12324	2.68824537e-29	0.000000	0.000000	discard	cycle 92 u=0.0980	agent0	initial_cond	1	-0.000000
exp12325	2.68824537e-29	0.000000	0.000000	discard	cycle 92 u=0.0980	agent0	initial_cond	0	-0.000000
exp12326	6.16758073e-29	0.000000	0.000000	discard	cycle 92 u=0.0980	agent0	initial_cond	1	-0.000000
exp12327	6.16758073e-29	0.000000	0.000000	discard	cycle 92 u=0.0980	agent0	initial_cond	0	-0.000000
exp12328	6.16758073e-29	0.000000	0.000000	discard	cycle 92 u=0.0980	agent0	initial_cond	0	-0.000000
exp12329	2.01926478e-29	0.000000	0.000000	discard	cycle 92 u=0.0980	agent0	initial_cond	0	0.000000
exp12330	2.01926478e-29	0.000000	0.000000	discard	cycle 92 u=0.0980	agent0	initial_cond	0	0.000000
exp12331	2.01926478e-29	0.000000	0.000000	discard	cycle 92 u=0.0980	agent0	initial_cond	1	0.000000
exp12332	1.30310780e-28	0.000000	0.000000	discard	cycle 92 u=0.0980	agent0	initial_cond	0	-0.000000
exp12333	1.30310780e-28	0.000000	0.000000	discard	cycle 92 u=0.0980	agent0	initial_cond	0	-0.000000
exp12334	1.30310780e-28	0.000000	0.000000	discard	cycle 92 u=0.0980	agent0	initial_cond	0	-0.000000
exp12335	5.45343271e-29	0.000000	0.000000	discard	cycle 92 u=0.0982	agent0	initial_cond	0	-0.000000
exp12336	5.45343271e-29	0.000000	0.000000	discard	cycle 92 u=0.0982	agent0	initial_cond	1	-0.000000
exp12337	5.45343271e-29	0.000000	0.000000	discard	cycle 92 u=0.0982	agent0	initial_cond	0	-0.000000
exp12338	1.23429977e-28	0.000000	0.000000	discard	cycle 92 u=0.0982	agent0	initial_cond	0	0.000000
exp12338	6.18472616e-18	0.011783	-0.000000	discard	Round 8: 3D refinement u=0.240 a=0.42 p=1.20	manual	perturbation	0	-0.000002
exp12339	1.23429977e-28	0.000000	0.000000	discard	cycle 92 u=0.0982	agent0	initial_cond	0	0.000000
exp12340	6.18472616e-18	0.011783	-0.000000	discard	Round 8: 3D refinement u=0.240 a=0.42 p=1.21	manual	perturbation	0	-0.000002
exp12341	1.23429977e-28	0.000000	0.000000	discard	cycle 92 u=0.0982	agent0	initial_cond	0	0.000000
exp12342	6.18472616e-18	0.011783	-0.000000	discard	Round 8: 3D refinement u=0.240 a=0.42 p=1.22	manual	perturbation	0	-0.000002
exp12343	1.88036672e-29	0.000000	0.000000	discard	cycle 92 u=0.0982	agent0	initial_cond	1	0.000000
exp12344	6.18472616e-18	0.011783	-0.000000	discard	Round 8: 3D refinement u=0.240 a=0.42 p=1.23	manual	perturbation	1	-0.000002
exp12345	1.88036672e-29	0.000000	0.000000	discard	cycle 92 u=0.0982	agent0	initial_cond	0	0.000000
exp12346	6.18472616e-18	0.011783	-0.000000	discard	Round 8: 3D refinement u=0.240 a=0.42 p=1.24	manual	perturbation	0	-0.000002
exp12347	1.88036672e-29	0.000000	0.000000	discard	cycle 92 u=0.0982	agent0	initial_cond	0	0.000000
exp12348	6.18472616e-18	0.011783	-0.000000	discard	Round 8: 3D refinement u=0.240 a=0.43 p=1.20	manual	perturbation	1	-0.000002
exp12349	1.91190259e-29	0.000000	-0.000000	discard	cycle 92 u=0.0982	agent0	initial_cond	0	0.000000
exp12350	6.18472616e-18	0.011783	-0.000000	discard	Round 8: 3D refinement u=0.240 a=0.43 p=1.21	manual	perturbation	0	-0.000002
exp12351	1.91190259e-29	0.000000	-0.000000	discard	cycle 92 u=0.0982	agent0	initial_cond	0	0.000000
exp12352	6.18472616e-18	0.011783	-0.000000	discard	Round 8: 3D refinement u=0.240 a=0.43 p=1.22	manual	perturbation	0	-0.000002
exp12353	1.91190259e-29	0.000000	-0.000000	discard	cycle 92 u=0.0982	agent0	initial_cond	1	0.000000
exp12354	6.18472616e-18	0.011783	-0.000000	discard	Round 8: 3D refinement u=0.240 a=0.43 p=1.23	manual	perturbation	0	-0.000002
exp12355	6.13049994e-29	0.000000	0.000000	discard	cycle 92 u=0.0985	agent0	initial_cond	0	0.000000
exp12356	6.18472616e-18	0.011783	-0.000000	discard	Round 8: 3D refinement u=0.240 a=0.43 p=1.24	manual	perturbation	0	-0.000002
exp12357	6.13049994e-29	0.000000	0.000000	discard	cycle 92 u=0.0985	agent0	initial_cond	0	0.000000
exp12358	6.18472616e-18	0.011783	-0.000000	discard	Round 8: 3D refinement u=0.240 a=0.44 p=1.20	manual	perturbation	1	-0.000002
exp12359	6.13049994e-29	0.000000	0.000000	discard	cycle 92 u=0.0985	agent0	initial_cond	0	0.000000
exp12360	6.18472616e-18	0.011783	-0.000000	discard	Round 8: 3D refinement u=0.240 a=0.44 p=1.21	manual	perturbation	0	-0.000002
exp12361	5.49750971e-29	0.000000	0.000000	discard	cycle 92 u=0.0985	agent0	initial_cond	0	0.000000
exp12362	6.18472616e-18	0.011783	-0.000000	discard	Round 8: 3D refinement u=0.240 a=0.44 p=1.22	manual	perturbation	0	-0.000002
exp12363	5.49750971e-29	0.000000	0.000000	discard	cycle 92 u=0.0985	agent0	initial_cond	1	0.000000
exp12364	6.18472616e-18	0.011783	-0.000000	discard	Round 8: 3D refinement u=0.240 a=0.44 p=1.23	manual	perturbation	0	-0.000002
exp12365	5.49750971e-29	0.000000	0.000000	discard	cycle 92 u=0.0985	agent0	initial_cond	0	0.000000
exp12366	6.18472616e-18	0.011783	-0.000000	discard	Round 8: 3D refinement u=0.240 a=0.44 p=1.24	manual	perturbation	0	-0.000002
exp12367	4.15642452e-29	0.000000	0.000000	discard	cycle 92 u=0.0985	agent0	initial_cond	1	0.000000
exp12368	6.18472616e-18	0.011783	-0.000000	discard	Round 8: 3D refinement u=0.240 a=0.45 p=1.20	manual	perturbation	1	-0.000002
exp12369	4.15642452e-29	0.000000	0.000000	discard	cycle 92 u=0.0985	agent0	initial_cond	0	0.000000
exp12370	6.18472616e-18	0.011783	-0.000000	discard	Round 8: 3D refinement u=0.240 a=0.45 p=1.21	manual	perturbation	0	-0.000002
exp12371	4.15642452e-29	0.000000	0.000000	discard	cycle 92 u=0.0985	agent0	initial_cond	0	0.000000
exp12372	6.18472616e-18	0.011783	-0.000000	discard	Round 8: 3D refinement u=0.240 a=0.45 p=1.22	manual	perturbation	1	-0.000002
exp12373	2.19292611e-29	0.000000	0.000000	discard	cycle 92 u=0.0985	agent0	initial_cond	1	-0.000000
exp12374	6.18472616e-18	0.011783	-0.000000	discard	Round 8: 3D refinement u=0.240 a=0.45 p=1.23	manual	perturbation	0	-0.000002
exp12375	2.19292611e-29	0.000000	0.000000	discard	cycle 92 u=0.0985	agent0	initial_cond	0	-0.000000
exp12376	6.18472616e-18	0.011783	-0.000000	discard	Round 8: 3D refinement u=0.240 a=0.45 p=1.24	manual	perturbation	0	-0.000002
exp12377	2.19292611e-29	0.000000	0.000000	discard	cycle 92 u=0.0985	agent0	initial_cond	1	-0.000000
exp12378	6.18472616e-18	0.011783	-0.000000	discard	Round 8: 3D refinement u=0.240 a=0.46 p=1.20	manual	perturbation	1	-0.000002
exp12379	4.22491788e-29	0.000000	0.000000	discard	cycle 92 u=0.0990	agent0	initial_cond	0	-0.000000
exp12380	6.18472616e-18	0.011783	-0.000000	discard	Round 8: 3D refinement u=0.240 a=0.46 p=1.21	manual	perturbation	0	-0.000002
exp12381	4.22491788e-29	0.000000	0.000000	discard	cycle 92 u=0.0990	agent0	initial_cond	0	-0.000000
exp12382	6.18472616e-18	0.011783	-0.000000	discard	Round 8: 3D refinement u=0.240 a=0.46 p=1.22	manual	perturbation	1	-0.000002
exp12383	4.22491788e-29	0.000000	0.000000	discard	cycle 92 u=0.0990	agent0	initial_cond	1	-0.000000
exp12384	6.18472616e-18	0.011783	-0.000000	discard	Round 8: 3D refinement u=0.240 a=0.46 p=1.23	manual	perturbation	0	-0.000002
exp12385	3.22245147e-29	0.000000	0.000000	discard	cycle 92 u=0.0990	agent0	initial_cond	0	0.000000
exp12386	6.18472616e-18	0.011783	-0.000000	discard	Round 8: 3D refinement u=0.240 a=0.46 p=1.24	manual	perturbation	0	-0.000002
exp12387	3.22245147e-29	0.000000	0.000000	discard	cycle 92 u=0.0990	agent0	initial_cond	1	0.000000
exp12388	6.18472616e-18	0.011783	-0.000000	discard	Round 8: 3D refinement u=0.242 a=0.42 p=1.20	manual	perturbation	0	-0.000002
exp12389	3.22245147e-29	0.000000	0.000000	discard	cycle 92 u=0.0990	agent0	initial_cond	0	0.000000
exp12390	6.18472616e-18	0.011783	-0.000000	discard	Round 8: 3D refinement u=0.242 a=0.42 p=1.21	manual	perturbation	0	-0.000002
exp12391	4.50941488e-29	0.000000	-0.000000	discard	cycle 92 u=0.0990	agent0	initial_cond	0	0.000000
exp12392	6.18472616e-18	0.011783	-0.000000	discard	Round 8: 3D refinement u=0.242 a=0.42 p=1.22	manual	perturbation	1	-0.000002
exp12393	4.50941488e-29	0.000000	-0.000000	discard	cycle 92 u=0.0990	agent0	initial_cond	0	0.000000
exp12394	6.18472616e-18	0.011783	-0.000000	discard	Round 8: 3D refinement u=0.242 a=0.42 p=1.23	manual	perturbation	0	-0.000002
exp12395	4.50941488e-29	0.000000	-0.000000	discard	cycle 92 u=0.0990	agent0	initial_cond	0	0.000000
exp12396	6.18472616e-18	0.011783	-0.000000	discard	Round 8: 3D refinement u=0.242 a=0.42 p=1.24	manual	perturbation	0	-0.000002
exp12397	4.88330883e-29	0.000000	-0.000000	discard	cycle 92 u=0.0990	agent0	initial_cond	1	0.000000
exp12398	6.18472616e-18	0.011783	-0.000000	discard	Round 8: 3D refinement u=0.242 a=0.43 p=1.20	manual	perturbation	0	-0.000002
exp12399	4.88330883e-29	0.000000	-0.000000	discard	cycle 92 u=0.0990	agent0	initial_cond	0	0.000000
exp12400	6.18472616e-18	0.011783	-0.000000	discard	Round 8: 3D refinement u=0.242 a=0.43 p=1.21	manual	perturbation	0	-0.000002
exp12401	4.88330883e-29	0.000000	-0.000000	discard	cycle 92 u=0.0990	agent0	initial_cond	0	0.000000
exp12402	6.18472616e-18	0.011783	-0.000000	discard	Round 8: 3D refinement u=0.242 a=0.43 p=1.22	manual	perturbation	1	-0.000002
exp12403	5.74085541e-29	0.000000	-0.000000	discard	cycle 92 u=0.0995	agent0	initial_cond	0	0.000000
exp12404	6.18472616e-18	0.011783	-0.000000	discard	Round 8: 3D refinement u=0.242 a=0.43 p=1.23	manual	perturbation	0	-0.000002
exp12404	5.74085541e-29	0.000000	-0.000000	discard	cycle 92 u=0.0995	agent0	initial_cond	0	0.000000
exp12405	6.18472616e-18	0.011783	-0.000000	discard	Round 8: 3D refinement u=0.242 a=0.43 p=1.24	manual	perturbation	1	-0.000002
exp12405	5.74085541e-29	0.000000	-0.000000	discard	cycle 92 u=0.0995	agent0	initial_cond	1	0.000000
exp12406	6.18472616e-18	0.011783	-0.000000	discard	Round 8: 3D refinement u=0.242 a=0.44 p=1.20	manual	perturbation	0	-0.000002
exp12406	1.54984578e-28	0.000000	0.000000	discard	cycle 92 u=0.0995	agent0	initial_cond	0	-0.000000
exp12407	6.18472616e-18	0.011783	-0.000000	discard	Round 8: 3D refinement u=0.242 a=0.44 p=1.21	manual	perturbation	0	-0.000002
exp12407	1.54984578e-28	0.000000	0.000000	discard	cycle 92 u=0.0995	agent0	initial_cond	0	-0.000000
exp12408	6.18472616e-18	0.011783	-0.000000	discard	Round 8: 3D refinement u=0.242 a=0.44 p=1.22	manual	perturbation	0	-0.000002
exp12408	1.54984578e-28	0.000000	0.000000	discard	cycle 92 u=0.0995	agent0	initial_cond	0	-0.000000
exp12409	6.18472616e-18	0.011783	-0.000000	discard	Round 8: 3D refinement u=0.242 a=0.44 p=1.23	manual	perturbation	0	-0.000002
exp12409	1.60328418e-29	0.000000	-0.000000	discard	cycle 92 u=0.0995	agent0	initial_cond	0	-0.000000
exp12410	6.18472616e-18	0.011783	-0.000000	discard	Round 8: 3D refinement u=0.242 a=0.44 p=1.24	manual	perturbation	1	-0.000002
exp12410	1.60328418e-29	0.000000	-0.000000	discard	cycle 92 u=0.0995	agent0	initial_cond	1	-0.000000
exp12411	1.60328418e-29	0.000000	-0.000000	discard	cycle 92 u=0.0995	agent0	initial_cond	0	-0.000000
exp12411	6.18472616e-18	0.011783	-0.000000	discard	Round 8: 3D refinement u=0.242 a=0.45 p=1.20	manual	perturbation	0	-0.000002
exp12412	7.34590618e-29	0.000000	0.000000	discard	cycle 92 u=0.0995	agent0	initial_cond	0	0.000000
exp12412	6.18472616e-18	0.011783	-0.000000	discard	Round 8: 3D refinement u=0.242 a=0.45 p=1.21	manual	perturbation	0	-0.000002
exp12413	7.34590618e-29	0.000000	0.000000	discard	cycle 92 u=0.0995	agent0	initial_cond	0	0.000000
exp12413	6.18472616e-18	0.011783	-0.000000	discard	Round 8: 3D refinement u=0.242 a=0.45 p=1.22	manual	perturbation	0	-0.000002
exp12414	6.18472616e-18	0.011783	-0.000000	discard	Round 8: 3D refinement u=0.242 a=0.45 p=1.23	manual	perturbation	0	-0.000002
exp12414	7.34590618e-29	0.000000	0.000000	discard	cycle 92 u=0.0995	agent0	initial_cond	0	0.000000
exp12415	4.46546993e-29	0.000000	0.000000	discard	cycle 92 u=0.1000	agent0	initial_cond	1	-0.000000
exp12415	6.18472616e-18	0.011783	-0.000000	discard	Round 8: 3D refinement u=0.242 a=0.45 p=1.24	manual	perturbation	1	-0.000002
exp12416	4.46546993e-29	0.000000	0.000000	discard	cycle 92 u=0.1000	agent0	initial_cond	0	-0.000000
exp12416	6.18472616e-18	0.011783	-0.000000	discard	Round 8: 3D refinement u=0.242 a=0.46 p=1.20	manual	perturbation	0	-0.000002
exp12417	4.46546993e-29	0.000000	0.000000	discard	cycle 92 u=0.1000	agent0	initial_cond	0	-0.000000
exp12417	6.18472616e-18	0.011783	-0.000000	discard	Round 8: 3D refinement u=0.242 a=0.46 p=1.21	manual	perturbation	0	-0.000002
exp12418	4.08106752e-29	0.000000	0.000000	discard	cycle 92 u=0.1000	agent0	initial_cond	0	-0.000000
exp12418	6.18472616e-18	0.011783	-0.000000	discard	Round 8: 3D refinement u=0.242 a=0.46 p=1.22	manual	perturbation	0	-0.000002
exp12419	4.08106752e-29	0.000000	0.000000	discard	cycle 92 u=0.1000	agent0	initial_cond	0	-0.000000
exp12419	6.18472616e-18	0.011783	-0.000000	discard	Round 8: 3D refinement u=0.242 a=0.46 p=1.23	manual	perturbation	0	-0.000002
exp12420	4.08106752e-29	0.000000	0.000000	discard	cycle 92 u=0.1000	agent0	initial_cond	1	-0.000000
exp12420	6.18472616e-18	0.011783	-0.000000	discard	Round 8: 3D refinement u=0.242 a=0.46 p=1.24	manual	perturbation	1	-0.000002
exp12421	4.58623706e-29	0.000000	0.000000	discard	cycle 92 u=0.1000	agent0	initial_cond	0	-0.000000
exp12421	6.18472616e-18	0.011783	-0.000000	discard	Round 8: 3D refinement u=0.244 a=0.42 p=1.20	manual	perturbation	0	-0.000002
exp12422	6.18472616e-18	0.011783	-0.000000	discard	Round 8: 3D refinement u=0.244 a=0.42 p=1.21	manual	perturbation	1	-0.000002
