exp_id	residual	solution_norm	solution_mean	status	description	agent	design	elapsed_s	solution_energy
exp7515	3.77087249e-15	0.070278	-0.000000	discard	Negative u_offset exploration u=-0.205 modes=3 amp=0.5 phase=1.0	manual	memory	0	0.000097
exp7515	2.19292611e-29	0.000000	0.000000	discard	cycle 50 u=0.0985	agent0	initial_cond	0	-0.000000
exp7516	4.22491788e-29	0.000000	0.000000	discard	cycle 50 u=0.0990	agent0	initial_cond	0	-0.000000
exp7517	5.27716309e-15	0.070278	-0.000000	discard	Negative u_offset exploration u=-0.208 modes=3 amp=0.5 phase=1.0	manual	memory	0	0.000097
exp7518	4.22491788e-29	0.000000	0.000000	discard	cycle 50 u=0.0990	agent0	initial_cond	0	-0.000000
exp7519	4.22491788e-29	0.000000	0.000000	discard	cycle 50 u=0.0990	agent0	initial_cond	1	-0.000000
exp7519	5.27716309e-15	0.070278	-0.000000	discard	Negative u_offset exploration u=-0.2080 modes=3 amp=0.5 phase=1.0	manual	memory	1	0.000097
exp7520	3.22245147e-29	0.000000	0.000000	discard	cycle 50 u=0.0990	agent0	initial_cond	0	0.000000
exp7521	2.14165589e-15	0.070278	-0.000000	discard	Negative u_offset exploration u=-0.200 modes=3 amp=0.5 phase=1.0	manual	memory	0	0.000097
exp7522	3.22245147e-29	0.000000	0.000000	discard	cycle 50 u=0.0990	agent0	initial_cond	0	0.000000
exp7523	3.22245147e-29	0.000000	0.000000	discard	cycle 50 u=0.0990	agent0	initial_cond	1	0.000000
exp7523	6.54050647e-15	0.070278	-0.000000	discard	Negative u_offset exploration u=-0.210 modes=3 amp=0.5 phase=1.0	manual	memory	0	0.000097
exp7524	4.50941488e-29	0.000000	-0.000000	discard	cycle 50 u=0.0990	agent0	initial_cond	0	0.000000
exp7525	4.50941488e-29	0.000000	-0.000000	discard	cycle 50 u=0.0990	agent0	initial_cond	1	0.000000
exp7526	4.50941488e-29	0.000000	-0.000000	discard	cycle 50 u=0.0990	agent0	initial_cond	0	0.000000
exp7527	4.88330883e-29	0.000000	-0.000000	discard	cycle 50 u=0.0990	agent0	initial_cond	0	0.000000
exp7528	4.88330883e-29	0.000000	-0.000000	discard	cycle 50 u=0.0990	agent0	initial_cond	1	0.000000
exp7529	4.88330883e-29	0.000000	-0.000000	discard	cycle 50 u=0.0990	agent0	initial_cond	0	0.000000
exp7530	5.74085541e-29	0.000000	-0.000000	discard	cycle 50 u=0.0995	agent0	initial_cond	0	0.000000
exp7531	5.74085541e-29	0.000000	-0.000000	discard	cycle 50 u=0.0995	agent0	initial_cond	0	0.000000
exp7532	5.74085541e-29	0.000000	-0.000000	discard	cycle 50 u=0.0995	agent0	initial_cond	0	0.000000
exp7533	1.54984578e-28	0.000000	0.000000	discard	cycle 50 u=0.0995	agent0	initial_cond	1	-0.000000
exp7534	1.54984578e-28	0.000000	0.000000	discard	cycle 50 u=0.0995	agent0	initial_cond	0	-0.000000
exp7535	1.54984578e-28	0.000000	0.000000	discard	cycle 50 u=0.0995	agent0	initial_cond	0	-0.000000
exp7536	1.60328418e-29	0.000000	-0.000000	discard	cycle 50 u=0.0995	agent0	initial_cond	1	-0.000000
exp7537	1.60328418e-29	0.000000	-0.000000	discard	cycle 50 u=0.0995	agent0	initial_cond	0	-0.000000
exp7538	1.60328418e-29	0.000000	-0.000000	discard	cycle 50 u=0.0995	agent0	initial_cond	0	-0.000000
exp7539	7.34590618e-29	0.000000	0.000000	discard	cycle 50 u=0.0995	agent0	initial_cond	0	0.000000
exp7540	7.34590618e-29	0.000000	0.000000	discard	cycle 50 u=0.0995	agent0	initial_cond	0	0.000000
exp7541	7.34590618e-29	0.000000	0.000000	discard	cycle 50 u=0.0995	agent0	initial_cond	1	0.000000
exp7541	3.75459838e-17	0.070278	-0.000000	discard	Special phase exploration phase=2.88 u=0.2080	manual	memory	1	0.000097
exp7542	4.46546993e-29	0.000000	0.000000	discard	cycle 50 u=0.1000	agent0	initial_cond	0	-0.000000
exp7543	1.60502130e-17	0.070278	-0.000000	discard	Special phase exploration phase=2.89 u=0.2080	manual	memory	0	0.000097
exp7544	4.46546993e-29	0.000000	0.000000	discard	cycle 50 u=0.1000	agent0	initial_cond	0	-0.000000
exp7545	4.46546993e-29	0.000000	0.000000	discard	cycle 50 u=0.1000	agent0	initial_cond	1	-0.000000
exp7545	4.51204637e-17	0.070278	-0.000000	discard	Special phase exploration phase=2.90 u=0.2080	manual	memory	0	0.000097
exp7546	4.08106752e-29	0.000000	0.000000	discard	cycle 50 u=0.1000	agent0	initial_cond	0	-0.000000
exp7547	1.26357492e-17	0.070278	-0.000000	discard	Special phase exploration phase=2.91 u=0.2080	manual	memory	0	0.000097
exp7548	4.08106752e-29	0.000000	0.000000	discard	cycle 50 u=0.1000	agent0	initial_cond	1	-0.000000
exp7549	4.08106752e-29	0.000000	0.000000	discard	cycle 50 u=0.1000	agent0	initial_cond	0	-0.000000
exp7550	1.08766573e-17	0.070278	-0.000000	discard	Special phase exploration phase=2.92 u=0.2080	manual	memory	0	0.000097
exp7551	4.58623706e-29	0.000000	0.000000	discard	cycle 50 u=0.1000	agent0	initial_cond	0	-0.000000
exp7552	4.58623706e-29	0.000000	0.000000	discard	cycle 50 u=0.1000	agent0	initial_cond	1	-0.000000
exp7553	4.58623706e-29	0.000000	0.000000	discard	cycle 50 u=0.1000	agent0	initial_cond	0	-0.000000
exp7554	4.39794337e-29	0.000000	0.000000	discard	cycle 50 u=0.1000	agent0	initial_cond	0	-0.000000
exp7555	4.39794337e-29	0.000000	0.000000	discard	cycle 50 u=0.1000	agent0	initial_cond	0	-0.000000
exp7556	4.39794337e-29	0.000000	0.000000	discard	cycle 50 u=0.1000	agent0	initial_cond	0	-0.000000
exp7557	1.36727475e-28	0.000000	0.000000	discard	cycle 50 u=0.1050	agent0	initial_cond	1	-0.000000
exp7558	1.36727475e-28	0.000000	0.000000	discard	cycle 50 u=0.1050	agent0	initial_cond	0	-0.000000
exp7559	1.36727475e-28	0.000000	0.000000	discard	cycle 50 u=0.1050	agent0	initial_cond	0	-0.000000
exp7560	3.19928430e-17	0.070278	-0.000000	discard	Phase fine-tune phase=2.905 u=0.2080	manual	memory	1	0.000097
exp7561	6.14461376e-29	0.000000	0.000000	discard	cycle 50 u=0.1050	agent0	initial_cond	1	-0.000000
exp7562	6.14461376e-29	0.000000	0.000000	discard	cycle 50 u=0.1050	agent0	initial_cond	0	-0.000000
exp7562	2.83512205e-17	0.070278	-0.000000	discard	Phase fine-tune phase=2.908 u=0.2080	manual	memory	0	0.000097
exp7563	6.14461376e-29	0.000000	0.000000	discard	cycle 50 u=0.1050	agent0	initial_cond	0	-0.000000
exp7564	4.96932847e-17	0.070278	-0.000000	discard	Phase fine-tune phase=2.909 u=0.2080	manual	memory	1	0.000097
exp7565	1.75906666e-28	0.000000	0.000000	discard	cycle 50 u=0.1050	agent0	initial_cond	0	-0.000000
exp7566	1.75906666e-28	0.000000	0.000000	discard	cycle 50 u=0.1050	agent0	initial_cond	0	-0.000000
exp7567	1.26357492e-17	0.070278	-0.000000	discard	Phase fine-tune phase=2.910 u=0.2080	manual	memory	0	0.000097
exp7568	1.75906666e-28	0.000000	0.000000	discard	cycle 50 u=0.1050	agent0	initial_cond	1	-0.000000
exp7569	4.09688327e-17	0.070278	-0.000000	discard	Phase fine-tune phase=2.911 u=0.2080	manual	memory	0	0.000097
exp7570	1.11257917e-28	0.000000	0.000000	discard	cycle 50 u=0.1050	agent0	initial_cond	0	-0.000000
exp7571	1.11257917e-28	0.000000	0.000000	discard	cycle 50 u=0.1050	agent0	initial_cond	0	-0.000000
exp7572	6.85081912e-17	0.070278	-0.000000	discard	Phase fine-tune phase=2.912 u=0.2080	manual	memory	1	0.000097
exp7573	1.11257917e-28	0.000000	0.000000	discard	cycle 50 u=0.1050	agent0	initial_cond	1	-0.000000
exp7574	3.71247109e-17	0.070278	-0.000000	discard	Phase fine-tune phase=2.915 u=0.2080	manual	memory	0	0.000097
exp7574	8.58580947e-29	0.000000	0.000000	discard	cycle 51 u=0.0975	agent0	initial_cond	0	0.000000
exp7575	8.58580947e-29	0.000000	0.000000	discard	cycle 51 u=0.0975	agent0	initial_cond	1	0.000000
exp7576	8.58580947e-29	0.000000	0.000000	discard	cycle 51 u=0.0975	agent0	initial_cond	0	0.000000
exp7577	5.23962023e-29	0.000000	0.000000	discard	cycle 51 u=0.0975	agent0	initial_cond	0	0.000000
exp7578	5.23962023e-29	0.000000	0.000000	discard	cycle 51 u=0.0975	agent0	initial_cond	1	0.000000
exp7579	5.23962023e-29	0.000000	0.000000	discard	cycle 51 u=0.0975	agent0	initial_cond	0	0.000000
exp7580	4.03266298e-29	0.000000	0.000000	discard	cycle 51 u=0.0975	agent0	initial_cond	0	0.000000
exp7581	4.03266298e-29	0.000000	0.000000	discard	cycle 51 u=0.0975	agent0	initial_cond	0	0.000000
exp7582	4.03266298e-29	0.000000	0.000000	discard	cycle 51 u=0.0975	agent0	initial_cond	0	0.000000
exp7583	4.80015937e-29	0.000000	0.000000	discard	cycle 51 u=0.0975	agent0	initial_cond	1	0.000000
exp7584	4.80015937e-29	0.000000	0.000000	discard	cycle 51 u=0.0975	agent0	initial_cond	0	0.000000
exp7585	4.80015937e-29	0.000000	0.000000	discard	cycle 51 u=0.0975	agent0	initial_cond	0	0.000000
exp7586	2.68824537e-29	0.000000	0.000000	discard	cycle 51 u=0.0980	agent0	initial_cond	1	-0.000000
exp7587	2.68824537e-29	0.000000	0.000000	discard	cycle 51 u=0.0980	agent0	initial_cond	0	-0.000000
exp7588	2.68824537e-29	0.000000	0.000000	discard	cycle 51 u=0.0980	agent0	initial_cond	0	-0.000000
exp7589	6.16758073e-29	0.000000	0.000000	discard	cycle 51 u=0.0980	agent0	initial_cond	0	-0.000000
exp7590	6.16758073e-29	0.000000	0.000000	discard	cycle 51 u=0.0980	agent0	initial_cond	0	-0.000000
exp7591	1.77348205e-17	0.070278	-0.000000	discard	u_offset with phase=2.910 u=0.200	manual	memory	0	0.000097
exp7592	6.16758073e-29	0.000000	0.000000	discard	cycle 51 u=0.0980	agent0	initial_cond	1	-0.000000
exp7593	5.05163348e-17	0.070278	-0.000000	discard	u_offset with phase=2.910 u=0.202	manual	memory	0	0.000097
exp7593	2.01926478e-29	0.000000	0.000000	discard	cycle 51 u=0.0980	agent0	initial_cond	0	0.000000
exp7594	2.01926478e-29	0.000000	0.000000	discard	cycle 51 u=0.0980	agent0	initial_cond	0	0.000000
exp7595	1.00279997e-16	0.070278	-0.000000	discard	u_offset with phase=2.910 u=0.204	manual	memory	1	0.000097
exp7596	2.01926478e-29	0.000000	0.000000	discard	cycle 51 u=0.0980	agent0	initial_cond	1	0.000000
exp7597	1.30310780e-28	0.000000	0.000000	discard	cycle 51 u=0.0980	agent0	initial_cond	0	-0.000000
exp7597	1.84343586e-17	0.070278	-0.000000	discard	u_offset with phase=2.910 u=0.206	manual	memory	0	0.000097
exp7598	1.30310780e-28	0.000000	0.000000	discard	cycle 51 u=0.0980	agent0	initial_cond	0	-0.000000
exp7599	1.26357492e-17	0.070278	-0.000000	discard	u_offset with phase=2.910 u=0.208	manual	memory	1	0.000097
exp7600	1.30310780e-28	0.000000	0.000000	discard	cycle 51 u=0.0980	agent0	initial_cond	0	-0.000000
exp7601	5.45343271e-29	0.000000	0.000000	discard	cycle 51 u=0.0982	agent0	initial_cond	0	-0.000000
exp7602	3.84414746e-17	0.070278	-0.000000	discard	u_offset with phase=2.910 u=0.210	manual	memory	0	0.000097
exp7603	5.45343271e-29	0.000000	0.000000	discard	cycle 51 u=0.0982	agent0	initial_cond	1	-0.000000
exp7604	6.99389840e-17	0.070278	-0.000000	discard	u_offset with phase=2.910 u=0.212	manual	memory	0	0.000097
exp7605	5.45343271e-29	0.000000	0.000000	discard	cycle 51 u=0.0982	agent0	initial_cond	0	-0.000000
exp7606	1.23429977e-28	0.000000	0.000000	discard	cycle 51 u=0.0982	agent0	initial_cond	0	0.000000
exp7607	2.19537313e-17	0.070278	0.000000	discard	u_offset with phase=2.910 u=0.214	manual	memory	1	0.000097
exp7608	1.23429977e-28	0.000000	0.000000	discard	cycle 51 u=0.0982	agent0	initial_cond	0	0.000000
exp7609	1.23429977e-28	0.000000	0.000000	discard	cycle 51 u=0.0982	agent0	initial_cond	0	0.000000
exp7610	1.88036672e-29	0.000000	0.000000	discard	cycle 51 u=0.0982	agent0	initial_cond	1	0.000000
exp7611	1.88036672e-29	0.000000	0.000000	discard	cycle 51 u=0.0982	agent0	initial_cond	0	0.000000
exp7612	1.88036672e-29	0.000000	0.000000	discard	cycle 51 u=0.0982	agent0	initial_cond	0	0.000000
exp7613	1.91190259e-29	0.000000	-0.000000	discard	cycle 51 u=0.0982	agent0	initial_cond	1	0.000000
exp7614	1.91190259e-29	0.000000	-0.000000	discard	cycle 51 u=0.0982	agent0	initial_cond	0	0.000000
exp7615	1.91190259e-29	0.000000	-0.000000	discard	cycle 51 u=0.0982	agent0	initial_cond	0	0.000000
exp7616	6.13049994e-29	0.000000	0.000000	discard	cycle 51 u=0.0985	agent0	initial_cond	0	0.000000
exp7617	6.13049994e-29	0.000000	0.000000	discard	cycle 51 u=0.0985	agent0	initial_cond	0	0.000000
exp7618	6.13049994e-29	0.000000	0.000000	discard	cycle 51 u=0.0985	agent0	initial_cond	1	0.000000
exp7619	5.49750971e-29	0.000000	0.000000	discard	cycle 51 u=0.0985	agent0	initial_cond	0	0.000000
exp7620	5.49750971e-29	0.000000	0.000000	discard	cycle 51 u=0.0985	agent0	initial_cond	0	0.000000
exp7621	5.49750971e-29	0.000000	0.000000	discard	cycle 51 u=0.0985	agent0	initial_cond	1	0.000000
exp7622	4.15642452e-29	0.000000	0.000000	discard	cycle 51 u=0.0985	agent0	initial_cond	0	0.000000
exp7623	2.21102512e-17	0.070278	-0.000000	discard	Ultra-fine u_offset u=0.2078 phase=1.0	manual	memory	0	0.000097
exp7624	4.15642452e-29	0.000000	0.000000	discard	cycle 51 u=0.0985	agent0	initial_cond	0	0.000000
exp7625	4.15642452e-29	0.000000	0.000000	discard	cycle 51 u=0.0985	agent0	initial_cond	0	0.000000
exp7625	2.62364415e-17	0.070278	-0.000000	discard	Ultra-fine u_offset u=0.2079 phase=1.0	manual	memory	0	0.000097
exp7626	2.19292611e-29	0.000000	0.000000	discard	cycle 51 u=0.0985	agent0	initial_cond	0	-0.000000
exp7627	1.06327351e-17	0.070278	-0.000000	discard	Ultra-fine u_offset u=0.2080 phase=1.0	manual	memory	0	0.000097
exp7628	2.19292611e-29	0.000000	0.000000	discard	cycle 51 u=0.0985	agent0	initial_cond	1	-0.000000
exp7629	2.19292611e-29	0.000000	0.000000	discard	cycle 51 u=0.0985	agent0	initial_cond	0	-0.000000
exp7630	7.24300626e-17	0.070278	-0.000000	discard	Ultra-fine u_offset u=0.2081 phase=1.0	manual	memory	0	0.000097
exp7631	4.22491788e-29	0.000000	0.000000	discard	cycle 51 u=0.0990	agent0	initial_cond	0	-0.000000
exp7632	4.49967488e-17	0.070278	-0.000000	discard	Ultra-fine u_offset u=0.2082 phase=1.0	manual	memory	1	0.000097
exp7633	4.22491788e-29	0.000000	0.000000	discard	cycle 51 u=0.0990	agent0	initial_cond	1	-0.000000
exp7634	4.22491788e-29	0.000000	0.000000	discard	cycle 51 u=0.0990	agent0	initial_cond	0	-0.000000
exp7635	3.22245147e-29	0.000000	0.000000	discard	cycle 51 u=0.0990	agent0	initial_cond	1	0.000000
exp7636	3.22245147e-29	0.000000	0.000000	discard	cycle 51 u=0.0990	agent0	initial_cond	0	0.000000
exp7637	3.22245147e-29	0.000000	0.000000	discard	cycle 51 u=0.0990	agent0	initial_cond	0	0.000000
exp7638	4.50941488e-29	0.000000	-0.000000	discard	cycle 51 u=0.0990	agent0	initial_cond	1	0.000000
exp7639	4.50941488e-29	0.000000	-0.000000	discard	cycle 51 u=0.0990	agent0	initial_cond	0	0.000000
exp7640	4.50941488e-29	0.000000	-0.000000	discard	cycle 51 u=0.0990	agent0	initial_cond	0	0.000000
exp7641	4.88330883e-29	0.000000	-0.000000	discard	cycle 51 u=0.0990	agent0	initial_cond	1	0.000000
exp7642	4.88330883e-29	0.000000	-0.000000	discard	cycle 51 u=0.0990	agent0	initial_cond	0	0.000000
exp7643	4.88330883e-29	0.000000	-0.000000	discard	cycle 51 u=0.0990	agent0	initial_cond	1	0.000000
exp7644	5.74085541e-29	0.000000	-0.000000	discard	cycle 51 u=0.0995	agent0	initial_cond	0	0.000000
exp7645	5.74085541e-29	0.000000	-0.000000	discard	cycle 51 u=0.0995	agent0	initial_cond	0	0.000000
exp7646	5.74085541e-29	0.000000	-0.000000	discard	cycle 51 u=0.0995	agent0	initial_cond	1	0.000000
exp7647	1.54984578e-28	0.000000	0.000000	discard	cycle 51 u=0.0995	agent0	initial_cond	0	-0.000000
exp7648	1.54984578e-28	0.000000	0.000000	discard	cycle 51 u=0.0995	agent0	initial_cond	0	-0.000000
exp7649	1.54984578e-28	0.000000	0.000000	discard	cycle 51 u=0.0995	agent0	initial_cond	0	-0.000000
exp7650	1.60328418e-29	0.000000	-0.000000	discard	cycle 51 u=0.0995	agent0	initial_cond	0	-0.000000
exp7651	1.60328418e-29	0.000000	-0.000000	discard	cycle 51 u=0.0995	agent0	initial_cond	1	-0.000000
exp7652	1.60328418e-29	0.000000	-0.000000	discard	cycle 51 u=0.0995	agent0	initial_cond	0	-0.000000
exp7653	7.34590618e-29	0.000000	0.000000	discard	cycle 51 u=0.0995	agent0	initial_cond	0	0.000000
exp7654	7.34590618e-29	0.000000	0.000000	discard	cycle 51 u=0.0995	agent0	initial_cond	1	0.000000
exp7655	7.34590618e-29	0.000000	0.000000	discard	cycle 51 u=0.0995	agent0	initial_cond	0	0.000000
exp7656	4.46546993e-29	0.000000	0.000000	discard	cycle 51 u=0.1000	agent0	initial_cond	0	-0.000000
exp7657	4.46546993e-29	0.000000	0.000000	discard	cycle 51 u=0.1000	agent0	initial_cond	0	-0.000000
exp7658	4.46546993e-29	0.000000	0.000000	discard	cycle 51 u=0.1000	agent0	initial_cond	0	-0.000000
exp7659	4.08106752e-29	0.000000	0.000000	discard	cycle 51 u=0.1000	agent0	initial_cond	1	-0.000000
exp7660	4.08106752e-29	0.000000	0.000000	discard	cycle 51 u=0.1000	agent0	initial_cond	0	-0.000000
exp7661	4.08106752e-29	0.000000	0.000000	discard	cycle 51 u=0.1000	agent0	initial_cond	0	-0.000000
exp7662	4.58623706e-29	0.000000	0.000000	discard	cycle 51 u=0.1000	agent0	initial_cond	1	-0.000000
exp7663	4.58623706e-29	0.000000	0.000000	discard	cycle 51 u=0.1000	agent0	initial_cond	0	-0.000000
exp7664	4.58623706e-29	0.000000	0.000000	discard	cycle 51 u=0.1000	agent0	initial_cond	0	-0.000000
exp7665	4.39794337e-29	0.000000	0.000000	discard	cycle 51 u=0.1000	agent0	initial_cond	0	-0.000000
exp7666	4.39794337e-29	0.000000	0.000000	discard	cycle 51 u=0.1000	agent0	initial_cond	0	-0.000000
exp7667	4.39794337e-29	0.000000	0.000000	discard	cycle 51 u=0.1000	agent0	initial_cond	1	-0.000000
exp7668	1.36727475e-28	0.000000	0.000000	discard	cycle 51 u=0.1050	agent0	initial_cond	0	-0.000000
exp7669	1.36727475e-28	0.000000	0.000000	discard	cycle 51 u=0.1050	agent0	initial_cond	0	-0.000000
exp7670	1.36727475e-28	0.000000	0.000000	discard	cycle 51 u=0.1050	agent0	initial_cond	1	-0.000000
exp7671	6.14461376e-29	0.000000	0.000000	discard	cycle 51 u=0.1050	agent0	initial_cond	0	-0.000000
exp7672	6.14461376e-29	0.000000	0.000000	discard	cycle 51 u=0.1050	agent0	initial_cond	1	-0.000000
exp7673	6.14461376e-29	0.000000	0.000000	discard	cycle 51 u=0.1050	agent0	initial_cond	0	-0.000000
exp7674	1.75906666e-28	0.000000	0.000000	discard	cycle 51 u=0.1050	agent0	initial_cond	0	-0.000000
exp7675	1.75906666e-28	0.000000	0.000000	discard	cycle 51 u=0.1050	agent0	initial_cond	1	-0.000000
exp7676	1.75906666e-28	0.000000	0.000000	discard	cycle 51 u=0.1050	agent0	initial_cond	0	-0.000000
exp7677	1.11257917e-28	0.000000	0.000000	discard	cycle 51 u=0.1050	agent0	initial_cond	0	-0.000000
exp7678	1.11257917e-28	0.000000	0.000000	discard	cycle 51 u=0.1050	agent0	initial_cond	0	-0.000000
exp7679	1.11257917e-28	0.000000	0.000000	discard	cycle 51 u=0.1050	agent0	initial_cond	0	-0.000000
exp7680	8.58580947e-29	0.000000	0.000000	discard	cycle 52 u=0.0975	agent0	initial_cond	1	0.000000
exp7681	8.58580947e-29	0.000000	0.000000	discard	cycle 52 u=0.0975	agent0	initial_cond	0	0.000000
exp7682	8.58580947e-29	0.000000	0.000000	discard	cycle 52 u=0.0975	agent0	initial_cond	0	0.000000
exp7683	5.23962023e-29	0.000000	0.000000	discard	cycle 52 u=0.0975	agent0	initial_cond	1	0.000000
exp7684	5.23962023e-29	0.000000	0.000000	discard	cycle 52 u=0.0975	agent0	initial_cond	0	0.000000
exp7685	5.23962023e-29	0.000000	0.000000	discard	cycle 52 u=0.0975	agent0	initial_cond	0	0.000000
exp7686	4.03266298e-29	0.000000	0.000000	discard	cycle 52 u=0.0975	agent0	initial_cond	0	0.000000
exp7687	4.03266298e-29	0.000000	0.000000	discard	cycle 52 u=0.0975	agent0	initial_cond	0	0.000000
exp7688	4.03266298e-29	0.000000	0.000000	discard	cycle 52 u=0.0975	agent0	initial_cond	1	0.000000
exp7689	4.80015937e-29	0.000000	0.000000	discard	cycle 52 u=0.0975	agent0	initial_cond	0	0.000000
exp7690	4.80015937e-29	0.000000	0.000000	discard	cycle 52 u=0.0975	agent0	initial_cond	0	0.000000
exp7691	4.80015937e-29	0.000000	0.000000	discard	cycle 52 u=0.0975	agent0	initial_cond	1	0.000000
exp7692	2.68824537e-29	0.000000	0.000000	discard	cycle 52 u=0.0980	agent0	initial_cond	0	-0.000000
exp7693	2.68824537e-29	0.000000	0.000000	discard	cycle 52 u=0.0980	agent0	initial_cond	1	-0.000000
exp7694	2.68824537e-29	0.000000	0.000000	discard	cycle 52 u=0.0980	agent0	initial_cond	0	-0.000000
exp7695	6.16758073e-29	0.000000	0.000000	discard	cycle 52 u=0.0980	agent0	initial_cond	0	-0.000000
exp7696	6.16758073e-29	0.000000	0.000000	discard	cycle 52 u=0.0980	agent0	initial_cond	1	-0.000000
exp7697	6.16758073e-29	0.000000	0.000000	discard	cycle 52 u=0.0980	agent0	initial_cond	0	-0.000000
exp7698	2.01926478e-29	0.000000	0.000000	discard	cycle 52 u=0.0980	agent0	initial_cond	0	0.000000
exp7699	2.01926478e-29	0.000000	0.000000	discard	cycle 52 u=0.0980	agent0	initial_cond	0	0.000000
exp7700	2.01926478e-29	0.000000	0.000000	discard	cycle 52 u=0.0980	agent0	initial_cond	0	0.000000
exp7701	1.30310780e-28	0.000000	0.000000	discard	cycle 52 u=0.0980	agent0	initial_cond	1	-0.000000
exp7702	1.30310780e-28	0.000000	0.000000	discard	cycle 52 u=0.0980	agent0	initial_cond	0	-0.000000
exp7703	1.30310780e-28	0.000000	0.000000	discard	cycle 52 u=0.0980	agent0	initial_cond	0	-0.000000
exp7704	5.45343271e-29	0.000000	0.000000	discard	cycle 52 u=0.0982	agent0	initial_cond	1	-0.000000
exp7705	5.45343271e-29	0.000000	0.000000	discard	cycle 52 u=0.0982	agent0	initial_cond	0	-0.000000
exp7706	5.45343271e-29	0.000000	0.000000	discard	cycle 52 u=0.0982	agent0	initial_cond	0	-0.000000
exp7707	1.23429977e-28	0.000000	0.000000	discard	cycle 52 u=0.0982	agent0	initial_cond	0	0.000000
exp7708	1.23429977e-28	0.000000	0.000000	discard	cycle 52 u=0.0982	agent0	initial_cond	0	0.000000
exp7709	1.23429977e-28	0.000000	0.000000	discard	cycle 52 u=0.0982	agent0	initial_cond	1	0.000000
exp7710	1.88036672e-29	0.000000	0.000000	discard	cycle 52 u=0.0982	agent0	initial_cond	0	0.000000
exp7711	1.88036672e-29	0.000000	0.000000	discard	cycle 52 u=0.0982	agent0	initial_cond	0	0.000000
exp7712	1.88036672e-29	0.000000	0.000000	discard	cycle 52 u=0.0982	agent0	initial_cond	1	0.000000
exp7713	1.91190259e-29	0.000000	-0.000000	discard	cycle 52 u=0.0982	agent0	initial_cond	0	0.000000
exp7714	1.91190259e-29	0.000000	-0.000000	discard	cycle 52 u=0.0982	agent0	initial_cond	0	0.000000
exp7715	1.91190259e-29	0.000000	-0.000000	discard	cycle 52 u=0.0982	agent0	initial_cond	0	0.000000
exp7716	6.13049994e-29	0.000000	0.000000	discard	cycle 52 u=0.0985	agent0	initial_cond	0	0.000000
exp7717	6.13049994e-29	0.000000	0.000000	discard	cycle 52 u=0.0985	agent0	initial_cond	1	0.000000
exp7718	6.13049994e-29	0.000000	0.000000	discard	cycle 52 u=0.0985	agent0	initial_cond	0	0.000000
exp7719	5.49750971e-29	0.000000	0.000000	discard	cycle 52 u=0.0985	agent0	initial_cond	0	0.000000
exp7720	5.49750971e-29	0.000000	0.000000	discard	cycle 52 u=0.0985	agent0	initial_cond	0	0.000000
