exp_id	residual	solution_norm	solution_mean	status	description	agent	design	elapsed_s	solution_energy
exp16442	3.22245147e-29	0.000000	0.000000	discard	cycle 131 u=0.0990	agent0	initial_cond	1	0.000000
exp16443	3.22245147e-29	0.000000	0.000000	discard	cycle 131 u=0.0990	agent0	initial_cond	0	0.000000
exp16444	3.22245147e-29	0.000000	0.000000	discard	cycle 131 u=0.0990	agent0	initial_cond	0	0.000000
exp16445	4.50941488e-29	0.000000	-0.000000	discard	cycle 131 u=0.0990	agent0	initial_cond	0	0.000000
exp16446	4.50941488e-29	0.000000	-0.000000	discard	cycle 131 u=0.0990	agent0	initial_cond	0	0.000000
exp16447	4.50941488e-29	0.000000	-0.000000	discard	cycle 131 u=0.0990	agent0	initial_cond	1	0.000000
exp16448	4.88330883e-29	0.000000	-0.000000	discard	cycle 131 u=0.0990	agent0	initial_cond	0	0.000000
exp16449	4.88330883e-29	0.000000	-0.000000	discard	cycle 131 u=0.0990	agent0	initial_cond	1	0.000000
exp16450	4.88330883e-29	0.000000	-0.000000	discard	cycle 131 u=0.0990	agent0	initial_cond	0	0.000000
exp16451	5.74085541e-29	0.000000	-0.000000	discard	cycle 131 u=0.0995	agent0	initial_cond	0	0.000000
exp16452	5.74085541e-29	0.000000	-0.000000	discard	cycle 131 u=0.0995	agent0	initial_cond	0	0.000000
exp16453	5.74085541e-29	0.000000	-0.000000	discard	cycle 131 u=0.0995	agent0	initial_cond	0	0.000000
exp16454	1.54984578e-28	0.000000	0.000000	discard	cycle 131 u=0.0995	agent0	initial_cond	1	-0.000000
exp16455	1.54984578e-28	0.000000	0.000000	discard	cycle 131 u=0.0995	agent0	initial_cond	0	-0.000000
exp16456	1.54984578e-28	0.000000	0.000000	discard	cycle 131 u=0.0995	agent0	initial_cond	1	-0.000000
exp16457	1.60328418e-29	0.000000	-0.000000	discard	cycle 131 u=0.0995	agent0	initial_cond	0	-0.000000
exp16458	1.60328418e-29	0.000000	-0.000000	discard	cycle 131 u=0.0995	agent0	initial_cond	0	-0.000000
exp16459	1.60328418e-29	0.000000	-0.000000	discard	cycle 131 u=0.0995	agent0	initial_cond	0	-0.000000
exp16460	7.34590618e-29	0.000000	0.000000	discard	cycle 131 u=0.0995	agent0	initial_cond	0	0.000000
exp16461	7.34590618e-29	0.000000	0.000000	discard	cycle 131 u=0.0995	agent0	initial_cond	1	0.000000
exp16462	7.34590618e-29	0.000000	0.000000	discard	cycle 131 u=0.0995	agent0	initial_cond	0	0.000000
exp16463	4.46546993e-29	0.000000	0.000000	discard	cycle 131 u=0.1000	agent0	initial_cond	1	-0.000000
exp16464	4.46546993e-29	0.000000	0.000000	discard	cycle 131 u=0.1000	agent0	initial_cond	0	-0.000000
exp16465	4.46546993e-29	0.000000	0.000000	discard	cycle 131 u=0.1000	agent0	initial_cond	0	-0.000000
exp16466	4.08106752e-29	0.000000	0.000000	discard	cycle 131 u=0.1000	agent0	initial_cond	0	-0.000000
exp16467	4.08106752e-29	0.000000	0.000000	discard	cycle 131 u=0.1000	agent0	initial_cond	0	-0.000000
exp16468	4.08106752e-29	0.000000	0.000000	discard	cycle 131 u=0.1000	agent0	initial_cond	1	-0.000000
exp16469	4.58623706e-29	0.000000	0.000000	discard	cycle 131 u=0.1000	agent0	initial_cond	0	-0.000000
exp16470	4.58623706e-29	0.000000	0.000000	discard	cycle 131 u=0.1000	agent0	initial_cond	1	-0.000000
exp16471	4.58623706e-29	0.000000	0.000000	discard	cycle 131 u=0.1000	agent0	initial_cond	0	-0.000000
exp16472	4.39794337e-29	0.000000	0.000000	discard	cycle 131 u=0.1000	agent0	initial_cond	0	-0.000000
exp16473	4.39794337e-29	0.000000	0.000000	discard	cycle 131 u=0.1000	agent0	initial_cond	1	-0.000000
exp16474	4.39794337e-29	0.000000	0.000000	discard	cycle 131 u=0.1000	agent0	initial_cond	0	-0.000000
exp16475	1.36727475e-28	0.000000	0.000000	discard	cycle 131 u=0.1050	agent0	initial_cond	1	-0.000000
exp16476	1.36727475e-28	0.000000	0.000000	discard	cycle 131 u=0.1050	agent0	initial_cond	0	-0.000000
exp16477	1.36727475e-28	0.000000	0.000000	discard	cycle 131 u=0.1050	agent0	initial_cond	0	-0.000000
exp16478	6.14461376e-29	0.000000	0.000000	discard	cycle 131 u=0.1050	agent0	initial_cond	0	-0.000000
exp16479	6.14461376e-29	0.000000	0.000000	discard	cycle 131 u=0.1050	agent0	initial_cond	0	-0.000000
exp16480	6.14461376e-29	0.000000	0.000000	discard	cycle 131 u=0.1050	agent0	initial_cond	1	-0.000000
exp16481	1.75906666e-28	0.000000	0.000000	discard	cycle 131 u=0.1050	agent0	initial_cond	0	-0.000000
exp16482	1.75906666e-28	0.000000	0.000000	discard	cycle 131 u=0.1050	agent0	initial_cond	1	-0.000000
exp16483	1.75906666e-28	0.000000	0.000000	discard	cycle 131 u=0.1050	agent0	initial_cond	0	-0.000000
exp16484	1.11257917e-28	0.000000	0.000000	discard	cycle 131 u=0.1050	agent0	initial_cond	0	-0.000000
exp16485	1.11257917e-28	0.000000	0.000000	discard	cycle 131 u=0.1050	agent0	initial_cond	0	-0.000000
exp16486	1.11257917e-28	0.000000	0.000000	discard	cycle 131 u=0.1050	agent0	initial_cond	0	-0.000000
exp16487	8.58580947e-29	0.000000	0.000000	discard	cycle 132 u=0.0975	agent0	initial_cond	1	0.000000
exp16488	8.58580947e-29	0.000000	0.000000	discard	cycle 132 u=0.0975	agent0	initial_cond	0	0.000000
exp16489	8.58580947e-29	0.000000	0.000000	discard	cycle 132 u=0.0975	agent0	initial_cond	1	0.000000
exp16490	5.23962023e-29	0.000000	0.000000	discard	cycle 132 u=0.0975	agent0	initial_cond	0	0.000000
exp16491	5.23962023e-29	0.000000	0.000000	discard	cycle 132 u=0.0975	agent0	initial_cond	0	0.000000
exp16492	5.23962023e-29	0.000000	0.000000	discard	cycle 132 u=0.0975	agent0	initial_cond	0	0.000000
exp16493	4.03266298e-29	0.000000	0.000000	discard	cycle 132 u=0.0975	agent0	initial_cond	0	0.000000
exp16494	4.03266298e-29	0.000000	0.000000	discard	cycle 132 u=0.0975	agent0	initial_cond	1	0.000000
exp16495	4.03266298e-29	0.000000	0.000000	discard	cycle 132 u=0.0975	agent0	initial_cond	0	0.000000
exp16496	4.80015937e-29	0.000000	0.000000	discard	cycle 132 u=0.0975	agent0	initial_cond	1	0.000000
exp16497	4.80015937e-29	0.000000	0.000000	discard	cycle 132 u=0.0975	agent0	initial_cond	0	0.000000
r9_2d_k0.0055_p1.44	3.14000129e-20	0.0	0.0	keep	Phase19 2D K=0.0055 p=1.44	agent1	memory	0	0.0
exp16498	4.80015937e-29	0.000000	0.000000	discard	cycle 132 u=0.0975	agent0	initial_cond	0	0.000000
r9_2d_k0.0055_p1.445	3.76881297e-21	0.0	0.0	keep	Phase19 2D K=0.0055 p=1.445	agent1	memory	0	0.0
r9_2d_k0.0055_p1.45	3.58736992e-22	0.0	0.0	keep	Phase19 2D K=0.0055 p=1.45	agent1	memory	0	0.0
exp16499	2.68824537e-29	0.000000	0.000000	discard	cycle 132 u=0.0980	agent0	initial_cond	0	-0.000000
r9_2d_k0.0055_p1.455	2.65990571e-23	0.0	0.0	keep	Phase19 2D K=0.0055 p=1.455	agent1	memory	0	0.0
exp16500	2.68824537e-29	0.000000	0.000000	discard	cycle 132 u=0.0980	agent0	initial_cond	0	-0.000000
r9_2d_k0.0055_p1.46	1.92164222e-24	0.0	0.0	keep	Phase19 2D K=0.0055 p=1.46	agent1	memory	0	0.0
r9_2d_k0.0057_p1.44	1.85042264e-21	0.0	0.0	keep	Phase19 2D K=0.0057 p=1.44	agent1	memory	0	0.0
exp16501	2.68824537e-29	0.000000	0.000000	discard	cycle 132 u=0.0980	agent0	initial_cond	1	-0.000000
r9_2d_k0.0057_p1.445	1.83014703e-22	0.0	0.0	keep	Phase19 2D K=0.0057 p=1.445	agent1	memory	0	0.0
exp16502	6.16758073e-29	0.000000	0.000000	discard	cycle 132 u=0.0980	agent0	initial_cond	0	-0.000000
r9_2d_k0.0057_p1.45	1.42450283e-23	0.0	0.0	keep	Phase19 2D K=0.0057 p=1.45	agent1	memory	0	0.0
r9_2d_k0.0057_p1.455	1.46575638e-24	0.0	0.0	keep	Phase19 2D K=0.0057 p=1.455	agent1	memory	0	0.0
exp16503	6.16758073e-29	0.000000	0.000000	discard	cycle 132 u=0.0980	agent0	initial_cond	0	-0.000000
r9_2d_k0.0057_p1.46	7.47065973e-26	0.0	0.0	keep	Phase19 2D K=0.0057 p=1.46	agent1	memory	0	0.0
exp16504	6.16758073e-29	0.000000	0.000000	discard	cycle 132 u=0.0980	agent0	initial_cond	0	-0.000000
r9_2d_k0.0059_p1.44	8.84528298e-23	0.0	0.0	keep	Phase19 2D K=0.0059 p=1.44	agent1	memory	0	0.0
r9_2d_k0.0059_p1.445	6.81066391e-24	0.0	0.0	keep	Phase19 2D K=0.0059 p=1.445	agent1	memory	0	0.0
exp16505	2.01926478e-29	0.000000	0.000000	discard	cycle 132 u=0.0980	agent0	initial_cond	0	0.000000
r9_2d_k0.0059_p1.45	1.37970498e-24	0.0	0.0	keep	Phase19 2D K=0.0059 p=1.45	agent1	memory	0	0.0
exp16506	2.01926478e-29	0.000000	0.000000	discard	cycle 132 u=0.0980	agent0	initial_cond	0	0.000000
r9_2d_k0.0059_p1.455	6.24938443e-26	0.0	0.0	keep	Phase19 2D K=0.0059 p=1.455	agent1	memory	0	0.0
r9_2d_k0.0059_p1.46	3.73589116e-26	0.0	0.0	keep	Phase19 2D K=0.0059 p=1.46	agent1	memory	0	0.0
exp16507	2.01926478e-29	0.000000	0.000000	discard	cycle 132 u=0.0980	agent0	initial_cond	0	0.000000
r9_2d_k0.0061_p1.44	3.32384654e-24	0.0	0.0	keep	Phase19 2D K=0.0061 p=1.44	agent1	memory	0	0.0
exp16508	1.30310780e-28	0.000000	0.000000	discard	cycle 132 u=0.0980	agent0	initial_cond	1	-0.000000
r9_2d_k0.0061_p1.445	5.37540815e-25	0.0	0.0	keep	Phase19 2D K=0.0061 p=1.445	agent1	memory	0	0.0
r9_2d_k0.0061_p1.45	1.95213146e-26	0.0	0.0	keep	Phase19 2D K=0.0061 p=1.45	agent1	memory	0	0.0
exp16509	1.30310780e-28	0.000000	0.000000	discard	cycle 132 u=0.0980	agent0	initial_cond	0	-0.000000
r9_2d_k0.0061_p1.455	2.13130385e-26	0.0	0.0	keep	Phase19 2D K=0.0061 p=1.455	agent1	memory	0	0.0
exp16510	1.30310780e-28	0.000000	0.000000	discard	cycle 132 u=0.0980	agent0	initial_cond	0	-0.000000
r9_2d_k0.0061_p1.46	5.55725454e-15	0.0	0.0	keep	Phase19 2D K=0.0061 p=1.46	agent1	memory	0	0.0
r9_2d_k0.0063_p1.44	8.40471067e-26	0.0	0.0	keep	Phase19 2D K=0.0063 p=1.44	agent1	memory	0	0.0
exp16511	5.45343271e-29	0.000000	0.000000	discard	cycle 132 u=0.0982	agent0	initial_cond	0	-0.000000
r9_2d_k0.0063_p1.445	5.47041039e-26	0.0	0.0	keep	Phase19 2D K=0.0063 p=1.445	agent1	memory	0	0.0
exp16512	5.45343271e-29	0.000000	0.000000	discard	cycle 132 u=0.0982	agent0	initial_cond	0	-0.000000
r9_2d_k0.0063_p1.45	2.90982114e-26	0.0	0.0	keep	Phase19 2D K=0.0063 p=1.45	agent1	memory	0	0.0
r9_2d_k0.0063_p1.455	5.15731900e-15	0.0	0.0	keep	Phase19 2D K=0.0063 p=1.455	agent1	memory	0	0.0
exp16513	5.45343271e-29	0.000000	0.000000	discard	cycle 132 u=0.0982	agent0	initial_cond	1	-0.000000
r9_2d_k0.0063_p1.46	1.27545336e-15	0.0	0.0	keep	Phase19 2D K=0.0063 p=1.46	agent1	memory	0	0.0
exp16514	1.23429977e-28	0.000000	0.000000	discard	cycle 132 u=0.0982	agent0	initial_cond	0	0.000000
exp16515	1.23429977e-28	0.000000	0.000000	discard	cycle 132 u=0.0982	agent0	initial_cond	1	0.000000
exp16516	1.23429977e-28	0.000000	0.000000	discard	cycle 132 u=0.0982	agent0	initial_cond	0	0.000000
exp16517	1.88036672e-29	0.000000	0.000000	discard	cycle 132 u=0.0982	agent0	initial_cond	0	0.000000
exp16518	1.88036672e-29	0.000000	0.000000	discard	cycle 132 u=0.0982	agent0	initial_cond	0	0.000000
exp16519	1.88036672e-29	0.000000	0.000000	discard	cycle 132 u=0.0982	agent0	initial_cond	0	0.000000
exp16520	1.91190259e-29	0.000000	-0.000000	discard	cycle 132 u=0.0982	agent0	initial_cond	1	0.000000
exp16521	1.91190259e-29	0.000000	-0.000000	discard	cycle 132 u=0.0982	agent0	initial_cond	0	0.000000
exp16522	1.91190259e-29	0.000000	-0.000000	discard	cycle 132 u=0.0982	agent0	initial_cond	1	0.000000
exp16523	6.13049994e-29	0.000000	0.000000	discard	cycle 132 u=0.0985	agent0	initial_cond	0	0.000000
exp16524	6.13049994e-29	0.000000	0.000000	discard	cycle 132 u=0.0985	agent0	initial_cond	0	0.000000
exp16525	6.13049994e-29	0.000000	0.000000	discard	cycle 132 u=0.0985	agent0	initial_cond	0	0.000000
r9_bound_k0.0060	2.43254748e-26	0.0	0.0	keep	Phase20 boundary K=0.0060	agent1	memory	0	0.0
exp16526	5.49750971e-29	0.000000	0.000000	discard	cycle 132 u=0.0985	agent0	initial_cond	0	0.000000
r9_bound_k0.00605	5.84036437e-26	0.0	0.0	keep	Phase20 boundary K=0.00605	agent1	memory	0	0.0
exp16527	5.49750971e-29	0.000000	0.000000	discard	cycle 132 u=0.0985	agent0	initial_cond	1	0.000000
r9_bound_k0.00608	1.37057737e-26	0.0	0.0	keep	Phase20 boundary K=0.00608	agent1	memory	0	0.0
r9_bound_k0.00609	2.07137814e-26	0.0	0.0	keep	Phase20 boundary K=0.00609	agent1	memory	0	0.0
exp16528	5.49750971e-29	0.000000	0.000000	discard	cycle 132 u=0.0985	agent0	initial_cond	0	0.000000
r9_bound_k0.006090	2.07137814e-26	0.0	0.0	keep	Phase20 boundary K=0.006090	agent1	memory	0	0.0
exp16529	4.15642452e-29	0.000000	0.000000	discard	cycle 132 u=0.0985	agent0	initial_cond	1	0.000000
r9_bound_k0.006091	1.20553849e-26	0.0	0.0	keep	Phase20 boundary K=0.006091	agent1	memory	0	0.0
r9_bound_k0.006092	9.72137340e-27	0.0	0.0	keep	Phase20 boundary K=0.006092	agent1	memory	0	0.0
exp16530	4.15642452e-29	0.000000	0.000000	discard	cycle 132 u=0.0985	agent0	initial_cond	0	0.000000
r9_bound_k0.006093	1.61670359e-26	0.0	0.0	keep	Phase20 boundary K=0.006093	agent1	memory	0	0.0
exp16531	4.15642452e-29	0.000000	0.000000	discard	cycle 132 u=0.0985	agent0	initial_cond	0	0.000000
r9_bound_k0.006094	2.02430571e-26	0.0	0.0	keep	Phase20 boundary K=0.006094	agent1	memory	0	0.0
r9_bound_k0.006095	1.46529193e-26	0.0	0.0	keep	Phase20 boundary K=0.006095	agent1	memory	0	0.0
exp16532	2.19292611e-29	0.000000	0.000000	discard	cycle 132 u=0.0985	agent0	initial_cond	0	-0.000000
exp16533	2.19292611e-29	0.000000	0.000000	discard	cycle 132 u=0.0985	agent0	initial_cond	0	-0.000000
exp16534	2.19292611e-29	0.000000	0.000000	discard	cycle 132 u=0.0985	agent0	initial_cond	1	-0.000000
exp16535	4.22491788e-29	0.000000	0.000000	discard	cycle 132 u=0.0990	agent0	initial_cond	0	-0.000000
exp16536	4.22491788e-29	0.000000	0.000000	discard	cycle 132 u=0.0990	agent0	initial_cond	1	-0.000000
exp16537	4.22491788e-29	0.000000	0.000000	discard	cycle 132 u=0.0990	agent0	initial_cond	0	-0.000000
exp16538	3.22245147e-29	0.000000	0.000000	discard	cycle 132 u=0.0990	agent0	initial_cond	0	0.000000
exp16539	3.22245147e-29	0.000000	0.000000	discard	cycle 132 u=0.0990	agent0	initial_cond	0	0.000000
exp16540	3.22245147e-29	0.000000	0.000000	discard	cycle 132 u=0.0990	agent0	initial_cond	0	0.000000
exp16541	4.50941488e-29	0.000000	-0.000000	discard	cycle 132 u=0.0990	agent0	initial_cond	1	0.000000
exp16542	4.50941488e-29	0.000000	-0.000000	discard	cycle 132 u=0.0990	agent0	initial_cond	0	0.000000
exp16543	4.50941488e-29	0.000000	-0.000000	discard	cycle 132 u=0.0990	agent0	initial_cond	1	0.000000
r9_final_k0.0060915	1.51787836e-26	0.0	0.0	keep	Phase21 final K=0.0060915	agent1	memory	0	0.0
r9_final_k0.0060917	2.41961151e-26	0.0	0.0	keep	Phase21 final K=0.0060917	agent1	memory	0	0.0
exp16544	4.88330883e-29	0.000000	-0.000000	discard	cycle 132 u=0.0990	agent0	initial_cond	0	0.000000
r9_final_k0.0060918	7.10657943e-27	0.0	0.0	keep	Phase21 final K=0.0060918	agent1	memory	0	0.0
exp16545	4.88330883e-29	0.000000	-0.000000	discard	cycle 132 u=0.0990	agent0	initial_cond	0	0.000000
r9_final_k0.0060919	8.17726705e-27	0.0	0.0	keep	Phase21 final K=0.0060919	agent1	memory	0	0.0
r9_final_k0.0060920	9.72137340e-27	0.0	0.0	keep	Phase21 final K=0.0060920	agent1	memory	0	0.0
exp16546	4.88330883e-29	0.000000	-0.000000	discard	cycle 132 u=0.0990	agent0	initial_cond	0	0.000000
r9_final_k0.0060921	1.87041061e-26	0.0	0.0	keep	Phase21 final K=0.0060921	agent1	memory	0	0.0
exp16547	5.74085541e-29	0.000000	-0.000000	discard	cycle 132 u=0.0995	agent0	initial_cond	0	0.000000
r9_final_k0.0060922	2.68963460e-26	0.0	0.0	keep	Phase21 final K=0.0060922	agent1	memory	0	0.0
r9_final_k0.0060923	2.41094131e-26	0.0	0.0	keep	Phase21 final K=0.0060923	agent1	memory	0	0.0
exp16548	5.74085541e-29	0.000000	-0.000000	discard	cycle 132 u=0.0995	agent0	initial_cond	1	0.000000
r9_final_k0.0060925	1.12664278e-26	0.0	0.0	keep	Phase21 final K=0.0060925	agent1	memory	0	0.0
exp16549	5.74085541e-29	0.000000	-0.000000	discard	cycle 132 u=0.0995	agent0	initial_cond	0	0.000000
exp16550	1.54984578e-28	0.000000	0.000000	discard	cycle 132 u=0.0995	agent0	initial_cond	1	-0.000000
exp16551	1.54984578e-28	0.000000	0.000000	discard	cycle 132 u=0.0995	agent0	initial_cond	0	-0.000000
exp16552	1.54984578e-28	0.000000	0.000000	discard	cycle 132 u=0.0995	agent0	initial_cond	0	-0.000000
exp16553	1.60328418e-29	0.000000	-0.000000	discard	cycle 132 u=0.0995	agent0	initial_cond	0	-0.000000
exp16554	1.60328418e-29	0.000000	-0.000000	discard	cycle 132 u=0.0995	agent0	initial_cond	0	-0.000000
exp16555	1.60328418e-29	0.000000	-0.000000	discard	cycle 132 u=0.0995	agent0	initial_cond	1	-0.000000
exp16556	7.34590618e-29	0.000000	0.000000	discard	cycle 132 u=0.0995	agent0	initial_cond	0	0.000000
exp16557	7.34590618e-29	0.000000	0.000000	discard	cycle 132 u=0.0995	agent0	initial_cond	1	0.000000
exp16558	7.34590618e-29	0.000000	0.000000	discard	cycle 132 u=0.0995	agent0	initial_cond	0	0.000000
r9_best_k0.00609175	1.93165850e-26	0.0	0.0	keep	Phase22 best K=0.00609175	agent1	memory	0	0.0
exp16559	4.46546993e-29	0.000000	0.000000	discard	cycle 132 u=0.1000	agent0	initial_cond	0	-0.000000
r9_best_k0.00609176	1.43398178e-26	0.0	0.0	keep	Phase22 best K=0.00609176	agent1	memory	0	0.0
r9_best_k0.00609177	1.97868595e-26	0.0	0.0	keep	Phase22 best K=0.00609177	agent1	memory	0	0.0
exp16560	4.46546993e-29	0.000000	0.000000	discard	cycle 132 u=0.1000	agent0	initial_cond	1	-0.000000
r9_best_k0.00609178	2.91909751e-26	0.0	0.0	keep	Phase22 best K=0.00609178	agent1	memory	0	0.0
exp16561	4.46546993e-29	0.000000	0.000000	discard	cycle 132 u=0.1000	agent0	initial_cond	0	-0.000000
r9_best_k0.00609179	1.73255941e-26	0.0	0.0	keep	Phase22 best K=0.00609179	agent1	memory	0	0.0
r9_best_k0.00609180	7.10657943e-27	0.0	0.0	keep	Phase22 best K=0.00609180	agent1	memory	0	0.0
exp16562	4.08106752e-29	0.000000	0.000000	discard	cycle 132 u=0.1000	agent0	initial_cond	1	-0.000000
exp16563	4.08106752e-29	0.000000	0.000000	discard	cycle 132 u=0.1000	agent0	initial_cond	0	-0.000000
exp16564	4.08106752e-29	0.000000	0.000000	discard	cycle 132 u=0.1000	agent0	initial_cond	0	-0.000000
exp16565	4.58623706e-29	0.000000	0.000000	discard	cycle 132 u=0.1000	agent0	initial_cond	0	-0.000000
exp16566	4.58623706e-29	0.000000	0.000000	discard	cycle 132 u=0.1000	agent0	initial_cond	0	-0.000000
exp16567	4.58623706e-29	0.000000	0.000000	discard	cycle 132 u=0.1000	agent0	initial_cond	1	-0.000000
exp16568	4.39794337e-29	0.000000	0.000000	discard	cycle 132 u=0.1000	agent0	initial_cond	0	-0.000000
exp16569	4.39794337e-29	0.000000	0.000000	discard	cycle 132 u=0.1000	agent0	initial_cond	1	-0.000000
exp16570	4.39794337e-29	0.000000	0.000000	discard	cycle 132 u=0.1000	agent0	initial_cond	0	-0.000000
exp16571	1.36727475e-28	0.000000	0.000000	discard	cycle 132 u=0.1050	agent0	initial_cond	0	-0.000000
exp16572	1.36727475e-28	0.000000	0.000000	discard	cycle 132 u=0.1050	agent0	initial_cond	0	-0.000000
r9_final_best_k0.00609180	7.106579e-27	0.0	0.0	keep	R9 Absolute Best: K=0.00609180 at 7.106579e-27	agent1	memory	0	0.0
exp16573	1.36727475e-28	0.000000	0.000000	discard	cycle 132 u=0.1050	agent0	initial_cond	0	-0.000000
exp16574	6.14461376e-29	0.000000	0.000000	discard	cycle 132 u=0.1050	agent0	initial_cond	1	-0.000000
exp16575	6.14461376e-29	0.000000	0.000000	discard	cycle 132 u=0.1050	agent0	initial_cond	0	-0.000000
exp16576	6.14461376e-29	0.000000	0.000000	discard	cycle 132 u=0.1050	agent0	initial_cond	1	-0.000000
exp16577	1.75906666e-28	0.000000	0.000000	discard	cycle 132 u=0.1050	agent0	initial_cond	0	-0.000000
exp16578	1.75906666e-28	0.000000	0.000000	discard	cycle 132 u=0.1050	agent0	initial_cond	0	-0.000000
exp16579	1.75906666e-28	0.000000	0.000000	discard	cycle 132 u=0.1050	agent0	initial_cond	0	-0.000000
exp16580	1.11257917e-28	0.000000	0.000000	discard	cycle 132 u=0.1050	agent0	initial_cond	0	-0.000000
exp16581	1.11257917e-28	0.000000	0.000000	discard	cycle 132 u=0.1050	agent0	initial_cond	1	-0.000000
exp16582	1.11257917e-28	0.000000	0.000000	discard	cycle 132 u=0.1050	agent0	initial_cond	0	-0.000000
exp16583	8.58580947e-29	0.000000	0.000000	discard	cycle 133 u=0.0975	agent0	initial_cond	1	0.000000
exp16584	8.58580947e-29	0.000000	0.000000	discard	cycle 133 u=0.0975	agent0	initial_cond	0	0.000000
exp16585	8.58580947e-29	0.000000	0.000000	discard	cycle 133 u=0.0975	agent0	initial_cond	0	0.000000
exp16586	5.23962023e-29	0.000000	0.000000	discard	cycle 133 u=0.0975	agent0	initial_cond	0	0.000000
exp16587	5.23962023e-29	0.000000	0.000000	discard	cycle 133 u=0.0975	agent0	initial_cond	0	0.000000
exp16588	5.23962023e-29	0.000000	0.000000	discard	cycle 133 u=0.0975	agent0	initial_cond	1	0.000000
exp16589	4.03266298e-29	0.000000	0.000000	discard	cycle 133 u=0.0975	agent0	initial_cond	0	0.000000
exp16590	4.03266298e-29	0.000000	0.000000	discard	cycle 133 u=0.0975	agent0	initial_cond	1	0.000000
exp16591	4.03266298e-29	0.000000	0.000000	discard	cycle 133 u=0.0975	agent0	initial_cond	0	0.000000
exp16592	4.80015937e-29	0.000000	0.000000	discard	cycle 133 u=0.0975	agent0	initial_cond	0	0.000000
exp16593	4.80015937e-29	0.000000	0.000000	discard	cycle 133 u=0.0975	agent0	initial_cond	1	0.000000
exp16594	4.80015937e-29	0.000000	0.000000	discard	cycle 133 u=0.0975	agent0	initial_cond	0	0.000000
exp16595	2.68824537e-29	0.000000	0.000000	discard	cycle 133 u=0.0980	agent0	initial_cond	1	-0.000000
exp16596	2.68824537e-29	0.000000	0.000000	discard	cycle 133 u=0.0980	agent0	initial_cond	0	-0.000000
exp16597	2.68824537e-29	0.000000	0.000000	discard	cycle 133 u=0.0980	agent0	initial_cond	0	-0.000000
exp16598	6.16758073e-29	0.000000	0.000000	discard	cycle 133 u=0.0980	agent0	initial_cond	0	-0.000000
exp16599	6.16758073e-29	0.000000	0.000000	discard	cycle 133 u=0.0980	agent0	initial_cond	0	-0.000000
exp16600	6.16758073e-29	0.000000	0.000000	discard	cycle 133 u=0.0980	agent0	initial_cond	1	-0.000000
exp16601	2.01926478e-29	0.000000	0.000000	discard	cycle 133 u=0.0980	agent0	initial_cond	0	0.000000
exp16602	2.01926478e-29	0.000000	0.000000	discard	cycle 133 u=0.0980	agent0	initial_cond	1	0.000000
exp16603	2.01926478e-29	0.000000	0.000000	discard	cycle 133 u=0.0980	agent0	initial_cond	0	0.000000
exp16604	1.30310780e-28	0.000000	0.000000	discard	cycle 133 u=0.0980	agent0	initial_cond	0	-0.000000
exp16605	1.30310780e-28	0.000000	0.000000	discard	cycle 133 u=0.0980	agent0	initial_cond	0	-0.000000
exp16606	1.30310780e-28	0.000000	0.000000	discard	cycle 133 u=0.0980	agent0	initial_cond	0	-0.000000
exp16607	5.45343271e-29	0.000000	0.000000	discard	cycle 133 u=0.0982	agent0	initial_cond	1	-0.000000
exp16608	5.45343271e-29	0.000000	0.000000	discard	cycle 133 u=0.0982	agent0	initial_cond	0	-0.000000
exp16609	5.45343271e-29	0.000000	0.000000	discard	cycle 133 u=0.0982	agent0	initial_cond	1	-0.000000
exp16610	1.23429977e-28	0.000000	0.000000	discard	cycle 133 u=0.0982	agent0	initial_cond	0	0.000000
