exp_id	residual	solution_norm	solution_mean	status	description	agent	design	elapsed_s	solution_energy
exp16250	3.22245147e-29	0.000000	0.000000	discard	cycle 129 u=0.0990	agent0	initial_cond	0	0.000000
exp16251	3.22245147e-29	0.000000	0.000000	discard	cycle 129 u=0.0990	agent0	initial_cond	1	0.000000
exp16252	3.22245147e-29	0.000000	0.000000	discard	cycle 129 u=0.0990	agent0	initial_cond	0	0.000000
exp16253	4.50941488e-29	0.000000	-0.000000	discard	cycle 129 u=0.0990	agent0	initial_cond	1	0.000000
exp16254	4.50941488e-29	0.000000	-0.000000	discard	cycle 129 u=0.0990	agent0	initial_cond	0	0.000000
exp16255	4.50941488e-29	0.000000	-0.000000	discard	cycle 129 u=0.0990	agent0	initial_cond	0	0.000000
exp16256	4.88330883e-29	0.000000	-0.000000	discard	cycle 129 u=0.0990	agent0	initial_cond	0	0.000000
exp16257	4.88330883e-29	0.000000	-0.000000	discard	cycle 129 u=0.0990	agent0	initial_cond	0	0.000000
exp16258	4.88330883e-29	0.000000	-0.000000	discard	cycle 129 u=0.0990	agent0	initial_cond	1	0.000000
exp16259	5.74085541e-29	0.000000	-0.000000	discard	cycle 129 u=0.0995	agent0	initial_cond	0	0.000000
exp16260	5.74085541e-29	0.000000	-0.000000	discard	cycle 129 u=0.0995	agent0	initial_cond	1	0.000000
exp16261	5.74085541e-29	0.000000	-0.000000	discard	cycle 129 u=0.0995	agent0	initial_cond	0	0.000000
exp16262	1.54984578e-28	0.000000	0.000000	discard	cycle 129 u=0.0995	agent0	initial_cond	0	-0.000000
exp16263	1.54984578e-28	0.000000	0.000000	discard	cycle 129 u=0.0995	agent0	initial_cond	1	-0.000000
exp16264	1.54984578e-28	0.000000	0.000000	discard	cycle 129 u=0.0995	agent0	initial_cond	0	-0.000000
exp16265	1.60328418e-29	0.000000	-0.000000	discard	cycle 129 u=0.0995	agent0	initial_cond	1	-0.000000
exp16266	1.60328418e-29	0.000000	-0.000000	discard	cycle 129 u=0.0995	agent0	initial_cond	0	-0.000000
exp16267	1.60328418e-29	0.000000	-0.000000	discard	cycle 129 u=0.0995	agent0	initial_cond	0	-0.000000
exp16268	7.34590618e-29	0.000000	0.000000	discard	cycle 129 u=0.0995	agent0	initial_cond	0	0.000000
exp16269	7.34590618e-29	0.000000	0.000000	discard	cycle 129 u=0.0995	agent0	initial_cond	0	0.000000
exp16270	7.34590618e-29	0.000000	0.000000	discard	cycle 129 u=0.0995	agent0	initial_cond	1	0.000000
exp16271	4.46546993e-29	0.000000	0.000000	discard	cycle 129 u=0.1000	agent0	initial_cond	0	-0.000000
exp16272	4.46546993e-29	0.000000	0.000000	discard	cycle 129 u=0.1000	agent0	initial_cond	1	-0.000000
exp16273	4.46546993e-29	0.000000	0.000000	discard	cycle 129 u=0.1000	agent0	initial_cond	0	-0.000000
exp16274	4.08106752e-29	0.000000	0.000000	discard	cycle 129 u=0.1000	agent0	initial_cond	0	-0.000000
exp16275	4.08106752e-29	0.000000	0.000000	discard	cycle 129 u=0.1000	agent0	initial_cond	0	-0.000000
exp16276	4.08106752e-29	0.000000	0.000000	discard	cycle 129 u=0.1000	agent0	initial_cond	0	-0.000000
exp16277	4.58623706e-29	0.000000	0.000000	discard	cycle 129 u=0.1000	agent0	initial_cond	1	-0.000000
exp16278	4.58623706e-29	0.000000	0.000000	discard	cycle 129 u=0.1000	agent0	initial_cond	0	-0.000000
exp16279	4.58623706e-29	0.000000	0.000000	discard	cycle 129 u=0.1000	agent0	initial_cond	1	-0.000000
exp16280	4.39794337e-29	0.000000	0.000000	discard	cycle 129 u=0.1000	agent0	initial_cond	0	-0.000000
exp16281	4.39794337e-29	0.000000	0.000000	discard	cycle 129 u=0.1000	agent0	initial_cond	0	-0.000000
exp16282	4.39794337e-29	0.000000	0.000000	discard	cycle 129 u=0.1000	agent0	initial_cond	0	-0.000000
exp16283	1.36727475e-28	0.000000	0.000000	discard	cycle 129 u=0.1050	agent0	initial_cond	0	-0.000000
exp16284	1.36727475e-28	0.000000	0.000000	discard	cycle 129 u=0.1050	agent0	initial_cond	1	-0.000000
exp16285	1.36727475e-28	0.000000	0.000000	discard	cycle 129 u=0.1050	agent0	initial_cond	0	-0.000000
exp16286	6.14461376e-29	0.000000	0.000000	discard	cycle 129 u=0.1050	agent0	initial_cond	0	-0.000000
exp16287	6.14461376e-29	0.000000	0.000000	discard	cycle 129 u=0.1050	agent0	initial_cond	0	-0.000000
exp16288	6.14461376e-29	0.000000	0.000000	discard	cycle 129 u=0.1050	agent0	initial_cond	0	-0.000000
exp16289	1.75906666e-28	0.000000	0.000000	discard	cycle 129 u=0.1050	agent0	initial_cond	1	-0.000000
exp16290	1.75906666e-28	0.000000	0.000000	discard	cycle 129 u=0.1050	agent0	initial_cond	0	-0.000000
exp16291	1.75906666e-28	0.000000	0.000000	discard	cycle 129 u=0.1050	agent0	initial_cond	1	-0.000000
exp16292	1.11257917e-28	0.000000	0.000000	discard	cycle 129 u=0.1050	agent0	initial_cond	0	-0.000000
r9_nmode1_m1	2.25498001e-27	0.0	0.0	keep	Phase15 n_mode=1	agent1	memory	0	0.0
exp16293	1.11257917e-28	0.000000	0.000000	discard	cycle 129 u=0.1050	agent0	initial_cond	0	-0.000000
r9_nmode2_m1	4.62520394e-26	0.0	0.0	keep	Phase15 n_mode=2	agent1	memory	0	0.0
r9_nmode3_m1	1.26839945e-26	0.0	0.0	keep	Phase15 n_mode=3	agent1	memory	0	0.0
exp16294	1.11257917e-28	0.000000	0.000000	discard	cycle 129 u=0.1050	agent0	initial_cond	0	-0.000000
r9_nmode4_m1	6.85519305e-26	0.0	0.0	keep	Phase15 n_mode=4	agent1	memory	0	0.0
exp16295	8.58580947e-29	0.000000	0.000000	discard	cycle 130 u=0.0975	agent0	initial_cond	0	0.000000
r9_nmode5_m1	1.15445154e-26	0.0	0.0	keep	Phase15 n_mode=5	agent1	memory	0	0.0
exp16296	8.58580947e-29	0.000000	0.000000	discard	cycle 130 u=0.0975	agent0	initial_cond	1	0.000000
exp16297	8.58580947e-29	0.000000	0.000000	discard	cycle 130 u=0.0975	agent0	initial_cond	0	0.000000
exp16298	5.23962023e-29	0.000000	0.000000	discard	cycle 130 u=0.0975	agent0	initial_cond	1	0.000000
exp16299	5.23962023e-29	0.000000	0.000000	discard	cycle 130 u=0.0975	agent0	initial_cond	0	0.000000
exp16300	5.23962023e-29	0.000000	0.000000	discard	cycle 130 u=0.0975	agent0	initial_cond	0	0.000000
exp16301	4.03266298e-29	0.000000	0.000000	discard	cycle 130 u=0.0975	agent0	initial_cond	0	0.000000
exp16302	4.03266298e-29	0.000000	0.000000	discard	cycle 130 u=0.0975	agent0	initial_cond	0	0.000000
exp16303	4.03266298e-29	0.000000	0.000000	discard	cycle 130 u=0.0975	agent0	initial_cond	1	0.000000
exp16304	4.80015937e-29	0.000000	0.000000	discard	cycle 130 u=0.0975	agent0	initial_cond	0	0.000000
exp16305	4.80015937e-29	0.000000	0.000000	discard	cycle 130 u=0.0975	agent0	initial_cond	1	0.000000
exp16306	4.80015937e-29	0.000000	0.000000	discard	cycle 130 u=0.0975	agent0	initial_cond	0	0.000000
r9_breakthrough_modes1_global	2.254980e-27	0.0	0.0	keep	R9 Breakthrough: modes=1 global minimum	agent1	memory	0	0.0
exp16307	2.68824537e-29	0.000000	0.000000	discard	cycle 130 u=0.0980	agent0	initial_cond	0	-0.000000
exp16308	2.68824537e-29	0.000000	0.000000	discard	cycle 130 u=0.0980	agent0	initial_cond	0	-0.000000
exp16309	2.68824537e-29	0.000000	0.000000	discard	cycle 130 u=0.0980	agent0	initial_cond	0	-0.000000
exp16310	6.16758073e-29	0.000000	0.000000	discard	cycle 130 u=0.0980	agent0	initial_cond	1	-0.000000
exp16311	6.16758073e-29	0.000000	0.000000	discard	cycle 130 u=0.0980	agent0	initial_cond	0	-0.000000
exp16312	6.16758073e-29	0.000000	0.000000	discard	cycle 130 u=0.0980	agent0	initial_cond	1	-0.000000
exp16313	2.01926478e-29	0.000000	0.000000	discard	cycle 130 u=0.0980	agent0	initial_cond	0	0.000000
exp16314	2.01926478e-29	0.000000	0.000000	discard	cycle 130 u=0.0980	agent0	initial_cond	0	0.000000
exp16315	2.01926478e-29	0.000000	0.000000	discard	cycle 130 u=0.0980	agent0	initial_cond	0	0.000000
exp16316	1.30310780e-28	0.000000	0.000000	discard	cycle 130 u=0.0980	agent0	initial_cond	0	-0.000000
exp16317	1.30310780e-28	0.000000	0.000000	discard	cycle 130 u=0.0980	agent0	initial_cond	1	-0.000000
exp16318	1.30310780e-28	0.000000	0.000000	discard	cycle 130 u=0.0980	agent0	initial_cond	0	-0.000000
exp16319	5.45343271e-29	0.000000	0.000000	discard	cycle 130 u=0.0982	agent0	initial_cond	0	-0.000000
exp16320	5.45343271e-29	0.000000	0.000000	discard	cycle 130 u=0.0982	agent0	initial_cond	0	-0.000000
exp16321	5.45343271e-29	0.000000	0.000000	discard	cycle 130 u=0.0982	agent0	initial_cond	0	-0.000000
r9_tol1e-12_m1	1.38078530e-14	0.0	0.0	keep	Phase16 tol=1e-12	agent1	memory	0	0.0
exp16322	1.23429977e-28	0.000000	0.000000	discard	cycle 130 u=0.0982	agent0	initial_cond	1	0.000000
r9_tol1e-13_m1	1.38078530e-14	0.0	0.0	keep	Phase16 tol=1e-13	agent1	memory	0	0.0
r9_tol1e-14_m1	2.25498001e-27	0.0	0.0	keep	Phase16 tol=1e-14	agent1	memory	0	0.0
exp16323	1.23429977e-28	0.000000	0.000000	discard	cycle 130 u=0.0982	agent0	initial_cond	0	0.000000
r9_tol1e-15_m1	2.25498001e-27	0.0	0.0	keep	Phase16 tol=1e-15	agent1	memory	0	0.0
exp16324	1.23429977e-28	0.000000	0.000000	discard	cycle 130 u=0.0982	agent0	initial_cond	1	0.000000
r9_tol1e-16_m1	2.25498001e-27	0.0	0.0	keep	Phase16 tol=1e-16	agent1	memory	0	0.0
r9_tol1e-18_m1	2.25498001e-27	0.0	0.0	keep	Phase16 tol=1e-18	agent1	memory	0	0.0
exp16325	1.88036672e-29	0.000000	0.000000	discard	cycle 130 u=0.0982	agent0	initial_cond	0	0.000000
r9_tol1e-20_m1	2.25498001e-27	0.0	0.0	keep	Phase16 tol=1e-20	agent1	memory	0	0.0
exp16326	1.88036672e-29	0.000000	0.000000	discard	cycle 130 u=0.0982	agent0	initial_cond	0	0.000000
exp16327	1.88036672e-29	0.000000	0.000000	discard	cycle 130 u=0.0982	agent0	initial_cond	0	0.000000
exp16328	1.91190259e-29	0.000000	-0.000000	discard	cycle 130 u=0.0982	agent0	initial_cond	0	0.000000
exp16329	1.91190259e-29	0.000000	-0.000000	discard	cycle 130 u=0.0982	agent0	initial_cond	1	0.000000
exp16330	1.91190259e-29	0.000000	-0.000000	discard	cycle 130 u=0.0982	agent0	initial_cond	0	0.000000
exp16331	6.13049994e-29	0.000000	0.000000	discard	cycle 130 u=0.0985	agent0	initial_cond	1	0.000000
exp16332	6.13049994e-29	0.000000	0.000000	discard	cycle 130 u=0.0985	agent0	initial_cond	0	0.000000
exp16333	6.13049994e-29	0.000000	0.000000	discard	cycle 130 u=0.0985	agent0	initial_cond	0	0.000000
exp16334	5.49750971e-29	0.000000	0.000000	discard	cycle 130 u=0.0985	agent0	initial_cond	0	0.000000
exp16335	5.49750971e-29	0.000000	0.000000	discard	cycle 130 u=0.0985	agent0	initial_cond	0	0.000000
exp16336	5.49750971e-29	0.000000	0.000000	discard	cycle 130 u=0.0985	agent0	initial_cond	1	0.000000
exp16337	4.15642452e-29	0.000000	0.000000	discard	cycle 130 u=0.0985	agent0	initial_cond	0	0.000000
exp16338	4.15642452e-29	0.000000	0.000000	discard	cycle 130 u=0.0985	agent0	initial_cond	1	0.000000
exp16339	4.15642452e-29	0.000000	0.000000	discard	cycle 130 u=0.0985	agent0	initial_cond	0	0.000000
exp16340	2.19292611e-29	0.000000	0.000000	discard	cycle 130 u=0.0985	agent0	initial_cond	0	-0.000000
exp16341	2.19292611e-29	0.000000	0.000000	discard	cycle 130 u=0.0985	agent0	initial_cond	0	-0.000000
exp16342	2.19292611e-29	0.000000	0.000000	discard	cycle 130 u=0.0985	agent0	initial_cond	0	-0.000000
exp16343	4.22491788e-29	0.000000	0.000000	discard	cycle 130 u=0.0990	agent0	initial_cond	1	-0.000000
exp16344	4.22491788e-29	0.000000	0.000000	discard	cycle 130 u=0.0990	agent0	initial_cond	0	-0.000000
r9_neg_k-0.010	7.74214603e-16	0.0	0.0	keep	Phase17 K=-0.010	agent1	memory	0	0.0
exp16345	4.22491788e-29	0.000000	0.000000	discard	cycle 130 u=0.0990	agent0	initial_cond	1	-0.000000
r9_neg_k-0.008	7.21661875e-22	0.0	0.0	keep	Phase17 K=-0.008	agent1	memory	0	0.0
exp16346	3.22245147e-29	0.000000	0.000000	discard	cycle 130 u=0.0990	agent0	initial_cond	0	0.000000
r9_neg_k-0.006	4.72509956e-26	0.0	0.0	keep	Phase17 K=-0.006	agent1	memory	0	0.0
r9_neg_k-0.0061	1.33644978e-26	0.0	0.0	keep	Phase17 K=-0.0061	agent1	memory	0	0.0
exp16347	3.22245147e-29	0.000000	0.000000	discard	cycle 130 u=0.0990	agent0	initial_cond	0	0.000000
r9_neg_k-0.005	3.87264858e-20	0.0	0.0	keep	Phase17 K=-0.005	agent1	memory	0	0.0
exp16348	3.22245147e-29	0.000000	0.000000	discard	cycle 130 u=0.0990	agent0	initial_cond	0	0.000000
r9_neg_k-0.002	2.85208546e-18	0.0	0.0	keep	Phase17 K=-0.002	agent1	memory	0	0.0
r9_neg_k0.0	2.40040897e-15	0.0	0.0	keep	Phase17 K=0.0	agent1	memory	0	0.0
exp16349	4.50941488e-29	0.000000	-0.000000	discard	cycle 130 u=0.0990	agent0	initial_cond	0	0.000000
r9_neg_k0.002	2.83178549e-18	0.0	0.0	keep	Phase17 K=0.002	agent1	memory	0	0.0
exp16350	4.50941488e-29	0.000000	-0.000000	discard	cycle 130 u=0.0990	agent0	initial_cond	1	0.000000
exp16351	4.50941488e-29	0.000000	-0.000000	discard	cycle 130 u=0.0990	agent0	initial_cond	0	0.000000
exp16352	4.88330883e-29	0.000000	-0.000000	discard	cycle 130 u=0.0990	agent0	initial_cond	0	0.000000
exp16353	4.88330883e-29	0.000000	-0.000000	discard	cycle 130 u=0.0990	agent0	initial_cond	0	0.000000
exp16354	4.88330883e-29	0.000000	-0.000000	discard	cycle 130 u=0.0990	agent0	initial_cond	0	0.000000
exp16355	5.74085541e-29	0.000000	-0.000000	discard	cycle 130 u=0.0995	agent0	initial_cond	1	0.000000
exp16356	5.74085541e-29	0.000000	-0.000000	discard	cycle 130 u=0.0995	agent0	initial_cond	0	0.000000
exp16357	5.74085541e-29	0.000000	-0.000000	discard	cycle 130 u=0.0995	agent0	initial_cond	1	0.000000
exp16358	1.54984578e-28	0.000000	0.000000	discard	cycle 130 u=0.0995	agent0	initial_cond	0	-0.000000
exp16359	1.54984578e-28	0.000000	0.000000	discard	cycle 130 u=0.0995	agent0	initial_cond	0	-0.000000
exp16360	1.54984578e-28	0.000000	0.000000	discard	cycle 130 u=0.0995	agent0	initial_cond	0	-0.000000
r9_phase0.5_broad	8.09020342e-26	0.0	0.0	keep	Phase18 phase=0.5 broad	agent1	memory	0	0.0
exp16361	1.60328418e-29	0.000000	-0.000000	discard	cycle 130 u=0.0995	agent0	initial_cond	0	-0.000000
r9_phase0.75_broad	9.68607667e-17	0.0	0.0	keep	Phase18 phase=0.75 broad	agent1	memory	0	0.0
exp16362	1.60328418e-29	0.000000	-0.000000	discard	cycle 130 u=0.0995	agent0	initial_cond	1	-0.000000
r9_phase1.0_broad	9.06417973e-22	0.0	0.0	keep	Phase18 phase=1.0 broad	agent1	memory	0	0.0
r9_phase1.25_broad	9.63118070e-18	0.0	0.0	keep	Phase18 phase=1.25 broad	agent1	memory	0	0.0
exp16363	1.60328418e-29	0.000000	-0.000000	discard	cycle 130 u=0.0995	agent0	initial_cond	0	-0.000000
r9_phase1.5_broad	1.25918349e-22	0.0	0.0	keep	Phase18 phase=1.5 broad	agent1	memory	0	0.0
exp16364	7.34590618e-29	0.000000	0.000000	discard	cycle 130 u=0.0995	agent0	initial_cond	1	0.000000
r9_phase1.75_broad	6.09988468e-17	0.0	0.0	keep	Phase18 phase=1.75 broad	agent1	memory	0	0.0
r9_phase2.0_broad	2.50425601e-26	0.0	0.0	keep	Phase18 phase=2.0 broad	agent1	memory	0	0.0
exp16365	7.34590618e-29	0.000000	0.000000	discard	cycle 130 u=0.0995	agent0	initial_cond	0	0.000000
r9_phase2.25_broad	1.70096023e-19	0.0	0.0	keep	Phase18 phase=2.25 broad	agent1	memory	0	0.0
exp16366	7.34590618e-29	0.000000	0.000000	discard	cycle 130 u=0.0995	agent0	initial_cond	0	0.000000
r9_phase2.5_broad	1.08876752e-15	0.0	0.0	keep	Phase18 phase=2.5 broad	agent1	memory	0	0.0
exp16367	4.46546993e-29	0.000000	0.000000	discard	cycle 130 u=0.1000	agent0	initial_cond	0	-0.000000
exp16368	4.46546993e-29	0.000000	0.000000	discard	cycle 130 u=0.1000	agent0	initial_cond	0	-0.000000
exp16369	4.46546993e-29	0.000000	0.000000	discard	cycle 130 u=0.1000	agent0	initial_cond	1	-0.000000
exp16370	4.08106752e-29	0.000000	0.000000	discard	cycle 130 u=0.1000	agent0	initial_cond	0	-0.000000
exp16371	4.08106752e-29	0.000000	0.000000	discard	cycle 130 u=0.1000	agent0	initial_cond	1	-0.000000
exp16372	4.08106752e-29	0.000000	0.000000	discard	cycle 130 u=0.1000	agent0	initial_cond	0	-0.000000
exp16373	4.58623706e-29	0.000000	0.000000	discard	cycle 130 u=0.1000	agent0	initial_cond	0	-0.000000
exp16374	4.58623706e-29	0.000000	0.000000	discard	cycle 130 u=0.1000	agent0	initial_cond	0	-0.000000
exp16375	4.58623706e-29	0.000000	0.000000	discard	cycle 130 u=0.1000	agent0	initial_cond	0	-0.000000
exp16376	4.39794337e-29	0.000000	0.000000	discard	cycle 130 u=0.1000	agent0	initial_cond	1	-0.000000
exp16377	4.39794337e-29	0.000000	0.000000	discard	cycle 130 u=0.1000	agent0	initial_cond	0	-0.000000
exp16378	4.39794337e-29	0.000000	0.000000	discard	cycle 130 u=0.1000	agent0	initial_cond	0	-0.000000
exp16379	1.36727475e-28	0.000000	0.000000	discard	cycle 130 u=0.1050	agent0	initial_cond	0	-0.000000
exp16380	1.36727475e-28	0.000000	0.000000	discard	cycle 130 u=0.1050	agent0	initial_cond	0	-0.000000
exp16381	1.36727475e-28	0.000000	0.000000	discard	cycle 130 u=0.1050	agent0	initial_cond	1	-0.000000
exp16382	6.14461376e-29	0.000000	0.000000	discard	cycle 130 u=0.1050	agent0	initial_cond	0	-0.000000
exp16383	6.14461376e-29	0.000000	0.000000	discard	cycle 130 u=0.1050	agent0	initial_cond	1	-0.000000
exp16384	6.14461376e-29	0.000000	0.000000	discard	cycle 130 u=0.1050	agent0	initial_cond	0	-0.000000
exp16385	1.75906666e-28	0.000000	0.000000	discard	cycle 130 u=0.1050	agent0	initial_cond	0	-0.000000
exp16386	1.75906666e-28	0.000000	0.000000	discard	cycle 130 u=0.1050	agent0	initial_cond	0	-0.000000
exp16387	1.75906666e-28	0.000000	0.000000	discard	cycle 130 u=0.1050	agent0	initial_cond	0	-0.000000
exp16388	1.11257917e-28	0.000000	0.000000	discard	cycle 130 u=0.1050	agent0	initial_cond	1	-0.000000
exp16389	1.11257917e-28	0.000000	0.000000	discard	cycle 130 u=0.1050	agent0	initial_cond	0	-0.000000
exp16390	1.11257917e-28	0.000000	0.000000	discard	cycle 130 u=0.1050	agent0	initial_cond	1	-0.000000
exp16391	8.58580947e-29	0.000000	0.000000	discard	cycle 131 u=0.0975	agent0	initial_cond	0	0.000000
exp16392	8.58580947e-29	0.000000	0.000000	discard	cycle 131 u=0.0975	agent0	initial_cond	0	0.000000
exp16393	8.58580947e-29	0.000000	0.000000	discard	cycle 131 u=0.0975	agent0	initial_cond	0	0.000000
exp16394	5.23962023e-29	0.000000	0.000000	discard	cycle 131 u=0.0975	agent0	initial_cond	0	0.000000
exp16395	5.23962023e-29	0.000000	0.000000	discard	cycle 131 u=0.0975	agent0	initial_cond	1	0.000000
exp16396	5.23962023e-29	0.000000	0.000000	discard	cycle 131 u=0.0975	agent0	initial_cond	0	0.000000
exp16397	4.03266298e-29	0.000000	0.000000	discard	cycle 131 u=0.0975	agent0	initial_cond	1	0.000000
exp16398	4.03266298e-29	0.000000	0.000000	discard	cycle 131 u=0.0975	agent0	initial_cond	0	0.000000
exp16399	4.03266298e-29	0.000000	0.000000	discard	cycle 131 u=0.0975	agent0	initial_cond	0	0.000000
exp16400	4.80015937e-29	0.000000	0.000000	discard	cycle 131 u=0.0975	agent0	initial_cond	0	0.000000
exp16401	4.80015937e-29	0.000000	0.000000	discard	cycle 131 u=0.0975	agent0	initial_cond	0	0.000000
exp16402	4.80015937e-29	0.000000	0.000000	discard	cycle 131 u=0.0975	agent0	initial_cond	1	0.000000
exp16403	2.68824537e-29	0.000000	0.000000	discard	cycle 131 u=0.0980	agent0	initial_cond	0	-0.000000
exp16404	2.68824537e-29	0.000000	0.000000	discard	cycle 131 u=0.0980	agent0	initial_cond	0	-0.000000
exp16405	2.68824537e-29	0.000000	0.000000	discard	cycle 131 u=0.0980	agent0	initial_cond	0	-0.000000
exp16406	6.16758073e-29	0.000000	0.000000	discard	cycle 131 u=0.0980	agent0	initial_cond	0	-0.000000
exp16407	6.16758073e-29	0.000000	0.000000	discard	cycle 131 u=0.0980	agent0	initial_cond	1	-0.000000
exp16408	6.16758073e-29	0.000000	0.000000	discard	cycle 131 u=0.0980	agent0	initial_cond	0	-0.000000
exp16409	2.01926478e-29	0.000000	0.000000	discard	cycle 131 u=0.0980	agent0	initial_cond	1	0.000000
exp16410	2.01926478e-29	0.000000	0.000000	discard	cycle 131 u=0.0980	agent0	initial_cond	0	0.000000
exp16411	2.01926478e-29	0.000000	0.000000	discard	cycle 131 u=0.0980	agent0	initial_cond	0	0.000000
exp16412	1.30310780e-28	0.000000	0.000000	discard	cycle 131 u=0.0980	agent0	initial_cond	0	-0.000000
exp16413	1.30310780e-28	0.000000	0.000000	discard	cycle 131 u=0.0980	agent0	initial_cond	0	-0.000000
exp16414	1.30310780e-28	0.000000	0.000000	discard	cycle 131 u=0.0980	agent0	initial_cond	1	-0.000000
exp16415	5.45343271e-29	0.000000	0.000000	discard	cycle 131 u=0.0982	agent0	initial_cond	0	-0.000000
exp16416	5.45343271e-29	0.000000	0.000000	discard	cycle 131 u=0.0982	agent0	initial_cond	1	-0.000000
exp16417	5.45343271e-29	0.000000	0.000000	discard	cycle 131 u=0.0982	agent0	initial_cond	0	-0.000000
exp16418	1.23429977e-28	0.000000	0.000000	discard	cycle 131 u=0.0982	agent0	initial_cond	0	0.000000
exp16419	1.23429977e-28	0.000000	0.000000	discard	cycle 131 u=0.0982	agent0	initial_cond	0	0.000000
exp16420	1.23429977e-28	0.000000	0.000000	discard	cycle 131 u=0.0982	agent0	initial_cond	0	0.000000
exp16421	1.88036672e-29	0.000000	0.000000	discard	cycle 131 u=0.0982	agent0	initial_cond	1	0.000000
exp16422	1.88036672e-29	0.000000	0.000000	discard	cycle 131 u=0.0982	agent0	initial_cond	0	0.000000
exp16423	1.88036672e-29	0.000000	0.000000	discard	cycle 131 u=0.0982	agent0	initial_cond	1	0.000000
exp16424	1.91190259e-29	0.000000	-0.000000	discard	cycle 131 u=0.0982	agent0	initial_cond	0	0.000000
exp16425	1.91190259e-29	0.000000	-0.000000	discard	cycle 131 u=0.0982	agent0	initial_cond	0	0.000000
exp16426	1.91190259e-29	0.000000	-0.000000	discard	cycle 131 u=0.0982	agent0	initial_cond	1	0.000000
exp16427	6.13049994e-29	0.000000	0.000000	discard	cycle 131 u=0.0985	agent0	initial_cond	0	0.000000
exp16428	6.13049994e-29	0.000000	0.000000	discard	cycle 131 u=0.0985	agent0	initial_cond	1	0.000000
exp16429	6.13049994e-29	0.000000	0.000000	discard	cycle 131 u=0.0985	agent0	initial_cond	0	0.000000
exp16430	5.49750971e-29	0.000000	0.000000	discard	cycle 131 u=0.0985	agent0	initial_cond	0	0.000000
exp16431	5.49750971e-29	0.000000	0.000000	discard	cycle 131 u=0.0985	agent0	initial_cond	0	0.000000
exp16432	5.49750971e-29	0.000000	0.000000	discard	cycle 131 u=0.0985	agent0	initial_cond	0	0.000000
exp16433	4.15642452e-29	0.000000	0.000000	discard	cycle 131 u=0.0985	agent0	initial_cond	1	0.000000
exp16434	4.15642452e-29	0.000000	0.000000	discard	cycle 131 u=0.0985	agent0	initial_cond	0	0.000000
exp16435	4.15642452e-29	0.000000	0.000000	discard	cycle 131 u=0.0985	agent0	initial_cond	1	0.000000
exp16436	2.19292611e-29	0.000000	0.000000	discard	cycle 131 u=0.0985	agent0	initial_cond	0	-0.000000
exp16437	2.19292611e-29	0.000000	0.000000	discard	cycle 131 u=0.0985	agent0	initial_cond	0	-0.000000
exp16438	2.19292611e-29	0.000000	0.000000	discard	cycle 131 u=0.0985	agent0	initial_cond	0	-0.000000
exp16439	4.22491788e-29	0.000000	0.000000	discard	cycle 131 u=0.0990	agent0	initial_cond	0	-0.000000
exp16440	4.22491788e-29	0.000000	0.000000	discard	cycle 131 u=0.0990	agent0	initial_cond	1	-0.000000
exp16441	4.22491788e-29	0.000000	0.000000	discard	cycle 131 u=0.0990	agent0	initial_cond	0	-0.000000
