exp_id	residual	solution_norm	solution_mean	status	description	agent	design	elapsed_s	solution_energy
exp10191	1.56522442e-17	0.070278	-0.000000	discard	Refine alt u=0.220 a=0.42 p=1.18	manual	memory	1	0.000097
exp10192	1.91190259e-29	0.000000	-0.000000	discard	cycle 72 u=0.0982	agent0	initial_cond	1	0.000000
exp10193	1.91190259e-29	0.000000	-0.000000	discard	cycle 72 u=0.0982	agent0	initial_cond	0	0.000000
exp10193	7.24806035e-17	0.070278	-0.000000	discard	Refine alt u=0.220 a=0.42 p=1.20	manual	memory	0	0.000097
exp10194	1.91190259e-29	0.000000	-0.000000	discard	cycle 72 u=0.0982	agent0	initial_cond	0	0.000000
exp10195	2.66497696e-17	0.070278	-0.000000	discard	Refine alt u=0.220 a=0.43 p=1.10	manual	memory	0	0.000097
exp10196	6.13049994e-29	0.000000	0.000000	discard	cycle 72 u=0.0985	agent0	initial_cond	0	0.000000
exp10197	1.81617783e-17	0.070278	-0.000000	discard	Refine alt u=0.220 a=0.43 p=1.12	manual	memory	0	0.000097
exp10198	6.13049994e-29	0.000000	0.000000	discard	cycle 72 u=0.0985	agent0	initial_cond	0	0.000000
exp10199	2.67982027e-17	0.070278	-0.000000	discard	Refine alt u=0.220 a=0.43 p=1.15	manual	memory	0	0.000097
exp10200	6.13049994e-29	0.000000	0.000000	discard	cycle 72 u=0.0985	agent0	initial_cond	1	0.000000
exp10201	5.49750971e-29	0.000000	0.000000	discard	cycle 72 u=0.0985	agent0	initial_cond	0	0.000000
exp10201	1.56434086e-17	0.070278	-0.000000	discard	Refine alt u=0.220 a=0.43 p=1.18	manual	memory	0	0.000097
exp10202	5.49750971e-29	0.000000	0.000000	discard	cycle 72 u=0.0985	agent0	initial_cond	0	0.000000
exp10203	3.56457801e-17	0.070278	-0.000000	discard	Refine alt u=0.220 a=0.43 p=1.20	manual	memory	0	0.000097
exp10204	5.49750971e-29	0.000000	0.000000	discard	cycle 72 u=0.0985	agent0	initial_cond	1	0.000000
exp10205	1.78280878e-17	0.070278	-0.000000	discard	Refine alt u=0.220 a=0.44 p=1.10	manual	memory	0	0.000097
exp10206	4.15642452e-29	0.000000	0.000000	discard	cycle 72 u=0.0985	agent0	initial_cond	0	0.000000
exp10207	6.69589264e-17	0.070278	-0.000000	discard	Refine alt u=0.220 a=0.44 p=1.12	manual	memory	0	0.000097
exp10208	4.15642452e-29	0.000000	0.000000	discard	cycle 72 u=0.0985	agent0	initial_cond	1	0.000000
exp10209	2.21113961e-17	0.070278	-0.000000	discard	Refine alt u=0.220 a=0.44 p=1.15	manual	memory	0	0.000097
exp10209	4.15642452e-29	0.000000	0.000000	discard	cycle 72 u=0.0985	agent0	initial_cond	0	0.000000
exp10210	2.19292611e-29	0.000000	0.000000	discard	cycle 72 u=0.0985	agent0	initial_cond	0	-0.000000
exp10211	5.84678020e-17	0.070278	-0.000000	discard	Refine alt u=0.220 a=0.44 p=1.18	manual	memory	0	0.000097
exp10212	2.19292611e-29	0.000000	0.000000	discard	cycle 72 u=0.0985	agent0	initial_cond	1	-0.000000
exp10213	7.95478201e-17	0.070278	-0.000000	discard	Refine alt u=0.220 a=0.44 p=1.20	manual	memory	0	0.000097
exp10214	2.19292611e-29	0.000000	0.000000	discard	cycle 72 u=0.0985	agent0	initial_cond	0	-0.000000
exp10215	1.32150567e-17	0.070278	-0.000000	discard	Refine alt u=0.220 a=0.45 p=1.10	manual	memory	0	0.000097
exp10216	4.22491788e-29	0.000000	0.000000	discard	cycle 72 u=0.0990	agent0	initial_cond	1	-0.000000
exp10217	4.22491788e-29	0.000000	0.000000	discard	cycle 72 u=0.0990	agent0	initial_cond	0	-0.000000
exp10217	2.66182695e-17	0.070278	-0.000000	discard	Refine alt u=0.220 a=0.45 p=1.12	manual	memory	0	0.000097
exp10218	4.22491788e-29	0.000000	0.000000	discard	cycle 72 u=0.0990	agent0	initial_cond	0	-0.000000
exp10219	2.84704972e-17	0.070278	-0.000000	discard	Refine alt u=0.220 a=0.45 p=1.15	manual	memory	0	0.000097
exp10220	3.22245147e-29	0.000000	0.000000	discard	cycle 72 u=0.0990	agent0	initial_cond	1	0.000000
exp10221	2.83543351e-17	0.070278	-0.000000	discard	Refine alt u=0.220 a=0.45 p=1.18	manual	memory	0	0.000097
exp10222	3.22245147e-29	0.000000	0.000000	discard	cycle 72 u=0.0990	agent0	initial_cond	0	0.000000
exp10223	9.10003833e-17	0.070278	-0.000000	discard	Refine alt u=0.220 a=0.45 p=1.20	manual	memory	0	0.000097
exp10224	3.22245147e-29	0.000000	0.000000	discard	cycle 72 u=0.0990	agent0	initial_cond	0	0.000000
exp10225	3.35808445e-17	0.070278	-0.000000	discard	Refine alt u=0.220 a=0.46 p=1.10	manual	memory	0	0.000097
exp10225	4.50941488e-29	0.000000	-0.000000	discard	cycle 72 u=0.0990	agent0	initial_cond	0	0.000000
exp10226	4.50941488e-29	0.000000	-0.000000	discard	cycle 72 u=0.0990	agent0	initial_cond	0	0.000000
exp10227	1.93644528e-17	0.070278	-0.000000	discard	Refine alt u=0.220 a=0.46 p=1.12	manual	memory	0	0.000097
exp10228	4.50941488e-29	0.000000	-0.000000	discard	cycle 72 u=0.0990	agent0	initial_cond	1	0.000000
exp10229	4.79512864e-17	0.070278	-0.000000	discard	Refine alt u=0.220 a=0.46 p=1.15	manual	memory	0	0.000097
exp10230	4.88330883e-29	0.000000	-0.000000	discard	cycle 72 u=0.0990	agent0	initial_cond	0	0.000000
exp10231	1.57539337e-17	0.070278	-0.000000	discard	Refine alt u=0.220 a=0.46 p=1.18	manual	memory	0	0.000097
exp10232	4.88330883e-29	0.000000	-0.000000	discard	cycle 72 u=0.0990	agent0	initial_cond	0	0.000000
exp10233	5.15238393e-17	0.070278	-0.000000	discard	Refine alt u=0.220 a=0.46 p=1.20	manual	memory	0	0.000097
exp10233	4.88330883e-29	0.000000	-0.000000	discard	cycle 72 u=0.0990	agent0	initial_cond	0	0.000000
exp10234	5.74085541e-29	0.000000	-0.000000	discard	cycle 72 u=0.0995	agent0	initial_cond	0	0.000000
exp10235	5.74085541e-29	0.000000	-0.000000	discard	cycle 72 u=0.0995	agent0	initial_cond	1	0.000000
exp10236	5.74085541e-29	0.000000	-0.000000	discard	cycle 72 u=0.0995	agent0	initial_cond	0	0.000000
exp10237	1.54984578e-28	0.000000	0.000000	discard	cycle 72 u=0.0995	agent0	initial_cond	0	-0.000000
exp10238	1.54984578e-28	0.000000	0.000000	discard	cycle 72 u=0.0995	agent0	initial_cond	0	-0.000000
exp10239	1.54984578e-28	0.000000	0.000000	discard	cycle 72 u=0.0995	agent0	initial_cond	0	-0.000000
exp10240	1.60328418e-29	0.000000	-0.000000	discard	cycle 72 u=0.0995	agent0	initial_cond	1	-0.000000
exp10241	1.60328418e-29	0.000000	-0.000000	discard	cycle 72 u=0.0995	agent0	initial_cond	0	-0.000000
exp10242	1.60328418e-29	0.000000	-0.000000	discard	cycle 72 u=0.0995	agent0	initial_cond	0	-0.000000
exp10243	7.34590618e-29	0.000000	0.000000	discard	cycle 72 u=0.0995	agent0	initial_cond	0	0.000000
exp10244	7.34590618e-29	0.000000	0.000000	discard	cycle 72 u=0.0995	agent0	initial_cond	0	0.000000
exp10245	7.34590618e-29	0.000000	0.000000	discard	cycle 72 u=0.0995	agent0	initial_cond	1	0.000000
exp10246	4.46546993e-29	0.000000	0.000000	discard	cycle 72 u=0.1000	agent0	initial_cond	0	-0.000000
exp10247	4.46546993e-29	0.000000	0.000000	discard	cycle 72 u=0.1000	agent0	initial_cond	0	-0.000000
exp10248	4.46546993e-29	0.000000	0.000000	discard	cycle 72 u=0.1000	agent0	initial_cond	0	-0.000000
exp10249	4.08106752e-29	0.000000	0.000000	discard	cycle 72 u=0.1000	agent0	initial_cond	0	-0.000000
exp10250	4.08106752e-29	0.000000	0.000000	discard	cycle 72 u=0.1000	agent0	initial_cond	1	-0.000000
exp10251	4.08106752e-29	0.000000	0.000000	discard	cycle 72 u=0.1000	agent0	initial_cond	0	-0.000000
exp10252	4.58623706e-29	0.000000	0.000000	discard	cycle 72 u=0.1000	agent0	initial_cond	0	-0.000000
exp10253	4.58623706e-29	0.000000	0.000000	discard	cycle 72 u=0.1000	agent0	initial_cond	1	-0.000000
exp10254	4.58623706e-29	0.000000	0.000000	discard	cycle 72 u=0.1000	agent0	initial_cond	0	-0.000000
exp10255	4.39794337e-29	0.000000	0.000000	discard	cycle 72 u=0.1000	agent0	initial_cond	1	-0.000000
exp10256	4.39794337e-29	0.000000	0.000000	discard	cycle 72 u=0.1000	agent0	initial_cond	0	-0.000000
exp10257	4.39794337e-29	0.000000	0.000000	discard	cycle 72 u=0.1000	agent0	initial_cond	0	-0.000000
exp10258	1.36727475e-28	0.000000	0.000000	discard	cycle 72 u=0.1050	agent0	initial_cond	1	-0.000000
exp10259	1.36727475e-28	0.000000	0.000000	discard	cycle 72 u=0.1050	agent0	initial_cond	0	-0.000000
exp10260	1.36727475e-28	0.000000	0.000000	discard	cycle 72 u=0.1050	agent0	initial_cond	1	-0.000000
exp10261	6.14461376e-29	0.000000	0.000000	discard	cycle 72 u=0.1050	agent0	initial_cond	0	-0.000000
exp10262	6.14461376e-29	0.000000	0.000000	discard	cycle 72 u=0.1050	agent0	initial_cond	0	-0.000000
exp10263	6.14461376e-29	0.000000	0.000000	discard	cycle 72 u=0.1050	agent0	initial_cond	1	-0.000000
exp10264	1.75906666e-28	0.000000	0.000000	discard	cycle 72 u=0.1050	agent0	initial_cond	0	-0.000000
exp10265	1.75906666e-28	0.000000	0.000000	discard	cycle 72 u=0.1050	agent0	initial_cond	0	-0.000000
exp10266	1.75906666e-28	0.000000	0.000000	discard	cycle 72 u=0.1050	agent0	initial_cond	0	-0.000000
exp10267	1.11257917e-28	0.000000	0.000000	discard	cycle 72 u=0.1050	agent0	initial_cond	0	-0.000000
exp10268	1.11257917e-28	0.000000	0.000000	discard	cycle 72 u=0.1050	agent0	initial_cond	1	-0.000000
exp10269	1.11257917e-28	0.000000	0.000000	discard	cycle 72 u=0.1050	agent0	initial_cond	0	-0.000000
exp10270	8.58580947e-29	0.000000	0.000000	discard	cycle 73 u=0.0975	agent0	initial_cond	0	0.000000
exp10271	8.58580947e-29	0.000000	0.000000	discard	cycle 73 u=0.0975	agent0	initial_cond	0	0.000000
exp10272	8.58580947e-29	0.000000	0.000000	discard	cycle 73 u=0.0975	agent0	initial_cond	0	0.000000
exp10273	5.23962023e-29	0.000000	0.000000	discard	cycle 73 u=0.0975	agent0	initial_cond	1	0.000000
exp10274	5.23962023e-29	0.000000	0.000000	discard	cycle 73 u=0.0975	agent0	initial_cond	0	0.000000
exp10275	5.23962023e-29	0.000000	0.000000	discard	cycle 73 u=0.0975	agent0	initial_cond	0	0.000000
exp10276	4.03266298e-29	0.000000	0.000000	discard	cycle 73 u=0.0975	agent0	initial_cond	0	0.000000
exp10277	4.03266298e-29	0.000000	0.000000	discard	cycle 73 u=0.0975	agent0	initial_cond	0	0.000000
exp10278	4.03266298e-29	0.000000	0.000000	discard	cycle 73 u=0.0975	agent0	initial_cond	1	0.000000
exp10279	4.80015937e-29	0.000000	0.000000	discard	cycle 73 u=0.0975	agent0	initial_cond	0	0.000000
exp10280	4.80015937e-29	0.000000	0.000000	discard	cycle 73 u=0.0975	agent0	initial_cond	0	0.000000
exp10281	4.80015937e-29	0.000000	0.000000	discard	cycle 73 u=0.0975	agent0	initial_cond	0	0.000000
exp10282	2.68824537e-29	0.000000	0.000000	discard	cycle 73 u=0.0980	agent0	initial_cond	0	-0.000000
exp10283	2.68824537e-29	0.000000	0.000000	discard	cycle 73 u=0.0980	agent0	initial_cond	1	-0.000000
exp10284	2.68824537e-29	0.000000	0.000000	discard	cycle 73 u=0.0980	agent0	initial_cond	0	-0.000000
exp10285	6.16758073e-29	0.000000	0.000000	discard	cycle 73 u=0.0980	agent0	initial_cond	0	-0.000000
exp10286	6.16758073e-29	0.000000	0.000000	discard	cycle 73 u=0.0980	agent0	initial_cond	1	-0.000000
exp10287	6.16758073e-29	0.000000	0.000000	discard	cycle 73 u=0.0980	agent0	initial_cond	0	-0.000000
exp10288	2.01926478e-29	0.000000	0.000000	discard	cycle 73 u=0.0980	agent0	initial_cond	1	0.000000
exp10289	2.01926478e-29	0.000000	0.000000	discard	cycle 73 u=0.0980	agent0	initial_cond	0	0.000000
exp10290	2.01926478e-29	0.000000	0.000000	discard	cycle 73 u=0.0980	agent0	initial_cond	0	0.000000
exp10291	1.30310780e-28	0.000000	0.000000	discard	cycle 73 u=0.0980	agent0	initial_cond	1	-0.000000
exp10292	1.30310780e-28	0.000000	0.000000	discard	cycle 73 u=0.0980	agent0	initial_cond	0	-0.000000
exp10293	1.30310780e-28	0.000000	0.000000	discard	cycle 73 u=0.0980	agent0	initial_cond	1	-0.000000
exp10294	5.45343271e-29	0.000000	0.000000	discard	cycle 73 u=0.0982	agent0	initial_cond	0	-0.000000
exp10295	5.45343271e-29	0.000000	0.000000	discard	cycle 73 u=0.0982	agent0	initial_cond	0	-0.000000
exp10296	5.45343271e-29	0.000000	0.000000	discard	cycle 73 u=0.0982	agent0	initial_cond	1	-0.000000
exp10297	1.23429977e-28	0.000000	0.000000	discard	cycle 73 u=0.0982	agent0	initial_cond	0	0.000000
exp10298	1.23429977e-28	0.000000	0.000000	discard	cycle 73 u=0.0982	agent0	initial_cond	0	0.000000
exp10299	1.23429977e-28	0.000000	0.000000	discard	cycle 73 u=0.0982	agent0	initial_cond	0	0.000000
exp10300	1.88036672e-29	0.000000	0.000000	discard	cycle 73 u=0.0982	agent0	initial_cond	0	0.000000
exp10301	1.88036672e-29	0.000000	0.000000	discard	cycle 73 u=0.0982	agent0	initial_cond	1	0.000000
exp10302	1.88036672e-29	0.000000	0.000000	discard	cycle 73 u=0.0982	agent0	initial_cond	0	0.000000
exp10303	1.91190259e-29	0.000000	-0.000000	discard	cycle 73 u=0.0982	agent0	initial_cond	0	0.000000
exp10304	1.91190259e-29	0.000000	-0.000000	discard	cycle 73 u=0.0982	agent0	initial_cond	0	0.000000
exp10305	1.91190259e-29	0.000000	-0.000000	discard	cycle 73 u=0.0982	agent0	initial_cond	0	0.000000
exp10306	6.13049994e-29	0.000000	0.000000	discard	cycle 73 u=0.0985	agent0	initial_cond	1	0.000000
exp10307	6.13049994e-29	0.000000	0.000000	discard	cycle 73 u=0.0985	agent0	initial_cond	0	0.000000
exp10308	6.13049994e-29	0.000000	0.000000	discard	cycle 73 u=0.0985	agent0	initial_cond	0	0.000000
exp10309	5.49750971e-29	0.000000	0.000000	discard	cycle 73 u=0.0985	agent0	initial_cond	0	0.000000
exp10310	5.49750971e-29	0.000000	0.000000	discard	cycle 73 u=0.0985	agent0	initial_cond	0	0.000000
exp10311	5.49750971e-29	0.000000	0.000000	discard	cycle 73 u=0.0985	agent0	initial_cond	1	0.000000
exp10312	4.15642452e-29	0.000000	0.000000	discard	cycle 73 u=0.0985	agent0	initial_cond	0	0.000000
exp10313	4.15642452e-29	0.000000	0.000000	discard	cycle 73 u=0.0985	agent0	initial_cond	0	0.000000
exp10314	4.15642452e-29	0.000000	0.000000	discard	cycle 73 u=0.0985	agent0	initial_cond	0	0.000000
exp10315	2.19292611e-29	0.000000	0.000000	discard	cycle 73 u=0.0985	agent0	initial_cond	0	-0.000000
exp10316	2.19292611e-29	0.000000	0.000000	discard	cycle 73 u=0.0985	agent0	initial_cond	1	-0.000000
exp10317	2.19292611e-29	0.000000	0.000000	discard	cycle 73 u=0.0985	agent0	initial_cond	0	-0.000000
exp10318	4.22491788e-29	0.000000	0.000000	discard	cycle 73 u=0.0990	agent0	initial_cond	0	-0.000000
exp10319	4.22491788e-29	0.000000	0.000000	discard	cycle 73 u=0.0990	agent0	initial_cond	0	-0.000000
exp10320	4.22491788e-29	0.000000	0.000000	discard	cycle 73 u=0.0990	agent0	initial_cond	0	-0.000000
exp10321	3.22245147e-29	0.000000	0.000000	discard	cycle 73 u=0.0990	agent0	initial_cond	1	0.000000
exp10322	3.22245147e-29	0.000000	0.000000	discard	cycle 73 u=0.0990	agent0	initial_cond	0	0.000000
exp10323	3.22245147e-29	0.000000	0.000000	discard	cycle 73 u=0.0990	agent0	initial_cond	0	0.000000
exp10324	4.50941488e-29	0.000000	-0.000000	discard	cycle 73 u=0.0990	agent0	initial_cond	0	0.000000
exp10325	4.50941488e-29	0.000000	-0.000000	discard	cycle 73 u=0.0990	agent0	initial_cond	0	0.000000
exp10326	4.50941488e-29	0.000000	-0.000000	discard	cycle 73 u=0.0990	agent0	initial_cond	1	0.000000
exp10327	4.88330883e-29	0.000000	-0.000000	discard	cycle 73 u=0.0990	agent0	initial_cond	0	0.000000
exp10328	4.88330883e-29	0.000000	-0.000000	discard	cycle 73 u=0.0990	agent0	initial_cond	0	0.000000
exp10329	4.88330883e-29	0.000000	-0.000000	discard	cycle 73 u=0.0990	agent0	initial_cond	0	0.000000
exp10330	5.74085541e-29	0.000000	-0.000000	discard	cycle 73 u=0.0995	agent0	initial_cond	0	0.000000
exp10331	5.74085541e-29	0.000000	-0.000000	discard	cycle 73 u=0.0995	agent0	initial_cond	1	0.000000
exp10332	5.74085541e-29	0.000000	-0.000000	discard	cycle 73 u=0.0995	agent0	initial_cond	0	0.000000
exp10333	1.54984578e-28	0.000000	0.000000	discard	cycle 73 u=0.0995	agent0	initial_cond	0	-0.000000
exp10334	1.54984578e-28	0.000000	0.000000	discard	cycle 73 u=0.0995	agent0	initial_cond	0	-0.000000
exp10335	1.54984578e-28	0.000000	0.000000	discard	cycle 73 u=0.0995	agent0	initial_cond	0	-0.000000
exp10336	1.60328418e-29	0.000000	-0.000000	discard	cycle 73 u=0.0995	agent0	initial_cond	1	-0.000000
exp10337	1.60328418e-29	0.000000	-0.000000	discard	cycle 73 u=0.0995	agent0	initial_cond	0	-0.000000
exp10338	1.60328418e-29	0.000000	-0.000000	discard	cycle 73 u=0.0995	agent0	initial_cond	0	-0.000000
exp10339	7.34590618e-29	0.000000	0.000000	discard	cycle 73 u=0.0995	agent0	initial_cond	0	0.000000
exp10340	7.34590618e-29	0.000000	0.000000	discard	cycle 73 u=0.0995	agent0	initial_cond	0	0.000000
exp10341	7.34590618e-29	0.000000	0.000000	discard	cycle 73 u=0.0995	agent0	initial_cond	1	0.000000
exp10342	4.46546993e-29	0.000000	0.000000	discard	cycle 73 u=0.1000	agent0	initial_cond	0	-0.000000
exp10343	4.46546993e-29	0.000000	0.000000	discard	cycle 73 u=0.1000	agent0	initial_cond	0	-0.000000
exp10344	4.46546993e-29	0.000000	0.000000	discard	cycle 73 u=0.1000	agent0	initial_cond	0	-0.000000
exp10345	4.08106752e-29	0.000000	0.000000	discard	cycle 73 u=0.1000	agent0	initial_cond	0	-0.000000
exp10346	4.08106752e-29	0.000000	0.000000	discard	cycle 73 u=0.1000	agent0	initial_cond	1	-0.000000
exp10347	4.08106752e-29	0.000000	0.000000	discard	cycle 73 u=0.1000	agent0	initial_cond	0	-0.000000
exp10348	4.58623706e-29	0.000000	0.000000	discard	cycle 73 u=0.1000	agent0	initial_cond	0	-0.000000
exp10349	4.58623706e-29	0.000000	0.000000	discard	cycle 73 u=0.1000	agent0	initial_cond	0	-0.000000
exp10350	4.58623706e-29	0.000000	0.000000	discard	cycle 73 u=0.1000	agent0	initial_cond	0	-0.000000
exp10351	4.39794337e-29	0.000000	0.000000	discard	cycle 73 u=0.1000	agent0	initial_cond	1	-0.000000
exp10352	4.39794337e-29	0.000000	0.000000	discard	cycle 73 u=0.1000	agent0	initial_cond	0	-0.000000
exp10353	4.39794337e-29	0.000000	0.000000	discard	cycle 73 u=0.1000	agent0	initial_cond	0	-0.000000
exp10354	1.36727475e-28	0.000000	0.000000	discard	cycle 73 u=0.1050	agent0	initial_cond	1	-0.000000
exp10355	1.36727475e-28	0.000000	0.000000	discard	cycle 73 u=0.1050	agent0	initial_cond	0	-0.000000
exp10356	1.36727475e-28	0.000000	0.000000	discard	cycle 73 u=0.1050	agent0	initial_cond	1	-0.000000
exp10357	6.14461376e-29	0.000000	0.000000	discard	cycle 73 u=0.1050	agent0	initial_cond	0	-0.000000
exp10358	6.14461376e-29	0.000000	0.000000	discard	cycle 73 u=0.1050	agent0	initial_cond	0	-0.000000
exp10359	6.14461376e-29	0.000000	0.000000	discard	cycle 73 u=0.1050	agent0	initial_cond	1	-0.000000
exp10360	1.75906666e-28	0.000000	0.000000	discard	cycle 73 u=0.1050	agent0	initial_cond	0	-0.000000
exp10361	1.75906666e-28	0.000000	0.000000	discard	cycle 73 u=0.1050	agent0	initial_cond	1	-0.000000
exp10362	1.75906666e-28	0.000000	0.000000	discard	cycle 73 u=0.1050	agent0	initial_cond	0	-0.000000
exp10363	1.11257917e-28	0.000000	0.000000	discard	cycle 73 u=0.1050	agent0	initial_cond	0	-0.000000
exp10364	1.11257917e-28	0.000000	0.000000	discard	cycle 73 u=0.1050	agent0	initial_cond	1	-0.000000
exp10365	1.11257917e-28	0.000000	0.000000	discard	cycle 73 u=0.1050	agent0	initial_cond	0	-0.000000
exp10366	8.58580947e-29	0.000000	0.000000	discard	cycle 74 u=0.0975	agent0	initial_cond	1	0.000000
exp10367	8.58580947e-29	0.000000	0.000000	discard	cycle 74 u=0.0975	agent0	initial_cond	0	0.000000
exp10368	8.58580947e-29	0.000000	0.000000	discard	cycle 74 u=0.0975	agent0	initial_cond	0	0.000000
exp10369	5.23962023e-29	0.000000	0.000000	discard	cycle 74 u=0.0975	agent0	initial_cond	1	0.000000
exp10370	5.23962023e-29	0.000000	0.000000	discard	cycle 74 u=0.0975	agent0	initial_cond	0	0.000000
exp10371	5.23962023e-29	0.000000	0.000000	discard	cycle 74 u=0.0975	agent0	initial_cond	0	0.000000
exp10372	4.03266298e-29	0.000000	0.000000	discard	cycle 74 u=0.0975	agent0	initial_cond	0	0.000000
exp10373	4.03266298e-29	0.000000	0.000000	discard	cycle 74 u=0.0975	agent0	initial_cond	0	0.000000
exp10374	4.03266298e-29	0.000000	0.000000	discard	cycle 74 u=0.0975	agent0	initial_cond	1	0.000000
exp10375	4.80015937e-29	0.000000	0.000000	discard	cycle 74 u=0.0975	agent0	initial_cond	0	0.000000
exp10376	4.80015937e-29	0.000000	0.000000	discard	cycle 74 u=0.0975	agent0	initial_cond	0	0.000000
exp10377	4.80015937e-29	0.000000	0.000000	discard	cycle 74 u=0.0975	agent0	initial_cond	0	0.000000
exp10378	2.68824537e-29	0.000000	0.000000	discard	cycle 74 u=0.0980	agent0	initial_cond	0	-0.000000
exp10379	2.68824537e-29	0.000000	0.000000	discard	cycle 74 u=0.0980	agent0	initial_cond	1	-0.000000
exp10380	2.68824537e-29	0.000000	0.000000	discard	cycle 74 u=0.0980	agent0	initial_cond	0	-0.000000
exp10381	6.16758073e-29	0.000000	0.000000	discard	cycle 74 u=0.0980	agent0	initial_cond	0	-0.000000
exp10382	6.16758073e-29	0.000000	0.000000	discard	cycle 74 u=0.0980	agent0	initial_cond	0	-0.000000
exp10383	6.16758073e-29	0.000000	0.000000	discard	cycle 74 u=0.0980	agent0	initial_cond	0	-0.000000
exp10384	2.01926478e-29	0.000000	0.000000	discard	cycle 74 u=0.0980	agent0	initial_cond	1	0.000000
exp10385	2.01926478e-29	0.000000	0.000000	discard	cycle 74 u=0.0980	agent0	initial_cond	0	0.000000
exp10386	2.01926478e-29	0.000000	0.000000	discard	cycle 74 u=0.0980	agent0	initial_cond	0	0.000000
exp10387	1.30310780e-28	0.000000	0.000000	discard	cycle 74 u=0.0980	agent0	initial_cond	0	-0.000000
exp10388	1.30310780e-28	0.000000	0.000000	discard	cycle 74 u=0.0980	agent0	initial_cond	0	-0.000000
exp10389	1.30310780e-28	0.000000	0.000000	discard	cycle 74 u=0.0980	agent0	initial_cond	1	-0.000000
exp10390	5.45343271e-29	0.000000	0.000000	discard	cycle 74 u=0.0982	agent0	initial_cond	0	-0.000000
exp10391	5.45343271e-29	0.000000	0.000000	discard	cycle 74 u=0.0982	agent0	initial_cond	0	-0.000000
exp10392	5.45343271e-29	0.000000	0.000000	discard	cycle 74 u=0.0982	agent0	initial_cond	0	-0.000000
exp10393	1.23429977e-28	0.000000	0.000000	discard	cycle 74 u=0.0982	agent0	initial_cond	0	0.000000
exp10394	1.23429977e-28	0.000000	0.000000	discard	cycle 74 u=0.0982	agent0	initial_cond	1	0.000000
exp10395	1.23429977e-28	0.000000	0.000000	discard	cycle 74 u=0.0982	agent0	initial_cond	0	0.000000
exp10396	1.88036672e-29	0.000000	0.000000	discard	cycle 74 u=0.0982	agent0	initial_cond	0	0.000000
exp10397	1.88036672e-29	0.000000	0.000000	discard	cycle 74 u=0.0982	agent0	initial_cond	1	0.000000
exp10398	1.88036672e-29	0.000000	0.000000	discard	cycle 74 u=0.0982	agent0	initial_cond	0	0.000000
exp10399	1.91190259e-29	0.000000	-0.000000	discard	cycle 74 u=0.0982	agent0	initial_cond	1	0.000000
exp10400	1.91190259e-29	0.000000	-0.000000	discard	cycle 74 u=0.0982	agent0	initial_cond	0	0.000000
exp10401	1.91190259e-29	0.000000	-0.000000	discard	cycle 74 u=0.0982	agent0	initial_cond	0	0.000000
