exp_id	residual	solution_norm	solution_mean	status	description	agent	design	elapsed_s	solution_energy
exp16611	1.23429977e-28	0.000000	0.000000	discard	cycle 133 u=0.0982	agent0	initial_cond	0	0.000000
exp16612	1.23429977e-28	0.000000	0.000000	discard	cycle 133 u=0.0982	agent0	initial_cond	0	0.000000
exp16613	1.88036672e-29	0.000000	0.000000	discard	cycle 133 u=0.0982	agent0	initial_cond	0	0.000000
exp16614	1.88036672e-29	0.000000	0.000000	discard	cycle 133 u=0.0982	agent0	initial_cond	1	0.000000
exp16615	1.88036672e-29	0.000000	0.000000	discard	cycle 133 u=0.0982	agent0	initial_cond	0	0.000000
exp16616	1.91190259e-29	0.000000	-0.000000	discard	cycle 133 u=0.0982	agent0	initial_cond	1	0.000000
exp16617	1.91190259e-29	0.000000	-0.000000	discard	cycle 133 u=0.0982	agent0	initial_cond	0	0.000000
exp16618	1.91190259e-29	0.000000	-0.000000	discard	cycle 133 u=0.0982	agent0	initial_cond	0	0.000000
exp16619	6.13049994e-29	0.000000	0.000000	discard	cycle 133 u=0.0985	agent0	initial_cond	0	0.000000
exp16620	6.13049994e-29	0.000000	0.000000	discard	cycle 133 u=0.0985	agent0	initial_cond	0	0.000000
exp16621	6.13049994e-29	0.000000	0.000000	discard	cycle 133 u=0.0985	agent0	initial_cond	1	0.000000
exp16622	5.49750971e-29	0.000000	0.000000	discard	cycle 133 u=0.0985	agent0	initial_cond	0	0.000000
exp16623	5.49750971e-29	0.000000	0.000000	discard	cycle 133 u=0.0985	agent0	initial_cond	0	0.000000
exp16624	5.49750971e-29	0.000000	0.000000	discard	cycle 133 u=0.0985	agent0	initial_cond	0	0.000000
exp16625	4.15642452e-29	0.000000	0.000000	discard	cycle 133 u=0.0985	agent0	initial_cond	0	0.000000
exp16626	4.15642452e-29	0.000000	0.000000	discard	cycle 133 u=0.0985	agent0	initial_cond	1	0.000000
exp16627	4.15642452e-29	0.000000	0.000000	discard	cycle 133 u=0.0985	agent0	initial_cond	0	0.000000
exp16628	2.19292611e-29	0.000000	0.000000	discard	cycle 133 u=0.0985	agent0	initial_cond	1	-0.000000
exp16629	2.19292611e-29	0.000000	0.000000	discard	cycle 133 u=0.0985	agent0	initial_cond	0	-0.000000
exp16630	2.19292611e-29	0.000000	0.000000	discard	cycle 133 u=0.0985	agent0	initial_cond	0	-0.000000
exp16631	4.22491788e-29	0.000000	0.000000	discard	cycle 133 u=0.0990	agent0	initial_cond	0	-0.000000
exp16632	4.22491788e-29	0.000000	0.000000	discard	cycle 133 u=0.0990	agent0	initial_cond	0	-0.000000
exp16633	4.22491788e-29	0.000000	0.000000	discard	cycle 133 u=0.0990	agent0	initial_cond	1	-0.000000
exp16634	3.22245147e-29	0.000000	0.000000	discard	cycle 133 u=0.0990	agent0	initial_cond	0	0.000000
exp16635	3.22245147e-29	0.000000	0.000000	discard	cycle 133 u=0.0990	agent0	initial_cond	1	0.000000
exp16636	3.22245147e-29	0.000000	0.000000	discard	cycle 133 u=0.0990	agent0	initial_cond	0	0.000000
exp16637	4.50941488e-29	0.000000	-0.000000	discard	cycle 133 u=0.0990	agent0	initial_cond	0	0.000000
exp16638	4.50941488e-29	0.000000	-0.000000	discard	cycle 133 u=0.0990	agent0	initial_cond	0	0.000000
exp16639	4.50941488e-29	0.000000	-0.000000	discard	cycle 133 u=0.0990	agent0	initial_cond	0	0.000000
exp16640	4.88330883e-29	0.000000	-0.000000	discard	cycle 133 u=0.0990	agent0	initial_cond	1	0.000000
exp16641	4.88330883e-29	0.000000	-0.000000	discard	cycle 133 u=0.0990	agent0	initial_cond	0	0.000000
exp16642	4.88330883e-29	0.000000	-0.000000	discard	cycle 133 u=0.0990	agent0	initial_cond	1	0.000000
exp16643	5.74085541e-29	0.000000	-0.000000	discard	cycle 133 u=0.0995	agent0	initial_cond	0	0.000000
exp16644	5.74085541e-29	0.000000	-0.000000	discard	cycle 133 u=0.0995	agent0	initial_cond	0	0.000000
exp16645	5.74085541e-29	0.000000	-0.000000	discard	cycle 133 u=0.0995	agent0	initial_cond	0	0.000000
exp16646	1.54984578e-28	0.000000	0.000000	discard	cycle 133 u=0.0995	agent0	initial_cond	0	-0.000000
exp16647	1.54984578e-28	0.000000	0.000000	discard	cycle 133 u=0.0995	agent0	initial_cond	1	-0.000000
exp16648	1.54984578e-28	0.000000	0.000000	discard	cycle 133 u=0.0995	agent0	initial_cond	0	-0.000000
exp16649	1.60328418e-29	0.000000	-0.000000	discard	cycle 133 u=0.0995	agent0	initial_cond	1	-0.000000
exp16650	1.60328418e-29	0.000000	-0.000000	discard	cycle 133 u=0.0995	agent0	initial_cond	0	-0.000000
exp16651	1.60328418e-29	0.000000	-0.000000	discard	cycle 133 u=0.0995	agent0	initial_cond	0	-0.000000
exp16652	7.34590618e-29	0.000000	0.000000	discard	cycle 133 u=0.0995	agent0	initial_cond	0	0.000000
exp16653	7.34590618e-29	0.000000	0.000000	discard	cycle 133 u=0.0995	agent0	initial_cond	0	0.000000
exp16654	7.34590618e-29	0.000000	0.000000	discard	cycle 133 u=0.0995	agent0	initial_cond	1	0.000000
exp16655	4.46546993e-29	0.000000	0.000000	discard	cycle 133 u=0.1000	agent0	initial_cond	0	-0.000000
exp16656	4.46546993e-29	0.000000	0.000000	discard	cycle 133 u=0.1000	agent0	initial_cond	1	-0.000000
r9_ext_amp0.35	1.66704596e-17	0.0	0.0	keep	Phase23 amp=0.35	agent1	memory	0	0.0
exp16657	4.46546993e-29	0.000000	0.000000	discard	cycle 133 u=0.1000	agent0	initial_cond	0	-0.000000
r9_ext_amp0.40	1.65061646e-15	0.0	0.0	keep	Phase23 amp=0.40	agent1	memory	0	0.0
r9_ext_amp0.42	7.35187638e-15	0.0	0.0	keep	Phase23 amp=0.42	agent1	memory	0	0.0
exp16658	4.08106752e-29	0.000000	0.000000	discard	cycle 133 u=0.1000	agent0	initial_cond	0	-0.000000
r9_ext_amp0.43	7.10657943e-27	0.0	0.0	keep	Phase23 amp=0.43	agent1	memory	0	0.0
exp16659	4.08106752e-29	0.000000	0.000000	discard	cycle 133 u=0.1000	agent0	initial_cond	0	-0.000000
r9_ext_amp0.44	6.14030423e-26	0.0	0.0	keep	Phase23 amp=0.44	agent1	memory	0	0.0
r9_ext_amp0.45	5.11721113e-26	0.0	0.0	keep	Phase23 amp=0.45	agent1	memory	0	0.0
exp16660	4.08106752e-29	0.000000	0.000000	discard	cycle 133 u=0.1000	agent0	initial_cond	0	-0.000000
r9_ext_amp0.50	1.37822869e-23	0.0	0.0	keep	Phase23 amp=0.50	agent1	memory	0	0.0
exp16661	4.58623706e-29	0.000000	0.000000	discard	cycle 133 u=0.1000	agent0	initial_cond	1	-0.000000
r9_ext_amp0.55	5.41522800e-21	0.0	0.0	keep	Phase23 amp=0.55	agent1	memory	0	0.0
exp16662	4.58623706e-29	0.000000	0.000000	discard	cycle 133 u=0.1000	agent0	initial_cond	0	-0.000000
exp16663	4.58623706e-29	0.000000	0.000000	discard	cycle 133 u=0.1000	agent0	initial_cond	1	-0.000000
exp16664	4.39794337e-29	0.000000	0.000000	discard	cycle 133 u=0.1000	agent0	initial_cond	0	-0.000000
exp16665	4.39794337e-29	0.000000	0.000000	discard	cycle 133 u=0.1000	agent0	initial_cond	0	-0.000000
exp16666	4.39794337e-29	0.000000	0.000000	discard	cycle 133 u=0.1000	agent0	initial_cond	0	-0.000000
exp16667	1.36727475e-28	0.000000	0.000000	discard	cycle 133 u=0.1050	agent0	initial_cond	0	-0.000000
exp16668	1.36727475e-28	0.000000	0.000000	discard	cycle 133 u=0.1050	agent0	initial_cond	1	-0.000000
exp16669	1.36727475e-28	0.000000	0.000000	discard	cycle 133 u=0.1050	agent0	initial_cond	0	-0.000000
exp16670	6.14461376e-29	0.000000	0.000000	discard	cycle 133 u=0.1050	agent0	initial_cond	1	-0.000000
exp16671	6.14461376e-29	0.000000	0.000000	discard	cycle 133 u=0.1050	agent0	initial_cond	0	-0.000000
r9_ext_u-0.5	1.24126708e-16	0.0	0.0	keep	Phase24 u=-0.5	agent1	memory	0	0.0
exp16672	6.14461376e-29	0.000000	0.000000	discard	cycle 133 u=0.1050	agent0	initial_cond	0	-0.000000
r9_ext_u-0.2	8.18388225e-18	0.0	0.0	keep	Phase24 u=-0.2	agent1	memory	0	0.0
exp16673	1.75906666e-28	0.000000	0.000000	discard	cycle 133 u=0.1050	agent0	initial_cond	0	-0.000000
r9_ext_u0.0	1.39160173e-16	0.0	0.0	keep	Phase24 u=0.0	agent1	memory	0	0.0
r9_ext_u0.1	8.06075230e-25	0.0	0.0	keep	Phase24 u=0.1	agent1	memory	0	0.0
exp16674	1.75906666e-28	0.000000	0.000000	discard	cycle 133 u=0.1050	agent0	initial_cond	0	-0.000000
r9_ext_u0.2	7.72139538e-18	0.0	0.0	keep	Phase24 u=0.2	agent1	memory	0	0.0
exp16675	1.75906666e-28	0.000000	0.000000	discard	cycle 133 u=0.1050	agent0	initial_cond	1	-0.000000
r9_ext_u0.240	7.10657943e-27	0.0	0.0	keep	Phase24 u=0.240	agent1	memory	0	0.0
r9_ext_u0.3	2.06134938e-15	0.0	0.0	keep	Phase24 u=0.3	agent1	memory	0	0.0
exp16676	1.11257917e-28	0.000000	0.000000	discard	cycle 133 u=0.1050	agent0	initial_cond	0	-0.000000
r9_ext_u0.5	1.24126708e-16	0.0	0.0	keep	Phase24 u=0.5	agent1	memory	0	0.0
exp16677	1.11257917e-28	0.000000	0.000000	discard	cycle 133 u=0.1050	agent0	initial_cond	1	-0.000000
r9_ext_u0.8	1.24126708e-16	0.0	0.0	keep	Phase24 u=0.8	agent1	memory	0	0.0
exp16678	1.11257917e-28	0.000000	0.000000	discard	cycle 133 u=0.1050	agent0	initial_cond	0	-0.000000
exp16679	8.58580947e-29	0.000000	0.000000	discard	cycle 134 u=0.0975	agent0	initial_cond	0	0.000000
exp16680	8.58580947e-29	0.000000	0.000000	discard	cycle 134 u=0.0975	agent0	initial_cond	0	0.000000
exp16681	8.58580947e-29	0.000000	0.000000	discard	cycle 134 u=0.0975	agent0	initial_cond	0	0.000000
exp16682	5.23962023e-29	0.000000	0.000000	discard	cycle 134 u=0.0975	agent0	initial_cond	1	0.000000
exp16683	5.23962023e-29	0.000000	0.000000	discard	cycle 134 u=0.0975	agent0	initial_cond	0	0.000000
exp16684	5.23962023e-29	0.000000	0.000000	discard	cycle 134 u=0.0975	agent0	initial_cond	1	0.000000
exp16685	4.03266298e-29	0.000000	0.000000	discard	cycle 134 u=0.0975	agent0	initial_cond	0	0.000000
exp16686	4.03266298e-29	0.000000	0.000000	discard	cycle 134 u=0.0975	agent0	initial_cond	0	0.000000
exp16687	4.03266298e-29	0.000000	0.000000	discard	cycle 134 u=0.0975	agent0	initial_cond	1	0.000000
exp16688	4.80015937e-29	0.000000	0.000000	discard	cycle 134 u=0.0975	agent0	initial_cond	0	0.000000
exp16689	4.80015937e-29	0.000000	0.000000	discard	cycle 134 u=0.0975	agent0	initial_cond	1	0.000000
exp16690	4.80015937e-29	0.000000	0.000000	discard	cycle 134 u=0.0975	agent0	initial_cond	0	0.000000
r9_kfreq0.5_m1	0.00000000e+00	0.0	0.0	keep	Phase25 Kfreq=0.5	agent1	memory	0	0.0
r9_kfreq1_m1	7.10657943e-27	0.0	0.0	keep	Phase25 Kfreq=1	agent1	memory	0	0.0
exp16691	2.68824537e-29	0.000000	0.000000	discard	cycle 134 u=0.0980	agent0	initial_cond	1	-0.000000
r9_kfreq1.5_m1	7.10657943e-27	0.0	0.0	keep	Phase25 Kfreq=1.5	agent1	memory	0	0.0
exp16692	2.68824537e-29	0.000000	0.000000	discard	cycle 134 u=0.0980	agent0	initial_cond	0	-0.000000
r9_kfreq2_m1	0.00000000e+00	0.0	0.0	keep	Phase25 Kfreq=2	agent1	memory	0	0.0
r9_kfreq2.5_m1	0.00000000e+00	0.0	0.0	keep	Phase25 Kfreq=2.5	agent1	memory	0	0.0
exp16693	2.68824537e-29	0.000000	0.000000	discard	cycle 134 u=0.0980	agent0	initial_cond	0	-0.000000
r9_kfreq3_m1	7.10657943e-27	0.0	0.0	keep	Phase25 Kfreq=3	agent1	memory	0	0.0
exp16694	6.16758073e-29	0.000000	0.000000	discard	cycle 134 u=0.0980	agent0	initial_cond	0	-0.000000
r9_kfreq4_m1	0.00000000e+00	0.0	0.0	keep	Phase25 Kfreq=4	agent1	memory	0	0.0
r9_kfreq5_m1	7.10657943e-27	0.0	0.0	keep	Phase25 Kfreq=5	agent1	memory	0	0.0
exp16695	6.16758073e-29	0.000000	0.000000	discard	cycle 134 u=0.0980	agent0	initial_cond	0	-0.000000
r9_kfreq6_m1	0.00000000e+00	0.0	0.0	keep	Phase25 Kfreq=6	agent1	memory	0	0.0
exp16696	6.16758073e-29	0.000000	0.000000	discard	cycle 134 u=0.0980	agent0	initial_cond	1	-0.000000
exp16697	2.01926478e-29	0.000000	0.000000	discard	cycle 134 u=0.0980	agent0	initial_cond	0	0.000000
exp16698	2.01926478e-29	0.000000	0.000000	discard	cycle 134 u=0.0980	agent0	initial_cond	0	0.000000
exp16699	2.01926478e-29	0.000000	0.000000	discard	cycle 134 u=0.0980	agent0	initial_cond	0	0.000000
exp16700	1.30310780e-28	0.000000	0.000000	discard	cycle 134 u=0.0980	agent0	initial_cond	0	-0.000000
exp16701	1.30310780e-28	0.000000	0.000000	discard	cycle 134 u=0.0980	agent0	initial_cond	1	-0.000000
exp16702	1.30310780e-28	0.000000	0.000000	discard	cycle 134 u=0.0980	agent0	initial_cond	0	-0.000000
exp16703	5.45343271e-29	0.000000	0.000000	discard	cycle 134 u=0.0982	agent0	initial_cond	1	-0.000000
exp16704	5.45343271e-29	0.000000	0.000000	discard	cycle 134 u=0.0982	agent0	initial_cond	0	-0.000000
exp16705	5.45343271e-29	0.000000	0.000000	discard	cycle 134 u=0.0982	agent0	initial_cond	0	-0.000000
exp16706	1.23429977e-28	0.000000	0.000000	discard	cycle 134 u=0.0982	agent0	initial_cond	0	0.000000
exp16707	1.23429977e-28	0.000000	0.000000	discard	cycle 134 u=0.0982	agent0	initial_cond	0	0.000000
exp16708	1.23429977e-28	0.000000	0.000000	discard	cycle 134 u=0.0982	agent0	initial_cond	1	0.000000
exp16709	1.88036672e-29	0.000000	0.000000	discard	cycle 134 u=0.0982	agent0	initial_cond	0	0.000000
exp16710	1.88036672e-29	0.000000	0.000000	discard	cycle 134 u=0.0982	agent0	initial_cond	1	0.000000
exp16711	1.88036672e-29	0.000000	0.000000	discard	cycle 134 u=0.0982	agent0	initial_cond	0	0.000000
r9_exact_kf0.5_a0.30	0.00000000e+00	0.0	0.0	keep	Phase26 Kf=0.5 a=0.30	agent1	memory	0	0.0
exp16712	1.91190259e-29	0.000000	-0.000000	discard	cycle 134 u=0.0982	agent0	initial_cond	0	0.000000
r9_exact_kf0.5_a0.40	0.00000000e+00	0.0	0.0	keep	Phase26 Kf=0.5 a=0.40	agent1	memory	0	0.0
r9_exact_kf0.5_a0.43	0.00000000e+00	0.0	0.0	keep	Phase26 Kf=0.5 a=0.43	agent1	memory	0	0.0
exp16713	1.91190259e-29	0.000000	-0.000000	discard	cycle 134 u=0.0982	agent0	initial_cond	0	0.000000
r9_exact_kf0.5_a0.50	0.00000000e+00	0.0	0.0	keep	Phase26 Kf=0.5 a=0.50	agent1	memory	0	0.0
exp16714	1.91190259e-29	0.000000	-0.000000	discard	cycle 134 u=0.0982	agent0	initial_cond	0	0.000000
r9_exact_kf2.0_a0.30	0.00000000e+00	0.0	0.0	keep	Phase26 Kf=2.0 a=0.30	agent1	memory	0	0.0
r9_exact_kf2.0_a0.40	0.00000000e+00	0.0	0.0	keep	Phase26 Kf=2.0 a=0.40	agent1	memory	0	0.0
exp16715	6.13049994e-29	0.000000	0.000000	discard	cycle 134 u=0.0985	agent0	initial_cond	0	0.000000
r9_exact_kf2.0_a0.43	0.00000000e+00	0.0	0.0	keep	Phase26 Kf=2.0 a=0.43	agent1	memory	0	0.0
exp16716	6.13049994e-29	0.000000	0.000000	discard	cycle 134 u=0.0985	agent0	initial_cond	0	0.000000
r9_exact_kf2.0_a0.50	0.00000000e+00	0.0	0.0	keep	Phase26 Kf=2.0 a=0.50	agent1	memory	0	0.0
r9_exact_kf2.5_a0.30	0.00000000e+00	0.0	0.0	keep	Phase26 Kf=2.5 a=0.30	agent1	memory	0	0.0
exp16717	6.13049994e-29	0.000000	0.000000	discard	cycle 134 u=0.0985	agent0	initial_cond	1	0.000000
r9_exact_kf2.5_a0.40	0.00000000e+00	0.0	0.0	keep	Phase26 Kf=2.5 a=0.40	agent1	memory	0	0.0
exp16718	5.49750971e-29	0.000000	0.000000	discard	cycle 134 u=0.0985	agent0	initial_cond	0	0.000000
r9_exact_kf2.5_a0.43	0.00000000e+00	0.0	0.0	keep	Phase26 Kf=2.5 a=0.43	agent1	memory	0	0.0
r9_exact_kf2.5_a0.50	0.00000000e+00	0.0	0.0	keep	Phase26 Kf=2.5 a=0.50	agent1	memory	0	0.0
exp16719	5.49750971e-29	0.000000	0.000000	discard	cycle 134 u=0.0985	agent0	initial_cond	0	0.000000
r9_exact_kf4.0_a0.30	0.00000000e+00	0.0	0.0	keep	Phase26 Kf=4.0 a=0.30	agent1	memory	0	0.0
exp16720	5.49750971e-29	0.000000	0.000000	discard	cycle 134 u=0.0985	agent0	initial_cond	0	0.000000
r9_exact_kf4.0_a0.40	0.00000000e+00	0.0	0.0	keep	Phase26 Kf=4.0 a=0.40	agent1	memory	0	0.0
r9_exact_kf4.0_a0.43	0.00000000e+00	0.0	0.0	keep	Phase26 Kf=4.0 a=0.43	agent1	memory	0	0.0
exp16721	4.15642452e-29	0.000000	0.000000	discard	cycle 134 u=0.0985	agent0	initial_cond	0	0.000000
r9_exact_kf4.0_a0.50	0.00000000e+00	0.0	0.0	keep	Phase26 Kf=4.0 a=0.50	agent1	memory	0	0.0
r9_exact_kf6.0_a0.30	0.00000000e+00	0.0	0.0	keep	Phase26 Kf=6.0 a=0.30	agent1	memory	0	0.0
exp16722	4.15642452e-29	0.000000	0.000000	discard	cycle 134 u=0.0985	agent0	initial_cond	1	0.000000
r9_exact_kf6.0_a0.40	0.00000000e+00	0.0	0.0	keep	Phase26 Kf=6.0 a=0.40	agent1	memory	0	0.0
exp16723	4.15642452e-29	0.000000	0.000000	discard	cycle 134 u=0.0985	agent0	initial_cond	0	0.000000
r9_exact_kf6.0_a0.43	0.00000000e+00	0.0	0.0	keep	Phase26 Kf=6.0 a=0.43	agent1	memory	0	0.0
exp16724	2.19292611e-29	0.000000	0.000000	discard	cycle 134 u=0.0985	agent0	initial_cond	1	-0.000000
r9_exact_kf6.0_a0.50	0.00000000e+00	0.0	0.0	keep	Phase26 Kf=6.0 a=0.50	agent1	memory	0	0.0
exp16725	2.19292611e-29	0.000000	0.000000	discard	cycle 134 u=0.0985	agent0	initial_cond	0	-0.000000
exp16726	2.19292611e-29	0.000000	0.000000	discard	cycle 134 u=0.0985	agent0	initial_cond	0	-0.000000
exp16727	4.22491788e-29	0.000000	0.000000	discard	cycle 134 u=0.0990	agent0	initial_cond	0	-0.000000
exp16728	4.22491788e-29	0.000000	0.000000	discard	cycle 134 u=0.0990	agent0	initial_cond	0	-0.000000
exp16729	4.22491788e-29	0.000000	0.000000	discard	cycle 134 u=0.0990	agent0	initial_cond	1	-0.000000
exp16730	3.22245147e-29	0.000000	0.000000	discard	cycle 134 u=0.0990	agent0	initial_cond	0	0.000000
exp16731	3.22245147e-29	0.000000	0.000000	discard	cycle 134 u=0.0990	agent0	initial_cond	1	0.000000
exp16732	3.22245147e-29	0.000000	0.000000	discard	cycle 134 u=0.0990	agent0	initial_cond	0	0.000000
exp16733	4.50941488e-29	0.000000	-0.000000	discard	cycle 134 u=0.0990	agent0	initial_cond	0	0.000000
exp16734	4.50941488e-29	0.000000	-0.000000	discard	cycle 134 u=0.0990	agent0	initial_cond	0	0.000000
exp16735	4.50941488e-29	0.000000	-0.000000	discard	cycle 134 u=0.0990	agent0	initial_cond	0	0.000000
exp16736	4.88330883e-29	0.000000	-0.000000	discard	cycle 134 u=0.0990	agent0	initial_cond	1	0.000000
exp16737	4.88330883e-29	0.000000	-0.000000	discard	cycle 134 u=0.0990	agent0	initial_cond	0	0.000000
exp16738	4.88330883e-29	0.000000	-0.000000	discard	cycle 134 u=0.0990	agent0	initial_cond	1	0.000000
exp16739	5.74085541e-29	0.000000	-0.000000	discard	cycle 134 u=0.0995	agent0	initial_cond	0	0.000000
exp16740	5.74085541e-29	0.000000	-0.000000	discard	cycle 134 u=0.0995	agent0	initial_cond	0	0.000000
exp16741	5.74085541e-29	0.000000	-0.000000	discard	cycle 134 u=0.0995	agent0	initial_cond	0	0.000000
r9_zero_u-1.0_a0.1	0.00000000e+00	0.0	0.0	keep	Phase27 zero test u=-1.0	agent1	memory	0	0.0
exp16742	1.54984578e-28	0.000000	0.000000	discard	cycle 134 u=0.0995	agent0	initial_cond	0	-0.000000
r9_zero_u-1.0_a0.5	4.00296604e-16	0.0	0.0	keep	Phase27 zero test u=-1.0	agent1	memory	0	0.0
r9_zero_u-1.0_a1.0	0.00000000e+00	0.0	0.0	keep	Phase27 zero test u=-1.0	agent1	memory	0	0.0
exp16743	1.54984578e-28	0.000000	0.000000	discard	cycle 134 u=0.0995	agent0	initial_cond	1	-0.000000
r9_zero_u-0.5_a0.1	0.00000000e+00	0.0	0.0	keep	Phase27 zero test u=-0.5	agent1	memory	0	0.0
exp16744	1.54984578e-28	0.000000	0.000000	discard	cycle 134 u=0.0995	agent0	initial_cond	0	-0.000000
r9_zero_u-0.5_a0.5	2.77555756e-17	0.0	0.0	keep	Phase27 zero test u=-0.5	agent1	memory	0	0.0
r9_zero_u-0.5_a1.0	0.00000000e+00	0.0	0.0	keep	Phase27 zero test u=-0.5	agent1	memory	0	0.0
exp16745	1.60328418e-29	0.000000	-0.000000	discard	cycle 134 u=0.0995	agent0	initial_cond	1	-0.000000
r9_zero_u0.0_a0.1	0.00000000e+00	0.0	0.0	keep	Phase27 zero test u=0.0	agent1	memory	0	0.0
exp16746	1.60328418e-29	0.000000	-0.000000	discard	cycle 134 u=0.0995	agent0	initial_cond	0	-0.000000
r9_zero_u0.0_a0.5	4.46864767e-15	0.0	0.0	keep	Phase27 zero test u=0.0	agent1	memory	0	0.0
r9_zero_u0.0_a1.0	1.38777878e-17	0.0	0.0	keep	Phase27 zero test u=0.0	agent1	memory	0	0.0
exp16747	1.60328418e-29	0.000000	-0.000000	discard	cycle 134 u=0.0995	agent0	initial_cond	0	-0.000000
r9_zero_u0.5_a0.1	0.00000000e+00	0.0	0.0	keep	Phase27 zero test u=0.5	agent1	memory	0	0.0
exp16748	7.34590618e-29	0.000000	0.000000	discard	cycle 134 u=0.0995	agent0	initial_cond	0	0.000000
r9_zero_u0.5_a0.5	4.16333634e-17	0.0	0.0	keep	Phase27 zero test u=0.5	agent1	memory	0	0.0
r9_zero_u0.5_a1.0	0.00000000e+00	0.0	0.0	keep	Phase27 zero test u=0.5	agent1	memory	0	0.0
exp16749	7.34590618e-29	0.000000	0.000000	discard	cycle 134 u=0.0995	agent0	initial_cond	0	0.000000
r9_zero_u1.0_a0.1	0.00000000e+00	0.0	0.0	keep	Phase27 zero test u=1.0	agent1	memory	0	0.0
r9_zero_u1.0_a0.5	4.00296604e-16	0.0	0.0	keep	Phase27 zero test u=1.0	agent1	memory	0	0.0
exp16750	7.34590618e-29	0.000000	0.000000	discard	cycle 134 u=0.0995	agent0	initial_cond	1	0.000000
r9_zero_u1.0_a1.0	0.00000000e+00	0.0	0.0	keep	Phase27 zero test u=1.0	agent1	memory	0	0.0
exp16751	4.46546993e-29	0.000000	0.000000	discard	cycle 134 u=0.1000	agent0	initial_cond	0	-0.000000
exp16752	4.46546993e-29	0.000000	0.000000	discard	cycle 134 u=0.1000	agent0	initial_cond	1	-0.000000
exp16753	4.46546993e-29	0.000000	0.000000	discard	cycle 134 u=0.1000	agent0	initial_cond	0	-0.000000
exp16754	4.08106752e-29	0.000000	0.000000	discard	cycle 134 u=0.1000	agent0	initial_cond	0	-0.000000
exp16755	4.08106752e-29	0.000000	0.000000	discard	cycle 134 u=0.1000	agent0	initial_cond	0	-0.000000
exp16756	4.08106752e-29	0.000000	0.000000	discard	cycle 134 u=0.1000	agent0	initial_cond	0	-0.000000
exp16757	4.58623706e-29	0.000000	0.000000	discard	cycle 134 u=0.1000	agent0	initial_cond	1	-0.000000
exp16758	4.58623706e-29	0.000000	0.000000	discard	cycle 134 u=0.1000	agent0	initial_cond	0	-0.000000
exp16759	4.58623706e-29	0.000000	0.000000	discard	cycle 134 u=0.1000	agent0	initial_cond	1	-0.000000
exp16760	4.39794337e-29	0.000000	0.000000	discard	cycle 134 u=0.1000	agent0	initial_cond	0	-0.000000
exp16761	4.39794337e-29	0.000000	0.000000	discard	cycle 134 u=0.1000	agent0	initial_cond	0	-0.000000
exp16762	4.39794337e-29	0.000000	0.000000	discard	cycle 134 u=0.1000	agent0	initial_cond	0	-0.000000
exp16763	1.36727475e-28	0.000000	0.000000	discard	cycle 134 u=0.1050	agent0	initial_cond	0	-0.000000
exp16764	1.36727475e-28	0.000000	0.000000	discard	cycle 134 u=0.1050	agent0	initial_cond	1	-0.000000
exp16765	1.36727475e-28	0.000000	0.000000	discard	cycle 134 u=0.1050	agent0	initial_cond	0	-0.000000
r9_phase1.45550_ultra	2.88781250e-26	0.0	0.0	keep	Phase28 phase=1.45550 ultra	agent1	memory	0	0.0
exp16766	6.14461376e-29	0.000000	0.000000	discard	cycle 134 u=0.1050	agent0	initial_cond	1	-0.000000
r9_phase1.45555_ultra	1.83189779e-26	0.0	0.0	keep	Phase28 phase=1.45555 ultra	agent1	memory	0	0.0
exp16767	6.14461376e-29	0.000000	0.000000	discard	cycle 134 u=0.1050	agent0	initial_cond	0	-0.000000
r9_phase1.45560_ultra	4.42143921e-26	0.0	0.0	keep	Phase28 phase=1.45560 ultra	agent1	memory	0	0.0
r9_phase1.45565_ultra	4.84382881e-26	0.0	0.0	keep	Phase28 phase=1.45565 ultra	agent1	memory	0	0.0
exp16768	6.14461376e-29	0.000000	0.000000	discard	cycle 134 u=0.1050	agent0	initial_cond	0	-0.000000
r9_phase1.45570_ultra	4.03789259e-26	0.0	0.0	keep	Phase28 phase=1.45570 ultra	agent1	memory	0	0.0
exp16769	1.75906666e-28	0.000000	0.000000	discard	cycle 134 u=0.1050	agent0	initial_cond	0	-0.000000
r9_phase1.45575_ultra	4.06771537e-26	0.0	0.0	keep	Phase28 phase=1.45575 ultra	agent1	memory	0	0.0
r9_phase1.45580_ultra	1.25276776e-26	0.0	0.0	keep	Phase28 phase=1.45580 ultra	agent1	memory	0	0.0
