exp_id	residual	solution_norm	solution_mean	status	description	agent	design	elapsed_s	solution_energy
exp13267	4.22491788e-29	0.000000	0.000000	discard	cycle 100 u=0.0990	agent0	initial_cond	0	-0.000000
exp13268	3.14139955e-17	0.106907	-0.000000	discard	Round 10: 3D at K=0.023 u=0.242 a=0.46 p=1.20	agent1	perturbation	0	0.000731
exp13269	4.22491788e-29	0.000000	0.000000	discard	cycle 100 u=0.0990	agent0	initial_cond	0	-0.000000
exp13270	1.88155749e-17	0.106907	-0.000000	discard	Round 10: 3D at K=0.023 u=0.242 a=0.46 p=1.21	agent1	perturbation	0	0.000731
exp13271	4.22491788e-29	0.000000	0.000000	discard	cycle 100 u=0.0990	agent0	initial_cond	1	-0.000000
exp13272	1.99326703e-17	0.106907	-0.000000	discard	Round 10: 3D at K=0.023 u=0.242 a=0.46 p=1.22	agent1	perturbation	0	0.000731
exp13273	3.22245147e-29	0.000000	0.000000	discard	cycle 100 u=0.0990	agent0	initial_cond	0	0.000000
exp13274	2.98067223e-17	0.106907	-0.000000	discard	Round 10: 3D at K=0.023 u=0.242 a=0.46 p=1.23	agent1	perturbation	0	0.000731
exp13275	3.22245147e-29	0.000000	0.000000	discard	cycle 100 u=0.0990	agent0	initial_cond	0	0.000000
exp13276	5.18773007e-17	0.106907	-0.000000	discard	Round 10: 3D at K=0.023 u=0.242 a=0.46 p=1.24	agent1	perturbation	1	0.000731
exp13277	3.22245147e-29	0.000000	0.000000	discard	cycle 100 u=0.0990	agent0	initial_cond	0	0.000000
exp13278	8.25233616e-17	0.097831	-0.000000	discard	Round 10: 3D at K=0.023 u=0.244 a=0.42 p=1.20	agent1	perturbation	0	0.000490
exp13279	4.50941488e-29	0.000000	-0.000000	discard	cycle 100 u=0.0990	agent0	initial_cond	0	0.000000
exp13280	3.73933302e-17	0.097831	-0.000000	discard	Round 10: 3D at K=0.023 u=0.244 a=0.42 p=1.21	agent1	perturbation	1	0.000490
exp13280	4.50941488e-29	0.000000	-0.000000	discard	cycle 100 u=0.0990	agent0	initial_cond	1	0.000000
exp13281	4.23826361e-17	0.097831	-0.000000	discard	Round 10: 3D at K=0.023 u=0.244 a=0.42 p=1.22	agent1	perturbation	0	0.000490
exp13281	4.50941488e-29	0.000000	-0.000000	discard	cycle 100 u=0.0990	agent0	initial_cond	0	0.000000
exp13282	4.88330883e-29	0.000000	-0.000000	discard	cycle 100 u=0.0990	agent0	initial_cond	1	0.000000
exp13282	4.20732633e-17	0.097831	-0.000000	discard	Round 10: 3D at K=0.023 u=0.244 a=0.42 p=1.23	agent1	perturbation	1	0.000490
exp13283	4.88330883e-29	0.000000	-0.000000	discard	cycle 100 u=0.0990	agent0	initial_cond	0	0.000000
exp13283	3.73665023e-17	0.097831	-0.000000	discard	Round 10: 3D at K=0.023 u=0.244 a=0.42 p=1.24	agent1	perturbation	0	0.000490
exp13284	4.88330883e-29	0.000000	-0.000000	discard	cycle 100 u=0.0990	agent0	initial_cond	0	0.000000
exp13285	2.07284312e-17	0.100106	0.000000	discard	Round 10: 3D at K=0.023 u=0.244 a=0.43 p=1.20	agent1	perturbation	0	0.000544
exp13286	5.74085541e-29	0.000000	-0.000000	discard	cycle 100 u=0.0995	agent0	initial_cond	1	0.000000
exp13287	9.86267733e-17	0.100106	-0.000000	discard	Round 10: 3D at K=0.023 u=0.244 a=0.43 p=1.21	agent1	perturbation	0	0.000544
exp13288	5.74085541e-29	0.000000	-0.000000	discard	cycle 100 u=0.0995	agent0	initial_cond	0	0.000000
exp13289	1.32140962e-17	0.100106	-0.000000	discard	Round 10: 3D at K=0.023 u=0.244 a=0.43 p=1.22	agent1	perturbation	0	0.000544
exp13290	5.74085541e-29	0.000000	-0.000000	discard	cycle 100 u=0.0995	agent0	initial_cond	1	0.000000
exp13291	5.25454391e-17	0.100106	-0.000000	discard	Round 10: 3D at K=0.023 u=0.244 a=0.43 p=1.23	agent1	perturbation	1	0.000544
exp13292	1.54984578e-28	0.000000	0.000000	discard	cycle 100 u=0.0995	agent0	initial_cond	0	-0.000000
exp13293	3.49782742e-17	0.100106	-0.000000	discard	Round 10: 3D at K=0.023 u=0.244 a=0.43 p=1.24	agent1	perturbation	0	0.000544
exp13294	1.54984578e-28	0.000000	0.000000	discard	cycle 100 u=0.0995	agent0	initial_cond	0	-0.000000
exp13295	4.09769055e-17	0.102376	-0.000000	discard	Round 10: 3D at K=0.023 u=0.244 a=0.44 p=1.20	agent1	perturbation	1	0.000602
exp13296	1.54984578e-28	0.000000	0.000000	discard	cycle 100 u=0.0995	agent0	initial_cond	0	-0.000000
exp13297	2.53707625e-17	0.102376	0.000000	discard	Round 10: 3D at K=0.023 u=0.244 a=0.44 p=1.21	agent1	perturbation	0	0.000602
exp13298	1.60328418e-29	0.000000	-0.000000	discard	cycle 100 u=0.0995	agent0	initial_cond	0	-0.000000
exp13299	3.17673295e-17	0.102376	-0.000000	discard	Round 10: 3D at K=0.023 u=0.244 a=0.44 p=1.22	agent1	perturbation	1	0.000602
exp13299	1.60328418e-29	0.000000	-0.000000	discard	cycle 100 u=0.0995	agent0	initial_cond	1	-0.000000
exp13300	2.42745501e-17	0.102376	-0.000000	discard	Round 10: 3D at K=0.023 u=0.244 a=0.44 p=1.23	agent1	perturbation	0	0.000602
exp13300	1.60328418e-29	0.000000	-0.000000	discard	cycle 100 u=0.0995	agent0	initial_cond	0	-0.000000
exp13301	7.34590618e-29	0.000000	0.000000	discard	cycle 100 u=0.0995	agent0	initial_cond	0	0.000000
exp13301	7.69402482e-17	0.102376	-0.000000	discard	Round 10: 3D at K=0.023 u=0.244 a=0.44 p=1.24	agent1	perturbation	0	0.000602
exp13302	7.34590618e-29	0.000000	0.000000	discard	cycle 100 u=0.0995	agent0	initial_cond	0	0.000000
exp13302	1.58766621e-17	0.104643	-0.000000	discard	Round 10: 3D at K=0.023 u=0.244 a=0.45 p=1.20	agent1	perturbation	0	0.000664
exp13303	7.34590618e-29	0.000000	0.000000	discard	cycle 100 u=0.0995	agent0	initial_cond	0	0.000000
exp13304	3.79741213e-17	0.104643	-0.000000	discard	Round 10: 3D at K=0.023 u=0.244 a=0.45 p=1.21	agent1	perturbation	0	0.000664
exp13305	4.46546993e-29	0.000000	0.000000	discard	cycle 100 u=0.1000	agent0	initial_cond	1	-0.000000
exp13306	3.38867164e-17	0.104643	-0.000000	discard	Round 10: 3D at K=0.023 u=0.244 a=0.45 p=1.22	agent1	perturbation	0	0.000664
exp13307	4.46546993e-29	0.000000	0.000000	discard	cycle 100 u=0.1000	agent0	initial_cond	0	-0.000000
exp13308	3.34853091e-17	0.104643	-0.000000	discard	Round 10: 3D at K=0.023 u=0.244 a=0.45 p=1.23	agent1	perturbation	0	0.000664
exp13309	4.46546993e-29	0.000000	0.000000	discard	cycle 100 u=0.1000	agent0	initial_cond	0	-0.000000
exp13310	2.34274629e-17	0.104643	-0.000000	discard	Round 10: 3D at K=0.023 u=0.244 a=0.45 p=1.24	agent1	perturbation	1	0.000664
exp13311	4.08106752e-29	0.000000	0.000000	discard	cycle 100 u=0.1000	agent0	initial_cond	0	-0.000000
exp13312	3.02880712e-17	0.106907	-0.000000	discard	Round 10: 3D at K=0.023 u=0.244 a=0.46 p=1.20	agent1	perturbation	0	0.000731
exp13313	4.08106752e-29	0.000000	0.000000	discard	cycle 100 u=0.1000	agent0	initial_cond	0	-0.000000
exp13314	3.68324001e-17	0.106907	-0.000000	discard	Round 10: 3D at K=0.023 u=0.244 a=0.46 p=1.21	agent1	perturbation	1	0.000731
exp13315	4.08106752e-29	0.000000	0.000000	discard	cycle 100 u=0.1000	agent0	initial_cond	1	-0.000000
exp13316	7.21290640e-17	0.106907	-0.000000	discard	Round 10: 3D at K=0.023 u=0.244 a=0.46 p=1.22	agent1	perturbation	0	0.000731
exp13316	4.58623706e-29	0.000000	0.000000	discard	cycle 100 u=0.1000	agent0	initial_cond	0	-0.000000
exp13317	4.58626662e-17	0.106907	-0.000000	discard	Round 10: 3D at K=0.023 u=0.244 a=0.46 p=1.23	agent1	perturbation	0	0.000731
exp13317	4.58623706e-29	0.000000	0.000000	discard	cycle 100 u=0.1000	agent0	initial_cond	1	-0.000000
exp13318	4.58623706e-29	0.000000	0.000000	discard	cycle 100 u=0.1000	agent0	initial_cond	0	-0.000000
exp13318	3.38016235e-17	0.106907	-0.000000	discard	Round 10: 3D at K=0.023 u=0.244 a=0.46 p=1.24	agent1	perturbation	0	0.000731
exp13319	4.39794337e-29	0.000000	0.000000	discard	cycle 100 u=0.1000	agent0	initial_cond	0	-0.000000
exp13319	6.09477193e-17	0.097831	-0.000000	discard	Round 10: 3D at K=0.023 u=0.246 a=0.42 p=1.20	agent1	perturbation	0	0.000490
exp13320	4.39794337e-29	0.000000	0.000000	discard	cycle 100 u=0.1000	agent0	initial_cond	1	-0.000000
exp13320	2.32760147e-17	0.097831	0.000000	discard	Round 10: 3D at K=0.023 u=0.246 a=0.42 p=1.21	agent1	perturbation	0	0.000490
exp13321	4.39794337e-29	0.000000	0.000000	discard	cycle 100 u=0.1000	agent0	initial_cond	0	-0.000000
exp13322	5.59661671e-17	0.097831	-0.000000	discard	Round 10: 3D at K=0.023 u=0.246 a=0.42 p=1.22	agent1	perturbation	0	0.000490
exp13323	1.36727475e-28	0.000000	0.000000	discard	cycle 100 u=0.1050	agent0	initial_cond	1	-0.000000
exp13324	4.60502485e-17	0.097831	-0.000000	discard	Round 10: 3D at K=0.023 u=0.246 a=0.42 p=1.23	agent1	perturbation	1	0.000490
exp13325	1.36727475e-28	0.000000	0.000000	discard	cycle 100 u=0.1050	agent0	initial_cond	0	-0.000000
exp13326	2.69362420e-17	0.097831	-0.000000	discard	Round 10: 3D at K=0.023 u=0.246 a=0.42 p=1.24	agent1	perturbation	0	0.000490
exp13327	1.36727475e-28	0.000000	0.000000	discard	cycle 100 u=0.1050	agent0	initial_cond	0	-0.000000
exp13328	1.64260025e-17	0.100106	-0.000000	discard	Round 10: 3D at K=0.023 u=0.246 a=0.43 p=1.20	agent1	perturbation	1	0.000544
exp13329	6.14461376e-29	0.000000	0.000000	discard	cycle 100 u=0.1050	agent0	initial_cond	0	-0.000000
exp13330	6.06662012e-17	0.100106	-0.000000	discard	Round 10: 3D at K=0.023 u=0.246 a=0.43 p=1.21	agent1	perturbation	0	0.000544
exp13331	6.14461376e-29	0.000000	0.000000	discard	cycle 100 u=0.1050	agent0	initial_cond	0	-0.000000
exp13332	4.93715726e-17	0.100106	-0.000000	discard	Round 10: 3D at K=0.023 u=0.246 a=0.43 p=1.22	agent1	perturbation	1	0.000544
exp13333	6.14461376e-29	0.000000	0.000000	discard	cycle 100 u=0.1050	agent0	initial_cond	1	-0.000000
exp13334	6.01129668e-17	0.100106	-0.000000	discard	Round 10: 3D at K=0.023 u=0.246 a=0.43 p=1.23	agent1	perturbation	0	0.000544
exp13335	1.75906666e-28	0.000000	0.000000	discard	cycle 100 u=0.1050	agent0	initial_cond	0	-0.000000
exp13336	3.04513204e-17	0.100106	-0.000000	discard	Round 10: 3D at K=0.023 u=0.246 a=0.43 p=1.24	agent1	perturbation	0	0.000544
exp13336	1.75906666e-28	0.000000	0.000000	discard	cycle 100 u=0.1050	agent0	initial_cond	0	-0.000000
exp13337	2.40439265e-17	0.102376	-0.000000	discard	Round 10: 3D at K=0.023 u=0.246 a=0.44 p=1.20	agent1	perturbation	0	0.000602
exp13337	1.75906666e-28	0.000000	0.000000	discard	cycle 100 u=0.1050	agent0	initial_cond	0	-0.000000
exp13338	1.11257917e-28	0.000000	0.000000	discard	cycle 100 u=0.1050	agent0	initial_cond	0	-0.000000
exp13338	2.49708340e-17	0.102376	-0.000000	discard	Round 10: 3D at K=0.023 u=0.246 a=0.44 p=1.21	agent1	perturbation	0	0.000602
exp13339	1.11257917e-28	0.000000	0.000000	discard	cycle 100 u=0.1050	agent0	initial_cond	1	-0.000000
exp13339	5.42399241e-17	0.102376	-0.000000	discard	Round 10: 3D at K=0.023 u=0.246 a=0.44 p=1.22	agent1	perturbation	1	0.000602
exp13340	1.11257917e-28	0.000000	0.000000	discard	cycle 100 u=0.1050	agent0	initial_cond	0	-0.000000
exp13341	5.30407136e-17	0.102376	0.000000	discard	Round 10: 3D at K=0.023 u=0.246 a=0.44 p=1.23	agent1	perturbation	0	0.000602
exp13342	8.58580947e-29	0.000000	0.000000	discard	cycle 101 u=0.0975	agent0	initial_cond	1	0.000000
exp13343	8.09362858e-17	0.102376	-0.000000	discard	Round 10: 3D at K=0.023 u=0.246 a=0.44 p=1.24	agent1	perturbation	1	0.000602
exp13344	8.58580947e-29	0.000000	0.000000	discard	cycle 101 u=0.0975	agent0	initial_cond	0	0.000000
exp13345	7.05493836e-17	0.104643	-0.000000	discard	Round 10: 3D at K=0.023 u=0.246 a=0.45 p=1.20	agent1	perturbation	0	0.000664
exp13346	8.58580947e-29	0.000000	0.000000	discard	cycle 101 u=0.0975	agent0	initial_cond	0	0.000000
exp13347	6.34047012e-17	0.104643	-0.000000	discard	Round 10: 3D at K=0.023 u=0.246 a=0.45 p=1.21	agent1	perturbation	1	0.000664
exp13348	5.23962023e-29	0.000000	0.000000	discard	cycle 101 u=0.0975	agent0	initial_cond	1	0.000000
exp13349	2.03010104e-17	0.104643	-0.000000	discard	Round 10: 3D at K=0.023 u=0.246 a=0.45 p=1.22	agent1	perturbation	0	0.000664
exp13350	5.23962023e-29	0.000000	0.000000	discard	cycle 101 u=0.0975	agent0	initial_cond	0	0.000000
exp13351	2.62695658e-17	0.104643	-0.000000	discard	Round 10: 3D at K=0.023 u=0.246 a=0.45 p=1.23	agent1	perturbation	0	0.000664
exp13352	5.23962023e-29	0.000000	0.000000	discard	cycle 101 u=0.0975	agent0	initial_cond	1	0.000000
exp13353	4.03925768e-17	0.104643	-0.000000	discard	Round 10: 3D at K=0.023 u=0.246 a=0.45 p=1.24	agent1	perturbation	0	0.000664
exp13354	4.03266298e-29	0.000000	0.000000	discard	cycle 101 u=0.0975	agent0	initial_cond	0	0.000000
exp13355	5.11061015e-17	0.106907	-0.000000	discard	Round 10: 3D at K=0.023 u=0.246 a=0.46 p=1.20	agent1	perturbation	0	0.000731
exp13355	4.03266298e-29	0.000000	0.000000	discard	cycle 101 u=0.0975	agent0	initial_cond	0	0.000000
exp13356	3.64050657e-17	0.106907	-0.000000	discard	Round 10: 3D at K=0.023 u=0.246 a=0.46 p=1.21	agent1	perturbation	0	0.000731
exp13356	4.03266298e-29	0.000000	0.000000	discard	cycle 101 u=0.0975	agent0	initial_cond	0	0.000000
exp13357	4.80015937e-29	0.000000	0.000000	discard	cycle 101 u=0.0975	agent0	initial_cond	0	0.000000
exp13357	4.87026283e-17	0.106907	-0.000000	discard	Round 10: 3D at K=0.023 u=0.246 a=0.46 p=1.22	agent1	perturbation	0	0.000731
exp13358	4.80015937e-29	0.000000	0.000000	discard	cycle 101 u=0.0975	agent0	initial_cond	1	0.000000
exp13358	1.28530972e-16	0.106907	-0.000000	discard	Round 10: 3D at K=0.023 u=0.246 a=0.46 p=1.23	agent1	perturbation	1	0.000731
exp13359	4.80015937e-29	0.000000	0.000000	discard	cycle 101 u=0.0975	agent0	initial_cond	0	0.000000
exp13360	6.08908763e-17	0.106907	-0.000000	discard	Round 10: 3D at K=0.023 u=0.246 a=0.46 p=1.24	agent1	perturbation	0	0.000731
exp13361	2.68824537e-29	0.000000	0.000000	discard	cycle 101 u=0.0980	agent0	initial_cond	0	-0.000000
exp13362	2.06389297e-17	0.097831	-0.000000	discard	Round 10: 3D at K=0.023 u=0.248 a=0.42 p=1.20	agent1	perturbation	1	0.000490
exp13363	2.68824537e-29	0.000000	0.000000	discard	cycle 101 u=0.0980	agent0	initial_cond	0	-0.000000
exp13364	3.13559665e-17	0.097831	-0.000000	discard	Round 10: 3D at K=0.023 u=0.248 a=0.42 p=1.21	agent1	perturbation	0	0.000490
exp13365	2.68824537e-29	0.000000	0.000000	discard	cycle 101 u=0.0980	agent0	initial_cond	0	-0.000000
exp13366	4.19338651e-17	0.097831	-0.000000	discard	Round 10: 3D at K=0.023 u=0.248 a=0.42 p=1.22	agent1	perturbation	0	0.000490
exp13367	6.16758073e-29	0.000000	0.000000	discard	cycle 101 u=0.0980	agent0	initial_cond	1	-0.000000
exp13368	1.17609436e-17	0.097831	-0.000000	discard	Round 10: 3D at K=0.023 u=0.248 a=0.42 p=1.23	agent1	perturbation	0	0.000490
exp13369	6.16758073e-29	0.000000	0.000000	discard	cycle 101 u=0.0980	agent0	initial_cond	0	-0.000000
exp13370	5.02504479e-17	0.097831	-0.000000	discard	Round 10: 3D at K=0.023 u=0.248 a=0.42 p=1.24	agent1	perturbation	0	0.000490
exp13371	6.16758073e-29	0.000000	0.000000	discard	cycle 101 u=0.0980	agent0	initial_cond	0	-0.000000
exp13372	2.47768142e-17	0.100106	-0.000000	discard	Round 10: 3D at K=0.023 u=0.248 a=0.43 p=1.20	agent1	perturbation	0	0.000544
exp13372	2.01926478e-29	0.000000	0.000000	discard	cycle 101 u=0.0980	agent0	initial_cond	0	0.000000
exp13373	1.82544653e-17	0.100106	-0.000000	discard	Round 10: 3D at K=0.023 u=0.248 a=0.43 p=1.21	agent1	perturbation	0	0.000544
exp13373	2.01926478e-29	0.000000	0.000000	discard	cycle 101 u=0.0980	agent0	initial_cond	0	0.000000
exp13374	2.01926478e-29	0.000000	0.000000	discard	cycle 101 u=0.0980	agent0	initial_cond	1	0.000000
exp13374	3.40910907e-17	0.100106	-0.000000	discard	Round 10: 3D at K=0.023 u=0.248 a=0.43 p=1.22	agent1	perturbation	1	0.000544
exp13375	1.30310780e-28	0.000000	0.000000	discard	cycle 101 u=0.0980	agent0	initial_cond	0	-0.000000
exp13375	2.64113498e-17	0.100106	-0.000000	discard	Round 10: 3D at K=0.023 u=0.248 a=0.43 p=1.23	agent1	perturbation	0	0.000544
exp13376	1.30310780e-28	0.000000	0.000000	discard	cycle 101 u=0.0980	agent0	initial_cond	1	-0.000000
exp13376	3.67538252e-17	0.100106	-0.000000	discard	Round 10: 3D at K=0.023 u=0.248 a=0.43 p=1.24	agent1	perturbation	1	0.000544
exp13377	1.30310780e-28	0.000000	0.000000	discard	cycle 101 u=0.0980	agent0	initial_cond	0	-0.000000
exp13378	5.51134258e-17	0.102376	-0.000000	discard	Round 10: 3D at K=0.023 u=0.248 a=0.44 p=1.20	agent1	perturbation	0	0.000602
exp13379	5.45343271e-29	0.000000	0.000000	discard	cycle 101 u=0.0982	agent0	initial_cond	0	-0.000000
exp13380	4.98153410e-17	0.102376	-0.000000	discard	Round 10: 3D at K=0.023 u=0.248 a=0.44 p=1.21	agent1	perturbation	0	0.000602
exp13381	5.45343271e-29	0.000000	0.000000	discard	cycle 101 u=0.0982	agent0	initial_cond	1	-0.000000
exp13382	8.59571598e-17	0.102376	-0.000000	discard	Round 10: 3D at K=0.023 u=0.248 a=0.44 p=1.22	agent1	perturbation	0	0.000602
exp13383	5.45343271e-29	0.000000	0.000000	discard	cycle 101 u=0.0982	agent0	initial_cond	0	-0.000000
exp13384	3.99233561e-17	0.102376	-0.000000	discard	Round 10: 3D at K=0.023 u=0.248 a=0.44 p=1.23	agent1	perturbation	0	0.000602
exp13385	1.23429977e-28	0.000000	0.000000	discard	cycle 101 u=0.0982	agent0	initial_cond	1	0.000000
exp13386	8.22081112e-17	0.102376	-0.000000	discard	Round 10: 3D at K=0.023 u=0.248 a=0.44 p=1.24	agent1	perturbation	0	0.000602
exp13387	1.23429977e-28	0.000000	0.000000	discard	cycle 101 u=0.0982	agent0	initial_cond	0	0.000000
exp13388	8.21779647e-17	0.104643	-0.000000	discard	Round 10: 3D at K=0.023 u=0.248 a=0.45 p=1.20	agent1	perturbation	0	0.000664
exp13389	1.23429977e-28	0.000000	0.000000	discard	cycle 101 u=0.0982	agent0	initial_cond	0	0.000000
exp13390	1.70549904e-17	0.104643	-0.000000	discard	Round 10: 3D at K=0.023 u=0.248 a=0.45 p=1.21	agent1	perturbation	1	0.000664
exp13390	1.88036672e-29	0.000000	0.000000	discard	cycle 101 u=0.0982	agent0	initial_cond	0	0.000000
exp13391	3.24623855e-17	0.104643	-0.000000	discard	Round 10: 3D at K=0.023 u=0.248 a=0.45 p=1.22	agent1	perturbation	0	0.000664
exp13391	1.88036672e-29	0.000000	0.000000	discard	cycle 101 u=0.0982	agent0	initial_cond	0	0.000000
exp13392	1.88036672e-29	0.000000	0.000000	discard	cycle 101 u=0.0982	agent0	initial_cond	1	0.000000
exp13392	4.14734287e-17	0.104643	-0.000000	discard	Round 10: 3D at K=0.023 u=0.248 a=0.45 p=1.23	agent1	perturbation	1	0.000664
exp13393	1.91190259e-29	0.000000	-0.000000	discard	cycle 101 u=0.0982	agent0	initial_cond	0	0.000000
exp13393	3.82877504e-17	0.104643	-0.000000	discard	Round 10: 3D at K=0.023 u=0.248 a=0.45 p=1.24	agent1	perturbation	0	0.000664
exp13394	1.91190259e-29	0.000000	-0.000000	discard	cycle 101 u=0.0982	agent0	initial_cond	0	0.000000
exp13394	4.69481576e-17	0.106907	0.000000	discard	Round 10: 3D at K=0.023 u=0.248 a=0.46 p=1.20	agent1	perturbation	1	0.000731
exp13395	1.91190259e-29	0.000000	-0.000000	discard	cycle 101 u=0.0982	agent0	initial_cond	0	0.000000
exp13396	1.41514903e-16	0.106907	-0.000000	discard	Round 10: 3D at K=0.023 u=0.248 a=0.46 p=1.21	agent1	perturbation	0	0.000731
exp13397	6.13049994e-29	0.000000	0.000000	discard	cycle 101 u=0.0985	agent0	initial_cond	0	0.000000
exp13398	5.19701597e-17	0.106907	-0.000000	discard	Round 10: 3D at K=0.023 u=0.248 a=0.46 p=1.22	agent1	perturbation	0	0.000731
exp13399	6.13049994e-29	0.000000	0.000000	discard	cycle 101 u=0.0985	agent0	initial_cond	1	0.000000
exp13400	3.05403469e-17	0.106907	-0.000000	discard	Round 10: 3D at K=0.023 u=0.248 a=0.46 p=1.23	agent1	perturbation	0	0.000731
exp13401	6.13049994e-29	0.000000	0.000000	discard	cycle 101 u=0.0985	agent0	initial_cond	0	0.000000
exp13402	1.00580919e-16	0.106907	-0.000000	discard	Round 10: 3D at K=0.023 u=0.248 a=0.46 p=1.24	agent1	perturbation	0	0.000731
exp13403	5.49750971e-29	0.000000	0.000000	discard	cycle 101 u=0.0985	agent0	initial_cond	0	0.000000
exp13404	5.49750971e-29	0.000000	0.000000	discard	cycle 101 u=0.0985	agent0	initial_cond	0	0.000000
exp13405	5.49750971e-29	0.000000	0.000000	discard	cycle 101 u=0.0985	agent0	initial_cond	0	0.000000
exp13406	4.15642452e-29	0.000000	0.000000	discard	cycle 101 u=0.0985	agent0	initial_cond	1	0.000000
exp13407	4.15642452e-29	0.000000	0.000000	discard	cycle 101 u=0.0985	agent0	initial_cond	0	0.000000
exp13408	4.15642452e-29	0.000000	0.000000	discard	cycle 101 u=0.0985	agent0	initial_cond	1	0.000000
exp13409	2.19292611e-29	0.000000	0.000000	discard	cycle 101 u=0.0985	agent0	initial_cond	0	-0.000000
exp13410	2.19292611e-29	0.000000	0.000000	discard	cycle 101 u=0.0985	agent0	initial_cond	0	-0.000000
exp13411	2.19292611e-29	0.000000	0.000000	discard	cycle 101 u=0.0985	agent0	initial_cond	1	-0.000000
exp13412	4.22491788e-29	0.000000	0.000000	discard	cycle 101 u=0.0990	agent0	initial_cond	0	-0.000000
exp13413	4.22491788e-29	0.000000	0.000000	discard	cycle 101 u=0.0990	agent0	initial_cond	1	-0.000000
exp13414	4.22491788e-29	0.000000	0.000000	discard	cycle 101 u=0.0990	agent0	initial_cond	0	-0.000000
exp13415	3.22245147e-29	0.000000	0.000000	discard	cycle 101 u=0.0990	agent0	initial_cond	0	0.000000
exp13416	3.22245147e-29	0.000000	0.000000	discard	cycle 101 u=0.0990	agent0	initial_cond	0	0.000000
exp13417	3.22245147e-29	0.000000	0.000000	discard	cycle 101 u=0.0990	agent0	initial_cond	0	0.000000
exp13418	4.50941488e-29	0.000000	-0.000000	discard	cycle 101 u=0.0990	agent0	initial_cond	1	0.000000
exp13419	4.50941488e-29	0.000000	-0.000000	discard	cycle 101 u=0.0990	agent0	initial_cond	0	0.000000
exp13420	4.50941488e-29	0.000000	-0.000000	discard	cycle 101 u=0.0990	agent0	initial_cond	0	0.000000
exp13421	4.88330883e-29	0.000000	-0.000000	discard	cycle 101 u=0.0990	agent0	initial_cond	0	0.000000
exp13422	4.88330883e-29	0.000000	-0.000000	discard	cycle 101 u=0.0990	agent0	initial_cond	0	0.000000
exp13423	4.88330883e-29	0.000000	-0.000000	discard	cycle 101 u=0.0990	agent0	initial_cond	1	0.000000
exp13424	5.74085541e-29	0.000000	-0.000000	discard	cycle 101 u=0.0995	agent0	initial_cond	0	0.000000
exp13425	5.74085541e-29	0.000000	-0.000000	discard	cycle 101 u=0.0995	agent0	initial_cond	0	0.000000
exp13426	5.74085541e-29	0.000000	-0.000000	discard	cycle 101 u=0.0995	agent0	initial_cond	0	0.000000
exp13427	1.54984578e-28	0.000000	0.000000	discard	cycle 101 u=0.0995	agent0	initial_cond	0	-0.000000
exp13428	1.54984578e-28	0.000000	0.000000	discard	cycle 101 u=0.0995	agent0	initial_cond	1	-0.000000
exp13429	1.54984578e-28	0.000000	0.000000	discard	cycle 101 u=0.0995	agent0	initial_cond	0	-0.000000
exp13430	1.60328418e-29	0.000000	-0.000000	discard	cycle 101 u=0.0995	agent0	initial_cond	1	-0.000000
