exp_id	residual	solution_norm	solution_mean	status	description	agent	design	elapsed_s	solution_energy
exp2658	1.11257917e-28	0.000000	0.000000	discard	cycle 8 u=0.1050	agent0	initial_cond	0	-0.000000
exp2659	1.11257917e-28	0.000000	0.000000	discard	cycle 8 u=0.1050	agent0	initial_cond	0	-0.000000
exp2660	1.11257917e-28	0.000000	0.000000	discard	recover n=100 tol=1e-8	agent0	solver_param	1	-0.000000
exp2661	1.11257917e-28	0.000000	0.000000	discard	cycle 8 u=0.1050	agent0	initial_cond	1	-0.000000
exp2662	8.58580947e-29	0.000000	0.000000	discard	recover n=150 tol=1e-8	agent0	solver_param	0	0.000000
exp2663	8.58580947e-29	0.000000	0.000000	discard	cycle 9 u=0.0975	agent0	initial_cond	0	0.000000
exp2664	8.58580947e-29	0.000000	0.000000	discard	recover n=200 tol=1e-8	agent0	solver_param	0	0.000000
exp2665	8.58580947e-29	0.000000	0.000000	discard	cycle 9 u=0.0975	agent0	initial_cond	0	0.000000
exp2666	8.58580947e-29	0.000000	0.000000	discard	recover n=250 tol=1e-8	agent0	solver_param	1	0.000000
exp2667	8.58580947e-29	0.000000	0.000000	discard	cycle 9 u=0.0975	agent0	initial_cond	0	0.000000
exp2668	5.23962023e-29	0.000000	0.000000	discard	recover n=269 tol=1e-8	agent0	solver_param	0	0.000000
exp2669	5.23962023e-29	0.000000	0.000000	discard	cycle 9 u=0.0975	agent0	initial_cond	0	0.000000
exp2670	5.23962023e-29	0.000000	0.000000	discard	cycle 9 u=0.0975	agent0	initial_cond	1	0.000000
exp2671	5.23962023e-29	0.000000	0.000000	discard	cycle 9 u=0.0975	agent0	initial_cond	0	0.000000
exp2672	4.03266298e-29	0.000000	0.000000	discard	cycle 9 u=0.0975	agent0	initial_cond	0	0.000000
exp2673	4.03266298e-29	0.000000	0.000000	discard	cycle 9 u=0.0975	agent0	initial_cond	1	0.000000
exp2674	4.03266298e-29	0.000000	0.000000	discard	cycle 9 u=0.0975	agent0	initial_cond	0	0.000000
exp2675	4.80015937e-29	0.000000	0.000000	discard	cycle 9 u=0.0975	agent0	initial_cond	1	0.000000
exp2676	4.80015937e-29	0.000000	0.000000	discard	cycle 9 u=0.0975	agent0	initial_cond	0	0.000000
exp2677	4.80015937e-29	0.000000	0.000000	discard	cycle 9 u=0.0975	agent0	initial_cond	0	0.000000
exp2678	2.68824537e-29	0.000000	0.000000	discard	cycle 9 u=0.0980	agent0	initial_cond	1	-0.000000
exp2679	2.68824537e-29	0.000000	0.000000	discard	cycle 9 u=0.0980	agent0	initial_cond	0	-0.000000
exp2680	2.68824537e-29	0.000000	0.000000	discard	cycle 9 u=0.0980	agent0	initial_cond	0	-0.000000
exp2681	6.16758073e-29	0.000000	0.000000	discard	cycle 9 u=0.0980	agent0	initial_cond	0	-0.000000
exp2682	6.16758073e-29	0.000000	0.000000	discard	cycle 9 u=0.0980	agent0	initial_cond	0	-0.000000
exp2683	6.16758073e-29	0.000000	0.000000	discard	cycle 9 u=0.0980	agent0	initial_cond	1	-0.000000
exp2684	2.01926478e-29	0.000000	0.000000	discard	cycle 9 u=0.0980	agent0	initial_cond	0	0.000000
exp2685	2.01926478e-29	0.000000	0.000000	discard	cycle 9 u=0.0980	agent0	initial_cond	0	0.000000
exp2686	2.01926478e-29	0.000000	0.000000	discard	cycle 9 u=0.0980	agent0	initial_cond	1	0.000000
exp2687	5.90447763e-09	1.002503	1.000218	discard	cycle 9 u=0.0980	agent0	initial_cond	0	-1.523848
exp2688	1.30310780e-28	0.000000	0.000000	discard	low n=50 tol=1e-8	agent0	solver_param	0	-0.000000
exp2689	3.38270383e-09	1.002503	1.000218	discard	cycle 9 u=0.0980	agent0	initial_cond	1	-1.523848
exp2690	1.30310780e-28	0.000000	0.000000	discard	low n=60 tol=1e-8	agent0	solver_param	1	-0.000000
exp2691	2.11499135e-09	1.002503	1.000218	discard	cycle 9 u=0.0980	agent0	initial_cond	0	-1.523848
exp2692	5.45343271e-29	0.000000	0.000000	discard	low n=70 tol=1e-8	agent0	solver_param	0	-0.000000
exp2693	9.99272203e-09	1.002503	1.000218	discard	cycle 9 u=0.0982	agent0	initial_cond	0	-1.523848
exp2694	5.45343271e-29	0.000000	0.000000	discard	low n=80 tol=1e-8	agent0	solver_param	1	-0.000000
exp2695	7.88252869e-09	1.002503	1.000218	discard	cycle 9 u=0.0982	agent0	initial_cond	1	-1.523848
exp2696	5.45343271e-29	0.000000	0.000000	discard	low n=90 tol=1e-8	agent0	solver_param	0	-0.000000
exp2697	5.45343271e-29	0.000000	0.000000	discard	cycle 9 u=0.0982	agent0	initial_cond	0	-0.000000
exp2698	1.23429977e-28	0.000000	0.000000	discard	cycle 9 u=0.0982	agent0	initial_cond	1	0.000000
exp2699	1.23429977e-28	0.000000	0.000000	discard	cycle 9 u=0.0982	agent0	initial_cond	0	0.000000
exp2700	1.23429977e-28	0.000000	0.000000	discard	cycle 9 u=0.0982	agent0	initial_cond	0	0.000000
exp2701	1.88036672e-29	0.000000	0.000000	discard	cycle 9 u=0.0982	agent0	initial_cond	1	0.000000
exp2702	1.88036672e-29	0.000000	0.000000	discard	cycle 9 u=0.0982	agent0	initial_cond	0	0.000000
exp2703	1.39973253e-12	0.070278	-0.000000	discard	4TH_BRANCH_VERIFY trial=1	agent1	memory	0	0.000097
exp2704	1.88036672e-29	0.000000	0.000000	discard	cycle 9 u=0.0982	agent0	initial_cond	0	0.000000
exp2705	1.39973253e-12	0.070278	-0.000000	discard	4TH_BRANCH_VERIFY trial=1	agent1	memory	1	0.000097
exp2706	1.91190259e-29	0.000000	-0.000000	discard	cycle 9 u=0.0982	agent0	initial_cond	0	0.000000
exp2707	1.39973253e-12	0.070278	-0.000000	discard	4TH_BRANCH_VERIFY trial=1	agent1	memory	0	0.000097
exp2708	1.91190259e-29	0.000000	-0.000000	discard	cycle 9 u=0.0982	agent0	initial_cond	0	0.000000
exp2709	1.39973253e-12	0.070278	-0.000000	discard	4TH_BRANCH_VERIFY trial=2	agent1	memory	0	0.000097
exp2710	1.91190259e-29	0.000000	-0.000000	discard	cycle 9 u=0.0982	agent0	initial_cond	1	0.000000
exp2711	1.39973253e-12	0.070278	-0.000000	discard	4TH_BRANCH_VERIFY trial=2	agent1	memory	1	0.000097
exp2712	6.13049994e-29	0.000000	0.000000	discard	cycle 9 u=0.0985	agent0	initial_cond	0	0.000000
exp2713	1.39973253e-12	0.070278	-0.000000	discard	4TH_BRANCH_VERIFY trial=2	agent1	memory	0	0.000097
exp2714	6.13049994e-29	0.000000	0.000000	discard	cycle 9 u=0.0985	agent0	initial_cond	0	0.000000
exp2715	1.39973253e-12	0.070278	-0.000000	discard	4TH_BRANCH_VERIFY trial=3	agent1	memory	1	0.000097
exp2716	6.13049994e-29	0.000000	0.000000	discard	cycle 9 u=0.0985	agent0	initial_cond	1	0.000000
exp2717	1.39973253e-12	0.070278	-0.000000	discard	4TH_BRANCH_VERIFY trial=3	agent1	memory	0	0.000097
exp2718	5.49750971e-29	0.000000	0.000000	discard	cycle 9 u=0.0985	agent0	initial_cond	0	0.000000
exp2719	1.39973253e-12	0.070278	-0.000000	discard	4TH_BRANCH_VERIFY trial=3	agent1	memory	0	0.000097
exp2720	5.49750971e-29	0.000000	0.000000	discard	cycle 9 u=0.0985	agent0	initial_cond	1	0.000000
exp2721	1.39973253e-12	0.070278	-0.000000	discard	4TH_BRANCH_VERIFY trial=4	agent1	memory	1	0.000097
exp2722	5.49750971e-29	0.000000	0.000000	discard	cycle 9 u=0.0985	agent0	initial_cond	0	0.000000
exp2723	1.39973253e-12	0.070278	-0.000000	discard	4TH_BRANCH_VERIFY trial=4	agent1	memory	0	0.000097
exp2724	4.15642452e-29	0.000000	0.000000	discard	kickstart u=5.0 n=50 tol=1e-6	agent0	branch_search	0	0.000000
exp2725	4.15642452e-29	0.000000	0.000000	discard	cycle 9 u=0.0985	agent0	initial_cond	0	0.000000
exp2726	1.39973253e-12	0.070278	-0.000000	discard	4TH_BRANCH_VERIFY trial=4	agent1	memory	0	0.000097
exp2727	4.15642452e-29	0.000000	0.000000	discard	cycle 9 u=0.0985	agent0	initial_cond	1	0.000000
exp2728	1.39973253e-12	0.070278	-0.000000	discard	4TH_BRANCH_VERIFY trial=5	agent1	memory	0	0.000097
exp2729	4.15642452e-29	0.000000	0.000000	discard	cycle 9 u=0.0985	agent0	initial_cond	0	0.000000
exp2730	1.39973253e-12	0.070278	-0.000000	discard	4TH_BRANCH_VERIFY trial=5	agent1	memory	0	0.000097
exp2731	2.19292611e-29	0.000000	0.000000	discard	cycle 9 u=0.0985	agent0	initial_cond	1	-0.000000
exp2732	1.39973253e-12	0.070278	-0.000000	discard	4TH_BRANCH_VERIFY trial=5	agent1	memory	1	0.000097
exp2733	2.19292611e-29	0.000000	0.000000	discard	cycle 9 u=0.0985	agent0	initial_cond	0	-0.000000
exp2734	3.74579333e-21	0.000000	-0.000000	discard	4TH_MODES modes=1	agent1	memory	0	-0.000000
exp2735	2.19292611e-29	0.000000	0.000000	discard	cycle 9 u=0.0985	agent0	initial_cond	0	-0.000000
exp2736	3.74579333e-21	0.000000	-0.000000	discard	4TH_MODES modes=1	agent1	memory	0	-0.000000
exp2737	4.22491788e-29	0.000000	0.000000	discard	cycle 9 u=0.0990	agent0	initial_cond	1	-0.000000
exp2738	5.22282692e-12	0.000138	0.000000	discard	4TH_MODES modes=2	agent1	memory	0	-0.000000
exp2739	4.22491788e-29	0.000000	0.000000	discard	cycle 9 u=0.0990	agent0	initial_cond	0	-0.000000
exp2740	5.22282692e-12	0.000138	0.000000	discard	4TH_MODES modes=2	agent1	memory	0	-0.000000
exp2741	4.22491788e-29	0.000000	0.000000	discard	cycle 9 u=0.0990	agent0	initial_cond	0	-0.000000
exp2742	1.39973253e-12	0.070278	-0.000000	discard	4TH_MODES modes=3	agent1	memory	1	0.000097
exp2743	3.22245147e-29	0.000000	0.000000	discard	cycle 9 u=0.0990	agent0	initial_cond	0	0.000000
exp2744	1.39973253e-12	0.070278	-0.000000	discard	4TH_MODES modes=3	agent1	memory	0	0.000097
exp2745	3.22245147e-29	0.000000	0.000000	discard	cycle 9 u=0.0990	agent0	initial_cond	0	0.000000
exp2746	1.33162036e-12	0.070535	-0.000000	discard	4TH_MODES modes=4	agent1	memory	0	0.000099
exp2747	3.22245147e-29	0.000000	0.000000	discard	cycle 9 u=0.0990	agent0	initial_cond	1	0.000000
exp2748	1.33162036e-12	0.070535	-0.000000	discard	4TH_MODES modes=4	agent1	memory	1	0.000099
exp2749	4.50941488e-29	0.000000	-0.000000	discard	cycle 9 u=0.0990	agent0	initial_cond	0	0.000000
exp2750	1.33401055e-12	0.070536	-0.000000	discard	4TH_MODES modes=5	agent1	memory	0	0.000099
exp2751	4.50941488e-29	0.000000	-0.000000	discard	cycle 9 u=0.0990	agent0	initial_cond	0	0.000000
exp2752	1.33401055e-12	0.070536	-0.000000	discard	4TH_MODES modes=5	agent1	memory	1	0.000099
exp2753	4.50941488e-29	0.000000	-0.000000	discard	cycle 9 u=0.0990	agent0	initial_cond	0	0.000000
exp2754	1.33408460e-12	0.070536	-0.000000	discard	4TH_MODES modes=6	agent1	memory	0	0.000099
exp2755	4.88330883e-29	0.000000	-0.000000	discard	cycle 9 u=0.0990	agent0	initial_cond	0	0.000000
exp2756	1.33408460e-12	0.070536	-0.000000	discard	4TH_MODES modes=6	agent1	memory	0	0.000099
exp2757	4.88330883e-29	0.000000	-0.000000	discard	cycle 9 u=0.0990	agent0	initial_cond	1	0.000000
exp2758	9.99175173e-12	0.070536	-0.000000	discard	4TH_SCIPY	agent1	memory	1	0.000175
exp2759	4.88330883e-29	0.000000	-0.000000	discard	cycle 9 u=0.0990	agent0	initial_cond	0	0.000000
exp2760	9.99175173e-12	0.070536	-0.000000	discard	4TH_SCIPY	agent1	memory	0	0.000175
exp2761	5.74085541e-29	0.000000	-0.000000	discard	cycle 9 u=0.0995	agent0	initial_cond	0	0.000000
exp2762	9.99175173e-12	0.070536	-0.000000	discard	4TH_SCIPY	agent1	memory	1	0.000175
exp2763	5.74085541e-29	0.000000	-0.000000	discard	cycle 9 u=0.0995	agent0	initial_cond	1	0.000000
exp2764	5.74085541e-29	0.000000	-0.000000	discard	cycle 9 u=0.0995	agent0	initial_cond	0	0.000000
exp2765	1.54984578e-28	0.000000	0.000000	discard	cycle 9 u=0.0995	agent0	initial_cond	1	-0.000000
exp2766	1.54984578e-28	0.000000	0.000000	discard	cycle 9 u=0.0995	agent0	initial_cond	0	-0.000000
exp2767	1.54984578e-28	0.000000	0.000000	discard	cycle 9 u=0.0995	agent0	initial_cond	0	-0.000000
exp2768	1.60328418e-29	0.000000	-0.000000	discard	cycle 9 u=0.0995	agent0	initial_cond	1	-0.000000
exp2769	1.60328418e-29	0.000000	-0.000000	discard	cycle 9 u=0.0995	agent0	initial_cond	0	-0.000000
exp2770	1.60328418e-29	0.000000	-0.000000	discard	cycle 9 u=0.0995	agent0	initial_cond	0	-0.000000
exp2771	7.34590618e-29	0.000000	0.000000	discard	cycle 9 u=0.0995	agent0	initial_cond	0	0.000000
exp2772	7.34590618e-29	0.000000	0.000000	discard	cycle 9 u=0.0995	agent0	initial_cond	0	0.000000
exp2773	7.34590618e-29	0.000000	0.000000	discard	cycle 9 u=0.0995	agent0	initial_cond	1	0.000000
exp2774	4.46546993e-29	0.000000	0.000000	discard	cycle 9 u=0.1000	agent0	initial_cond	0	-0.000000
exp2775	4.46546993e-29	0.000000	0.000000	discard	cycle 9 u=0.1000	agent0	initial_cond	0	-0.000000
exp2776	4.46546993e-29	0.000000	0.000000	discard	cycle 9 u=0.1000	agent0	initial_cond	1	-0.000000
exp2777	4.08106752e-29	0.000000	0.000000	discard	cycle 9 u=0.1000	agent0	initial_cond	0	-0.000000
exp2778	4.08106752e-29	0.000000	0.000000	discard	cycle 9 u=0.1000	agent0	initial_cond	1	-0.000000
exp2779	4.08106752e-29	0.000000	0.000000	discard	cycle 9 u=0.1000	agent0	initial_cond	0	-0.000000
exp2780	4.58623706e-29	0.000000	0.000000	discard	cycle 9 u=0.1000	agent0	initial_cond	0	-0.000000
exp2781	4.58623706e-29	0.000000	0.000000	discard	cycle 9 u=0.1000	agent0	initial_cond	1	-0.000000
exp2782	4.58623706e-29	0.000000	0.000000	discard	cycle 9 u=0.1000	agent0	initial_cond	0	-0.000000
exp2783	4.39794337e-29	0.000000	0.000000	discard	cycle 9 u=0.1000	agent0	initial_cond	0	-0.000000
exp2784	4.39794337e-29	0.000000	0.000000	discard	cycle 9 u=0.1000	agent0	initial_cond	0	-0.000000
exp2785	4.39794337e-29	0.000000	0.000000	discard	cycle 9 u=0.1000	agent0	initial_cond	0	-0.000000
exp2786	1.36727475e-28	0.000000	0.000000	discard	cycle 9 u=0.1050	agent0	initial_cond	1	-0.000000
exp2787	1.36727475e-28	0.000000	0.000000	discard	cycle 9 u=0.1050	agent0	initial_cond	0	-0.000000
exp2788	1.36727475e-28	0.000000	0.000000	discard	cycle 9 u=0.1050	agent0	initial_cond	0	-0.000000
exp2789	6.14461376e-29	0.000000	0.000000	discard	cycle 9 u=0.1050	agent0	initial_cond	0	-0.000000
exp2790	6.14461376e-29	0.000000	0.000000	discard	cycle 9 u=0.1050	agent0	initial_cond	0	-0.000000
exp2791	6.14461376e-29	0.000000	0.000000	discard	cycle 9 u=0.1050	agent0	initial_cond	1	-0.000000
exp2792	1.75906666e-28	0.000000	0.000000	discard	cycle 9 u=0.1050	agent0	initial_cond	0	-0.000000
exp2793	1.75906666e-28	0.000000	0.000000	discard	cycle 9 u=0.1050	agent0	initial_cond	0	-0.000000
exp2794	1.75906666e-28	0.000000	0.000000	discard	cycle 9 u=0.1050	agent0	initial_cond	1	-0.000000
exp2795	crash	0	0	crash	cycle 9 u=0.1050	agent0	initial_cond	0	0
exp2796	crash	0	0	crash	Fourier spectral positive u=1.0 modes=64	agent0	solver_param	0	0
exp2796	3.74579333e-21	0.000000	-0.000000	discard	ULTRA_BREAKTHROUGH trial=1	agent1	memory	0	-0.000000
exp2797	1.11257917e-28	0.000000	0.000000	discard	cycle 9 u=0.1050	agent0	initial_cond	1	-0.000000
exp2798	3.74579333e-21	0.000000	-0.000000	discard	ULTRA_BREAKTHROUGH trial=2	agent1	memory	1	-0.000000
exp2799	1.11257917e-28	0.000000	0.000000	discard	cycle 9 u=0.1050	agent0	initial_cond	0	-0.000000
exp2800	3.74579333e-21	0.000000	-0.000000	discard	ULTRA_BREAKTHROUGH trial=3	agent1	memory	0	-0.000000
exp2801	8.58580947e-29	0.000000	0.000000	discard	cycle 10 u=0.0975	agent0	initial_cond	0	0.000000
exp2802	3.74579333e-21	0.000000	-0.000000	discard	ULTRA_BREAKTHROUGH trial=4	agent1	memory	0	-0.000000
exp2803	8.58580947e-29	0.000000	0.000000	discard	cycle 10 u=0.0975	agent0	initial_cond	1	0.000000
exp2804	3.74579333e-21	0.000000	-0.000000	discard	ULTRA_BREAKTHROUGH trial=5	agent1	memory	0	-0.000000
exp2805	8.58580947e-29	0.000000	0.000000	discard	cycle 10 u=0.0975	agent0	initial_cond	0	0.000000
exp2806	3.74579333e-21	0.000000	-0.000000	discard	ULTRA_BREAKTHROUGH trial=6	agent1	memory	0	-0.000000
exp2807	5.23962023e-29	0.000000	0.000000	discard	cycle 10 u=0.0975	agent0	initial_cond	0	0.000000
exp2808	3.74579333e-21	0.000000	-0.000000	discard	ULTRA_BREAKTHROUGH trial=7	agent1	memory	1	-0.000000
exp2809	5.23962023e-29	0.000000	0.000000	discard	cycle 10 u=0.0975	agent0	initial_cond	0	0.000000
exp2810	3.74579333e-21	0.000000	-0.000000	discard	ULTRA_BREAKTHROUGH trial=8	agent1	memory	0	-0.000000
exp2811	5.23962023e-29	0.000000	0.000000	discard	cycle 10 u=0.0975	agent0	initial_cond	0	0.000000
exp2812	3.74579333e-21	0.000000	-0.000000	discard	ULTRA_BREAKTHROUGH trial=9	agent1	memory	0	-0.000000
exp2813	4.03266298e-29	0.000000	0.000000	discard	cycle 10 u=0.0975	agent0	initial_cond	1	0.000000
exp2814	3.74579333e-21	0.000000	-0.000000	discard	ULTRA_BREAKTHROUGH trial=10	agent1	memory	0	-0.000000
exp2815	4.03266298e-29	0.000000	0.000000	discard	cycle 10 u=0.0975	agent0	initial_cond	0	0.000000
exp2816	3.29721682e-17	0.000000	-0.000000	discard	PHASE_SWEEP mode=1 u=0 amp=0.5 phase=0.5	agent1	memory	0	-0.000000
exp2817	4.03266298e-29	0.000000	0.000000	discard	cycle 10 u=0.0975	agent0	initial_cond	0	0.000000
exp2818	3.74579333e-21	0.000000	-0.000000	discard	PHASE_SWEEP mode=1 u=0 amp=0.5 phase=1.0	agent1	memory	1	-0.000000
exp2819	4.80015937e-29	0.000000	0.000000	discard	cycle 10 u=0.0975	agent0	initial_cond	0	0.000000
exp2820	6.44054532e-23	0.000000	-0.000000	discard	PHASE_SWEEP mode=1 u=0 amp=0.5 phase=1.5	agent1	memory	0	-0.000000
exp2821	4.80015937e-29	0.000000	0.000000	discard	cycle 10 u=0.0975	agent0	initial_cond	0	0.000000
exp2822	9.34824623e-13	0.000000	0.000000	discard	PHASE_SWEEP mode=1 u=0 amp=0.5 phase=2.0	agent1	memory	0	-0.000000
exp2823	4.80015937e-29	0.000000	0.000000	discard	cycle 10 u=0.0975	agent0	initial_cond	1	0.000000
exp2824	5.48155560e-23	0.000000	0.000000	discard	PHASE_SWEEP mode=1 u=0 amp=0.5 phase=2.5	agent1	memory	1	-0.000000
exp2825	2.68824537e-29	0.000000	0.000000	discard	cycle 10 u=0.0980	agent0	initial_cond	0	-0.000000
exp2826	3.26971847e-26	0.000000	-0.000000	discard	PHASE_SWEEP mode=1 u=0 amp=0.5 phase=3.0	agent1	memory	0	-0.000000
exp2827	2.68824537e-29	0.000000	0.000000	discard	cycle 10 u=0.0980	agent0	initial_cond	0	-0.000000
exp2828	2.41162518e-25	0.000000	0.000000	discard	PHASE_SWEEP mode=1 u=0 amp=0.5 phase=3.14	agent1	memory	1	-0.000000
exp2829	2.68824537e-29	0.000000	0.000000	discard	cycle 10 u=0.0980	agent0	initial_cond	1	-0.000000
exp2830	9.04483866e-18	0.000000	-0.000000	discard	AMP_SWEEP mode=1 u=0 phase=1.0 amp=0.3	agent1	memory	0	-0.000000
exp2831	6.16758073e-29	0.000000	0.000000	discard	cycle 10 u=0.0980	agent0	initial_cond	0	-0.000000
exp2832	4.30035336e-12	0.000000	-0.000000	discard	AMP_SWEEP mode=1 u=0 phase=1.0 amp=0.4	agent1	memory	0	-0.000000
exp2833	6.16758073e-29	0.000000	0.000000	discard	cycle 10 u=0.0980	agent0	initial_cond	1	-0.000000
exp2834	3.74579333e-21	0.000000	-0.000000	discard	AMP_SWEEP mode=1 u=0 phase=1.0 amp=0.5	agent1	memory	1	-0.000000
exp2835	6.16758073e-29	0.000000	0.000000	discard	cycle 10 u=0.0980	agent0	initial_cond	0	-0.000000
exp2836	7.46397922e-15	0.000000	-0.000000	discard	AMP_SWEEP mode=1 u=0 phase=1.0 amp=0.6	agent1	memory	0	-0.000000
exp2837	2.01926478e-29	0.000000	0.000000	discard	cycle 10 u=0.0980	agent0	initial_cond	0	0.000000
exp2838	7.87452483e-26	0.000000	-0.000000	discard	AMP_SWEEP mode=1 u=0 phase=1.0 amp=0.7	agent1	memory	1	-0.000000
exp2839	7.22973119e-11	0.070536	0.000000	discard	scipy 4th branch u=0 amp=0.5 phase=pi/2	agent1_mem	branch_search	1	0.000175
exp2840	2.01926478e-29	0.000000	0.000000	discard	cycle 10 u=0.0980	agent0	initial_cond	1	0.000000
exp2841	2.01926478e-29	0.000000	0.000000	discard	cycle 10 u=0.0980	agent0	initial_cond	0	0.000000
exp2842	1.30310780e-28	0.000000	0.000000	discard	cycle 10 u=0.0980	agent0	initial_cond	1	-0.000000
exp2843	1.30310780e-28	0.000000	0.000000	discard	cycle 10 u=0.0980	agent0	initial_cond	0	-0.000000
exp2844	1.30310780e-28	0.000000	0.000000	discard	cycle 10 u=0.0980	agent0	initial_cond	0	-0.000000
exp2845	5.45343271e-29	0.000000	0.000000	discard	cycle 10 u=0.0982	agent0	initial_cond	1	-0.000000
exp2846	5.45343271e-29	0.000000	0.000000	discard	cycle 10 u=0.0982	agent0	initial_cond	0	-0.000000
exp2847	5.45343271e-29	0.000000	0.000000	discard	cycle 10 u=0.0982	agent0	initial_cond	0	-0.000000
exp2848	1.23429977e-28	0.000000	0.000000	discard	cycle 10 u=0.0982	agent0	initial_cond	0	0.000000
exp2849	1.23429977e-28	0.000000	0.000000	discard	cycle 10 u=0.0982	agent0	initial_cond	0	0.000000
exp2850	1.23429977e-28	0.000000	0.000000	discard	cycle 10 u=0.0982	agent0	initial_cond	1	0.000000
exp2851	1.88036672e-29	0.000000	0.000000	discard	cycle 10 u=0.0982	agent0	initial_cond	0	0.000000
exp2852	1.88036672e-29	0.000000	0.000000	discard	cycle 10 u=0.0982	agent0	initial_cond	0	0.000000
exp2853	1.88036672e-29	0.000000	0.000000	discard	cycle 10 u=0.0982	agent0	initial_cond	1	0.000000
exp2854	1.91190259e-29	0.000000	-0.000000	discard	cycle 10 u=0.0982	agent0	initial_cond	0	0.000000
exp2855	1.91190259e-29	0.000000	-0.000000	discard	cycle 10 u=0.0982	agent0	initial_cond	1	0.000000
exp2856	1.91190259e-29	0.000000	-0.000000	discard	cycle 10 u=0.0982	agent0	initial_cond	0	0.000000
exp2857	6.13049994e-29	0.000000	0.000000	discard	cycle 10 u=0.0985	agent0	initial_cond	0	0.000000
exp2858	6.13049994e-29	0.000000	0.000000	discard	Fourier pos u=1.0 modes=64 maxiter=200 tol=1e-12	agent0	solver_param	1	0.000000
exp2859	6.13049994e-29	0.000000	0.000000	discard	cycle 10 u=0.0985	agent0	initial_cond	1	0.000000
exp2860	6.13049994e-29	0.000000	0.000000	discard	cycle 10 u=0.0985	agent0	initial_cond	0	0.000000
exp2861	5.49750971e-29	0.000000	0.000000	discard	cycle 10 u=0.0985	agent0	initial_cond	0	0.000000
exp2862	5.49750971e-29	0.000000	0.000000	discard	cycle 10 u=0.0985	agent0	initial_cond	0	0.000000
exp2863	5.49750971e-29	0.000000	0.000000	discard	cycle 10 u=0.0985	agent0	initial_cond	0	0.000000
exp2864	4.15642452e-29	0.000000	0.000000	discard	cycle 10 u=0.0985	agent0	initial_cond	1	0.000000
exp2865	4.15642452e-29	0.000000	0.000000	discard	cycle 10 u=0.0985	agent0	initial_cond	0	0.000000
exp2866	4.15642452e-29	0.000000	0.000000	discard	cycle 10 u=0.0985	agent0	initial_cond	0	0.000000
exp2867	2.19292611e-29	0.000000	0.000000	discard	cycle 10 u=0.0985	agent0	initial_cond	1	-0.000000
exp2868	9.99175386e-12	0.070536	0.000000	discard	scipy 4th branch n=300 tol=1e-11	agent1_mem	solver_param	0	0.000175
exp2869	2.19292611e-29	0.000000	0.000000	discard	cycle 10 u=0.0985	agent0	initial_cond	0	-0.000000
exp2870	4.22395220e-10	0.070536	0.000000	discard	scipy 4th branch n=250 tol=1e-9	agent1_mem	solver_param	0	0.000175
exp2871	2.19292611e-29	0.000000	0.000000	discard	cycle 10 u=0.0985	agent0	initial_cond	1	-0.000000
exp2872	6.61474009e-09	0.070536	0.000000	discard	scipy 4th branch n=200 tol=1e-8	agent1_mem	solver_param	1	0.000175
exp2873	4.22491788e-29	0.000000	0.000000	discard	cycle 10 u=0.0990	agent0	initial_cond	0	-0.000000
exp2874	4.22491788e-29	0.000000	0.000000	discard	cycle 10 u=0.0990	agent0	initial_cond	0	-0.000000
exp2875	4.22491788e-29	0.000000	0.000000	discard	cycle 10 u=0.0990	agent0	initial_cond	1	-0.000000
exp2876	3.22245147e-29	0.000000	0.000000	discard	cycle 10 u=0.0990	agent0	initial_cond	0	0.000000
