exp_id	residual	solution_norm	solution_mean	status	description	agent	design	elapsed_s	solution_energy
exp1316	8.40990514e-15	0.000000	-0.000000	discard	u=0.0988 a=0.001350	agent0	initial_cond	2	-0.000000
exp1316	8.40990514e-15	0.000000	-0.000000	discard	u=0.1000 a=0.001350	agent0	initial_cond	2	-0.000000
exp1316	8.40990514e-15	0.000000	-0.000000	discard	u=0.0990 a=0.001344	agent0	initial_cond	2	-0.000000
exp1316	8.40990514e-15	0.000000	-0.000000	discard	u=0.2400 a=0.001344	agent0	initial_cond	2	-0.000000
exp1317	8.40990514e-15	0.000000	-0.000000	discard	u=0.1010 a=0.001346	agent0	initial_cond	2	-0.000000
exp1317	8.40990514e-15	0.000000	-0.000000	discard	u=0.1010 a=0.001350	agent0	initial_cond	2	-0.000000
exp1318	8.40990514e-15	0.000000	-0.000000	discard	u=0.2400 a=0.001342	agent0	initial_cond	2	-0.000000
exp1318	8.40990514e-15	0.000000	-0.000000	discard	u=0.2400 a=0.001346	agent0	initial_cond	1	-0.000000
exp1319	8.40990514e-15	0.000000	-0.000000	discard	u=0.2500 a=0.001342	agent0	initial_cond	1	-0.000000
exp1319	8.40990514e-15	0.000000	-0.000000	discard	u=0.2400 a=0.001348	agent0	initial_cond	1	-0.000000
exp1319	8.40990514e-15	0.000000	-0.000000	discard	u=0.2400 a=0.001340	agent0	initial_cond	2	-0.000000
exp1319	8.40990514e-15	0.000000	-0.000000	discard	u=0.2400 a=0.001350	agent0	initial_cond	1	-0.000000
exp1319	8.40990514e-15	0.000000	-0.000000	discard	u=0.2500 a=0.001350	agent0	initial_cond	2	-0.000000
exp1320	8.40990514e-15	0.000000	-0.000000	discard	u=0.2600 a=0.001348	agent0	initial_cond	1	-0.000000
exp1320	8.40990514e-15	0.000000	-0.000000	discard	u=0.2500 a=0.001346	agent0	initial_cond	2	-0.000000
exp1320	8.40990514e-15	0.000000	-0.000000	discard	u=0.2500 a=0.001340	agent0	initial_cond	2	-0.000000
exp1320	8.40990514e-15	0.000000	-0.000000	discard	u=0.2500 a=0.001344	agent0	initial_cond	2	-0.000000
exp1321	8.40990514e-15	0.000000	-0.000000	discard	basin map u=-0.2	agent0	branch_search	1	-0.000000
exp1321	8.40990514e-15	0.000000	-0.000000	discard	u=0.2600 a=0.001342	agent0	initial_cond	1	-0.000000
exp1321	8.40990514e-15	0.000000	-0.000000	discard	u=0.2600 a=0.001340	agent0	initial_cond	1	-0.000000
exp1321	8.40990514e-15	0.000000	-0.000000	discard	u=0.2600 a=0.001344	agent0	initial_cond	1	-0.000000
exp1321	8.40990514e-15	0.000000	-0.000000	discard	u=0.2600 a=0.001350	agent0	initial_cond	1	-0.000000
exp1321	8.40990514e-15	0.000000	-0.000000	discard	u=0.2500 a=0.001348	agent0	initial_cond	2	-0.000000
exp1322	8.40990514e-15	0.000000	-0.000000	discard	u=0.2600 a=0.001346	agent0	initial_cond	1	-0.000000
exp1323	2.03509144e-27	0.000000	0.000000	discard	u=0.0982 a=0.001346	agent0	initial_cond	2	-0.000000
exp1323	2.03509144e-27	0.000000	0.000000	discard	u=0.0980 a=0.001350	agent0	initial_cond	1	-0.000000
exp1323	2.03509144e-27	0.000000	0.000000	discard	u=0.0982 a=0.001342	agent0	initial_cond	2	-0.000000
exp1323	2.03509144e-27	0.000000	0.000000	discard	u=0.0984 a=0.001342	agent0	initial_cond	2	-0.000000
exp1324	2.03509144e-27	0.000000	0.000000	discard	u=0.0986 a=0.001346	agent0	initial_cond	2	-0.000000
exp1324	8.80620767e-13	0.000000	0.000000	discard	u=0.0986 a=0.001344	agent0	initial_cond	2	-0.000000
exp1324	8.80620767e-13	0.000000	0.000000	discard	u=0.0988 a=0.001350	agent0	initial_cond	2	-0.000000
exp1323	2.03509144e-27	0.000000	0.000000	discard	u=0.0980 a=0.001342	agent0	initial_cond	2	-0.000000
exp1324	8.80620767e-13	0.000000	0.000000	discard	u=0.0988 a=0.001340	agent0	initial_cond	2	-0.000000
exp1324	8.80620767e-13	0.000000	0.000000	discard	u=0.0990 a=0.001348	agent0	initial_cond	2	-0.000000
exp1324	8.80620767e-13	0.000000	0.000000	discard	u=0.0982 a=0.001340	agent0	initial_cond	2	-0.000000
exp1324	8.80620767e-13	0.000000	0.000000	discard	u=0.0986 a=0.001348	agent0	initial_cond	2	-0.000000
exp1324	8.80620767e-13	0.000000	0.000000	discard	u=0.0986 a=0.001342	agent0	initial_cond	2	-0.000000
exp1325	8.80620767e-13	0.000000	0.000000	discard	u=0.0986 a=0.001350	agent0	initial_cond	2	-0.000000
exp1325	8.80620767e-13	0.000000	0.000000	discard	u=0.0988 a=0.001346	agent0	initial_cond	2	-0.000000
exp1324	8.80620767e-13	0.000000	0.000000	discard	u=0.0984 a=0.001350	agent0	initial_cond	2	-0.000000
exp1325	8.80620767e-13	0.000000	0.000000	discard	u=0.1000 a=0.001342	agent0	initial_cond	2	-0.000000
exp1325	8.80620767e-13	0.000000	0.000000	discard	u=0.0990 a=0.001344	agent0	initial_cond	2	-0.000000
exp1324	8.80620767e-13	0.000000	0.000000	discard	u=0.0988 a=0.001342	agent0	initial_cond	2	-0.000000
exp1325	8.80620767e-13	0.000000	0.000000	discard	u=0.0984 a=0.001348	agent0	initial_cond	2	-0.000000
exp1325	8.80620767e-13	0.000000	0.000000	discard	u=0.0988 a=0.001348	agent0	initial_cond	2	-0.000000
exp1325	8.80620767e-13	0.000000	0.000000	discard	u=0.1010 a=0.001340	agent0	initial_cond	1	-0.000000
exp1325	8.80620767e-13	0.000000	0.000000	discard	u=0.0990 a=0.001342	agent0	initial_cond	2	-0.000000
exp1325	8.80620767e-13	0.000000	0.000000	discard	u=0.1000 a=0.001344	agent0	initial_cond	2	-0.000000
exp1325	8.80620767e-13	0.000000	0.000000	discard	u=0.1000 a=0.001350	agent0	initial_cond	2	-0.000000
exp1325	8.80620767e-13	0.000000	0.000000	discard	u=0.0984 a=0.001340	agent0	initial_cond	2	-0.000000
exp1325	8.80620767e-13	0.000000	0.000000	discard	u=0.1000 a=0.001346	agent0	initial_cond	2	-0.000000
exp1326	8.80620767e-13	0.000000	0.000000	discard	u=0.2400 a=0.001342	agent0	initial_cond	2	-0.000000
exp1325	8.80620767e-13	0.000000	0.000000	discard	u=0.0990 a=0.001346	agent0	initial_cond	2	-0.000000
exp1325	8.80620767e-13	0.000000	0.000000	discard	u=0.0990 a=0.001340	agent0	initial_cond	2	-0.000000
exp1325	8.80620767e-13	0.000000	0.000000	discard	u=0.0990 a=0.001350	agent0	initial_cond	2	-0.000000
exp1326	8.80620767e-13	0.000000	0.000000	discard	u=0.1000 a=0.001340	agent0	initial_cond	2	-0.000000
exp1326	8.80620767e-13	0.000000	0.000000	discard	u=0.1010 a=0.001342	agent0	initial_cond	2	-0.000000
exp1326	8.80620767e-13	0.000000	0.000000	discard	u=0.1000 a=0.001348	agent0	initial_cond	3	-0.000000
exp1326	8.80620767e-13	0.000000	0.000000	discard	u=0.1010 a=0.001346	agent0	initial_cond	2	-0.000000
exp1326	8.80620767e-13	0.000000	0.000000	discard	u=0.1010 a=0.001348	agent0	initial_cond	2	-0.000000
exp1327	8.80620767e-13	0.000000	0.000000	discard	u=0.2400 a=0.001346	agent0	initial_cond	2	-0.000000
exp1326	8.80620767e-13	0.000000	0.000000	discard	u=0.2400 a=0.001340	agent0	initial_cond	2	-0.000000
exp1327	8.80620767e-13	0.000000	0.000000	discard	u=0.2500 a=0.001342	agent0	initial_cond	2	-0.000000
exp1327	8.80620767e-13	0.000000	0.000000	discard	u=0.1010 a=0.001344	agent0	initial_cond	2	-0.000000
exp1327	8.80620767e-13	0.000000	0.000000	discard	u=0.2400 a=0.001344	agent0	initial_cond	2	-0.000000
exp1327	8.80620767e-13	0.000000	0.000000	discard	u=0.2500 a=0.001344	agent0	initial_cond	2	-0.000000
exp1327	8.80620767e-13	0.000000	0.000000	discard	u=0.1010 a=0.001350	agent0	initial_cond	2	-0.000000
exp1327	2.00148302e-16	1.001298	-1.000025	discard	u=-1.44 Fourier 2modes neg	agent1_mem	solver_param	1	-1.520921
exp1327	8.80620767e-13	0.000000	0.000000	discard	u=0.2500 a=0.001340	agent0	initial_cond	2	-0.000000
exp1327	8.80620767e-13	0.000000	0.000000	discard	u=0.2400 a=0.001348	agent0	initial_cond	2	-0.000000
exp1327	8.80620767e-13	0.000000	0.000000	discard	u=0.2500 a=0.001346	agent0	initial_cond	2	-0.000000
exp1327	8.80620767e-13	0.000000	0.000000	discard	u=0.2500 a=0.001348	agent0	initial_cond	1	-0.000000
exp1328	8.80620767e-13	0.000000	0.000000	discard	u=0.2400 a=0.001350	agent0	initial_cond	1	-0.000000
exp1328	8.80620767e-13	0.000000	0.000000	discard	u=0.2600 a=0.001344	agent0	initial_cond	1	-0.000000
exp1328	8.80620767e-13	0.000000	0.000000	discard	u=0.2600 a=0.001346	agent0	initial_cond	1	-0.000000
exp1328	8.80620767e-13	0.000000	0.000000	discard	u=0.2600 a=0.001342	agent0	initial_cond	1	-0.000000
exp1328	8.80620767e-13	0.000000	0.000000	discard	u=0.2600 a=0.001340	agent0	initial_cond	1	-0.000000
exp1329	8.80620767e-13	0.000000	0.000000	discard	basin map u=0.2	agent0	branch_search	2	-0.000000
exp1329	8.80620767e-13	0.000000	0.000000	discard	u=0.2500 a=0.001350	agent0	initial_cond	2	-0.000000
exp1329	8.80620767e-13	0.000000	0.000000	discard	u=0.2600 a=0.001348	agent0	initial_cond	2	-0.000000
exp1330	8.80620767e-13	0.000000	0.000000	discard	u=0.2600 a=0.001350	agent0	initial_cond	2	-0.000000
exp1331	4.42586856e-16	1.001296	-1.000019	discard	u=-1.44 Fourier 3modes neg	agent1_mem	solver_param	1	-1.520844
exp1332	1.65737278e-15	0.000000	0.000000	discard	basin map u=0.4	agent0	branch_search	1	-0.000000
exp1333	4.53858387e-27	0.000000	0.000000	discard	u=0.0980 a=0.001348	agent0	initial_cond	1	-0.000000
exp1333	4.53858387e-27	0.000000	0.000000	discard	u=0.0980 a=0.001342	agent0	initial_cond	1	-0.000000
exp1333	2.03509144e-27	0.000000	0.000000	discard	u=0.0980 a=0.001340	agent0	initial_cond	1	-0.000000
exp1333	2.03509144e-27	0.000000	0.000000	discard	u=0.0980 a=0.001350	agent0	initial_cond	1	-0.000000
exp1334	2.03509144e-27	0.000000	0.000000	discard	u=0.0982 a=0.001340	agent0	initial_cond	1	-0.000000
exp1334	2.03509144e-27	0.000000	0.000000	discard	u=0.0980 a=0.001346	agent0	initial_cond	1	-0.000000
exp1333	2.03509144e-27	0.000000	0.000000	discard	u=0.0984 a=0.001340	agent0	initial_cond	1	-0.000000
exp1334	2.03509144e-27	0.000000	0.000000	discard	u=0.0982 a=0.001346	agent0	initial_cond	1	-0.000000
exp1334	2.03509144e-27	0.000000	0.000000	discard	u=0.0980 a=0.001344	agent0	initial_cond	1	-0.000000
exp1335	2.60017645e-14	0.000000	0.000000	discard	u=0.0982 a=0.001342	agent0	initial_cond	2	-0.000000
exp1335	2.60017645e-14	0.000000	0.000000	discard	u=0.0986 a=0.001346	agent0	initial_cond	2	-0.000000
exp1335	2.60017645e-14	0.000000	0.000000	discard	u=0.0984 a=0.001348	agent0	initial_cond	2	-0.000000
exp1336	2.60017645e-14	0.000000	0.000000	discard	u=0.0982 a=0.001348	agent0	initial_cond	2	-0.000000
exp1336	2.60017645e-14	0.000000	0.000000	discard	u=0.0984 a=0.001346	agent0	initial_cond	2	-0.000000
exp1336	2.60017645e-14	0.000000	0.000000	discard	u=0.0984 a=0.001344	agent0	initial_cond	2	-0.000000
exp1336	2.60017645e-14	0.000000	0.000000	discard	u=0.0982 a=0.001350	agent0	initial_cond	2	-0.000000
exp1336	2.60017645e-14	0.000000	0.000000	discard	u=0.0986 a=0.001340	agent0	initial_cond	2	-0.000000
exp1337	2.60017645e-14	0.000000	0.000000	discard	u=0.0984 a=0.001342	agent0	initial_cond	2	-0.000000
exp1337	2.60017645e-14	0.000000	0.000000	discard	u=0.0988 a=0.001348	agent0	initial_cond	2	-0.000000
exp1337	2.60017645e-14	0.000000	0.000000	discard	u=0.0986 a=0.001350	agent0	initial_cond	2	-0.000000
exp1337	2.60017645e-14	0.000000	0.000000	discard	u=0.0988 a=0.001344	agent0	initial_cond	2	-0.000000
exp1337	2.60017645e-14	0.000000	0.000000	discard	u=0.0988 a=0.001346	agent0	initial_cond	2	-0.000000
exp1337	2.60017645e-14	0.000000	0.000000	discard	u=0.0986 a=0.001344	agent0	initial_cond	2	-0.000000
exp1337	2.60017645e-14	0.000000	0.000000	discard	u=0.0984 a=0.001350	agent0	initial_cond	2	-0.000000
exp1338	2.60017645e-14	0.000000	0.000000	discard	u=0.0986 a=0.001348	agent0	initial_cond	2	-0.000000
exp1337	2.60017645e-14	0.000000	0.000000	discard	u=0.0988 a=0.001340	agent0	initial_cond	2	-0.000000
exp1338	2.60017645e-14	0.000000	0.000000	discard	u=0.0990 a=0.001342	agent0	initial_cond	3	-0.000000
exp1338	2.60017645e-14	0.000000	0.000000	discard	u=0.0990 a=0.001340	agent0	initial_cond	3	-0.000000
exp1338	2.60017645e-14	0.000000	0.000000	discard	u=0.0990 a=0.001348	agent0	initial_cond	3	-0.000000
exp1338	2.60017645e-14	0.000000	0.000000	discard	u=0.0988 a=0.001350	agent0	initial_cond	3	-0.000000
exp1338	2.60017645e-14	0.000000	0.000000	discard	u=0.0990 a=0.001344	agent0	initial_cond	3	-0.000000
exp1338	2.60017645e-14	0.000000	0.000000	discard	u=0.0988 a=0.001342	agent0	initial_cond	2	-0.000000
exp1338	2.60017645e-14	0.000000	0.000000	discard	u=0.0986 a=0.001342	agent0	initial_cond	3	-0.000000
exp1339	2.60017645e-14	0.000000	0.000000	discard	u=0.1010 a=0.001342	agent0	initial_cond	3	-0.000000
exp1338	2.60017645e-14	0.000000	0.000000	discard	u=0.1000 a=0.001344	agent0	initial_cond	3	-0.000000
exp1338	2.60017645e-14	0.000000	0.000000	discard	u=0.1000 a=0.001346	agent0	initial_cond	3	-0.000000
exp1338	2.60017645e-14	0.000000	0.000000	discard	u=0.1000 a=0.001342	agent0	initial_cond	3	-0.000000
exp1339	2.60017645e-14	0.000000	0.000000	discard	u=0.0990 a=0.001346	agent0	initial_cond	3	-0.000000
exp1338	2.60017645e-14	0.000000	0.000000	discard	u=0.1000 a=0.001340	agent0	initial_cond	3	-0.000000
exp1338	2.60017645e-14	0.000000	0.000000	discard	u=0.0990 a=0.001350	agent0	initial_cond	3	-0.000000
exp1339	2.60017645e-14	0.000000	0.000000	discard	u=0.1000 a=0.001348	agent0	initial_cond	3	-0.000000
exp1339	2.60017645e-14	0.000000	0.000000	discard	u=0.1010 a=0.001350	agent0	initial_cond	2	-0.000000
exp1339	2.60017645e-14	0.000000	0.000000	discard	u=0.2400 a=0.001344	agent0	initial_cond	2	-0.000000
exp1339	2.60017645e-14	0.000000	0.000000	discard	u=0.1000 a=0.001350	agent0	initial_cond	2	-0.000000
exp1339	2.60017645e-14	0.000000	0.000000	discard	u=0.1010 a=0.001344	agent0	initial_cond	2	-0.000000
exp1339	2.60017645e-14	0.000000	0.000000	discard	u=0.1010 a=0.001340	agent0	initial_cond	2	-0.000000
exp1339	2.60017645e-14	0.000000	0.000000	discard	u=0.2400 a=0.001342	agent0	initial_cond	2	-0.000000
exp1339	2.60017645e-14	0.000000	0.000000	discard	u=0.2400 a=0.001348	agent0	initial_cond	2	-0.000000
exp1340	2.60017645e-14	0.000000	0.000000	discard	u=0.2400 a=0.001340	agent0	initial_cond	2	-0.000000
exp1340	2.60017645e-14	0.000000	0.000000	discard	u=0.1010 a=0.001348	agent0	initial_cond	2	-0.000000
exp1340	1.86448479e-16	1.001296	-1.000019	discard	u=-1.44 Fourier 4modes neg	agent1_mem	solver_param	2	-1.520844
exp1340	2.60017645e-14	0.000000	0.000000	discard	u=0.1010 a=0.001346	agent0	initial_cond	2	-0.000000
exp1341	2.60017645e-14	0.000000	0.000000	discard	basin map u=0.45	agent0	branch_search	1	-0.000000
exp1340	2.60017645e-14	0.000000	0.000000	discard	u=0.2500 a=0.001342	agent0	initial_cond	2	-0.000000
exp1341	2.60017645e-14	0.000000	0.000000	discard	u=0.2400 a=0.001346	agent0	initial_cond	2	-0.000000
exp1341	2.60017645e-14	0.000000	0.000000	discard	u=0.2500 a=0.001340	agent0	initial_cond	2	-0.000000
exp1341	2.60017645e-14	0.000000	0.000000	discard	u=0.2500 a=0.001350	agent0	initial_cond	3	-0.000000
exp1341	2.60017645e-14	0.000000	0.000000	discard	u=0.2600 a=0.001340	agent0	initial_cond	2	-0.000000
exp1341	2.60017645e-14	0.000000	0.000000	discard	u=0.2400 a=0.001350	agent0	initial_cond	2	-0.000000
exp1341	2.60017645e-14	0.000000	0.000000	discard	u=0.2500 a=0.001346	agent0	initial_cond	2	-0.000000
exp1341	1.34360442e-12	1.002503	1.000218	discard	pos u=0.95 amp=0.5 mode=3 n=269	agent1	memory	3	-1.523848
exp1341	2.60017645e-14	0.000000	0.000000	discard	u=0.2500 a=0.001348	agent0	initial_cond	2	-0.000000
exp1341	2.60017645e-14	0.000000	0.000000	discard	u=0.2600 a=0.001350	agent0	initial_cond	3	-0.000000
exp1341	2.60017645e-14	0.000000	0.000000	discard	u=0.2600 a=0.001344	agent0	initial_cond	3	-0.000000
exp1341	2.60017645e-14	0.000000	0.000000	discard	u=0.2600 a=0.001342	agent0	initial_cond	3	-0.000000
exp1341	2.60017645e-14	0.000000	0.000000	discard	u=0.2500 a=0.001344	agent0	initial_cond	3	-0.000000
exp1341	2.60017645e-14	0.000000	0.000000	discard	u=0.2600 a=0.001346	agent0	initial_cond	3	-0.000000
exp1342	2.60017645e-14	0.000000	0.000000	discard	u=0.2600 a=0.001348	agent0	initial_cond	2	-0.000000
exp1343	1.25416452e-15	1.001296	-1.000019	discard	u=-1.44 Fourier 5modes neg	agent1_mem	solver_param	1	-1.520844
exp1344	2.27542960e-27	0.000000	0.000000	discard	u=0.0980 a=0.001342	agent0	initial_cond	1	
exp1344	2.84711225e-27	0.000000	0.000000	discard	u=0.0980 a=0.001348	agent0	initial_cond	1	-0.000000
exp1344	2.03509144e-27	0.000000	0.000000	discard	u=0.0980 a=0.001344	agent0	initial_cond	2	-0.000000
exp1344	2.03509144e-27	0.000000	0.000000	discard	u=0.0980 a=0.001340	agent0	initial_cond	1	-0.000000
exp1345	1.34357540e-12	1.002503	1.000218	discard	pos u=1.05 amp=0.5 mode=3 n=269	agent1	memory	2	-1.523848
exp1345	2.03509144e-27	0.000000	0.000000	discard	u=0.0984 a=0.001348	agent0	initial_cond	2	-0.000000
exp1345	2.03509144e-27	0.000000	0.000000	discard	u=0.0984 a=0.001344	agent0	initial_cond	2	-0.000000
exp1345	2.03509144e-27	0.000000	0.000000	discard	u=0.0980 a=0.001350	agent0	initial_cond	2	-0.000000
exp1345	2.03509144e-27	0.000000	0.000000	discard	u=0.0986 a=0.001346	agent0	initial_cond	2	-0.000000
exp1345	2.03509144e-27	0.000000	0.000000	discard	u=0.0984 a=0.001342	agent0	initial_cond	2	-0.000000
exp1345	2.03509144e-27	0.000000	0.000000	discard	u=0.0988 a=0.001342	agent0	initial_cond	2	-0.000000
exp1345	2.03509144e-27	0.000000	0.000000	discard	u=0.0982 a=0.001342	agent0	initial_cond	2	-0.000000
exp1345	2.03509144e-27	0.000000	0.000000	discard	u=0.0984 a=0.001350	agent0	initial_cond	2	-0.000000
exp1346	2.03509144e-27	0.000000	0.000000	discard	u=0.0986 a=0.001340	agent0	initial_cond	2	-0.000000
exp1346	2.03509144e-27	0.000000	0.000000	discard	u=0.0988 a=0.001346	agent0	initial_cond	2	-0.000000
exp1345	2.03509144e-27	0.000000	0.000000	discard	u=0.0984 a=0.001346	agent0	initial_cond	2	-0.000000
exp1345	2.03509144e-27	0.000000	0.000000	discard	u=0.0986 a=0.001344	agent0	initial_cond	2	-0.000000
exp1346	2.03509144e-27	0.000000	0.000000	discard	u=0.0982 a=0.001340	agent0	initial_cond	2	-0.000000
exp1346	2.03509144e-27	0.000000	0.000000	discard	u=0.0988 a=0.001340	agent0	initial_cond	2	-0.000000
exp1345	2.03509144e-27	0.000000	0.000000	discard	u=0.0984 a=0.001340	agent0	initial_cond	2	-0.000000
exp1345	2.03509144e-27	0.000000	0.000000	discard	u=0.0982 a=0.001348	agent0	initial_cond	2	-0.000000
exp1346	2.03509144e-27	0.000000	0.000000	discard	u=0.0988 a=0.001348	agent0	initial_cond	3	-0.000000
exp1346	2.03509144e-27	0.000000	0.000000	discard	u=0.0986 a=0.001342	agent0	initial_cond	3	-0.000000
exp1346	2.03509144e-27	0.000000	0.000000	discard	u=0.0990 a=0.001342	agent0	initial_cond	2	-0.000000
exp1346	2.03509144e-27	0.000000	0.000000	discard	u=0.0986 a=0.001348	agent0	initial_cond	2	-0.000000
exp1347	2.03509144e-27	0.000000	0.000000	discard	u=0.1000 a=0.001346	agent0	initial_cond	2	-0.000000
exp1346	2.03509144e-27	0.000000	0.000000	discard	basin map u=0.55	agent0	branch_search	2	-0.000000
exp1346	2.03509144e-27	0.000000	0.000000	discard	u=0.0982 a=0.001346	agent0	initial_cond	2	-0.000000
exp1347	2.03509144e-27	0.000000	0.000000	discard	u=0.0986 a=0.001350	agent0	initial_cond	3	-0.000000
exp1347	2.03509144e-27	0.000000	0.000000	discard	u=0.0988 a=0.001350	agent0	initial_cond	2	-0.000000
exp1347	2.03509144e-27	0.000000	0.000000	discard	u=0.0990 a=0.001350	agent0	initial_cond	2	-0.000000
exp1346	2.03509144e-27	0.000000	0.000000	discard	u=0.0988 a=0.001344	agent0	initial_cond	3	-0.000000
exp1347	2.03509144e-27	0.000000	0.000000	discard	u=0.0990 a=0.001344	agent0	initial_cond	2	-0.000000
exp1347	2.03509144e-27	0.000000	0.000000	discard	u=0.1000 a=0.001348	agent0	initial_cond	2	-0.000000
exp1347	2.03509144e-27	0.000000	0.000000	discard	u=0.1000 a=0.001342	agent0	initial_cond	2	-0.000000
exp1347	2.03509144e-27	0.000000	0.000000	discard	u=0.0990 a=0.001340	agent0	initial_cond	2	-0.000000
exp1347	2.03509144e-27	0.000000	0.000000	discard	u=0.0990 a=0.001348	agent0	initial_cond	2	-0.000000
exp1347	2.03509144e-27	0.000000	0.000000	discard	u=0.0990 a=0.001346	agent0	initial_cond	2	-0.000000
exp1347	2.03509144e-27	0.000000	0.000000	discard	u=0.1000 a=0.001340	agent0	initial_cond	2	-0.000000
exp1347	2.03509144e-27	0.000000	0.000000	discard	u=0.1000 a=0.001344	agent0	initial_cond	2	-0.000000
exp1348	1.05197182e-15	1.001296	-1.000019	discard	u=-1.44 Fourier 6modes neg	agent1_mem	solver_param	2	-1.520844
exp1347	2.03509144e-27	0.000000	0.000000	discard	u=0.1010 a=0.001340	agent0	initial_cond	2	-0.000000
exp1348	2.03509144e-27	0.000000	0.000000	discard	u=0.2600 a=0.001342	agent0	initial_cond	1	-0.000000
exp1348	2.03509144e-27	0.000000	0.000000	discard	u=0.1010 a=0.001346	agent0	initial_cond	2	-0.000000
exp1348	2.03509144e-27	0.000000	0.000000	discard	u=0.2500 a=0.001340	agent0	initial_cond	2	-0.000000
exp1348	2.03509144e-27	0.000000	0.000000	discard	u=0.2400 a=0.001342	agent0	initial_cond	3	-0.000000
exp1348	2.03509144e-27	0.000000	0.000000	discard	u=0.2400 a=0.001340	agent0	initial_cond	2	-0.000000
exp1348	2.03509144e-27	0.000000	0.000000	discard	u=0.2400 a=0.001346	agent0	initial_cond	2	-0.000000
exp1348	2.03509144e-27	0.000000	0.000000	discard	u=0.1010 a=0.001344	agent0	initial_cond	2	-0.000000
exp1348	2.03509144e-27	0.000000	0.000000	discard	u=0.2400 a=0.001350	agent0	initial_cond	3	-0.000000
exp1348	2.03509144e-27	0.000000	0.000000	discard	u=0.1010 a=0.001342	agent0	initial_cond	2	-0.000000
exp1348	2.03509144e-27	0.000000	0.000000	discard	u=0.1010 a=0.001350	agent0	initial_cond	2	-0.000000
exp1348	2.03509144e-27	0.000000	0.000000	discard	u=0.1000 a=0.001350	agent0	initial_cond	2	-0.000000
exp1349	2.03509144e-27	0.000000	0.000000	discard	u=0.2500 a=0.001348	agent0	initial_cond	2	-0.000000
exp1348	2.03509144e-27	0.000000	0.000000	discard	u=0.2400 a=0.001344	agent0	initial_cond	2	-0.000000
exp1349	2.03509144e-27	0.000000	0.000000	discard	u=0.2500 a=0.001342	agent0	initial_cond	3	-0.000000
exp1348	2.03509144e-27	0.000000	0.000000	discard	u=0.2400 a=0.001348	agent0	initial_cond	3	-0.000000
exp1349	2.03509144e-27	0.000000	0.000000	discard	u=0.2600 a=0.001340	agent0	initial_cond	2	-0.000000
exp1348	2.03509144e-27	0.000000	0.000000	discard	u=0.2500 a=0.001344	agent0	initial_cond	3	-0.000000
exp1349	2.03509144e-27	0.000000	0.000000	discard	u=0.2500 a=0.001346	agent0	initial_cond	2	-0.000000
exp1349	2.03509144e-27	0.000000	0.000000	discard	u=0.1010 a=0.001348	agent0	initial_cond	3	-0.000000
exp1349	2.03509144e-27	0.000000	0.000000	discard	u=0.2500 a=0.001350	agent0	initial_cond	2	-0.000000
exp1349	2.03509144e-27	0.000000	0.000000	discard	u=0.2600 a=0.001346	agent0	initial_cond	2	-0.000000
exp1350	2.03509144e-27	0.000000	0.000000	discard	u=0.2600 a=0.001350	agent0	initial_cond	2	-0.000000
