exp_id	residual	solution_norm	solution_mean	status	description	agent	design	elapsed_s	solution_energy
exp15538	4.80015937e-29	0.000000	0.000000	discard	cycle 122 u=0.0975	agent0	initial_cond	0	0.000000
exp15539	2.68824537e-29	0.000000	0.000000	discard	cycle 122 u=0.0980	agent0	initial_cond	0	-0.000000
exp15540	2.68824537e-29	0.000000	0.000000	discard	cycle 122 u=0.0980	agent0	initial_cond	0	-0.000000
exp15541	2.68824537e-29	0.000000	0.000000	discard	cycle 122 u=0.0980	agent0	initial_cond	0	-0.000000
exp15542	6.16758073e-29	0.000000	0.000000	discard	cycle 122 u=0.0980	agent0	initial_cond	1	-0.000000
exp15543	6.16758073e-29	0.000000	0.000000	discard	cycle 122 u=0.0980	agent0	initial_cond	0	-0.000000
exp15544	6.16758073e-29	0.000000	0.000000	discard	cycle 122 u=0.0980	agent0	initial_cond	1	-0.000000
exp15545	2.01926478e-29	0.000000	0.000000	discard	cycle 122 u=0.0980	agent0	initial_cond	0	0.000000
exp15546	2.01926478e-29	0.000000	0.000000	discard	cycle 122 u=0.0980	agent0	initial_cond	0	0.000000
exp15547	2.01926478e-29	0.000000	0.000000	discard	cycle 122 u=0.0980	agent0	initial_cond	0	0.000000
exp15548	1.30310780e-28	0.000000	0.000000	discard	cycle 122 u=0.0980	agent0	initial_cond	0	-0.000000
exp15549	1.30310780e-28	0.000000	0.000000	discard	cycle 122 u=0.0980	agent0	initial_cond	1	-0.000000
exp15550	1.30310780e-28	0.000000	0.000000	discard	cycle 122 u=0.0980	agent0	initial_cond	0	-0.000000
exp15551	5.45343271e-29	0.000000	0.000000	discard	cycle 122 u=0.0982	agent0	initial_cond	1	-0.000000
exp15552	5.45343271e-29	0.000000	0.000000	discard	cycle 122 u=0.0982	agent0	initial_cond	0	-0.000000
exp15553	5.45343271e-29	0.000000	0.000000	discard	cycle 122 u=0.0982	agent0	initial_cond	0	-0.000000
exp15554	1.23429977e-28	0.000000	0.000000	discard	cycle 122 u=0.0982	agent0	initial_cond	0	0.000000
exp15555	1.23429977e-28	0.000000	0.000000	discard	cycle 122 u=0.0982	agent0	initial_cond	0	0.000000
exp15556	1.23429977e-28	0.000000	0.000000	discard	cycle 122 u=0.0982	agent0	initial_cond	1	0.000000
exp15557	1.88036672e-29	0.000000	0.000000	discard	cycle 122 u=0.0982	agent0	initial_cond	0	0.000000
exp15558	1.88036672e-29	0.000000	0.000000	discard	cycle 122 u=0.0982	agent0	initial_cond	0	0.000000
exp15559	1.88036672e-29	0.000000	0.000000	discard	cycle 122 u=0.0982	agent0	initial_cond	0	0.000000
exp15560	1.91190259e-29	0.000000	-0.000000	discard	cycle 122 u=0.0982	agent0	initial_cond	0	0.000000
exp15561	1.91190259e-29	0.000000	-0.000000	discard	cycle 122 u=0.0982	agent0	initial_cond	1	0.000000
exp15562	1.91190259e-29	0.000000	-0.000000	discard	cycle 122 u=0.0982	agent0	initial_cond	0	0.000000
exp15563	6.13049994e-29	0.000000	0.000000	discard	cycle 122 u=0.0985	agent0	initial_cond	1	0.000000
exp15564	6.13049994e-29	0.000000	0.000000	discard	cycle 122 u=0.0985	agent0	initial_cond	0	0.000000
exp15565	6.13049994e-29	0.000000	0.000000	discard	cycle 122 u=0.0985	agent0	initial_cond	0	0.000000
exp15566	5.49750971e-29	0.000000	0.000000	discard	cycle 122 u=0.0985	agent0	initial_cond	0	0.000000
exp15567	5.49750971e-29	0.000000	0.000000	discard	cycle 122 u=0.0985	agent0	initial_cond	0	0.000000
exp15568	5.49750971e-29	0.000000	0.000000	discard	cycle 122 u=0.0985	agent0	initial_cond	1	0.000000
exp15569	4.15642452e-29	0.000000	0.000000	discard	cycle 122 u=0.0985	agent0	initial_cond	0	0.000000
exp15570	4.15642452e-29	0.000000	0.000000	discard	cycle 122 u=0.0985	agent0	initial_cond	0	0.000000
exp15571	4.15642452e-29	0.000000	0.000000	discard	cycle 122 u=0.0985	agent0	initial_cond	0	0.000000
exp15572	2.19292611e-29	0.000000	0.000000	discard	cycle 122 u=0.0985	agent0	initial_cond	0	-0.000000
exp15573	2.19292611e-29	0.000000	0.000000	discard	cycle 122 u=0.0985	agent0	initial_cond	1	-0.000000
exp15574	2.19292611e-29	0.000000	0.000000	discard	cycle 122 u=0.0985	agent0	initial_cond	0	-0.000000
exp15575	4.22491788e-29	0.000000	0.000000	discard	cycle 122 u=0.0990	agent0	initial_cond	1	-0.000000
exp15576	4.22491788e-29	0.000000	0.000000	discard	cycle 122 u=0.0990	agent0	initial_cond	0	-0.000000
exp15577	4.22491788e-29	0.000000	0.000000	discard	cycle 122 u=0.0990	agent0	initial_cond	0	-0.000000
exp15578	3.22245147e-29	0.000000	0.000000	discard	cycle 122 u=0.0990	agent0	initial_cond	0	0.000000
exp15579	3.22245147e-29	0.000000	0.000000	discard	cycle 122 u=0.0990	agent0	initial_cond	0	0.000000
exp15580	3.22245147e-29	0.000000	0.000000	discard	cycle 122 u=0.0990	agent0	initial_cond	1	0.000000
exp15581	4.50941488e-29	0.000000	-0.000000	discard	cycle 122 u=0.0990	agent0	initial_cond	0	0.000000
exp15582	4.50941488e-29	0.000000	-0.000000	discard	cycle 122 u=0.0990	agent0	initial_cond	0	0.000000
exp15583	4.50941488e-29	0.000000	-0.000000	discard	cycle 122 u=0.0990	agent0	initial_cond	0	0.000000
exp15584	4.88330883e-29	0.000000	-0.000000	discard	cycle 122 u=0.0990	agent0	initial_cond	0	0.000000
exp15585	4.88330883e-29	0.000000	-0.000000	discard	cycle 122 u=0.0990	agent0	initial_cond	1	0.000000
exp15586	4.88330883e-29	0.000000	-0.000000	discard	cycle 122 u=0.0990	agent0	initial_cond	0	0.000000
exp15587	5.74085541e-29	0.000000	-0.000000	discard	cycle 122 u=0.0995	agent0	initial_cond	1	0.000000
exp15588	5.74085541e-29	0.000000	-0.000000	discard	cycle 122 u=0.0995	agent0	initial_cond	0	0.000000
exp15589	5.74085541e-29	0.000000	-0.000000	discard	cycle 122 u=0.0995	agent0	initial_cond	0	0.000000
exp15590	1.54984578e-28	0.000000	0.000000	discard	cycle 122 u=0.0995	agent0	initial_cond	0	-0.000000
exp15591	1.54984578e-28	0.000000	0.000000	discard	cycle 122 u=0.0995	agent0	initial_cond	0	-0.000000
exp15592	1.54984578e-28	0.000000	0.000000	discard	cycle 122 u=0.0995	agent0	initial_cond	1	-0.000000
exp15593	1.60328418e-29	0.000000	-0.000000	discard	cycle 122 u=0.0995	agent0	initial_cond	0	-0.000000
exp15594	1.60328418e-29	0.000000	-0.000000	discard	cycle 122 u=0.0995	agent0	initial_cond	0	-0.000000
exp15595	1.60328418e-29	0.000000	-0.000000	discard	cycle 122 u=0.0995	agent0	initial_cond	0	-0.000000
exp15596	7.34590618e-29	0.000000	0.000000	discard	cycle 122 u=0.0995	agent0	initial_cond	0	0.000000
exp15597	7.34590618e-29	0.000000	0.000000	discard	cycle 122 u=0.0995	agent0	initial_cond	1	0.000000
exp15598	7.34590618e-29	0.000000	0.000000	discard	cycle 122 u=0.0995	agent0	initial_cond	0	0.000000
exp15599	4.46546993e-29	0.000000	0.000000	discard	cycle 122 u=0.1000	agent0	initial_cond	1	-0.000000
exp15600	4.46546993e-29	0.000000	0.000000	discard	cycle 122 u=0.1000	agent0	initial_cond	0	-0.000000
exp15601	4.46546993e-29	0.000000	0.000000	discard	cycle 122 u=0.1000	agent0	initial_cond	0	-0.000000
exp15602	4.08106752e-29	0.000000	0.000000	discard	cycle 122 u=0.1000	agent0	initial_cond	0	-0.000000
exp15603	4.08106752e-29	0.000000	0.000000	discard	cycle 122 u=0.1000	agent0	initial_cond	0	-0.000000
exp15604	4.08106752e-29	0.000000	0.000000	discard	cycle 122 u=0.1000	agent0	initial_cond	1	-0.000000
exp15605	4.58623706e-29	0.000000	0.000000	discard	cycle 122 u=0.1000	agent0	initial_cond	0	-0.000000
exp15606	4.58623706e-29	0.000000	0.000000	discard	cycle 122 u=0.1000	agent0	initial_cond	0	-0.000000
exp15607	4.58623706e-29	0.000000	0.000000	discard	cycle 122 u=0.1000	agent0	initial_cond	0	-0.000000
exp15608	4.39794337e-29	0.000000	0.000000	discard	cycle 122 u=0.1000	agent0	initial_cond	0	-0.000000
exp15609	4.39794337e-29	0.000000	0.000000	discard	cycle 122 u=0.1000	agent0	initial_cond	1	-0.000000
exp15610	4.39794337e-29	0.000000	0.000000	discard	cycle 122 u=0.1000	agent0	initial_cond	0	-0.000000
exp15611	1.36727475e-28	0.000000	0.000000	discard	cycle 122 u=0.1050	agent0	initial_cond	1	-0.000000
exp15612	1.36727475e-28	0.000000	0.000000	discard	cycle 122 u=0.1050	agent0	initial_cond	0	-0.000000
exp15613	1.36727475e-28	0.000000	0.000000	discard	cycle 122 u=0.1050	agent0	initial_cond	0	-0.000000
exp15614	6.14461376e-29	0.000000	0.000000	discard	cycle 122 u=0.1050	agent0	initial_cond	0	-0.000000
exp15615	6.14461376e-29	0.000000	0.000000	discard	cycle 122 u=0.1050	agent0	initial_cond	0	-0.000000
exp15616	6.14461376e-29	0.000000	0.000000	discard	cycle 122 u=0.1050	agent0	initial_cond	1	-0.000000
exp15617	1.75906666e-28	0.000000	0.000000	discard	cycle 122 u=0.1050	agent0	initial_cond	0	-0.000000
exp15618	1.75906666e-28	0.000000	0.000000	discard	cycle 122 u=0.1050	agent0	initial_cond	0	-0.000000
exp15619	1.75906666e-28	0.000000	0.000000	discard	cycle 122 u=0.1050	agent0	initial_cond	0	-0.000000
exp15620	1.11257917e-28	0.000000	0.000000	discard	cycle 122 u=0.1050	agent0	initial_cond	0	-0.000000
exp15621	1.11257917e-28	0.000000	0.000000	discard	cycle 122 u=0.1050	agent0	initial_cond	1	-0.000000
exp15622	1.11257917e-28	0.000000	0.000000	discard	cycle 122 u=0.1050	agent0	initial_cond	0	-0.000000
exp15623	8.58580947e-29	0.000000	0.000000	discard	cycle 123 u=0.0975	agent0	initial_cond	1	0.000000
exp15624	8.58580947e-29	0.000000	0.000000	discard	cycle 123 u=0.0975	agent0	initial_cond	0	0.000000
exp15625	8.58580947e-29	0.000000	0.000000	discard	cycle 123 u=0.0975	agent0	initial_cond	0	0.000000
exp15626	5.23962023e-29	0.000000	0.000000	discard	cycle 123 u=0.0975	agent0	initial_cond	0	0.000000
exp15627	5.23962023e-29	0.000000	0.000000	discard	cycle 123 u=0.0975	agent0	initial_cond	0	0.000000
exp15628	5.23962023e-29	0.000000	0.000000	discard	cycle 123 u=0.0975	agent0	initial_cond	1	0.000000
exp15629	4.03266298e-29	0.000000	0.000000	discard	cycle 123 u=0.0975	agent0	initial_cond	0	0.000000
exp15630	4.03266298e-29	0.000000	0.000000	discard	cycle 123 u=0.0975	agent0	initial_cond	0	0.000000
exp15631	4.03266298e-29	0.000000	0.000000	discard	cycle 123 u=0.0975	agent0	initial_cond	0	0.000000
exp15632	4.80015937e-29	0.000000	0.000000	discard	cycle 123 u=0.0975	agent0	initial_cond	0	0.000000
exp15633	4.80015937e-29	0.000000	0.000000	discard	cycle 123 u=0.0975	agent0	initial_cond	1	0.000000
exp15634	4.80015937e-29	0.000000	0.000000	discard	cycle 123 u=0.0975	agent0	initial_cond	0	0.000000
exp15635	2.68824537e-29	0.000000	0.000000	discard	cycle 123 u=0.0980	agent0	initial_cond	1	-0.000000
exp15636	2.68824537e-29	0.000000	0.000000	discard	cycle 123 u=0.0980	agent0	initial_cond	0	-0.000000
exp15637	2.68824537e-29	0.000000	0.000000	discard	cycle 123 u=0.0980	agent0	initial_cond	0	-0.000000
exp15638	6.16758073e-29	0.000000	0.000000	discard	cycle 123 u=0.0980	agent0	initial_cond	0	-0.000000
exp15639	6.16758073e-29	0.000000	0.000000	discard	cycle 123 u=0.0980	agent0	initial_cond	0	-0.000000
exp15640	6.16758073e-29	0.000000	0.000000	discard	cycle 123 u=0.0980	agent0	initial_cond	1	-0.000000
exp15641	2.01926478e-29	0.000000	0.000000	discard	cycle 123 u=0.0980	agent0	initial_cond	0	0.000000
exp15642	2.01926478e-29	0.000000	0.000000	discard	cycle 123 u=0.0980	agent0	initial_cond	1	0.000000
exp15643	2.01926478e-29	0.000000	0.000000	discard	cycle 123 u=0.0980	agent0	initial_cond	0	0.000000
exp15644	1.30310780e-28	0.000000	0.000000	discard	cycle 123 u=0.0980	agent0	initial_cond	0	-0.000000
exp15645	1.30310780e-28	0.000000	0.000000	discard	cycle 123 u=0.0980	agent0	initial_cond	1	-0.000000
exp15646	1.30310780e-28	0.000000	0.000000	discard	cycle 123 u=0.0980	agent0	initial_cond	0	-0.000000
exp15647	5.45343271e-29	0.000000	0.000000	discard	cycle 123 u=0.0982	agent0	initial_cond	1	-0.000000
exp15648	5.45343271e-29	0.000000	0.000000	discard	cycle 123 u=0.0982	agent0	initial_cond	0	-0.000000
exp15649	5.45343271e-29	0.000000	0.000000	discard	cycle 123 u=0.0982	agent0	initial_cond	0	-0.000000
exp15650	1.23429977e-28	0.000000	0.000000	discard	cycle 123 u=0.0982	agent0	initial_cond	0	0.000000
exp15651	1.23429977e-28	0.000000	0.000000	discard	cycle 123 u=0.0982	agent0	initial_cond	0	0.000000
exp15652	1.23429977e-28	0.000000	0.000000	discard	cycle 123 u=0.0982	agent0	initial_cond	1	0.000000
exp15653	1.88036672e-29	0.000000	0.000000	discard	cycle 123 u=0.0982	agent0	initial_cond	0	0.000000
exp15654	1.88036672e-29	0.000000	0.000000	discard	cycle 123 u=0.0982	agent0	initial_cond	1	0.000000
exp15655	1.88036672e-29	0.000000	0.000000	discard	cycle 123 u=0.0982	agent0	initial_cond	0	0.000000
exp15656	1.91190259e-29	0.000000	-0.000000	discard	cycle 123 u=0.0982	agent0	initial_cond	0	0.000000
exp15657	1.91190259e-29	0.000000	-0.000000	discard	cycle 123 u=0.0982	agent0	initial_cond	0	0.000000
exp15658	1.91190259e-29	0.000000	-0.000000	discard	cycle 123 u=0.0982	agent0	initial_cond	0	0.000000
exp15659	6.13049994e-29	0.000000	0.000000	discard	cycle 123 u=0.0985	agent0	initial_cond	1	0.000000
exp15660	6.13049994e-29	0.000000	0.000000	discard	cycle 123 u=0.0985	agent0	initial_cond	0	0.000000
exp15661	6.13049994e-29	0.000000	0.000000	discard	cycle 123 u=0.0985	agent0	initial_cond	1	0.000000
exp15662	5.49750971e-29	0.000000	0.000000	discard	cycle 123 u=0.0985	agent0	initial_cond	0	0.000000
exp15663	5.49750971e-29	0.000000	0.000000	discard	cycle 123 u=0.0985	agent0	initial_cond	0	0.000000
exp15664	5.49750971e-29	0.000000	0.000000	discard	cycle 123 u=0.0985	agent0	initial_cond	1	0.000000
exp15665	4.15642452e-29	0.000000	0.000000	discard	cycle 123 u=0.0985	agent0	initial_cond	0	0.000000
exp15666	4.15642452e-29	0.000000	0.000000	discard	cycle 123 u=0.0985	agent0	initial_cond	1	0.000000
exp15667	4.15642452e-29	0.000000	0.000000	discard	cycle 123 u=0.0985	agent0	initial_cond	0	0.000000
exp15668	2.19292611e-29	0.000000	0.000000	discard	cycle 123 u=0.0985	agent0	initial_cond	0	-0.000000
exp15669	2.19292611e-29	0.000000	0.000000	discard	cycle 123 u=0.0985	agent0	initial_cond	0	-0.000000
exp15670	2.19292611e-29	0.000000	0.000000	discard	cycle 123 u=0.0985	agent0	initial_cond	0	-0.000000
exp15671	4.22491788e-29	0.000000	0.000000	discard	cycle 123 u=0.0990	agent0	initial_cond	1	-0.000000
exp15672	4.22491788e-29	0.000000	0.000000	discard	cycle 123 u=0.0990	agent0	initial_cond	0	-0.000000
exp15673	4.22491788e-29	0.000000	0.000000	discard	cycle 123 u=0.0990	agent0	initial_cond	1	-0.000000
exp15674	3.22245147e-29	0.000000	0.000000	discard	cycle 123 u=0.0990	agent0	initial_cond	0	0.000000
exp15675	3.22245147e-29	0.000000	0.000000	discard	cycle 123 u=0.0990	agent0	initial_cond	0	0.000000
exp15676	3.22245147e-29	0.000000	0.000000	discard	cycle 123 u=0.0990	agent0	initial_cond	0	0.000000
exp15677	4.50941488e-29	0.000000	-0.000000	discard	cycle 123 u=0.0990	agent0	initial_cond	0	0.000000
exp15678	4.50941488e-29	0.000000	-0.000000	discard	cycle 123 u=0.0990	agent0	initial_cond	1	0.000000
exp15679	4.50941488e-29	0.000000	-0.000000	discard	cycle 123 u=0.0990	agent0	initial_cond	0	0.000000
exp15680	4.88330883e-29	0.000000	-0.000000	discard	cycle 123 u=0.0990	agent0	initial_cond	1	0.000000
exp15681	4.88330883e-29	0.000000	-0.000000	discard	cycle 123 u=0.0990	agent0	initial_cond	0	0.000000
exp15682	4.88330883e-29	0.000000	-0.000000	discard	cycle 123 u=0.0990	agent0	initial_cond	0	0.000000
exp15683	5.74085541e-29	0.000000	-0.000000	discard	cycle 123 u=0.0995	agent0	initial_cond	1	0.000000
exp15684	5.74085541e-29	0.000000	-0.000000	discard	cycle 123 u=0.0995	agent0	initial_cond	0	0.000000
exp15685	5.74085541e-29	0.000000	-0.000000	discard	cycle 123 u=0.0995	agent0	initial_cond	1	0.000000
exp15686	1.54984578e-28	0.000000	0.000000	discard	cycle 123 u=0.0995	agent0	initial_cond	0	-0.000000
exp15687	1.54984578e-28	0.000000	0.000000	discard	cycle 123 u=0.0995	agent0	initial_cond	0	-0.000000
exp15688	1.54984578e-28	0.000000	0.000000	discard	cycle 123 u=0.0995	agent0	initial_cond	0	-0.000000
exp15689	1.60328418e-29	0.000000	-0.000000	discard	cycle 123 u=0.0995	agent0	initial_cond	0	-0.000000
exp15690	1.60328418e-29	0.000000	-0.000000	discard	cycle 123 u=0.0995	agent0	initial_cond	1	-0.000000
exp15691	1.60328418e-29	0.000000	-0.000000	discard	cycle 123 u=0.0995	agent0	initial_cond	0	-0.000000
exp15692	7.34590618e-29	0.000000	0.000000	discard	cycle 123 u=0.0995	agent0	initial_cond	1	0.000000
exp15693	7.34590618e-29	0.000000	0.000000	discard	cycle 123 u=0.0995	agent0	initial_cond	0	0.000000
exp15694	7.34590618e-29	0.000000	0.000000	discard	cycle 123 u=0.0995	agent0	initial_cond	0	0.000000
exp15695	4.46546993e-29	0.000000	0.000000	discard	cycle 123 u=0.1000	agent0	initial_cond	0	-0.000000
exp15696	4.46546993e-29	0.000000	0.000000	discard	cycle 123 u=0.1000	agent0	initial_cond	0	-0.000000
exp15697	4.46546993e-29	0.000000	0.000000	discard	cycle 123 u=0.1000	agent0	initial_cond	1	-0.000000
exp15698	4.08106752e-29	0.000000	0.000000	discard	cycle 123 u=0.1000	agent0	initial_cond	0	-0.000000
exp15699	4.08106752e-29	0.000000	0.000000	discard	cycle 123 u=0.1000	agent0	initial_cond	1	-0.000000
exp15700	4.08106752e-29	0.000000	0.000000	discard	cycle 123 u=0.1000	agent0	initial_cond	0	-0.000000
exp15701	4.58623706e-29	0.000000	0.000000	discard	cycle 123 u=0.1000	agent0	initial_cond	0	-0.000000
exp15702	4.58623706e-29	0.000000	0.000000	discard	cycle 123 u=0.1000	agent0	initial_cond	0	-0.000000
exp15703	4.58623706e-29	0.000000	0.000000	discard	cycle 123 u=0.1000	agent0	initial_cond	0	-0.000000
exp15704	4.39794337e-29	0.000000	0.000000	discard	cycle 123 u=0.1000	agent0	initial_cond	1	-0.000000
exp15705	4.39794337e-29	0.000000	0.000000	discard	cycle 123 u=0.1000	agent0	initial_cond	0	-0.000000
exp15706	4.39794337e-29	0.000000	0.000000	discard	cycle 123 u=0.1000	agent0	initial_cond	1	-0.000000
exp15707	1.36727475e-28	0.000000	0.000000	discard	cycle 123 u=0.1050	agent0	initial_cond	0	-0.000000
exp15708	1.36727475e-28	0.000000	0.000000	discard	cycle 123 u=0.1050	agent0	initial_cond	0	-0.000000
exp15709	1.36727475e-28	0.000000	0.000000	discard	cycle 123 u=0.1050	agent0	initial_cond	0	-0.000000
exp15710	6.14461376e-29	0.000000	0.000000	discard	cycle 123 u=0.1050	agent0	initial_cond	0	-0.000000
exp15711	6.14461376e-29	0.000000	0.000000	discard	cycle 123 u=0.1050	agent0	initial_cond	1	-0.000000
exp15712	6.14461376e-29	0.000000	0.000000	discard	cycle 123 u=0.1050	agent0	initial_cond	0	-0.000000
exp15713	1.75906666e-28	0.000000	0.000000	discard	cycle 123 u=0.1050	agent0	initial_cond	1	-0.000000
exp15714	1.75906666e-28	0.000000	0.000000	discard	cycle 123 u=0.1050	agent0	initial_cond	0	-0.000000
exp15715	1.75906666e-28	0.000000	0.000000	discard	cycle 123 u=0.1050	agent0	initial_cond	0	-0.000000
exp15716	1.11257917e-28	0.000000	0.000000	discard	cycle 123 u=0.1050	agent0	initial_cond	1	-0.000000
exp15717	1.11257917e-28	0.000000	0.000000	discard	cycle 123 u=0.1050	agent0	initial_cond	0	-0.000000
exp15718	1.11257917e-28	0.000000	0.000000	discard	cycle 123 u=0.1050	agent0	initial_cond	1	-0.000000
exp15719	8.58580947e-29	0.000000	0.000000	discard	cycle 124 u=0.0975	agent0	initial_cond	0	0.000000
exp15720	8.58580947e-29	0.000000	0.000000	discard	cycle 124 u=0.0975	agent0	initial_cond	0	0.000000
exp15721	8.58580947e-29	0.000000	0.000000	discard	cycle 124 u=0.0975	agent0	initial_cond	0	0.000000
exp15722	5.23962023e-29	0.000000	0.000000	discard	cycle 124 u=0.0975	agent0	initial_cond	0	0.000000
exp15723	5.23962023e-29	0.000000	0.000000	discard	cycle 124 u=0.0975	agent0	initial_cond	1	0.000000
exp15724	5.23962023e-29	0.000000	0.000000	discard	cycle 124 u=0.0975	agent0	initial_cond	0	0.000000
exp15725	4.03266298e-29	0.000000	0.000000	discard	cycle 124 u=0.0975	agent0	initial_cond	1	0.000000
exp15726	4.03266298e-29	0.000000	0.000000	discard	cycle 124 u=0.0975	agent0	initial_cond	0	0.000000
exp15727	4.03266298e-29	0.000000	0.000000	discard	cycle 124 u=0.0975	agent0	initial_cond	0	0.000000
exp15728	4.80015937e-29	0.000000	0.000000	discard	cycle 124 u=0.0975	agent0	initial_cond	0	0.000000
exp15729	4.80015937e-29	0.000000	0.000000	discard	cycle 124 u=0.0975	agent0	initial_cond	0	0.000000
exp15730	4.80015937e-29	0.000000	0.000000	discard	cycle 124 u=0.0975	agent0	initial_cond	1	0.000000
exp15731	2.68824537e-29	0.000000	0.000000	discard	cycle 124 u=0.0980	agent0	initial_cond	0	-0.000000
exp15732	2.68824537e-29	0.000000	0.000000	discard	cycle 124 u=0.0980	agent0	initial_cond	0	-0.000000
exp15733	2.68824537e-29	0.000000	0.000000	discard	cycle 124 u=0.0980	agent0	initial_cond	0	-0.000000
exp15734	6.16758073e-29	0.000000	0.000000	discard	cycle 124 u=0.0980	agent0	initial_cond	0	-0.000000
exp15735	6.16758073e-29	0.000000	0.000000	discard	cycle 124 u=0.0980	agent0	initial_cond	1	-0.000000
exp15736	6.16758073e-29	0.000000	0.000000	discard	cycle 124 u=0.0980	agent0	initial_cond	0	-0.000000
exp15737	2.01926478e-29	0.000000	0.000000	discard	cycle 124 u=0.0980	agent0	initial_cond	1	0.000000
exp15738	2.01926478e-29	0.000000	0.000000	discard	cycle 124 u=0.0980	agent0	initial_cond	0	0.000000
exp15739	2.01926478e-29	0.000000	0.000000	discard	cycle 124 u=0.0980	agent0	initial_cond	0	0.000000
exp15740	1.30310780e-28	0.000000	0.000000	discard	cycle 124 u=0.0980	agent0	initial_cond	0	-0.000000
exp15741	1.30310780e-28	0.000000	0.000000	discard	cycle 124 u=0.0980	agent0	initial_cond	0	-0.000000
exp15742	1.30310780e-28	0.000000	0.000000	discard	cycle 124 u=0.0980	agent0	initial_cond	1	-0.000000
exp15743	5.45343271e-29	0.000000	0.000000	discard	cycle 124 u=0.0982	agent0	initial_cond	0	-0.000000
exp15744	5.45343271e-29	0.000000	0.000000	discard	cycle 124 u=0.0982	agent0	initial_cond	1	-0.000000
exp15745	5.45343271e-29	0.000000	0.000000	discard	cycle 124 u=0.0982	agent0	initial_cond	0	-0.000000
exp15746	1.23429977e-28	0.000000	0.000000	discard	cycle 124 u=0.0982	agent0	initial_cond	0	0.000000
exp15747	1.23429977e-28	0.000000	0.000000	discard	cycle 124 u=0.0982	agent0	initial_cond	0	0.000000
exp15748	1.23429977e-28	0.000000	0.000000	discard	cycle 124 u=0.0982	agent0	initial_cond	0	0.000000
exp15749	1.88036672e-29	0.000000	0.000000	discard	cycle 124 u=0.0982	agent0	initial_cond	1	0.000000
exp15750	1.88036672e-29	0.000000	0.000000	discard	cycle 124 u=0.0982	agent0	initial_cond	0	0.000000
exp15751	1.88036672e-29	0.000000	0.000000	discard	cycle 124 u=0.0982	agent0	initial_cond	0	0.000000
exp15752	1.91190259e-29	0.000000	-0.000000	discard	cycle 124 u=0.0982	agent0	initial_cond	0	0.000000
exp15753	1.91190259e-29	0.000000	-0.000000	discard	cycle 124 u=0.0982	agent0	initial_cond	0	0.000000
exp15754	1.91190259e-29	0.000000	-0.000000	discard	cycle 124 u=0.0982	agent0	initial_cond	1	0.000000
