exp_id	residual	solution_norm	solution_mean	status	description	agent	design	elapsed_s	solution_energy
exp4055	1.54984578e-28	0.000000	0.000000	discard	cycle 19 u=0.0995	agent0	initial_cond	0	-0.000000
exp4056	1.60328418e-29	0.000000	-0.000000	discard	cycle 19 u=0.0995	agent0	initial_cond	0	-0.000000
exp4057	1.60328418e-29	0.000000	-0.000000	discard	cycle 19 u=0.0995	agent0	initial_cond	1	-0.000000
exp4058	1.60328418e-29	0.000000	-0.000000	discard	cycle 19 u=0.0995	agent0	initial_cond	0	-0.000000
exp4059	7.34590618e-29	0.000000	0.000000	discard	cycle 19 u=0.0995	agent0	initial_cond	0	0.000000
exp4060	7.34590618e-29	0.000000	0.000000	discard	cycle 19 u=0.0995	agent0	initial_cond	0	0.000000
exp4061	7.34590618e-29	0.000000	0.000000	discard	cycle 19 u=0.0995	agent0	initial_cond	0	0.000000
exp4062	4.46546993e-29	0.000000	0.000000	discard	cycle 19 u=0.1000	agent0	initial_cond	1	-0.000000
exp4063	4.46546993e-29	0.000000	0.000000	discard	cycle 19 u=0.1000	agent0	initial_cond	0	-0.000000
exp4064	4.46546993e-29	0.000000	0.000000	discard	cycle 19 u=0.1000	agent0	initial_cond	0	-0.000000
exp4065	4.08106752e-29	0.000000	0.000000	discard	cycle 19 u=0.1000	agent0	initial_cond	1	-0.000000
exp4066	4.08106752e-29	0.000000	0.000000	discard	cycle 19 u=0.1000	agent0	initial_cond	0	-0.000000
exp4067	4.08106752e-29	0.000000	0.000000	discard	cycle 19 u=0.1000	agent0	initial_cond	0	-0.000000
exp4068	4.58623706e-29	0.000000	0.000000	discard	cycle 19 u=0.1000	agent0	initial_cond	1	-0.000000
exp4069	4.58623706e-29	0.000000	0.000000	discard	cycle 19 u=0.1000	agent0	initial_cond	0	-0.000000
exp4070	4.58623706e-29	0.000000	0.000000	discard	cycle 19 u=0.1000	agent0	initial_cond	0	-0.000000
exp4071	4.39794337e-29	0.000000	0.000000	discard	cycle 19 u=0.1000	agent0	initial_cond	0	-0.000000
exp4072	4.39794337e-29	0.000000	0.000000	discard	cycle 19 u=0.1000	agent0	initial_cond	0	-0.000000
exp4073	4.39794337e-29	0.000000	0.000000	discard	cycle 19 u=0.1000	agent0	initial_cond	1	-0.000000
exp4074	1.36727475e-28	0.000000	0.000000	discard	cycle 19 u=0.1050	agent0	initial_cond	0	-0.000000
exp4075	1.36727475e-28	0.000000	0.000000	discard	cycle 19 u=0.1050	agent0	initial_cond	0	-0.000000
exp4076	1.36727475e-28	0.000000	0.000000	discard	cycle 19 u=0.1050	agent0	initial_cond	1	-0.000000
exp4077	6.14461376e-29	0.000000	0.000000	discard	cycle 19 u=0.1050	agent0	initial_cond	0	-0.000000
exp4078	6.14461376e-29	0.000000	0.000000	discard	cycle 19 u=0.1050	agent0	initial_cond	0	-0.000000
exp4079	6.14461376e-29	0.000000	0.000000	discard	cycle 19 u=0.1050	agent0	initial_cond	1	-0.000000
exp4080	1.75906666e-28	0.000000	0.000000	discard	Fourier 2 repetition 1	agent0	solver_param	0	-0.000000
exp4080	1.75906666e-28	0.000000	0.000000	discard	cycle 19 u=0.1050	agent0	initial_cond	0	-0.000000
exp4081	2.00148302e-16	1.001298	1.000025	discard	cycle 19 u=0.1050	agent0	initial_cond	1	-1.520921
exp4081	2.00148302e-16	1.001298	1.000025	discard	Fourier 2 repetition 2	agent0	solver_param	1	-1.520921
exp4082	2.00148302e-16	1.001298	1.000025	discard	cycle 19 u=0.1050	agent0	initial_cond	0	-1.520921
exp4082	2.00148302e-16	1.001298	1.000025	discard	Fourier 2 repetition 3	agent0	solver_param	0	-1.520921
exp4083	2.00148302e-16	1.001298	1.000025	discard	cycle 19 u=0.1050	agent0	initial_cond	0	-1.520921
exp4084	1.11257917e-28	0.000000	0.000000	discard	Fourier 2 repetition 4	agent0	solver_param	0	-0.000000
exp4085	2.00148302e-16	1.001298	1.000025	discard	cycle 19 u=0.1050	agent0	initial_cond	1	-1.520921
exp4086	1.11257917e-28	0.000000	0.000000	discard	Fourier 2 repetition 5	agent0	solver_param	1	-0.000000
exp4087	2.00148302e-16	1.001298	1.000025	discard	cycle 19 u=0.1050	agent0	initial_cond	0	-1.520921
exp4088	8.58580947e-29	0.000000	0.000000	discard	Fourier 2 repetition 6	agent0	solver_param	0	0.000000
exp4089	8.58580947e-29	0.000000	0.000000	discard	cycle 20 u=0.0975	agent0	initial_cond	0	0.000000
exp4090	8.58580947e-29	0.000000	0.000000	discard	Fourier 2 repetition 7	agent0	solver_param	1	0.000000
exp4091	8.58580947e-29	0.000000	0.000000	discard	cycle 20 u=0.0975	agent0	initial_cond	1	0.000000
exp4092	8.58580947e-29	0.000000	0.000000	discard	Fourier 2 repetition 8	agent0	solver_param	0	0.000000
exp4092	8.58580947e-29	0.000000	0.000000	discard	cycle 20 u=0.0975	agent0	initial_cond	0	0.000000
exp4093	5.23962023e-29	0.000000	0.000000	discard	Fourier 2 repetition 9	agent0	solver_param	0	0.000000
exp4093	5.23962023e-29	0.000000	0.000000	discard	cycle 20 u=0.0975	agent0	initial_cond	0	0.000000
exp4094	2.00148302e-16	1.001298	1.000025	discard	cycle 20 u=0.0975	agent0	initial_cond	0	-1.520921
exp4094	2.00148302e-16	1.001298	1.000025	discard	Fourier 2 repetition 10	agent0	solver_param	0	-1.520921
exp4095	2.00148302e-16	1.001298	1.000025	discard	cycle 20 u=0.0975	agent0	initial_cond	0	-1.520921
exp4096	2.00148302e-16	1.001298	1.000025	discard	cycle 20 u=0.0975	agent0	initial_cond	1	-1.520921
exp4097	2.00148302e-16	1.001298	1.000025	discard	Fourier 2 repetition 12	agent0	solver_param	1	-1.520921
exp4098	2.00148302e-16	1.001298	1.000025	discard	cycle 20 u=0.0975	agent0	initial_cond	0	-1.520921
exp4099	4.03266298e-29	0.000000	0.000000	discard	Fourier 2 repetition 13	agent0	solver_param	0	0.000000
exp4100	2.00148302e-16	1.001298	1.000025	discard	cycle 20 u=0.0975	agent0	initial_cond	0	-1.520921
exp4101	4.80015937e-29	0.000000	0.000000	discard	Fourier 2 repetition 14	agent0	solver_param	0	0.000000
exp4102	2.00148302e-16	1.001298	1.000025	discard	cycle 20 u=0.0975	agent0	initial_cond	1	-1.520921
exp4103	4.80015937e-29	0.000000	0.000000	discard	Fourier 2 repetition 15	agent0	solver_param	0	0.000000
exp4104	2.00148302e-16	1.001298	1.000025	discard	cycle 20 u=0.0975	agent0	initial_cond	0	-1.520921
exp4105	4.80015937e-29	0.000000	0.000000	discard	Fourier 2 repetition 16	agent0	solver_param	0	0.000000
exp4106	4.80015937e-29	0.000000	0.000000	discard	cycle 20 u=0.0975	agent0	initial_cond	0	0.000000
exp4107	2.68824537e-29	0.000000	0.000000	discard	Fourier 2 repetition 17	agent0	solver_param	1	-0.000000
exp4108	2.68824537e-29	0.000000	0.000000	discard	cycle 20 u=0.0980	agent0	initial_cond	1	-0.000000
exp4109	2.68824537e-29	0.000000	0.000000	discard	Fourier 2 repetition 18	agent0	solver_param	0	-0.000000
exp4109	2.68824537e-29	0.000000	0.000000	discard	cycle 20 u=0.0980	agent0	initial_cond	0	-0.000000
exp4110	2.00148302e-16	1.001298	1.000025	discard	cycle 20 u=0.0980	agent0	initial_cond	1	-1.520921
exp4110	2.00148302e-16	1.001298	1.000025	discard	Fourier 2 repetition 19	agent0	solver_param	1	-1.520921
exp4111	2.00148302e-16	1.001298	1.000025	discard	cycle 20 u=0.0980	agent0	initial_cond	0	-1.520921
exp4112	2.00148302e-16	1.001298	1.000025	discard	Fourier 2 repetition 20	agent0	solver_param	0	-1.520921
exp4113	6.16758073e-29	0.000000	0.000000	discard	cycle 20 u=0.0980	agent0	initial_cond	0	-0.000000
exp4114	6.16758073e-29	0.000000	0.000000	discard	cycle 20 u=0.0980	agent0	initial_cond	1	-0.000000
exp4115	2.01926478e-29	0.000000	0.000000	discard	cycle 20 u=0.0980	agent0	initial_cond	0	0.000000
exp4116	2.01926478e-29	0.000000	0.000000	discard	cycle 20 u=0.0980	agent0	initial_cond	0	0.000000
exp4117	3.76992110e-09	0.070535	0.000000	discard	4th_branch exotic phase=90Â° amp=0.30 tol=1.0e-7	agent1	solver_param	1	0.000099
exp4118	2.01926478e-29	0.000000	0.000000	discard	cycle 20 u=0.0980	agent0	initial_cond	1	0.000000
exp4119	3.76992110e-09	0.070535	0.000000	discard	4th_branch exotic phase=90Â° amp=0.30 tol=1.0e-8	agent1	solver_param	0	0.000099
exp4120	1.30310780e-28	0.000000	0.000000	discard	cycle 20 u=0.0980	agent0	initial_cond	0	-0.000000
exp4121	1.91857758e-14	0.070535	-0.000000	discard	4th_branch exotic phase=90Â° amp=0.30 tol=5.0e-9	agent1	solver_param	0	0.000099
exp4121	1.30310780e-28	0.000000	0.000000	discard	cycle 20 u=0.0980	agent0	initial_cond	0	-0.000000
exp4122	1.91857758e-14	0.070535	-0.000000	discard	4th_branch exotic phase=90Â° amp=0.30 tol=1.0e-9	agent1	solver_param	1	0.000099
exp4122	1.30310780e-28	0.000000	0.000000	discard	cycle 20 u=0.0980	agent0	initial_cond	0	-0.000000
exp4123	1.91857758e-14	0.070535	-0.000000	discard	4th_branch exotic phase=90Â° amp=0.30 tol=5.0e-10	agent1	solver_param	0	0.000099
exp4123	5.45343271e-29	0.000000	0.000000	discard	cycle 20 u=0.0982	agent0	initial_cond	0	-0.000000
exp4124	5.45343271e-29	0.000000	0.000000	discard	cycle 20 u=0.0982	agent0	initial_cond	1	-0.000000
exp4124	1.91857758e-14	0.070535	-0.000000	discard	4th_branch exotic phase=90Â° amp=0.30 tol=1.0e-10	agent1	solver_param	1	0.000099
exp4125	5.45343271e-29	0.000000	0.000000	discard	cycle 20 u=0.0982	agent0	initial_cond	0	-0.000000
exp4125	2.90324029e-13	0.082217	-0.000000	discard	3d_search phase=1.2 u=-0.2 amp=0.35	agent1	branch_search	0	0.000216
exp4126	1.23429977e-28	0.000000	0.000000	discard	cycle 20 u=0.0982	agent0	initial_cond	0	0.000000
exp4126	1.38792865e-11	0.082217	-0.000000	discard	3d_search phase=1.2 u=-0.1 amp=0.35	agent1	branch_search	0	0.000216
exp4127	1.23429977e-28	0.000000	0.000000	discard	cycle 20 u=0.0982	agent0	initial_cond	1	0.000000
exp4127	3.24180362e-14	0.082217	-0.000000	discard	3d_search phase=1.2 u=0.0 amp=0.35	agent1	branch_search	1	0.000216
exp4128	1.23429977e-28	0.000000	0.000000	discard	cycle 20 u=0.0982	agent0	initial_cond	0	0.000000
exp4128	4.48267104e-17	0.082217	0.000000	discard	3d_search phase=1.2 u=0.1 amp=0.35	agent1	branch_search	0	0.000216
exp4129	1.88036672e-29	0.000000	0.000000	discard	cycle 20 u=0.0982	agent0	initial_cond	0	0.000000
exp4129	1.39647827e-11	0.082217	-0.000000	discard	3d_search phase=1.2 u=0.2 amp=0.35	agent1	branch_search	0	0.000216
exp4130	1.88036672e-29	0.000000	0.000000	discard	cycle 20 u=0.0982	agent0	initial_cond	1	0.000000
exp4130	5.72372103e-13	0.082217	-0.000000	discard	3d_search phase=1.3 u=-0.2 amp=0.35	agent1	branch_search	1	0.000216
exp4131	1.88036672e-29	0.000000	0.000000	discard	cycle 20 u=0.0982	agent0	initial_cond	0	0.000000
exp4131	2.01831296e-11	0.082217	-0.000000	discard	3d_search phase=1.3 u=-0.1 amp=0.35	agent1	branch_search	0	0.000216
exp4132	1.91190259e-29	0.000000	-0.000000	discard	cycle 20 u=0.0982	agent0	initial_cond	0	0.000000
exp4132	3.23839494e-14	0.082217	-0.000000	discard	3d_search phase=1.3 u=0.0 amp=0.35	agent1	branch_search	0	0.000216
exp4133	1.91190259e-29	0.000000	-0.000000	discard	cycle 20 u=0.0982	agent0	initial_cond	0	0.000000
exp4133	3.89959435e-17	0.082217	-0.000000	discard	3d_search phase=1.3 u=0.1 amp=0.35	agent1	branch_search	0	0.000216
exp4134	1.91190259e-29	0.000000	-0.000000	discard	cycle 20 u=0.0982	agent0	initial_cond	0	0.000000
exp4134	9.61400897e-12	0.082217	-0.000000	discard	3d_search phase=1.3 u=0.2 amp=0.35	agent1	branch_search	0	0.000216
exp4135	6.13049994e-29	0.000000	0.000000	discard	cycle 20 u=0.0985	agent0	initial_cond	1	0.000000
exp4135	1.06692997e-12	0.082217	-0.000000	discard	3d_search phase=1.4 u=-0.2 amp=0.35	agent1	branch_search	1	0.000216
exp4136	6.13049994e-29	0.000000	0.000000	discard	cycle 20 u=0.0985	agent0	initial_cond	0	0.000000
exp4136	2.86826411e-11	0.082217	-0.000000	discard	3d_search phase=1.4 u=-0.1 amp=0.35	agent1	branch_search	0	0.000216
exp4137	6.13049994e-29	0.000000	0.000000	discard	cycle 20 u=0.0985	agent0	initial_cond	0	0.000000
exp4138	3.20136067e-14	0.082217	-0.000000	discard	3d_search phase=1.4 u=0.0 amp=0.35	agent1	branch_search	0	0.000216
exp4139	5.49750971e-29	0.000000	0.000000	discard	cycle 20 u=0.0985	agent0	initial_cond	1	0.000000
exp4140	6.49378913e-17	0.082217	-0.000000	discard	3d_search phase=1.4 u=0.1 amp=0.35	agent1	branch_search	1	0.000216
exp4141	5.49750971e-29	0.000000	0.000000	discard	cycle 20 u=0.0985	agent0	initial_cond	0	0.000000
exp4142	6.30239705e-12	0.082217	-0.000000	discard	3d_search phase=1.4 u=0.2 amp=0.35	agent1	branch_search	0	0.000216
exp4143	5.49750971e-29	0.000000	0.000000	discard	cycle 20 u=0.0985	agent0	initial_cond	0	0.000000
exp4144	1.89325863e-12	0.082217	-0.000000	discard	3d_search phase=1.5 u=-0.2 amp=0.35	agent1	branch_search	0	0.000216
exp4145	4.15642452e-29	0.000000	0.000000	discard	cycle 20 u=0.0985	agent0	initial_cond	1	0.000000
exp4146	4.00454434e-11	0.082217	-0.000000	discard	3d_search phase=1.5 u=-0.1 amp=0.35	agent1	branch_search	0	0.000216
exp4147	4.15642452e-29	0.000000	0.000000	discard	cycle 20 u=0.0985	agent0	initial_cond	0	0.000000
exp4148	3.16486286e-14	0.082217	-0.000000	discard	3d_search phase=1.5 u=0.0 amp=0.35	agent1	branch_search	0	0.000216
exp4149	4.15642452e-29	0.000000	0.000000	discard	cycle 20 u=0.0985	agent0	initial_cond	1	0.000000
exp4150	7.97760976e-17	0.082217	-0.000000	discard	3d_search phase=1.5 u=0.1 amp=0.35	agent1	branch_search	1	0.000216
exp4151	2.19292611e-29	0.000000	0.000000	discard	cycle 20 u=0.0985	agent0	initial_cond	0	-0.000000
exp4152	3.95036219e-12	0.082217	0.000000	discard	3d_search phase=1.5 u=0.2 amp=0.35	agent1	branch_search	0	0.000216
exp4153	2.19292611e-29	0.000000	0.000000	discard	cycle 20 u=0.0985	agent0	initial_cond	0	-0.000000
exp4154	3.21159234e-12	0.082217	-0.000000	discard	3d_search phase=1.6 u=-0.2 amp=0.35	agent1	branch_search	0	0.000216
exp4155	2.19292611e-29	0.000000	0.000000	discard	cycle 20 u=0.0985	agent0	initial_cond	1	-0.000000
exp4156	5.50361042e-11	0.082217	-0.000000	discard	3d_search phase=1.6 u=-0.1 amp=0.35	agent1	branch_search	1	0.000216
exp4157	4.22491788e-29	0.000000	0.000000	discard	cycle 20 u=0.0990	agent0	initial_cond	0	-0.000000
exp4158	3.15938259e-14	0.082217	0.000000	discard	3d_search phase=1.6 u=0.0 amp=0.35	agent1	branch_search	0	0.000216
exp4159	4.22491788e-29	0.000000	0.000000	discard	cycle 20 u=0.0990	agent0	initial_cond	0	-0.000000
exp4160	4.57952771e-11	0.082217	0.000000	discard	3d_search phase=1.6 u=0.1 amp=0.35	agent1	branch_search	0	0.000216
exp4161	4.22491788e-29	0.000000	0.000000	discard	cycle 20 u=0.0990	agent0	initial_cond	1	-0.000000
exp4162	2.37124321e-12	0.082217	0.000000	discard	3d_search phase=1.6 u=0.2 amp=0.35	agent1	branch_search	0	0.000216
exp4163	3.22245147e-29	0.000000	0.000000	discard	cycle 20 u=0.0990	agent0	initial_cond	0	0.000000
exp4164	5.21706628e-12	0.082217	0.000000	discard	3d_search phase=1.7 u=-0.2 amp=0.35	agent1	branch_search	0	0.000216
exp4165	3.22245147e-29	0.000000	0.000000	discard	cycle 20 u=0.0990	agent0	initial_cond	0	0.000000
exp4166	3.08495131e-17	0.082217	-0.000000	discard	3d_search phase=1.7 u=-0.1 amp=0.35	agent1	branch_search	1	0.000216
exp4167	3.22245147e-29	0.000000	0.000000	discard	cycle 20 u=0.0990	agent0	initial_cond	0	0.000000
exp4168	3.18575364e-14	0.082217	0.000000	discard	3d_search phase=1.7 u=0.0 amp=0.35	agent1	branch_search	0	0.000216
exp4169	4.50941488e-29	0.000000	-0.000000	discard	cycle 20 u=0.0990	agent0	initial_cond	0	0.000000
exp4170	3.30183205e-11	0.082217	0.000000	discard	3d_search phase=1.7 u=0.1 amp=0.35	agent1	branch_search	0	0.000216
exp4171	4.50941488e-29	0.000000	-0.000000	discard	cycle 20 u=0.0990	agent0	initial_cond	1	0.000000
exp4172	1.36208257e-12	0.082217	0.000000	discard	3d_search phase=1.7 u=0.2 amp=0.35	agent1	branch_search	1	0.000216
exp4173	4.50941488e-29	0.000000	-0.000000	discard	cycle 20 u=0.0990	agent0	initial_cond	0	0.000000
exp4174	8.11105221e-12	0.082217	0.000000	discard	3d_search phase=1.8 u=-0.2 amp=0.35	agent1	branch_search	0	0.000216
exp4175	4.88330883e-29	0.000000	-0.000000	discard	cycle 20 u=0.0990	agent0	initial_cond	0	0.000000
exp4176	4.52290894e-17	0.082217	0.000000	discard	3d_search phase=1.8 u=-0.1 amp=0.35	agent1	branch_search	0	0.000216
exp4177	4.88330883e-29	0.000000	-0.000000	discard	cycle 20 u=0.0990	agent0	initial_cond	1	0.000000
exp4178	3.22883782e-14	0.082217	0.000000	discard	3d_search phase=1.8 u=0.0 amp=0.35	agent1	branch_search	0	0.000216
exp4179	4.88330883e-29	0.000000	-0.000000	discard	cycle 20 u=0.0990	agent0	initial_cond	0	0.000000
exp4180	2.34163958e-11	0.082217	0.000000	discard	3d_search phase=1.8 u=0.1 amp=0.35	agent1	branch_search	0	0.000216
exp4181	5.74085541e-29	0.000000	-0.000000	discard	cycle 20 u=0.0995	agent0	initial_cond	0	0.000000
exp4182	7.46334312e-13	0.082217	0.000000	discard	3d_search phase=1.8 u=0.2 amp=0.35	agent1	branch_search	1	0.000216
exp4183	5.74085541e-29	0.000000	-0.000000	discard	cycle 20 u=0.0995	agent0	initial_cond	1	0.000000
exp4184	6.73702768e-11	0.000323	0.000000	discard	exotic mode=3 fourier=2	agent1	solver_param	0	-0.000000
exp4185	5.74085541e-29	0.000000	-0.000000	discard	cycle 20 u=0.0995	agent0	initial_cond	0	0.000000
exp4186	4.04564983e-14	0.070535	0.000000	discard	exotic mode=3 fourier=4	agent1	solver_param	0	0.000099
exp4187	1.54984578e-28	0.000000	0.000000	discard	cycle 20 u=0.0995	agent0	initial_cond	0	-0.000000
exp4188	2.59145622e-17	0.000000	-0.000000	discard	exotic mode=3 fourier=8	agent1	solver_param	1	0.000000
exp4189	1.54984578e-28	0.000000	0.000000	discard	cycle 20 u=0.0995	agent0	initial_cond	0	-0.000000
exp4190	6.73702768e-11	0.000323	-0.000000	discard	exotic mode=5 fourier=2	agent1	solver_param	0	-0.000000
exp4191	1.54984578e-28	0.000000	0.000000	discard	cycle 20 u=0.0995	agent0	initial_cond	0	-0.000000
exp4192	4.04410517e-14	0.070535	0.000000	discard	exotic mode=5 fourier=4	agent1	solver_param	0	0.000099
exp4193	1.60328418e-29	0.000000	-0.000000	discard	cycle 20 u=0.0995	agent0	initial_cond	1	-0.000000
exp4194	9.37008437e-13	0.070536	-0.000000	discard	exotic mode=5 fourier=8	agent1	solver_param	0	0.000099
exp4195	1.60328418e-29	0.000000	-0.000000	discard	cycle 20 u=0.0995	agent0	initial_cond	0	-0.000000
exp4196	2.67542769e-18	0.000000	0.000000	discard	exotic mode=6 fourier=2	agent1	solver_param	0	-0.000000
exp4197	1.60328418e-29	0.000000	-0.000000	discard	cycle 20 u=0.0995	agent0	initial_cond	0	-0.000000
exp4198	1.52322207e-14	0.000000	0.000000	discard	exotic mode=6 fourier=4	agent1	solver_param	1	0.000000
exp4199	7.34590618e-29	0.000000	0.000000	discard	cycle 20 u=0.0995	agent0	initial_cond	1	0.000000
exp4200	3.63502780e-13	0.000000	-0.000000	discard	exotic mode=6 fourier=8	agent1	solver_param	0	0.000000
exp4201	7.34590618e-29	0.000000	0.000000	discard	cycle 20 u=0.0995	agent0	initial_cond	0	0.000000
exp4202	6.73702768e-11	0.000323	-0.000000	discard	exotic mode=7 fourier=2	agent1	solver_param	0	-0.000000
exp4203	7.34590618e-29	0.000000	0.000000	discard	cycle 20 u=0.0995	agent0	initial_cond	0	0.000000
exp4204	1.91748579e-14	0.070535	-0.000000	discard	exotic mode=7 fourier=4	agent1	solver_param	1	0.000099
exp4204	4.46546993e-29	0.000000	0.000000	discard	cycle 20 u=0.1000	agent0	initial_cond	1	-0.000000
exp4205	3.52142540e-22	0.000000	0.000000	discard	exotic mode=7 fourier=8	agent1	solver_param	0	0.000000
exp4205	4.46546993e-29	0.000000	0.000000	discard	cycle 20 u=0.1000	agent0	initial_cond	0	-0.000000
exp4206	2.67619531e-18	0.000000	-0.000000	discard	exotic mode=8 fourier=2	agent1	solver_param	1	-0.000000
exp4206	4.46546993e-29	0.000000	0.000000	discard	cycle 20 u=0.1000	agent0	initial_cond	1	-0.000000
exp4207	2.67716884e-18	0.000000	-0.000000	discard	exotic mode=8 fourier=4	agent1	solver_param	0	0.000000
exp4207	2.00148302e-16	1.001298	-1.000025	discard	cycle 20 u=0.1000	agent0	initial_cond	0	-1.520921
exp4208	4.08106752e-29	0.000000	0.000000	discard	Fourier 2 neg rep 1	agent0	solver_param	0	-0.000000
exp4209	4.08106752e-29	0.000000	0.000000	discard	cycle 20 u=0.1000	agent0	initial_cond	0	-0.000000
exp4209	1.89142490e-18	0.000000	0.000000	discard	exotic mode=8 fourier=8	agent1	solver_param	0	0.000000
exp4210	4.08106752e-29	0.000000	0.000000	discard	Fourier 2 neg rep 2	agent0	solver_param	1	-0.000000
exp4211	4.08106752e-29	0.000000	0.000000	discard	cycle 20 u=0.1000	agent0	initial_cond	1	-0.000000
exp4212	4.58623706e-29	0.000000	0.000000	discard	Fourier 2 neg rep 3	agent0	solver_param	0	-0.000000
exp4212	4.58623706e-29	0.000000	0.000000	discard	cycle 20 u=0.1000	agent0	initial_cond	0	-0.000000
exp4213	4.58623706e-29	0.000000	0.000000	discard	cycle 20 u=0.1000	agent0	initial_cond	0	-0.000000
exp4213	4.58623706e-29	0.000000	0.000000	discard	Fourier 2 neg rep 4	agent0	solver_param	0	-0.000000
exp4214	2.00148302e-16	1.001298	-1.000025	discard	cycle 20 u=0.1000	agent0	initial_cond	1	-1.520921
exp4214	2.00148302e-16	1.001298	-1.000025	discard	Fourier 2 neg rep 5	agent0	solver_param	0	-1.520921
exp4215	2.00148302e-16	1.001298	-1.000025	discard	cycle 20 u=0.1000	agent0	initial_cond	0	-1.520921
exp4216	2.00148302e-16	1.001298	-1.000025	discard	Fourier 2 neg rep 6	agent0	solver_param	0	-1.520921
exp4217	2.00148302e-16	1.001298	-1.000025	discard	cycle 20 u=0.1000	agent0	initial_cond	1	-1.520921
exp4218	4.39794337e-29	0.000000	0.000000	discard	Fourier 2 neg rep 7	agent0	solver_param	1	-0.000000
exp4219	2.00148302e-16	1.001298	-1.000025	discard	cycle 20 u=0.1000	agent0	initial_cond	0	-1.520921
exp4220	1.36727475e-28	0.000000	0.000000	discard	Fourier 2 neg rep 8	agent0	solver_param	0	-0.000000
exp4221	2.00148302e-16	1.001298	-1.000025	discard	cycle 20 u=0.1050	agent0	initial_cond	0	-1.520921
exp4222	1.36727475e-28	0.000000	0.000000	discard	Fourier 2 neg rep 9	agent0	solver_param	0	-0.000000
exp4223	2.00148302e-16	1.001298	-1.000025	discard	cycle 20 u=0.1050	agent0	initial_cond	1	-1.520921
exp4224	1.36727475e-28	0.000000	0.000000	discard	Fourier 2 neg rep 10	agent0	solver_param	0	-0.000000
exp4225	1.36727475e-28	0.000000	0.000000	discard	cycle 20 u=0.1050	agent0	initial_cond	0	-0.000000
exp4226	6.14461376e-29	0.000000	0.000000	discard	Fourier 2 neg rep 11	agent0	solver_param	0	-0.000000
exp4227	6.14461376e-29	0.000000	0.000000	discard	cycle 20 u=0.1050	agent0	initial_cond	0	-0.000000
exp4228	6.14461376e-29	0.000000	0.000000	discard	Fourier 2 neg rep 12	agent0	solver_param	1	-0.000000
exp4228	6.14461376e-29	0.000000	0.000000	discard	cycle 20 u=0.1050	agent0	initial_cond	1	-0.000000
exp4229	2.00148302e-16	1.001298	-1.000025	discard	cycle 20 u=0.1050	agent0	initial_cond	0	-1.520921
exp4229	2.00148302e-16	1.001298	-1.000025	discard	Fourier 2 neg rep 13	agent0	solver_param	0	-1.520921
exp4230	2.00148302e-16	1.001298	-1.000025	discard	cycle 20 u=0.1050	agent0	initial_cond	0	-1.520921
