exp_id	residual	solution_norm	solution_mean	status	description	agent	design	elapsed_s	solution_energy
exp7094	5.49750971e-29	0.000000	0.000000	discard	cycle 46 u=0.0985	agent0	initial_cond	1	0.000000
exp7095	5.49750971e-29	0.000000	0.000000	discard	cycle 46 u=0.0985	agent0	initial_cond	0	0.000000
exp7096	4.15642452e-29	0.000000	0.000000	discard	cycle 46 u=0.0985	agent0	initial_cond	0	0.000000
exp7097	4.15642452e-29	0.000000	0.000000	discard	cycle 46 u=0.0985	agent0	initial_cond	1	0.000000
exp7098	4.15642452e-29	0.000000	0.000000	discard	cycle 46 u=0.0985	agent0	initial_cond	0	0.000000
exp7099	2.19292611e-29	0.000000	0.000000	discard	cycle 46 u=0.0985	agent0	initial_cond	0	-0.000000
exp7100	2.19292611e-29	0.000000	0.000000	discard	cycle 46 u=0.0985	agent0	initial_cond	0	-0.000000
exp7101	2.19292611e-29	0.000000	0.000000	discard	cycle 46 u=0.0985	agent0	initial_cond	0	-0.000000
exp7102	4.22491788e-29	0.000000	0.000000	discard	cycle 46 u=0.0990	agent0	initial_cond	1	-0.000000
exp7103	4.22491788e-29	0.000000	0.000000	discard	cycle 46 u=0.0990	agent0	initial_cond	0	-0.000000
exp7104	4.22491788e-29	0.000000	0.000000	discard	cycle 46 u=0.0990	agent0	initial_cond	0	-0.000000
exp7105	3.22245147e-29	0.000000	0.000000	discard	cycle 46 u=0.0990	agent0	initial_cond	1	0.000000
exp7106	3.22245147e-29	0.000000	0.000000	discard	cycle 46 u=0.0990	agent0	initial_cond	0	0.000000
exp7107	3.22245147e-29	0.000000	0.000000	discard	cycle 46 u=0.0990	agent0	initial_cond	0	0.000000
exp7108	4.50941488e-29	0.000000	-0.000000	discard	cycle 46 u=0.0990	agent0	initial_cond	0	0.000000
exp7109	4.50941488e-29	0.000000	-0.000000	discard	cycle 46 u=0.0990	agent0	initial_cond	0	0.000000
exp7110	4.50941488e-29	0.000000	-0.000000	discard	cycle 46 u=0.0990	agent0	initial_cond	1	0.000000
exp7111	4.88330883e-29	0.000000	-0.000000	discard	cycle 46 u=0.0990	agent0	initial_cond	0	0.000000
exp7112	4.88330883e-29	0.000000	-0.000000	discard	cycle 46 u=0.0990	agent0	initial_cond	0	0.000000
exp7113	4.88330883e-29	0.000000	-0.000000	discard	cycle 46 u=0.0990	agent0	initial_cond	1	0.000000
exp7114	5.74085541e-29	0.000000	-0.000000	discard	cycle 46 u=0.0995	agent0	initial_cond	0	0.000000
exp7115	5.74085541e-29	0.000000	-0.000000	discard	cycle 46 u=0.0995	agent0	initial_cond	1	0.000000
exp7116	5.74085541e-29	0.000000	-0.000000	discard	cycle 46 u=0.0995	agent0	initial_cond	0	0.000000
exp7117	1.54984578e-28	0.000000	0.000000	discard	cycle 46 u=0.0995	agent0	initial_cond	0	-0.000000
exp7118	1.54984578e-28	0.000000	0.000000	discard	cycle 46 u=0.0995	agent0	initial_cond	1	-0.000000
exp7119	1.54984578e-28	0.000000	0.000000	discard	cycle 46 u=0.0995	agent0	initial_cond	0	-0.000000
exp7120	1.60328418e-29	0.000000	-0.000000	discard	cycle 46 u=0.0995	agent0	initial_cond	0	-0.000000
exp7121	1.60328418e-29	0.000000	-0.000000	discard	cycle 46 u=0.0995	agent0	initial_cond	0	-0.000000
exp7122	1.60328418e-29	0.000000	-0.000000	discard	cycle 46 u=0.0995	agent0	initial_cond	0	-0.000000
exp7123	7.34590618e-29	0.000000	0.000000	discard	cycle 46 u=0.0995	agent0	initial_cond	1	0.000000
exp7124	7.34590618e-29	0.000000	0.000000	discard	cycle 46 u=0.0995	agent0	initial_cond	0	0.000000
exp7125	7.34590618e-29	0.000000	0.000000	discard	cycle 46 u=0.0995	agent0	initial_cond	0	0.000000
exp7126	4.46546993e-29	0.000000	0.000000	discard	cycle 46 u=0.1000	agent0	initial_cond	1	-0.000000
exp7127	4.46546993e-29	0.000000	0.000000	discard	cycle 46 u=0.1000	agent0	initial_cond	0	-0.000000
exp7128	4.46546993e-29	0.000000	0.000000	discard	cycle 46 u=0.1000	agent0	initial_cond	0	-0.000000
exp7129	4.08106752e-29	0.000000	0.000000	discard	cycle 46 u=0.1000	agent0	initial_cond	0	-0.000000
exp7130	4.08106752e-29	0.000000	0.000000	discard	cycle 46 u=0.1000	agent0	initial_cond	0	-0.000000
exp7131	4.08106752e-29	0.000000	0.000000	discard	cycle 46 u=0.1000	agent0	initial_cond	1	-0.000000
exp7132	4.58623706e-29	0.000000	0.000000	discard	cycle 46 u=0.1000	agent0	initial_cond	0	-0.000000
exp7133	4.58623706e-29	0.000000	0.000000	discard	cycle 46 u=0.1000	agent0	initial_cond	0	-0.000000
exp7134	4.58623706e-29	0.000000	0.000000	discard	cycle 46 u=0.1000	agent0	initial_cond	1	-0.000000
exp7135	4.39794337e-29	0.000000	0.000000	discard	cycle 46 u=0.1000	agent0	initial_cond	0	-0.000000
exp7136	4.39794337e-29	0.000000	0.000000	discard	cycle 46 u=0.1000	agent0	initial_cond	0	-0.000000
exp7137	4.39794337e-29	0.000000	0.000000	discard	cycle 46 u=0.1000	agent0	initial_cond	0	-0.000000
exp7138	1.36727475e-28	0.000000	0.000000	discard	cycle 46 u=0.1050	agent0	initial_cond	0	-0.000000
exp7139	1.36727475e-28	0.000000	0.000000	discard	cycle 46 u=0.1050	agent0	initial_cond	1	-0.000000
exp7140	1.36727475e-28	0.000000	0.000000	discard	cycle 46 u=0.1050	agent0	initial_cond	0	-0.000000
exp7141	6.14461376e-29	0.000000	0.000000	discard	cycle 46 u=0.1050	agent0	initial_cond	0	-0.000000
exp7142	6.14461376e-29	0.000000	0.000000	discard	cycle 46 u=0.1050	agent0	initial_cond	1	-0.000000
exp7143	6.14461376e-29	0.000000	0.000000	discard	cycle 46 u=0.1050	agent0	initial_cond	0	-0.000000
exp7144	1.75906666e-28	0.000000	0.000000	discard	cycle 46 u=0.1050	agent0	initial_cond	0	-0.000000
exp7145	1.75906666e-28	0.000000	0.000000	discard	cycle 46 u=0.1050	agent0	initial_cond	0	-0.000000
exp7146	1.75906666e-28	0.000000	0.000000	discard	cycle 46 u=0.1050	agent0	initial_cond	0	-0.000000
exp7147	1.11257917e-28	0.000000	0.000000	discard	cycle 46 u=0.1050	agent0	initial_cond	1	-0.000000
exp7148	1.11257917e-28	0.000000	0.000000	discard	cycle 46 u=0.1050	agent0	initial_cond	0	-0.000000
exp7149	1.11257917e-28	0.000000	0.000000	discard	cycle 46 u=0.1050	agent0	initial_cond	0	-0.000000
exp7150	8.58580947e-29	0.000000	0.000000	discard	cycle 47 u=0.0975	agent0	initial_cond	1	0.000000
exp7151	8.58580947e-29	0.000000	0.000000	discard	cycle 47 u=0.0975	agent0	initial_cond	0	0.000000
exp7152	8.58580947e-29	0.000000	0.000000	discard	cycle 47 u=0.0975	agent0	initial_cond	0	0.000000
exp7153	5.23962023e-29	0.000000	0.000000	discard	cycle 47 u=0.0975	agent0	initial_cond	0	0.000000
exp7154	5.23962023e-29	0.000000	0.000000	discard	cycle 47 u=0.0975	agent0	initial_cond	0	0.000000
exp7155	5.23962023e-29	0.000000	0.000000	discard	cycle 47 u=0.0975	agent0	initial_cond	1	0.000000
exp7156	4.03266298e-29	0.000000	0.000000	discard	cycle 47 u=0.0975	agent0	initial_cond	0	0.000000
exp7157	4.03266298e-29	0.000000	0.000000	discard	cycle 47 u=0.0975	agent0	initial_cond	0	0.000000
exp7158	4.03266298e-29	0.000000	0.000000	discard	cycle 47 u=0.0975	agent0	initial_cond	1	0.000000
exp7159	4.80015937e-29	0.000000	0.000000	discard	cycle 47 u=0.0975	agent0	initial_cond	0	0.000000
exp7160	4.80015937e-29	0.000000	0.000000	discard	cycle 47 u=0.0975	agent0	initial_cond	0	0.000000
exp7161	4.80015937e-29	0.000000	0.000000	discard	cycle 47 u=0.0975	agent0	initial_cond	0	0.000000
exp7162	2.68824537e-29	0.000000	0.000000	discard	cycle 47 u=0.0980	agent0	initial_cond	0	-0.000000
exp7163	2.68824537e-29	0.000000	0.000000	discard	cycle 47 u=0.0980	agent0	initial_cond	1	-0.000000
exp7164	2.68824537e-29	0.000000	0.000000	discard	cycle 47 u=0.0980	agent0	initial_cond	0	-0.000000
exp7165	6.16758073e-29	0.000000	0.000000	discard	cycle 47 u=0.0980	agent0	initial_cond	0	-0.000000
exp7166	6.16758073e-29	0.000000	0.000000	discard	cycle 47 u=0.0980	agent0	initial_cond	1	-0.000000
exp7167	6.16758073e-29	0.000000	0.000000	discard	cycle 47 u=0.0980	agent0	initial_cond	0	-0.000000
exp7168	2.01926478e-29	0.000000	0.000000	discard	cycle 47 u=0.0980	agent0	initial_cond	0	0.000000
exp7169	2.01926478e-29	0.000000	0.000000	discard	cycle 47 u=0.0980	agent0	initial_cond	0	0.000000
exp7170	2.01926478e-29	0.000000	0.000000	discard	cycle 47 u=0.0980	agent0	initial_cond	0	0.000000
exp7171	1.30310780e-28	0.000000	0.000000	discard	cycle 47 u=0.0980	agent0	initial_cond	1	-0.000000
exp7172	1.30310780e-28	0.000000	0.000000	discard	cycle 47 u=0.0980	agent0	initial_cond	0	-0.000000
exp7173	1.30310780e-28	0.000000	0.000000	discard	cycle 47 u=0.0980	agent0	initial_cond	0	-0.000000
exp7174	5.45343271e-29	0.000000	0.000000	discard	cycle 47 u=0.0982	agent0	initial_cond	1	-0.000000
exp7175	5.45343271e-29	0.000000	0.000000	discard	cycle 47 u=0.0982	agent0	initial_cond	0	-0.000000
exp7176	5.45343271e-29	0.000000	0.000000	discard	cycle 47 u=0.0982	agent0	initial_cond	1	-0.000000
exp7177	1.23429977e-28	0.000000	0.000000	discard	cycle 47 u=0.0982	agent0	initial_cond	0	0.000000
exp7178	1.23429977e-28	0.000000	0.000000	discard	cycle 47 u=0.0982	agent0	initial_cond	0	0.000000
exp7179	1.23429977e-28	0.000000	0.000000	discard	cycle 47 u=0.0982	agent0	initial_cond	1	0.000000
exp7180	1.88036672e-29	0.000000	0.000000	discard	cycle 47 u=0.0982	agent0	initial_cond	0	0.000000
exp7181	1.88036672e-29	0.000000	0.000000	discard	cycle 47 u=0.0982	agent0	initial_cond	0	0.000000
exp7182	1.88036672e-29	0.000000	0.000000	discard	cycle 47 u=0.0982	agent0	initial_cond	1	0.000000
exp7183	1.91190259e-29	0.000000	-0.000000	discard	cycle 47 u=0.0982	agent0	initial_cond	0	0.000000
exp7184	1.91190259e-29	0.000000	-0.000000	discard	cycle 47 u=0.0982	agent0	initial_cond	1	0.000000
exp7185	1.91190259e-29	0.000000	-0.000000	discard	cycle 47 u=0.0982	agent0	initial_cond	0	0.000000
exp7186	6.13049994e-29	0.000000	0.000000	discard	cycle 47 u=0.0985	agent0	initial_cond	0	0.000000
exp7187	6.13049994e-29	0.000000	0.000000	discard	cycle 47 u=0.0985	agent0	initial_cond	1	0.000000
exp7188	6.13049994e-29	0.000000	0.000000	discard	cycle 47 u=0.0985	agent0	initial_cond	0	0.000000
exp7189	5.49750971e-29	0.000000	0.000000	discard	cycle 47 u=0.0985	agent0	initial_cond	0	0.000000
exp7190	5.49750971e-29	0.000000	0.000000	discard	cycle 47 u=0.0985	agent0	initial_cond	0	0.000000
exp7191	5.49750971e-29	0.000000	0.000000	discard	cycle 47 u=0.0985	agent0	initial_cond	0	0.000000
exp7192	4.15642452e-29	0.000000	0.000000	discard	cycle 47 u=0.0985	agent0	initial_cond	1	0.000000
exp7193	4.15642452e-29	0.000000	0.000000	discard	cycle 47 u=0.0985	agent0	initial_cond	0	0.000000
exp7194	4.15642452e-29	0.000000	0.000000	discard	cycle 47 u=0.0985	agent0	initial_cond	0	0.000000
exp7195	2.19292611e-29	0.000000	0.000000	discard	cycle 47 u=0.0985	agent0	initial_cond	1	-0.000000
exp7196	2.19292611e-29	0.000000	0.000000	discard	cycle 47 u=0.0985	agent0	initial_cond	0	-0.000000
exp7197	2.19292611e-29	0.000000	0.000000	discard	cycle 47 u=0.0985	agent0	initial_cond	0	-0.000000
exp7198	4.22491788e-29	0.000000	0.000000	discard	cycle 47 u=0.0990	agent0	initial_cond	0	-0.000000
exp7199	4.22491788e-29	0.000000	0.000000	discard	cycle 47 u=0.0990	agent0	initial_cond	0	-0.000000
exp7200	4.22491788e-29	0.000000	0.000000	discard	cycle 47 u=0.0990	agent0	initial_cond	1	-0.000000
exp7201	3.22245147e-29	0.000000	0.000000	discard	cycle 47 u=0.0990	agent0	initial_cond	0	0.000000
exp7202	3.22245147e-29	0.000000	0.000000	discard	cycle 47 u=0.0990	agent0	initial_cond	0	0.000000
exp7203	3.22245147e-29	0.000000	0.000000	discard	cycle 47 u=0.0990	agent0	initial_cond	1	0.000000
exp7204	4.50941488e-29	0.000000	-0.000000	discard	cycle 47 u=0.0990	agent0	initial_cond	0	0.000000
exp7205	4.50941488e-29	0.000000	-0.000000	discard	cycle 47 u=0.0990	agent0	initial_cond	0	0.000000
exp7206	4.50941488e-29	0.000000	-0.000000	discard	cycle 47 u=0.0990	agent0	initial_cond	0	0.000000
exp7207	4.88330883e-29	0.000000	-0.000000	discard	cycle 47 u=0.0990	agent0	initial_cond	0	0.000000
exp7208	4.88330883e-29	0.000000	-0.000000	discard	cycle 47 u=0.0990	agent0	initial_cond	1	0.000000
exp7209	4.88330883e-29	0.000000	-0.000000	discard	cycle 47 u=0.0990	agent0	initial_cond	0	0.000000
exp7210	5.74085541e-29	0.000000	-0.000000	discard	cycle 47 u=0.0995	agent0	initial_cond	0	0.000000
exp7211	5.74085541e-29	0.000000	-0.000000	discard	cycle 47 u=0.0995	agent0	initial_cond	1	0.000000
exp7212	5.74085541e-29	0.000000	-0.000000	discard	cycle 47 u=0.0995	agent0	initial_cond	0	0.000000
exp7213	1.54984578e-28	0.000000	0.000000	discard	cycle 47 u=0.0995	agent0	initial_cond	0	-0.000000
exp7214	1.54984578e-28	0.000000	0.000000	discard	cycle 47 u=0.0995	agent0	initial_cond	0	-0.000000
exp7215	1.54984578e-28	0.000000	0.000000	discard	cycle 47 u=0.0995	agent0	initial_cond	0	-0.000000
exp7216	1.60328418e-29	0.000000	-0.000000	discard	cycle 47 u=0.0995	agent0	initial_cond	1	-0.000000
exp7217	1.60328418e-29	0.000000	-0.000000	discard	cycle 47 u=0.0995	agent0	initial_cond	0	-0.000000
exp7218	1.60328418e-29	0.000000	-0.000000	discard	cycle 47 u=0.0995	agent0	initial_cond	0	-0.000000
exp7219	7.34590618e-29	0.000000	0.000000	discard	cycle 47 u=0.0995	agent0	initial_cond	1	0.000000
exp7220	7.34590618e-29	0.000000	0.000000	discard	cycle 47 u=0.0995	agent0	initial_cond	0	0.000000
exp7221	7.34590618e-29	0.000000	0.000000	discard	cycle 47 u=0.0995	agent0	initial_cond	1	0.000000
exp7222	4.46546993e-29	0.000000	0.000000	discard	cycle 47 u=0.1000	agent0	initial_cond	0	-0.000000
exp7223	4.46546993e-29	0.000000	0.000000	discard	cycle 47 u=0.1000	agent0	initial_cond	0	-0.000000
exp7224	4.46546993e-29	0.000000	0.000000	discard	cycle 47 u=0.1000	agent0	initial_cond	1	-0.000000
exp7225	4.08106752e-29	0.000000	0.000000	discard	cycle 47 u=0.1000	agent0	initial_cond	0	-0.000000
exp7226	4.08106752e-29	0.000000	0.000000	discard	cycle 47 u=0.1000	agent0	initial_cond	0	-0.000000
exp7227	4.08106752e-29	0.000000	0.000000	discard	cycle 47 u=0.1000	agent0	initial_cond	0	-0.000000
exp7228	4.58623706e-29	0.000000	0.000000	discard	cycle 47 u=0.1000	agent0	initial_cond	0	-0.000000
exp7229	4.58623706e-29	0.000000	0.000000	discard	cycle 47 u=0.1000	agent0	initial_cond	1	-0.000000
exp7230	4.58623706e-29	0.000000	0.000000	discard	cycle 47 u=0.1000	agent0	initial_cond	0	-0.000000
exp7231	4.39794337e-29	0.000000	0.000000	discard	cycle 47 u=0.1000	agent0	initial_cond	0	-0.000000
exp7232	4.39794337e-29	0.000000	0.000000	discard	cycle 47 u=0.1000	agent0	initial_cond	1	-0.000000
exp7233	4.39794337e-29	0.000000	0.000000	discard	cycle 47 u=0.1000	agent0	initial_cond	0	-0.000000
exp7234	1.36727475e-28	0.000000	0.000000	discard	cycle 47 u=0.1050	agent0	initial_cond	0	-0.000000
exp7235	1.36727475e-28	0.000000	0.000000	discard	cycle 47 u=0.1050	agent0	initial_cond	0	-0.000000
exp7236	1.36727475e-28	0.000000	0.000000	discard	cycle 47 u=0.1050	agent0	initial_cond	0	-0.000000
exp7237	6.14461376e-29	0.000000	0.000000	discard	cycle 47 u=0.1050	agent0	initial_cond	1	-0.000000
exp7238	6.14461376e-29	0.000000	0.000000	discard	cycle 47 u=0.1050	agent0	initial_cond	0	-0.000000
exp7239	6.14461376e-29	0.000000	0.000000	discard	cycle 47 u=0.1050	agent0	initial_cond	0	-0.000000
exp7240	1.75906666e-28	0.000000	0.000000	discard	cycle 47 u=0.1050	agent0	initial_cond	1	-0.000000
exp7241	1.75906666e-28	0.000000	0.000000	discard	cycle 47 u=0.1050	agent0	initial_cond	0	-0.000000
exp7242	1.75906666e-28	0.000000	0.000000	discard	cycle 47 u=0.1050	agent0	initial_cond	0	-0.000000
exp7243	1.11257917e-28	0.000000	0.000000	discard	cycle 47 u=0.1050	agent0	initial_cond	0	-0.000000
exp7244	1.11257917e-28	0.000000	0.000000	discard	cycle 47 u=0.1050	agent0	initial_cond	0	-0.000000
exp7245	1.11257917e-28	0.000000	0.000000	discard	cycle 47 u=0.1050	agent0	initial_cond	1	-0.000000
exp7246	8.58580947e-29	0.000000	0.000000	discard	cycle 48 u=0.0975	agent0	initial_cond	0	0.000000
exp7247	8.58580947e-29	0.000000	0.000000	discard	cycle 48 u=0.0975	agent0	initial_cond	0	0.000000
exp7248	8.58580947e-29	0.000000	0.000000	discard	cycle 48 u=0.0975	agent0	initial_cond	1	0.000000
exp7249	5.23962023e-29	0.000000	0.000000	discard	cycle 48 u=0.0975	agent0	initial_cond	0	0.000000
exp7250	5.23962023e-29	0.000000	0.000000	discard	cycle 48 u=0.0975	agent0	initial_cond	0	0.000000
exp7251	5.23962023e-29	0.000000	0.000000	discard	cycle 48 u=0.0975	agent0	initial_cond	0	0.000000
exp7252	4.03266298e-29	0.000000	0.000000	discard	cycle 48 u=0.0975	agent0	initial_cond	0	0.000000
exp7253	4.03266298e-29	0.000000	0.000000	discard	cycle 48 u=0.0975	agent0	initial_cond	1	0.000000
exp7254	4.03266298e-29	0.000000	0.000000	discard	cycle 48 u=0.0975	agent0	initial_cond	0	0.000000
exp7255	4.80015937e-29	0.000000	0.000000	discard	cycle 48 u=0.0975	agent0	initial_cond	0	0.000000
exp7256	4.80015937e-29	0.000000	0.000000	discard	cycle 48 u=0.0975	agent0	initial_cond	1	0.000000
exp7257	4.80015937e-29	0.000000	0.000000	discard	cycle 48 u=0.0975	agent0	initial_cond	0	0.000000
exp7258	2.68824537e-29	0.000000	0.000000	discard	cycle 48 u=0.0980	agent0	initial_cond	0	-0.000000
exp7259	2.68824537e-29	0.000000	0.000000	discard	cycle 48 u=0.0980	agent0	initial_cond	0	-0.000000
exp7260	2.68824537e-29	0.000000	0.000000	discard	cycle 48 u=0.0980	agent0	initial_cond	0	-0.000000
exp7261	6.16758073e-29	0.000000	0.000000	discard	cycle 48 u=0.0980	agent0	initial_cond	1	-0.000000
exp7262	6.16758073e-29	0.000000	0.000000	discard	cycle 48 u=0.0980	agent0	initial_cond	0	-0.000000
exp7263	6.16758073e-29	0.000000	0.000000	discard	cycle 48 u=0.0980	agent0	initial_cond	0	-0.000000
exp7264	2.01926478e-29	0.000000	0.000000	discard	cycle 48 u=0.0980	agent0	initial_cond	1	0.000000
exp7265	2.01926478e-29	0.000000	0.000000	discard	cycle 48 u=0.0980	agent0	initial_cond	0	0.000000
exp7266	2.01926478e-29	0.000000	0.000000	discard	cycle 48 u=0.0980	agent0	initial_cond	0	0.000000
exp7267	1.30310780e-28	0.000000	0.000000	discard	cycle 48 u=0.0980	agent0	initial_cond	0	-0.000000
exp7268	1.30310780e-28	0.000000	0.000000	discard	cycle 48 u=0.0980	agent0	initial_cond	0	-0.000000
exp7269	1.30310780e-28	0.000000	0.000000	discard	cycle 48 u=0.0980	agent0	initial_cond	1	-0.000000
exp7270	5.45343271e-29	0.000000	0.000000	discard	cycle 48 u=0.0982	agent0	initial_cond	0	-0.000000
exp7271	5.45343271e-29	0.000000	0.000000	discard	cycle 48 u=0.0982	agent0	initial_cond	0	-0.000000
exp7272	5.45343271e-29	0.000000	0.000000	discard	cycle 48 u=0.0982	agent0	initial_cond	1	-0.000000
exp7273	1.23429977e-28	0.000000	0.000000	discard	cycle 48 u=0.0982	agent0	initial_cond	0	0.000000
exp7274	1.23429977e-28	0.000000	0.000000	discard	cycle 48 u=0.0982	agent0	initial_cond	1	0.000000
exp7275	1.23429977e-28	0.000000	0.000000	discard	cycle 48 u=0.0982	agent0	initial_cond	0	0.000000
exp7276	1.88036672e-29	0.000000	0.000000	discard	cycle 48 u=0.0982	agent0	initial_cond	0	0.000000
exp7277	1.88036672e-29	0.000000	0.000000	discard	cycle 48 u=0.0982	agent0	initial_cond	1	0.000000
exp7278	1.88036672e-29	0.000000	0.000000	discard	cycle 48 u=0.0982	agent0	initial_cond	0	0.000000
exp7279	1.91190259e-29	0.000000	-0.000000	discard	cycle 48 u=0.0982	agent0	initial_cond	0	0.000000
exp7280	1.91190259e-29	0.000000	-0.000000	discard	cycle 48 u=0.0982	agent0	initial_cond	1	0.000000
exp7281	1.91190259e-29	0.000000	-0.000000	discard	cycle 48 u=0.0982	agent0	initial_cond	0	0.000000
exp7282	6.13049994e-29	0.000000	0.000000	discard	cycle 48 u=0.0985	agent0	initial_cond	1	0.000000
exp7283	6.13049994e-29	0.000000	0.000000	discard	cycle 48 u=0.0985	agent0	initial_cond	0	0.000000
exp7284	6.13049994e-29	0.000000	0.000000	discard	cycle 48 u=0.0985	agent0	initial_cond	0	0.000000
exp7285	5.49750971e-29	0.000000	0.000000	discard	cycle 48 u=0.0985	agent0	initial_cond	1	0.000000
exp7286	5.49750971e-29	0.000000	0.000000	discard	cycle 48 u=0.0985	agent0	initial_cond	0	0.000000
exp7287	5.49750971e-29	0.000000	0.000000	discard	cycle 48 u=0.0985	agent0	initial_cond	0	0.000000
exp7288	4.15642452e-29	0.000000	0.000000	discard	cycle 48 u=0.0985	agent0	initial_cond	0	0.000000
exp7289	4.15642452e-29	0.000000	0.000000	discard	cycle 48 u=0.0985	agent0	initial_cond	0	0.000000
exp7290	4.15642452e-29	0.000000	0.000000	discard	cycle 48 u=0.0985	agent0	initial_cond	1	0.000000
exp7291	2.19292611e-29	0.000000	0.000000	discard	cycle 48 u=0.0985	agent0	initial_cond	0	-0.000000
exp7292	2.19292611e-29	0.000000	0.000000	discard	cycle 48 u=0.0985	agent0	initial_cond	0	-0.000000
exp7293	2.19292611e-29	0.000000	0.000000	discard	cycle 48 u=0.0985	agent0	initial_cond	1	-0.000000
exp7294	4.22491788e-29	0.000000	0.000000	discard	cycle 48 u=0.0990	agent0	initial_cond	0	-0.000000
exp7295	4.22491788e-29	0.000000	0.000000	discard	cycle 48 u=0.0990	agent0	initial_cond	0	-0.000000
exp7296	4.22491788e-29	0.000000	0.000000	discard	cycle 48 u=0.0990	agent0	initial_cond	0	-0.000000
exp7297	3.22245147e-29	0.000000	0.000000	discard	cycle 48 u=0.0990	agent0	initial_cond	0	0.000000
exp7298	3.22245147e-29	0.000000	0.000000	discard	cycle 48 u=0.0990	agent0	initial_cond	1	0.000000
exp7299	3.22245147e-29	0.000000	0.000000	discard	cycle 48 u=0.0990	agent0	initial_cond	0	0.000000
exp7300	4.50941488e-29	0.000000	-0.000000	discard	cycle 48 u=0.0990	agent0	initial_cond	0	0.000000
exp7301	4.50941488e-29	0.000000	-0.000000	discard	cycle 48 u=0.0990	agent0	initial_cond	1	0.000000
exp7302	4.50941488e-29	0.000000	-0.000000	discard	cycle 48 u=0.0990	agent0	initial_cond	0	0.000000
exp7303	4.88330883e-29	0.000000	-0.000000	discard	cycle 48 u=0.0990	agent0	initial_cond	0	0.000000
exp7304	4.88330883e-29	0.000000	-0.000000	discard	cycle 48 u=0.0990	agent0	initial_cond	0	0.000000
exp7305	4.88330883e-29	0.000000	-0.000000	discard	cycle 48 u=0.0990	agent0	initial_cond	0	0.000000
exp7306	5.74085541e-29	0.000000	-0.000000	discard	cycle 48 u=0.0995	agent0	initial_cond	1	0.000000
exp7307	5.74085541e-29	0.000000	-0.000000	discard	cycle 48 u=0.0995	agent0	initial_cond	0	0.000000
exp7308	5.74085541e-29	0.000000	-0.000000	discard	cycle 48 u=0.0995	agent0	initial_cond	0	0.000000
exp7309	1.54984578e-28	0.000000	0.000000	discard	cycle 48 u=0.0995	agent0	initial_cond	1	-0.000000
exp7310	1.54984578e-28	0.000000	0.000000	discard	cycle 48 u=0.0995	agent0	initial_cond	0	-0.000000
exp7311	1.54984578e-28	0.000000	0.000000	discard	cycle 48 u=0.0995	agent0	initial_cond	1	-0.000000
exp7312	1.60328418e-29	0.000000	-0.000000	discard	cycle 48 u=0.0995	agent0	initial_cond	0	-0.000000
exp7313	1.60328418e-29	0.000000	-0.000000	discard	cycle 48 u=0.0995	agent0	initial_cond	0	-0.000000
exp7314	1.60328418e-29	0.000000	-0.000000	discard	cycle 48 u=0.0995	agent0	initial_cond	1	-0.000000
