exp_id	residual	solution_norm	solution_mean	status	description	agent	design	elapsed_s	solution_energy
exp5578	5.23962023e-29	0.000000	0.000000	discard	cycle 31 u=0.0975	agent0	initial_cond	0	0.000000
exp5579	5.23962023e-29	0.000000	0.000000	discard	cycle 31 u=0.0975	agent0	initial_cond	0	0.000000
exp5580	5.23962023e-29	0.000000	0.000000	discard	cycle 31 u=0.0975	agent0	initial_cond	1	0.000000
exp5581	4.03266298e-29	0.000000	0.000000	discard	cycle 31 u=0.0975	agent0	initial_cond	0	0.000000
exp5582	4.03266298e-29	0.000000	0.000000	discard	cycle 31 u=0.0975	agent0	initial_cond	0	0.000000
exp5583	4.03266298e-29	0.000000	0.000000	discard	cycle 31 u=0.0975	agent0	initial_cond	0	0.000000
exp5584	4.80015937e-29	0.000000	0.000000	discard	cycle 31 u=0.0975	agent0	initial_cond	0	0.000000
exp5585	4.80015937e-29	0.000000	0.000000	discard	cycle 31 u=0.0975	agent0	initial_cond	1	0.000000
exp5586	5.63598005e-11	0.000000	-0.000000	discard	scipy 4th branch u=0 amp=0.8 phase=1.0 n=200	manual	memory	0	-0.000000
exp5586	4.80015937e-29	0.000000	0.000000	discard	cycle 31 u=0.0975	agent0	initial_cond	0	0.000000
exp5587	2.68824537e-29	0.000000	0.000000	discard	cycle 31 u=0.0980	agent0	initial_cond	0	-0.000000
exp5588	2.68824537e-29	0.000000	0.000000	discard	cycle 31 u=0.0980	agent0	initial_cond	1	-0.000000
exp5589	2.68824537e-29	0.000000	0.000000	discard	cycle 31 u=0.0980	agent0	initial_cond	0	-0.000000
exp5590	6.16758073e-29	0.000000	0.000000	discard	cycle 31 u=0.0980	agent0	initial_cond	0	-0.000000
exp5591	7.16287468e-16	1.001298	1.000025	discard	cycle 31 u=0.0980	agent0	initial_cond	0	-1.520921
exp5592	6.16758073e-29	0.000000	0.000000	discard	exact u=1.00001	agent0	solver_param	0	-0.000000
exp5593	7.16287468e-16	1.001298	1.000025	discard	cycle 31 u=0.0980	agent0	initial_cond	0	-1.520921
exp5594	2.01926478e-29	0.000000	0.000000	discard	exact u=1.00002	agent0	solver_param	0	0.000000
exp5595	2.01926478e-29	0.000000	0.000000	discard	cycle 31 u=0.0980	agent0	initial_cond	1	0.000000
exp5596	2.01926478e-29	0.000000	0.000000	discard	exact u=1.00005	agent0	solver_param	0	0.000000
exp5597	2.01926478e-29	0.000000	0.000000	discard	cycle 31 u=0.0980	agent0	initial_cond	0	0.000000
exp5598	2.01926478e-29	0.000000	0.000000	discard	exact u=1.0001	agent0	solver_param	0	0.000000
exp5598	2.01926478e-29	0.000000	0.000000	discard	cycle 31 u=0.0980	agent0	initial_cond	0	0.000000
exp5599	7.16287468e-16	1.001298	1.000025	discard	cycle 31 u=0.0980	agent0	initial_cond	1	-1.520921
exp5599	7.16287468e-16	1.001298	1.000025	discard	exact u=1.0002	agent0	solver_param	1	-1.520921
exp5600	4.85524279e-16	1.001298	1.000025	discard	cycle 31 u=0.0980	agent0	initial_cond	0	-1.520921
exp5601	4.85524279e-16	1.001298	1.000025	discard	exact u=1.0005	agent0	solver_param	0	-1.520921
exp5602	1.30310780e-28	0.000000	0.000000	discard	cycle 31 u=0.0980	agent0	initial_cond	0	-0.000000
exp5603	5.45343271e-29	0.000000	0.000000	discard	cycle 31 u=0.0982	agent0	initial_cond	1	-0.000000
exp5604	5.45343271e-29	0.000000	0.000000	discard	cycle 31 u=0.0982	agent0	initial_cond	0	-0.000000
exp5605	5.45343271e-29	0.000000	0.000000	discard	cycle 31 u=0.0982	agent0	initial_cond	1	-0.000000
exp5606	1.23429977e-28	0.000000	0.000000	discard	cycle 31 u=0.0982	agent0	initial_cond	0	0.000000
exp5607	5.63598005e-11	0.000000	-0.000000	discard	Fourier 4th branch u=0 amp=0.4 phase=1.0 modes=3	manual	memory	0	-0.000000
exp5607	1.23429977e-28	0.000000	0.000000	discard	cycle 31 u=0.0982	agent0	initial_cond	0	0.000000
exp5608	1.23429977e-28	0.000000	0.000000	discard	cycle 31 u=0.0982	agent0	initial_cond	1	0.000000
exp5609	1.88036672e-29	0.000000	0.000000	discard	cycle 31 u=0.0982	agent0	initial_cond	0	0.000000
exp5610	1.88036672e-29	0.000000	0.000000	discard	cycle 31 u=0.0982	agent0	initial_cond	0	0.000000
exp5611	1.88036672e-29	0.000000	0.000000	discard	cycle 31 u=0.0982	agent0	initial_cond	1	0.000000
exp5612	1.91190259e-29	0.000000	-0.000000	discard	cycle 31 u=0.0982	agent0	initial_cond	0	0.000000
exp5613	1.91190259e-29	0.000000	-0.000000	discard	cycle 31 u=0.0982	agent0	initial_cond	0	0.000000
exp5614	1.91190259e-29	0.000000	-0.000000	discard	cycle 31 u=0.0982	agent0	initial_cond	0	0.000000
exp5615	6.13049994e-29	0.000000	0.000000	discard	cycle 31 u=0.0985	agent0	initial_cond	0	0.000000
exp5616	6.13049994e-29	0.000000	0.000000	discard	cycle 31 u=0.0985	agent0	initial_cond	1	0.000000
exp5617	6.13049994e-29	0.000000	0.000000	discard	cycle 31 u=0.0985	agent0	initial_cond	0	0.000000
exp5618	5.49750971e-29	0.000000	0.000000	discard	cycle 31 u=0.0985	agent0	initial_cond	0	0.000000
exp5619	5.49750971e-29	0.000000	0.000000	discard	cycle 31 u=0.0985	agent0	initial_cond	1	0.000000
exp5620	5.49750971e-29	0.000000	0.000000	discard	cycle 31 u=0.0985	agent0	initial_cond	0	0.000000
exp5621	4.15642452e-29	0.000000	0.000000	discard	cycle 31 u=0.0985	agent0	initial_cond	0	0.000000
exp5622	4.15642452e-29	0.000000	0.000000	discard	cycle 31 u=0.0985	agent0	initial_cond	0	0.000000
exp5623	4.15642452e-29	0.000000	0.000000	discard	cycle 31 u=0.0985	agent0	initial_cond	0	0.000000
exp5624	2.19292611e-29	0.000000	0.000000	discard	cycle 31 u=0.0985	agent0	initial_cond	1	-0.000000
exp5625	2.19292611e-29	0.000000	0.000000	discard	cycle 31 u=0.0985	agent0	initial_cond	0	-0.000000
exp5626	2.19292611e-29	0.000000	0.000000	discard	cycle 31 u=0.0985	agent0	initial_cond	0	-0.000000
exp5627	4.22491788e-29	0.000000	0.000000	discard	cycle 31 u=0.0990	agent0	initial_cond	1	-0.000000
exp5628	4.22491788e-29	0.000000	0.000000	discard	cycle 31 u=0.0990	agent0	initial_cond	0	-0.000000
exp5629	4.22491788e-29	0.000000	0.000000	discard	cycle 31 u=0.0990	agent0	initial_cond	0	-0.000000
exp5630	3.22245147e-29	0.000000	0.000000	discard	cycle 31 u=0.0990	agent0	initial_cond	0	0.000000
exp5631	3.22245147e-29	0.000000	0.000000	discard	cycle 31 u=0.0990	agent0	initial_cond	0	0.000000
exp5632	3.22245147e-29	0.000000	0.000000	discard	cycle 31 u=0.0990	agent0	initial_cond	1	0.000000
exp5633	4.50941488e-29	0.000000	-0.000000	discard	cycle 31 u=0.0990	agent0	initial_cond	0	0.000000
exp5634	4.50941488e-29	0.000000	-0.000000	discard	cycle 31 u=0.0990	agent0	initial_cond	0	0.000000
exp5635	4.50941488e-29	0.000000	-0.000000	discard	cycle 31 u=0.0990	agent0	initial_cond	1	0.000000
exp5636	4.88330883e-29	0.000000	-0.000000	discard	cycle 31 u=0.0990	agent0	initial_cond	0	0.000000
exp5637	4.88330883e-29	0.000000	-0.000000	discard	cycle 31 u=0.0990	agent0	initial_cond	0	0.000000
exp5638	4.88330883e-29	0.000000	-0.000000	discard	cycle 31 u=0.0990	agent0	initial_cond	1	0.000000
exp5639	5.74085541e-29	0.000000	-0.000000	discard	cycle 31 u=0.0995	agent0	initial_cond	0	0.000000
exp5640	5.74085541e-29	0.000000	-0.000000	discard	cycle 31 u=0.0995	agent0	initial_cond	1	0.000000
exp5641	5.74085541e-29	0.000000	-0.000000	discard	cycle 31 u=0.0995	agent0	initial_cond	0	0.000000
exp5642	1.54984578e-28	0.000000	0.000000	discard	cycle 31 u=0.0995	agent0	initial_cond	0	-0.000000
exp5643	1.54984578e-28	0.000000	0.000000	discard	cycle 31 u=0.0995	agent0	initial_cond	1	-0.000000
exp5644	1.54984578e-28	0.000000	0.000000	discard	cycle 31 u=0.0995	agent0	initial_cond	0	-0.000000
exp5645	1.60328418e-29	0.000000	-0.000000	discard	cycle 31 u=0.0995	agent0	initial_cond	0	-0.000000
exp5646	1.60328418e-29	0.000000	-0.000000	discard	cycle 31 u=0.0995	agent0	initial_cond	1	-0.000000
exp5647	1.60328418e-29	0.000000	-0.000000	discard	cycle 31 u=0.0995	agent0	initial_cond	0	-0.000000
exp5648	7.34590618e-29	0.000000	0.000000	discard	cycle 31 u=0.0995	agent0	initial_cond	0	0.000000
exp5649	7.34590618e-29	0.000000	0.000000	discard	cycle 31 u=0.0995	agent0	initial_cond	0	0.000000
exp5650	7.34590618e-29	0.000000	0.000000	discard	cycle 31 u=0.0995	agent0	initial_cond	0	0.000000
exp5651	4.46546993e-29	0.000000	0.000000	discard	cycle 31 u=0.1000	agent0	initial_cond	1	-0.000000
exp5652	4.46546993e-29	0.000000	0.000000	discard	cycle 31 u=0.1000	agent0	initial_cond	0	-0.000000
exp5653	4.46546993e-29	0.000000	0.000000	discard	cycle 31 u=0.1000	agent0	initial_cond	0	-0.000000
exp5654	4.08106752e-29	0.000000	0.000000	discard	cycle 31 u=0.1000	agent0	initial_cond	1	-0.000000
exp5655	4.08106752e-29	0.000000	0.000000	discard	cycle 31 u=0.1000	agent0	initial_cond	0	-0.000000
exp5656	4.08106752e-29	0.000000	0.000000	discard	cycle 31 u=0.1000	agent0	initial_cond	0	-0.000000
exp5657	4.58623706e-29	0.000000	0.000000	discard	cycle 31 u=0.1000	agent0	initial_cond	0	-0.000000
exp5658	4.58623706e-29	0.000000	0.000000	discard	cycle 31 u=0.1000	agent0	initial_cond	0	-0.000000
exp5659	4.58623706e-29	0.000000	0.000000	discard	cycle 31 u=0.1000	agent0	initial_cond	1	-0.000000
exp5660	4.39794337e-29	0.000000	0.000000	discard	cycle 31 u=0.1000	agent0	initial_cond	0	-0.000000
exp5661	4.39794337e-29	0.000000	0.000000	discard	cycle 31 u=0.1000	agent0	initial_cond	0	-0.000000
exp5662	4.39794337e-29	0.000000	0.000000	discard	cycle 31 u=0.1000	agent0	initial_cond	1	-0.000000
exp5663	1.36727475e-28	0.000000	0.000000	discard	cycle 31 u=0.1050	agent0	initial_cond	0	-0.000000
exp5664	1.36727475e-28	0.000000	0.000000	discard	cycle 31 u=0.1050	agent0	initial_cond	0	-0.000000
exp5665	1.36727475e-28	0.000000	0.000000	discard	cycle 31 u=0.1050	agent0	initial_cond	0	-0.000000
exp5666	6.14461376e-29	0.000000	0.000000	discard	cycle 31 u=0.1050	agent0	initial_cond	0	-0.000000
exp5667	6.14461376e-29	0.000000	0.000000	discard	cycle 31 u=0.1050	agent0	initial_cond	1	-0.000000
exp5668	6.14461376e-29	0.000000	0.000000	discard	cycle 31 u=0.1050	agent0	initial_cond	0	-0.000000
exp5669	9.16425797e-17	0.070278	-0.000000	discard	Fourier 4th branch u=0 amp=0.4 phase=1.0 modes=3	manual	memory	0	0.000097
exp5669	1.75906666e-28	0.000000	0.000000	discard	cycle 31 u=0.1050	agent0	initial_cond	0	-0.000000
exp5670	1.75906666e-28	0.000000	0.000000	discard	cycle 31 u=0.1050	agent0	initial_cond	1	-0.000000
exp5671	1.75906666e-28	0.000000	0.000000	discard	cycle 31 u=0.1050	agent0	initial_cond	0	-0.000000
exp5672	1.11257917e-28	0.000000	0.000000	discard	cycle 31 u=0.1050	agent0	initial_cond	0	-0.000000
exp5673	1.11257917e-28	0.000000	0.000000	discard	cycle 31 u=0.1050	agent0	initial_cond	0	-0.000000
exp5674	1.11257917e-28	0.000000	0.000000	discard	cycle 31 u=0.1050	agent0	initial_cond	0	-0.000000
exp5675	8.58580947e-29	0.000000	0.000000	discard	cycle 32 u=0.0975	agent0	initial_cond	1	0.000000
exp5676	8.58580947e-29	0.000000	0.000000	discard	cycle 32 u=0.0975	agent0	initial_cond	0	0.000000
exp5677	8.58580947e-29	0.000000	0.000000	discard	cycle 32 u=0.0975	agent0	initial_cond	0	0.000000
exp5678	5.23962023e-29	0.000000	0.000000	discard	cycle 32 u=0.0975	agent0	initial_cond	1	0.000000
exp5679	5.23962023e-29	0.000000	0.000000	discard	cycle 32 u=0.0975	agent0	initial_cond	0	0.000000
exp5680	5.23962023e-29	0.000000	0.000000	discard	cycle 32 u=0.0975	agent0	initial_cond	0	0.000000
exp5681	4.03266298e-29	0.000000	0.000000	discard	cycle 32 u=0.0975	agent0	initial_cond	0	0.000000
exp5682	4.03266298e-29	0.000000	0.000000	discard	cycle 32 u=0.0975	agent0	initial_cond	0	0.000000
exp5683	4.03266298e-29	0.000000	0.000000	discard	cycle 32 u=0.0975	agent0	initial_cond	1	0.000000
exp5684	4.80015937e-29	0.000000	0.000000	discard	cycle 32 u=0.0975	agent0	initial_cond	0	0.000000
exp5685	4.80015937e-29	0.000000	0.000000	discard	cycle 32 u=0.0975	agent0	initial_cond	0	0.000000
exp5686	4.80015937e-29	0.000000	0.000000	discard	cycle 32 u=0.0975	agent0	initial_cond	1	0.000000
exp5687	1.14220180e-17	0.070278	-0.000000	discard	Fourier 4th branch u=0 amp=0.5 phase=1.0 modes=3	manual	memory	0	0.000097
exp5688	2.68824537e-29	0.000000	0.000000	discard	cycle 32 u=0.0980	agent0	initial_cond	0	-0.000000
exp5689	2.68824537e-29	0.000000	0.000000	discard	cycle 32 u=0.0980	agent0	initial_cond	0	-0.000000
exp5690	2.68824537e-29	0.000000	0.000000	discard	cycle 32 u=0.0980	agent0	initial_cond	1	-0.000000
exp5691	6.16758073e-29	0.000000	0.000000	discard	cycle 32 u=0.0980	agent0	initial_cond	0	-0.000000
exp5692	6.16758073e-29	0.000000	0.000000	discard	cycle 32 u=0.0980	agent0	initial_cond	1	-0.000000
exp5693	6.16758073e-29	0.000000	0.000000	discard	cycle 32 u=0.0980	agent0	initial_cond	0	-0.000000
exp5694	2.01926478e-29	0.000000	0.000000	discard	cycle 32 u=0.0980	agent0	initial_cond	0	0.000000
exp5695	2.01926478e-29	0.000000	0.000000	discard	cycle 32 u=0.0980	agent0	initial_cond	1	0.000000
exp5696	2.01926478e-29	0.000000	0.000000	discard	cycle 32 u=0.0980	agent0	initial_cond	0	0.000000
exp5697	1.30310780e-28	0.000000	0.000000	discard	cycle 32 u=0.0980	agent0	initial_cond	0	-0.000000
exp5698	1.30310780e-28	0.000000	0.000000	discard	cycle 32 u=0.0980	agent0	initial_cond	1	-0.000000
exp5699	1.30310780e-28	0.000000	0.000000	discard	cycle 32 u=0.0980	agent0	initial_cond	0	-0.000000
exp5700	5.45343271e-29	0.000000	0.000000	discard	cycle 32 u=0.0982	agent0	initial_cond	0	-0.000000
exp5701	1.93183224e-17	0.070278	-0.000000	discard	Fourier 4th branch u=0 amp=0.5 phase=1.5 modes=3	manual	memory	1	0.000097
exp5702	5.45343271e-29	0.000000	0.000000	discard	cycle 32 u=0.0982	agent0	initial_cond	0	-0.000000
exp5703	5.45343271e-29	0.000000	0.000000	discard	cycle 32 u=0.0982	agent0	initial_cond	0	-0.000000
exp5704	1.23429977e-28	0.000000	0.000000	discard	cycle 32 u=0.0982	agent0	initial_cond	1	0.000000
exp5705	1.23429977e-28	0.000000	0.000000	discard	cycle 32 u=0.0982	agent0	initial_cond	0	0.000000
exp5706	1.23429977e-28	0.000000	0.000000	discard	cycle 32 u=0.0982	agent0	initial_cond	0	0.000000
exp5707	1.88036672e-29	0.000000	0.000000	discard	cycle 32 u=0.0982	agent0	initial_cond	1	0.000000
exp5708	1.88036672e-29	0.000000	0.000000	discard	cycle 32 u=0.0982	agent0	initial_cond	0	0.000000
exp5709	1.88036672e-29	0.000000	0.000000	discard	cycle 32 u=0.0982	agent0	initial_cond	0	0.000000
exp5710	1.91190259e-29	0.000000	-0.000000	discard	cycle 32 u=0.0982	agent0	initial_cond	0	0.000000
exp5711	1.91190259e-29	0.000000	-0.000000	discard	cycle 32 u=0.0982	agent0	initial_cond	0	0.000000
exp5712	1.91190259e-29	0.000000	-0.000000	discard	cycle 32 u=0.0982	agent0	initial_cond	1	0.000000
exp5713	6.13049994e-29	0.000000	0.000000	discard	cycle 32 u=0.0985	agent0	initial_cond	0	0.000000
exp5714	6.13049994e-29	0.000000	0.000000	discard	cycle 32 u=0.0985	agent0	initial_cond	0	0.000000
exp5714	5.08770336e-17	0.070278	-0.000000	discard	Fourier 4th branch u=0 amp=0.5 phase=0.9 modes=3	manual	memory	0	0.000097
exp5715	6.13049994e-29	0.000000	0.000000	discard	cycle 32 u=0.0985	agent0	initial_cond	1	0.000000
exp5716	5.49750971e-29	0.000000	0.000000	discard	cycle 32 u=0.0985	agent0	initial_cond	0	0.000000
exp5717	5.49750971e-29	0.000000	0.000000	discard	cycle 32 u=0.0985	agent0	initial_cond	0	0.000000
exp5718	5.49750971e-29	0.000000	0.000000	discard	cycle 32 u=0.0985	agent0	initial_cond	0	0.000000
exp5719	4.15642452e-29	0.000000	0.000000	discard	cycle 32 u=0.0985	agent0	initial_cond	0	0.000000
exp5720	4.15642452e-29	0.000000	0.000000	discard	cycle 32 u=0.0985	agent0	initial_cond	1	0.000000
exp5721	4.15642452e-29	0.000000	0.000000	discard	cycle 32 u=0.0985	agent0	initial_cond	0	0.000000
exp5722	2.19292611e-29	0.000000	0.000000	discard	cycle 32 u=0.0985	agent0	initial_cond	0	-0.000000
exp5723	2.19292611e-29	0.000000	0.000000	discard	cycle 32 u=0.0985	agent0	initial_cond	1	-0.000000
exp5724	2.19292611e-29	0.000000	0.000000	discard	cycle 32 u=0.0985	agent0	initial_cond	0	-0.000000
exp5725	4.22491788e-29	0.000000	0.000000	discard	cycle 32 u=0.0990	agent0	initial_cond	0	-0.000000
exp5726	4.22491788e-29	0.000000	0.000000	discard	cycle 32 u=0.0990	agent0	initial_cond	0	-0.000000
exp5727	4.22491788e-29	0.000000	0.000000	discard	cycle 32 u=0.0990	agent0	initial_cond	0	-0.000000
exp5728	3.22245147e-29	0.000000	0.000000	discard	cycle 32 u=0.0990	agent0	initial_cond	1	0.000000
exp5729	3.22245147e-29	0.000000	0.000000	discard	cycle 32 u=0.0990	agent0	initial_cond	0	0.000000
exp5730	3.22245147e-29	0.000000	0.000000	discard	cycle 32 u=0.0990	agent0	initial_cond	0	0.000000
exp5731	4.50941488e-29	0.000000	-0.000000	discard	cycle 32 u=0.0990	agent0	initial_cond	1	0.000000
exp5732	2.29641525e-16	0.070535	0.000000	discard	hunt 5th branch mode=2 u=0 amp=0.5 phase=Ď€/2 modes=4	manual	memory	0	0.000099
exp5733	4.50941488e-29	0.000000	-0.000000	discard	cycle 32 u=0.0990	agent0	initial_cond	0	0.000000
exp5734	4.50941488e-29	0.000000	-0.000000	discard	cycle 32 u=0.0990	agent0	initial_cond	0	0.000000
exp5735	4.88330883e-29	0.000000	-0.000000	discard	cycle 32 u=0.0990	agent0	initial_cond	0	0.000000
exp5736	4.88330883e-29	0.000000	-0.000000	discard	cycle 32 u=0.0990	agent0	initial_cond	0	0.000000
exp5737	4.88330883e-29	0.000000	-0.000000	discard	cycle 32 u=0.0990	agent0	initial_cond	1	0.000000
exp5738	5.74085541e-29	0.000000	-0.000000	discard	cycle 32 u=0.0995	agent0	initial_cond	0	0.000000
exp5739	5.74085541e-29	0.000000	-0.000000	discard	cycle 32 u=0.0995	agent0	initial_cond	0	0.000000
exp5740	5.74085541e-29	0.000000	-0.000000	discard	cycle 32 u=0.0995	agent0	initial_cond	1	0.000000
exp5741	1.54984578e-28	0.000000	0.000000	discard	cycle 32 u=0.0995	agent0	initial_cond	0	-0.000000
exp5742	1.54984578e-28	0.000000	0.000000	discard	cycle 32 u=0.0995	agent0	initial_cond	0	-0.000000
exp5743	1.54984578e-28	0.000000	0.000000	discard	cycle 32 u=0.0995	agent0	initial_cond	1	-0.000000
exp5744	1.60328418e-29	0.000000	-0.000000	discard	cycle 32 u=0.0995	agent0	initial_cond	0	-0.000000
exp5745	1.60328418e-29	0.000000	-0.000000	discard	cycle 32 u=0.0995	agent0	initial_cond	0	-0.000000
exp5746	1.60328418e-29	0.000000	-0.000000	discard	cycle 32 u=0.0995	agent0	initial_cond	0	-0.000000
exp5747	6.19615180e-17	0.070535	-0.000000	discard	hunt 5th branch mode=3 u=0 amp=0.5 phase=Ď€/2 modes=4	manual	memory	0	0.000099
exp5748	7.34590618e-29	0.000000	0.000000	discard	cycle 32 u=0.0995	agent0	initial_cond	0	0.000000
exp5749	7.34590618e-29	0.000000	0.000000	discard	cycle 32 u=0.0995	agent0	initial_cond	1	0.000000
exp5750	7.34590618e-29	0.000000	0.000000	discard	cycle 32 u=0.0995	agent0	initial_cond	0	0.000000
exp5751	4.46546993e-29	0.000000	0.000000	discard	cycle 32 u=0.1000	agent0	initial_cond	0	-0.000000
exp5752	4.46546993e-29	0.000000	0.000000	discard	cycle 32 u=0.1000	agent0	initial_cond	1	-0.000000
exp5753	4.46546993e-29	0.000000	0.000000	discard	cycle 32 u=0.1000	agent0	initial_cond	0	-0.000000
exp5754	4.08106752e-29	0.000000	0.000000	discard	cycle 32 u=0.1000	agent0	initial_cond	0	-0.000000
exp5755	4.08106752e-29	0.000000	0.000000	discard	cycle 32 u=0.1000	agent0	initial_cond	0	-0.000000
exp5756	4.08106752e-29	0.000000	0.000000	discard	cycle 32 u=0.1000	agent0	initial_cond	0	-0.000000
exp5757	4.58623706e-29	0.000000	0.000000	discard	cycle 32 u=0.1000	agent0	initial_cond	1	-0.000000
exp5758	4.58623706e-29	0.000000	0.000000	discard	cycle 32 u=0.1000	agent0	initial_cond	0	-0.000000
exp5759	4.58623706e-29	0.000000	0.000000	discard	cycle 32 u=0.1000	agent0	initial_cond	0	-0.000000
exp5760	4.39794337e-29	0.000000	0.000000	discard	cycle 32 u=0.1000	agent0	initial_cond	1	-0.000000
exp5761	4.39794337e-29	0.000000	0.000000	discard	cycle 32 u=0.1000	agent0	initial_cond	0	-0.000000
exp5762	4.39794337e-29	0.000000	0.000000	discard	cycle 32 u=0.1000	agent0	initial_cond	0	-0.000000
exp5763	1.36727475e-28	0.000000	0.000000	discard	cycle 32 u=0.1050	agent0	initial_cond	0	-0.000000
exp5764	4.42586856e-16	1.001296	-1.000019	discard	4th branch near boundary u_offset=0.462 amp=0.5 phase=1.0	manual	memory	0	-1.520844
exp5765	1.36727475e-28	0.000000	0.000000	discard	cycle 32 u=0.1050	agent0	initial_cond	0	-0.000000
exp5766	1.36727475e-28	0.000000	0.000000	discard	cycle 32 u=0.1050	agent0	initial_cond	1	-0.000000
exp5767	6.14461376e-29	0.000000	0.000000	discard	cycle 32 u=0.1050	agent0	initial_cond	0	-0.000000
exp5768	6.14461376e-29	0.000000	0.000000	discard	cycle 32 u=0.1050	agent0	initial_cond	0	-0.000000
exp5769	6.14461376e-29	0.000000	0.000000	discard	cycle 32 u=0.1050	agent0	initial_cond	1	-0.000000
exp5770	1.75906666e-28	0.000000	0.000000	discard	cycle 32 u=0.1050	agent0	initial_cond	0	-0.000000
exp5771	1.75906666e-28	0.000000	0.000000	discard	cycle 32 u=0.1050	agent0	initial_cond	0	-0.000000
exp5772	1.75906666e-28	0.000000	0.000000	discard	cycle 32 u=0.1050	agent0	initial_cond	0	-0.000000
exp5773	1.11257917e-28	0.000000	0.000000	discard	cycle 32 u=0.1050	agent0	initial_cond	0	-0.000000
exp5774	1.11257917e-28	0.000000	0.000000	discard	cycle 32 u=0.1050	agent0	initial_cond	1	-0.000000
exp5775	1.11257917e-28	0.000000	0.000000	discard	cycle 32 u=0.1050	agent0	initial_cond	0	-0.000000
exp5776	8.58580947e-29	0.000000	0.000000	discard	cycle 33 u=0.0975	agent0	initial_cond	0	0.000000
exp5777	8.58580947e-29	0.000000	0.000000	discard	cycle 33 u=0.0975	agent0	initial_cond	1	0.000000
exp5778	3.17909165e-17	0.070278	-0.000000	discard	4th branch u_offset=0.3 amp=0.5 phase=1.0 modes=3	manual	memory	0	0.000097
exp5778	8.58580947e-29	0.000000	0.000000	discard	cycle 33 u=0.0975	agent0	initial_cond	0	0.000000
exp5779	5.23962023e-29	0.000000	0.000000	discard	cycle 33 u=0.0975	agent0	initial_cond	0	0.000000
exp5780	5.23962023e-29	0.000000	0.000000	discard	cycle 33 u=0.0975	agent0	initial_cond	1	0.000000
exp5781	5.23962023e-29	0.000000	0.000000	discard	cycle 33 u=0.0975	agent0	initial_cond	0	0.000000
exp5782	4.03266298e-29	0.000000	0.000000	discard	cycle 33 u=0.0975	agent0	initial_cond	0	0.000000
exp5783	4.03266298e-29	0.000000	0.000000	discard	cycle 33 u=0.0975	agent0	initial_cond	0	0.000000
exp5784	4.03266298e-29	0.000000	0.000000	discard	cycle 33 u=0.0975	agent0	initial_cond	0	0.000000
exp5785	4.80015937e-29	0.000000	0.000000	discard	cycle 33 u=0.0975	agent0	initial_cond	1	0.000000
exp5786	4.80015937e-29	0.000000	0.000000	discard	cycle 33 u=0.0975	agent0	initial_cond	0	0.000000
exp5787	4.80015937e-29	0.000000	0.000000	discard	cycle 33 u=0.0975	agent0	initial_cond	0	0.000000
exp5788	2.68824537e-29	0.000000	0.000000	discard	cycle 33 u=0.0980	agent0	initial_cond	1	-0.000000
exp5789	2.68824537e-29	0.000000	0.000000	discard	cycle 33 u=0.0980	agent0	initial_cond	0	-0.000000
