exp_id	residual	solution_norm	solution_mean	status	description	agent	design	elapsed_s	solution_energy
exp13099	4.03266298e-29	0.000000	0.000000	discard	cycle 99 u=0.0975	agent0	initial_cond	1	0.000000
exp13100	4.03266298e-29	0.000000	0.000000	discard	cycle 99 u=0.0975	agent0	initial_cond	0	0.000000
exp13101	4.80015937e-29	0.000000	0.000000	discard	cycle 99 u=0.0975	agent0	initial_cond	1	0.000000
exp13102	4.80015937e-29	0.000000	0.000000	discard	cycle 99 u=0.0975	agent0	initial_cond	0	0.000000
exp13103	4.80015937e-29	0.000000	0.000000	discard	cycle 99 u=0.0975	agent0	initial_cond	0	0.000000
exp13104	2.68824537e-29	0.000000	0.000000	discard	cycle 99 u=0.0980	agent0	initial_cond	1	-0.000000
exp13105	2.68824537e-29	0.000000	0.000000	discard	cycle 99 u=0.0980	agent0	initial_cond	0	-0.000000
exp13106	2.68824537e-29	0.000000	0.000000	discard	cycle 99 u=0.0980	agent0	initial_cond	1	-0.000000
exp13107	6.16758073e-29	0.000000	0.000000	discard	cycle 99 u=0.0980	agent0	initial_cond	0	-0.000000
exp13108	6.16758073e-29	0.000000	0.000000	discard	cycle 99 u=0.0980	agent0	initial_cond	0	-0.000000
exp13109	6.16758073e-29	0.000000	0.000000	discard	cycle 99 u=0.0980	agent0	initial_cond	0	-0.000000
exp13110	2.01926478e-29	0.000000	0.000000	discard	cycle 99 u=0.0980	agent0	initial_cond	0	0.000000
exp13111	2.01926478e-29	0.000000	0.000000	discard	cycle 99 u=0.0980	agent0	initial_cond	1	0.000000
exp13112	2.01926478e-29	0.000000	0.000000	discard	cycle 99 u=0.0980	agent0	initial_cond	0	0.000000
exp13113	1.30310780e-28	0.000000	0.000000	discard	cycle 99 u=0.0980	agent0	initial_cond	0	-0.000000
exp13114	1.30310780e-28	0.000000	0.000000	discard	cycle 99 u=0.0980	agent0	initial_cond	0	-0.000000
exp13115	1.30310780e-28	0.000000	0.000000	discard	cycle 99 u=0.0980	agent0	initial_cond	0	-0.000000
exp13116	5.45343271e-29	0.000000	0.000000	discard	cycle 99 u=0.0982	agent0	initial_cond	1	-0.000000
exp13117	1.95110970e-18	0.005185	-0.000000	discard	Round 10: Hyper-fine K=0.0220	agent1	branch_search	0	-0.000000
exp13118	5.45343271e-29	0.000000	0.000000	discard	cycle 99 u=0.0982	agent0	initial_cond	0	-0.000000
exp13119	1.31462540e-18	0.005209	-0.000000	discard	Round 10: Hyper-fine K=0.0221	agent1	branch_search	0	-0.000000
exp13120	5.45343271e-29	0.000000	0.000000	discard	cycle 99 u=0.0982	agent0	initial_cond	1	-0.000000
exp13121	3.40487480e-18	0.005232	-0.000000	discard	Round 10: Hyper-fine K=0.0222	agent1	branch_search	0	-0.000000
exp13122	1.23429977e-28	0.000000	0.000000	discard	cycle 99 u=0.0982	agent0	initial_cond	0	0.000000
exp13123	2.84964943e-18	0.005256	0.000000	discard	Round 10: Hyper-fine K=0.0223	agent1	branch_search	0	-0.000000
exp13123	1.23429977e-28	0.000000	0.000000	discard	cycle 99 u=0.0982	agent0	initial_cond	0	0.000000
exp13124	1.08506272e-18	0.005280	-0.000000	discard	Round 10: Hyper-fine K=0.0224	agent1	branch_search	1	-0.000000
exp13124	1.23429977e-28	0.000000	0.000000	discard	cycle 99 u=0.0982	agent0	initial_cond	1	0.000000
exp13125	1.72621154e-18	0.005303	-0.000000	discard	Round 10: Hyper-fine K=0.0225	agent1	branch_search	0	-0.000000
exp13125	1.88036672e-29	0.000000	0.000000	discard	cycle 99 u=0.0982	agent0	initial_cond	0	0.000000
exp13126	3.51615143e-18	0.005327	-0.000000	discard	Round 10: Hyper-fine K=0.0226	agent1	branch_search	1	-0.000000
exp13126	1.88036672e-29	0.000000	0.000000	discard	cycle 99 u=0.0982	agent0	initial_cond	1	0.000000
exp13127	2.35182591e-18	0.005350	-0.000000	discard	Round 10: Hyper-fine K=0.0227	agent1	branch_search	0	-0.000000
exp13127	1.88036672e-29	0.000000	0.000000	discard	cycle 99 u=0.0982	agent0	initial_cond	0	0.000000
exp13128	2.03465180e-18	0.005374	-0.000000	discard	Round 10: Hyper-fine K=0.0228	agent1	branch_search	0	-0.000000
exp13128	1.91190259e-29	0.000000	-0.000000	discard	cycle 99 u=0.0982	agent0	initial_cond	0	0.000000
exp13129	1.91190259e-29	0.000000	-0.000000	discard	cycle 99 u=0.0982	agent0	initial_cond	1	0.000000
exp13129	3.67274997e-18	0.005397	-0.000000	discard	Round 10: Hyper-fine K=0.0229	agent1	branch_search	1	-0.000000
exp13130	1.02571623e-18	0.005421	-0.000000	discard	Round 10: Hyper-fine K=0.0230	agent1	branch_search	0	-0.000000
exp13130	1.91190259e-29	0.000000	-0.000000	discard	cycle 99 u=0.0982	agent0	initial_cond	0	0.000000
exp13131	6.13049994e-29	0.000000	0.000000	discard	cycle 99 u=0.0985	agent0	initial_cond	1	0.000000
exp13131	2.33026091e-18	0.005445	-0.000000	discard	Round 10: Hyper-fine K=0.0231	agent1	branch_search	1	-0.000000
exp13132	6.13049994e-29	0.000000	0.000000	discard	cycle 99 u=0.0985	agent0	initial_cond	0	0.000000
exp13132	6.49953037e-18	0.005468	-0.000000	discard	Round 10: Hyper-fine K=0.0232	agent1	branch_search	0	-0.000000
exp13133	6.13049994e-29	0.000000	0.000000	discard	cycle 99 u=0.0985	agent0	initial_cond	0	0.000000
exp13133	1.80180839e-18	0.005492	-0.000000	discard	Round 10: Hyper-fine K=0.0233	agent1	branch_search	0	-0.000000
exp13134	5.49750971e-29	0.000000	0.000000	discard	cycle 99 u=0.0985	agent0	initial_cond	0	0.000000
exp13134	3.23389995e-18	0.005515	-0.000000	discard	Round 10: Hyper-fine K=0.0234	agent1	branch_search	0	-0.000000
exp13135	5.49750971e-29	0.000000	0.000000	discard	cycle 99 u=0.0985	agent0	initial_cond	0	0.000000
exp13135	4.28637216e-18	0.005539	-0.000000	discard	Round 10: Hyper-fine K=0.0235	agent1	branch_search	0	-0.000000
exp13136	5.49750971e-29	0.000000	0.000000	discard	cycle 99 u=0.0985	agent0	initial_cond	1	0.000000
exp13136	2.80397360e-18	0.005562	-0.000000	discard	Round 10: Hyper-fine K=0.0236	agent1	branch_search	1	-0.000000
exp13137	4.15642452e-29	0.000000	0.000000	discard	cycle 99 u=0.0985	agent0	initial_cond	0	0.000000
exp13137	3.90721753e-18	0.005586	-0.000000	discard	Round 10: Hyper-fine K=0.0237	agent1	branch_search	0	-0.000000
exp13138	4.15642452e-29	0.000000	0.000000	discard	cycle 99 u=0.0985	agent0	initial_cond	0	0.000000
exp13138	3.79532568e-18	0.005609	-0.000000	discard	Round 10: Hyper-fine K=0.0238	agent1	branch_search	1	-0.000000
exp13139	4.15642452e-29	0.000000	0.000000	discard	cycle 99 u=0.0985	agent0	initial_cond	0	0.000000
exp13139	1.42356393e-18	0.005633	-0.000000	discard	Round 10: Hyper-fine K=0.0239	agent1	branch_search	0	-0.000000
exp13140	2.19292611e-29	0.000000	0.000000	discard	cycle 99 u=0.0985	agent0	initial_cond	0	-0.000000
exp13140	1.03694843e-18	0.005657	-0.000000	discard	Round 10: Hyper-fine K=0.0240	agent1	branch_search	0	-0.000000
exp13141	2.19292611e-29	0.000000	0.000000	discard	cycle 99 u=0.0985	agent0	initial_cond	1	-0.000000
exp13142	2.19292611e-29	0.000000	0.000000	discard	cycle 99 u=0.0985	agent0	initial_cond	0	-0.000000
exp13143	4.22491788e-29	0.000000	0.000000	discard	cycle 99 u=0.0990	agent0	initial_cond	1	-0.000000
exp13144	4.22491788e-29	0.000000	0.000000	discard	cycle 99 u=0.0990	agent0	initial_cond	0	-0.000000
exp13145	4.22491788e-29	0.000000	0.000000	discard	cycle 99 u=0.0990	agent0	initial_cond	0	-0.000000
exp13146	3.22245147e-29	0.000000	0.000000	discard	cycle 99 u=0.0990	agent0	initial_cond	1	0.000000
exp13147	3.22245147e-29	0.000000	0.000000	discard	cycle 99 u=0.0990	agent0	initial_cond	0	0.000000
exp13148	3.22245147e-29	0.000000	0.000000	discard	cycle 99 u=0.0990	agent0	initial_cond	1	0.000000
exp13149	4.50941488e-29	0.000000	-0.000000	discard	cycle 99 u=0.0990	agent0	initial_cond	0	0.000000
exp13150	4.50941488e-29	0.000000	-0.000000	discard	cycle 99 u=0.0990	agent0	initial_cond	0	0.000000
exp13151	4.50941488e-29	0.000000	-0.000000	discard	cycle 99 u=0.0990	agent0	initial_cond	0	0.000000
exp13152	4.88330883e-29	0.000000	-0.000000	discard	cycle 99 u=0.0990	agent0	initial_cond	0	0.000000
exp13153	4.88330883e-29	0.000000	-0.000000	discard	cycle 99 u=0.0990	agent0	initial_cond	1	0.000000
exp13154	4.88330883e-29	0.000000	-0.000000	discard	cycle 99 u=0.0990	agent0	initial_cond	0	0.000000
exp13155	5.74085541e-29	0.000000	-0.000000	discard	cycle 99 u=0.0995	agent0	initial_cond	0	0.000000
exp13156	5.74085541e-29	0.000000	-0.000000	discard	cycle 99 u=0.0995	agent0	initial_cond	0	0.000000
exp13157	5.74085541e-29	0.000000	-0.000000	discard	cycle 99 u=0.0995	agent0	initial_cond	0	0.000000
exp13158	1.54984578e-28	0.000000	0.000000	discard	cycle 99 u=0.0995	agent0	initial_cond	1	-0.000000
exp13159	1.54984578e-28	0.000000	0.000000	discard	cycle 99 u=0.0995	agent0	initial_cond	0	-0.000000
exp13160	1.54984578e-28	0.000000	0.000000	discard	cycle 99 u=0.0995	agent0	initial_cond	0	-0.000000
exp13161	1.60328418e-29	0.000000	-0.000000	discard	cycle 99 u=0.0995	agent0	initial_cond	0	-0.000000
exp13162	1.60328418e-29	0.000000	-0.000000	discard	cycle 99 u=0.0995	agent0	initial_cond	0	-0.000000
exp13163	1.60328418e-29	0.000000	-0.000000	discard	cycle 99 u=0.0995	agent0	initial_cond	1	-0.000000
exp13164	7.34590618e-29	0.000000	0.000000	discard	cycle 99 u=0.0995	agent0	initial_cond	0	0.000000
exp13165	7.34590618e-29	0.000000	0.000000	discard	cycle 99 u=0.0995	agent0	initial_cond	1	0.000000
exp13166	7.34590618e-29	0.000000	0.000000	discard	cycle 99 u=0.0995	agent0	initial_cond	0	0.000000
exp13167	4.46546993e-29	0.000000	0.000000	discard	cycle 99 u=0.1000	agent0	initial_cond	0	-0.000000
exp13168	4.46546993e-29	0.000000	0.000000	discard	cycle 99 u=0.1000	agent0	initial_cond	1	-0.000000
exp13169	4.46546993e-29	0.000000	0.000000	discard	cycle 99 u=0.1000	agent0	initial_cond	0	-0.000000
exp13170	4.08106752e-29	0.000000	0.000000	discard	cycle 99 u=0.1000	agent0	initial_cond	1	-0.000000
exp13171	4.08106752e-29	0.000000	0.000000	discard	cycle 99 u=0.1000	agent0	initial_cond	0	-0.000000
exp13172	4.08106752e-29	0.000000	0.000000	discard	cycle 99 u=0.1000	agent0	initial_cond	0	-0.000000
exp13173	4.58623706e-29	0.000000	0.000000	discard	cycle 99 u=0.1000	agent0	initial_cond	1	-0.000000
exp13174	4.58623706e-29	0.000000	0.000000	discard	cycle 99 u=0.1000	agent0	initial_cond	0	-0.000000
exp13175	4.58623706e-29	0.000000	0.000000	discard	cycle 99 u=0.1000	agent0	initial_cond	1	-0.000000
exp13176	4.39794337e-29	0.000000	0.000000	discard	cycle 99 u=0.1000	agent0	initial_cond	0	-0.000000
exp13177	4.39794337e-29	0.000000	0.000000	discard	cycle 99 u=0.1000	agent0	initial_cond	0	-0.000000
exp13178	4.39794337e-29	0.000000	0.000000	discard	cycle 99 u=0.1000	agent0	initial_cond	0	-0.000000
exp13179	1.36727475e-28	0.000000	0.000000	discard	cycle 99 u=0.1050	agent0	initial_cond	0	-0.000000
exp13180	1.36727475e-28	0.000000	0.000000	discard	cycle 99 u=0.1050	agent0	initial_cond	1	-0.000000
exp13181	1.36727475e-28	0.000000	0.000000	discard	cycle 99 u=0.1050	agent0	initial_cond	0	-0.000000
exp13182	6.14461376e-29	0.000000	0.000000	discard	cycle 99 u=0.1050	agent0	initial_cond	0	-0.000000
exp13183	6.14461376e-29	0.000000	0.000000	discard	cycle 99 u=0.1050	agent0	initial_cond	0	-0.000000
exp13184	6.14461376e-29	0.000000	0.000000	discard	cycle 99 u=0.1050	agent0	initial_cond	0	-0.000000
exp13185	1.75906666e-28	0.000000	0.000000	discard	cycle 99 u=0.1050	agent0	initial_cond	1	-0.000000
exp13186	1.75906666e-28	0.000000	0.000000	discard	cycle 99 u=0.1050	agent0	initial_cond	0	-0.000000
exp13187	1.75906666e-28	0.000000	0.000000	discard	cycle 99 u=0.1050	agent0	initial_cond	0	-0.000000
exp13188	1.11257917e-28	0.000000	0.000000	discard	cycle 99 u=0.1050	agent0	initial_cond	0	-0.000000
exp13189	1.11257917e-28	0.000000	0.000000	discard	cycle 99 u=0.1050	agent0	initial_cond	0	-0.000000
exp13190	1.11257917e-28	0.000000	0.000000	discard	cycle 99 u=0.1050	agent0	initial_cond	1	-0.000000
exp13191	5.32692937e-17	0.097831	-0.000000	discard	Round 10: 3D at K=0.023 u=0.240 a=0.42 p=1.20	agent1	perturbation	1	0.000490
exp13192	8.58580947e-29	0.000000	0.000000	discard	cycle 100 u=0.0975	agent0	initial_cond	0	0.000000
exp13193	4.81015189e-17	0.097831	-0.000000	discard	Round 10: 3D at K=0.023 u=0.240 a=0.42 p=1.21	agent1	perturbation	0	0.000490
exp13194	8.58580947e-29	0.000000	0.000000	discard	cycle 100 u=0.0975	agent0	initial_cond	1	0.000000
exp13195	3.81859718e-17	0.097831	0.000000	discard	Round 10: 3D at K=0.023 u=0.240 a=0.42 p=1.22	agent1	perturbation	1	0.000490
exp13196	8.58580947e-29	0.000000	0.000000	discard	cycle 100 u=0.0975	agent0	initial_cond	0	0.000000
exp13197	7.87547131e-17	0.097831	-0.000000	discard	Round 10: 3D at K=0.023 u=0.240 a=0.42 p=1.23	agent1	perturbation	0	0.000490
exp13198	5.23962023e-29	0.000000	0.000000	discard	cycle 100 u=0.0975	agent0	initial_cond	0	0.000000
exp13199	9.28738703e-17	0.097831	-0.000000	discard	Round 10: 3D at K=0.023 u=0.240 a=0.42 p=1.24	agent1	perturbation	1	0.000490
exp13200	5.23962023e-29	0.000000	0.000000	discard	cycle 100 u=0.0975	agent0	initial_cond	1	0.000000
exp13201	2.44287094e-17	0.100106	-0.000000	discard	Round 10: 3D at K=0.023 u=0.240 a=0.43 p=1.20	agent1	perturbation	0	0.000544
exp13202	5.23962023e-29	0.000000	0.000000	discard	cycle 100 u=0.0975	agent0	initial_cond	0	0.000000
exp13203	2.51992825e-17	0.100106	-0.000000	discard	Round 10: 3D at K=0.023 u=0.240 a=0.43 p=1.21	agent1	perturbation	0	0.000544
exp13204	4.03266298e-29	0.000000	0.000000	discard	cycle 100 u=0.0975	agent0	initial_cond	1	0.000000
exp13205	3.00923059e-17	0.100106	-0.000000	discard	Round 10: 3D at K=0.023 u=0.240 a=0.43 p=1.22	agent1	perturbation	0	0.000544
exp13205	4.03266298e-29	0.000000	0.000000	discard	cycle 100 u=0.0975	agent0	initial_cond	0	0.000000
exp13206	7.09286322e-17	0.100106	-0.000000	discard	Round 10: 3D at K=0.023 u=0.240 a=0.43 p=1.23	agent1	perturbation	0	0.000544
exp13206	4.03266298e-29	0.000000	0.000000	discard	cycle 100 u=0.0975	agent0	initial_cond	0	0.000000
exp13207	4.80015937e-29	0.000000	0.000000	discard	cycle 100 u=0.0975	agent0	initial_cond	0	0.000000
exp13207	9.99238615e-17	0.100106	0.000000	discard	Round 10: 3D at K=0.023 u=0.240 a=0.43 p=1.24	agent1	perturbation	0	0.000544
exp13208	4.80015937e-29	0.000000	0.000000	discard	cycle 100 u=0.0975	agent0	initial_cond	0	0.000000
exp13208	6.42721882e-17	0.102376	-0.000000	discard	Round 10: 3D at K=0.023 u=0.240 a=0.44 p=1.20	agent1	perturbation	0	0.000602
exp13209	4.80015937e-29	0.000000	0.000000	discard	cycle 100 u=0.0975	agent0	initial_cond	1	0.000000
exp13210	8.37169457e-17	0.102376	-0.000000	discard	Round 10: 3D at K=0.023 u=0.240 a=0.44 p=1.21	agent1	perturbation	1	0.000602
exp13211	2.68824537e-29	0.000000	0.000000	discard	cycle 100 u=0.0980	agent0	initial_cond	0	-0.000000
exp13212	1.23886510e-16	0.102376	-0.000000	discard	Round 10: 3D at K=0.023 u=0.240 a=0.44 p=1.22	agent1	perturbation	0	0.000602
exp13213	2.68824537e-29	0.000000	0.000000	discard	cycle 100 u=0.0980	agent0	initial_cond	0	-0.000000
exp13214	5.24367656e-17	0.102376	-0.000000	discard	Round 10: 3D at K=0.023 u=0.240 a=0.44 p=1.23	agent1	perturbation	1	0.000602
exp13215	2.68824537e-29	0.000000	0.000000	discard	cycle 100 u=0.0980	agent0	initial_cond	0	-0.000000
exp13216	3.53731938e-17	0.102376	-0.000000	discard	Round 10: 3D at K=0.023 u=0.240 a=0.44 p=1.24	agent1	perturbation	0	0.000602
exp13217	6.16758073e-29	0.000000	0.000000	discard	cycle 100 u=0.0980	agent0	initial_cond	0	-0.000000
exp13218	4.43747642e-17	0.104643	-0.000000	discard	Round 10: 3D at K=0.023 u=0.240 a=0.45 p=1.20	agent1	perturbation	0	0.000664
exp13219	6.16758073e-29	0.000000	0.000000	discard	cycle 100 u=0.0980	agent0	initial_cond	1	-0.000000
exp13220	5.40009928e-17	0.104643	-0.000000	discard	Round 10: 3D at K=0.023 u=0.240 a=0.45 p=1.21	agent1	perturbation	0	0.000664
exp13221	6.16758073e-29	0.000000	0.000000	discard	cycle 100 u=0.0980	agent0	initial_cond	0	-0.000000
exp13222	4.59800906e-17	0.104643	-0.000000	discard	Round 10: 3D at K=0.023 u=0.240 a=0.45 p=1.22	agent1	perturbation	0	0.000664
exp13223	2.01926478e-29	0.000000	0.000000	discard	cycle 100 u=0.0980	agent0	initial_cond	0	0.000000
exp13224	2.10227642e-17	0.104643	-0.000000	discard	Round 10: 3D at K=0.023 u=0.240 a=0.45 p=1.23	agent1	perturbation	0	0.000664
exp13224	2.01926478e-29	0.000000	0.000000	discard	cycle 100 u=0.0980	agent0	initial_cond	0	0.000000
exp13225	5.65531924e-17	0.104643	-0.000000	discard	Round 10: 3D at K=0.023 u=0.240 a=0.45 p=1.24	agent1	perturbation	0	0.000664
exp13225	2.01926478e-29	0.000000	0.000000	discard	cycle 100 u=0.0980	agent0	initial_cond	0	0.000000
exp13226	4.89462612e-17	0.106907	-0.000000	discard	Round 10: 3D at K=0.023 u=0.240 a=0.46 p=1.20	agent1	perturbation	1	0.000731
exp13226	1.30310780e-28	0.000000	0.000000	discard	cycle 100 u=0.0980	agent0	initial_cond	1	-0.000000
exp13227	1.30310780e-28	0.000000	0.000000	discard	cycle 100 u=0.0980	agent0	initial_cond	0	-0.000000
exp13227	7.67607605e-17	0.106907	-0.000000	discard	Round 10: 3D at K=0.023 u=0.240 a=0.46 p=1.21	agent1	perturbation	0	0.000731
exp13228	1.30310780e-28	0.000000	0.000000	discard	cycle 100 u=0.0980	agent0	initial_cond	1	-0.000000
exp13228	4.02623844e-17	0.106907	-0.000000	discard	Round 10: 3D at K=0.023 u=0.240 a=0.46 p=1.22	agent1	perturbation	1	0.000731
exp13229	5.45343271e-29	0.000000	0.000000	discard	cycle 100 u=0.0982	agent0	initial_cond	0	-0.000000
exp13230	6.81542365e-17	0.106907	-0.000000	discard	Round 10: 3D at K=0.023 u=0.240 a=0.46 p=1.23	agent1	perturbation	0	0.000731
exp13231	5.45343271e-29	0.000000	0.000000	discard	cycle 100 u=0.0982	agent0	initial_cond	0	-0.000000
exp13232	1.22104552e-17	0.106907	-0.000000	discard	Round 10: 3D at K=0.023 u=0.240 a=0.46 p=1.24	agent1	perturbation	1	0.000731
exp13233	5.45343271e-29	0.000000	0.000000	discard	cycle 100 u=0.0982	agent0	initial_cond	0	-0.000000
exp13234	1.62257312e-17	0.097831	-0.000000	discard	Round 10: 3D at K=0.023 u=0.242 a=0.42 p=1.20	agent1	perturbation	0	0.000490
exp13235	1.23429977e-28	0.000000	0.000000	discard	cycle 100 u=0.0982	agent0	initial_cond	0	0.000000
exp13236	6.35266421e-17	0.097831	0.000000	discard	Round 10: 3D at K=0.023 u=0.242 a=0.42 p=1.21	agent1	perturbation	0	0.000490
exp13237	1.23429977e-28	0.000000	0.000000	discard	cycle 100 u=0.0982	agent0	initial_cond	1	0.000000
exp13238	6.67732304e-17	0.097831	-0.000000	discard	Round 10: 3D at K=0.023 u=0.242 a=0.42 p=1.22	agent1	perturbation	0	0.000490
exp13239	1.23429977e-28	0.000000	0.000000	discard	cycle 100 u=0.0982	agent0	initial_cond	0	0.000000
exp13240	2.95188736e-17	0.097831	-0.000000	discard	Round 10: 3D at K=0.023 u=0.242 a=0.42 p=1.23	agent1	perturbation	0	0.000490
exp13241	1.88036672e-29	0.000000	0.000000	discard	cycle 100 u=0.0982	agent0	initial_cond	0	0.000000
exp13242	2.75576252e-17	0.097831	-0.000000	discard	Round 10: 3D at K=0.023 u=0.242 a=0.42 p=1.24	agent1	perturbation	1	0.000490
exp13242	1.88036672e-29	0.000000	0.000000	discard	cycle 100 u=0.0982	agent0	initial_cond	0	0.000000
exp13243	7.85308703e-17	0.100106	-0.000000	discard	Round 10: 3D at K=0.023 u=0.242 a=0.43 p=1.20	agent1	perturbation	0	0.000544
exp13243	1.88036672e-29	0.000000	0.000000	discard	cycle 100 u=0.0982	agent0	initial_cond	0	0.000000
exp13244	1.91190259e-29	0.000000	-0.000000	discard	cycle 100 u=0.0982	agent0	initial_cond	1	0.000000
exp13244	3.94385648e-17	0.100106	-0.000000	discard	Round 10: 3D at K=0.023 u=0.242 a=0.43 p=1.21	agent1	perturbation	1	0.000544
exp13245	1.91190259e-29	0.000000	-0.000000	discard	cycle 100 u=0.0982	agent0	initial_cond	0	0.000000
exp13245	4.07321717e-17	0.100106	-0.000000	discard	Round 10: 3D at K=0.023 u=0.242 a=0.43 p=1.22	agent1	perturbation	0	0.000544
exp13246	1.91190259e-29	0.000000	-0.000000	discard	cycle 100 u=0.0982	agent0	initial_cond	0	0.000000
exp13247	2.30785610e-17	0.100106	-0.000000	discard	Round 10: 3D at K=0.023 u=0.242 a=0.43 p=1.23	agent1	perturbation	1	0.000544
exp13248	6.13049994e-29	0.000000	0.000000	discard	cycle 100 u=0.0985	agent0	initial_cond	0	0.000000
exp13249	1.87568950e-17	0.100106	-0.000000	discard	Round 10: 3D at K=0.023 u=0.242 a=0.43 p=1.24	agent1	perturbation	0	0.000544
exp13250	6.13049994e-29	0.000000	0.000000	discard	cycle 100 u=0.0985	agent0	initial_cond	0	0.000000
exp13251	1.10219374e-16	0.102376	0.000000	discard	Round 10: 3D at K=0.023 u=0.242 a=0.44 p=1.20	agent1	perturbation	0	0.000602
exp13252	6.13049994e-29	0.000000	0.000000	discard	cycle 100 u=0.0985	agent0	initial_cond	1	0.000000
exp13253	5.25138180e-17	0.102376	-0.000000	discard	Round 10: 3D at K=0.023 u=0.242 a=0.44 p=1.21	agent1	perturbation	0	0.000602
exp13254	5.49750971e-29	0.000000	0.000000	discard	cycle 100 u=0.0985	agent0	initial_cond	0	0.000000
exp13255	3.85145457e-17	0.102376	-0.000000	discard	Round 10: 3D at K=0.023 u=0.242 a=0.44 p=1.22	agent1	perturbation	0	0.000602
exp13256	5.49750971e-29	0.000000	0.000000	discard	cycle 100 u=0.0985	agent0	initial_cond	1	0.000000
exp13257	4.02434142e-17	0.102376	0.000000	discard	Round 10: 3D at K=0.023 u=0.242 a=0.44 p=1.23	agent1	perturbation	0	0.000602
exp13258	5.49750971e-29	0.000000	0.000000	discard	cycle 100 u=0.0985	agent0	initial_cond	0	0.000000
exp13259	6.94324297e-17	0.102376	0.000000	discard	Round 10: 3D at K=0.023 u=0.242 a=0.44 p=1.24	agent1	perturbation	0	0.000602
exp13260	4.15642452e-29	0.000000	0.000000	discard	cycle 100 u=0.0985	agent0	initial_cond	0	0.000000
exp13261	4.19120867e-17	0.104643	-0.000000	discard	Round 10: 3D at K=0.023 u=0.242 a=0.45 p=1.20	agent1	perturbation	1	0.000664
exp13261	4.15642452e-29	0.000000	0.000000	discard	cycle 100 u=0.0985	agent0	initial_cond	1	0.000000
exp13262	4.15642452e-29	0.000000	0.000000	discard	cycle 100 u=0.0985	agent0	initial_cond	0	0.000000
exp13262	6.19101527e-17	0.104643	0.000000	discard	Round 10: 3D at K=0.023 u=0.242 a=0.45 p=1.21	agent1	perturbation	0	0.000664
exp13263	2.19292611e-29	0.000000	0.000000	discard	cycle 100 u=0.0985	agent0	initial_cond	1	-0.000000
exp13263	4.43062838e-17	0.104643	-0.000000	discard	Round 10: 3D at K=0.023 u=0.242 a=0.45 p=1.22	agent1	perturbation	1	0.000664
exp13264	2.19292611e-29	0.000000	0.000000	discard	cycle 100 u=0.0985	agent0	initial_cond	0	-0.000000
exp13264	1.92476550e-17	0.104643	-0.000000	discard	Round 10: 3D at K=0.023 u=0.242 a=0.45 p=1.23	agent1	perturbation	0	0.000664
exp13265	2.19292611e-29	0.000000	0.000000	discard	cycle 100 u=0.0985	agent0	initial_cond	0	-0.000000
exp13266	5.35716079e-17	0.104643	-0.000000	discard	Round 10: 3D at K=0.023 u=0.242 a=0.45 p=1.24	agent1	perturbation	1	0.000664
