exp_id	residual	solution_norm	solution_mean	status	description	agent	design	elapsed_s	solution_energy
exp11828	4.22491788e-29	0.000000	0.000000	discard	cycle 87 u=0.0990	agent0	initial_cond	1	-0.000000
exp11829	3.22245147e-29	0.000000	0.000000	discard	cycle 87 u=0.0990	agent0	initial_cond	0	0.000000
exp11830	3.22245147e-29	0.000000	0.000000	discard	cycle 87 u=0.0990	agent0	initial_cond	0	0.000000
exp11831	3.22245147e-29	0.000000	0.000000	discard	cycle 87 u=0.0990	agent0	initial_cond	0	0.000000
exp11832	4.50941488e-29	0.000000	-0.000000	discard	cycle 87 u=0.0990	agent0	initial_cond	0	0.000000
exp11833	4.50941488e-29	0.000000	-0.000000	discard	cycle 87 u=0.0990	agent0	initial_cond	1	0.000000
exp11834	4.50941488e-29	0.000000	-0.000000	discard	cycle 87 u=0.0990	agent0	initial_cond	0	0.000000
exp11835	4.88330883e-29	0.000000	-0.000000	discard	cycle 87 u=0.0990	agent0	initial_cond	0	0.000000
exp11836	4.88330883e-29	0.000000	-0.000000	discard	cycle 87 u=0.0990	agent0	initial_cond	0	0.000000
exp11837	2.67514219e-17	0.097831	-0.000000	discard	Final K=0.05 refinement	manual	k005_refine_final	0	0.000490
exp11837	4.88330883e-29	0.000000	-0.000000	discard	cycle 87 u=0.0990	agent0	initial_cond	0	0.000000
exp11838	5.74085541e-29	0.000000	-0.000000	discard	cycle 87 u=0.0995	agent0	initial_cond	1	0.000000
exp11839	8.32546447e-17	0.102376	-0.000000	discard	Final K=0.05 refinement	manual	k005_refine_final	1	0.000602
exp11840	5.74085541e-29	0.000000	-0.000000	discard	cycle 87 u=0.0995	agent0	initial_cond	0	0.000000
exp11841	3.84240678e-17	0.106907	-0.000000	discard	Final K=0.05 refinement	manual	k005_refine_final	0	0.000731
exp11842	5.74085541e-29	0.000000	-0.000000	discard	cycle 87 u=0.0995	agent0	initial_cond	0	0.000000
exp11843	1.54984578e-28	0.000000	0.000000	discard	cycle 87 u=0.0995	agent0	initial_cond	0	-0.000000
exp11844	3.40323831e-17	0.111421	-0.000000	discard	Final K=0.05 refinement	manual	k005_refine_final	0	0.000877
exp11845	1.54984578e-28	0.000000	0.000000	discard	cycle 87 u=0.0995	agent0	initial_cond	0	-0.000000
exp11846	7.87547131e-17	0.097831	-0.000000	discard	Final K=0.05 refinement	manual	k005_refine_final	0	0.000490
exp11847	1.54984578e-28	0.000000	0.000000	discard	cycle 87 u=0.0995	agent0	initial_cond	1	-0.000000
exp11848	1.60328418e-29	0.000000	-0.000000	discard	cycle 87 u=0.0995	agent0	initial_cond	0	-0.000000
exp11848	5.24367656e-17	0.102376	-0.000000	discard	Final K=0.05 refinement	manual	k005_refine_final	0	0.000602
exp11849	1.60328418e-29	0.000000	-0.000000	discard	cycle 87 u=0.0995	agent0	initial_cond	0	-0.000000
exp11850	6.81542365e-17	0.106907	-0.000000	discard	Final K=0.05 refinement	manual	k005_refine_final	1	0.000731
exp11851	1.60328418e-29	0.000000	-0.000000	discard	cycle 87 u=0.0995	agent0	initial_cond	0	-0.000000
exp11852	1.30684783e-16	0.111421	-0.000000	discard	Final K=0.05 refinement	manual	k005_refine_final	0	0.000877
exp11852	7.34590618e-29	0.000000	0.000000	discard	cycle 87 u=0.0995	agent0	initial_cond	0	0.000000
exp11853	7.34590618e-29	0.000000	0.000000	discard	cycle 87 u=0.0995	agent0	initial_cond	1	0.000000
exp11854	4.97398538e-17	0.097831	-0.000000	discard	Final K=0.05 refinement	manual	k005_refine_final	1	0.000490
exp11855	7.34590618e-29	0.000000	0.000000	discard	cycle 87 u=0.0995	agent0	initial_cond	0	0.000000
exp11856	2.45294547e-17	0.102376	-0.000000	discard	Final K=0.05 refinement	manual	k005_refine_final	0	0.000602
exp11857	4.46546993e-29	0.000000	0.000000	discard	cycle 87 u=0.1000	agent0	initial_cond	0	-0.000000
exp11858	4.46546993e-29	0.000000	0.000000	discard	cycle 87 u=0.1000	agent0	initial_cond	0	-0.000000
exp11858	2.82148497e-17	0.106907	-0.000000	discard	Final K=0.05 refinement	manual	k005_refine_final	0	0.000731
exp11859	4.46546993e-29	0.000000	0.000000	discard	cycle 87 u=0.1000	agent0	initial_cond	0	-0.000000
exp11860	1.02528508e-16	0.111421	0.000000	discard	Final K=0.05 refinement	manual	k005_refine_final	0	0.000877
exp11861	4.08106752e-29	0.000000	0.000000	discard	cycle 87 u=0.1000	agent0	initial_cond	1	-0.000000
exp11862	5.33992721e-16	0.097831	-0.000000	discard	Final K=0.05 refinement	manual	k005_refine_final	0	0.000490
exp11862	4.08106752e-29	0.000000	0.000000	discard	cycle 87 u=0.1000	agent0	initial_cond	0	-0.000000
exp11863	4.08106752e-29	0.000000	0.000000	discard	cycle 87 u=0.1000	agent0	initial_cond	0	-0.000000
exp11864	2.84094980e-16	0.102376	-0.000000	discard	Final K=0.05 refinement	manual	k005_refine_final	1	0.000602
exp11865	4.58623706e-29	0.000000	0.000000	discard	cycle 87 u=0.1000	agent0	initial_cond	0	-0.000000
exp11866	1.73212705e-16	0.106907	0.000000	discard	Final K=0.05 refinement	manual	k005_refine_final	0	0.000731
exp11866	4.58623706e-29	0.000000	0.000000	discard	cycle 87 u=0.1000	agent0	initial_cond	0	-0.000000
exp11867	4.58623706e-29	0.000000	0.000000	discard	cycle 87 u=0.1000	agent0	initial_cond	1	-0.000000
exp11868	6.83968878e-17	0.111421	-0.000000	discard	Final K=0.05 refinement	manual	k005_refine_final	1	0.000877
exp11869	4.39794337e-29	0.000000	0.000000	discard	cycle 87 u=0.1000	agent0	initial_cond	0	-0.000000
exp11870	2.67514219e-17	0.097831	-0.000000	discard	Final K=0.05 refinement	manual	k005_refine_final	0	0.000490
exp11871	4.39794337e-29	0.000000	0.000000	discard	cycle 87 u=0.1000	agent0	initial_cond	0	-0.000000
exp11872	4.39794337e-29	0.000000	0.000000	discard	cycle 87 u=0.1000	agent0	initial_cond	0	-0.000000
exp11872	8.32546447e-17	0.102376	-0.000000	discard	Final K=0.05 refinement	manual	k005_refine_final	0	0.000602
exp11873	1.36727475e-28	0.000000	0.000000	discard	cycle 87 u=0.1050	agent0	initial_cond	0	-0.000000
exp11874	3.84240678e-17	0.106907	-0.000000	discard	Final K=0.05 refinement	manual	k005_refine_final	0	0.000731
exp11875	1.36727475e-28	0.000000	0.000000	discard	cycle 87 u=0.1050	agent0	initial_cond	1	-0.000000
exp11876	3.40323831e-17	0.111421	-0.000000	discard	Final K=0.05 refinement	manual	k005_refine_final	0	0.000877
exp11876	1.36727475e-28	0.000000	0.000000	discard	cycle 87 u=0.1050	agent0	initial_cond	0	-0.000000
exp11877	6.14461376e-29	0.000000	0.000000	discard	cycle 87 u=0.1050	agent0	initial_cond	0	-0.000000
exp11878	7.87547131e-17	0.097831	-0.000000	discard	Final K=0.05 refinement	manual	k005_refine_final	1	0.000490
exp11879	6.14461376e-29	0.000000	0.000000	discard	cycle 87 u=0.1050	agent0	initial_cond	0	-0.000000
exp11880	5.24367656e-17	0.102376	-0.000000	discard	Final K=0.05 refinement	manual	k005_refine_final	0	0.000602
exp11881	6.14461376e-29	0.000000	0.000000	discard	cycle 87 u=0.1050	agent0	initial_cond	0	-0.000000
exp11882	1.75906666e-28	0.000000	0.000000	discard	cycle 87 u=0.1050	agent0	initial_cond	1	-0.000000
exp11882	6.81542365e-17	0.106907	-0.000000	discard	Final K=0.05 refinement	manual	k005_refine_final	1	0.000731
exp11883	1.75906666e-28	0.000000	0.000000	discard	cycle 87 u=0.1050	agent0	initial_cond	0	-0.000000
exp11884	1.30684783e-16	0.111421	-0.000000	discard	Final K=0.05 refinement	manual	k005_refine_final	0	0.000877
exp11885	1.75906666e-28	0.000000	0.000000	discard	cycle 87 u=0.1050	agent0	initial_cond	0	-0.000000
exp11886	1.11257917e-28	0.000000	0.000000	discard	cycle 87 u=0.1050	agent0	initial_cond	0	-0.000000
exp11886	4.97398538e-17	0.097831	-0.000000	discard	Final K=0.05 refinement	manual	k005_refine_final	0	0.000490
exp11887	1.11257917e-28	0.000000	0.000000	discard	cycle 87 u=0.1050	agent0	initial_cond	0	-0.000000
exp11888	2.45294547e-17	0.102376	-0.000000	discard	Final K=0.05 refinement	manual	k005_refine_final	0	0.000602
exp11889	1.11257917e-28	0.000000	0.000000	discard	cycle 87 u=0.1050	agent0	initial_cond	1	-0.000000
exp11890	2.82148497e-17	0.106907	-0.000000	discard	Final K=0.05 refinement	manual	k005_refine_final	0	0.000731
exp11890	8.58580947e-29	0.000000	0.000000	discard	cycle 88 u=0.0975	agent0	initial_cond	0	0.000000
exp11891	8.58580947e-29	0.000000	0.000000	discard	cycle 88 u=0.0975	agent0	initial_cond	0	0.000000
exp11892	1.02528508e-16	0.111421	0.000000	discard	Final K=0.05 refinement	manual	k005_refine_final	1	0.000877
exp11893	8.58580947e-29	0.000000	0.000000	discard	cycle 88 u=0.0975	agent0	initial_cond	0	0.000000
exp11894	5.33992721e-16	0.097831	-0.000000	discard	Final K=0.05 refinement	manual	k005_refine_final	0	0.000490
exp11895	5.23962023e-29	0.000000	0.000000	discard	cycle 88 u=0.0975	agent0	initial_cond	0	0.000000
exp11896	5.23962023e-29	0.000000	0.000000	discard	cycle 88 u=0.0975	agent0	initial_cond	1	0.000000
exp11896	2.84094980e-16	0.102376	-0.000000	discard	Final K=0.05 refinement	manual	k005_refine_final	1	0.000602
exp11897	5.23962023e-29	0.000000	0.000000	discard	cycle 88 u=0.0975	agent0	initial_cond	0	0.000000
exp11898	1.73212705e-16	0.106907	0.000000	discard	Final K=0.05 refinement	manual	k005_refine_final	0	0.000731
exp11899	4.03266298e-29	0.000000	0.000000	discard	cycle 88 u=0.0975	agent0	initial_cond	0	0.000000
exp11900	6.83968878e-17	0.111421	-0.000000	discard	Final K=0.05 refinement	manual	k005_refine_final	0	0.000877
exp11900	4.03266298e-29	0.000000	0.000000	discard	cycle 88 u=0.0975	agent0	initial_cond	0	0.000000
exp11901	4.03266298e-29	0.000000	0.000000	discard	cycle 88 u=0.0975	agent0	initial_cond	0	0.000000
exp11902	2.67514219e-17	0.097831	-0.000000	discard	Final K=0.05 refinement	manual	k005_refine_final	0	0.000490
exp11903	4.80015937e-29	0.000000	0.000000	discard	cycle 88 u=0.0975	agent0	initial_cond	1	0.000000
exp11904	8.32546447e-17	0.102376	-0.000000	discard	Final K=0.05 refinement	manual	k005_refine_final	0	0.000602
exp11905	4.80015937e-29	0.000000	0.000000	discard	cycle 88 u=0.0975	agent0	initial_cond	0	0.000000
exp11906	4.80015937e-29	0.000000	0.000000	discard	cycle 88 u=0.0975	agent0	initial_cond	0	0.000000
exp11907	3.84240678e-17	0.106907	-0.000000	discard	Final K=0.05 refinement	manual	k005_refine_final	1	0.000731
exp11908	2.68824537e-29	0.000000	0.000000	discard	cycle 88 u=0.0980	agent0	initial_cond	0	-0.000000
exp11909	3.40323831e-17	0.111421	-0.000000	discard	Final K=0.05 refinement	manual	k005_refine_final	0	0.000877
exp11910	2.68824537e-29	0.000000	0.000000	discard	cycle 88 u=0.0980	agent0	initial_cond	0	-0.000000
exp11911	2.68824537e-29	0.000000	0.000000	discard	cycle 88 u=0.0980	agent0	initial_cond	1	-0.000000
exp11911	7.87547131e-17	0.097831	-0.000000	discard	Final K=0.05 refinement	manual	k005_refine_final	1	0.000490
exp11912	6.16758073e-29	0.000000	0.000000	discard	cycle 88 u=0.0980	agent0	initial_cond	0	-0.000000
exp11913	5.24367656e-17	0.102376	-0.000000	discard	Final K=0.05 refinement	manual	k005_refine_final	0	0.000602
exp11914	6.16758073e-29	0.000000	0.000000	discard	cycle 88 u=0.0980	agent0	initial_cond	0	-0.000000
exp11915	6.81542365e-17	0.106907	-0.000000	discard	Final K=0.05 refinement	manual	k005_refine_final	0	0.000731
exp11915	6.16758073e-29	0.000000	0.000000	discard	cycle 88 u=0.0980	agent0	initial_cond	0	-0.000000
exp11916	2.01926478e-29	0.000000	0.000000	discard	cycle 88 u=0.0980	agent0	initial_cond	0	0.000000
exp11917	1.30684783e-16	0.111421	-0.000000	discard	Final K=0.05 refinement	manual	k005_refine_final	0	0.000877
exp11918	2.01926478e-29	0.000000	0.000000	discard	cycle 88 u=0.0980	agent0	initial_cond	1	0.000000
exp11919	4.97398538e-17	0.097831	-0.000000	discard	Final K=0.05 refinement	manual	k005_refine_final	0	0.000490
exp11920	2.01926478e-29	0.000000	0.000000	discard	cycle 88 u=0.0980	agent0	initial_cond	0	0.000000
exp11921	1.30310780e-28	0.000000	0.000000	discard	cycle 88 u=0.0980	agent0	initial_cond	0	-0.000000
exp11921	2.45294547e-17	0.102376	-0.000000	discard	Final K=0.05 refinement	manual	k005_refine_final	1	0.000602
exp11922	1.30310780e-28	0.000000	0.000000	discard	cycle 88 u=0.0980	agent0	initial_cond	0	-0.000000
exp11923	2.82148497e-17	0.106907	-0.000000	discard	Final K=0.05 refinement	manual	k005_refine_final	0	0.000731
exp11924	1.30310780e-28	0.000000	0.000000	discard	cycle 88 u=0.0980	agent0	initial_cond	0	-0.000000
exp11925	1.02528508e-16	0.111421	0.000000	discard	Final K=0.05 refinement	manual	k005_refine_final	1	0.000877
exp11925	5.45343271e-29	0.000000	0.000000	discard	cycle 88 u=0.0982	agent0	initial_cond	1	-0.000000
exp11926	5.45343271e-29	0.000000	0.000000	discard	cycle 88 u=0.0982	agent0	initial_cond	0	-0.000000
exp11927	5.33992721e-16	0.097831	-0.000000	discard	Final K=0.05 refinement	manual	k005_refine_final	0	0.000490
exp11928	5.45343271e-29	0.000000	0.000000	discard	cycle 88 u=0.0982	agent0	initial_cond	0	-0.000000
exp11929	2.84094980e-16	0.102376	-0.000000	discard	Final K=0.05 refinement	manual	k005_refine_final	0	0.000602
exp11930	1.23429977e-28	0.000000	0.000000	discard	cycle 88 u=0.0982	agent0	initial_cond	0	0.000000
exp11931	1.23429977e-28	0.000000	0.000000	discard	cycle 88 u=0.0982	agent0	initial_cond	0	0.000000
exp11932	1.73212705e-16	0.106907	0.000000	discard	Final K=0.05 refinement	manual	k005_refine_final	0	0.000731
exp11933	1.23429977e-28	0.000000	0.000000	discard	cycle 88 u=0.0982	agent0	initial_cond	1	0.000000
exp11934	6.83968878e-17	0.111421	-0.000000	discard	Final K=0.05 refinement	manual	k005_refine_final	0	0.000877
exp11935	1.88036672e-29	0.000000	0.000000	discard	cycle 88 u=0.0982	agent0	initial_cond	0	0.000000
exp11936	1.88036672e-29	0.000000	0.000000	discard	cycle 88 u=0.0982	agent0	initial_cond	0	0.000000
exp11937	1.88036672e-29	0.000000	0.000000	discard	cycle 88 u=0.0982	agent0	initial_cond	0	0.000000
exp11938	1.91190259e-29	0.000000	-0.000000	discard	cycle 88 u=0.0982	agent0	initial_cond	0	0.000000
exp11939	1.91190259e-29	0.000000	-0.000000	discard	cycle 88 u=0.0982	agent0	initial_cond	1	0.000000
exp11940	1.91190259e-29	0.000000	-0.000000	discard	cycle 88 u=0.0982	agent0	initial_cond	0	0.000000
exp11941	6.13049994e-29	0.000000	0.000000	discard	cycle 88 u=0.0985	agent0	initial_cond	0	0.000000
exp11942	6.13049994e-29	0.000000	0.000000	discard	cycle 88 u=0.0985	agent0	initial_cond	0	0.000000
exp11943	6.13049994e-29	0.000000	0.000000	discard	cycle 88 u=0.0985	agent0	initial_cond	0	0.000000
exp11944	5.49750971e-29	0.000000	0.000000	discard	cycle 88 u=0.0985	agent0	initial_cond	1	0.000000
exp11945	5.49750971e-29	0.000000	0.000000	discard	cycle 88 u=0.0985	agent0	initial_cond	0	0.000000
exp11946	5.49750971e-29	0.000000	0.000000	discard	cycle 88 u=0.0985	agent0	initial_cond	1	0.000000
exp11947	4.15642452e-29	0.000000	0.000000	discard	cycle 88 u=0.0985	agent0	initial_cond	0	0.000000
exp11948	4.15642452e-29	0.000000	0.000000	discard	cycle 88 u=0.0985	agent0	initial_cond	0	0.000000
exp11949	4.15642452e-29	0.000000	0.000000	discard	cycle 88 u=0.0985	agent0	initial_cond	1	0.000000
exp11950	2.19292611e-29	0.000000	0.000000	discard	cycle 88 u=0.0985	agent0	initial_cond	0	-0.000000
exp11951	2.19292611e-29	0.000000	0.000000	discard	cycle 88 u=0.0985	agent0	initial_cond	1	-0.000000
exp11952	2.19292611e-29	0.000000	0.000000	discard	cycle 88 u=0.0985	agent0	initial_cond	0	-0.000000
exp11953	4.22491788e-29	0.000000	0.000000	discard	cycle 88 u=0.0990	agent0	initial_cond	0	-0.000000
exp11954	4.22491788e-29	0.000000	0.000000	discard	cycle 88 u=0.0990	agent0	initial_cond	1	-0.000000
exp11955	4.22491788e-29	0.000000	0.000000	discard	cycle 88 u=0.0990	agent0	initial_cond	0	-0.000000
exp11956	3.22245147e-29	0.000000	0.000000	discard	cycle 88 u=0.0990	agent0	initial_cond	1	0.000000
exp11957	3.22245147e-29	0.000000	0.000000	discard	cycle 88 u=0.0990	agent0	initial_cond	0	0.000000
exp11958	3.22245147e-29	0.000000	0.000000	discard	cycle 88 u=0.0990	agent0	initial_cond	0	0.000000
exp11959	4.50941488e-29	0.000000	-0.000000	discard	cycle 88 u=0.0990	agent0	initial_cond	1	0.000000
exp11960	4.50941488e-29	0.000000	-0.000000	discard	cycle 88 u=0.0990	agent0	initial_cond	0	0.000000
exp11961	4.50941488e-29	0.000000	-0.000000	discard	cycle 88 u=0.0990	agent0	initial_cond	1	0.000000
exp11962	4.88330883e-29	0.000000	-0.000000	discard	cycle 88 u=0.0990	agent0	initial_cond	0	0.000000
exp11963	4.88330883e-29	0.000000	-0.000000	discard	cycle 88 u=0.0990	agent0	initial_cond	0	0.000000
exp11964	4.88330883e-29	0.000000	-0.000000	discard	cycle 88 u=0.0990	agent0	initial_cond	1	0.000000
exp11965	5.74085541e-29	0.000000	-0.000000	discard	cycle 88 u=0.0995	agent0	initial_cond	0	0.000000
exp11966	5.74085541e-29	0.000000	-0.000000	discard	cycle 88 u=0.0995	agent0	initial_cond	1	0.000000
exp11967	5.74085541e-29	0.000000	-0.000000	discard	cycle 88 u=0.0995	agent0	initial_cond	0	0.000000
exp11968	1.54984578e-28	0.000000	0.000000	discard	cycle 88 u=0.0995	agent0	initial_cond	0	-0.000000
exp11969	1.54984578e-28	0.000000	0.000000	discard	cycle 88 u=0.0995	agent0	initial_cond	1	-0.000000
exp11970	1.54984578e-28	0.000000	0.000000	discard	cycle 88 u=0.0995	agent0	initial_cond	0	-0.000000
exp11971	1.60328418e-29	0.000000	-0.000000	discard	cycle 88 u=0.0995	agent0	initial_cond	1	-0.000000
exp11972	1.60328418e-29	0.000000	-0.000000	discard	cycle 88 u=0.0995	agent0	initial_cond	0	-0.000000
exp11973	1.60328418e-29	0.000000	-0.000000	discard	cycle 88 u=0.0995	agent0	initial_cond	0	-0.000000
exp11974	2.42745501e-17	0.102376	-0.000000	discard	Reproduce breakthrough 6.18e-18	manual	reproduce_sota	1	0.000602
exp11974	7.34590618e-29	0.000000	0.000000	discard	cycle 88 u=0.0995	agent0	initial_cond	1	0.000000
exp11975	7.34590618e-29	0.000000	0.000000	discard	cycle 88 u=0.0995	agent0	initial_cond	0	0.000000
exp11976	7.34590618e-29	0.000000	0.000000	discard	cycle 88 u=0.0995	agent0	initial_cond	1	0.000000
exp11977	4.46546993e-29	0.000000	0.000000	discard	cycle 88 u=0.1000	agent0	initial_cond	0	-0.000000
exp11978	4.46546993e-29	0.000000	0.000000	discard	cycle 88 u=0.1000	agent0	initial_cond	0	-0.000000
exp11979	4.46546993e-29	0.000000	0.000000	discard	cycle 88 u=0.1000	agent0	initial_cond	1	-0.000000
exp11980	4.08106752e-29	0.000000	0.000000	discard	cycle 88 u=0.1000	agent0	initial_cond	0	-0.000000
exp11981	4.08106752e-29	0.000000	0.000000	discard	cycle 88 u=0.1000	agent0	initial_cond	1	-0.000000
exp11982	4.08106752e-29	0.000000	0.000000	discard	cycle 88 u=0.1000	agent0	initial_cond	0	-0.000000
exp11983	4.58623706e-29	0.000000	0.000000	discard	cycle 88 u=0.1000	agent0	initial_cond	0	-0.000000
exp11984	4.58623706e-29	0.000000	0.000000	discard	cycle 88 u=0.1000	agent0	initial_cond	1	-0.000000
exp11985	4.58623706e-29	0.000000	0.000000	discard	cycle 88 u=0.1000	agent0	initial_cond	0	-0.000000
exp11986	4.39794337e-29	0.000000	0.000000	discard	cycle 88 u=0.1000	agent0	initial_cond	1	-0.000000
exp11987	4.39794337e-29	0.000000	0.000000	discard	cycle 88 u=0.1000	agent0	initial_cond	0	-0.000000
exp11988	4.39794337e-29	0.000000	0.000000	discard	cycle 88 u=0.1000	agent0	initial_cond	0	-0.000000
exp11989	1.36727475e-28	0.000000	0.000000	discard	cycle 88 u=0.1050	agent0	initial_cond	1	-0.000000
exp11990	1.36727475e-28	0.000000	0.000000	discard	cycle 88 u=0.1050	agent0	initial_cond	0	-0.000000
exp11991	1.36727475e-28	0.000000	0.000000	discard	cycle 88 u=0.1050	agent0	initial_cond	1	-0.000000
exp11992	6.14461376e-29	0.000000	0.000000	discard	cycle 88 u=0.1050	agent0	initial_cond	0	-0.000000
exp11993	6.14461376e-29	0.000000	0.000000	discard	cycle 88 u=0.1050	agent0	initial_cond	0	-0.000000
exp11994	6.14461376e-29	0.000000	0.000000	discard	cycle 88 u=0.1050	agent0	initial_cond	1	-0.000000
exp11995	1.75906666e-28	0.000000	0.000000	discard	cycle 88 u=0.1050	agent0	initial_cond	0	-0.000000
exp11996	1.75906666e-28	0.000000	0.000000	discard	cycle 88 u=0.1050	agent0	initial_cond	1	-0.000000
exp11997	1.75906666e-28	0.000000	0.000000	discard	cycle 88 u=0.1050	agent0	initial_cond	0	-0.000000
exp11998	1.11257917e-28	0.000000	0.000000	discard	cycle 88 u=0.1050	agent0	initial_cond	0	-0.000000
exp11999	1.11257917e-28	0.000000	0.000000	discard	cycle 88 u=0.1050	agent0	initial_cond	1	-0.000000
exp12000	1.11257917e-28	0.000000	0.000000	discard	cycle 88 u=0.1050	agent0	initial_cond	0	-0.000000
exp12001	6.18472616e-18	0.011783	-0.000000	discard	Final breakthrough confirmation	manual	final_breakthrough	0	-0.000002
exp12002	8.58580947e-29	0.000000	0.000000	discard	cycle 89 u=0.0975	agent0	initial_cond	1	0.000000
exp12003	8.58580947e-29	0.000000	0.000000	discard	cycle 89 u=0.0975	agent0	initial_cond	0	0.000000
exp12004	8.58580947e-29	0.000000	0.000000	discard	cycle 89 u=0.0975	agent0	initial_cond	0	0.000000
exp12005	5.23962023e-29	0.000000	0.000000	discard	cycle 89 u=0.0975	agent0	initial_cond	1	0.000000
exp12006	5.23962023e-29	0.000000	0.000000	discard	cycle 89 u=0.0975	agent0	initial_cond	0	0.000000
exp12007	5.23962023e-29	0.000000	0.000000	discard	cycle 89 u=0.0975	agent0	initial_cond	1	0.000000
exp12008	4.03266298e-29	0.000000	0.000000	discard	cycle 89 u=0.0975	agent0	initial_cond	0	0.000000
exp12009	4.03266298e-29	0.000000	0.000000	discard	cycle 89 u=0.0975	agent0	initial_cond	0	0.000000
exp12010	4.03266298e-29	0.000000	0.000000	discard	cycle 89 u=0.0975	agent0	initial_cond	1	0.000000
exp12011	4.80015937e-29	0.000000	0.000000	discard	cycle 89 u=0.0975	agent0	initial_cond	0	0.000000
exp12012	4.80015937e-29	0.000000	0.000000	discard	cycle 89 u=0.0975	agent0	initial_cond	1	0.000000
exp12013	4.80015937e-29	0.000000	0.000000	discard	cycle 89 u=0.0975	agent0	initial_cond	0	0.000000
exp12014	2.68824537e-29	0.000000	0.000000	discard	cycle 89 u=0.0980	agent0	initial_cond	0	-0.000000
exp12015	2.68824537e-29	0.000000	0.000000	discard	cycle 89 u=0.0980	agent0	initial_cond	1	-0.000000
exp12016	2.68824537e-29	0.000000	0.000000	discard	cycle 89 u=0.0980	agent0	initial_cond	0	-0.000000
exp12017	6.16758073e-29	0.000000	0.000000	discard	cycle 89 u=0.0980	agent0	initial_cond	1	-0.000000
exp12018	6.16758073e-29	0.000000	0.000000	discard	cycle 89 u=0.0980	agent0	initial_cond	0	-0.000000
exp12019	6.16758073e-29	0.000000	0.000000	discard	cycle 89 u=0.0980	agent0	initial_cond	0	-0.000000
exp12020	2.01926478e-29	0.000000	0.000000	discard	cycle 89 u=0.0980	agent0	initial_cond	1	0.000000
exp12021	2.01926478e-29	0.000000	0.000000	discard	cycle 89 u=0.0980	agent0	initial_cond	0	0.000000
exp12022	2.01926478e-29	0.000000	0.000000	discard	cycle 89 u=0.0980	agent0	initial_cond	1	0.000000
