exp_id	residual	solution_norm	solution_mean	status	description	agent	design	elapsed_s	solution_energy
exp9646	4.59121804e-15	0.070278	-0.000000	discard	3D grid u=0.35 amp=0.35 p=0.6	manual	memory	1	0.000097
exp9647	1.23429977e-28	0.000000	0.000000	discard	cycle 68 u=0.0982	agent0	initial_cond	0	0.000000
exp9648	2.67787129e-16	0.070278	-0.000000	discard	3D grid u=0.35 amp=0.35 p=1.2	manual	memory	0	0.000097
exp9649	1.23429977e-28	0.000000	0.000000	discard	cycle 68 u=0.0982	agent0	initial_cond	0	0.000000
exp9650	9.91644520e-17	0.070278	-0.000000	discard	3D grid u=0.35 amp=0.35 p=1.8	manual	memory	1	0.000097
exp9651	1.88036672e-29	0.000000	0.000000	discard	cycle 68 u=0.0982	agent0	initial_cond	1	0.000000
exp9652	3.62223497e-17	0.070278	-0.000000	discard	3D grid u=0.35 amp=0.35 p=2.4	manual	memory	0	0.000097
exp9653	1.88036672e-29	0.000000	0.000000	discard	cycle 68 u=0.0982	agent0	initial_cond	0	0.000000
exp9654	1.88036672e-29	0.000000	0.000000	discard	cycle 68 u=0.0982	agent0	initial_cond	0	0.000000
exp9654	2.11043589e-25	0.000000	0.000000	discard	3D grid u=0.35 amp=0.40 p=0.0	manual	memory	0	0.000000
exp9655	1.91190259e-29	0.000000	-0.000000	discard	cycle 68 u=0.0982	agent0	initial_cond	0	0.000000
exp9656	8.79039736e-17	0.070278	-0.000000	discard	3D grid u=0.35 amp=0.40 p=0.6	manual	memory	0	0.000097
exp9657	1.91190259e-29	0.000000	-0.000000	discard	cycle 68 u=0.0982	agent0	initial_cond	0	0.000000
exp9658	4.50875384e-15	0.070278	-0.000000	discard	3D grid u=0.35 amp=0.40 p=1.2	manual	memory	0	0.000097
exp9659	1.91190259e-29	0.000000	-0.000000	discard	cycle 68 u=0.0982	agent0	initial_cond	1	0.000000
exp9660	5.96582006e-17	0.070278	-0.000000	discard	3D grid u=0.35 amp=0.40 p=1.8	manual	memory	0	0.000097
exp9661	6.13049994e-29	0.000000	0.000000	discard	cycle 68 u=0.0985	agent0	initial_cond	0	0.000000
exp9662	6.13049994e-29	0.000000	0.000000	discard	cycle 68 u=0.0985	agent0	initial_cond	0	0.000000
exp9662	5.63024466e-17	0.070278	-0.000000	discard	3D grid u=0.35 amp=0.40 p=2.4	manual	memory	0	0.000097
exp9663	6.13049994e-29	0.000000	0.000000	discard	cycle 68 u=0.0985	agent0	initial_cond	0	0.000000
exp9664	3.03736497e-21	0.000000	-0.000000	discard	3D grid u=0.35 amp=0.45 p=0.0	manual	memory	0	-0.000000
exp9665	5.49750971e-29	0.000000	0.000000	discard	cycle 68 u=0.0985	agent0	initial_cond	0	0.000000
exp9666	4.00748002e-17	0.070278	-0.000000	discard	3D grid u=0.35 amp=0.45 p=0.6	manual	memory	0	0.000097
exp9667	5.49750971e-29	0.000000	0.000000	discard	cycle 68 u=0.0985	agent0	initial_cond	1	0.000000
exp9668	2.05676028e-17	0.070278	-0.000000	discard	3D grid u=0.35 amp=0.45 p=1.2	manual	memory	0	0.000097
exp9669	5.49750971e-29	0.000000	0.000000	discard	cycle 68 u=0.0985	agent0	initial_cond	0	0.000000
exp9670	2.04019503e-16	0.070278	-0.000000	discard	3D grid u=0.35 amp=0.45 p=1.8	manual	memory	0	0.000097
exp9670	4.15642452e-29	0.000000	0.000000	discard	cycle 68 u=0.0985	agent0	initial_cond	0	0.000000
exp9671	4.15642452e-29	0.000000	0.000000	discard	cycle 68 u=0.0985	agent0	initial_cond	1	0.000000
exp9672	5.70600706e-17	0.070278	-0.000000	discard	3D grid u=0.35 amp=0.45 p=2.4	manual	memory	0	0.000097
exp9673	4.15642452e-29	0.000000	0.000000	discard	cycle 68 u=0.0985	agent0	initial_cond	0	0.000000
exp9674	2.39955392e-28	0.000000	-0.000000	discard	3D grid u=0.35 amp=0.50 p=0.0	manual	memory	0	0.000000
exp9675	2.19292611e-29	0.000000	0.000000	discard	cycle 68 u=0.0985	agent0	initial_cond	1	-0.000000
exp9676	1.04205024e-16	0.070278	-0.000000	discard	3D grid u=0.35 amp=0.50 p=0.6	manual	memory	0	0.000097
exp9677	2.19292611e-29	0.000000	0.000000	discard	cycle 68 u=0.0985	agent0	initial_cond	0	-0.000000
exp9678	2.70269823e-17	0.070278	-0.000000	discard	3D grid u=0.35 amp=0.50 p=1.2	manual	memory	0	0.000097
exp9678	2.19292611e-29	0.000000	0.000000	discard	cycle 68 u=0.0985	agent0	initial_cond	0	-0.000000
exp9679	4.22491788e-29	0.000000	0.000000	discard	cycle 68 u=0.0990	agent0	initial_cond	1	-0.000000
exp9679	2.66815046e-15	0.070278	-0.000000	discard	3D grid u=0.35 amp=0.50 p=1.8	manual	memory	1	0.000097
exp9680	4.22491788e-29	0.000000	0.000000	discard	cycle 68 u=0.0990	agent0	initial_cond	0	-0.000000
exp9681	2.58409485e-17	0.070278	-0.000000	discard	3D grid u=0.35 amp=0.50 p=2.4	manual	memory	0	0.000097
exp9682	4.22491788e-29	0.000000	0.000000	discard	cycle 68 u=0.0990	agent0	initial_cond	1	-0.000000
exp9683	2.24513790e-24	0.000000	-0.000000	discard	3D grid u=0.35 amp=0.55 p=0.0	manual	memory	1	0.000000
exp9684	3.22245147e-29	0.000000	0.000000	discard	cycle 68 u=0.0990	agent0	initial_cond	0	0.000000
exp9685	7.26834055e-17	0.070278	-0.000000	discard	3D grid u=0.35 amp=0.55 p=0.6	manual	memory	0	0.000097
exp9686	3.22245147e-29	0.000000	0.000000	discard	cycle 68 u=0.0990	agent0	initial_cond	0	0.000000
exp9687	3.22245147e-29	0.000000	0.000000	discard	cycle 68 u=0.0990	agent0	initial_cond	1	0.000000
exp9687	3.13420412e-17	0.070278	-0.000000	discard	3D grid u=0.35 amp=0.55 p=1.2	manual	memory	1	0.000097
exp9688	4.50941488e-29	0.000000	-0.000000	discard	cycle 68 u=0.0990	agent0	initial_cond	0	0.000000
exp9689	4.92798439e-17	0.070278	-0.000000	discard	3D grid u=0.35 amp=0.55 p=1.8	manual	memory	0	0.000097
exp9690	4.50941488e-29	0.000000	-0.000000	discard	cycle 68 u=0.0990	agent0	initial_cond	0	0.000000
exp9691	4.29997147e-17	0.070278	-0.000000	discard	3D grid u=0.35 amp=0.55 p=2.4	manual	memory	1	0.000097
exp9692	4.50941488e-29	0.000000	-0.000000	discard	cycle 68 u=0.0990	agent0	initial_cond	0	0.000000
exp9693	4.88330883e-29	0.000000	-0.000000	discard	cycle 68 u=0.0990	agent0	initial_cond	0	0.000000
exp9694	4.88330883e-29	0.000000	-0.000000	discard	cycle 68 u=0.0990	agent0	initial_cond	1	0.000000
exp9695	4.88330883e-29	0.000000	-0.000000	discard	cycle 68 u=0.0990	agent0	initial_cond	0	0.000000
exp9696	5.74085541e-29	0.000000	-0.000000	discard	cycle 68 u=0.0995	agent0	initial_cond	0	0.000000
exp9697	5.74085541e-29	0.000000	-0.000000	discard	cycle 68 u=0.0995	agent0	initial_cond	0	0.000000
exp9698	5.74085541e-29	0.000000	-0.000000	discard	cycle 68 u=0.0995	agent0	initial_cond	0	0.000000
exp9699	1.54984578e-28	0.000000	0.000000	discard	cycle 68 u=0.0995	agent0	initial_cond	1	-0.000000
exp9700	1.54984578e-28	0.000000	0.000000	discard	cycle 68 u=0.0995	agent0	initial_cond	0	-0.000000
exp9701	1.54984578e-28	0.000000	0.000000	discard	cycle 68 u=0.0995	agent0	initial_cond	0	-0.000000
exp9702	1.60328418e-29	0.000000	-0.000000	discard	cycle 68 u=0.0995	agent0	initial_cond	1	-0.000000
exp9703	1.60328418e-29	0.000000	-0.000000	discard	cycle 68 u=0.0995	agent0	initial_cond	0	-0.000000
exp9704	1.60328418e-29	0.000000	-0.000000	discard	cycle 68 u=0.0995	agent0	initial_cond	1	-0.000000
exp9705	7.34590618e-29	0.000000	0.000000	discard	cycle 68 u=0.0995	agent0	initial_cond	0	0.000000
exp9706	7.34590618e-29	0.000000	0.000000	discard	cycle 68 u=0.0995	agent0	initial_cond	0	0.000000
exp9707	7.34590618e-29	0.000000	0.000000	discard	cycle 68 u=0.0995	agent0	initial_cond	1	0.000000
exp9708	4.46546993e-29	0.000000	0.000000	discard	cycle 68 u=0.1000	agent0	initial_cond	0	-0.000000
exp9709	4.46546993e-29	0.000000	0.000000	discard	cycle 68 u=0.1000	agent0	initial_cond	0	-0.000000
exp9710	4.46546993e-29	0.000000	0.000000	discard	cycle 68 u=0.1000	agent0	initial_cond	0	-0.000000
exp9711	4.08106752e-29	0.000000	0.000000	discard	cycle 68 u=0.1000	agent0	initial_cond	0	-0.000000
exp9712	4.08106752e-29	0.000000	0.000000	discard	cycle 68 u=0.1000	agent0	initial_cond	1	-0.000000
exp9713	4.08106752e-29	0.000000	0.000000	discard	cycle 68 u=0.1000	agent0	initial_cond	0	-0.000000
exp9714	4.58623706e-29	0.000000	0.000000	discard	cycle 68 u=0.1000	agent0	initial_cond	0	-0.000000
exp9715	4.58623706e-29	0.000000	0.000000	discard	cycle 68 u=0.1000	agent0	initial_cond	0	-0.000000
exp9716	4.58623706e-29	0.000000	0.000000	discard	cycle 68 u=0.1000	agent0	initial_cond	0	-0.000000
exp9717	4.39794337e-29	0.000000	0.000000	discard	cycle 68 u=0.1000	agent0	initial_cond	1	-0.000000
exp9718	4.39794337e-29	0.000000	0.000000	discard	cycle 68 u=0.1000	agent0	initial_cond	0	-0.000000
exp9719	4.39794337e-29	0.000000	0.000000	discard	cycle 68 u=0.1000	agent0	initial_cond	0	-0.000000
exp9720	1.36727475e-28	0.000000	0.000000	discard	cycle 68 u=0.1050	agent0	initial_cond	0	-0.000000
exp9721	1.36727475e-28	0.000000	0.000000	discard	cycle 68 u=0.1050	agent0	initial_cond	0	-0.000000
exp9722	1.36727475e-28	0.000000	0.000000	discard	cycle 68 u=0.1050	agent0	initial_cond	1	-0.000000
exp9723	6.14461376e-29	0.000000	0.000000	discard	cycle 68 u=0.1050	agent0	initial_cond	0	-0.000000
exp9724	6.14461376e-29	0.000000	0.000000	discard	cycle 68 u=0.1050	agent0	initial_cond	0	-0.000000
exp9725	6.14461376e-29	0.000000	0.000000	discard	cycle 68 u=0.1050	agent0	initial_cond	1	-0.000000
exp9726	1.75906666e-28	0.000000	0.000000	discard	cycle 68 u=0.1050	agent0	initial_cond	0	-0.000000
exp9727	1.75906666e-28	0.000000	0.000000	discard	cycle 68 u=0.1050	agent0	initial_cond	1	-0.000000
exp9728	1.75906666e-28	0.000000	0.000000	discard	cycle 68 u=0.1050	agent0	initial_cond	0	-0.000000
exp9729	1.11257917e-28	0.000000	0.000000	discard	cycle 68 u=0.1050	agent0	initial_cond	0	-0.000000
exp9730	1.11257917e-28	0.000000	0.000000	discard	cycle 68 u=0.1050	agent0	initial_cond	1	-0.000000
exp9731	1.11257917e-28	0.000000	0.000000	discard	cycle 68 u=0.1050	agent0	initial_cond	0	-0.000000
exp9732	8.58580947e-29	0.000000	0.000000	discard	cycle 69 u=0.0975	agent0	initial_cond	0	0.000000
exp9733	8.58580947e-29	0.000000	0.000000	discard	cycle 69 u=0.0975	agent0	initial_cond	0	0.000000
exp9734	8.58580947e-29	0.000000	0.000000	discard	cycle 69 u=0.0975	agent0	initial_cond	0	0.000000
exp9735	5.23962023e-29	0.000000	0.000000	discard	cycle 69 u=0.0975	agent0	initial_cond	1	0.000000
exp9736	5.23962023e-29	0.000000	0.000000	discard	cycle 69 u=0.0975	agent0	initial_cond	0	0.000000
exp9737	5.23962023e-29	0.000000	0.000000	discard	cycle 69 u=0.0975	agent0	initial_cond	0	0.000000
exp9738	4.03266298e-29	0.000000	0.000000	discard	cycle 69 u=0.0975	agent0	initial_cond	0	0.000000
exp9739	4.03266298e-29	0.000000	0.000000	discard	cycle 69 u=0.0975	agent0	initial_cond	0	0.000000
exp9740	4.03266298e-29	0.000000	0.000000	discard	cycle 69 u=0.0975	agent0	initial_cond	1	0.000000
exp9741	4.80015937e-29	0.000000	0.000000	discard	cycle 69 u=0.0975	agent0	initial_cond	0	0.000000
exp9742	4.80015937e-29	0.000000	0.000000	discard	cycle 69 u=0.0975	agent0	initial_cond	0	0.000000
exp9743	4.80015937e-29	0.000000	0.000000	discard	cycle 69 u=0.0975	agent0	initial_cond	1	0.000000
exp9744	2.68824537e-29	0.000000	0.000000	discard	cycle 69 u=0.0980	agent0	initial_cond	0	-0.000000
exp9745	7.79962053e-17	0.070278	-0.000000	discard	Broad u_offset sweep u=0.00 amp=0.44 p=1.23	manual	memory	1	0.000097
exp9745	2.68824537e-29	0.000000	0.000000	discard	cycle 69 u=0.0980	agent0	initial_cond	1	-0.000000
exp9746	2.68824537e-29	0.000000	0.000000	discard	cycle 69 u=0.0980	agent0	initial_cond	0	-0.000000
exp9747	7.80501147e-17	0.070278	-0.000000	discard	Broad u_offset sweep u=0.05 amp=0.44 p=1.23	manual	memory	0	0.000097
exp9748	6.16758073e-29	0.000000	0.000000	discard	cycle 69 u=0.0980	agent0	initial_cond	0	-0.000000
exp9749	2.66672514e-17	0.070278	-0.000000	discard	Broad u_offset sweep u=0.10 amp=0.44 p=1.23	manual	memory	1	0.000097
exp9750	6.16758073e-29	0.000000	0.000000	discard	cycle 69 u=0.0980	agent0	initial_cond	1	-0.000000
exp9751	6.16758073e-29	0.000000	0.000000	discard	cycle 69 u=0.0980	agent0	initial_cond	0	-0.000000
exp9751	6.37477373e-16	0.070278	-0.000000	discard	Broad u_offset sweep u=0.15 amp=0.44 p=1.23	manual	memory	0	0.000097
exp9752	2.01926478e-29	0.000000	0.000000	discard	cycle 69 u=0.0980	agent0	initial_cond	0	0.000000
exp9753	1.84686438e-17	0.070278	-0.000000	discard	Broad u_offset sweep u=0.20 amp=0.44 p=1.23	manual	memory	1	0.000097
exp9754	2.01926478e-29	0.000000	0.000000	discard	cycle 69 u=0.0980	agent0	initial_cond	0	0.000000
exp9755	1.02653324e-16	0.070278	-0.000000	discard	Broad u_offset sweep u=0.25 amp=0.44 p=1.23	manual	memory	0	0.000097
exp9755	2.01926478e-29	0.000000	0.000000	discard	cycle 69 u=0.0980	agent0	initial_cond	0	0.000000
exp9756	1.30310780e-28	0.000000	0.000000	discard	cycle 69 u=0.0980	agent0	initial_cond	1	-0.000000
exp9757	1.38938445e-16	0.070278	-0.000000	discard	Broad u_offset sweep u=0.30 amp=0.44 p=1.23	manual	memory	0	0.000097
exp9758	1.30310780e-28	0.000000	0.000000	discard	cycle 69 u=0.0980	agent0	initial_cond	0	-0.000000
exp9759	3.50928251e-17	0.070278	-0.000000	discard	Broad u_offset sweep u=0.35 amp=0.44 p=1.23	manual	memory	0	0.000097
exp9760	1.30310780e-28	0.000000	0.000000	discard	cycle 69 u=0.0980	agent0	initial_cond	0	-0.000000
exp9761	5.45343271e-29	0.000000	0.000000	discard	cycle 69 u=0.0982	agent0	initial_cond	0	-0.000000
exp9762	3.84319472e-17	0.070278	-0.000000	discard	Broad u_offset sweep u=0.40 amp=0.44 p=1.23	manual	memory	0	0.000097
exp9763	5.45343271e-29	0.000000	0.000000	discard	cycle 69 u=0.0982	agent0	initial_cond	0	-0.000000
exp9764	3.47002133e-16	0.070278	-0.000000	discard	Broad u_offset sweep u=0.45 amp=0.44 p=1.23	manual	memory	0	0.000097
exp9765	5.45343271e-29	0.000000	0.000000	discard	cycle 69 u=0.0982	agent0	initial_cond	1	-0.000000
exp9766	1.23429977e-28	0.000000	0.000000	discard	cycle 69 u=0.0982	agent0	initial_cond	0	0.000000
exp9766	7.46498362e-16	1.001296	-1.000019	discard	Broad u_offset sweep u=0.50 amp=0.44 p=1.23	manual	memory	0	-1.520844
exp9767	1.23429977e-28	0.000000	0.000000	discard	cycle 69 u=0.0982	agent0	initial_cond	0	0.000000
exp9768	1.23429977e-28	0.000000	0.000000	discard	cycle 69 u=0.0982	agent0	initial_cond	0	0.000000
exp9769	1.88036672e-29	0.000000	0.000000	discard	cycle 69 u=0.0982	agent0	initial_cond	0	0.000000
exp9770	1.88036672e-29	0.000000	0.000000	discard	cycle 69 u=0.0982	agent0	initial_cond	1	0.000000
exp9771	1.88036672e-29	0.000000	0.000000	discard	cycle 69 u=0.0982	agent0	initial_cond	0	0.000000
exp9772	1.91190259e-29	0.000000	-0.000000	discard	cycle 69 u=0.0982	agent0	initial_cond	0	0.000000
exp9773	1.91190259e-29	0.000000	-0.000000	discard	cycle 69 u=0.0982	agent0	initial_cond	1	0.000000
exp9774	1.91190259e-29	0.000000	-0.000000	discard	cycle 69 u=0.0982	agent0	initial_cond	0	0.000000
exp9775	6.13049994e-29	0.000000	0.000000	discard	cycle 69 u=0.0985	agent0	initial_cond	1	0.000000
exp9776	6.13049994e-29	0.000000	0.000000	discard	cycle 69 u=0.0985	agent0	initial_cond	0	0.000000
exp9777	6.13049994e-29	0.000000	0.000000	discard	cycle 69 u=0.0985	agent0	initial_cond	0	0.000000
exp9778	5.49750971e-29	0.000000	0.000000	discard	cycle 69 u=0.0985	agent0	initial_cond	1	0.000000
exp9779	5.49750971e-29	0.000000	0.000000	discard	cycle 69 u=0.0985	agent0	initial_cond	0	0.000000
exp9780	5.49750971e-29	0.000000	0.000000	discard	cycle 69 u=0.0985	agent0	initial_cond	0	0.000000
exp9781	4.15642452e-29	0.000000	0.000000	discard	cycle 69 u=0.0985	agent0	initial_cond	0	0.000000
exp9782	4.15642452e-29	0.000000	0.000000	discard	cycle 69 u=0.0985	agent0	initial_cond	0	0.000000
exp9783	4.15642452e-29	0.000000	0.000000	discard	cycle 69 u=0.0985	agent0	initial_cond	1	0.000000
exp9784	2.19292611e-29	0.000000	0.000000	discard	cycle 69 u=0.0985	agent0	initial_cond	0	-0.000000
exp9785	2.39104890e-17	0.070278	-0.000000	discard	Alternative optimum u=0.19 amp=0.40 p=1.1	manual	memory	0	0.000097
exp9785	2.19292611e-29	0.000000	0.000000	discard	cycle 69 u=0.0985	agent0	initial_cond	0	-0.000000
exp9786	2.19292611e-29	0.000000	0.000000	discard	cycle 69 u=0.0985	agent0	initial_cond	0	-0.000000
exp9787	6.49999665e-15	0.070278	-0.000000	discard	Alternative optimum u=0.19 amp=0.40 p=1.15	manual	memory	0	0.000097
exp9788	4.22491788e-29	0.000000	0.000000	discard	cycle 69 u=0.0990	agent0	initial_cond	0	-0.000000
exp9789	5.33905464e-15	0.070278	-0.000000	discard	Alternative optimum u=0.19 amp=0.40 p=1.2	manual	memory	0	0.000097
exp9790	4.22491788e-29	0.000000	0.000000	discard	cycle 69 u=0.0990	agent0	initial_cond	1	-0.000000
exp9791	4.26517137e-15	0.070278	-0.000000	discard	Alternative optimum u=0.19 amp=0.40 p=1.25	manual	memory	0	0.000097
exp9792	4.22491788e-29	0.000000	0.000000	discard	cycle 69 u=0.0990	agent0	initial_cond	0	-0.000000
exp9793	3.32841822e-15	0.070278	-0.000000	discard	Alternative optimum u=0.19 amp=0.40 p=1.3	manual	memory	0	0.000097
exp9793	3.22245147e-29	0.000000	0.000000	discard	cycle 69 u=0.0990	agent0	initial_cond	0	0.000000
exp9794	3.22245147e-29	0.000000	0.000000	discard	cycle 69 u=0.0990	agent0	initial_cond	1	0.000000
exp9795	1.66481117e-17	0.070278	-0.000000	discard	Alternative optimum u=0.19 amp=0.42 p=1.1	manual	memory	0	0.000097
exp9796	3.22245147e-29	0.000000	0.000000	discard	cycle 69 u=0.0990	agent0	initial_cond	0	0.000000
exp9797	4.54430026e-17	0.070278	-0.000000	discard	Alternative optimum u=0.19 amp=0.42 p=1.15	manual	memory	0	0.000097
exp9798	4.50941488e-29	0.000000	-0.000000	discard	cycle 69 u=0.0990	agent0	initial_cond	1	0.000000
exp9799	2.56283474e-17	0.070278	-0.000000	discard	Alternative optimum u=0.19 amp=0.42 p=1.2	manual	memory	0	0.000097
exp9800	4.50941488e-29	0.000000	-0.000000	discard	cycle 69 u=0.0990	agent0	initial_cond	0	0.000000
exp9801	4.50941488e-29	0.000000	-0.000000	discard	cycle 69 u=0.0990	agent0	initial_cond	0	0.000000
exp9801	3.60514908e-17	0.070278	-0.000000	discard	Alternative optimum u=0.19 amp=0.42 p=1.25	manual	memory	0	0.000097
exp9802	4.88330883e-29	0.000000	-0.000000	discard	cycle 69 u=0.0990	agent0	initial_cond	1	0.000000
exp9803	4.29157567e-17	0.070278	-0.000000	discard	Alternative optimum u=0.19 amp=0.42 p=1.3	manual	memory	0	0.000097
exp9804	4.88330883e-29	0.000000	-0.000000	discard	cycle 69 u=0.0990	agent0	initial_cond	0	0.000000
exp9805	2.18158090e-17	0.070278	-0.000000	discard	Alternative optimum u=0.19 amp=0.44 p=1.1	manual	memory	0	0.000097
exp9806	4.88330883e-29	0.000000	-0.000000	discard	cycle 69 u=0.0990	agent0	initial_cond	1	0.000000
exp9807	9.99408707e-18	0.070278	-0.000000	discard	Alternative optimum u=0.19 amp=0.44 p=1.15	manual	memory	0	0.000097
exp9808	5.74085541e-29	0.000000	-0.000000	discard	cycle 69 u=0.0995	agent0	initial_cond	0	0.000000
exp9809	5.74085541e-29	0.000000	-0.000000	discard	cycle 69 u=0.0995	agent0	initial_cond	0	0.000000
exp9809	3.74170674e-17	0.070278	-0.000000	discard	Alternative optimum u=0.19 amp=0.44 p=1.2	manual	memory	0	0.000097
exp9810	5.74085541e-29	0.000000	-0.000000	discard	cycle 69 u=0.0995	agent0	initial_cond	1	0.000000
exp9811	7.19963742e-17	0.070278	-0.000000	discard	Alternative optimum u=0.19 amp=0.44 p=1.25	manual	memory	0	0.000097
exp9812	1.54984578e-28	0.000000	0.000000	discard	cycle 69 u=0.0995	agent0	initial_cond	0	-0.000000
exp9813	5.26590661e-17	0.070278	-0.000000	discard	Alternative optimum u=0.19 amp=0.44 p=1.3	manual	memory	0	0.000097
exp9814	1.54984578e-28	0.000000	0.000000	discard	cycle 69 u=0.0995	agent0	initial_cond	0	-0.000000
exp9815	1.08946382e-16	0.070278	-0.000000	discard	Alternative optimum u=0.19 amp=0.46 p=1.1	manual	memory	1	0.000097
exp9816	1.54984578e-28	0.000000	0.000000	discard	cycle 69 u=0.0995	agent0	initial_cond	0	-0.000000
exp9817	8.43319793e-17	0.070278	-0.000000	discard	Alternative optimum u=0.19 amp=0.46 p=1.15	manual	memory	0	0.000097
exp9817	1.60328418e-29	0.000000	-0.000000	discard	cycle 69 u=0.0995	agent0	initial_cond	0	-0.000000
exp9818	1.60328418e-29	0.000000	-0.000000	discard	cycle 69 u=0.0995	agent0	initial_cond	1	-0.000000
exp9819	2.81151328e-17	0.070278	-0.000000	discard	Alternative optimum u=0.19 amp=0.46 p=1.2	manual	memory	1	0.000097
exp9820	1.60328418e-29	0.000000	-0.000000	discard	cycle 69 u=0.0995	agent0	initial_cond	0	-0.000000
exp9821	1.58716768e-17	0.070278	-0.000000	discard	Alternative optimum u=0.19 amp=0.46 p=1.25	manual	memory	0	0.000097
exp9822	7.34590618e-29	0.000000	0.000000	discard	cycle 69 u=0.0995	agent0	initial_cond	0	0.000000
exp9823	9.99871684e-17	0.070278	-0.000000	discard	Alternative optimum u=0.19 amp=0.46 p=1.3	manual	memory	1	0.000097
exp9824	7.34590618e-29	0.000000	0.000000	discard	cycle 69 u=0.0995	agent0	initial_cond	0	0.000000
exp9825	7.34590618e-29	0.000000	0.000000	discard	cycle 69 u=0.0995	agent0	initial_cond	0	0.000000
exp9825	2.64854825e-17	0.070278	-0.000000	discard	Alternative optimum u=0.19 amp=0.48 p=1.1	manual	memory	0	0.000097
exp9826	4.46546993e-29	0.000000	0.000000	discard	cycle 69 u=0.1000	agent0	initial_cond	1	-0.000000
exp9827	7.12762017e-17	0.070278	-0.000000	discard	Alternative optimum u=0.19 amp=0.48 p=1.15	manual	memory	1	0.000097
exp9828	4.46546993e-29	0.000000	0.000000	discard	cycle 69 u=0.1000	agent0	initial_cond	0	-0.000000
exp9829	3.38394829e-17	0.070278	-0.000000	discard	Alternative optimum u=0.19 amp=0.48 p=1.2	manual	memory	0	0.000097
exp9830	4.46546993e-29	0.000000	0.000000	discard	cycle 69 u=0.1000	agent0	initial_cond	0	-0.000000
exp9831	5.93359651e-17	0.070278	-0.000000	discard	Alternative optimum u=0.19 amp=0.48 p=1.25	manual	memory	1	0.000097
exp9832	4.08106752e-29	0.000000	0.000000	discard	cycle 69 u=0.1000	agent0	initial_cond	0	-0.000000
exp9833	5.00235688e-17	0.070278	-0.000000	discard	Alternative optimum u=0.19 amp=0.48 p=1.3	manual	memory	0	0.000097
exp9833	4.08106752e-29	0.000000	0.000000	discard	cycle 69 u=0.1000	agent0	initial_cond	0	-0.000000
exp9834	4.08106752e-29	0.000000	0.000000	discard	cycle 69 u=0.1000	agent0	initial_cond	1	-0.000000
exp9835	1.62910232e-17	0.070278	-0.000000	discard	Alternative optimum u=0.195 amp=0.40 p=1.1	manual	memory	1	0.000097
exp9836	4.58623706e-29	0.000000	0.000000	discard	cycle 69 u=0.1000	agent0	initial_cond	0	-0.000000
exp9837	4.75024070e-17	0.070278	-0.000000	discard	Alternative optimum u=0.195 amp=0.40 p=1.15	manual	memory	0	0.000097
exp9838	4.58623706e-29	0.000000	0.000000	discard	cycle 69 u=0.1000	agent0	initial_cond	0	-0.000000
exp9839	2.73974120e-17	0.070278	-0.000000	discard	Alternative optimum u=0.195 amp=0.40 p=1.2	manual	memory	1	0.000097
exp9840	4.58623706e-29	0.000000	0.000000	discard	cycle 69 u=0.1000	agent0	initial_cond	0	-0.000000
