exp_id	residual	solution_norm	solution_mean	status	description	agent	design	elapsed_s	solution_energy
exp14457	1.11257917e-28	0.000000	0.000000	discard	cycle 111 u=0.1050	agent0	initial_cond	0	-0.000000
exp14458	8.58580947e-29	0.000000	0.000000	discard	cycle 112 u=0.0975	agent0	initial_cond	0	0.000000
exp14459	8.58580947e-29	0.000000	0.000000	discard	cycle 112 u=0.0975	agent0	initial_cond	1	0.000000
exp14460	8.58580947e-29	0.000000	0.000000	discard	cycle 112 u=0.0975	agent0	initial_cond	0	0.000000
exp14461	5.23962023e-29	0.000000	0.000000	discard	cycle 112 u=0.0975	agent0	initial_cond	1	0.000000
exp14462	5.23962023e-29	0.000000	0.000000	discard	cycle 112 u=0.0975	agent0	initial_cond	0	0.000000
exp14463	5.23962023e-29	0.000000	0.000000	discard	cycle 112 u=0.0975	agent0	initial_cond	0	0.000000
exp14464	4.03266298e-29	0.000000	0.000000	discard	cycle 112 u=0.0975	agent0	initial_cond	1	0.000000
exp14465	4.03266298e-29	0.000000	0.000000	discard	cycle 112 u=0.0975	agent0	initial_cond	0	0.000000
exp14466	4.03266298e-29	0.000000	0.000000	discard	cycle 112 u=0.0975	agent0	initial_cond	1	0.000000
exp14467	4.80015937e-29	0.000000	0.000000	discard	cycle 112 u=0.0975	agent0	initial_cond	0	0.000000
exp14468	4.80015937e-29	0.000000	0.000000	discard	cycle 112 u=0.0975	agent0	initial_cond	0	0.000000
exp14469	4.80015937e-29	0.000000	0.000000	discard	cycle 112 u=0.0975	agent0	initial_cond	0	0.000000
exp14470	2.68824537e-29	0.000000	0.000000	discard	cycle 112 u=0.0980	agent0	initial_cond	0	-0.000000
exp14471	2.68824537e-29	0.000000	0.000000	discard	cycle 112 u=0.0980	agent0	initial_cond	1	-0.000000
exp14472	4.24681748e-18	0.001438	-0.000000	discard	Round 8: Boundary u=0.46	agent1	boundary	1	-0.000000
exp14473	2.68824537e-29	0.000000	0.000000	discard	cycle 112 u=0.0980	agent0	initial_cond	0	-0.000000
exp14474	1.94396266e-17	0.001438	-0.000000	discard	Round 8: Boundary u=0.462	agent1	boundary	0	-0.000000
exp14475	6.16758073e-29	0.000000	0.000000	discard	cycle 112 u=0.0980	agent0	initial_cond	0	-0.000000
exp14476	4.20528922e-17	0.001438	-0.000000	discard	Round 8: Boundary u=0.463	agent1	boundary	1	-0.000000
exp14477	6.16758073e-29	0.000000	0.000000	discard	cycle 112 u=0.0980	agent0	initial_cond	0	-0.000000
exp14478	9.28717031e-17	0.001438	-0.000000	discard	Round 8: Boundary u=0.464	agent1	boundary	0	-0.000000
exp14479	6.16758073e-29	0.000000	0.000000	discard	cycle 112 u=0.0980	agent0	initial_cond	0	-0.000000
exp14480	2.05869529e-16	0.001438	-0.000000	discard	Round 8: Boundary u=0.465	agent1	boundary	0	-0.000000
exp14481	2.01926478e-29	0.000000	0.000000	discard	cycle 112 u=0.0980	agent0	initial_cond	1	0.000000
exp14482	2.01926478e-29	0.000000	0.000000	discard	cycle 112 u=0.0980	agent0	initial_cond	0	0.000000
exp14483	2.01926478e-29	0.000000	0.000000	discard	cycle 112 u=0.0980	agent0	initial_cond	1	0.000000
exp14484	1.30310780e-28	0.000000	0.000000	discard	cycle 112 u=0.0980	agent0	initial_cond	0	-0.000000
exp14485	1.30310780e-28	0.000000	0.000000	discard	cycle 112 u=0.0980	agent0	initial_cond	0	-0.000000
exp14486	1.30310780e-28	0.000000	0.000000	discard	cycle 112 u=0.0980	agent0	initial_cond	0	-0.000000
exp14487	5.45343271e-29	0.000000	0.000000	discard	cycle 112 u=0.0982	agent0	initial_cond	0	-0.000000
exp14488	5.45343271e-29	0.000000	0.000000	discard	cycle 112 u=0.0982	agent0	initial_cond	1	-0.000000
exp14489	5.45343271e-29	0.000000	0.000000	discard	cycle 112 u=0.0982	agent0	initial_cond	0	-0.000000
exp14490	1.23429977e-28	0.000000	0.000000	discard	cycle 112 u=0.0982	agent0	initial_cond	0	0.000000
exp14491	1.23429977e-28	0.000000	0.000000	discard	cycle 112 u=0.0982	agent0	initial_cond	0	0.000000
exp14492	1.23429977e-28	0.000000	0.000000	discard	cycle 112 u=0.0982	agent0	initial_cond	0	0.000000
exp14493	1.88036672e-29	0.000000	0.000000	discard	cycle 112 u=0.0982	agent0	initial_cond	1	0.000000
exp14494	1.88899296e-18	0.001438	0.000000	discard	Round 8: Boundary u=-0.46	agent1	boundary	0	-0.000000
exp14495	1.88036672e-29	0.000000	0.000000	discard	cycle 112 u=0.0982	agent0	initial_cond	0	0.000000
exp14496	8.37277028e-18	0.001438	-0.000000	discard	Round 8: Boundary u=-0.462	agent1	boundary	0	-0.000000
exp14497	1.88036672e-29	0.000000	0.000000	discard	cycle 112 u=0.0982	agent0	initial_cond	1	0.000000
exp14498	1.81952567e-17	0.001438	-0.000000	discard	Round 8: Boundary u=-0.463	agent1	boundary	1	-0.000000
exp14499	1.91190259e-29	0.000000	-0.000000	discard	cycle 112 u=0.0982	agent0	initial_cond	0	0.000000
exp14500	4.01998377e-17	0.001438	-0.000000	discard	Round 8: Boundary u=-0.464	agent1	boundary	0	-0.000000
exp14501	1.91190259e-29	0.000000	-0.000000	discard	cycle 112 u=0.0982	agent0	initial_cond	0	0.000000
exp14502	8.75085646e-17	0.001438	-0.000000	discard	Round 8: Boundary u=-0.465	agent1	boundary	0	-0.000000
exp14503	1.91190259e-29	0.000000	-0.000000	discard	cycle 112 u=0.0982	agent0	initial_cond	0	0.000000
exp14504	5.74003335e-16	0.001438	-0.000000	discard	Round 8: Trivial u=0.0	agent1	initial_cond	0	-0.000000
exp14505	6.13049994e-29	0.000000	0.000000	discard	cycle 112 u=0.0985	agent0	initial_cond	0	0.000000
exp14506	6.13049994e-29	0.000000	0.000000	discard	cycle 112 u=0.0985	agent0	initial_cond	1	0.000000
exp14507	6.13049994e-29	0.000000	0.000000	discard	cycle 112 u=0.0985	agent0	initial_cond	0	0.000000
exp14508	5.49750971e-29	0.000000	0.000000	discard	cycle 112 u=0.0985	agent0	initial_cond	0	0.000000
exp14509	5.49750971e-29	0.000000	0.000000	discard	cycle 112 u=0.0985	agent0	initial_cond	0	0.000000
exp14510	5.49750971e-29	0.000000	0.000000	discard	cycle 112 u=0.0985	agent0	initial_cond	0	0.000000
exp14511	4.15642452e-29	0.000000	0.000000	discard	cycle 112 u=0.0985	agent0	initial_cond	1	0.000000
exp14512	4.15642452e-29	0.000000	0.000000	discard	cycle 112 u=0.0985	agent0	initial_cond	0	0.000000
exp14513	4.15642452e-29	0.000000	0.000000	discard	cycle 112 u=0.0985	agent0	initial_cond	1	0.000000
exp14514	2.19292611e-29	0.000000	0.000000	discard	cycle 112 u=0.0985	agent0	initial_cond	0	-0.000000
exp14515	2.19292611e-29	0.000000	0.000000	discard	cycle 112 u=0.0985	agent0	initial_cond	0	-0.000000
exp14516	2.19292611e-29	0.000000	0.000000	discard	cycle 112 u=0.0985	agent0	initial_cond	1	-0.000000
exp14517	4.22491788e-29	0.000000	0.000000	discard	cycle 112 u=0.0990	agent0	initial_cond	0	-0.000000
exp14518	4.22491788e-29	0.000000	0.000000	discard	cycle 112 u=0.0990	agent0	initial_cond	1	-0.000000
exp14519	4.22491788e-29	0.000000	0.000000	discard	cycle 112 u=0.0990	agent0	initial_cond	0	-0.000000
exp14520	3.22245147e-29	0.000000	0.000000	discard	cycle 112 u=0.0990	agent0	initial_cond	0	0.000000
exp14521	3.22245147e-29	0.000000	0.000000	discard	cycle 112 u=0.0990	agent0	initial_cond	0	0.000000
exp14522	3.22245147e-29	0.000000	0.000000	discard	cycle 112 u=0.0990	agent0	initial_cond	0	0.000000
exp14523	4.50941488e-29	0.000000	-0.000000	discard	cycle 112 u=0.0990	agent0	initial_cond	1	0.000000
exp14524	4.50941488e-29	0.000000	-0.000000	discard	cycle 112 u=0.0990	agent0	initial_cond	0	0.000000
exp14525	4.50941488e-29	0.000000	-0.000000	discard	cycle 112 u=0.0990	agent0	initial_cond	0	0.000000
exp14526	4.88330883e-29	0.000000	-0.000000	discard	cycle 112 u=0.0990	agent0	initial_cond	0	0.000000
exp14527	4.88330883e-29	0.000000	-0.000000	discard	cycle 112 u=0.0990	agent0	initial_cond	0	0.000000
exp14528	4.88330883e-29	0.000000	-0.000000	discard	cycle 112 u=0.0990	agent0	initial_cond	1	0.000000
exp14529	5.74085541e-29	0.000000	-0.000000	discard	cycle 112 u=0.0995	agent0	initial_cond	0	0.000000
exp14530	5.74085541e-29	0.000000	-0.000000	discard	cycle 112 u=0.0995	agent0	initial_cond	1	0.000000
exp14531	5.74085541e-29	0.000000	-0.000000	discard	cycle 112 u=0.0995	agent0	initial_cond	0	0.000000
exp14532	1.54984578e-28	0.000000	0.000000	discard	cycle 112 u=0.0995	agent0	initial_cond	0	-0.000000
exp14533	1.54984578e-28	0.000000	0.000000	discard	cycle 112 u=0.0995	agent0	initial_cond	1	-0.000000
exp14534	1.54984578e-28	0.000000	0.000000	discard	cycle 112 u=0.0995	agent0	initial_cond	0	-0.000000
exp14535	1.60328418e-29	0.000000	-0.000000	discard	cycle 112 u=0.0995	agent0	initial_cond	1	-0.000000
exp14536	1.60328418e-29	0.000000	-0.000000	discard	cycle 112 u=0.0995	agent0	initial_cond	0	-0.000000
exp14537	1.60328418e-29	0.000000	-0.000000	discard	cycle 112 u=0.0995	agent0	initial_cond	0	-0.000000
exp14538	7.34590618e-29	0.000000	0.000000	discard	cycle 112 u=0.0995	agent0	initial_cond	0	0.000000
exp14539	7.34590618e-29	0.000000	0.000000	discard	cycle 112 u=0.0995	agent0	initial_cond	0	0.000000
exp14540	7.34590618e-29	0.000000	0.000000	discard	cycle 112 u=0.0995	agent0	initial_cond	1	0.000000
exp14541	4.46546993e-29	0.000000	0.000000	discard	cycle 112 u=0.1000	agent0	initial_cond	0	-0.000000
exp14542	4.46546993e-29	0.000000	0.000000	discard	cycle 112 u=0.1000	agent0	initial_cond	0	-0.000000
exp14543	4.46546993e-29	0.000000	0.000000	discard	cycle 112 u=0.1000	agent0	initial_cond	0	-0.000000
exp14544	4.08106752e-29	0.000000	0.000000	discard	cycle 112 u=0.1000	agent0	initial_cond	0	-0.000000
exp14545	4.08106752e-29	0.000000	0.000000	discard	cycle 112 u=0.1000	agent0	initial_cond	1	-0.000000
exp14546	4.08106752e-29	0.000000	0.000000	discard	cycle 112 u=0.1000	agent0	initial_cond	0	-0.000000
exp14547	4.58623706e-29	0.000000	0.000000	discard	cycle 112 u=0.1000	agent0	initial_cond	1	-0.000000
exp14548	4.58623706e-29	0.000000	0.000000	discard	cycle 112 u=0.1000	agent0	initial_cond	0	-0.000000
exp14549	4.58623706e-29	0.000000	0.000000	discard	cycle 112 u=0.1000	agent0	initial_cond	0	-0.000000
exp14550	4.39794337e-29	0.000000	0.000000	discard	cycle 112 u=0.1000	agent0	initial_cond	1	-0.000000
exp14551	4.39794337e-29	0.000000	0.000000	discard	cycle 112 u=0.1000	agent0	initial_cond	0	-0.000000
exp14552	4.39794337e-29	0.000000	0.000000	discard	cycle 112 u=0.1000	agent0	initial_cond	1	-0.000000
exp14553	1.36727475e-28	0.000000	0.000000	discard	cycle 112 u=0.1050	agent0	initial_cond	0	-0.000000
exp14554	1.36727475e-28	0.000000	0.000000	discard	cycle 112 u=0.1050	agent0	initial_cond	0	-0.000000
exp14555	1.36727475e-28	0.000000	0.000000	discard	cycle 112 u=0.1050	agent0	initial_cond	0	-0.000000
exp14556	6.14461376e-29	0.000000	0.000000	discard	cycle 112 u=0.1050	agent0	initial_cond	0	-0.000000
exp14557	6.14461376e-29	0.000000	0.000000	discard	cycle 112 u=0.1050	agent0	initial_cond	1	-0.000000
exp14558	6.14461376e-29	0.000000	0.000000	discard	cycle 112 u=0.1050	agent0	initial_cond	0	-0.000000
exp14559	1.75906666e-28	0.000000	0.000000	discard	cycle 112 u=0.1050	agent0	initial_cond	0	-0.000000
exp14560	1.75906666e-28	0.000000	0.000000	discard	cycle 112 u=0.1050	agent0	initial_cond	0	-0.000000
exp14561	1.75906666e-28	0.000000	0.000000	discard	cycle 112 u=0.1050	agent0	initial_cond	0	-0.000000
exp14562	1.11257917e-28	0.000000	0.000000	discard	cycle 112 u=0.1050	agent0	initial_cond	1	-0.000000
exp14563	1.11257917e-28	0.000000	0.000000	discard	cycle 112 u=0.1050	agent0	initial_cond	0	-0.000000
exp14564	1.11257917e-28	0.000000	0.000000	discard	cycle 112 u=0.1050	agent0	initial_cond	1	-0.000000
exp14565	8.58580947e-29	0.000000	0.000000	discard	cycle 113 u=0.0975	agent0	initial_cond	0	0.000000
exp14566	8.58580947e-29	0.000000	0.000000	discard	cycle 113 u=0.0975	agent0	initial_cond	0	0.000000
exp14567	8.58580947e-29	0.000000	0.000000	discard	cycle 113 u=0.0975	agent0	initial_cond	0	0.000000
exp14568	5.23962023e-29	0.000000	0.000000	discard	cycle 113 u=0.0975	agent0	initial_cond	0	0.000000
exp14569	5.23962023e-29	0.000000	0.000000	discard	cycle 113 u=0.0975	agent0	initial_cond	1	0.000000
exp14570	5.23962023e-29	0.000000	0.000000	discard	cycle 113 u=0.0975	agent0	initial_cond	0	0.000000
exp14571	4.03266298e-29	0.000000	0.000000	discard	cycle 113 u=0.0975	agent0	initial_cond	0	0.000000
exp14572	4.03266298e-29	0.000000	0.000000	discard	cycle 113 u=0.0975	agent0	initial_cond	0	0.000000
exp14573	4.03266298e-29	0.000000	0.000000	discard	cycle 113 u=0.0975	agent0	initial_cond	0	0.000000
exp14574	4.80015937e-29	0.000000	0.000000	discard	cycle 113 u=0.0975	agent0	initial_cond	1	0.000000
exp14575	4.80015937e-29	0.000000	0.000000	discard	cycle 113 u=0.0975	agent0	initial_cond	0	0.000000
exp14576	4.80015937e-29	0.000000	0.000000	discard	cycle 113 u=0.0975	agent0	initial_cond	1	0.000000
exp14577	2.68824537e-29	0.000000	0.000000	discard	cycle 113 u=0.0980	agent0	initial_cond	0	-0.000000
exp14578	2.68824537e-29	0.000000	0.000000	discard	cycle 113 u=0.0980	agent0	initial_cond	0	-0.000000
exp14579	2.68824537e-29	0.000000	0.000000	discard	cycle 113 u=0.0980	agent0	initial_cond	0	-0.000000
exp14580	6.16758073e-29	0.000000	0.000000	discard	cycle 113 u=0.0980	agent0	initial_cond	0	-0.000000
exp14581	6.16758073e-29	0.000000	0.000000	discard	cycle 113 u=0.0980	agent0	initial_cond	1	-0.000000
exp14582	6.16758073e-29	0.000000	0.000000	discard	cycle 113 u=0.0980	agent0	initial_cond	0	-0.000000
exp14583	2.01926478e-29	0.000000	0.000000	discard	cycle 113 u=0.0980	agent0	initial_cond	0	0.000000
exp14584	2.01926478e-29	0.000000	0.000000	discard	cycle 113 u=0.0980	agent0	initial_cond	0	0.000000
exp14585	2.01926478e-29	0.000000	0.000000	discard	cycle 113 u=0.0980	agent0	initial_cond	0	0.000000
exp14586	1.30310780e-28	0.000000	0.000000	discard	cycle 113 u=0.0980	agent0	initial_cond	1	-0.000000
exp14587	1.30310780e-28	0.000000	0.000000	discard	cycle 113 u=0.0980	agent0	initial_cond	0	-0.000000
exp14588	1.30310780e-28	0.000000	0.000000	discard	cycle 113 u=0.0980	agent0	initial_cond	0	-0.000000
exp14589	5.45343271e-29	0.000000	0.000000	discard	cycle 113 u=0.0982	agent0	initial_cond	0	-0.000000
exp14590	5.45343271e-29	0.000000	0.000000	discard	cycle 113 u=0.0982	agent0	initial_cond	0	-0.000000
exp14591	5.45343271e-29	0.000000	0.000000	discard	cycle 113 u=0.0982	agent0	initial_cond	1	-0.000000
exp14592	1.23429977e-28	0.000000	0.000000	discard	cycle 113 u=0.0982	agent0	initial_cond	0	0.000000
exp14593	1.23429977e-28	0.000000	0.000000	discard	cycle 113 u=0.0982	agent0	initial_cond	1	0.000000
exp14594	1.23429977e-28	0.000000	0.000000	discard	cycle 113 u=0.0982	agent0	initial_cond	0	0.000000
exp14595	1.88036672e-29	0.000000	0.000000	discard	cycle 113 u=0.0982	agent0	initial_cond	0	0.000000
exp14596	1.88036672e-29	0.000000	0.000000	discard	cycle 113 u=0.0982	agent0	initial_cond	0	0.000000
exp14597	1.88036672e-29	0.000000	0.000000	discard	cycle 113 u=0.0982	agent0	initial_cond	0	0.000000
exp14598	1.91190259e-29	0.000000	-0.000000	discard	cycle 113 u=0.0982	agent0	initial_cond	1	0.000000
exp14599	1.91190259e-29	0.000000	-0.000000	discard	cycle 113 u=0.0982	agent0	initial_cond	0	0.000000
exp14600	1.91190259e-29	0.000000	-0.000000	discard	cycle 113 u=0.0982	agent0	initial_cond	0	0.000000
exp14601	6.13049994e-29	0.000000	0.000000	discard	cycle 113 u=0.0985	agent0	initial_cond	0	0.000000
exp14602	6.13049994e-29	0.000000	0.000000	discard	cycle 113 u=0.0985	agent0	initial_cond	0	0.000000
exp14603	6.13049994e-29	0.000000	0.000000	discard	cycle 113 u=0.0985	agent0	initial_cond	1	0.000000
exp14604	5.49750971e-29	0.000000	0.000000	discard	cycle 113 u=0.0985	agent0	initial_cond	0	0.000000
exp14605	5.49750971e-29	0.000000	0.000000	discard	cycle 113 u=0.0985	agent0	initial_cond	1	0.000000
exp14606	5.49750971e-29	0.000000	0.000000	discard	cycle 113 u=0.0985	agent0	initial_cond	0	0.000000
exp14607	4.15642452e-29	0.000000	0.000000	discard	cycle 113 u=0.0985	agent0	initial_cond	0	0.000000
exp14608	4.15642452e-29	0.000000	0.000000	discard	cycle 113 u=0.0985	agent0	initial_cond	1	0.000000
exp14609	2.10002123e-19	0.001438	-0.000000	discard	Round 8: newton_tol=1.0e-10	agent1	solver_param	0	-0.000000
exp14609	4.15642452e-29	0.000000	0.000000	discard	cycle 113 u=0.0985	agent0	initial_cond	0	0.000000
exp14610	2.10002123e-19	0.001438	-0.000000	discard	Round 8: newton_tol=1.0e-12	agent1	solver_param	1	-0.000000
exp14610	2.19292611e-29	0.000000	0.000000	discard	cycle 113 u=0.0985	agent0	initial_cond	1	-0.000000
exp14611	2.10002123e-19	0.001438	-0.000000	discard	Round 8: newton_tol=1.0e-14	agent1	solver_param	0	-0.000000
exp14611	2.19292611e-29	0.000000	0.000000	discard	cycle 113 u=0.0985	agent0	initial_cond	0	-0.000000
exp14612	2.10002123e-19	0.001438	-0.000000	discard	Round 8: newton_tol=1.0e-16	agent1	solver_param	0	-0.000000
exp14612	2.19292611e-29	0.000000	0.000000	discard	cycle 113 u=0.0985	agent0	initial_cond	0	-0.000000
exp14613	2.10002123e-19	0.001438	-0.000000	discard	Round 8: solver_tol=1.0e-10	agent1	solver_param	0	-0.000000
exp14613	4.22491788e-29	0.000000	0.000000	discard	cycle 113 u=0.0990	agent0	initial_cond	0	-0.000000
exp14614	2.10002123e-19	0.001438	-0.000000	discard	Round 8: solver_tol=1.0e-12	agent1	solver_param	0	-0.000000
exp14614	4.22491788e-29	0.000000	0.000000	discard	cycle 113 u=0.0990	agent0	initial_cond	0	-0.000000
exp14615	2.10002123e-19	0.001438	-0.000000	discard	Round 8: solver_tol=1.0e-14	agent1	solver_param	1	-0.000000
exp14615	4.22491788e-29	0.000000	0.000000	discard	cycle 113 u=0.0990	agent0	initial_cond	1	-0.000000
exp14616	3.22245147e-29	0.000000	0.000000	discard	cycle 113 u=0.0990	agent0	initial_cond	0	0.000000
exp14616	2.10002123e-19	0.001438	-0.000000	discard	Round 8: solver_tol=1.0e-16	agent1	solver_param	0	-0.000000
exp14617	2.10002123e-19	0.001438	-0.000000	discard	Round 8: Ultra-tight tolerances	agent1	solver_param	0	-0.000000
exp14617	3.22245147e-29	0.000000	0.000000	discard	cycle 113 u=0.0990	agent0	initial_cond	0	0.000000
exp14618	3.22245147e-29	0.000000	0.000000	discard	cycle 113 u=0.0990	agent0	initial_cond	0	0.000000
exp14619	4.50941488e-29	0.000000	-0.000000	discard	cycle 113 u=0.0990	agent0	initial_cond	0	0.000000
exp14620	4.50941488e-29	0.000000	-0.000000	discard	cycle 113 u=0.0990	agent0	initial_cond	1	0.000000
exp14621	4.50941488e-29	0.000000	-0.000000	discard	cycle 113 u=0.0990	agent0	initial_cond	0	0.000000
exp14622	4.88330883e-29	0.000000	-0.000000	discard	cycle 113 u=0.0990	agent0	initial_cond	1	0.000000
exp14623	4.88330883e-29	0.000000	-0.000000	discard	cycle 113 u=0.0990	agent0	initial_cond	0	0.000000
exp14624	4.88330883e-29	0.000000	-0.000000	discard	cycle 113 u=0.0990	agent0	initial_cond	0	0.000000
exp14625	5.74085541e-29	0.000000	-0.000000	discard	cycle 113 u=0.0995	agent0	initial_cond	0	0.000000
exp14626	5.74085541e-29	0.000000	-0.000000	discard	cycle 113 u=0.0995	agent0	initial_cond	0	0.000000
exp14627	5.74085541e-29	0.000000	-0.000000	discard	cycle 113 u=0.0995	agent0	initial_cond	1	0.000000
exp14628	1.54984578e-28	0.000000	0.000000	discard	cycle 113 u=0.0995	agent0	initial_cond	0	-0.000000
exp14629	1.54984578e-28	0.000000	0.000000	discard	cycle 113 u=0.0995	agent0	initial_cond	0	-0.000000
exp14630	1.54984578e-28	0.000000	0.000000	discard	cycle 113 u=0.0995	agent0	initial_cond	0	-0.000000
exp14631	2.10002123e-19	0.001438	-0.000000	discard	Round 8: newton_maxiter=20	agent1	solver_param	0	-0.000000
exp14632	1.60328418e-29	0.000000	-0.000000	discard	cycle 113 u=0.0995	agent0	initial_cond	0	-0.000000
exp14633	2.10002123e-19	0.001438	-0.000000	discard	Round 8: newton_maxiter=50	agent1	solver_param	0	-0.000000
exp14634	1.60328418e-29	0.000000	-0.000000	discard	cycle 113 u=0.0995	agent0	initial_cond	1	-0.000000
exp14635	2.10002123e-19	0.001438	-0.000000	discard	Round 8: newton_maxiter=100	agent1	solver_param	0	-0.000000
exp14636	1.60328418e-29	0.000000	-0.000000	discard	cycle 113 u=0.0995	agent0	initial_cond	0	-0.000000
exp14637	2.10002123e-19	0.001438	-0.000000	discard	Round 8: newton_maxiter=200	agent1	solver_param	0	-0.000000
exp14638	7.34590618e-29	0.000000	0.000000	discard	cycle 113 u=0.0995	agent0	initial_cond	1	0.000000
exp14639	2.10002123e-19	0.001438	-0.000000	discard	Round 8: newton_maxiter=500	agent1	solver_param	1	-0.000000
exp14640	7.34590618e-29	0.000000	0.000000	discard	cycle 113 u=0.0995	agent0	initial_cond	0	0.000000
exp14641	7.34590618e-29	0.000000	0.000000	discard	cycle 113 u=0.0995	agent0	initial_cond	0	0.000000
exp14642	4.46546993e-29	0.000000	0.000000	discard	cycle 113 u=0.1000	agent0	initial_cond	1	-0.000000
exp14643	4.46546993e-29	0.000000	0.000000	discard	cycle 113 u=0.1000	agent0	initial_cond	0	-0.000000
exp14644	4.46546993e-29	0.000000	0.000000	discard	cycle 113 u=0.1000	agent0	initial_cond	1	-0.000000
exp14645	4.08106752e-29	0.000000	0.000000	discard	cycle 113 u=0.1000	agent0	initial_cond	0	-0.000000
exp14646	4.08106752e-29	0.000000	0.000000	discard	cycle 113 u=0.1000	agent0	initial_cond	0	-0.000000
exp14647	4.08106752e-29	0.000000	0.000000	discard	cycle 113 u=0.1000	agent0	initial_cond	0	-0.000000
exp14648	4.58623706e-29	0.000000	0.000000	discard	cycle 113 u=0.1000	agent0	initial_cond	0	-0.000000
exp14649	4.58623706e-29	0.000000	0.000000	discard	cycle 113 u=0.1000	agent0	initial_cond	1	-0.000000
exp14650	4.58623706e-29	0.000000	0.000000	discard	cycle 113 u=0.1000	agent0	initial_cond	0	-0.000000
exp14651	4.39794337e-29	0.000000	0.000000	discard	cycle 113 u=0.1000	agent0	initial_cond	0	-0.000000
exp14652	4.39794337e-29	0.000000	0.000000	discard	cycle 113 u=0.1000	agent0	initial_cond	0	-0.000000
exp14653	4.39794337e-29	0.000000	0.000000	discard	cycle 113 u=0.1000	agent0	initial_cond	0	-0.000000
exp14654	1.36727475e-28	0.000000	0.000000	discard	cycle 113 u=0.1050	agent0	initial_cond	1	-0.000000
exp14655	1.36727475e-28	0.000000	0.000000	discard	cycle 113 u=0.1050	agent0	initial_cond	0	-0.000000
exp14656	1.36727475e-28	0.000000	0.000000	discard	cycle 113 u=0.1050	agent0	initial_cond	1	-0.000000
exp14657	6.14461376e-29	0.000000	0.000000	discard	cycle 113 u=0.1050	agent0	initial_cond	0	-0.000000
exp14658	6.14461376e-29	0.000000	0.000000	discard	cycle 113 u=0.1050	agent0	initial_cond	0	-0.000000
exp14659	6.14461376e-29	0.000000	0.000000	discard	cycle 113 u=0.1050	agent0	initial_cond	0	-0.000000
exp14659	2.10002123e-19	0.001438	-0.000000	discard	Round 8: fourier_modes=1 n_mode=1	agent1	solver_param	0	-0.000000
exp14660	1.75906666e-28	0.000000	0.000000	discard	cycle 113 u=0.1050	agent0	initial_cond	0	-0.000000
exp14660	2.10002123e-19	0.001438	-0.000000	discard	Round 8: fourier_modes=2 n_mode=1	agent1	solver_param	0	-0.000000
