exp_id	residual	solution_norm	solution_mean	status	description	agent	design	elapsed_s	solution_energy
exp1350	2.03509144e-27	0.000000	0.000000	discard	u=0.2600 a=0.001344	agent0	initial_cond	2	-0.000000
exp1350	2.03509144e-27	0.000000	0.000000	discard	u=0.2600 a=0.001348	agent0	initial_cond	2	-0.000000
exp1351	1.34357540e-12	1.002503	1.000218	discard	pos u=1.1 amp=0.5 mode=3 n=269	agent1	memory	1	-1.523848
exp1352	2.03509144e-27	0.000000	0.000000	discard	u=0.0982 a=0.001340	agent0	initial_cond	2	-0.000000
exp1352	2.03509144e-27	0.000000	0.000000	discard	u=0.0980 a=0.001342	agent0	initial_cond	2	-0.000000
exp1352	2.03509144e-27	0.000000	0.000000	discard	u=0.0984 a=0.001340	agent0	initial_cond	2	-0.000000
exp1352	2.03509144e-27	0.000000	0.000000	discard	u=0.0984 a=0.001346	agent0	initial_cond	2	-0.000000
exp1352	2.03509144e-27	0.000000	0.000000	discard	u=0.0980 a=0.001344	agent0	initial_cond	2	-0.000000
exp1352	2.03509144e-27	0.000000	0.000000	discard	u=0.0980 a=0.001346	agent0	initial_cond	2	-0.000000
exp1352	2.03509144e-27	0.000000	0.000000	discard	u=0.0980 a=0.001340	agent0	initial_cond	2	-0.000000
exp1352	2.03509144e-27	0.000000	0.000000	discard	u=0.0980 a=0.001350	agent0	initial_cond	2	-0.000000
exp1353	2.03509144e-27	0.000000	1.000218	discard	u=0.0982 a=0.001344	agent0	initial_cond	2	-1.523848
exp1353	2.03509144e-27	0.000000	1.000218	discard	u=0.0986 a=0.001344	agent0	initial_cond	2	-1.523848
exp1353	2.03509144e-27	0.000000	1.000218	discard	u=0.0982 a=0.001350	agent0	initial_cond	2	-1.523848
exp1354	1.34357540e-12	1.002503	1.000218	discard	u=0.0984 a=0.001342	agent0	initial_cond	3	-1.523848
exp1353	1.34357540e-12	1.002503	1.000218	discard	u=0.0980 a=0.001348	agent0	initial_cond	3	-1.523848
exp1353	1.34357540e-12	1.002503	1.000218	discard	u=0.0982 a=0.001342	agent0	initial_cond	3	-1.523848
exp1354	1.34357540e-12	1.002503	1.000218	discard	u=0.0986 a=0.001342	agent0	initial_cond	3	-1.523848
exp1354	1.34357540e-12	1.002503	1.000218	discard	u=0.0986 a=0.001346	agent0	initial_cond	2	-1.523848
exp1354	1.34357540e-12	1.002503	1.000218	discard	u=0.0984 a=0.001344	agent0	initial_cond	4	-1.523848
exp1354	1.34357540e-12	1.002503	1.000218	discard	u=0.0986 a=0.001340	agent0	initial_cond	3	-1.523848
exp1354	1.34357540e-12	1.002503	1.000218	discard	u=0.0988 a=0.001340	agent0	initial_cond	3	-1.523848
exp1354	1.34357540e-12	1.002503	1.000218	discard	u=0.0986 a=0.001350	agent0	initial_cond	3	-1.523848
exp1355	1.34357540e-12	1.002503	1.000218	discard	u=0.0984 a=0.001348	agent0	initial_cond	4	-1.523848
exp1354	1.34357540e-12	1.002503	1.000218	discard	u=0.0982 a=0.001348	agent0	initial_cond	3	-1.523848
exp1355	1.34357540e-12	1.002503	1.000218	discard	u=0.2400 a=0.001346	agent0	initial_cond	3	-1.523848
exp1355	1.34357540e-12	1.002503	1.000218	discard	u=0.0988 a=0.001348	agent0	initial_cond	3	-1.523848
exp1355	1.34357540e-12	1.002503	1.000218	discard	u=0.0990 a=0.001340	agent0	initial_cond	3	-1.523848
exp1355	1.34357540e-12	1.002503	1.000218	discard	u=0.0988 a=0.001344	agent0	initial_cond	3	-1.523848
exp1354	1.34357540e-12	1.002503	1.000218	discard	u=0.0982 a=0.001346	agent0	initial_cond	3	-1.523848
exp1355	1.34357540e-12	1.002503	1.000218	discard	u=0.0990 a=0.001342	agent0	initial_cond	2	-1.523848
exp1355	1.34357540e-12	1.002503	1.000218	discard	u=0.0984 a=0.001350	agent0	initial_cond	4	-1.523848
exp1355	1.34357540e-12	1.002503	1.000218	discard	u=0.0990 a=0.001344	agent0	initial_cond	3	-1.523848
exp1355	1.34357540e-12	1.002503	1.000218	discard	u=0.2400 a=0.001342	agent0	initial_cond	3	-1.523848
exp1355	1.34357540e-12	1.002503	1.000218	discard	u=0.0990 a=0.001346	agent0	initial_cond	3	-1.523848
exp1355	1.34357540e-12	1.002503	1.000218	discard	u=0.0988 a=0.001350	agent0	initial_cond	3	-1.523848
exp1355	1.34357540e-12	1.002503	1.000218	discard	u=0.1000 a=0.001340	agent0	initial_cond	3	-1.523848
exp1355	1.34357540e-12	1.002503	1.000218	discard	u=0.1000 a=0.001344	agent0	initial_cond	3	-1.523848
exp1355	1.34357540e-12	1.002503	1.000218	discard	u=0.0988 a=0.001346	agent0	initial_cond	3	-1.523848
exp1355	1.34357540e-12	1.002503	1.000218	discard	u=0.0988 a=0.001342	agent0	initial_cond	2	-1.523848
exp1355	1.34357540e-12	1.002503	1.000218	discard	pos u=1.2 amp=0.5 mode=3 n=269	agent1	memory	3	-1.523848
exp1355	1.34357540e-12	1.002503	1.000218	discard	u=0.1000 a=0.001342	agent0	initial_cond	3	-1.523848
exp1356	1.34357540e-12	1.002503	1.000218	discard	u=0.1010 a=0.001346	agent0	initial_cond	3	-1.523848
exp1355	1.34357540e-12	1.002503	1.000218	discard	u=0.1000 a=0.001346	agent0	initial_cond	3	-1.523848
exp1355	1.34357540e-12	1.002503	1.000218	discard	u=0.1010 a=0.001350	agent0	initial_cond	3	-1.523848
exp1355	1.34357540e-12	1.002503	1.000218	discard	u=0.1000 a=0.001350	agent0	initial_cond	3	-1.523848
exp1356	1.34357540e-12	1.002503	1.000218	discard	u=0.2400 a=0.001348	agent0	initial_cond	3	-1.523848
exp1355	1.34357540e-12	1.002503	1.000218	discard	u=0.0986 a=0.001348	agent0	initial_cond	3	-1.523848
exp1356	1.34357540e-12	1.002503	1.000218	discard	u=0.2500 a=0.001342	agent0	initial_cond	3	-1.523848
exp1355	1.34357540e-12	1.002503	1.000218	discard	u=0.1000 a=0.001348	agent0	initial_cond	3	-1.523848
exp1355	1.34357540e-12	1.002503	1.000218	discard	u=0.1010 a=0.001348	agent0	initial_cond	3	-1.523848
exp1356	1.34357540e-12	1.002503	1.000218	discard	u=0.2400 a=0.001340	agent0	initial_cond	3	-1.523848
exp1356	1.34357540e-12	1.002503	1.000218	discard	u=0.2600 a=0.001346	agent0	initial_cond	2	-1.523848
exp1355	1.34357540e-12	1.002503	1.000218	discard	u=0.0990 a=0.001350	agent0	initial_cond	3	-1.523848
exp1355	1.34357540e-12	1.002503	1.000218	discard	u=0.1010 a=0.001344	agent0	initial_cond	3	-1.523848
exp1356	1.34357540e-12	1.002503	1.000218	discard	u=0.2400 a=0.001344	agent0	initial_cond	3	-1.523848
exp1356	1.34357540e-12	1.002503	1.000218	discard	u=0.2500 a=0.001344	agent0	initial_cond	3	-1.523848
exp1356	1.34357540e-12	1.002503	1.000218	discard	u=0.2500 a=0.001346	agent0	initial_cond	2	-1.523848
exp1356	1.34357540e-12	1.002503	1.000218	discard	u=0.0990 a=0.001348	agent0	initial_cond	3	-1.523848
exp1356	1.34357540e-12	1.002503	1.000218	discard	u=0.2500 a=0.001340	agent0	initial_cond	3	-1.523848
exp1356	1.34357540e-12	1.002503	1.000218	discard	u=0.1010 a=0.001342	agent0	initial_cond	3	-1.523848
exp1356	1.34357540e-12	1.002503	1.000218	discard	u=0.2600 a=0.001340	agent0	initial_cond	2	-1.523848
exp1356	1.34357540e-12	1.002503	1.000218	discard	u=0.2600 a=0.001342	agent0	initial_cond	2	-1.523848
exp1357	1.34357540e-12	1.002503	1.000218	discard	basin map u=0.6	agent0	branch_search	2	-1.523848
exp1356	1.34357540e-12	1.002503	1.000218	discard	u=0.2600 a=0.001350	agent0	initial_cond	2	-1.523848
exp1356	1.34357540e-12	1.002503	1.000218	discard	u=0.1010 a=0.001340	agent0	initial_cond	3	-1.523848
exp1356	1.34357540e-12	1.002503	1.000218	discard	u=0.2500 a=0.001350	agent0	initial_cond	2	-1.523848
exp1357	1.34357540e-12	1.002503	1.000218	discard	u=0.2500 a=0.001348	agent0	initial_cond	2	-1.523848
exp1356	1.34357540e-12	1.002503	1.000218	discard	u=0.2400 a=0.001350	agent0	initial_cond	3	-1.523848
exp1357	1.34357540e-12	1.002503	1.000218	discard	u=0.2600 a=0.001348	agent0	initial_cond	3	-1.523848
exp1357	1.34357540e-12	1.002503	1.000218	discard	u=0.2600 a=0.001344	agent0	initial_cond	3	-1.523848
exp1358	4.06882107e-28	0.000000	0.000000	discard	basin map u=0.8	agent0	branch_search	1	0.000000
exp1359	2.03509144e-27	0.000000	0.000000	discard	u=0.0980 a=0.001344	agent0	initial_cond	2	-0.000000
exp1359	2.03509144e-27	0.000000	0.000000	discard	u=0.0980 a=0.001348	agent0	initial_cond	2	-0.000000
exp1359	2.03509144e-27	0.000000	0.000000	discard	u=0.0980 a=0.001340	agent0	initial_cond	2	-0.000000
exp1359	2.03509144e-27	0.000000	0.000000	discard	u=0.0980 a=0.001346	agent0	initial_cond	2	-0.000000
exp1360	1.34360442e-12	1.002503	1.000218	discard	pos u=1.5 amp=0.5 mode=3 n=269	agent1	memory	2	-1.523848
exp1359	2.03509144e-27	0.000000	0.000000	discard	u=0.0980 a=0.001350	agent0	initial_cond	2	-0.000000
exp1359	2.03509144e-27	0.000000	0.000000	discard	u=0.0982 a=0.001344	agent0	initial_cond	2	-0.000000
exp1360	2.03509144e-27	0.000000	1.000218	discard	u=0.0982 a=0.001340	agent0	initial_cond	2	-0.000000
exp1360	2.03509144e-27	0.000000	0.000000	discard	u=0.0982 a=0.001342	agent0	initial_cond	2	-0.000000
exp1360	2.03509144e-27	0.000000	1.000218	discard	u=0.0984 a=0.001350	agent0	initial_cond	2	-1.523848
exp1360	2.03509144e-27	0.000000	1.000218	discard	u=0.0986 a=0.001344	agent0	initial_cond	2	-0.000000
exp1360	2.03509144e-27	0.000000	1.000218	discard	u=0.0982 a=0.001348	agent0	initial_cond	2	-0.000000
exp1360	2.03509144e-27	0.000000	1.000218	discard	u=0.0986 a=0.001346	agent0	initial_cond	2	-0.000000
exp1360	2.03509144e-27	0.000000	1.000218	discard	u=0.0986 a=0.001342	agent0	initial_cond	2	-0.000000
exp1361	1.34357540e-12	1.002503	1.000218	discard	u=0.0984 a=0.001342	agent0	initial_cond	2	-1.523848
exp1361	2.03509144e-27	0.000000	1.000218	discard	u=0.0984 a=0.001344	agent0	initial_cond	2	-1.523848
exp1361	1.34357540e-12	1.002503	1.000218	discard	u=0.0988 a=0.001342	agent0	initial_cond	2	-1.523848
exp1361	1.34357540e-12	1.002503	1.000218	discard	u=0.0984 a=0.001340	agent0	initial_cond	2	-1.523848
exp1362	1.34357540e-12	1.002503	1.000218	discard	u=0.0984 a=0.001348	agent0	initial_cond	3	-1.523848
exp1362	1.34357540e-12	1.002503	1.000218	discard	u=0.0986 a=0.001340	agent0	initial_cond	3	-1.523848
exp1362	1.34357540e-12	1.002503	1.000218	discard	u=0.0982 a=0.001350	agent0	initial_cond	3	-1.523848
exp1363	1.34357540e-12	1.002503	1.000218	discard	u=0.0988 a=0.001348	agent0	initial_cond	3	-1.523848
exp1363	1.34357540e-12	1.002503	1.000218	discard	u=0.0986 a=0.001350	agent0	initial_cond	3	-1.523848
exp1363	1.34357540e-12	1.002503	1.000218	discard	u=0.0988 a=0.001340	agent0	initial_cond	3	-1.523848
exp1364	1.34357540e-12	1.002503	1.000218	discard	u=0.0988 a=0.001350	agent0	initial_cond	2	-1.523848
exp1364	1.34357540e-12	1.002503	1.000218	discard	u=0.0986 a=0.001348	agent0	initial_cond	3	-1.523848
exp1364	1.34357540e-12	1.002503	1.000218	discard	u=0.0984 a=0.001346	agent0	initial_cond	3	-1.523848
exp1364	1.34357540e-12	1.002503	1.000218	discard	u=0.0990 a=0.001344	agent0	initial_cond	2	-1.523848
exp1364	1.34357540e-12	1.002503	1.000218	discard	u=0.0988 a=0.001344	agent0	initial_cond	3	-1.523848
exp1364	1.34357540e-12	1.002503	1.000218	discard	u=0.0988 a=0.001346	agent0	initial_cond	3	-1.523848
exp1364	1.34357540e-12	1.002503	1.000218	discard	u=0.0990 a=0.001340	agent0	initial_cond	3	-1.523848
exp1365	1.34357540e-12	1.002503	1.000218	discard	u=0.0990 a=0.001342	agent0	initial_cond	2	-1.523848
exp1364	1.34357540e-12	1.002503	1.000218	discard	u=0.1000 a=0.001342	agent0	initial_cond	2	-1.523848
exp1365	1.34357540e-12	1.002503	1.000218	discard	u=0.1000 a=0.001344	agent0	initial_cond	2	-1.523848
exp1365	1.34357540e-12	1.002503	1.000218	discard	u=0.0990 a=0.001348	agent0	initial_cond	3	-1.523848
exp1365	1.34357540e-12	1.002503	1.000218	discard	u=0.0990 a=0.001350	agent0	initial_cond	3	-1.523848
exp1365	1.34357540e-12	1.002503	1.000218	discard	u=0.1010 a=0.001340	agent0	initial_cond	3	-1.523848
exp1366	1.34357540e-12	1.002503	1.000218	discard	u=0.0990 a=0.001346	agent0	initial_cond	3	-1.523848
exp1366	1.34357540e-12	1.002503	1.000218	discard	u=0.1000 a=0.001346	agent0	initial_cond	3	-1.523848
exp1366	1.34357540e-12	1.002503	1.000218	discard	u=0.2400 a=0.001344	agent0	initial_cond	3	-1.523848
exp1366	1.34357540e-12	1.002503	1.000218	discard	u=0.1000 a=0.001340	agent0	initial_cond	3	-1.523848
exp1366	1.34357540e-12	1.002503	1.000218	discard	u=0.1010 a=0.001346	agent0	initial_cond	3	-1.523848
exp1366	1.34357540e-12	1.002503	1.000218	discard	u=0.2400 a=0.001342	agent0	initial_cond	3	-1.523848
exp1367	1.34357540e-12	1.002503	1.000218	discard	u=0.1010 a=0.001344	agent0	initial_cond	3	-1.523848
exp1366	1.34357540e-12	1.002503	1.000218	discard	u=0.1010 a=0.001342	agent0	initial_cond	3	-1.523848
exp1366	1.34357540e-12	1.002503	1.000218	discard	u=0.1000 a=0.001348	agent0	initial_cond	3	-1.523848
exp1368	1.34357540e-12	1.002503	1.000218	discard	u=0.2400 a=0.001348	agent0	initial_cond	3	-1.523848
exp1368	1.34357540e-12	1.002503	1.000218	discard	u=0.1000 a=0.001350	agent0	initial_cond	3	-1.523848
exp1368	1.34357540e-12	1.002503	1.000218	discard	u=0.2400 a=0.001346	agent0	initial_cond	3	-1.523848
exp1368	1.34357540e-12	1.002503	1.000218	discard	u=0.2500 a=0.001340	agent0	initial_cond	3	-1.523848
exp1368	1.34357540e-12	1.002503	1.000218	discard	u=0.2500 a=0.001344	agent0	initial_cond	2	-1.523848
exp1368	1.34357540e-12	1.002503	1.000218	discard	u=0.1010 a=0.001348	agent0	initial_cond	3	-1.523848
exp1368	1.34357540e-12	1.002503	1.000218	discard	u=0.2400 a=0.001350	agent0	initial_cond	3	-1.523848
exp1368	1.34357540e-12	1.002503	1.000218	discard	u=0.1010 a=0.001350	agent0	initial_cond	3	-1.523848
exp1368	1.34357540e-12	1.002503	1.000218	discard	u=0.2400 a=0.001340	agent0	initial_cond	3	-1.523848
exp1368	1.34357540e-12	1.002503	1.000218	discard	u=0.2500 a=0.001346	agent0	initial_cond	2	-1.523848
exp1369	1.34357540e-12	1.002503	1.000218	discard	u=0.2600 a=0.001342	agent0	initial_cond	2	-1.523848
exp1369	1.34357540e-12	1.002503	1.000218	discard	u=0.2600 a=0.001340	agent0	initial_cond	2	-1.523848
exp1369	1.34357540e-12	1.002503	1.000218	discard	u=0.2500 a=0.001342	agent0	initial_cond	2	-1.523848
exp1369	1.34357540e-12	1.002503	1.000218	discard	u=0.2600 a=0.001346	agent0	initial_cond	2	-1.523848
exp1369	1.34357540e-12	1.002503	1.000218	discard	u=0.2600 a=0.001350	agent0	initial_cond	2	-1.523848
exp1369	1.34357540e-12	1.002503	1.000218	discard	u=0.2500 a=0.001350	agent0	initial_cond	2	-1.523848
exp1369	1.34357540e-12	1.002503	1.000218	discard	basin map u=1.0	agent0	branch_search	2	-1.523848
exp1369	1.34357540e-12	1.002503	1.000218	discard	u=0.2500 a=0.001348	agent0	initial_cond	2	-1.523848
exp1369	1.34357540e-12	1.002503	1.000218	discard	u=0.2600 a=0.001344	agent0	initial_cond	2	-1.523848
exp1370	1.34357540e-12	1.002503	1.000218	discard	u=0.2600 a=0.001348	agent0	initial_cond	2	-1.523848
exp1371	1.34360442e-12	1.002503	-1.000218	discard	neg u=-0.95 amp=0.5 mode=3 n=269	agent1	memory	1	-1.523848
exp1372	1.66539251e-15	0.000000	0.000000	discard	basin map u=1.2	agent0	branch_search	1	-0.000000
exp1373	crash	0	0	crash	u=0.0980 a=0.001342	agent0	initial_cond	2	0
exp1374	crash	0	0	crash	u=0.0980 a=0.001350	agent0	initial_cond	2	0
exp1375	crash	0	0	crash	u=0.0980 a=0.001340	agent0	initial_cond	2	0
exp1376	2.03509144e-27	0.000000	0.000000	discard	u=0.0980 a=0.001344	agent0	initial_cond	2	-0.000000
exp1374	2.03509144e-27	0.000000	0.000000	discard	u=0.0982 a=0.001342	agent0	initial_cond	2	-0.000000
exp1376	2.03509144e-27	0.000000	0.000000	discard	u=0.0982 a=0.001350	agent0	initial_cond	2	-0.000000
exp1374	2.03509144e-27	0.000000	0.000000	discard	u=0.0980 a=0.001346	agent0	initial_cond	2	-0.000000
exp1376	2.03509144e-27	0.000000	0.000000	discard	u=0.0982 a=0.001340	agent0	initial_cond	2	-0.000000
exp1377	1.86448479e-16	1.001296	1.000019	discard	Fourier 4modes u=1.44 positive attempt	agent1_mem	branch_search	3	-1.520844
exp1377	2.03509144e-27	0.000000	0.000000	discard	u=0.0984 a=0.001346	agent0	initial_cond	2	-0.000000
exp1377	2.03509144e-27	0.000000	0.000000	discard	u=0.0984 a=0.001340	agent0	initial_cond	3	-0.000000
exp1377	2.03509144e-27	0.000000	0.000000	discard	u=0.0986 a=0.001340	agent0	initial_cond	2	-0.000000
exp1378	1.34360442e-12	1.002503	1.000218	discard	u=0.0990 a=0.001350	agent0	initial_cond	2	-1.523848
exp1377	2.03509144e-27	0.000000	1.000218	discard	u=0.0988 a=0.001346	agent0	initial_cond	2	-1.523848
exp1378	1.34360442e-12	1.002503	1.000218	discard	u=0.1000 a=0.001344	agent0	initial_cond	2	-1.523848
exp1378	1.34360442e-12	1.002503	1.000218	discard	u=0.0988 a=0.001348	agent0	initial_cond	2	-1.523848
exp1377	1.34360442e-12	1.002503	1.000218	discard	u=0.0988 a=0.001344	agent0	initial_cond	2	-1.523848
exp1378	1.34360442e-12	1.002503	1.000218	discard	u=0.1000 a=0.001340	agent0	initial_cond	2	-1.523848
exp1377	2.03509144e-27	0.000000	0.000000	discard	u=0.0986 a=0.001344	agent0	initial_cond	2	-0.000000
exp1378	2.03509144e-27	1.002503	1.000218	discard	u=0.0990 a=0.001344	agent0	initial_cond	2	-1.523848
exp1378	1.34360442e-12	1.002503	1.000218	discard	u=0.0990 a=0.001346	agent0	initial_cond	2	-1.523848
exp1378	1.34360442e-12	1.002503	1.000218	discard	u=0.0990 a=0.001340	agent0	initial_cond	2	-1.523848
exp1378	1.34360442e-12	1.002503	1.000218	discard	u=0.1000 a=0.001348	agent0	initial_cond	2	-1.523848
exp1378	1.34360442e-12	1.002503	1.000218	discard	u=0.0990 a=0.001348	agent0	initial_cond	2	-1.523848
exp1379	1.34360442e-12	1.002503	1.000218	discard	u=0.0990 a=0.001342	agent0	initial_cond	2	-1.523848
exp1378	1.34360442e-12	1.002503	1.000218	discard	u=0.1010 a=0.001346	agent0	initial_cond	2	-1.523848
exp1379	1.34357540e-12	1.002503	-1.000218	discard	neg u=-1.05 amp=0.5 mode=3 n=269	agent1	memory	3	-1.523848
exp1379	1.34360442e-12	1.002503	1.000218	discard	u=0.1010 a=0.001342	agent0	initial_cond	2	-1.523848
exp1379	1.34360442e-12	1.002503	1.000218	discard	u=0.1000 a=0.001346	agent0	initial_cond	2	-1.523848
exp1379	1.34360442e-12	1.002503	1.000218	discard	u=0.2400 a=0.001344	agent0	initial_cond	3	-1.523848
exp1379	1.34360442e-12	1.002503	1.000218	discard	u=0.1000 a=0.001350	agent0	initial_cond	2	-1.523848
exp1380	1.34360442e-12	1.002503	1.000218	discard	u=0.1000 a=0.001342	agent0	initial_cond	3	-1.523848
exp1379	1.34360442e-12	1.002503	1.000218	discard	u=0.1010 a=0.001348	agent0	initial_cond	3	-1.523848
exp1379	1.34360442e-12	1.002503	1.000218	discard	u=0.1010 a=0.001340	agent0	initial_cond	3	-1.523848
exp1380	1.34360442e-12	1.002503	1.000218	discard	u=0.2400 a=0.001346	agent0	initial_cond	3	-1.523848
exp1380	1.34360442e-12	1.002503	1.000218	discard	u=0.2400 a=0.001342	agent0	initial_cond	3	-1.523848
exp1380	1.34360442e-12	1.002503	1.000218	discard	u=0.2400 a=0.001340	agent0	initial_cond	3	-1.523848
exp1380	1.34360442e-12	1.002503	1.000218	discard	u=0.1010 a=0.001350	agent0	initial_cond	3	-1.523848
exp1380	1.34360442e-12	1.002503	1.000218	discard	u=0.1010 a=0.001344	agent0	initial_cond	3	-1.523848
exp1381	1.34360442e-12	1.002503	1.000218	discard	u=0.2500 a=0.001340	agent0	initial_cond	2	-1.523848
exp1381	1.34360442e-12	1.002503	1.000218	discard	u=0.2400 a=0.001350	agent0	initial_cond	2	-1.523848
exp1381	1.34360442e-12	1.002503	1.000218	discard	u=0.2400 a=0.001348	agent0	initial_cond	2	-1.523848
exp1382	1.34360442e-12	1.002503	1.000218	discard	u=0.2500 a=0.001342	agent0	initial_cond	2	-1.523848
exp1382	1.34360442e-12	1.002503	1.000218	discard	u=0.2500 a=0.001350	agent0	initial_cond	2	-1.523848
exp1382	1.34360442e-12	1.002503	1.000218	discard	u=0.2500 a=0.001346	agent0	initial_cond	2	-1.523848
exp1383	1.34360442e-12	1.002503	1.000218	discard	u=0.2600 a=0.001342	agent0	initial_cond	2	-1.523848
exp1383	1.34360442e-12	1.002503	1.000218	discard	u=0.2500 a=0.001344	agent0	initial_cond	2	-1.523848
exp1383	1.34360442e-12	1.002503	1.000218	discard	u=0.2600 a=0.001340	agent0	initial_cond	1	-1.523848
exp1384	1.34360442e-12	1.002503	1.000218	discard	u=0.2500 a=0.001348	agent0	initial_cond	2	-1.523848
exp1384	1.34360442e-12	1.002503	1.000218	discard	u=0.2600 a=0.001344	agent0	initial_cond	1	-1.523848
exp1385	1.34360442e-12	1.002503	1.000218	discard	u=0.2600 a=0.001346	agent0	initial_cond	1	-1.523848
exp1385	1.34360442e-12	1.002503	1.000218	discard	u=0.2600 a=0.001348	agent0	initial_cond	1	-1.523848
exp1385	1.34360442e-12	1.002503	1.000218	discard	basin map u=1.5	agent0	branch_search	1	-1.523848
exp1386	1.34360442e-12	1.002503	1.000218	discard	u=0.2600 a=0.001350	agent0	initial_cond	1	-1.523848
exp1387	1.34357540e-12	1.002503	-1.000218	discard	neg u=-1.1 amp=0.5 mode=3 n=269	agent1	memory	0	-1.523848
exp1388	4.06882107e-28	0.000000	0.000000	discard	u=0.0980 a=0.001344	agent0	initial_cond	2	0.000000
exp1389	2.03509144e-27	0.000000	0.000000	discard	u=0.0980 a=0.001348	agent0	initial_cond	2	-0.000000
exp1389	2.03509144e-27	0.000000	0.000000	discard	u=0.0980 a=0.001342	agent0	initial_cond	2	-0.000000
exp1389	7.48974675e-29	0.000000	0.000000	discard	u=0.0980 a=0.001346	agent0	initial_cond	2	-0.000000
exp1389	2.03509144e-27	0.000000	0.000000	discard	u=0.0982 a=0.001344	agent0	initial_cond	2	-0.000000
exp1389	2.03509144e-27	0.000000	0.000000	discard	u=0.0982 a=0.001342	agent0	initial_cond	2	-0.000000
exp1390	2.03509144e-27	0.000000	0.000000	discard	u=0.0986 a=0.001342	agent0	initial_cond	1	-0.000000
exp1390	2.03509144e-27	0.000000	0.000000	discard	u=0.0982 a=0.001348	agent0	initial_cond	1	-0.000000
exp1390	2.03509144e-27	0.000000	0.000000	discard	u=0.0986 a=0.001340	agent0	initial_cond	1	-0.000000
exp1390	2.03509144e-27	0.000000	0.000000	discard	u=0.0988 a=0.001340	agent0	initial_cond	1	-0.000000
exp1390	2.03509144e-27	0.000000	0.000000	discard	u=0.0984 a=0.001348	agent0	initial_cond	1	-0.000000
exp1391	2.03509144e-27	0.000000	0.000000	discard	u=0.0982 a=0.001346	agent0	initial_cond	1	-0.000000
exp1391	2.03509144e-27	0.000000	0.000000	discard	u=0.0984 a=0.001340	agent0	initial_cond	1	-0.000000
exp1391	2.03509144e-27	0.000000	0.000000	discard	u=0.0984 a=0.001342	agent0	initial_cond	1	-0.000000
exp1392	2.03509144e-27	0.000000	0.000000	discard	u=0.0988 a=0.001346	agent0	initial_cond	2	-0.000000
exp1392	2.03509144e-27	0.000000	0.000000	discard	u=0.0984 a=0.001346	agent0	initial_cond	2	-0.000000
exp1392	2.03509144e-27	0.000000	0.000000	discard	u=0.0982 a=0.001350	agent0	initial_cond	2	-0.000000
exp1392	2.03509144e-27	0.000000	0.000000	discard	u=0.0984 a=0.001344	agent0	initial_cond	2	-0.000000
exp1392	2.03509144e-27	0.000000	0.000000	discard	u=0.0984 a=0.001350	agent0	initial_cond	2	-0.000000
exp1393	1.34357540e-12	1.002503	-1.000218	discard	neg u=-1.2 amp=0.5 mode=3 n=269	agent1	memory	2	-1.523848
exp1393	2.03509144e-27	0.000000	0.000000	discard	u=0.0986 a=0.001350	agent0	initial_cond	2	-0.000000
exp1393	2.03509144e-27	0.000000	0.000000	discard	u=0.0988 a=0.001344	agent0	initial_cond	2	-0.000000
