exp_id	residual	solution_norm	solution_mean	status	description	agent	design	elapsed_s	solution_energy
exp407	crash	0	0	crash	pos nodes=275 amp=0.5 mode=3 tol=2.5e-12	agent0	solver_param	0	0
exp408	crash	0	0	crash	pos nodes=280 amp=0.5 mode=3 tol=2.5e-12	agent0	solver_param	0	0
exp409	crash	0	0	crash	pos nodes=285 amp=0.5 mode=3 tol=2.5e-12	agent0	solver_param	1	0
exp410	crash	0	0	crash	pos nodes=290 amp=0.5 mode=3 tol=2.5e-12	agent0	solver_param	0	0
exp411	crash	0	0	crash	pos nodes=295 amp=0.5 mode=3 tol=2.5e-12	agent0	solver_param	0	0
exp412	crash	0	0	crash	pos nodes=300 amp=0.5 mode=3 tol=2.5e-12	agent0	solver_param	1	0
exp413	1.93466006e-23	0.000000	0.000000	discard	basin boundary u_offset=0.4 Fourier 4modes	agent1	perturbation	0	-0.000000
exp414	1.53755377e-21	0.000000	0.000000	discard	u=0.460 amp=0.0035	agent0	initial_cond	1	0.000000
exp414	1.53755377e-21	0.000000	0.000000	discard	u=0.461 amp=0.0035	agent0	initial_cond	1	0.000000
exp414	1.53755377e-21	0.000000	0.000000	discard	u=0.460 amp=0.0045	agent0	initial_cond	1	0.000000
exp414	1.53755377e-21	0.000000	0.000000	discard	u=0.460 amp=0.004	agent0	initial_cond	1	0.000000
exp415	1.53755377e-21	0.000000	0.000000	discard	u=0.464 amp=0.0035	agent0	initial_cond	1	0.000000
exp415	1.53755377e-21	0.000000	0.000000	discard	u=0.462 amp=0.0035	agent0	initial_cond	1	0.000000
exp415	1.53755377e-21	0.000000	0.000000	discard	u=0.463 amp=0.0045	agent0	initial_cond	1	0.000000
exp415	1.53755377e-21	0.000000	0.000000	discard	u=0.461 amp=0.0045	agent0	initial_cond	1	0.000000
exp415	1.53755377e-21	0.000000	0.000000	discard	u=0.462 amp=0.004	agent0	initial_cond	1	0.000000
exp415	1.53755377e-21	0.000000	0.000000	discard	u=0.468 amp=0.0035	agent0	initial_cond	1	0.000000
exp416	1.53755377e-21	0.000000	0.000000	discard	u=0.461 amp=0.004	agent0	initial_cond	1	0.000000
exp416	1.53755377e-21	0.000000	0.000000	discard	u=0.464 amp=0.004	agent0	initial_cond	1	0.000000
exp416	1.53755377e-21	0.000000	0.000000	discard	u=0.465 amp=0.004	agent0	initial_cond	1	0.000000
exp416	1.53755377e-21	0.000000	0.000000	discard	u=0.465 amp=0.0035	agent0	initial_cond	1	0.000000
exp416	1.53755377e-21	0.000000	0.000000	discard	u=0.462 amp=0.0045	agent0	initial_cond	1	0.000000
exp416	1.53755377e-21	0.000000	0.000000	discard	u=0.466 amp=0.0035	agent0	initial_cond	1	0.000000
exp417	1.53755377e-21	0.000000	0.000000	discard	u=0.463 amp=0.0035	agent0	initial_cond	1	0.000000
exp417	1.53755377e-21	0.000000	0.000000	discard	u=0.463 amp=0.004	agent0	initial_cond	1	0.000000
exp417	1.53755377e-21	0.000000	0.000000	discard	u=0.468 amp=0.004	agent0	initial_cond	2	0.000000
exp418	1.53755377e-21	0.000000	0.000000	discard	u=0.465 amp=0.0045	agent0	initial_cond	2	0.000000
exp418	1.53755377e-21	0.000000	0.000000	discard	u=0.466 amp=0.0045	agent0	initial_cond	2	0.000000
exp418	1.53755377e-21	0.000000	0.000000	discard	u=0.464 amp=0.0045	agent0	initial_cond	2	0.000000
exp418	1.53755377e-21	0.000000	0.000000	discard	u=0.466 amp=0.004	agent0	initial_cond	2	0.000000
exp418	1.53755377e-21	0.000000	0.000000	discard	u=0.467 amp=0.004	agent0	initial_cond	2	0.000000
exp418	1.53755377e-21	0.000000	0.000000	discard	u=0.467 amp=0.0035	agent0	initial_cond	2	0.000000
exp418	1.53755377e-21	0.000000	0.000000	discard	u=0.467 amp=0.0045	agent0	initial_cond	2	0.000000
exp419	1.53755377e-21	0.000000	0.000000	discard	u=0.468 amp=0.0045	agent0	initial_cond	1	0.000000
exp420	1.34357540e-12	1.002503	1.000218	discard	pos nodes=269 amp=0.5 mode=3 tol=2.5e-12	agent0	solver_param	0	-1.523848
exp421	1.93466006e-23	0.000000	0.000000	discard	boundary exploration u=0.55	agent1	initial_cond	1	-0.000000
exp422	8.70547970e-24	0.000000	0.000000	discard	best config u=0.464 amp=0.004	agent0	initial_cond	0	0.000000
exp423	3.95472360e-16	0.000000	0.000000	discard	basin boundary u_offset=0.45 Fourier 4modes	agent1	perturbation	1	-0.000000
exp424	1.34360442e-12	1.002503	-1.000218	discard	neg nodes=269 amp=0.5 mode=3 tol=2.5e-12	agent0	solver_param	0	-1.523848
exp425	2.13088450e-15	1.001296	1.000019	discard	boundary u=0.50	agent1	initial_cond	0	-1.520844
exp426	3.39573826e-15	0.000000	0.000000	discard	amp=0.003 p=2.8	agent0	initial_cond	1	0.000000
exp427	7.97129463e-19	0.000000	0.000000	discard	amp=0.003 p=3.0	agent0	initial_cond	0	0.000000
exp428	7.61712710e-12	0.000000	0.000000	discard	amp=0.003 p=3.14	agent0	initial_cond	0	-0.000000
exp429	7.05174203e-19	0.000000	0.000000	discard	amp=0.003 p=3.28	agent0	initial_cond	1	0.000000
exp430	8.89392157e-17	0.000000	0.000000	discard	amp=0.003 p=3.4	agent0	initial_cond	0	0.000000
exp431	1.34357540e-12	1.002503	1.000218	discard	amp=0.0035 p=2.8	agent0	initial_cond	0	-1.523848
exp432	1.34357540e-12	1.002503	1.000218	discard	pos n=269 amp=0.5 mode=3 tol=2.0e-12	agent0	solver_param	0	-1.523848
exp433	1.34357540e-12	1.002503	1.000218	discard	amp=0.0035 p=3.0	agent0	initial_cond	0	-1.523848
exp434	1.34357540e-12	1.002503	1.000218	discard	pos n=269 amp=0.5 mode=3 tol=1.5e-12	agent0	solver_param	0	-1.523848
exp435	crash	0	0	crash	amp=0.0035 p=3.14	agent0	initial_cond	0	0
exp436	crash	0	0	crash	pos n=269 amp=0.5 mode=3 tol=1.0e-12	agent0	solver_param	0	0
exp437	2.17119643e-18	0.000000	0.000000	discard	amp=0.0035 p=3.28	agent0	initial_cond	1	0.000000
exp438	4.48811800e-16	0.000000	0.000000	discard	amp=0.0035 p=3.4	agent0	initial_cond	0	0.000000
exp439	1.62743264e-13	0.000000	0.000000	discard	amp=0.004 p=2.8	agent0	initial_cond	0	0.000000
exp440	7.18980681e-18	0.000000	0.000000	discard	amp=0.004 p=3.0	agent0	initial_cond	1	0.000000
exp441	8.70547970e-24	0.000000	0.000000	discard	amp=0.004 p=3.14	agent0	initial_cond	0	0.000000
exp442	6.22442158e-18	0.000000	0.000000	discard	amp=0.004 p=3.28	agent0	initial_cond	0	0.000000
exp443	2.13088450e-15	1.001296	1.000019	discard	basin boundary u_offset=0.48 Fourier 4modes	agent1	perturbation	1	-1.520844
exp444	1.98646893e-15	0.000000	0.000000	discard	amp=0.004 p=3.4	agent0	initial_cond	0	0.000000
exp445	1.37447588e-18	0.000000	-0.000000	discard	amp=0.0045 p=2.8	agent0	initial_cond	0	0.000000
exp446	1.96105164e-17	0.000000	0.000000	discard	amp=0.0045 p=3.0	agent0	initial_cond	1	0.000000
exp447	1.14566600e-23	0.000000	-0.000000	discard	amp=0.0045 p=3.14	agent0	initial_cond	0	0.000000
exp448	1.68500888e-17	0.000000	0.000000	discard	amp=0.0045 p=3.28	agent0	initial_cond	0	0.000000
exp449	7.84777145e-15	0.000000	0.000000	discard	amp=0.0045 p=3.4	agent0	initial_cond	1	0.000000
exp450	1.80505601e-17	0.000000	-0.000000	discard	amp=0.005 p=2.8	agent0	initial_cond	0	0.000000
exp451	5.07357400e-17	0.000000	0.000000	discard	amp=0.005 p=3.0	agent0	initial_cond	0	0.000000
exp452	8.98199830e-23	0.000000	0.000000	discard	amp=0.005 p=3.14	agent0	initial_cond	1	0.000000
exp453	2.13088450e-15	1.001296	1.000019	discard	boundary u=0.52	agent1	initial_cond	0	-1.520844
exp454	4.31438242e-17	0.000000	0.000000	discard	amp=0.005 p=3.28	agent0	initial_cond	0	0.000000
exp455	2.80737565e-14	0.000000	0.000000	discard	amp=0.005 p=3.4	agent0	initial_cond	1	0.000000
exp456	1.12100058e-22	0.000000	-0.000000	discard	phase=3.138	agent0	initial_cond	0	0.000000
exp457	2.20695668e-23	0.000000	0.000000	discard	phase=3.1395	agent0	initial_cond	0	0.000000
exp458	8.70547970e-24	0.000000	0.000000	discard	phase=3.14	agent0	initial_cond	1	0.000000
exp459	1.44821532e-23	0.000000	0.000000	discard	phase=3.1405	agent0	initial_cond	0	0.000000
exp460	1.81339908e-12	0.000000	0.000000	discard	phase=3.141	agent0	initial_cond	0	-0.000000
exp461	2.15736580e-22	0.000000	-0.000000	discard	phase=3.142	agent0	initial_cond	1	0.000000
exp462	2.58112775e-23	0.000000	0.000000	discard	phase=3.143	agent0	initial_cond	0	0.000000
exp463	1.34715656e-25	0.000000	0.000000	discard	basin boundary u_offset=0.46 Fourier 4modes	agent1	perturbation	0	-0.000000
exp464	1.34715656e-25	0.000000	0.000000	discard	boundary u=0.56	agent1	initial_cond	0	-0.000000
exp465	4.12481252e-21	0.000000	0.000000	discard	boundary u=0.48 amp=0.5 mode=3 n=269	agent0	branch_search	0	-0.000000
exp466	1.34357540e-12	1.002503	-1.000218	discard	boundary u=0.49 amp=0.5 mode=3 n=269	agent0	branch_search	1	-1.523848
exp467	crash	0	0	crash	boundary u=0.50 amp=0.5 mode=3 n=269	agent0	branch_search	0	0
exp468	1.34357540e-12	1.002503	-1.000218	discard	boundary u=0.51 amp=0.5 mode=3 n=269	agent0	branch_search	0	-1.523848
exp469	1.34357540e-12	1.002503	1.000218	discard	boundary u=0.52 amp=0.5 mode=3 n=269	agent0	branch_search	1	-1.523848
exp470	1.34357540e-12	1.002503	1.000218	discard	boundary u=0.53 amp=0.5 mode=3 n=269	agent0	branch_search	0	-1.523848
exp471	1.45056491e-13	0.000000	0.000000	discard	u=0.0	agent0	initial_cond	0	-0.000000
exp472	1.45056491e-13	0.000000	0.000000	discard	u=0.0	agent0	initial_cond	0	-0.000000
exp473	2.98677268e-17	0.000000	-0.000000	discard	u=0.1	agent0	initial_cond	1	0.000000
exp474	2.98677268e-17	0.000000	-0.000000	discard	u=0.1	agent0	initial_cond	0	0.000000
exp475	3.48307749e-15	0.000000	0.000000	discard	u=0.2	agent0	initial_cond	0	-0.000000
exp476	1.26950752e-12	1.001296	-1.000019	discard	basin boundary u_offset=0.47 Fourier 4modes	agent1	perturbation	0	-1.520844
exp477	3.48307749e-15	0.000000	0.000000	discard	u=0.2	agent0	initial_cond	1	-0.000000
exp478	1.26950752e-12	1.001296	-1.000019	discard	boundary u=0.57	agent1	initial_cond	1	-1.520844
exp479	1.13316115e-15	0.000000	0.000000	discard	u=0.3	agent0	initial_cond	0	-0.000000
exp480	1.13316115e-15	0.000000	0.000000	discard	u=0.3	agent0	initial_cond	0	-0.000000
exp481	4.03748224e-14	0.000000	0.000000	discard	u=0.35	agent0	initial_cond	1	-0.000000
exp482	4.03748224e-14	0.000000	0.000000	discard	u=0.35	agent0	initial_cond	0	-0.000000
exp483	6.66601342e-19	0.000000	0.000000	discard	u=0.40	agent0	initial_cond	1	-0.000000
exp484	6.66601342e-19	0.000000	0.000000	discard	u=0.40	agent0	initial_cond	0	-0.000000
exp485	3.76392918e-23	0.000000	0.000000	discard	u=0.45	agent0	initial_cond	0	0.000000
exp486	3.76392918e-23	0.000000	0.000000	discard	u=0.45	agent0	initial_cond	1	0.000000
exp487	3.25175165e-12	1.002503	-1.000218	discard	u=0.50	agent0	initial_cond	0	-1.523848
exp488	3.25175165e-12	1.002503	-1.000218	discard	u=0.50	agent0	initial_cond	0	-1.523848
exp489	3.25175408e-12	1.002503	-1.000218	discard	u=0.55	agent0	initial_cond	1	-1.523848
exp490	3.25175408e-12	1.002503	-1.000218	discard	u=0.55	agent0	initial_cond	0	-1.523848
exp491	3.25175165e-12	1.002503	1.000218	discard	u=0.60	agent0	initial_cond	0	-1.523848
exp492	3.25175165e-12	1.002503	1.000218	discard	u=0.60	agent0	initial_cond	0	-1.523848
exp493	1.05065435e-20	0.000000	-0.000000	discard	u=-0.40	agent0	initial_cond	0	-0.000000
exp494	1.05065435e-20	0.000000	-0.000000	discard	u=-0.40	agent0	initial_cond	1	-0.000000
exp495	6.70617119e-22	0.000000	-0.000000	discard	u=-0.45	agent0	initial_cond	0	0.000000
exp496	1.34357540e-12	1.002503	1.000218	discard	u=-0.45	agent0	initial_cond	0	-1.523848
exp496	1.34357540e-12	1.002503	1.000218	discard	pos u_offset=1.1 amp=0.5 mode=3 n=269	agent0	branch_search	0	-1.523848
exp497	1.34357540e-12	1.002503	1.000218	discard	u=-0.46	agent0	initial_cond	0	-1.523848
exp497	1.34357540e-12	1.002503	1.000218	discard	pos u_offset=1.2 amp=0.5 mode=3 n=269	agent0	branch_search	0	-1.523848
exp498	1.34357540e-12	1.002503	1.000218	discard	u=-0.46	agent0	initial_cond	0	-1.523848
exp498	1.34357540e-12	1.002503	1.000218	discard	pos u_offset=1.3 amp=0.5 mode=3 n=269	agent0	branch_search	0	-1.523848
exp499	1.34357540e-12	1.002503	1.000218	discard	u=-0.465	agent0	initial_cond	1	-1.523848
exp499	1.34357540e-12	1.002503	1.000218	discard	pos u_offset=1.4 amp=0.5 mode=3 n=269	agent0	branch_search	1	-1.523848
exp500	1.34360442e-12	1.002503	1.000218	discard	pos u_offset=1.5 amp=0.5 mode=3 n=269	agent0	branch_search	0	-1.523848
exp500	1.34360442e-12	1.002503	1.000218	discard	u=-0.465	agent0	initial_cond	0	-1.523848
exp501	1.31340144e-12	0.000000	-0.000000	discard	u=-0.47	agent0	initial_cond	1	-0.000000
exp502	1.31340144e-12	0.000000	-0.000000	discard	u=-0.47	agent0	initial_cond	0	-0.000000
exp503	1.34715656e-25	0.000000	-0.000000	discard	basin boundary u_offset=-0.46 Fourier 4modes	agent1	perturbation	1	-0.000000
exp504	7.47676032e-22	0.000000	0.000000	discard	u=0.445	agent0	initial_cond	0	0.000000
exp505	2.91301103e-21	0.000000	0.000000	discard	u=0.448	agent0	initial_cond	0	0.000000
exp506	3.76392918e-23	0.000000	0.000000	discard	u=0.450	agent0	initial_cond	1	0.000000
exp507	2.03586261e-23	0.000000	0.000000	discard	u=0.452	agent0	initial_cond	0	0.000000
exp508	1.13595461e-23	0.000000	-0.000000	discard	u=0.455	agent0	initial_cond	1	0.000000
exp509	6.78646155e-14	0.000000	0.000000	discard	explore u=0.1 amp=0.5 mode=2 n=269	agent0	branch_search	0	-0.000000
exp510	1.51583218e-14	0.000000	0.000000	discard	explore u=0.15 amp=0.5 mode=2 n=269	agent0	branch_search	1	-0.000000
exp511	5.28179296e-14	0.000000	0.000000	discard	explore u=0.2 amp=0.5 mode=2 n=269	agent0	branch_search	0	-0.000000
exp512	2.30063510e-12	0.000000	0.000000	discard	explore u=0.25 amp=0.5 mode=2 n=269	agent0	branch_search	0	-0.000000
exp513	9.81729082e-18	0.000000	0.000000	discard	explore u=0.3 amp=0.5 mode=2 n=269	agent0	branch_search	1	-0.000000
exp514	1.34357540e-12	1.002503	-1.000218	discard	explore u=0.35 amp=0.5 mode=2 n=269	agent0	branch_search	0	-1.523848
exp515	1.30661286e-20	0.000000	-0.000000	discard	explore u=0.4 amp=0.5 mode=2 n=269	agent0	branch_search	1	0.000000
exp516	1.34357540e-12	1.002503	1.000218	discard	explore u=0.45 amp=0.5 mode=2 n=269	agent0	branch_search	0	-1.523848
exp517	3.76392918e-23	0.000000	0.000000	discard	u=0.450	agent0	initial_cond	0	0.000000
exp518	2.03586261e-23	0.000000	0.000000	discard	u=0.452	agent0	initial_cond	0	0.000000
exp519	1.84749937e-23	0.000000	0.000000	discard	u=0.454	agent0	initial_cond	0	0.000000
exp520	1.26950752e-12	1.001296	1.000019	discard	basin boundary u_offset=-0.47 Fourier 4modes	agent1	perturbation	0	-1.520844
exp521	2.68198988e-23	0.000000	-0.000000	discard	u=0.456	agent0	initial_cond	1	0.000000
exp522	3.48998870e-23	0.000000	-0.000000	discard	u=0.458	agent0	initial_cond	0	0.000000
exp523	2.07280771e-23	0.000000	-0.000000	discard	u=0.460	agent0	initial_cond	0	0.000000
exp524	3.18368338e-23	0.000000	-0.000000	discard	u=0.462	agent0	initial_cond	1	0.000000
exp525	8.70547970e-24	0.000000	0.000000	discard	u=0.464	agent0	initial_cond	0	0.000000
exp526	8.45572777e-12	0.000000	0.000000	discard	u=0.466	agent0	initial_cond	1	-0.000000
exp527	1.26950752e-12	1.001296	1.000019	discard	u=0.54	agent1	initial_cond	1	-1.520844
exp528	2.19641993e-17	0.000000	0.000000	discard	super-conv u=0.463 tol=1.0e-13	agent0	solver_param	1	-0.000000
exp529	2.19641993e-17	0.000000	0.000000	discard	super-conv u=0.463 tol=1.0e-14	agent0	solver_param	0	-0.000000
exp530	2.19641993e-17	0.000000	0.000000	discard	super-conv u=0.463 tol=1.0e-15	agent0	solver_param	0	-0.000000
exp531	7.32285656e-24	0.000000	-0.000000	discard	amp=0.0038	agent0	initial_cond	0	0.000000
exp532	2.80154904e-23	0.000000	0.000000	discard	amp=0.0039	agent0	initial_cond	0	0.000000
exp533	8.70547970e-24	0.000000	0.000000	discard	amp=0.004	agent0	initial_cond	1	0.000000
exp534	2.65329599e-23	0.000000	0.000000	discard	amp=0.0041	agent0	initial_cond	0	0.000000
exp535	2.26151954e-23	0.000000	-0.000000	discard	amp=0.0042	agent0	initial_cond	1	0.000000
exp536	2.06774381e-16	1.001296	1.000019	discard	u=0.555	agent1	initial_cond	0	-1.520844
exp537	1.33817560e-15	0.000000	0.000000	discard	super-conv u=0.463 n=100 tol=1e-13	agent0	solver_param	0	-0.000000
exp538	7.33311072e-16	0.000000	0.000000	discard	super-conv u=0.463 n=150 tol=1e-13	agent0	solver_param	0	-0.000000
exp539	2.19905652e-17	0.000000	0.000000	discard	super-conv u=0.463 n=200 tol=1e-13	agent0	solver_param	0	-0.000000
exp540	2.19641993e-17	0.000000	0.000000	discard	super-conv u=0.463 n=250 tol=1e-13	agent0	solver_param	0	-0.000000
exp541	2.15768612e-17	0.000000	0.000000	discard	super-conv u=0.463 n=300 tol=1e-13	agent0	solver_param	1	-0.000000
exp542	2.06774381e-16	1.001296	1.000019	discard	Fourier 4modes positive mode-2 perturbation	agent1	perturbation	1	-1.520844
exp543	7.40643458e-24	0.000000	-0.000000	discard	amp=0.00375	agent0	initial_cond	0	0.000000
exp544	2.73711008e-23	0.000000	0.000000	discard	amp=0.00377	agent0	initial_cond	0	0.000000
exp545	2.13632946e-23	0.000000	-0.000000	discard	amp=0.00378	agent0	initial_cond	1	0.000000
exp546	8.67051728e-24	0.000000	-0.000000	discard	amp=0.00379	agent0	initial_cond	0	0.000000
exp547	7.32285656e-24	0.000000	-0.000000	discard	amp=0.00380	agent0	initial_cond	0	0.000000
exp548	1.58671297e-23	0.000000	-0.000000	discard	amp=0.00381	agent0	initial_cond	0	0.000000
exp549	2.01571726e-23	0.000000	-0.000000	discard	amp=0.00382	agent0	initial_cond	0	0.000000
exp549	2.06774381e-16	1.001296	1.000019	discard	u=0.559	agent1	initial_cond	0	-1.520844
exp550	3.52651286e-23	0.000000	0.000000	discard	amp=0.003700	agent0	initial_cond	1	0.000000
exp551	2.67668477e-23	0.000000	0.000000	discard	amp=0.003710	agent0	initial_cond	0	0.000000
exp552	0.00000000e+00	0.000000	0.000000	discard	amp=0.003720	agent0	initial_cond	0	0.000000
exp552	0.00000000e+00	0.000000	0.000000	discard	trivial u=0 n=300 tol=1e-13	agent0	solver_param	0	0.000000
exp553	1.01634689e-23	0.000000	0.000000	discard	amp=0.003730	agent0	initial_cond	0	0.000000
exp554	1.45157375e-23	0.000000	-0.000000	discard	amp=0.003740	agent0	initial_cond	0	0.000000
exp555	7.40643458e-24	0.000000	-0.000000	discard	amp=0.003750	agent0	initial_cond	1	0.000000
exp556	7.46562045e-24	0.000000	-0.000000	discard	amp=0.003760	agent0	initial_cond	0	0.000000
exp557	5.40101384e-12	1.001296	1.000019	discard	Fourier 4modes pos mode-3 phase=pi/2	agent1	perturbation	1	-1.520844
exp558	1.19482534e-23	0.000000	-0.000000	discard	nodes=250	agent0	initial_cond	0	0.000000
exp559	6.52525564e-24	0.000000	0.000000	discard	nodes=275	agent0	initial_cond	1	0.000000
exp560	7.40643458e-24	0.000000	-0.000000	discard	nodes=300	agent0	initial_cond	0	0.000000
exp561	9.77917019e-24	0.000000	0.000000	discard	nodes=325	agent0	initial_cond	0	-0.000000
exp562	1.11789968e-23	0.000000	0.000000	discard	nodes=350	agent0	initial_cond	0	0.000000
exp563	5.40101384e-12	1.001296	1.000019	discard	negative u=-1.2 n=300 tol=1e-9 (recheck)	agent1	initial_cond	0	-1.520844
exp564	1.15593590e-18	0.000000	-0.000000	discard	u=0.463 a=0.3 m=1 n=269	agent0	perturbation	1	-0.000000
exp565	1.34360442e-12	1.002503	-1.000218	discard	u=0.463 a=0.3 m=2 n=269	agent0	perturbation	0	-1.523848
exp566	9.88475933e-16	0.000000	-0.000000	discard	u=0.463 a=0.3 m=3 n=269	agent0	perturbation	1	-0.000000
exp567	9.48240302e-16	0.000000	-0.000000	discard	u=0.463 a=0.4 m=1 n=269	agent0	perturbation	0	-0.000000
exp568	8.24070343e-19	0.000000	-0.000000	discard	u=0.463 a=0.4 m=2 n=269	agent0	perturbation	0	-0.000000
exp569	crash	0	0	crash	u=0.463 a=0.4 m=3 n=269	agent0	perturbation	1	0
exp570	2.21494273e-15	0.000000	-0.000000	discard	nodes=270	agent0	initial_cond	0	-0.000000
exp571	2.21494273e-15	0.000000	-0.000000	discard	u=0.463 a=0.5 m=1 n=269	agent0	perturbation	0	-0.000000
exp572	2.42968041e-15	0.000000	0.000000	discard	nodes=272	agent0	initial_cond	0	-0.000000
exp573	2.42968041e-15	0.000000	0.000000	discard	u=0.463 a=0.5 m=2 n=269	agent0	perturbation	0	-0.000000
exp574	1.34357540e-12	1.002503	-1.000218	discard	nodes=274	agent0	initial_cond	1	-1.523848
exp575	1.34357540e-12	1.002503	-1.000218	discard	u=0.463 a=0.5 m=3 n=269	agent0	perturbation	0	-1.523848
exp576	1.88543277e-16	0.000000	-0.000000	discard	nodes=275	agent0	initial_cond	0	-0.000000
exp577	1.88543277e-16	0.000000	-0.000000	discard	u=0.500 a=0.3 m=1 n=269	agent0	perturbation	0	-0.000000
exp578	1.34357540e-12	1.002503	1.000218	discard	nodes=276	agent0	initial_cond	1	-1.523848
exp579	1.34357540e-12	1.002503	1.000218	discard	u=0.500 a=0.3 m=2 n=269	agent0	perturbation	1	-1.523848
exp580	crash	0	0	crash	nodes=278	agent0	initial_cond	0	0
exp581	crash	0	0	crash	u=0.500 a=0.3 m=3 n=269	agent0	perturbation	0	0
exp582	4.22386168e-28	0.000000	0.000000	discard	negative u=-1.5	agent1	initial_cond	0	-0.000000
exp583	3.17599901e-18	0.000000	-0.000000	discard	nodes=280	agent0	initial_cond	0	-0.000000
exp584	3.17599901e-18	0.000000	-0.000000	discard	u=0.500 a=0.4 m=1 n=269	agent0	perturbation	1	-0.000000
exp585	1.34360442e-12	1.002503	-1.000218	discard	u=0.500 a=0.4 m=2 n=269	agent0	perturbation	0	-1.523848
exp586	6.90376485e-14	0.000000	0.000000	discard	u=0.500 a=0.4 m=3 n=269	agent0	perturbation	0	-0.000000
exp587	3.31923019e-14	0.000000	-0.000000	discard	u=0.500 a=0.5 m=1 n=269	agent0	perturbation	1	-0.000000
exp588	9.16445268e-23	0.000000	0.000000	discard	u=0.500 a=0.5 m=2 n=269	agent0	perturbation	0	0.000000
exp589	crash	0	0	crash	u=0.500 a=0.5 m=3 n=269	agent0	perturbation	0	0
exp590	4.69046256e-15	0.000000	-0.000000	discard	u=0.530 a=0.3 m=1 n=269	agent0	perturbation	0	-0.000000
exp591	1.83488344e-15	0.000000	0.000000	discard	u=0.530 a=0.3 m=2 n=269	agent0	perturbation	0	-0.000000
exp592	1.47160103e-13	0.000000	0.000000	discard	u=0.530 a=0.3 m=3 n=269	agent0	perturbation	1	-0.000000
exp593	7.40482087e-17	0.000000	-0.000000	discard	u=0.530 a=0.4 m=1 n=269	agent0	perturbation	0	-0.000000
exp594	4.22386168e-28	0.000000	0.000000	discard	Fourier 4modes trivial u_offset=0.1 ultra-low	agent1	ablation	0	-0.000000
exp595	crash	0	0	crash	u=0.530 a=0.4 m=2 n=269	agent0	perturbation	0	0
exp596	3.52368172e-21	0.000000	0.000000	discard	u=0.530 a=0.4 m=3 n=269	agent0	perturbation	1	0.000000
exp597	1.54735754e-16	0.000000	-0.000000	discard	tol=5.0e-12	agent0	initial_cond	0	-0.000000
exp598	1.54735754e-16	0.000000	-0.000000	discard	u=0.530 a=0.5 m=1 n=269	agent0	perturbation	0	-0.000000
exp599	1.34805948e-16	0.000000	-0.000000	discard	tol=1.0e-11	agent0	initial_cond	0	-0.000000
exp600	1.34805948e-16	0.000000	-0.000000	discard	u=0.530 a=0.5 m=2 n=269	agent0	perturbation	0	-0.000000
exp601	1.34357540e-12	1.002503	1.000218	discard	tol=2.0e-11	agent0	initial_cond	1	-1.523848
exp602	1.34357540e-12	1.002503	1.000218	discard	u=0.530 a=0.5 m=3 n=269	agent0	perturbation	0	-1.523848
