exp_id	residual	solution_norm	solution_mean	status	description	agent	design	elapsed_s	solution_energy
exp4230	2.00148302e-16	1.001298	-1.000025	discard	Fourier 2 neg rep 14	agent0	solver_param	1	-1.520921
exp4231	2.00148302e-16	1.001298	-1.000025	discard	cycle 20 u=0.1050	agent0	initial_cond	0	-1.520921
exp4232	2.00148302e-16	1.001298	-1.000025	discard	Fourier 2 neg rep 15	agent0	solver_param	0	-1.520921
exp4233	2.00148302e-16	1.001298	-1.000025	discard	cycle 20 u=0.1050	agent0	initial_cond	0	-1.520921
exp4234	1.11257917e-28	0.000000	0.000000	discard	Fourier 2 neg rep 16	agent0	solver_param	0	-0.000000
exp4235	2.00148302e-16	1.001298	-1.000025	discard	cycle 20 u=0.1050	agent0	initial_cond	1	-1.520921
exp4236	1.11257917e-28	0.000000	0.000000	discard	Fourier 2 neg rep 17	agent0	solver_param	1	-0.000000
exp4237	2.00148302e-16	1.001298	-1.000025	discard	cycle 20 u=0.1050	agent0	initial_cond	0	-1.520921
exp4238	1.11257917e-28	0.000000	0.000000	discard	Fourier 2 neg rep 18	agent0	solver_param	0	-0.000000
exp4239	2.00148302e-16	1.001298	-1.000025	discard	cycle 20 u=0.1050	agent0	initial_cond	0	-1.520921
exp4240	8.58580947e-29	0.000000	0.000000	discard	Fourier 2 neg rep 19	agent0	solver_param	1	0.000000
exp4241	8.58580947e-29	0.000000	0.000000	discard	cycle 21 u=0.0975	agent0	initial_cond	1	0.000000
exp4242	8.58580947e-29	0.000000	0.000000	discard	Fourier 2 neg rep 20	agent0	solver_param	0	0.000000
exp4243	8.58580947e-29	0.000000	0.000000	discard	cycle 21 u=0.0975	agent0	initial_cond	0	0.000000
exp4244	8.58580947e-29	0.000000	0.000000	discard	cycle 21 u=0.0975	agent0	initial_cond	0	0.000000
exp4245	5.23962023e-29	0.000000	0.000000	discard	cycle 21 u=0.0975	agent0	initial_cond	0	0.000000
exp4246	5.23962023e-29	0.000000	0.000000	discard	cycle 21 u=0.0975	agent0	initial_cond	0	0.000000
exp4247	5.23962023e-29	0.000000	0.000000	discard	cycle 21 u=0.0975	agent0	initial_cond	1	0.000000
exp4248	4.03266298e-29	0.000000	0.000000	discard	cycle 21 u=0.0975	agent0	initial_cond	0	0.000000
exp4249	4.03266298e-29	0.000000	0.000000	discard	cycle 21 u=0.0975	agent0	initial_cond	0	0.000000
exp4250	4.03266298e-29	0.000000	0.000000	discard	cycle 21 u=0.0975	agent0	initial_cond	1	0.000000
exp4251	4.80015937e-29	0.000000	0.000000	discard	cycle 21 u=0.0975	agent0	initial_cond	0	0.000000
exp4252	4.80015937e-29	0.000000	0.000000	discard	cycle 21 u=0.0975	agent0	initial_cond	0	0.000000
exp4253	4.80015937e-29	0.000000	0.000000	discard	cycle 21 u=0.0975	agent0	initial_cond	1	0.000000
exp4254	2.68824537e-29	0.000000	0.000000	discard	cycle 21 u=0.0980	agent0	initial_cond	0	-0.000000
exp4255	2.68824537e-29	0.000000	0.000000	discard	cycle 21 u=0.0980	agent0	initial_cond	0	-0.000000
exp4256	2.68824537e-29	0.000000	0.000000	discard	cycle 21 u=0.0980	agent0	initial_cond	0	-0.000000
exp4257	6.16758073e-29	0.000000	0.000000	discard	cycle 21 u=0.0980	agent0	initial_cond	0	-0.000000
exp4258	6.16758073e-29	0.000000	0.000000	discard	cycle 21 u=0.0980	agent0	initial_cond	1	-0.000000
exp4259	6.16758073e-29	0.000000	0.000000	discard	cycle 21 u=0.0980	agent0	initial_cond	0	-0.000000
exp4260	2.01926478e-29	0.000000	0.000000	discard	cycle 21 u=0.0980	agent0	initial_cond	0	0.000000
exp4261	2.01926478e-29	0.000000	0.000000	discard	cycle 21 u=0.0980	agent0	initial_cond	1	0.000000
exp4262	2.01926478e-29	0.000000	0.000000	discard	cycle 21 u=0.0980	agent0	initial_cond	0	0.000000
exp4263	1.30310780e-28	0.000000	0.000000	discard	cycle 21 u=0.0980	agent0	initial_cond	0	-0.000000
exp4264	1.30310780e-28	0.000000	0.000000	discard	cycle 21 u=0.0980	agent0	initial_cond	1	-0.000000
exp4265	1.30310780e-28	0.000000	0.000000	discard	cycle 21 u=0.0980	agent0	initial_cond	0	-0.000000
exp4266	5.45343271e-29	0.000000	0.000000	discard	cycle 21 u=0.0982	agent0	initial_cond	1	-0.000000
exp4267	5.45343271e-29	0.000000	0.000000	discard	cycle 21 u=0.0982	agent0	initial_cond	0	-0.000000
exp4268	5.45343271e-29	0.000000	0.000000	discard	cycle 21 u=0.0982	agent0	initial_cond	0	-0.000000
exp4269	1.23429977e-28	0.000000	0.000000	discard	cycle 21 u=0.0982	agent0	initial_cond	1	0.000000
exp4270	2.93044737e-23	0.000000	0.000000	discard	ultra mode=7 phase=1.4708 amp=.25 fourier=8	agent1	solver_param	0	-0.000000
exp4271	1.23429977e-28	0.000000	0.000000	discard	cycle 21 u=0.0982	agent0	initial_cond	0	0.000000
exp4272	1.68998580e-19	0.000000	-0.000000	discard	ultra mode=8 phase=1.4708 amp=.25 fourier=8	agent1	solver_param	0	0.000000
exp4272	1.23429977e-28	0.000000	0.000000	discard	cycle 21 u=0.0982	agent0	initial_cond	0	0.000000
exp4273	3.53878915e-23	0.000000	0.000000	discard	ultra mode=9 phase=1.4708 amp=.25 fourier=8	agent1	solver_param	1	0.000000
exp4273	1.88036672e-29	0.000000	0.000000	discard	cycle 21 u=0.0982	agent0	initial_cond	1	0.000000
exp4274	1.54167772e-22	0.000000	0.000000	discard	ultra mode=7 phase=1.4708 amp=.30 fourier=8	agent1	solver_param	0	0.000000
exp4274	1.88036672e-29	0.000000	0.000000	discard	cycle 21 u=0.0982	agent0	initial_cond	0	0.000000
exp4275	8.78333077e-19	0.000000	0.000000	discard	ultra mode=8 phase=1.4708 amp=.30 fourier=8	agent1	solver_param	0	0.000000
exp4275	1.88036672e-29	0.000000	0.000000	discard	cycle 21 u=0.0982	agent0	initial_cond	0	0.000000
exp4276	1.91190259e-29	0.000000	-0.000000	discard	cycle 21 u=0.0982	agent0	initial_cond	0	0.000000
exp4276	1.74954057e-22	0.000000	0.000000	discard	ultra mode=9 phase=1.4708 amp=.30 fourier=8	agent1	solver_param	0	0.000000
exp4277	1.91190259e-29	0.000000	-0.000000	discard	cycle 21 u=0.0982	agent0	initial_cond	0	0.000000
exp4277	2.89227224e-21	0.000000	0.000000	discard	ultra mode=7 phase=1.4708 amp=.35 fourier=8	agent1	solver_param	0	0.000000
exp4278	1.91190259e-29	0.000000	-0.000000	discard	cycle 21 u=0.0982	agent0	initial_cond	1	0.000000
exp4278	3.51469104e-18	0.000000	0.000000	discard	ultra mode=8 phase=1.4708 amp=.35 fourier=8	agent1	solver_param	1	0.000000
exp4279	6.13049994e-29	0.000000	0.000000	discard	cycle 21 u=0.0985	agent0	initial_cond	0	0.000000
exp4279	2.83112601e-21	0.000000	0.000000	discard	ultra mode=9 phase=1.4708 amp=.35 fourier=8	agent1	solver_param	0	0.000000
exp4280	6.13049994e-29	0.000000	0.000000	discard	cycle 21 u=0.0985	agent0	initial_cond	0	0.000000
exp4281	4.68621202e-23	0.000000	-0.000000	discard	ultra mode=7 phase=1.5208 amp=.25 fourier=8	agent1	solver_param	0	0.000000
exp4282	6.13049994e-29	0.000000	0.000000	discard	cycle 21 u=0.0985	agent0	initial_cond	1	0.000000
exp4283	8.11049457e-22	0.000000	0.000000	discard	ultra mode=8 phase=1.5208 amp=.25 fourier=8	agent1	solver_param	1	0.000000
exp4284	5.49750971e-29	0.000000	0.000000	discard	cycle 21 u=0.0985	agent0	initial_cond	0	0.000000
exp4285	5.26286921e-23	0.000000	0.000000	discard	ultra mode=9 phase=1.5208 amp=.25 fourier=8	agent1	solver_param	0	-0.000000
exp4286	5.49750971e-29	0.000000	0.000000	discard	cycle 21 u=0.0985	agent0	initial_cond	0	0.000000
exp4287	2.97346594e-22	0.000000	0.000000	discard	ultra mode=7 phase=1.5208 amp=.30 fourier=8	agent1	solver_param	0	0.000000
exp4288	5.49750971e-29	0.000000	0.000000	discard	cycle 21 u=0.0985	agent0	initial_cond	1	0.000000
exp4289	2.15195995e-21	0.000000	-0.000000	discard	ultra mode=8 phase=1.5208 amp=.30 fourier=8	agent1	solver_param	0	0.000000
exp4290	4.15642452e-29	0.000000	0.000000	discard	cycle 21 u=0.0985	agent0	initial_cond	0	0.000000
exp4291	2.81024486e-22	0.000000	-0.000000	discard	ultra mode=9 phase=1.5208 amp=.30 fourier=8	agent1	solver_param	0	0.000000
exp4292	4.15642452e-29	0.000000	0.000000	discard	cycle 21 u=0.0985	agent0	initial_cond	0	0.000000
exp4293	5.60387017e-21	0.000000	0.000000	discard	ultra mode=7 phase=1.5208 amp=.35 fourier=8	agent1	solver_param	1	0.000000
exp4294	4.15642452e-29	0.000000	0.000000	discard	cycle 21 u=0.0985	agent0	initial_cond	0	0.000000
exp4295	7.14579380e-21	0.000000	-0.000000	discard	ultra mode=8 phase=1.5208 amp=.35 fourier=8	agent1	solver_param	0	0.000000
exp4296	2.19292611e-29	0.000000	0.000000	discard	cycle 21 u=0.0985	agent0	initial_cond	0	-0.000000
exp4297	5.63112824e-21	0.000000	0.000000	discard	ultra mode=9 phase=1.5208 amp=.35 fourier=8	agent1	solver_param	0	0.000000
exp4298	2.19292611e-29	0.000000	0.000000	discard	cycle 21 u=0.0985	agent0	initial_cond	1	-0.000000
exp4299	5.13460046e-23	0.000000	0.000000	discard	ultra mode=7 phase=1.5708 amp=.25 fourier=8	agent1	solver_param	1	0.000000
exp4300	2.19292611e-29	0.000000	0.000000	discard	cycle 21 u=0.0985	agent0	initial_cond	0	-0.000000
exp4301	1.09869464e-18	0.000000	-0.000000	discard	ultra mode=8 phase=1.5708 amp=.25 fourier=8	agent1	solver_param	0	0.000000
exp4302	4.22491788e-29	0.000000	0.000000	discard	cycle 21 u=0.0990	agent0	initial_cond	0	-0.000000
exp4303	4.54284808e-23	0.000000	-0.000000	discard	ultra mode=9 phase=1.5708 amp=.25 fourier=8	agent1	solver_param	0	0.000000
exp4304	4.22491788e-29	0.000000	0.000000	discard	cycle 21 u=0.0990	agent0	initial_cond	1	-0.000000
exp4305	3.52142540e-22	0.000000	0.000000	discard	ultra mode=7 phase=1.5708 amp=.30 fourier=8	agent1	solver_param	0	0.000000
exp4306	4.22491788e-29	0.000000	0.000000	discard	cycle 21 u=0.0990	agent0	initial_cond	0	-0.000000
exp4307	1.89142490e-18	0.000000	0.000000	discard	ultra mode=8 phase=1.5708 amp=.30 fourier=8	agent1	solver_param	0	0.000000
exp4308	3.22245147e-29	0.000000	0.000000	discard	cycle 21 u=0.0990	agent0	initial_cond	0	0.000000
exp4309	3.38617867e-22	0.000000	-0.000000	discard	ultra mode=9 phase=1.5708 amp=.30 fourier=8	agent1	solver_param	1	0.000000
exp4310	3.22245147e-29	0.000000	0.000000	discard	cycle 21 u=0.0990	agent0	initial_cond	0	0.000000
exp4311	6.77057085e-21	0.000000	0.000000	discard	ultra mode=7 phase=1.5708 amp=.35 fourier=8	agent1	solver_param	0	0.000000
exp4312	3.22245147e-29	0.000000	0.000000	discard	cycle 21 u=0.0990	agent0	initial_cond	0	0.000000
exp4313	3.00744413e-18	0.000000	0.000000	discard	ultra mode=8 phase=1.5708 amp=.35 fourier=8	agent1	solver_param	0	0.000000
exp4314	4.50941488e-29	0.000000	-0.000000	discard	cycle 21 u=0.0990	agent0	initial_cond	1	0.000000
exp4315	6.82495430e-21	0.000000	-0.000000	discard	ultra mode=9 phase=1.5708 amp=.35 fourier=8	agent1	solver_param	1	0.000000
exp4316	4.50941488e-29	0.000000	-0.000000	discard	cycle 21 u=0.0990	agent0	initial_cond	0	0.000000
exp4317	4.82683172e-23	0.000000	-0.000000	discard	ultra mode=7 phase=1.6208 amp=.25 fourier=8	agent1	solver_param	0	0.000000
exp4318	4.50941488e-29	0.000000	-0.000000	discard	cycle 21 u=0.0990	agent0	initial_cond	0	0.000000
exp4319	7.83394032e-22	0.000000	0.000000	discard	ultra mode=8 phase=1.6208 amp=.25 fourier=8	agent1	solver_param	1	0.000000
exp4320	4.88330883e-29	0.000000	-0.000000	discard	cycle 21 u=0.0990	agent0	initial_cond	1	0.000000
exp4321	3.77697293e-23	0.000000	0.000000	discard	ultra mode=9 phase=1.6208 amp=.25 fourier=8	agent1	solver_param	0	0.000000
exp4322	4.88330883e-29	0.000000	-0.000000	discard	cycle 21 u=0.0990	agent0	initial_cond	0	0.000000
exp4323	2.76501756e-22	0.000000	0.000000	discard	ultra mode=7 phase=1.6208 amp=.30 fourier=8	agent1	solver_param	0	0.000000
exp4324	4.88330883e-29	0.000000	-0.000000	discard	cycle 21 u=0.0990	agent0	initial_cond	0	0.000000
exp4325	2.14791365e-21	0.000000	0.000000	discard	ultra mode=8 phase=1.6208 amp=.30 fourier=8	agent1	solver_param	1	0.000000
exp4326	5.74085541e-29	0.000000	-0.000000	discard	cycle 21 u=0.0995	agent0	initial_cond	1	0.000000
exp4327	3.00467537e-22	0.000000	-0.000000	discard	ultra mode=9 phase=1.6208 amp=.30 fourier=8	agent1	solver_param	0	0.000000
exp4328	5.74085541e-29	0.000000	-0.000000	discard	cycle 21 u=0.0995	agent0	initial_cond	0	0.000000
exp4329	5.59009494e-21	0.000000	-0.000000	discard	ultra mode=7 phase=1.6208 amp=.35 fourier=8	agent1	solver_param	0	0.000000
exp4329	5.74085541e-29	0.000000	-0.000000	discard	cycle 21 u=0.0995	agent0	initial_cond	0	0.000000
exp4330	6.65307862e-21	0.000000	0.000000	discard	ultra mode=8 phase=1.6208 amp=.35 fourier=8	agent1	solver_param	0	0.000000
exp4330	1.54984578e-28	0.000000	0.000000	discard	cycle 21 u=0.0995	agent0	initial_cond	0	-0.000000
exp4331	5.55055116e-21	0.000000	-0.000000	discard	ultra mode=9 phase=1.6208 amp=.35 fourier=8	agent1	solver_param	0	0.000000
exp4331	1.54984578e-28	0.000000	0.000000	discard	cycle 21 u=0.0995	agent0	initial_cond	0	-0.000000
exp4332	3.24525841e-23	0.000000	-0.000000	discard	ultra mode=7 phase=1.6708 amp=.25 fourier=8	agent1	solver_param	1	0.000000
exp4332	1.54984578e-28	0.000000	0.000000	discard	cycle 21 u=0.0995	agent0	initial_cond	1	-0.000000
exp4333	1.60328418e-29	0.000000	-0.000000	discard	cycle 21 u=0.0995	agent0	initial_cond	0	-0.000000
exp4333	1.69595072e-19	0.000000	0.000000	discard	ultra mode=8 phase=1.6708 amp=.25 fourier=8	agent1	solver_param	0	0.000000
exp4334	1.60328418e-29	0.000000	-0.000000	discard	cycle 21 u=0.0995	agent0	initial_cond	0	-0.000000
exp4334	2.84401185e-23	0.000000	-0.000000	discard	ultra mode=9 phase=1.6708 amp=.25 fourier=8	agent1	solver_param	0	-0.000000
exp4335	1.60328418e-29	0.000000	-0.000000	discard	cycle 21 u=0.0995	agent0	initial_cond	1	-0.000000
exp4335	1.90594500e-22	0.000000	-0.000000	discard	ultra mode=7 phase=1.6708 amp=.30 fourier=8	agent1	solver_param	1	0.000000
exp4336	2.00148302e-16	1.001298	1.000025	discard	cycle 21 u=0.0995	agent0	initial_cond	0	-1.520921
exp4336	8.76325565e-19	0.000000	-0.000000	discard	ultra mode=8 phase=1.6708 amp=.30 fourier=8	agent1	solver_param	0	0.000000
exp4337	7.34590618e-29	0.000000	0.000000	discard	ntol sweep 1.0e-15 run 1	agent0	solver_param	0	0.000000
exp4338	2.00148302e-16	1.001298	1.000025	discard	cycle 21 u=0.0995	agent0	initial_cond	0	-1.520921
exp4338	1.93725369e-22	0.000000	-0.000000	discard	ultra mode=9 phase=1.6708 amp=.30 fourier=8	agent1	solver_param	1	0.000000
exp4339	7.34590618e-29	0.000000	0.000000	discard	ntol sweep 1.0e-15 run 2	agent0	solver_param	1	0.000000
exp4340	7.34590618e-29	0.000000	0.000000	discard	cycle 21 u=0.0995	agent0	initial_cond	0	0.000000
exp4340	2.82696021e-21	0.000000	-0.000000	discard	ultra mode=7 phase=1.6708 amp=.35 fourier=8	agent1	solver_param	0	0.000000
exp4341	4.46546993e-29	0.000000	0.000000	discard	ntol sweep 1.0e-15 run 3	agent0	solver_param	0	-0.000000
exp4342	4.46546993e-29	0.000000	0.000000	discard	cycle 21 u=0.1000	agent0	initial_cond	0	-0.000000
exp4343	3.51707814e-18	0.000000	-0.000000	discard	ultra mode=8 phase=1.6708 amp=.35 fourier=8	agent1	solver_param	0	0.000000
exp4344	4.46546993e-29	0.000000	0.000000	discard	ntol sweep 1.0e-14 run 1	agent0	solver_param	1	-0.000000
exp4344	4.46546993e-29	0.000000	0.000000	discard	cycle 21 u=0.1000	agent0	initial_cond	1	-0.000000
exp4345	2.87209662e-21	0.000000	-0.000000	discard	ultra mode=9 phase=1.6708 amp=.35 fourier=8	agent1	solver_param	1	0.000000
exp4346	2.00148302e-16	1.001298	1.000025	discard	cycle 21 u=0.1000	agent0	initial_cond	0	-1.520921
exp4346	2.00148302e-16	1.001298	1.000025	discard	ntol sweep 1.0e-14 run 2	agent0	solver_param	0	-1.520921
exp4347	0.00000000e+00	0.998999	1.000000	discard	boundary hyper-precision	agent1	solver_param	0	-1.567655
exp4348	2.00148302e-16	1.001298	1.000025	discard	cycle 21 u=0.1000	agent0	initial_cond	0	-1.520921
exp4348	2.00148302e-16	1.001298	1.000025	discard	ntol sweep 5.0e-14 run 1	agent0	solver_param	0	-1.520921
exp4349	0.00000000e+00	0.998999	1.000000	discard	boundary hyper-precision	agent1	solver_param	0	-1.567655
exp4350	2.00148302e-16	1.001298	1.000025	discard	cycle 21 u=0.1000	agent0	initial_cond	1	-1.520921
exp4351	2.00148302e-16	1.001298	1.000025	discard	ntol sweep 1.0e-13 run 1	agent0	solver_param	0	-1.520921
exp4351	0.00000000e+00	0.998999	1.000000	discard	boundary hyper-precision	agent1	solver_param	0	-1.567655
exp4352	2.00148302e-16	1.001298	1.000025	discard	cycle 21 u=0.1000	agent0	initial_cond	0	-1.520921
exp4353	0.00000000e+00	0.998999	1.000000	discard	boundary hyper-precision	agent1	solver_param	0	-1.567655
exp4353	4.58623706e-29	0.000000	0.000000	discard	ntol sweep 5.0e-13 run 1	agent0	solver_param	0	-0.000000
exp4354	2.00148302e-16	1.001298	1.000025	discard	cycle 21 u=0.1000	agent0	initial_cond	1	-1.520921
exp4355	0.00000000e+00	0.998999	1.000000	discard	boundary hyper-precision	agent1	solver_param	1	-1.567655
exp4355	4.58623706e-29	0.000000	0.000000	discard	ntol sweep 5.0e-13 run 2	agent0	solver_param	1	-0.000000
exp4356	2.00148302e-16	1.001298	1.000025	discard	cycle 21 u=0.1000	agent0	initial_cond	0	-1.520921
exp4357	0.00000000e+00	0.998999	1.000000	discard	boundary hyper-precision	agent1	solver_param	0	-1.567655
exp4358	4.58623706e-29	0.000000	0.000000	discard	ntol sweep 5.0e-13 run 3	agent0	solver_param	0	-0.000000
exp4359	2.00148302e-16	1.001298	1.000025	discard	cycle 21 u=0.1000	agent0	initial_cond	0	-1.520921
exp4360	0.00000000e+00	0.998999	1.000000	discard	boundary hyper-precision	agent1	solver_param	0	-1.567655
exp4361	4.39794337e-29	0.000000	0.000000	discard	ntol sweep 1.0e-12 run 1	agent0	solver_param	1	-0.000000
exp4362	2.00148302e-16	1.001298	1.000025	discard	cycle 21 u=0.1000	agent0	initial_cond	1	-1.520921
exp4363	0.00000000e+00	0.998999	1.000000	discard	boundary hyper-precision	agent1	solver_param	1	-1.567655
exp4364	4.39794337e-29	0.000000	0.000000	discard	ntol sweep 1.0e-12 run 2	agent0	solver_param	0	-0.000000
exp4365	4.39794337e-29	0.000000	0.000000	discard	cycle 21 u=0.1000	agent0	initial_cond	0	-0.000000
exp4366	0.00000000e+00	0.998999	1.000000	discard	boundary hyper-precision	agent1	solver_param	0	-1.567655
exp4367	4.39794337e-29	0.000000	0.000000	discard	ntol sweep 1.0e-12 run 3	agent0	solver_param	0	-0.000000
exp4368	4.39794337e-29	0.000000	0.000000	discard	cycle 21 u=0.1000	agent0	initial_cond	0	-0.000000
exp4369	1.23835463e-27	0.000000	-0.000000	discard	mode=6 fourier=4	agent1	solver_param	1	-0.000000
exp4370	1.36727475e-28	0.000000	0.000000	discard	ntol sweep 5.0e-12 run 1	agent0	solver_param	1	-0.000000
exp4370	1.36727475e-28	0.000000	0.000000	discard	cycle 21 u=0.1050	agent0	initial_cond	0	-0.000000
exp4371	1.89010125e-18	0.000000	0.000000	discard	mode=6 fourier=6	agent1	solver_param	0	0.000000
exp4372	2.00148302e-16	1.001298	1.000025	discard	cycle 21 u=0.1050	agent0	initial_cond	0	-1.520921
exp4372	2.00148302e-16	1.001298	1.000025	discard	ntol sweep 5.0e-12 run 2	agent0	solver_param	0	-1.520921
exp4373	1.64573027e-25	0.000000	0.000000	discard	mode=6 fourier=8	agent1	solver_param	0	0.000000
exp4374	2.00148302e-16	1.001298	1.000025	discard	cycle 21 u=0.1050	agent0	initial_cond	1	-1.520921
exp4375	2.00148302e-16	1.001298	1.000025	discard	ntol sweep 1.0e-11 run 1	agent0	solver_param	1	-1.520921
exp4376	4.00744063e-25	0.000000	0.000000	discard	mode=6 fourier=10	agent1	solver_param	1	0.000000
exp4377	6.14461376e-29	0.000000	0.000000	discard	cycle 21 u=0.1050	agent0	initial_cond	0	-0.000000
exp4378	1.46980082e-24	0.000000	0.000000	discard	mode=6 fourier=12	agent1	solver_param	0	0.000000
exp4379	6.14461376e-29	0.000000	0.000000	discard	cycle 21 u=0.1050	agent0	initial_cond	0	-0.000000
exp4380	2.30234832e-24	0.000000	0.000000	discard	mode=6 fourier=16	agent1	solver_param	0	0.000000
exp4381	6.14461376e-29	0.000000	0.000000	discard	cycle 21 u=0.1050	agent0	initial_cond	1	-0.000000
exp4382	1.75906666e-28	0.000000	0.000000	discard	cycle 21 u=0.1050	agent0	initial_cond	0	-0.000000
exp4383	1.75906666e-28	0.000000	0.000000	discard	cycle 21 u=0.1050	agent0	initial_cond	0	-0.000000
exp4384	1.75906666e-28	0.000000	0.000000	discard	cycle 21 u=0.1050	agent0	initial_cond	1	-0.000000
exp4385	1.11257917e-28	0.000000	0.000000	discard	cycle 21 u=0.1050	agent0	initial_cond	0	-0.000000
exp4386	1.11257917e-28	0.000000	0.000000	discard	cycle 21 u=0.1050	agent0	initial_cond	0	-0.000000
exp4387	1.11257917e-28	0.000000	0.000000	discard	cycle 21 u=0.1050	agent0	initial_cond	0	-0.000000
exp4388	8.58580947e-29	0.000000	0.000000	discard	cycle 22 u=0.0975	agent0	initial_cond	0	0.000000
exp4389	8.58580947e-29	0.000000	0.000000	discard	cycle 22 u=0.0975	agent0	initial_cond	1	0.000000
exp4390	8.58580947e-29	0.000000	0.000000	discard	cycle 22 u=0.0975	agent0	initial_cond	0	0.000000
exp4391	5.23962023e-29	0.000000	0.000000	discard	cycle 22 u=0.0975	agent0	initial_cond	0	0.000000
exp4392	5.23962023e-29	0.000000	0.000000	discard	cycle 22 u=0.0975	agent0	initial_cond	1	0.000000
exp4393	5.23962023e-29	0.000000	0.000000	discard	cycle 22 u=0.0975	agent0	initial_cond	0	0.000000
exp4394	4.03266298e-29	0.000000	0.000000	discard	cycle 22 u=0.0975	agent0	initial_cond	0	0.000000
exp4395	4.03266298e-29	0.000000	0.000000	discard	cycle 22 u=0.0975	agent0	initial_cond	0	0.000000
exp4396	4.03266298e-29	0.000000	0.000000	discard	cycle 22 u=0.0975	agent0	initial_cond	0	0.000000
exp4397	4.80015937e-29	0.000000	0.000000	discard	cycle 22 u=0.0975	agent0	initial_cond	1	0.000000
exp4398	4.80015937e-29	0.000000	0.000000	discard	cycle 22 u=0.0975	agent0	initial_cond	0	0.000000
exp4399	4.80015937e-29	0.000000	0.000000	discard	cycle 22 u=0.0975	agent0	initial_cond	0	0.000000
exp4400	2.68824537e-29	0.000000	0.000000	discard	cycle 22 u=0.0980	agent0	initial_cond	1	-0.000000
exp4401	2.68824537e-29	0.000000	0.000000	discard	cycle 22 u=0.0980	agent0	initial_cond	0	-0.000000
exp4402	2.68824537e-29	0.000000	0.000000	discard	cycle 22 u=0.0980	agent0	initial_cond	0	-0.000000
exp4403	6.16758073e-29	0.000000	0.000000	discard	cycle 22 u=0.0980	agent0	initial_cond	1	-0.000000
exp4404	6.16758073e-29	0.000000	0.000000	discard	cycle 22 u=0.0980	agent0	initial_cond	0	-0.000000
exp4405	6.16758073e-29	0.000000	0.000000	discard	cycle 22 u=0.0980	agent0	initial_cond	0	-0.000000
exp4406	2.01926478e-29	0.000000	0.000000	discard	cycle 22 u=0.0980	agent0	initial_cond	0	0.000000
exp4407	2.01926478e-29	0.000000	0.000000	discard	cycle 22 u=0.0980	agent0	initial_cond	0	0.000000
exp4408	2.01926478e-29	0.000000	0.000000	discard	cycle 22 u=0.0980	agent0	initial_cond	1	0.000000
exp4409	1.30310780e-28	0.000000	0.000000	discard	cycle 22 u=0.0980	agent0	initial_cond	0	-0.000000
exp4410	1.30310780e-28	0.000000	0.000000	discard	cycle 22 u=0.0980	agent0	initial_cond	0	-0.000000
exp4411	1.30310780e-28	0.000000	0.000000	discard	cycle 22 u=0.0980	agent0	initial_cond	1	-0.000000
