exp_id	residual	solution_norm	solution_mean	status	description	agent	design	elapsed_s	solution_energy
exp13431	1.60328418e-29	0.000000	-0.000000	discard	cycle 101 u=0.0995	agent0	initial_cond	0	-0.000000
exp13432	1.60328418e-29	0.000000	-0.000000	discard	cycle 101 u=0.0995	agent0	initial_cond	0	-0.000000
exp13433	7.34590618e-29	0.000000	0.000000	discard	cycle 101 u=0.0995	agent0	initial_cond	1	0.000000
exp13434	7.34590618e-29	0.000000	0.000000	discard	cycle 101 u=0.0995	agent0	initial_cond	0	0.000000
exp13435	7.34590618e-29	0.000000	0.000000	discard	cycle 101 u=0.0995	agent0	initial_cond	1	0.000000
exp13436	4.46546993e-29	0.000000	0.000000	discard	cycle 101 u=0.1000	agent0	initial_cond	0	-0.000000
exp13437	4.46546993e-29	0.000000	0.000000	discard	cycle 101 u=0.1000	agent0	initial_cond	0	-0.000000
exp13438	4.46546993e-29	0.000000	0.000000	discard	cycle 101 u=0.1000	agent0	initial_cond	0	-0.000000
exp13439	4.08106752e-29	0.000000	0.000000	discard	cycle 101 u=0.1000	agent0	initial_cond	0	-0.000000
exp13440	4.08106752e-29	0.000000	0.000000	discard	cycle 101 u=0.1000	agent0	initial_cond	1	-0.000000
exp13441	4.08106752e-29	0.000000	0.000000	discard	cycle 101 u=0.1000	agent0	initial_cond	0	-0.000000
exp13442	4.58623706e-29	0.000000	0.000000	discard	cycle 101 u=0.1000	agent0	initial_cond	0	-0.000000
exp13443	4.58623706e-29	0.000000	0.000000	discard	cycle 101 u=0.1000	agent0	initial_cond	0	-0.000000
exp13444	4.58623706e-29	0.000000	0.000000	discard	cycle 101 u=0.1000	agent0	initial_cond	0	-0.000000
exp13445	4.39794337e-29	0.000000	0.000000	discard	cycle 101 u=0.1000	agent0	initial_cond	1	-0.000000
exp13446	4.39794337e-29	0.000000	0.000000	discard	cycle 101 u=0.1000	agent0	initial_cond	0	-0.000000
exp13447	4.39794337e-29	0.000000	0.000000	discard	cycle 101 u=0.1000	agent0	initial_cond	0	-0.000000
exp13448	1.36727475e-28	0.000000	0.000000	discard	cycle 101 u=0.1050	agent0	initial_cond	0	-0.000000
exp13449	1.36727475e-28	0.000000	0.000000	discard	cycle 101 u=0.1050	agent0	initial_cond	0	-0.000000
exp13450	1.36727475e-28	0.000000	0.000000	discard	cycle 101 u=0.1050	agent0	initial_cond	1	-0.000000
exp13451	6.14461376e-29	0.000000	0.000000	discard	cycle 101 u=0.1050	agent0	initial_cond	0	-0.000000
exp13452	6.14461376e-29	0.000000	0.000000	discard	cycle 101 u=0.1050	agent0	initial_cond	1	-0.000000
exp13453	6.14461376e-29	0.000000	0.000000	discard	cycle 101 u=0.1050	agent0	initial_cond	0	-0.000000
exp13454	1.75906666e-28	0.000000	0.000000	discard	cycle 101 u=0.1050	agent0	initial_cond	0	-0.000000
exp13455	1.75906666e-28	0.000000	0.000000	discard	cycle 101 u=0.1050	agent0	initial_cond	1	-0.000000
exp13456	1.75906666e-28	0.000000	0.000000	discard	cycle 101 u=0.1050	agent0	initial_cond	0	-0.000000
exp13457	1.11257917e-28	0.000000	0.000000	discard	cycle 101 u=0.1050	agent0	initial_cond	1	-0.000000
exp13458	1.11257917e-28	0.000000	0.000000	discard	cycle 101 u=0.1050	agent0	initial_cond	0	-0.000000
exp13459	1.11257917e-28	0.000000	0.000000	discard	cycle 101 u=0.1050	agent0	initial_cond	0	-0.000000
exp13460	8.58580947e-29	0.000000	0.000000	discard	cycle 102 u=0.0975	agent0	initial_cond	0	0.000000
exp13461	8.58580947e-29	0.000000	0.000000	discard	cycle 102 u=0.0975	agent0	initial_cond	0	0.000000
exp13462	8.58580947e-29	0.000000	0.000000	discard	cycle 102 u=0.0975	agent0	initial_cond	1	0.000000
exp13463	5.23962023e-29	0.000000	0.000000	discard	cycle 102 u=0.0975	agent0	initial_cond	0	0.000000
exp13464	5.23962023e-29	0.000000	0.000000	discard	cycle 102 u=0.0975	agent0	initial_cond	0	0.000000
exp13465	5.23962023e-29	0.000000	0.000000	discard	cycle 102 u=0.0975	agent0	initial_cond	0	0.000000
exp13466	4.03266298e-29	0.000000	0.000000	discard	cycle 102 u=0.0975	agent0	initial_cond	0	0.000000
exp13467	4.03266298e-29	0.000000	0.000000	discard	cycle 102 u=0.0975	agent0	initial_cond	1	0.000000
exp13468	4.03266298e-29	0.000000	0.000000	discard	cycle 102 u=0.0975	agent0	initial_cond	0	0.000000
exp13469	4.80015937e-29	0.000000	0.000000	discard	cycle 102 u=0.0975	agent0	initial_cond	0	0.000000
exp13470	4.80015937e-29	0.000000	0.000000	discard	cycle 102 u=0.0975	agent0	initial_cond	0	0.000000
exp13471	4.80015937e-29	0.000000	0.000000	discard	cycle 102 u=0.0975	agent0	initial_cond	0	0.000000
exp13472	2.68824537e-29	0.000000	0.000000	discard	cycle 102 u=0.0980	agent0	initial_cond	1	-0.000000
exp13473	2.68824537e-29	0.000000	0.000000	discard	cycle 102 u=0.0980	agent0	initial_cond	0	-0.000000
exp13474	2.68824537e-29	0.000000	0.000000	discard	cycle 102 u=0.0980	agent0	initial_cond	0	-0.000000
exp13475	6.16758073e-29	0.000000	0.000000	discard	cycle 102 u=0.0980	agent0	initial_cond	0	-0.000000
exp13476	6.16758073e-29	0.000000	0.000000	discard	cycle 102 u=0.0980	agent0	initial_cond	0	-0.000000
exp13477	6.16758073e-29	0.000000	0.000000	discard	cycle 102 u=0.0980	agent0	initial_cond	1	-0.000000
exp13478	2.01926478e-29	0.000000	0.000000	discard	cycle 102 u=0.0980	agent0	initial_cond	0	0.000000
exp13479	2.01926478e-29	0.000000	0.000000	discard	cycle 102 u=0.0980	agent0	initial_cond	1	0.000000
exp13480	2.01926478e-29	0.000000	0.000000	discard	cycle 102 u=0.0980	agent0	initial_cond	0	0.000000
exp13481	1.30310780e-28	0.000000	0.000000	discard	cycle 102 u=0.0980	agent0	initial_cond	0	-0.000000
exp13482	1.30310780e-28	0.000000	0.000000	discard	cycle 102 u=0.0980	agent0	initial_cond	1	-0.000000
exp13483	1.30310780e-28	0.000000	0.000000	discard	cycle 102 u=0.0980	agent0	initial_cond	0	-0.000000
exp13484	5.45343271e-29	0.000000	0.000000	discard	cycle 102 u=0.0982	agent0	initial_cond	1	-0.000000
exp13485	5.45343271e-29	0.000000	0.000000	discard	cycle 102 u=0.0982	agent0	initial_cond	0	-0.000000
exp13486	5.45343271e-29	0.000000	0.000000	discard	cycle 102 u=0.0982	agent0	initial_cond	0	-0.000000
exp13487	1.23429977e-28	0.000000	0.000000	discard	cycle 102 u=0.0982	agent0	initial_cond	0	0.000000
exp13488	1.23429977e-28	0.000000	0.000000	discard	cycle 102 u=0.0982	agent0	initial_cond	0	0.000000
exp13489	1.23429977e-28	0.000000	0.000000	discard	cycle 102 u=0.0982	agent0	initial_cond	1	0.000000
exp13490	1.88036672e-29	0.000000	0.000000	discard	cycle 102 u=0.0982	agent0	initial_cond	0	0.000000
exp13491	1.88036672e-29	0.000000	0.000000	discard	cycle 102 u=0.0982	agent0	initial_cond	0	0.000000
exp13492	1.88036672e-29	0.000000	0.000000	discard	cycle 102 u=0.0982	agent0	initial_cond	0	0.000000
exp13493	1.91190259e-29	0.000000	-0.000000	discard	cycle 102 u=0.0982	agent0	initial_cond	0	0.000000
exp13494	1.91190259e-29	0.000000	-0.000000	discard	cycle 102 u=0.0982	agent0	initial_cond	1	0.000000
exp13495	1.91190259e-29	0.000000	-0.000000	discard	cycle 102 u=0.0982	agent0	initial_cond	0	0.000000
exp13496	6.13049994e-29	0.000000	0.000000	discard	cycle 102 u=0.0985	agent0	initial_cond	0	0.000000
exp13497	6.13049994e-29	0.000000	0.000000	discard	cycle 102 u=0.0985	agent0	initial_cond	0	0.000000
exp13498	6.13049994e-29	0.000000	0.000000	discard	cycle 102 u=0.0985	agent0	initial_cond	0	0.000000
exp13499	5.49750971e-29	0.000000	0.000000	discard	cycle 102 u=0.0985	agent0	initial_cond	1	0.000000
exp13500	5.49750971e-29	0.000000	0.000000	discard	cycle 102 u=0.0985	agent0	initial_cond	0	0.000000
exp13501	5.49750971e-29	0.000000	0.000000	discard	cycle 102 u=0.0985	agent0	initial_cond	1	0.000000
exp13502	4.15642452e-29	0.000000	0.000000	discard	cycle 102 u=0.0985	agent0	initial_cond	0	0.000000
exp13503	4.15642452e-29	0.000000	0.000000	discard	cycle 102 u=0.0985	agent0	initial_cond	0	0.000000
exp13504	4.15642452e-29	0.000000	0.000000	discard	cycle 102 u=0.0985	agent0	initial_cond	1	0.000000
exp13505	2.19292611e-29	0.000000	0.000000	discard	cycle 102 u=0.0985	agent0	initial_cond	0	-0.000000
exp13506	2.19292611e-29	0.000000	0.000000	discard	cycle 102 u=0.0985	agent0	initial_cond	1	-0.000000
exp13507	2.19292611e-29	0.000000	0.000000	discard	cycle 102 u=0.0985	agent0	initial_cond	0	-0.000000
exp13508	4.22491788e-29	0.000000	0.000000	discard	cycle 102 u=0.0990	agent0	initial_cond	0	-0.000000
exp13509	4.22491788e-29	0.000000	0.000000	discard	cycle 102 u=0.0990	agent0	initial_cond	1	-0.000000
exp13510	4.22491788e-29	0.000000	0.000000	discard	cycle 102 u=0.0990	agent0	initial_cond	0	-0.000000
exp13511	3.22245147e-29	0.000000	0.000000	discard	cycle 102 u=0.0990	agent0	initial_cond	1	0.000000
exp13512	3.22245147e-29	0.000000	0.000000	discard	cycle 102 u=0.0990	agent0	initial_cond	0	0.000000
exp13513	3.22245147e-29	0.000000	0.000000	discard	cycle 102 u=0.0990	agent0	initial_cond	0	0.000000
exp13514	4.50941488e-29	0.000000	-0.000000	discard	cycle 102 u=0.0990	agent0	initial_cond	0	0.000000
exp13515	4.50941488e-29	0.000000	-0.000000	discard	cycle 102 u=0.0990	agent0	initial_cond	0	0.000000
exp13516	4.50941488e-29	0.000000	-0.000000	discard	cycle 102 u=0.0990	agent0	initial_cond	1	0.000000
exp13517	4.88330883e-29	0.000000	-0.000000	discard	cycle 102 u=0.0990	agent0	initial_cond	0	0.000000
exp13518	4.88330883e-29	0.000000	-0.000000	discard	cycle 102 u=0.0990	agent0	initial_cond	0	0.000000
exp13519	4.88330883e-29	0.000000	-0.000000	discard	cycle 102 u=0.0990	agent0	initial_cond	0	0.000000
exp13520	5.74085541e-29	0.000000	-0.000000	discard	cycle 102 u=0.0995	agent0	initial_cond	0	0.000000
exp13521	5.74085541e-29	0.000000	-0.000000	discard	cycle 102 u=0.0995	agent0	initial_cond	1	0.000000
exp13522	5.74085541e-29	0.000000	-0.000000	discard	cycle 102 u=0.0995	agent0	initial_cond	0	0.000000
exp13523	1.54984578e-28	0.000000	0.000000	discard	cycle 102 u=0.0995	agent0	initial_cond	0	-0.000000
exp13524	1.54984578e-28	0.000000	0.000000	discard	cycle 102 u=0.0995	agent0	initial_cond	0	-0.000000
exp13525	1.54984578e-28	0.000000	0.000000	discard	cycle 102 u=0.0995	agent0	initial_cond	0	-0.000000
exp13526	1.82727678e-15	0.000236	-0.000000	discard	Round 11: Coarse K=0.001	agent1	branch_search	0	-0.000000
exp13527	1.60328418e-29	0.000000	-0.000000	discard	cycle 102 u=0.0995	agent0	initial_cond	1	-0.000000
exp13528	3.37527863e-17	0.000471	-0.000000	discard	Round 11: Coarse K=0.002	agent1	branch_search	0	-0.000000
exp13529	1.60328418e-29	0.000000	-0.000000	discard	cycle 102 u=0.0995	agent0	initial_cond	0	-0.000000
exp13530	2.46662739e-17	0.001179	-0.000000	discard	Round 11: Coarse K=0.005	agent1	branch_search	0	-0.000000
exp13531	1.60328418e-29	0.000000	-0.000000	discard	cycle 102 u=0.0995	agent0	initial_cond	1	-0.000000
exp13532	6.12999068e-15	0.002357	-0.000000	discard	Round 11: Coarse K=0.010	agent1	branch_search	1	-0.000000
exp13533	7.34590618e-29	0.000000	0.000000	discard	cycle 102 u=0.0995	agent0	initial_cond	0	0.000000
exp13534	1.74886520e-18	0.003535	-0.000000	discard	Round 11: Coarse K=0.015	agent1	branch_search	0	-0.000000
exp13535	7.34590618e-29	0.000000	0.000000	discard	cycle 102 u=0.0995	agent0	initial_cond	0	0.000000
exp13536	3.65164686e-18	0.004714	-0.000000	discard	Round 11: Coarse K=0.020	agent1	branch_search	1	-0.000000
exp13537	7.34590618e-29	0.000000	0.000000	discard	cycle 102 u=0.0995	agent0	initial_cond	1	0.000000
exp13538	5.22709784e-15	0.005892	-0.000000	discard	Round 11: Coarse K=0.025	agent1	branch_search	0	-0.000000
exp13539	4.46546993e-29	0.000000	0.000000	discard	cycle 102 u=0.1000	agent0	initial_cond	0	-0.000000
exp13540	1.29653480e-17	0.007071	-0.000000	discard	Round 11: Coarse K=0.030	agent1	branch_search	0	-0.000001
exp13541	4.46546993e-29	0.000000	0.000000	discard	cycle 102 u=0.1000	agent0	initial_cond	1	-0.000000
exp13542	2.88403669e-15	0.009427	-0.000000	discard	Round 11: Coarse K=0.040	agent1	branch_search	0	-0.000001
exp13543	4.46546993e-29	0.000000	0.000000	discard	cycle 102 u=0.1000	agent0	initial_cond	0	-0.000000
exp13544	6.18472616e-18	0.011783	-0.000000	discard	Round 11: Coarse K=0.050	agent1	branch_search	0	-0.000002
exp13545	4.08106752e-29	0.000000	0.000000	discard	cycle 102 u=0.1000	agent0	initial_cond	0	-0.000000
exp13546	1.40684424e-17	0.017671	0.000000	discard	Round 11: Coarse K=0.075	agent1	branch_search	1	-0.000003
exp13547	4.08106752e-29	0.000000	0.000000	discard	cycle 102 u=0.1000	agent0	initial_cond	0	-0.000000
exp13548	1.40197541e-15	0.023554	-0.000000	discard	Round 11: Coarse K=0.100	agent1	branch_search	0	-0.000005
exp13549	4.08106752e-29	0.000000	0.000000	discard	cycle 102 u=0.1000	agent0	initial_cond	0	-0.000000
exp13550	2.17489005e-17	0.029431	-0.000000	discard	Round 11: Coarse K=0.125	agent1	branch_search	0	-0.000007
exp13551	4.58623706e-29	0.000000	0.000000	discard	cycle 102 u=0.1000	agent0	initial_cond	1	-0.000000
exp13552	7.04401156e-15	0.035300	-0.000000	discard	Round 11: Coarse K=0.150	agent1	branch_search	0	-0.000006
exp13553	4.58623706e-29	0.000000	0.000000	discard	cycle 102 u=0.1000	agent0	initial_cond	0	-0.000000
exp13554	4.58623706e-29	0.000000	0.000000	discard	cycle 102 u=0.1000	agent0	initial_cond	1	-0.000000
exp13555	4.39794337e-29	0.000000	0.000000	discard	cycle 102 u=0.1000	agent0	initial_cond	0	-0.000000
exp13556	4.39794337e-29	0.000000	0.000000	discard	cycle 102 u=0.1000	agent0	initial_cond	0	-0.000000
exp13557	4.39794337e-29	0.000000	0.000000	discard	cycle 102 u=0.1000	agent0	initial_cond	1	-0.000000
exp13558	1.36727475e-28	0.000000	0.000000	discard	cycle 102 u=0.1050	agent0	initial_cond	0	-0.000000
exp13559	1.36727475e-28	0.000000	0.000000	discard	cycle 102 u=0.1050	agent0	initial_cond	1	-0.000000
exp13560	1.36727475e-28	0.000000	0.000000	discard	cycle 102 u=0.1050	agent0	initial_cond	0	-0.000000
exp13561	6.14461376e-29	0.000000	0.000000	discard	cycle 102 u=0.1050	agent0	initial_cond	0	-0.000000
exp13562	1.82727678e-15	0.000236	-0.000000	discard	Round 11: Test K=0.001	agent1	branch_search	0	-0.000000
exp13563	6.14461376e-29	0.000000	0.000000	discard	cycle 102 u=0.1050	agent0	initial_cond	0	-0.000000
exp13564	6.14461376e-29	0.000000	0.000000	discard	cycle 102 u=0.1050	agent0	initial_cond	0	-0.000000
exp13565	1.75906666e-28	0.000000	0.000000	discard	cycle 102 u=0.1050	agent0	initial_cond	1	-0.000000
exp13566	1.75906666e-28	0.000000	0.000000	discard	cycle 102 u=0.1050	agent0	initial_cond	0	-0.000000
exp13567	1.75906666e-28	0.000000	0.000000	discard	cycle 102 u=0.1050	agent0	initial_cond	0	-0.000000
exp13568	1.11257917e-28	0.000000	0.000000	discard	cycle 102 u=0.1050	agent0	initial_cond	0	-0.000000
exp13569	1.11257917e-28	0.000000	0.000000	discard	cycle 102 u=0.1050	agent0	initial_cond	0	-0.000000
exp13570	1.11257917e-28	0.000000	0.000000	discard	cycle 102 u=0.1050	agent0	initial_cond	1	-0.000000
exp13571	8.58580947e-29	0.000000	0.000000	discard	cycle 103 u=0.0975	agent0	initial_cond	0	0.000000
exp13572	8.58580947e-29	0.000000	0.000000	discard	cycle 103 u=0.0975	agent0	initial_cond	0	0.000000
exp13573	8.58580947e-29	0.000000	0.000000	discard	cycle 103 u=0.0975	agent0	initial_cond	0	0.000000
exp13574	5.23962023e-29	0.000000	0.000000	discard	cycle 103 u=0.0975	agent0	initial_cond	0	0.000000
exp13575	5.23962023e-29	0.000000	0.000000	discard	cycle 103 u=0.0975	agent0	initial_cond	1	0.000000
exp13576	5.23962023e-29	0.000000	0.000000	discard	cycle 103 u=0.0975	agent0	initial_cond	0	0.000000
exp13577	4.03266298e-29	0.000000	0.000000	discard	cycle 103 u=0.0975	agent0	initial_cond	1	0.000000
exp13578	4.03266298e-29	0.000000	0.000000	discard	cycle 103 u=0.0975	agent0	initial_cond	0	0.000000
exp13579	4.03266298e-29	0.000000	0.000000	discard	cycle 103 u=0.0975	agent0	initial_cond	0	0.000000
exp13580	4.80015937e-29	0.000000	0.000000	discard	cycle 103 u=0.0975	agent0	initial_cond	1	0.000000
exp13581	4.80015937e-29	0.000000	0.000000	discard	cycle 103 u=0.0975	agent0	initial_cond	0	0.000000
exp13582	4.80015937e-29	0.000000	0.000000	discard	cycle 103 u=0.0975	agent0	initial_cond	1	0.000000
exp13583	2.68824537e-29	0.000000	0.000000	discard	cycle 103 u=0.0980	agent0	initial_cond	0	-0.000000
exp13584	2.68824537e-29	0.000000	0.000000	discard	cycle 103 u=0.0980	agent0	initial_cond	0	-0.000000
exp13585	2.68824537e-29	0.000000	0.000000	discard	cycle 103 u=0.0980	agent0	initial_cond	0	-0.000000
exp13586	6.16758073e-29	0.000000	0.000000	discard	cycle 103 u=0.0980	agent0	initial_cond	0	-0.000000
exp13587	6.16758073e-29	0.000000	0.000000	discard	cycle 103 u=0.0980	agent0	initial_cond	1	-0.000000
exp13588	6.16758073e-29	0.000000	0.000000	discard	cycle 103 u=0.0980	agent0	initial_cond	0	-0.000000
exp13589	2.01926478e-29	0.000000	0.000000	discard	cycle 103 u=0.0980	agent0	initial_cond	0	0.000000
exp13590	2.01926478e-29	0.000000	0.000000	discard	cycle 103 u=0.0980	agent0	initial_cond	0	0.000000
exp13591	2.01926478e-29	0.000000	0.000000	discard	cycle 103 u=0.0980	agent0	initial_cond	0	0.000000
exp13592	1.30310780e-28	0.000000	0.000000	discard	cycle 103 u=0.0980	agent0	initial_cond	1	-0.000000
exp13593	1.30310780e-28	0.000000	0.000000	discard	cycle 103 u=0.0980	agent0	initial_cond	0	-0.000000
exp13594	1.30310780e-28	0.000000	0.000000	discard	cycle 103 u=0.0980	agent0	initial_cond	1	-0.000000
exp13595	5.45343271e-29	0.000000	0.000000	discard	cycle 103 u=0.0982	agent0	initial_cond	0	-0.000000
exp13596	5.45343271e-29	0.000000	0.000000	discard	cycle 103 u=0.0982	agent0	initial_cond	0	-0.000000
exp13597	5.45343271e-29	0.000000	0.000000	discard	cycle 103 u=0.0982	agent0	initial_cond	1	-0.000000
exp13598	1.23429977e-28	0.000000	0.000000	discard	cycle 103 u=0.0982	agent0	initial_cond	0	0.000000
exp13599	1.23429977e-28	0.000000	0.000000	discard	cycle 103 u=0.0982	agent0	initial_cond	1	0.000000
exp13600	1.23429977e-28	0.000000	0.000000	discard	cycle 103 u=0.0982	agent0	initial_cond	0	0.000000
exp13601	1.88036672e-29	0.000000	0.000000	discard	cycle 103 u=0.0982	agent0	initial_cond	0	0.000000
exp13602	1.88036672e-29	0.000000	0.000000	discard	cycle 103 u=0.0982	agent0	initial_cond	0	0.000000
exp13603	1.88036672e-29	0.000000	0.000000	discard	cycle 103 u=0.0982	agent0	initial_cond	0	0.000000
exp13604	1.91190259e-29	0.000000	-0.000000	discard	cycle 103 u=0.0982	agent0	initial_cond	1	0.000000
exp13605	1.91190259e-29	0.000000	-0.000000	discard	cycle 103 u=0.0982	agent0	initial_cond	0	0.000000
exp13606	1.91190259e-29	0.000000	-0.000000	discard	cycle 103 u=0.0982	agent0	initial_cond	0	0.000000
exp13607	6.13049994e-29	0.000000	0.000000	discard	cycle 103 u=0.0985	agent0	initial_cond	0	0.000000
exp13608	6.13049994e-29	0.000000	0.000000	discard	cycle 103 u=0.0985	agent0	initial_cond	0	0.000000
exp13609	6.13049994e-29	0.000000	0.000000	discard	cycle 103 u=0.0985	agent0	initial_cond	1	0.000000
exp13610	5.49750971e-29	0.000000	0.000000	discard	cycle 103 u=0.0985	agent0	initial_cond	0	0.000000
exp13611	5.49750971e-29	0.000000	0.000000	discard	cycle 103 u=0.0985	agent0	initial_cond	1	0.000000
exp13612	5.49750971e-29	0.000000	0.000000	discard	cycle 103 u=0.0985	agent0	initial_cond	0	0.000000
exp13613	4.15642452e-29	0.000000	0.000000	discard	cycle 103 u=0.0985	agent0	initial_cond	0	0.000000
exp13614	4.15642452e-29	0.000000	0.000000	discard	cycle 103 u=0.0985	agent0	initial_cond	1	0.000000
exp13615	4.15642452e-29	0.000000	0.000000	discard	cycle 103 u=0.0985	agent0	initial_cond	0	0.000000
exp13616	2.19292611e-29	0.000000	0.000000	discard	cycle 103 u=0.0985	agent0	initial_cond	1	-0.000000
exp13617	2.19292611e-29	0.000000	0.000000	discard	cycle 103 u=0.0985	agent0	initial_cond	0	-0.000000
exp13618	2.19292611e-29	0.000000	0.000000	discard	cycle 103 u=0.0985	agent0	initial_cond	0	-0.000000
exp13619	4.22491788e-29	0.000000	0.000000	discard	cycle 103 u=0.0990	agent0	initial_cond	1	-0.000000
exp13620	4.22491788e-29	0.000000	0.000000	discard	cycle 103 u=0.0990	agent0	initial_cond	0	-0.000000
exp13621	4.22491788e-29	0.000000	0.000000	discard	cycle 103 u=0.0990	agent0	initial_cond	1	-0.000000
exp13622	3.22245147e-29	0.000000	0.000000	discard	cycle 103 u=0.0990	agent0	initial_cond	0	0.000000
exp13623	3.22245147e-29	0.000000	0.000000	discard	cycle 103 u=0.0990	agent0	initial_cond	0	0.000000
exp13624	3.22245147e-29	0.000000	0.000000	discard	cycle 103 u=0.0990	agent0	initial_cond	0	0.000000
exp13625	4.50941488e-29	0.000000	-0.000000	discard	cycle 103 u=0.0990	agent0	initial_cond	0	0.000000
exp13626	4.50941488e-29	0.000000	-0.000000	discard	cycle 103 u=0.0990	agent0	initial_cond	1	0.000000
exp13627	4.50941488e-29	0.000000	-0.000000	discard	cycle 103 u=0.0990	agent0	initial_cond	0	0.000000
exp13628	4.88330883e-29	0.000000	-0.000000	discard	cycle 103 u=0.0990	agent0	initial_cond	0	0.000000
exp13629	4.88330883e-29	0.000000	-0.000000	discard	cycle 103 u=0.0990	agent0	initial_cond	0	0.000000
exp13630	4.88330883e-29	0.000000	-0.000000	discard	cycle 103 u=0.0990	agent0	initial_cond	0	0.000000
exp13631	5.74085541e-29	0.000000	-0.000000	discard	cycle 103 u=0.0995	agent0	initial_cond	1	0.000000
exp13632	5.74085541e-29	0.000000	-0.000000	discard	cycle 103 u=0.0995	agent0	initial_cond	0	0.000000
exp13633	5.74085541e-29	0.000000	-0.000000	discard	cycle 103 u=0.0995	agent0	initial_cond	1	0.000000
exp13634	1.54984578e-28	0.000000	0.000000	discard	cycle 103 u=0.0995	agent0	initial_cond	0	-0.000000
exp13635	1.54984578e-28	0.000000	0.000000	discard	cycle 103 u=0.0995	agent0	initial_cond	0	-0.000000
exp13636	1.54984578e-28	0.000000	0.000000	discard	cycle 103 u=0.0995	agent0	initial_cond	1	-0.000000
exp13637	1.60328418e-29	0.000000	-0.000000	discard	cycle 103 u=0.0995	agent0	initial_cond	0	-0.000000
exp13638	1.60328418e-29	0.000000	-0.000000	discard	cycle 103 u=0.0995	agent0	initial_cond	1	-0.000000
exp13639	1.60328418e-29	0.000000	-0.000000	discard	cycle 103 u=0.0995	agent0	initial_cond	0	-0.000000
exp13640	7.34590618e-29	0.000000	0.000000	discard	cycle 103 u=0.0995	agent0	initial_cond	0	0.000000
exp13641	7.34590618e-29	0.000000	0.000000	discard	cycle 103 u=0.0995	agent0	initial_cond	0	0.000000
exp13642	7.34590618e-29	0.000000	0.000000	discard	cycle 103 u=0.0995	agent0	initial_cond	0	0.000000
exp13643	4.46546993e-29	0.000000	0.000000	discard	cycle 103 u=0.1000	agent0	initial_cond	1	-0.000000
exp13644	4.46546993e-29	0.000000	0.000000	discard	cycle 103 u=0.1000	agent0	initial_cond	0	-0.000000
exp13645	4.46546993e-29	0.000000	0.000000	discard	cycle 103 u=0.1000	agent0	initial_cond	0	-0.000000
exp13646	4.08106752e-29	0.000000	0.000000	discard	cycle 103 u=0.1000	agent0	initial_cond	0	-0.000000
