exp_id	residual	solution_norm	solution_mean	status	description	agent	design	elapsed_s	solution_energy
exp15052	1.19249364e-16	0.001438	0.000000	discard	Round 9: Ultra-precision mode=8 fourier=10 at K=0.0061	agent1	solver_param	0	-0.000000
exp15053	4.15642452e-29	0.000000	0.000000	discard	cycle 117 u=0.0985	agent0	initial_cond	1	0.000000
exp15054	1.79901697e-16	0.000000	0.000000	discard	Round 9: Ultra-precision mode=6 fourier=8 at K=0.0061	agent1	solver_param	1	0.000000
exp15055	4.15642452e-29	0.000000	0.000000	discard	cycle 117 u=0.0985	agent0	initial_cond	0	0.000000
exp15056	2.19292611e-29	0.000000	0.000000	discard	cycle 117 u=0.0985	agent0	initial_cond	0	-0.000000
exp15057	2.19292611e-29	0.000000	0.000000	discard	cycle 117 u=0.0985	agent0	initial_cond	1	-0.000000
exp15058	2.19292611e-29	0.000000	0.000000	discard	cycle 117 u=0.0985	agent0	initial_cond	0	-0.000000
exp15059	4.22491788e-29	0.000000	0.000000	discard	cycle 117 u=0.0990	agent0	initial_cond	1	-0.000000
exp15060	4.22491788e-29	0.000000	0.000000	discard	cycle 117 u=0.0990	agent0	initial_cond	0	-0.000000
exp15061	4.22491788e-29	0.000000	0.000000	discard	cycle 117 u=0.0990	agent0	initial_cond	0	-0.000000
exp15062	3.22245147e-29	0.000000	0.000000	discard	cycle 117 u=0.0990	agent0	initial_cond	0	0.000000
exp15063	3.22245147e-29	0.000000	0.000000	discard	cycle 117 u=0.0990	agent0	initial_cond	0	0.000000
exp15064	3.22245147e-29	0.000000	0.000000	discard	cycle 117 u=0.0990	agent0	initial_cond	1	0.000000
exp15065	4.50941488e-29	0.000000	-0.000000	discard	cycle 117 u=0.0990	agent0	initial_cond	0	0.000000
exp15066	4.50941488e-29	0.000000	-0.000000	discard	cycle 117 u=0.0990	agent0	initial_cond	0	0.000000
exp15067	4.50941488e-29	0.000000	-0.000000	discard	cycle 117 u=0.0990	agent0	initial_cond	0	0.000000
exp15068	4.88330883e-29	0.000000	-0.000000	discard	cycle 117 u=0.0990	agent0	initial_cond	0	0.000000
exp15069	4.88330883e-29	0.000000	-0.000000	discard	cycle 117 u=0.0990	agent0	initial_cond	1	0.000000
exp15070	4.88330883e-29	0.000000	-0.000000	discard	cycle 117 u=0.0990	agent0	initial_cond	0	0.000000
exp15071	5.74085541e-29	0.000000	-0.000000	discard	cycle 117 u=0.0995	agent0	initial_cond	1	0.000000
exp15072	6.39971521e-16	0.999035	1.000000	discard	Round 9: Positive branch u=1.0 K=0.05	agent1	initial_cond	0	-1.566349
exp15072	5.74085541e-29	0.000000	-0.000000	discard	cycle 117 u=0.0995	agent0	initial_cond	0	0.000000
exp15073	5.21774140e-16	0.999210	1.000000	discard	Round 9: Positive branch u=1.0 K=0.1	agent1	initial_cond	0	-1.562435
exp15073	5.74085541e-29	0.000000	-0.000000	discard	cycle 117 u=0.0995	agent0	initial_cond	0	0.000000
exp15074	5.08239441e-16	0.999975	1.000004	discard	Round 9: Positive branch u=1.0 K=0.2	agent1	initial_cond	1	-1.546805
exp15074	1.54984578e-28	0.000000	0.000000	discard	cycle 117 u=0.0995	agent0	initial_cond	0	-0.000000
exp15075	2.29141147e-16	1.001296	1.000019	discard	Round 9: Positive branch u=1.0 K=0.3	agent1	initial_cond	0	-1.520844
exp15075	1.54984578e-28	0.000000	0.000000	discard	cycle 117 u=0.0995	agent0	initial_cond	0	-0.000000
exp15076	5.52706602e-16	1.005614	1.000140	discard	Round 9: Positive branch u=1.0 K=0.5	agent1	initial_cond	1	-1.438489
exp15076	1.54984578e-28	0.000000	0.000000	discard	cycle 117 u=0.0995	agent0	initial_cond	1	-0.000000
exp15077	7.07926248e-16	0.999035	-1.000000	discard	Round 9: Negative branch u=-1.0 K=0.05	agent1	initial_cond	0	-1.566349
exp15077	1.60328418e-29	0.000000	-0.000000	discard	cycle 117 u=0.0995	agent0	initial_cond	0	-0.000000
exp15078	2.23003454e-15	0.999210	-1.000000	discard	Round 9: Negative branch u=-1.0 K=0.1	agent1	initial_cond	0	-1.562435
exp15078	1.60328418e-29	0.000000	-0.000000	discard	cycle 117 u=0.0995	agent0	initial_cond	0	-0.000000
exp15079	3.87823547e-16	0.999975	-1.000004	discard	Round 9: Negative branch u=-1.0 K=0.2	agent1	initial_cond	0	-1.546805
exp15079	1.60328418e-29	0.000000	-0.000000	discard	cycle 117 u=0.0995	agent0	initial_cond	0	-0.000000
exp15080	5.53098474e-16	1.001296	-1.000019	discard	Round 9: Negative branch u=-1.0 K=0.3	agent1	initial_cond	0	-1.520844
exp15080	7.34590618e-29	0.000000	0.000000	discard	cycle 117 u=0.0995	agent0	initial_cond	0	0.000000
exp15081	1.69589368e-16	1.005614	-1.000140	discard	Round 9: Negative branch u=-1.0 K=0.5	agent1	initial_cond	1	-1.438489
exp15081	7.34590618e-29	0.000000	0.000000	discard	cycle 117 u=0.0995	agent0	initial_cond	1	0.000000
exp15082	7.34590618e-29	0.000000	0.000000	discard	cycle 117 u=0.0995	agent0	initial_cond	0	0.000000
exp15083	4.46546993e-29	0.000000	0.000000	discard	cycle 117 u=0.1000	agent0	initial_cond	1	-0.000000
exp15084	4.46546993e-29	0.000000	0.000000	discard	cycle 117 u=0.1000	agent0	initial_cond	0	-0.000000
exp15085	4.46546993e-29	0.000000	0.000000	discard	cycle 117 u=0.1000	agent0	initial_cond	0	-0.000000
exp15086	4.08106752e-29	0.000000	0.000000	discard	cycle 117 u=0.1000	agent0	initial_cond	0	-0.000000
exp15087	4.08106752e-29	0.000000	0.000000	discard	cycle 117 u=0.1000	agent0	initial_cond	0	-0.000000
exp15088	4.08106752e-29	0.000000	0.000000	discard	cycle 117 u=0.1000	agent0	initial_cond	1	-0.000000
exp15089	4.58623706e-29	0.000000	0.000000	discard	cycle 117 u=0.1000	agent0	initial_cond	0	-0.000000
exp15090	4.58623706e-29	0.000000	0.000000	discard	cycle 117 u=0.1000	agent0	initial_cond	0	-0.000000
exp15091	4.58623706e-29	0.000000	0.000000	discard	cycle 117 u=0.1000	agent0	initial_cond	0	-0.000000
exp15092	4.39794337e-29	0.000000	0.000000	discard	cycle 117 u=0.1000	agent0	initial_cond	0	-0.000000
exp15093	4.39794337e-29	0.000000	0.000000	discard	cycle 117 u=0.1000	agent0	initial_cond	1	-0.000000
exp15094	4.39794337e-29	0.000000	0.000000	discard	cycle 117 u=0.1000	agent0	initial_cond	0	-0.000000
exp15095	1.36727475e-28	0.000000	0.000000	discard	cycle 117 u=0.1050	agent0	initial_cond	1	-0.000000
exp15096	1.36727475e-28	0.000000	0.000000	discard	cycle 117 u=0.1050	agent0	initial_cond	0	-0.000000
exp15097	1.36727475e-28	0.000000	0.000000	discard	cycle 117 u=0.1050	agent0	initial_cond	0	-0.000000
exp15098	6.14461376e-29	0.000000	0.000000	discard	cycle 117 u=0.1050	agent0	initial_cond	0	-0.000000
exp15099	6.14461376e-29	0.000000	0.000000	discard	cycle 117 u=0.1050	agent0	initial_cond	0	-0.000000
exp15100	6.14461376e-29	0.000000	0.000000	discard	cycle 117 u=0.1050	agent0	initial_cond	1	-0.000000
exp15101	1.75906666e-28	0.000000	0.000000	discard	cycle 117 u=0.1050	agent0	initial_cond	0	-0.000000
exp15102	1.75906666e-28	0.000000	0.000000	discard	cycle 117 u=0.1050	agent0	initial_cond	0	-0.000000
exp15103	1.75906666e-28	0.000000	0.000000	discard	cycle 117 u=0.1050	agent0	initial_cond	0	-0.000000
exp15104	1.11257917e-28	0.000000	0.000000	discard	cycle 117 u=0.1050	agent0	initial_cond	0	-0.000000
exp15105	1.11257917e-28	0.000000	0.000000	discard	cycle 117 u=0.1050	agent0	initial_cond	1	-0.000000
exp15106	1.11257917e-28	0.000000	0.000000	discard	cycle 117 u=0.1050	agent0	initial_cond	0	-0.000000
exp15107	8.58580947e-29	0.000000	0.000000	discard	cycle 118 u=0.0975	agent0	initial_cond	1	0.000000
exp15108	8.58580947e-29	0.000000	0.000000	discard	cycle 118 u=0.0975	agent0	initial_cond	0	0.000000
exp15109	8.58580947e-29	0.000000	0.000000	discard	cycle 118 u=0.0975	agent0	initial_cond	0	0.000000
exp15110	5.23962023e-29	0.000000	0.000000	discard	cycle 118 u=0.0975	agent0	initial_cond	0	0.000000
exp15111	5.23962023e-29	0.000000	0.000000	discard	cycle 118 u=0.0975	agent0	initial_cond	0	0.000000
exp15112	5.23962023e-29	0.000000	0.000000	discard	cycle 118 u=0.0975	agent0	initial_cond	1	0.000000
exp15113	4.03266298e-29	0.000000	0.000000	discard	cycle 118 u=0.0975	agent0	initial_cond	0	0.000000
exp15114	4.03266298e-29	0.000000	0.000000	discard	cycle 118 u=0.0975	agent0	initial_cond	0	0.000000
exp15115	4.03266298e-29	0.000000	0.000000	discard	cycle 118 u=0.0975	agent0	initial_cond	0	0.000000
exp15116	4.80015937e-29	0.000000	0.000000	discard	cycle 118 u=0.0975	agent0	initial_cond	0	0.000000
exp15117	4.80015937e-29	0.000000	0.000000	discard	cycle 118 u=0.0975	agent0	initial_cond	1	0.000000
exp15118	4.80015937e-29	0.000000	0.000000	discard	cycle 118 u=0.0975	agent0	initial_cond	0	0.000000
exp15119	2.68824537e-29	0.000000	0.000000	discard	cycle 118 u=0.0980	agent0	initial_cond	1	-0.000000
exp15120	2.68824537e-29	0.000000	0.000000	discard	cycle 118 u=0.0980	agent0	initial_cond	0	-0.000000
exp15121	2.68824537e-29	0.000000	0.000000	discard	cycle 118 u=0.0980	agent0	initial_cond	0	-0.000000
exp15122	6.16758073e-29	0.000000	0.000000	discard	cycle 118 u=0.0980	agent0	initial_cond	1	-0.000000
exp15123	6.16758073e-29	0.000000	0.000000	discard	cycle 118 u=0.0980	agent0	initial_cond	0	-0.000000
exp15124	6.16758073e-29	0.000000	0.000000	discard	cycle 118 u=0.0980	agent0	initial_cond	1	-0.000000
exp15125	2.01926478e-29	0.000000	0.000000	discard	cycle 118 u=0.0980	agent0	initial_cond	0	0.000000
exp15126	2.01926478e-29	0.000000	0.000000	discard	cycle 118 u=0.0980	agent0	initial_cond	0	0.000000
exp15127	2.01926478e-29	0.000000	0.000000	discard	cycle 118 u=0.0980	agent0	initial_cond	0	0.000000
exp15128	1.30310780e-28	0.000000	0.000000	discard	cycle 118 u=0.0980	agent0	initial_cond	0	-0.000000
exp15129	1.30310780e-28	0.000000	0.000000	discard	cycle 118 u=0.0980	agent0	initial_cond	1	-0.000000
exp15130	1.30310780e-28	0.000000	0.000000	discard	cycle 118 u=0.0980	agent0	initial_cond	0	-0.000000
exp15131	5.45343271e-29	0.000000	0.000000	discard	cycle 118 u=0.0982	agent0	initial_cond	1	-0.000000
exp15132	5.45343271e-29	0.000000	0.000000	discard	cycle 118 u=0.0982	agent0	initial_cond	0	-0.000000
exp15133	5.45343271e-29	0.000000	0.000000	discard	cycle 118 u=0.0982	agent0	initial_cond	0	-0.000000
exp15134	1.23429977e-28	0.000000	0.000000	discard	cycle 118 u=0.0982	agent0	initial_cond	0	0.000000
exp15135	1.23429977e-28	0.000000	0.000000	discard	cycle 118 u=0.0982	agent0	initial_cond	0	0.000000
exp15136	1.23429977e-28	0.000000	0.000000	discard	cycle 118 u=0.0982	agent0	initial_cond	1	0.000000
exp15137	1.88036672e-29	0.000000	0.000000	discard	cycle 118 u=0.0982	agent0	initial_cond	0	0.000000
exp15138	1.88036672e-29	0.000000	0.000000	discard	cycle 118 u=0.0982	agent0	initial_cond	0	0.000000
exp15139	1.88036672e-29	0.000000	0.000000	discard	cycle 118 u=0.0982	agent0	initial_cond	0	0.000000
exp15140	1.91190259e-29	0.000000	-0.000000	discard	cycle 118 u=0.0982	agent0	initial_cond	0	0.000000
exp15141	1.91190259e-29	0.000000	-0.000000	discard	cycle 118 u=0.0982	agent0	initial_cond	1	0.000000
exp15142	1.91190259e-29	0.000000	-0.000000	discard	cycle 118 u=0.0982	agent0	initial_cond	0	0.000000
exp15143	6.13049994e-29	0.000000	0.000000	discard	cycle 118 u=0.0985	agent0	initial_cond	1	0.000000
exp15144	6.13049994e-29	0.000000	0.000000	discard	cycle 118 u=0.0985	agent0	initial_cond	0	0.000000
exp15145	6.13049994e-29	0.000000	0.000000	discard	cycle 118 u=0.0985	agent0	initial_cond	0	0.000000
exp15146	5.49750971e-29	0.000000	0.000000	discard	cycle 118 u=0.0985	agent0	initial_cond	1	0.000000
exp15147	5.49750971e-29	0.000000	0.000000	discard	cycle 118 u=0.0985	agent0	initial_cond	0	0.000000
exp15148	5.49750971e-29	0.000000	0.000000	discard	cycle 118 u=0.0985	agent0	initial_cond	1	0.000000
exp15149	4.15642452e-29	0.000000	0.000000	discard	cycle 118 u=0.0985	agent0	initial_cond	0	0.000000
exp15150	4.15642452e-29	0.000000	0.000000	discard	cycle 118 u=0.0985	agent0	initial_cond	0	0.000000
exp15151	4.15642452e-29	0.000000	0.000000	discard	cycle 118 u=0.0985	agent0	initial_cond	0	0.000000
exp15152	2.19292611e-29	0.000000	0.000000	discard	cycle 118 u=0.0985	agent0	initial_cond	0	-0.000000
exp15153	2.19292611e-29	0.000000	0.000000	discard	cycle 118 u=0.0985	agent0	initial_cond	1	-0.000000
exp15154	2.19292611e-29	0.000000	0.000000	discard	cycle 118 u=0.0985	agent0	initial_cond	0	-0.000000
exp15155	4.22491788e-29	0.000000	0.000000	discard	cycle 118 u=0.0990	agent0	initial_cond	1	-0.000000
exp15156	4.22491788e-29	0.000000	0.000000	discard	cycle 118 u=0.0990	agent0	initial_cond	0	-0.000000
exp15157	4.22491788e-29	0.000000	0.000000	discard	cycle 118 u=0.0990	agent0	initial_cond	0	-0.000000
exp15158	3.22245147e-29	0.000000	0.000000	discard	cycle 118 u=0.0990	agent0	initial_cond	0	0.000000
exp15159	3.22245147e-29	0.000000	0.000000	discard	cycle 118 u=0.0990	agent0	initial_cond	0	0.000000
exp15160	3.22245147e-29	0.000000	0.000000	discard	cycle 118 u=0.0990	agent0	initial_cond	1	0.000000
exp15161	9.75152120e-19	0.002357	-0.000000	discard	R10: Grid u=0 K=0.01 a=0.1	agent1	initial_cond	0	-0.000000
exp15161	4.50941488e-29	0.000000	-0.000000	discard	cycle 118 u=0.0990	agent0	initial_cond	0	0.000000
exp15162	3.63042873e-16	0.002357	-0.000000	discard	R10: Grid u=0 K=0.01 a=0.3	agent1	initial_cond	0	-0.000000
exp15162	4.50941488e-29	0.000000	-0.000000	discard	cycle 118 u=0.0990	agent0	initial_cond	1	0.000000
exp15163	7.16945898e-15	0.002357	-0.000000	discard	R10: Grid u=0 K=0.01 a=0.5	agent1	initial_cond	0	-0.000000
exp15163	4.50941488e-29	0.000000	-0.000000	discard	cycle 118 u=0.0990	agent0	initial_cond	0	0.000000
exp15164	4.88330883e-29	0.000000	-0.000000	discard	cycle 118 u=0.0990	agent0	initial_cond	0	0.000000
exp15164	6.63279254e-18	0.011783	-0.000000	discard	R10: Grid u=0 K=0.05 a=0.1	agent1	initial_cond	0	-0.000002
exp15165	4.88330883e-29	0.000000	-0.000000	discard	cycle 118 u=0.0990	agent0	initial_cond	1	0.000000
exp15165	3.13324373e-18	0.011783	-0.000000	discard	R10: Grid u=0 K=0.05 a=0.3	agent1	initial_cond	1	-0.000002
exp15166	4.88330883e-29	0.000000	-0.000000	discard	cycle 118 u=0.0990	agent0	initial_cond	0	0.000000
exp15166	6.14903241e-18	0.011783	-0.000000	discard	R10: Grid u=0 K=0.05 a=0.5	agent1	initial_cond	0	-0.000002
exp15167	5.74085541e-29	0.000000	-0.000000	discard	cycle 118 u=0.0995	agent0	initial_cond	1	0.000000
exp15167	5.57506725e-16	0.023554	-0.000000	discard	R10: Grid u=0 K=0.1 a=0.1	agent1	initial_cond	1	-0.000005
exp15168	5.74085541e-29	0.000000	-0.000000	discard	cycle 118 u=0.0995	agent0	initial_cond	0	0.000000
exp15168	1.31284041e-17	0.023554	-0.000000	discard	R10: Grid u=0 K=0.1 a=0.3	agent1	initial_cond	0	-0.000005
exp15169	5.74085541e-29	0.000000	-0.000000	discard	cycle 118 u=0.0995	agent0	initial_cond	0	0.000000
exp15169	8.25448293e-16	0.023554	-0.000000	discard	R10: Grid u=0 K=0.1 a=0.5	agent1	initial_cond	0	-0.000005
exp15170	1.54984578e-28	0.000000	0.000000	discard	cycle 118 u=0.0995	agent0	initial_cond	0	-0.000000
exp15170	2.14411762e-17	0.070278	-0.000000	discard	R10: Grid u=0 K=0.3 a=0.1	agent1	initial_cond	0	0.000097
exp15171	1.54984578e-28	0.000000	0.000000	discard	cycle 118 u=0.0995	agent0	initial_cond	0	-0.000000
exp15171	6.16885595e-17	0.070278	0.000000	discard	R10: Grid u=0 K=0.3 a=0.3	agent1	initial_cond	0	0.000097
exp15172	1.54984578e-28	0.000000	0.000000	discard	cycle 118 u=0.0995	agent0	initial_cond	1	-0.000000
exp15172	3.42109678e-17	0.070278	-0.000000	discard	R10: Grid u=0 K=0.3 a=0.5	agent1	initial_cond	1	0.000097
exp15173	1.60328418e-29	0.000000	-0.000000	discard	cycle 118 u=0.0995	agent0	initial_cond	0	-0.000000
exp15173	6.30169215e-17	0.115920	0.000000	discard	R10: Grid u=0 K=0.5 a=0.1	agent1	initial_cond	0	0.001044
exp15174	1.60328418e-29	0.000000	-0.000000	discard	cycle 118 u=0.0995	agent0	initial_cond	1	-0.000000
exp15174	1.80521831e-16	0.115920	-0.000000	discard	R10: Grid u=0 K=0.5 a=0.3	agent1	initial_cond	1	0.001044
exp15175	1.60328418e-29	0.000000	-0.000000	discard	cycle 118 u=0.0995	agent0	initial_cond	0	-0.000000
exp15175	1.93662122e-17	0.115920	-0.000000	discard	R10: Grid u=0 K=0.5 a=0.5	agent1	initial_cond	0	0.001044
exp15176	7.34590618e-29	0.000000	0.000000	discard	cycle 118 u=0.0995	agent0	initial_cond	0	0.000000
exp15176	1.07474352e-16	0.002357	-0.000000	discard	R10: Grid u=0.2 K=0.01 a=0.1	agent1	initial_cond	0	-0.000000
exp15177	7.34590618e-29	0.000000	0.000000	discard	cycle 118 u=0.0995	agent0	initial_cond	0	0.000000
exp15177	1.07428161e-18	0.002357	-0.000000	discard	R10: Grid u=0.2 K=0.01 a=0.3	agent1	initial_cond	0	-0.000000
exp15178	7.34590618e-29	0.000000	0.000000	discard	cycle 118 u=0.0995	agent0	initial_cond	0	0.000000
exp15178	5.64149754e-15	0.002357	-0.000000	discard	R10: Grid u=0.2 K=0.01 a=0.5	agent1	initial_cond	0	-0.000000
exp15179	4.46546993e-29	0.000000	0.000000	discard	cycle 118 u=0.1000	agent0	initial_cond	1	-0.000000
exp15179	2.32705949e-18	0.011783	-0.000000	discard	R10: Grid u=0.2 K=0.05 a=0.1	agent1	initial_cond	1	-0.000002
exp15180	4.46546993e-29	0.000000	0.000000	discard	cycle 118 u=0.1000	agent0	initial_cond	0	-0.000000
exp15180	2.40054251e-17	0.011783	-0.000000	discard	R10: Grid u=0.2 K=0.05 a=0.3	agent1	initial_cond	0	-0.000002
exp15181	4.46546993e-29	0.000000	0.000000	discard	cycle 118 u=0.1000	agent0	initial_cond	1	-0.000000
exp15181	2.47523850e-18	0.011783	-0.000000	discard	R10: Grid u=0.2 K=0.05 a=0.5	agent1	initial_cond	1	-0.000002
exp15182	4.08106752e-29	0.000000	0.000000	discard	cycle 118 u=0.1000	agent0	initial_cond	0	-0.000000
exp15182	9.12341824e-18	0.023554	-0.000000	discard	R10: Grid u=0.2 K=0.1 a=0.1	agent1	initial_cond	0	-0.000005
exp15183	4.08106752e-29	0.000000	0.000000	discard	cycle 118 u=0.1000	agent0	initial_cond	0	-0.000000
exp15183	1.04560123e-17	0.023554	-0.000000	discard	R10: Grid u=0.2 K=0.1 a=0.3	agent1	initial_cond	0	-0.000005
exp15184	4.08106752e-29	0.000000	0.000000	discard	cycle 118 u=0.1000	agent0	initial_cond	0	-0.000000
exp15184	1.31203141e-15	0.023554	0.000000	discard	R10: Grid u=0.2 K=0.1 a=0.5	agent1	initial_cond	0	-0.000005
exp15185	2.33017171e-15	0.070278	-0.000000	discard	R10: Grid u=0.2 K=0.3 a=0.1	agent1	initial_cond	0	0.000097
exp15185	4.58623706e-29	0.000000	0.000000	discard	cycle 118 u=0.1000	agent0	initial_cond	0	-0.000000
exp15186	4.58623706e-29	0.000000	0.000000	discard	cycle 118 u=0.1000	agent0	initial_cond	1	-0.000000
exp15186	3.70302229e-17	0.070278	0.000000	discard	R10: Grid u=0.2 K=0.3 a=0.3	agent1	initial_cond	1	0.000097
exp15187	4.58623706e-29	0.000000	0.000000	discard	cycle 118 u=0.1000	agent0	initial_cond	0	-0.000000
exp15187	2.27550885e-17	0.070278	-0.000000	discard	R10: Grid u=0.2 K=0.3 a=0.5	agent1	initial_cond	0	0.000097
exp15188	4.39794337e-29	0.000000	0.000000	discard	cycle 118 u=0.1000	agent0	initial_cond	1	-0.000000
exp15188	5.94001949e-17	0.115920	-0.000000	discard	R10: Grid u=0.2 K=0.5 a=0.1	agent1	initial_cond	1	0.001044
exp15189	4.39794337e-29	0.000000	0.000000	discard	cycle 118 u=0.1000	agent0	initial_cond	0	-0.000000
exp15189	6.39190985e-17	0.115920	-0.000000	discard	R10: Grid u=0.2 K=0.5 a=0.3	agent1	initial_cond	0	0.001044
exp15190	7.11256678e-17	0.115920	-0.000000	discard	R10: Grid u=0.2 K=0.5 a=0.5	agent1	initial_cond	0	0.001044
exp15190	4.39794337e-29	0.000000	0.000000	discard	cycle 118 u=0.1000	agent0	initial_cond	0	-0.000000
exp15191	1.36727475e-28	0.000000	0.000000	discard	cycle 118 u=0.1050	agent0	initial_cond	0	-0.000000
exp15191	1.80684848e-18	0.002357	0.000000	discard	R10: Grid u=0.4 K=0.01 a=0.1	agent1	initial_cond	0	-0.000000
exp15192	1.48287187e-16	0.002357	-0.000000	discard	R10: Grid u=0.4 K=0.01 a=0.3	agent1	initial_cond	0	-0.000000
exp15192	1.36727475e-28	0.000000	0.000000	discard	cycle 118 u=0.1050	agent0	initial_cond	0	-0.000000
exp15193	1.36727475e-28	0.000000	0.000000	discard	cycle 118 u=0.1050	agent0	initial_cond	1	-0.000000
exp15193	1.46262560e-18	0.002357	0.000000	discard	R10: Grid u=0.4 K=0.01 a=0.5	agent1	initial_cond	1	-0.000000
exp15194	6.14461376e-29	0.000000	0.000000	discard	cycle 118 u=0.1050	agent0	initial_cond	0	-0.000000
exp15194	3.97837452e-17	0.011783	0.000000	discard	R10: Grid u=0.4 K=0.05 a=0.1	agent1	initial_cond	0	-0.000002
exp15195	6.14461376e-29	0.000000	0.000000	discard	cycle 118 u=0.1050	agent0	initial_cond	1	-0.000000
exp15195	4.95349747e-18	0.011783	-0.000000	discard	R10: Grid u=0.4 K=0.05 a=0.3	agent1	initial_cond	1	-0.000002
exp15196	6.14461376e-29	0.000000	0.000000	discard	cycle 118 u=0.1050	agent0	initial_cond	0	-0.000000
exp15196	4.61378102e-17	0.011783	-0.000000	discard	R10: Grid u=0.4 K=0.05 a=0.5	agent1	initial_cond	0	-0.000002
exp15197	1.75906666e-28	0.000000	0.000000	discard	cycle 118 u=0.1050	agent0	initial_cond	0	-0.000000
exp15197	4.60678655e-18	0.023554	-0.000000	discard	R10: Grid u=0.4 K=0.1 a=0.1	agent1	initial_cond	0	-0.000005
exp15198	1.75906666e-28	0.000000	0.000000	discard	cycle 118 u=0.1050	agent0	initial_cond	0	-0.000000
exp15198	1.29853883e-17	0.023554	-0.000000	discard	R10: Grid u=0.4 K=0.1 a=0.3	agent1	initial_cond	0	-0.000005
exp15199	1.75906666e-28	0.000000	0.000000	discard	cycle 118 u=0.1050	agent0	initial_cond	0	-0.000000
exp15199	7.47157127e-18	0.023554	-0.000000	discard	R10: Grid u=0.4 K=0.1 a=0.5	agent1	initial_cond	0	-0.000005
exp15200	3.59338068e-17	0.070278	-0.000000	discard	R10: Grid u=0.4 K=0.3 a=0.1	agent1	initial_cond	1	0.000097
exp15200	1.11257917e-28	0.000000	0.000000	discard	cycle 118 u=0.1050	agent0	initial_cond	1	-0.000000
exp15201	1.11257917e-28	0.000000	0.000000	discard	cycle 118 u=0.1050	agent0	initial_cond	0	-0.000000
exp15201	5.54384527e-17	0.070278	-0.000000	discard	R10: Grid u=0.4 K=0.3 a=0.3	agent1	initial_cond	0	0.000097
exp15202	1.11257917e-28	0.000000	0.000000	discard	cycle 118 u=0.1050	agent0	initial_cond	1	-0.000000
exp15202	3.15819718e-16	0.070278	-0.000000	discard	R10: Grid u=0.4 K=0.3 a=0.5	agent1	initial_cond	1	0.000097
exp15203	8.58580947e-29	0.000000	0.000000	discard	cycle 119 u=0.0975	agent0	initial_cond	0	0.000000
exp15203	2.53799799e-17	0.115920	-0.000000	discard	R10: Grid u=0.4 K=0.5 a=0.1	agent1	initial_cond	0	0.001044
exp15204	8.58580947e-29	0.000000	0.000000	discard	cycle 119 u=0.0975	agent0	initial_cond	0	0.000000
exp15204	4.28954722e-17	0.115920	-0.000000	discard	R10: Grid u=0.4 K=0.5 a=0.3	agent1	initial_cond	0	0.001044
exp15205	8.58580947e-29	0.000000	0.000000	discard	cycle 119 u=0.0975	agent0	initial_cond	0	0.000000
exp15205	6.64665881e-17	0.115920	-0.000000	discard	R10: Grid u=0.4 K=0.5 a=0.5	agent1	initial_cond	0	0.001044
exp15206	5.23962023e-29	0.000000	0.000000	discard	cycle 119 u=0.0975	agent0	initial_cond	0	0.000000
