exp_id	residual	solution_norm	solution_mean	status	description	agent	design	elapsed_s	solution_energy
exp14081	1.88036672e-29	0.000000	0.000000	discard	cycle 108 u=0.0982	agent0	initial_cond	0	0.000000
exp14082	1.88036672e-29	0.000000	0.000000	discard	cycle 108 u=0.0982	agent0	initial_cond	0	0.000000
exp14083	1.88036672e-29	0.000000	0.000000	discard	cycle 108 u=0.0982	agent0	initial_cond	1	0.000000
exp14084	1.91190259e-29	0.000000	-0.000000	discard	cycle 108 u=0.0982	agent0	initial_cond	0	0.000000
exp14085	1.91190259e-29	0.000000	-0.000000	discard	cycle 108 u=0.0982	agent0	initial_cond	1	0.000000
exp14086	1.91190259e-29	0.000000	-0.000000	discard	cycle 108 u=0.0982	agent0	initial_cond	0	0.000000
exp14087	6.13049994e-29	0.000000	0.000000	discard	cycle 108 u=0.0985	agent0	initial_cond	0	0.000000
exp14088	6.13049994e-29	0.000000	0.000000	discard	cycle 108 u=0.0985	agent0	initial_cond	1	0.000000
exp14089	6.13049994e-29	0.000000	0.000000	discard	cycle 108 u=0.0985	agent0	initial_cond	0	0.000000
exp14090	5.49750971e-29	0.000000	0.000000	discard	cycle 108 u=0.0985	agent0	initial_cond	1	0.000000
exp14091	5.49750971e-29	0.000000	0.000000	discard	cycle 108 u=0.0985	agent0	initial_cond	0	0.000000
exp14092	5.49750971e-29	0.000000	0.000000	discard	cycle 108 u=0.0985	agent0	initial_cond	0	0.000000
exp14093	4.15642452e-29	0.000000	0.000000	discard	cycle 108 u=0.0985	agent0	initial_cond	0	0.000000
exp14094	4.15642452e-29	0.000000	0.000000	discard	cycle 108 u=0.0985	agent0	initial_cond	0	0.000000
exp14095	4.15642452e-29	0.000000	0.000000	discard	cycle 108 u=0.0985	agent0	initial_cond	1	0.000000
exp14096	2.19292611e-29	0.000000	0.000000	discard	cycle 108 u=0.0985	agent0	initial_cond	0	-0.000000
exp14097	2.19292611e-29	0.000000	0.000000	discard	cycle 108 u=0.0985	agent0	initial_cond	0	-0.000000
exp14098	2.19292611e-29	0.000000	0.000000	discard	cycle 108 u=0.0985	agent0	initial_cond	0	-0.000000
exp14099	4.22491788e-29	0.000000	0.000000	discard	cycle 108 u=0.0990	agent0	initial_cond	0	-0.000000
exp14100	4.22491788e-29	0.000000	0.000000	discard	cycle 108 u=0.0990	agent0	initial_cond	1	-0.000000
exp14101	4.22491788e-29	0.000000	0.000000	discard	cycle 108 u=0.0990	agent0	initial_cond	0	-0.000000
exp14102	3.22245147e-29	0.000000	0.000000	discard	cycle 108 u=0.0990	agent0	initial_cond	1	0.000000
exp14103	3.22245147e-29	0.000000	0.000000	discard	cycle 108 u=0.0990	agent0	initial_cond	0	0.000000
exp14104	3.22245147e-29	0.000000	0.000000	discard	cycle 108 u=0.0990	agent0	initial_cond	0	0.000000
exp14105	4.50941488e-29	0.000000	-0.000000	discard	cycle 108 u=0.0990	agent0	initial_cond	1	0.000000
exp14106	4.50941488e-29	0.000000	-0.000000	discard	cycle 108 u=0.0990	agent0	initial_cond	0	0.000000
exp14107	4.50941488e-29	0.000000	-0.000000	discard	cycle 108 u=0.0990	agent0	initial_cond	1	0.000000
exp14108	4.88330883e-29	0.000000	-0.000000	discard	cycle 108 u=0.0990	agent0	initial_cond	0	0.000000
exp14109	4.88330883e-29	0.000000	-0.000000	discard	cycle 108 u=0.0990	agent0	initial_cond	0	0.000000
exp14110	4.88330883e-29	0.000000	-0.000000	discard	cycle 108 u=0.0990	agent0	initial_cond	0	0.000000
exp14111	5.74085541e-29	0.000000	-0.000000	discard	cycle 108 u=0.0995	agent0	initial_cond	0	0.000000
exp14112	5.74085541e-29	0.000000	-0.000000	discard	cycle 108 u=0.0995	agent0	initial_cond	1	0.000000
exp14113	5.74085541e-29	0.000000	-0.000000	discard	cycle 108 u=0.0995	agent0	initial_cond	0	0.000000
exp14114	1.54984578e-28	0.000000	0.000000	discard	cycle 108 u=0.0995	agent0	initial_cond	0	-0.000000
exp14115	1.54984578e-28	0.000000	0.000000	discard	cycle 108 u=0.0995	agent0	initial_cond	0	-0.000000
exp14116	1.54984578e-28	0.000000	0.000000	discard	cycle 108 u=0.0995	agent0	initial_cond	0	-0.000000
exp14117	1.60328418e-29	0.000000	-0.000000	discard	cycle 108 u=0.0995	agent0	initial_cond	1	-0.000000
exp14118	1.60328418e-29	0.000000	-0.000000	discard	cycle 108 u=0.0995	agent0	initial_cond	0	-0.000000
exp14119	1.60328418e-29	0.000000	-0.000000	discard	cycle 108 u=0.0995	agent0	initial_cond	0	-0.000000
exp14120	7.34590618e-29	0.000000	0.000000	discard	cycle 108 u=0.0995	agent0	initial_cond	0	0.000000
exp14121	7.34590618e-29	0.000000	0.000000	discard	cycle 108 u=0.0995	agent0	initial_cond	0	0.000000
exp14122	7.34590618e-29	0.000000	0.000000	discard	cycle 108 u=0.0995	agent0	initial_cond	1	0.000000
exp14123	4.46546993e-29	0.000000	0.000000	discard	cycle 108 u=0.1000	agent0	initial_cond	0	-0.000000
exp14124	4.46546993e-29	0.000000	0.000000	discard	cycle 108 u=0.1000	agent0	initial_cond	1	-0.000000
exp14125	4.46546993e-29	0.000000	0.000000	discard	cycle 108 u=0.1000	agent0	initial_cond	0	-0.000000
exp14126	4.08106752e-29	0.000000	0.000000	discard	cycle 108 u=0.1000	agent0	initial_cond	0	-0.000000
exp14127	4.08106752e-29	0.000000	0.000000	discard	cycle 108 u=0.1000	agent0	initial_cond	0	-0.000000
exp14128	4.08106752e-29	0.000000	0.000000	discard	cycle 108 u=0.1000	agent0	initial_cond	0	-0.000000
exp14129	4.58623706e-29	0.000000	0.000000	discard	cycle 108 u=0.1000	agent0	initial_cond	1	-0.000000
exp14130	4.58623706e-29	0.000000	0.000000	discard	cycle 108 u=0.1000	agent0	initial_cond	0	-0.000000
exp14131	4.58623706e-29	0.000000	0.000000	discard	cycle 108 u=0.1000	agent0	initial_cond	0	-0.000000
exp14132	4.39794337e-29	0.000000	0.000000	discard	cycle 108 u=0.1000	agent0	initial_cond	0	-0.000000
exp14133	4.39794337e-29	0.000000	0.000000	discard	cycle 108 u=0.1000	agent0	initial_cond	0	-0.000000
exp14134	4.39794337e-29	0.000000	0.000000	discard	cycle 108 u=0.1000	agent0	initial_cond	1	-0.000000
exp14135	1.36727475e-28	0.000000	0.000000	discard	cycle 108 u=0.1050	agent0	initial_cond	0	-0.000000
exp14136	1.36727475e-28	0.000000	0.000000	discard	cycle 108 u=0.1050	agent0	initial_cond	0	-0.000000
exp14137	1.36727475e-28	0.000000	0.000000	discard	cycle 108 u=0.1050	agent0	initial_cond	0	-0.000000
exp14138	6.14461376e-29	0.000000	0.000000	discard	cycle 108 u=0.1050	agent0	initial_cond	0	-0.000000
exp14139	6.14461376e-29	0.000000	0.000000	discard	cycle 108 u=0.1050	agent0	initial_cond	1	-0.000000
exp14140	6.14461376e-29	0.000000	0.000000	discard	cycle 108 u=0.1050	agent0	initial_cond	0	-0.000000
exp14141	1.75906666e-28	0.000000	0.000000	discard	cycle 108 u=0.1050	agent0	initial_cond	1	-0.000000
exp14142	1.75906666e-28	0.000000	0.000000	discard	cycle 108 u=0.1050	agent0	initial_cond	0	-0.000000
exp14143	1.75906666e-28	0.000000	0.000000	discard	cycle 108 u=0.1050	agent0	initial_cond	0	-0.000000
exp14144	1.11257917e-28	0.000000	0.000000	discard	cycle 108 u=0.1050	agent0	initial_cond	0	-0.000000
exp14145	1.11257917e-28	0.000000	0.000000	discard	cycle 108 u=0.1050	agent0	initial_cond	0	-0.000000
exp14146	1.11257917e-28	0.000000	0.000000	discard	cycle 108 u=0.1050	agent0	initial_cond	1	-0.000000
exp14147	8.58580947e-29	0.000000	0.000000	discard	cycle 109 u=0.0975	agent0	initial_cond	0	0.000000
exp14148	8.58580947e-29	0.000000	0.000000	discard	cycle 109 u=0.0975	agent0	initial_cond	0	0.000000
exp14149	8.58580947e-29	0.000000	0.000000	discard	cycle 109 u=0.0975	agent0	initial_cond	0	0.000000
exp14150	5.23962023e-29	0.000000	0.000000	discard	cycle 109 u=0.0975	agent0	initial_cond	0	0.000000
exp14151	5.23962023e-29	0.000000	0.000000	discard	cycle 109 u=0.0975	agent0	initial_cond	1	0.000000
exp14152	5.23962023e-29	0.000000	0.000000	discard	cycle 109 u=0.0975	agent0	initial_cond	0	0.000000
exp14153	4.03266298e-29	0.000000	0.000000	discard	cycle 109 u=0.0975	agent0	initial_cond	1	0.000000
exp14154	4.03266298e-29	0.000000	0.000000	discard	cycle 109 u=0.0975	agent0	initial_cond	0	0.000000
exp14155	4.03266298e-29	0.000000	0.000000	discard	cycle 109 u=0.0975	agent0	initial_cond	0	0.000000
exp14156	4.80015937e-29	0.000000	0.000000	discard	cycle 109 u=0.0975	agent0	initial_cond	1	0.000000
exp14157	4.80015937e-29	0.000000	0.000000	discard	cycle 109 u=0.0975	agent0	initial_cond	0	0.000000
exp14158	4.80015937e-29	0.000000	0.000000	discard	cycle 109 u=0.0975	agent0	initial_cond	1	0.000000
exp14159	2.68824537e-29	0.000000	0.000000	discard	cycle 109 u=0.0980	agent0	initial_cond	0	-0.000000
exp14160	2.68824537e-29	0.000000	0.000000	discard	cycle 109 u=0.0980	agent0	initial_cond	0	-0.000000
exp14161	2.68824537e-29	0.000000	0.000000	discard	cycle 109 u=0.0980	agent0	initial_cond	0	-0.000000
exp14162	6.16758073e-29	0.000000	0.000000	discard	cycle 109 u=0.0980	agent0	initial_cond	0	-0.000000
exp14163	6.16758073e-29	0.000000	0.000000	discard	cycle 109 u=0.0980	agent0	initial_cond	1	-0.000000
exp14164	6.16758073e-29	0.000000	0.000000	discard	cycle 109 u=0.0980	agent0	initial_cond	0	-0.000000
exp14165	2.01926478e-29	0.000000	0.000000	discard	cycle 109 u=0.0980	agent0	initial_cond	0	0.000000
exp14166	2.01926478e-29	0.000000	0.000000	discard	cycle 109 u=0.0980	agent0	initial_cond	0	0.000000
exp14167	2.01926478e-29	0.000000	0.000000	discard	cycle 109 u=0.0980	agent0	initial_cond	0	0.000000
exp14168	1.30310780e-28	0.000000	0.000000	discard	cycle 109 u=0.0980	agent0	initial_cond	1	-0.000000
exp14169	1.30310780e-28	0.000000	0.000000	discard	cycle 109 u=0.0980	agent0	initial_cond	0	-0.000000
exp14170	1.30310780e-28	0.000000	0.000000	discard	cycle 109 u=0.0980	agent0	initial_cond	0	-0.000000
exp14171	5.45343271e-29	0.000000	0.000000	discard	cycle 109 u=0.0982	agent0	initial_cond	0	-0.000000
exp14172	5.45343271e-29	0.000000	0.000000	discard	cycle 109 u=0.0982	agent0	initial_cond	0	-0.000000
exp14173	5.45343271e-29	0.000000	0.000000	discard	cycle 109 u=0.0982	agent0	initial_cond	1	-0.000000
exp14174	1.23429977e-28	0.000000	0.000000	discard	cycle 109 u=0.0982	agent0	initial_cond	0	0.000000
exp14175	1.23429977e-28	0.000000	0.000000	discard	cycle 109 u=0.0982	agent0	initial_cond	1	0.000000
exp14176	1.23429977e-28	0.000000	0.000000	discard	cycle 109 u=0.0982	agent0	initial_cond	0	0.000000
exp14177	1.88036672e-29	0.000000	0.000000	discard	cycle 109 u=0.0982	agent0	initial_cond	0	0.000000
exp14178	1.88036672e-29	0.000000	0.000000	discard	cycle 109 u=0.0982	agent0	initial_cond	0	0.000000
exp14179	1.88036672e-29	0.000000	0.000000	discard	cycle 109 u=0.0982	agent0	initial_cond	0	0.000000
exp14180	1.91190259e-29	0.000000	-0.000000	discard	cycle 109 u=0.0982	agent0	initial_cond	1	0.000000
exp14181	1.91190259e-29	0.000000	-0.000000	discard	cycle 109 u=0.0982	agent0	initial_cond	0	0.000000
exp14182	1.91190259e-29	0.000000	-0.000000	discard	cycle 109 u=0.0982	agent0	initial_cond	0	0.000000
exp14183	6.13049994e-29	0.000000	0.000000	discard	cycle 109 u=0.0985	agent0	initial_cond	0	0.000000
exp14184	6.13049994e-29	0.000000	0.000000	discard	cycle 109 u=0.0985	agent0	initial_cond	0	0.000000
exp14185	6.13049994e-29	0.000000	0.000000	discard	cycle 109 u=0.0985	agent0	initial_cond	1	0.000000
exp14186	5.49750971e-29	0.000000	0.000000	discard	cycle 109 u=0.0985	agent0	initial_cond	0	0.000000
exp14187	5.49750971e-29	0.000000	0.000000	discard	cycle 109 u=0.0985	agent0	initial_cond	0	0.000000
exp14188	5.49750971e-29	0.000000	0.000000	discard	cycle 109 u=0.0985	agent0	initial_cond	0	0.000000
exp14189	4.15642452e-29	0.000000	0.000000	discard	cycle 109 u=0.0985	agent0	initial_cond	0	0.000000
exp14190	4.15642452e-29	0.000000	0.000000	discard	cycle 109 u=0.0985	agent0	initial_cond	1	0.000000
exp14191	4.15642452e-29	0.000000	0.000000	discard	cycle 109 u=0.0985	agent0	initial_cond	0	0.000000
exp14192	2.19292611e-29	0.000000	0.000000	discard	cycle 109 u=0.0985	agent0	initial_cond	1	-0.000000
exp14193	2.19292611e-29	0.000000	0.000000	discard	cycle 109 u=0.0985	agent0	initial_cond	0	-0.000000
exp14194	2.19292611e-29	0.000000	0.000000	discard	cycle 109 u=0.0985	agent0	initial_cond	0	-0.000000
exp14195	4.22491788e-29	0.000000	0.000000	discard	cycle 109 u=0.0990	agent0	initial_cond	0	-0.000000
exp14196	4.22491788e-29	0.000000	0.000000	discard	cycle 109 u=0.0990	agent0	initial_cond	0	-0.000000
exp14197	4.22491788e-29	0.000000	0.000000	discard	cycle 109 u=0.0990	agent0	initial_cond	1	-0.000000
exp14198	3.22245147e-29	0.000000	0.000000	discard	cycle 109 u=0.0990	agent0	initial_cond	0	0.000000
exp14199	3.22245147e-29	0.000000	0.000000	discard	cycle 109 u=0.0990	agent0	initial_cond	0	0.000000
exp14200	3.22245147e-29	0.000000	0.000000	discard	cycle 109 u=0.0990	agent0	initial_cond	0	0.000000
exp14201	4.50941488e-29	0.000000	-0.000000	discard	cycle 109 u=0.0990	agent0	initial_cond	0	0.000000
exp14202	4.50941488e-29	0.000000	-0.000000	discard	cycle 109 u=0.0990	agent0	initial_cond	1	0.000000
exp14203	4.50941488e-29	0.000000	-0.000000	discard	cycle 109 u=0.0990	agent0	initial_cond	0	0.000000
exp14204	4.88330883e-29	0.000000	-0.000000	discard	cycle 109 u=0.0990	agent0	initial_cond	1	0.000000
exp14205	4.88330883e-29	0.000000	-0.000000	discard	cycle 109 u=0.0990	agent0	initial_cond	0	0.000000
exp14206	4.88330883e-29	0.000000	-0.000000	discard	cycle 109 u=0.0990	agent0	initial_cond	0	0.000000
exp14207	5.74085541e-29	0.000000	-0.000000	discard	cycle 109 u=0.0995	agent0	initial_cond	1	0.000000
exp14208	2.10002123e-19	0.001438	-0.000000	discard	Round 8: Validate K_amplitude=0.0061 baseline config	agent1	initial_cond	0	-0.000000
exp14208	5.74085541e-29	0.000000	-0.000000	discard	cycle 109 u=0.0995	agent0	initial_cond	0	0.000000
exp14209	5.74085541e-29	0.000000	-0.000000	discard	cycle 109 u=0.0995	agent0	initial_cond	1	0.000000
exp14210	1.54984578e-28	0.000000	0.000000	discard	cycle 109 u=0.0995	agent0	initial_cond	0	-0.000000
exp14211	1.54984578e-28	0.000000	0.000000	discard	cycle 109 u=0.0995	agent0	initial_cond	0	-0.000000
exp14212	1.54984578e-28	0.000000	0.000000	discard	cycle 109 u=0.0995	agent0	initial_cond	0	-0.000000
exp14213	1.60328418e-29	0.000000	-0.000000	discard	cycle 109 u=0.0995	agent0	initial_cond	0	-0.000000
exp14214	1.60328418e-29	0.000000	-0.000000	discard	cycle 109 u=0.0995	agent0	initial_cond	1	-0.000000
exp14215	1.60328418e-29	0.000000	-0.000000	discard	cycle 109 u=0.0995	agent0	initial_cond	0	-0.000000
exp14216	7.34590618e-29	0.000000	0.000000	discard	cycle 109 u=0.0995	agent0	initial_cond	0	0.000000
exp14217	7.34590618e-29	0.000000	0.000000	discard	cycle 109 u=0.0995	agent0	initial_cond	0	0.000000
exp14218	7.34590618e-29	0.000000	0.000000	discard	cycle 109 u=0.0995	agent0	initial_cond	0	0.000000
exp14219	4.46546993e-29	0.000000	0.000000	discard	cycle 109 u=0.1000	agent0	initial_cond	1	-0.000000
exp14220	4.46546993e-29	0.000000	0.000000	discard	cycle 109 u=0.1000	agent0	initial_cond	0	-0.000000
exp14221	4.46546993e-29	0.000000	0.000000	discard	cycle 109 u=0.1000	agent0	initial_cond	1	-0.000000
exp14222	4.08106752e-29	0.000000	0.000000	discard	cycle 109 u=0.1000	agent0	initial_cond	0	-0.000000
exp14223	4.08106752e-29	0.000000	0.000000	discard	cycle 109 u=0.1000	agent0	initial_cond	0	-0.000000
exp14224	4.08106752e-29	0.000000	0.000000	discard	cycle 109 u=0.1000	agent0	initial_cond	1	-0.000000
exp14225	4.58623706e-29	0.000000	0.000000	discard	cycle 109 u=0.1000	agent0	initial_cond	0	-0.000000
exp14226	4.58623706e-29	0.000000	0.000000	discard	cycle 109 u=0.1000	agent0	initial_cond	1	-0.000000
exp14227	4.58623706e-29	0.000000	0.000000	discard	cycle 109 u=0.1000	agent0	initial_cond	0	-0.000000
exp14228	4.39794337e-29	0.000000	0.000000	discard	cycle 109 u=0.1000	agent0	initial_cond	0	-0.000000
exp14229	4.39794337e-29	0.000000	0.000000	discard	cycle 109 u=0.1000	agent0	initial_cond	0	-0.000000
exp14230	4.39794337e-29	0.000000	0.000000	discard	cycle 109 u=0.1000	agent0	initial_cond	0	-0.000000
exp14231	1.36727475e-28	0.000000	0.000000	discard	cycle 109 u=0.1050	agent0	initial_cond	1	-0.000000
exp14232	1.36727475e-28	0.000000	0.000000	discard	cycle 109 u=0.1050	agent0	initial_cond	0	-0.000000
exp14233	1.36727475e-28	0.000000	0.000000	discard	cycle 109 u=0.1050	agent0	initial_cond	1	-0.000000
exp14234	6.14461376e-29	0.000000	0.000000	discard	cycle 109 u=0.1050	agent0	initial_cond	0	-0.000000
exp14235	6.14461376e-29	0.000000	0.000000	discard	cycle 109 u=0.1050	agent0	initial_cond	0	-0.000000
exp14236	6.14461376e-29	0.000000	0.000000	discard	cycle 109 u=0.1050	agent0	initial_cond	0	-0.000000
exp14237	1.75906666e-28	0.000000	0.000000	discard	cycle 109 u=0.1050	agent0	initial_cond	0	-0.000000
exp14238	1.75906666e-28	0.000000	0.000000	discard	cycle 109 u=0.1050	agent0	initial_cond	1	-0.000000
exp14239	1.75906666e-28	0.000000	0.000000	discard	cycle 109 u=0.1050	agent0	initial_cond	0	-0.000000
exp14240	1.11257917e-28	0.000000	0.000000	discard	cycle 109 u=0.1050	agent0	initial_cond	0	-0.000000
exp14241	1.11257917e-28	0.000000	0.000000	discard	cycle 109 u=0.1050	agent0	initial_cond	0	-0.000000
exp14242	1.11257917e-28	0.000000	0.000000	discard	cycle 109 u=0.1050	agent0	initial_cond	0	-0.000000
exp14243	8.58580947e-29	0.000000	0.000000	discard	cycle 110 u=0.0975	agent0	initial_cond	1	0.000000
exp14244	8.58580947e-29	0.000000	0.000000	discard	cycle 110 u=0.0975	agent0	initial_cond	0	0.000000
exp14245	8.58580947e-29	0.000000	0.000000	discard	cycle 110 u=0.0975	agent0	initial_cond	1	0.000000
exp14246	5.23962023e-29	0.000000	0.000000	discard	cycle 110 u=0.0975	agent0	initial_cond	0	0.000000
exp14247	5.23962023e-29	0.000000	0.000000	discard	cycle 110 u=0.0975	agent0	initial_cond	0	0.000000
exp14248	5.23962023e-29	0.000000	0.000000	discard	cycle 110 u=0.0975	agent0	initial_cond	1	0.000000
exp14249	4.03266298e-29	0.000000	0.000000	discard	cycle 110 u=0.0975	agent0	initial_cond	0	0.000000
exp14250	4.03266298e-29	0.000000	0.000000	discard	cycle 110 u=0.0975	agent0	initial_cond	1	0.000000
exp14251	4.03266298e-29	0.000000	0.000000	discard	cycle 110 u=0.0975	agent0	initial_cond	0	0.000000
exp14252	4.80015937e-29	0.000000	0.000000	discard	cycle 110 u=0.0975	agent0	initial_cond	0	0.000000
exp14253	4.80015937e-29	0.000000	0.000000	discard	cycle 110 u=0.0975	agent0	initial_cond	0	0.000000
exp14254	4.80015937e-29	0.000000	0.000000	discard	cycle 110 u=0.0975	agent0	initial_cond	0	0.000000
exp14255	2.68824537e-29	0.000000	0.000000	discard	cycle 110 u=0.0980	agent0	initial_cond	1	-0.000000
exp14256	2.68824537e-29	0.000000	0.000000	discard	cycle 110 u=0.0980	agent0	initial_cond	0	-0.000000
exp14257	2.68824537e-29	0.000000	0.000000	discard	cycle 110 u=0.0980	agent0	initial_cond	0	-0.000000
exp14258	6.16758073e-29	0.000000	0.000000	discard	cycle 110 u=0.0980	agent0	initial_cond	0	-0.000000
exp14259	6.16758073e-29	0.000000	0.000000	discard	cycle 110 u=0.0980	agent0	initial_cond	0	-0.000000
exp14260	6.16758073e-29	0.000000	0.000000	discard	cycle 110 u=0.0980	agent0	initial_cond	1	-0.000000
exp14261	2.01926478e-29	0.000000	0.000000	discard	cycle 110 u=0.0980	agent0	initial_cond	0	0.000000
exp14262	2.01926478e-29	0.000000	0.000000	discard	cycle 110 u=0.0980	agent0	initial_cond	1	0.000000
exp14263	2.01926478e-29	0.000000	0.000000	discard	cycle 110 u=0.0980	agent0	initial_cond	0	0.000000
exp14264	1.30310780e-28	0.000000	0.000000	discard	cycle 110 u=0.0980	agent0	initial_cond	0	-0.000000
exp14265	1.30310780e-28	0.000000	0.000000	discard	cycle 110 u=0.0980	agent0	initial_cond	0	-0.000000
exp14266	1.30310780e-28	0.000000	0.000000	discard	cycle 110 u=0.0980	agent0	initial_cond	0	-0.000000
exp14267	5.45343271e-29	0.000000	0.000000	discard	cycle 110 u=0.0982	agent0	initial_cond	1	-0.000000
exp14268	5.45343271e-29	0.000000	0.000000	discard	cycle 110 u=0.0982	agent0	initial_cond	0	-0.000000
exp14269	5.45343271e-29	0.000000	0.000000	discard	cycle 110 u=0.0982	agent0	initial_cond	0	-0.000000
exp14270	1.23429977e-28	0.000000	0.000000	discard	cycle 110 u=0.0982	agent0	initial_cond	0	0.000000
exp14271	1.23429977e-28	0.000000	0.000000	discard	cycle 110 u=0.0982	agent0	initial_cond	0	0.000000
exp14272	1.23429977e-28	0.000000	0.000000	discard	cycle 110 u=0.0982	agent0	initial_cond	1	0.000000
exp14273	1.88036672e-29	0.000000	0.000000	discard	cycle 110 u=0.0982	agent0	initial_cond	0	0.000000
exp14274	1.88036672e-29	0.000000	0.000000	discard	cycle 110 u=0.0982	agent0	initial_cond	1	0.000000
exp14275	1.88036672e-29	0.000000	0.000000	discard	cycle 110 u=0.0982	agent0	initial_cond	0	0.000000
exp14276	1.91190259e-29	0.000000	-0.000000	discard	cycle 110 u=0.0982	agent0	initial_cond	0	0.000000
exp14277	1.91190259e-29	0.000000	-0.000000	discard	cycle 110 u=0.0982	agent0	initial_cond	1	0.000000
exp14278	1.91190259e-29	0.000000	-0.000000	discard	cycle 110 u=0.0982	agent0	initial_cond	0	0.000000
exp14279	6.13049994e-29	0.000000	0.000000	discard	cycle 110 u=0.0985	agent0	initial_cond	1	0.000000
exp14280	6.13049994e-29	0.000000	0.000000	discard	cycle 110 u=0.0985	agent0	initial_cond	0	0.000000
exp14281	6.13049994e-29	0.000000	0.000000	discard	cycle 110 u=0.0985	agent0	initial_cond	0	0.000000
exp14281	1.82727678e-15	0.000236	-0.000000	discard	Round 8: K_amplitude sweep 0.001	agent1	branch_search	0	-0.000000
exp14282	5.49750971e-29	0.000000	0.000000	discard	cycle 110 u=0.0985	agent0	initial_cond	0	0.000000
exp14282	1.14265570e-16	0.000707	-0.000000	discard	Round 8: K_amplitude sweep 0.003	agent1	branch_search	0	-0.000000
exp14283	2.46662739e-17	0.001179	-0.000000	discard	Round 8: K_amplitude sweep 0.005	agent1	branch_search	0	-0.000000
exp14283	5.49750971e-29	0.000000	0.000000	discard	cycle 110 u=0.0985	agent0	initial_cond	0	0.000000
exp14284	5.49750971e-29	0.000000	0.000000	discard	cycle 110 u=0.0985	agent0	initial_cond	1	0.000000
exp14284	6.12999068e-15	0.002357	-0.000000	discard	Round 8: K_amplitude sweep 0.010	agent1	branch_search	1	-0.000000
exp14285	4.15642452e-29	0.000000	0.000000	discard	cycle 110 u=0.0985	agent0	initial_cond	0	0.000000
exp14285	1.74886520e-18	0.003535	-0.000000	discard	Round 8: K_amplitude sweep 0.015	agent1	branch_search	0	-0.000000
exp14286	4.15642452e-29	0.000000	0.000000	discard	cycle 110 u=0.0985	agent0	initial_cond	0	0.000000
exp14286	3.65164686e-18	0.004714	-0.000000	discard	Round 8: K_amplitude sweep 0.020	agent1	branch_search	0	-0.000000
exp14287	4.15642452e-29	0.000000	0.000000	discard	cycle 110 u=0.0985	agent0	initial_cond	0	0.000000
exp14287	1.29653480e-17	0.007071	-0.000000	discard	Round 8: K_amplitude sweep 0.030	agent1	branch_search	0	-0.000001
exp14288	2.19292611e-29	0.000000	0.000000	discard	cycle 110 u=0.0985	agent0	initial_cond	0	-0.000000
