exp_id	residual	solution_norm	solution_mean	status	description	agent	design	elapsed_s	solution_energy
exp14288	6.18472616e-18	0.011783	-0.000000	discard	Round 8: K_amplitude sweep 0.050	agent1	branch_search	0	-0.000002
exp14289	2.19292611e-29	0.000000	0.000000	discard	cycle 110 u=0.0985	agent0	initial_cond	1	-0.000000
exp14289	1.40197541e-15	0.023554	-0.000000	discard	Round 8: K_amplitude sweep 0.100	agent1	branch_search	1	-0.000005
exp14290	2.19292611e-29	0.000000	0.000000	discard	cycle 110 u=0.0985	agent0	initial_cond	0	-0.000000
exp14291	4.22491788e-29	0.000000	0.000000	discard	cycle 110 u=0.0990	agent0	initial_cond	1	-0.000000
exp14292	4.22491788e-29	0.000000	0.000000	discard	cycle 110 u=0.0990	agent0	initial_cond	0	-0.000000
exp14293	4.22491788e-29	0.000000	0.000000	discard	cycle 110 u=0.0990	agent0	initial_cond	0	-0.000000
exp14294	3.22245147e-29	0.000000	0.000000	discard	cycle 110 u=0.0990	agent0	initial_cond	0	0.000000
exp14295	3.22245147e-29	0.000000	0.000000	discard	cycle 110 u=0.0990	agent0	initial_cond	0	0.000000
exp14296	3.22245147e-29	0.000000	0.000000	discard	cycle 110 u=0.0990	agent0	initial_cond	1	0.000000
exp14297	4.50941488e-29	0.000000	-0.000000	discard	cycle 110 u=0.0990	agent0	initial_cond	0	0.000000
exp14298	4.50941488e-29	0.000000	-0.000000	discard	cycle 110 u=0.0990	agent0	initial_cond	1	0.000000
exp14299	4.50941488e-29	0.000000	-0.000000	discard	cycle 110 u=0.0990	agent0	initial_cond	0	0.000000
exp14300	4.88330883e-29	0.000000	-0.000000	discard	cycle 110 u=0.0990	agent0	initial_cond	0	0.000000
exp14301	6.12999068e-15	0.002357	-0.000000	discard	Round 8: Fine K around 0.015 - k=0.010	agent1	branch_search	1	-0.000000
exp14302	4.88330883e-29	0.000000	-0.000000	discard	cycle 110 u=0.0990	agent0	initial_cond	1	0.000000
exp14303	5.51520630e-16	0.002593	-0.000000	discard	Round 8: Fine K around 0.015 - k=0.011	agent1	branch_search	0	-0.000000
exp14303	4.88330883e-29	0.000000	-0.000000	discard	cycle 110 u=0.0990	agent0	initial_cond	0	0.000000
exp14304	4.09039482e-17	0.002828	-0.000000	discard	Round 8: Fine K around 0.015 - k=0.012	agent1	branch_search	1	-0.000000
exp14304	5.74085541e-29	0.000000	-0.000000	discard	cycle 110 u=0.0995	agent0	initial_cond	1	0.000000
exp14305	2.86295289e-18	0.003064	-0.000000	discard	Round 8: Fine K around 0.015 - k=0.013	agent1	branch_search	0	-0.000000
exp14305	5.74085541e-29	0.000000	-0.000000	discard	cycle 110 u=0.0995	agent0	initial_cond	0	0.000000
exp14306	1.52077650e-18	0.003300	-0.000000	discard	Round 8: Fine K around 0.015 - k=0.014	agent1	branch_search	0	-0.000000
exp14306	5.74085541e-29	0.000000	-0.000000	discard	cycle 110 u=0.0995	agent0	initial_cond	0	0.000000
exp14307	1.74886520e-18	0.003535	-0.000000	discard	Round 8: Fine K around 0.015 - k=0.015	agent1	branch_search	1	-0.000000
exp14307	1.54984578e-28	0.000000	0.000000	discard	cycle 110 u=0.0995	agent0	initial_cond	0	-0.000000
exp14308	4.39929945e-15	0.003771	-0.000000	discard	Round 8: Fine K around 0.015 - k=0.016	agent1	branch_search	0	-0.000000
exp14308	1.54984578e-28	0.000000	0.000000	discard	cycle 110 u=0.0995	agent0	initial_cond	0	-0.000000
exp14309	8.29870503e-16	0.004007	-0.000000	discard	Round 8: Fine K around 0.015 - k=0.017	agent1	branch_search	1	-0.000000
exp14309	1.54984578e-28	0.000000	0.000000	discard	cycle 110 u=0.0995	agent0	initial_cond	1	-0.000000
exp14310	1.43973211e-16	0.004243	-0.000000	discard	Round 8: Fine K around 0.015 - k=0.018	agent1	branch_search	0	-0.000000
exp14310	1.60328418e-29	0.000000	-0.000000	discard	cycle 110 u=0.0995	agent0	initial_cond	0	-0.000000
exp14311	2.33634735e-17	0.004478	-0.000000	discard	Round 8: Fine K around 0.015 - k=0.019	agent1	branch_search	0	-0.000000
exp14311	1.60328418e-29	0.000000	-0.000000	discard	cycle 110 u=0.0995	agent0	initial_cond	0	-0.000000
exp14312	3.65164686e-18	0.004714	-0.000000	discard	Round 8: Fine K around 0.015 - k=0.020	agent1	branch_search	0	-0.000000
exp14312	1.60328418e-29	0.000000	-0.000000	discard	cycle 110 u=0.0995	agent0	initial_cond	0	-0.000000
exp14313	7.34590618e-29	0.000000	0.000000	discard	cycle 110 u=0.0995	agent0	initial_cond	0	0.000000
exp14314	7.34590618e-29	0.000000	0.000000	discard	cycle 110 u=0.0995	agent0	initial_cond	1	0.000000
exp14315	7.34590618e-29	0.000000	0.000000	discard	cycle 110 u=0.0995	agent0	initial_cond	0	0.000000
exp14316	4.46546993e-29	0.000000	0.000000	discard	cycle 110 u=0.1000	agent0	initial_cond	1	-0.000000
exp14317	4.46546993e-29	0.000000	0.000000	discard	cycle 110 u=0.1000	agent0	initial_cond	0	-0.000000
exp14318	4.46546993e-29	0.000000	0.000000	discard	cycle 110 u=0.1000	agent0	initial_cond	0	-0.000000
exp14319	4.08106752e-29	0.000000	0.000000	discard	cycle 110 u=0.1000	agent0	initial_cond	0	-0.000000
exp14320	4.08106752e-29	0.000000	0.000000	discard	cycle 110 u=0.1000	agent0	initial_cond	0	-0.000000
exp14321	4.08106752e-29	0.000000	0.000000	discard	cycle 110 u=0.1000	agent0	initial_cond	1	-0.000000
exp14322	4.58623706e-29	0.000000	0.000000	discard	cycle 110 u=0.1000	agent0	initial_cond	0	-0.000000
exp14323	4.58623706e-29	0.000000	0.000000	discard	cycle 110 u=0.1000	agent0	initial_cond	0	-0.000000
exp14324	4.58623706e-29	0.000000	0.000000	discard	cycle 110 u=0.1000	agent0	initial_cond	0	-0.000000
exp14325	4.39794337e-29	0.000000	0.000000	discard	cycle 110 u=0.1000	agent0	initial_cond	0	-0.000000
exp14326	4.39794337e-29	0.000000	0.000000	discard	cycle 110 u=0.1000	agent0	initial_cond	1	-0.000000
exp14327	4.39794337e-29	0.000000	0.000000	discard	cycle 110 u=0.1000	agent0	initial_cond	0	-0.000000
exp14328	1.36727475e-28	0.000000	0.000000	discard	cycle 110 u=0.1050	agent0	initial_cond	0	-0.000000
exp14329	1.36727475e-28	0.000000	0.000000	discard	cycle 110 u=0.1050	agent0	initial_cond	0	-0.000000
exp14330	1.36727475e-28	0.000000	0.000000	discard	cycle 110 u=0.1050	agent0	initial_cond	0	-0.000000
exp14331	1.06430190e-17	0.002946	-0.000000	discard	Round 8: Ultra-fine K=0.0125	agent1	branch_search	1	-0.000000
exp14332	6.14461376e-29	0.000000	0.000000	discard	cycle 110 u=0.1050	agent0	initial_cond	1	-0.000000
exp14333	2.86295289e-18	0.003064	-0.000000	discard	Round 8: Ultra-fine K=0.0130	agent1	branch_search	0	-0.000000
exp14334	6.14461376e-29	0.000000	0.000000	discard	cycle 110 u=0.1050	agent0	initial_cond	0	-0.000000
exp14335	9.08799199e-19	0.003182	-0.000000	discard	Round 8: Ultra-fine K=0.0135	agent1	branch_search	0	-0.000000
exp14336	6.14461376e-29	0.000000	0.000000	discard	cycle 110 u=0.1050	agent0	initial_cond	1	-0.000000
exp14337	1.52077650e-18	0.003300	-0.000000	discard	Round 8: Ultra-fine K=0.0140	agent1	branch_search	0	-0.000000
exp14338	1.75906666e-28	0.000000	0.000000	discard	cycle 110 u=0.1050	agent0	initial_cond	0	-0.000000
exp14339	3.16102439e-18	0.003418	-0.000000	discard	Round 8: Ultra-fine K=0.0145	agent1	branch_search	0	-0.000000
exp14340	1.75906666e-28	0.000000	0.000000	discard	cycle 110 u=0.1050	agent0	initial_cond	0	-0.000000
exp14341	1.74886520e-18	0.003535	-0.000000	discard	Round 8: Ultra-fine K=0.0150	agent1	branch_search	1	-0.000000
exp14342	1.75906666e-28	0.000000	0.000000	discard	cycle 110 u=0.1050	agent0	initial_cond	0	-0.000000
exp14343	8.23541987e-19	0.003653	0.000000	discard	Round 8: Ultra-fine K=0.0155	agent1	branch_search	0	-0.000000
exp14344	1.11257917e-28	0.000000	0.000000	discard	cycle 110 u=0.1050	agent0	initial_cond	0	-0.000000
exp14345	4.09039482e-17	0.002828	-0.000000	discard	Round 8: Boundary check K=0.0120	agent1	branch_search	1	-0.000000
exp14346	1.11257917e-28	0.000000	0.000000	discard	cycle 110 u=0.1050	agent0	initial_cond	1	-0.000000
exp14347	4.39929945e-15	0.003771	-0.000000	discard	Round 8: Boundary check K=0.0160	agent1	branch_search	0	-0.000000
exp14348	1.11257917e-28	0.000000	0.000000	discard	cycle 110 u=0.1050	agent0	initial_cond	0	-0.000000
exp14349	8.58580947e-29	0.000000	0.000000	discard	cycle 111 u=0.0975	agent0	initial_cond	0	0.000000
exp14350	8.58580947e-29	0.000000	0.000000	discard	cycle 111 u=0.0975	agent0	initial_cond	0	0.000000
exp14351	8.58580947e-29	0.000000	0.000000	discard	cycle 111 u=0.0975	agent0	initial_cond	0	0.000000
exp14352	5.23962023e-29	0.000000	0.000000	discard	cycle 111 u=0.0975	agent0	initial_cond	1	0.000000
exp14353	5.23962023e-29	0.000000	0.000000	discard	cycle 111 u=0.0975	agent0	initial_cond	0	0.000000
exp14354	5.23962023e-29	0.000000	0.000000	discard	cycle 111 u=0.0975	agent0	initial_cond	1	0.000000
exp14355	4.03266298e-29	0.000000	0.000000	discard	cycle 111 u=0.0975	agent0	initial_cond	0	0.000000
exp14356	4.03266298e-29	0.000000	0.000000	discard	cycle 111 u=0.0975	agent0	initial_cond	0	0.000000
exp14357	1.08575268e-18	0.003135	-0.000000	discard	Round 8: Final refinement K=0.0133	agent1	branch_search	1	-0.000000
exp14357	4.03266298e-29	0.000000	0.000000	discard	cycle 111 u=0.0975	agent0	initial_cond	1	0.000000
exp14358	2.28017207e-18	0.003229	-0.000000	discard	Round 8: Final refinement K=0.0137	agent1	branch_search	0	-0.000000
exp14358	4.80015937e-29	0.000000	0.000000	discard	cycle 111 u=0.0975	agent0	initial_cond	0	0.000000
exp14359	4.24659514e-19	0.003323	-0.000000	discard	Round 8: Final refinement K=0.0141	agent1	branch_search	1	-0.000000
exp14359	4.80015937e-29	0.000000	0.000000	discard	cycle 111 u=0.0975	agent0	initial_cond	1	0.000000
exp14360	3.16102439e-18	0.003418	-0.000000	discard	Round 8: Final refinement K=0.0145	agent1	branch_search	0	-0.000000
exp14360	4.80015937e-29	0.000000	0.000000	discard	cycle 111 u=0.0975	agent0	initial_cond	0	0.000000
exp14361	3.01347404e-18	0.003512	0.000000	discard	Round 8: Final refinement K=0.0149	agent1	branch_search	0	-0.000000
exp14361	2.68824537e-29	0.000000	0.000000	discard	cycle 111 u=0.0980	agent0	initial_cond	0	-0.000000
exp14362	2.68824537e-29	0.000000	0.000000	discard	cycle 111 u=0.0980	agent0	initial_cond	0	-0.000000
exp14362	1.22748569e-18	0.003606	-0.000000	discard	Round 8: Final refinement K=0.0153	agent1	branch_search	0	-0.000000
exp14363	2.68824537e-29	0.000000	0.000000	discard	cycle 111 u=0.0980	agent0	initial_cond	0	-0.000000
exp14363	7.13213906e-15	0.003700	-0.000000	discard	Round 8: Final refinement K=0.0157	agent1	branch_search	0	-0.000000
exp14364	6.16758073e-29	0.000000	0.000000	discard	cycle 111 u=0.0980	agent0	initial_cond	1	-0.000000
exp14365	6.16758073e-29	0.000000	0.000000	discard	cycle 111 u=0.0980	agent0	initial_cond	0	-0.000000
exp14366	6.16758073e-29	0.000000	0.000000	discard	cycle 111 u=0.0980	agent0	initial_cond	0	-0.000000
exp14367	2.01926478e-29	0.000000	0.000000	discard	cycle 111 u=0.0980	agent0	initial_cond	0	0.000000
exp14368	2.01926478e-29	0.000000	0.000000	discard	cycle 111 u=0.0980	agent0	initial_cond	0	0.000000
exp14369	2.01926478e-29	0.000000	0.000000	discard	cycle 111 u=0.0980	agent0	initial_cond	1	0.000000
exp14370	1.30310780e-28	0.000000	0.000000	discard	cycle 111 u=0.0980	agent0	initial_cond	0	-0.000000
exp14371	1.30310780e-28	0.000000	0.000000	discard	cycle 111 u=0.0980	agent0	initial_cond	1	-0.000000
exp14372	1.17771991e-18	0.003276	-0.000000	discard	Round 8: Pinpoint K=0.0139	agent1	branch_search	0	-0.000000
exp14373	1.30310780e-28	0.000000	0.000000	discard	cycle 111 u=0.0980	agent0	initial_cond	0	-0.000000
exp14374	1.52077650e-18	0.003300	-0.000000	discard	Round 8: Pinpoint K=0.0140	agent1	branch_search	0	-0.000000
exp14375	5.45343271e-29	0.000000	0.000000	discard	cycle 111 u=0.0982	agent0	initial_cond	0	-0.000000
exp14376	4.24659514e-19	0.003323	-0.000000	discard	Round 8: Pinpoint K=0.0141	agent1	branch_search	1	-0.000000
exp14377	5.45343271e-29	0.000000	0.000000	discard	cycle 111 u=0.0982	agent0	initial_cond	0	-0.000000
exp14378	1.56468920e-18	0.003347	-0.000000	discard	Round 8: Pinpoint K=0.0142	agent1	branch_search	0	-0.000000
exp14379	5.45343271e-29	0.000000	0.000000	discard	cycle 111 u=0.0982	agent0	initial_cond	0	-0.000000
exp14380	8.38105638e-19	0.003370	-0.000000	discard	Round 8: Pinpoint K=0.0143	agent1	branch_search	0	-0.000000
exp14381	1.23429977e-28	0.000000	0.000000	discard	cycle 111 u=0.0982	agent0	initial_cond	1	0.000000
exp14382	1.23429977e-28	0.000000	0.000000	discard	cycle 111 u=0.0982	agent0	initial_cond	0	0.000000
exp14383	1.23429977e-28	0.000000	0.000000	discard	cycle 111 u=0.0982	agent0	initial_cond	0	0.000000
exp14384	1.88036672e-29	0.000000	0.000000	discard	cycle 111 u=0.0982	agent0	initial_cond	0	0.000000
exp14385	1.88036672e-29	0.000000	0.000000	discard	cycle 111 u=0.0982	agent0	initial_cond	0	0.000000
exp14386	1.88036672e-29	0.000000	0.000000	discard	cycle 111 u=0.0982	agent0	initial_cond	1	0.000000
exp14387	1.91190259e-29	0.000000	-0.000000	discard	cycle 111 u=0.0982	agent0	initial_cond	0	0.000000
exp14388	1.91190259e-29	0.000000	-0.000000	discard	cycle 111 u=0.0982	agent0	initial_cond	1	0.000000
exp14389	1.91190259e-29	0.000000	-0.000000	discard	cycle 111 u=0.0982	agent0	initial_cond	0	0.000000
exp14390	6.13049994e-29	0.000000	0.000000	discard	cycle 111 u=0.0985	agent0	initial_cond	0	0.000000
exp14391	6.13049994e-29	0.000000	0.000000	discard	cycle 111 u=0.0985	agent0	initial_cond	1	0.000000
exp14392	6.13049994e-29	0.000000	0.000000	discard	cycle 111 u=0.0985	agent0	initial_cond	0	0.000000
exp14393	5.49750971e-29	0.000000	0.000000	discard	cycle 111 u=0.0985	agent0	initial_cond	1	0.000000
exp14394	5.49750971e-29	0.000000	0.000000	discard	cycle 111 u=0.0985	agent0	initial_cond	0	0.000000
exp14395	5.49750971e-29	0.000000	0.000000	discard	cycle 111 u=0.0985	agent0	initial_cond	0	0.000000
exp14396	4.15642452e-29	0.000000	0.000000	discard	cycle 111 u=0.0985	agent0	initial_cond	0	0.000000
exp14397	4.15642452e-29	0.000000	0.000000	discard	cycle 111 u=0.0985	agent0	initial_cond	0	0.000000
exp14398	4.15642452e-29	0.000000	0.000000	discard	cycle 111 u=0.0985	agent0	initial_cond	1	0.000000
exp14399	1.07936085e-18	0.001296	-0.000000	discard	Round 8: Verify 0.0061 region K=0.0055	agent1	branch_search	0	-0.000000
exp14400	2.19292611e-29	0.000000	0.000000	discard	cycle 111 u=0.0985	agent0	initial_cond	0	-0.000000
exp14401	8.91428825e-19	0.001367	-0.000000	discard	Round 8: Verify 0.0061 region K=0.0058	agent1	branch_search	0	-0.000000
exp14402	2.19292611e-29	0.000000	0.000000	discard	cycle 111 u=0.0985	agent0	initial_cond	1	-0.000000
exp14403	2.37680703e-19	0.001414	-0.000000	discard	Round 8: Verify 0.0061 region K=0.0060	agent1	branch_search	1	-0.000000
exp14404	2.19292611e-29	0.000000	0.000000	discard	cycle 111 u=0.0985	agent0	initial_cond	0	-0.000000
exp14405	2.10002123e-19	0.001438	-0.000000	discard	Round 8: Verify 0.0061 region K=0.0061	agent1	branch_search	0	-0.000000
exp14406	4.22491788e-29	0.000000	0.000000	discard	cycle 111 u=0.0990	agent0	initial_cond	0	-0.000000
exp14407	4.37882228e-19	0.001461	-0.000000	discard	Round 8: Verify 0.0061 region K=0.0062	agent1	branch_search	0	-0.000000
exp14408	4.22491788e-29	0.000000	0.000000	discard	cycle 111 u=0.0990	agent0	initial_cond	1	-0.000000
exp14409	6.13800807e-15	0.001485	-0.000000	discard	Round 8: Verify 0.0061 region K=0.0063	agent1	branch_search	0	-0.000000
exp14410	4.22491788e-29	0.000000	0.000000	discard	cycle 111 u=0.0990	agent0	initial_cond	0	-0.000000
exp14411	3.15053579e-15	0.001532	-0.000000	discard	Round 8: Verify 0.0061 region K=0.0065	agent1	branch_search	0	-0.000000
exp14412	3.22245147e-29	0.000000	0.000000	discard	cycle 111 u=0.0990	agent0	initial_cond	1	0.000000
exp14413	5.46379294e-16	0.001650	-0.000000	discard	Round 8: Verify 0.0061 region K=0.0070	agent1	branch_search	1	-0.000000
exp14414	3.22245147e-29	0.000000	0.000000	discard	cycle 111 u=0.0990	agent0	initial_cond	0	0.000000
exp14415	3.22245147e-29	0.000000	0.000000	discard	cycle 111 u=0.0990	agent0	initial_cond	0	0.000000
exp14416	4.50941488e-29	0.000000	-0.000000	discard	cycle 111 u=0.0990	agent0	initial_cond	0	0.000000
exp14417	4.50941488e-29	0.000000	-0.000000	discard	cycle 111 u=0.0990	agent0	initial_cond	0	0.000000
exp14418	4.50941488e-29	0.000000	-0.000000	discard	cycle 111 u=0.0990	agent0	initial_cond	1	0.000000
exp14419	4.88330883e-29	0.000000	-0.000000	discard	cycle 111 u=0.0990	agent0	initial_cond	0	0.000000
exp14420	4.88330883e-29	0.000000	-0.000000	discard	cycle 111 u=0.0990	agent0	initial_cond	0	0.000000
exp14421	4.88330883e-29	0.000000	-0.000000	discard	cycle 111 u=0.0990	agent0	initial_cond	0	0.000000
exp14422	5.74085541e-29	0.000000	-0.000000	discard	cycle 111 u=0.0995	agent0	initial_cond	0	0.000000
exp14423	5.74085541e-29	0.000000	-0.000000	discard	cycle 111 u=0.0995	agent0	initial_cond	1	0.000000
exp14424	5.74085541e-29	0.000000	-0.000000	discard	cycle 111 u=0.0995	agent0	initial_cond	0	0.000000
exp14425	1.54984578e-28	0.000000	0.000000	discard	cycle 111 u=0.0995	agent0	initial_cond	1	-0.000000
exp14426	1.54984578e-28	0.000000	0.000000	discard	cycle 111 u=0.0995	agent0	initial_cond	0	-0.000000
exp14427	1.54984578e-28	0.000000	0.000000	discard	cycle 111 u=0.0995	agent0	initial_cond	0	-0.000000
exp14428	1.60328418e-29	0.000000	-0.000000	discard	cycle 111 u=0.0995	agent0	initial_cond	0	-0.000000
exp14429	1.60328418e-29	0.000000	-0.000000	discard	cycle 111 u=0.0995	agent0	initial_cond	0	-0.000000
exp14430	1.60328418e-29	0.000000	-0.000000	discard	cycle 111 u=0.0995	agent0	initial_cond	1	-0.000000
exp14431	7.34590618e-29	0.000000	0.000000	discard	cycle 111 u=0.0995	agent0	initial_cond	0	0.000000
exp14432	7.34590618e-29	0.000000	0.000000	discard	cycle 111 u=0.0995	agent0	initial_cond	0	0.000000
exp14433	7.34590618e-29	0.000000	0.000000	discard	cycle 111 u=0.0995	agent0	initial_cond	0	0.000000
exp14434	4.46546993e-29	0.000000	0.000000	discard	cycle 111 u=0.1000	agent0	initial_cond	0	-0.000000
exp14434	9.48947344e-16	0.001438	-0.000000	discard	Round 8: u_offset=0.20 at K=0.0061	agent1	initial_cond	0	-0.000000
exp14435	4.46546993e-29	0.000000	0.000000	discard	cycle 111 u=0.1000	agent0	initial_cond	1	-0.000000
exp14435	3.23250657e-15	0.001438	-0.000000	discard	Round 8: u_offset=0.22 at K=0.0061	agent1	initial_cond	1	-0.000000
exp14436	4.46546993e-29	0.000000	0.000000	discard	cycle 111 u=0.1000	agent0	initial_cond	0	-0.000000
exp14436	8.06573602e-19	0.001438	-0.000000	discard	Round 8: u_offset=0.24 at K=0.0061	agent1	initial_cond	0	-0.000000
exp14437	4.08106752e-29	0.000000	0.000000	discard	cycle 111 u=0.1000	agent0	initial_cond	1	-0.000000
exp14437	2.10002123e-19	0.001438	-0.000000	discard	Round 8: u_offset=0.244 at K=0.0061	agent1	initial_cond	1	-0.000000
exp14438	4.08106752e-29	0.000000	0.000000	discard	cycle 111 u=0.1000	agent0	initial_cond	0	-0.000000
exp14438	2.79832075e-19	0.001438	-0.000000	discard	Round 8: u_offset=0.25 at K=0.0061	agent1	initial_cond	0	-0.000000
exp14439	4.08106752e-29	0.000000	0.000000	discard	cycle 111 u=0.1000	agent0	initial_cond	0	-0.000000
exp14439	9.08871486e-19	0.001438	-0.000000	discard	Round 8: u_offset=0.27 at K=0.0061	agent1	initial_cond	0	-0.000000
exp14440	4.58623706e-29	0.000000	0.000000	discard	cycle 111 u=0.1000	agent0	initial_cond	1	-0.000000
exp14440	3.15548706e-18	0.001438	-0.000000	discard	Round 8: u_offset=0.30 at K=0.0061	agent1	initial_cond	0	-0.000000
exp14441	4.58623706e-29	0.000000	0.000000	discard	cycle 111 u=0.1000	agent0	initial_cond	0	-0.000000
exp14441	4.50238676e-16	0.001438	-0.000000	discard	Round 8: amplitude=0.35 at K=0.0061	agent1	perturbation	0	-0.000000
exp14442	4.58623706e-29	0.000000	0.000000	discard	cycle 111 u=0.1000	agent0	initial_cond	1	-0.000000
exp14442	2.99083084e-15	0.001438	-0.000000	discard	Round 8: amplitude=0.40 at K=0.0061	agent1	perturbation	1	-0.000000
exp14443	4.39794337e-29	0.000000	0.000000	discard	cycle 111 u=0.1000	agent0	initial_cond	0	-0.000000
exp14443	2.10002123e-19	0.001438	-0.000000	discard	Round 8: amplitude=0.44 at K=0.0061	agent1	perturbation	0	-0.000000
exp14444	4.39794337e-29	0.000000	0.000000	discard	cycle 111 u=0.1000	agent0	initial_cond	0	-0.000000
exp14444	2.40521449e-19	0.001438	-0.000000	discard	Round 8: amplitude=0.45 at K=0.0061	agent1	perturbation	0	-0.000000
exp14445	4.39794337e-29	0.000000	0.000000	discard	cycle 111 u=0.1000	agent0	initial_cond	0	-0.000000
exp14445	7.07019354e-19	0.001438	0.000000	discard	Round 8: amplitude=0.46 at K=0.0061	agent1	perturbation	0	-0.000000
exp14446	1.36727475e-28	0.000000	0.000000	discard	cycle 111 u=0.1050	agent0	initial_cond	0	-0.000000
exp14446	1.08645777e-18	0.001438	-0.000000	discard	Round 8: amplitude=0.50 at K=0.0061	agent1	perturbation	0	-0.000000
exp14447	1.36727475e-28	0.000000	0.000000	discard	cycle 111 u=0.1050	agent0	initial_cond	1	-0.000000
exp14447	4.84931206e-16	0.001438	-0.000000	discard	Round 8: phase=0.5 at K=0.0061	agent1	perturbation	1	-0.000000
exp14448	1.36727475e-28	0.000000	0.000000	discard	cycle 111 u=0.1050	agent0	initial_cond	0	-0.000000
exp14448	6.99088621e-15	0.001438	-0.000000	discard	Round 8: phase=1.0 at K=0.0061	agent1	perturbation	0	-0.000000
exp14449	6.14461376e-29	0.000000	0.000000	discard	cycle 111 u=0.1050	agent0	initial_cond	0	-0.000000
exp14449	2.10002123e-19	0.001438	-0.000000	discard	Round 8: phase=1.23 at K=0.0061	agent1	perturbation	1	-0.000000
exp14450	6.14461376e-29	0.000000	0.000000	discard	cycle 111 u=0.1050	agent0	initial_cond	0	-0.000000
exp14450	3.45624220e-19	0.001438	-0.000000	discard	Round 8: phase=1.5 at K=0.0061	agent1	perturbation	0	-0.000000
exp14451	6.14461376e-29	0.000000	0.000000	discard	cycle 111 u=0.1050	agent0	initial_cond	0	-0.000000
exp14451	4.86287950e-19	0.001438	-0.000000	discard	Round 8: phase=1.8 at K=0.0061	agent1	perturbation	0	-0.000000
exp14452	1.75906666e-28	0.000000	0.000000	discard	cycle 111 u=0.1050	agent0	initial_cond	1	-0.000000
exp14452	4.07709055e-19	0.001438	-0.000000	discard	Round 8: phase=2.0 at K=0.0061	agent1	perturbation	0	-0.000000
exp14453	1.75906666e-28	0.000000	0.000000	discard	cycle 111 u=0.1050	agent0	initial_cond	0	-0.000000
exp14454	1.75906666e-28	0.000000	0.000000	discard	cycle 111 u=0.1050	agent0	initial_cond	1	-0.000000
exp14455	1.11257917e-28	0.000000	0.000000	discard	cycle 111 u=0.1050	agent0	initial_cond	0	-0.000000
exp14456	1.11257917e-28	0.000000	0.000000	discard	cycle 111 u=0.1050	agent0	initial_cond	0	-0.000000
