exp_id	residual	solution_norm	solution_mean	status	description	agent	design	elapsed_s	solution_energy
exp6875	6.16758073e-29	0.000000	0.000000	discard	cycle 44 u=0.0980	agent0	initial_cond	1	-0.000000
exp6876	6.16758073e-29	0.000000	0.000000	discard	cycle 44 u=0.0980	agent0	initial_cond	0	-0.000000
exp6877	6.16758073e-29	0.000000	0.000000	discard	cycle 44 u=0.0980	agent0	initial_cond	0	-0.000000
exp6878	2.01926478e-29	0.000000	0.000000	discard	cycle 44 u=0.0980	agent0	initial_cond	0	0.000000
exp6879	2.01926478e-29	0.000000	0.000000	discard	cycle 44 u=0.0980	agent0	initial_cond	0	0.000000
exp6880	2.01926478e-29	0.000000	0.000000	discard	cycle 44 u=0.0980	agent0	initial_cond	1	0.000000
exp6881	1.30310780e-28	0.000000	0.000000	discard	cycle 44 u=0.0980	agent0	initial_cond	0	-0.000000
exp6882	1.30310780e-28	0.000000	0.000000	discard	cycle 44 u=0.0980	agent0	initial_cond	0	-0.000000
exp6883	1.30310780e-28	0.000000	0.000000	discard	cycle 44 u=0.0980	agent0	initial_cond	1	-0.000000
exp6884	5.45343271e-29	0.000000	0.000000	discard	cycle 44 u=0.0982	agent0	initial_cond	0	-0.000000
exp6885	5.45343271e-29	0.000000	0.000000	discard	cycle 44 u=0.0982	agent0	initial_cond	0	-0.000000
exp6886	5.45343271e-29	0.000000	0.000000	discard	cycle 44 u=0.0982	agent0	initial_cond	0	-0.000000
exp6887	3.49825688e-17	0.070278	-0.000000	discard	4th branch u=-0.205 amp=0.5 phase=1.0	manual	memory	0	0.000097
exp6887	1.23429977e-28	0.000000	0.000000	discard	cycle 44 u=0.0982	agent0	initial_cond	0	0.000000
exp6888	1.23429977e-28	0.000000	0.000000	discard	cycle 44 u=0.0982	agent0	initial_cond	1	0.000000
exp6889	1.23429977e-28	0.000000	0.000000	discard	cycle 44 u=0.0982	agent0	initial_cond	0	0.000000
exp6890	1.88036672e-29	0.000000	0.000000	discard	cycle 44 u=0.0982	agent0	initial_cond	0	0.000000
exp6891	1.88036672e-29	0.000000	0.000000	discard	cycle 44 u=0.0982	agent0	initial_cond	1	0.000000
exp6892	1.88036672e-29	0.000000	0.000000	discard	cycle 44 u=0.0982	agent0	initial_cond	0	0.000000
exp6893	1.91190259e-29	0.000000	-0.000000	discard	cycle 44 u=0.0982	agent0	initial_cond	0	0.000000
exp6894	1.91190259e-29	0.000000	-0.000000	discard	cycle 44 u=0.0982	agent0	initial_cond	0	0.000000
exp6895	1.91190259e-29	0.000000	-0.000000	discard	cycle 44 u=0.0982	agent0	initial_cond	0	0.000000
exp6896	6.13049994e-29	0.000000	0.000000	discard	cycle 44 u=0.0985	agent0	initial_cond	1	0.000000
exp6897	6.13049994e-29	0.000000	0.000000	discard	cycle 44 u=0.0985	agent0	initial_cond	0	0.000000
exp6898	6.13049994e-29	0.000000	0.000000	discard	cycle 44 u=0.0985	agent0	initial_cond	0	0.000000
exp6899	5.49750971e-29	0.000000	0.000000	discard	cycle 44 u=0.0985	agent0	initial_cond	1	0.000000
exp6900	5.49750971e-29	0.000000	0.000000	discard	cycle 44 u=0.0985	agent0	initial_cond	0	0.000000
exp6901	5.49750971e-29	0.000000	0.000000	discard	cycle 44 u=0.0985	agent0	initial_cond	1	0.000000
exp6902	4.15642452e-29	0.000000	0.000000	discard	cycle 44 u=0.0985	agent0	initial_cond	0	0.000000
exp6903	4.15642452e-29	0.000000	0.000000	discard	cycle 44 u=0.0985	agent0	initial_cond	0	0.000000
exp6904	4.15642452e-29	0.000000	0.000000	discard	cycle 44 u=0.0985	agent0	initial_cond	1	0.000000
exp6905	2.19292611e-29	0.000000	0.000000	discard	cycle 44 u=0.0985	agent0	initial_cond	0	-0.000000
exp6906	1.77318212e-17	0.070278	-0.000000	discard	4th branch u=0.207 amp=0.5 phase=1.0	manual	memory	0	0.000097
exp6907	2.19292611e-29	0.000000	0.000000	discard	cycle 44 u=0.0985	agent0	initial_cond	0	-0.000000
exp6908	2.19292611e-29	0.000000	0.000000	discard	cycle 44 u=0.0985	agent0	initial_cond	0	-0.000000
exp6909	4.22491788e-29	0.000000	0.000000	discard	cycle 44 u=0.0990	agent0	initial_cond	0	-0.000000
exp6910	4.22491788e-29	0.000000	0.000000	discard	cycle 44 u=0.0990	agent0	initial_cond	1	-0.000000
exp6911	4.22491788e-29	0.000000	0.000000	discard	cycle 44 u=0.0990	agent0	initial_cond	0	-0.000000
exp6912	3.22245147e-29	0.000000	0.000000	discard	cycle 44 u=0.0990	agent0	initial_cond	0	0.000000
exp6913	3.22245147e-29	0.000000	0.000000	discard	cycle 44 u=0.0990	agent0	initial_cond	1	0.000000
exp6914	3.22245147e-29	0.000000	0.000000	discard	cycle 44 u=0.0990	agent0	initial_cond	0	0.000000
exp6915	4.50941488e-29	0.000000	-0.000000	discard	cycle 44 u=0.0990	agent0	initial_cond	0	0.000000
exp6916	4.50941488e-29	0.000000	-0.000000	discard	cycle 44 u=0.0990	agent0	initial_cond	0	0.000000
exp6917	4.50941488e-29	0.000000	-0.000000	discard	cycle 44 u=0.0990	agent0	initial_cond	0	0.000000
exp6918	4.88330883e-29	0.000000	-0.000000	discard	cycle 44 u=0.0990	agent0	initial_cond	1	0.000000
exp6919	4.88330883e-29	0.000000	-0.000000	discard	cycle 44 u=0.0990	agent0	initial_cond	0	0.000000
exp6920	4.88330883e-29	0.000000	-0.000000	discard	cycle 44 u=0.0990	agent0	initial_cond	0	0.000000
exp6921	5.74085541e-29	0.000000	-0.000000	discard	cycle 44 u=0.0995	agent0	initial_cond	1	0.000000
exp6922	5.74085541e-29	0.000000	-0.000000	discard	cycle 44 u=0.0995	agent0	initial_cond	0	0.000000
exp6923	5.74085541e-29	0.000000	-0.000000	discard	cycle 44 u=0.0995	agent0	initial_cond	0	0.000000
exp6924	1.54984578e-28	0.000000	0.000000	discard	cycle 44 u=0.0995	agent0	initial_cond	0	-0.000000
exp6925	1.54984578e-28	0.000000	0.000000	discard	cycle 44 u=0.0995	agent0	initial_cond	0	-0.000000
exp6926	1.54984578e-28	0.000000	0.000000	discard	cycle 44 u=0.0995	agent0	initial_cond	1	-0.000000
exp6927	1.60328418e-29	0.000000	-0.000000	discard	cycle 44 u=0.0995	agent0	initial_cond	0	-0.000000
exp6928	1.60328418e-29	0.000000	-0.000000	discard	cycle 44 u=0.0995	agent0	initial_cond	0	-0.000000
exp6929	1.60328418e-29	0.000000	-0.000000	discard	cycle 44 u=0.0995	agent0	initial_cond	1	-0.000000
exp6930	7.34590618e-29	0.000000	0.000000	discard	cycle 44 u=0.0995	agent0	initial_cond	0	0.000000
exp6931	7.34590618e-29	0.000000	0.000000	discard	cycle 44 u=0.0995	agent0	initial_cond	0	0.000000
exp6932	7.34590618e-29	0.000000	0.000000	discard	cycle 44 u=0.0995	agent0	initial_cond	0	0.000000
exp6933	4.46546993e-29	0.000000	0.000000	discard	cycle 44 u=0.1000	agent0	initial_cond	0	-0.000000
exp6934	4.46546993e-29	0.000000	0.000000	discard	cycle 44 u=0.1000	agent0	initial_cond	1	-0.000000
exp6934	1.80467783e-16	0.070536	-0.000000	discard	4th branch u=0.205 amp=0.5 modes=6	manual	memory	1	0.000099
exp6935	4.46546993e-29	0.000000	0.000000	discard	cycle 44 u=0.1000	agent0	initial_cond	0	-0.000000
exp6936	4.08106752e-29	0.000000	0.000000	discard	cycle 44 u=0.1000	agent0	initial_cond	0	-0.000000
exp6937	4.08106752e-29	0.000000	0.000000	discard	cycle 44 u=0.1000	agent0	initial_cond	1	-0.000000
exp6938	4.08106752e-29	0.000000	0.000000	discard	cycle 44 u=0.1000	agent0	initial_cond	0	-0.000000
exp6939	4.58623706e-29	0.000000	0.000000	discard	cycle 44 u=0.1000	agent0	initial_cond	1	-0.000000
exp6940	4.58623706e-29	0.000000	0.000000	discard	cycle 44 u=0.1000	agent0	initial_cond	0	-0.000000
exp6941	4.58623706e-29	0.000000	0.000000	discard	cycle 44 u=0.1000	agent0	initial_cond	0	-0.000000
exp6942	4.39794337e-29	0.000000	0.000000	discard	cycle 44 u=0.1000	agent0	initial_cond	1	-0.000000
exp6943	4.39794337e-29	0.000000	0.000000	discard	cycle 44 u=0.1000	agent0	initial_cond	0	-0.000000
exp6944	4.39794337e-29	0.000000	0.000000	discard	cycle 44 u=0.1000	agent0	initial_cond	0	-0.000000
exp6945	1.36727475e-28	0.000000	0.000000	discard	cycle 44 u=0.1050	agent0	initial_cond	1	-0.000000
exp6946	1.36727475e-28	0.000000	0.000000	discard	cycle 44 u=0.1050	agent0	initial_cond	0	-0.000000
exp6947	1.36727475e-28	0.000000	0.000000	discard	cycle 44 u=0.1050	agent0	initial_cond	1	-0.000000
exp6948	6.14461376e-29	0.000000	0.000000	discard	cycle 44 u=0.1050	agent0	initial_cond	0	-0.000000
exp6949	6.14461376e-29	0.000000	0.000000	discard	cycle 44 u=0.1050	agent0	initial_cond	0	-0.000000
exp6950	6.14461376e-29	0.000000	0.000000	discard	cycle 44 u=0.1050	agent0	initial_cond	1	-0.000000
exp6951	1.75906666e-28	0.000000	0.000000	discard	cycle 44 u=0.1050	agent0	initial_cond	0	-0.000000
exp6952	1.75906666e-28	0.000000	0.000000	discard	cycle 44 u=0.1050	agent0	initial_cond	0	-0.000000
exp6953	1.75906666e-28	0.000000	0.000000	discard	cycle 44 u=0.1050	agent0	initial_cond	0	-0.000000
exp6954	1.11257917e-28	0.000000	0.000000	discard	cycle 44 u=0.1050	agent0	initial_cond	0	-0.000000
exp6955	1.11257917e-28	0.000000	0.000000	discard	cycle 44 u=0.1050	agent0	initial_cond	1	-0.000000
exp6956	1.11257917e-28	0.000000	0.000000	discard	cycle 44 u=0.1050	agent0	initial_cond	0	-0.000000
exp6957	8.58580947e-29	0.000000	0.000000	discard	cycle 45 u=0.0975	agent0	initial_cond	0	0.000000
exp6958	8.58580947e-29	0.000000	0.000000	discard	cycle 45 u=0.0975	agent0	initial_cond	1	0.000000
exp6959	8.58580947e-29	0.000000	0.000000	discard	cycle 45 u=0.0975	agent0	initial_cond	0	0.000000
exp6960	5.23962023e-29	0.000000	0.000000	discard	cycle 45 u=0.0975	agent0	initial_cond	0	0.000000
exp6961	5.23962023e-29	0.000000	0.000000	discard	cycle 45 u=0.0975	agent0	initial_cond	0	0.000000
exp6962	5.23962023e-29	0.000000	0.000000	discard	cycle 45 u=0.0975	agent0	initial_cond	0	0.000000
exp6963	4.03266298e-29	0.000000	0.000000	discard	cycle 45 u=0.0975	agent0	initial_cond	1	0.000000
exp6964	4.03266298e-29	0.000000	0.000000	discard	cycle 45 u=0.0975	agent0	initial_cond	0	0.000000
exp6965	4.03266298e-29	0.000000	0.000000	discard	cycle 45 u=0.0975	agent0	initial_cond	0	0.000000
exp6966	4.80015937e-29	0.000000	0.000000	discard	cycle 45 u=0.0975	agent0	initial_cond	1	0.000000
exp6967	4.80015937e-29	0.000000	0.000000	discard	cycle 45 u=0.0975	agent0	initial_cond	0	0.000000
exp6968	1.64580528e-17	0.070278	-0.000000	discard	4th branch u=0.205 amp=0.5 FINAL VERIFICATION	manual	memory	0	0.000097
exp6969	4.80015937e-29	0.000000	0.000000	discard	cycle 45 u=0.0975	agent0	initial_cond	0	0.000000
exp6970	2.68824537e-29	0.000000	0.000000	discard	cycle 45 u=0.0980	agent0	initial_cond	0	-0.000000
exp6971	2.68824537e-29	0.000000	0.000000	discard	cycle 45 u=0.0980	agent0	initial_cond	0	-0.000000
exp6972	2.68824537e-29	0.000000	0.000000	discard	cycle 45 u=0.0980	agent0	initial_cond	1	-0.000000
exp6973	6.16758073e-29	0.000000	0.000000	discard	cycle 45 u=0.0980	agent0	initial_cond	0	-0.000000
exp6974	6.16758073e-29	0.000000	0.000000	discard	cycle 45 u=0.0980	agent0	initial_cond	0	-0.000000
exp6975	6.16758073e-29	0.000000	0.000000	discard	cycle 45 u=0.0980	agent0	initial_cond	1	-0.000000
exp6976	2.01926478e-29	0.000000	0.000000	discard	cycle 45 u=0.0980	agent0	initial_cond	0	0.000000
exp6977	2.01926478e-29	0.000000	0.000000	discard	cycle 45 u=0.0980	agent0	initial_cond	0	0.000000
exp6978	2.01926478e-29	0.000000	0.000000	discard	cycle 45 u=0.0980	agent0	initial_cond	0	0.000000
exp6979	1.30310780e-28	0.000000	0.000000	discard	cycle 45 u=0.0980	agent0	initial_cond	0	-0.000000
exp6980	1.30310780e-28	0.000000	0.000000	discard	cycle 45 u=0.0980	agent0	initial_cond	1	-0.000000
exp6981	1.30310780e-28	0.000000	0.000000	discard	cycle 45 u=0.0980	agent0	initial_cond	0	-0.000000
exp6982	5.45343271e-29	0.000000	0.000000	discard	cycle 45 u=0.0982	agent0	initial_cond	0	-0.000000
exp6983	5.45343271e-29	0.000000	0.000000	discard	cycle 45 u=0.0982	agent0	initial_cond	1	-0.000000
exp6984	5.45343271e-29	0.000000	0.000000	discard	cycle 45 u=0.0982	agent0	initial_cond	0	-0.000000
exp6985	1.23429977e-28	0.000000	0.000000	discard	cycle 45 u=0.0982	agent0	initial_cond	0	0.000000
exp6986	1.23429977e-28	0.000000	0.000000	discard	cycle 45 u=0.0982	agent0	initial_cond	0	0.000000
exp6987	1.23429977e-28	0.000000	0.000000	discard	cycle 45 u=0.0982	agent0	initial_cond	0	0.000000
exp6988	1.88036672e-29	0.000000	0.000000	discard	cycle 45 u=0.0982	agent0	initial_cond	1	0.000000
exp6989	1.88036672e-29	0.000000	0.000000	discard	cycle 45 u=0.0982	agent0	initial_cond	0	0.000000
exp6990	1.88036672e-29	0.000000	0.000000	discard	cycle 45 u=0.0982	agent0	initial_cond	0	0.000000
exp6991	1.91190259e-29	0.000000	-0.000000	discard	cycle 45 u=0.0982	agent0	initial_cond	1	0.000000
exp6992	1.91190259e-29	0.000000	-0.000000	discard	cycle 45 u=0.0982	agent0	initial_cond	0	0.000000
exp6993	1.91190259e-29	0.000000	-0.000000	discard	cycle 45 u=0.0982	agent0	initial_cond	0	0.000000
exp6994	6.13049994e-29	0.000000	0.000000	discard	cycle 45 u=0.0985	agent0	initial_cond	0	0.000000
exp6995	6.13049994e-29	0.000000	0.000000	discard	cycle 45 u=0.0985	agent0	initial_cond	0	0.000000
exp6996	6.13049994e-29	0.000000	0.000000	discard	cycle 45 u=0.0985	agent0	initial_cond	1	0.000000
exp6997	5.49750971e-29	0.000000	0.000000	discard	cycle 45 u=0.0985	agent0	initial_cond	0	0.000000
exp6998	5.49750971e-29	0.000000	0.000000	discard	cycle 45 u=0.0985	agent0	initial_cond	0	0.000000
exp6999	5.49750971e-29	0.000000	0.000000	discard	cycle 45 u=0.0985	agent0	initial_cond	1	0.000000
exp7000	4.15642452e-29	0.000000	0.000000	discard	cycle 45 u=0.0985	agent0	initial_cond	0	0.000000
exp7001	4.15642452e-29	0.000000	0.000000	discard	cycle 45 u=0.0985	agent0	initial_cond	1	0.000000
exp7002	4.15642452e-29	0.000000	0.000000	discard	cycle 45 u=0.0985	agent0	initial_cond	0	0.000000
exp7003	2.19292611e-29	0.000000	0.000000	discard	cycle 45 u=0.0985	agent0	initial_cond	0	-0.000000
exp7004	2.19292611e-29	0.000000	0.000000	discard	cycle 45 u=0.0985	agent0	initial_cond	1	-0.000000
exp7005	2.19292611e-29	0.000000	0.000000	discard	cycle 45 u=0.0985	agent0	initial_cond	0	-0.000000
exp7006	4.22491788e-29	0.000000	0.000000	discard	cycle 45 u=0.0990	agent0	initial_cond	0	-0.000000
exp7007	4.22491788e-29	0.000000	0.000000	discard	cycle 45 u=0.0990	agent0	initial_cond	1	-0.000000
exp7008	4.22491788e-29	0.000000	0.000000	discard	cycle 45 u=0.0990	agent0	initial_cond	0	-0.000000
exp7009	3.22245147e-29	0.000000	0.000000	discard	cycle 45 u=0.0990	agent0	initial_cond	1	0.000000
exp7010	3.22245147e-29	0.000000	0.000000	discard	cycle 45 u=0.0990	agent0	initial_cond	0	0.000000
exp7011	3.22245147e-29	0.000000	0.000000	discard	cycle 45 u=0.0990	agent0	initial_cond	0	0.000000
exp7012	4.50941488e-29	0.000000	-0.000000	discard	cycle 45 u=0.0990	agent0	initial_cond	1	0.000000
exp7013	4.50941488e-29	0.000000	-0.000000	discard	cycle 45 u=0.0990	agent0	initial_cond	0	0.000000
exp7014	4.50941488e-29	0.000000	-0.000000	discard	cycle 45 u=0.0990	agent0	initial_cond	0	0.000000
exp7015	4.88330883e-29	0.000000	-0.000000	discard	cycle 45 u=0.0990	agent0	initial_cond	0	0.000000
exp7016	4.88330883e-29	0.000000	-0.000000	discard	cycle 45 u=0.0990	agent0	initial_cond	0	0.000000
exp7017	4.88330883e-29	0.000000	-0.000000	discard	cycle 45 u=0.0990	agent0	initial_cond	1	0.000000
exp7018	5.74085541e-29	0.000000	-0.000000	discard	cycle 45 u=0.0995	agent0	initial_cond	0	0.000000
exp7019	5.74085541e-29	0.000000	-0.000000	discard	cycle 45 u=0.0995	agent0	initial_cond	0	0.000000
exp7020	5.74085541e-29	0.000000	-0.000000	discard	cycle 45 u=0.0995	agent0	initial_cond	1	0.000000
exp7021	1.54984578e-28	0.000000	0.000000	discard	cycle 45 u=0.0995	agent0	initial_cond	0	-0.000000
exp7022	1.54984578e-28	0.000000	0.000000	discard	cycle 45 u=0.0995	agent0	initial_cond	0	-0.000000
exp7023	1.54984578e-28	0.000000	0.000000	discard	cycle 45 u=0.0995	agent0	initial_cond	0	-0.000000
exp7024	1.60328418e-29	0.000000	-0.000000	discard	cycle 45 u=0.0995	agent0	initial_cond	0	-0.000000
exp7025	1.60328418e-29	0.000000	-0.000000	discard	cycle 45 u=0.0995	agent0	initial_cond	1	-0.000000
exp7026	1.60328418e-29	0.000000	-0.000000	discard	cycle 45 u=0.0995	agent0	initial_cond	0	-0.000000
exp7027	7.34590618e-29	0.000000	0.000000	discard	cycle 45 u=0.0995	agent0	initial_cond	0	0.000000
exp7028	7.34590618e-29	0.000000	0.000000	discard	cycle 45 u=0.0995	agent0	initial_cond	1	0.000000
exp7029	7.34590618e-29	0.000000	0.000000	discard	cycle 45 u=0.0995	agent0	initial_cond	0	0.000000
exp7030	4.46546993e-29	0.000000	0.000000	discard	cycle 45 u=0.1000	agent0	initial_cond	0	-0.000000
exp7031	4.46546993e-29	0.000000	0.000000	discard	cycle 45 u=0.1000	agent0	initial_cond	0	-0.000000
exp7032	4.46546993e-29	0.000000	0.000000	discard	cycle 45 u=0.1000	agent0	initial_cond	0	-0.000000
exp7033	4.08106752e-29	0.000000	0.000000	discard	cycle 45 u=0.1000	agent0	initial_cond	1	-0.000000
exp7034	4.08106752e-29	0.000000	0.000000	discard	cycle 45 u=0.1000	agent0	initial_cond	0	-0.000000
exp7035	4.08106752e-29	0.000000	0.000000	discard	cycle 45 u=0.1000	agent0	initial_cond	0	-0.000000
exp7036	4.58623706e-29	0.000000	0.000000	discard	cycle 45 u=0.1000	agent0	initial_cond	1	-0.000000
exp7037	4.58623706e-29	0.000000	0.000000	discard	cycle 45 u=0.1000	agent0	initial_cond	0	-0.000000
exp7038	4.58623706e-29	0.000000	0.000000	discard	cycle 45 u=0.1000	agent0	initial_cond	0	-0.000000
exp7039	4.39794337e-29	0.000000	0.000000	discard	cycle 45 u=0.1000	agent0	initial_cond	0	-0.000000
exp7040	4.39794337e-29	0.000000	0.000000	discard	cycle 45 u=0.1000	agent0	initial_cond	0	-0.000000
exp7041	4.39794337e-29	0.000000	0.000000	discard	cycle 45 u=0.1000	agent0	initial_cond	1	-0.000000
exp7042	1.36727475e-28	0.000000	0.000000	discard	cycle 45 u=0.1050	agent0	initial_cond	0	-0.000000
exp7043	1.36727475e-28	0.000000	0.000000	discard	cycle 45 u=0.1050	agent0	initial_cond	0	-0.000000
exp7044	1.36727475e-28	0.000000	0.000000	discard	cycle 45 u=0.1050	agent0	initial_cond	1	-0.000000
exp7045	6.14461376e-29	0.000000	0.000000	discard	cycle 45 u=0.1050	agent0	initial_cond	0	-0.000000
exp7046	6.14461376e-29	0.000000	0.000000	discard	cycle 45 u=0.1050	agent0	initial_cond	0	-0.000000
exp7047	6.14461376e-29	0.000000	0.000000	discard	cycle 45 u=0.1050	agent0	initial_cond	0	-0.000000
exp7048	1.75906666e-28	0.000000	0.000000	discard	cycle 45 u=0.1050	agent0	initial_cond	0	-0.000000
exp7049	1.75906666e-28	0.000000	0.000000	discard	cycle 45 u=0.1050	agent0	initial_cond	1	-0.000000
exp7050	1.75906666e-28	0.000000	0.000000	discard	cycle 45 u=0.1050	agent0	initial_cond	0	-0.000000
exp7051	1.11257917e-28	0.000000	0.000000	discard	cycle 45 u=0.1050	agent0	initial_cond	0	-0.000000
exp7052	1.11257917e-28	0.000000	0.000000	discard	cycle 45 u=0.1050	agent0	initial_cond	1	-0.000000
exp7053	1.11257917e-28	0.000000	0.000000	discard	cycle 45 u=0.1050	agent0	initial_cond	0	-0.000000
exp7054	8.58580947e-29	0.000000	0.000000	discard	cycle 46 u=0.0975	agent0	initial_cond	0	0.000000
exp7055	8.58580947e-29	0.000000	0.000000	discard	cycle 46 u=0.0975	agent0	initial_cond	0	0.000000
exp7056	8.58580947e-29	0.000000	0.000000	discard	cycle 46 u=0.0975	agent0	initial_cond	0	0.000000
exp7057	5.23962023e-29	0.000000	0.000000	discard	cycle 46 u=0.0975	agent0	initial_cond	1	0.000000
exp7058	5.23962023e-29	0.000000	0.000000	discard	cycle 46 u=0.0975	agent0	initial_cond	0	0.000000
exp7059	5.23962023e-29	0.000000	0.000000	discard	cycle 46 u=0.0975	agent0	initial_cond	0	0.000000
exp7060	4.03266298e-29	0.000000	0.000000	discard	cycle 46 u=0.0975	agent0	initial_cond	1	0.000000
exp7061	4.03266298e-29	0.000000	0.000000	discard	cycle 46 u=0.0975	agent0	initial_cond	0	0.000000
exp7062	4.03266298e-29	0.000000	0.000000	discard	cycle 46 u=0.0975	agent0	initial_cond	0	0.000000
exp7063	4.80015937e-29	0.000000	0.000000	discard	cycle 46 u=0.0975	agent0	initial_cond	0	0.000000
exp7064	4.80015937e-29	0.000000	0.000000	discard	cycle 46 u=0.0975	agent0	initial_cond	0	0.000000
exp7065	4.80015937e-29	0.000000	0.000000	discard	cycle 46 u=0.0975	agent0	initial_cond	1	0.000000
exp7066	2.68824537e-29	0.000000	0.000000	discard	cycle 46 u=0.0980	agent0	initial_cond	0	-0.000000
exp7067	2.68824537e-29	0.000000	0.000000	discard	cycle 46 u=0.0980	agent0	initial_cond	0	-0.000000
exp7068	2.68824537e-29	0.000000	0.000000	discard	cycle 46 u=0.0980	agent0	initial_cond	1	-0.000000
exp7069	6.16758073e-29	0.000000	0.000000	discard	cycle 46 u=0.0980	agent0	initial_cond	0	-0.000000
exp7070	6.16758073e-29	0.000000	0.000000	discard	cycle 46 u=0.0980	agent0	initial_cond	1	-0.000000
exp7071	6.16758073e-29	0.000000	0.000000	discard	cycle 46 u=0.0980	agent0	initial_cond	0	-0.000000
exp7072	2.01926478e-29	0.000000	0.000000	discard	cycle 46 u=0.0980	agent0	initial_cond	0	0.000000
exp7073	2.01926478e-29	0.000000	0.000000	discard	cycle 46 u=0.0980	agent0	initial_cond	1	0.000000
exp7074	2.01926478e-29	0.000000	0.000000	discard	cycle 46 u=0.0980	agent0	initial_cond	0	0.000000
exp7075	1.30310780e-28	0.000000	0.000000	discard	cycle 46 u=0.0980	agent0	initial_cond	0	-0.000000
exp7076	1.30310780e-28	0.000000	0.000000	discard	cycle 46 u=0.0980	agent0	initial_cond	0	-0.000000
exp7077	1.30310780e-28	0.000000	0.000000	discard	cycle 46 u=0.0980	agent0	initial_cond	0	-0.000000
exp7078	5.45343271e-29	0.000000	0.000000	discard	cycle 46 u=0.0982	agent0	initial_cond	1	-0.000000
exp7079	5.45343271e-29	0.000000	0.000000	discard	cycle 46 u=0.0982	agent0	initial_cond	0	-0.000000
exp7080	5.45343271e-29	0.000000	0.000000	discard	cycle 46 u=0.0982	agent0	initial_cond	0	-0.000000
exp7081	1.23429977e-28	0.000000	0.000000	discard	cycle 46 u=0.0982	agent0	initial_cond	1	0.000000
exp7082	1.23429977e-28	0.000000	0.000000	discard	cycle 46 u=0.0982	agent0	initial_cond	0	0.000000
exp7083	1.23429977e-28	0.000000	0.000000	discard	cycle 46 u=0.0982	agent0	initial_cond	0	0.000000
exp7084	1.88036672e-29	0.000000	0.000000	discard	cycle 46 u=0.0982	agent0	initial_cond	0	0.000000
exp7085	1.88036672e-29	0.000000	0.000000	discard	cycle 46 u=0.0982	agent0	initial_cond	0	0.000000
exp7086	1.88036672e-29	0.000000	0.000000	discard	cycle 46 u=0.0982	agent0	initial_cond	1	0.000000
exp7087	1.91190259e-29	0.000000	-0.000000	discard	cycle 46 u=0.0982	agent0	initial_cond	0	0.000000
exp7088	1.91190259e-29	0.000000	-0.000000	discard	cycle 46 u=0.0982	agent0	initial_cond	0	0.000000
exp7089	1.91190259e-29	0.000000	-0.000000	discard	cycle 46 u=0.0982	agent0	initial_cond	1	0.000000
exp7090	6.13049994e-29	0.000000	0.000000	discard	cycle 46 u=0.0985	agent0	initial_cond	0	0.000000
exp7091	6.13049994e-29	0.000000	0.000000	discard	cycle 46 u=0.0985	agent0	initial_cond	0	0.000000
exp7092	6.13049994e-29	0.000000	0.000000	discard	cycle 46 u=0.0985	agent0	initial_cond	0	0.000000
exp7093	5.49750971e-29	0.000000	0.000000	discard	cycle 46 u=0.0985	agent0	initial_cond	0	0.000000
