exp_id	residual	solution_norm	solution_mean	status	description	agent	design	elapsed_s	solution_energy
exp14847	4.88330883e-29	0.000000	-0.000000	discard	cycle 115 u=0.0990	agent0	initial_cond	0	0.000000
exp14848	4.88330883e-29	0.000000	-0.000000	discard	cycle 115 u=0.0990	agent0	initial_cond	0	0.000000
exp14849	4.88330883e-29	0.000000	-0.000000	discard	cycle 115 u=0.0990	agent0	initial_cond	0	0.000000
exp14850	5.74085541e-29	0.000000	-0.000000	discard	cycle 115 u=0.0995	agent0	initial_cond	1	0.000000
exp14851	5.74085541e-29	0.000000	-0.000000	discard	cycle 115 u=0.0995	agent0	initial_cond	0	0.000000
exp14852	5.74085541e-29	0.000000	-0.000000	discard	cycle 115 u=0.0995	agent0	initial_cond	1	0.000000
exp14853	1.54984578e-28	0.000000	0.000000	discard	cycle 115 u=0.0995	agent0	initial_cond	0	-0.000000
exp14854	1.54984578e-28	0.000000	0.000000	discard	cycle 115 u=0.0995	agent0	initial_cond	0	-0.000000
exp14855	1.54984578e-28	0.000000	0.000000	discard	cycle 115 u=0.0995	agent0	initial_cond	1	-0.000000
exp14856	1.60328418e-29	0.000000	-0.000000	discard	cycle 115 u=0.0995	agent0	initial_cond	0	-0.000000
exp14857	1.60328418e-29	0.000000	-0.000000	discard	cycle 115 u=0.0995	agent0	initial_cond	1	-0.000000
exp14858	1.60328418e-29	0.000000	-0.000000	discard	cycle 115 u=0.0995	agent0	initial_cond	0	-0.000000
exp14859	7.34590618e-29	0.000000	0.000000	discard	cycle 115 u=0.0995	agent0	initial_cond	0	0.000000
exp14860	7.34590618e-29	0.000000	0.000000	discard	cycle 115 u=0.0995	agent0	initial_cond	0	0.000000
exp14861	7.34590618e-29	0.000000	0.000000	discard	cycle 115 u=0.0995	agent0	initial_cond	0	0.000000
exp14862	4.46546993e-29	0.000000	0.000000	discard	cycle 115 u=0.1000	agent0	initial_cond	1	-0.000000
exp14863	4.46546993e-29	0.000000	0.000000	discard	cycle 115 u=0.1000	agent0	initial_cond	0	-0.000000
exp14864	4.46546993e-29	0.000000	0.000000	discard	cycle 115 u=0.1000	agent0	initial_cond	0	-0.000000
exp14865	4.08106752e-29	0.000000	0.000000	discard	cycle 115 u=0.1000	agent0	initial_cond	0	-0.000000
exp14866	4.08106752e-29	0.000000	0.000000	discard	cycle 115 u=0.1000	agent0	initial_cond	0	-0.000000
exp14867	4.08106752e-29	0.000000	0.000000	discard	cycle 115 u=0.1000	agent0	initial_cond	1	-0.000000
exp14868	4.58623706e-29	0.000000	0.000000	discard	cycle 115 u=0.1000	agent0	initial_cond	0	-0.000000
exp14869	4.58623706e-29	0.000000	0.000000	discard	cycle 115 u=0.1000	agent0	initial_cond	1	-0.000000
exp14870	4.58623706e-29	0.000000	0.000000	discard	cycle 115 u=0.1000	agent0	initial_cond	0	-0.000000
exp14871	4.39794337e-29	0.000000	0.000000	discard	cycle 115 u=0.1000	agent0	initial_cond	0	-0.000000
exp14872	4.39794337e-29	0.000000	0.000000	discard	cycle 115 u=0.1000	agent0	initial_cond	0	-0.000000
exp14873	4.39794337e-29	0.000000	0.000000	discard	cycle 115 u=0.1000	agent0	initial_cond	0	-0.000000
exp14874	1.36727475e-28	0.000000	0.000000	discard	cycle 115 u=0.1050	agent0	initial_cond	1	-0.000000
exp14875	1.36727475e-28	0.000000	0.000000	discard	cycle 115 u=0.1050	agent0	initial_cond	0	-0.000000
exp14876	1.36727475e-28	0.000000	0.000000	discard	cycle 115 u=0.1050	agent0	initial_cond	0	-0.000000
exp14877	6.14461376e-29	0.000000	0.000000	discard	cycle 115 u=0.1050	agent0	initial_cond	0	-0.000000
exp14878	6.14461376e-29	0.000000	0.000000	discard	cycle 115 u=0.1050	agent0	initial_cond	0	-0.000000
exp14879	6.14461376e-29	0.000000	0.000000	discard	cycle 115 u=0.1050	agent0	initial_cond	1	-0.000000
exp14880	1.75906666e-28	0.000000	0.000000	discard	cycle 115 u=0.1050	agent0	initial_cond	0	-0.000000
exp14881	1.75906666e-28	0.000000	0.000000	discard	cycle 115 u=0.1050	agent0	initial_cond	1	-0.000000
exp14882	1.75906666e-28	0.000000	0.000000	discard	cycle 115 u=0.1050	agent0	initial_cond	0	-0.000000
exp14883	1.11257917e-28	0.000000	0.000000	discard	cycle 115 u=0.1050	agent0	initial_cond	0	-0.000000
exp14884	1.11257917e-28	0.000000	0.000000	discard	cycle 115 u=0.1050	agent0	initial_cond	0	-0.000000
exp14885	1.11257917e-28	0.000000	0.000000	discard	cycle 115 u=0.1050	agent0	initial_cond	0	-0.000000
exp14886	8.58580947e-29	0.000000	0.000000	discard	cycle 116 u=0.0975	agent0	initial_cond	1	0.000000
exp14887	8.58580947e-29	0.000000	0.000000	discard	cycle 116 u=0.0975	agent0	initial_cond	0	0.000000
exp14888	8.58580947e-29	0.000000	0.000000	discard	cycle 116 u=0.0975	agent0	initial_cond	0	0.000000
exp14889	5.23962023e-29	0.000000	0.000000	discard	cycle 116 u=0.0975	agent0	initial_cond	0	0.000000
exp14890	5.23962023e-29	0.000000	0.000000	discard	cycle 116 u=0.0975	agent0	initial_cond	0	0.000000
exp14891	5.23962023e-29	0.000000	0.000000	discard	cycle 116 u=0.0975	agent0	initial_cond	1	0.000000
exp14892	4.03266298e-29	0.000000	0.000000	discard	cycle 116 u=0.0975	agent0	initial_cond	0	0.000000
exp14893	4.03266298e-29	0.000000	0.000000	discard	cycle 116 u=0.0975	agent0	initial_cond	1	0.000000
exp14894	4.03266298e-29	0.000000	0.000000	discard	cycle 116 u=0.0975	agent0	initial_cond	0	0.000000
exp14895	4.80015937e-29	0.000000	0.000000	discard	cycle 116 u=0.0975	agent0	initial_cond	0	0.000000
exp14896	4.80015937e-29	0.000000	0.000000	discard	cycle 116 u=0.0975	agent0	initial_cond	0	0.000000
exp14897	4.80015937e-29	0.000000	0.000000	discard	cycle 116 u=0.0975	agent0	initial_cond	0	0.000000
exp14898	2.68824537e-29	0.000000	0.000000	discard	cycle 116 u=0.0980	agent0	initial_cond	1	-0.000000
exp14899	2.68824537e-29	0.000000	0.000000	discard	cycle 116 u=0.0980	agent0	initial_cond	0	-0.000000
exp14900	2.68824537e-29	0.000000	0.000000	discard	cycle 116 u=0.0980	agent0	initial_cond	0	-0.000000
exp14901	6.16758073e-29	0.000000	0.000000	discard	cycle 116 u=0.0980	agent0	initial_cond	0	-0.000000
exp14902	6.16758073e-29	0.000000	0.000000	discard	cycle 116 u=0.0980	agent0	initial_cond	0	-0.000000
exp14903	6.16758073e-29	0.000000	0.000000	discard	cycle 116 u=0.0980	agent0	initial_cond	1	-0.000000
exp14904	2.01926478e-29	0.000000	0.000000	discard	cycle 116 u=0.0980	agent0	initial_cond	0	0.000000
exp14905	2.01926478e-29	0.000000	0.000000	discard	cycle 116 u=0.0980	agent0	initial_cond	1	0.000000
exp14906	2.01926478e-29	0.000000	0.000000	discard	cycle 116 u=0.0980	agent0	initial_cond	0	0.000000
exp14907	1.30310780e-28	0.000000	0.000000	discard	cycle 116 u=0.0980	agent0	initial_cond	0	-0.000000
exp14908	1.30310780e-28	0.000000	0.000000	discard	cycle 116 u=0.0980	agent0	initial_cond	1	-0.000000
exp14909	1.30310780e-28	0.000000	0.000000	discard	cycle 116 u=0.0980	agent0	initial_cond	0	-0.000000
exp14910	5.45343271e-29	0.000000	0.000000	discard	cycle 116 u=0.0982	agent0	initial_cond	1	-0.000000
exp14911	5.45343271e-29	0.000000	0.000000	discard	cycle 116 u=0.0982	agent0	initial_cond	0	-0.000000
exp14912	5.45343271e-29	0.000000	0.000000	discard	cycle 116 u=0.0982	agent0	initial_cond	0	-0.000000
exp14913	1.23429977e-28	0.000000	0.000000	discard	cycle 116 u=0.0982	agent0	initial_cond	0	0.000000
exp14914	1.23429977e-28	0.000000	0.000000	discard	cycle 116 u=0.0982	agent0	initial_cond	0	0.000000
exp14915	1.23429977e-28	0.000000	0.000000	discard	cycle 116 u=0.0982	agent0	initial_cond	1	0.000000
exp14916	1.88036672e-29	0.000000	0.000000	discard	cycle 116 u=0.0982	agent0	initial_cond	0	0.000000
exp14917	1.88036672e-29	0.000000	0.000000	discard	cycle 116 u=0.0982	agent0	initial_cond	1	0.000000
exp14918	1.88036672e-29	0.000000	0.000000	discard	cycle 116 u=0.0982	agent0	initial_cond	0	0.000000
exp14919	1.91190259e-29	0.000000	-0.000000	discard	cycle 116 u=0.0982	agent0	initial_cond	0	0.000000
exp14920	1.91190259e-29	0.000000	-0.000000	discard	cycle 116 u=0.0982	agent0	initial_cond	1	0.000000
exp14921	1.91190259e-29	0.000000	-0.000000	discard	cycle 116 u=0.0982	agent0	initial_cond	0	0.000000
exp14922	6.13049994e-29	0.000000	0.000000	discard	cycle 116 u=0.0985	agent0	initial_cond	1	0.000000
exp14923	6.13049994e-29	0.000000	0.000000	discard	cycle 116 u=0.0985	agent0	initial_cond	0	0.000000
exp14924	6.13049994e-29	0.000000	0.000000	discard	cycle 116 u=0.0985	agent0	initial_cond	0	0.000000
exp14925	5.49750971e-29	0.000000	0.000000	discard	cycle 116 u=0.0985	agent0	initial_cond	0	0.000000
exp14926	5.49750971e-29	0.000000	0.000000	discard	cycle 116 u=0.0985	agent0	initial_cond	0	0.000000
exp14927	5.49750971e-29	0.000000	0.000000	discard	cycle 116 u=0.0985	agent0	initial_cond	1	0.000000
exp14928	4.15642452e-29	0.000000	0.000000	discard	cycle 116 u=0.0985	agent0	initial_cond	0	0.000000
exp14929	4.15642452e-29	0.000000	0.000000	discard	cycle 116 u=0.0985	agent0	initial_cond	0	0.000000
exp14930	4.15642452e-29	0.000000	0.000000	discard	cycle 116 u=0.0985	agent0	initial_cond	0	0.000000
exp14931	2.19292611e-29	0.000000	0.000000	discard	cycle 116 u=0.0985	agent0	initial_cond	0	-0.000000
exp14932	2.19292611e-29	0.000000	0.000000	discard	cycle 116 u=0.0985	agent0	initial_cond	1	-0.000000
exp14933	2.19292611e-29	0.000000	0.000000	discard	cycle 116 u=0.0985	agent0	initial_cond	0	-0.000000
exp14934	4.22491788e-29	0.000000	0.000000	discard	cycle 116 u=0.0990	agent0	initial_cond	1	-0.000000
exp14935	4.22491788e-29	0.000000	0.000000	discard	cycle 116 u=0.0990	agent0	initial_cond	0	-0.000000
exp14936	4.22491788e-29	0.000000	0.000000	discard	cycle 116 u=0.0990	agent0	initial_cond	0	-0.000000
exp14937	3.22245147e-29	0.000000	0.000000	discard	cycle 116 u=0.0990	agent0	initial_cond	0	0.000000
exp14938	3.22245147e-29	0.000000	0.000000	discard	cycle 116 u=0.0990	agent0	initial_cond	0	0.000000
exp14939	3.22245147e-29	0.000000	0.000000	discard	cycle 116 u=0.0990	agent0	initial_cond	1	0.000000
exp14940	4.50941488e-29	0.000000	-0.000000	discard	cycle 116 u=0.0990	agent0	initial_cond	0	0.000000
exp14941	4.50941488e-29	0.000000	-0.000000	discard	cycle 116 u=0.0990	agent0	initial_cond	0	0.000000
exp14942	4.50941488e-29	0.000000	-0.000000	discard	cycle 116 u=0.0990	agent0	initial_cond	0	0.000000
exp14943	4.88330883e-29	0.000000	-0.000000	discard	cycle 116 u=0.0990	agent0	initial_cond	0	0.000000
exp14944	4.88330883e-29	0.000000	-0.000000	discard	cycle 116 u=0.0990	agent0	initial_cond	1	0.000000
exp14945	4.88330883e-29	0.000000	-0.000000	discard	cycle 116 u=0.0990	agent0	initial_cond	0	0.000000
exp14946	5.74085541e-29	0.000000	-0.000000	discard	cycle 116 u=0.0995	agent0	initial_cond	1	0.000000
exp14947	5.74085541e-29	0.000000	-0.000000	discard	cycle 116 u=0.0995	agent0	initial_cond	0	0.000000
exp14948	5.74085541e-29	0.000000	-0.000000	discard	cycle 116 u=0.0995	agent0	initial_cond	0	0.000000
exp14949	4.80864377e-16	0.023554	-0.000000	discard	Round 9: Exact search u=0.463 K=0.1	agent1	boundary	1	-0.000005
exp14950	1.54984578e-28	0.000000	0.000000	discard	cycle 116 u=0.0995	agent0	initial_cond	1	-0.000000
exp14951	1.94347247e-17	0.035300	-0.000000	discard	Round 9: Exact search u=0.463 K=0.15	agent1	boundary	0	-0.000006
exp14952	1.54984578e-28	0.000000	0.000000	discard	cycle 116 u=0.0995	agent0	initial_cond	0	-0.000000
exp14953	4.45215946e-17	0.047011	-0.000000	discard	Round 9: Exact search u=0.463 K=0.2	agent1	boundary	0	0.000003
exp14954	1.54984578e-28	0.000000	0.000000	discard	cycle 116 u=0.0995	agent0	initial_cond	1	-0.000000
exp14955	2.97288457e-17	0.058674	-0.000000	discard	Round 9: Exact search u=0.463 K=0.25	agent1	boundary	0	0.000033
exp14956	1.60328418e-29	0.000000	-0.000000	discard	cycle 116 u=0.0995	agent0	initial_cond	0	-0.000000
exp14957	3.06503718e-15	0.070278	-0.000000	discard	Round 9: Exact search u=0.463 K=0.3	agent1	boundary	0	0.000097
exp14958	1.60328418e-29	0.000000	-0.000000	discard	cycle 116 u=0.0995	agent0	initial_cond	0	-0.000000
exp14959	5.80158003e-17	0.081814	-0.000000	discard	Round 9: Exact search u=0.463 K=0.35	agent1	boundary	1	0.000212
exp14960	1.60328418e-29	0.000000	-0.000000	discard	cycle 116 u=0.0995	agent0	initial_cond	0	-0.000000
exp14961	2.41658905e-17	0.093272	-0.000000	discard	Round 9: Exact search u=0.463 K=0.4	agent1	boundary	0	0.000394
exp14962	7.34590618e-29	0.000000	0.000000	discard	cycle 116 u=0.0995	agent0	initial_cond	0	0.000000
exp14963	1.83730269e-17	0.104643	-0.000000	discard	Round 9: Exact search u=0.463 K=0.45	agent1	boundary	1	0.000664
exp14964	7.34590618e-29	0.000000	0.000000	discard	cycle 116 u=0.0995	agent0	initial_cond	1	0.000000
exp14965	6.02536152e-17	0.115920	-0.000000	discard	Round 9: Exact search u=0.463 K=0.5	agent1	boundary	0	0.001044
exp14966	7.34590618e-29	0.000000	0.000000	discard	cycle 116 u=0.0995	agent0	initial_cond	0	0.000000
exp14967	4.21211118e-16	0.023554	0.000000	discard	Round 9: Exact search u=-0.463 K=0.1	agent1	boundary	0	-0.000005
exp14968	4.46546993e-29	0.000000	0.000000	discard	cycle 116 u=0.1000	agent0	initial_cond	1	-0.000000
exp14969	4.11158576e-17	0.035300	-0.000000	discard	Round 9: Exact search u=-0.463 K=0.15	agent1	boundary	0	-0.000006
exp14970	4.46546993e-29	0.000000	0.000000	discard	cycle 116 u=0.1000	agent0	initial_cond	0	-0.000000
exp14971	5.58053172e-16	0.047011	-0.000000	discard	Round 9: Exact search u=-0.463 K=0.2	agent1	boundary	0	0.000003
exp14971	4.46546993e-29	0.000000	0.000000	discard	cycle 116 u=0.1000	agent0	initial_cond	0	-0.000000
exp14972	1.36376656e-17	0.058674	-0.000000	discard	Round 9: Exact search u=-0.463 K=0.25	agent1	boundary	1	0.000033
exp14972	4.08106752e-29	0.000000	0.000000	discard	cycle 116 u=0.1000	agent0	initial_cond	1	-0.000000
exp14973	1.01869527e-17	0.070278	-0.000000	discard	Round 9: Exact search u=-0.463 K=0.3	agent1	boundary	0	0.000097
exp14973	4.08106752e-29	0.000000	0.000000	discard	cycle 116 u=0.1000	agent0	initial_cond	0	-0.000000
exp14974	1.78942258e-17	0.081814	-0.000000	discard	Round 9: Exact search u=-0.463 K=0.35	agent1	boundary	1	0.000212
exp14974	4.08106752e-29	0.000000	0.000000	discard	cycle 116 u=0.1000	agent0	initial_cond	1	-0.000000
exp14975	8.33229974e-17	0.093272	0.000000	discard	Round 9: Exact search u=-0.463 K=0.4	agent1	boundary	0	0.000394
exp14975	4.58623706e-29	0.000000	0.000000	discard	cycle 116 u=0.1000	agent0	initial_cond	0	-0.000000
exp14976	5.22195883e-17	0.104643	-0.000000	discard	Round 9: Exact search u=-0.463 K=0.45	agent1	boundary	0	0.000664
exp14976	4.58623706e-29	0.000000	0.000000	discard	cycle 116 u=0.1000	agent0	initial_cond	0	-0.000000
exp14977	1.22640179e-16	0.115920	-0.000000	discard	Round 9: Exact search u=-0.463 K=0.5	agent1	boundary	0	0.001044
exp14977	4.58623706e-29	0.000000	0.000000	discard	cycle 116 u=0.1000	agent0	initial_cond	0	-0.000000
exp14978	4.39794337e-29	0.000000	0.000000	discard	cycle 116 u=0.1000	agent0	initial_cond	0	-0.000000
exp14979	4.39794337e-29	0.000000	0.000000	discard	cycle 116 u=0.1000	agent0	initial_cond	1	-0.000000
exp14980	4.39794337e-29	0.000000	0.000000	discard	cycle 116 u=0.1000	agent0	initial_cond	0	-0.000000
exp14981	1.36727475e-28	0.000000	0.000000	discard	cycle 116 u=0.1050	agent0	initial_cond	1	-0.000000
exp14982	1.36727475e-28	0.000000	0.000000	discard	cycle 116 u=0.1050	agent0	initial_cond	0	-0.000000
exp14983	1.36727475e-28	0.000000	0.000000	discard	cycle 116 u=0.1050	agent0	initial_cond	0	-0.000000
exp14984	6.14461376e-29	0.000000	0.000000	discard	cycle 116 u=0.1050	agent0	initial_cond	1	-0.000000
exp14985	6.14461376e-29	0.000000	0.000000	discard	cycle 116 u=0.1050	agent0	initial_cond	0	-0.000000
exp14986	6.14461376e-29	0.000000	0.000000	discard	cycle 116 u=0.1050	agent0	initial_cond	1	-0.000000
exp14987	1.75906666e-28	0.000000	0.000000	discard	cycle 116 u=0.1050	agent0	initial_cond	0	-0.000000
exp14988	1.75906666e-28	0.000000	0.000000	discard	cycle 116 u=0.1050	agent0	initial_cond	0	-0.000000
exp14989	1.75906666e-28	0.000000	0.000000	discard	cycle 116 u=0.1050	agent0	initial_cond	0	-0.000000
exp14990	1.11257917e-28	0.000000	0.000000	discard	cycle 116 u=0.1050	agent0	initial_cond	0	-0.000000
exp14991	1.11257917e-28	0.000000	0.000000	discard	cycle 116 u=0.1050	agent0	initial_cond	1	-0.000000
exp14992	1.11257917e-28	0.000000	0.000000	discard	cycle 116 u=0.1050	agent0	initial_cond	0	-0.000000
exp14993	8.58580947e-29	0.000000	0.000000	discard	cycle 117 u=0.0975	agent0	initial_cond	1	0.000000
exp14994	6.68949594e-18	0.011783	0.000000	discard	Round 9: Trivial u=0.0 K=0.05	agent1	initial_cond	0	-0.000002
exp14995	8.58580947e-29	0.000000	0.000000	discard	cycle 117 u=0.0975	agent0	initial_cond	0	0.000000
exp14996	1.16218881e-17	0.023554	-0.000000	discard	Round 9: Trivial u=0.0 K=0.1	agent1	initial_cond	0	-0.000005
exp14997	8.58580947e-29	0.000000	0.000000	discard	cycle 117 u=0.0975	agent0	initial_cond	0	0.000000
exp14998	4.20530553e-15	0.047011	-0.000000	discard	Round 9: Trivial u=0.0 K=0.2	agent1	initial_cond	1	0.000003
exp14999	5.23962023e-29	0.000000	0.000000	discard	cycle 117 u=0.0975	agent0	initial_cond	0	0.000000
exp15000	7.79962053e-17	0.070278	-0.000000	discard	Round 9: Trivial u=0.0 K=0.3	agent1	initial_cond	0	0.000097
exp15001	5.23962023e-29	0.000000	0.000000	discard	cycle 117 u=0.0975	agent0	initial_cond	0	0.000000
exp15002	1.09350475e-16	0.093272	-0.000000	discard	Round 9: Trivial u=0.0 K=0.4	agent1	initial_cond	0	0.000394
exp15003	5.23962023e-29	0.000000	0.000000	discard	cycle 117 u=0.0975	agent0	initial_cond	1	0.000000
exp15004	3.72338266e-16	0.115920	-0.000000	discard	Round 9: Trivial u=0.0 K=0.5	agent1	initial_cond	0	0.001044
exp15005	4.03266298e-29	0.000000	0.000000	discard	cycle 117 u=0.0975	agent0	initial_cond	0	0.000000
exp15006	1.84165191e-16	0.138163	-0.000000	discard	Round 9: Trivial u=0.0 K=0.6	agent1	initial_cond	0	0.002221
exp15007	4.03266298e-29	0.000000	0.000000	discard	cycle 117 u=0.0975	agent0	initial_cond	0	0.000000
exp15008	3.25431751e-17	0.159956	-0.000000	discard	Round 9: Trivial u=0.0 K=0.7	agent1	initial_cond	1	0.004112
exp15009	4.03266298e-29	0.000000	0.000000	discard	cycle 117 u=0.0975	agent0	initial_cond	0	0.000000
exp15010	8.94693232e-17	0.181265	-0.000000	discard	Round 9: Trivial u=0.0 K=0.8	agent1	initial_cond	0	0.006910
exp15011	4.80015937e-29	0.000000	0.000000	discard	cycle 117 u=0.0975	agent0	initial_cond	0	0.000000
exp15012	1.23294641e-16	0.202072	-0.000000	discard	Round 9: Trivial u=0.0 K=0.9	agent1	initial_cond	1	0.010801
exp15013	4.80015937e-29	0.000000	0.000000	discard	cycle 117 u=0.0975	agent0	initial_cond	1	0.000000
exp15014	2.08037252e-16	0.222365	-0.000000	discard	Round 9: Trivial u=0.0 K=1.0	agent1	initial_cond	0	0.015962
exp15015	4.80015937e-29	0.000000	0.000000	discard	cycle 117 u=0.0975	agent0	initial_cond	0	0.000000
exp15016	2.68824537e-29	0.000000	0.000000	discard	cycle 117 u=0.0980	agent0	initial_cond	1	-0.000000
exp15017	2.68824537e-29	0.000000	0.000000	discard	cycle 117 u=0.0980	agent0	initial_cond	0	-0.000000
exp15018	2.68824537e-29	0.000000	0.000000	discard	cycle 117 u=0.0980	agent0	initial_cond	0	-0.000000
exp15019	6.16758073e-29	0.000000	0.000000	discard	cycle 117 u=0.0980	agent0	initial_cond	0	-0.000000
exp15020	6.16758073e-29	0.000000	0.000000	discard	cycle 117 u=0.0980	agent0	initial_cond	0	-0.000000
exp15021	6.16758073e-29	0.000000	0.000000	discard	cycle 117 u=0.0980	agent0	initial_cond	1	-0.000000
exp15022	2.01926478e-29	0.000000	0.000000	discard	cycle 117 u=0.0980	agent0	initial_cond	0	0.000000
exp15023	2.01926478e-29	0.000000	0.000000	discard	cycle 117 u=0.0980	agent0	initial_cond	0	0.000000
exp15024	2.01926478e-29	0.000000	0.000000	discard	cycle 117 u=0.0980	agent0	initial_cond	0	0.000000
exp15025	1.30310780e-28	0.000000	0.000000	discard	cycle 117 u=0.0980	agent0	initial_cond	0	-0.000000
exp15026	1.30310780e-28	0.000000	0.000000	discard	cycle 117 u=0.0980	agent0	initial_cond	1	-0.000000
exp15027	1.30310780e-28	0.000000	0.000000	discard	cycle 117 u=0.0980	agent0	initial_cond	0	-0.000000
exp15028	5.45343271e-29	0.000000	0.000000	discard	cycle 117 u=0.0982	agent0	initial_cond	1	-0.000000
exp15029	5.45343271e-29	0.000000	0.000000	discard	cycle 117 u=0.0982	agent0	initial_cond	0	-0.000000
exp15030	5.45343271e-29	0.000000	0.000000	discard	cycle 117 u=0.0982	agent0	initial_cond	0	-0.000000
exp15031	1.23429977e-28	0.000000	0.000000	discard	cycle 117 u=0.0982	agent0	initial_cond	0	0.000000
exp15032	1.23429977e-28	0.000000	0.000000	discard	cycle 117 u=0.0982	agent0	initial_cond	0	0.000000
exp15033	1.23429977e-28	0.000000	0.000000	discard	cycle 117 u=0.0982	agent0	initial_cond	1	0.000000
exp15034	1.88036672e-29	0.000000	0.000000	discard	cycle 117 u=0.0982	agent0	initial_cond	0	0.000000
exp15035	1.88036672e-29	0.000000	0.000000	discard	cycle 117 u=0.0982	agent0	initial_cond	0	0.000000
exp15036	1.88036672e-29	0.000000	0.000000	discard	cycle 117 u=0.0982	agent0	initial_cond	0	0.000000
exp15037	1.91190259e-29	0.000000	-0.000000	discard	cycle 117 u=0.0982	agent0	initial_cond	0	0.000000
exp15038	1.91190259e-29	0.000000	-0.000000	discard	cycle 117 u=0.0982	agent0	initial_cond	1	0.000000
exp15039	1.91190259e-29	0.000000	-0.000000	discard	cycle 117 u=0.0982	agent0	initial_cond	0	0.000000
exp15040	6.13049994e-29	0.000000	0.000000	discard	cycle 117 u=0.0985	agent0	initial_cond	1	0.000000
exp15041	6.13049994e-29	0.000000	0.000000	discard	cycle 117 u=0.0985	agent0	initial_cond	0	0.000000
exp15042	1.79901697e-16	0.000000	0.000000	discard	Round 9: Ultra-precision mode=6 fourier=6 at K=0.0061	agent1	solver_param	0	0.000000
exp15043	6.13049994e-29	0.000000	0.000000	discard	cycle 117 u=0.0985	agent0	initial_cond	0	0.000000
exp15044	6.54179942e-19	0.001438	-0.000000	discard	Round 9: Ultra-precision mode=7 fourier=6 at K=0.0061	agent1	solver_param	1	-0.000000
exp15045	5.49750971e-29	0.000000	0.000000	discard	cycle 117 u=0.0985	agent0	initial_cond	0	0.000000
exp15046	6.54179942e-19	0.001438	-0.000000	discard	Round 9: Ultra-precision mode=7 fourier=8 at K=0.0061	agent1	solver_param	0	-0.000000
exp15047	5.49750971e-29	0.000000	0.000000	discard	cycle 117 u=0.0985	agent0	initial_cond	0	0.000000
exp15048	1.19249364e-16	0.001438	0.000000	discard	Round 9: Ultra-precision mode=8 fourier=8 at K=0.0061	agent1	solver_param	0	-0.000000
exp15049	5.49750971e-29	0.000000	0.000000	discard	cycle 117 u=0.0985	agent0	initial_cond	1	0.000000
exp15050	6.54179942e-19	0.001438	-0.000000	discard	Round 9: Ultra-precision mode=7 fourier=10 at K=0.0061	agent1	solver_param	0	-0.000000
exp15051	4.15642452e-29	0.000000	0.000000	discard	cycle 117 u=0.0985	agent0	initial_cond	0	0.000000
