exp_id	residual	solution_norm	solution_mean	status	description	agent	design	elapsed_s	solution_energy
exp3473	1.30310780e-28	0.000000	0.000000	discard	cycle 15 u=0.0980	agent0	initial_cond	1	-0.000000
exp3474	7.96826541e-17	0.128562	0.000000	discard	phase=90Â° amp=0.55 u=0 mode=1 fourier=4 tol=1e-9	agent1	perturbation	0	0.001631
exp3475	1.30310780e-28	0.000000	0.000000	discard	cycle 15 u=0.0980	agent0	initial_cond	0	-0.000000
exp3476	1.85381193e-16	0.140031	0.000000	discard	phase=90Â° amp=0.60 u=0 mode=1 fourier=4 tol=1e-9	agent1	perturbation	0	0.002348
exp3477	1.30310780e-28	0.000000	0.000000	discard	cycle 15 u=0.0980	agent0	initial_cond	1	-0.000000
exp3478	5.91168715e-17	0.151444	-0.000000	discard	phase=90Â° amp=0.65 u=0 mode=1 fourier=4 tol=1e-9	agent1	perturbation	1	0.003268
exp3479	5.45343271e-29	0.000000	0.000000	discard	cycle 15 u=0.0982	agent0	initial_cond	0	-0.000000
exp3480	5.88147149e-17	0.162797	0.000000	discard	phase=90Â° amp=0.70 u=0 mode=1 fourier=4 tol=1e-9	agent1	perturbation	0	0.004424
exp3481	5.45343271e-29	0.000000	0.000000	discard	cycle 15 u=0.0982	agent0	initial_cond	0	-0.000000
exp3482	5.45343271e-29	0.000000	0.000000	discard	cycle 15 u=0.0982	agent0	initial_cond	1	-0.000000
exp3483	1.23429977e-28	0.000000	0.000000	discard	cycle 15 u=0.0982	agent0	initial_cond	0	0.000000
exp3484	1.23429977e-28	0.000000	0.000000	discard	cycle 15 u=0.0982	agent0	initial_cond	0	0.000000
exp3485	1.23429977e-28	0.000000	0.000000	discard	cycle 15 u=0.0982	agent0	initial_cond	1	0.000000
exp3486	1.88036672e-29	0.000000	0.000000	discard	cycle 15 u=0.0982	agent0	initial_cond	0	0.000000
exp3487	1.88036672e-29	0.000000	0.000000	discard	cycle 15 u=0.0982	agent0	initial_cond	1	0.000000
exp3488	1.88036672e-29	0.000000	0.000000	discard	cycle 15 u=0.0982	agent0	initial_cond	0	0.000000
exp3489	2.06774381e-16	1.001296	1.000019	discard	cycle 15 u=0.0982	agent0	initial_cond	0	-1.520844
exp3489	2.06774381e-16	1.001296	1.000019	discard	Fourier fine modes=4	agent0	solver_param	0	-1.520844
exp3490	1.33461196e-15	1.001296	1.000019	discard	cycle 15 u=0.0982	agent0	initial_cond	1	-1.520844
exp3491	1.33461196e-15	1.001296	1.000019	discard	Fourier fine modes=5	agent0	solver_param	1	-1.520844
exp3492	2.64830595e-15	1.001296	1.000019	discard	cycle 15 u=0.0982	agent0	initial_cond	0	-1.520844
exp3493	2.64830595e-15	1.001296	1.000019	discard	Fourier fine modes=6	agent0	solver_param	0	-1.520844
exp3494	3.36713165e-15	1.001296	1.000019	discard	cycle 15 u=0.0985	agent0	initial_cond	1	-1.520844
exp3495	6.13049994e-29	0.000000	0.000000	discard	Fourier fine modes=7	agent0	solver_param	1	0.000000
exp3496	2.27731282e-15	1.001296	1.000019	discard	cycle 15 u=0.0985	agent0	initial_cond	0	-1.520844
exp3497	6.13049994e-29	0.000000	0.000000	discard	Fourier fine modes=8	agent0	solver_param	0	0.000000
exp3498	4.94271309e-15	1.001296	1.000019	discard	cycle 15 u=0.0985	agent0	initial_cond	0	-1.520844
exp3499	5.49750971e-29	0.000000	0.000000	discard	Fourier fine modes=9	agent0	solver_param	0	0.000000
exp3500	5.89401543e-15	1.001296	1.000019	discard	cycle 15 u=0.0985	agent0	initial_cond	1	-1.520844
exp3501	5.49750971e-29	0.000000	0.000000	discard	Fourier fine modes=10	agent0	solver_param	0	0.000000
exp3502	5.49750971e-29	0.000000	0.000000	discard	cycle 15 u=0.0985	agent0	initial_cond	0	0.000000
exp3503	5.49750971e-29	0.000000	0.000000	discard	cycle 15 u=0.0985	agent0	initial_cond	0	0.000000
exp3504	4.15642452e-29	0.000000	0.000000	discard	cycle 15 u=0.0985	agent0	initial_cond	0	0.000000
exp3505	4.15642452e-29	0.000000	0.000000	discard	cycle 15 u=0.0985	agent0	initial_cond	0	0.000000
exp3506	4.15642452e-29	0.000000	0.000000	discard	cycle 15 u=0.0985	agent0	initial_cond	1	0.000000
exp3506	0.00000000e+00	0.998999	1.000000	discard	positive boundary u=0.4600 fourier=4 tol=1e-9	agent1	branch_search	1	-1.567655
exp3507	2.19292611e-29	0.000000	0.000000	discard	cycle 15 u=0.0985	agent0	initial_cond	0	-0.000000
exp3507	8.88178420e-15	0.998999	1.000000	discard	positive boundary u=0.4610 fourier=4 tol=1e-9	agent1	branch_search	0	-1.567655
exp3508	2.19292611e-29	0.000000	0.000000	discard	cycle 15 u=0.0985	agent0	initial_cond	0	-0.000000
exp3508	0.00000000e+00	0.998999	1.000000	discard	positive boundary u=0.4620 fourier=4 tol=1e-9	agent1	branch_search	0	-1.567655
exp3509	2.19292611e-29	0.000000	0.000000	discard	cycle 15 u=0.0985	agent0	initial_cond	1	-0.000000
exp3509	0.00000000e+00	0.998999	1.000000	discard	positive boundary u=0.4630 fourier=4 tol=1e-9	agent1	branch_search	1	-1.567655
exp3510	4.22491788e-29	0.000000	0.000000	discard	cycle 15 u=0.0990	agent0	initial_cond	0	-0.000000
exp3510	8.88178420e-16	0.998999	1.000000	discard	positive boundary u=0.4640 fourier=4 tol=1e-9	agent1	branch_search	0	-1.567655
exp3511	4.22491788e-29	0.000000	0.000000	discard	cycle 15 u=0.0990	agent0	initial_cond	1	-0.000000
exp3512	0.00000000e+00	0.998999	1.000000	discard	positive boundary u=0.4650 fourier=4 tol=1e-9	agent1	branch_search	1	-1.567655
exp3513	4.22491788e-29	0.000000	0.000000	discard	cycle 15 u=0.0990	agent0	initial_cond	0	-0.000000
exp3514	0.00000000e+00	0.998999	-1.000000	discard	positive boundary u=0.4660 fourier=4 tol=1e-9	agent1	branch_search	0	-1.567655
exp3515	3.22245147e-29	0.000000	0.000000	discard	cycle 15 u=0.0990	agent0	initial_cond	0	0.000000
exp3516	0.00000000e+00	0.998999	-1.000000	discard	positive boundary u=0.4670 fourier=4 tol=1e-9	agent1	branch_search	0	-1.567655
exp3517	3.22245147e-29	0.000000	0.000000	discard	cycle 15 u=0.0990	agent0	initial_cond	1	0.000000
exp3518	0.00000000e+00	0.998999	-1.000000	discard	positive boundary u=0.4680 fourier=4 tol=1e-9	agent1	branch_search	1	-1.567655
exp3519	3.22245147e-29	0.000000	0.000000	discard	cycle 15 u=0.0990	agent0	initial_cond	0	0.000000
exp3520	0.00000000e+00	0.998999	-1.000000	discard	negative boundary u=-.4600 fourier=4 tol=1e-9	agent1	branch_search	0	-1.567655
exp3521	4.50941488e-29	0.000000	-0.000000	discard	cycle 15 u=0.0990	agent0	initial_cond	0	0.000000
exp3522	8.88178420e-15	0.998999	-1.000000	discard	negative boundary u=-.4610 fourier=4 tol=1e-9	agent1	branch_search	1	-1.567655
exp3523	4.50941488e-29	0.000000	-0.000000	discard	cycle 15 u=0.0990	agent0	initial_cond	0	0.000000
exp3524	0.00000000e+00	0.998999	-1.000000	discard	negative boundary u=-.4620 fourier=4 tol=1e-9	agent1	branch_search	0	-1.567655
exp3525	4.50941488e-29	0.000000	-0.000000	discard	cycle 15 u=0.0990	agent0	initial_cond	0	0.000000
exp3526	0.00000000e+00	0.998999	-1.000000	discard	negative boundary u=-.4630 fourier=4 tol=1e-9	agent1	branch_search	0	-1.567655
exp3527	4.88330883e-29	0.000000	-0.000000	discard	cycle 15 u=0.0990	agent0	initial_cond	1	0.000000
exp3528	8.88178420e-16	0.998999	-1.000000	discard	negative boundary u=-.4640 fourier=4 tol=1e-9	agent1	branch_search	1	-1.567655
exp3529	4.88330883e-29	0.000000	-0.000000	discard	cycle 15 u=0.0990	agent0	initial_cond	0	0.000000
exp3530	0.00000000e+00	0.998999	-1.000000	discard	negative boundary u=-.4650 fourier=4 tol=1e-9	agent1	branch_search	0	-1.567655
exp3531	2.00148302e-16	1.001298	1.000025	discard	cycle 15 u=0.0990	agent0	initial_cond	0	-1.520921
exp3531	2.00148302e-16	1.001298	1.000025	discard	Fourier ultra modes=2	agent0	solver_param	0	-1.520921
exp3532	0.00000000e+00	0.998999	1.000000	discard	negative boundary u=-.4660 fourier=4 tol=1e-9	agent1	branch_search	0	-1.567655
exp3533	4.22769823e-16	1.001296	1.000019	discard	cycle 15 u=0.0995	agent0	initial_cond	1	-1.520844
exp3534	4.22769823e-16	1.001296	1.000019	discard	Fourier ultra modes=3	agent0	solver_param	0	-1.520844
exp3535	0.00000000e+00	0.998999	1.000000	discard	negative boundary u=-.4670 fourier=4 tol=1e-9	agent1	branch_search	0	-1.567655
exp3536	2.06774381e-16	1.001296	1.000019	discard	cycle 15 u=0.0995	agent0	initial_cond	0	-1.520844
exp3537	5.74085541e-29	0.000000	-0.000000	discard	Fourier ultra modes=4	agent0	solver_param	0	0.000000
exp3537	0.00000000e+00	0.998999	1.000000	discard	negative boundary u=-.4680 fourier=4 tol=1e-9	agent1	branch_search	0	-1.567655
exp3538	5.74085541e-29	0.000000	-0.000000	discard	cycle 15 u=0.0995	agent0	initial_cond	1	0.000000
exp3539	1.54984578e-28	0.000000	0.000000	discard	cycle 15 u=0.0995	agent0	initial_cond	0	-0.000000
exp3540	1.54984578e-28	0.000000	0.000000	discard	cycle 15 u=0.0995	agent0	initial_cond	0	-0.000000
exp3541	1.54984578e-28	0.000000	0.000000	discard	cycle 15 u=0.0995	agent0	initial_cond	1	-0.000000
exp3542	1.60328418e-29	0.000000	-0.000000	discard	cycle 15 u=0.0995	agent0	initial_cond	0	-0.000000
exp3543	1.60328418e-29	0.000000	-0.000000	discard	cycle 15 u=0.0995	agent0	initial_cond	0	-0.000000
exp3544	1.60328418e-29	0.000000	-0.000000	discard	cycle 15 u=0.0995	agent0	initial_cond	1	-0.000000
exp3545	7.34590618e-29	0.000000	0.000000	discard	cycle 15 u=0.0995	agent0	initial_cond	0	0.000000
exp3546	7.34590618e-29	0.000000	0.000000	discard	cycle 15 u=0.0995	agent0	initial_cond	1	0.000000
exp3547	7.34590618e-29	0.000000	0.000000	discard	cycle 15 u=0.0995	agent0	initial_cond	0	0.000000
exp3548	4.46546993e-29	0.000000	0.000000	discard	cycle 15 u=0.1000	agent0	initial_cond	0	-0.000000
exp3549	4.46546993e-29	0.000000	0.000000	discard	cycle 15 u=0.1000	agent0	initial_cond	1	-0.000000
exp3550	4.46546993e-29	0.000000	0.000000	discard	cycle 15 u=0.1000	agent0	initial_cond	0	-0.000000
exp3551	4.08106752e-29	0.000000	0.000000	discard	cycle 15 u=0.1000	agent0	initial_cond	0	-0.000000
exp3552	4.08106752e-29	0.000000	0.000000	discard	cycle 15 u=0.1000	agent0	initial_cond	0	-0.000000
exp3553	4.08106752e-29	0.000000	0.000000	discard	cycle 15 u=0.1000	agent0	initial_cond	0	-0.000000
exp3554	4.58623706e-29	0.000000	0.000000	discard	cycle 15 u=0.1000	agent0	initial_cond	1	-0.000000
exp3555	4.58623706e-29	0.000000	0.000000	discard	cycle 15 u=0.1000	agent0	initial_cond	0	-0.000000
exp3556	4.58623706e-29	0.000000	0.000000	discard	cycle 15 u=0.1000	agent0	initial_cond	0	-0.000000
exp3557	4.39794337e-29	0.000000	0.000000	discard	cycle 15 u=0.1000	agent0	initial_cond	1	-0.000000
exp3558	4.39794337e-29	0.000000	0.000000	discard	cycle 15 u=0.1000	agent0	initial_cond	0	-0.000000
exp3559	4.39794337e-29	0.000000	0.000000	discard	cycle 15 u=0.1000	agent0	initial_cond	1	-0.000000
exp3560	2.00148302e-16	1.001298	1.000025	discard	cycle 15 u=0.1050	agent0	initial_cond	0	-1.520921
exp3560	3.87261605e-17	0.070535	-0.000000	discard	4th_branch phase=90Â° amp=0.30 mode=1 fourier=4 tol=1e-9	agent1	solver_param	0	0.000099
exp3561	1.36727475e-28	0.000000	0.000000	discard	Fourier 2 modes newton_tol=1.0e-14	agent0	solver_param	0	-0.000000
exp3562	2.00148302e-16	1.001298	1.000025	discard	cycle 15 u=0.1050	agent0	initial_cond	0	-1.520921
exp3562	1.53600205e-27	0.000000	0.000000	discard	4th_branch phase=90Â° amp=0.30 mode=2 fourier=4 tol=1e-9	agent1	solver_param	0	-0.000000
exp3563	1.36727475e-28	0.000000	0.000000	discard	Fourier 2 modes newton_tol=1.0e-13	agent0	solver_param	0	-0.000000
exp3564	2.00148302e-16	1.001298	1.000025	discard	cycle 15 u=0.1050	agent0	initial_cond	1	-1.520921
exp3564	4.38830890e-17	0.070535	0.000000	discard	4th_branch phase=90Â° amp=0.30 mode=3 fourier=4 tol=1e-9	agent1	solver_param	1	0.000099
exp3565	6.14461376e-29	0.000000	0.000000	discard	Fourier 2 modes newton_tol=1.0e-12	agent0	solver_param	0	-0.000000
exp3566	6.14461376e-29	0.000000	0.000000	discard	cycle 15 u=0.1050	agent0	initial_cond	0	-0.000000
exp3567	1.89374146e-18	0.000000	-0.000000	discard	4th_branch phase=90Â° amp=0.30 mode=4 fourier=4 tol=1e-9	agent1	solver_param	0	0.000000
exp3568	6.14461376e-29	0.000000	0.000000	discard	Fourier 2 modes newton_tol=5.0e-13	agent0	solver_param	0	-0.000000
exp3569	6.14461376e-29	0.000000	0.000000	discard	cycle 15 u=0.1050	agent0	initial_cond	0	-0.000000
exp3570	4.98807004e-17	0.070535	0.000000	discard	4th_branch phase=90Â° amp=0.30 mode=5 fourier=4 tol=1e-9	agent1	solver_param	1	0.000099
exp3571	6.14461376e-29	0.000000	0.000000	discard	cycle 15 u=0.1050	agent0	initial_cond	0	-0.000000
exp3572	1.23835463e-27	0.000000	-0.000000	discard	4th_branch phase=90Â° amp=0.30 mode=6 fourier=4 tol=1e-9	agent1	solver_param	0	-0.000000
exp3573	1.75906666e-28	0.000000	0.000000	discard	cycle 15 u=0.1050	agent0	initial_cond	0	-0.000000
exp3574	0.00000000e+00	0.998999	1.000000	discard	boundary u=0.463 mode=1 fourier=4 tol=1e-9	agent1	solver_param	0	-1.567655
exp3575	1.75906666e-28	0.000000	0.000000	discard	cycle 15 u=0.1050	agent0	initial_cond	1	-0.000000
exp3576	0.00000000e+00	0.998999	1.000000	discard	boundary u=0.463 mode=2 fourier=4 tol=1e-9	agent1	solver_param	1	-1.567655
exp3577	1.75906666e-28	0.000000	0.000000	discard	cycle 15 u=0.1050	agent0	initial_cond	0	-0.000000
exp3578	0.00000000e+00	0.998999	1.000000	discard	boundary u=0.463 mode=3 fourier=4 tol=1e-9	agent1	solver_param	0	-1.567655
exp3579	1.11257917e-28	0.000000	0.000000	discard	cycle 15 u=0.1050	agent0	initial_cond	0	-0.000000
exp3580	0.00000000e+00	0.998999	1.000000	discard	boundary u=0.463 mode=4 fourier=4 tol=1e-9	agent1	solver_param	0	-1.567655
exp3581	1.11257917e-28	0.000000	0.000000	discard	cycle 15 u=0.1050	agent0	initial_cond	1	-0.000000
exp3582	0.00000000e+00	0.998999	1.000000	discard	boundary u=0.463 mode=5 fourier=4 tol=1e-9	agent1	solver_param	0	-1.567655
exp3583	1.11257917e-28	0.000000	0.000000	discard	cycle 15 u=0.1050	agent0	initial_cond	0	-0.000000
exp3584	0.00000000e+00	0.998999	1.000000	discard	boundary u=0.463 mode=6 fourier=4 tol=1e-9	agent1	solver_param	0	-1.567655
exp3585	8.58580947e-29	0.000000	0.000000	discard	cycle 16 u=0.0975	agent0	initial_cond	1	0.000000
exp3586	0.00000000e+00	0.998999	1.000000	discard	positive u=1.44 mode=1 fourier=4 tol=1e-9	agent1	solver_param	1	-1.567655
exp3587	8.58580947e-29	0.000000	0.000000	discard	cycle 16 u=0.0975	agent0	initial_cond	0	0.000000
exp3588	0.00000000e+00	0.998999	1.000000	discard	positive u=1.44 mode=2 fourier=4 tol=1e-9	agent1	solver_param	0	-1.567655
exp3589	8.58580947e-29	0.000000	0.000000	discard	cycle 16 u=0.0975	agent0	initial_cond	0	0.000000
exp3590	0.00000000e+00	0.998999	1.000000	discard	positive u=1.44 mode=3 fourier=4 tol=1e-9	agent1	solver_param	0	-1.567655
exp3591	5.23962023e-29	0.000000	0.000000	discard	cycle 16 u=0.0975	agent0	initial_cond	1	0.000000
exp3592	0.00000000e+00	0.998999	1.000000	discard	positive u=1.44 mode=4 fourier=4 tol=1e-9	agent1	solver_param	0	-1.567655
exp3593	5.23962023e-29	0.000000	0.000000	discard	cycle 16 u=0.0975	agent0	initial_cond	0	0.000000
exp3594	0.00000000e+00	0.998999	1.000000	discard	positive u=1.44 mode=5 fourier=4 tol=1e-9	agent1	solver_param	0	-1.567655
exp3595	5.23962023e-29	0.000000	0.000000	discard	cycle 16 u=0.0975	agent0	initial_cond	0	0.000000
exp3596	0.00000000e+00	0.998999	1.000000	discard	positive u=1.44 mode=6 fourier=4 tol=1e-9	agent1	solver_param	1	-1.567655
exp3597	4.03266298e-29	0.000000	0.000000	discard	cycle 16 u=0.0975	agent0	initial_cond	0	0.000000
exp3598	4.03266298e-29	0.000000	0.000000	discard	cycle 16 u=0.0975	agent0	initial_cond	0	0.000000
exp3599	4.03266298e-29	0.000000	0.000000	discard	cycle 16 u=0.0975	agent0	initial_cond	1	0.000000
exp3600	4.80015937e-29	0.000000	0.000000	discard	cycle 16 u=0.0975	agent0	initial_cond	0	0.000000
exp3601	4.80015937e-29	0.000000	0.000000	discard	cycle 16 u=0.0975	agent0	initial_cond	0	0.000000
exp3602	4.80015937e-29	0.000000	0.000000	discard	cycle 16 u=0.0975	agent0	initial_cond	1	0.000000
exp3603	2.68824537e-29	0.000000	0.000000	discard	cycle 16 u=0.0980	agent0	initial_cond	0	-0.000000
exp3604	2.68824537e-29	0.000000	0.000000	discard	cycle 16 u=0.0980	agent0	initial_cond	0	-0.000000
exp3605	2.68824537e-29	0.000000	0.000000	discard	cycle 16 u=0.0980	agent0	initial_cond	0	-0.000000
exp3606	6.16758073e-29	0.000000	0.000000	discard	cycle 16 u=0.0980	agent0	initial_cond	0	-0.000000
exp3607	6.16758073e-29	0.000000	0.000000	discard	cycle 16 u=0.0980	agent0	initial_cond	1	-0.000000
exp3608	6.16758073e-29	0.000000	0.000000	discard	cycle 16 u=0.0980	agent0	initial_cond	0	-0.000000
exp3609	2.01926478e-29	0.000000	0.000000	discard	cycle 16 u=0.0980	agent0	initial_cond	0	0.000000
exp3610	2.01926478e-29	0.000000	0.000000	discard	cycle 16 u=0.0980	agent0	initial_cond	1	0.000000
exp3611	2.01926478e-29	0.000000	0.000000	discard	Fourier 2 retry 1	agent0	solver_param	0	0.000000
exp3611	2.01926478e-29	0.000000	0.000000	discard	cycle 16 u=0.0980	agent0	initial_cond	0	0.000000
exp3612	2.00148302e-16	1.001298	1.000025	discard	cycle 16 u=0.0980	agent0	initial_cond	1	-1.520921
exp3612	2.00148302e-16	1.001298	1.000025	discard	Fourier 2 retry 2	agent0	solver_param	1	-1.520921
exp3613	2.00148302e-16	1.001298	1.000025	discard	cycle 16 u=0.0980	agent0	initial_cond	0	-1.520921
exp3613	2.00148302e-16	1.001298	1.000025	discard	Fourier 2 retry 3	agent0	solver_param	0	-1.520921
exp3614	2.00148302e-16	1.001298	1.000025	discard	cycle 16 u=0.0980	agent0	initial_cond	0	-1.520921
exp3615	2.00148302e-16	1.001298	1.000025	discard	Fourier 2 retry 4	agent0	solver_param	0	-1.520921
exp3616	2.00148302e-16	1.001298	1.000025	discard	cycle 16 u=0.0982	agent0	initial_cond	1	-1.520921
exp3617	5.45343271e-29	0.000000	0.000000	discard	Fourier 2 retry 5	agent0	solver_param	0	-0.000000
exp3618	2.00148302e-16	1.001298	1.000025	discard	cycle 16 u=0.0982	agent0	initial_cond	0	-1.520921
exp3619	5.45343271e-29	0.000000	0.000000	discard	Fourier 2 retry 6	agent0	solver_param	0	-0.000000
exp3620	2.00148302e-16	1.001298	1.000025	discard	cycle 16 u=0.0982	agent0	initial_cond	0	-1.520921
exp3621	1.23429977e-28	0.000000	0.000000	discard	Fourier 2 retry 7	agent0	solver_param	1	0.000000
exp3622	2.00148302e-16	1.001298	1.000025	discard	cycle 16 u=0.0982	agent0	initial_cond	0	-1.520921
exp3623	1.23429977e-28	0.000000	0.000000	discard	Fourier 2 retry 8	agent0	solver_param	0	0.000000
exp3624	1.23429977e-28	0.000000	0.000000	discard	cycle 16 u=0.0982	agent0	initial_cond	0	0.000000
exp3625	1.23429977e-28	0.000000	0.000000	discard	Fourier 2 retry 9	agent0	solver_param	1	0.000000
exp3626	1.23429977e-28	0.000000	0.000000	discard	cycle 16 u=0.0982	agent0	initial_cond	1	0.000000
exp3627	1.88036672e-29	0.000000	0.000000	discard	Fourier 2 retry 10	agent0	solver_param	0	0.000000
exp3627	1.88036672e-29	0.000000	0.000000	discard	cycle 16 u=0.0982	agent0	initial_cond	0	0.000000
exp3628	1.88036672e-29	0.000000	0.000000	discard	cycle 16 u=0.0982	agent0	initial_cond	0	0.000000
exp3629	1.88036672e-29	0.000000	0.000000	discard	cycle 16 u=0.0982	agent0	initial_cond	1	0.000000
exp3630	1.91190259e-29	0.000000	-0.000000	discard	cycle 16 u=0.0982	agent0	initial_cond	0	0.000000
exp3631	1.91190259e-29	0.000000	-0.000000	discard	cycle 16 u=0.0982	agent0	initial_cond	0	0.000000
exp3632	1.91190259e-29	0.000000	-0.000000	discard	cycle 16 u=0.0982	agent0	initial_cond	0	0.000000
exp3633	6.13049994e-29	0.000000	0.000000	discard	cycle 16 u=0.0985	agent0	initial_cond	0	0.000000
exp3634	6.13049994e-29	0.000000	0.000000	discard	cycle 16 u=0.0985	agent0	initial_cond	1	0.000000
exp3635	6.13049994e-29	0.000000	0.000000	discard	cycle 16 u=0.0985	agent0	initial_cond	0	0.000000
exp3636	5.49750971e-29	0.000000	0.000000	discard	cycle 16 u=0.0985	agent0	initial_cond	0	0.000000
exp3637	5.49750971e-29	0.000000	0.000000	discard	cycle 16 u=0.0985	agent0	initial_cond	1	0.000000
exp3638	5.49750971e-29	0.000000	0.000000	discard	cycle 16 u=0.0985	agent0	initial_cond	0	0.000000
exp3639	4.15642452e-29	0.000000	0.000000	discard	cycle 16 u=0.0985	agent0	initial_cond	1	0.000000
exp3640	4.15642452e-29	0.000000	0.000000	discard	cycle 16 u=0.0985	agent0	initial_cond	0	0.000000
exp3641	4.15642452e-29	0.000000	0.000000	discard	cycle 16 u=0.0985	agent0	initial_cond	0	0.000000
exp3642	2.19292611e-29	0.000000	0.000000	discard	cycle 16 u=0.0985	agent0	initial_cond	1	-0.000000
exp3643	2.19292611e-29	0.000000	0.000000	discard	cycle 16 u=0.0985	agent0	initial_cond	0	-0.000000
exp3644	2.19292611e-29	0.000000	0.000000	discard	cycle 16 u=0.0985	agent0	initial_cond	0	-0.000000
exp3645	4.22491788e-29	0.000000	0.000000	discard	cycle 16 u=0.0990	agent0	initial_cond	0	-0.000000
exp3646	4.22491788e-29	0.000000	0.000000	discard	cycle 16 u=0.0990	agent0	initial_cond	0	-0.000000
exp3647	4.22491788e-29	0.000000	0.000000	discard	cycle 16 u=0.0990	agent0	initial_cond	1	-0.000000
exp3648	3.22245147e-29	0.000000	0.000000	discard	cycle 16 u=0.0990	agent0	initial_cond	0	0.000000
exp3649	3.22245147e-29	0.000000	0.000000	discard	cycle 16 u=0.0990	agent0	initial_cond	0	0.000000
exp3650	3.22245147e-29	0.000000	0.000000	discard	cycle 16 u=0.0990	agent0	initial_cond	1	0.000000
exp3651	4.50941488e-29	0.000000	-0.000000	discard	cycle 16 u=0.0990	agent0	initial_cond	0	0.000000
exp3652	4.50941488e-29	0.000000	-0.000000	discard	cycle 16 u=0.0990	agent0	initial_cond	0	0.000000
exp3653	4.50941488e-29	0.000000	-0.000000	discard	cycle 16 u=0.0990	agent0	initial_cond	0	0.000000
exp3654	4.88330883e-29	0.000000	-0.000000	discard	cycle 16 u=0.0990	agent0	initial_cond	0	0.000000
exp3655	4.88330883e-29	0.000000	-0.000000	discard	cycle 16 u=0.0990	agent0	initial_cond	1	0.000000
exp3656	4.88330883e-29	0.000000	-0.000000	discard	cycle 16 u=0.0990	agent0	initial_cond	0	0.000000
exp3657	5.74085541e-29	0.000000	-0.000000	discard	cycle 16 u=0.0995	agent0	initial_cond	0	0.000000
exp3658	5.74085541e-29	0.000000	-0.000000	discard	cycle 16 u=0.0995	agent0	initial_cond	1	0.000000
exp3659	5.74085541e-29	0.000000	-0.000000	discard	cycle 16 u=0.0995	agent0	initial_cond	0	0.000000
exp3660	1.54984578e-28	0.000000	0.000000	discard	cycle 16 u=0.0995	agent0	initial_cond	1	-0.000000
exp3661	1.54984578e-28	0.000000	0.000000	discard	cycle 16 u=0.0995	agent0	initial_cond	0	-0.000000
exp3662	1.54984578e-28	0.000000	0.000000	discard	cycle 16 u=0.0995	agent0	initial_cond	0	-0.000000
exp3663	1.60328418e-29	0.000000	-0.000000	discard	cycle 16 u=0.0995	agent0	initial_cond	1	-0.000000
exp3664	1.60328418e-29	0.000000	-0.000000	discard	cycle 16 u=0.0995	agent0	initial_cond	0	-0.000000
exp3665	1.60328418e-29	0.000000	-0.000000	discard	cycle 16 u=0.0995	agent0	initial_cond	0	-0.000000
