exp_id	residual	solution_norm	solution_mean	status	description	agent	design	elapsed_s	solution_energy
exp797	1.34357540e-12	1.002503	1.000218	discard	Verify best config run 1	agent0	initial_cond	0	-1.523848
exp797	1.34357540e-12	1.002503	1.000218	discard	grid2 mode=2 u=1.3 amp=0.3 phase=pi	agent0	perturbation	0	-1.523848
exp798	1.34357540e-12	1.002503	1.000218	discard	Verify best config run 2	agent0	initial_cond	1	-1.523848
exp798	1.34357540e-12	1.002503	1.000218	discard	grid2 mode=2 u=1.3 amp=0.5 phase=pi	agent0	perturbation	1	-1.523848
exp799	4.42586856e-16	1.001296	1.000019	discard	Fourier 3modes pos tol=1e-14	agent1	solver_param	0	-1.520844
exp799	7.80745707e-14	0.000000	0.000000	discard	Verify best config run 3	agent0	initial_cond	0	-0.000000
exp800	7.80745707e-14	0.000000	0.000000	discard	grid2 mode=3 u=0.3 amp=0.1 phase=pi	agent0	perturbation	0	-0.000000
exp801	1.01502544e-14	0.000000	0.000000	discard	grid2 mode=3 u=0.3 amp=0.3 phase=pi	agent0	perturbation	0	-0.000000
exp802	4.09232828e-19	0.000000	-0.000000	discard	grid2 mode=3 u=0.3 amp=0.5 phase=pi	agent0	perturbation	1	-0.000000
exp803	1.34360442e-12	1.002503	-1.000218	discard	grid2 mode=3 u=0.5 amp=0.1 phase=pi	agent0	perturbation	0	-1.523848
exp804	1.01781865e-16	0.000000	0.000000	discard	grid2 mode=3 u=0.5 amp=0.3 phase=pi	agent0	perturbation	1	-0.000000
exp805	1.34357540e-12	1.002503	1.000218	discard	grid2 mode=3 u=0.5 amp=0.5 phase=pi	agent0	perturbation	0	-1.523848
exp806	1.34357540e-12	1.002503	1.000218	discard	grid2 mode=3 u=0.7 amp=0.1 phase=pi	agent0	perturbation	1	-1.523848
exp807	1.34357540e-12	1.002503	1.000218	discard	grid2 mode=3 u=0.7 amp=0.3 phase=pi	agent0	perturbation	0	-1.523848
exp808	1.34357540e-12	1.002503	1.000218	discard	grid2 mode=3 u=0.7 amp=0.5 phase=pi	agent0	perturbation	1	-1.523848
exp809	1.34357540e-12	1.002503	1.000218	discard	grid2 mode=3 u=1.0 amp=0.1 phase=pi	agent0	perturbation	0	-1.523848
exp810	1.34357540e-12	1.002503	1.000218	discard	grid2 mode=3 u=1.0 amp=0.3 phase=pi	agent0	perturbation	1	-1.523848
exp811	1.34357540e-12	1.002503	1.000218	discard	grid2 mode=3 u=1.0 amp=0.5 phase=pi	agent0	perturbation	0	-1.523848
exp812	1.34357540e-12	1.002503	1.000218	discard	grid2 mode=3 u=1.3 amp=0.1 phase=pi	agent0	perturbation	1	-1.523848
exp813	1.34357540e-12	1.002503	1.000218	discard	grid2 mode=3 u=1.3 amp=0.3 phase=pi	agent0	perturbation	0	-1.523848
exp814	1.34357540e-12	1.002503	1.000218	discard	grid2 mode=3 u=1.3 amp=0.5 phase=pi	agent0	perturbation	0	-1.523848
exp815	6.73667301e-29	0.000000	0.000000	discard	Verify config test	agent0	initial_cond	1	-0.000000
exp816	2.06774381e-16	1.001296	1.000019	discard	Fourier 4modes u_offset=1.5 large offset	agent1	perturbation	0	-1.520844
exp817	crash	0	0	crash	Fourier modes=2	agent0	initial_cond	1	0
exp818	6.73667301e-29	0.000000	0.000000	discard	Fourier modes=3	agent0	initial_cond	0	-0.000000
exp819	1.59348322e-28	0.000000	0.000000	discard	Fourier modes=4	agent0	initial_cond	0	-0.000000
exp820	2.75469290e-28	0.000000	-0.000000	discard	Fourier modes=5	agent0	initial_cond	1	0.000000
exp821	7.31082989e-29	0.000000	0.000000	discard	m=3 a=0.0010 n=250 t=1.0e-10	agent0	initial_cond	0	-0.000000
exp822	7.31082989e-29	0.000000	0.000000	discard	m=3 a=0.0010 n=250 t=5.0e-11	agent0	initial_cond	0	-0.000000
exp823	5.62802405e-12	1.002503	1.000218	discard	m=3 a=0.0010 n=250 t=1.0e-11	agent0	initial_cond	1	-1.523848
exp824	7.31082989e-29	0.000000	0.000000	discard	opt pos n=250 tol=1.0e-11	agent0	solver_param	0	-0.000000
exp825	5.30249219e-12	1.002503	1.000218	discard	m=3 a=0.0010 n=300 t=1.0e-10	agent0	initial_cond	0	-1.523848
exp826	7.31082989e-29	0.000000	0.000000	discard	opt pos n=255 tol=1.0e-11	agent0	solver_param	0	-0.000000
exp827	5.00149461e-12	1.002503	1.000218	discard	m=3 a=0.0010 n=300 t=5.0e-11	agent0	initial_cond	0	-1.523848
exp828	7.31082989e-29	0.000000	0.000000	discard	opt pos n=260 tol=1.0e-11	agent0	solver_param	1	-0.000000
exp829	4.72229382e-12	1.002503	1.000218	discard	m=3 a=0.0010 n=300 t=1.0e-11	agent0	initial_cond	0	-1.523848
exp830	7.31082989e-29	0.000000	0.000000	discard	opt pos n=265 tol=1.0e-11	agent0	solver_param	0	-0.000000
exp831	4.51432576e-12	1.002503	1.000218	discard	m=3 a=0.0010 n=350 t=1.0e-10	agent0	initial_cond	0	-1.523848
exp832	7.31082989e-29	0.000000	0.000000	discard	opt pos n=269 tol=1.0e-11	agent0	solver_param	0	-0.000000
exp833	4.99938860e-12	1.002503	1.000218	discard	m=3 a=0.0010 n=350 t=5.0e-11	agent0	initial_cond	1	-1.523848
exp834	7.31082989e-29	0.000000	0.000000	discard	opt pos n=250 tol=5.0e-12	agent0	solver_param	1	-0.000000
exp835	4.99835501e-12	1.002503	1.000218	discard	m=3 a=0.0010 n=350 t=1.0e-11	agent0	initial_cond	0	-1.523848
exp836	4.99835501e-12	1.002503	1.000218	discard	opt pos n=255 tol=5.0e-12	agent0	solver_param	0	-1.523848
exp837	4.99972624e-12	1.002503	1.000218	discard	opt pos n=260 tol=5.0e-12	agent0	solver_param	1	-1.523848
exp838	4.72229382e-12	1.002503	1.000218	discard	opt pos n=265 tol=5.0e-12	agent0	solver_param	0	-1.523848
exp839	4.51432576e-12	1.002503	1.000218	discard	opt pos n=269 tol=5.0e-12	agent0	solver_param	0	-1.523848
exp840	1.67423858e-12	1.002503	1.000218	discard	opt pos n=250 tol=3.0e-12	agent0	solver_param	1	-1.523848
exp841	crash	0	0	crash	opt pos n=255 tol=3.0e-12	agent0	solver_param	0	0
exp842	crash	0	0	crash	opt pos n=260 tol=3.0e-12	agent0	solver_param	1	0
exp843	crash	0	0	crash	opt pos n=265 tol=3.0e-12	agent0	solver_param	0	0
exp844	crash	0	0	crash	opt pos n=269 tol=3.0e-12	agent0	solver_param	0	0
exp845	1.67423858e-12	1.002503	1.000218	discard	opt pos n=250 tol=2.5e-12	agent0	solver_param	1	-1.523848
exp846	1.57773901e-12	1.002503	1.000218	discard	opt pos n=255 tol=2.5e-12	agent0	solver_param	0	-1.523848
exp847	1.48880320e-12	1.002503	1.000218	discard	opt pos n=260 tol=2.5e-12	agent0	solver_param	0	-1.523848
exp848	4.17584944e-29	0.000000	0.000000	discard	opt pos n=265 tol=2.5e-12	agent0	solver_param	0	-0.000000
exp849	1.34357540e-12	1.002503	1.000218	discard	amp=0.00095	agent0	initial_cond	0	-1.523848
exp850	1.34357540e-12	1.002503	1.000218	discard	opt pos n=269 tol=2.5e-12	agent0	solver_param	0	-1.523848
exp851	1.67423858e-12	1.002503	1.000218	discard	amp=0.001	agent0	initial_cond	1	-1.523848
exp852	1.67423858e-12	1.002503	1.000218	discard	opt pos n=250 tol=2.0e-12	agent0	solver_param	1	-1.523848
exp853	1.57773901e-12	1.002503	1.000218	discard	amp=0.00105	agent0	initial_cond	0	-1.523848
exp854	1.57773901e-12	1.002503	1.000218	discard	opt pos n=255 tol=2.0e-12	agent0	solver_param	0	-1.523848
exp855	1.48880320e-12	1.002503	1.000218	discard	amp=0.0011	agent0	initial_cond	0	-1.523848
exp856	1.48880320e-12	1.002503	1.000218	discard	opt pos n=260 tol=2.0e-12	agent0	solver_param	1	-1.523848
exp857	1.40774009e-12	1.002503	1.000218	discard	amp=0.00115	agent0	initial_cond	0	-1.523848
exp858	1.40774009e-12	1.002503	1.000218	discard	opt pos n=265 tol=2.0e-12	agent0	solver_param	0	-1.523848
exp859	1.34357540e-12	1.002503	1.000218	discard	amp=0.0012	agent0	initial_cond	0	-1.523848
exp860	1.34357540e-12	1.002503	1.000218	discard	opt pos n=269 tol=2.0e-12	agent0	solver_param	0	-1.523848
exp861	1.19051839e-28	0.000000	0.000000	discard	amp=0.00125	agent0	initial_cond	1	0.000000
exp862	1.09101311e-28	0.000000	0.000000	discard	amp=0.0013	agent0	initial_cond	0	-0.000000
exp863	6.33733754e-29	0.000000	0.000000	discard	amp=0.00135	agent0	initial_cond	0	0.000000
exp864	8.55007482e-29	0.000000	0.000000	discard	amp=0.001330	agent0	initial_cond	0	-0.000000
exp865	8.55333489e-29	0.000000	0.000000	discard	amp=0.001335	agent0	initial_cond	0	-0.000000
exp866	4.46546993e-29	0.000000	0.000000	discard	amp=0.001340	agent0	initial_cond	1	-0.000000
exp867	4.58623706e-29	0.000000	0.000000	discard	amp=0.001345	agent0	initial_cond	0	-0.000000
exp868	6.33733754e-29	0.000000	0.000000	discard	amp=0.001350	agent0	initial_cond	0	0.000000
exp869	4.66087970e-29	0.000000	0.000000	discard	amp=0.001355	agent0	initial_cond	1	-0.000000
exp870	1.51253966e-28	0.000000	0.000000	discard	amp=0.001360	agent0	initial_cond	0	0.000000
exp871	1.40774009e-12	1.002503	1.000218	discard	reliability test n=265 run 1	agent0	solver_param	0	-1.523848
exp872	1.40774009e-12	1.002503	1.000218	discard	reliability test n=265 run 2	agent0	solver_param	1	-1.523848
exp873	1.40774009e-12	1.002503	1.000218	discard	reliability test n=265 run 3	agent0	solver_param	0	-1.523848
exp874	1.40774009e-12	1.002503	1.000218	discard	reliability test n=265 run 4	agent0	solver_param	0	-1.523848
exp875	1.40774009e-12	1.002503	1.000218	discard	reliability test n=265 run 5	agent0	solver_param	1	-1.523848
exp876	1.14590596e-28	0.000000	-0.000000	discard	amp=0.001338	agent0	initial_cond	0	0.000000
exp877	1.52044913e-28	0.000000	0.000000	discard	amp=0.001339	agent0	initial_cond	0	-0.000000
exp878	4.46546993e-29	0.000000	0.000000	discard	amp=0.001340	agent0	initial_cond	0	-0.000000
exp879	4.60328409e-29	0.000000	0.000000	discard	amp=0.001341	agent0	initial_cond	0	-0.000000
exp880	4.05782361e-29	0.000000	0.000000	discard	amp=0.001342	agent0	initial_cond	1	-0.000000
exp881	1.34357540e-12	1.002503	1.000218	discard	reliability test n=269 run 1	agent0	solver_param	1	-1.523848
exp882	1.34357540e-12	1.002503	1.000218	discard	reliability test n=269 run 2	agent0	solver_param	0	-1.523848
exp883	1.34357540e-12	1.002503	1.000218	discard	reliability test n=269 run 3	agent0	solver_param	1	-1.523848
exp884	1.34357540e-12	1.002503	1.000218	discard	reliability test n=269 run 4	agent0	solver_param	0	-1.523848
exp885	1.34357540e-12	1.002503	1.000218	discard	reliability test n=269 run 5	agent0	solver_param	1	-1.523848
exp886	6.73660582e-17	0.000000	0.000000	discard	u=0.08	agent0	initial_cond	0	-0.000000
exp887	9.47170599e-16	0.000000	0.000000	discard	u=0.09	agent0	initial_cond	0	-0.000000
exp888	4.05782361e-29	0.000000	0.000000	discard	u=0.100	agent0	initial_cond	1	-0.000000
exp889	2.31498622e-28	0.000000	0.000000	discard	u=0.110	agent0	initial_cond	0	-0.000000
exp890	3.88227947e-27	0.000000	0.000000	discard	u=0.120	agent0	initial_cond	1	-0.000000
exp891	1.66378531e-15	0.000000	0.000000	discard	u=0.24	agent0	initial_cond	0	-0.000000
exp892	2.37086744e-28	0.000000	0.000000	discard	u=0.25	agent0	initial_cond	0	0.000000
exp893	2.39850264e-27	0.000000	0.000000	discard	u=0.26	agent0	initial_cond	1	-0.000000
exp894	1.34357540e-12	1.002503	1.000218	discard	fine tol=1.9e-12 n=269	agent0	solver_param	0	-1.523848
exp895	1.34357540e-12	1.002503	1.000218	discard	fine tol=1.8e-12 n=269	agent0	solver_param	0	-1.523848
exp896	1.34357540e-12	1.002503	1.000218	discard	fine tol=1.7e-12 n=269	agent0	solver_param	0	-1.523848
exp897	1.34357540e-12	1.002503	1.000218	discard	fine tol=1.6e-12 n=269	agent0	solver_param	1	-1.523848
exp898	1.34357540e-12	1.002503	1.000218	discard	nodes=200	agent0	initial_cond	0	-1.523848
exp899	1.34357540e-12	1.002503	1.000218	discard	fine tol=1.5e-12 n=269	agent0	solver_param	0	-1.523848
exp900	1.34357540e-12	1.002503	1.000218	discard	nodes=250	agent0	initial_cond	0	-1.523848
exp901	1.34357540e-12	1.002503	1.000218	discard	fine tol=1.4e-12 n=269	agent0	solver_param	1	-1.523848
exp902	crash	0	0	crash	nodes=300	agent0	initial_cond	0	0
exp903	crash	0	0	crash	fine tol=1.3e-12 n=269	agent0	solver_param	0	0
exp904	4.05782361e-29	0.000000	0.000000	discard	nodes=350	agent0	initial_cond	0	-0.000000
exp905	4.05782361e-29	0.000000	0.000000	discard	nodes=400	agent0	initial_cond	1	-0.000000
exp906	4.05782361e-29	0.000000	0.000000	discard	nodes=300 run 1	agent0	initial_cond	1	-0.000000
exp907	4.05782361e-29	0.000000	0.000000	discard	nodes=300 run 2	agent0	initial_cond	0	-0.000000
exp908	4.05782361e-29	0.000000	0.000000	discard	nodes=300 run 3	agent0	initial_cond	0	-0.000000
exp909	6.30815879e-14	0.000000	0.000000	discard	neg amp u=0.3 mode=1	agent0	perturbation	0	-0.000000
exp910	1.82558200e-14	0.000000	0.000000	discard	neg amp u=0.3 mode=2	agent0	perturbation	1	-0.000000
exp911	3.84914566e-19	0.000000	-0.000000	discard	neg amp u=0.3 mode=3	agent0	perturbation	0	-0.000000
exp912	1.86448438e-21	0.000000	-0.000000	discard	u=-0.5	agent0	initial_cond	0	0.000000
exp913	1.86448438e-21	0.000000	-0.000000	discard	neg amp u=0.5 mode=1	agent0	perturbation	0	0.000000
exp914	1.66819907e-15	0.000000	0.000000	discard	u=-0.4	agent0	initial_cond	1	-0.000000
exp915	1.66819907e-15	0.000000	0.000000	discard	neg amp u=0.5 mode=2	agent0	perturbation	0	-0.000000
exp916	1.34357540e-12	1.002503	1.000218	discard	u=-0.3	agent0	initial_cond	0	-1.523848
exp917	1.34357540e-12	1.002503	1.000218	discard	neg amp u=0.5 mode=3	agent0	perturbation	0	-1.523848
exp918	1.42647428e-13	0.000000	0.000000	discard	u=-0.2	agent0	initial_cond	1	-0.000000
exp919	1.42647428e-13	0.000000	0.000000	discard	neg amp u=0.7 mode=1	agent0	perturbation	1	-0.000000
exp920	1.34357540e-12	1.002503	1.000218	discard	u=-0.1	agent0	initial_cond	0	-1.523848
exp921	1.34357540e-12	1.002503	1.000218	discard	neg amp u=0.7 mode=2	agent0	perturbation	0	-1.523848
exp922	1.34357540e-12	1.002503	1.000218	discard	u=0.0	agent0	initial_cond	0	-1.523848
exp923	1.34357540e-12	1.002503	1.000218	discard	neg amp u=0.7 mode=3	agent0	perturbation	1	-1.523848
exp924	1.34357540e-12	1.002503	1.000218	discard	u=0.05	agent0	initial_cond	0	-1.523848
exp925	1.34357540e-12	1.002503	1.000218	discard	neg amp u=1.0 mode=1	agent0	perturbation	0	-1.523848
exp926	1.34357540e-12	1.002503	1.000218	discard	u=0.1	agent0	initial_cond	0	-1.523848
exp927	1.34357540e-12	1.002503	1.000218	discard	neg amp u=1.0 mode=2	agent0	perturbation	1	-1.523848
exp928	1.34360442e-12	1.002503	1.000218	discard	u=0.15	agent0	initial_cond	1	-1.523848
exp929	1.34360442e-12	1.002503	1.000218	discard	neg amp u=1.0 mode=3	agent0	perturbation	0	-1.523848
exp930	2.10242585e-20	0.000000	0.000000	discard	u=0.2	agent0	initial_cond	0	-0.000000
exp931	2.37086744e-28	0.000000	0.000000	discard	u=0.25	agent0	initial_cond	1	0.000000
exp932	1.04817750e-21	0.000000	0.000000	discard	u=0.3	agent0	initial_cond	0	-0.000000
exp933	4.39979165e-25	0.000000	-0.000000	discard	u=0.35	agent0	initial_cond	0	0.000000
exp934	3.80781454e-24	0.000000	0.000000	discard	u=0.4	agent0	initial_cond	1	-0.000000
exp935	6.31700312e-16	0.000000	0.000000	discard	u=0.45	agent0	initial_cond	0	-0.000000
exp936	6.21596067e-16	1.001296	-1.000019	discard	u=0.5	agent0	initial_cond	1	-1.520844
exp937	2.87172723e-28	0.000000	0.000000	discard	u=0.25 amp=0.0010	agent0	initial_cond	0	-0.000000
exp938	2.19157366e-28	0.000000	0.000000	discard	u=0.25 amp=0.0012	agent0	initial_cond	1	0.000000
exp939	2.49268596e-28	0.000000	0.000000	discard	u=0.25 amp=0.0014	agent0	initial_cond	0	-0.000000
exp940	7.48974675e-29	0.000000	0.000000	discard	u=0.25 amp=0.00135	agent0	initial_cond	1	0.000000
exp941	1.44155548e-28	0.000000	-0.000000	discard	u=0.25 amp=0.00145	agent0	initial_cond	0	0.000000
exp942	7.90561609e-29	0.000000	0.000000	discard	u=0.25 amp=0.00155	agent0	initial_cond	0	-0.000000
exp943	4.12481252e-21	0.000000	0.000000	discard	boundary u=0.480 n=269 mode=3	agent0	branch_search	1	-0.000000
exp944	1.65347426e-20	0.000000	-0.000000	discard	boundary u=0.485 n=269 mode=3	agent0	branch_search	0	0.000000
exp945	1.34357540e-12	1.002503	-1.000218	discard	boundary u=0.490 n=269 mode=3	agent0	branch_search	1	-1.523848
exp946	1.34357540e-12	1.002503	-1.000218	discard	boundary u=0.491 n=269 mode=3	agent0	branch_search	0	-1.523848
exp947	6.34244435e-14	0.000000	0.000000	discard	boundary u=0.492 n=269 mode=3	agent0	branch_search	0	-0.000000
exp948	7.39931012e-14	0.000000	0.000000	discard	boundary u=0.493 n=269 mode=3	agent0	branch_search	1	-0.000000
exp949	5.22643479e-15	0.000000	0.000000	discard	boundary u=0.494 n=269 mode=3	agent0	branch_search	0	-0.000000
exp950	4.81588818e-18	0.000000	-0.000000	discard	boundary u=0.495 n=269 mode=3	agent0	branch_search	1	-0.000000
exp951	1.62070097e-12	0.000000	-0.000000	discard	boundary u=0.496 n=269 mode=3	agent0	branch_search	0	-0.000000
exp952	1.44417479e-16	0.000000	0.000000	discard	boundary u=0.497 n=269 mode=3	agent0	branch_search	0	-0.000000
exp953	3.24596716e-28	0.000000	0.000000	discard	boundary u=0.498 n=269 mode=3	agent0	branch_search	1	-0.000000
exp954	3.24596716e-28	0.000000	0.000000	discard	u=0.25 amp=0.001330	agent0	initial_cond	1	-0.000000
exp955	1.23492882e-28	0.000000	0.000000	discard	boundary u=0.499 n=269 mode=3	agent0	branch_search	0	-0.000000
exp955	1.23492882e-28	0.000000	0.000000	discard	u=0.25 amp=0.001335	agent0	initial_cond	0	-0.000000
exp956	1.92572048e-28	0.000000	0.000000	discard	boundary u=0.500 n=269 mode=3	agent0	branch_search	0	-0.000000
exp956	1.92572048e-28	0.000000	0.000000	discard	u=0.25 amp=0.001340	agent0	initial_cond	0	-0.000000
exp957	2.15450646e-28	0.000000	-0.000000	discard	u=0.25 amp=0.001345	agent0	initial_cond	1	0.000000
exp958	7.48974675e-29	0.000000	0.000000	discard	u=0.25 amp=0.001350	agent0	initial_cond	0	0.000000
exp959	1.80387390e-28	0.000000	0.000000	discard	u=0.25 amp=0.001355	agent0	initial_cond	0	-0.000000
exp960	3.51670664e-28	0.000000	0.000000	discard	u=0.25 amp=0.001360	agent0	initial_cond	0	0.000000
exp961	5.63598005e-11	0.000000	-0.000000	discard	refine u=-1.45 zone scipy tol=1e-9	manual	memory	0	-0.000000
exp962	2.08015649e-10	1.002503	-1.000218	discard	Fourier 2modes u=0.8 amp=0.15 beat 1.86e-16	agent1	solver_param	0	-1.523848
exp963	crash	0	0	crash	u=-0.1 amp=0.001340	agent0	initial_cond	0	0
exp964	crash	0	0	crash	pos boundary u=0.500 n=269 mode=3	agent0	branch_search	0	0
exp965	1.34357540e-12	1.002503	-1.000218	discard	u=-0.1 amp=0.001342	agent0	initial_cond	1	-1.523848
exp965	1.34357540e-12	1.002503	-1.000218	discard	pos boundary u=0.510 n=269 mode=3	agent0	branch_search	1	-1.523848
exp966	crash	0	0	crash	u=-0.1 amp=0.001350	agent0	initial_cond	0	0
exp967	crash	0	0	crash	pos boundary u=0.515 n=269 mode=3	agent0	branch_search	0	0
exp968	1.34357540e-12	1.002503	1.000218	discard	u=-0.25 amp=0.001340	agent0	initial_cond	0	-1.523848
exp968	1.34357540e-12	1.002503	1.000218	discard	pos boundary u=0.520 n=269 mode=3	agent0	branch_search	1	-1.523848
exp969	1.34357540e-12	1.002503	1.000218	discard	u=-0.25 amp=0.001342	agent0	initial_cond	0	-1.523848
exp969	1.34357540e-12	1.002503	1.000218	discard	pos boundary u=0.525 n=269 mode=3	agent0	branch_search	0	-1.523848
exp970	1.34357540e-12	1.002503	1.000218	discard	u=-0.25 amp=0.001350	agent0	initial_cond	0	-1.523848
exp971	1.34357540e-12	1.002503	1.000218	discard	pos boundary u=0.530 n=269 mode=3	agent0	branch_search	0	-1.523848
exp972	2.08015649e-10	1.002503	-1.000218	discard	refine u=-1.45 scipy tol=1e-9 n=300	agent1	memory	1	-1.523848
exp973	1.34357540e-12	1.002503	1.000218	discard	pos boundary u=0.535 n=269 mode=3	agent0	branch_search	1	-1.523848
exp974	1.34357540e-12	1.002503	1.000218	discard	pos boundary u=0.540 n=269 mode=3	agent0	branch_search	0	-1.523848
exp975	4.05782361e-29	0.000000	0.000000	discard	maxiter=100	agent0	initial_cond	1	-0.000000
exp976	4.05782361e-29	0.000000	0.000000	discard	maxiter=150	agent0	initial_cond	0	-0.000000
exp977	4.05782361e-29	0.000000	0.000000	discard	maxiter=200	agent0	initial_cond	0	-0.000000
exp978	4.05782361e-29	0.000000	0.000000	discard	maxiter=300	agent0	initial_cond	0	-0.000000
exp979	4.05782361e-29	0.000000	0.000000	discard	maxiter=500	agent0	initial_cond	0	-0.000000
exp980	1.48880320e-12	1.002503	1.000218	discard	fine n=260 pos mode=3	agent0	solver_param	1	-1.523848
exp981	1.46910673e-12	1.002503	1.000218	discard	fine n=261 pos mode=3	agent0	solver_param	0	-1.523848
exp982	1.45535398e-12	1.002503	1.000218	discard	fine n=262 pos mode=3	agent0	solver_param	1	-1.523848
exp982	2.07994543e-10	1.002503	-1.000218	discard	super-convergence zone u=-1.50 n=300 tol=1e-9	agent1	memory	1	-1.523848
exp983	2.08003506e-10	1.002503	-1.000218	discard	super-convergence zone u=-1.52 n=300 tol=1e-9	agent1	memory	0	-1.523848
exp983	1.43707146e-12	1.002503	1.000218	discard	fine n=263 pos mode=3	agent0	solver_param	0	-1.523848
exp984	2.08163397e-10	1.002503	-1.000218	discard	super-convergence zone u=-1.55 n=300 tol=1e-9	agent1	memory	0	-1.523848
exp985	1.41827379e-12	1.002503	1.000218	discard	fine n=264 pos mode=3	agent0	solver_param	0	-1.523848
exp986	2.08431153e-10	1.002503	-1.000218	discard	super-convergence zone u=-1.48 n=300 tol=1e-9	agent1	memory	1	-1.523848
exp987	1.40774009e-12	1.002503	1.000218	discard	fine n=265 pos mode=3	agent0	solver_param	1	-1.523848
exp988	2.07997100e-10	1.002503	-1.000218	discard	super-convergence zone u=-1.51 n=300 tol=1e-9	agent1	memory	0	-1.523848
exp989	1.38696447e-12	1.002503	1.000218	discard	fine n=266 pos mode=3	agent0	solver_param	0	-1.523848
exp990	1.37357611e-12	1.002503	1.000218	discard	fine n=267 pos mode=3	agent0	solver_param	1	-1.523848
exp991	1.35748465e-12	1.002503	1.000218	discard	fine n=268 pos mode=3	agent0	solver_param	0	-1.523848
exp992	1.34357540e-12	1.002503	1.000218	discard	fine n=269 pos mode=3	agent0	solver_param	0	-1.523848
exp993	crash	0	0	crash	fine n=270 pos mode=3	agent0	solver_param	0	0
exp994	2.12761318e-16	1.001296	1.000019	discard	Fourier pos u=0.8	agent0	initial_cond	0	-1.520844
exp995	2.12761318e-16	1.001296	1.000019	discard	Fourier pos u=0.8	agent0	initial_cond	0	-1.520844
exp996	3.54057812e-15	1.001296	1.000019	discard	Fourier pos u=0.85	agent0	initial_cond	0	-1.520844
exp997	3.54057812e-15	1.001296	1.000019	discard	Fourier pos u=0.85	agent0	initial_cond	0	-1.520844
exp998	4.42586856e-16	1.001296	1.000019	discard	Fourier pos u=0.9	agent0	initial_cond	1	-1.520844
exp999	4.42586856e-16	1.001296	1.000019	discard	Fourier pos u=0.9	agent0	initial_cond	0	-1.520844
exp1000	4.42586856e-16	1.001296	1.000019	discard	Fourier pos u=0.95	agent0	initial_cond	0	-1.520844
exp1001	4.42586856e-16	1.001296	1.000019	discard	Fourier pos u=0.95	agent0	initial_cond	1	-1.520844
exp1002	9.35134491e-16	1.001296	1.000019	discard	Fourier pos u=1.0	agent0	initial_cond	0	-1.520844
exp1003	9.35134491e-16	1.001296	1.000019	discard	Fourier pos u=1.0	agent0	initial_cond	0	-1.520844
