exp_id	residual	solution_norm	solution_mean	status	description	agent	design	elapsed_s	solution_energy
exp5790	2.68824537e-29	0.000000	0.000000	discard	cycle 33 u=0.0980	agent0	initial_cond	0	-0.000000
exp5791	3.25854008e-16	0.070278	-0.000000	discard	4th branch u_offset=0.25 amp=0.5 phase=1.0 modes=3	manual	memory	1	0.000097
exp5792	6.16758073e-29	0.000000	0.000000	discard	cycle 33 u=0.0980	agent0	initial_cond	0	-0.000000
exp5793	6.16758073e-29	0.000000	0.000000	discard	cycle 33 u=0.0980	agent0	initial_cond	0	-0.000000
exp5794	6.16758073e-29	0.000000	0.000000	discard	cycle 33 u=0.0980	agent0	initial_cond	1	-0.000000
exp5795	2.01926478e-29	0.000000	0.000000	discard	cycle 33 u=0.0980	agent0	initial_cond	0	0.000000
exp5796	2.01926478e-29	0.000000	0.000000	discard	cycle 33 u=0.0980	agent0	initial_cond	0	0.000000
exp5797	2.01926478e-29	0.000000	0.000000	discard	cycle 33 u=0.0980	agent0	initial_cond	1	0.000000
exp5798	1.30310780e-28	0.000000	0.000000	discard	cycle 33 u=0.0980	agent0	initial_cond	0	-0.000000
exp5799	1.30310780e-28	0.000000	0.000000	discard	cycle 33 u=0.0980	agent0	initial_cond	0	-0.000000
exp5800	1.30310780e-28	0.000000	0.000000	discard	cycle 33 u=0.0980	agent0	initial_cond	0	-0.000000
exp5801	5.45343271e-29	0.000000	0.000000	discard	cycle 33 u=0.0982	agent0	initial_cond	0	-0.000000
exp5802	5.45343271e-29	0.000000	0.000000	discard	cycle 33 u=0.0982	agent0	initial_cond	1	-0.000000
exp5802	9.95671772e-18	0.070278	-0.000000	discard	4th branch u_offset=0.35 amp=0.5 phase=1.0 modes=3	manual	memory	1	0.000097
exp5803	5.45343271e-29	0.000000	0.000000	discard	cycle 33 u=0.0982	agent0	initial_cond	0	-0.000000
exp5804	1.23429977e-28	0.000000	0.000000	discard	cycle 33 u=0.0982	agent0	initial_cond	0	0.000000
exp5805	1.23429977e-28	0.000000	0.000000	discard	cycle 33 u=0.0982	agent0	initial_cond	1	0.000000
exp5806	1.23429977e-28	0.000000	0.000000	discard	cycle 33 u=0.0982	agent0	initial_cond	0	0.000000
exp5807	1.88036672e-29	0.000000	0.000000	discard	cycle 33 u=0.0982	agent0	initial_cond	0	0.000000
exp5808	1.88036672e-29	0.000000	0.000000	discard	cycle 33 u=0.0982	agent0	initial_cond	0	0.000000
exp5809	1.88036672e-29	0.000000	0.000000	discard	cycle 33 u=0.0982	agent0	initial_cond	0	0.000000
exp5810	1.91190259e-29	0.000000	-0.000000	discard	cycle 33 u=0.0982	agent0	initial_cond	1	0.000000
exp5811	1.91190259e-29	0.000000	-0.000000	discard	cycle 33 u=0.0982	agent0	initial_cond	0	0.000000
exp5812	1.91190259e-29	0.000000	-0.000000	discard	cycle 33 u=0.0982	agent0	initial_cond	0	0.000000
exp5813	2.79958055e-17	0.070278	-0.000000	discard	4th branch u_offset=0.40 amp=0.5 phase=1.0 modes=3	manual	memory	1	0.000097
exp5814	6.13049994e-29	0.000000	0.000000	discard	cycle 33 u=0.0985	agent0	initial_cond	1	0.000000
exp5815	6.13049994e-29	0.000000	0.000000	discard	cycle 33 u=0.0985	agent0	initial_cond	0	0.000000
exp5816	6.13049994e-29	0.000000	0.000000	discard	cycle 33 u=0.0985	agent0	initial_cond	0	0.000000
exp5817	5.49750971e-29	0.000000	0.000000	discard	cycle 33 u=0.0985	agent0	initial_cond	0	0.000000
exp5818	5.49750971e-29	0.000000	0.000000	discard	cycle 33 u=0.0985	agent0	initial_cond	0	0.000000
exp5819	5.49750971e-29	0.000000	0.000000	discard	cycle 33 u=0.0985	agent0	initial_cond	1	0.000000
exp5820	4.15642452e-29	0.000000	0.000000	discard	cycle 33 u=0.0985	agent0	initial_cond	0	0.000000
exp5821	4.15642452e-29	0.000000	0.000000	discard	cycle 33 u=0.0985	agent0	initial_cond	0	0.000000
exp5822	4.15642452e-29	0.000000	0.000000	discard	cycle 33 u=0.0985	agent0	initial_cond	1	0.000000
exp5823	2.19292611e-29	0.000000	0.000000	discard	cycle 33 u=0.0985	agent0	initial_cond	0	-0.000000
exp5824	2.19292611e-29	0.000000	0.000000	discard	cycle 33 u=0.0985	agent0	initial_cond	0	-0.000000
exp5825	2.19292611e-29	0.000000	0.000000	discard	cycle 33 u=0.0985	agent0	initial_cond	0	-0.000000
exp5826	4.22491788e-29	0.000000	0.000000	discard	cycle 33 u=0.0990	agent0	initial_cond	0	-0.000000
exp5827	4.22491788e-29	0.000000	0.000000	discard	cycle 33 u=0.0990	agent0	initial_cond	1	-0.000000
exp5828	4.22491788e-29	0.000000	0.000000	discard	cycle 33 u=0.0990	agent0	initial_cond	0	-0.000000
exp5829	3.22245147e-29	0.000000	0.000000	discard	cycle 33 u=0.0990	agent0	initial_cond	0	0.000000
exp5830	3.22245147e-29	0.000000	0.000000	discard	cycle 33 u=0.0990	agent0	initial_cond	1	0.000000
exp5830	1.76957053e-17	0.070278	-0.000000	discard	4th branch u_offset=0.36 amp=0.5 phase=1.0 modes=3	manual	memory	1	0.000097
exp5831	3.22245147e-29	0.000000	0.000000	discard	cycle 33 u=0.0990	agent0	initial_cond	0	0.000000
exp5832	4.50941488e-29	0.000000	-0.000000	discard	cycle 33 u=0.0990	agent0	initial_cond	0	0.000000
exp5833	4.50941488e-29	0.000000	-0.000000	discard	cycle 33 u=0.0990	agent0	initial_cond	0	0.000000
exp5834	4.50941488e-29	0.000000	-0.000000	discard	cycle 33 u=0.0990	agent0	initial_cond	0	0.000000
exp5835	4.88330883e-29	0.000000	-0.000000	discard	cycle 33 u=0.0990	agent0	initial_cond	1	0.000000
exp5836	4.88330883e-29	0.000000	-0.000000	discard	cycle 33 u=0.0990	agent0	initial_cond	0	0.000000
exp5837	4.88330883e-29	0.000000	-0.000000	discard	cycle 33 u=0.0990	agent0	initial_cond	0	0.000000
exp5838	5.74085541e-29	0.000000	-0.000000	discard	cycle 33 u=0.0995	agent0	initial_cond	1	0.000000
exp5839	5.74085541e-29	0.000000	-0.000000	discard	cycle 33 u=0.0995	agent0	initial_cond	0	0.000000
exp5840	5.74085541e-29	0.000000	-0.000000	discard	cycle 33 u=0.0995	agent0	initial_cond	0	0.000000
exp5841	1.54984578e-28	0.000000	0.000000	discard	cycle 33 u=0.0995	agent0	initial_cond	0	-0.000000
exp5842	1.54984578e-28	0.000000	0.000000	discard	cycle 33 u=0.0995	agent0	initial_cond	0	-0.000000
exp5843	1.54984578e-28	0.000000	0.000000	discard	cycle 33 u=0.0995	agent0	initial_cond	1	-0.000000
exp5843	5.00628442e-17	0.070278	-0.000000	discard	4th branch u_offset=0.37 amp=0.5 phase=1.0 modes=3	manual	memory	1	0.000097
exp5844	1.60328418e-29	0.000000	-0.000000	discard	cycle 33 u=0.0995	agent0	initial_cond	0	-0.000000
exp5845	1.60328418e-29	0.000000	-0.000000	discard	cycle 33 u=0.0995	agent0	initial_cond	0	-0.000000
exp5846	1.60328418e-29	0.000000	-0.000000	discard	cycle 33 u=0.0995	agent0	initial_cond	1	-0.000000
exp5847	7.34590618e-29	0.000000	0.000000	discard	cycle 33 u=0.0995	agent0	initial_cond	0	0.000000
exp5848	7.34590618e-29	0.000000	0.000000	discard	cycle 33 u=0.0995	agent0	initial_cond	0	0.000000
exp5849	7.34590618e-29	0.000000	0.000000	discard	cycle 33 u=0.0995	agent0	initial_cond	1	0.000000
exp5850	4.46546993e-29	0.000000	0.000000	discard	cycle 33 u=0.1000	agent0	initial_cond	0	-0.000000
exp5851	4.46546993e-29	0.000000	0.000000	discard	cycle 33 u=0.1000	agent0	initial_cond	1	-0.000000
exp5852	4.46546993e-29	0.000000	0.000000	discard	cycle 33 u=0.1000	agent0	initial_cond	0	-0.000000
exp5853	4.08106752e-29	0.000000	0.000000	discard	cycle 33 u=0.1000	agent0	initial_cond	0	-0.000000
exp5854	4.08106752e-29	0.000000	0.000000	discard	cycle 33 u=0.1000	agent0	initial_cond	1	-0.000000
exp5855	4.08106752e-29	0.000000	0.000000	discard	cycle 33 u=0.1000	agent0	initial_cond	0	-0.000000
exp5856	4.58623706e-29	0.000000	0.000000	discard	cycle 33 u=0.1000	agent0	initial_cond	0	-0.000000
exp5857	4.58623706e-29	0.000000	0.000000	discard	cycle 33 u=0.1000	agent0	initial_cond	1	-0.000000
exp5858	4.58623706e-29	0.000000	0.000000	discard	cycle 33 u=0.1000	agent0	initial_cond	0	-0.000000
exp5859	4.39794337e-29	0.000000	0.000000	discard	cycle 33 u=0.1000	agent0	initial_cond	1	-0.000000
exp5860	4.39794337e-29	0.000000	0.000000	discard	cycle 33 u=0.1000	agent0	initial_cond	0	-0.000000
exp5861	4.39794337e-29	0.000000	0.000000	discard	cycle 33 u=0.1000	agent0	initial_cond	0	-0.000000
exp5862	4.87462529e-17	0.070535	0.000000	discard	4th branch u_offset=0.36 amp=0.5 phase=1.0 modes=4	manual	memory	0	0.000099
exp5863	1.36727475e-28	0.000000	0.000000	discard	cycle 33 u=0.1050	agent0	initial_cond	1	-0.000000
exp5864	1.36727475e-28	0.000000	0.000000	discard	cycle 33 u=0.1050	agent0	initial_cond	0	-0.000000
exp5865	1.36727475e-28	0.000000	0.000000	discard	cycle 33 u=0.1050	agent0	initial_cond	0	-0.000000
exp5866	6.14461376e-29	0.000000	0.000000	discard	cycle 33 u=0.1050	agent0	initial_cond	1	-0.000000
exp5867	6.14461376e-29	0.000000	0.000000	discard	cycle 33 u=0.1050	agent0	initial_cond	0	-0.000000
exp5868	6.14461376e-29	0.000000	0.000000	discard	cycle 33 u=0.1050	agent0	initial_cond	1	-0.000000
exp5869	1.75906666e-28	0.000000	0.000000	discard	cycle 33 u=0.1050	agent0	initial_cond	0	-0.000000
exp5870	1.75906666e-28	0.000000	0.000000	discard	cycle 33 u=0.1050	agent0	initial_cond	0	-0.000000
exp5871	1.75906666e-28	0.000000	0.000000	discard	cycle 33 u=0.1050	agent0	initial_cond	1	-0.000000
exp5872	1.11257917e-28	0.000000	0.000000	discard	cycle 33 u=0.1050	agent0	initial_cond	0	-0.000000
exp5873	1.11257917e-28	0.000000	0.000000	discard	cycle 33 u=0.1050	agent0	initial_cond	0	-0.000000
exp5874	1.11257917e-28	0.000000	0.000000	discard	cycle 33 u=0.1050	agent0	initial_cond	1	-0.000000
exp5875	8.58580947e-29	0.000000	0.000000	discard	cycle 34 u=0.0975	agent0	initial_cond	0	0.000000
exp5876	3.57812612e-17	0.070278	-0.000000	discard	4th branch u_offset=0.36 amp=0.45 phase=1.0 modes=3	manual	memory	0	0.000097
exp5876	8.58580947e-29	0.000000	0.000000	discard	cycle 34 u=0.0975	agent0	initial_cond	1	0.000000
exp5877	8.58580947e-29	0.000000	0.000000	discard	cycle 34 u=0.0975	agent0	initial_cond	0	0.000000
exp5878	5.23962023e-29	0.000000	0.000000	discard	cycle 34 u=0.0975	agent0	initial_cond	0	0.000000
exp5879	5.23962023e-29	0.000000	0.000000	discard	cycle 34 u=0.0975	agent0	initial_cond	1	0.000000
exp5880	5.23962023e-29	0.000000	0.000000	discard	cycle 34 u=0.0975	agent0	initial_cond	0	0.000000
exp5881	4.03266298e-29	0.000000	0.000000	discard	cycle 34 u=0.0975	agent0	initial_cond	0	0.000000
exp5882	4.03266298e-29	0.000000	0.000000	discard	cycle 34 u=0.0975	agent0	initial_cond	1	0.000000
exp5883	4.03266298e-29	0.000000	0.000000	discard	cycle 34 u=0.0975	agent0	initial_cond	0	0.000000
exp5884	4.80015937e-29	0.000000	0.000000	discard	cycle 34 u=0.0975	agent0	initial_cond	0	0.000000
exp5885	4.80015937e-29	0.000000	0.000000	discard	cycle 34 u=0.0975	agent0	initial_cond	0	0.000000
exp5886	4.80015937e-29	0.000000	0.000000	discard	cycle 34 u=0.0975	agent0	initial_cond	0	0.000000
exp5887	2.68824537e-29	0.000000	0.000000	discard	cycle 34 u=0.0980	agent0	initial_cond	1	-0.000000
exp5888	2.68824537e-29	0.000000	0.000000	discard	cycle 34 u=0.0980	agent0	initial_cond	0	-0.000000
exp5889	2.68824537e-29	0.000000	0.000000	discard	cycle 34 u=0.0980	agent0	initial_cond	0	-0.000000
exp5890	6.16758073e-29	0.000000	0.000000	discard	cycle 34 u=0.0980	agent0	initial_cond	1	-0.000000
exp5891	2.01220451e-17	0.070278	-0.000000	discard	4th branch u_offset=0.36 amp=0.55 phase=1.0 modes=3	manual	memory	0	0.000097
exp5892	6.16758073e-29	0.000000	0.000000	discard	cycle 34 u=0.0980	agent0	initial_cond	0	-0.000000
exp5893	6.16758073e-29	0.000000	0.000000	discard	cycle 34 u=0.0980	agent0	initial_cond	0	-0.000000
exp5894	2.01926478e-29	0.000000	0.000000	discard	cycle 34 u=0.0980	agent0	initial_cond	0	0.000000
exp5895	2.01926478e-29	0.000000	0.000000	discard	cycle 34 u=0.0980	agent0	initial_cond	0	0.000000
exp5896	2.01926478e-29	0.000000	0.000000	discard	cycle 34 u=0.0980	agent0	initial_cond	1	0.000000
exp5897	1.30310780e-28	0.000000	0.000000	discard	cycle 34 u=0.0980	agent0	initial_cond	0	-0.000000
exp5898	1.30310780e-28	0.000000	0.000000	discard	cycle 34 u=0.0980	agent0	initial_cond	0	-0.000000
exp5899	1.30310780e-28	0.000000	0.000000	discard	cycle 34 u=0.0980	agent0	initial_cond	1	-0.000000
exp5900	5.45343271e-29	0.000000	0.000000	discard	cycle 34 u=0.0982	agent0	initial_cond	0	-0.000000
exp5901	5.45343271e-29	0.000000	0.000000	discard	cycle 34 u=0.0982	agent0	initial_cond	0	-0.000000
exp5902	5.45343271e-29	0.000000	0.000000	discard	cycle 34 u=0.0982	agent0	initial_cond	0	-0.000000
exp5903	1.23429977e-28	0.000000	0.000000	discard	cycle 34 u=0.0982	agent0	initial_cond	0	0.000000
exp5904	1.23429977e-28	0.000000	0.000000	discard	cycle 34 u=0.0982	agent0	initial_cond	1	0.000000
exp5905	1.23429977e-28	0.000000	0.000000	discard	cycle 34 u=0.0982	agent0	initial_cond	0	0.000000
exp5906	1.88036672e-29	0.000000	0.000000	discard	cycle 34 u=0.0982	agent0	initial_cond	0	0.000000
exp5907	1.88036672e-29	0.000000	0.000000	discard	cycle 34 u=0.0982	agent0	initial_cond	1	0.000000
exp5908	1.88036672e-29	0.000000	0.000000	discard	cycle 34 u=0.0982	agent0	initial_cond	0	0.000000
exp5909	1.91190259e-29	0.000000	-0.000000	discard	cycle 34 u=0.0982	agent0	initial_cond	0	0.000000
exp5910	1.91190259e-29	0.000000	-0.000000	discard	cycle 34 u=0.0982	agent0	initial_cond	0	0.000000
exp5911	1.91190259e-29	0.000000	-0.000000	discard	cycle 34 u=0.0982	agent0	initial_cond	0	0.000000
exp5912	6.13049994e-29	0.000000	0.000000	discard	cycle 34 u=0.0985	agent0	initial_cond	1	0.000000
exp5913	6.13049994e-29	0.000000	0.000000	discard	cycle 34 u=0.0985	agent0	initial_cond	0	0.000000
exp5914	6.13049994e-29	0.000000	0.000000	discard	cycle 34 u=0.0985	agent0	initial_cond	0	0.000000
exp5915	5.49750971e-29	0.000000	0.000000	discard	cycle 34 u=0.0985	agent0	initial_cond	1	0.000000
exp5916	5.49750971e-29	0.000000	0.000000	discard	cycle 34 u=0.0985	agent0	initial_cond	0	0.000000
exp5917	5.49750971e-29	0.000000	0.000000	discard	cycle 34 u=0.0985	agent0	initial_cond	0	0.000000
exp5918	4.15642452e-29	0.000000	0.000000	discard	cycle 34 u=0.0985	agent0	initial_cond	0	0.000000
exp5919	4.15642452e-29	0.000000	0.000000	discard	cycle 34 u=0.0985	agent0	initial_cond	0	0.000000
exp5920	4.15642452e-29	0.000000	0.000000	discard	cycle 34 u=0.0985	agent0	initial_cond	1	0.000000
exp5921	2.19292611e-29	0.000000	0.000000	discard	cycle 34 u=0.0985	agent0	initial_cond	0	-0.000000
exp5922	2.19292611e-29	0.000000	0.000000	discard	cycle 34 u=0.0985	agent0	initial_cond	0	-0.000000
exp5923	2.19292611e-29	0.000000	0.000000	discard	cycle 34 u=0.0985	agent0	initial_cond	1	-0.000000
exp5924	4.22491788e-29	0.000000	0.000000	discard	cycle 34 u=0.0990	agent0	initial_cond	0	-0.000000
exp5925	4.22491788e-29	0.000000	0.000000	discard	cycle 34 u=0.0990	agent0	initial_cond	0	-0.000000
exp5926	4.22491788e-29	0.000000	0.000000	discard	cycle 34 u=0.0990	agent0	initial_cond	0	-0.000000
exp5927	3.22245147e-29	0.000000	0.000000	discard	cycle 34 u=0.0990	agent0	initial_cond	0	0.000000
exp5928	3.22245147e-29	0.000000	0.000000	discard	cycle 34 u=0.0990	agent0	initial_cond	1	0.000000
exp5929	3.22245147e-29	0.000000	0.000000	discard	cycle 34 u=0.0990	agent0	initial_cond	0	0.000000
exp5930	4.50941488e-29	0.000000	-0.000000	discard	cycle 34 u=0.0990	agent0	initial_cond	0	0.000000
exp5931	4.50941488e-29	0.000000	-0.000000	discard	cycle 34 u=0.0990	agent0	initial_cond	1	0.000000
exp5932	4.50941488e-29	0.000000	-0.000000	discard	cycle 34 u=0.0990	agent0	initial_cond	0	0.000000
exp5933	4.88330883e-29	0.000000	-0.000000	discard	cycle 34 u=0.0990	agent0	initial_cond	0	0.000000
exp5934	4.88330883e-29	0.000000	-0.000000	discard	cycle 34 u=0.0990	agent0	initial_cond	1	0.000000
exp5935	4.88330883e-29	0.000000	-0.000000	discard	cycle 34 u=0.0990	agent0	initial_cond	0	0.000000
exp5936	5.74085541e-29	0.000000	-0.000000	discard	cycle 34 u=0.0995	agent0	initial_cond	1	0.000000
exp5937	5.74085541e-29	0.000000	-0.000000	discard	cycle 34 u=0.0995	agent0	initial_cond	0	0.000000
exp5938	5.74085541e-29	0.000000	-0.000000	discard	cycle 34 u=0.0995	agent0	initial_cond	0	0.000000
exp5939	1.54984578e-28	0.000000	0.000000	discard	cycle 34 u=0.0995	agent0	initial_cond	1	-0.000000
exp5940	1.54984578e-28	0.000000	0.000000	discard	cycle 34 u=0.0995	agent0	initial_cond	0	-0.000000
exp5941	1.54984578e-28	0.000000	0.000000	discard	cycle 34 u=0.0995	agent0	initial_cond	0	-0.000000
exp5942	1.60328418e-29	0.000000	-0.000000	discard	cycle 34 u=0.0995	agent0	initial_cond	1	-0.000000
exp5943	1.60328418e-29	0.000000	-0.000000	discard	cycle 34 u=0.0995	agent0	initial_cond	0	-0.000000
exp5944	1.60328418e-29	0.000000	-0.000000	discard	cycle 34 u=0.0995	agent0	initial_cond	0	-0.000000
exp5945	7.34590618e-29	0.000000	0.000000	discard	cycle 34 u=0.0995	agent0	initial_cond	0	0.000000
exp5946	7.34590618e-29	0.000000	0.000000	discard	cycle 34 u=0.0995	agent0	initial_cond	0	0.000000
exp5947	7.34590618e-29	0.000000	0.000000	discard	cycle 34 u=0.0995	agent0	initial_cond	1	0.000000
exp5948	4.46546993e-29	0.000000	0.000000	discard	cycle 34 u=0.1000	agent0	initial_cond	0	-0.000000
exp5949	4.46546993e-29	0.000000	0.000000	discard	cycle 34 u=0.1000	agent0	initial_cond	0	-0.000000
exp5950	4.46546993e-29	0.000000	0.000000	discard	cycle 34 u=0.1000	agent0	initial_cond	1	-0.000000
exp5951	4.08106752e-29	0.000000	0.000000	discard	cycle 34 u=0.1000	agent0	initial_cond	0	-0.000000
exp5952	4.08106752e-29	0.000000	0.000000	discard	cycle 34 u=0.1000	agent0	initial_cond	0	-0.000000
exp5953	4.08106752e-29	0.000000	0.000000	discard	cycle 34 u=0.1000	agent0	initial_cond	0	-0.000000
exp5954	4.58623706e-29	0.000000	0.000000	discard	cycle 34 u=0.1000	agent0	initial_cond	0	-0.000000
exp5955	4.58623706e-29	0.000000	0.000000	discard	cycle 34 u=0.1000	agent0	initial_cond	1	-0.000000
exp5956	4.58623706e-29	0.000000	0.000000	discard	cycle 34 u=0.1000	agent0	initial_cond	0	-0.000000
exp5957	4.39794337e-29	0.000000	0.000000	discard	cycle 34 u=0.1000	agent0	initial_cond	0	-0.000000
exp5958	4.39794337e-29	0.000000	0.000000	discard	cycle 34 u=0.1000	agent0	initial_cond	1	-0.000000
exp5959	4.39794337e-29	0.000000	0.000000	discard	cycle 34 u=0.1000	agent0	initial_cond	0	-0.000000
exp5960	1.36727475e-28	0.000000	0.000000	discard	cycle 34 u=0.1050	agent0	initial_cond	0	-0.000000
exp5961	1.36727475e-28	0.000000	0.000000	discard	cycle 34 u=0.1050	agent0	initial_cond	0	-0.000000
exp5962	1.36727475e-28	0.000000	0.000000	discard	cycle 34 u=0.1050	agent0	initial_cond	0	-0.000000
exp5963	6.14461376e-29	0.000000	0.000000	discard	cycle 34 u=0.1050	agent0	initial_cond	1	-0.000000
exp5964	6.14461376e-29	0.000000	0.000000	discard	cycle 34 u=0.1050	agent0	initial_cond	0	-0.000000
exp5965	6.14461376e-29	0.000000	0.000000	discard	cycle 34 u=0.1050	agent0	initial_cond	0	-0.000000
exp5966	1.75906666e-28	0.000000	0.000000	discard	cycle 34 u=0.1050	agent0	initial_cond	1	-0.000000
exp5967	1.75906666e-28	0.000000	0.000000	discard	cycle 34 u=0.1050	agent0	initial_cond	0	-0.000000
exp5968	1.75906666e-28	0.000000	0.000000	discard	cycle 34 u=0.1050	agent0	initial_cond	0	-0.000000
exp5969	1.11257917e-28	0.000000	0.000000	discard	cycle 34 u=0.1050	agent0	initial_cond	0	-0.000000
exp5970	1.11257917e-28	0.000000	0.000000	discard	cycle 34 u=0.1050	agent0	initial_cond	0	-0.000000
exp5971	1.11257917e-28	0.000000	0.000000	discard	cycle 34 u=0.1050	agent0	initial_cond	1	-0.000000
exp5972	8.58580947e-29	0.000000	0.000000	discard	cycle 35 u=0.0975	agent0	initial_cond	0	0.000000
exp5973	8.58580947e-29	0.000000	0.000000	discard	cycle 35 u=0.0975	agent0	initial_cond	0	0.000000
exp5974	8.58580947e-29	0.000000	0.000000	discard	cycle 35 u=0.0975	agent0	initial_cond	1	0.000000
exp5975	5.23962023e-29	0.000000	0.000000	discard	cycle 35 u=0.0975	agent0	initial_cond	0	0.000000
exp5976	5.23962023e-29	0.000000	0.000000	discard	cycle 35 u=0.0975	agent0	initial_cond	0	0.000000
exp5977	5.23962023e-29	0.000000	0.000000	discard	cycle 35 u=0.0975	agent0	initial_cond	1	0.000000
exp5978	4.03266298e-29	0.000000	0.000000	discard	cycle 35 u=0.0975	agent0	initial_cond	0	0.000000
exp5979	4.03266298e-29	0.000000	0.000000	discard	cycle 35 u=0.0975	agent0	initial_cond	0	0.000000
exp5980	4.03266298e-29	0.000000	0.000000	discard	cycle 35 u=0.0975	agent0	initial_cond	0	0.000000
exp5981	4.80015937e-29	0.000000	0.000000	discard	cycle 35 u=0.0975	agent0	initial_cond	0	0.000000
exp5982	4.80015937e-29	0.000000	0.000000	discard	cycle 35 u=0.0975	agent0	initial_cond	1	0.000000
exp5983	4.80015937e-29	0.000000	0.000000	discard	cycle 35 u=0.0975	agent0	initial_cond	0	0.000000
exp5984	2.68824537e-29	0.000000	0.000000	discard	cycle 35 u=0.0980	agent0	initial_cond	0	-0.000000
exp5985	2.68824537e-29	0.000000	0.000000	discard	cycle 35 u=0.0980	agent0	initial_cond	1	-0.000000
exp5986	2.68824537e-29	0.000000	0.000000	discard	cycle 35 u=0.0980	agent0	initial_cond	0	-0.000000
exp5987	6.16758073e-29	0.000000	0.000000	discard	cycle 35 u=0.0980	agent0	initial_cond	0	-0.000000
exp5988	6.16758073e-29	0.000000	0.000000	discard	cycle 35 u=0.0980	agent0	initial_cond	0	-0.000000
exp5989	6.16758073e-29	0.000000	0.000000	discard	cycle 35 u=0.0980	agent0	initial_cond	0	-0.000000
exp5990	2.01926478e-29	0.000000	0.000000	discard	cycle 35 u=0.0980	agent0	initial_cond	1	0.000000
exp5991	2.01926478e-29	0.000000	0.000000	discard	cycle 35 u=0.0980	agent0	initial_cond	0	0.000000
exp5992	2.01926478e-29	0.000000	0.000000	discard	cycle 35 u=0.0980	agent0	initial_cond	0	0.000000
exp5993	1.30310780e-28	0.000000	0.000000	discard	cycle 35 u=0.0980	agent0	initial_cond	1	-0.000000
exp5994	1.30310780e-28	0.000000	0.000000	discard	cycle 35 u=0.0980	agent0	initial_cond	0	-0.000000
exp5995	1.30310780e-28	0.000000	0.000000	discard	cycle 35 u=0.0980	agent0	initial_cond	0	-0.000000
exp5996	5.45343271e-29	0.000000	0.000000	discard	cycle 35 u=0.0982	agent0	initial_cond	0	-0.000000
exp5997	5.45343271e-29	0.000000	0.000000	discard	cycle 35 u=0.0982	agent0	initial_cond	0	-0.000000
exp5998	5.45343271e-29	0.000000	0.000000	discard	cycle 35 u=0.0982	agent0	initial_cond	1	-0.000000
exp5999	1.23429977e-28	0.000000	0.000000	discard	cycle 35 u=0.0982	agent0	initial_cond	0	0.000000
exp6000	1.23429977e-28	0.000000	0.000000	discard	cycle 35 u=0.0982	agent0	initial_cond	0	0.000000
exp6001	5.31634415e-17	0.070278	-0.000000	discard	4th branch u_offset=0.355 amp=0.5 phase=1.0 modes=3	manual	memory	0	0.000097
exp6002	1.23429977e-28	0.000000	0.000000	discard	cycle 35 u=0.0982	agent0	initial_cond	1	0.000000
exp6003	1.88036672e-29	0.000000	0.000000	discard	cycle 35 u=0.0982	agent0	initial_cond	0	0.000000
exp6004	1.88036672e-29	0.000000	0.000000	discard	cycle 35 u=0.0982	agent0	initial_cond	0	0.000000
