exp_id	residual	solution_norm	solution_mean	status	description	agent	design	elapsed_s	solution_energy
exp4979	5.49750971e-29	0.000000	0.000000	discard	cycle 26 u=0.0985	agent0	initial_cond	0	0.000000
exp4980	5.49750971e-29	0.000000	0.000000	discard	cycle 26 u=0.0985	agent0	initial_cond	0	0.000000
exp4981	4.15642452e-29	0.000000	0.000000	discard	cycle 26 u=0.0985	agent0	initial_cond	0	0.000000
exp4982	4.15642452e-29	0.000000	0.000000	discard	cycle 26 u=0.0985	agent0	initial_cond	1	0.000000
exp4983	4.15642452e-29	0.000000	0.000000	discard	cycle 26 u=0.0985	agent0	initial_cond	0	0.000000
exp4984	2.19292611e-29	0.000000	0.000000	discard	cycle 26 u=0.0985	agent0	initial_cond	0	-0.000000
exp4985	2.19292611e-29	0.000000	0.000000	discard	cycle 26 u=0.0985	agent0	initial_cond	1	-0.000000
exp4986	2.19292611e-29	0.000000	0.000000	discard	cycle 26 u=0.0985	agent0	initial_cond	0	-0.000000
exp4987	4.22491788e-29	0.000000	0.000000	discard	cycle 26 u=0.0990	agent0	initial_cond	0	-0.000000
exp4988	4.22491788e-29	0.000000	0.000000	discard	cycle 26 u=0.0990	agent0	initial_cond	1	-0.000000
exp4989	4.22491788e-29	0.000000	0.000000	discard	cycle 26 u=0.0990	agent0	initial_cond	0	-0.000000
exp4990	3.22245147e-29	0.000000	0.000000	discard	cycle 26 u=0.0990	agent0	initial_cond	0	0.000000
exp4991	3.22245147e-29	0.000000	0.000000	discard	cycle 26 u=0.0990	agent0	initial_cond	0	0.000000
exp4992	3.22245147e-29	0.000000	0.000000	discard	cycle 26 u=0.0990	agent0	initial_cond	0	0.000000
exp4993	4.50941488e-29	0.000000	-0.000000	discard	cycle 26 u=0.0990	agent0	initial_cond	1	0.000000
exp4994	4.50941488e-29	0.000000	-0.000000	discard	cycle 26 u=0.0990	agent0	initial_cond	0	0.000000
exp4995	4.50941488e-29	0.000000	-0.000000	discard	cycle 26 u=0.0990	agent0	initial_cond	0	0.000000
exp4996	4.88330883e-29	0.000000	-0.000000	discard	cycle 26 u=0.0990	agent0	initial_cond	1	0.000000
exp4997	4.88330883e-29	0.000000	-0.000000	discard	cycle 26 u=0.0990	agent0	initial_cond	0	0.000000
exp4998	4.88330883e-29	0.000000	-0.000000	discard	cycle 26 u=0.0990	agent0	initial_cond	0	0.000000
exp4999	5.74085541e-29	0.000000	-0.000000	discard	cycle 26 u=0.0995	agent0	initial_cond	0	0.000000
exp5000	5.74085541e-29	0.000000	-0.000000	discard	cycle 26 u=0.0995	agent0	initial_cond	0	0.000000
exp5001	5.74085541e-29	0.000000	-0.000000	discard	cycle 26 u=0.0995	agent0	initial_cond	1	0.000000
exp5002	1.54984578e-28	0.000000	0.000000	discard	cycle 26 u=0.0995	agent0	initial_cond	0	-0.000000
exp5003	1.54984578e-28	0.000000	0.000000	discard	cycle 26 u=0.0995	agent0	initial_cond	0	-0.000000
exp5004	1.54984578e-28	0.000000	0.000000	discard	cycle 26 u=0.0995	agent0	initial_cond	1	-0.000000
exp5005	1.60328418e-29	0.000000	-0.000000	discard	cycle 26 u=0.0995	agent0	initial_cond	0	-0.000000
exp5006	1.60328418e-29	0.000000	-0.000000	discard	cycle 26 u=0.0995	agent0	initial_cond	0	-0.000000
exp5007	1.60328418e-29	0.000000	-0.000000	discard	cycle 26 u=0.0995	agent0	initial_cond	1	-0.000000
exp5008	7.34590618e-29	0.000000	0.000000	discard	cycle 26 u=0.0995	agent0	initial_cond	0	0.000000
exp5009	7.34590618e-29	0.000000	0.000000	discard	cycle 26 u=0.0995	agent0	initial_cond	0	0.000000
exp5010	7.34590618e-29	0.000000	0.000000	discard	cycle 26 u=0.0995	agent0	initial_cond	0	0.000000
exp5011	4.46546993e-29	0.000000	0.000000	discard	cycle 26 u=0.1000	agent0	initial_cond	0	-0.000000
exp5012	4.46546993e-29	0.000000	0.000000	discard	cycle 26 u=0.1000	agent0	initial_cond	1	-0.000000
exp5013	4.46546993e-29	0.000000	0.000000	discard	cycle 26 u=0.1000	agent0	initial_cond	0	-0.000000
exp5014	4.08106752e-29	0.000000	0.000000	discard	cycle 26 u=0.1000	agent0	initial_cond	0	-0.000000
exp5015	4.08106752e-29	0.000000	0.000000	discard	cycle 26 u=0.1000	agent0	initial_cond	1	-0.000000
exp5016	4.08106752e-29	0.000000	0.000000	discard	cycle 26 u=0.1000	agent0	initial_cond	0	-0.000000
exp5017	4.58623706e-29	0.000000	0.000000	discard	Fourier 2 phase=0.0	agent0	perturbation	0	-0.000000
exp5017	4.58623706e-29	0.000000	0.000000	discard	cycle 26 u=0.1000	agent0	initial_cond	0	-0.000000
exp5018	4.58623706e-29	0.000000	0.000000	discard	Fourier 2 phase=0.5	agent0	perturbation	1	-0.000000
exp5018	4.58623706e-29	0.000000	0.000000	discard	cycle 26 u=0.1000	agent0	initial_cond	0	-0.000000
exp5019	5.77222557e-15	1.001298	1.000025	discard	cycle 26 u=0.1000	agent0	initial_cond	0	-1.520921
exp5019	5.77222557e-15	1.001298	1.000025	discard	Fourier 2 phase=1.0	agent0	perturbation	0	-1.520921
exp5020	2.00148302e-16	1.001298	1.000025	discard	cycle 26 u=0.1000	agent0	initial_cond	1	-1.520921
exp5021	2.00148302e-16	1.001298	1.000025	discard	Fourier 2 phase=1.5	agent0	perturbation	1	-1.520921
exp5022	2.00148302e-16	1.001298	1.000025	discard	cycle 26 u=0.1000	agent0	initial_cond	0	-1.520921
exp5023	4.39794337e-29	0.000000	0.000000	discard	Fourier 2 phase=2.0	agent0	perturbation	0	-0.000000
exp5024	2.75669182e-14	1.001298	1.000025	discard	cycle 26 u=0.1000	agent0	initial_cond	0	-1.520921
exp5025	1.36727475e-28	0.000000	0.000000	discard	Fourier 2 phase=2.5	agent0	perturbation	0	-0.000000
exp5026	2.00148302e-16	1.001298	1.000025	discard	cycle 26 u=0.1050	agent0	initial_cond	1	-1.520921
exp5027	1.36727475e-28	0.000000	0.000000	discard	Fourier 2 phase=3.0	agent0	perturbation	0	-0.000000
exp5028	2.00148302e-16	1.001298	1.000025	discard	cycle 26 u=0.1050	agent0	initial_cond	0	-1.520921
exp5029	1.36727475e-28	0.000000	0.000000	discard	Fourier 2 phase=3.5	agent0	perturbation	0	-0.000000
exp5030	1.36727475e-28	0.000000	0.000000	discard	cycle 26 u=0.1050	agent0	initial_cond	0	-0.000000
exp5031	6.14461376e-29	0.000000	0.000000	discard	Fourier 2 phase=4.0	agent0	perturbation	1	-0.000000
exp5032	6.14461376e-29	0.000000	0.000000	discard	cycle 26 u=0.1050	agent0	initial_cond	1	-0.000000
exp5033	6.14461376e-29	0.000000	0.000000	discard	Fourier 2 phase=4.5	agent0	perturbation	0	-0.000000
exp5033	6.14461376e-29	0.000000	0.000000	discard	cycle 26 u=0.1050	agent0	initial_cond	0	-0.000000
exp5034	1.26340277e-12	1.001298	1.000025	discard	cycle 26 u=0.1050	agent0	initial_cond	1	-1.520921
exp5034	1.26340277e-12	1.001298	1.000025	discard	Fourier 2 phase=5.0	agent0	perturbation	1	-1.520921
exp5035	4.59436527e-16	1.001298	1.000025	discard	cycle 26 u=0.1050	agent0	initial_cond	0	-1.520921
exp5035	4.59436527e-16	1.001298	1.000025	discard	Fourier 2 phase=5.5	agent0	perturbation	0	-1.520921
exp5036	2.85761141e-16	1.001298	1.000025	discard	cycle 26 u=0.1050	agent0	initial_cond	0	-1.520921
exp5037	2.85761141e-16	1.001298	1.000025	discard	Fourier 2 phase=6.0	agent0	perturbation	0	-1.520921
exp5038	1.75906666e-28	0.000000	0.000000	discard	cycle 26 u=0.1050	agent0	initial_cond	1	-0.000000
exp5039	1.11257917e-28	0.000000	0.000000	discard	cycle 26 u=0.1050	agent0	initial_cond	0	-0.000000
exp5040	1.11257917e-28	0.000000	0.000000	discard	cycle 26 u=0.1050	agent0	initial_cond	0	-0.000000
exp5041	1.11257917e-28	0.000000	0.000000	discard	cycle 26 u=0.1050	agent0	initial_cond	1	-0.000000
exp5042	8.58580947e-29	0.000000	0.000000	discard	cycle 27 u=0.0975	agent0	initial_cond	0	0.000000
exp5043	8.58580947e-29	0.000000	0.000000	discard	cycle 27 u=0.0975	agent0	initial_cond	0	0.000000
exp5044	8.58580947e-29	0.000000	0.000000	discard	cycle 27 u=0.0975	agent0	initial_cond	0	0.000000
exp5045	5.23962023e-29	0.000000	0.000000	discard	cycle 27 u=0.0975	agent0	initial_cond	0	0.000000
exp5046	5.23962023e-29	0.000000	0.000000	discard	cycle 27 u=0.0975	agent0	initial_cond	1	0.000000
exp5047	5.23962023e-29	0.000000	0.000000	discard	cycle 27 u=0.0975	agent0	initial_cond	0	0.000000
exp5048	4.03266298e-29	0.000000	0.000000	discard	cycle 27 u=0.0975	agent0	initial_cond	0	0.000000
exp5049	4.03266298e-29	0.000000	0.000000	discard	cycle 27 u=0.0975	agent0	initial_cond	1	0.000000
exp5050	4.03266298e-29	0.000000	0.000000	discard	cycle 27 u=0.0975	agent0	initial_cond	0	0.000000
exp5051	4.80015937e-29	0.000000	0.000000	discard	cycle 27 u=0.0975	agent0	initial_cond	0	0.000000
exp5052	4.80015937e-29	0.000000	0.000000	discard	cycle 27 u=0.0975	agent0	initial_cond	0	0.000000
exp5053	4.80015937e-29	0.000000	0.000000	discard	cycle 27 u=0.0975	agent0	initial_cond	0	0.000000
exp5054	2.68824537e-29	0.000000	0.000000	discard	cycle 27 u=0.0980	agent0	initial_cond	1	-0.000000
exp5055	2.68824537e-29	0.000000	0.000000	discard	cycle 27 u=0.0980	agent0	initial_cond	0	-0.000000
exp5056	2.68824537e-29	0.000000	0.000000	discard	cycle 27 u=0.0980	agent0	initial_cond	0	-0.000000
exp5057	6.16758073e-29	0.000000	0.000000	discard	cycle 27 u=0.0980	agent0	initial_cond	1	-0.000000
exp5058	6.16758073e-29	0.000000	0.000000	discard	cycle 27 u=0.0980	agent0	initial_cond	0	-0.000000
exp5059	6.16758073e-29	0.000000	0.000000	discard	cycle 27 u=0.0980	agent0	initial_cond	0	-0.000000
exp5060	2.01926478e-29	0.000000	0.000000	discard	cycle 27 u=0.0980	agent0	initial_cond	1	0.000000
exp5061	2.01926478e-29	0.000000	0.000000	discard	cycle 27 u=0.0980	agent0	initial_cond	0	0.000000
exp5062	2.01926478e-29	0.000000	0.000000	discard	cycle 27 u=0.0980	agent0	initial_cond	0	0.000000
exp5063	1.30310780e-28	0.000000	0.000000	discard	cycle 27 u=0.0980	agent0	initial_cond	0	-0.000000
exp5064	1.09482697e-16	0.229470	-0.000000	discard	ultra_amplitude amp=1.0 phase=Ď€/2	agent1	perturbation	0	0.018178
exp5065	1.30310780e-28	0.000000	0.000000	discard	cycle 27 u=0.0980	agent0	initial_cond	0	-0.000000
exp5066	3.41991191e-16	0.272325	0.000000	discard	ultra_amplitude amp=1.2 phase=Ď€/2	agent1	perturbation	0	0.036387
exp5067	1.34360442e-12	1.002503	-1.000218	discard	cycle 27 u=0.0980	agent0	initial_cond	1	-1.523848
exp5068	1.34360442e-12	1.002503	-1.000218	discard	scipy neg verify 1	agent0	solver_param	1	-1.523848
exp5069	2.53215893e-16	0.313749	0.000000	discard	ultra_amplitude amp=1.4 phase=Ď€/2	agent1	perturbation	0	0.064313
exp5070	5.45343271e-29	0.000000	0.000000	discard	cycle 27 u=0.0982	agent0	initial_cond	0	-0.000000
exp5071	5.45343271e-29	0.000000	0.000000	discard	scipy neg verify 2	agent0	solver_param	0	-0.000000
exp5072	1.90679534e-16	0.353672	0.000000	discard	ultra_amplitude amp=1.6 phase=Ď€/2	agent1	perturbation	0	0.103820
exp5073	5.45343271e-29	0.000000	0.000000	discard	cycle 27 u=0.0982	agent0	initial_cond	0	-0.000000
exp5074	5.45343271e-29	0.000000	0.000000	discard	scipy neg verify 3	agent0	solver_param	1	-0.000000
exp5075	2.75452939e-16	0.392075	-0.000000	discard	ultra_amplitude amp=1.8 phase=Ď€/2	agent1	perturbation	1	0.156437
exp5076	5.45343271e-29	0.000000	0.000000	discard	cycle 27 u=0.0982	agent0	initial_cond	0	-0.000000
exp5077	5.45343271e-29	0.000000	0.000000	discard	scipy neg verify 4	agent0	solver_param	0	-0.000000
exp5078	1.76752849e-16	0.428980	-0.000000	discard	ultra_amplitude amp=2.0 phase=Ď€/2	agent1	perturbation	0	0.223348
exp5079	1.23429977e-28	0.000000	0.000000	discard	cycle 27 u=0.0982	agent0	initial_cond	0	0.000000
exp5080	1.23429977e-28	0.000000	0.000000	discard	scipy neg verify 5	agent0	solver_param	0	0.000000
exp5081	2.54994464e-16	0.464436	0.000000	discard	ultra_amplitude amp=2.2 phase=Ď€/2	agent1	perturbation	0	0.305420
exp5082	1.23429977e-28	0.000000	0.000000	discard	cycle 27 u=0.0982	agent0	initial_cond	1	0.000000
exp5083	3.20551413e-16	0.498509	0.000000	discard	ultra_amplitude amp=2.4 phase=Ď€/2	agent1	perturbation	1	0.403246
exp5084	1.23429977e-28	0.000000	0.000000	discard	cycle 27 u=0.0982	agent0	initial_cond	0	0.000000
exp5085	4.78560012e-16	0.531280	-0.000000	discard	ultra_amplitude amp=2.6 phase=Ď€/2	agent1	perturbation	0	0.517205
exp5086	1.88036672e-29	0.000000	0.000000	discard	cycle 27 u=0.0982	agent0	initial_cond	0	0.000000
exp5087	2.62966404e-16	0.562830	-0.000000	discard	ultra_amplitude amp=2.8 phase=Ď€/2	agent1	perturbation	1	0.647510
exp5088	1.88036672e-29	0.000000	0.000000	discard	cycle 27 u=0.0982	agent0	initial_cond	1	0.000000
exp5089	2.41467707e-16	0.593242	-0.000000	discard	ultra_amplitude amp=3.0 phase=Ď€/2	agent1	perturbation	0	0.794248
exp5090	1.88036672e-29	0.000000	0.000000	discard	cycle 27 u=0.0982	agent0	initial_cond	0	0.000000
exp5091	0.00000000e+00	0.998999	1.000000	discard	positive_branch_manifold u=1.44 phase=0.0 amp=0.0	agent1	branch_search	0	-1.567655
exp5092	1.91190259e-29	0.000000	-0.000000	discard	cycle 27 u=0.0982	agent0	initial_cond	0	0.000000
exp5093	crash	0	0	crash	positive_branch_manifold u=1.44 phase=0.0 amp=0.1	agent1	branch_search	1	0
exp5094	1.91190259e-29	0.000000	-0.000000	discard	cycle 27 u=0.0982	agent0	initial_cond	0	0.000000
exp5095	2.75466223e-16	0.999975	1.000004	discard	positive_branch_manifold u=1.44 phase=0.0 amp=0.2	agent1	branch_search	0	-1.546805
exp5096	1.91190259e-29	0.000000	-0.000000	discard	cycle 27 u=0.0982	agent0	initial_cond	0	0.000000
exp5097	1.96261557e-16	1.001296	1.000019	discard	positive_branch_manifold u=1.44 phase=0.0 amp=0.3	agent1	branch_search	0	-1.520844
exp5098	6.13049994e-29	0.000000	0.000000	discard	cycle 27 u=0.0985	agent0	initial_cond	1	0.000000
exp5099	0.00000000e+00	0.998999	1.000000	discard	positive_branch_manifold u=1.44 phase=0.5 amp=0.0	agent1	branch_search	1	-1.567655
exp5100	6.13049994e-29	0.000000	0.000000	discard	cycle 27 u=0.0985	agent0	initial_cond	0	0.000000
exp5101	crash	0	0	crash	positive_branch_manifold u=1.44 phase=0.5 amp=0.1	agent1	branch_search	0	0
exp5102	6.13049994e-29	0.000000	0.000000	discard	cycle 27 u=0.0985	agent0	initial_cond	0	0.000000
exp5103	3.00863292e-16	0.999975	1.000004	discard	positive_branch_manifold u=1.44 phase=0.5 amp=0.2	agent1	branch_search	0	-1.546805
exp5104	5.49750971e-29	0.000000	0.000000	discard	cycle 27 u=0.0985	agent0	initial_cond	1	0.000000
exp5105	5.02914270e-16	1.001296	1.000019	discard	positive_branch_manifold u=1.44 phase=0.5 amp=0.3	agent1	branch_search	0	-1.520844
exp5106	5.49750971e-29	0.000000	0.000000	discard	cycle 27 u=0.0985	agent0	initial_cond	0	0.000000
exp5107	0.00000000e+00	0.998999	1.000000	discard	positive_branch_manifold u=1.44 phase=1.0 amp=0.0	agent1	branch_search	0	-1.567655
exp5108	5.49750971e-29	0.000000	0.000000	discard	cycle 27 u=0.0985	agent0	initial_cond	0	0.000000
exp5109	crash	0	0	crash	positive_branch_manifold u=1.44 phase=1.0 amp=0.1	agent1	branch_search	1	0
exp5110	4.15642452e-29	0.000000	0.000000	discard	cycle 27 u=0.0985	agent0	initial_cond	0	0.000000
exp5111	2.75466223e-16	0.999975	1.000004	discard	positive_branch_manifold u=1.44 phase=1.0 amp=0.2	agent1	branch_search	0	-1.546805
exp5112	4.15642452e-29	0.000000	0.000000	discard	cycle 27 u=0.0985	agent0	initial_cond	0	0.000000
exp5113	3.84592606e-16	1.001296	1.000019	discard	positive_branch_manifold u=1.44 phase=1.0 amp=0.3	agent1	branch_search	0	-1.520844
exp5114	4.15642452e-29	0.000000	0.000000	discard	cycle 27 u=0.0985	agent0	initial_cond	1	0.000000
exp5115	0.00000000e+00	0.998999	1.000000	discard	positive_branch_manifold u=1.44 phase=1.5 amp=0.0	agent1	branch_search	1	-1.567655
exp5116	2.19292611e-29	0.000000	0.000000	discard	cycle 27 u=0.0985	agent0	initial_cond	0	-0.000000
exp5117	crash	0	0	crash	positive_branch_manifold u=1.44 phase=1.5 amp=0.1	agent1	branch_search	0	0
exp5118	2.19292611e-29	0.000000	0.000000	discard	cycle 27 u=0.0985	agent0	initial_cond	0	-0.000000
exp5119	2.75466223e-16	0.999975	1.000004	discard	positive_branch_manifold u=1.44 phase=1.5 amp=0.2	agent1	branch_search	0	-1.546805
exp5120	2.19292611e-29	0.000000	0.000000	discard	cycle 27 u=0.0985	agent0	initial_cond	1	-0.000000
exp5121	3.66121206e-16	1.001296	1.000019	discard	positive_branch_manifold u=1.44 phase=1.5 amp=0.3	agent1	branch_search	0	-1.520844
exp5122	4.22491788e-29	0.000000	0.000000	discard	cycle 27 u=0.0990	agent0	initial_cond	0	-0.000000
exp5123	0.00000000e+00	0.998999	1.000000	discard	positive_branch_manifold u=1.44 phase=2.0 amp=0.0	agent1	branch_search	0	-1.567655
exp5124	4.22491788e-29	0.000000	0.000000	discard	cycle 27 u=0.0990	agent0	initial_cond	0	-0.000000
exp5125	crash	0	0	crash	positive_branch_manifold u=1.44 phase=2.0 amp=0.1	agent1	branch_search	1	0
exp5126	4.22491788e-29	0.000000	0.000000	discard	cycle 27 u=0.0990	agent0	initial_cond	0	-0.000000
exp5127	crash	0	0	crash	positive_branch_manifold u=1.44 phase=2.0 amp=0.2	agent1	branch_search	0	0
exp5128	3.22245147e-29	0.000000	0.000000	discard	cycle 27 u=0.0990	agent0	initial_cond	0	0.000000
exp5129	3.84592606e-16	1.001296	1.000019	discard	positive_branch_manifold u=1.44 phase=2.0 amp=0.3	agent1	branch_search	0	-1.520844
exp5130	3.22245147e-29	0.000000	0.000000	discard	cycle 27 u=0.0990	agent0	initial_cond	1	0.000000
exp5131	2.51050332e-26	0.000000	-0.000000	discard	phase_singularity phase=0.0	agent1	branch_search	1	0.000000
exp5132	3.22245147e-29	0.000000	0.000000	discard	cycle 27 u=0.0990	agent0	initial_cond	0	0.000000
exp5133	7.61970838e-17	0.070535	0.000000	discard	phase_singularity phase=1.5	agent1	branch_search	0	0.000099
exp5134	4.50941488e-29	0.000000	-0.000000	discard	cycle 27 u=0.0990	agent0	initial_cond	0	0.000000
exp5135	2.36486539e-26	0.000000	0.000000	discard	phase_singularity phase=3.14159	agent1	branch_search	0	0.000000
exp5136	4.50941488e-29	0.000000	-0.000000	discard	cycle 27 u=0.0990	agent0	initial_cond	1	0.000000
exp5137	2.32283877e-17	0.070535	-0.000000	discard	phase_singularity phase=4.71239	agent1	branch_search	0	0.000099
exp5138	4.50941488e-29	0.000000	-0.000000	discard	cycle 27 u=0.0990	agent0	initial_cond	0	0.000000
exp5139	1.38860177e-26	0.000000	-0.000000	discard	phase_singularity phase=6.28318	agent1	branch_search	0	0.000000
exp5140	4.88330883e-29	0.000000	-0.000000	discard	cycle 27 u=0.0990	agent0	initial_cond	0	0.000000
exp5141	4.88330883e-29	0.000000	-0.000000	discard	cycle 27 u=0.0990	agent0	initial_cond	0	0.000000
exp5142	4.88330883e-29	0.000000	-0.000000	discard	cycle 27 u=0.0990	agent0	initial_cond	0	0.000000
exp5143	5.74085541e-29	0.000000	-0.000000	discard	cycle 27 u=0.0995	agent0	initial_cond	1	0.000000
exp5144	5.74085541e-29	0.000000	-0.000000	discard	cycle 27 u=0.0995	agent0	initial_cond	0	0.000000
exp5145	5.74085541e-29	0.000000	-0.000000	discard	cycle 27 u=0.0995	agent0	initial_cond	0	0.000000
exp5146	1.54984578e-28	0.000000	0.000000	discard	cycle 27 u=0.0995	agent0	initial_cond	1	-0.000000
exp5147	1.54984578e-28	0.000000	0.000000	discard	cycle 27 u=0.0995	agent0	initial_cond	0	-0.000000
exp5148	1.54984578e-28	0.000000	0.000000	discard	cycle 27 u=0.0995	agent0	initial_cond	0	-0.000000
exp5149	1.60328418e-29	0.000000	-0.000000	discard	cycle 27 u=0.0995	agent0	initial_cond	1	-0.000000
exp5150	1.60328418e-29	0.000000	-0.000000	discard	cycle 27 u=0.0995	agent0	initial_cond	0	-0.000000
exp5151	1.60328418e-29	0.000000	-0.000000	discard	cycle 27 u=0.0995	agent0	initial_cond	0	-0.000000
exp5152	7.34590618e-29	0.000000	0.000000	discard	cycle 27 u=0.0995	agent0	initial_cond	0	0.000000
exp5153	7.34590618e-29	0.000000	0.000000	discard	cycle 27 u=0.0995	agent0	initial_cond	0	0.000000
exp5154	7.34590618e-29	0.000000	0.000000	discard	cycle 27 u=0.0995	agent0	initial_cond	1	0.000000
exp5155	4.46546993e-29	0.000000	0.000000	discard	cycle 27 u=0.1000	agent0	initial_cond	0	-0.000000
exp5156	4.42586856e-16	1.001296	-1.000019	discard	cycle 27 u=0.1000	agent0	initial_cond	0	-1.520844
exp5157	4.42586856e-16	1.001296	-1.000019	discard	Fourier 3 u=-1.5 a=0.3	agent0	solver_param	0	-1.520844
exp5158	2.42296870e-14	1.001296	-1.000019	discard	cycle 27 u=0.1000	agent0	initial_cond	1	-1.520844
exp5159	4.08106752e-29	0.000000	0.000000	discard	Fourier 3 u=-1.5 a=0.5	agent0	solver_param	0	-0.000000
exp5160	4.42586856e-16	1.001296	-1.000019	discard	cycle 27 u=0.1000	agent0	initial_cond	0	-1.520844
exp5161	4.08106752e-29	0.000000	0.000000	discard	Fourier 3 u=-1.5 a=0.8	agent0	solver_param	0	-0.000000
exp5162	4.42586856e-16	1.001296	-1.000019	discard	cycle 27 u=0.1000	agent0	initial_cond	0	-1.520844
exp5163	4.08106752e-29	0.000000	0.000000	discard	Fourier 3 u=-1.0 a=0.3	agent0	solver_param	1	-0.000000
exp5164	3.37042680e-16	1.001296	-1.000019	discard	cycle 27 u=0.1000	agent0	initial_cond	0	-1.520844
exp5165	4.58623706e-29	0.000000	0.000000	discard	Fourier 3 u=-1.0 a=0.5	agent0	solver_param	0	-0.000000
exp5166	4.58623706e-29	0.000000	0.000000	discard	cycle 27 u=0.1000	agent0	initial_cond	0	-0.000000
exp5167	4.58623706e-29	0.000000	0.000000	discard	Fourier 3 u=-1.0 a=0.8	agent0	solver_param	0	-0.000000
exp5168	4.58623706e-29	0.000000	0.000000	discard	cycle 27 u=0.1000	agent0	initial_cond	1	-0.000000
exp5169	4.58623706e-29	0.000000	0.000000	discard	Fourier 3 u=-0.5 a=0.3	agent0	solver_param	0	-0.000000
exp5169	4.58623706e-29	0.000000	0.000000	discard	cycle 27 u=0.1000	agent0	initial_cond	0	-0.000000
exp5170	1.96187247e-25	0.000000	-0.000000	discard	cycle 27 u=0.1000	agent0	initial_cond	0	0.000000
exp5170	1.96187247e-25	0.000000	-0.000000	discard	Fourier 3 u=-0.5 a=0.5	agent0	solver_param	0	0.000000
exp5171	4.17680684e-16	1.001296	1.000019	discard	cycle 27 u=0.1000	agent0	initial_cond	1	-1.520844
exp5171	4.17680684e-16	1.001296	1.000019	discard	Fourier 3 u=-0.5 a=0.8	agent0	solver_param	1	-1.520844
exp5172	4.42586856e-16	1.001296	1.000019	discard	cycle 27 u=0.1000	agent0	initial_cond	0	-1.520844
exp5173	4.42586856e-16	1.001296	1.000019	discard	Fourier 3 u=0.5 a=0.3	agent0	solver_param	0	-1.520844
exp5174	6.38912260e-16	1.001296	1.000019	discard	cycle 27 u=0.1050	agent0	initial_cond	0	-1.520844
exp5175	1.36727475e-28	0.000000	0.000000	discard	Fourier 3 u=0.5 a=0.5	agent0	solver_param	1	-0.000000
exp5176	2.16094841e-15	1.001296	-1.000019	discard	cycle 27 u=0.1050	agent0	initial_cond	0	-1.520844
exp5177	1.36727475e-28	0.000000	0.000000	discard	Fourier 3 u=0.5 a=0.8	agent0	solver_param	0	-0.000000
exp5178	9.56519247e-16	1.001296	1.000019	discard	cycle 27 u=0.1050	agent0	initial_cond	0	-1.520844
exp5179	6.14461376e-29	0.000000	0.000000	discard	Fourier 3 u=1.0 a=0.3	agent0	solver_param	0	-0.000000
exp5180	0.00000000e+00	0.998999	1.000000	discard	positive_branch phase=0.0 amp=0.0 u=1.44	agent1	perturbation	1	-1.567655
exp5180	4.22769823e-16	1.001296	1.000019	discard	cycle 27 u=0.1050	agent0	initial_cond	1	-1.520844
exp5181	6.14461376e-29	0.000000	0.000000	discard	Fourier 3 u=1.0 a=0.5	agent0	solver_param	0	-0.000000
