exp_id	residual	solution_norm	solution_mean	status	description	agent	design	elapsed_s	solution_energy
exp4609	5.74085541e-29	0.000000	-0.000000	discard	cycle 23 u=0.0995	agent0	initial_cond	0	0.000000
exp4610	1.54984578e-28	0.000000	0.000000	discard	cycle 23 u=0.0995	agent0	initial_cond	0	-0.000000
exp4611	1.54984578e-28	0.000000	0.000000	discard	cycle 23 u=0.0995	agent0	initial_cond	0	-0.000000
exp4612	1.54984578e-28	0.000000	0.000000	discard	cycle 23 u=0.0995	agent0	initial_cond	1	-0.000000
exp4613	1.60328418e-29	0.000000	-0.000000	discard	cycle 23 u=0.0995	agent0	initial_cond	0	-0.000000
exp4614	1.60328418e-29	0.000000	-0.000000	discard	cycle 23 u=0.0995	agent0	initial_cond	0	-0.000000
exp4615	1.60328418e-29	0.000000	-0.000000	discard	cycle 23 u=0.0995	agent0	initial_cond	1	-0.000000
exp4616	7.34590618e-29	0.000000	0.000000	discard	cycle 23 u=0.0995	agent0	initial_cond	0	0.000000
exp4617	7.34590618e-29	0.000000	0.000000	discard	cycle 23 u=0.0995	agent0	initial_cond	0	0.000000
exp4617	0.00000000e+00	0.998999	1.000000	discard	K_amplitude=1.0 boundary u=0.463	agent1	solver_param	0	-1.567655
exp4618	crash	0	0	crash	K_amplitude=1.0 4th_branch	agent1	solver_param	0	0
exp4618	7.34590618e-29	0.000000	0.000000	discard	cycle 23 u=0.0995	agent0	initial_cond	1	0.000000
exp4619	4.46546993e-29	0.000000	0.000000	discard	cycle 23 u=0.1000	agent0	initial_cond	0	-0.000000
exp4619	0.00000000e+00	0.998999	1.000000	discard	K_amplitude=0.0 (homogeneous)	agent1	solver_param	0	-1.567655
exp4620	crash	0	0	crash	K_amplitude=0.0 (homogeneous) 4th_branch	agent1	solver_param	1	0
exp4620	4.46546993e-29	0.000000	0.000000	discard	cycle 23 u=0.1000	agent0	initial_cond	1	-0.000000
exp4621	0.00000000e+00	0.998999	1.000000	discard	K_amplitude=-0.3 boundary	agent1	solver_param	0	-1.567655
exp4621	4.46546993e-29	0.000000	0.000000	discard	cycle 23 u=0.1000	agent0	initial_cond	0	-0.000000
exp4622	crash	0	0	crash	K_amplitude=-0.3 4th_branch	agent1	solver_param	0	0
exp4623	4.08106752e-29	0.000000	0.000000	discard	cycle 23 u=0.1000	agent0	initial_cond	0	-0.000000
exp4624	4.08106752e-29	0.000000	0.000000	discard	cycle 23 u=0.1000	agent0	initial_cond	1	-0.000000
exp4625	4.08106752e-29	0.000000	0.000000	discard	cycle 23 u=0.1000	agent0	initial_cond	0	-0.000000
exp4626	4.58623706e-29	0.000000	0.000000	discard	cycle 23 u=0.1000	agent0	initial_cond	0	-0.000000
exp4627	2.00148302e-16	1.001298	1.000025	discard	cycle 23 u=0.1000	agent0	initial_cond	1	-1.520921
exp4628	2.00148302e-16	1.001298	1.000025	discard	statistical trial 1	agent0	solver_param	0	-1.520921
exp4629	2.00148302e-16	1.001298	1.000025	discard	cycle 23 u=0.1000	agent0	initial_cond	0	-1.520921
exp4630	4.39794337e-29	0.000000	0.000000	discard	statistical trial 2	agent0	solver_param	0	-0.000000
exp4631	2.00148302e-16	1.001298	1.000025	discard	cycle 23 u=0.1000	agent0	initial_cond	0	-1.520921
exp4632	4.39794337e-29	0.000000	0.000000	discard	statistical trial 3	agent0	solver_param	1	-0.000000
exp4633	2.00148302e-16	1.001298	1.000025	discard	cycle 23 u=0.1000	agent0	initial_cond	0	-1.520921
exp4634	4.39794337e-29	0.000000	0.000000	discard	statistical trial 4	agent0	solver_param	0	-0.000000
exp4635	2.00148302e-16	1.001298	1.000025	discard	cycle 23 u=0.1000	agent0	initial_cond	0	-1.520921
exp4636	1.36727475e-28	0.000000	0.000000	discard	statistical trial 5	agent0	solver_param	0	-0.000000
exp4637	1.36727475e-28	0.000000	0.000000	discard	cycle 23 u=0.1050	agent0	initial_cond	1	-0.000000
exp4638	1.36727475e-28	0.000000	0.000000	discard	statistical trial 6	agent0	solver_param	0	-0.000000
exp4639	1.36727475e-28	0.000000	0.000000	discard	cycle 23 u=0.1050	agent0	initial_cond	0	-0.000000
exp4640	1.36727475e-28	0.000000	0.000000	discard	statistical trial 7	agent0	solver_param	0	-0.000000
exp4641	1.36727475e-28	0.000000	0.000000	discard	cycle 23 u=0.1050	agent0	initial_cond	0	-0.000000
exp4642	6.14461376e-29	0.000000	0.000000	discard	statistical trial 8	agent0	solver_param	1	-0.000000
exp4642	6.14461376e-29	0.000000	0.000000	discard	cycle 23 u=0.1050	agent0	initial_cond	1	-0.000000
exp4643	2.00148302e-16	1.001298	1.000025	discard	cycle 23 u=0.1050	agent0	initial_cond	0	-1.520921
exp4643	2.00148302e-16	1.001298	1.000025	discard	statistical trial 9	agent0	solver_param	0	-1.520921
exp4644	2.00148302e-16	1.001298	1.000025	discard	cycle 23 u=0.1050	agent0	initial_cond	0	-1.520921
exp4645	2.00148302e-16	1.001298	1.000025	discard	statistical trial 10	agent0	solver_param	0	-1.520921
exp4646	2.00148302e-16	1.001298	1.000025	discard	cycle 23 u=0.1050	agent0	initial_cond	1	-1.520921
exp4647	1.75906666e-28	0.000000	0.000000	discard	statistical trial 11	agent0	solver_param	0	-0.000000
exp4648	2.00148302e-16	1.001298	1.000025	discard	cycle 23 u=0.1050	agent0	initial_cond	0	-1.520921
exp4649	1.75906666e-28	0.000000	0.000000	discard	statistical trial 12	agent0	solver_param	0	-0.000000
exp4650	2.00148302e-16	1.001298	1.000025	discard	cycle 23 u=0.1050	agent0	initial_cond	1	-1.520921
exp4651	1.11257917e-28	0.000000	0.000000	discard	statistical trial 13	agent0	solver_param	1	-0.000000
exp4652	2.00148302e-16	1.001298	1.000025	discard	cycle 23 u=0.1050	agent0	initial_cond	0	-1.520921
exp4653	1.11257917e-28	0.000000	0.000000	discard	statistical trial 14	agent0	solver_param	0	-0.000000
exp4654	1.11257917e-28	0.000000	0.000000	discard	cycle 23 u=0.1050	agent0	initial_cond	0	-0.000000
exp4655	1.11257917e-28	0.000000	0.000000	discard	statistical trial 15	agent0	solver_param	1	-0.000000
exp4656	1.11257917e-28	0.000000	0.000000	discard	cycle 23 u=0.1050	agent0	initial_cond	1	-0.000000
exp4657	8.58580947e-29	0.000000	0.000000	discard	statistical trial 16	agent0	solver_param	0	0.000000
exp4658	8.58580947e-29	0.000000	0.000000	discard	cycle 24 u=0.0975	agent0	initial_cond	0	0.000000
exp4659	8.58580947e-29	0.000000	0.000000	discard	statistical trial 17	agent0	solver_param	0	0.000000
exp4659	8.58580947e-29	0.000000	0.000000	discard	cycle 24 u=0.0975	agent0	initial_cond	0	0.000000
exp4660	2.00148302e-16	1.001298	1.000025	discard	cycle 24 u=0.0975	agent0	initial_cond	1	-1.520921
exp4660	2.00148302e-16	1.001298	1.000025	discard	statistical trial 18	agent0	solver_param	1	-1.520921
exp4661	2.00148302e-16	1.001298	1.000025	discard	cycle 24 u=0.0975	agent0	initial_cond	0	-1.520921
exp4662	2.00148302e-16	1.001298	1.000025	discard	statistical trial 19	agent0	solver_param	0	-1.520921
exp4663	2.00148302e-16	1.001298	1.000025	discard	cycle 24 u=0.0975	agent0	initial_cond	0	-1.520921
exp4664	5.23962023e-29	0.000000	0.000000	discard	statistical trial 20	agent0	solver_param	1	0.000000
exp4665	2.00148302e-16	1.001298	1.000025	discard	cycle 24 u=0.0975	agent0	initial_cond	0	-1.520921
exp4666	4.03266298e-29	0.000000	0.000000	discard	statistical trial 21	agent0	solver_param	0	0.000000
exp4667	2.00148302e-16	1.001298	1.000025	discard	cycle 24 u=0.0975	agent0	initial_cond	0	-1.520921
exp4668	4.03266298e-29	0.000000	0.000000	discard	statistical trial 22	agent0	solver_param	0	0.000000
exp4669	2.00148302e-16	1.001298	1.000025	discard	cycle 24 u=0.0975	agent0	initial_cond	1	-1.520921
exp4670	4.03266298e-29	0.000000	0.000000	discard	statistical trial 23	agent0	solver_param	0	0.000000
exp4671	4.80015937e-29	0.000000	0.000000	discard	statistical trial 24	agent0	solver_param	0	0.000000
exp4671	4.80015937e-29	0.000000	0.000000	discard	cycle 24 u=0.0975	agent0	initial_cond	0	0.000000
exp4672	2.00148302e-16	1.001298	1.000025	discard	cycle 24 u=0.0975	agent0	initial_cond	1	-1.520921
exp4672	2.00148302e-16	1.001298	1.000025	discard	statistical trial 25	agent0	solver_param	1	-1.520921
exp4673	2.00148302e-16	1.001298	1.000025	discard	cycle 24 u=0.0975	agent0	initial_cond	0	-1.520921
exp4674	2.00148302e-16	1.001298	1.000025	discard	statistical trial 26	agent0	solver_param	0	-1.520921
exp4675	2.00148302e-16	1.001298	1.000025	discard	cycle 24 u=0.0980	agent0	initial_cond	0	-1.520921
exp4676	2.00148302e-16	1.001298	1.000025	discard	statistical trial 27	agent0	solver_param	0	-1.520921
exp4677	2.00148302e-16	1.001298	1.000025	discard	cycle 24 u=0.0980	agent0	initial_cond	1	-1.520921
exp4678	2.68824537e-29	0.000000	0.000000	discard	statistical trial 28	agent0	solver_param	0	-0.000000
exp4679	2.00148302e-16	1.001298	1.000025	discard	cycle 24 u=0.0980	agent0	initial_cond	0	-1.520921
exp4680	6.16758073e-29	0.000000	0.000000	discard	statistical trial 29	agent0	solver_param	0	-0.000000
exp4681	2.00148302e-16	1.001298	1.000025	discard	cycle 24 u=0.0980	agent0	initial_cond	0	-1.520921
exp4682	6.16758073e-29	0.000000	0.000000	discard	statistical trial 30	agent0	solver_param	1	-0.000000
exp4683	6.16758073e-29	0.000000	0.000000	discard	cycle 24 u=0.0980	agent0	initial_cond	0	-0.000000
exp4684	6.16758073e-29	0.000000	0.000000	discard	cycle 24 u=0.0980	agent0	initial_cond	0	-0.000000
exp4685	2.01926478e-29	0.000000	0.000000	discard	cycle 24 u=0.0980	agent0	initial_cond	1	0.000000
exp4686	2.01926478e-29	0.000000	0.000000	discard	cycle 24 u=0.0980	agent0	initial_cond	0	0.000000
exp4687	2.01926478e-29	0.000000	0.000000	discard	cycle 24 u=0.0980	agent0	initial_cond	0	0.000000
exp4688	1.30310780e-28	0.000000	0.000000	discard	cycle 24 u=0.0980	agent0	initial_cond	1	-0.000000
exp4689	1.30310780e-28	0.000000	0.000000	discard	cycle 24 u=0.0980	agent0	initial_cond	0	-0.000000
exp4690	1.30310780e-28	0.000000	0.000000	discard	cycle 24 u=0.0980	agent0	initial_cond	0	-0.000000
exp4691	5.45343271e-29	0.000000	0.000000	discard	cycle 24 u=0.0982	agent0	initial_cond	1	-0.000000
exp4692	5.45343271e-29	0.000000	0.000000	discard	cycle 24 u=0.0982	agent0	initial_cond	0	-0.000000
exp4693	5.45343271e-29	0.000000	0.000000	discard	cycle 24 u=0.0982	agent0	initial_cond	1	-0.000000
exp4694	1.23429977e-28	0.000000	0.000000	discard	cycle 24 u=0.0982	agent0	initial_cond	0	0.000000
exp4695	1.23429977e-28	0.000000	0.000000	discard	cycle 24 u=0.0982	agent0	initial_cond	0	0.000000
exp4696	1.23429977e-28	0.000000	0.000000	discard	cycle 24 u=0.0982	agent0	initial_cond	1	0.000000
exp4697	1.88036672e-29	0.000000	0.000000	discard	cycle 24 u=0.0982	agent0	initial_cond	0	0.000000
exp4698	1.88036672e-29	0.000000	0.000000	discard	cycle 24 u=0.0982	agent0	initial_cond	0	0.000000
exp4699	1.88036672e-29	0.000000	0.000000	discard	cycle 24 u=0.0982	agent0	initial_cond	1	0.000000
exp4700	1.91190259e-29	0.000000	-0.000000	discard	cycle 24 u=0.0982	agent0	initial_cond	0	0.000000
exp4701	1.91190259e-29	0.000000	-0.000000	discard	cycle 24 u=0.0982	agent0	initial_cond	0	0.000000
exp4702	1.91190259e-29	0.000000	-0.000000	discard	cycle 24 u=0.0982	agent0	initial_cond	0	0.000000
exp4703	6.13049994e-29	0.000000	0.000000	discard	cycle 24 u=0.0985	agent0	initial_cond	0	0.000000
exp4704	6.13049994e-29	0.000000	0.000000	discard	cycle 24 u=0.0985	agent0	initial_cond	1	0.000000
exp4705	6.13049994e-29	0.000000	0.000000	discard	cycle 24 u=0.0985	agent0	initial_cond	0	0.000000
exp4706	5.49750971e-29	0.000000	0.000000	discard	cycle 24 u=0.0985	agent0	initial_cond	0	0.000000
exp4707	1.34357540e-12	1.002503	1.000218	discard	cycle 24 u=0.0985	agent0	initial_cond	1	-1.523848
exp4708	1.34357540e-12	1.002503	1.000218	discard	scipy verify positive 1	agent0	solver_param	0	-1.523848
exp4709	1.34357540e-12	1.002503	1.000218	discard	cycle 24 u=0.0985	agent0	initial_cond	0	-1.523848
exp4710	4.15642452e-29	0.000000	0.000000	discard	scipy verify positive 2	agent0	solver_param	0	0.000000
exp4711	1.34357540e-12	1.002503	1.000218	discard	cycle 24 u=0.0985	agent0	initial_cond	1	-1.523848
exp4712	1.34357540e-12	1.002503	1.000218	discard	scipy verify positive 3	agent0	solver_param	1	-1.523848
exp4713	1.34357540e-12	1.002503	1.000218	discard	cycle 24 u=0.0985	agent0	initial_cond	0	-1.523848
exp4714	4.15642452e-29	0.000000	0.000000	discard	scipy verify positive 4	agent0	solver_param	0	0.000000
exp4715	1.34357540e-12	1.002503	1.000218	discard	cycle 24 u=0.0985	agent0	initial_cond	1	-1.523848
exp4716	1.34357540e-12	1.002503	1.000218	discard	scipy verify positive 5	agent0	solver_param	1	-1.523848
exp4717	2.19292611e-29	0.000000	0.000000	discard	cycle 24 u=0.0985	agent0	initial_cond	0	-0.000000
exp4718	2.19292611e-29	0.000000	0.000000	discard	cycle 24 u=0.0985	agent0	initial_cond	0	-0.000000
exp4719	2.19292611e-29	0.000000	0.000000	discard	cycle 24 u=0.0985	agent0	initial_cond	1	-0.000000
exp4720	4.22491788e-29	0.000000	0.000000	discard	cycle 24 u=0.0990	agent0	initial_cond	0	-0.000000
exp4721	4.22491788e-29	0.000000	0.000000	discard	cycle 24 u=0.0990	agent0	initial_cond	0	-0.000000
exp4722	4.22491788e-29	0.000000	0.000000	discard	cycle 24 u=0.0990	agent0	initial_cond	1	-0.000000
exp4723	3.22245147e-29	0.000000	0.000000	discard	cycle 24 u=0.0990	agent0	initial_cond	0	0.000000
exp4724	3.22245147e-29	0.000000	0.000000	discard	cycle 24 u=0.0990	agent0	initial_cond	0	0.000000
exp4725	3.22245147e-29	0.000000	0.000000	discard	cycle 24 u=0.0990	agent0	initial_cond	0	0.000000
exp4726	4.50941488e-29	0.000000	-0.000000	discard	cycle 24 u=0.0990	agent0	initial_cond	0	0.000000
exp4727	4.50941488e-29	0.000000	-0.000000	discard	cycle 24 u=0.0990	agent0	initial_cond	1	0.000000
exp4728	4.50941488e-29	0.000000	-0.000000	discard	cycle 24 u=0.0990	agent0	initial_cond	0	0.000000
exp4729	4.88330883e-29	0.000000	-0.000000	discard	cycle 24 u=0.0990	agent0	initial_cond	0	0.000000
exp4730	4.88330883e-29	0.000000	-0.000000	discard	cycle 24 u=0.0990	agent0	initial_cond	1	0.000000
exp4731	4.88330883e-29	0.000000	-0.000000	discard	cycle 24 u=0.0990	agent0	initial_cond	0	0.000000
exp4732	5.74085541e-29	0.000000	-0.000000	discard	cycle 24 u=0.0995	agent0	initial_cond	0	0.000000
exp4733	5.74085541e-29	0.000000	-0.000000	discard	cycle 24 u=0.0995	agent0	initial_cond	1	0.000000
exp4734	5.74085541e-29	0.000000	-0.000000	discard	cycle 24 u=0.0995	agent0	initial_cond	0	0.000000
exp4735	1.54984578e-28	0.000000	0.000000	discard	cycle 24 u=0.0995	agent0	initial_cond	1	-0.000000
exp4736	1.54984578e-28	0.000000	0.000000	discard	cycle 24 u=0.0995	agent0	initial_cond	0	-0.000000
exp4737	1.54984578e-28	0.000000	0.000000	discard	cycle 24 u=0.0995	agent0	initial_cond	0	-0.000000
exp4738	1.60328418e-29	0.000000	-0.000000	discard	cycle 24 u=0.0995	agent0	initial_cond	1	-0.000000
exp4739	1.60328418e-29	0.000000	-0.000000	discard	cycle 24 u=0.0995	agent0	initial_cond	0	-0.000000
exp4740	1.60328418e-29	0.000000	-0.000000	discard	cycle 24 u=0.0995	agent0	initial_cond	0	-0.000000
exp4741	7.34590618e-29	0.000000	0.000000	discard	cycle 24 u=0.0995	agent0	initial_cond	1	0.000000
exp4742	7.34590618e-29	0.000000	0.000000	discard	cycle 24 u=0.0995	agent0	initial_cond	0	0.000000
exp4743	7.34590618e-29	0.000000	0.000000	discard	cycle 24 u=0.0995	agent0	initial_cond	0	0.000000
exp4744	4.46546993e-29	0.000000	0.000000	discard	cycle 24 u=0.1000	agent0	initial_cond	0	-0.000000
exp4745	4.46546993e-29	0.000000	0.000000	discard	cycle 24 u=0.1000	agent0	initial_cond	0	-0.000000
exp4746	4.46546993e-29	0.000000	0.000000	discard	cycle 24 u=0.1000	agent0	initial_cond	1	-0.000000
exp4747	4.08106752e-29	0.000000	0.000000	discard	cycle 24 u=0.1000	agent0	initial_cond	0	-0.000000
exp4748	4.08106752e-29	0.000000	0.000000	discard	cycle 24 u=0.1000	agent0	initial_cond	0	-0.000000
exp4749	4.08106752e-29	0.000000	0.000000	discard	cycle 24 u=0.1000	agent0	initial_cond	1	-0.000000
exp4750	4.58623706e-29	0.000000	0.000000	discard	cycle 24 u=0.1000	agent0	initial_cond	0	-0.000000
exp4751	4.58623706e-29	0.000000	0.000000	discard	cycle 24 u=0.1000	agent0	initial_cond	0	-0.000000
exp4752	4.58623706e-29	0.000000	0.000000	discard	cycle 24 u=0.1000	agent0	initial_cond	1	-0.000000
exp4753	4.39794337e-29	0.000000	0.000000	discard	cycle 24 u=0.1000	agent0	initial_cond	0	-0.000000
exp4754	4.39794337e-29	0.000000	0.000000	discard	cycle 24 u=0.1000	agent0	initial_cond	0	-0.000000
exp4755	4.39794337e-29	0.000000	0.000000	discard	cycle 24 u=0.1000	agent0	initial_cond	0	-0.000000
exp4756	1.36727475e-28	0.000000	0.000000	discard	cycle 24 u=0.1050	agent0	initial_cond	0	-0.000000
exp4757	1.36727475e-28	0.000000	0.000000	discard	cycle 24 u=0.1050	agent0	initial_cond	1	-0.000000
exp4758	1.36727475e-28	0.000000	0.000000	discard	cycle 24 u=0.1050	agent0	initial_cond	0	-0.000000
exp4759	6.14461376e-29	0.000000	0.000000	discard	cycle 24 u=0.1050	agent0	initial_cond	0	-0.000000
exp4760	6.14461376e-29	0.000000	0.000000	discard	cycle 24 u=0.1050	agent0	initial_cond	1	-0.000000
exp4761	6.14461376e-29	0.000000	0.000000	discard	cycle 24 u=0.1050	agent0	initial_cond	0	-0.000000
exp4762	1.75906666e-28	0.000000	0.000000	discard	cycle 24 u=0.1050	agent0	initial_cond	0	-0.000000
exp4763	1.75906666e-28	0.000000	0.000000	discard	cycle 24 u=0.1050	agent0	initial_cond	0	-0.000000
exp4764	1.75906666e-28	0.000000	0.000000	discard	nmode test 1 r1	agent0	perturbation	0	-0.000000
exp4765	1.75906666e-28	0.000000	0.000000	discard	cycle 24 u=0.1050	agent0	initial_cond	0	-0.000000
exp4766	1.11257917e-28	0.000000	0.000000	discard	nmode test 1 r2	agent0	perturbation	1	-0.000000
exp4766	1.11257917e-28	0.000000	0.000000	discard	cycle 24 u=0.1050	agent0	initial_cond	1	-0.000000
exp4767	2.00148302e-16	1.001298	1.000025	discard	cycle 24 u=0.1050	agent0	initial_cond	0	-1.520921
exp4767	2.00148302e-16	1.001298	1.000025	discard	nmode test 1 r3	agent0	perturbation	0	-1.520921
exp4768	2.00148302e-16	1.001298	1.000025	discard	cycle 24 u=0.1050	agent0	initial_cond	0	-1.520921
exp4768	2.00148302e-16	1.001298	1.000025	discard	nmode test 1 r4	agent0	perturbation	0	-1.520921
exp4769	2.00148302e-16	1.001298	1.000025	discard	cycle 25 u=0.0975	agent0	initial_cond	1	-1.520921
exp4770	2.00148302e-16	1.001298	1.000025	discard	nmode test 1 r5	agent0	perturbation	1	-1.520921
exp4771	2.00148302e-16	1.001298	1.000025	discard	cycle 25 u=0.0975	agent0	initial_cond	0	-1.520921
exp4772	8.58580947e-29	0.000000	0.000000	discard	nmode test 1 r6	agent0	perturbation	0	0.000000
exp4773	2.00148302e-16	1.001298	1.000025	discard	cycle 25 u=0.0975	agent0	initial_cond	0	-1.520921
exp4774	5.23962023e-29	0.000000	0.000000	discard	nmode test 1 r7	agent0	perturbation	1	0.000000
exp4775	2.00148302e-16	1.001298	1.000025	discard	cycle 25 u=0.0975	agent0	initial_cond	0	-1.520921
exp4776	5.23962023e-29	0.000000	0.000000	discard	nmode test 1 r8	agent0	perturbation	0	0.000000
exp4777	2.00148302e-16	1.001298	1.000025	discard	cycle 25 u=0.0975	agent0	initial_cond	0	-1.520921
exp4778	5.23962023e-29	0.000000	0.000000	discard	nmode test 1 r9	agent0	perturbation	0	0.000000
exp4779	5.23962023e-29	0.000000	0.000000	discard	cycle 25 u=0.0975	agent0	initial_cond	1	0.000000
exp4780	2.70683191e-16	0.070536	0.000000	discard	resonance K_freq=1 mode=1	agent1	solver_param	1	0.000099
exp4781	4.03266298e-29	0.000000	0.000000	discard	nmode test 1 r10	agent0	perturbation	0	0.000000
exp4782	4.03266298e-29	0.000000	0.000000	discard	cycle 25 u=0.0975	agent0	initial_cond	0	0.000000
exp4783	4.59079438e-18	0.000000	0.000000	discard	resonance K_freq=1 mode=2	agent1	solver_param	0	0.000000
exp4784	4.03266298e-29	0.000000	0.000000	discard	nmode test 2 r1	agent0	perturbation	0	0.000000
exp4784	4.03266298e-29	0.000000	0.000000	discard	cycle 25 u=0.0975	agent0	initial_cond	0	0.000000
exp4785	2.59145622e-17	0.000000	-0.000000	discard	resonance K_freq=1 mode=3	agent1	solver_param	1	0.000000
exp4786	4.03266298e-29	0.000000	0.000000	discard	cycle 25 u=0.0975	agent0	initial_cond	1	0.000000
exp4786	4.03266298e-29	0.000000	0.000000	discard	nmode test 2 r2	agent0	perturbation	1	0.000000
exp4787	4.21900524e-23	0.000000	-0.000000	discard	resonance K_freq=1 mode=4	agent1	solver_param	0	0.000000
exp4788	2.00148302e-16	1.001298	1.000025	discard	cycle 25 u=0.0975	agent0	initial_cond	0	-1.520921
exp4788	2.00148302e-16	1.001298	1.000025	discard	nmode test 2 r3	agent0	perturbation	0	-1.520921
exp4789	1.35634976e-18	0.000000	-0.000000	discard	resonance K_freq=2 mode=2	agent1	solver_param	0	0.000000
exp4790	2.00148302e-16	1.001298	1.000025	discard	cycle 25 u=0.0975	agent0	initial_cond	0	-1.520921
exp4791	2.00148302e-16	1.001298	1.000025	discard	nmode test 2 r4	agent0	perturbation	1	-1.520921
exp4792	1.67320203e-23	0.000000	-0.000000	discard	resonance K_freq=2 mode=4	agent1	solver_param	1	-0.000000
exp4793	2.00148302e-16	1.001298	1.000025	discard	cycle 25 u=0.0975	agent0	initial_cond	0	-1.520921
exp4794	2.68824537e-29	0.000000	0.000000	discard	nmode test 2 r5	agent0	perturbation	0	-0.000000
exp4795	2.78892897e-22	0.000000	0.000000	discard	resonance K_freq=2 mode=6	agent1	solver_param	0	0.000000
exp4796	2.00148302e-16	1.001298	1.000025	discard	cycle 25 u=0.0980	agent0	initial_cond	0	-1.520921
exp4797	2.68824537e-29	0.000000	0.000000	discard	nmode test 2 r6	agent0	perturbation	0	-0.000000
exp4798	1.89315446e-18	0.000000	0.000000	discard	resonance K_freq=2 mode=8	agent1	solver_param	1	0.000000
exp4799	2.00148302e-16	1.001298	1.000025	discard	cycle 25 u=0.0980	agent0	initial_cond	1	-1.520921
exp4800	2.68824537e-29	0.000000	0.000000	discard	nmode test 2 r7	agent0	perturbation	1	-0.000000
exp4801	1.89901439e-22	0.000000	0.000000	discard	resonance K_freq=3 mode=3	agent1	solver_param	0	0.000000
exp4802	2.00148302e-16	1.001298	1.000025	discard	cycle 25 u=0.0980	agent0	initial_cond	0	-1.520921
exp4803	6.16758073e-29	0.000000	0.000000	discard	nmode test 2 r8	agent0	perturbation	0	-0.000000
exp4804	9.61705723e-26	0.000000	0.000000	discard	resonance K_freq=3 mode=6	agent1	solver_param	0	0.000000
exp4804	6.16758073e-29	0.000000	0.000000	discard	cycle 25 u=0.0980	agent0	initial_cond	0	-0.000000
exp4805	6.16758073e-29	0.000000	0.000000	discard	nmode test 2 r9	agent0	perturbation	1	-0.000000
exp4805	1.46437485e-22	0.000000	-0.000000	discard	resonance K_freq=3 mode=9	agent1	solver_param	1	0.000000
exp4806	6.16758073e-29	0.000000	0.000000	discard	cycle 25 u=0.0980	agent0	initial_cond	1	-0.000000
exp4807	crash	0	0	crash	boundary_search u=0.30	agent1	branch_search	0	0
exp4807	6.16758073e-29	0.000000	0.000000	discard	nmode test 2 r10	agent0	perturbation	0	-0.000000
exp4808	6.16758073e-29	0.000000	0.000000	discard	cycle 25 u=0.0980	agent0	initial_cond	0	-0.000000
