exp_id	residual	solution_norm	solution_mean	status	description	agent	design	elapsed_s	solution_energy
exp10402	6.13049994e-29	0.000000	0.000000	discard	cycle 74 u=0.0985	agent0	initial_cond	1	0.000000
exp10403	6.13049994e-29	0.000000	0.000000	discard	cycle 74 u=0.0985	agent0	initial_cond	0	0.000000
exp10404	6.13049994e-29	0.000000	0.000000	discard	cycle 74 u=0.0985	agent0	initial_cond	1	0.000000
exp10405	5.49750971e-29	0.000000	0.000000	discard	cycle 74 u=0.0985	agent0	initial_cond	0	0.000000
exp10406	5.49750971e-29	0.000000	0.000000	discard	cycle 74 u=0.0985	agent0	initial_cond	0	0.000000
exp10407	5.49750971e-29	0.000000	0.000000	discard	cycle 74 u=0.0985	agent0	initial_cond	1	0.000000
exp10408	4.15642452e-29	0.000000	0.000000	discard	cycle 74 u=0.0985	agent0	initial_cond	0	0.000000
exp10409	4.15642452e-29	0.000000	0.000000	discard	cycle 74 u=0.0985	agent0	initial_cond	1	0.000000
exp10410	4.15642452e-29	0.000000	0.000000	discard	cycle 74 u=0.0985	agent0	initial_cond	0	0.000000
exp10411	2.19292611e-29	0.000000	0.000000	discard	cycle 74 u=0.0985	agent0	initial_cond	0	-0.000000
exp10412	2.19292611e-29	0.000000	0.000000	discard	cycle 74 u=0.0985	agent0	initial_cond	1	-0.000000
exp10413	2.19292611e-29	0.000000	0.000000	discard	cycle 74 u=0.0985	agent0	initial_cond	0	-0.000000
exp10414	4.22491788e-29	0.000000	0.000000	discard	cycle 74 u=0.0990	agent0	initial_cond	0	-0.000000
exp10415	4.22491788e-29	0.000000	0.000000	discard	cycle 74 u=0.0990	agent0	initial_cond	0	-0.000000
exp10416	4.22491788e-29	0.000000	0.000000	discard	cycle 74 u=0.0990	agent0	initial_cond	0	-0.000000
exp10417	3.22245147e-29	0.000000	0.000000	discard	cycle 74 u=0.0990	agent0	initial_cond	1	0.000000
exp10418	3.22245147e-29	0.000000	0.000000	discard	cycle 74 u=0.0990	agent0	initial_cond	0	0.000000
exp10419	3.22245147e-29	0.000000	0.000000	discard	cycle 74 u=0.0990	agent0	initial_cond	0	0.000000
exp10420	4.50941488e-29	0.000000	-0.000000	discard	cycle 74 u=0.0990	agent0	initial_cond	0	0.000000
exp10421	4.50941488e-29	0.000000	-0.000000	discard	cycle 74 u=0.0990	agent0	initial_cond	0	0.000000
exp10422	4.50941488e-29	0.000000	-0.000000	discard	cycle 74 u=0.0990	agent0	initial_cond	1	0.000000
exp10423	4.88330883e-29	0.000000	-0.000000	discard	cycle 74 u=0.0990	agent0	initial_cond	0	0.000000
exp10424	4.88330883e-29	0.000000	-0.000000	discard	cycle 74 u=0.0990	agent0	initial_cond	0	0.000000
exp10425	4.88330883e-29	0.000000	-0.000000	discard	cycle 74 u=0.0990	agent0	initial_cond	0	0.000000
exp10426	5.74085541e-29	0.000000	-0.000000	discard	cycle 74 u=0.0995	agent0	initial_cond	0	0.000000
exp10427	5.74085541e-29	0.000000	-0.000000	discard	cycle 74 u=0.0995	agent0	initial_cond	1	0.000000
exp10428	5.74085541e-29	0.000000	-0.000000	discard	cycle 74 u=0.0995	agent0	initial_cond	0	0.000000
exp10429	1.54984578e-28	0.000000	0.000000	discard	cycle 74 u=0.0995	agent0	initial_cond	0	-0.000000
exp10430	1.54984578e-28	0.000000	0.000000	discard	cycle 74 u=0.0995	agent0	initial_cond	0	-0.000000
exp10431	1.54984578e-28	0.000000	0.000000	discard	cycle 74 u=0.0995	agent0	initial_cond	0	-0.000000
exp10432	1.60328418e-29	0.000000	-0.000000	discard	cycle 74 u=0.0995	agent0	initial_cond	1	-0.000000
exp10433	1.60328418e-29	0.000000	-0.000000	discard	cycle 74 u=0.0995	agent0	initial_cond	0	-0.000000
exp10434	1.60328418e-29	0.000000	-0.000000	discard	cycle 74 u=0.0995	agent0	initial_cond	0	-0.000000
exp10435	7.34590618e-29	0.000000	0.000000	discard	cycle 74 u=0.0995	agent0	initial_cond	1	0.000000
exp10436	7.34590618e-29	0.000000	0.000000	discard	cycle 74 u=0.0995	agent0	initial_cond	0	0.000000
exp10437	7.34590618e-29	0.000000	0.000000	discard	cycle 74 u=0.0995	agent0	initial_cond	1	0.000000
exp10438	4.46546993e-29	0.000000	0.000000	discard	cycle 74 u=0.1000	agent0	initial_cond	0	-0.000000
exp10439	4.46546993e-29	0.000000	0.000000	discard	cycle 74 u=0.1000	agent0	initial_cond	0	-0.000000
exp10440	4.46546993e-29	0.000000	0.000000	discard	cycle 74 u=0.1000	agent0	initial_cond	1	-0.000000
exp10441	4.08106752e-29	0.000000	0.000000	discard	cycle 74 u=0.1000	agent0	initial_cond	0	-0.000000
exp10442	4.08106752e-29	0.000000	0.000000	discard	cycle 74 u=0.1000	agent0	initial_cond	1	-0.000000
exp10443	4.08106752e-29	0.000000	0.000000	discard	cycle 74 u=0.1000	agent0	initial_cond	0	-0.000000
exp10444	4.58623706e-29	0.000000	0.000000	discard	cycle 74 u=0.1000	agent0	initial_cond	0	-0.000000
exp10445	4.58623706e-29	0.000000	0.000000	discard	cycle 74 u=0.1000	agent0	initial_cond	1	-0.000000
exp10446	4.58623706e-29	0.000000	0.000000	discard	cycle 74 u=0.1000	agent0	initial_cond	0	-0.000000
exp10447	4.39794337e-29	0.000000	0.000000	discard	cycle 74 u=0.1000	agent0	initial_cond	1	-0.000000
exp10448	4.39794337e-29	0.000000	0.000000	discard	cycle 74 u=0.1000	agent0	initial_cond	0	-0.000000
exp10449	4.39794337e-29	0.000000	0.000000	discard	cycle 74 u=0.1000	agent0	initial_cond	0	-0.000000
exp10450	1.36727475e-28	0.000000	0.000000	discard	cycle 74 u=0.1050	agent0	initial_cond	1	-0.000000
exp10451	1.36727475e-28	0.000000	0.000000	discard	cycle 74 u=0.1050	agent0	initial_cond	0	-0.000000
exp10452	1.36727475e-28	0.000000	0.000000	discard	cycle 74 u=0.1050	agent0	initial_cond	0	-0.000000
exp10453	6.14461376e-29	0.000000	0.000000	discard	cycle 74 u=0.1050	agent0	initial_cond	0	-0.000000
exp10454	6.14461376e-29	0.000000	0.000000	discard	cycle 74 u=0.1050	agent0	initial_cond	0	-0.000000
exp10455	6.14461376e-29	0.000000	0.000000	discard	cycle 74 u=0.1050	agent0	initial_cond	1	-0.000000
exp10456	1.75906666e-28	0.000000	0.000000	discard	cycle 74 u=0.1050	agent0	initial_cond	0	-0.000000
exp10457	1.75906666e-28	0.000000	0.000000	discard	cycle 74 u=0.1050	agent0	initial_cond	0	-0.000000
exp10458	1.75906666e-28	0.000000	0.000000	discard	cycle 74 u=0.1050	agent0	initial_cond	0	-0.000000
exp10459	1.11257917e-28	0.000000	0.000000	discard	cycle 74 u=0.1050	agent0	initial_cond	0	-0.000000
exp10460	1.11257917e-28	0.000000	0.000000	discard	cycle 74 u=0.1050	agent0	initial_cond	1	-0.000000
exp10461	5.15238393e-17	0.070278	-0.000000	discard	Round 7 bifurcation study	manual	bifurcation_map	1	0.000097
exp10462	1.11257917e-28	0.000000	0.000000	discard	cycle 74 u=0.1050	agent0	initial_cond	0	-0.000000
exp10463	8.58580947e-29	0.000000	0.000000	discard	cycle 75 u=0.0975	agent0	initial_cond	0	0.000000
exp10464	8.58580947e-29	0.000000	0.000000	discard	cycle 75 u=0.0975	agent0	initial_cond	0	0.000000
exp10465	8.58580947e-29	0.000000	0.000000	discard	cycle 75 u=0.0975	agent0	initial_cond	0	0.000000
exp10466	5.23962023e-29	0.000000	0.000000	discard	cycle 75 u=0.0975	agent0	initial_cond	1	0.000000
exp10467	5.23962023e-29	0.000000	0.000000	discard	cycle 75 u=0.0975	agent0	initial_cond	0	0.000000
exp10468	5.23962023e-29	0.000000	0.000000	discard	cycle 75 u=0.0975	agent0	initial_cond	0	0.000000
exp10469	4.03266298e-29	0.000000	0.000000	discard	cycle 75 u=0.0975	agent0	initial_cond	0	0.000000
exp10470	4.03266298e-29	0.000000	0.000000	discard	cycle 75 u=0.0975	agent0	initial_cond	0	0.000000
exp10471	5.15238393e-17	0.070278	-0.000000	discard	K_amplitude sweep	manual	bifurcation_map	1	0.000097
exp10472	4.03266298e-29	0.000000	0.000000	discard	cycle 75 u=0.0975	agent0	initial_cond	1	0.000000
exp10473	4.80015937e-29	0.000000	0.000000	discard	cycle 75 u=0.0975	agent0	initial_cond	0	0.000000
exp10474	4.80015937e-29	0.000000	0.000000	discard	cycle 75 u=0.0975	agent0	initial_cond	0	0.000000
exp10475	4.80015937e-29	0.000000	0.000000	discard	cycle 75 u=0.0975	agent0	initial_cond	0	0.000000
exp10476	5.15238393e-17	0.070278	-0.000000	discard	K_amplitude sweep	manual	bifurcation_map	0	0.000097
exp10477	2.68824537e-29	0.000000	0.000000	discard	cycle 75 u=0.0980	agent0	initial_cond	0	-0.000000
exp10478	2.68824537e-29	0.000000	0.000000	discard	cycle 75 u=0.0980	agent0	initial_cond	1	-0.000000
exp10479	2.68824537e-29	0.000000	0.000000	discard	cycle 75 u=0.0980	agent0	initial_cond	0	-0.000000
exp10480	5.15238393e-17	0.070278	-0.000000	discard	K_amplitude sweep	manual	bifurcation_map	0	0.000097
exp10480	6.16758073e-29	0.000000	0.000000	discard	cycle 75 u=0.0980	agent0	initial_cond	0	-0.000000
exp10481	6.16758073e-29	0.000000	0.000000	discard	cycle 75 u=0.0980	agent0	initial_cond	1	-0.000000
exp10482	6.16758073e-29	0.000000	0.000000	discard	cycle 75 u=0.0980	agent0	initial_cond	0	-0.000000
exp10483	2.01926478e-29	0.000000	0.000000	discard	cycle 75 u=0.0980	agent0	initial_cond	1	0.000000
exp10484	5.15238393e-17	0.070278	-0.000000	discard	K_amplitude sweep	manual	bifurcation_map	1	0.000097
exp10485	2.01926478e-29	0.000000	0.000000	discard	cycle 75 u=0.0980	agent0	initial_cond	0	0.000000
exp10486	2.01926478e-29	0.000000	0.000000	discard	cycle 75 u=0.0980	agent0	initial_cond	0	0.000000
exp10487	1.30310780e-28	0.000000	0.000000	discard	cycle 75 u=0.0980	agent0	initial_cond	1	-0.000000
exp10488	1.30310780e-28	0.000000	0.000000	discard	cycle 75 u=0.0980	agent0	initial_cond	0	-0.000000
exp10488	5.15238393e-17	0.070278	-0.000000	discard	K_amplitude sweep	manual	bifurcation_map	0	0.000097
exp10489	1.30310780e-28	0.000000	0.000000	discard	cycle 75 u=0.0980	agent0	initial_cond	1	-0.000000
exp10490	5.45343271e-29	0.000000	0.000000	discard	cycle 75 u=0.0982	agent0	initial_cond	0	-0.000000
exp10491	5.45343271e-29	0.000000	0.000000	discard	cycle 75 u=0.0982	agent0	initial_cond	0	-0.000000
exp10492	5.15238393e-17	0.070278	-0.000000	discard	K_amplitude sweep	manual	bifurcation_map	1	0.000097
exp10493	5.45343271e-29	0.000000	0.000000	discard	cycle 75 u=0.0982	agent0	initial_cond	1	-0.000000
exp10494	1.23429977e-28	0.000000	0.000000	discard	cycle 75 u=0.0982	agent0	initial_cond	0	0.000000
exp10495	1.23429977e-28	0.000000	0.000000	discard	cycle 75 u=0.0982	agent0	initial_cond	1	0.000000
exp10496	1.23429977e-28	0.000000	0.000000	discard	cycle 75 u=0.0982	agent0	initial_cond	0	0.000000
exp10496	5.15238393e-17	0.070278	-0.000000	discard	K_amplitude sweep	manual	bifurcation_map	0	0.000097
exp10497	1.88036672e-29	0.000000	0.000000	discard	cycle 75 u=0.0982	agent0	initial_cond	0	0.000000
exp10498	1.88036672e-29	0.000000	0.000000	discard	cycle 75 u=0.0982	agent0	initial_cond	1	0.000000
exp10499	1.88036672e-29	0.000000	0.000000	discard	cycle 75 u=0.0982	agent0	initial_cond	0	0.000000
exp10500	1.91190259e-29	0.000000	-0.000000	discard	cycle 75 u=0.0982	agent0	initial_cond	1	0.000000
exp10501	1.91190259e-29	0.000000	-0.000000	discard	cycle 75 u=0.0982	agent0	initial_cond	0	0.000000
exp10502	1.91190259e-29	0.000000	-0.000000	discard	cycle 75 u=0.0982	agent0	initial_cond	0	0.000000
exp10503	6.13049994e-29	0.000000	0.000000	discard	cycle 75 u=0.0985	agent0	initial_cond	1	0.000000
exp10504	6.13049994e-29	0.000000	0.000000	discard	cycle 75 u=0.0985	agent0	initial_cond	0	0.000000
exp10505	6.13049994e-29	0.000000	0.000000	discard	cycle 75 u=0.0985	agent0	initial_cond	0	0.000000
exp10506	5.49750971e-29	0.000000	0.000000	discard	cycle 75 u=0.0985	agent0	initial_cond	0	0.000000
exp10507	5.49750971e-29	0.000000	0.000000	discard	cycle 75 u=0.0985	agent0	initial_cond	0	0.000000
exp10508	5.49750971e-29	0.000000	0.000000	discard	cycle 75 u=0.0985	agent0	initial_cond	1	0.000000
exp10509	4.15642452e-29	0.000000	0.000000	discard	cycle 75 u=0.0985	agent0	initial_cond	0	0.000000
exp10510	4.15642452e-29	0.000000	0.000000	discard	cycle 75 u=0.0985	agent0	initial_cond	0	0.000000
exp10511	4.15642452e-29	0.000000	0.000000	discard	cycle 75 u=0.0985	agent0	initial_cond	0	0.000000
exp10512	2.19292611e-29	0.000000	0.000000	discard	cycle 75 u=0.0985	agent0	initial_cond	0	-0.000000
exp10513	5.15238393e-17	0.070278	-0.000000	discard	Verify K_amplitude=0.3 optimum	manual	bifurcation_verify	0	0.000097
exp10514	2.19292611e-29	0.000000	0.000000	discard	cycle 75 u=0.0985	agent0	initial_cond	1	-0.000000
exp10515	2.19292611e-29	0.000000	0.000000	discard	cycle 75 u=0.0985	agent0	initial_cond	0	-0.000000
exp10516	4.22491788e-29	0.000000	0.000000	discard	cycle 75 u=0.0990	agent0	initial_cond	0	-0.000000
exp10517	4.22491788e-29	0.000000	0.000000	discard	cycle 75 u=0.0990	agent0	initial_cond	0	-0.000000
exp10518	4.22491788e-29	0.000000	0.000000	discard	cycle 75 u=0.0990	agent0	initial_cond	0	-0.000000
exp10519	3.22245147e-29	0.000000	0.000000	discard	cycle 75 u=0.0990	agent0	initial_cond	1	0.000000
exp10520	3.22245147e-29	0.000000	0.000000	discard	cycle 75 u=0.0990	agent0	initial_cond	0	0.000000
exp10521	3.22245147e-29	0.000000	0.000000	discard	cycle 75 u=0.0990	agent0	initial_cond	0	0.000000
exp10522	4.50941488e-29	0.000000	-0.000000	discard	cycle 75 u=0.0990	agent0	initial_cond	0	0.000000
exp10523	4.50941488e-29	0.000000	-0.000000	discard	cycle 75 u=0.0990	agent0	initial_cond	0	0.000000
exp10524	4.50941488e-29	0.000000	-0.000000	discard	cycle 75 u=0.0990	agent0	initial_cond	1	0.000000
exp10525	4.88330883e-29	0.000000	-0.000000	discard	cycle 75 u=0.0990	agent0	initial_cond	0	0.000000
exp10526	4.88330883e-29	0.000000	-0.000000	discard	cycle 75 u=0.0990	agent0	initial_cond	0	0.000000
exp10527	4.88330883e-29	0.000000	-0.000000	discard	cycle 75 u=0.0990	agent0	initial_cond	0	0.000000
exp10528	5.74085541e-29	0.000000	-0.000000	discard	cycle 75 u=0.0995	agent0	initial_cond	0	0.000000
exp10529	5.74085541e-29	0.000000	-0.000000	discard	cycle 75 u=0.0995	agent0	initial_cond	1	0.000000
exp10530	5.74085541e-29	0.000000	-0.000000	discard	cycle 75 u=0.0995	agent0	initial_cond	0	0.000000
exp10531	1.54984578e-28	0.000000	0.000000	discard	cycle 75 u=0.0995	agent0	initial_cond	0	-0.000000
exp10532	1.54984578e-28	0.000000	0.000000	discard	cycle 75 u=0.0995	agent0	initial_cond	1	-0.000000
exp10533	1.54984578e-28	0.000000	0.000000	discard	cycle 75 u=0.0995	agent0	initial_cond	0	-0.000000
exp10534	1.60328418e-29	0.000000	-0.000000	discard	cycle 75 u=0.0995	agent0	initial_cond	1	-0.000000
exp10535	1.60328418e-29	0.000000	-0.000000	discard	cycle 75 u=0.0995	agent0	initial_cond	0	-0.000000
exp10536	1.60328418e-29	0.000000	-0.000000	discard	cycle 75 u=0.0995	agent0	initial_cond	0	-0.000000
exp10537	7.34590618e-29	0.000000	0.000000	discard	cycle 75 u=0.0995	agent0	initial_cond	1	0.000000
exp10538	7.34590618e-29	0.000000	0.000000	discard	cycle 75 u=0.0995	agent0	initial_cond	0	0.000000
exp10539	7.34590618e-29	0.000000	0.000000	discard	cycle 75 u=0.0995	agent0	initial_cond	1	0.000000
exp10540	4.46546993e-29	0.000000	0.000000	discard	cycle 75 u=0.1000	agent0	initial_cond	0	-0.000000
exp10541	4.46546993e-29	0.000000	0.000000	discard	cycle 75 u=0.1000	agent0	initial_cond	0	-0.000000
exp10542	4.46546993e-29	0.000000	0.000000	discard	cycle 75 u=0.1000	agent0	initial_cond	1	-0.000000
exp10543	4.08106752e-29	0.000000	0.000000	discard	cycle 75 u=0.1000	agent0	initial_cond	0	-0.000000
exp10544	4.08106752e-29	0.000000	0.000000	discard	cycle 75 u=0.1000	agent0	initial_cond	1	-0.000000
exp10545	4.08106752e-29	0.000000	0.000000	discard	cycle 75 u=0.1000	agent0	initial_cond	0	-0.000000
exp10546	4.58623706e-29	0.000000	0.000000	discard	cycle 75 u=0.1000	agent0	initial_cond	0	-0.000000
exp10547	4.58623706e-29	0.000000	0.000000	discard	cycle 75 u=0.1000	agent0	initial_cond	1	-0.000000
exp10548	4.58623706e-29	0.000000	0.000000	discard	cycle 75 u=0.1000	agent0	initial_cond	0	-0.000000
exp10549	4.39794337e-29	0.000000	0.000000	discard	cycle 75 u=0.1000	agent0	initial_cond	1	-0.000000
exp10550	4.39794337e-29	0.000000	0.000000	discard	cycle 75 u=0.1000	agent0	initial_cond	0	-0.000000
exp10551	4.39794337e-29	0.000000	0.000000	discard	cycle 75 u=0.1000	agent0	initial_cond	0	-0.000000
exp10552	1.36727475e-28	0.000000	0.000000	discard	cycle 75 u=0.1050	agent0	initial_cond	1	-0.000000
exp10553	1.36727475e-28	0.000000	0.000000	discard	cycle 75 u=0.1050	agent0	initial_cond	0	-0.000000
exp10554	1.36727475e-28	0.000000	0.000000	discard	cycle 75 u=0.1050	agent0	initial_cond	1	-0.000000
exp10555	6.14461376e-29	0.000000	0.000000	discard	cycle 75 u=0.1050	agent0	initial_cond	0	-0.000000
exp10556	6.14461376e-29	0.000000	0.000000	discard	cycle 75 u=0.1050	agent0	initial_cond	0	-0.000000
exp10557	6.14461376e-29	0.000000	0.000000	discard	cycle 75 u=0.1050	agent0	initial_cond	1	-0.000000
exp10558	1.75906666e-28	0.000000	0.000000	discard	cycle 75 u=0.1050	agent0	initial_cond	0	-0.000000
exp10559	1.75906666e-28	0.000000	0.000000	discard	cycle 75 u=0.1050	agent0	initial_cond	0	-0.000000
exp10560	1.75906666e-28	0.000000	0.000000	discard	cycle 75 u=0.1050	agent0	initial_cond	0	-0.000000
exp10561	1.11257917e-28	0.000000	0.000000	discard	cycle 75 u=0.1050	agent0	initial_cond	0	-0.000000
exp10562	1.11257917e-28	0.000000	0.000000	discard	cycle 75 u=0.1050	agent0	initial_cond	1	-0.000000
exp10563	1.11257917e-28	0.000000	0.000000	discard	cycle 75 u=0.1050	agent0	initial_cond	0	-0.000000
exp10564	8.58580947e-29	0.000000	0.000000	discard	cycle 76 u=0.0975	agent0	initial_cond	0	0.000000
exp10565	8.58580947e-29	0.000000	0.000000	discard	cycle 76 u=0.0975	agent0	initial_cond	0	0.000000
exp10566	8.58580947e-29	0.000000	0.000000	discard	cycle 76 u=0.0975	agent0	initial_cond	0	0.000000
exp10567	5.23962023e-29	0.000000	0.000000	discard	cycle 76 u=0.0975	agent0	initial_cond	1	0.000000
exp10568	5.23962023e-29	0.000000	0.000000	discard	cycle 76 u=0.0975	agent0	initial_cond	0	0.000000
exp10569	5.23962023e-29	0.000000	0.000000	discard	cycle 76 u=0.0975	agent0	initial_cond	0	0.000000
exp10570	4.03266298e-29	0.000000	0.000000	discard	cycle 76 u=0.0975	agent0	initial_cond	0	0.000000
exp10571	4.03266298e-29	0.000000	0.000000	discard	cycle 76 u=0.0975	agent0	initial_cond	0	0.000000
exp10572	4.03266298e-29	0.000000	0.000000	discard	cycle 76 u=0.0975	agent0	initial_cond	1	0.000000
exp10573	4.80015937e-29	0.000000	0.000000	discard	cycle 76 u=0.0975	agent0	initial_cond	0	0.000000
exp10574	4.80015937e-29	0.000000	0.000000	discard	cycle 76 u=0.0975	agent0	initial_cond	0	0.000000
exp10575	4.80015937e-29	0.000000	0.000000	discard	cycle 76 u=0.0975	agent0	initial_cond	0	0.000000
exp10576	2.68824537e-29	0.000000	0.000000	discard	cycle 76 u=0.0980	agent0	initial_cond	0	-0.000000
exp10577	2.68824537e-29	0.000000	0.000000	discard	cycle 76 u=0.0980	agent0	initial_cond	1	-0.000000
exp10578	2.68824537e-29	0.000000	0.000000	discard	cycle 76 u=0.0980	agent0	initial_cond	0	-0.000000
exp10579	6.16758073e-29	0.000000	0.000000	discard	cycle 76 u=0.0980	agent0	initial_cond	0	-0.000000
exp10580	6.16758073e-29	0.000000	0.000000	discard	cycle 76 u=0.0980	agent0	initial_cond	0	-0.000000
exp10581	6.16758073e-29	0.000000	0.000000	discard	cycle 76 u=0.0980	agent0	initial_cond	0	-0.000000
exp10582	2.01926478e-29	0.000000	0.000000	discard	cycle 76 u=0.0980	agent0	initial_cond	1	0.000000
exp10583	2.01926478e-29	0.000000	0.000000	discard	cycle 76 u=0.0980	agent0	initial_cond	0	0.000000
exp10584	2.01926478e-29	0.000000	0.000000	discard	cycle 76 u=0.0980	agent0	initial_cond	0	0.000000
exp10585	1.30310780e-28	0.000000	0.000000	discard	cycle 76 u=0.0980	agent0	initial_cond	0	-0.000000
exp10586	1.30310780e-28	0.000000	0.000000	discard	cycle 76 u=0.0980	agent0	initial_cond	0	-0.000000
exp10587	1.30310780e-28	0.000000	0.000000	discard	cycle 76 u=0.0980	agent0	initial_cond	1	-0.000000
exp10588	5.45343271e-29	0.000000	0.000000	discard	cycle 76 u=0.0982	agent0	initial_cond	0	-0.000000
exp10589	5.45343271e-29	0.000000	0.000000	discard	cycle 76 u=0.0982	agent0	initial_cond	0	-0.000000
exp10590	5.45343271e-29	0.000000	0.000000	discard	cycle 76 u=0.0982	agent0	initial_cond	1	-0.000000
exp10591	1.23429977e-28	0.000000	0.000000	discard	cycle 76 u=0.0982	agent0	initial_cond	0	0.000000
exp10592	1.23429977e-28	0.000000	0.000000	discard	cycle 76 u=0.0982	agent0	initial_cond	1	0.000000
exp10593	1.23429977e-28	0.000000	0.000000	discard	cycle 76 u=0.0982	agent0	initial_cond	0	0.000000
exp10594	1.88036672e-29	0.000000	0.000000	discard	cycle 76 u=0.0982	agent0	initial_cond	0	0.000000
exp10595	1.88036672e-29	0.000000	0.000000	discard	cycle 76 u=0.0982	agent0	initial_cond	1	0.000000
exp10596	1.88036672e-29	0.000000	0.000000	discard	cycle 76 u=0.0982	agent0	initial_cond	0	0.000000
exp10597	1.91190259e-29	0.000000	-0.000000	discard	cycle 76 u=0.0982	agent0	initial_cond	1	0.000000
exp10598	1.91190259e-29	0.000000	-0.000000	discard	cycle 76 u=0.0982	agent0	initial_cond	0	0.000000
exp10599	1.91190259e-29	0.000000	-0.000000	discard	cycle 76 u=0.0982	agent0	initial_cond	0	0.000000
exp10600	6.13049994e-29	0.000000	0.000000	discard	cycle 76 u=0.0985	agent0	initial_cond	1	0.000000
exp10601	6.13049994e-29	0.000000	0.000000	discard	cycle 76 u=0.0985	agent0	initial_cond	0	0.000000
exp10602	6.13049994e-29	0.000000	0.000000	discard	cycle 76 u=0.0985	agent0	initial_cond	0	0.000000
exp10603	5.49750971e-29	0.000000	0.000000	discard	cycle 76 u=0.0985	agent0	initial_cond	0	0.000000
exp10604	5.49750971e-29	0.000000	0.000000	discard	cycle 76 u=0.0985	agent0	initial_cond	0	0.000000
exp10605	5.49750971e-29	0.000000	0.000000	discard	cycle 76 u=0.0985	agent0	initial_cond	1	0.000000
exp10606	4.15642452e-29	0.000000	0.000000	discard	cycle 76 u=0.0985	agent0	initial_cond	0	0.000000
exp10607	4.15642452e-29	0.000000	0.000000	discard	cycle 76 u=0.0985	agent0	initial_cond	0	0.000000
exp10608	4.15642452e-29	0.000000	0.000000	discard	cycle 76 u=0.0985	agent0	initial_cond	0	0.000000
exp10609	2.19292611e-29	0.000000	0.000000	discard	cycle 76 u=0.0985	agent0	initial_cond	0	-0.000000
exp10610	5.15238393e-17	0.070278	-0.000000	discard	Verify SOTA reproduction	manual	verify	1	0.000097
exp10610	2.19292611e-29	0.000000	0.000000	discard	cycle 76 u=0.0985	agent0	initial_cond	1	-0.000000
exp10611	2.19292611e-29	0.000000	0.000000	discard	cycle 76 u=0.0985	agent0	initial_cond	0	-0.000000
exp10612	4.22491788e-29	0.000000	0.000000	discard	cycle 76 u=0.0990	agent0	initial_cond	0	-0.000000
exp10613	4.22491788e-29	0.000000	0.000000	discard	cycle 76 u=0.0990	agent0	initial_cond	0	-0.000000
exp10614	4.22491788e-29	0.000000	0.000000	discard	cycle 76 u=0.0990	agent0	initial_cond	0	-0.000000
exp10615	3.22245147e-29	0.000000	0.000000	discard	cycle 76 u=0.0990	agent0	initial_cond	1	0.000000
exp10616	3.22245147e-29	0.000000	0.000000	discard	cycle 76 u=0.0990	agent0	initial_cond	0	0.000000
