exp_id	residual	solution_norm	solution_mean	status	description	agent	design	elapsed_s	solution_energy
exp15360	4.15642452e-29	0.000000	0.000000	discard	cycle 120 u=0.0985	agent0	initial_cond	0	0.000000
exp15361	4.15642452e-29	0.000000	0.000000	discard	cycle 120 u=0.0985	agent0	initial_cond	0	0.000000
exp15362	4.15642452e-29	0.000000	0.000000	discard	cycle 120 u=0.0985	agent0	initial_cond	0	0.000000
exp15363	2.19292611e-29	0.000000	0.000000	discard	cycle 120 u=0.0985	agent0	initial_cond	1	-0.000000
exp15364	2.19292611e-29	0.000000	0.000000	discard	cycle 120 u=0.0985	agent0	initial_cond	0	-0.000000
exp15365	2.19292611e-29	0.000000	0.000000	discard	cycle 120 u=0.0985	agent0	initial_cond	0	-0.000000
exp15366	4.22491788e-29	0.000000	0.000000	discard	cycle 120 u=0.0990	agent0	initial_cond	0	-0.000000
exp15367	4.22491788e-29	0.000000	0.000000	discard	cycle 120 u=0.0990	agent0	initial_cond	0	-0.000000
exp15368	3.30298079e-17	0.001438	-0.000000	discard	R10 new: u=0.0 K=0.0061 amp=0.40	agent1	perturbation	1	-0.000000
exp15369	4.22491788e-29	0.000000	0.000000	discard	cycle 120 u=0.0990	agent0	initial_cond	1	-0.000000
exp15370	1.50669492e-16	0.001438	-0.000000	discard	R10 new: u=0.0 K=0.0061 amp=0.42	agent1	perturbation	0	-0.000000
exp15371	3.22245147e-29	0.000000	0.000000	discard	cycle 120 u=0.0990	agent0	initial_cond	0	0.000000
exp15372	5.74003335e-16	0.001438	-0.000000	discard	R10 new: u=0.0 K=0.0061 amp=0.44	agent1	perturbation	0	-0.000000
exp15373	3.22245147e-29	0.000000	0.000000	discard	cycle 120 u=0.0990	agent0	initial_cond	1	0.000000
exp15374	1.87209045e-15	0.001438	-0.000000	discard	R10 new: u=0.0 K=0.0061 amp=0.46	agent1	perturbation	1	-0.000000
exp15375	3.22245147e-29	0.000000	0.000000	discard	cycle 120 u=0.0990	agent0	initial_cond	0	0.000000
exp15376	5.35291696e-15	0.001438	-0.000000	discard	R10 new: u=0.0 K=0.0061 amp=0.48	agent1	perturbation	0	-0.000000
exp15377	4.50941488e-29	0.000000	-0.000000	discard	cycle 120 u=0.0990	agent0	initial_cond	0	0.000000
exp15378	3.64659294e-19	0.001438	-0.000000	discard	R10 new: u=0.0 K=0.0061 amp=0.50	agent1	perturbation	1	-0.000000
exp15379	4.50941488e-29	0.000000	-0.000000	discard	cycle 120 u=0.0990	agent0	initial_cond	0	0.000000
exp15380	1.10235807e-18	0.001438	-0.000000	discard	R10 new: u=0.0 K=0.0061 amp=0.52	agent1	perturbation	0	-0.000000
exp15381	4.50941488e-29	0.000000	-0.000000	discard	cycle 120 u=0.0990	agent0	initial_cond	0	0.000000
exp15382	1.01024990e-18	0.001438	-0.000000	discard	R10 new: u=0.0 K=0.0061 amp=0.54	agent1	perturbation	0	-0.000000
exp15383	4.88330883e-29	0.000000	-0.000000	discard	cycle 120 u=0.0990	agent0	initial_cond	1	0.000000
exp15384	4.88330883e-29	0.000000	-0.000000	discard	cycle 120 u=0.0990	agent0	initial_cond	0	0.000000
exp15385	4.88330883e-29	0.000000	-0.000000	discard	cycle 120 u=0.0990	agent0	initial_cond	1	0.000000
exp15386	5.74085541e-29	0.000000	-0.000000	discard	cycle 120 u=0.0995	agent0	initial_cond	0	0.000000
exp15387	5.74085541e-29	0.000000	-0.000000	discard	cycle 120 u=0.0995	agent0	initial_cond	0	0.000000
exp15388	5.74085541e-29	0.000000	-0.000000	discard	cycle 120 u=0.0995	agent0	initial_cond	0	0.000000
exp15389	1.54984578e-28	0.000000	0.000000	discard	cycle 120 u=0.0995	agent0	initial_cond	0	-0.000000
exp15390	1.54984578e-28	0.000000	0.000000	discard	cycle 120 u=0.0995	agent0	initial_cond	1	-0.000000
exp15391	1.54984578e-28	0.000000	0.000000	discard	cycle 120 u=0.0995	agent0	initial_cond	0	-0.000000
exp15392	1.60328418e-29	0.000000	-0.000000	discard	cycle 120 u=0.0995	agent0	initial_cond	0	-0.000000
exp15393	1.60328418e-29	0.000000	-0.000000	discard	cycle 120 u=0.0995	agent0	initial_cond	0	-0.000000
exp15394	1.60328418e-29	0.000000	-0.000000	discard	cycle 120 u=0.0995	agent0	initial_cond	0	-0.000000
exp15395	7.34590618e-29	0.000000	0.000000	discard	cycle 120 u=0.0995	agent0	initial_cond	1	0.000000
exp15396	7.34590618e-29	0.000000	0.000000	discard	cycle 120 u=0.0995	agent0	initial_cond	0	0.000000
exp15397	7.34590618e-29	0.000000	0.000000	discard	cycle 120 u=0.0995	agent0	initial_cond	1	0.000000
exp15398	4.46546993e-29	0.000000	0.000000	discard	cycle 120 u=0.1000	agent0	initial_cond	0	-0.000000
exp15399	4.46546993e-29	0.000000	0.000000	discard	cycle 120 u=0.1000	agent0	initial_cond	0	-0.000000
exp15400	4.46546993e-29	0.000000	0.000000	discard	cycle 120 u=0.1000	agent0	initial_cond	0	-0.000000
exp15401	4.08106752e-29	0.000000	0.000000	discard	cycle 120 u=0.1000	agent0	initial_cond	0	-0.000000
exp15402	4.08106752e-29	0.000000	0.000000	discard	cycle 120 u=0.1000	agent0	initial_cond	1	-0.000000
exp15403	4.08106752e-29	0.000000	0.000000	discard	cycle 120 u=0.1000	agent0	initial_cond	0	-0.000000
exp15404	4.58623706e-29	0.000000	0.000000	discard	cycle 120 u=0.1000	agent0	initial_cond	0	-0.000000
exp15405	4.58623706e-29	0.000000	0.000000	discard	cycle 120 u=0.1000	agent0	initial_cond	0	-0.000000
exp15406	4.58623706e-29	0.000000	0.000000	discard	cycle 120 u=0.1000	agent0	initial_cond	0	-0.000000
exp15407	4.39794337e-29	0.000000	0.000000	discard	cycle 120 u=0.1000	agent0	initial_cond	1	-0.000000
exp15408	4.39794337e-29	0.000000	0.000000	discard	cycle 120 u=0.1000	agent0	initial_cond	0	-0.000000
exp15409	4.39794337e-29	0.000000	0.000000	discard	cycle 120 u=0.1000	agent0	initial_cond	1	-0.000000
exp15410	1.36727475e-28	0.000000	0.000000	discard	cycle 120 u=0.1050	agent0	initial_cond	0	-0.000000
exp15411	1.36727475e-28	0.000000	0.000000	discard	cycle 120 u=0.1050	agent0	initial_cond	0	-0.000000
exp15412	1.36727475e-28	0.000000	0.000000	discard	cycle 120 u=0.1050	agent0	initial_cond	0	-0.000000
exp15413	6.14461376e-29	0.000000	0.000000	discard	cycle 120 u=0.1050	agent0	initial_cond	0	-0.000000
exp15414	6.14461376e-29	0.000000	0.000000	discard	cycle 120 u=0.1050	agent0	initial_cond	1	-0.000000
exp15415	6.14461376e-29	0.000000	0.000000	discard	cycle 120 u=0.1050	agent0	initial_cond	0	-0.000000
exp15416	1.75906666e-28	0.000000	0.000000	discard	cycle 120 u=0.1050	agent0	initial_cond	0	-0.000000
exp15417	1.75906666e-28	0.000000	0.000000	discard	cycle 120 u=0.1050	agent0	initial_cond	0	-0.000000
exp15418	1.75906666e-28	0.000000	0.000000	discard	cycle 120 u=0.1050	agent0	initial_cond	0	-0.000000
exp15419	1.11257917e-28	0.000000	0.000000	discard	cycle 120 u=0.1050	agent0	initial_cond	1	-0.000000
exp15420	1.11257917e-28	0.000000	0.000000	discard	cycle 120 u=0.1050	agent0	initial_cond	0	-0.000000
exp15421	1.11257917e-28	0.000000	0.000000	discard	cycle 120 u=0.1050	agent0	initial_cond	1	-0.000000
exp15422	8.58580947e-29	0.000000	0.000000	discard	cycle 121 u=0.0975	agent0	initial_cond	0	0.000000
exp15423	8.58580947e-29	0.000000	0.000000	discard	cycle 121 u=0.0975	agent0	initial_cond	0	0.000000
exp15424	8.58580947e-29	0.000000	0.000000	discard	cycle 121 u=0.0975	agent0	initial_cond	0	0.000000
exp15425	5.23962023e-29	0.000000	0.000000	discard	cycle 121 u=0.0975	agent0	initial_cond	0	0.000000
exp15426	5.23962023e-29	0.000000	0.000000	discard	cycle 121 u=0.0975	agent0	initial_cond	1	0.000000
exp15427	5.23962023e-29	0.000000	0.000000	discard	cycle 121 u=0.0975	agent0	initial_cond	0	0.000000
exp15428	4.03266298e-29	0.000000	0.000000	discard	cycle 121 u=0.0975	agent0	initial_cond	1	0.000000
exp15429	4.03266298e-29	0.000000	0.000000	discard	cycle 121 u=0.0975	agent0	initial_cond	0	0.000000
exp15430	4.03266298e-29	0.000000	0.000000	discard	cycle 121 u=0.0975	agent0	initial_cond	0	0.000000
exp15431	4.80015937e-29	0.000000	0.000000	discard	cycle 121 u=0.0975	agent0	initial_cond	0	0.000000
exp15432	4.80015937e-29	0.000000	0.000000	discard	cycle 121 u=0.0975	agent0	initial_cond	0	0.000000
exp15433	4.80015937e-29	0.000000	0.000000	discard	cycle 121 u=0.0975	agent0	initial_cond	1	0.000000
exp15434	2.68824537e-29	0.000000	0.000000	discard	cycle 121 u=0.0980	agent0	initial_cond	0	-0.000000
exp15435	2.68824537e-29	0.000000	0.000000	discard	cycle 121 u=0.0980	agent0	initial_cond	0	-0.000000
exp15436	2.68824537e-29	0.000000	0.000000	discard	cycle 121 u=0.0980	agent0	initial_cond	0	-0.000000
exp15437	6.16758073e-29	0.000000	0.000000	discard	cycle 121 u=0.0980	agent0	initial_cond	0	-0.000000
exp15438	6.16758073e-29	0.000000	0.000000	discard	cycle 121 u=0.0980	agent0	initial_cond	1	-0.000000
exp15439	6.16758073e-29	0.000000	0.000000	discard	cycle 121 u=0.0980	agent0	initial_cond	0	-0.000000
exp15440	2.01926478e-29	0.000000	0.000000	discard	cycle 121 u=0.0980	agent0	initial_cond	1	0.000000
exp15441	2.01926478e-29	0.000000	0.000000	discard	cycle 121 u=0.0980	agent0	initial_cond	0	0.000000
exp15442	2.01926478e-29	0.000000	0.000000	discard	cycle 121 u=0.0980	agent0	initial_cond	0	0.000000
exp15443	1.30310780e-28	0.000000	0.000000	discard	cycle 121 u=0.0980	agent0	initial_cond	0	-0.000000
exp15444	1.30310780e-28	0.000000	0.000000	discard	cycle 121 u=0.0980	agent0	initial_cond	0	-0.000000
exp15445	1.30310780e-28	0.000000	0.000000	discard	cycle 121 u=0.0980	agent0	initial_cond	1	-0.000000
exp15446	5.45343271e-29	0.000000	0.000000	discard	cycle 121 u=0.0982	agent0	initial_cond	0	-0.000000
exp15447	5.45343271e-29	0.000000	0.000000	discard	cycle 121 u=0.0982	agent0	initial_cond	0	-0.000000
exp15448	5.45343271e-29	0.000000	0.000000	discard	cycle 121 u=0.0982	agent0	initial_cond	0	-0.000000
exp15449	1.23429977e-28	0.000000	0.000000	discard	cycle 121 u=0.0982	agent0	initial_cond	0	0.000000
exp15450	1.23429977e-28	0.000000	0.000000	discard	cycle 121 u=0.0982	agent0	initial_cond	1	0.000000
exp15451	1.23429977e-28	0.000000	0.000000	discard	cycle 121 u=0.0982	agent0	initial_cond	0	0.000000
exp15452	1.88036672e-29	0.000000	0.000000	discard	cycle 121 u=0.0982	agent0	initial_cond	1	0.000000
exp15453	1.88036672e-29	0.000000	0.000000	discard	cycle 121 u=0.0982	agent0	initial_cond	0	0.000000
exp15454	1.88036672e-29	0.000000	0.000000	discard	cycle 121 u=0.0982	agent0	initial_cond	0	0.000000
exp15455	1.91190259e-29	0.000000	-0.000000	discard	cycle 121 u=0.0982	agent0	initial_cond	0	0.000000
exp15456	1.91190259e-29	0.000000	-0.000000	discard	cycle 121 u=0.0982	agent0	initial_cond	0	0.000000
exp15457	1.91190259e-29	0.000000	-0.000000	discard	cycle 121 u=0.0982	agent0	initial_cond	1	0.000000
exp15458	6.13049994e-29	0.000000	0.000000	discard	cycle 121 u=0.0985	agent0	initial_cond	0	0.000000
exp15459	6.13049994e-29	0.000000	0.000000	discard	cycle 121 u=0.0985	agent0	initial_cond	0	0.000000
exp15460	6.13049994e-29	0.000000	0.000000	discard	cycle 121 u=0.0985	agent0	initial_cond	0	0.000000
exp15461	5.49750971e-29	0.000000	0.000000	discard	cycle 121 u=0.0985	agent0	initial_cond	0	0.000000
exp15462	5.49750971e-29	0.000000	0.000000	discard	cycle 121 u=0.0985	agent0	initial_cond	1	0.000000
exp15463	5.49750971e-29	0.000000	0.000000	discard	cycle 121 u=0.0985	agent0	initial_cond	0	0.000000
exp15464	4.15642452e-29	0.000000	0.000000	discard	cycle 121 u=0.0985	agent0	initial_cond	1	0.000000
exp15465	4.15642452e-29	0.000000	0.000000	discard	cycle 121 u=0.0985	agent0	initial_cond	0	0.000000
exp15466	4.15642452e-29	0.000000	0.000000	discard	cycle 121 u=0.0985	agent0	initial_cond	0	0.000000
exp15467	2.19292611e-29	0.000000	0.000000	discard	cycle 121 u=0.0985	agent0	initial_cond	0	-0.000000
exp15468	2.19292611e-29	0.000000	0.000000	discard	cycle 121 u=0.0985	agent0	initial_cond	0	-0.000000
exp15469	2.19292611e-29	0.000000	0.000000	discard	cycle 121 u=0.0985	agent0	initial_cond	1	-0.000000
exp15470	4.22491788e-29	0.000000	0.000000	discard	cycle 121 u=0.0990	agent0	initial_cond	0	-0.000000
exp15471	4.22491788e-29	0.000000	0.000000	discard	cycle 121 u=0.0990	agent0	initial_cond	1	-0.000000
exp15472	4.22491788e-29	0.000000	0.000000	discard	cycle 121 u=0.0990	agent0	initial_cond	0	-0.000000
exp15473	3.22245147e-29	0.000000	0.000000	discard	cycle 121 u=0.0990	agent0	initial_cond	0	0.000000
exp15474	3.22245147e-29	0.000000	0.000000	discard	cycle 121 u=0.0990	agent0	initial_cond	0	0.000000
exp15475	3.22245147e-29	0.000000	0.000000	discard	cycle 121 u=0.0990	agent0	initial_cond	0	0.000000
exp15476	4.50941488e-29	0.000000	-0.000000	discard	cycle 121 u=0.0990	agent0	initial_cond	1	0.000000
exp15477	4.50941488e-29	0.000000	-0.000000	discard	cycle 121 u=0.0990	agent0	initial_cond	0	0.000000
exp15478	4.50941488e-29	0.000000	-0.000000	discard	cycle 121 u=0.0990	agent0	initial_cond	0	0.000000
exp15479	4.88330883e-29	0.000000	-0.000000	discard	cycle 121 u=0.0990	agent0	initial_cond	0	0.000000
exp15480	4.88330883e-29	0.000000	-0.000000	discard	cycle 121 u=0.0990	agent0	initial_cond	0	0.000000
exp15481	4.88330883e-29	0.000000	-0.000000	discard	cycle 121 u=0.0990	agent0	initial_cond	1	0.000000
exp15482	5.74085541e-29	0.000000	-0.000000	discard	cycle 121 u=0.0995	agent0	initial_cond	0	0.000000
exp15483	1.43263272e-17	0.047011	-0.000000	discard	R11: u=0.4 K=0.2 (exact search)	agent1	boundary	0	0.000003
exp15484	5.74085541e-29	0.000000	-0.000000	discard	cycle 121 u=0.0995	agent0	initial_cond	1	0.000000
exp15485	1.78338873e-15	0.058674	-0.000000	discard	R11: u=0.4 K=0.25 (exact search)	agent1	boundary	0	0.000033
exp15486	5.74085541e-29	0.000000	-0.000000	discard	cycle 121 u=0.0995	agent0	initial_cond	0	0.000000
exp15487	3.84319472e-17	0.070278	-0.000000	discard	R11: u=0.4 K=0.3 (exact search)	agent1	boundary	0	0.000097
exp15488	1.54984578e-28	0.000000	0.000000	discard	cycle 121 u=0.0995	agent0	initial_cond	0	-0.000000
exp15489	1.74020958e-17	0.081814	0.000000	discard	R11: u=0.4 K=0.35 (exact search)	agent1	boundary	1	0.000212
exp15490	1.54984578e-28	0.000000	0.000000	discard	cycle 121 u=0.0995	agent0	initial_cond	0	-0.000000
exp15491	8.29953055e-16	0.093272	0.000000	discard	R11: u=0.4 K=0.4 (exact search)	agent1	boundary	0	0.000394
exp15492	1.54984578e-28	0.000000	0.000000	discard	cycle 121 u=0.0995	agent0	initial_cond	0	-0.000000
exp15493	2.08072478e-17	0.104643	-0.000000	discard	R11: u=0.4 K=0.45 (exact search)	agent1	boundary	1	0.000664
exp15494	1.60328418e-29	0.000000	-0.000000	discard	cycle 121 u=0.0995	agent0	initial_cond	1	-0.000000
exp15495	9.77262851e-17	0.115920	-0.000000	discard	R11: u=0.4 K=0.5 (exact search)	agent1	boundary	0	0.001044
exp15496	1.60328418e-29	0.000000	-0.000000	discard	cycle 121 u=0.0995	agent0	initial_cond	0	-0.000000
exp15497	3.04134740e-17	0.047011	-0.000000	discard	R11: u=0.45 K=0.2 (exact search)	agent1	boundary	0	0.000003
exp15498	1.60328418e-29	0.000000	-0.000000	discard	cycle 121 u=0.0995	agent0	initial_cond	1	-0.000000
exp15499	2.53388207e-17	0.058674	-0.000000	discard	R11: u=0.45 K=0.25 (exact search)	agent1	boundary	0	0.000033
exp15500	7.34590618e-29	0.000000	0.000000	discard	cycle 121 u=0.0995	agent0	initial_cond	0	0.000000
exp15501	3.47002133e-16	0.070278	-0.000000	discard	R11: u=0.45 K=0.3 (exact search)	agent1	boundary	0	0.000097
exp15501	7.34590618e-29	0.000000	0.000000	discard	cycle 121 u=0.0995	agent0	initial_cond	0	0.000000
exp15502	7.22233754e-17	0.081814	-0.000000	discard	R11: u=0.45 K=0.35 (exact search)	agent1	boundary	1	0.000212
exp15502	7.34590618e-29	0.000000	0.000000	discard	cycle 121 u=0.0995	agent0	initial_cond	1	0.000000
exp15503	3.17508366e-17	0.093272	-0.000000	discard	R11: u=0.45 K=0.4 (exact search)	agent1	boundary	0	0.000394
exp15503	4.46546993e-29	0.000000	0.000000	discard	cycle 121 u=0.1000	agent0	initial_cond	0	-0.000000
exp15504	8.39891328e-17	0.104643	-0.000000	discard	R11: u=0.45 K=0.45 (exact search)	agent1	boundary	1	0.000664
exp15504	4.46546993e-29	0.000000	0.000000	discard	cycle 121 u=0.1000	agent0	initial_cond	1	-0.000000
exp15505	6.75727441e-17	0.115920	0.000000	discard	R11: u=0.45 K=0.5 (exact search)	agent1	boundary	0	0.001044
exp15505	4.46546993e-29	0.000000	0.000000	discard	cycle 121 u=0.1000	agent0	initial_cond	0	-0.000000
exp15506	3.56705354e-17	0.047011	0.000000	discard	R11: u=0.46 K=0.2 (exact search)	agent1	boundary	0	0.000003
exp15506	4.08106752e-29	0.000000	0.000000	discard	cycle 121 u=0.1000	agent0	initial_cond	0	-0.000000
exp15507	4.07955579e-15	0.058674	-0.000000	discard	R11: u=0.46 K=0.25 (exact search)	agent1	boundary	0	0.000033
exp15507	4.08106752e-29	0.000000	0.000000	discard	cycle 121 u=0.1000	agent0	initial_cond	0	-0.000000
exp15508	4.38505598e-17	0.070278	-0.000000	discard	R11: u=0.46 K=0.3 (exact search)	agent1	boundary	0	0.000097
exp15508	4.08106752e-29	0.000000	0.000000	discard	cycle 121 u=0.1000	agent0	initial_cond	0	-0.000000
exp15509	4.72667113e-17	0.081814	-0.000000	discard	R11: u=0.46 K=0.35 (exact search)	agent1	boundary	1	0.000212
exp15509	4.58623706e-29	0.000000	0.000000	discard	cycle 121 u=0.1000	agent0	initial_cond	1	-0.000000
exp15510	1.98181699e-16	0.093272	-0.000000	discard	R11: u=0.46 K=0.4 (exact search)	agent1	boundary	0	0.000394
exp15510	4.58623706e-29	0.000000	0.000000	discard	cycle 121 u=0.1000	agent0	initial_cond	0	-0.000000
exp15511	4.29625723e-17	0.104643	-0.000000	discard	R11: u=0.46 K=0.45 (exact search)	agent1	boundary	1	0.000664
exp15511	4.58623706e-29	0.000000	0.000000	discard	cycle 121 u=0.1000	agent0	initial_cond	1	-0.000000
exp15512	5.30180790e-17	0.115920	-0.000000	discard	R11: u=0.46 K=0.5 (exact search)	agent1	boundary	0	0.001044
exp15512	4.39794337e-29	0.000000	0.000000	discard	cycle 121 u=0.1000	agent0	initial_cond	0	-0.000000
exp15513	4.45215946e-17	0.047011	-0.000000	discard	R11: u=0.463 K=0.2 (exact search)	agent1	boundary	0	0.000003
exp15513	4.39794337e-29	0.000000	0.000000	discard	cycle 121 u=0.1000	agent0	initial_cond	0	-0.000000
exp15514	4.39794337e-29	0.000000	0.000000	discard	cycle 121 u=0.1000	agent0	initial_cond	1	-0.000000
exp15514	2.97288457e-17	0.058674	-0.000000	discard	R11: u=0.463 K=0.25 (exact search)	agent1	boundary	1	0.000033
exp15515	1.36727475e-28	0.000000	0.000000	discard	cycle 121 u=0.1050	agent0	initial_cond	0	-0.000000
exp15515	3.06503718e-15	0.070278	-0.000000	discard	R11: u=0.463 K=0.3 (exact search)	agent1	boundary	0	0.000097
exp15516	1.36727475e-28	0.000000	0.000000	discard	cycle 121 u=0.1050	agent0	initial_cond	1	-0.000000
exp15516	5.80158003e-17	0.081814	-0.000000	discard	R11: u=0.463 K=0.35 (exact search)	agent1	boundary	1	0.000212
exp15517	2.41658905e-17	0.093272	-0.000000	discard	R11: u=0.463 K=0.4 (exact search)	agent1	boundary	0	0.000394
exp15517	1.36727475e-28	0.000000	0.000000	discard	cycle 121 u=0.1050	agent0	initial_cond	0	-0.000000
exp15518	6.14461376e-29	0.000000	0.000000	discard	cycle 121 u=0.1050	agent0	initial_cond	1	-0.000000
exp15518	1.83730269e-17	0.104643	-0.000000	discard	R11: u=0.463 K=0.45 (exact search)	agent1	boundary	1	0.000664
exp15519	6.14461376e-29	0.000000	0.000000	discard	cycle 121 u=0.1050	agent0	initial_cond	0	-0.000000
exp15519	6.02536152e-17	0.115920	-0.000000	discard	R11: u=0.463 K=0.5 (exact search)	agent1	boundary	0	0.001044
exp15520	6.14461376e-29	0.000000	0.000000	discard	cycle 121 u=0.1050	agent0	initial_cond	0	-0.000000
exp15520	3.60101351e-17	0.047011	-0.000000	discard	R11: u=0.47 K=0.2 (exact search)	agent1	boundary	0	0.000003
exp15521	1.70674223e-16	1.000566	1.000009	discard	R11: u=0.47 K=0.25 (exact search)	agent1	boundary	0	-1.535109
exp15521	1.75906666e-28	0.000000	0.000000	discard	cycle 121 u=0.1050	agent0	initial_cond	0	-0.000000
exp15522	1.75906666e-28	0.000000	0.000000	discard	cycle 121 u=0.1050	agent0	initial_cond	0	-0.000000
exp15522	2.29141147e-16	1.001296	-1.000019	discard	R11: u=0.47 K=0.3 (exact search)	agent1	boundary	0	-1.520844
exp15523	1.75906666e-28	0.000000	0.000000	discard	cycle 121 u=0.1050	agent0	initial_cond	1	-0.000000
exp15523	3.86081537e-16	1.002165	-1.000034	discard	R11: u=0.47 K=0.35 (exact search)	agent1	boundary	1	-1.504028
exp15524	1.11257917e-28	0.000000	0.000000	discard	cycle 121 u=0.1050	agent0	initial_cond	0	-0.000000
exp15524	5.73635756e-17	0.093272	-0.000000	discard	R11: u=0.47 K=0.4 (exact search)	agent1	boundary	0	0.000394
exp15525	1.11257917e-28	0.000000	0.000000	discard	cycle 121 u=0.1050	agent0	initial_cond	1	-0.000000
exp15525	2.66499476e-15	0.104643	-0.000000	discard	R11: u=0.47 K=0.45 (exact search)	agent1	boundary	1	0.000664
exp15526	1.11257917e-28	0.000000	0.000000	discard	cycle 121 u=0.1050	agent0	initial_cond	0	-0.000000
exp15526	3.33343231e-17	0.115920	-0.000000	discard	R11: u=0.47 K=0.5 (exact search)	agent1	boundary	0	0.001044
exp15527	8.58580947e-29	0.000000	0.000000	discard	cycle 122 u=0.0975	agent0	initial_cond	0	0.000000
exp15527	6.19643614e-16	0.999975	-1.000004	discard	R11: u=0.5 K=0.2 (exact search)	agent1	boundary	0	-1.546805
exp15528	8.58580947e-29	0.000000	0.000000	discard	cycle 122 u=0.0975	agent0	initial_cond	0	0.000000
exp15528	6.91607368e-16	1.000566	-1.000009	discard	R11: u=0.5 K=0.25 (exact search)	agent1	boundary	0	-1.535109
exp15529	8.58580947e-29	0.000000	0.000000	discard	cycle 122 u=0.0975	agent0	initial_cond	0	0.000000
exp15529	7.46498362e-16	1.001296	-1.000019	discard	R11: u=0.5 K=0.3 (exact search)	agent1	boundary	0	-1.520844
exp15530	5.23962023e-29	0.000000	0.000000	discard	cycle 122 u=0.0975	agent0	initial_cond	1	0.000000
exp15530	3.96054250e-16	1.002165	1.000034	discard	R11: u=0.5 K=0.35 (exact search)	agent1	boundary	1	-1.504028
exp15531	5.23962023e-29	0.000000	0.000000	discard	cycle 122 u=0.0975	agent0	initial_cond	0	0.000000
exp15531	3.88867072e-16	1.003175	1.000058	discard	R11: u=0.5 K=0.4 (exact search)	agent1	boundary	0	-1.484680
exp15532	5.23962023e-29	0.000000	0.000000	discard	cycle 122 u=0.0975	agent0	initial_cond	1	0.000000
exp15532	4.45352316e-16	1.004324	1.000093	discard	R11: u=0.5 K=0.45 (exact search)	agent1	boundary	1	-1.462826
exp15533	4.03266298e-29	0.000000	0.000000	discard	cycle 122 u=0.0975	agent0	initial_cond	0	0.000000
exp15533	1.33111064e-16	1.005614	1.000140	discard	R11: u=0.5 K=0.5 (exact search)	agent1	boundary	0	-1.438489
exp15534	4.03266298e-29	0.000000	0.000000	discard	cycle 122 u=0.0975	agent0	initial_cond	0	0.000000
exp15535	4.03266298e-29	0.000000	0.000000	discard	cycle 122 u=0.0975	agent0	initial_cond	1	0.000000
exp15536	4.80015937e-29	0.000000	0.000000	discard	cycle 122 u=0.0975	agent0	initial_cond	0	0.000000
exp15537	4.80015937e-29	0.000000	0.000000	discard	cycle 122 u=0.0975	agent0	initial_cond	1	0.000000
