exp_id	residual	solution_norm	solution_mean	status	description	agent	design	elapsed_s	solution_energy
exp6005	1.88036672e-29	0.000000	0.000000	discard	cycle 35 u=0.0982	agent0	initial_cond	0	0.000000
exp6006	1.91190259e-29	0.000000	-0.000000	discard	cycle 35 u=0.0982	agent0	initial_cond	0	0.000000
exp6007	1.91190259e-29	0.000000	-0.000000	discard	cycle 35 u=0.0982	agent0	initial_cond	1	0.000000
exp6008	1.91190259e-29	0.000000	-0.000000	discard	cycle 35 u=0.0982	agent0	initial_cond	0	0.000000
exp6009	6.13049994e-29	0.000000	0.000000	discard	cycle 35 u=0.0985	agent0	initial_cond	0	0.000000
exp6010	6.13049994e-29	0.000000	0.000000	discard	cycle 35 u=0.0985	agent0	initial_cond	1	0.000000
exp6011	6.13049994e-29	0.000000	0.000000	discard	cycle 35 u=0.0985	agent0	initial_cond	0	0.000000
exp6012	5.49750971e-29	0.000000	0.000000	discard	cycle 35 u=0.0985	agent0	initial_cond	0	0.000000
exp6013	5.49750971e-29	0.000000	0.000000	discard	cycle 35 u=0.0985	agent0	initial_cond	0	0.000000
exp6014	5.49750971e-29	0.000000	0.000000	discard	cycle 35 u=0.0985	agent0	initial_cond	0	0.000000
exp6015	4.15642452e-29	0.000000	0.000000	discard	cycle 35 u=0.0985	agent0	initial_cond	1	0.000000
exp6016	4.15642452e-29	0.000000	0.000000	discard	cycle 35 u=0.0985	agent0	initial_cond	0	0.000000
exp6017	4.15642452e-29	0.000000	0.000000	discard	cycle 35 u=0.0985	agent0	initial_cond	0	0.000000
exp6018	2.19292611e-29	0.000000	0.000000	discard	cycle 35 u=0.0985	agent0	initial_cond	1	-0.000000
exp6019	2.19292611e-29	0.000000	0.000000	discard	cycle 35 u=0.0985	agent0	initial_cond	0	-0.000000
exp6020	2.19292611e-29	0.000000	0.000000	discard	cycle 35 u=0.0985	agent0	initial_cond	0	-0.000000
exp6021	4.22491788e-29	0.000000	0.000000	discard	cycle 35 u=0.0990	agent0	initial_cond	1	-0.000000
exp6022	4.22491788e-29	0.000000	0.000000	discard	cycle 35 u=0.0990	agent0	initial_cond	0	-0.000000
exp6023	4.22491788e-29	0.000000	0.000000	discard	cycle 35 u=0.0990	agent0	initial_cond	1	-0.000000
exp6024	3.39966218e-17	0.070278	-0.000000	discard	4th branch u_offset=0.365 amp=0.5 phase=1.0 modes=3	manual	memory	0	0.000097
exp6024	3.22245147e-29	0.000000	0.000000	discard	cycle 35 u=0.0990	agent0	initial_cond	0	0.000000
exp6025	3.22245147e-29	0.000000	0.000000	discard	cycle 35 u=0.0990	agent0	initial_cond	0	0.000000
exp6026	3.22245147e-29	0.000000	0.000000	discard	cycle 35 u=0.0990	agent0	initial_cond	1	0.000000
exp6027	4.50941488e-29	0.000000	-0.000000	discard	cycle 35 u=0.0990	agent0	initial_cond	0	0.000000
exp6028	4.50941488e-29	0.000000	-0.000000	discard	cycle 35 u=0.0990	agent0	initial_cond	0	0.000000
exp6029	4.50941488e-29	0.000000	-0.000000	discard	cycle 35 u=0.0990	agent0	initial_cond	1	0.000000
exp6030	4.88330883e-29	0.000000	-0.000000	discard	cycle 35 u=0.0990	agent0	initial_cond	0	0.000000
exp6031	4.88330883e-29	0.000000	-0.000000	discard	cycle 35 u=0.0990	agent0	initial_cond	0	0.000000
exp6032	4.88330883e-29	0.000000	-0.000000	discard	cycle 35 u=0.0990	agent0	initial_cond	0	0.000000
exp6033	5.74085541e-29	0.000000	-0.000000	discard	cycle 35 u=0.0995	agent0	initial_cond	0	0.000000
exp6034	5.74085541e-29	0.000000	-0.000000	discard	cycle 35 u=0.0995	agent0	initial_cond	1	0.000000
exp6035	5.74085541e-29	0.000000	-0.000000	discard	cycle 35 u=0.0995	agent0	initial_cond	0	0.000000
exp6036	1.54984578e-28	0.000000	0.000000	discard	cycle 35 u=0.0995	agent0	initial_cond	0	-0.000000
exp6037	1.54984578e-28	0.000000	0.000000	discard	cycle 35 u=0.0995	agent0	initial_cond	1	-0.000000
exp6038	1.54984578e-28	0.000000	0.000000	discard	cycle 35 u=0.0995	agent0	initial_cond	0	-0.000000
exp6039	1.60328418e-29	0.000000	-0.000000	discard	cycle 35 u=0.0995	agent0	initial_cond	0	-0.000000
exp6040	4.05995687e-17	0.070278	-0.000000	discard	4th branch u_offset=0.358 amp=0.5 phase=1.0 modes=3	manual	memory	1	0.000097
exp6041	1.60328418e-29	0.000000	-0.000000	discard	cycle 35 u=0.0995	agent0	initial_cond	0	-0.000000
exp6042	1.60328418e-29	0.000000	-0.000000	discard	cycle 35 u=0.0995	agent0	initial_cond	0	-0.000000
exp6043	7.34590618e-29	0.000000	0.000000	discard	cycle 35 u=0.0995	agent0	initial_cond	1	0.000000
exp6044	7.34590618e-29	0.000000	0.000000	discard	cycle 35 u=0.0995	agent0	initial_cond	0	0.000000
exp6045	7.34590618e-29	0.000000	0.000000	discard	cycle 35 u=0.0995	agent0	initial_cond	0	0.000000
exp6046	4.46546993e-29	0.000000	0.000000	discard	cycle 35 u=0.1000	agent0	initial_cond	1	-0.000000
exp6047	4.46546993e-29	0.000000	0.000000	discard	cycle 35 u=0.1000	agent0	initial_cond	0	-0.000000
exp6048	4.46546993e-29	0.000000	0.000000	discard	cycle 35 u=0.1000	agent0	initial_cond	0	-0.000000
exp6049	4.08106752e-29	0.000000	0.000000	discard	cycle 35 u=0.1000	agent0	initial_cond	0	-0.000000
exp6050	4.08106752e-29	0.000000	0.000000	discard	cycle 35 u=0.1000	agent0	initial_cond	0	-0.000000
exp6051	4.08106752e-29	0.000000	0.000000	discard	cycle 35 u=0.1000	agent0	initial_cond	1	-0.000000
exp6052	4.58623706e-29	0.000000	0.000000	discard	cycle 35 u=0.1000	agent0	initial_cond	0	-0.000000
exp6053	4.58623706e-29	0.000000	0.000000	discard	cycle 35 u=0.1000	agent0	initial_cond	0	-0.000000
exp6054	4.58623706e-29	0.000000	0.000000	discard	cycle 35 u=0.1000	agent0	initial_cond	1	-0.000000
exp6055	4.39794337e-29	0.000000	0.000000	discard	cycle 35 u=0.1000	agent0	initial_cond	0	-0.000000
exp6056	4.39794337e-29	0.000000	0.000000	discard	cycle 35 u=0.1000	agent0	initial_cond	0	-0.000000
exp6057	4.39794337e-29	0.000000	0.000000	discard	cycle 35 u=0.1000	agent0	initial_cond	0	-0.000000
exp6058	1.36727475e-28	0.000000	0.000000	discard	cycle 35 u=0.1050	agent0	initial_cond	0	-0.000000
exp6059	3.86031414e-15	0.000012	0.000000	discard	4th branch u_offset=0.36 amp=0.5 phase=1.0 modes=2	manual	memory	0	-0.000000
exp6060	1.36727475e-28	0.000000	0.000000	discard	cycle 35 u=0.1050	agent0	initial_cond	1	-0.000000
exp6061	1.36727475e-28	0.000000	0.000000	discard	cycle 35 u=0.1050	agent0	initial_cond	0	-0.000000
exp6062	6.14461376e-29	0.000000	0.000000	discard	cycle 35 u=0.1050	agent0	initial_cond	0	-0.000000
exp6063	6.14461376e-29	0.000000	0.000000	discard	cycle 35 u=0.1050	agent0	initial_cond	1	-0.000000
exp6064	6.14461376e-29	0.000000	0.000000	discard	cycle 35 u=0.1050	agent0	initial_cond	0	-0.000000
exp6065	1.75906666e-28	0.000000	0.000000	discard	cycle 35 u=0.1050	agent0	initial_cond	0	-0.000000
exp6066	1.75906666e-28	0.000000	0.000000	discard	cycle 35 u=0.1050	agent0	initial_cond	0	-0.000000
exp6067	1.75906666e-28	0.000000	0.000000	discard	cycle 35 u=0.1050	agent0	initial_cond	0	-0.000000
exp6068	1.11257917e-28	0.000000	0.000000	discard	cycle 35 u=0.1050	agent0	initial_cond	1	-0.000000
exp6069	1.11257917e-28	0.000000	0.000000	discard	cycle 35 u=0.1050	agent0	initial_cond	0	-0.000000
exp6070	1.11257917e-28	0.000000	0.000000	discard	cycle 35 u=0.1050	agent0	initial_cond	0	-0.000000
exp6071	8.58580947e-29	0.000000	0.000000	discard	cycle 36 u=0.0975	agent0	initial_cond	1	0.000000
exp6072	8.58580947e-29	0.000000	0.000000	discard	cycle 36 u=0.0975	agent0	initial_cond	0	0.000000
exp6073	7.84383584e-24	0.000000	-0.000000	discard	4th branch u_offset=0.36 amp=0.5 phase=1.0 modes=1	manual	memory	0	-0.000000
exp6074	8.58580947e-29	0.000000	0.000000	discard	cycle 36 u=0.0975	agent0	initial_cond	0	0.000000
exp6075	5.23962023e-29	0.000000	0.000000	discard	cycle 36 u=0.0975	agent0	initial_cond	0	0.000000
exp6076	5.23962023e-29	0.000000	0.000000	discard	cycle 36 u=0.0975	agent0	initial_cond	0	0.000000
exp6077	5.23962023e-29	0.000000	0.000000	discard	cycle 36 u=0.0975	agent0	initial_cond	1	0.000000
exp6078	4.03266298e-29	0.000000	0.000000	discard	cycle 36 u=0.0975	agent0	initial_cond	0	0.000000
exp6079	4.03266298e-29	0.000000	0.000000	discard	cycle 36 u=0.0975	agent0	initial_cond	0	0.000000
exp6080	4.03266298e-29	0.000000	0.000000	discard	cycle 36 u=0.0975	agent0	initial_cond	1	0.000000
exp6081	4.80015937e-29	0.000000	0.000000	discard	cycle 36 u=0.0975	agent0	initial_cond	0	0.000000
exp6082	4.80015937e-29	0.000000	0.000000	discard	cycle 36 u=0.0975	agent0	initial_cond	0	0.000000
exp6083	4.80015937e-29	0.000000	0.000000	discard	cycle 36 u=0.0975	agent0	initial_cond	0	0.000000
exp6084	2.68824537e-29	0.000000	0.000000	discard	cycle 36 u=0.0980	agent0	initial_cond	0	-0.000000
exp6085	2.68824537e-29	0.000000	0.000000	discard	cycle 36 u=0.0980	agent0	initial_cond	1	-0.000000
exp6086	2.68824537e-29	0.000000	0.000000	discard	cycle 36 u=0.0980	agent0	initial_cond	0	-0.000000
exp6087	6.16758073e-29	0.000000	0.000000	discard	cycle 36 u=0.0980	agent0	initial_cond	0	-0.000000
exp6088	6.16758073e-29	0.000000	0.000000	discard	cycle 36 u=0.0980	agent0	initial_cond	1	-0.000000
exp6089	6.16758073e-29	0.000000	0.000000	discard	cycle 36 u=0.0980	agent0	initial_cond	0	-0.000000
exp6090	5.36169987e-17	0.070536	0.000000	discard	4th branch u_offset=0.36 amp=0.5 phase=1.0 modes=5	manual	memory	0	0.000099
exp6091	2.01926478e-29	0.000000	0.000000	discard	cycle 36 u=0.0980	agent0	initial_cond	0	0.000000
exp6092	2.01926478e-29	0.000000	0.000000	discard	cycle 36 u=0.0980	agent0	initial_cond	0	0.000000
exp6093	2.01926478e-29	0.000000	0.000000	discard	cycle 36 u=0.0980	agent0	initial_cond	0	0.000000
exp6094	1.30310780e-28	0.000000	0.000000	discard	cycle 36 u=0.0980	agent0	initial_cond	1	-0.000000
exp6095	1.30310780e-28	0.000000	0.000000	discard	cycle 36 u=0.0980	agent0	initial_cond	0	-0.000000
exp6096	1.30310780e-28	0.000000	0.000000	discard	cycle 36 u=0.0980	agent0	initial_cond	0	-0.000000
exp6097	5.45343271e-29	0.000000	0.000000	discard	cycle 36 u=0.0982	agent0	initial_cond	1	-0.000000
exp6098	5.45343271e-29	0.000000	0.000000	discard	cycle 36 u=0.0982	agent0	initial_cond	0	-0.000000
exp6099	5.45343271e-29	0.000000	0.000000	discard	cycle 36 u=0.0982	agent0	initial_cond	0	-0.000000
exp6100	1.23429977e-28	0.000000	0.000000	discard	cycle 36 u=0.0982	agent0	initial_cond	0	0.000000
exp6101	1.23429977e-28	0.000000	0.000000	discard	cycle 36 u=0.0982	agent0	initial_cond	0	0.000000
exp6102	1.23429977e-28	0.000000	0.000000	discard	cycle 36 u=0.0982	agent0	initial_cond	1	0.000000
exp6103	1.88036672e-29	0.000000	0.000000	discard	cycle 36 u=0.0982	agent0	initial_cond	0	0.000000
exp6104	1.88036672e-29	0.000000	0.000000	discard	cycle 36 u=0.0982	agent0	initial_cond	0	0.000000
exp6105	1.88036672e-29	0.000000	0.000000	discard	cycle 36 u=0.0982	agent0	initial_cond	1	0.000000
exp6106	1.91190259e-29	0.000000	-0.000000	discard	cycle 36 u=0.0982	agent0	initial_cond	0	0.000000
exp6107	1.91190259e-29	0.000000	-0.000000	discard	cycle 36 u=0.0982	agent0	initial_cond	0	0.000000
exp6108	1.91190259e-29	0.000000	-0.000000	discard	cycle 36 u=0.0982	agent0	initial_cond	0	0.000000
exp6109	6.13049994e-29	0.000000	0.000000	discard	cycle 36 u=0.0985	agent0	initial_cond	0	0.000000
exp6110	2.57581612e-16	1.001296	1.000019	discard	positive branch u=0.9 baseline	manual	memory	0	-1.520844
exp6111	6.13049994e-29	0.000000	0.000000	discard	cycle 36 u=0.0985	agent0	initial_cond	1	0.000000
exp6112	6.13049994e-29	0.000000	0.000000	discard	cycle 36 u=0.0985	agent0	initial_cond	0	0.000000
exp6113	5.49750971e-29	0.000000	0.000000	discard	cycle 36 u=0.0985	agent0	initial_cond	0	0.000000
exp6114	5.49750971e-29	0.000000	0.000000	discard	cycle 36 u=0.0985	agent0	initial_cond	1	0.000000
exp6115	5.49750971e-29	0.000000	0.000000	discard	cycle 36 u=0.0985	agent0	initial_cond	0	0.000000
exp6116	4.15642452e-29	0.000000	0.000000	discard	cycle 36 u=0.0985	agent0	initial_cond	0	0.000000
exp6117	4.15642452e-29	0.000000	0.000000	discard	cycle 36 u=0.0985	agent0	initial_cond	0	0.000000
exp6118	4.15642452e-29	0.000000	0.000000	discard	cycle 36 u=0.0985	agent0	initial_cond	0	0.000000
exp6119	2.19292611e-29	0.000000	0.000000	discard	cycle 36 u=0.0985	agent0	initial_cond	1	-0.000000
exp6120	2.19292611e-29	0.000000	0.000000	discard	cycle 36 u=0.0985	agent0	initial_cond	0	-0.000000
exp6121	2.19292611e-29	0.000000	0.000000	discard	cycle 36 u=0.0985	agent0	initial_cond	0	-0.000000
exp6122	4.22491788e-29	0.000000	0.000000	discard	cycle 36 u=0.0990	agent0	initial_cond	1	-0.000000
exp6123	4.22491788e-29	0.000000	0.000000	discard	cycle 36 u=0.0990	agent0	initial_cond	0	-0.000000
exp6124	4.22491788e-29	0.000000	0.000000	discard	cycle 36 u=0.0990	agent0	initial_cond	0	-0.000000
exp6124	2.01875310e-15	1.001296	1.000019	discard	positive branch u=1.0	manual	memory	1	-1.520844
exp6125	3.22245147e-29	0.000000	0.000000	discard	cycle 36 u=0.0990	agent0	initial_cond	0	0.000000
exp6126	3.22245147e-29	0.000000	0.000000	discard	cycle 36 u=0.0990	agent0	initial_cond	0	0.000000
exp6127	3.22245147e-29	0.000000	0.000000	discard	cycle 36 u=0.0990	agent0	initial_cond	1	0.000000
exp6128	4.50941488e-29	0.000000	-0.000000	discard	cycle 36 u=0.0990	agent0	initial_cond	0	0.000000
exp6129	4.50941488e-29	0.000000	-0.000000	discard	cycle 36 u=0.0990	agent0	initial_cond	0	0.000000
exp6130	4.50941488e-29	0.000000	-0.000000	discard	cycle 36 u=0.0990	agent0	initial_cond	1	0.000000
exp6131	4.88330883e-29	0.000000	-0.000000	discard	cycle 36 u=0.0990	agent0	initial_cond	0	0.000000
exp6132	4.88330883e-29	0.000000	-0.000000	discard	cycle 36 u=0.0990	agent0	initial_cond	0	0.000000
exp6133	4.88330883e-29	0.000000	-0.000000	discard	cycle 36 u=0.0990	agent0	initial_cond	0	0.000000
exp6134	5.74085541e-29	0.000000	-0.000000	discard	cycle 36 u=0.0995	agent0	initial_cond	0	0.000000
exp6135	5.74085541e-29	0.000000	-0.000000	discard	cycle 36 u=0.0995	agent0	initial_cond	1	0.000000
exp6136	5.74085541e-29	0.000000	-0.000000	discard	cycle 36 u=0.0995	agent0	initial_cond	0	0.000000
exp6137	1.54984578e-28	0.000000	0.000000	discard	cycle 36 u=0.0995	agent0	initial_cond	0	-0.000000
exp6138	1.54984578e-28	0.000000	0.000000	discard	cycle 36 u=0.0995	agent0	initial_cond	1	-0.000000
exp6139	1.54984578e-28	0.000000	0.000000	discard	cycle 36 u=0.0995	agent0	initial_cond	0	-0.000000
exp6139	1.86448479e-16	1.001296	1.000019	discard	positive branch u=1.44	manual	memory	0	-1.520844
exp6140	1.60328418e-29	0.000000	-0.000000	discard	cycle 36 u=0.0995	agent0	initial_cond	0	-0.000000
exp6141	1.60328418e-29	0.000000	-0.000000	discard	cycle 36 u=0.0995	agent0	initial_cond	0	-0.000000
exp6142	1.60328418e-29	0.000000	-0.000000	discard	cycle 36 u=0.0995	agent0	initial_cond	0	-0.000000
exp6143	7.34590618e-29	0.000000	0.000000	discard	cycle 36 u=0.0995	agent0	initial_cond	1	0.000000
exp6144	7.34590618e-29	0.000000	0.000000	discard	cycle 36 u=0.0995	agent0	initial_cond	0	0.000000
exp6145	7.34590618e-29	0.000000	0.000000	discard	cycle 36 u=0.0995	agent0	initial_cond	0	0.000000
exp6146	4.46546993e-29	0.000000	0.000000	discard	cycle 36 u=0.1000	agent0	initial_cond	1	-0.000000
exp6147	4.46546993e-29	0.000000	0.000000	discard	cycle 36 u=0.1000	agent0	initial_cond	0	-0.000000
exp6148	4.46546993e-29	0.000000	0.000000	discard	cycle 36 u=0.1000	agent0	initial_cond	1	-0.000000
exp6149	4.08106752e-29	0.000000	0.000000	discard	cycle 36 u=0.1000	agent0	initial_cond	0	-0.000000
exp6150	4.08106752e-29	0.000000	0.000000	discard	cycle 36 u=0.1000	agent0	initial_cond	0	-0.000000
exp6151	4.08106752e-29	0.000000	0.000000	discard	cycle 36 u=0.1000	agent0	initial_cond	1	-0.000000
exp6152	4.58623706e-29	0.000000	0.000000	discard	cycle 36 u=0.1000	agent0	initial_cond	0	-0.000000
exp6153	4.58623706e-29	0.000000	0.000000	discard	cycle 36 u=0.1000	agent0	initial_cond	0	-0.000000
exp6154	4.58623706e-29	0.000000	0.000000	discard	cycle 36 u=0.1000	agent0	initial_cond	1	-0.000000
exp6155	4.39794337e-29	0.000000	0.000000	discard	cycle 36 u=0.1000	agent0	initial_cond	0	-0.000000
exp6156	4.39794337e-29	0.000000	0.000000	discard	cycle 36 u=0.1000	agent0	initial_cond	1	-0.000000
exp6157	4.39794337e-29	0.000000	0.000000	discard	cycle 36 u=0.1000	agent0	initial_cond	0	-0.000000
exp6158	1.36727475e-28	0.000000	0.000000	discard	cycle 36 u=0.1050	agent0	initial_cond	0	-0.000000
exp6159	1.36727475e-28	0.000000	0.000000	discard	cycle 36 u=0.1050	agent0	initial_cond	1	-0.000000
exp6160	1.36727475e-28	0.000000	0.000000	discard	cycle 36 u=0.1050	agent0	initial_cond	0	-0.000000
exp6161	6.14461376e-29	0.000000	0.000000	discard	cycle 36 u=0.1050	agent0	initial_cond	0	-0.000000
exp6162	6.14461376e-29	0.000000	0.000000	discard	cycle 36 u=0.1050	agent0	initial_cond	0	-0.000000
exp6163	6.14461376e-29	0.000000	0.000000	discard	cycle 36 u=0.1050	agent0	initial_cond	0	-0.000000
exp6164	1.75906666e-28	0.000000	0.000000	discard	cycle 36 u=0.1050	agent0	initial_cond	1	-0.000000
exp6165	1.75906666e-28	0.000000	0.000000	discard	cycle 36 u=0.1050	agent0	initial_cond	0	-0.000000
exp6166	1.75906666e-28	0.000000	0.000000	discard	cycle 36 u=0.1050	agent0	initial_cond	0	-0.000000
exp6167	1.86448479e-16	1.001296	-1.000019	discard	negative branch u=-1.44	manual	memory	0	-1.520844
exp6168	1.11257917e-28	0.000000	0.000000	discard	cycle 36 u=0.1050	agent0	initial_cond	1	-0.000000
exp6169	1.11257917e-28	0.000000	0.000000	discard	cycle 36 u=0.1050	agent0	initial_cond	0	-0.000000
exp6170	1.11257917e-28	0.000000	0.000000	discard	cycle 36 u=0.1050	agent0	initial_cond	0	-0.000000
exp6171	8.58580947e-29	0.000000	0.000000	discard	cycle 37 u=0.0975	agent0	initial_cond	0	0.000000
exp6172	8.58580947e-29	0.000000	0.000000	discard	cycle 37 u=0.0975	agent0	initial_cond	0	0.000000
exp6173	8.58580947e-29	0.000000	0.000000	discard	cycle 37 u=0.0975	agent0	initial_cond	1	0.000000
exp6174	5.23962023e-29	0.000000	0.000000	discard	cycle 37 u=0.0975	agent0	initial_cond	0	0.000000
exp6175	5.23962023e-29	0.000000	0.000000	discard	cycle 37 u=0.0975	agent0	initial_cond	0	0.000000
exp6176	5.23962023e-29	0.000000	0.000000	discard	cycle 37 u=0.0975	agent0	initial_cond	1	0.000000
exp6177	4.03266298e-29	0.000000	0.000000	discard	cycle 37 u=0.0975	agent0	initial_cond	0	0.000000
exp6178	4.03266298e-29	0.000000	0.000000	discard	cycle 37 u=0.0975	agent0	initial_cond	1	0.000000
exp6179	4.03266298e-29	0.000000	0.000000	discard	cycle 37 u=0.0975	agent0	initial_cond	0	0.000000
exp6180	4.80015937e-29	0.000000	0.000000	discard	cycle 37 u=0.0975	agent0	initial_cond	0	0.000000
exp6181	4.80015937e-29	0.000000	0.000000	discard	cycle 37 u=0.0975	agent0	initial_cond	1	0.000000
exp6182	4.80015937e-29	0.000000	0.000000	discard	cycle 37 u=0.0975	agent0	initial_cond	0	0.000000
exp6183	2.68824537e-29	0.000000	0.000000	discard	cycle 37 u=0.0980	agent0	initial_cond	0	-0.000000
exp6184	2.68824537e-29	0.000000	0.000000	discard	cycle 37 u=0.0980	agent0	initial_cond	1	-0.000000
exp6185	2.68824537e-29	0.000000	0.000000	discard	cycle 37 u=0.0980	agent0	initial_cond	0	-0.000000
exp6186	6.16758073e-29	0.000000	0.000000	discard	cycle 37 u=0.0980	agent0	initial_cond	1	-0.000000
exp6187	4.16759869e-16	1.001296	1.000019	discard	hunt new branch u=0 amp=1.0 phase=1.0 modes=5	manual	memory	0	-1.520844
exp6187	6.16758073e-29	0.000000	0.000000	discard	cycle 37 u=0.0980	agent0	initial_cond	0	-0.000000
exp6188	6.16758073e-29	0.000000	0.000000	discard	cycle 37 u=0.0980	agent0	initial_cond	0	-0.000000
exp6189	2.01926478e-29	0.000000	0.000000	discard	cycle 37 u=0.0980	agent0	initial_cond	1	0.000000
exp6190	2.01926478e-29	0.000000	0.000000	discard	cycle 37 u=0.0980	agent0	initial_cond	0	0.000000
exp6191	2.01926478e-29	0.000000	0.000000	discard	cycle 37 u=0.0980	agent0	initial_cond	0	0.000000
exp6192	1.30310780e-28	0.000000	0.000000	discard	cycle 37 u=0.0980	agent0	initial_cond	0	-0.000000
exp6193	1.30310780e-28	0.000000	0.000000	discard	cycle 37 u=0.0980	agent0	initial_cond	0	-0.000000
exp6194	1.30310780e-28	0.000000	0.000000	discard	cycle 37 u=0.0980	agent0	initial_cond	1	-0.000000
exp6195	5.45343271e-29	0.000000	0.000000	discard	cycle 37 u=0.0982	agent0	initial_cond	0	-0.000000
exp6196	5.45343271e-29	0.000000	0.000000	discard	cycle 37 u=0.0982	agent0	initial_cond	0	-0.000000
exp6197	5.45343271e-29	0.000000	0.000000	discard	cycle 37 u=0.0982	agent0	initial_cond	1	-0.000000
exp6198	1.23429977e-28	0.000000	0.000000	discard	cycle 37 u=0.0982	agent0	initial_cond	0	0.000000
exp6199	1.23429977e-28	0.000000	0.000000	discard	cycle 37 u=0.0982	agent0	initial_cond	0	0.000000
exp6200	1.23429977e-28	0.000000	0.000000	discard	cycle 37 u=0.0982	agent0	initial_cond	0	0.000000
exp6201	1.88036672e-29	0.000000	0.000000	discard	cycle 37 u=0.0982	agent0	initial_cond	0	0.000000
exp6202	1.88036672e-29	0.000000	0.000000	discard	cycle 37 u=0.0982	agent0	initial_cond	1	0.000000
exp6203	1.88036672e-29	0.000000	0.000000	discard	cycle 37 u=0.0982	agent0	initial_cond	0	0.000000
exp6204	1.91190259e-29	0.000000	-0.000000	discard	cycle 37 u=0.0982	agent0	initial_cond	0	0.000000
exp6205	1.91190259e-29	0.000000	-0.000000	discard	cycle 37 u=0.0982	agent0	initial_cond	1	0.000000
exp6206	1.91190259e-29	0.000000	-0.000000	discard	cycle 37 u=0.0982	agent0	initial_cond	0	0.000000
exp6207	6.13049994e-29	0.000000	0.000000	discard	cycle 37 u=0.0985	agent0	initial_cond	0	0.000000
exp6207	1.07971924e-16	0.070278	0.000000	discard	4th branch (symmetric) u=-0.36 amp=0.5 phase=-1.0	manual	memory	1	0.000097
exp6208	6.13049994e-29	0.000000	0.000000	discard	cycle 37 u=0.0985	agent0	initial_cond	0	0.000000
exp6209	6.13049994e-29	0.000000	0.000000	discard	cycle 37 u=0.0985	agent0	initial_cond	0	0.000000
exp6210	5.49750971e-29	0.000000	0.000000	discard	cycle 37 u=0.0985	agent0	initial_cond	1	0.000000
exp6211	5.49750971e-29	0.000000	0.000000	discard	cycle 37 u=0.0985	agent0	initial_cond	0	0.000000
exp6212	5.49750971e-29	0.000000	0.000000	discard	cycle 37 u=0.0985	agent0	initial_cond	0	0.000000
exp6213	4.15642452e-29	0.000000	0.000000	discard	cycle 37 u=0.0985	agent0	initial_cond	1	0.000000
exp6214	4.15642452e-29	0.000000	0.000000	discard	cycle 37 u=0.0985	agent0	initial_cond	0	0.000000
exp6215	4.15642452e-29	0.000000	0.000000	discard	cycle 37 u=0.0985	agent0	initial_cond	0	0.000000
exp6216	2.19292611e-29	0.000000	0.000000	discard	cycle 37 u=0.0985	agent0	initial_cond	0	-0.000000
exp6217	2.19292611e-29	0.000000	0.000000	discard	cycle 37 u=0.0985	agent0	initial_cond	0	-0.000000
exp6218	2.19292611e-29	0.000000	0.000000	discard	cycle 37 u=0.0985	agent0	initial_cond	1	-0.000000
exp6219	4.22491788e-29	0.000000	0.000000	discard	cycle 37 u=0.0990	agent0	initial_cond	0	-0.000000
