exp_id	residual	solution_norm	solution_mean	status	description	agent	design	elapsed_s	solution_energy
exp3666	7.34590618e-29	0.000000	0.000000	discard	cycle 16 u=0.0995	agent0	initial_cond	0	0.000000
exp3667	7.34590618e-29	0.000000	0.000000	discard	cycle 16 u=0.0995	agent0	initial_cond	0	0.000000
exp3668	7.34590618e-29	0.000000	0.000000	discard	cycle 16 u=0.0995	agent0	initial_cond	1	0.000000
exp3669	4.46546993e-29	0.000000	0.000000	discard	cycle 16 u=0.1000	agent0	initial_cond	0	-0.000000
exp3670	4.46546993e-29	0.000000	0.000000	discard	cycle 16 u=0.1000	agent0	initial_cond	0	-0.000000
exp3671	4.46546993e-29	0.000000	0.000000	discard	cycle 16 u=0.1000	agent0	initial_cond	1	-0.000000
exp3672	4.08106752e-29	0.000000	0.000000	discard	cycle 16 u=0.1000	agent0	initial_cond	0	-0.000000
exp3673	4.08106752e-29	0.000000	0.000000	discard	cycle 16 u=0.1000	agent0	initial_cond	0	-0.000000
exp3674	4.08106752e-29	0.000000	0.000000	discard	cycle 16 u=0.1000	agent0	initial_cond	0	-0.000000
exp3675	2.87608203e-17	0.058824	0.000000	discard	fine_grid phase=1.50 amp=0.25	agent1	perturbation	0	0.000033
exp3675	4.58623706e-29	0.000000	0.000000	discard	cycle 16 u=0.1000	agent0	initial_cond	0	-0.000000
exp3676	7.61970838e-17	0.070535	0.000000	discard	fine_grid phase=1.50 amp=0.30	agent1	perturbation	1	0.000099
exp3676	4.58623706e-29	0.000000	0.000000	discard	cycle 16 u=0.1000	agent0	initial_cond	1	-0.000000
exp3677	5.03240039e-17	0.082217	0.000000	discard	fine_grid phase=1.50 amp=0.35	agent1	perturbation	0	0.000216
exp3677	4.58623706e-29	0.000000	0.000000	discard	cycle 16 u=0.1000	agent0	initial_cond	0	-0.000000
exp3678	2.60230385e-17	0.058824	0.000000	discard	fine_grid phase=1.55 amp=0.25	agent1	perturbation	0	0.000033
exp3678	4.39794337e-29	0.000000	0.000000	discard	cycle 16 u=0.1000	agent0	initial_cond	0	-0.000000
exp3679	4.39794337e-29	0.000000	0.000000	discard	cycle 16 u=0.1000	agent0	initial_cond	1	-0.000000
exp3679	5.52902988e-17	0.070535	0.000000	discard	fine_grid phase=1.55 amp=0.30	agent1	perturbation	1	0.000099
exp3680	4.39794337e-29	0.000000	0.000000	discard	Fourier 4 modes u=0.5	agent0	branch_search	0	-0.000000
exp3680	4.39794337e-29	0.000000	0.000000	discard	cycle 16 u=0.1000	agent0	initial_cond	0	-0.000000
exp3680	8.92873890e-17	0.082217	-0.000000	discard	fine_grid phase=1.55 amp=0.35	agent1	perturbation	0	0.000216
exp3681	2.06102671e-15	1.001296	1.000019	discard	cycle 16 u=0.1050	agent0	initial_cond	1	-1.520844
exp3681	2.06102671e-15	1.001296	1.000019	discard	Fourier 4 modes u=0.8	agent0	branch_search	1	-1.520844
exp3681	2.34651361e-17	0.058824	0.000000	discard	fine_grid phase=1.57 amp=0.25	agent1	perturbation	1	0.000033
exp3682	3.84592606e-16	1.001296	1.000019	discard	cycle 16 u=0.1050	agent0	initial_cond	0	-1.520844
exp3682	7.28145628e-17	0.070535	0.000000	discard	fine_grid phase=1.57 amp=0.30	agent1	perturbation	0	0.000099
exp3683	3.84592606e-16	1.001296	1.000019	discard	Fourier 4 modes u=0.9	agent0	branch_search	0	-1.520844
exp3684	2.06774381e-16	1.001296	1.000019	discard	cycle 16 u=0.1050	agent0	initial_cond	0	-1.520844
exp3685	1.75925969e-17	0.082217	0.000000	discard	fine_grid phase=1.57 amp=0.35	agent1	perturbation	0	0.000216
exp3686	6.14461376e-29	0.000000	0.000000	discard	Fourier 4 modes u=1.0	agent0	branch_search	0	-0.000000
exp3687	4.87416595e-14	1.001296	1.000019	discard	cycle 16 u=0.1050	agent0	initial_cond	1	-1.520844
exp3688	3.77060482e-17	0.058824	0.000000	discard	fine_grid phase=1.59 amp=0.25	agent1	perturbation	1	0.000033
exp3689	6.14461376e-29	0.000000	0.000000	discard	Fourier 4 modes u=1.1	agent0	branch_search	0	-0.000000
exp3690	1.86448479e-16	1.001296	1.000019	discard	cycle 16 u=0.1050	agent0	initial_cond	0	-1.520844
exp3691	7.48468891e-17	0.070535	-0.000000	discard	fine_grid phase=1.59 amp=0.30	agent1	perturbation	0	0.000099
exp3692	6.14461376e-29	0.000000	0.000000	discard	Fourier 4 modes u=1.2	agent0	branch_search	0	-0.000000
exp3693	2.57581612e-16	1.001296	1.000019	discard	cycle 16 u=0.1050	agent0	initial_cond	1	-1.520844
exp3694	3.06729024e-17	0.082217	0.000000	discard	fine_grid phase=1.59 amp=0.35	agent1	perturbation	1	0.000216
exp3695	1.75906666e-28	0.000000	0.000000	discard	Fourier 4 modes u=1.5	agent0	branch_search	1	-0.000000
exp3696	1.75906666e-28	0.000000	0.000000	discard	cycle 16 u=0.1050	agent0	initial_cond	0	-0.000000
exp3697	3.10210988e-17	0.058824	0.000000	discard	fine_grid phase=1.64 amp=0.25	agent1	perturbation	0	0.000033
exp3698	1.75906666e-28	0.000000	0.000000	discard	Fourier 4 modes u=2.0	agent0	branch_search	0	-0.000000
exp3699	1.75906666e-28	0.000000	0.000000	discard	cycle 16 u=0.1050	agent0	initial_cond	0	-0.000000
exp3700	4.44261653e-17	0.070535	0.000000	discard	fine_grid phase=1.64 amp=0.30	agent1	perturbation	0	0.000099
exp3701	1.75906666e-28	0.000000	0.000000	discard	cycle 16 u=0.1050	agent0	initial_cond	1	-0.000000
exp3702	6.73123399e-17	0.082217	0.000000	discard	fine_grid phase=1.64 amp=0.35	agent1	perturbation	1	0.000216
exp3703	1.11257917e-28	0.000000	0.000000	discard	cycle 16 u=0.1050	agent0	initial_cond	0	-0.000000
exp3704	0.00000000e+00	0.998999	1.000000	discard	symmetric_boundary pos u=0.462 fourier=2	agent1	branch_search	0	-1.567655
exp3705	1.11257917e-28	0.000000	0.000000	discard	cycle 16 u=0.1050	agent0	initial_cond	0	-0.000000
exp3706	0.00000000e+00	0.998999	-1.000000	discard	symmetric_boundary neg u=-.462 fourier=2	agent1	branch_search	1	-1.567655
exp3707	1.11257917e-28	0.000000	0.000000	discard	cycle 16 u=0.1050	agent0	initial_cond	0	-0.000000
exp3708	0.00000000e+00	0.998999	1.000000	discard	symmetric_boundary pos u=0.4625 fourier=2	agent1	branch_search	0	-1.567655
exp3709	8.58580947e-29	0.000000	0.000000	discard	cycle 17 u=0.0975	agent0	initial_cond	0	0.000000
exp3710	0.00000000e+00	0.998999	-1.000000	discard	symmetric_boundary neg u=-.4625 fourier=2	agent1	branch_search	0	-1.567655
exp3711	8.58580947e-29	0.000000	0.000000	discard	cycle 17 u=0.0975	agent0	initial_cond	1	0.000000
exp3712	0.00000000e+00	0.998999	1.000000	discard	symmetric_boundary pos u=0.4630 fourier=2	agent1	branch_search	1	-1.567655
exp3713	8.58580947e-29	0.000000	0.000000	discard	cycle 17 u=0.0975	agent0	initial_cond	0	0.000000
exp3714	0.00000000e+00	0.998999	-1.000000	discard	symmetric_boundary neg u=-.4630 fourier=2	agent1	branch_search	0	-1.567655
exp3715	5.23962023e-29	0.000000	0.000000	discard	cycle 17 u=0.0975	agent0	initial_cond	0	0.000000
exp3716	0.00000000e+00	0.998999	1.000000	discard	symmetric_boundary pos u=0.4635 fourier=2	agent1	branch_search	0	-1.567655
exp3717	5.23962023e-29	0.000000	0.000000	discard	cycle 17 u=0.0975	agent0	initial_cond	1	0.000000
exp3718	0.00000000e+00	0.998999	-1.000000	discard	symmetric_boundary neg u=-.4635 fourier=2	agent1	branch_search	0	-1.567655
exp3719	5.23962023e-29	0.000000	0.000000	discard	cycle 17 u=0.0975	agent0	initial_cond	0	0.000000
exp3720	8.88178420e-16	0.998999	1.000000	discard	symmetric_boundary pos u=0.4640 fourier=2	agent1	branch_search	0	-1.567655
exp3721	4.03266298e-29	0.000000	0.000000	discard	cycle 17 u=0.0975	agent0	initial_cond	0	0.000000
exp3722	8.88178420e-16	0.998999	-1.000000	discard	symmetric_boundary neg u=-.4640 fourier=2	agent1	branch_search	1	-1.567655
exp3723	4.03266298e-29	0.000000	0.000000	discard	cycle 17 u=0.0975	agent0	initial_cond	0	0.000000
exp3724	0.00000000e+00	0.998999	1.000000	discard	nontrivial_scan u=0.85 fourier=2 tol=1e-9	agent1	branch_search	0	-1.567655
exp3725	4.03266298e-29	0.000000	0.000000	discard	cycle 17 u=0.0975	agent0	initial_cond	0	0.000000
exp3726	0.00000000e+00	0.998999	1.000000	discard	nontrivial_scan u=0.95 fourier=2 tol=1e-9	agent1	branch_search	0	-1.567655
exp3727	4.80015937e-29	0.000000	0.000000	discard	cycle 17 u=0.0975	agent0	initial_cond	1	0.000000
exp3728	0.00000000e+00	0.998999	1.000000	discard	nontrivial_scan u=1.05 fourier=2 tol=1e-9	agent1	branch_search	0	-1.567655
exp3729	4.80015937e-29	0.000000	0.000000	discard	cycle 17 u=0.0975	agent0	initial_cond	0	0.000000
exp3730	0.00000000e+00	0.998999	1.000000	discard	nontrivial_scan u=1.15 fourier=2 tol=1e-9	agent1	branch_search	0	-1.567655
exp3731	4.80015937e-29	0.000000	0.000000	discard	cycle 17 u=0.0975	agent0	initial_cond	0	0.000000
exp3732	0.00000000e+00	0.998999	1.000000	discard	nontrivial_scan u=1.25 fourier=2 tol=1e-9	agent1	branch_search	1	-1.567655
exp3733	2.68824537e-29	0.000000	0.000000	discard	cycle 17 u=0.0980	agent0	initial_cond	1	-0.000000
exp3734	0.00000000e+00	0.998999	1.000000	discard	nontrivial_scan u=1.35 fourier=2 tol=1e-9	agent1	branch_search	0	-1.567655
exp3735	2.68824537e-29	0.000000	0.000000	discard	cycle 17 u=0.0980	agent0	initial_cond	0	-0.000000
exp3736	0.00000000e+00	0.998999	1.000000	discard	nontrivial_scan u=1.45 fourier=2 tol=1e-9	agent1	branch_search	0	-1.567655
exp3737	2.68824537e-29	0.000000	0.000000	discard	cycle 17 u=0.0980	agent0	initial_cond	1	-0.000000
exp3738	0.00000000e+00	0.998999	1.000000	discard	nontrivial_scan u=1.55 fourier=2 tol=1e-9	agent1	branch_search	1	-1.567655
exp3739	6.16758073e-29	0.000000	0.000000	discard	cycle 17 u=0.0980	agent0	initial_cond	0	-0.000000
exp3740	0.00000000e+00	0.998999	1.000000	discard	boundary fourier_modes=2	agent1	solver_param	0	-1.567655
exp3741	6.16758073e-29	0.000000	0.000000	discard	cycle 17 u=0.0980	agent0	initial_cond	0	-0.000000
exp3742	0.00000000e+00	0.998999	1.000000	discard	boundary fourier_modes=4	agent1	solver_param	1	-1.567655
exp3743	6.16758073e-29	0.000000	0.000000	discard	cycle 17 u=0.0980	agent0	initial_cond	1	-0.000000
exp3744	0.00000000e+00	0.998999	1.000000	discard	boundary fourier_modes=8	agent1	solver_param	0	-1.567655
exp3745	2.01926478e-29	0.000000	0.000000	discard	cycle 17 u=0.0980	agent0	initial_cond	0	0.000000
exp3746	0.00000000e+00	0.998999	1.000000	discard	boundary fourier_modes=16	agent1	solver_param	0	-1.567655
exp3747	3.84592606e-16	1.001296	1.000019	discard	cycle 17 u=0.0980	agent0	initial_cond	0	-1.520844
exp3748	0.00000000e+00	0.998999	1.000000	discard	boundary fourier_modes=32	agent1	solver_param	1	-1.567655
exp3748	2.01926478e-29	0.000000	0.000000	discard	Fourier 4 u=0.9 retry 1	agent0	solver_param	1	0.000000
exp3749	2.01926478e-29	0.000000	0.000000	discard	cycle 17 u=0.0980	agent0	initial_cond	0	0.000000
exp3750	1.30310780e-28	0.000000	0.000000	discard	Fourier 4 u=0.9 retry 2	agent0	solver_param	0	-0.000000
exp3751	1.30310780e-28	0.000000	0.000000	discard	cycle 17 u=0.0980	agent0	initial_cond	0	-0.000000
exp3752	1.30310780e-28	0.000000	0.000000	discard	Fourier 4 u=0.9 retry 3	agent0	solver_param	1	-0.000000
exp3752	1.30310780e-28	0.000000	0.000000	discard	cycle 17 u=0.0980	agent0	initial_cond	1	-0.000000
exp3753	3.84592606e-16	1.001296	1.000019	discard	cycle 17 u=0.0980	agent0	initial_cond	0	-1.520844
exp3753	3.84592606e-16	1.001296	1.000019	discard	Fourier 4 u=0.9 retry 4	agent0	solver_param	0	-1.520844
exp3754	3.84592606e-16	1.001296	1.000019	discard	cycle 17 u=0.0982	agent0	initial_cond	0	-1.520844
exp3755	3.84592606e-16	1.001296	1.000019	discard	Fourier 4 u=0.9 retry 5	agent0	solver_param	0	-1.520844
exp3756	5.45343271e-29	0.000000	0.000000	discard	cycle 17 u=0.0982	agent0	initial_cond	1	-0.000000
exp3757	5.45343271e-29	0.000000	0.000000	discard	cycle 17 u=0.0982	agent0	initial_cond	0	-0.000000
exp3758	1.23429977e-28	0.000000	0.000000	discard	cycle 17 u=0.0982	agent0	initial_cond	0	0.000000
exp3759	1.23429977e-28	0.000000	0.000000	discard	cycle 17 u=0.0982	agent0	initial_cond	0	0.000000
exp3760	1.23429977e-28	0.000000	0.000000	discard	cycle 17 u=0.0982	agent0	initial_cond	0	0.000000
exp3761	1.88036672e-29	0.000000	0.000000	discard	cycle 17 u=0.0982	agent0	initial_cond	1	0.000000
exp3762	1.88036672e-29	0.000000	0.000000	discard	cycle 17 u=0.0982	agent0	initial_cond	0	0.000000
exp3763	1.88036672e-29	0.000000	0.000000	discard	cycle 17 u=0.0982	agent0	initial_cond	0	0.000000
exp3764	1.91190259e-29	0.000000	-0.000000	discard	cycle 17 u=0.0982	agent0	initial_cond	1	0.000000
exp3765	1.91190259e-29	0.000000	-0.000000	discard	cycle 17 u=0.0982	agent0	initial_cond	0	0.000000
exp3766	1.91190259e-29	0.000000	-0.000000	discard	cycle 17 u=0.0982	agent0	initial_cond	1	0.000000
exp3767	6.13049994e-29	0.000000	0.000000	discard	cycle 17 u=0.0985	agent0	initial_cond	0	0.000000
exp3768	6.13049994e-29	0.000000	0.000000	discard	cycle 17 u=0.0985	agent0	initial_cond	0	0.000000
exp3769	6.13049994e-29	0.000000	0.000000	discard	cycle 17 u=0.0985	agent0	initial_cond	1	0.000000
exp3770	5.49750971e-29	0.000000	0.000000	discard	cycle 17 u=0.0985	agent0	initial_cond	0	0.000000
exp3771	5.49750971e-29	0.000000	0.000000	discard	cycle 17 u=0.0985	agent0	initial_cond	0	0.000000
exp3772	5.49750971e-29	0.000000	0.000000	discard	cycle 17 u=0.0985	agent0	initial_cond	1	0.000000
exp3773	4.15642452e-29	0.000000	0.000000	discard	cycle 17 u=0.0985	agent0	initial_cond	0	0.000000
exp3774	4.15642452e-29	0.000000	0.000000	discard	cycle 17 u=0.0985	agent0	initial_cond	1	0.000000
exp3775	4.15642452e-29	0.000000	0.000000	discard	cycle 17 u=0.0985	agent0	initial_cond	0	0.000000
exp3776	2.19292611e-29	0.000000	0.000000	discard	cycle 17 u=0.0985	agent0	initial_cond	0	-0.000000
exp3777	2.19292611e-29	0.000000	0.000000	discard	cycle 17 u=0.0985	agent0	initial_cond	1	-0.000000
exp3778	2.19292611e-29	0.000000	0.000000	discard	cycle 17 u=0.0985	agent0	initial_cond	0	-0.000000
exp3779	4.22491788e-29	0.000000	0.000000	discard	cycle 17 u=0.0990	agent0	initial_cond	0	-0.000000
exp3780	4.22491788e-29	0.000000	0.000000	discard	Fourier 4 u=-0.9 retry 1	agent0	branch_search	1	-0.000000
exp3780	4.22491788e-29	0.000000	0.000000	discard	cycle 17 u=0.0990	agent0	initial_cond	1	-0.000000
exp3781	2.57581612e-16	1.001296	-1.000019	discard	cycle 17 u=0.0990	agent0	initial_cond	0	-1.520844
exp3781	2.57581612e-16	1.001296	-1.000019	discard	Fourier 4 u=-0.9 retry 2	agent0	branch_search	0	-1.520844
exp3782	2.57581612e-16	1.001296	-1.000019	discard	cycle 17 u=0.0990	agent0	initial_cond	1	-1.520844
exp3782	2.57581612e-16	1.001296	-1.000019	discard	Fourier 4 u=-0.9 retry 3	agent0	branch_search	1	-1.520844
exp3783	2.57581612e-16	1.001296	-1.000019	discard	cycle 17 u=0.0990	agent0	initial_cond	0	-1.520844
exp3784	2.57581612e-16	1.001296	-1.000019	discard	Fourier 4 u=-0.9 retry 4	agent0	branch_search	0	-1.520844
exp3785	2.57581612e-16	1.001296	-1.000019	discard	cycle 17 u=0.0990	agent0	initial_cond	0	-1.520844
exp3786	4.50941488e-29	0.000000	-0.000000	discard	Fourier 4 u=-0.9 retry 5	agent0	branch_search	0	0.000000
exp3787	4.50941488e-29	0.000000	-0.000000	discard	cycle 17 u=0.0990	agent0	initial_cond	1	0.000000
exp3788	4.50941488e-29	0.000000	-0.000000	discard	cycle 17 u=0.0990	agent0	initial_cond	0	0.000000
exp3789	4.50941488e-29	0.000000	-0.000000	discard	cycle 17 u=0.0990	agent0	initial_cond	0	0.000000
exp3790	4.88330883e-29	0.000000	-0.000000	discard	cycle 17 u=0.0990	agent0	initial_cond	0	0.000000
exp3791	4.88330883e-29	0.000000	-0.000000	discard	cycle 17 u=0.0990	agent0	initial_cond	0	0.000000
exp3792	4.88330883e-29	0.000000	-0.000000	discard	cycle 17 u=0.0990	agent0	initial_cond	1	0.000000
exp3793	5.74085541e-29	0.000000	-0.000000	discard	cycle 17 u=0.0995	agent0	initial_cond	0	0.000000
exp3794	5.74085541e-29	0.000000	-0.000000	discard	cycle 17 u=0.0995	agent0	initial_cond	0	0.000000
exp3795	5.74085541e-29	0.000000	-0.000000	discard	cycle 17 u=0.0995	agent0	initial_cond	1	0.000000
exp3796	1.54984578e-28	0.000000	0.000000	discard	cycle 17 u=0.0995	agent0	initial_cond	0	-0.000000
exp3797	1.54984578e-28	0.000000	0.000000	discard	cycle 17 u=0.0995	agent0	initial_cond	1	-0.000000
exp3798	1.54984578e-28	0.000000	0.000000	discard	cycle 17 u=0.0995	agent0	initial_cond	0	-0.000000
exp3799	1.60328418e-29	0.000000	-0.000000	discard	cycle 17 u=0.0995	agent0	initial_cond	0	-0.000000
exp3800	1.60328418e-29	0.000000	-0.000000	discard	cycle 17 u=0.0995	agent0	initial_cond	1	-0.000000
exp3801	1.60328418e-29	0.000000	-0.000000	discard	cycle 17 u=0.0995	agent0	initial_cond	0	-0.000000
exp3802	7.34590618e-29	0.000000	0.000000	discard	cycle 17 u=0.0995	agent0	initial_cond	0	0.000000
exp3803	7.34590618e-29	0.000000	0.000000	discard	cycle 17 u=0.0995	agent0	initial_cond	0	0.000000
exp3804	7.34590618e-29	0.000000	0.000000	discard	cycle 17 u=0.0995	agent0	initial_cond	0	0.000000
exp3805	4.46546993e-29	0.000000	0.000000	discard	cycle 17 u=0.1000	agent0	initial_cond	1	-0.000000
exp3806	4.46546993e-29	0.000000	0.000000	discard	cycle 17 u=0.1000	agent0	initial_cond	0	-0.000000
exp3807	4.46546993e-29	0.000000	0.000000	discard	cycle 17 u=0.1000	agent0	initial_cond	0	-0.000000
exp3808	4.08106752e-29	0.000000	0.000000	discard	cycle 17 u=0.1000	agent0	initial_cond	1	-0.000000
exp3809	4.08106752e-29	0.000000	0.000000	discard	cycle 17 u=0.1000	agent0	initial_cond	0	-0.000000
exp3810	4.08106752e-29	0.000000	0.000000	discard	cycle 17 u=0.1000	agent0	initial_cond	0	-0.000000
exp3811	4.58623706e-29	0.000000	0.000000	discard	cycle 17 u=0.1000	agent0	initial_cond	0	-0.000000
exp3812	4.58623706e-29	0.000000	0.000000	discard	cycle 17 u=0.1000	agent0	initial_cond	0	-0.000000
exp3813	4.58623706e-29	0.000000	0.000000	discard	cycle 17 u=0.1000	agent0	initial_cond	1	-0.000000
exp3814	4.39794337e-29	0.000000	0.000000	discard	cycle 17 u=0.1000	agent0	initial_cond	0	-0.000000
exp3815	4.39794337e-29	0.000000	0.000000	discard	cycle 17 u=0.1000	agent0	initial_cond	0	-0.000000
exp3816	4.39794337e-29	0.000000	0.000000	discard	cycle 17 u=0.1000	agent0	initial_cond	1	-0.000000
exp3817	1.36727475e-28	0.000000	0.000000	discard	cycle 17 u=0.1050	agent0	initial_cond	0	-0.000000
exp3818	1.36727475e-28	0.000000	0.000000	discard	cycle 17 u=0.1050	agent0	initial_cond	1	-0.000000
exp3819	1.36727475e-28	0.000000	0.000000	discard	Fourier opt m=2 u=0.9 a=0.3	agent0	solver_param	0	-0.000000
exp3819	1.36727475e-28	0.000000	0.000000	discard	cycle 17 u=0.1050	agent0	initial_cond	0	-0.000000
exp3820	9.77262427e-14	1.001298	1.000025	discard	cycle 17 u=0.1050	agent0	initial_cond	0	-1.520921
exp3820	9.77262427e-14	1.001298	1.000025	discard	Fourier opt m=2 u=0.9 a=0.3	agent0	solver_param	0	-1.520921
exp3821	3.70305566e-16	1.001298	1.000025	discard	cycle 17 u=0.1050	agent0	initial_cond	1	-1.520921
exp3822	3.70305566e-16	1.001298	1.000025	discard	Fourier opt m=2 u=0.9 a=0.5	agent0	solver_param	1	-1.520921
exp3823	3.70305566e-16	1.001298	1.000025	discard	cycle 17 u=0.1050	agent0	initial_cond	0	-1.520921
exp3824	1.75906666e-28	0.000000	0.000000	discard	Fourier opt m=2 u=0.9 a=0.5	agent0	solver_param	0	-0.000000
exp3825	2.00148302e-16	1.001298	1.000025	discard	cycle 17 u=0.1050	agent0	initial_cond	0	-1.520921
exp3826	1.75906666e-28	0.000000	0.000000	discard	Fourier opt m=2 u=0.9 a=0.8	agent0	solver_param	1	-0.000000
exp3827	2.00148302e-16	1.001298	1.000025	discard	cycle 17 u=0.1050	agent0	initial_cond	1	-1.520921
exp3828	1.75906666e-28	0.000000	0.000000	discard	Fourier opt m=2 u=0.9 a=0.8	agent0	solver_param	0	-0.000000
exp3829	2.00148302e-16	1.001298	1.000025	discard	cycle 17 u=0.1050	agent0	initial_cond	0	-1.520921
exp3830	1.11257917e-28	0.000000	0.000000	discard	Fourier opt m=2 u=1.0 a=0.3	agent0	solver_param	0	-0.000000
exp3831	1.11257917e-28	0.000000	0.000000	discard	cycle 17 u=0.1050	agent0	initial_cond	1	-0.000000
exp3832	1.11257917e-28	0.000000	0.000000	discard	Fourier opt m=2 u=1.0 a=0.3	agent0	solver_param	0	-0.000000
exp3833	1.11257917e-28	0.000000	0.000000	discard	cycle 17 u=0.1050	agent0	initial_cond	0	-0.000000
exp3834	1.11257917e-28	0.000000	0.000000	discard	Fourier opt m=2 u=1.0 a=0.5	agent0	solver_param	0	-0.000000
exp3834	1.11257917e-28	0.000000	0.000000	discard	cycle 17 u=0.1050	agent0	initial_cond	0	-0.000000
exp3835	2.00148302e-16	1.001298	1.000025	discard	cycle 18 u=0.0975	agent0	initial_cond	1	-1.520921
exp3835	2.00148302e-16	1.001298	1.000025	discard	Fourier opt m=2 u=1.0 a=0.5	agent0	solver_param	1	-1.520921
exp3836	2.00148302e-16	1.001298	1.000025	discard	cycle 18 u=0.0975	agent0	initial_cond	0	-1.520921
exp3836	2.00148302e-16	1.001298	1.000025	discard	Fourier opt m=2 u=1.0 a=0.8	agent0	solver_param	0	-1.520921
exp3837	2.00148302e-16	1.001298	1.000025	discard	cycle 18 u=0.0975	agent0	initial_cond	0	-1.520921
exp3838	2.00148302e-16	1.001298	1.000025	discard	Fourier opt m=2 u=1.0 a=0.8	agent0	solver_param	1	-1.520921
exp3839	7.52139241e-14	1.001296	1.000019	discard	cycle 18 u=0.0975	agent0	initial_cond	0	-1.520844
exp3840	5.23962023e-29	0.000000	0.000000	discard	Fourier opt m=3 u=0.9 a=0.3	agent0	solver_param	0	0.000000
exp3841	7.52139241e-14	1.001296	1.000019	discard	cycle 18 u=0.0975	agent0	initial_cond	0	-1.520844
exp3842	5.23962023e-29	0.000000	0.000000	discard	Fourier opt m=3 u=0.9 a=0.3	agent0	solver_param	0	0.000000
exp3843	6.09642810e-16	1.001296	1.000019	discard	cycle 18 u=0.0975	agent0	initial_cond	1	-1.520844
exp3844	4.03266298e-29	0.000000	0.000000	discard	Fourier opt m=3 u=0.9 a=0.5	agent0	solver_param	0	0.000000
exp3845	6.09642810e-16	1.001296	1.000019	discard	cycle 18 u=0.0975	agent0	initial_cond	0	-1.520844
exp3846	4.03266298e-29	0.000000	0.000000	discard	Fourier opt m=3 u=0.9 a=0.5	agent0	solver_param	0	0.000000
exp3847	4.03266298e-29	0.000000	0.000000	discard	cycle 18 u=0.0975	agent0	initial_cond	0	0.000000
exp3848	4.03266298e-29	0.000000	0.000000	discard	Fourier opt m=3 u=0.9 a=0.8	agent0	solver_param	1	0.000000
exp3849	4.03266298e-29	0.000000	0.000000	discard	cycle 18 u=0.0975	agent0	initial_cond	1	0.000000
exp3850	4.80015937e-29	0.000000	0.000000	discard	Fourier opt m=3 u=0.9 a=0.8	agent0	solver_param	0	0.000000
exp3850	4.80015937e-29	0.000000	0.000000	discard	cycle 18 u=0.0975	agent0	initial_cond	0	0.000000
exp3851	9.56519247e-16	1.001296	1.000019	discard	cycle 18 u=0.0975	agent0	initial_cond	1	-1.520844
exp3851	9.56519247e-16	1.001296	1.000019	discard	Fourier opt m=3 u=1.0 a=0.3	agent0	solver_param	1	-1.520844
exp3852	9.56519247e-16	1.001296	1.000019	discard	cycle 18 u=0.0975	agent0	initial_cond	0	-1.520844
exp3852	9.56519247e-16	1.001296	1.000019	discard	Fourier opt m=3 u=1.0 a=0.3	agent0	solver_param	0	-1.520844
