exp_id	residual	solution_norm	solution_mean	status	description	agent	design	elapsed_s	solution_energy
exp1393	2.03509144e-27	0.000000	0.000000	discard	u=0.0986 a=0.001348	agent0	initial_cond	2	-0.000000
exp1393	2.03509144e-27	0.000000	0.000000	discard	u=0.0986 a=0.001346	agent0	initial_cond	2	-0.000000
exp1393	2.03509144e-27	0.000000	0.000000	discard	u=0.0988 a=0.001342	agent0	initial_cond	2	-0.000000
exp1393	2.03509144e-27	0.000000	0.000000	discard	u=0.0986 a=0.001344	agent0	initial_cond	2	-0.000000
exp1393	2.03509144e-27	0.000000	0.000000	discard	u=0.0988 a=0.001350	agent0	initial_cond	2	-0.000000
exp1393	2.03509144e-27	0.000000	0.000000	discard	u=0.0988 a=0.001348	agent0	initial_cond	2	-0.000000
exp1394	2.03509144e-27	0.000000	0.000000	discard	u=0.0990 a=0.001344	agent0	initial_cond	2	-0.000000
exp1394	2.03509144e-27	0.000000	0.000000	discard	u=0.0990 a=0.001342	agent0	initial_cond	2	-0.000000
exp1394	2.03509144e-27	0.000000	0.000000	discard	u=0.0990 a=0.001348	agent0	initial_cond	2	-0.000000
exp1394	2.03509144e-27	0.000000	0.000000	discard	u=0.0990 a=0.001350	agent0	initial_cond	2	-0.000000
exp1394	2.03509144e-27	0.000000	0.000000	discard	u=0.0990 a=0.001346	agent0	initial_cond	2	-0.000000
exp1394	2.03509144e-27	0.000000	0.000000	discard	u=0.0990 a=0.001340	agent0	initial_cond	2	-0.000000
exp1395	2.03509144e-27	0.000000	0.000000	discard	u=0.1000 a=0.001342	agent0	initial_cond	2	-0.000000
exp1395	2.03509144e-27	0.000000	0.000000	discard	u=0.1000 a=0.001344	agent0	initial_cond	2	-0.000000
exp1395	2.03509144e-27	0.000000	0.000000	discard	u=0.1000 a=0.001340	agent0	initial_cond	2	-0.000000
exp1395	2.03509144e-27	0.000000	0.000000	discard	u=0.1000 a=0.001348	agent0	initial_cond	2	-0.000000
exp1395	2.03509144e-27	0.000000	0.000000	discard	u=0.1000 a=0.001350	agent0	initial_cond	2	-0.000000
exp1395	2.03509144e-27	0.000000	0.000000	discard	u=0.1010 a=0.001346	agent0	initial_cond	2	-0.000000
exp1396	2.03509144e-27	0.000000	0.000000	discard	u=0.2400 a=0.001344	agent0	initial_cond	1	-0.000000
exp1396	2.03509144e-27	0.000000	0.000000	discard	u=0.1010 a=0.001340	agent0	initial_cond	2	-0.000000
exp1396	2.03509144e-27	0.000000	0.000000	discard	u=0.2400 a=0.001340	agent0	initial_cond	1	-0.000000
exp1396	2.03509144e-27	0.000000	0.000000	discard	u=0.2400 a=0.001348	agent0	initial_cond	1	-0.000000
exp1396	2.03509144e-27	0.000000	0.000000	discard	u=0.1010 a=0.001342	agent0	initial_cond	2	-0.000000
exp1396	2.03509144e-27	0.000000	0.000000	discard	u=0.1010 a=0.001350	agent0	initial_cond	1	-0.000000
exp1397	2.03509144e-27	0.000000	0.000000	discard	u=0.1010 a=0.001344	agent0	initial_cond	2	-0.000000
exp1397	2.03509144e-27	0.000000	0.000000	discard	u=0.1010 a=0.001348	agent0	initial_cond	3	-0.000000
exp1397	2.03509144e-27	0.000000	0.000000	discard	u=0.2400 a=0.001346	agent0	initial_cond	2	-0.000000
exp1397	2.03509144e-27	0.000000	0.000000	discard	u=0.2400 a=0.001342	agent0	initial_cond	2	-0.000000
exp1397	2.03509144e-27	0.000000	0.000000	discard	u=0.2500 a=0.001348	agent0	initial_cond	2	-0.000000
exp1397	2.03509144e-27	0.000000	0.000000	discard	u=0.2500 a=0.001340	agent0	initial_cond	2	-0.000000
exp1398	2.03509144e-27	0.000000	0.000000	discard	u=0.2600 a=0.001342	agent0	initial_cond	2	-0.000000
exp1398	2.03509144e-27	0.000000	0.000000	discard	u=0.2600 a=0.001340	agent0	initial_cond	2	-0.000000
exp1398	2.03509144e-27	0.000000	0.000000	discard	u=0.2500 a=0.001342	agent0	initial_cond	2	-0.000000
exp1398	2.03509144e-27	0.000000	0.000000	discard	u=0.1000 a=0.001346	agent0	initial_cond	3	-0.000000
exp1398	2.03509144e-27	0.000000	0.000000	discard	u=0.2500 a=0.001350	agent0	initial_cond	2	-0.000000
exp1399	2.03509144e-27	0.000000	0.000000	discard	u=0.2500 a=0.001346	agent0	initial_cond	2	-0.000000
exp1399	2.03509144e-27	0.000000	0.000000	discard	u=0.2500 a=0.001344	agent0	initial_cond	2	-0.000000
exp1399	2.03509144e-27	0.000000	0.000000	discard	u=0.2400 a=0.001350	agent0	initial_cond	2	-0.000000
exp1399	2.03509144e-27	0.000000	0.000000	discard	u=0.2600 a=0.001346	agent0	initial_cond	2	-0.000000
exp1399	2.03509144e-27	0.000000	0.000000	discard	u=0.2600 a=0.001350	agent0	initial_cond	2	-0.000000
exp1399	2.03509144e-27	0.000000	0.000000	discard	u=0.2600 a=0.001344	agent0	initial_cond	2	-0.000000
exp1400	2.03509144e-27	0.000000	0.000000	discard	u=0.2600 a=0.001348	agent0	initial_cond	2	-0.000000
exp1401	1.34360442e-12	1.002503	-1.000218	discard	neg u=-1.5 amp=0.5 mode=3 n=269	agent1	memory	1	-1.523848
exp1402	2.03509144e-27	0.000000	0.000000	discard	u=0.0980 a=0.001340	agent0	initial_cond	2	-0.000000
exp1402	2.03509144e-27	0.000000	0.000000	discard	u=0.0980 a=0.001346	agent0	initial_cond	2	-0.000000
exp1402	2.03509144e-27	0.000000	0.000000	discard	u=0.0980 a=0.001350	agent0	initial_cond	2	-0.000000
exp1402	2.03509144e-27	0.000000	0.000000	discard	u=0.0982 a=0.001344	agent0	initial_cond	2	-0.000000
exp1403	2.03509144e-27	0.000000	0.000000	discard	u=0.0982 a=0.001346	agent0	initial_cond	2	-0.000000
exp1403	2.03509144e-27	0.000000	0.000000	discard	u=0.0986 a=0.001340	agent0	initial_cond	2	-0.000000
exp1403	2.03509144e-27	0.000000	0.000000	discard	u=0.0980 a=0.001348	agent0	initial_cond	2	-0.000000
exp1403	2.03509144e-27	0.000000	0.000000	discard	u=0.0982 a=0.001340	agent0	initial_cond	2	-0.000000
exp1403	2.03509144e-27	0.000000	0.000000	discard	u=0.0982 a=0.001342	agent0	initial_cond	2	-0.000000
exp1403	2.03509144e-27	0.000000	0.000000	discard	u=0.0984 a=0.001346	agent0	initial_cond	2	-0.000000
exp1404	2.03509144e-27	0.000000	0.000000	discard	u=0.0982 a=0.001350	agent0	initial_cond	2	-0.000000
exp1404	2.03509144e-27	0.000000	0.000000	discard	u=0.0984 a=0.001340	agent0	initial_cond	2	-0.000000
exp1404	2.03509144e-27	0.000000	0.000000	discard	u=0.0988 a=0.001348	agent0	initial_cond	2	-0.000000
exp1404	2.03509144e-27	0.000000	0.000000	discard	u=0.0984 a=0.001344	agent0	initial_cond	2	-0.000000
exp1405	2.03509144e-27	0.000000	0.000000	discard	u=0.0986 a=0.001342	agent0	initial_cond	2	-0.000000
exp1405	2.03509144e-27	0.000000	0.000000	discard	u=0.0988 a=0.001340	agent0	initial_cond	2	-0.000000
exp1405	2.03509144e-27	0.000000	0.000000	discard	u=0.0984 a=0.001350	agent0	initial_cond	2	-0.000000
exp1405	2.03509144e-27	0.000000	0.000000	discard	u=0.0986 a=0.001344	agent0	initial_cond	2	-0.000000
exp1404	2.03509144e-27	0.000000	0.000000	discard	u=0.0984 a=0.001348	agent0	initial_cond	2	-0.000000
exp1406	2.03509144e-27	0.000000	0.000000	discard	u=0.0988 a=0.001350	agent0	initial_cond	2	-0.000000
exp1406	2.03509144e-27	0.000000	0.000000	discard	u=0.0986 a=0.001350	agent0	initial_cond	2	-0.000000
exp1405	2.03509144e-27	0.000000	0.000000	discard	u=0.0986 a=0.001348	agent0	initial_cond	2	-0.000000
exp1406	2.03509144e-27	0.000000	0.000000	discard	u=0.0984 a=0.001342	agent0	initial_cond	2	-0.000000
exp1406	2.03509144e-27	0.000000	0.000000	discard	u=0.1000 a=0.001348	agent0	initial_cond	3	-0.000000
exp1406	2.03509144e-27	0.000000	0.000000	discard	u=0.0982 a=0.001348	agent0	initial_cond	3	-0.000000
exp1406	2.03509144e-27	0.000000	0.000000	discard	u=0.0986 a=0.001346	agent0	initial_cond	3	-0.000000
exp1407	2.03509144e-27	0.000000	0.000000	discard	u=0.0988 a=0.001342	agent0	initial_cond	3	-0.000000
exp1407	2.03509144e-27	0.000000	0.000000	discard	u=0.0990 a=0.001340	agent0	initial_cond	3	-0.000000
exp1407	2.03509144e-27	0.000000	0.000000	discard	u=0.0990 a=0.001348	agent0	initial_cond	3	-0.000000
exp1407	2.03509144e-27	0.000000	0.000000	discard	u=0.0990 a=0.001344	agent0	initial_cond	3	-0.000000
exp1407	2.03509144e-27	0.000000	0.000000	discard	u=0.0990 a=0.001346	agent0	initial_cond	3	-0.000000
exp1407	2.03509144e-27	0.000000	0.000000	discard	u=0.0988 a=0.001346	agent0	initial_cond	3	-0.000000
exp1408	2.03509144e-27	0.000000	0.000000	discard	u=0.0990 a=0.001350	agent0	initial_cond	3	-0.000000
exp1408	2.03509144e-27	0.000000	0.000000	discard	u=0.0988 a=0.001344	agent0	initial_cond	3	-0.000000
exp1408	2.03509144e-27	0.000000	0.000000	discard	u=0.1000 a=0.001342	agent0	initial_cond	3	-0.000000
exp1408	2.03509144e-27	0.000000	0.000000	discard	u=0.1000 a=0.001340	agent0	initial_cond	3	-0.000000
exp1408	2.03509144e-27	0.000000	0.000000	discard	u=0.1000 a=0.001346	agent0	initial_cond	3	-0.000000
exp1408	2.03509144e-27	0.000000	0.000000	discard	u=0.1000 a=0.001350	agent0	initial_cond	3	-0.000000
exp1409	2.03509144e-27	0.000000	0.000000	discard	u=0.0990 a=0.001342	agent0	initial_cond	3	-0.000000
exp1409	2.03509144e-27	0.000000	0.000000	discard	u=0.1010 a=0.001342	agent0	initial_cond	2	-0.000000
exp1409	2.03509144e-27	0.000000	0.000000	discard	u=0.1000 a=0.001344	agent0	initial_cond	3	-0.000000
exp1409	2.03509144e-27	0.000000	0.000000	discard	u=0.1010 a=0.001344	agent0	initial_cond	2	-0.000000
exp1410	4.22413620e-12	1.002503	1.000218	discard	pos u=1.0 amp=0.5 mode=3 n=275 tol=5e-12	agent1	memory	2	-1.523848
exp1410	2.03509144e-27	0.000000	0.000000	discard	u=0.1010 a=0.001348	agent0	initial_cond	2	-0.000000
exp1410	2.03509144e-27	0.000000	0.000000	discard	u=0.2500 a=0.001346	agent0	initial_cond	2	-0.000000
exp1410	2.03509144e-27	0.000000	0.000000	discard	u=0.2400 a=0.001340	agent0	initial_cond	2	-0.000000
exp1410	2.03509144e-27	0.000000	0.000000	discard	u=0.1010 a=0.001346	agent0	initial_cond	2	-0.000000
exp1410	2.03509144e-27	0.000000	0.000000	discard	u=0.1010 a=0.001340	agent0	initial_cond	2	-0.000000
exp1410	2.03509144e-27	0.000000	0.000000	discard	u=0.2600 a=0.001340	agent0	initial_cond	2	-0.000000
exp1411	2.03509144e-27	0.000000	0.000000	discard	u=0.1010 a=0.001350	agent0	initial_cond	2	-0.000000
exp1411	2.03509144e-27	0.000000	0.000000	discard	u=0.2400 a=0.001342	agent0	initial_cond	2	-0.000000
exp1411	2.03509144e-27	0.000000	0.000000	discard	u=0.2400 a=0.001350	agent0	initial_cond	2	-0.000000
exp1411	2.03509144e-27	0.000000	0.000000	discard	u=0.2500 a=0.001342	agent0	initial_cond	2	-0.000000
exp1411	2.03509144e-27	0.000000	0.000000	discard	u=0.2500 a=0.001348	agent0	initial_cond	2	-0.000000
exp1412	2.03509144e-27	0.000000	0.000000	discard	u=0.2400 a=0.001344	agent0	initial_cond	2	-0.000000
exp1412	2.03509144e-27	0.000000	0.000000	discard	u=0.2500 a=0.001340	agent0	initial_cond	2	-0.000000
exp1412	2.03509144e-27	0.000000	0.000000	discard	u=0.2400 a=0.001348	agent0	initial_cond	2	-0.000000
exp1412	2.03509144e-27	0.000000	0.000000	discard	u=0.2500 a=0.001344	agent0	initial_cond	2	-0.000000
exp1412	2.03509144e-27	0.000000	0.000000	discard	u=0.2400 a=0.001346	agent0	initial_cond	2	-0.000000
exp1413	2.03509144e-27	0.000000	0.000000	discard	u=0.2600 a=0.001342	agent0	initial_cond	2	-0.000000
exp1413	2.03509144e-27	0.000000	0.000000	discard	u=0.2600 a=0.001344	agent0	initial_cond	2	-0.000000
exp1413	2.03509144e-27	0.000000	0.000000	discard	u=0.2500 a=0.001350	agent0	initial_cond	2	-0.000000
exp1413	2.03509144e-27	0.000000	0.000000	discard	u=0.2600 a=0.001348	agent0	initial_cond	2	-0.000000
exp1413	2.03509144e-27	0.000000	0.000000	discard	u=0.2600 a=0.001350	agent0	initial_cond	2	-0.000000
exp1413	2.03509144e-27	0.000000	0.000000	discard	u=0.2600 a=0.001346	agent0	initial_cond	2	-0.000000
exp1414	4.00125878e-12	1.002503	1.000218	discard	pos u=1.0 amp=0.5 mode=3 n=280 tol=5e-12	agent1	memory	1	-1.523848
exp1415	crash	0	0	crash	u=0.0980 a=0.001344	agent0	initial_cond	2	0
exp1416	crash	0	0	crash	u=0.0980 a=0.001350	agent0	initial_cond	2	0
exp1417	2.03509144e-27	0.000000	0.000000	discard	u=0.0986 a=0.001342	agent0	initial_cond	1	-0.000000
exp1417	2.03509144e-27	0.000000	0.000000	discard	u=0.0986 a=0.001344	agent0	initial_cond	1	-0.000000
exp1417	2.03509144e-27	0.000000	0.000000	discard	u=0.0984 a=0.001348	agent0	initial_cond	1	-0.000000
exp1417	2.03509144e-27	0.000000	0.000000	discard	u=0.0982 a=0.001350	agent0	initial_cond	1	-0.000000
exp1417	2.03509144e-27	0.000000	0.000000	discard	u=0.0982 a=0.001346	agent0	initial_cond	1	-0.000000
exp1418	2.03509144e-27	0.000000	0.000000	discard	u=0.0984 a=0.001350	agent0	initial_cond	1	-0.000000
exp1417	2.03509144e-27	0.000000	0.000000	discard	u=0.0984 a=0.001346	agent0	initial_cond	1	-0.000000
exp1418	2.03509144e-27	0.000000	0.000000	discard	u=0.0984 a=0.001342	agent0	initial_cond	2	-0.000000
exp1418	2.03509144e-27	0.000000	0.000000	discard	u=0.0984 a=0.001340	agent0	initial_cond	1	-0.000000
exp1418	2.03509144e-27	0.000000	0.000000	discard	u=0.0986 a=0.001348	agent0	initial_cond	2	-0.000000
exp1418	2.03509144e-27	0.000000	0.000000	discard	u=0.0986 a=0.001346	agent0	initial_cond	1	-0.000000
exp1418	2.03509144e-27	0.000000	0.000000	discard	u=0.0984 a=0.001344	agent0	initial_cond	2	-0.000000
exp1418	2.03509144e-27	0.000000	0.000000	discard	u=0.0986 a=0.001340	agent0	initial_cond	2	-0.000000
exp1419	2.03509144e-27	0.000000	0.000000	discard	u=0.0986 a=0.001350	agent0	initial_cond	2	-0.000000
exp1419	2.03509144e-27	0.000000	0.000000	discard	u=0.0988 a=0.001342	agent0	initial_cond	2	-0.000000
exp1419	2.03509144e-27	0.000000	0.000000	discard	u=0.0988 a=0.001346	agent0	initial_cond	2	-0.000000
exp1419	2.03509144e-27	0.000000	0.000000	discard	u=0.0988 a=0.001340	agent0	initial_cond	2	-0.000000
exp1419	2.03509144e-27	0.000000	0.000000	discard	u=0.0990 a=0.001350	agent0	initial_cond	2	-0.000000
exp1419	2.03509144e-27	0.000000	0.000000	discard	u=0.0990 a=0.001340	agent0	initial_cond	2	-0.000000
exp1419	2.03509144e-27	0.000000	0.000000	discard	u=0.0990 a=0.001342	agent0	initial_cond	2	-0.000000
exp1419	2.03509144e-27	0.000000	0.000000	discard	u=0.0988 a=0.001348	agent0	initial_cond	2	-0.000000
exp1419	2.03509144e-27	0.000000	0.000000	discard	u=0.0988 a=0.001344	agent0	initial_cond	2	-0.000000
exp1420	2.03509144e-27	0.000000	0.000000	discard	u=0.0990 a=0.001344	agent0	initial_cond	2	-0.000000
exp1420	2.03509144e-27	0.000000	0.000000	discard	u=0.0990 a=0.001346	agent0	initial_cond	2	-0.000000
exp1420	2.03509144e-27	0.000000	0.000000	discard	u=0.1000 a=0.001344	agent0	initial_cond	2	-0.000000
exp1420	2.03509144e-27	0.000000	0.000000	discard	u=0.1000 a=0.001350	agent0	initial_cond	2	-0.000000
exp1420	2.03509144e-27	0.000000	0.000000	discard	u=0.1000 a=0.001348	agent0	initial_cond	2	-0.000000
exp1420	2.03509144e-27	0.000000	0.000000	discard	u=0.0990 a=0.001348	agent0	initial_cond	2	-0.000000
exp1420	2.03509144e-27	0.000000	0.000000	discard	u=0.0988 a=0.001350	agent0	initial_cond	2	-0.000000
exp1421	crash	0	0	crash	u=0.2400 a=0.001344	agent0	initial_cond	2	0
exp1420	2.03509144e-27	0.000000	0.000000	discard	u=0.1000 a=0.001340	agent0	initial_cond	2	-0.000000
exp1420	2.03509144e-27	0.000000	0.000000	discard	u=0.1000 a=0.001346	agent0	initial_cond	3	-0.000000
exp1422	crash	0	0	crash	u=0.2400 a=0.001346	agent0	initial_cond	2	0
exp1422	crash	0	0	crash	u=0.2500 a=0.001344	agent0	initial_cond	2	0
exp1422	crash	0	0	crash	u=0.2400 a=0.001342	agent0	initial_cond	2	0
exp1421	2.03509144e-27	0.000000	0.000000	discard	u=0.1010 a=0.001350	agent0	initial_cond	2	-0.000000
exp1423	crash	0	0	crash	u=0.2400 a=0.001348	agent0	initial_cond	2	0
exp1421	2.03509144e-27	0.000000	0.000000	discard	u=0.1000 a=0.001342	agent0	initial_cond	2	-0.000000
exp1421	1.96261557e-16	1.001296	1.000019	discard	Fourier 4modes u=1.44 amp=0.01 positive	agent1_mem	perturbation	2	-1.520844
exp1421	2.03509144e-27	0.000000	0.000000	discard	u=0.1010 a=0.001340	agent0	initial_cond	2	-0.000000
exp1421	2.03509144e-27	0.000000	0.000000	discard	u=0.1010 a=0.001342	agent0	initial_cond	2	-0.000000
exp1424	crash	0	0	crash	u=0.1010 a=0.001348	agent0	initial_cond	2	0
exp1424	crash	0	0	crash	u=0.2400 a=0.001350	agent0	initial_cond	2	0
exp1425	crash	0	0	crash	u=0.2500 a=0.001340	agent0	initial_cond	2	0
exp1425	crash	0	0	crash	u=0.2600 a=0.001350	agent0	initial_cond	2	0
exp1423	3.59981005e-12	1.002503	1.000218	discard	pos u=1.0 amp=0.5 mode=3 n=290 tol=5e-12	agent1	memory	2	-1.523848
exp1423	2.03509144e-27	0.000000	0.000000	discard	u=0.1010 a=0.001346	agent0	initial_cond	2	-0.000000
exp1425	2.03509144e-27	0.000000	0.000000	discard	u=0.1010 a=0.001344	agent0	initial_cond	2	-0.000000
exp1426	1.34357540e-12	1.002503	1.000218	discard	u=0.2500 a=0.001346	agent0	initial_cond	2	-1.523848
exp1426	1.34357540e-12	1.002503	1.000218	discard	u=0.2400 a=0.001340	agent0	initial_cond	2	-1.523848
exp1427	1.34357540e-12	1.002503	1.000218	discard	u=0.2500 a=0.001348	agent0	initial_cond	2	-1.523848
exp1427	1.34357540e-12	1.002503	1.000218	discard	u=0.2600 a=0.001346	agent0	initial_cond	2	-1.523848
exp1427	1.34357540e-12	1.002503	1.000218	discard	u=0.2600 a=0.001344	agent0	initial_cond	2	-1.523848
exp1427	1.34357540e-12	1.002503	1.000218	discard	u=0.2600 a=0.001342	agent0	initial_cond	2	-1.523848
exp1428	1.21995933e-28	0.000000	0.000000	discard	fine basin u=0.6	agent0	branch_search	1	0.000000
exp1429	2.06774381e-16	1.001296	1.000019	discard	Fourier 4modes u=1.44 amp=0.05 positive	agent1_mem	perturbation	1	-1.520844
exp1429	3.25175165e-12	1.002503	1.000218	discard	pos u=1.0 amp=0.5 mode=3 n=300 tol=5e-12	agent1	memory	1	-1.523848
exp1430	crash	0	0	crash	u=0.0980 a=0.001344	agent0	initial_cond	2	0
exp1431	2.03509144e-27	0.000000	0.000000	discard	u=0.0984 a=0.001344	agent0	initial_cond	2	-0.000000
exp1431	2.03509144e-27	0.000000	0.000000	discard	u=0.0984 a=0.001346	agent0	initial_cond	1	-0.000000
exp1431	2.03509144e-27	0.000000	0.000000	discard	u=0.0988 a=0.001344	agent0	initial_cond	1	-0.000000
exp1432	2.03509144e-27	0.000000	0.000000	discard	fine basin u=0.7	agent0	branch_search	2	-0.000000
exp1431	2.03509144e-27	0.000000	0.000000	discard	u=0.0986 a=0.001342	agent0	initial_cond	2	-0.000000
exp1432	2.03509144e-27	0.000000	0.000000	discard	u=0.0988 a=0.001342	agent0	initial_cond	1	-0.000000
exp1433	2.03509144e-27	0.000000	0.000000	discard	u=0.0988 a=0.001350	agent0	initial_cond	2	-0.000000
exp1433	2.03509144e-27	0.000000	0.000000	discard	u=0.0988 a=0.001340	agent0	initial_cond	2	-0.000000
exp1433	2.03509144e-27	0.000000	0.000000	discard	u=0.1000 a=0.001348	agent0	initial_cond	2	-0.000000
exp1433	2.03509144e-27	0.000000	0.000000	discard	u=0.0986 a=0.001350	agent0	initial_cond	1	-0.000000
exp1433	2.03509144e-27	0.000000	0.000000	discard	u=0.0990 a=0.001342	agent0	initial_cond	2	-0.000000
exp1433	2.03509144e-27	0.000000	0.000000	discard	u=0.0988 a=0.001346	agent0	initial_cond	2	-0.000000
exp1434	2.03509144e-27	0.000000	0.000000	discard	u=0.0990 a=0.001340	agent0	initial_cond	2	-0.000000
exp1434	2.03509144e-27	0.000000	0.000000	discard	u=0.1000 a=0.001346	agent0	initial_cond	2	-0.000000
exp1434	2.03509144e-27	0.000000	0.000000	discard	u=0.0988 a=0.001348	agent0	initial_cond	2	-0.000000
exp1434	2.03509144e-27	0.000000	0.000000	discard	u=0.0990 a=0.001350	agent0	initial_cond	2	-0.000000
exp1434	2.03509144e-27	0.000000	0.000000	discard	u=0.1000 a=0.001350	agent0	initial_cond	2	-0.000000
exp1435	2.03509144e-27	0.000000	0.000000	discard	u=0.1000 a=0.001342	agent0	initial_cond	2	-0.000000
exp1435	2.03509144e-27	0.000000	0.000000	discard	u=0.1010 a=0.001344	agent0	initial_cond	2	-0.000000
exp1436	1.34360442e-12	1.002503	1.000218	discard	u=0.2400 a=0.001340	agent0	initial_cond	2	-1.523848
exp1436	1.34360442e-12	1.002503	1.000218	discard	u=0.0990 a=0.001344	agent0	initial_cond	2	-1.523848
exp1436	1.34360442e-12	1.002503	1.000218	discard	u=0.1010 a=0.001340	agent0	initial_cond	3	-1.523848
exp1437	1.34360442e-12	1.002503	1.000218	discard	u=0.0990 a=0.001348	agent0	initial_cond	3	-1.523848
exp1437	1.34360442e-12	1.002503	1.000218	discard	u=0.2400 a=0.001344	agent0	initial_cond	2	-1.523848
exp1437	1.34360442e-12	1.002503	1.000218	discard	u=0.1010 a=0.001346	agent0	initial_cond	3	-1.523848
exp1437	1.34360442e-12	1.002503	1.000218	discard	u=0.0990 a=0.001346	agent0	initial_cond	2	-1.523848
exp1438	4.00777441e-16	1.001296	1.000019	discard	Fourier 4modes u=1.44 amp=0.10 positive	agent1_mem	perturbation	2	-1.520844
exp1438	1.34360442e-12	1.002503	1.000218	discard	u=0.1010 a=0.001342	agent0	initial_cond	2	-1.523848
exp1438	1.34360442e-12	1.002503	1.000218	discard	u=0.1010 a=0.001348	agent0	initial_cond	3	-1.523848
exp1438	1.34360442e-12	1.002503	1.000218	discard	u=0.1000 a=0.001340	agent0	initial_cond	3	-1.523848
exp1439	1.34360442e-12	1.002503	1.000218	discard	u=0.2400 a=0.001342	agent0	initial_cond	2	-1.523848
exp1439	1.34360442e-12	1.002503	1.000218	discard	u=0.1010 a=0.001350	agent0	initial_cond	2	-1.523848
exp1439	1.34360442e-12	1.002503	1.000218	discard	u=0.2500 a=0.001342	agent0	initial_cond	2	-1.523848
exp1439	1.34360442e-12	1.002503	1.000218	discard	u=0.2400 a=0.001348	agent0	initial_cond	2	-1.523848
exp1439	1.34360442e-12	1.002503	1.000218	discard	u=0.2500 a=0.001340	agent0	initial_cond	2	-1.523848
exp1439	1.34360442e-12	1.002503	1.000218	discard	u=0.2500 a=0.001344	agent0	initial_cond	2	-1.523848
exp1439	1.34360442e-12	1.002503	1.000218	discard	u=0.2400 a=0.001346	agent0	initial_cond	2	-1.523848
exp1440	1.34360442e-12	1.002503	1.000218	discard	u=0.2600 a=0.001342	agent0	initial_cond	2	-1.523848
exp1440	1.34360442e-12	1.002503	1.000218	discard	u=0.1000 a=0.001344	agent0	initial_cond	2	-1.523848
exp1440	1.34360442e-12	1.002503	1.000218	discard	u=0.2400 a=0.001350	agent0	initial_cond	2	-1.523848
exp1440	1.34360442e-12	1.002503	1.000218	discard	u=0.2500 a=0.001346	agent0	initial_cond	2	-1.523848
exp1441	1.34360442e-12	1.002503	1.000218	discard	u=0.2600 a=0.001348	agent0	initial_cond	2	-1.523848
exp1441	1.34360442e-12	1.002503	1.000218	discard	u=0.2600 a=0.001350	agent0	initial_cond	2	-1.523848
exp1441	1.34360442e-12	1.002503	1.000218	discard	u=0.2500 a=0.001348	agent0	initial_cond	2	-1.523848
exp1441	1.34360442e-12	1.002503	1.000218	discard	u=0.2600 a=0.001346	agent0	initial_cond	2	-1.523848
exp1441	1.34360442e-12	1.002503	1.000218	discard	u=0.2500 a=0.001350	agent0	initial_cond	2	-1.523848
exp1441	1.34360442e-12	1.002503	1.000218	discard	u=0.2600 a=0.001340	agent0	initial_cond	2	-1.523848
exp1442	1.34360442e-12	1.002503	1.000218	discard	u=0.2600 a=0.001344	agent0	initial_cond	2	-1.523848
exp1442	1.34360442e-12	1.002503	1.000218	discard	fine basin u=0.8	agent0	branch_search	1	-1.523848
exp1443	2.06774381e-16	1.001296	1.000019	discard	Fourier 4modes u=1.44 amp=0.15 positive	agent1_mem	perturbation	0	-1.520844
