exp_id	residual	solution_norm	solution_mean	status	description	agent	design	elapsed_s	solution_energy
exp1684	1.34357540e-12	1.002503	1.000218	discard	cycle 1 u=0.1000	agent0	initial_cond	0	-1.523848
exp1685	1.34357540e-12	1.002503	1.000218	discard	no-perturbation basin u=0.8	agent0	branch_search	0	-1.523848
exp1686	1.34360442e-12	1.002503	1.000218	discard	cycle 1 u=0.1000	agent0	initial_cond	1	-1.523848
exp1687	1.34360442e-12	1.002503	1.000218	discard	no-perturbation basin u=0.9	agent0	branch_search	1	-1.523848
exp1688	1.34360442e-12	1.002503	1.000218	discard	cycle 1 u=0.1000	agent0	initial_cond	0	-1.523848
exp1689	1.34360442e-12	1.002503	1.000218	discard	no-perturbation basin u=1.0	agent0	branch_search	0	-1.523848
exp1690	1.34357540e-12	1.002503	1.000218	discard	cycle 1 u=0.1000	agent0	initial_cond	1	-1.523848
exp1691	1.34357540e-12	1.002503	1.000218	discard	no-perturbation basin u=1.1	agent0	branch_search	1	-1.523848
exp1692	1.34357540e-12	1.002503	1.000218	discard	cycle 1 u=0.1000	agent0	initial_cond	0	-1.523848
exp1693	1.34357540e-12	1.002503	1.000218	discard	no-perturbation basin u=1.2	agent0	branch_search	0	-1.523848
exp1694	1.34357540e-12	1.002503	1.000218	discard	cycle 1 u=0.1000	agent0	initial_cond	0	-1.523848
exp1695	1.34357540e-12	1.002503	1.000218	discard	no-perturbation basin u=1.3	agent0	branch_search	1	-1.523848
exp1696	1.34357540e-12	1.002503	1.000218	discard	cycle 1 u=0.1000	agent0	initial_cond	0	-1.523848
exp1697	1.34357540e-12	1.002503	1.000218	discard	no-perturbation basin u=1.4	agent0	branch_search	0	-1.523848
exp1698	1.34357540e-12	1.002503	1.000218	discard	cycle 1 u=0.1000	agent0	initial_cond	0	-1.523848
exp1699	1.34357540e-12	1.002503	1.000218	discard	no-perturbation basin u=1.5	agent0	branch_search	0	-1.523848
exp1700	4.58623706e-29	0.000000	0.000000	discard	cycle 1 u=0.1000	agent0	initial_cond	1	-0.000000
exp1701	4.39794337e-29	0.000000	0.000000	discard	cycle 1 u=0.1000	agent0	initial_cond	0	-0.000000
exp1702	4.39794337e-29	0.000000	0.000000	discard	cycle 1 u=0.1000	agent0	initial_cond	0	-0.000000
exp1703	2.12761318e-16	1.001296	1.000019	discard	Fourier mode=3 amp=0.180 u=1.0	agent1	memory	1	-1.520844
exp1704	4.39794337e-29	0.000000	0.000000	discard	cycle 1 u=0.1000	agent0	initial_cond	0	-0.000000
exp1705	3.37042680e-16	1.001296	1.000019	discard	Fourier mode=3 amp=0.185 u=1.0	agent1	memory	0	-1.520844
exp1706	1.36727475e-28	0.000000	0.000000	discard	cycle 1 u=0.1050	agent0	initial_cond	0	-0.000000
exp1707	2.19719466e-16	1.001296	1.000019	discard	Fourier mode=3 amp=0.190 u=1.0	agent1	memory	0	-1.520844
exp1708	1.36727475e-28	0.000000	0.000000	discard	cycle 1 u=0.1050	agent0	initial_cond	1	-0.000000
exp1709	3.08032707e-16	1.001296	1.000019	discard	Fourier mode=3 amp=0.195 u=1.0	agent1	memory	1	-1.520844
exp1710	1.36727475e-28	0.000000	0.000000	discard	cycle 1 u=0.1050	agent0	initial_cond	0	-0.000000
exp1711	7.15564497e-16	1.001296	1.000019	discard	Fourier mode=3 amp=0.200 u=1.0	agent1	memory	0	-1.520844
exp1712	6.14461376e-29	0.000000	0.000000	discard	cycle 1 u=0.1050	agent0	initial_cond	0	-0.000000
exp1713	1.47584363e-15	1.001296	1.000019	discard	Fourier mode=3 amp=0.205 u=1.0	agent1	memory	1	-1.520844
exp1714	6.14461376e-29	0.000000	0.000000	discard	cycle 1 u=0.1050	agent0	initial_cond	1	-0.000000
exp1715	2.50229714e-14	1.001322	1.000049	discard	Fourier amp=0.19 mode=1 u=1.0	agent1	memory	0	-1.520921
exp1716	6.14461376e-29	0.000000	0.000000	discard	cycle 1 u=0.1050	agent0	initial_cond	0	-0.000000
exp1717	5.10280049e-16	1.001298	1.000025	discard	Fourier amp=0.19 mode=2 u=1.0	agent1	memory	0	-1.520921
exp1718	1.75906666e-28	0.000000	0.000000	discard	cycle 1 u=0.1050	agent0	initial_cond	0	-0.000000
exp1719	2.19719466e-16	1.001296	1.000019	discard	Fourier amp=0.19 mode=3 u=1.0	agent1	memory	1	-1.520844
exp1720	1.75906666e-28	0.000000	0.000000	discard	cycle 1 u=0.1050	agent0	initial_cond	0	-0.000000
exp1721	1.86448479e-16	1.001296	1.000019	discard	Fourier amp=0.19 mode=4 u=1.0	agent1	memory	0	-1.520844
exp1722	1.75906666e-28	0.000000	0.000000	discard	cycle 1 u=0.1050	agent0	initial_cond	0	-0.000000
exp1723	1.30143113e-15	1.001296	1.000019	discard	Fourier amp=0.19 mode=5 u=1.0	agent1	memory	0	-1.520844
exp1723	2.01875310e-15	1.001296	1.000019	discard	matched freq Fourier 4modes amp=0.0 maxit=500	agent1_mem	perturbation	0	-1.520844
exp1724	1.11257917e-28	0.000000	0.000000	discard	cycle 1 u=0.1050	agent0	initial_cond	1	-0.000000
exp1725	2.57581612e-16	1.001296	1.000019	discard	matched freq Fourier 4modes amp=0.05 maxit=500	agent1_mem	perturbation	0	-1.520844
exp1726	1.11257917e-28	0.000000	0.000000	discard	cycle 1 u=0.1050	agent0	initial_cond	0	-0.000000
exp1727	1.96261557e-16	1.001296	1.000019	discard	matched freq Fourier 4modes amp=0.10 maxit=500	agent1_mem	perturbation	0	-1.520844
exp1728	1.11257917e-28	0.000000	0.000000	discard	cycle 1 u=0.1050	agent0	initial_cond	0	-0.000000
exp1729	2.06774381e-16	1.001296	1.000019	discard	matched freq Fourier 4modes amp=0.15 maxit=500	agent1_mem	perturbation	1	-1.520844
exp1730	8.58580947e-29	0.000000	0.000000	discard	cycle 2 u=0.0975	agent0	initial_cond	1	0.000000
exp1731	8.58580947e-29	0.000000	0.000000	discard	cycle 2 u=0.0975	agent0	initial_cond	0	0.000000
exp1732	8.58580947e-29	0.000000	0.000000	discard	cycle 2 u=0.0975	agent0	initial_cond	0	0.000000
exp1733	5.23962023e-29	0.000000	0.000000	discard	cycle 2 u=0.0975	agent0	initial_cond	0	0.000000
exp1734	5.23962023e-29	0.000000	0.000000	discard	cycle 2 u=0.0975	agent0	initial_cond	0	0.000000
exp1735	5.23962023e-29	0.000000	0.000000	discard	cycle 2 u=0.0975	agent0	initial_cond	1	0.000000
exp1736	4.03266298e-29	0.000000	0.000000	discard	cycle 2 u=0.0975	agent0	initial_cond	0	0.000000
exp1737	4.03266298e-29	0.000000	0.000000	discard	cycle 2 u=0.0975	agent0	initial_cond	0	0.000000
exp1738	4.03266298e-29	0.000000	0.000000	discard	cycle 2 u=0.0975	agent0	initial_cond	1	0.000000
exp1739	4.80015937e-29	0.000000	0.000000	discard	positive branch no perturbation n=269 tol=1.4e-12	agent0	solver_param	0	0.000000
exp1739	4.80015937e-29	0.000000	0.000000	discard	cycle 2 u=0.0975	agent0	initial_cond	0	0.000000
exp1740	4.80015937e-29	0.000000	0.000000	discard	cycle 2 u=0.0975	agent0	initial_cond	0	0.000000
exp1741	4.80015937e-29	0.000000	0.000000	discard	cycle 2 u=0.0975	agent0	initial_cond	0	0.000000
exp1742	2.68824537e-29	0.000000	0.000000	discard	cycle 2 u=0.0980	agent0	initial_cond	0	-0.000000
exp1743	2.68824537e-29	0.000000	0.000000	discard	cycle 2 u=0.0980	agent0	initial_cond	1	-0.000000
exp1744	2.68824537e-29	0.000000	0.000000	discard	cycle 2 u=0.0980	agent0	initial_cond	0	-0.000000
exp1745	6.16758073e-29	0.000000	0.000000	discard	cycle 2 u=0.0980	agent0	initial_cond	0	-0.000000
exp1746	6.16758073e-29	0.000000	0.000000	discard	cycle 2 u=0.0980	agent0	initial_cond	1	-0.000000
exp1747	6.16758073e-29	0.000000	0.000000	discard	cycle 2 u=0.0980	agent0	initial_cond	0	-0.000000
exp1748	2.01926478e-29	0.000000	0.000000	discard	cycle 2 u=0.0980	agent0	initial_cond	0	0.000000
exp1749	2.19719466e-16	1.001296	1.000019	discard	Fourier mode=3 amp=0.19 u=1.0	agent1	memory	1	-1.520844
exp1750	2.01926478e-29	0.000000	0.000000	discard	cycle 2 u=0.0980	agent0	initial_cond	0	0.000000
exp1751	1.86448479e-16	1.001296	1.000019	discard	Fourier mode=4 amp=0.19 u=1.0	agent1	memory	0	-1.520844
exp1752	2.01926478e-29	0.000000	0.000000	discard	cycle 2 u=0.0980	agent0	initial_cond	0	0.000000
exp1753	1.30143113e-15	1.001296	1.000019	discard	Fourier mode=5 amp=0.19 u=1.0	agent1	memory	0	-1.520844
exp1754	1.30310780e-28	0.000000	0.000000	discard	cycle 2 u=0.0980	agent0	initial_cond	1	-0.000000
exp1755	1.86448479e-16	1.001296	1.000019	discard	Fourier 4modes u=1.44 newton_tol=1e-15 maxit=500	agent1_mem	solver_param	1	-1.520844
exp1756	1.85113464e-15	1.001296	1.000019	discard	Fourier mode=6 amp=0.19 u=1.0	agent1	memory	0	-1.520844
exp1757	1.30310780e-28	0.000000	0.000000	discard	cycle 2 u=0.0980	agent0	initial_cond	0	-0.000000
exp1758	2.06774381e-16	1.001296	1.000019	discard	Fourier mode=4 amp=0.15 u=1.0	agent1	memory	0	-1.520844
exp1759	1.30310780e-28	0.000000	0.000000	discard	cycle 2 u=0.0980	agent0	initial_cond	0	-0.000000
exp1760	1.96261557e-16	1.001296	1.000019	discard	Fourier mode=4 amp=0.17 u=1.0	agent1	memory	1	-1.520844
exp1761	5.45343271e-29	0.000000	0.000000	discard	cycle 2 u=0.0982	agent0	initial_cond	1	-0.000000
exp1762	5.02914270e-16	1.001296	1.000019	discard	Fourier mode=4 amp=0.18 u=1.0	agent1	memory	0	-1.520844
exp1763	5.45343271e-29	0.000000	0.000000	discard	cycle 2 u=0.0982	agent0	initial_cond	0	-0.000000
exp1764	1.86448479e-16	1.001296	1.000019	discard	Fourier mode=4 amp=0.19 u=1.0	agent1	memory	0	-1.520844
exp1764	5.45343271e-29	0.000000	0.000000	discard	cycle 2 u=0.0982	agent0	initial_cond	0	-0.000000
exp1765	6.01806552e-16	1.001296	1.000019	discard	Fourier mode=4 amp=0.20 u=1.0	agent1	memory	1	-1.520844
exp1765	1.23429977e-28	0.000000	0.000000	discard	cycle 2 u=0.0982	agent0	initial_cond	1	0.000000
exp1766	3.51456269e-15	1.001296	1.000019	discard	Fourier mode=4 amp=0.21 u=1.0	agent1	memory	0	-1.520844
exp1766	1.23429977e-28	0.000000	0.000000	discard	cycle 2 u=0.0982	agent0	initial_cond	0	0.000000
exp1767	1.23429977e-28	0.000000	0.000000	discard	cycle 2 u=0.0982	agent0	initial_cond	1	0.000000
exp1768	1.88036672e-29	0.000000	0.000000	discard	cycle 2 u=0.0982	agent0	initial_cond	0	0.000000
exp1769	1.88036672e-29	0.000000	0.000000	discard	cycle 2 u=0.0982	agent0	initial_cond	0	0.000000
exp1770	1.88036672e-29	0.000000	0.000000	discard	cycle 2 u=0.0982	agent0	initial_cond	1	0.000000
exp1771	1.91190259e-29	0.000000	-0.000000	discard	cycle 2 u=0.0982	agent0	initial_cond	0	0.000000
exp1772	1.91190259e-29	0.000000	-0.000000	discard	cycle 2 u=0.0982	agent0	initial_cond	0	0.000000
exp1773	1.91190259e-29	0.000000	-0.000000	discard	no-pert tol=2.5e-12 n=269	agent0	solver_param	1	0.000000
exp1774	1.91190259e-29	0.000000	-0.000000	discard	cycle 2 u=0.0982	agent0	initial_cond	1	0.000000
exp1775	6.13049994e-29	0.000000	0.000000	discard	no-pert tol=5.0e-12 n=269	agent0	solver_param	0	0.000000
exp1776	6.13049994e-29	0.000000	0.000000	discard	cycle 2 u=0.0985	agent0	initial_cond	0	0.000000
exp1777	6.13049994e-29	0.000000	0.000000	discard	no-pert tol=1.0e-11 n=269	agent0	solver_param	0	0.000000
exp1778	6.13049994e-29	0.000000	0.000000	discard	cycle 2 u=0.0985	agent0	initial_cond	0	0.000000
exp1779	6.13049994e-29	0.000000	0.000000	discard	cycle 2 u=0.0985	agent0	initial_cond	0	0.000000
exp1780	5.49750971e-29	0.000000	0.000000	discard	cycle 2 u=0.0985	agent0	initial_cond	0	0.000000
exp1781	5.49750971e-29	0.000000	0.000000	discard	cycle 2 u=0.0985	agent0	initial_cond	1	0.000000
exp1782	5.49750971e-29	0.000000	0.000000	discard	cycle 2 u=0.0985	agent0	initial_cond	0	0.000000
exp1783	4.15642452e-29	0.000000	0.000000	discard	cycle 2 u=0.0985	agent0	initial_cond	0	0.000000
exp1784	4.15642452e-29	0.000000	0.000000	discard	cycle 2 u=0.0985	agent0	initial_cond	1	0.000000
exp1785	4.15642452e-29	0.000000	0.000000	discard	cycle 2 u=0.0985	agent0	initial_cond	0	0.000000
exp1786	2.19292611e-29	0.000000	0.000000	discard	cycle 2 u=0.0985	agent0	initial_cond	0	-0.000000
exp1787	2.19292611e-29	0.000000	0.000000	discard	cycle 2 u=0.0985	agent0	initial_cond	0	-0.000000
exp1788	2.19292611e-29	0.000000	0.000000	discard	cycle 2 u=0.0985	agent0	initial_cond	0	-0.000000
exp1789	4.22491788e-29	0.000000	0.000000	discard	cycle 2 u=0.0990	agent0	initial_cond	1	-0.000000
exp1790	4.50218076e-12	1.001296	1.000019	discard	Fourier 4modes u=0.7 amp=0.3 mode2 phase=1.0	agent1_mem	perturbation	1	-1.520844
exp1791	4.22491788e-29	0.000000	0.000000	discard	cycle 2 u=0.0990	agent0	initial_cond	0	-0.000000
exp1792	4.22491788e-29	0.000000	0.000000	discard	cycle 2 u=0.0990	agent0	initial_cond	0	-0.000000
exp1793	3.22245147e-29	0.000000	0.000000	discard	cycle 2 u=0.0990	agent0	initial_cond	1	0.000000
exp1794	1.86448479e-16	1.001296	1.000019	discard	Fourier mode=4 amp=0.19 stol=1.0e-9 u=1.0	agent1	memory	0	-1.520844
exp1795	3.22245147e-29	0.000000	0.000000	discard	cycle 2 u=0.0990	agent0	initial_cond	0	0.000000
exp1796	1.86448479e-16	1.001296	1.000019	discard	Fourier mode=4 amp=0.19 stol=1.0e-10 u=1.0	agent1	memory	0	-1.520844
exp1797	3.22245147e-29	0.000000	0.000000	discard	cycle 2 u=0.0990	agent0	initial_cond	0	0.000000
exp1798	1.86448479e-16	1.001296	1.000019	discard	Fourier mode=4 amp=0.19 stol=1.0e-11 u=1.0	agent1	memory	1	-1.520844
exp1799	4.50941488e-29	0.000000	-0.000000	discard	cycle 2 u=0.0990	agent0	initial_cond	0	0.000000
exp1800	1.86448479e-16	1.001296	1.000019	discard	Fourier mode=4 amp=0.19 stol=1.0e-12 u=1.0	agent1	memory	0	-1.520844
exp1801	4.50941488e-29	0.000000	-0.000000	discard	cycle 2 u=0.0990	agent0	initial_cond	0	0.000000
exp1802	1.86448479e-16	1.001296	1.000019	discard	Fourier mode=4 amp=0.19 stol=1.0e-13 u=1.0	agent1	memory	0	-1.520844
exp1803	4.50941488e-29	0.000000	-0.000000	discard	cycle 2 u=0.0990	agent0	initial_cond	1	0.000000
exp1804	1.86448479e-16	1.001296	1.000019	discard	Fourier mode=4 amp=0.19 n=200 u=1.0	agent1	memory	0	-1.520844
exp1805	4.88330883e-29	0.000000	-0.000000	discard	cycle 2 u=0.0990	agent0	initial_cond	0	0.000000
exp1806	1.86448479e-16	1.001296	1.000019	discard	Fourier mode=4 amp=0.19 n=250 u=1.0	agent1	memory	0	-1.520844
exp1807	4.88330883e-29	0.000000	-0.000000	discard	cycle 2 u=0.0990	agent0	initial_cond	0	0.000000
exp1808	1.86448479e-16	1.001296	1.000019	discard	Fourier mode=4 amp=0.19 n=300 u=1.0	agent1	memory	1	-1.520844
exp1809	1.34360442e-12	1.002503	1.000218	discard	cycle 2 u=0.0990	agent0	initial_cond	1	-1.523848
exp1809	1.34360442e-12	1.002503	1.000218	discard	min amp=0.01 n=269 mode=3	agent0	perturbation	1	-1.523848
exp1810	1.86448479e-16	1.001296	1.000019	discard	Fourier mode=4 amp=0.19 n=350 u=1.0	agent1	memory	0	-1.520844
exp1811	1.34360442e-12	1.002503	1.000218	discard	cycle 2 u=0.0995	agent0	initial_cond	0	-1.523848
exp1811	1.34360442e-12	1.002503	1.000218	discard	min amp=0.02 n=269 mode=3	agent0	perturbation	0	-1.523848
exp1812	1.86448479e-16	1.001296	1.000019	discard	Fourier mode=4 amp=0.19 n=400 u=1.0	agent1	memory	0	-1.520844
exp1813	1.34357540e-12	1.002503	1.000218	discard	cycle 2 u=0.0995	agent0	initial_cond	1	-1.523848
exp1813	1.34357540e-12	1.002503	1.000218	discard	min amp=0.05 n=269 mode=3	agent0	perturbation	1	-1.523848
exp1814	1.34357540e-12	1.002503	1.000218	discard	cycle 2 u=0.0995	agent0	initial_cond	0	-1.523848
exp1814	1.34357540e-12	1.002503	1.000218	discard	min amp=0.1 n=269 mode=3	agent0	perturbation	0	-1.523848
exp1815	1.34360442e-12	1.002503	1.000218	discard	cycle 2 u=0.0995	agent0	initial_cond	1	-1.523848
exp1815	1.34360442e-12	1.002503	1.000218	discard	min amp=0.15 n=269 mode=3	agent0	perturbation	1	-1.523848
exp1816	1.34360442e-12	1.002503	1.000218	discard	cycle 2 u=0.0995	agent0	initial_cond	0	-1.523848
exp1816	1.34360442e-12	1.002503	1.000218	discard	min amp=0.2 n=269 mode=3	agent0	perturbation	0	-1.523848
exp1817	1.34357540e-12	1.002503	1.000218	discard	cycle 2 u=0.0995	agent0	initial_cond	1	-1.523848
exp1817	1.34357540e-12	1.002503	1.000218	discard	min amp=0.3 n=269 mode=3	agent0	perturbation	1	-1.523848
exp1818	1.60328418e-29	0.000000	-0.000000	discard	cycle 2 u=0.0995	agent0	initial_cond	0	-0.000000
exp1819	1.60328418e-29	0.000000	-0.000000	discard	cycle 2 u=0.0995	agent0	initial_cond	0	-0.000000
exp1820	1.60328418e-29	0.000000	-0.000000	discard	cycle 2 u=0.0995	agent0	initial_cond	0	-0.000000
exp1821	7.34590618e-29	0.000000	0.000000	discard	cycle 2 u=0.0995	agent0	initial_cond	0	0.000000
exp1822	7.34590618e-29	0.000000	0.000000	discard	cycle 2 u=0.0995	agent0	initial_cond	1	0.000000
exp1823	1.90280355e-16	0.000000	-0.000000	discard	oscillatory u=0.1 amp=0.5 mode1 Fourier 4	agent1_mem	perturbation	0	-0.000000
exp1824	7.34590618e-29	0.000000	0.000000	discard	cycle 2 u=0.0995	agent0	initial_cond	0	0.000000
exp1825	6.50084470e-13	0.000000	-0.000000	discard	oscillatory u=0.2 amp=0.4 mode1 Fourier 4	agent1_mem	perturbation	0	-0.000000
exp1826	4.46546993e-29	0.000000	0.000000	discard	cycle 2 u=0.1000	agent0	initial_cond	0	-0.000000
exp1827	1.19406916e-23	0.000000	-0.000000	discard	oscillatory u=0.3 amp=0.3 mode1 Fourier 4	agent1_mem	perturbation	1	-0.000000
exp1828	4.46546993e-29	0.000000	0.000000	discard	cycle 2 u=0.1000	agent0	initial_cond	1	-0.000000
exp1829	1.96261557e-16	1.001296	1.000019	discard	oscillatory u=0.5 amp=0.5 mode1 Fourier 4	agent1_mem	perturbation	0	-1.520844
exp1830	4.46546993e-29	0.000000	0.000000	discard	cycle 2 u=0.1000	agent0	initial_cond	0	-0.000000
exp1831	4.08106752e-29	0.000000	0.000000	discard	cycle 2 u=0.1000	agent0	initial_cond	1	-0.000000
exp1832	4.08106752e-29	0.000000	0.000000	discard	cycle 2 u=0.1000	agent0	initial_cond	0	-0.000000
exp1833	4.08106752e-29	0.000000	0.000000	discard	cycle 2 u=0.1000	agent0	initial_cond	0	-0.000000
exp1834	4.58623706e-29	0.000000	0.000000	discard	cycle 2 u=0.1000	agent0	initial_cond	1	-0.000000
exp1835	4.58623706e-29	0.000000	0.000000	discard	cycle 2 u=0.1000	agent0	initial_cond	0	-0.000000
exp1836	4.58623706e-29	0.000000	0.000000	discard	cycle 2 u=0.1000	agent0	initial_cond	0	-0.000000
exp1837	4.39794337e-29	0.000000	0.000000	discard	cycle 2 u=0.1000	agent0	initial_cond	1	-0.000000
exp1838	4.39794337e-29	0.000000	0.000000	discard	cycle 2 u=0.1000	agent0	initial_cond	0	-0.000000
exp1839	4.39794337e-29	0.000000	0.000000	discard	cycle 2 u=0.1000	agent0	initial_cond	1	-0.000000
exp1840	1.34357540e-12	1.002503	1.000218	discard	cycle 2 u=0.1050	agent0	initial_cond	0	-1.523848
exp1841	1.34357540e-12	1.002503	1.000218	discard	tiny amp=0.001 n=269 mode=3	agent0	perturbation	0	-1.523848
exp1842	1.34360442e-12	1.002503	1.000218	discard	cycle 2 u=0.1050	agent0	initial_cond	0	-1.523848
exp1843	1.34360442e-12	1.002503	1.000218	discard	tiny amp=0.002 n=269 mode=3	agent0	perturbation	1	-1.523848
exp1844	1.34360442e-12	1.002503	1.000218	discard	cycle 2 u=0.1050	agent0	initial_cond	0	-1.523848
exp1845	1.34360442e-12	1.002503	1.000218	discard	tiny amp=0.005 n=269 mode=3	agent0	perturbation	0	-1.523848
exp1846	1.34357540e-12	1.002503	1.000218	discard	cycle 2 u=0.1050	agent0	initial_cond	0	-1.523848
exp1847	1.34357540e-12	1.002503	1.000218	discard	tiny amp=0.008 n=269 mode=3	agent0	perturbation	0	-1.523848
exp1848	6.14461376e-29	0.000000	0.000000	discard	cycle 2 u=0.1050	agent0	initial_cond	1	-0.000000
exp1849	6.14461376e-29	0.000000	0.000000	discard	cycle 2 u=0.1050	agent0	initial_cond	0	-0.000000
exp1850	1.75906666e-28	0.000000	0.000000	discard	cycle 2 u=0.1050	agent0	initial_cond	1	-0.000000
exp1851	1.75906666e-28	0.000000	0.000000	discard	cycle 2 u=0.1050	agent0	initial_cond	0	-0.000000
exp1852	1.75906666e-28	0.000000	0.000000	discard	cycle 2 u=0.1050	agent0	initial_cond	0	-0.000000
exp1853	1.11257917e-28	0.000000	0.000000	discard	cycle 2 u=0.1050	agent0	initial_cond	1	-0.000000
exp1854	1.11257917e-28	0.000000	0.000000	discard	cycle 2 u=0.1050	agent0	initial_cond	0	-0.000000
exp1855	1.11257917e-28	0.000000	0.000000	discard	cycle 2 u=0.1050	agent0	initial_cond	0	-0.000000
exp1856	8.58580947e-29	0.000000	0.000000	discard	cycle 3 u=0.0975	agent0	initial_cond	1	0.000000
exp1857	8.58580947e-29	0.000000	0.000000	discard	cycle 3 u=0.0975	agent0	initial_cond	0	0.000000
exp1858	8.58580947e-29	0.000000	0.000000	discard	cycle 3 u=0.0975	agent0	initial_cond	1	0.000000
exp1859	5.23962023e-29	0.000000	0.000000	discard	cycle 3 u=0.0975	agent0	initial_cond	0	0.000000
exp1860	5.23962023e-29	0.000000	0.000000	discard	cycle 3 u=0.0975	agent0	initial_cond	0	0.000000
exp1861	2.06774381e-16	1.001296	1.000019	discard	extreme offset u=2.0 Fourier 4modes	agent1_mem	perturbation	0	-1.520844
exp1862	5.23962023e-29	0.000000	0.000000	discard	cycle 3 u=0.0975	agent0	initial_cond	1	0.000000
exp1863	2.06774381e-16	1.001296	1.000019	discard	extreme offset u=3.0 Fourier 4modes	agent1_mem	perturbation	0	-1.520844
exp1864	4.03266298e-29	0.000000	0.000000	discard	cycle 3 u=0.0975	agent0	initial_cond	0	0.000000
exp1865	4.37535640e-16	1.001296	1.000019	discard	extreme offset u=5.0 Fourier 4modes	agent1_mem	perturbation	0	-1.520844
exp1866	4.03266298e-29	0.000000	0.000000	discard	cycle 3 u=0.0975	agent0	initial_cond	0	0.000000
exp1867	1.96261557e-16	1.001296	1.000019	discard	extreme offset u=10.0 Fourier 4modes	agent1_mem	perturbation	1	-1.520844
exp1868	4.03266298e-29	0.000000	0.000000	discard	cycle 3 u=0.0975	agent0	initial_cond	0	0.000000
exp1869	4.80015937e-29	0.000000	0.000000	discard	cycle 3 u=0.0975	agent0	initial_cond	0	0.000000
exp1870	4.80015937e-29	0.000000	0.000000	discard	cycle 3 u=0.0975	agent0	initial_cond	1	0.000000
exp1871	4.80015937e-29	0.000000	0.000000	discard	cycle 3 u=0.0975	agent0	initial_cond	0	0.000000
exp1872	2.68824537e-29	0.000000	0.000000	discard	cycle 3 u=0.0980	agent0	initial_cond	0	-0.000000
exp1873	1.34360442e-12	1.002503	1.000218	discard	cycle 3 u=0.0980	agent0	initial_cond	1	-1.523848
exp1874	2.68824537e-29	0.000000	0.000000	discard	micro amp=0.0001	agent0	perturbation	0	-0.000000
exp1875	1.34360442e-12	1.002503	1.000218	discard	cycle 3 u=0.0980	agent0	initial_cond	0	-1.523848
exp1876	1.34360442e-12	1.002503	1.000218	discard	micro amp=0.0005	agent0	perturbation	0	-1.523848
exp1877	1.34360442e-12	1.002503	1.000218	discard	cycle 3 u=0.0980	agent0	initial_cond	1	-1.523848
exp1877	1.96261557e-16	1.001296	1.000019	discard	verify amp=0.17 mode=4 u=1.0	agent1	memory	1	-1.520844
exp1878	1.34360442e-12	1.002503	1.000218	discard	micro amp=0.0008	agent0	perturbation	0	-1.523848
exp1879	2.06774381e-16	1.001296	1.000019	discard	Fourier mode=4 amp=0.160 u=1.0	agent1	memory	0	-1.520844
exp1880	1.34357540e-12	1.002503	1.000218	discard	cycle 3 u=0.0980	agent0	initial_cond	0	-1.523848
exp1881	1.34357540e-12	1.002503	1.000218	discard	micro amp=0.001	agent0	perturbation	0	-1.523848
exp1882	2.57581612e-16	1.001296	1.000019	discard	Fourier mode=4 amp=0.165 u=1.0	agent1	memory	1	-1.520844
exp1883	6.16758073e-29	0.000000	0.000000	discard	cycle 3 u=0.0980	agent0	initial_cond	1	-0.000000
