exp_id	residual	solution_norm	solution_mean	status	description	agent	design	elapsed_s	solution_energy
exp3059	0.00000000e+00	0.000000	0.000000	discard	PHASE_2_89_VERIFY trial=4	agent1	memory	0	0.000000
exp3060	4.39794337e-29	0.000000	0.000000	discard	Fourier pos modes=8	agent0	solver_param	0	-0.000000
exp3061	5.89401543e-15	1.001296	1.000019	discard	cycle 11 u=0.1000	agent0	initial_cond	0	-1.520844
exp3062	0.00000000e+00	0.000000	0.000000	discard	PHASE_2_89_VERIFY trial=5	agent1	memory	0	0.000000
exp3063	4.39794337e-29	0.000000	0.000000	discard	Fourier pos modes=10	agent0	solver_param	1	-0.000000
exp3064	9.43218526e-15	1.001296	1.000019	discard	cycle 11 u=0.1000	agent0	initial_cond	1	-1.520844
exp3065	0.00000000e+00	0.000000	0.000000	discard	PHASE_2_89_VERIFY trial=5	agent1	memory	1	0.000000
exp3066	1.36727475e-28	0.000000	0.000000	discard	Fourier pos modes=12	agent0	solver_param	0	-0.000000
exp3067	1.29135363e-14	1.001296	1.000019	discard	cycle 11 u=0.1050	agent0	initial_cond	0	-1.520844
exp3068	0.00000000e+00	0.000000	0.000000	discard	PHASE_2_89_VERIFY trial=5	agent1	memory	0	0.000000
exp3069	1.36727475e-28	0.000000	0.000000	discard	Fourier pos modes=14	agent0	solver_param	0	-0.000000
exp3070	1.15589045e-14	1.001296	1.000019	discard	cycle 11 u=0.1050	agent0	initial_cond	0	-1.520844
exp3071	0.00000000e+00	0.000000	0.000000	discard	PHASE_2_89_VERIFY trial=6	agent1	memory	1	0.000000
exp3072	1.36727475e-28	0.000000	0.000000	discard	Fourier pos modes=16	agent0	solver_param	1	-0.000000
exp3073	1.76896924e-14	1.001296	1.000019	discard	cycle 11 u=0.1050	agent0	initial_cond	0	-1.520844
exp3074	0.00000000e+00	0.000000	0.000000	discard	PHASE_2_89_VERIFY trial=6	agent1	memory	0	0.000000
exp3075	6.14461376e-29	0.000000	0.000000	discard	Fourier pos modes=18	agent0	solver_param	0	-0.000000
exp3076	2.54083327e-14	1.001296	1.000019	discard	cycle 11 u=0.1050	agent0	initial_cond	0	-1.520844
exp3077	0.00000000e+00	0.000000	0.000000	discard	PHASE_2_89_VERIFY trial=6	agent1	memory	0	0.000000
exp3078	6.14461376e-29	0.000000	0.000000	discard	Fourier pos modes=20	agent0	solver_param	1	-0.000000
exp3079	7.19787253e-14	1.001296	1.000019	discard	cycle 11 u=0.1050	agent0	initial_cond	1	-1.520844
exp3080	0.00000000e+00	0.000000	0.000000	discard	PHASE_2_89_VERIFY trial=7	agent1	memory	1	0.000000
exp3081	6.14461376e-29	0.000000	0.000000	discard	Fourier pos modes=24	agent0	solver_param	0	-0.000000
exp3082	6.14461376e-29	0.000000	0.000000	discard	cycle 11 u=0.1050	agent0	initial_cond	0	-0.000000
exp3083	0.00000000e+00	0.000000	0.000000	discard	PHASE_2_89_VERIFY trial=7	agent1	memory	0	0.000000
exp3084	1.75906666e-28	0.000000	0.000000	discard	cycle 11 u=0.1050	agent0	initial_cond	0	-0.000000
exp3085	0.00000000e+00	0.000000	0.000000	discard	PHASE_2_89_VERIFY trial=7	agent1	memory	1	0.000000
exp3086	1.75906666e-28	0.000000	0.000000	discard	cycle 11 u=0.1050	agent0	initial_cond	1	-0.000000
exp3087	0.00000000e+00	0.000000	0.000000	discard	PHASE_2_89_VERIFY trial=8	agent1	memory	0	0.000000
exp3088	1.75906666e-28	0.000000	0.000000	discard	cycle 11 u=0.1050	agent0	initial_cond	0	-0.000000
exp3089	0.00000000e+00	0.000000	0.000000	discard	PHASE_2_89_VERIFY trial=8	agent1	memory	0	0.000000
exp3090	1.11257917e-28	0.000000	0.000000	discard	cycle 11 u=0.1050	agent0	initial_cond	1	-0.000000
exp3091	0.00000000e+00	0.000000	0.000000	discard	PHASE_2_89_VERIFY trial=8	agent1	memory	1	0.000000
exp3092	1.11257917e-28	0.000000	0.000000	discard	cycle 11 u=0.1050	agent0	initial_cond	0	-0.000000
exp3093	0.00000000e+00	0.000000	0.000000	discard	PHASE_2_89_VERIFY trial=9	agent1	memory	0	0.000000
exp3094	1.11257917e-28	0.000000	0.000000	discard	cycle 11 u=0.1050	agent0	initial_cond	0	-0.000000
exp3095	0.00000000e+00	0.000000	0.000000	discard	PHASE_2_89_VERIFY trial=9	agent1	memory	0	0.000000
exp3096	8.58580947e-29	0.000000	0.000000	discard	cycle 12 u=0.0975	agent0	initial_cond	1	0.000000
exp3097	0.00000000e+00	0.000000	0.000000	discard	PHASE_2_89_VERIFY trial=9	agent1	memory	1	0.000000
exp3098	8.58580947e-29	0.000000	0.000000	discard	cycle 12 u=0.0975	agent0	initial_cond	0	0.000000
exp3099	0.00000000e+00	0.000000	0.000000	discard	PHASE_2_89_VERIFY trial=10	agent1	memory	0	0.000000
exp3100	8.58580947e-29	0.000000	0.000000	discard	cycle 12 u=0.0975	agent0	initial_cond	0	0.000000
exp3101	0.00000000e+00	0.000000	0.000000	discard	PHASE_2_89_VERIFY trial=10	agent1	memory	1	0.000000
exp3102	5.23962023e-29	0.000000	0.000000	discard	cycle 12 u=0.0975	agent0	initial_cond	0	0.000000
exp3103	0.00000000e+00	0.000000	0.000000	discard	PHASE_2_89_VERIFY trial=10	agent1	memory	0	0.000000
exp3104	1.43955439e-13	0.070536	0.000000	discard	4th branch stability test amp=0.05	agent1_mem	ablation	0	0.000099
exp3105	5.23962023e-29	0.000000	0.000000	discard	cycle 12 u=0.0975	agent0	initial_cond	0	0.000000
exp3106	1.93176520e-18	0.000000	0.000000	discard	PHASE_2_89_AMP amp=0.3	agent1	memory	0	-0.000000
exp3107	3.73573027e-15	0.070536	-0.000000	discard	4th branch stability test amp=0.07	agent1_mem	ablation	0	0.000099
exp3108	5.23962023e-29	0.000000	0.000000	discard	cycle 12 u=0.0975	agent0	initial_cond	1	0.000000
exp3109	0.00000000e+00	0.000000	0.000000	discard	PHASE_2_89_AMP amp=0.4	agent1	memory	1	0.000000
exp3110	1.39820990e-13	0.070536	-0.000000	discard	4th branch stability test amp=0.1	agent1_mem	ablation	0	0.000099
exp3111	4.03266298e-29	0.000000	0.000000	discard	cycle 12 u=0.0975	agent0	initial_cond	0	0.000000
exp3112	1.29191782e-17	0.000000	0.000000	discard	PHASE_2_89_AMP amp=0.45	agent1	memory	0	-0.000000
exp3113	2.08436719e-14	0.070536	-0.000000	discard	4th branch stability test amp=0.15	agent1_mem	ablation	0	0.000099
exp3114	4.03266298e-29	0.000000	0.000000	discard	cycle 12 u=0.0975	agent0	initial_cond	0	0.000000
exp3115	0.00000000e+00	0.000000	0.000000	discard	PHASE_2_89_AMP amp=0.5	agent1	memory	0	0.000000
exp3116	2.99204001e-15	0.070536	-0.000000	discard	4th branch stability test amp=0.2	agent1_mem	ablation	1	0.000099
exp3117	4.03266298e-29	0.000000	0.000000	discard	cycle 12 u=0.0975	agent0	initial_cond	1	0.000000
exp3118	2.12251292e-15	0.000000	0.000000	discard	PHASE_2_89_AMP amp=0.55	agent1	memory	0	-0.000000
exp3119	1.92003524e-14	0.070536	-0.000000	discard	4th branch stability test amp=0.3	agent1_mem	ablation	0	0.000099
exp3120	4.80015937e-29	0.000000	0.000000	discard	cycle 12 u=0.0975	agent0	initial_cond	0	0.000000
exp3121	5.55111512e-17	1.001322	1.000049	discard	PHASE_2_89_AMP amp=0.6	agent1	memory	0	-1.520921
exp3122	3.18363861e-16	0.070536	-0.000000	discard	4th branch stability test amp=0.4	agent1_mem	ablation	0	0.000099
exp3123	4.80015937e-29	0.000000	0.000000	discard	cycle 12 u=0.0975	agent0	initial_cond	1	0.000000
exp3124	4.80015937e-29	0.000000	0.000000	discard	cycle 12 u=0.0975	agent0	initial_cond	0	0.000000
exp3125	2.68824537e-29	0.000000	0.000000	discard	cycle 12 u=0.0980	agent0	initial_cond	0	-0.000000
exp3126	2.68824537e-29	0.000000	0.000000	discard	cycle 12 u=0.0980	agent0	initial_cond	1	-0.000000
exp3127	6.04747797e-14	1.001296	1.000019	discard	cycle 12 u=0.0980	agent0	initial_cond	0	-1.520844
exp3128	6.16758073e-29	0.000000	0.000000	discard	Fourier retry 1	agent0	solver_param	0	-0.000000
exp3129	6.16758073e-29	0.000000	0.000000	discard	cycle 12 u=0.0980	agent0	initial_cond	0	-0.000000
exp3130	6.16758073e-29	0.000000	0.000000	discard	Fourier retry 2	agent0	solver_param	1	-0.000000
exp3131	6.16758073e-29	0.000000	0.000000	discard	cycle 12 u=0.0980	agent0	initial_cond	0	-0.000000
exp3132	6.16758073e-29	0.000000	0.000000	discard	Fourier retry 3	agent0	solver_param	0	-0.000000
exp3133	6.16758073e-29	0.000000	0.000000	discard	cycle 12 u=0.0980	agent0	initial_cond	0	-0.000000
exp3134	2.01926478e-29	0.000000	0.000000	discard	Fourier retry 4	agent0	solver_param	0	0.000000
exp3135	2.01926478e-29	0.000000	0.000000	discard	cycle 12 u=0.0980	agent0	initial_cond	1	0.000000
exp3136	2.01926478e-29	0.000000	0.000000	discard	Fourier retry 5	agent0	solver_param	0	0.000000
exp3137	2.01926478e-29	0.000000	0.000000	discard	cycle 12 u=0.0980	agent0	initial_cond	0	0.000000
exp3138	2.01926478e-29	0.000000	0.000000	discard	cycle 12 u=0.0980	agent0	initial_cond	0	0.000000
exp3139	1.30310780e-28	0.000000	0.000000	discard	cycle 12 u=0.0980	agent0	initial_cond	1	-0.000000
exp3140	1.30310780e-28	0.000000	0.000000	discard	cycle 12 u=0.0980	agent0	initial_cond	0	-0.000000
exp3141	1.30310780e-28	0.000000	0.000000	discard	cycle 12 u=0.0980	agent0	initial_cond	0	-0.000000
exp3142	5.45343271e-29	0.000000	0.000000	discard	cycle 12 u=0.0982	agent0	initial_cond	0	-0.000000
exp3143	5.45343271e-29	0.000000	0.000000	discard	cycle 12 u=0.0982	agent0	initial_cond	0	-0.000000
exp3144	5.45343271e-29	0.000000	0.000000	discard	cycle 12 u=0.0982	agent0	initial_cond	1	-0.000000
exp3145	1.23429977e-28	0.000000	0.000000	discard	cycle 12 u=0.0982	agent0	initial_cond	0	0.000000
exp3146	1.23429977e-28	0.000000	0.000000	discard	cycle 12 u=0.0982	agent0	initial_cond	0	0.000000
exp3147	1.23429977e-28	0.000000	0.000000	discard	cycle 12 u=0.0982	agent0	initial_cond	1	0.000000
exp3148	1.88036672e-29	0.000000	0.000000	discard	cycle 12 u=0.0982	agent0	initial_cond	0	0.000000
exp3149	1.88036672e-29	0.000000	0.000000	discard	cycle 12 u=0.0982	agent0	initial_cond	0	0.000000
exp3150	1.88036672e-29	0.000000	0.000000	discard	cycle 12 u=0.0982	agent0	initial_cond	0	0.000000
exp3151	1.91190259e-29	0.000000	-0.000000	discard	cycle 12 u=0.0982	agent0	initial_cond	0	0.000000
exp3152	1.91190259e-29	0.000000	-0.000000	discard	cycle 12 u=0.0982	agent0	initial_cond	1	0.000000
exp3153	1.91190259e-29	0.000000	-0.000000	discard	cycle 12 u=0.0982	agent0	initial_cond	0	0.000000
exp3154	6.13049994e-29	0.000000	0.000000	discard	cycle 12 u=0.0985	agent0	initial_cond	0	0.000000
exp3155	6.13049994e-29	0.000000	0.000000	discard	cycle 12 u=0.0985	agent0	initial_cond	1	0.000000
exp3156	6.13049994e-29	0.000000	0.000000	discard	cycle 12 u=0.0985	agent0	initial_cond	0	0.000000
exp3157	5.49750971e-29	0.000000	0.000000	discard	cycle 12 u=0.0985	agent0	initial_cond	0	0.000000
exp3158	6.08424607e-15	0.070536	-0.000000	discard	exhaustive hunt u=0.0 phase=0.3	agent1_mem	branch_search	0	0.000099
exp3158	5.49750971e-29	0.000000	0.000000	discard	cycle 12 u=0.0985	agent0	initial_cond	0	0.000000
exp3159	4.39965024e-13	0.070536	-0.000000	discard	exhaustive hunt u=0.0 phase=0.7	agent1_mem	branch_search	0	0.000099
exp3159	5.49750971e-29	0.000000	0.000000	discard	cycle 12 u=0.0985	agent0	initial_cond	0	0.000000
exp3160	2.23494550e-16	0.070536	-0.000000	discard	exhaustive hunt u=0.0 phase=2.0	agent1_mem	branch_search	1	0.000099
exp3160	4.15642452e-29	0.000000	0.000000	discard	cycle 12 u=0.0985	agent0	initial_cond	1	0.000000
exp3161	4.15642452e-29	0.000000	0.000000	discard	scipy retry 1 n=269	agent0	solver_param	0	0.000000
exp3162	3.02537199e-13	0.070536	0.000000	discard	exhaustive hunt u=0.0 phase=2.5	agent1_mem	branch_search	0	0.000099
exp3162	4.15642452e-29	0.000000	0.000000	discard	cycle 12 u=0.0985	agent0	initial_cond	0	0.000000
exp3163	4.15642452e-29	0.000000	0.000000	discard	scipy retry 2 n=269	agent0	solver_param	0	0.000000
exp3164	4.20230369e-16	0.070536	0.000000	discard	exhaustive hunt u=0.0 phase=4.0	agent1_mem	branch_search	0	0.000099
exp3164	4.15642452e-29	0.000000	0.000000	discard	cycle 12 u=0.0985	agent0	initial_cond	0	0.000000
exp3165	2.19292611e-29	0.000000	0.000000	discard	scipy retry 3 n=269	agent0	solver_param	1	-0.000000
exp3166	2.46277773e-16	0.070536	0.000000	discard	exhaustive hunt u=0.0 phase=4.5	agent1_mem	branch_search	1	0.000099
exp3166	2.19292611e-29	0.000000	0.000000	discard	cycle 12 u=0.0985	agent0	initial_cond	1	-0.000000
exp3167	4.46041854e-16	0.070536	0.000000	discard	exhaustive hunt u=0.0 phase=5.0	agent1_mem	branch_search	0	0.000099
exp3167	2.19292611e-29	0.000000	0.000000	discard	cycle 12 u=0.0985	agent0	initial_cond	0	-0.000000
exp3168	1.57901072e-16	0.070536	-0.000000	discard	exhaustive hunt u=0.0 phase=5.5	agent1_mem	branch_search	1	0.000099
exp3168	2.19292611e-29	0.000000	0.000000	discard	cycle 12 u=0.0985	agent0	initial_cond	1	-0.000000
exp3169	3.87660844e-16	0.070536	-0.000000	discard	exhaustive hunt u=0.3 phase=1.5708	agent1_mem	branch_search	0	0.000099
exp3169	4.22491788e-29	0.000000	0.000000	discard	cycle 12 u=0.0990	agent0	initial_cond	0	-0.000000
exp3170	2.43169881e-15	1.001296	1.000019	discard	exhaustive hunt u=0.5 phase=1.5708	agent1_mem	branch_search	0	-1.520844
exp3170	4.22491788e-29	0.000000	0.000000	discard	cycle 12 u=0.0990	agent0	initial_cond	0	-0.000000
exp3171	4.22491788e-29	0.000000	0.000000	discard	cycle 12 u=0.0990	agent0	initial_cond	1	-0.000000
exp3171	3.99399166e-16	0.070536	0.000000	discard	exhaustive hunt u=-0.3 phase=1.5708	agent1_mem	branch_search	1	0.000099
exp3172	3.22245147e-29	0.000000	0.000000	discard	cycle 12 u=0.0990	agent0	initial_cond	0	0.000000
exp3173	3.22245147e-29	0.000000	0.000000	discard	cycle 12 u=0.0990	agent0	initial_cond	0	0.000000
exp3174	3.22245147e-29	0.000000	0.000000	discard	cycle 12 u=0.0990	agent0	initial_cond	0	0.000000
exp3175	4.50941488e-29	0.000000	-0.000000	discard	cycle 12 u=0.0990	agent0	initial_cond	0	0.000000
exp3176	4.50941488e-29	0.000000	-0.000000	discard	cycle 12 u=0.0990	agent0	initial_cond	1	0.000000
exp3177	4.50941488e-29	0.000000	-0.000000	discard	cycle 12 u=0.0990	agent0	initial_cond	0	0.000000
exp3178	4.88330883e-29	0.000000	-0.000000	discard	cycle 12 u=0.0990	agent0	initial_cond	0	0.000000
exp3179	4.88330883e-29	0.000000	-0.000000	discard	cycle 12 u=0.0990	agent0	initial_cond	1	0.000000
exp3180	4.88330883e-29	0.000000	-0.000000	discard	cycle 12 u=0.0990	agent0	initial_cond	0	0.000000
exp3181	1.50912756e-13	0.000000	0.000000	discard	EXACT_AMP amp=0.35 phase=2.89	agent1	memory	0	-0.000000
exp3182	5.74085541e-29	0.000000	-0.000000	discard	cycle 12 u=0.0995	agent0	initial_cond	0	0.000000
exp3183	1.96863121e-26	0.000000	0.000000	discard	EXACT_AMP amp=0.38 phase=2.89	agent1	memory	1	-0.000000
exp3184	5.74085541e-29	0.000000	-0.000000	discard	cycle 12 u=0.0995	agent0	initial_cond	0	0.000000
exp3185	0.00000000e+00	0.000000	0.000000	discard	EXACT_AMP amp=0.40 phase=2.89	agent1	memory	0	0.000000
exp3186	5.74085541e-29	0.000000	-0.000000	discard	cycle 12 u=0.0995	agent0	initial_cond	0	0.000000
exp3187	5.74561345e-22	0.000000	0.000000	discard	EXACT_AMP amp=0.42 phase=2.89	agent1	memory	0	-0.000000
exp3188	1.54984578e-28	0.000000	0.000000	discard	cycle 12 u=0.0995	agent0	initial_cond	1	-0.000000
exp3189	1.29191782e-17	0.000000	0.000000	discard	EXACT_AMP amp=0.45 phase=2.89	agent1	memory	0	-0.000000
exp3190	1.54984578e-28	0.000000	0.000000	discard	cycle 12 u=0.0995	agent0	initial_cond	0	-0.000000
exp3191	7.19572703e-14	0.000000	0.000000	discard	EXACT_AMP amp=0.48 phase=2.89	agent1	memory	0	-0.000000
exp3192	1.54984578e-28	0.000000	0.000000	discard	cycle 12 u=0.0995	agent0	initial_cond	0	-0.000000
exp3193	0.00000000e+00	0.000000	0.000000	discard	EXACT_AMP amp=0.50 phase=2.89	agent1	memory	1	0.000000
exp3194	1.60328418e-29	0.000000	-0.000000	discard	cycle 12 u=0.0995	agent0	initial_cond	1	-0.000000
exp3195	4.77190738e-24	0.000000	0.000000	discard	EXACT_AMP amp=0.52 phase=2.89	agent1	memory	0	-0.000000
exp3196	1.60328418e-29	0.000000	-0.000000	discard	cycle 12 u=0.0995	agent0	initial_cond	0	-0.000000
exp3197	2.12251292e-15	0.000000	0.000000	discard	EXACT_AMP amp=0.55 phase=2.89	agent1	memory	0	-0.000000
exp3198	1.60328418e-29	0.000000	-0.000000	discard	cycle 12 u=0.0995	agent0	initial_cond	1	-0.000000
exp3199	1.57170328e-12	1.001322	1.000049	discard	EXACT_AMP amp=0.58 phase=2.89	agent1	memory	1	-1.520921
exp3200	7.34590618e-29	0.000000	0.000000	discard	cycle 12 u=0.0995	agent0	initial_cond	0	0.000000
exp3201	5.55111512e-17	1.001322	1.000049	discard	EXACT_AMP amp=0.60 phase=2.89	agent1	memory	0	-1.520921
exp3202	7.34590618e-29	0.000000	0.000000	discard	cycle 12 u=0.0995	agent0	initial_cond	0	0.000000
exp3203	7.34590618e-29	0.000000	0.000000	discard	cycle 12 u=0.0995	agent0	initial_cond	1	0.000000
exp3204	4.46546993e-29	0.000000	0.000000	discard	cycle 12 u=0.1000	agent0	initial_cond	0	-0.000000
exp3205	4.46546993e-29	0.000000	0.000000	discard	cycle 12 u=0.1000	agent0	initial_cond	0	-0.000000
exp3206	4.46546993e-29	0.000000	0.000000	discard	cycle 12 u=0.1000	agent0	initial_cond	0	-0.000000
exp3207	4.08106752e-29	0.000000	0.000000	discard	cycle 12 u=0.1000	agent0	initial_cond	0	-0.000000
exp3208	4.08106752e-29	0.000000	0.000000	discard	cycle 12 u=0.1000	agent0	initial_cond	1	-0.000000
exp3209	4.08106752e-29	0.000000	0.000000	discard	cycle 12 u=0.1000	agent0	initial_cond	0	-0.000000
exp3210	4.58623706e-29	0.000000	0.000000	discard	cycle 12 u=0.1000	agent0	initial_cond	0	-0.000000
exp3211	4.58623706e-29	0.000000	0.000000	discard	cycle 12 u=0.1000	agent0	initial_cond	1	-0.000000
exp3212	4.58623706e-29	0.000000	0.000000	discard	cycle 12 u=0.1000	agent0	initial_cond	0	-0.000000
exp3213	4.39794337e-29	0.000000	0.000000	discard	cycle 12 u=0.1000	agent0	initial_cond	0	-0.000000
exp3214	4.39794337e-29	0.000000	0.000000	discard	cycle 12 u=0.1000	agent0	initial_cond	0	-0.000000
exp3215	4.39794337e-29	0.000000	0.000000	discard	cycle 12 u=0.1000	agent0	initial_cond	0	-0.000000
exp3216	1.36727475e-28	0.000000	0.000000	discard	cycle 12 u=0.1050	agent0	initial_cond	1	-0.000000
exp3217	1.36727475e-28	0.000000	0.000000	discard	cycle 12 u=0.1050	agent0	initial_cond	0	-0.000000
exp3218	1.36727475e-28	0.000000	0.000000	discard	cycle 12 u=0.1050	agent0	initial_cond	0	-0.000000
exp3219	6.14461376e-29	0.000000	0.000000	discard	cycle 12 u=0.1050	agent0	initial_cond	1	-0.000000
exp3220	6.14461376e-29	0.000000	0.000000	discard	cycle 12 u=0.1050	agent0	initial_cond	0	-0.000000
exp3221	6.14461376e-29	0.000000	0.000000	discard	cycle 12 u=0.1050	agent0	initial_cond	0	-0.000000
exp3222	1.75906666e-28	0.000000	0.000000	discard	cycle 12 u=0.1050	agent0	initial_cond	0	-0.000000
exp3223	1.75906666e-28	0.000000	0.000000	discard	cycle 12 u=0.1050	agent0	initial_cond	0	-0.000000
exp3224	1.75906666e-28	0.000000	0.000000	discard	cycle 12 u=0.1050	agent0	initial_cond	1	-0.000000
exp3225	1.11257917e-28	0.000000	0.000000	discard	cycle 12 u=0.1050	agent0	initial_cond	0	-0.000000
exp3226	1.11257917e-28	0.000000	0.000000	discard	cycle 12 u=0.1050	agent0	initial_cond	0	-0.000000
exp3227	1.11257917e-28	0.000000	0.000000	discard	cycle 12 u=0.1050	agent0	initial_cond	1	-0.000000
exp3228	8.58580947e-29	0.000000	0.000000	discard	cycle 13 u=0.0975	agent0	initial_cond	0	0.000000
exp3229	8.58580947e-29	0.000000	0.000000	discard	cycle 13 u=0.0975	agent0	initial_cond	0	0.000000
exp3230	8.58580947e-29	0.000000	0.000000	discard	cycle 13 u=0.0975	agent0	initial_cond	0	0.000000
exp3231	5.23962023e-29	0.000000	0.000000	discard	cycle 13 u=0.0975	agent0	initial_cond	0	0.000000
exp3232	5.23962023e-29	0.000000	0.000000	discard	cycle 13 u=0.0975	agent0	initial_cond	1	0.000000
exp3233	5.23962023e-29	0.000000	0.000000	discard	cycle 13 u=0.0975	agent0	initial_cond	0	0.000000
exp3234	4.03266298e-29	0.000000	0.000000	discard	cycle 13 u=0.0975	agent0	initial_cond	0	0.000000
exp3235	4.03266298e-29	0.000000	0.000000	discard	cycle 13 u=0.0975	agent0	initial_cond	1	0.000000
exp3236	4.03266298e-29	0.000000	0.000000	discard	cycle 13 u=0.0975	agent0	initial_cond	0	0.000000
exp3237	4.80015937e-29	0.000000	0.000000	discard	cycle 13 u=0.0975	agent0	initial_cond	1	0.000000
exp3238	4.80015937e-29	0.000000	0.000000	discard	cycle 13 u=0.0975	agent0	initial_cond	0	0.000000
exp3239	4.80015937e-29	0.000000	0.000000	discard	cycle 13 u=0.0975	agent0	initial_cond	0	0.000000
exp3240	2.68824537e-29	0.000000	0.000000	discard	cycle 13 u=0.0980	agent0	initial_cond	1	-0.000000
exp3241	2.68824537e-29	0.000000	0.000000	discard	cycle 13 u=0.0980	agent0	initial_cond	0	-0.000000
exp3242	2.68824537e-29	0.000000	0.000000	discard	cycle 13 u=0.0980	agent0	initial_cond	0	-0.000000
exp3243	6.16758073e-29	0.000000	0.000000	discard	cycle 13 u=0.0980	agent0	initial_cond	1	-0.000000
exp3244	6.16758073e-29	0.000000	0.000000	discard	cycle 13 u=0.0980	agent0	initial_cond	0	-0.000000
exp3245	6.16758073e-29	0.000000	0.000000	discard	cycle 13 u=0.0980	agent0	initial_cond	1	-0.000000
exp3246	2.01926478e-29	0.000000	0.000000	discard	cycle 13 u=0.0980	agent0	initial_cond	0	0.000000
exp3247	2.01926478e-29	0.000000	0.000000	discard	cycle 13 u=0.0980	agent0	initial_cond	0	0.000000
exp3248	2.01926478e-29	0.000000	0.000000	discard	cycle 13 u=0.0980	agent0	initial_cond	1	0.000000
exp3249	1.30310780e-28	0.000000	0.000000	discard	cycle 13 u=0.0980	agent0	initial_cond	0	-0.000000
exp3250	1.30310780e-28	0.000000	0.000000	discard	cycle 13 u=0.0980	agent0	initial_cond	0	-0.000000
exp3251	1.30310780e-28	0.000000	0.000000	discard	cycle 13 u=0.0980	agent0	initial_cond	0	-0.000000
exp3252	5.45343271e-29	0.000000	0.000000	discard	cycle 13 u=0.0982	agent0	initial_cond	0	-0.000000
exp3253	5.45343271e-29	0.000000	0.000000	discard	cycle 13 u=0.0982	agent0	initial_cond	1	-0.000000
exp3254	5.45343271e-29	0.000000	0.000000	discard	cycle 13 u=0.0982	agent0	initial_cond	0	-0.000000
exp3255	1.23429977e-28	0.000000	0.000000	discard	cycle 13 u=0.0982	agent0	initial_cond	0	0.000000
exp3256	1.23429977e-28	0.000000	0.000000	discard	cycle 13 u=0.0982	agent0	initial_cond	1	0.000000
exp3257	1.23429977e-28	0.000000	0.000000	discard	cycle 13 u=0.0982	agent0	initial_cond	0	0.000000
exp3258	1.88036672e-29	0.000000	0.000000	discard	cycle 13 u=0.0982	agent0	initial_cond	0	0.000000
exp3259	1.88036672e-29	0.000000	0.000000	discard	cycle 13 u=0.0982	agent0	initial_cond	0	0.000000
exp3260	1.88036672e-29	0.000000	0.000000	discard	cycle 13 u=0.0982	agent0	initial_cond	0	0.000000
exp3261	1.91190259e-29	0.000000	-0.000000	discard	cycle 13 u=0.0982	agent0	initial_cond	1	0.000000
exp3262	1.91190259e-29	0.000000	-0.000000	discard	cycle 13 u=0.0982	agent0	initial_cond	0	0.000000
exp3263	1.91190259e-29	0.000000	-0.000000	discard	cycle 13 u=0.0982	agent0	initial_cond	0	0.000000
exp3264	6.13049994e-29	0.000000	0.000000	discard	cycle 13 u=0.0985	agent0	initial_cond	1	0.000000
