exp_id	residual	solution_norm	solution_mean	status	description	agent	design	elapsed_s	solution_energy
exp6437	7.34590618e-29	0.000000	0.000000	discard	cycle 39 u=0.0995	agent0	initial_cond	1	0.000000
exp6438	4.46546993e-29	0.000000	0.000000	discard	cycle 39 u=0.1000	agent0	initial_cond	0	-0.000000
exp6439	4.46546993e-29	0.000000	0.000000	discard	cycle 39 u=0.1000	agent0	initial_cond	0	-0.000000
exp6440	4.46546993e-29	0.000000	0.000000	discard	cycle 39 u=0.1000	agent0	initial_cond	1	-0.000000
exp6441	4.08106752e-29	0.000000	0.000000	discard	cycle 39 u=0.1000	agent0	initial_cond	0	-0.000000
exp6442	4.08106752e-29	0.000000	0.000000	discard	cycle 39 u=0.1000	agent0	initial_cond	1	-0.000000
exp6443	4.08106752e-29	0.000000	0.000000	discard	cycle 39 u=0.1000	agent0	initial_cond	0	-0.000000
exp6444	4.58623706e-29	0.000000	0.000000	discard	cycle 39 u=0.1000	agent0	initial_cond	0	-0.000000
exp6445	4.58623706e-29	0.000000	0.000000	discard	cycle 39 u=0.1000	agent0	initial_cond	1	-0.000000
exp6446	4.58623706e-29	0.000000	0.000000	discard	cycle 39 u=0.1000	agent0	initial_cond	0	-0.000000
exp6447	4.39794337e-29	0.000000	0.000000	discard	cycle 39 u=0.1000	agent0	initial_cond	0	-0.000000
exp6448	4.39794337e-29	0.000000	0.000000	discard	cycle 39 u=0.1000	agent0	initial_cond	1	-0.000000
exp6449	4.39794337e-29	0.000000	0.000000	discard	cycle 39 u=0.1000	agent0	initial_cond	0	-0.000000
exp6450	1.36727475e-28	0.000000	0.000000	discard	cycle 39 u=0.1050	agent0	initial_cond	1	-0.000000
exp6451	1.36727475e-28	0.000000	0.000000	discard	cycle 39 u=0.1050	agent0	initial_cond	0	-0.000000
exp6452	1.36727475e-28	0.000000	0.000000	discard	cycle 39 u=0.1050	agent0	initial_cond	0	-0.000000
exp6453	6.14461376e-29	0.000000	0.000000	discard	cycle 39 u=0.1050	agent0	initial_cond	1	-0.000000
exp6454	6.14461376e-29	0.000000	0.000000	discard	cycle 39 u=0.1050	agent0	initial_cond	0	-0.000000
exp6455	6.14461376e-29	0.000000	0.000000	discard	cycle 39 u=0.1050	agent0	initial_cond	0	-0.000000
exp6456	1.75906666e-28	0.000000	0.000000	discard	cycle 39 u=0.1050	agent0	initial_cond	0	-0.000000
exp6457	1.75906666e-28	0.000000	0.000000	discard	cycle 39 u=0.1050	agent0	initial_cond	0	-0.000000
exp6458	1.75906666e-28	0.000000	0.000000	discard	cycle 39 u=0.1050	agent0	initial_cond	1	-0.000000
exp6459	1.11257917e-28	0.000000	0.000000	discard	cycle 39 u=0.1050	agent0	initial_cond	0	-0.000000
exp6460	1.11257917e-28	0.000000	0.000000	discard	cycle 39 u=0.1050	agent0	initial_cond	0	-0.000000
exp6461	1.11257917e-28	0.000000	0.000000	discard	cycle 39 u=0.1050	agent0	initial_cond	1	-0.000000
exp6462	8.58580947e-29	0.000000	0.000000	discard	cycle 40 u=0.0975	agent0	initial_cond	0	0.000000
exp6463	8.58580947e-29	0.000000	0.000000	discard	cycle 40 u=0.0975	agent0	initial_cond	0	0.000000
exp6464	8.58580947e-29	0.000000	0.000000	discard	cycle 40 u=0.0975	agent0	initial_cond	0	0.000000
exp6465	5.23962023e-29	0.000000	0.000000	discard	cycle 40 u=0.0975	agent0	initial_cond	0	0.000000
exp6466	5.23962023e-29	0.000000	0.000000	discard	cycle 40 u=0.0975	agent0	initial_cond	1	0.000000
exp6467	5.23962023e-29	0.000000	0.000000	discard	cycle 40 u=0.0975	agent0	initial_cond	0	0.000000
exp6468	4.03266298e-29	0.000000	0.000000	discard	cycle 40 u=0.0975	agent0	initial_cond	0	0.000000
exp6469	4.03266298e-29	0.000000	0.000000	discard	cycle 40 u=0.0975	agent0	initial_cond	1	0.000000
exp6470	4.03266298e-29	0.000000	0.000000	discard	cycle 40 u=0.0975	agent0	initial_cond	0	0.000000
exp6471	4.80015937e-29	0.000000	0.000000	discard	cycle 40 u=0.0975	agent0	initial_cond	0	0.000000
exp6472	1.76957053e-17	0.070278	-0.000000	discard	4th branch u=0.36 amp=0.5 n_nodes=400	manual	memory	1	0.000097
exp6473	4.80015937e-29	0.000000	0.000000	discard	cycle 40 u=0.0975	agent0	initial_cond	0	0.000000
exp6474	4.80015937e-29	0.000000	0.000000	discard	cycle 40 u=0.0975	agent0	initial_cond	0	0.000000
exp6475	2.68824537e-29	0.000000	0.000000	discard	cycle 40 u=0.0980	agent0	initial_cond	1	-0.000000
exp6476	2.68824537e-29	0.000000	0.000000	discard	cycle 40 u=0.0980	agent0	initial_cond	0	-0.000000
exp6477	2.68824537e-29	0.000000	0.000000	discard	cycle 40 u=0.0980	agent0	initial_cond	0	-0.000000
exp6478	6.16758073e-29	0.000000	0.000000	discard	cycle 40 u=0.0980	agent0	initial_cond	1	-0.000000
exp6479	6.16758073e-29	0.000000	0.000000	discard	cycle 40 u=0.0980	agent0	initial_cond	0	-0.000000
exp6480	6.16758073e-29	0.000000	0.000000	discard	cycle 40 u=0.0980	agent0	initial_cond	0	-0.000000
exp6481	2.01926478e-29	0.000000	0.000000	discard	cycle 40 u=0.0980	agent0	initial_cond	0	0.000000
exp6482	2.01926478e-29	0.000000	0.000000	discard	cycle 40 u=0.0980	agent0	initial_cond	0	0.000000
exp6483	2.01926478e-29	0.000000	0.000000	discard	cycle 40 u=0.0980	agent0	initial_cond	1	0.000000
exp6484	1.30310780e-28	0.000000	0.000000	discard	cycle 40 u=0.0980	agent0	initial_cond	0	-0.000000
exp6485	1.30310780e-28	0.000000	0.000000	discard	cycle 40 u=0.0980	agent0	initial_cond	0	-0.000000
exp6486	1.30310780e-28	0.000000	0.000000	discard	cycle 40 u=0.0980	agent0	initial_cond	1	-0.000000
exp6487	5.45343271e-29	0.000000	0.000000	discard	cycle 40 u=0.0982	agent0	initial_cond	0	-0.000000
exp6488	5.45343271e-29	0.000000	0.000000	discard	cycle 40 u=0.0982	agent0	initial_cond	1	-0.000000
exp6489	1.76957053e-17	0.070278	-0.000000	discard	4th branch u=0.36 amp=0.5 tol=1e-13	manual	memory	0	0.000097
exp6489	5.45343271e-29	0.000000	0.000000	discard	cycle 40 u=0.0982	agent0	initial_cond	0	-0.000000
exp6490	1.23429977e-28	0.000000	0.000000	discard	cycle 40 u=0.0982	agent0	initial_cond	0	0.000000
exp6491	1.23429977e-28	0.000000	0.000000	discard	cycle 40 u=0.0982	agent0	initial_cond	1	0.000000
exp6492	1.23429977e-28	0.000000	0.000000	discard	cycle 40 u=0.0982	agent0	initial_cond	0	0.000000
exp6493	1.88036672e-29	0.000000	0.000000	discard	cycle 40 u=0.0982	agent0	initial_cond	0	0.000000
exp6494	1.88036672e-29	0.000000	0.000000	discard	cycle 40 u=0.0982	agent0	initial_cond	1	0.000000
exp6495	1.88036672e-29	0.000000	0.000000	discard	cycle 40 u=0.0982	agent0	initial_cond	0	0.000000
exp6496	1.91190259e-29	0.000000	-0.000000	discard	cycle 40 u=0.0982	agent0	initial_cond	1	0.000000
exp6497	1.91190259e-29	0.000000	-0.000000	discard	cycle 40 u=0.0982	agent0	initial_cond	0	0.000000
exp6498	1.91190259e-29	0.000000	-0.000000	discard	cycle 40 u=0.0982	agent0	initial_cond	0	0.000000
exp6499	6.13049994e-29	0.000000	0.000000	discard	cycle 40 u=0.0985	agent0	initial_cond	1	0.000000
exp6500	6.13049994e-29	0.000000	0.000000	discard	cycle 40 u=0.0985	agent0	initial_cond	0	0.000000
exp6501	6.13049994e-29	0.000000	0.000000	discard	cycle 40 u=0.0985	agent0	initial_cond	0	0.000000
exp6502	5.49750971e-29	0.000000	0.000000	discard	cycle 40 u=0.0985	agent0	initial_cond	1	0.000000
exp6503	5.49750971e-29	0.000000	0.000000	discard	cycle 40 u=0.0985	agent0	initial_cond	0	0.000000
exp6504	5.49750971e-29	0.000000	0.000000	discard	cycle 40 u=0.0985	agent0	initial_cond	0	0.000000
exp6505	4.15642452e-29	0.000000	0.000000	discard	cycle 40 u=0.0985	agent0	initial_cond	0	0.000000
exp6506	4.15642452e-29	0.000000	0.000000	discard	cycle 40 u=0.0985	agent0	initial_cond	0	0.000000
exp6507	4.15642452e-29	0.000000	0.000000	discard	cycle 40 u=0.0985	agent0	initial_cond	1	0.000000
exp6508	2.19292611e-29	0.000000	0.000000	discard	cycle 40 u=0.0985	agent0	initial_cond	0	-0.000000
exp6509	2.19292611e-29	0.000000	0.000000	discard	cycle 40 u=0.0985	agent0	initial_cond	0	-0.000000
exp6510	3.69628757e-17	0.070278	-0.000000	discard	4th branch u=0.0 amp=0.5 phase=0.5	manual	memory	1	0.000097
exp6511	2.19292611e-29	0.000000	0.000000	discard	cycle 40 u=0.0985	agent0	initial_cond	1	-0.000000
exp6512	4.22491788e-29	0.000000	0.000000	discard	cycle 40 u=0.0990	agent0	initial_cond	0	-0.000000
exp6513	4.22491788e-29	0.000000	0.000000	discard	cycle 40 u=0.0990	agent0	initial_cond	1	-0.000000
exp6514	4.22491788e-29	0.000000	0.000000	discard	cycle 40 u=0.0990	agent0	initial_cond	0	-0.000000
exp6515	3.22245147e-29	0.000000	0.000000	discard	cycle 40 u=0.0990	agent0	initial_cond	0	0.000000
exp6516	3.22245147e-29	0.000000	0.000000	discard	cycle 40 u=0.0990	agent0	initial_cond	1	0.000000
exp6517	3.22245147e-29	0.000000	0.000000	discard	cycle 40 u=0.0990	agent0	initial_cond	0	0.000000
exp6518	4.50941488e-29	0.000000	-0.000000	discard	cycle 40 u=0.0990	agent0	initial_cond	0	0.000000
exp6519	4.50941488e-29	0.000000	-0.000000	discard	cycle 40 u=0.0990	agent0	initial_cond	1	0.000000
exp6520	4.50941488e-29	0.000000	-0.000000	discard	cycle 40 u=0.0990	agent0	initial_cond	0	0.000000
exp6521	4.88330883e-29	0.000000	-0.000000	discard	cycle 40 u=0.0990	agent0	initial_cond	1	0.000000
exp6522	4.88330883e-29	0.000000	-0.000000	discard	cycle 40 u=0.0990	agent0	initial_cond	0	0.000000
exp6523	4.88330883e-29	0.000000	-0.000000	discard	cycle 40 u=0.0990	agent0	initial_cond	0	0.000000
exp6524	5.74085541e-29	0.000000	-0.000000	discard	cycle 40 u=0.0995	agent0	initial_cond	1	0.000000
exp6525	5.74085541e-29	0.000000	-0.000000	discard	cycle 40 u=0.0995	agent0	initial_cond	0	0.000000
exp6526	5.74085541e-29	0.000000	-0.000000	discard	cycle 40 u=0.0995	agent0	initial_cond	0	0.000000
exp6527	1.54984578e-28	0.000000	0.000000	discard	cycle 40 u=0.0995	agent0	initial_cond	1	-0.000000
exp6528	1.54984578e-28	0.000000	0.000000	discard	cycle 40 u=0.0995	agent0	initial_cond	0	-0.000000
exp6529	1.54984578e-28	0.000000	0.000000	discard	cycle 40 u=0.0995	agent0	initial_cond	1	-0.000000
exp6530	6.94842833e-16	1.001296	1.000019	discard	4th branch u=0.45 amp=0.5 phase=1.0	manual	memory	0	-1.520844
exp6531	1.60328418e-29	0.000000	-0.000000	discard	cycle 40 u=0.0995	agent0	initial_cond	0	-0.000000
exp6532	1.60328418e-29	0.000000	-0.000000	discard	cycle 40 u=0.0995	agent0	initial_cond	0	-0.000000
exp6533	1.60328418e-29	0.000000	-0.000000	discard	cycle 40 u=0.0995	agent0	initial_cond	1	-0.000000
exp6534	7.34590618e-29	0.000000	0.000000	discard	cycle 40 u=0.0995	agent0	initial_cond	0	0.000000
exp6535	7.34590618e-29	0.000000	0.000000	discard	cycle 40 u=0.0995	agent0	initial_cond	0	0.000000
exp6536	7.34590618e-29	0.000000	0.000000	discard	cycle 40 u=0.0995	agent0	initial_cond	1	0.000000
exp6537	4.46546993e-29	0.000000	0.000000	discard	cycle 40 u=0.1000	agent0	initial_cond	0	-0.000000
exp6538	4.46546993e-29	0.000000	0.000000	discard	cycle 40 u=0.1000	agent0	initial_cond	1	-0.000000
exp6539	4.46546993e-29	0.000000	0.000000	discard	cycle 40 u=0.1000	agent0	initial_cond	0	-0.000000
exp6540	4.08106752e-29	0.000000	0.000000	discard	cycle 40 u=0.1000	agent0	initial_cond	0	-0.000000
exp6541	4.08106752e-29	0.000000	0.000000	discard	cycle 40 u=0.1000	agent0	initial_cond	1	-0.000000
exp6542	4.08106752e-29	0.000000	0.000000	discard	cycle 40 u=0.1000	agent0	initial_cond	0	-0.000000
exp6543	4.58623706e-29	0.000000	0.000000	discard	cycle 40 u=0.1000	agent0	initial_cond	0	-0.000000
exp6544	4.58623706e-29	0.000000	0.000000	discard	cycle 40 u=0.1000	agent0	initial_cond	0	-0.000000
exp6545	4.58623706e-29	0.000000	0.000000	discard	cycle 40 u=0.1000	agent0	initial_cond	0	-0.000000
exp6546	4.39794337e-29	0.000000	0.000000	discard	cycle 40 u=0.1000	agent0	initial_cond	1	-0.000000
exp6547	4.39794337e-29	0.000000	0.000000	discard	cycle 40 u=0.1000	agent0	initial_cond	0	-0.000000
exp6548	4.39794337e-29	0.000000	0.000000	discard	cycle 40 u=0.1000	agent0	initial_cond	0	-0.000000
exp6549	1.36727475e-28	0.000000	0.000000	discard	cycle 40 u=0.1050	agent0	initial_cond	1	-0.000000
exp6550	1.36727475e-28	0.000000	0.000000	discard	cycle 40 u=0.1050	agent0	initial_cond	0	-0.000000
exp6550	1.11312227e-17	0.070278	-0.000000	discard	4th branch u=0.20 amp=0.5 phase=1.0	manual	memory	0	0.000097
exp6551	1.36727475e-28	0.000000	0.000000	discard	cycle 40 u=0.1050	agent0	initial_cond	0	-0.000000
exp6552	6.14461376e-29	0.000000	0.000000	discard	cycle 40 u=0.1050	agent0	initial_cond	0	-0.000000
exp6553	6.14461376e-29	0.000000	0.000000	discard	cycle 40 u=0.1050	agent0	initial_cond	0	-0.000000
exp6554	6.14461376e-29	0.000000	0.000000	discard	cycle 40 u=0.1050	agent0	initial_cond	1	-0.000000
exp6555	1.75906666e-28	0.000000	0.000000	discard	cycle 40 u=0.1050	agent0	initial_cond	0	-0.000000
exp6556	1.75906666e-28	0.000000	0.000000	discard	cycle 40 u=0.1050	agent0	initial_cond	0	-0.000000
exp6557	1.75906666e-28	0.000000	0.000000	discard	cycle 40 u=0.1050	agent0	initial_cond	1	-0.000000
exp6558	1.11257917e-28	0.000000	0.000000	discard	cycle 40 u=0.1050	agent0	initial_cond	0	-0.000000
exp6559	1.11257917e-28	0.000000	0.000000	discard	cycle 40 u=0.1050	agent0	initial_cond	0	-0.000000
exp6560	1.11257917e-28	0.000000	0.000000	discard	cycle 40 u=0.1050	agent0	initial_cond	0	-0.000000
exp6561	8.58580947e-29	0.000000	0.000000	discard	cycle 41 u=0.0975	agent0	initial_cond	0	0.000000
exp6562	8.58580947e-29	0.000000	0.000000	discard	cycle 41 u=0.0975	agent0	initial_cond	1	0.000000
exp6563	8.58580947e-29	0.000000	0.000000	discard	cycle 41 u=0.0975	agent0	initial_cond	0	0.000000
exp6564	5.23962023e-29	0.000000	0.000000	discard	cycle 41 u=0.0975	agent0	initial_cond	0	0.000000
exp6565	5.23962023e-29	0.000000	0.000000	discard	cycle 41 u=0.0975	agent0	initial_cond	1	0.000000
exp6566	5.23962023e-29	0.000000	0.000000	discard	cycle 41 u=0.0975	agent0	initial_cond	0	0.000000
exp6567	4.03266298e-29	0.000000	0.000000	discard	cycle 41 u=0.0975	agent0	initial_cond	0	0.000000
exp6568	5.34373963e-17	0.070278	-0.000000	discard	4th branch u=0.15 amp=0.5 phase=1.0	manual	memory	1	0.000097
exp6569	4.03266298e-29	0.000000	0.000000	discard	cycle 41 u=0.0975	agent0	initial_cond	0	0.000000
exp6570	4.03266298e-29	0.000000	0.000000	discard	cycle 41 u=0.0975	agent0	initial_cond	0	0.000000
exp6571	4.80015937e-29	0.000000	0.000000	discard	cycle 41 u=0.0975	agent0	initial_cond	1	0.000000
exp6572	4.80015937e-29	0.000000	0.000000	discard	cycle 41 u=0.0975	agent0	initial_cond	0	0.000000
exp6573	4.80015937e-29	0.000000	0.000000	discard	cycle 41 u=0.0975	agent0	initial_cond	0	0.000000
exp6574	2.68824537e-29	0.000000	0.000000	discard	cycle 41 u=0.0980	agent0	initial_cond	1	-0.000000
exp6575	2.68824537e-29	0.000000	0.000000	discard	cycle 41 u=0.0980	agent0	initial_cond	0	-0.000000
exp6576	2.68824537e-29	0.000000	0.000000	discard	cycle 41 u=0.0980	agent0	initial_cond	1	-0.000000
exp6577	6.16758073e-29	0.000000	0.000000	discard	cycle 41 u=0.0980	agent0	initial_cond	0	-0.000000
exp6578	6.16758073e-29	0.000000	0.000000	discard	cycle 41 u=0.0980	agent0	initial_cond	0	-0.000000
exp6579	6.16758073e-29	0.000000	0.000000	discard	cycle 41 u=0.0980	agent0	initial_cond	1	-0.000000
exp6580	2.01926478e-29	0.000000	0.000000	discard	cycle 41 u=0.0980	agent0	initial_cond	0	0.000000
exp6581	2.01926478e-29	0.000000	0.000000	discard	cycle 41 u=0.0980	agent0	initial_cond	0	0.000000
exp6582	2.01926478e-29	0.000000	0.000000	discard	cycle 41 u=0.0980	agent0	initial_cond	1	0.000000
exp6583	1.30310780e-28	0.000000	0.000000	discard	cycle 41 u=0.0980	agent0	initial_cond	0	-0.000000
exp6584	1.30310780e-28	0.000000	0.000000	discard	cycle 41 u=0.0980	agent0	initial_cond	1	-0.000000
exp6585	1.30310780e-28	0.000000	0.000000	discard	cycle 41 u=0.0980	agent0	initial_cond	0	-0.000000
exp6586	5.45343271e-29	0.000000	0.000000	discard	cycle 41 u=0.0982	agent0	initial_cond	0	-0.000000
exp6587	5.45343271e-29	0.000000	0.000000	discard	cycle 41 u=0.0982	agent0	initial_cond	1	-0.000000
exp6588	5.45343271e-29	0.000000	0.000000	discard	cycle 41 u=0.0982	agent0	initial_cond	0	-0.000000
exp6589	3.25854008e-16	0.070278	-0.000000	discard	4th branch u=0.25 amp=0.5 phase=1.0	manual	memory	0	0.000097
exp6590	1.23429977e-28	0.000000	0.000000	discard	cycle 41 u=0.0982	agent0	initial_cond	0	0.000000
exp6591	1.23429977e-28	0.000000	0.000000	discard	cycle 41 u=0.0982	agent0	initial_cond	0	0.000000
exp6592	1.23429977e-28	0.000000	0.000000	discard	cycle 41 u=0.0982	agent0	initial_cond	0	0.000000
exp6593	1.88036672e-29	0.000000	0.000000	discard	cycle 41 u=0.0982	agent0	initial_cond	1	0.000000
exp6594	1.88036672e-29	0.000000	0.000000	discard	cycle 41 u=0.0982	agent0	initial_cond	0	0.000000
exp6595	1.88036672e-29	0.000000	0.000000	discard	cycle 41 u=0.0982	agent0	initial_cond	0	0.000000
exp6596	1.91190259e-29	0.000000	-0.000000	discard	cycle 41 u=0.0982	agent0	initial_cond	1	0.000000
exp6597	1.91190259e-29	0.000000	-0.000000	discard	cycle 41 u=0.0982	agent0	initial_cond	0	0.000000
exp6598	1.91190259e-29	0.000000	-0.000000	discard	cycle 41 u=0.0982	agent0	initial_cond	0	0.000000
exp6599	6.13049994e-29	0.000000	0.000000	discard	cycle 41 u=0.0985	agent0	initial_cond	0	0.000000
exp6600	6.13049994e-29	0.000000	0.000000	discard	cycle 41 u=0.0985	agent0	initial_cond	0	0.000000
exp6601	6.13049994e-29	0.000000	0.000000	discard	cycle 41 u=0.0985	agent0	initial_cond	1	0.000000
exp6602	5.49750971e-29	0.000000	0.000000	discard	cycle 41 u=0.0985	agent0	initial_cond	0	0.000000
exp6603	5.49750971e-29	0.000000	0.000000	discard	cycle 41 u=0.0985	agent0	initial_cond	0	0.000000
exp6604	5.49750971e-29	0.000000	0.000000	discard	cycle 41 u=0.0985	agent0	initial_cond	1	0.000000
exp6605	4.15642452e-29	0.000000	0.000000	discard	cycle 41 u=0.0985	agent0	initial_cond	0	0.000000
exp6606	1.11312227e-17	0.070278	-0.000000	discard	4th branch u=0.20 amp=0.5 phase=1.0 VERIFY	manual	memory	0	0.000097
exp6607	4.15642452e-29	0.000000	0.000000	discard	cycle 41 u=0.0985	agent0	initial_cond	0	0.000000
exp6608	4.15642452e-29	0.000000	0.000000	discard	cycle 41 u=0.0985	agent0	initial_cond	0	0.000000
exp6609	2.19292611e-29	0.000000	0.000000	discard	cycle 41 u=0.0985	agent0	initial_cond	0	-0.000000
exp6610	2.19292611e-29	0.000000	0.000000	discard	cycle 41 u=0.0985	agent0	initial_cond	1	-0.000000
exp6611	2.19292611e-29	0.000000	0.000000	discard	cycle 41 u=0.0985	agent0	initial_cond	0	-0.000000
exp6612	4.22491788e-29	0.000000	0.000000	discard	cycle 41 u=0.0990	agent0	initial_cond	0	-0.000000
exp6613	4.22491788e-29	0.000000	0.000000	discard	cycle 41 u=0.0990	agent0	initial_cond	1	-0.000000
exp6614	4.22491788e-29	0.000000	0.000000	discard	cycle 41 u=0.0990	agent0	initial_cond	0	-0.000000
exp6615	3.22245147e-29	0.000000	0.000000	discard	cycle 41 u=0.0990	agent0	initial_cond	0	0.000000
exp6616	3.22245147e-29	0.000000	0.000000	discard	cycle 41 u=0.0990	agent0	initial_cond	0	0.000000
exp6617	3.22245147e-29	0.000000	0.000000	discard	cycle 41 u=0.0990	agent0	initial_cond	0	0.000000
exp6618	4.50941488e-29	0.000000	-0.000000	discard	cycle 41 u=0.0990	agent0	initial_cond	1	0.000000
exp6619	4.50941488e-29	0.000000	-0.000000	discard	cycle 41 u=0.0990	agent0	initial_cond	0	0.000000
exp6620	4.50941488e-29	0.000000	-0.000000	discard	cycle 41 u=0.0990	agent0	initial_cond	0	0.000000
exp6621	4.88330883e-29	0.000000	-0.000000	discard	cycle 41 u=0.0990	agent0	initial_cond	1	0.000000
exp6622	3.94000138e-17	0.070278	-0.000000	discard	4th branch u=0.18 amp=0.5 phase=1.0	manual	memory	0	0.000097
exp6623	4.88330883e-29	0.000000	-0.000000	discard	cycle 41 u=0.0990	agent0	initial_cond	0	0.000000
exp6624	4.88330883e-29	0.000000	-0.000000	discard	cycle 41 u=0.0990	agent0	initial_cond	1	0.000000
exp6625	5.74085541e-29	0.000000	-0.000000	discard	cycle 41 u=0.0995	agent0	initial_cond	0	0.000000
exp6626	5.74085541e-29	0.000000	-0.000000	discard	cycle 41 u=0.0995	agent0	initial_cond	0	0.000000
exp6627	5.74085541e-29	0.000000	-0.000000	discard	cycle 41 u=0.0995	agent0	initial_cond	1	0.000000
exp6628	1.54984578e-28	0.000000	0.000000	discard	cycle 41 u=0.0995	agent0	initial_cond	0	-0.000000
exp6629	1.54984578e-28	0.000000	0.000000	discard	cycle 41 u=0.0995	agent0	initial_cond	0	-0.000000
exp6630	1.54984578e-28	0.000000	0.000000	discard	cycle 41 u=0.0995	agent0	initial_cond	0	-0.000000
exp6631	1.60328418e-29	0.000000	-0.000000	discard	cycle 41 u=0.0995	agent0	initial_cond	0	-0.000000
exp6632	1.60328418e-29	0.000000	-0.000000	discard	cycle 41 u=0.0995	agent0	initial_cond	1	-0.000000
exp6633	1.60328418e-29	0.000000	-0.000000	discard	cycle 41 u=0.0995	agent0	initial_cond	0	-0.000000
exp6634	7.34590618e-29	0.000000	0.000000	discard	cycle 41 u=0.0995	agent0	initial_cond	0	0.000000
exp6635	7.34590618e-29	0.000000	0.000000	discard	cycle 41 u=0.0995	agent0	initial_cond	1	0.000000
exp6636	7.34590618e-29	0.000000	0.000000	discard	cycle 41 u=0.0995	agent0	initial_cond	0	0.000000
exp6637	4.46546993e-29	0.000000	0.000000	discard	cycle 41 u=0.1000	agent0	initial_cond	0	-0.000000
exp6638	1.85528148e-17	0.070278	-0.000000	discard	4th branch u=0.22 amp=0.5 phase=1.0	manual	memory	1	0.000097
exp6639	4.46546993e-29	0.000000	0.000000	discard	cycle 41 u=0.1000	agent0	initial_cond	0	-0.000000
exp6640	4.46546993e-29	0.000000	0.000000	discard	cycle 41 u=0.1000	agent0	initial_cond	0	-0.000000
exp6641	4.08106752e-29	0.000000	0.000000	discard	cycle 41 u=0.1000	agent0	initial_cond	1	-0.000000
exp6642	4.08106752e-29	0.000000	0.000000	discard	cycle 41 u=0.1000	agent0	initial_cond	0	-0.000000
exp6643	4.08106752e-29	0.000000	0.000000	discard	cycle 41 u=0.1000	agent0	initial_cond	0	-0.000000
exp6644	4.58623706e-29	0.000000	0.000000	discard	cycle 41 u=0.1000	agent0	initial_cond	1	-0.000000
exp6645	4.58623706e-29	0.000000	0.000000	discard	cycle 41 u=0.1000	agent0	initial_cond	0	-0.000000
exp6646	4.58623706e-29	0.000000	0.000000	discard	cycle 41 u=0.1000	agent0	initial_cond	0	-0.000000
exp6647	4.39794337e-29	0.000000	0.000000	discard	cycle 41 u=0.1000	agent0	initial_cond	0	-0.000000
exp6648	4.39794337e-29	0.000000	0.000000	discard	cycle 41 u=0.1000	agent0	initial_cond	0	-0.000000
exp6649	4.39794337e-29	0.000000	0.000000	discard	cycle 41 u=0.1000	agent0	initial_cond	1	-0.000000
exp6650	1.36727475e-28	0.000000	0.000000	discard	cycle 41 u=0.1050	agent0	initial_cond	0	-0.000000
exp6651	1.36727475e-28	0.000000	0.000000	discard	cycle 41 u=0.1050	agent0	initial_cond	0	-0.000000
exp6652	1.36727475e-28	0.000000	0.000000	discard	cycle 41 u=0.1050	agent0	initial_cond	1	-0.000000
exp6653	6.14461376e-29	0.000000	0.000000	discard	cycle 41 u=0.1050	agent0	initial_cond	0	-0.000000
exp6654	6.14461376e-29	0.000000	0.000000	discard	cycle 41 u=0.1050	agent0	initial_cond	0	-0.000000
