exp_id	residual	solution_norm	solution_mean	status	description	agent	design	elapsed_s	solution_energy
exp13647	4.08106752e-29	0.000000	0.000000	discard	cycle 103 u=0.1000	agent0	initial_cond	0	-0.000000
exp13648	4.08106752e-29	0.000000	0.000000	discard	cycle 103 u=0.1000	agent0	initial_cond	1	-0.000000
exp13649	4.58623706e-29	0.000000	0.000000	discard	cycle 103 u=0.1000	agent0	initial_cond	0	-0.000000
exp13650	4.58623706e-29	0.000000	0.000000	discard	cycle 103 u=0.1000	agent0	initial_cond	1	-0.000000
exp13651	4.58623706e-29	0.000000	0.000000	discard	cycle 103 u=0.1000	agent0	initial_cond	0	-0.000000
exp13652	4.39794337e-29	0.000000	0.000000	discard	cycle 103 u=0.1000	agent0	initial_cond	0	-0.000000
exp13653	4.39794337e-29	0.000000	0.000000	discard	cycle 103 u=0.1000	agent0	initial_cond	1	-0.000000
exp13654	4.39794337e-29	0.000000	0.000000	discard	cycle 103 u=0.1000	agent0	initial_cond	0	-0.000000
exp13655	1.36727475e-28	0.000000	0.000000	discard	cycle 103 u=0.1050	agent0	initial_cond	1	-0.000000
exp13656	1.36727475e-28	0.000000	0.000000	discard	cycle 103 u=0.1050	agent0	initial_cond	0	-0.000000
exp13657	1.36727475e-28	0.000000	0.000000	discard	cycle 103 u=0.1050	agent0	initial_cond	0	-0.000000
exp13658	6.14461376e-29	0.000000	0.000000	discard	cycle 103 u=0.1050	agent0	initial_cond	0	-0.000000
exp13659	6.14461376e-29	0.000000	0.000000	discard	cycle 103 u=0.1050	agent0	initial_cond	0	-0.000000
exp13660	6.14461376e-29	0.000000	0.000000	discard	cycle 103 u=0.1050	agent0	initial_cond	1	-0.000000
exp13661	1.75906666e-28	0.000000	0.000000	discard	cycle 103 u=0.1050	agent0	initial_cond	0	-0.000000
exp13662	1.75906666e-28	0.000000	0.000000	discard	cycle 103 u=0.1050	agent0	initial_cond	0	-0.000000
exp13663	1.75906666e-28	0.000000	0.000000	discard	cycle 103 u=0.1050	agent0	initial_cond	0	-0.000000
exp13664	1.11257917e-28	0.000000	0.000000	discard	cycle 103 u=0.1050	agent0	initial_cond	0	-0.000000
exp13665	1.11257917e-28	0.000000	0.000000	discard	cycle 103 u=0.1050	agent0	initial_cond	1	-0.000000
exp13666	1.11257917e-28	0.000000	0.000000	discard	cycle 103 u=0.1050	agent0	initial_cond	0	-0.000000
exp13667	8.58580947e-29	0.000000	0.000000	discard	cycle 104 u=0.0975	agent0	initial_cond	1	0.000000
exp13668	8.58580947e-29	0.000000	0.000000	discard	cycle 104 u=0.0975	agent0	initial_cond	0	0.000000
exp13669	8.58580947e-29	0.000000	0.000000	discard	cycle 104 u=0.0975	agent0	initial_cond	0	0.000000
exp13670	5.23962023e-29	0.000000	0.000000	discard	cycle 104 u=0.0975	agent0	initial_cond	1	0.000000
exp13671	5.23962023e-29	0.000000	0.000000	discard	cycle 104 u=0.0975	agent0	initial_cond	0	0.000000
exp13672	5.23962023e-29	0.000000	0.000000	discard	cycle 104 u=0.0975	agent0	initial_cond	1	0.000000
exp13673	4.03266298e-29	0.000000	0.000000	discard	cycle 104 u=0.0975	agent0	initial_cond	0	0.000000
exp13674	4.03266298e-29	0.000000	0.000000	discard	cycle 104 u=0.0975	agent0	initial_cond	0	0.000000
exp13675	4.03266298e-29	0.000000	0.000000	discard	cycle 104 u=0.0975	agent0	initial_cond	0	0.000000
exp13676	4.80015937e-29	0.000000	0.000000	discard	cycle 104 u=0.0975	agent0	initial_cond	0	0.000000
exp13677	4.80015937e-29	0.000000	0.000000	discard	cycle 104 u=0.0975	agent0	initial_cond	1	0.000000
exp13678	4.80015937e-29	0.000000	0.000000	discard	cycle 104 u=0.0975	agent0	initial_cond	0	0.000000
exp13679	2.68824537e-29	0.000000	0.000000	discard	cycle 104 u=0.0980	agent0	initial_cond	0	-0.000000
exp13680	2.68824537e-29	0.000000	0.000000	discard	cycle 104 u=0.0980	agent0	initial_cond	0	-0.000000
exp13681	2.68824537e-29	0.000000	0.000000	discard	cycle 104 u=0.0980	agent0	initial_cond	0	-0.000000
exp13682	6.16758073e-29	0.000000	0.000000	discard	cycle 104 u=0.0980	agent0	initial_cond	1	-0.000000
exp13683	6.16758073e-29	0.000000	0.000000	discard	cycle 104 u=0.0980	agent0	initial_cond	0	-0.000000
exp13684	6.16758073e-29	0.000000	0.000000	discard	cycle 104 u=0.0980	agent0	initial_cond	0	-0.000000
exp13685	2.01926478e-29	0.000000	0.000000	discard	cycle 104 u=0.0980	agent0	initial_cond	0	0.000000
exp13686	2.01926478e-29	0.000000	0.000000	discard	cycle 104 u=0.0980	agent0	initial_cond	0	0.000000
exp13687	2.01926478e-29	0.000000	0.000000	discard	cycle 104 u=0.0980	agent0	initial_cond	1	0.000000
exp13688	1.30310780e-28	0.000000	0.000000	discard	cycle 104 u=0.0980	agent0	initial_cond	0	-0.000000
exp13689	1.30310780e-28	0.000000	0.000000	discard	cycle 104 u=0.0980	agent0	initial_cond	1	-0.000000
exp13690	1.30310780e-28	0.000000	0.000000	discard	cycle 104 u=0.0980	agent0	initial_cond	0	-0.000000
exp13691	5.45343271e-29	0.000000	0.000000	discard	cycle 104 u=0.0982	agent0	initial_cond	0	-0.000000
exp13692	5.45343271e-29	0.000000	0.000000	discard	cycle 104 u=0.0982	agent0	initial_cond	1	-0.000000
exp13693	5.45343271e-29	0.000000	0.000000	discard	cycle 104 u=0.0982	agent0	initial_cond	0	-0.000000
exp13694	1.23429977e-28	0.000000	0.000000	discard	cycle 104 u=0.0982	agent0	initial_cond	1	0.000000
exp13695	1.23429977e-28	0.000000	0.000000	discard	cycle 104 u=0.0982	agent0	initial_cond	0	0.000000
exp13696	1.23429977e-28	0.000000	0.000000	discard	cycle 104 u=0.0982	agent0	initial_cond	0	0.000000
exp13697	1.88036672e-29	0.000000	0.000000	discard	cycle 104 u=0.0982	agent0	initial_cond	0	0.000000
exp13698	1.88036672e-29	0.000000	0.000000	discard	cycle 104 u=0.0982	agent0	initial_cond	0	0.000000
exp13699	1.88036672e-29	0.000000	0.000000	discard	cycle 104 u=0.0982	agent0	initial_cond	1	0.000000
exp13700	1.91190259e-29	0.000000	-0.000000	discard	cycle 104 u=0.0982	agent0	initial_cond	0	0.000000
exp13701	1.91190259e-29	0.000000	-0.000000	discard	cycle 104 u=0.0982	agent0	initial_cond	0	0.000000
exp13702	1.91190259e-29	0.000000	-0.000000	discard	cycle 104 u=0.0982	agent0	initial_cond	0	0.000000
exp13703	6.13049994e-29	0.000000	0.000000	discard	cycle 104 u=0.0985	agent0	initial_cond	0	0.000000
exp13704	6.13049994e-29	0.000000	0.000000	discard	cycle 104 u=0.0985	agent0	initial_cond	1	0.000000
exp13705	6.13049994e-29	0.000000	0.000000	discard	cycle 104 u=0.0985	agent0	initial_cond	0	0.000000
exp13706	5.49750971e-29	0.000000	0.000000	discard	cycle 104 u=0.0985	agent0	initial_cond	1	0.000000
exp13707	5.49750971e-29	0.000000	0.000000	discard	cycle 104 u=0.0985	agent0	initial_cond	0	0.000000
exp13708	5.49750971e-29	0.000000	0.000000	discard	cycle 104 u=0.0985	agent0	initial_cond	0	0.000000
exp13709	4.15642452e-29	0.000000	0.000000	discard	cycle 104 u=0.0985	agent0	initial_cond	1	0.000000
exp13710	4.15642452e-29	0.000000	0.000000	discard	cycle 104 u=0.0985	agent0	initial_cond	0	0.000000
exp13711	4.15642452e-29	0.000000	0.000000	discard	cycle 104 u=0.0985	agent0	initial_cond	1	0.000000
exp13712	2.19292611e-29	0.000000	0.000000	discard	cycle 104 u=0.0985	agent0	initial_cond	0	-0.000000
exp13713	2.19292611e-29	0.000000	0.000000	discard	cycle 104 u=0.0985	agent0	initial_cond	0	-0.000000
exp13714	2.19292611e-29	0.000000	0.000000	discard	cycle 104 u=0.0985	agent0	initial_cond	0	-0.000000
exp13715	4.22491788e-29	0.000000	0.000000	discard	cycle 104 u=0.0990	agent0	initial_cond	0	-0.000000
exp13716	4.22491788e-29	0.000000	0.000000	discard	cycle 104 u=0.0990	agent0	initial_cond	1	-0.000000
exp13717	4.22491788e-29	0.000000	0.000000	discard	cycle 104 u=0.0990	agent0	initial_cond	0	-0.000000
exp13718	3.22245147e-29	0.000000	0.000000	discard	cycle 104 u=0.0990	agent0	initial_cond	0	0.000000
exp13719	3.22245147e-29	0.000000	0.000000	discard	cycle 104 u=0.0990	agent0	initial_cond	0	0.000000
exp13720	3.22245147e-29	0.000000	0.000000	discard	cycle 104 u=0.0990	agent0	initial_cond	0	0.000000
exp13721	4.50941488e-29	0.000000	-0.000000	discard	cycle 104 u=0.0990	agent0	initial_cond	1	0.000000
exp13722	4.50941488e-29	0.000000	-0.000000	discard	cycle 104 u=0.0990	agent0	initial_cond	0	0.000000
exp13723	4.50941488e-29	0.000000	-0.000000	discard	cycle 104 u=0.0990	agent0	initial_cond	0	0.000000
exp13724	4.88330883e-29	0.000000	-0.000000	discard	cycle 104 u=0.0990	agent0	initial_cond	0	0.000000
exp13725	4.88330883e-29	0.000000	-0.000000	discard	cycle 104 u=0.0990	agent0	initial_cond	0	0.000000
exp13726	4.88330883e-29	0.000000	-0.000000	discard	cycle 104 u=0.0990	agent0	initial_cond	1	0.000000
exp13727	5.74085541e-29	0.000000	-0.000000	discard	cycle 104 u=0.0995	agent0	initial_cond	0	0.000000
exp13728	5.74085541e-29	0.000000	-0.000000	discard	cycle 104 u=0.0995	agent0	initial_cond	1	0.000000
exp13729	5.74085541e-29	0.000000	-0.000000	discard	cycle 104 u=0.0995	agent0	initial_cond	0	0.000000
exp13730	1.54984578e-28	0.000000	0.000000	discard	cycle 104 u=0.0995	agent0	initial_cond	0	-0.000000
exp13731	1.54984578e-28	0.000000	0.000000	discard	cycle 104 u=0.0995	agent0	initial_cond	0	-0.000000
exp13732	1.54984578e-28	0.000000	0.000000	discard	cycle 104 u=0.0995	agent0	initial_cond	0	-0.000000
exp13733	1.60328418e-29	0.000000	-0.000000	discard	cycle 104 u=0.0995	agent0	initial_cond	1	-0.000000
exp13734	1.60328418e-29	0.000000	-0.000000	discard	cycle 104 u=0.0995	agent0	initial_cond	0	-0.000000
exp13735	1.60328418e-29	0.000000	-0.000000	discard	cycle 104 u=0.0995	agent0	initial_cond	0	-0.000000
exp13736	7.34590618e-29	0.000000	0.000000	discard	cycle 104 u=0.0995	agent0	initial_cond	0	0.000000
exp13737	7.34590618e-29	0.000000	0.000000	discard	cycle 104 u=0.0995	agent0	initial_cond	0	0.000000
exp13738	7.34590618e-29	0.000000	0.000000	discard	cycle 104 u=0.0995	agent0	initial_cond	1	0.000000
exp13739	4.46546993e-29	0.000000	0.000000	discard	cycle 104 u=0.1000	agent0	initial_cond	0	-0.000000
exp13740	4.46546993e-29	0.000000	0.000000	discard	cycle 104 u=0.1000	agent0	initial_cond	0	-0.000000
exp13741	4.46546993e-29	0.000000	0.000000	discard	cycle 104 u=0.1000	agent0	initial_cond	0	-0.000000
exp13742	4.08106752e-29	0.000000	0.000000	discard	cycle 104 u=0.1000	agent0	initial_cond	0	-0.000000
exp13743	4.08106752e-29	0.000000	0.000000	discard	cycle 104 u=0.1000	agent0	initial_cond	1	-0.000000
exp13744	4.08106752e-29	0.000000	0.000000	discard	cycle 104 u=0.1000	agent0	initial_cond	0	-0.000000
exp13745	4.58623706e-29	0.000000	0.000000	discard	cycle 104 u=0.1000	agent0	initial_cond	1	-0.000000
exp13746	4.58623706e-29	0.000000	0.000000	discard	cycle 104 u=0.1000	agent0	initial_cond	0	-0.000000
exp13747	4.58623706e-29	0.000000	0.000000	discard	cycle 104 u=0.1000	agent0	initial_cond	0	-0.000000
exp13748	4.39794337e-29	0.000000	0.000000	discard	cycle 104 u=0.1000	agent0	initial_cond	1	-0.000000
exp13749	4.39794337e-29	0.000000	0.000000	discard	cycle 104 u=0.1000	agent0	initial_cond	0	-0.000000
exp13750	4.39794337e-29	0.000000	0.000000	discard	cycle 104 u=0.1000	agent0	initial_cond	1	-0.000000
exp13751	1.36727475e-28	0.000000	0.000000	discard	cycle 104 u=0.1050	agent0	initial_cond	0	-0.000000
exp13752	1.36727475e-28	0.000000	0.000000	discard	cycle 104 u=0.1050	agent0	initial_cond	0	-0.000000
exp13753	1.36727475e-28	0.000000	0.000000	discard	cycle 104 u=0.1050	agent0	initial_cond	0	-0.000000
exp13754	6.14461376e-29	0.000000	0.000000	discard	cycle 104 u=0.1050	agent0	initial_cond	0	-0.000000
exp13755	6.14461376e-29	0.000000	0.000000	discard	cycle 104 u=0.1050	agent0	initial_cond	1	-0.000000
exp13756	6.14461376e-29	0.000000	0.000000	discard	cycle 104 u=0.1050	agent0	initial_cond	0	-0.000000
exp13757	1.75906666e-28	0.000000	0.000000	discard	cycle 104 u=0.1050	agent0	initial_cond	0	-0.000000
exp13758	1.75906666e-28	0.000000	0.000000	discard	cycle 104 u=0.1050	agent0	initial_cond	0	-0.000000
exp13759	1.75906666e-28	0.000000	0.000000	discard	cycle 104 u=0.1050	agent0	initial_cond	0	-0.000000
exp13760	1.11257917e-28	0.000000	0.000000	discard	cycle 104 u=0.1050	agent0	initial_cond	1	-0.000000
exp13761	1.11257917e-28	0.000000	0.000000	discard	cycle 104 u=0.1050	agent0	initial_cond	0	-0.000000
exp13762	1.11257917e-28	0.000000	0.000000	discard	cycle 104 u=0.1050	agent0	initial_cond	1	-0.000000
exp13763	8.58580947e-29	0.000000	0.000000	discard	cycle 105 u=0.0975	agent0	initial_cond	0	0.000000
exp13764	8.58580947e-29	0.000000	0.000000	discard	cycle 105 u=0.0975	agent0	initial_cond	0	0.000000
exp13765	8.58580947e-29	0.000000	0.000000	discard	cycle 105 u=0.0975	agent0	initial_cond	1	0.000000
exp13766	5.23962023e-29	0.000000	0.000000	discard	cycle 105 u=0.0975	agent0	initial_cond	0	0.000000
exp13767	5.23962023e-29	0.000000	0.000000	discard	cycle 105 u=0.0975	agent0	initial_cond	1	0.000000
exp13768	5.23962023e-29	0.000000	0.000000	discard	cycle 105 u=0.0975	agent0	initial_cond	0	0.000000
exp13769	4.03266298e-29	0.000000	0.000000	discard	cycle 105 u=0.0975	agent0	initial_cond	0	0.000000
exp13770	4.03266298e-29	0.000000	0.000000	discard	cycle 105 u=0.0975	agent0	initial_cond	1	0.000000
exp13771	4.03266298e-29	0.000000	0.000000	discard	cycle 105 u=0.0975	agent0	initial_cond	0	0.000000
exp13772	4.80015937e-29	0.000000	0.000000	discard	cycle 105 u=0.0975	agent0	initial_cond	1	0.000000
exp13773	4.80015937e-29	0.000000	0.000000	discard	cycle 105 u=0.0975	agent0	initial_cond	0	0.000000
exp13774	4.80015937e-29	0.000000	0.000000	discard	cycle 105 u=0.0975	agent0	initial_cond	0	0.000000
exp13775	2.68824537e-29	0.000000	0.000000	discard	cycle 105 u=0.0980	agent0	initial_cond	0	-0.000000
exp13776	2.68824537e-29	0.000000	0.000000	discard	cycle 105 u=0.0980	agent0	initial_cond	0	-0.000000
exp13777	2.68824537e-29	0.000000	0.000000	discard	cycle 105 u=0.0980	agent0	initial_cond	1	-0.000000
exp13778	6.16758073e-29	0.000000	0.000000	discard	cycle 105 u=0.0980	agent0	initial_cond	0	-0.000000
exp13779	6.16758073e-29	0.000000	0.000000	discard	cycle 105 u=0.0980	agent0	initial_cond	0	-0.000000
exp13780	6.16758073e-29	0.000000	0.000000	discard	cycle 105 u=0.0980	agent0	initial_cond	0	-0.000000
exp13781	2.01926478e-29	0.000000	0.000000	discard	cycle 105 u=0.0980	agent0	initial_cond	0	0.000000
exp13782	2.01926478e-29	0.000000	0.000000	discard	cycle 105 u=0.0980	agent0	initial_cond	1	0.000000
exp13783	2.01926478e-29	0.000000	0.000000	discard	cycle 105 u=0.0980	agent0	initial_cond	0	0.000000
exp13784	1.30310780e-28	0.000000	0.000000	discard	cycle 105 u=0.0980	agent0	initial_cond	0	-0.000000
exp13785	1.30310780e-28	0.000000	0.000000	discard	cycle 105 u=0.0980	agent0	initial_cond	0	-0.000000
exp13786	1.30310780e-28	0.000000	0.000000	discard	cycle 105 u=0.0980	agent0	initial_cond	0	-0.000000
exp13787	5.45343271e-29	0.000000	0.000000	discard	cycle 105 u=0.0982	agent0	initial_cond	1	-0.000000
exp13788	5.45343271e-29	0.000000	0.000000	discard	cycle 105 u=0.0982	agent0	initial_cond	0	-0.000000
exp13789	5.45343271e-29	0.000000	0.000000	discard	cycle 105 u=0.0982	agent0	initial_cond	1	-0.000000
exp13790	1.23429977e-28	0.000000	0.000000	discard	cycle 105 u=0.0982	agent0	initial_cond	0	0.000000
exp13791	1.23429977e-28	0.000000	0.000000	discard	cycle 105 u=0.0982	agent0	initial_cond	0	0.000000
exp13792	1.23429977e-28	0.000000	0.000000	discard	cycle 105 u=0.0982	agent0	initial_cond	1	0.000000
exp13793	1.88036672e-29	0.000000	0.000000	discard	cycle 105 u=0.0982	agent0	initial_cond	0	0.000000
exp13794	1.88036672e-29	0.000000	0.000000	discard	cycle 105 u=0.0982	agent0	initial_cond	1	0.000000
exp13795	1.88036672e-29	0.000000	0.000000	discard	cycle 105 u=0.0982	agent0	initial_cond	0	0.000000
exp13796	1.91190259e-29	0.000000	-0.000000	discard	cycle 105 u=0.0982	agent0	initial_cond	0	0.000000
exp13797	1.91190259e-29	0.000000	-0.000000	discard	cycle 105 u=0.0982	agent0	initial_cond	0	0.000000
exp13798	1.91190259e-29	0.000000	-0.000000	discard	cycle 105 u=0.0982	agent0	initial_cond	0	0.000000
exp13799	6.13049994e-29	0.000000	0.000000	discard	cycle 105 u=0.0985	agent0	initial_cond	1	0.000000
exp13800	6.13049994e-29	0.000000	0.000000	discard	cycle 105 u=0.0985	agent0	initial_cond	0	0.000000
exp13801	6.13049994e-29	0.000000	0.000000	discard	cycle 105 u=0.0985	agent0	initial_cond	0	0.000000
exp13802	5.49750971e-29	0.000000	0.000000	discard	cycle 105 u=0.0985	agent0	initial_cond	0	0.000000
exp13803	5.49750971e-29	0.000000	0.000000	discard	cycle 105 u=0.0985	agent0	initial_cond	0	0.000000
exp13804	5.49750971e-29	0.000000	0.000000	discard	cycle 105 u=0.0985	agent0	initial_cond	1	0.000000
exp13805	4.15642452e-29	0.000000	0.000000	discard	cycle 105 u=0.0985	agent0	initial_cond	0	0.000000
exp13806	4.15642452e-29	0.000000	0.000000	discard	cycle 105 u=0.0985	agent0	initial_cond	1	0.000000
exp13807	4.15642452e-29	0.000000	0.000000	discard	cycle 105 u=0.0985	agent0	initial_cond	0	0.000000
exp13808	2.19292611e-29	0.000000	0.000000	discard	cycle 105 u=0.0985	agent0	initial_cond	0	-0.000000
exp13809	2.19292611e-29	0.000000	0.000000	discard	cycle 105 u=0.0985	agent0	initial_cond	0	-0.000000
exp13810	2.19292611e-29	0.000000	0.000000	discard	cycle 105 u=0.0985	agent0	initial_cond	0	-0.000000
exp13811	4.22491788e-29	0.000000	0.000000	discard	cycle 105 u=0.0990	agent0	initial_cond	1	-0.000000
exp13812	4.22491788e-29	0.000000	0.000000	discard	cycle 105 u=0.0990	agent0	initial_cond	0	-0.000000
exp13813	4.22491788e-29	0.000000	0.000000	discard	cycle 105 u=0.0990	agent0	initial_cond	0	-0.000000
exp13814	3.22245147e-29	0.000000	0.000000	discard	cycle 105 u=0.0990	agent0	initial_cond	0	0.000000
exp13815	3.22245147e-29	0.000000	0.000000	discard	cycle 105 u=0.0990	agent0	initial_cond	0	0.000000
exp13816	3.22245147e-29	0.000000	0.000000	discard	cycle 105 u=0.0990	agent0	initial_cond	1	0.000000
exp13817	4.50941488e-29	0.000000	-0.000000	discard	cycle 105 u=0.0990	agent0	initial_cond	0	0.000000
exp13818	4.50941488e-29	0.000000	-0.000000	discard	cycle 105 u=0.0990	agent0	initial_cond	1	0.000000
exp13819	4.50941488e-29	0.000000	-0.000000	discard	cycle 105 u=0.0990	agent0	initial_cond	0	0.000000
exp13820	4.88330883e-29	0.000000	-0.000000	discard	cycle 105 u=0.0990	agent0	initial_cond	0	0.000000
exp13821	4.88330883e-29	0.000000	-0.000000	discard	cycle 105 u=0.0990	agent0	initial_cond	1	0.000000
exp13822	4.88330883e-29	0.000000	-0.000000	discard	cycle 105 u=0.0990	agent0	initial_cond	0	0.000000
exp13823	5.74085541e-29	0.000000	-0.000000	discard	cycle 105 u=0.0995	agent0	initial_cond	1	0.000000
exp13824	5.74085541e-29	0.000000	-0.000000	discard	cycle 105 u=0.0995	agent0	initial_cond	0	0.000000
exp13825	5.74085541e-29	0.000000	-0.000000	discard	cycle 105 u=0.0995	agent0	initial_cond	0	0.000000
exp13826	1.54984578e-28	0.000000	0.000000	discard	cycle 105 u=0.0995	agent0	initial_cond	0	-0.000000
exp13827	1.54984578e-28	0.000000	0.000000	discard	cycle 105 u=0.0995	agent0	initial_cond	0	-0.000000
exp13828	1.54984578e-28	0.000000	0.000000	discard	cycle 105 u=0.0995	agent0	initial_cond	1	-0.000000
exp13829	1.60328418e-29	0.000000	-0.000000	discard	cycle 105 u=0.0995	agent0	initial_cond	0	-0.000000
exp13830	1.60328418e-29	0.000000	-0.000000	discard	cycle 105 u=0.0995	agent0	initial_cond	0	-0.000000
exp13831	1.60328418e-29	0.000000	-0.000000	discard	cycle 105 u=0.0995	agent0	initial_cond	0	-0.000000
exp13832	7.34590618e-29	0.000000	0.000000	discard	cycle 105 u=0.0995	agent0	initial_cond	0	0.000000
exp13833	7.34590618e-29	0.000000	0.000000	discard	cycle 105 u=0.0995	agent0	initial_cond	1	0.000000
exp13834	7.34590618e-29	0.000000	0.000000	discard	cycle 105 u=0.0995	agent0	initial_cond	0	0.000000
exp13835	4.46546993e-29	0.000000	0.000000	discard	cycle 105 u=0.1000	agent0	initial_cond	1	-0.000000
exp13836	4.46546993e-29	0.000000	0.000000	discard	cycle 105 u=0.1000	agent0	initial_cond	0	-0.000000
exp13837	4.46546993e-29	0.000000	0.000000	discard	cycle 105 u=0.1000	agent0	initial_cond	0	-0.000000
exp13838	4.08106752e-29	0.000000	0.000000	discard	cycle 105 u=0.1000	agent0	initial_cond	1	-0.000000
exp13839	4.08106752e-29	0.000000	0.000000	discard	cycle 105 u=0.1000	agent0	initial_cond	0	-0.000000
exp13840	4.08106752e-29	0.000000	0.000000	discard	cycle 105 u=0.1000	agent0	initial_cond	1	-0.000000
exp13841	4.58623706e-29	0.000000	0.000000	discard	cycle 105 u=0.1000	agent0	initial_cond	0	-0.000000
exp13842	4.58623706e-29	0.000000	0.000000	discard	cycle 105 u=0.1000	agent0	initial_cond	0	-0.000000
exp13843	4.58623706e-29	0.000000	0.000000	discard	cycle 105 u=0.1000	agent0	initial_cond	0	-0.000000
exp13844	4.39794337e-29	0.000000	0.000000	discard	cycle 105 u=0.1000	agent0	initial_cond	0	-0.000000
exp13845	4.39794337e-29	0.000000	0.000000	discard	cycle 105 u=0.1000	agent0	initial_cond	1	-0.000000
exp13846	4.39794337e-29	0.000000	0.000000	discard	cycle 105 u=0.1000	agent0	initial_cond	0	-0.000000
exp13847	1.36727475e-28	0.000000	0.000000	discard	cycle 105 u=0.1050	agent0	initial_cond	0	-0.000000
exp13848	1.36727475e-28	0.000000	0.000000	discard	cycle 105 u=0.1050	agent0	initial_cond	0	-0.000000
exp13849	1.36727475e-28	0.000000	0.000000	discard	cycle 105 u=0.1050	agent0	initial_cond	0	-0.000000
exp13850	6.14461376e-29	0.000000	0.000000	discard	cycle 105 u=0.1050	agent0	initial_cond	1	-0.000000
exp13851	6.14461376e-29	0.000000	0.000000	discard	cycle 105 u=0.1050	agent0	initial_cond	0	-0.000000
exp13852	6.14461376e-29	0.000000	0.000000	discard	cycle 105 u=0.1050	agent0	initial_cond	1	-0.000000
exp13853	1.75906666e-28	0.000000	0.000000	discard	cycle 105 u=0.1050	agent0	initial_cond	0	-0.000000
exp13854	1.75906666e-28	0.000000	0.000000	discard	cycle 105 u=0.1050	agent0	initial_cond	0	-0.000000
exp13855	1.75906666e-28	0.000000	0.000000	discard	cycle 105 u=0.1050	agent0	initial_cond	1	-0.000000
exp13856	1.11257917e-28	0.000000	0.000000	discard	cycle 105 u=0.1050	agent0	initial_cond	0	-0.000000
exp13857	1.11257917e-28	0.000000	0.000000	discard	cycle 105 u=0.1050	agent0	initial_cond	1	-0.000000
exp13858	1.11257917e-28	0.000000	0.000000	discard	cycle 105 u=0.1050	agent0	initial_cond	0	-0.000000
exp13859	8.58580947e-29	0.000000	0.000000	discard	cycle 106 u=0.0975	agent0	initial_cond	0	0.000000
exp13860	8.58580947e-29	0.000000	0.000000	discard	cycle 106 u=0.0975	agent0	initial_cond	0	0.000000
exp13861	8.58580947e-29	0.000000	0.000000	discard	cycle 106 u=0.0975	agent0	initial_cond	0	0.000000
exp13862	5.23962023e-29	0.000000	0.000000	discard	cycle 106 u=0.0975	agent0	initial_cond	1	0.000000
exp13863	5.23962023e-29	0.000000	0.000000	discard	cycle 106 u=0.0975	agent0	initial_cond	0	0.000000
