exp_id	residual	solution_norm	solution_mean	status	description	agent	design	elapsed_s	solution_energy
exp12728	5.74085541e-29	0.000000	-0.000000	discard	cycle 95 u=0.0995	agent0	initial_cond	0	0.000000
exp12729	1.54984578e-28	0.000000	0.000000	discard	cycle 95 u=0.0995	agent0	initial_cond	0	-0.000000
exp12730	1.54984578e-28	0.000000	0.000000	discard	cycle 95 u=0.0995	agent0	initial_cond	1	-0.000000
exp12731	1.54984578e-28	0.000000	0.000000	discard	cycle 95 u=0.0995	agent0	initial_cond	0	-0.000000
exp12732	1.60328418e-29	0.000000	-0.000000	discard	cycle 95 u=0.0995	agent0	initial_cond	1	-0.000000
exp12733	1.60328418e-29	0.000000	-0.000000	discard	cycle 95 u=0.0995	agent0	initial_cond	0	-0.000000
exp12734	1.60328418e-29	0.000000	-0.000000	discard	cycle 95 u=0.0995	agent0	initial_cond	0	-0.000000
exp12735	7.34590618e-29	0.000000	0.000000	discard	cycle 95 u=0.0995	agent0	initial_cond	0	0.000000
exp12736	7.34590618e-29	0.000000	0.000000	discard	cycle 95 u=0.0995	agent0	initial_cond	0	0.000000
exp12737	7.34590618e-29	0.000000	0.000000	discard	cycle 95 u=0.0995	agent0	initial_cond	1	0.000000
exp12738	4.46546993e-29	0.000000	0.000000	discard	cycle 95 u=0.1000	agent0	initial_cond	0	-0.000000
exp12739	4.46546993e-29	0.000000	0.000000	discard	cycle 95 u=0.1000	agent0	initial_cond	0	-0.000000
exp12740	4.46546993e-29	0.000000	0.000000	discard	cycle 95 u=0.1000	agent0	initial_cond	0	-0.000000
exp12741	4.08106752e-29	0.000000	0.000000	discard	cycle 95 u=0.1000	agent0	initial_cond	0	-0.000000
exp12742	4.08106752e-29	0.000000	0.000000	discard	cycle 95 u=0.1000	agent0	initial_cond	1	-0.000000
exp12743	4.08106752e-29	0.000000	0.000000	discard	cycle 95 u=0.1000	agent0	initial_cond	0	-0.000000
exp12744	4.58623706e-29	0.000000	0.000000	discard	cycle 95 u=0.1000	agent0	initial_cond	0	-0.000000
exp12745	4.58623706e-29	0.000000	0.000000	discard	cycle 95 u=0.1000	agent0	initial_cond	0	-0.000000
exp12746	4.58623706e-29	0.000000	0.000000	discard	cycle 95 u=0.1000	agent0	initial_cond	0	-0.000000
exp12747	4.39794337e-29	0.000000	0.000000	discard	cycle 95 u=0.1000	agent0	initial_cond	1	-0.000000
exp12748	4.39794337e-29	0.000000	0.000000	discard	cycle 95 u=0.1000	agent0	initial_cond	0	-0.000000
exp12749	4.39794337e-29	0.000000	0.000000	discard	cycle 95 u=0.1000	agent0	initial_cond	0	-0.000000
exp12750	1.36727475e-28	0.000000	0.000000	discard	cycle 95 u=0.1050	agent0	initial_cond	0	-0.000000
exp12751	1.36727475e-28	0.000000	0.000000	discard	cycle 95 u=0.1050	agent0	initial_cond	0	-0.000000
exp12752	1.36727475e-28	0.000000	0.000000	discard	cycle 95 u=0.1050	agent0	initial_cond	1	-0.000000
exp12753	6.14461376e-29	0.000000	0.000000	discard	cycle 95 u=0.1050	agent0	initial_cond	0	-0.000000
exp12754	6.14461376e-29	0.000000	0.000000	discard	cycle 95 u=0.1050	agent0	initial_cond	0	-0.000000
exp12755	6.14461376e-29	0.000000	0.000000	discard	cycle 95 u=0.1050	agent0	initial_cond	0	-0.000000
exp12756	1.75906666e-28	0.000000	0.000000	discard	cycle 95 u=0.1050	agent0	initial_cond	0	-0.000000
exp12757	1.75906666e-28	0.000000	0.000000	discard	cycle 95 u=0.1050	agent0	initial_cond	1	-0.000000
exp12758	1.75906666e-28	0.000000	0.000000	discard	cycle 95 u=0.1050	agent0	initial_cond	0	-0.000000
exp12759	1.11257917e-28	0.000000	0.000000	discard	cycle 95 u=0.1050	agent0	initial_cond	0	-0.000000
exp12760	1.11257917e-28	0.000000	0.000000	discard	cycle 95 u=0.1050	agent0	initial_cond	0	-0.000000
exp12761	1.11257917e-28	0.000000	0.000000	discard	cycle 95 u=0.1050	agent0	initial_cond	0	-0.000000
exp12762	8.58580947e-29	0.000000	0.000000	discard	cycle 96 u=0.0975	agent0	initial_cond	1	0.000000
exp12763	8.58580947e-29	0.000000	0.000000	discard	cycle 96 u=0.0975	agent0	initial_cond	0	0.000000
exp12764	8.58580947e-29	0.000000	0.000000	discard	cycle 96 u=0.0975	agent0	initial_cond	1	0.000000
exp12765	5.23962023e-29	0.000000	0.000000	discard	cycle 96 u=0.0975	agent0	initial_cond	0	0.000000
exp12766	5.23962023e-29	0.000000	0.000000	discard	cycle 96 u=0.0975	agent0	initial_cond	0	0.000000
exp12767	5.23962023e-29	0.000000	0.000000	discard	cycle 96 u=0.0975	agent0	initial_cond	1	0.000000
exp12768	4.03266298e-29	0.000000	0.000000	discard	cycle 96 u=0.0975	agent0	initial_cond	0	0.000000
exp12769	4.03266298e-29	0.000000	0.000000	discard	cycle 96 u=0.0975	agent0	initial_cond	1	0.000000
exp12770	6.18472616e-18	0.011783	-0.000000	discard	Round 9: K_amp=0.01 u=0.0 bifurcation	manual	branch_search	1	-0.000002
exp12771	4.03266298e-29	0.000000	0.000000	discard	cycle 96 u=0.0975	agent0	initial_cond	0	0.000000
exp12772	6.18472616e-18	0.011783	-0.000000	discard	Round 9: K_amp=0.01 u=0.5 bifurcation	manual	branch_search	0	-0.000002
exp12773	4.80015937e-29	0.000000	0.000000	discard	cycle 96 u=0.0975	agent0	initial_cond	0	0.000000
exp12774	6.18472616e-18	0.011783	-0.000000	discard	Round 9: K_amp=0.01 u=1.0 bifurcation	manual	branch_search	1	-0.000002
exp12775	4.80015937e-29	0.000000	0.000000	discard	cycle 96 u=0.0975	agent0	initial_cond	1	0.000000
exp12776	6.18472616e-18	0.011783	-0.000000	discard	Round 9: K_amp=0.03 u=0.0 bifurcation	manual	branch_search	0	-0.000002
exp12777	4.80015937e-29	0.000000	0.000000	discard	cycle 96 u=0.0975	agent0	initial_cond	0	0.000000
exp12778	6.18472616e-18	0.011783	-0.000000	discard	Round 9: K_amp=0.03 u=0.5 bifurcation	manual	branch_search	0	-0.000002
exp12779	2.68824537e-29	0.000000	0.000000	discard	cycle 96 u=0.0980	agent0	initial_cond	1	-0.000000
exp12780	6.18472616e-18	0.011783	-0.000000	discard	Round 9: K_amp=0.03 u=1.0 bifurcation	manual	branch_search	0	-0.000002
exp12781	2.68824537e-29	0.000000	0.000000	discard	cycle 96 u=0.0980	agent0	initial_cond	0	-0.000000
exp12782	6.18472616e-18	0.011783	-0.000000	discard	Round 9: K_amp=0.05 u=0.0 bifurcation	manual	branch_search	0	-0.000002
exp12783	2.68824537e-29	0.000000	0.000000	discard	cycle 96 u=0.0980	agent0	initial_cond	0	-0.000000
exp12784	6.18472616e-18	0.011783	-0.000000	discard	Round 9: K_amp=0.05 u=0.5 bifurcation	manual	branch_search	1	-0.000002
exp12785	6.16758073e-29	0.000000	0.000000	discard	cycle 96 u=0.0980	agent0	initial_cond	0	-0.000000
exp12786	6.18472616e-18	0.011783	-0.000000	discard	Round 9: K_amp=0.05 u=1.0 bifurcation	manual	branch_search	0	-0.000002
exp12787	6.16758073e-29	0.000000	0.000000	discard	cycle 96 u=0.0980	agent0	initial_cond	0	-0.000000
exp12788	6.18472616e-18	0.011783	-0.000000	discard	Round 9: K_amp=0.07 u=0.0 bifurcation	manual	branch_search	1	-0.000002
exp12789	6.16758073e-29	0.000000	0.000000	discard	cycle 96 u=0.0980	agent0	initial_cond	1	-0.000000
exp12790	6.18472616e-18	0.011783	-0.000000	discard	Round 9: K_amp=0.07 u=0.5 bifurcation	manual	branch_search	0	-0.000002
exp12791	2.01926478e-29	0.000000	0.000000	discard	cycle 96 u=0.0980	agent0	initial_cond	0	0.000000
exp12792	6.18472616e-18	0.011783	-0.000000	discard	Round 9: K_amp=0.07 u=1.0 bifurcation	manual	branch_search	0	-0.000002
exp12793	2.01926478e-29	0.000000	0.000000	discard	cycle 96 u=0.0980	agent0	initial_cond	0	0.000000
exp12794	6.18472616e-18	0.011783	-0.000000	discard	Round 9: K_amp=0.10 u=0.0 bifurcation	manual	branch_search	1	-0.000002
exp12795	2.01926478e-29	0.000000	0.000000	discard	cycle 96 u=0.0980	agent0	initial_cond	0	0.000000
exp12796	6.18472616e-18	0.011783	-0.000000	discard	Round 9: K_amp=0.10 u=0.5 bifurcation	manual	branch_search	0	-0.000002
exp12797	1.30310780e-28	0.000000	0.000000	discard	cycle 96 u=0.0980	agent0	initial_cond	0	-0.000000
exp12798	6.18472616e-18	0.011783	-0.000000	discard	Round 9: K_amp=0.10 u=1.0 bifurcation	manual	branch_search	1	-0.000002
exp12798	1.30310780e-28	0.000000	0.000000	discard	cycle 96 u=0.0980	agent0	initial_cond	1	-0.000000
exp12799	6.18472616e-18	0.011783	-0.000000	discard	Round 9: K_amp=0.15 u=0.0 bifurcation	manual	branch_search	0	-0.000002
exp12799	1.30310780e-28	0.000000	0.000000	discard	cycle 96 u=0.0980	agent0	initial_cond	0	-0.000000
exp12800	6.18472616e-18	0.011783	-0.000000	discard	Round 9: K_amp=0.15 u=0.5 bifurcation	manual	branch_search	0	-0.000002
exp12800	5.45343271e-29	0.000000	0.000000	discard	cycle 96 u=0.0982	agent0	initial_cond	0	-0.000000
exp12801	6.18472616e-18	0.011783	-0.000000	discard	Round 9: K_amp=0.15 u=1.0 bifurcation	manual	branch_search	0	-0.000002
exp12801	5.45343271e-29	0.000000	0.000000	discard	cycle 96 u=0.0982	agent0	initial_cond	0	-0.000000
exp12802	5.45343271e-29	0.000000	0.000000	discard	cycle 96 u=0.0982	agent0	initial_cond	0	-0.000000
exp12802	6.18472616e-18	0.011783	-0.000000	discard	Round 9: K_amp=0.20 u=0.0 bifurcation	manual	branch_search	0	-0.000002
exp12803	1.23429977e-28	0.000000	0.000000	discard	cycle 96 u=0.0982	agent0	initial_cond	1	0.000000
exp12803	6.18472616e-18	0.011783	-0.000000	discard	Round 9: K_amp=0.20 u=0.5 bifurcation	manual	branch_search	1	-0.000002
exp12804	1.23429977e-28	0.000000	0.000000	discard	cycle 96 u=0.0982	agent0	initial_cond	0	0.000000
exp12804	6.18472616e-18	0.011783	-0.000000	discard	Round 9: K_amp=0.20 u=1.0 bifurcation	manual	branch_search	0	-0.000002
exp12805	1.23429977e-28	0.000000	0.000000	discard	cycle 96 u=0.0982	agent0	initial_cond	1	0.000000
exp12805	6.18472616e-18	0.011783	-0.000000	discard	Round 9: K_amp=0.25 u=0.0 bifurcation	manual	branch_search	1	-0.000002
exp12806	1.88036672e-29	0.000000	0.000000	discard	cycle 96 u=0.0982	agent0	initial_cond	0	0.000000
exp12806	6.18472616e-18	0.011783	-0.000000	discard	Round 9: K_amp=0.25 u=0.5 bifurcation	manual	branch_search	0	-0.000002
exp12807	1.88036672e-29	0.000000	0.000000	discard	cycle 96 u=0.0982	agent0	initial_cond	0	0.000000
exp12807	6.18472616e-18	0.011783	-0.000000	discard	Round 9: K_amp=0.25 u=1.0 bifurcation	manual	branch_search	0	-0.000002
exp12808	1.88036672e-29	0.000000	0.000000	discard	cycle 96 u=0.0982	agent0	initial_cond	1	0.000000
exp12808	6.18472616e-18	0.011783	-0.000000	discard	Round 9: K_amp=0.30 u=0.0 bifurcation	manual	branch_search	0	-0.000002
exp12809	1.91190259e-29	0.000000	-0.000000	discard	cycle 96 u=0.0982	agent0	initial_cond	0	0.000000
exp12809	6.18472616e-18	0.011783	-0.000000	discard	Round 9: K_amp=0.30 u=0.5 bifurcation	manual	branch_search	0	-0.000002
exp12810	1.91190259e-29	0.000000	-0.000000	discard	cycle 96 u=0.0982	agent0	initial_cond	1	0.000000
exp12811	6.18472616e-18	0.011783	-0.000000	discard	Round 9: K_amp=0.30 u=1.0 bifurcation	manual	branch_search	1	-0.000002
exp12812	1.91190259e-29	0.000000	-0.000000	discard	cycle 96 u=0.0982	agent0	initial_cond	0	0.000000
exp12813	6.18472616e-18	0.011783	-0.000000	discard	Round 9: K_amp=0.35 u=0.0 bifurcation	manual	branch_search	0	-0.000002
exp12814	6.13049994e-29	0.000000	0.000000	discard	cycle 96 u=0.0985	agent0	initial_cond	0	0.000000
exp12815	6.18472616e-18	0.011783	-0.000000	discard	Round 9: K_amp=0.35 u=0.5 bifurcation	manual	branch_search	0	-0.000002
exp12816	6.13049994e-29	0.000000	0.000000	discard	cycle 96 u=0.0985	agent0	initial_cond	0	0.000000
exp12817	6.18472616e-18	0.011783	-0.000000	discard	Round 9: K_amp=0.35 u=1.0 bifurcation	manual	branch_search	0	-0.000002
exp12818	6.13049994e-29	0.000000	0.000000	discard	cycle 96 u=0.0985	agent0	initial_cond	0	0.000000
exp12819	6.18472616e-18	0.011783	-0.000000	discard	Round 9: K_amp=0.40 u=0.0 bifurcation	manual	branch_search	0	-0.000002
exp12820	5.49750971e-29	0.000000	0.000000	discard	cycle 96 u=0.0985	agent0	initial_cond	1	0.000000
exp12821	6.18472616e-18	0.011783	-0.000000	discard	Round 9: K_amp=0.40 u=0.5 bifurcation	manual	branch_search	1	-0.000002
exp12822	5.49750971e-29	0.000000	0.000000	discard	cycle 96 u=0.0985	agent0	initial_cond	0	0.000000
exp12823	6.18472616e-18	0.011783	-0.000000	discard	Round 9: K_amp=0.40 u=1.0 bifurcation	manual	branch_search	0	-0.000002
exp12824	5.49750971e-29	0.000000	0.000000	discard	cycle 96 u=0.0985	agent0	initial_cond	0	0.000000
exp12825	6.18472616e-18	0.011783	-0.000000	discard	Round 9: K_amp=0.45 u=0.0 bifurcation	manual	branch_search	1	-0.000002
exp12826	4.15642452e-29	0.000000	0.000000	discard	cycle 96 u=0.0985	agent0	initial_cond	0	0.000000
exp12827	6.18472616e-18	0.011783	-0.000000	discard	Round 9: K_amp=0.45 u=0.5 bifurcation	manual	branch_search	0	-0.000002
exp12828	4.15642452e-29	0.000000	0.000000	discard	cycle 96 u=0.0985	agent0	initial_cond	0	0.000000
exp12829	6.18472616e-18	0.011783	-0.000000	discard	Round 9: K_amp=0.45 u=1.0 bifurcation	manual	branch_search	0	-0.000002
exp12830	4.15642452e-29	0.000000	0.000000	discard	cycle 96 u=0.0985	agent0	initial_cond	1	0.000000
exp12831	6.18472616e-18	0.011783	-0.000000	discard	Round 9: K_amp=0.50 u=0.0 bifurcation	manual	branch_search	0	-0.000002
exp12832	2.19292611e-29	0.000000	0.000000	discard	cycle 96 u=0.0985	agent0	initial_cond	0	-0.000000
exp12833	6.18472616e-18	0.011783	-0.000000	discard	Round 9: K_amp=0.50 u=0.5 bifurcation	manual	branch_search	0	-0.000002
exp12834	2.19292611e-29	0.000000	0.000000	discard	cycle 96 u=0.0985	agent0	initial_cond	0	-0.000000
exp12835	6.18472616e-18	0.011783	-0.000000	discard	Round 9: K_amp=0.50 u=1.0 bifurcation	manual	branch_search	1	-0.000002
exp12836	2.19292611e-29	0.000000	0.000000	discard	cycle 96 u=0.0985	agent0	initial_cond	0	-0.000000
exp12837	4.22491788e-29	0.000000	0.000000	discard	cycle 96 u=0.0990	agent0	initial_cond	0	-0.000000
exp12838	4.22491788e-29	0.000000	0.000000	discard	cycle 96 u=0.0990	agent0	initial_cond	1	-0.000000
exp12839	4.22491788e-29	0.000000	0.000000	discard	cycle 96 u=0.0990	agent0	initial_cond	0	-0.000000
exp12840	3.22245147e-29	0.000000	0.000000	discard	cycle 96 u=0.0990	agent0	initial_cond	1	0.000000
exp12841	3.22245147e-29	0.000000	0.000000	discard	cycle 96 u=0.0990	agent0	initial_cond	0	0.000000
exp12842	3.22245147e-29	0.000000	0.000000	discard	cycle 96 u=0.0990	agent0	initial_cond	0	0.000000
exp12843	4.50941488e-29	0.000000	-0.000000	discard	cycle 96 u=0.0990	agent0	initial_cond	1	0.000000
exp12844	4.50941488e-29	0.000000	-0.000000	discard	cycle 96 u=0.0990	agent0	initial_cond	0	0.000000
exp12845	4.50941488e-29	0.000000	-0.000000	discard	cycle 96 u=0.0990	agent0	initial_cond	1	0.000000
exp12846	4.88330883e-29	0.000000	-0.000000	discard	cycle 96 u=0.0990	agent0	initial_cond	0	0.000000
exp12847	4.88330883e-29	0.000000	-0.000000	discard	cycle 96 u=0.0990	agent0	initial_cond	0	0.000000
exp12848	4.88330883e-29	0.000000	-0.000000	discard	cycle 96 u=0.0990	agent0	initial_cond	1	0.000000
exp12849	5.74085541e-29	0.000000	-0.000000	discard	cycle 96 u=0.0995	agent0	initial_cond	0	0.000000
exp12850	5.74085541e-29	0.000000	-0.000000	discard	cycle 96 u=0.0995	agent0	initial_cond	1	0.000000
exp12851	5.74085541e-29	0.000000	-0.000000	discard	cycle 96 u=0.0995	agent0	initial_cond	0	0.000000
exp12852	1.54984578e-28	0.000000	0.000000	discard	cycle 96 u=0.0995	agent0	initial_cond	0	-0.000000
exp12853	1.54984578e-28	0.000000	0.000000	discard	cycle 96 u=0.0995	agent0	initial_cond	0	-0.000000
exp12854	1.54984578e-28	0.000000	0.000000	discard	cycle 96 u=0.0995	agent0	initial_cond	0	-0.000000
exp12855	1.60328418e-29	0.000000	-0.000000	discard	cycle 96 u=0.0995	agent0	initial_cond	1	-0.000000
exp12856	1.60328418e-29	0.000000	-0.000000	discard	cycle 96 u=0.0995	agent0	initial_cond	0	-0.000000
exp12857	1.60328418e-29	0.000000	-0.000000	discard	cycle 96 u=0.0995	agent0	initial_cond	0	-0.000000
exp12858	7.34590618e-29	0.000000	0.000000	discard	cycle 96 u=0.0995	agent0	initial_cond	0	0.000000
exp12859	7.34590618e-29	0.000000	0.000000	discard	cycle 96 u=0.0995	agent0	initial_cond	0	0.000000
exp12860	7.34590618e-29	0.000000	0.000000	discard	cycle 96 u=0.0995	agent0	initial_cond	1	0.000000
exp12861	4.46546993e-29	0.000000	0.000000	discard	cycle 96 u=0.1000	agent0	initial_cond	0	-0.000000
exp12862	4.46546993e-29	0.000000	0.000000	discard	cycle 96 u=0.1000	agent0	initial_cond	0	-0.000000
exp12863	4.46546993e-29	0.000000	0.000000	discard	cycle 96 u=0.1000	agent0	initial_cond	0	-0.000000
exp12863	6.18472616e-18	0.011783	-0.000000	discard	Round 9: EXTREME K_amplitude=-0.5	manual	branch_search	0	-0.000002
exp12864	6.18472616e-18	0.011783	-0.000000	discard	Round 9: EXTREME K_amplitude=-0.3	manual	branch_search	0	-0.000002
exp12864	4.08106752e-29	0.000000	0.000000	discard	cycle 96 u=0.1000	agent0	initial_cond	0	-0.000000
exp12865	4.08106752e-29	0.000000	0.000000	discard	cycle 96 u=0.1000	agent0	initial_cond	1	-0.000000
exp12865	6.18472616e-18	0.011783	-0.000000	discard	Round 9: EXTREME K_amplitude=-0.1	manual	branch_search	1	-0.000002
exp12866	4.08106752e-29	0.000000	0.000000	discard	cycle 96 u=0.1000	agent0	initial_cond	0	-0.000000
exp12866	6.18472616e-18	0.011783	-0.000000	discard	Round 9: EXTREME K_amplitude=0.0	manual	branch_search	0	-0.000002
exp12867	4.58623706e-29	0.000000	0.000000	discard	cycle 96 u=0.1000	agent0	initial_cond	0	-0.000000
exp12867	6.18472616e-18	0.011783	-0.000000	discard	Round 9: EXTREME K_amplitude=0.75	manual	branch_search	0	-0.000002
exp12868	4.58623706e-29	0.000000	0.000000	discard	cycle 96 u=0.1000	agent0	initial_cond	0	-0.000000
exp12868	6.18472616e-18	0.011783	-0.000000	discard	Round 9: EXTREME K_amplitude=1.0	manual	branch_search	0	-0.000002
exp12869	4.58623706e-29	0.000000	0.000000	discard	cycle 96 u=0.1000	agent0	initial_cond	0	-0.000000
exp12869	6.18472616e-18	0.011783	-0.000000	discard	Round 9: EXTREME K_amplitude=1.5	manual	branch_search	0	-0.000002
exp12870	4.39794337e-29	0.000000	0.000000	discard	cycle 96 u=0.1000	agent0	initial_cond	1	-0.000000
exp12870	6.18472616e-18	0.011783	-0.000000	discard	Round 9: EXTREME K_amplitude=2.0	manual	branch_search	1	-0.000002
exp12871	4.39794337e-29	0.000000	0.000000	discard	cycle 96 u=0.1000	agent0	initial_cond	0	-0.000000
exp12872	4.39794337e-29	0.000000	0.000000	discard	cycle 96 u=0.1000	agent0	initial_cond	1	-0.000000
exp12873	1.36727475e-28	0.000000	0.000000	discard	cycle 96 u=0.1050	agent0	initial_cond	0	-0.000000
exp12874	1.36727475e-28	0.000000	0.000000	discard	cycle 96 u=0.1050	agent0	initial_cond	0	-0.000000
exp12875	1.36727475e-28	0.000000	0.000000	discard	cycle 96 u=0.1050	agent0	initial_cond	1	-0.000000
exp12876	6.14461376e-29	0.000000	0.000000	discard	cycle 96 u=0.1050	agent0	initial_cond	0	-0.000000
exp12877	6.14461376e-29	0.000000	0.000000	discard	cycle 96 u=0.1050	agent0	initial_cond	1	-0.000000
exp12878	6.14461376e-29	0.000000	0.000000	discard	cycle 96 u=0.1050	agent0	initial_cond	0	-0.000000
exp12879	1.75906666e-28	0.000000	0.000000	discard	cycle 96 u=0.1050	agent0	initial_cond	0	-0.000000
exp12880	1.75906666e-28	0.000000	0.000000	discard	cycle 96 u=0.1050	agent0	initial_cond	1	-0.000000
exp12881	1.75906666e-28	0.000000	0.000000	discard	cycle 96 u=0.1050	agent0	initial_cond	0	-0.000000
exp12882	1.11257917e-28	0.000000	0.000000	discard	cycle 96 u=0.1050	agent0	initial_cond	1	-0.000000
exp12883	1.11257917e-28	0.000000	0.000000	discard	cycle 96 u=0.1050	agent0	initial_cond	0	-0.000000
exp12884	1.11257917e-28	0.000000	0.000000	discard	cycle 96 u=0.1050	agent0	initial_cond	0	-0.000000
exp12885	8.58580947e-29	0.000000	0.000000	discard	cycle 97 u=0.0975	agent0	initial_cond	0	0.000000
exp12886	8.58580947e-29	0.000000	0.000000	discard	cycle 97 u=0.0975	agent0	initial_cond	0	0.000000
exp12887	8.58580947e-29	0.000000	0.000000	discard	cycle 97 u=0.0975	agent0	initial_cond	1	0.000000
exp12888	5.23962023e-29	0.000000	0.000000	discard	cycle 97 u=0.0975	agent0	initial_cond	0	0.000000
exp12889	5.23962023e-29	0.000000	0.000000	discard	cycle 97 u=0.0975	agent0	initial_cond	0	0.000000
exp12890	5.23962023e-29	0.000000	0.000000	discard	cycle 97 u=0.0975	agent0	initial_cond	0	0.000000
exp12891	4.03266298e-29	0.000000	0.000000	discard	cycle 97 u=0.0975	agent0	initial_cond	0	0.000000
exp12892	4.03266298e-29	0.000000	0.000000	discard	cycle 97 u=0.0975	agent0	initial_cond	1	0.000000
exp12893	4.03266298e-29	0.000000	0.000000	discard	cycle 97 u=0.0975	agent0	initial_cond	0	0.000000
exp12894	4.80015937e-29	0.000000	0.000000	discard	cycle 97 u=0.0975	agent0	initial_cond	0	0.000000
exp12895	4.80015937e-29	0.000000	0.000000	discard	cycle 97 u=0.0975	agent0	initial_cond	0	0.000000
exp12896	4.80015937e-29	0.000000	0.000000	discard	cycle 97 u=0.0975	agent0	initial_cond	0	0.000000
exp12897	2.68824537e-29	0.000000	0.000000	discard	cycle 97 u=0.0980	agent0	initial_cond	1	-0.000000
exp12898	2.68824537e-29	0.000000	0.000000	discard	cycle 97 u=0.0980	agent0	initial_cond	0	-0.000000
exp12899	2.68824537e-29	0.000000	0.000000	discard	cycle 97 u=0.0980	agent0	initial_cond	0	-0.000000
exp12900	6.16758073e-29	0.000000	0.000000	discard	cycle 97 u=0.0980	agent0	initial_cond	0	-0.000000
exp12901	6.16758073e-29	0.000000	0.000000	discard	cycle 97 u=0.0980	agent0	initial_cond	0	-0.000000
exp12902	6.16758073e-29	0.000000	0.000000	discard	cycle 97 u=0.0980	agent0	initial_cond	1	-0.000000
exp12903	2.01926478e-29	0.000000	0.000000	discard	cycle 97 u=0.0980	agent0	initial_cond	0	0.000000
exp12904	2.01926478e-29	0.000000	0.000000	discard	cycle 97 u=0.0980	agent0	initial_cond	1	0.000000
exp12905	2.01926478e-29	0.000000	0.000000	discard	cycle 97 u=0.0980	agent0	initial_cond	0	0.000000
exp12906	1.30310780e-28	0.000000	0.000000	discard	cycle 97 u=0.0980	agent0	initial_cond	0	-0.000000
exp12907	1.30310780e-28	0.000000	0.000000	discard	cycle 97 u=0.0980	agent0	initial_cond	1	-0.000000
exp12908	1.30310780e-28	0.000000	0.000000	discard	cycle 97 u=0.0980	agent0	initial_cond	0	-0.000000
exp12909	5.45343271e-29	0.000000	0.000000	discard	cycle 97 u=0.0982	agent0	initial_cond	1	-0.000000
exp12910	5.45343271e-29	0.000000	0.000000	discard	cycle 97 u=0.0982	agent0	initial_cond	0	-0.000000
exp12911	5.45343271e-29	0.000000	0.000000	discard	cycle 97 u=0.0982	agent0	initial_cond	0	-0.000000
exp12912	1.23429977e-28	0.000000	0.000000	discard	cycle 97 u=0.0982	agent0	initial_cond	1	0.000000
exp12913	1.23429977e-28	0.000000	0.000000	discard	cycle 97 u=0.0982	agent0	initial_cond	0	0.000000
exp12914	1.23429977e-28	0.000000	0.000000	discard	cycle 97 u=0.0982	agent0	initial_cond	1	0.000000
exp12915	1.88036672e-29	0.000000	0.000000	discard	cycle 97 u=0.0982	agent0	initial_cond	0	0.000000
exp12916	1.88036672e-29	0.000000	0.000000	discard	cycle 97 u=0.0982	agent0	initial_cond	0	0.000000
