exp_id	residual	solution_norm	solution_mean	status	description	agent	design	elapsed_s	solution_energy
exp4412	5.45343271e-29	0.000000	0.000000	discard	cycle 22 u=0.0982	agent0	initial_cond	0	-0.000000
exp4413	5.45343271e-29	0.000000	0.000000	discard	cycle 22 u=0.0982	agent0	initial_cond	0	-0.000000
exp4414	5.45343271e-29	0.000000	0.000000	discard	cycle 22 u=0.0982	agent0	initial_cond	1	-0.000000
exp4414	5.45343271e-29	0.000000	0.000000	discard	best modes=2 r=1	agent0	solver_param	1	-0.000000
exp4415	2.00148302e-16	1.001298	1.000025	discard	cycle 22 u=0.0982	agent0	initial_cond	0	-1.520921
exp4415	2.00148302e-16	1.001298	1.000025	discard	best modes=2 r=2	agent0	solver_param	0	-1.520921
exp4416	2.00148302e-16	1.001298	1.000025	discard	cycle 22 u=0.0982	agent0	initial_cond	0	-1.520921
exp4417	2.00148302e-16	1.001298	1.000025	discard	best modes=2 r=3	agent0	solver_param	1	-1.520921
exp4418	2.00148302e-16	1.001298	1.000025	discard	cycle 22 u=0.0982	agent0	initial_cond	0	-1.520921
exp4419	1.88036672e-29	0.000000	0.000000	discard	best modes=2 r=4	agent0	solver_param	0	0.000000
exp4420	2.00148302e-16	1.001298	1.000025	discard	cycle 22 u=0.0982	agent0	initial_cond	0	-1.520921
exp4421	1.88036672e-29	0.000000	0.000000	discard	best modes=2 r=5	agent0	solver_param	0	0.000000
exp4422	2.00148302e-16	1.001298	1.000025	discard	cycle 22 u=0.0982	agent0	initial_cond	1	-1.520921
exp4423	1.88036672e-29	0.000000	0.000000	discard	best modes=2 r=6	agent0	solver_param	0	0.000000
exp4424	2.00148302e-16	1.001298	1.000025	discard	cycle 22 u=0.0982	agent0	initial_cond	0	-1.520921
exp4425	1.91190259e-29	0.000000	-0.000000	discard	best modes=2 r=7	agent0	solver_param	0	0.000000
exp4426	1.91190259e-29	0.000000	-0.000000	discard	cycle 22 u=0.0982	agent0	initial_cond	0	0.000000
exp4427	1.91190259e-29	0.000000	-0.000000	discard	best modes=2 r=8	agent0	solver_param	1	0.000000
exp4428	1.91190259e-29	0.000000	-0.000000	discard	cycle 22 u=0.0982	agent0	initial_cond	1	0.000000
exp4429	1.91190259e-29	0.000000	-0.000000	discard	best modes=2 r=9	agent0	solver_param	0	0.000000
exp4429	1.91190259e-29	0.000000	-0.000000	discard	cycle 22 u=0.0982	agent0	initial_cond	0	0.000000
exp4430	2.00148302e-16	1.001298	1.000025	discard	cycle 22 u=0.0985	agent0	initial_cond	0	-1.520921
exp4430	2.00148302e-16	1.001298	1.000025	discard	best modes=2 r=10	agent0	solver_param	0	-1.520921
exp4431	4.22769823e-16	1.001296	1.000019	discard	cycle 22 u=0.0985	agent0	initial_cond	0	-1.520844
exp4432	4.22769823e-16	1.001296	1.000019	discard	best modes=3 r=1	agent0	solver_param	0	-1.520844
exp4433	4.22769823e-16	1.001296	1.000019	discard	cycle 22 u=0.0985	agent0	initial_cond	0	-1.520844
exp4434	5.49750971e-29	0.000000	0.000000	discard	best modes=3 r=2	agent0	solver_param	0	0.000000
exp4435	4.22769823e-16	1.001296	1.000019	discard	cycle 22 u=0.0985	agent0	initial_cond	1	-1.520844
exp4436	5.49750971e-29	0.000000	0.000000	discard	best modes=3 r=3	agent0	solver_param	1	0.000000
exp4437	4.22769823e-16	1.001296	1.000019	discard	cycle 22 u=0.0985	agent0	initial_cond	0	-1.520844
exp4438	5.49750971e-29	0.000000	0.000000	discard	best modes=3 r=4	agent0	solver_param	0	0.000000
exp4439	4.22769823e-16	1.001296	1.000019	discard	cycle 22 u=0.0985	agent0	initial_cond	0	-1.520844
exp4440	4.15642452e-29	0.000000	0.000000	discard	best modes=3 r=5	agent0	solver_param	1	0.000000
exp4441	4.15642452e-29	0.000000	0.000000	discard	cycle 22 u=0.0985	agent0	initial_cond	1	0.000000
exp4442	4.15642452e-29	0.000000	0.000000	discard	best modes=3 r=6	agent0	solver_param	0	0.000000
exp4443	4.15642452e-29	0.000000	0.000000	discard	cycle 22 u=0.0985	agent0	initial_cond	0	0.000000
exp4444	4.15642452e-29	0.000000	0.000000	discard	best modes=3 r=7	agent0	solver_param	0	0.000000
exp4444	4.15642452e-29	0.000000	0.000000	discard	cycle 22 u=0.0985	agent0	initial_cond	0	0.000000
exp4445	2.19292611e-29	0.000000	0.000000	discard	best modes=3 r=8	agent0	solver_param	1	-0.000000
exp4445	2.19292611e-29	0.000000	0.000000	discard	cycle 22 u=0.0985	agent0	initial_cond	1	-0.000000
exp4446	4.22769823e-16	1.001296	1.000019	discard	cycle 22 u=0.0985	agent0	initial_cond	0	-1.520844
exp4446	4.22769823e-16	1.001296	1.000019	discard	best modes=3 r=9	agent0	solver_param	0	-1.520844
exp4447	4.22769823e-16	1.001296	1.000019	discard	cycle 22 u=0.0985	agent0	initial_cond	0	-1.520844
exp4448	4.22491788e-29	0.000000	0.000000	discard	best modes=3 r=10	agent0	solver_param	1	-0.000000
exp4449	2.06774381e-16	1.001296	1.000019	discard	cycle 22 u=0.0990	agent0	initial_cond	0	-1.520844
exp4450	4.22491788e-29	0.000000	0.000000	discard	best modes=4 r=1	agent0	solver_param	0	-0.000000
exp4451	2.06774381e-16	1.001296	1.000019	discard	cycle 22 u=0.0990	agent0	initial_cond	0	-1.520844
exp4452	4.22491788e-29	0.000000	0.000000	discard	best modes=4 r=2	agent0	solver_param	0	-0.000000
exp4453	2.06774381e-16	1.001296	1.000019	discard	cycle 22 u=0.0990	agent0	initial_cond	1	-1.520844
exp4454	3.22245147e-29	0.000000	0.000000	discard	best modes=4 r=3	agent0	solver_param	0	0.000000
exp4455	2.06774381e-16	1.001296	1.000019	discard	cycle 22 u=0.0990	agent0	initial_cond	0	-1.520844
exp4456	3.22245147e-29	0.000000	0.000000	discard	best modes=4 r=4	agent0	solver_param	0	0.000000
exp4457	3.22245147e-29	0.000000	0.000000	discard	cycle 22 u=0.0990	agent0	initial_cond	0	0.000000
exp4458	3.22245147e-29	0.000000	0.000000	discard	best modes=4 r=5	agent0	solver_param	1	0.000000
exp4459	3.22245147e-29	0.000000	0.000000	discard	cycle 22 u=0.0990	agent0	initial_cond	1	0.000000
exp4460	4.50941488e-29	0.000000	-0.000000	discard	best modes=4 r=6	agent0	solver_param	0	0.000000
exp4460	4.50941488e-29	0.000000	-0.000000	discard	cycle 22 u=0.0990	agent0	initial_cond	0	0.000000
exp4461	2.06774381e-16	1.001296	1.000019	discard	cycle 22 u=0.0990	agent0	initial_cond	0	-1.520844
exp4461	2.06774381e-16	1.001296	1.000019	discard	best modes=4 r=7	agent0	solver_param	0	-1.520844
exp4462	2.06774381e-16	1.001296	1.000019	discard	cycle 22 u=0.0990	agent0	initial_cond	0	-1.520844
exp4463	2.06774381e-16	1.001296	1.000019	discard	best modes=4 r=8	agent0	solver_param	0	-1.520844
exp4464	2.06774381e-16	1.001296	1.000019	discard	cycle 22 u=0.0990	agent0	initial_cond	0	-1.520844
exp4465	4.88330883e-29	0.000000	-0.000000	discard	best modes=4 r=9	agent0	solver_param	0	0.000000
exp4466	2.06774381e-16	1.001296	1.000019	discard	cycle 22 u=0.0990	agent0	initial_cond	1	-1.520844
exp4467	4.88330883e-29	0.000000	-0.000000	discard	best modes=4 r=10	agent0	solver_param	1	0.000000
exp4468	1.33461196e-15	1.001296	1.000019	discard	cycle 22 u=0.0990	agent0	initial_cond	0	-1.520844
exp4469	5.74085541e-29	0.000000	-0.000000	discard	best modes=5 r=1	agent0	solver_param	0	0.000000
exp4470	1.33461196e-15	1.001296	1.000019	discard	cycle 22 u=0.0995	agent0	initial_cond	0	-1.520844
exp4471	5.74085541e-29	0.000000	-0.000000	discard	best modes=5 r=2	agent0	solver_param	1	0.000000
exp4472	5.74085541e-29	0.000000	-0.000000	discard	cycle 22 u=0.0995	agent0	initial_cond	1	0.000000
exp4473	5.74085541e-29	0.000000	-0.000000	discard	best modes=5 r=3	agent0	solver_param	0	0.000000
exp4474	5.74085541e-29	0.000000	-0.000000	discard	cycle 22 u=0.0995	agent0	initial_cond	0	0.000000
exp4475	1.54984578e-28	0.000000	0.000000	discard	best modes=5 r=4	agent0	solver_param	0	-0.000000
exp4475	1.54984578e-28	0.000000	0.000000	discard	cycle 22 u=0.0995	agent0	initial_cond	0	-0.000000
exp4476	1.33461196e-15	1.001296	1.000019	discard	cycle 22 u=0.0995	agent0	initial_cond	1	-1.520844
exp4476	1.33461196e-15	1.001296	1.000019	discard	best modes=5 r=5	agent0	solver_param	1	-1.520844
exp4477	1.33461196e-15	1.001296	1.000019	discard	cycle 22 u=0.0995	agent0	initial_cond	0	-1.520844
exp4477	1.33461196e-15	1.001296	1.000019	discard	best modes=5 r=6	agent0	solver_param	0	-1.520844
exp4478	1.33461196e-15	1.001296	1.000019	discard	cycle 22 u=0.0995	agent0	initial_cond	0	-1.520844
exp4479	1.60328418e-29	0.000000	-0.000000	discard	best modes=5 r=7	agent0	solver_param	1	-0.000000
exp4480	1.33461196e-15	1.001296	1.000019	discard	cycle 22 u=0.0995	agent0	initial_cond	0	-1.520844
exp4481	1.60328418e-29	0.000000	-0.000000	discard	best modes=5 r=8	agent0	solver_param	0	-0.000000
exp4482	1.33461196e-15	1.001296	1.000019	discard	cycle 22 u=0.0995	agent0	initial_cond	0	-1.520844
exp4483	7.34590618e-29	0.000000	0.000000	discard	best modes=5 r=9	agent0	solver_param	0	0.000000
exp4484	1.33461196e-15	1.001296	1.000019	discard	cycle 22 u=0.0995	agent0	initial_cond	1	-1.520844
exp4485	7.34590618e-29	0.000000	0.000000	discard	best modes=5 r=10	agent0	solver_param	0	0.000000
exp4486	7.34590618e-29	0.000000	0.000000	discard	cycle 22 u=0.0995	agent0	initial_cond	0	0.000000
exp4487	7.34590618e-29	0.000000	0.000000	discard	best modes=6 r=1	agent0	solver_param	0	0.000000
exp4488	7.34590618e-29	0.000000	0.000000	discard	cycle 22 u=0.0995	agent0	initial_cond	0	0.000000
exp4489	4.46546993e-29	0.000000	0.000000	discard	best modes=6 r=2	agent0	solver_param	1	-0.000000
exp4489	4.46546993e-29	0.000000	0.000000	discard	cycle 22 u=0.1000	agent0	initial_cond	1	-0.000000
exp4490	2.64830595e-15	1.001296	1.000019	discard	cycle 22 u=0.1000	agent0	initial_cond	0	-1.520844
exp4490	2.64830595e-15	1.001296	1.000019	discard	best modes=6 r=3	agent0	solver_param	0	-1.520844
exp4491	2.64830595e-15	1.001296	1.000019	discard	cycle 22 u=0.1000	agent0	initial_cond	0	-1.520844
exp4491	2.64830595e-15	1.001296	1.000019	discard	best modes=6 r=4	agent0	solver_param	1	-1.520844
exp4492	2.64830595e-15	1.001296	1.000019	discard	cycle 22 u=0.1000	agent0	initial_cond	0	-1.520844
exp4493	4.08106752e-29	0.000000	0.000000	discard	best modes=6 r=5	agent0	solver_param	0	-0.000000
exp4494	2.64830595e-15	1.001296	1.000019	discard	cycle 22 u=0.1000	agent0	initial_cond	0	-1.520844
exp4495	4.08106752e-29	0.000000	0.000000	discard	best modes=6 r=6	agent0	solver_param	0	-0.000000
exp4496	2.64830595e-15	1.001296	1.000019	discard	cycle 22 u=0.1000	agent0	initial_cond	1	-1.520844
exp4497	4.58623706e-29	0.000000	0.000000	discard	best modes=6 r=7	agent0	solver_param	0	-0.000000
exp4498	2.64830595e-15	1.001296	1.000019	discard	cycle 22 u=0.1000	agent0	initial_cond	0	-1.520844
exp4499	4.58623706e-29	0.000000	0.000000	discard	best modes=6 r=8	agent0	solver_param	0	-0.000000
exp4500	4.58623706e-29	0.000000	0.000000	discard	cycle 22 u=0.1000	agent0	initial_cond	0	-0.000000
exp4501	4.58623706e-29	0.000000	0.000000	discard	best modes=6 r=9	agent0	solver_param	1	-0.000000
exp4502	4.58623706e-29	0.000000	0.000000	discard	cycle 22 u=0.1000	agent0	initial_cond	1	-0.000000
exp4503	4.39794337e-29	0.000000	0.000000	discard	best modes=6 r=10	agent0	solver_param	0	-0.000000
exp4503	4.39794337e-29	0.000000	0.000000	discard	cycle 22 u=0.1000	agent0	initial_cond	0	-0.000000
exp4504	4.39794337e-29	0.000000	0.000000	discard	best modes=8 r=1	agent0	solver_param	0	-0.000000
exp4504	4.39794337e-29	0.000000	0.000000	discard	cycle 22 u=0.1000	agent0	initial_cond	0	-0.000000
exp4505	2.27731282e-15	1.001296	1.000019	discard	cycle 22 u=0.1000	agent0	initial_cond	0	-1.520844
exp4505	2.27731282e-15	1.001296	1.000019	discard	best modes=8 r=2	agent0	solver_param	0	-1.520844
exp4506	2.27731282e-15	1.001296	1.000019	discard	cycle 22 u=0.1050	agent0	initial_cond	0	-1.520844
exp4507	2.27731282e-15	1.001296	1.000019	discard	best modes=8 r=3	agent0	solver_param	0	-1.520844
exp4508	2.27731282e-15	1.001296	1.000019	discard	cycle 22 u=0.1050	agent0	initial_cond	1	-1.520844
exp4509	1.36727475e-28	0.000000	0.000000	discard	best modes=8 r=4	agent0	solver_param	1	-0.000000
exp4510	2.27731282e-15	1.001296	1.000019	discard	cycle 22 u=0.1050	agent0	initial_cond	0	-1.520844
exp4511	6.14461376e-29	0.000000	0.000000	discard	best modes=8 r=5	agent0	solver_param	0	-0.000000
exp4512	2.27731282e-15	1.001296	1.000019	discard	cycle 22 u=0.1050	agent0	initial_cond	0	-1.520844
exp4513	6.14461376e-29	0.000000	0.000000	discard	best modes=8 r=6	agent0	solver_param	1	-0.000000
exp4514	6.14461376e-29	0.000000	0.000000	discard	cycle 22 u=0.1050	agent0	initial_cond	1	-0.000000
exp4515	6.14461376e-29	0.000000	0.000000	discard	best modes=8 r=7	agent0	solver_param	0	-0.000000
exp4516	6.14461376e-29	0.000000	0.000000	discard	cycle 22 u=0.1050	agent0	initial_cond	0	-0.000000
exp4517	1.75906666e-28	0.000000	0.000000	discard	best modes=8 r=8	agent0	solver_param	0	-0.000000
exp4517	1.75906666e-28	0.000000	0.000000	discard	cycle 22 u=0.1050	agent0	initial_cond	0	-0.000000
exp4518	1.75906666e-28	0.000000	0.000000	discard	cycle 22 u=0.1050	agent0	initial_cond	0	-0.000000
exp4518	1.75906666e-28	0.000000	0.000000	discard	best modes=8 r=9	agent0	solver_param	0	-0.000000
exp4519	2.27731282e-15	1.001296	1.000019	discard	cycle 22 u=0.1050	agent0	initial_cond	0	-1.520844
exp4519	2.27731282e-15	1.001296	1.000019	discard	best modes=8 r=10	agent0	solver_param	0	-1.520844
exp4520	1.11257917e-28	0.000000	0.000000	discard	cycle 22 u=0.1050	agent0	initial_cond	1	-0.000000
exp4521	1.11257917e-28	0.000000	0.000000	discard	cycle 22 u=0.1050	agent0	initial_cond	0	-0.000000
exp4522	1.11257917e-28	0.000000	0.000000	discard	cycle 22 u=0.1050	agent0	initial_cond	0	-0.000000
exp4523	8.58580947e-29	0.000000	0.000000	discard	cycle 23 u=0.0975	agent0	initial_cond	1	0.000000
exp4524	8.58580947e-29	0.000000	0.000000	discard	cycle 23 u=0.0975	agent0	initial_cond	0	0.000000
exp4525	8.58580947e-29	0.000000	0.000000	discard	cycle 23 u=0.0975	agent0	initial_cond	0	0.000000
exp4526	5.23962023e-29	0.000000	0.000000	discard	cycle 23 u=0.0975	agent0	initial_cond	1	0.000000
exp4527	5.23962023e-29	0.000000	0.000000	discard	cycle 23 u=0.0975	agent0	initial_cond	0	0.000000
exp4528	5.23962023e-29	0.000000	0.000000	discard	cycle 23 u=0.0975	agent0	initial_cond	0	0.000000
exp4529	4.03266298e-29	0.000000	0.000000	discard	cycle 23 u=0.0975	agent0	initial_cond	0	0.000000
exp4530	4.03266298e-29	0.000000	0.000000	discard	cycle 23 u=0.0975	agent0	initial_cond	0	0.000000
exp4531	4.03266298e-29	0.000000	0.000000	discard	cycle 23 u=0.0975	agent0	initial_cond	1	0.000000
exp4532	4.80015937e-29	0.000000	0.000000	discard	cycle 23 u=0.0975	agent0	initial_cond	0	0.000000
exp4533	4.80015937e-29	0.000000	0.000000	discard	cycle 23 u=0.0975	agent0	initial_cond	0	0.000000
exp4534	4.80015937e-29	0.000000	0.000000	discard	cycle 23 u=0.0975	agent0	initial_cond	1	0.000000
exp4535	2.68824537e-29	0.000000	0.000000	discard	cycle 23 u=0.0980	agent0	initial_cond	0	-0.000000
exp4536	2.68824537e-29	0.000000	0.000000	discard	cycle 23 u=0.0980	agent0	initial_cond	0	-0.000000
exp4537	2.68824537e-29	0.000000	0.000000	discard	cycle 23 u=0.0980	agent0	initial_cond	1	-0.000000
exp4538	0.00000000e+00	0.998999	1.000000	discard	K_frequency=1 boundary u=0.463	agent1	solver_param	0	-1.567655
exp4539	6.16758073e-29	0.000000	0.000000	discard	cycle 23 u=0.0980	agent0	initial_cond	0	-0.000000
exp4540	3.52142540e-22	0.000000	0.000000	discard	K_frequency=1 4th_branch phase=Ď€/2 amp=0.3	agent1	solver_param	0	0.000000
exp4541	6.16758073e-29	0.000000	0.000000	discard	cycle 23 u=0.0980	agent0	initial_cond	1	-0.000000
exp4542	0.00000000e+00	0.998999	1.000000	discard	K_frequency=2 boundary u=0.463	agent1	solver_param	1	-1.567655
exp4543	6.16758073e-29	0.000000	0.000000	discard	cycle 23 u=0.0980	agent0	initial_cond	0	-0.000000
exp4544	1.31357678e-23	0.000000	-0.000000	discard	K_frequency=2 4th_branch phase=Ď€/2 amp=0.3	agent1	solver_param	0	0.000000
exp4545	2.01926478e-29	0.000000	0.000000	discard	cycle 23 u=0.0980	agent0	initial_cond	0	0.000000
exp4546	0.00000000e+00	0.998999	1.000000	discard	K_frequency=3 boundary u=0.463	agent1	solver_param	0	-1.567655
exp4547	2.01926478e-29	0.000000	0.000000	discard	cycle 23 u=0.0980	agent0	initial_cond	1	0.000000
exp4548	8.34865632e-23	0.000000	-0.000000	discard	K_frequency=3 4th_branch phase=Ď€/2 amp=0.3	agent1	solver_param	1	0.000000
exp4549	2.01926478e-29	0.000000	0.000000	discard	cycle 23 u=0.0980	agent0	initial_cond	0	0.000000
exp4550	0.00000000e+00	0.998999	1.000000	discard	K_frequency=4 boundary u=0.463	agent1	solver_param	0	-1.567655
exp4551	1.30310780e-28	0.000000	0.000000	discard	cycle 23 u=0.0980	agent0	initial_cond	0	-0.000000
exp4552	6.66546336e-19	0.000000	0.000000	discard	K_frequency=4 4th_branch phase=Ď€/2 amp=0.3	agent1	solver_param	1	-0.000000
exp4553	1.30310780e-28	0.000000	0.000000	discard	cycle 23 u=0.0980	agent0	initial_cond	1	-0.000000
exp4554	0.00000000e+00	0.998999	1.000000	discard	K_amp=0.1 K_freq=1 boundary	agent1	solver_param	0	-1.567655
exp4555	1.30310780e-28	0.000000	0.000000	discard	cycle 23 u=0.0980	agent0	initial_cond	0	-0.000000
exp4556	0.00000000e+00	0.998999	1.000000	discard	K_amp=0.1 K_freq=2 boundary	agent1	solver_param	0	-1.567655
exp4557	5.45343271e-29	0.000000	0.000000	discard	cycle 23 u=0.0982	agent0	initial_cond	0	-0.000000
exp4558	0.00000000e+00	0.998999	1.000000	discard	K_amp=0.2 K_freq=1 boundary	agent1	solver_param	1	-1.567655
exp4559	5.45343271e-29	0.000000	0.000000	discard	cycle 23 u=0.0982	agent0	initial_cond	0	-0.000000
exp4560	0.00000000e+00	0.998999	1.000000	discard	K_amp=0.2 K_freq=2 boundary	agent1	solver_param	0	-1.567655
exp4561	5.45343271e-29	0.000000	0.000000	discard	cycle 23 u=0.0982	agent0	initial_cond	0	-0.000000
exp4562	0.00000000e+00	0.998999	1.000000	discard	K_amp=0.3 K_freq=1 boundary	agent1	solver_param	0	-1.567655
exp4563	1.23429977e-28	0.000000	0.000000	discard	cycle 23 u=0.0982	agent0	initial_cond	1	0.000000
exp4564	0.00000000e+00	0.998999	1.000000	discard	K_amp=0.3 K_freq=2 boundary	agent1	solver_param	0	-1.567655
exp4565	1.23429977e-28	0.000000	0.000000	discard	cycle 23 u=0.0982	agent0	initial_cond	0	0.000000
exp4566	0.00000000e+00	0.998999	1.000000	discard	K_amp=0.4 K_freq=1 boundary	agent1	solver_param	0	-1.567655
exp4567	1.23429977e-28	0.000000	0.000000	discard	cycle 23 u=0.0982	agent0	initial_cond	0	0.000000
exp4568	0.00000000e+00	0.998999	1.000000	discard	K_amp=0.4 K_freq=2 boundary	agent1	solver_param	1	-1.567655
exp4569	1.88036672e-29	0.000000	0.000000	discard	cycle 23 u=0.0982	agent0	initial_cond	1	0.000000
exp4570	2.20336133e-23	0.000000	0.000000	discard	K_frequency=2 mode=5 fourier=8	agent1	solver_param	0	-0.000000
exp4571	1.88036672e-29	0.000000	0.000000	discard	cycle 23 u=0.0982	agent0	initial_cond	0	0.000000
exp4572	2.78892897e-22	0.000000	0.000000	discard	K_frequency=2 mode=6 fourier=8	agent1	solver_param	0	0.000000
exp4573	1.88036672e-29	0.000000	0.000000	discard	cycle 23 u=0.0982	agent0	initial_cond	0	0.000000
exp4574	1.31357678e-23	0.000000	-0.000000	discard	K_frequency=2 mode=7 fourier=8	agent1	solver_param	1	0.000000
exp4575	1.91190259e-29	0.000000	-0.000000	discard	cycle 23 u=0.0982	agent0	initial_cond	0	0.000000
exp4576	1.89315446e-18	0.000000	0.000000	discard	K_frequency=2 mode=8 fourier=8	agent1	solver_param	0	0.000000
exp4577	1.91190259e-29	0.000000	-0.000000	discard	cycle 23 u=0.0982	agent0	initial_cond	0	0.000000
exp4578	9.00456430e-24	0.000000	0.000000	discard	K_frequency=2 mode=9 fourier=8	agent1	solver_param	0	0.000000
exp4579	1.91190259e-29	0.000000	-0.000000	discard	cycle 23 u=0.0982	agent0	initial_cond	1	0.000000
exp4580	6.13049994e-29	0.000000	0.000000	discard	cycle 23 u=0.0985	agent0	initial_cond	0	0.000000
exp4581	6.13049994e-29	0.000000	0.000000	discard	cycle 23 u=0.0985	agent0	initial_cond	0	0.000000
exp4582	6.13049994e-29	0.000000	0.000000	discard	cycle 23 u=0.0985	agent0	initial_cond	1	0.000000
exp4583	5.49750971e-29	0.000000	0.000000	discard	cycle 23 u=0.0985	agent0	initial_cond	0	0.000000
exp4584	5.49750971e-29	0.000000	0.000000	discard	cycle 23 u=0.0985	agent0	initial_cond	0	0.000000
exp4585	5.49750971e-29	0.000000	0.000000	discard	cycle 23 u=0.0985	agent0	initial_cond	1	0.000000
exp4586	4.15642452e-29	0.000000	0.000000	discard	cycle 23 u=0.0985	agent0	initial_cond	0	0.000000
exp4587	4.15642452e-29	0.000000	0.000000	discard	cycle 23 u=0.0985	agent0	initial_cond	0	0.000000
exp4588	4.15642452e-29	0.000000	0.000000	discard	cycle 23 u=0.0985	agent0	initial_cond	0	0.000000
exp4589	2.19292611e-29	0.000000	0.000000	discard	cycle 23 u=0.0985	agent0	initial_cond	0	-0.000000
exp4590	2.19292611e-29	0.000000	0.000000	discard	cycle 23 u=0.0985	agent0	initial_cond	1	-0.000000
exp4591	2.19292611e-29	0.000000	0.000000	discard	cycle 23 u=0.0985	agent0	initial_cond	0	-0.000000
exp4592	2.00148302e-16	1.001298	1.000025	discard	cycle 23 u=0.0990	agent0	initial_cond	0	-1.520921
exp4593	4.22491788e-29	0.000000	0.000000	discard	Fourier 2 n_mode=0	agent0	perturbation	1	-0.000000
exp4594	2.00148302e-16	1.001298	1.000025	discard	cycle 23 u=0.0990	agent0	initial_cond	1	-1.520921
exp4595	4.22491788e-29	0.000000	0.000000	discard	Fourier 2 n_mode=1	agent0	perturbation	0	-0.000000
exp4596	4.22491788e-29	0.000000	0.000000	discard	cycle 23 u=0.0990	agent0	initial_cond	0	-0.000000
exp4597	3.22245147e-29	0.000000	0.000000	discard	Fourier 2 n_mode=2	agent0	perturbation	0	0.000000
exp4598	3.22245147e-29	0.000000	0.000000	discard	cycle 23 u=0.0990	agent0	initial_cond	0	0.000000
exp4599	3.22245147e-29	0.000000	0.000000	discard	Fourier 2 n_mode=3	agent0	perturbation	0	0.000000
exp4599	3.22245147e-29	0.000000	0.000000	discard	cycle 23 u=0.0990	agent0	initial_cond	0	0.000000
exp4600	3.22245147e-29	0.000000	0.000000	discard	cycle 23 u=0.0990	agent0	initial_cond	0	0.000000
exp4601	4.50941488e-29	0.000000	-0.000000	discard	cycle 23 u=0.0990	agent0	initial_cond	1	0.000000
exp4602	4.50941488e-29	0.000000	-0.000000	discard	cycle 23 u=0.0990	agent0	initial_cond	0	0.000000
exp4603	4.50941488e-29	0.000000	-0.000000	discard	cycle 23 u=0.0990	agent0	initial_cond	0	0.000000
exp4604	4.88330883e-29	0.000000	-0.000000	discard	cycle 23 u=0.0990	agent0	initial_cond	1	0.000000
exp4605	4.88330883e-29	0.000000	-0.000000	discard	cycle 23 u=0.0990	agent0	initial_cond	0	0.000000
exp4606	4.88330883e-29	0.000000	-0.000000	discard	cycle 23 u=0.0990	agent0	initial_cond	0	0.000000
exp4607	5.74085541e-29	0.000000	-0.000000	discard	cycle 23 u=0.0995	agent0	initial_cond	1	0.000000
exp4608	5.74085541e-29	0.000000	-0.000000	discard	cycle 23 u=0.0995	agent0	initial_cond	0	0.000000
