exp_id	residual	solution_norm	solution_mean	status	description	agent	design	elapsed_s	solution_energy
exp3265	6.13049994e-29	0.000000	0.000000	discard	cycle 13 u=0.0985	agent0	initial_cond	0	0.000000
exp3266	6.13049994e-29	0.000000	0.000000	discard	cycle 13 u=0.0985	agent0	initial_cond	1	0.000000
exp3267	5.49750971e-29	0.000000	0.000000	discard	cycle 13 u=0.0985	agent0	initial_cond	0	0.000000
exp3268	5.49750971e-29	0.000000	0.000000	discard	cycle 13 u=0.0985	agent0	initial_cond	0	0.000000
exp3269	5.49750971e-29	0.000000	0.000000	discard	cycle 13 u=0.0985	agent0	initial_cond	1	0.000000
exp3270	1.34357540e-12	1.002503	1.000218	discard	cycle 13 u=0.0985	agent0	initial_cond	0	-1.523848
exp3271	1.34357540e-12	1.002503	1.000218	discard	FIXED config positive n=269	agent0	solver_param	0	-1.523848
exp3272	4.15642452e-29	0.000000	0.000000	discard	cycle 13 u=0.0985	agent0	initial_cond	0	0.000000
exp3273	4.15642452e-29	0.000000	0.000000	discard	cycle 13 u=0.0985	agent0	initial_cond	0	0.000000
exp3274	2.19292611e-29	0.000000	0.000000	discard	cycle 13 u=0.0985	agent0	initial_cond	0	-0.000000
exp3275	2.19292611e-29	0.000000	0.000000	discard	cycle 13 u=0.0985	agent0	initial_cond	1	-0.000000
exp3276	2.19292611e-29	0.000000	0.000000	discard	cycle 13 u=0.0985	agent0	initial_cond	0	-0.000000
exp3277	4.22491788e-29	0.000000	0.000000	discard	cycle 13 u=0.0990	agent0	initial_cond	0	-0.000000
exp3278	4.22491788e-29	0.000000	0.000000	discard	cycle 13 u=0.0990	agent0	initial_cond	1	-0.000000
exp3279	4.22491788e-29	0.000000	0.000000	discard	cycle 13 u=0.0990	agent0	initial_cond	0	-0.000000
exp3280	3.22245147e-29	0.000000	0.000000	discard	cycle 13 u=0.0990	agent0	initial_cond	1	0.000000
exp3281	3.22245147e-29	0.000000	0.000000	discard	cycle 13 u=0.0990	agent0	initial_cond	0	0.000000
exp3282	3.22245147e-29	0.000000	0.000000	discard	cycle 13 u=0.0990	agent0	initial_cond	0	0.000000
exp3283	4.50941488e-29	0.000000	-0.000000	discard	cycle 13 u=0.0990	agent0	initial_cond	1	0.000000
exp3284	4.50941488e-29	0.000000	-0.000000	discard	cycle 13 u=0.0990	agent0	initial_cond	0	0.000000
exp3285	4.50941488e-29	0.000000	-0.000000	discard	cycle 13 u=0.0990	agent0	initial_cond	0	0.000000
exp3286	4.88330883e-29	0.000000	-0.000000	discard	cycle 13 u=0.0990	agent0	initial_cond	0	0.000000
exp3287	4.88330883e-29	0.000000	-0.000000	discard	cycle 13 u=0.0990	agent0	initial_cond	0	0.000000
exp3288	4.88330883e-29	0.000000	-0.000000	discard	cycle 13 u=0.0990	agent0	initial_cond	1	0.000000
exp3289	5.74085541e-29	0.000000	-0.000000	discard	cycle 13 u=0.0995	agent0	initial_cond	0	0.000000
exp3290	5.74085541e-29	0.000000	-0.000000	discard	cycle 13 u=0.0995	agent0	initial_cond	0	0.000000
exp3291	5.74085541e-29	0.000000	-0.000000	discard	cycle 13 u=0.0995	agent0	initial_cond	1	0.000000
exp3292	1.54984578e-28	0.000000	0.000000	discard	cycle 13 u=0.0995	agent0	initial_cond	0	-0.000000
exp3293	1.54984578e-28	0.000000	0.000000	discard	cycle 13 u=0.0995	agent0	initial_cond	0	-0.000000
exp3294	1.54984578e-28	0.000000	0.000000	discard	cycle 13 u=0.0995	agent0	initial_cond	0	-0.000000
exp3295	1.60328418e-29	0.000000	-0.000000	discard	cycle 13 u=0.0995	agent0	initial_cond	0	-0.000000
exp3296	1.15589045e-14	1.001296	1.000019	discard	cycle 13 u=0.0995	agent0	initial_cond	1	-1.520844
exp3297	1.60328418e-29	0.000000	-0.000000	discard	Fourier pos modes=16 amp=0.5 tol=1e-12	agent0	solver_param	1	-0.000000
exp3298	6.04747797e-14	1.001296	1.000019	discard	cycle 13 u=0.0995	agent0	initial_cond	0	-1.520844
exp3299	7.34590618e-29	0.000000	0.000000	discard	Fourier pos modes=32 amp=0.5 tol=1e-12	agent0	solver_param	0	0.000000
exp3300	1.48482526e-13	1.001296	1.000019	discard	cycle 13 u=0.0995	agent0	initial_cond	0	-1.520844
exp3301	7.34590618e-29	0.000000	0.000000	discard	Fourier pos modes=48 amp=0.5 tol=1e-12	agent0	solver_param	1	0.000000
exp3302	3.77813934e-13	1.001296	1.000019	discard	cycle 13 u=0.0995	agent0	initial_cond	0	-1.520844
exp3303	7.34590618e-29	0.000000	0.000000	discard	Fourier pos modes=64 amp=0.5 tol=1e-12	agent0	solver_param	0	0.000000
exp3304	7.34590618e-29	0.000000	0.000000	discard	cycle 13 u=0.0995	agent0	initial_cond	0	0.000000
exp3305	4.46546993e-29	0.000000	0.000000	discard	cycle 13 u=0.1000	agent0	initial_cond	1	-0.000000
exp3306	4.46546993e-29	0.000000	0.000000	discard	cycle 13 u=0.1000	agent0	initial_cond	0	-0.000000
exp3307	4.46546993e-29	0.000000	0.000000	discard	cycle 13 u=0.1000	agent0	initial_cond	0	-0.000000
exp3308	4.08106752e-29	0.000000	0.000000	discard	cycle 13 u=0.1000	agent0	initial_cond	1	-0.000000
exp3309	4.08106752e-29	0.000000	0.000000	discard	cycle 13 u=0.1000	agent0	initial_cond	0	-0.000000
exp3310	4.08106752e-29	0.000000	0.000000	discard	cycle 13 u=0.1000	agent0	initial_cond	1	-0.000000
exp3311	4.58623706e-29	0.000000	0.000000	discard	cycle 13 u=0.1000	agent0	initial_cond	0	-0.000000
exp3312	4.58623706e-29	0.000000	0.000000	discard	cycle 13 u=0.1000	agent0	initial_cond	0	-0.000000
exp3313	4.58623706e-29	0.000000	0.000000	discard	cycle 13 u=0.1000	agent0	initial_cond	1	-0.000000
exp3314	4.39794337e-29	0.000000	0.000000	discard	cycle 13 u=0.1000	agent0	initial_cond	0	-0.000000
exp3315	4.39794337e-29	0.000000	0.000000	discard	cycle 13 u=0.1000	agent0	initial_cond	0	-0.000000
exp3316	4.39794337e-29	0.000000	0.000000	discard	cycle 13 u=0.1000	agent0	initial_cond	0	-0.000000
exp3317	1.36727475e-28	0.000000	0.000000	discard	cycle 13 u=0.1050	agent0	initial_cond	0	-0.000000
exp3318	1.36727475e-28	0.000000	0.000000	discard	cycle 13 u=0.1050	agent0	initial_cond	1	-0.000000
exp3319	1.36727475e-28	0.000000	0.000000	discard	cycle 13 u=0.1050	agent0	initial_cond	0	-0.000000
exp3320	6.14461376e-29	0.000000	0.000000	discard	cycle 13 u=0.1050	agent0	initial_cond	0	-0.000000
exp3321	6.14461376e-29	0.000000	0.000000	discard	cycle 13 u=0.1050	agent0	initial_cond	1	-0.000000
exp3322	6.14461376e-29	0.000000	0.000000	discard	cycle 13 u=0.1050	agent0	initial_cond	0	-0.000000
exp3323	1.75906666e-28	0.000000	0.000000	discard	cycle 13 u=0.1050	agent0	initial_cond	0	-0.000000
exp3324	1.75906666e-28	0.000000	0.000000	discard	cycle 13 u=0.1050	agent0	initial_cond	0	-0.000000
exp3325	1.75906666e-28	0.000000	0.000000	discard	cycle 13 u=0.1050	agent0	initial_cond	0	-0.000000
exp3326	1.11257917e-28	0.000000	0.000000	discard	cycle 13 u=0.1050	agent0	initial_cond	1	-0.000000
exp3327	1.11257917e-28	0.000000	0.000000	discard	cycle 13 u=0.1050	agent0	initial_cond	0	-0.000000
exp3328	6.04747797e-14	1.001296	1.000019	discard	cycle 13 u=0.1050	agent0	initial_cond	0	-1.520844
exp3329	6.04747797e-14	1.001296	1.000019	discard	Fourier atomic pos modes=32	agent0	solver_param	0	-1.520844
exp3330	8.58580947e-29	0.000000	0.000000	discard	cycle 14 u=0.0975	agent0	initial_cond	1	0.000000
exp3331	8.58580947e-29	0.000000	0.000000	discard	cycle 14 u=0.0975	agent0	initial_cond	0	0.000000
exp3332	8.58580947e-29	0.000000	0.000000	discard	cycle 14 u=0.0975	agent0	initial_cond	1	0.000000
exp3333	5.23962023e-29	0.000000	0.000000	discard	cycle 14 u=0.0975	agent0	initial_cond	0	0.000000
exp3334	5.23962023e-29	0.000000	0.000000	discard	cycle 14 u=0.0975	agent0	initial_cond	0	0.000000
exp3335	5.23962023e-29	0.000000	0.000000	discard	cycle 14 u=0.0975	agent0	initial_cond	1	0.000000
exp3336	4.03266298e-29	0.000000	0.000000	discard	cycle 14 u=0.0975	agent0	initial_cond	0	0.000000
exp3337	4.03266298e-29	0.000000	0.000000	discard	cycle 14 u=0.0975	agent0	initial_cond	0	0.000000
exp3338	4.03266298e-29	0.000000	0.000000	discard	cycle 14 u=0.0975	agent0	initial_cond	0	0.000000
exp3339	4.80015937e-29	0.000000	0.000000	discard	cycle 14 u=0.0975	agent0	initial_cond	0	0.000000
exp3340	4.80015937e-29	0.000000	0.000000	discard	cycle 14 u=0.0975	agent0	initial_cond	1	0.000000
exp3341	4.80015937e-29	0.000000	0.000000	discard	cycle 14 u=0.0975	agent0	initial_cond	0	0.000000
exp3342	2.68824537e-29	0.000000	0.000000	discard	cycle 14 u=0.0980	agent0	initial_cond	0	-0.000000
exp3343	2.68824537e-29	0.000000	0.000000	discard	cycle 14 u=0.0980	agent0	initial_cond	1	-0.000000
exp3344	2.68824537e-29	0.000000	0.000000	discard	cycle 14 u=0.0980	agent0	initial_cond	0	-0.000000
exp3345	6.16758073e-29	0.000000	0.000000	discard	cycle 14 u=0.0980	agent0	initial_cond	0	-0.000000
exp3346	6.16758073e-29	0.000000	0.000000	discard	cycle 14 u=0.0980	agent0	initial_cond	0	-0.000000
exp3347	6.16758073e-29	0.000000	0.000000	discard	cycle 14 u=0.0980	agent0	initial_cond	0	-0.000000
exp3348	2.01926478e-29	0.000000	0.000000	discard	cycle 14 u=0.0980	agent0	initial_cond	1	0.000000
exp3349	2.01926478e-29	0.000000	0.000000	discard	cycle 14 u=0.0980	agent0	initial_cond	0	0.000000
exp3350	2.01926478e-29	0.000000	0.000000	discard	cycle 14 u=0.0980	agent0	initial_cond	0	0.000000
exp3351	1.30310780e-28	0.000000	0.000000	discard	cycle 14 u=0.0980	agent0	initial_cond	1	-0.000000
exp3352	1.30310780e-28	0.000000	0.000000	discard	cycle 14 u=0.0980	agent0	initial_cond	0	-0.000000
exp3353	1.30310780e-28	0.000000	0.000000	discard	cycle 14 u=0.0980	agent0	initial_cond	1	-0.000000
exp3354	5.45343271e-29	0.000000	0.000000	discard	cycle 14 u=0.0982	agent0	initial_cond	0	-0.000000
exp3355	5.45343271e-29	0.000000	0.000000	discard	cycle 14 u=0.0982	agent0	initial_cond	0	-0.000000
exp3356	5.45343271e-29	0.000000	0.000000	discard	cycle 14 u=0.0982	agent0	initial_cond	1	-0.000000
exp3357	1.23429977e-28	0.000000	0.000000	discard	cycle 14 u=0.0982	agent0	initial_cond	0	0.000000
exp3358	1.23429977e-28	0.000000	0.000000	discard	cycle 14 u=0.0982	agent0	initial_cond	0	0.000000
exp3359	1.23429977e-28	0.000000	0.000000	discard	cycle 14 u=0.0982	agent0	initial_cond	0	0.000000
exp3360	1.88036672e-29	0.000000	0.000000	discard	cycle 14 u=0.0982	agent0	initial_cond	0	0.000000
exp3361	1.88036672e-29	0.000000	0.000000	discard	cycle 14 u=0.0982	agent0	initial_cond	1	0.000000
exp3362	2.27731282e-15	1.001296	1.000019	discard	cycle 14 u=0.0982	agent0	initial_cond	0	-1.520844
exp3363	2.27731282e-15	1.001296	1.000019	discard	Fourier sweep modes=8 amp=0.5	agent0	solver_param	0	-1.520844
exp3364	9.43218526e-15	1.001296	1.000019	discard	cycle 14 u=0.0982	agent0	initial_cond	0	-1.520844
exp3365	1.91190259e-29	0.000000	-0.000000	discard	Fourier sweep modes=12 amp=0.5	agent0	solver_param	0	0.000000
exp3366	1.15589045e-14	1.001296	1.000019	discard	cycle 14 u=0.0982	agent0	initial_cond	1	-1.520844
exp3367	1.91190259e-29	0.000000	-0.000000	discard	Fourier sweep modes=16 amp=0.5	agent0	solver_param	0	0.000000
exp3368	2.54083327e-14	1.001296	1.000019	discard	cycle 14 u=0.0982	agent0	initial_cond	0	-1.520844
exp3369	6.13049994e-29	0.000000	0.000000	discard	Fourier sweep modes=20 amp=0.5	agent0	solver_param	0	0.000000
exp3370	7.19787253e-14	1.001296	1.000019	discard	cycle 14 u=0.0985	agent0	initial_cond	0	-1.520844
exp3371	6.13049994e-29	0.000000	0.000000	discard	Fourier sweep modes=24 amp=0.5	agent0	solver_param	1	0.000000
exp3372	6.13049994e-29	0.000000	0.000000	discard	cycle 14 u=0.0985	agent0	initial_cond	0	0.000000
exp3373	6.13049994e-29	0.000000	0.000000	discard	Fourier sweep modes=28 amp=0.5	agent0	solver_param	0	0.000000
exp3374	6.13049994e-29	0.000000	0.000000	discard	cycle 14 u=0.0985	agent0	initial_cond	0	0.000000
exp3375	5.49750971e-29	0.000000	0.000000	discard	Fourier sweep modes=32 amp=0.5	agent0	solver_param	1	0.000000
exp3375	5.49750971e-29	0.000000	0.000000	discard	cycle 14 u=0.0985	agent0	initial_cond	1	0.000000
exp3376	1.25621924e-13	1.001296	1.000019	discard	cycle 14 u=0.0985	agent0	initial_cond	0	-1.520844
exp3376	1.25621924e-13	1.001296	1.000019	discard	Fourier sweep modes=40 amp=0.5	agent0	solver_param	0	-1.520844
exp3377	1.48482526e-13	1.001296	1.000019	discard	cycle 14 u=0.0985	agent0	initial_cond	0	-1.520844
exp3378	1.48482526e-13	1.001296	1.000019	discard	Fourier sweep modes=48 amp=0.5	agent0	solver_param	0	-1.520844
exp3379	3.25346574e-13	1.001296	1.000019	discard	cycle 14 u=0.0985	agent0	initial_cond	1	-1.520844
exp3380	4.15642452e-29	0.000000	0.000000	discard	Fourier sweep modes=56 amp=0.5	agent0	solver_param	0	0.000000
exp3381	3.77813934e-13	1.001296	1.000019	discard	cycle 14 u=0.0985	agent0	initial_cond	0	-1.520844
exp3382	4.15642452e-29	0.000000	0.000000	discard	Fourier sweep modes=64 amp=0.5	agent0	solver_param	0	0.000000
exp3383	4.15642452e-29	0.000000	0.000000	discard	cycle 14 u=0.0985	agent0	initial_cond	1	0.000000
exp3384	2.19292611e-29	0.000000	0.000000	discard	cycle 14 u=0.0985	agent0	initial_cond	0	-0.000000
exp3385	2.19292611e-29	0.000000	0.000000	discard	cycle 14 u=0.0985	agent0	initial_cond	0	-0.000000
exp3386	2.19292611e-29	0.000000	0.000000	discard	cycle 14 u=0.0985	agent0	initial_cond	1	-0.000000
exp3387	4.22491788e-29	0.000000	0.000000	discard	cycle 14 u=0.0990	agent0	initial_cond	0	-0.000000
exp3388	4.22491788e-29	0.000000	0.000000	discard	cycle 14 u=0.0990	agent0	initial_cond	0	-0.000000
exp3389	4.22491788e-29	0.000000	0.000000	discard	cycle 14 u=0.0990	agent0	initial_cond	0	-0.000000
exp3390	3.22245147e-29	0.000000	0.000000	discard	cycle 14 u=0.0990	agent0	initial_cond	0	0.000000
exp3391	3.22245147e-29	0.000000	0.000000	discard	cycle 14 u=0.0990	agent0	initial_cond	1	0.000000
exp3392	3.22245147e-29	0.000000	0.000000	discard	cycle 14 u=0.0990	agent0	initial_cond	0	0.000000
exp3393	4.50941488e-29	0.000000	-0.000000	discard	cycle 14 u=0.0990	agent0	initial_cond	0	0.000000
exp3394	4.50941488e-29	0.000000	-0.000000	discard	cycle 14 u=0.0990	agent0	initial_cond	1	0.000000
exp3395	4.50941488e-29	0.000000	-0.000000	discard	cycle 14 u=0.0990	agent0	initial_cond	0	0.000000
exp3396	4.88330883e-29	0.000000	-0.000000	discard	cycle 14 u=0.0990	agent0	initial_cond	1	0.000000
exp3397	4.88330883e-29	0.000000	-0.000000	discard	cycle 14 u=0.0990	agent0	initial_cond	0	0.000000
exp3398	4.88330883e-29	0.000000	-0.000000	discard	cycle 14 u=0.0990	agent0	initial_cond	0	0.000000
exp3399	5.74085541e-29	0.000000	-0.000000	discard	cycle 14 u=0.0995	agent0	initial_cond	1	0.000000
exp3400	5.74085541e-29	0.000000	-0.000000	discard	cycle 14 u=0.0995	agent0	initial_cond	0	0.000000
exp3401	5.74085541e-29	0.000000	-0.000000	discard	cycle 14 u=0.0995	agent0	initial_cond	0	0.000000
exp3402	1.54984578e-28	0.000000	0.000000	discard	cycle 14 u=0.0995	agent0	initial_cond	0	-0.000000
exp3403	1.54984578e-28	0.000000	0.000000	discard	cycle 14 u=0.0995	agent0	initial_cond	0	-0.000000
exp3404	1.54984578e-28	0.000000	0.000000	discard	cycle 14 u=0.0995	agent0	initial_cond	1	-0.000000
exp3405	1.60328418e-29	0.000000	-0.000000	discard	cycle 14 u=0.0995	agent0	initial_cond	0	-0.000000
exp3406	1.60328418e-29	0.000000	-0.000000	discard	cycle 14 u=0.0995	agent0	initial_cond	0	-0.000000
exp3407	1.60328418e-29	0.000000	-0.000000	discard	cycle 14 u=0.0995	agent0	initial_cond	1	-0.000000
exp3408	7.34590618e-29	0.000000	0.000000	discard	cycle 14 u=0.0995	agent0	initial_cond	0	0.000000
exp3409	7.34590618e-29	0.000000	0.000000	discard	cycle 14 u=0.0995	agent0	initial_cond	1	0.000000
exp3410	7.34590618e-29	0.000000	0.000000	discard	cycle 14 u=0.0995	agent0	initial_cond	0	0.000000
exp3411	4.46546993e-29	0.000000	0.000000	discard	cycle 14 u=0.1000	agent0	initial_cond	0	-0.000000
exp3412	2.27731282e-15	1.001296	1.000019	discard	cycle 14 u=0.1000	agent0	initial_cond	1	-1.520844
exp3413	4.46546993e-29	0.000000	0.000000	discard	Fourier 8 modes newton_tol=1.0e-14	agent0	solver_param	0	-0.000000
exp3414	4.08106752e-29	0.000000	0.000000	discard	Fourier 8 modes newton_tol=1.0e-13	agent0	solver_param	0	-0.000000
exp3414	4.08106752e-29	0.000000	0.000000	discard	cycle 14 u=0.1000	agent0	initial_cond	0	-0.000000
exp3415	2.27731282e-15	1.001296	1.000019	discard	cycle 14 u=0.1000	agent0	initial_cond	1	-1.520844
exp3415	2.27731282e-15	1.001296	1.000019	discard	Fourier 8 modes newton_tol=1.0e-12	agent0	solver_param	1	-1.520844
exp3416	2.27731282e-15	1.001296	1.000019	discard	cycle 14 u=0.1000	agent0	initial_cond	0	-1.520844
exp3417	2.27731282e-15	1.001296	1.000019	discard	Fourier 8 modes newton_tol=1.0e-11	agent0	solver_param	0	-1.520844
exp3418	2.27731282e-15	1.001296	1.000019	discard	cycle 14 u=0.1000	agent0	initial_cond	1	-1.520844
exp3419	4.58623706e-29	0.000000	0.000000	discard	Fourier 8 modes newton_tol=1.0e-10	agent0	solver_param	1	-0.000000
exp3420	4.58623706e-29	0.000000	0.000000	discard	cycle 14 u=0.1000	agent0	initial_cond	0	-0.000000
exp3421	4.58623706e-29	0.000000	0.000000	discard	cycle 14 u=0.1000	agent0	initial_cond	0	-0.000000
exp3422	4.39794337e-29	0.000000	0.000000	discard	cycle 14 u=0.1000	agent0	initial_cond	1	-0.000000
exp3423	4.39794337e-29	0.000000	0.000000	discard	cycle 14 u=0.1000	agent0	initial_cond	0	-0.000000
exp3424	4.39794337e-29	0.000000	0.000000	discard	cycle 14 u=0.1000	agent0	initial_cond	0	-0.000000
exp3425	1.36217862e-24	0.000000	0.000000	discard	phase=° amp=0.5 u=0 mode=1 fourier=4 tol=1e-9	agent1	branch_search	1	0.000000
exp3426	1.36727475e-28	0.000000	0.000000	discard	cycle 14 u=0.1050	agent0	initial_cond	0	-0.000000
exp3427	5.27944690e-17	0.117042	0.000000	discard	phase=° amp=0.5 u=0 mode=1 fourier=4 tol=1e-9	agent1	branch_search	0	0.001086
exp3428	1.36727475e-28	0.000000	0.000000	discard	cycle 14 u=0.1050	agent0	initial_cond	0	-0.000000
exp3429	5.52029874e-17	0.117042	0.000000	discard	phase=° amp=0.5 u=0 mode=1 fourier=4 tol=1e-9	agent1	branch_search	0	0.001086
exp3430	1.36727475e-28	0.000000	0.000000	discard	cycle 14 u=0.1050	agent0	initial_cond	1	-0.000000
exp3431	5.54176032e-17	0.117042	0.000000	discard	phase=° amp=0.5 u=0 mode=1 fourier=4 tol=1e-9	agent1	branch_search	1	0.001086
exp3432	6.14461376e-29	0.000000	0.000000	discard	cycle 14 u=0.1050	agent0	initial_cond	0	-0.000000
exp3433	4.77339643e-17	0.117042	-0.000000	discard	phase=° amp=0.5 u=0 mode=1 fourier=4 tol=1e-9	agent1	branch_search	0	0.001086
exp3434	6.14461376e-29	0.000000	0.000000	discard	cycle 14 u=0.1050	agent0	initial_cond	0	-0.000000
exp3435	2.60869318e-24	0.000000	-0.000000	discard	phase=° amp=0.5 u=0 mode=1 fourier=4 tol=1e-9	agent1	branch_search	1	0.000000
exp3436	6.14461376e-29	0.000000	0.000000	discard	cycle 14 u=0.1050	agent0	initial_cond	1	-0.000000
exp3437	4.57366107e-17	0.117042	-0.000000	discard	phase=° amp=0.5 u=0 mode=1 fourier=4 tol=1e-9	agent1	branch_search	0	0.001086
exp3438	1.75906666e-28	0.000000	0.000000	discard	cycle 14 u=0.1050	agent0	initial_cond	0	-0.000000
exp3439	6.23895877e-17	0.117042	-0.000000	discard	phase=° amp=0.5 u=0 mode=1 fourier=4 tol=1e-9	agent1	branch_search	0	0.001086
exp3440	1.75906666e-28	0.000000	0.000000	discard	cycle 14 u=0.1050	agent0	initial_cond	1	-0.000000
exp3441	7.21226231e-17	0.117042	0.000000	discard	phase=° amp=0.5 u=0 mode=1 fourier=4 tol=1e-9	agent1	branch_search	1	0.001086
exp3442	1.75906666e-28	0.000000	0.000000	discard	cycle 14 u=0.1050	agent0	initial_cond	0	-0.000000
exp3443	6.68546232e-17	0.117042	0.000000	discard	phase=° amp=0.5 u=0 mode=1 fourier=4 tol=1e-9	agent1	branch_search	0	0.001086
exp3444	1.11257917e-28	0.000000	0.000000	discard	cycle 14 u=0.1050	agent0	initial_cond	0	-0.000000
exp3445	1.11257917e-28	0.000000	0.000000	discard	cycle 14 u=0.1050	agent0	initial_cond	1	-0.000000
exp3446	1.11257917e-28	0.000000	0.000000	discard	cycle 14 u=0.1050	agent0	initial_cond	0	-0.000000
exp3447	8.58580947e-29	0.000000	0.000000	discard	cycle 15 u=0.0975	agent0	initial_cond	0	0.000000
exp3448	8.58580947e-29	0.000000	0.000000	discard	cycle 15 u=0.0975	agent0	initial_cond	0	0.000000
exp3449	8.58580947e-29	0.000000	0.000000	discard	cycle 15 u=0.0975	agent0	initial_cond	0	0.000000
exp3450	5.23962023e-29	0.000000	0.000000	discard	cycle 15 u=0.0975	agent0	initial_cond	1	0.000000
exp3451	5.23962023e-29	0.000000	0.000000	discard	cycle 15 u=0.0975	agent0	initial_cond	0	0.000000
exp3452	5.23962023e-29	0.000000	0.000000	discard	cycle 15 u=0.0975	agent0	initial_cond	0	0.000000
exp3453	4.03266298e-29	0.000000	0.000000	discard	cycle 15 u=0.0975	agent0	initial_cond	1	0.000000
exp3454	4.03266298e-29	0.000000	0.000000	discard	cycle 15 u=0.0975	agent0	initial_cond	0	0.000000
exp3455	4.03266298e-29	0.000000	0.000000	discard	cycle 15 u=0.0975	agent0	initial_cond	1	0.000000
exp3456	2.33728875e-15	1.001296	-1.000019	discard	cycle 15 u=0.0975	agent0	initial_cond	0	-1.520844
exp3456	2.33728875e-15	1.001296	-1.000019	discard	Fourier neg u=-1.0 8 modes	agent0	branch_search	0	-1.520844
exp3457	4.80015937e-29	0.000000	0.000000	discard	cycle 15 u=0.0975	agent0	initial_cond	0	0.000000
exp3458	4.80015937e-29	0.000000	0.000000	discard	cycle 15 u=0.0975	agent0	initial_cond	0	0.000000
exp3459	2.68824537e-29	0.000000	0.000000	discard	cycle 15 u=0.0980	agent0	initial_cond	0	-0.000000
exp3460	2.68824537e-29	0.000000	0.000000	discard	cycle 15 u=0.0980	agent0	initial_cond	1	-0.000000
exp3461	2.68824537e-29	0.000000	0.000000	discard	cycle 15 u=0.0980	agent0	initial_cond	0	-0.000000
exp3462	6.16758073e-29	0.000000	0.000000	discard	cycle 15 u=0.0980	agent0	initial_cond	0	-0.000000
exp3463	6.16758073e-29	0.000000	0.000000	discard	cycle 15 u=0.0980	agent0	initial_cond	0	-0.000000
exp3464	3.87261605e-17	0.070535	-0.000000	discard	phase=90Â° amp=0.30 u=0 mode=1 fourier=4 tol=1e-9	agent1	perturbation	0	0.000099
exp3465	6.16758073e-29	0.000000	0.000000	discard	cycle 15 u=0.0980	agent0	initial_cond	0	-0.000000
exp3466	5.19865099e-17	0.082217	0.000000	discard	phase=90Â° amp=0.35 u=0 mode=1 fourier=4 tol=1e-9	agent1	perturbation	0	0.000216
exp3467	2.01926478e-29	0.000000	0.000000	discard	cycle 15 u=0.0980	agent0	initial_cond	1	0.000000
exp3468	1.46236839e-16	0.093865	0.000000	discard	phase=90Â° amp=0.40 u=0 mode=1 fourier=4 tol=1e-9	agent1	perturbation	1	0.000405
exp3469	2.01926478e-29	0.000000	0.000000	discard	cycle 15 u=0.0980	agent0	initial_cond	0	0.000000
exp3470	1.07126622e-16	0.105475	-0.000000	discard	phase=90Â° amp=0.45 u=0 mode=1 fourier=4 tol=1e-9	agent1	perturbation	0	0.000687
exp3471	2.01926478e-29	0.000000	0.000000	discard	cycle 15 u=0.0980	agent0	initial_cond	0	0.000000
exp3472	1.24769788e-16	0.117042	-0.000000	discard	phase=90Â° amp=0.50 u=0 mode=1 fourier=4 tol=1e-9	agent1	perturbation	1	0.001086
