exp_id	residual	solution_norm	solution_mean	status	description	agent	design	elapsed_s	solution_energy
exp5366	2.00148302e-16	1.001298	1.000025	discard	cycle 29 u=0.0980	agent0	initial_cond	0	-1.520921
exp5366	2.00148302e-16	1.001298	1.000025	discard	batch trial 41	agent0	solver_param	0	-1.520921
exp5367	2.00148302e-16	1.001298	1.000025	discard	cycle 29 u=0.0980	agent0	initial_cond	1	-1.520921
exp5367	2.00148302e-16	1.001298	1.000025	discard	batch trial 42	agent0	solver_param	1	-1.520921
exp5368	2.00148302e-16	1.001298	1.000025	discard	cycle 29 u=0.0980	agent0	initial_cond	0	-1.520921
exp5369	2.00148302e-16	1.001298	1.000025	discard	batch trial 43	agent0	solver_param	0	-1.520921
exp5370	2.00148302e-16	1.001298	1.000025	discard	cycle 29 u=0.0980	agent0	initial_cond	0	-1.520921
exp5371	1.30310780e-28	0.000000	0.000000	discard	batch trial 44	agent0	solver_param	1	-0.000000
exp5372	2.00148302e-16	1.001298	1.000025	discard	cycle 29 u=0.0980	agent0	initial_cond	0	-1.520921
exp5373	1.30310780e-28	0.000000	0.000000	discard	batch trial 45	agent0	solver_param	0	-0.000000
exp5374	2.00148302e-16	1.001298	1.000025	discard	cycle 29 u=0.0980	agent0	initial_cond	0	-1.520921
exp5375	5.45343271e-29	0.000000	0.000000	discard	batch trial 46	agent0	solver_param	0	-0.000000
exp5376	2.00148302e-16	1.001298	1.000025	discard	cycle 29 u=0.0982	agent0	initial_cond	1	-1.520921
exp5377	5.45343271e-29	0.000000	0.000000	discard	batch trial 47	agent0	solver_param	0	-0.000000
exp5378	5.45343271e-29	0.000000	0.000000	discard	cycle 29 u=0.0982	agent0	initial_cond	0	-0.000000
exp5379	5.45343271e-29	0.000000	0.000000	discard	batch trial 48	agent0	solver_param	0	-0.000000
exp5380	5.45343271e-29	0.000000	0.000000	discard	cycle 29 u=0.0982	agent0	initial_cond	0	-0.000000
exp5381	1.23429977e-28	0.000000	0.000000	discard	batch trial 49	agent0	solver_param	1	0.000000
exp5381	1.23429977e-28	0.000000	0.000000	discard	cycle 29 u=0.0982	agent0	initial_cond	1	0.000000
exp5382	1.23429977e-28	0.000000	0.000000	discard	cycle 29 u=0.0982	agent0	initial_cond	0	0.000000
exp5382	1.23429977e-28	0.000000	0.000000	discard	batch trial 50	agent0	solver_param	0	0.000000
exp5383	1.23429977e-28	0.000000	0.000000	discard	cycle 29 u=0.0982	agent0	initial_cond	0	0.000000
exp5384	1.88036672e-29	0.000000	0.000000	discard	cycle 29 u=0.0982	agent0	initial_cond	0	0.000000
exp5385	1.88036672e-29	0.000000	0.000000	discard	cycle 29 u=0.0982	agent0	initial_cond	0	0.000000
exp5386	1.88036672e-29	0.000000	0.000000	discard	cycle 29 u=0.0982	agent0	initial_cond	1	0.000000
exp5387	1.91190259e-29	0.000000	-0.000000	discard	cycle 29 u=0.0982	agent0	initial_cond	0	0.000000
exp5388	1.91190259e-29	0.000000	-0.000000	discard	cycle 29 u=0.0982	agent0	initial_cond	0	0.000000
exp5389	1.91190259e-29	0.000000	-0.000000	discard	cycle 29 u=0.0982	agent0	initial_cond	1	0.000000
exp5390	6.13049994e-29	0.000000	0.000000	discard	cycle 29 u=0.0985	agent0	initial_cond	0	0.000000
exp5391	6.13049994e-29	0.000000	0.000000	discard	cycle 29 u=0.0985	agent0	initial_cond	0	0.000000
exp5392	6.13049994e-29	0.000000	0.000000	discard	cycle 29 u=0.0985	agent0	initial_cond	0	0.000000
exp5393	5.49750971e-29	0.000000	0.000000	discard	cycle 29 u=0.0985	agent0	initial_cond	0	0.000000
exp5394	5.49750971e-29	0.000000	0.000000	discard	cycle 29 u=0.0985	agent0	initial_cond	1	0.000000
exp5395	5.49750971e-29	0.000000	0.000000	discard	cycle 29 u=0.0985	agent0	initial_cond	0	0.000000
exp5396	4.15642452e-29	0.000000	0.000000	discard	cycle 29 u=0.0985	agent0	initial_cond	0	0.000000
exp5397	4.15642452e-29	0.000000	0.000000	discard	cycle 29 u=0.0985	agent0	initial_cond	1	0.000000
exp5398	4.15642452e-29	0.000000	0.000000	discard	cycle 29 u=0.0985	agent0	initial_cond	0	0.000000
exp5399	2.19292611e-29	0.000000	0.000000	discard	cycle 29 u=0.0985	agent0	initial_cond	0	-0.000000
exp5400	2.19292611e-29	0.000000	0.000000	discard	cycle 29 u=0.0985	agent0	initial_cond	0	-0.000000
exp5401	2.19292611e-29	0.000000	0.000000	discard	cycle 29 u=0.0985	agent0	initial_cond	0	-0.000000
exp5402	4.22491788e-29	0.000000	0.000000	discard	cycle 29 u=0.0990	agent0	initial_cond	1	-0.000000
exp5403	4.22491788e-29	0.000000	0.000000	discard	cycle 29 u=0.0990	agent0	initial_cond	0	-0.000000
exp5404	4.22491788e-29	0.000000	0.000000	discard	cycle 29 u=0.0990	agent0	initial_cond	0	-0.000000
exp5405	3.22245147e-29	0.000000	0.000000	discard	cycle 29 u=0.0990	agent0	initial_cond	1	0.000000
exp5406	3.22245147e-29	0.000000	0.000000	discard	cycle 29 u=0.0990	agent0	initial_cond	0	0.000000
exp5407	3.22245147e-29	0.000000	0.000000	discard	cycle 29 u=0.0990	agent0	initial_cond	0	0.000000
exp5408	4.50941488e-29	0.000000	-0.000000	discard	cycle 29 u=0.0990	agent0	initial_cond	1	0.000000
exp5409	4.50941488e-29	0.000000	-0.000000	discard	cycle 29 u=0.0990	agent0	initial_cond	0	0.000000
exp5410	4.50941488e-29	0.000000	-0.000000	discard	cycle 29 u=0.0990	agent0	initial_cond	1	0.000000
exp5411	4.88330883e-29	0.000000	-0.000000	discard	cycle 29 u=0.0990	agent0	initial_cond	0	0.000000
exp5412	4.88330883e-29	0.000000	-0.000000	discard	cycle 29 u=0.0990	agent0	initial_cond	0	0.000000
exp5413	4.88330883e-29	0.000000	-0.000000	discard	cycle 29 u=0.0990	agent0	initial_cond	1	0.000000
exp5414	5.74085541e-29	0.000000	-0.000000	discard	cycle 29 u=0.0995	agent0	initial_cond	0	0.000000
exp5415	5.74085541e-29	0.000000	-0.000000	discard	cycle 29 u=0.0995	agent0	initial_cond	0	0.000000
exp5416	5.74085541e-29	0.000000	-0.000000	discard	cycle 29 u=0.0995	agent0	initial_cond	1	0.000000
exp5417	1.54984578e-28	0.000000	0.000000	discard	cycle 29 u=0.0995	agent0	initial_cond	0	-0.000000
exp5418	1.54984578e-28	0.000000	0.000000	discard	cycle 29 u=0.0995	agent0	initial_cond	1	-0.000000
exp5419	1.54984578e-28	0.000000	0.000000	discard	cycle 29 u=0.0995	agent0	initial_cond	0	-0.000000
exp5420	1.60328418e-29	0.000000	-0.000000	discard	cycle 29 u=0.0995	agent0	initial_cond	0	-0.000000
exp5421	1.60328418e-29	0.000000	-0.000000	discard	cycle 29 u=0.0995	agent0	initial_cond	1	-0.000000
exp5422	1.60328418e-29	0.000000	-0.000000	discard	cycle 29 u=0.0995	agent0	initial_cond	0	-0.000000
exp5423	7.34590618e-29	0.000000	0.000000	discard	cycle 29 u=0.0995	agent0	initial_cond	0	0.000000
exp5424	7.34590618e-29	0.000000	0.000000	discard	cycle 29 u=0.0995	agent0	initial_cond	1	0.000000
exp5425	7.34590618e-29	0.000000	0.000000	discard	cycle 29 u=0.0995	agent0	initial_cond	0	0.000000
exp5426	4.46546993e-29	0.000000	0.000000	discard	cycle 29 u=0.1000	agent0	initial_cond	1	-0.000000
exp5427	4.46546993e-29	0.000000	0.000000	discard	cycle 29 u=0.1000	agent0	initial_cond	0	-0.000000
exp5428	4.46546993e-29	0.000000	0.000000	discard	cycle 29 u=0.1000	agent0	initial_cond	0	-0.000000
exp5429	4.08106752e-29	0.000000	0.000000	discard	cycle 29 u=0.1000	agent0	initial_cond	1	-0.000000
exp5430	4.08106752e-29	0.000000	0.000000	discard	cycle 29 u=0.1000	agent0	initial_cond	0	-0.000000
exp5431	4.08106752e-29	0.000000	0.000000	discard	cycle 29 u=0.1000	agent0	initial_cond	0	-0.000000
exp5432	4.58623706e-29	0.000000	0.000000	discard	cycle 29 u=0.1000	agent0	initial_cond	1	-0.000000
exp5433	4.58623706e-29	0.000000	0.000000	discard	cycle 29 u=0.1000	agent0	initial_cond	0	-0.000000
exp5434	4.58623706e-29	0.000000	0.000000	discard	cycle 29 u=0.1000	agent0	initial_cond	0	-0.000000
exp5435	4.39794337e-29	0.000000	0.000000	discard	cycle 29 u=0.1000	agent0	initial_cond	0	-0.000000
exp5436	4.39794337e-29	0.000000	0.000000	discard	cycle 29 u=0.1000	agent0	initial_cond	0	-0.000000
exp5437	4.39794337e-29	0.000000	0.000000	discard	cycle 29 u=0.1000	agent0	initial_cond	1	-0.000000
exp5438	1.36727475e-28	0.000000	0.000000	discard	cycle 29 u=0.1050	agent0	initial_cond	0	-0.000000
exp5439	1.36727475e-28	0.000000	0.000000	discard	cycle 29 u=0.1050	agent0	initial_cond	0	-0.000000
exp5440	1.36727475e-28	0.000000	0.000000	discard	cycle 29 u=0.1050	agent0	initial_cond	1	-0.000000
exp5441	6.14461376e-29	0.000000	0.000000	discard	cycle 29 u=0.1050	agent0	initial_cond	0	-0.000000
exp5442	6.14461376e-29	0.000000	0.000000	discard	cycle 29 u=0.1050	agent0	initial_cond	0	-0.000000
exp5443	6.14461376e-29	0.000000	0.000000	discard	cycle 29 u=0.1050	agent0	initial_cond	0	-0.000000
exp5444	1.75906666e-28	0.000000	0.000000	discard	cycle 29 u=0.1050	agent0	initial_cond	0	-0.000000
exp5445	1.75906666e-28	0.000000	0.000000	discard	cycle 29 u=0.1050	agent0	initial_cond	1	-0.000000
exp5446	1.75906666e-28	0.000000	0.000000	discard	cycle 29 u=0.1050	agent0	initial_cond	0	-0.000000
exp5447	1.11257917e-28	0.000000	0.000000	discard	cycle 29 u=0.1050	agent0	initial_cond	0	-0.000000
exp5448	1.11257917e-28	0.000000	0.000000	discard	cycle 29 u=0.1050	agent0	initial_cond	1	-0.000000
exp5449	1.11257917e-28	0.000000	0.000000	discard	cycle 29 u=0.1050	agent0	initial_cond	0	-0.000000
exp5450	8.58580947e-29	0.000000	0.000000	discard	cycle 30 u=0.0975	agent0	initial_cond	0	0.000000
exp5451	8.58580947e-29	0.000000	0.000000	discard	cycle 30 u=0.0975	agent0	initial_cond	0	0.000000
exp5452	8.58580947e-29	0.000000	0.000000	discard	cycle 30 u=0.0975	agent0	initial_cond	0	0.000000
exp5453	5.23962023e-29	0.000000	0.000000	discard	Fourier neg modes=2 r1	agent0	solver_param	1	0.000000
exp5453	5.23962023e-29	0.000000	0.000000	discard	cycle 30 u=0.0975	agent0	initial_cond	1	0.000000
exp5454	2.00148302e-16	1.001298	-1.000025	discard	cycle 30 u=0.0975	agent0	initial_cond	0	-1.520921
exp5454	2.00148302e-16	1.001298	-1.000025	discard	Fourier neg modes=2 r2	agent0	solver_param	0	-1.520921
exp5455	3.37042680e-16	1.001296	-1.000019	discard	cycle 30 u=0.0975	agent0	initial_cond	0	-1.520844
exp5456	3.37042680e-16	1.001296	-1.000019	discard	Fourier neg modes=3 r1	agent0	solver_param	0	-1.520844
exp5457	1.97399031e-15	1.001296	-1.000019	discard	cycle 30 u=0.0975	agent0	initial_cond	1	-1.520844
exp5458	4.03266298e-29	0.000000	0.000000	discard	Fourier neg modes=4 r1	agent0	solver_param	0	0.000000
exp5459	1.97399031e-15	1.001296	-1.000019	discard	cycle 30 u=0.0975	agent0	initial_cond	0	-1.520844
exp5460	4.03266298e-29	0.000000	0.000000	discard	Fourier neg modes=4 r2	agent0	solver_param	0	0.000000
exp5461	1.97399031e-15	1.001296	-1.000019	discard	cycle 30 u=0.0975	agent0	initial_cond	0	-1.520844
exp5462	4.80015937e-29	0.000000	0.000000	discard	Fourier neg modes=4 r3	agent0	solver_param	1	0.000000
exp5463	1.97399031e-15	1.001296	-1.000019	discard	cycle 30 u=0.0975	agent0	initial_cond	0	-1.520844
exp5464	4.80015937e-29	0.000000	0.000000	discard	Fourier neg modes=4 r4	agent0	solver_param	0	0.000000
exp5465	1.97399031e-15	1.001296	-1.000019	discard	cycle 30 u=0.0975	agent0	initial_cond	0	-1.520844
exp5466	4.80015937e-29	0.000000	0.000000	discard	Fourier neg modes=4 r5	agent0	solver_param	0	0.000000
exp5467	4.80015937e-29	0.000000	0.000000	discard	cycle 30 u=0.0975	agent0	initial_cond	1	0.000000
exp5468	2.68824537e-29	0.000000	0.000000	discard	Fourier neg modes=6 r1	agent0	solver_param	0	-0.000000
exp5469	2.68824537e-29	0.000000	0.000000	discard	cycle 30 u=0.0980	agent0	initial_cond	0	-0.000000
exp5470	2.68824537e-29	0.000000	0.000000	discard	Fourier neg modes=6 r2	agent0	solver_param	0	-0.000000
exp5470	2.68824537e-29	0.000000	0.000000	discard	cycle 30 u=0.0980	agent0	initial_cond	0	-0.000000
exp5471	2.46346119e-15	1.001296	-1.000019	discard	cycle 30 u=0.0980	agent0	initial_cond	1	-1.520844
exp5471	2.46346119e-15	1.001296	-1.000019	discard	Fourier neg modes=6 r3	agent0	solver_param	1	-1.520844
exp5472	2.33728875e-15	1.001296	-1.000019	discard	cycle 30 u=0.0980	agent0	initial_cond	0	-1.520844
exp5473	2.33728875e-15	1.001296	-1.000019	discard	Fourier neg modes=8 r1	agent0	solver_param	0	-1.520844
exp5474	6.16758073e-29	0.000000	0.000000	discard	cycle 30 u=0.0980	agent0	initial_cond	0	-0.000000
exp5475	6.16758073e-29	0.000000	0.000000	discard	cycle 30 u=0.0980	agent0	initial_cond	0	-0.000000
exp5476	2.01926478e-29	0.000000	0.000000	discard	cycle 30 u=0.0980	agent0	initial_cond	0	0.000000
exp5477	2.01926478e-29	0.000000	0.000000	discard	cycle 30 u=0.0980	agent0	initial_cond	1	0.000000
exp5478	2.01926478e-29	0.000000	0.000000	discard	cycle 30 u=0.0980	agent0	initial_cond	0	0.000000
exp5479	1.30310780e-28	0.000000	0.000000	discard	cycle 30 u=0.0980	agent0	initial_cond	0	-0.000000
exp5480	1.30310780e-28	0.000000	0.000000	discard	cycle 30 u=0.0980	agent0	initial_cond	1	-0.000000
exp5481	1.30310780e-28	0.000000	0.000000	discard	cycle 30 u=0.0980	agent0	initial_cond	0	-0.000000
exp5482	5.45343271e-29	0.000000	0.000000	discard	cycle 30 u=0.0982	agent0	initial_cond	0	-0.000000
exp5483	5.45343271e-29	0.000000	0.000000	discard	cycle 30 u=0.0982	agent0	initial_cond	0	-0.000000
exp5484	5.45343271e-29	0.000000	0.000000	discard	cycle 30 u=0.0982	agent0	initial_cond	0	-0.000000
exp5485	1.23429977e-28	0.000000	0.000000	discard	cycle 30 u=0.0982	agent0	initial_cond	1	0.000000
exp5486	1.23429977e-28	0.000000	0.000000	discard	cycle 30 u=0.0982	agent0	initial_cond	0	0.000000
exp5487	1.23429977e-28	0.000000	0.000000	discard	cycle 30 u=0.0982	agent0	initial_cond	0	0.000000
exp5488	1.88036672e-29	0.000000	0.000000	discard	cycle 30 u=0.0982	agent0	initial_cond	1	0.000000
exp5489	1.88036672e-29	0.000000	0.000000	discard	cycle 30 u=0.0982	agent0	initial_cond	0	0.000000
exp5490	1.88036672e-29	0.000000	0.000000	discard	cycle 30 u=0.0982	agent0	initial_cond	0	0.000000
exp5491	1.91190259e-29	0.000000	-0.000000	discard	cycle 30 u=0.0982	agent0	initial_cond	0	0.000000
exp5492	1.91190259e-29	0.000000	-0.000000	discard	cycle 30 u=0.0982	agent0	initial_cond	0	0.000000
exp5493	1.91190259e-29	0.000000	-0.000000	discard	cycle 30 u=0.0982	agent0	initial_cond	1	0.000000
exp5494	6.13049994e-29	0.000000	0.000000	discard	cycle 30 u=0.0985	agent0	initial_cond	0	0.000000
exp5495	6.13049994e-29	0.000000	0.000000	discard	cycle 30 u=0.0985	agent0	initial_cond	0	0.000000
exp5496	6.13049994e-29	0.000000	0.000000	discard	cycle 30 u=0.0985	agent0	initial_cond	1	0.000000
exp5497	5.49750971e-29	0.000000	0.000000	discard	cycle 30 u=0.0985	agent0	initial_cond	0	0.000000
exp5498	5.49750971e-29	0.000000	0.000000	discard	cycle 30 u=0.0985	agent0	initial_cond	0	0.000000
exp5499	5.49750971e-29	0.000000	0.000000	discard	cycle 30 u=0.0985	agent0	initial_cond	1	0.000000
exp5500	1.34357540e-12	1.002503	1.000218	discard	cycle 30 u=0.0985	agent0	initial_cond	0	-1.523848
exp5501	1.34357540e-12	1.002503	1.000218	discard	scipy batch u=1.0 r1	agent0	solver_param	0	-1.523848
exp5502	1.34357540e-12	1.002503	1.000218	discard	cycle 30 u=0.0985	agent0	initial_cond	1	-1.523848
exp5503	4.15642452e-29	0.000000	0.000000	discard	scipy batch u=1.0 r2	agent0	solver_param	0	0.000000
exp5504	1.34357540e-12	1.002503	1.000218	discard	cycle 30 u=0.0985	agent0	initial_cond	0	-1.523848
exp5505	1.34357540e-12	1.002503	1.000218	discard	scipy batch u=1.0 r3	agent0	solver_param	0	-1.523848
exp5506	1.34357540e-12	1.002503	1.000218	discard	cycle 30 u=0.0985	agent0	initial_cond	1	-1.523848
exp5507	2.19292611e-29	0.000000	0.000000	discard	scipy batch u=1.0 r4	agent0	solver_param	1	-0.000000
exp5508	1.34357540e-12	1.002503	1.000218	discard	cycle 30 u=0.0985	agent0	initial_cond	0	-1.523848
exp5509	1.34357540e-12	1.002503	1.000218	discard	scipy batch u=1.0 r5	agent0	solver_param	0	-1.523848
exp5510	1.34357540e-12	1.002503	1.000218	discard	cycle 30 u=0.0985	agent0	initial_cond	0	-1.523848
exp5511	4.22491788e-29	0.000000	0.000000	discard	scipy batch u=1.0 r6	agent0	solver_param	1	-0.000000
exp5512	1.34357540e-12	1.002503	1.000218	discard	cycle 30 u=0.0990	agent0	initial_cond	0	-1.523848
exp5513	1.34357540e-12	1.002503	1.000218	discard	scipy batch u=1.0 r7	agent0	solver_param	0	-1.523848
exp5514	1.34357540e-12	1.002503	1.000218	discard	cycle 30 u=0.0990	agent0	initial_cond	0	-1.523848
exp5515	4.22491788e-29	0.000000	0.000000	discard	scipy batch u=1.0 r8	agent0	solver_param	1	-0.000000
exp5516	1.34357540e-12	1.002503	1.000218	discard	cycle 30 u=0.0990	agent0	initial_cond	1	-1.523848
exp5517	1.34357540e-12	1.002503	1.000218	discard	scipy batch u=1.0 r9	agent0	solver_param	0	-1.523848
exp5518	1.34357540e-12	1.002503	1.000218	discard	cycle 30 u=0.0990	agent0	initial_cond	0	-1.523848
exp5519	3.22245147e-29	0.000000	0.000000	discard	scipy batch u=1.0 r10	agent0	solver_param	0	0.000000
exp5520	1.34360442e-12	1.002503	-1.000218	discard	cycle 30 u=0.0990	agent0	initial_cond	1	-1.523848
exp5521	1.34360442e-12	1.002503	-1.000218	discard	scipy batch u=-1.0 r1	agent0	solver_param	0	-1.523848
exp5522	1.34360442e-12	1.002503	-1.000218	discard	cycle 30 u=0.0990	agent0	initial_cond	0	-1.523848
exp5523	4.50941488e-29	0.000000	-0.000000	discard	scipy batch u=-1.0 r2	agent0	solver_param	0	0.000000
exp5524	1.34360442e-12	1.002503	-1.000218	discard	cycle 30 u=0.0990	agent0	initial_cond	1	-1.523848
exp5525	1.34360442e-12	1.002503	-1.000218	discard	scipy batch u=-1.0 r3	agent0	solver_param	1	-1.523848
exp5526	1.34360442e-12	1.002503	-1.000218	discard	cycle 30 u=0.0990	agent0	initial_cond	0	-1.523848
exp5527	4.50941488e-29	0.000000	-0.000000	discard	scipy batch u=-1.0 r4	agent0	solver_param	0	0.000000
exp5528	1.34360442e-12	1.002503	-1.000218	discard	cycle 30 u=0.0990	agent0	initial_cond	1	-1.523848
exp5529	1.34360442e-12	1.002503	-1.000218	discard	scipy batch u=-1.0 r5	agent0	solver_param	1	-1.523848
exp5530	1.34360442e-12	1.002503	-1.000218	discard	cycle 30 u=0.0990	agent0	initial_cond	0	-1.523848
exp5531	4.88330883e-29	0.000000	-0.000000	discard	scipy batch u=-1.0 r6	agent0	solver_param	0	0.000000
exp5532	1.34360442e-12	1.002503	-1.000218	discard	cycle 30 u=0.0990	agent0	initial_cond	0	-1.523848
exp5533	1.34360442e-12	1.002503	-1.000218	discard	scipy batch u=-1.0 r7	agent0	solver_param	1	-1.523848
exp5534	1.34360442e-12	1.002503	-1.000218	discard	cycle 30 u=0.0990	agent0	initial_cond	0	-1.523848
exp5535	5.74085541e-29	0.000000	-0.000000	discard	scipy batch u=-1.0 r8	agent0	solver_param	0	0.000000
exp5536	1.34360442e-12	1.002503	-1.000218	discard	cycle 30 u=0.0995	agent0	initial_cond	0	-1.523848
exp5537	1.34360442e-12	1.002503	-1.000218	discard	scipy batch u=-1.0 r9	agent0	solver_param	1	-1.523848
exp5538	1.34360442e-12	1.002503	-1.000218	discard	cycle 30 u=0.0995	agent0	initial_cond	1	-1.523848
exp5539	5.74085541e-29	0.000000	-0.000000	discard	scipy batch u=-1.0 r10	agent0	solver_param	0	0.000000
exp5540	5.74085541e-29	0.000000	-0.000000	discard	cycle 30 u=0.0995	agent0	initial_cond	0	0.000000
exp5541	1.54984578e-28	0.000000	0.000000	discard	cycle 30 u=0.0995	agent0	initial_cond	1	-0.000000
exp5542	1.54984578e-28	0.000000	0.000000	discard	cycle 30 u=0.0995	agent0	initial_cond	0	-0.000000
exp5543	1.54984578e-28	0.000000	0.000000	discard	cycle 30 u=0.0995	agent0	initial_cond	0	-0.000000
exp5544	1.60328418e-29	0.000000	-0.000000	discard	cycle 30 u=0.0995	agent0	initial_cond	1	-0.000000
exp5545	1.60328418e-29	0.000000	-0.000000	discard	cycle 30 u=0.0995	agent0	initial_cond	0	-0.000000
exp5546	1.60328418e-29	0.000000	-0.000000	discard	cycle 30 u=0.0995	agent0	initial_cond	0	-0.000000
exp5547	7.34590618e-29	0.000000	0.000000	discard	cycle 30 u=0.0995	agent0	initial_cond	0	0.000000
exp5548	7.34590618e-29	0.000000	0.000000	discard	cycle 30 u=0.0995	agent0	initial_cond	0	0.000000
exp5549	7.34590618e-29	0.000000	0.000000	discard	cycle 30 u=0.0995	agent0	initial_cond	1	0.000000
exp5550	4.46546993e-29	0.000000	0.000000	discard	cycle 30 u=0.1000	agent0	initial_cond	0	-0.000000
exp5551	4.46546993e-29	0.000000	0.000000	discard	cycle 30 u=0.1000	agent0	initial_cond	0	-0.000000
exp5552	4.46546993e-29	0.000000	0.000000	discard	cycle 30 u=0.1000	agent0	initial_cond	1	-0.000000
exp5553	4.08106752e-29	0.000000	0.000000	discard	cycle 30 u=0.1000	agent0	initial_cond	0	-0.000000
exp5554	4.08106752e-29	0.000000	0.000000	discard	cycle 30 u=0.1000	agent0	initial_cond	0	-0.000000
exp5555	4.08106752e-29	0.000000	0.000000	discard	cycle 30 u=0.1000	agent0	initial_cond	1	-0.000000
exp5556	4.58623706e-29	0.000000	0.000000	discard	cycle 30 u=0.1000	agent0	initial_cond	0	-0.000000
exp5557	4.58623706e-29	0.000000	0.000000	discard	cycle 30 u=0.1000	agent0	initial_cond	1	-0.000000
exp5558	4.58623706e-29	0.000000	0.000000	discard	cycle 30 u=0.1000	agent0	initial_cond	0	-0.000000
exp5559	4.39794337e-29	0.000000	0.000000	discard	cycle 30 u=0.1000	agent0	initial_cond	0	-0.000000
exp5560	4.39794337e-29	0.000000	0.000000	discard	cycle 30 u=0.1000	agent0	initial_cond	1	-0.000000
exp5561	4.39794337e-29	0.000000	0.000000	discard	cycle 30 u=0.1000	agent0	initial_cond	0	-0.000000
exp5562	1.36727475e-28	0.000000	0.000000	discard	cycle 30 u=0.1050	agent0	initial_cond	0	-0.000000
exp5563	1.36727475e-28	0.000000	0.000000	discard	cycle 30 u=0.1050	agent0	initial_cond	1	-0.000000
exp5564	1.36727475e-28	0.000000	0.000000	discard	cycle 30 u=0.1050	agent0	initial_cond	0	-0.000000
exp5565	6.14461376e-29	0.000000	0.000000	discard	cycle 30 u=0.1050	agent0	initial_cond	0	-0.000000
exp5566	6.14461376e-29	0.000000	0.000000	discard	cycle 30 u=0.1050	agent0	initial_cond	0	-0.000000
exp5567	6.14461376e-29	0.000000	0.000000	discard	cycle 30 u=0.1050	agent0	initial_cond	0	-0.000000
exp5568	1.75906666e-28	0.000000	0.000000	discard	cycle 30 u=0.1050	agent0	initial_cond	1	-0.000000
exp5569	5.63598005e-11	0.000000	-0.000000	discard	scipy 4th branch u=0 amp=0.5 phase=1.0 n=150	manual	memory	1	-0.000000
exp5570	1.75906666e-28	0.000000	0.000000	discard	cycle 30 u=0.1050	agent0	initial_cond	0	-0.000000
exp5571	1.75906666e-28	0.000000	0.000000	discard	cycle 30 u=0.1050	agent0	initial_cond	0	-0.000000
exp5572	1.11257917e-28	0.000000	0.000000	discard	cycle 30 u=0.1050	agent0	initial_cond	1	-0.000000
exp5573	1.11257917e-28	0.000000	0.000000	discard	cycle 30 u=0.1050	agent0	initial_cond	0	-0.000000
exp5574	1.11257917e-28	0.000000	0.000000	discard	cycle 30 u=0.1050	agent0	initial_cond	0	-0.000000
exp5575	8.58580947e-29	0.000000	0.000000	discard	cycle 31 u=0.0975	agent0	initial_cond	0	0.000000
exp5576	8.58580947e-29	0.000000	0.000000	discard	cycle 31 u=0.0975	agent0	initial_cond	0	0.000000
exp5577	8.58580947e-29	0.000000	0.000000	discard	cycle 31 u=0.0975	agent0	initial_cond	1	0.000000
