exp_id	residual	solution_norm	solution_mean	status	description	agent	design	elapsed_s	solution_energy
exp7315	7.34590618e-29	0.000000	0.000000	discard	cycle 48 u=0.0995	agent0	initial_cond	0	0.000000
exp7316	7.34590618e-29	0.000000	0.000000	discard	cycle 48 u=0.0995	agent0	initial_cond	0	0.000000
exp7317	7.34590618e-29	0.000000	0.000000	discard	cycle 48 u=0.0995	agent0	initial_cond	0	0.000000
exp7318	4.46546993e-29	0.000000	0.000000	discard	cycle 48 u=0.1000	agent0	initial_cond	0	-0.000000
exp7319	4.46546993e-29	0.000000	0.000000	discard	cycle 48 u=0.1000	agent0	initial_cond	1	-0.000000
exp7320	4.46546993e-29	0.000000	0.000000	discard	cycle 48 u=0.1000	agent0	initial_cond	0	-0.000000
exp7321	4.08106752e-29	0.000000	0.000000	discard	cycle 48 u=0.1000	agent0	initial_cond	0	-0.000000
exp7322	4.08106752e-29	0.000000	0.000000	discard	cycle 48 u=0.1000	agent0	initial_cond	1	-0.000000
exp7323	4.08106752e-29	0.000000	0.000000	discard	cycle 48 u=0.1000	agent0	initial_cond	0	-0.000000
exp7324	1.64580528e-17	0.070278	-0.000000	discard	SOTA verification u=0.205 modes=3 amp=0.5 phase=1.0	manual	memory	0	0.000097
exp7325	4.58623706e-29	0.000000	0.000000	discard	cycle 48 u=0.1000	agent0	initial_cond	0	-0.000000
exp7326	4.58623706e-29	0.000000	0.000000	discard	cycle 48 u=0.1000	agent0	initial_cond	0	-0.000000
exp7327	4.58623706e-29	0.000000	0.000000	discard	cycle 48 u=0.1000	agent0	initial_cond	0	-0.000000
exp7328	4.39794337e-29	0.000000	0.000000	discard	cycle 48 u=0.1000	agent0	initial_cond	1	-0.000000
exp7329	4.39794337e-29	0.000000	0.000000	discard	cycle 48 u=0.1000	agent0	initial_cond	0	-0.000000
exp7330	4.39794337e-29	0.000000	0.000000	discard	cycle 48 u=0.1000	agent0	initial_cond	0	-0.000000
exp7331	1.36727475e-28	0.000000	0.000000	discard	cycle 48 u=0.1050	agent0	initial_cond	1	-0.000000
exp7332	1.36727475e-28	0.000000	0.000000	discard	cycle 48 u=0.1050	agent0	initial_cond	0	-0.000000
exp7333	1.36727475e-28	0.000000	0.000000	discard	cycle 48 u=0.1050	agent0	initial_cond	0	-0.000000
exp7334	6.14461376e-29	0.000000	0.000000	discard	cycle 48 u=0.1050	agent0	initial_cond	0	-0.000000
exp7335	6.14461376e-29	0.000000	0.000000	discard	cycle 48 u=0.1050	agent0	initial_cond	0	-0.000000
exp7336	6.14461376e-29	0.000000	0.000000	discard	cycle 48 u=0.1050	agent0	initial_cond	1	-0.000000
exp7337	1.75906666e-28	0.000000	0.000000	discard	cycle 48 u=0.1050	agent0	initial_cond	0	-0.000000
exp7338	1.75906666e-28	0.000000	0.000000	discard	cycle 48 u=0.1050	agent0	initial_cond	0	-0.000000
exp7339	1.75906666e-28	0.000000	0.000000	discard	cycle 48 u=0.1050	agent0	initial_cond	1	-0.000000
exp7340	1.11257917e-28	0.000000	0.000000	discard	cycle 48 u=0.1050	agent0	initial_cond	0	-0.000000
exp7341	1.64580528e-17	0.070278	-0.000000	discard	Phase exploration phase=0.9 modes=3 u=0.205 amp=0.5	manual	memory	0	0.000097
exp7342	1.11257917e-28	0.000000	0.000000	discard	cycle 48 u=0.1050	agent0	initial_cond	1	-0.000000
exp7343	1.64580528e-17	0.070278	-0.000000	discard	Phase exploration phase=0.95 modes=3 u=0.205 amp=0.5	manual	memory	1	0.000097
exp7344	1.11257917e-28	0.000000	0.000000	discard	cycle 48 u=0.1050	agent0	initial_cond	0	-0.000000
exp7345	1.64580528e-17	0.070278	-0.000000	discard	Phase exploration phase=1.05 modes=3 u=0.205 amp=0.5	manual	memory	0	0.000097
exp7346	8.58580947e-29	0.000000	0.000000	discard	cycle 49 u=0.0975	agent0	initial_cond	0	0.000000
exp7347	1.64580528e-17	0.070278	-0.000000	discard	Phase exploration phase=1.1 modes=3 u=0.205 amp=0.5	manual	memory	0	0.000097
exp7348	8.58580947e-29	0.000000	0.000000	discard	cycle 49 u=0.0975	agent0	initial_cond	1	0.000000
exp7349	8.58580947e-29	0.000000	0.000000	discard	cycle 49 u=0.0975	agent0	initial_cond	0	0.000000
exp7350	5.23962023e-29	0.000000	0.000000	discard	cycle 49 u=0.0975	agent0	initial_cond	0	0.000000
exp7351	5.23962023e-29	0.000000	0.000000	discard	cycle 49 u=0.0975	agent0	initial_cond	1	0.000000
exp7352	5.23962023e-29	0.000000	0.000000	discard	cycle 49 u=0.0975	agent0	initial_cond	0	0.000000
exp7353	4.03266298e-29	0.000000	0.000000	discard	cycle 49 u=0.0975	agent0	initial_cond	1	0.000000
exp7354	4.03266298e-29	0.000000	0.000000	discard	cycle 49 u=0.0975	agent0	initial_cond	0	0.000000
exp7355	4.03266298e-29	0.000000	0.000000	discard	cycle 49 u=0.0975	agent0	initial_cond	0	0.000000
exp7356	4.80015937e-29	0.000000	0.000000	discard	cycle 49 u=0.0975	agent0	initial_cond	1	0.000000
exp7357	2.05433273e-17	0.070278	-0.000000	discard	Amplitude exploration amp=0.3 modes=3 u=0.205 phase=1.0	manual	memory	0	0.000097
exp7358	4.80015937e-29	0.000000	0.000000	discard	cycle 49 u=0.0975	agent0	initial_cond	0	0.000000
exp7359	4.80015937e-29	0.000000	0.000000	discard	cycle 49 u=0.0975	agent0	initial_cond	0	0.000000
exp7360	2.68824537e-29	0.000000	0.000000	discard	cycle 49 u=0.0980	agent0	initial_cond	0	-0.000000
exp7360	3.12995491e-17	0.070278	-0.000000	discard	Amplitude exploration amp=0.4 modes=3 u=0.205 phase=1.0	manual	memory	0	0.000097
exp7361	2.68824537e-29	0.000000	0.000000	discard	cycle 49 u=0.0980	agent0	initial_cond	0	-0.000000
exp7362	2.68824537e-29	0.000000	0.000000	discard	cycle 49 u=0.0980	agent0	initial_cond	1	-0.000000
exp7363	2.99833296e-17	0.070278	-0.000000	discard	Amplitude exploration amp=0.6 modes=3 u=0.205 phase=1.0	manual	memory	1	0.000097
exp7364	6.16758073e-29	0.000000	0.000000	discard	cycle 49 u=0.0980	agent0	initial_cond	0	-0.000000
exp7365	6.16758073e-29	0.000000	0.000000	discard	cycle 49 u=0.0980	agent0	initial_cond	0	-0.000000
exp7366	2.89514089e-15	0.070278	-0.000000	discard	Amplitude exploration amp=0.7 modes=3 u=0.205 phase=1.0	manual	memory	1	0.000097
exp7367	6.16758073e-29	0.000000	0.000000	discard	cycle 49 u=0.0980	agent0	initial_cond	1	-0.000000
exp7368	2.01926478e-29	0.000000	0.000000	discard	cycle 49 u=0.0980	agent0	initial_cond	0	0.000000
exp7369	2.01926478e-29	0.000000	0.000000	discard	cycle 49 u=0.0980	agent0	initial_cond	0	0.000000
exp7370	2.01926478e-29	0.000000	0.000000	discard	cycle 49 u=0.0980	agent0	initial_cond	0	0.000000
exp7371	1.30310780e-28	0.000000	0.000000	discard	cycle 49 u=0.0980	agent0	initial_cond	0	-0.000000
exp7372	1.30310780e-28	0.000000	0.000000	discard	cycle 49 u=0.0980	agent0	initial_cond	1	-0.000000
exp7373	1.30310780e-28	0.000000	0.000000	discard	cycle 49 u=0.0980	agent0	initial_cond	0	-0.000000
exp7374	5.45343271e-29	0.000000	0.000000	discard	cycle 49 u=0.0982	agent0	initial_cond	0	-0.000000
exp7375	5.45343271e-29	0.000000	0.000000	discard	cycle 49 u=0.0982	agent0	initial_cond	1	-0.000000
exp7376	5.45343271e-29	0.000000	0.000000	discard	cycle 49 u=0.0982	agent0	initial_cond	0	-0.000000
exp7377	1.23429977e-28	0.000000	0.000000	discard	cycle 49 u=0.0982	agent0	initial_cond	0	0.000000
exp7378	1.23429977e-28	0.000000	0.000000	discard	cycle 49 u=0.0982	agent0	initial_cond	0	0.000000
exp7379	1.23429977e-28	0.000000	0.000000	discard	cycle 49 u=0.0982	agent0	initial_cond	0	0.000000
exp7380	1.76481058e-16	0.070278	-0.000000	discard	u_offset refinement u=0.200 modes=3 amp=0.5 phase=1.0	manual	memory	0	0.000097
exp7381	1.88036672e-29	0.000000	0.000000	discard	cycle 49 u=0.0982	agent0	initial_cond	1	0.000000
exp7382	1.88036672e-29	0.000000	0.000000	discard	cycle 49 u=0.0982	agent0	initial_cond	0	0.000000
exp7382	5.00933718e-16	0.070278	-0.000000	discard	u_offset refinement u=0.202 modes=3 amp=0.5 phase=1.0	manual	memory	0	0.000097
exp7383	1.88036672e-29	0.000000	0.000000	discard	cycle 49 u=0.0982	agent0	initial_cond	0	0.000000
exp7384	9.09148006e-16	0.070278	-0.000000	discard	u_offset refinement u=0.203 modes=3 amp=0.5 phase=1.0	manual	memory	1	0.000097
exp7384	1.91190259e-29	0.000000	-0.000000	discard	cycle 49 u=0.0982	agent0	initial_cond	1	0.000000
exp7385	1.91190259e-29	0.000000	-0.000000	discard	cycle 49 u=0.0982	agent0	initial_cond	0	0.000000
exp7386	1.61529008e-15	0.070278	-0.000000	discard	u_offset refinement u=0.204 modes=3 amp=0.5 phase=1.0	manual	memory	0	0.000097
exp7387	1.91190259e-29	0.000000	-0.000000	discard	cycle 49 u=0.0982	agent0	initial_cond	1	0.000000
exp7388	6.13049994e-29	0.000000	0.000000	discard	cycle 49 u=0.0985	agent0	initial_cond	0	0.000000
exp7389	5.16645442e-15	0.070278	-0.000000	discard	u_offset refinement u=0.206 modes=3 amp=0.5 phase=1.0	manual	memory	0	0.000097
exp7390	6.13049994e-29	0.000000	0.000000	discard	cycle 49 u=0.0985	agent0	initial_cond	0	0.000000
exp7391	6.13049994e-29	0.000000	0.000000	discard	cycle 49 u=0.0985	agent0	initial_cond	1	0.000000
exp7392	2.42867751e-17	0.070278	-0.000000	discard	u_offset refinement u=0.207 modes=3 amp=0.5 phase=1.0	manual	memory	0	0.000097
exp7393	5.49750971e-29	0.000000	0.000000	discard	cycle 49 u=0.0985	agent0	initial_cond	0	0.000000
exp7394	5.49750971e-29	0.000000	0.000000	discard	cycle 49 u=0.0985	agent0	initial_cond	0	0.000000
exp7395	1.06327351e-17	0.070278	-0.000000	discard	u_offset refinement u=0.208 modes=3 amp=0.5 phase=1.0	manual	memory	1	0.000097
exp7396	5.49750971e-29	0.000000	0.000000	discard	cycle 49 u=0.0985	agent0	initial_cond	0	0.000000
exp7397	4.15642452e-29	0.000000	0.000000	discard	cycle 49 u=0.0985	agent0	initial_cond	0	0.000000
exp7397	6.03027031e-17	0.070278	-0.000000	discard	u_offset refinement u=0.210 modes=3 amp=0.5 phase=1.0	manual	memory	0	0.000097
exp7398	4.15642452e-29	0.000000	0.000000	discard	cycle 49 u=0.0985	agent0	initial_cond	1	0.000000
exp7399	4.15642452e-29	0.000000	0.000000	discard	cycle 49 u=0.0985	agent0	initial_cond	0	0.000000
exp7400	2.19292611e-29	0.000000	0.000000	discard	cycle 49 u=0.0985	agent0	initial_cond	0	-0.000000
exp7401	2.19292611e-29	0.000000	0.000000	discard	cycle 49 u=0.0985	agent0	initial_cond	1	-0.000000
exp7402	2.19292611e-29	0.000000	0.000000	discard	cycle 49 u=0.0985	agent0	initial_cond	0	-0.000000
exp7403	4.22491788e-29	0.000000	0.000000	discard	cycle 49 u=0.0990	agent0	initial_cond	0	-0.000000
exp7404	4.22491788e-29	0.000000	0.000000	discard	cycle 49 u=0.0990	agent0	initial_cond	0	-0.000000
exp7405	4.22491788e-29	0.000000	0.000000	discard	cycle 49 u=0.0990	agent0	initial_cond	0	-0.000000
exp7406	3.22245147e-29	0.000000	0.000000	discard	cycle 49 u=0.0990	agent0	initial_cond	1	0.000000
exp7407	3.22245147e-29	0.000000	0.000000	discard	cycle 49 u=0.0990	agent0	initial_cond	0	0.000000
exp7408	3.22245147e-29	0.000000	0.000000	discard	cycle 49 u=0.0990	agent0	initial_cond	0	0.000000
exp7409	4.50941488e-29	0.000000	-0.000000	discard	cycle 49 u=0.0990	agent0	initial_cond	1	0.000000
exp7410	4.50941488e-29	0.000000	-0.000000	discard	cycle 49 u=0.0990	agent0	initial_cond	0	0.000000
exp7411	1.53074436e-17	0.070278	-0.000000	discard	u_offset fine-tune u=0.2075 modes=3 amp=0.5 phase=1.0	manual	memory	0	0.000097
exp7412	4.50941488e-29	0.000000	-0.000000	discard	cycle 49 u=0.0990	agent0	initial_cond	0	0.000000
exp7413	4.88330883e-29	0.000000	-0.000000	discard	cycle 49 u=0.0990	agent0	initial_cond	0	0.000000
exp7414	5.25263281e-17	0.070278	-0.000000	discard	u_offset fine-tune u=0.2077 modes=3 amp=0.5 phase=1.0	manual	memory	0	0.000097
exp7415	4.88330883e-29	0.000000	-0.000000	discard	cycle 49 u=0.0990	agent0	initial_cond	0	0.000000
exp7416	2.21102512e-17	0.070278	-0.000000	discard	u_offset fine-tune u=0.2078 modes=3 amp=0.5 phase=1.0	manual	memory	1	0.000097
exp7417	4.88330883e-29	0.000000	-0.000000	discard	cycle 49 u=0.0990	agent0	initial_cond	1	0.000000
exp7418	5.74085541e-29	0.000000	-0.000000	discard	cycle 49 u=0.0995	agent0	initial_cond	0	0.000000
exp7419	2.62364415e-17	0.070278	-0.000000	discard	u_offset fine-tune u=0.2079 modes=3 amp=0.5 phase=1.0	manual	memory	0	0.000097
exp7420	5.74085541e-29	0.000000	-0.000000	discard	cycle 49 u=0.0995	agent0	initial_cond	0	0.000000
exp7421	1.06327351e-17	0.070278	-0.000000	discard	u_offset fine-tune u=0.2080 modes=3 amp=0.5 phase=1.0	manual	memory	1	0.000097
exp7421	5.74085541e-29	0.000000	-0.000000	discard	cycle 49 u=0.0995	agent0	initial_cond	1	0.000000
exp7422	1.54984578e-28	0.000000	0.000000	discard	cycle 49 u=0.0995	agent0	initial_cond	0	-0.000000
exp7423	7.24300626e-17	0.070278	-0.000000	discard	u_offset fine-tune u=0.2081 modes=3 amp=0.5 phase=1.0	manual	memory	0	0.000097
exp7424	1.54984578e-28	0.000000	0.000000	discard	cycle 49 u=0.0995	agent0	initial_cond	1	-0.000000
exp7425	1.54984578e-28	0.000000	0.000000	discard	cycle 49 u=0.0995	agent0	initial_cond	0	-0.000000
exp7425	4.49967488e-17	0.070278	-0.000000	discard	u_offset fine-tune u=0.2082 modes=3 amp=0.5 phase=1.0	manual	memory	0	0.000097
exp7426	1.60328418e-29	0.000000	-0.000000	discard	cycle 49 u=0.0995	agent0	initial_cond	0	-0.000000
exp7427	3.57458887e-17	0.070278	-0.000000	discard	u_offset fine-tune u=0.2083 modes=3 amp=0.5 phase=1.0	manual	memory	1	0.000097
exp7428	1.60328418e-29	0.000000	-0.000000	discard	cycle 49 u=0.0995	agent0	initial_cond	1	-0.000000
exp7429	1.60328418e-29	0.000000	-0.000000	discard	cycle 49 u=0.0995	agent0	initial_cond	0	-0.000000
exp7429	3.58797018e-17	0.070278	-0.000000	discard	u_offset fine-tune u=0.2085 modes=3 amp=0.5 phase=1.0	manual	memory	0	0.000097
exp7430	7.34590618e-29	0.000000	0.000000	discard	cycle 49 u=0.0995	agent0	initial_cond	0	0.000000
exp7431	7.34590618e-29	0.000000	0.000000	discard	cycle 49 u=0.0995	agent0	initial_cond	0	0.000000
exp7432	7.34590618e-29	0.000000	0.000000	discard	cycle 49 u=0.0995	agent0	initial_cond	0	0.000000
exp7433	4.46546993e-29	0.000000	0.000000	discard	cycle 49 u=0.1000	agent0	initial_cond	1	-0.000000
exp7434	4.46546993e-29	0.000000	0.000000	discard	cycle 49 u=0.1000	agent0	initial_cond	0	-0.000000
exp7435	4.46546993e-29	0.000000	0.000000	discard	cycle 49 u=0.1000	agent0	initial_cond	0	-0.000000
exp7436	4.08106752e-29	0.000000	0.000000	discard	cycle 49 u=0.1000	agent0	initial_cond	1	-0.000000
exp7437	4.08106752e-29	0.000000	0.000000	discard	cycle 49 u=0.1000	agent0	initial_cond	0	-0.000000
exp7438	4.08106752e-29	0.000000	0.000000	discard	cycle 49 u=0.1000	agent0	initial_cond	0	-0.000000
exp7439	4.58623706e-29	0.000000	0.000000	discard	cycle 49 u=0.1000	agent0	initial_cond	0	-0.000000
exp7440	4.58623706e-29	0.000000	0.000000	discard	cycle 49 u=0.1000	agent0	initial_cond	0	-0.000000
exp7441	4.58623706e-29	0.000000	0.000000	discard	cycle 49 u=0.1000	agent0	initial_cond	1	-0.000000
exp7442	4.39794337e-29	0.000000	0.000000	discard	cycle 49 u=0.1000	agent0	initial_cond	0	-0.000000
exp7443	4.39794337e-29	0.000000	0.000000	discard	cycle 49 u=0.1000	agent0	initial_cond	0	-0.000000
exp7444	5.02798394e-17	0.070535	-0.000000	discard	Fourier modes exploration modes=4 u=0.2080 amp=0.5	manual	memory	0	0.000099
exp7445	4.39794337e-29	0.000000	0.000000	discard	cycle 49 u=0.1000	agent0	initial_cond	1	-0.000000
exp7446	1.36727475e-28	0.000000	0.000000	discard	cycle 49 u=0.1050	agent0	initial_cond	0	-0.000000
exp7447	7.74924422e-17	0.070536	0.000000	discard	Fourier modes exploration modes=5 u=0.2080 amp=0.5	manual	memory	0	0.000099
exp7448	1.36727475e-28	0.000000	0.000000	discard	cycle 49 u=0.1050	agent0	initial_cond	0	-0.000000
exp7449	1.36727475e-28	0.000000	0.000000	discard	cycle 49 u=0.1050	agent0	initial_cond	0	-0.000000
exp7449	1.59989505e-16	0.070536	-0.000000	discard	Fourier modes exploration modes=6 u=0.2080 amp=0.5	manual	memory	0	0.000099
exp7450	6.14461376e-29	0.000000	0.000000	discard	cycle 49 u=0.1050	agent0	initial_cond	0	-0.000000
exp7451	2.42580564e-16	0.070536	-0.000000	discard	Fourier modes exploration modes=7 u=0.2080 amp=0.5	manual	memory	1	0.000099
exp7452	6.14461376e-29	0.000000	0.000000	discard	cycle 49 u=0.1050	agent0	initial_cond	1	-0.000000
exp7453	6.14461376e-29	0.000000	0.000000	discard	cycle 49 u=0.1050	agent0	initial_cond	0	-0.000000
exp7454	1.28403265e-16	0.070536	0.000000	discard	Fourier modes exploration modes=8 u=0.2080 amp=0.5	manual	memory	0	0.000099
exp7455	1.75906666e-28	0.000000	0.000000	discard	cycle 49 u=0.1050	agent0	initial_cond	0	-0.000000
exp7456	1.75906666e-28	0.000000	0.000000	discard	cycle 49 u=0.1050	agent0	initial_cond	1	-0.000000
exp7457	1.75906666e-28	0.000000	0.000000	discard	cycle 49 u=0.1050	agent0	initial_cond	0	-0.000000
exp7458	1.11257917e-28	0.000000	0.000000	discard	cycle 49 u=0.1050	agent0	initial_cond	1	-0.000000
exp7459	1.11257917e-28	0.000000	0.000000	discard	cycle 49 u=0.1050	agent0	initial_cond	0	-0.000000
exp7460	1.11257917e-28	0.000000	0.000000	discard	cycle 49 u=0.1050	agent0	initial_cond	0	-0.000000
exp7461	8.58580947e-29	0.000000	0.000000	discard	cycle 50 u=0.0975	agent0	initial_cond	1	0.000000
exp7462	8.58580947e-29	0.000000	0.000000	discard	cycle 50 u=0.0975	agent0	initial_cond	0	0.000000
exp7463	8.58580947e-29	0.000000	0.000000	discard	cycle 50 u=0.0975	agent0	initial_cond	0	0.000000
exp7464	5.23962023e-29	0.000000	0.000000	discard	cycle 50 u=0.0975	agent0	initial_cond	0	0.000000
exp7465	5.23962023e-29	0.000000	0.000000	discard	cycle 50 u=0.0975	agent0	initial_cond	0	0.000000
exp7466	5.23962023e-29	0.000000	0.000000	discard	cycle 50 u=0.0975	agent0	initial_cond	1	0.000000
exp7467	1.06327351e-17	0.070278	-0.000000	discard	Solver tolerance exploration tol=1e-11 u=0.2080 modes=3	manual	memory	0	0.000097
exp7468	4.03266298e-29	0.000000	0.000000	discard	cycle 50 u=0.0975	agent0	initial_cond	0	0.000000
exp7469	4.03266298e-29	0.000000	0.000000	discard	cycle 50 u=0.0975	agent0	initial_cond	0	0.000000
exp7470	1.06327351e-17	0.070278	-0.000000	discard	Solver tolerance exploration tol=1e-12 u=0.2080 modes=3	manual	memory	1	0.000097
exp7471	4.03266298e-29	0.000000	0.000000	discard	cycle 50 u=0.0975	agent0	initial_cond	1	0.000000
exp7472	4.80015937e-29	0.000000	0.000000	discard	cycle 50 u=0.0975	agent0	initial_cond	0	0.000000
exp7473	1.06327351e-17	0.070278	-0.000000	discard	Solver tolerance exploration tol=1e-13 u=0.2080 modes=3	manual	memory	0	0.000097
exp7474	4.80015937e-29	0.000000	0.000000	discard	cycle 50 u=0.0975	agent0	initial_cond	0	0.000000
exp7475	4.80015937e-29	0.000000	0.000000	discard	cycle 50 u=0.0975	agent0	initial_cond	0	0.000000
exp7476	1.06327351e-17	0.070278	-0.000000	discard	Solver tolerance exploration tol=1e-14 u=0.2080 modes=3	manual	memory	0	0.000097
exp7477	2.68824537e-29	0.000000	0.000000	discard	cycle 50 u=0.0980	agent0	initial_cond	0	-0.000000
exp7478	2.68824537e-29	0.000000	0.000000	discard	cycle 50 u=0.0980	agent0	initial_cond	1	-0.000000
exp7478	1.06327351e-17	0.070278	-0.000000	discard	Solver tolerance exploration tol=1e-15 u=0.2080 modes=3	manual	memory	1	0.000097
exp7479	2.68824537e-29	0.000000	0.000000	discard	cycle 50 u=0.0980	agent0	initial_cond	0	-0.000000
exp7480	6.16758073e-29	0.000000	0.000000	discard	cycle 50 u=0.0980	agent0	initial_cond	0	-0.000000
exp7481	6.16758073e-29	0.000000	0.000000	discard	cycle 50 u=0.0980	agent0	initial_cond	1	-0.000000
exp7482	6.16758073e-29	0.000000	0.000000	discard	cycle 50 u=0.0980	agent0	initial_cond	0	-0.000000
exp7483	2.01926478e-29	0.000000	0.000000	discard	cycle 50 u=0.0980	agent0	initial_cond	0	0.000000
exp7484	2.01926478e-29	0.000000	0.000000	discard	cycle 50 u=0.0980	agent0	initial_cond	0	0.000000
exp7485	2.01926478e-29	0.000000	0.000000	discard	cycle 50 u=0.0980	agent0	initial_cond	0	0.000000
exp7486	1.30310780e-28	0.000000	0.000000	discard	cycle 50 u=0.0980	agent0	initial_cond	1	-0.000000
exp7487	1.30310780e-28	0.000000	0.000000	discard	cycle 50 u=0.0980	agent0	initial_cond	0	-0.000000
exp7488	1.30310780e-28	0.000000	0.000000	discard	cycle 50 u=0.0980	agent0	initial_cond	0	-0.000000
exp7489	5.45343271e-29	0.000000	0.000000	discard	cycle 50 u=0.0982	agent0	initial_cond	1	-0.000000
exp7490	5.45343271e-29	0.000000	0.000000	discard	cycle 50 u=0.0982	agent0	initial_cond	0	-0.000000
exp7491	5.45343271e-29	0.000000	0.000000	discard	cycle 50 u=0.0982	agent0	initial_cond	1	-0.000000
exp7492	1.23429977e-28	0.000000	0.000000	discard	cycle 50 u=0.0982	agent0	initial_cond	0	0.000000
exp7493	1.06327351e-17	0.070278	-0.000000	discard	Mesh refinement n_nodes=250 u=0.2080 modes=3	manual	memory	0	0.000097
exp7494	1.23429977e-28	0.000000	0.000000	discard	cycle 50 u=0.0982	agent0	initial_cond	0	0.000000
exp7495	1.23429977e-28	0.000000	0.000000	discard	cycle 50 u=0.0982	agent0	initial_cond	1	0.000000
exp7495	1.06327351e-17	0.070278	-0.000000	discard	Mesh refinement n_nodes=350 u=0.2080 modes=3	manual	memory	1	0.000097
exp7496	1.88036672e-29	0.000000	0.000000	discard	cycle 50 u=0.0982	agent0	initial_cond	0	0.000000
exp7497	1.06327351e-17	0.070278	-0.000000	discard	Mesh refinement n_nodes=400 u=0.2080 modes=3	manual	memory	0	0.000097
exp7498	1.88036672e-29	0.000000	0.000000	discard	cycle 50 u=0.0982	agent0	initial_cond	0	0.000000
exp7499	1.88036672e-29	0.000000	0.000000	discard	cycle 50 u=0.0982	agent0	initial_cond	0	0.000000
exp7500	1.06327351e-17	0.070278	-0.000000	discard	Mesh refinement n_nodes=500 u=0.2080 modes=3	manual	memory	0	0.000097
exp7501	1.91190259e-29	0.000000	-0.000000	discard	cycle 50 u=0.0982	agent0	initial_cond	0	0.000000
exp7502	1.91190259e-29	0.000000	-0.000000	discard	cycle 50 u=0.0982	agent0	initial_cond	1	0.000000
exp7503	1.91190259e-29	0.000000	-0.000000	discard	cycle 50 u=0.0982	agent0	initial_cond	0	0.000000
exp7504	6.13049994e-29	0.000000	0.000000	discard	cycle 50 u=0.0985	agent0	initial_cond	0	0.000000
exp7505	6.13049994e-29	0.000000	0.000000	discard	cycle 50 u=0.0985	agent0	initial_cond	1	0.000000
exp7506	6.13049994e-29	0.000000	0.000000	discard	cycle 50 u=0.0985	agent0	initial_cond	0	0.000000
exp7507	5.49750971e-29	0.000000	0.000000	discard	cycle 50 u=0.0985	agent0	initial_cond	0	0.000000
exp7508	5.49750971e-29	0.000000	0.000000	discard	cycle 50 u=0.0985	agent0	initial_cond	0	0.000000
exp7509	5.49750971e-29	0.000000	0.000000	discard	cycle 50 u=0.0985	agent0	initial_cond	0	0.000000
exp7510	4.15642452e-29	0.000000	0.000000	discard	cycle 50 u=0.0985	agent0	initial_cond	1	0.000000
exp7511	4.15642452e-29	0.000000	0.000000	discard	cycle 50 u=0.0985	agent0	initial_cond	0	0.000000
exp7512	4.15642452e-29	0.000000	0.000000	discard	cycle 50 u=0.0985	agent0	initial_cond	0	0.000000
exp7513	2.19292611e-29	0.000000	0.000000	discard	cycle 50 u=0.0985	agent0	initial_cond	1	-0.000000
exp7514	2.19292611e-29	0.000000	0.000000	discard	cycle 50 u=0.0985	agent0	initial_cond	0	-0.000000
