exp_id	residual	solution_norm	solution_mean	status	description	agent	design	elapsed_s	solution_energy
exp9467	2.61855332e-18	0.000000	-0.000000	discard	3D grid u=0.15 amp=0.40 p=0.0	manual	memory	0	-0.000000
exp9468	5.23962023e-29	0.000000	0.000000	discard	cycle 67 u=0.0975	agent0	initial_cond	0	0.000000
exp9469	3.26447770e-17	0.070278	-0.000000	discard	3D grid u=0.15 amp=0.40 p=0.6	manual	memory	1	0.000097
exp9470	4.03266298e-29	0.000000	0.000000	discard	cycle 67 u=0.0975	agent0	initial_cond	0	0.000000
exp9471	4.03266298e-29	0.000000	0.000000	discard	cycle 67 u=0.0975	agent0	initial_cond	0	0.000000
exp9471	3.66993897e-17	0.070278	-0.000000	discard	3D grid u=0.15 amp=0.40 p=1.2	manual	memory	0	0.000097
exp9472	4.03266298e-29	0.000000	0.000000	discard	cycle 67 u=0.0975	agent0	initial_cond	1	0.000000
exp9473	2.20374241e-17	0.070278	-0.000000	discard	3D grid u=0.15 amp=0.40 p=1.8	manual	memory	1	0.000097
exp9474	4.80015937e-29	0.000000	0.000000	discard	cycle 67 u=0.0975	agent0	initial_cond	0	0.000000
exp9475	3.74086927e-17	0.070278	-0.000000	discard	3D grid u=0.15 amp=0.40 p=2.4	manual	memory	0	0.000097
exp9476	4.80015937e-29	0.000000	0.000000	discard	cycle 67 u=0.0975	agent0	initial_cond	0	0.000000
exp9477	1.24410943e-28	0.000000	-0.000000	discard	3D grid u=0.15 amp=0.45 p=0.0	manual	memory	1	0.000000
exp9478	4.80015937e-29	0.000000	0.000000	discard	cycle 67 u=0.0975	agent0	initial_cond	1	0.000000
exp9479	2.68824537e-29	0.000000	0.000000	discard	cycle 67 u=0.0980	agent0	initial_cond	0	-0.000000
exp9479	2.02048485e-15	0.070278	-0.000000	discard	3D grid u=0.15 amp=0.45 p=0.6	manual	memory	0	0.000097
exp9480	2.68824537e-29	0.000000	0.000000	discard	cycle 67 u=0.0980	agent0	initial_cond	1	-0.000000
exp9481	1.76926434e-15	0.070278	-0.000000	discard	3D grid u=0.15 amp=0.45 p=1.2	manual	memory	1	0.000097
exp9482	2.68824537e-29	0.000000	0.000000	discard	cycle 67 u=0.0980	agent0	initial_cond	0	-0.000000
exp9483	3.78067114e-17	0.070278	0.000000	discard	3D grid u=0.15 amp=0.45 p=1.8	manual	memory	0	0.000097
exp9484	6.16758073e-29	0.000000	0.000000	discard	cycle 67 u=0.0980	agent0	initial_cond	0	-0.000000
exp9485	1.03511764e-17	0.070278	-0.000000	discard	3D grid u=0.15 amp=0.45 p=2.4	manual	memory	1	0.000097
exp9486	6.16758073e-29	0.000000	0.000000	discard	cycle 67 u=0.0980	agent0	initial_cond	1	-0.000000
exp9487	2.42296803e-25	0.000000	-0.000000	discard	3D grid u=0.15 amp=0.50 p=0.0	manual	memory	0	0.000000
exp9487	6.16758073e-29	0.000000	0.000000	discard	cycle 67 u=0.0980	agent0	initial_cond	0	-0.000000
exp9488	2.01926478e-29	0.000000	0.000000	discard	cycle 67 u=0.0980	agent0	initial_cond	0	0.000000
exp9488	3.67268623e-17	0.070278	-0.000000	discard	3D grid u=0.15 amp=0.50 p=0.6	manual	memory	1	0.000097
exp9489	2.01926478e-29	0.000000	0.000000	discard	cycle 67 u=0.0980	agent0	initial_cond	0	0.000000
exp9490	7.32704141e-17	0.070278	-0.000000	discard	3D grid u=0.15 amp=0.50 p=1.2	manual	memory	0	0.000097
exp9491	2.01926478e-29	0.000000	0.000000	discard	cycle 67 u=0.0980	agent0	initial_cond	0	0.000000
exp9492	1.36616511e-15	0.070278	-0.000000	discard	3D grid u=0.15 amp=0.50 p=1.8	manual	memory	1	0.000097
exp9493	1.30310780e-28	0.000000	0.000000	discard	cycle 67 u=0.0980	agent0	initial_cond	1	-0.000000
exp9494	3.59090039e-17	0.070278	-0.000000	discard	3D grid u=0.15 amp=0.50 p=2.4	manual	memory	0	0.000097
exp9494	1.30310780e-28	0.000000	0.000000	discard	cycle 67 u=0.0980	agent0	initial_cond	0	-0.000000
exp9495	1.30310780e-28	0.000000	0.000000	discard	cycle 67 u=0.0980	agent0	initial_cond	0	-0.000000
exp9495	6.24238804e-21	0.000000	-0.000000	discard	3D grid u=0.15 amp=0.55 p=0.0	manual	memory	0	-0.000000
exp9496	5.45343271e-29	0.000000	0.000000	discard	cycle 67 u=0.0982	agent0	initial_cond	0	-0.000000
exp9497	5.06321503e-17	0.070278	-0.000000	discard	3D grid u=0.15 amp=0.55 p=0.6	manual	memory	0	0.000097
exp9498	5.45343271e-29	0.000000	0.000000	discard	cycle 67 u=0.0982	agent0	initial_cond	0	-0.000000
exp9499	3.07254060e-17	0.070278	-0.000000	discard	3D grid u=0.15 amp=0.55 p=1.2	manual	memory	0	0.000097
exp9500	5.45343271e-29	0.000000	0.000000	discard	cycle 67 u=0.0982	agent0	initial_cond	1	-0.000000
exp9501	2.59044716e-17	0.070278	-0.000000	discard	3D grid u=0.15 amp=0.55 p=1.8	manual	memory	0	0.000097
exp9502	1.23429977e-28	0.000000	0.000000	discard	cycle 67 u=0.0982	agent0	initial_cond	0	0.000000
exp9503	1.23429977e-28	0.000000	0.000000	discard	cycle 67 u=0.0982	agent0	initial_cond	0	0.000000
exp9503	2.42881293e-16	0.070278	-0.000000	discard	3D grid u=0.15 amp=0.55 p=2.4	manual	memory	0	0.000097
exp9504	1.23429977e-28	0.000000	0.000000	discard	cycle 67 u=0.0982	agent0	initial_cond	1	0.000000
exp9505	1.20564605e-15	0.000000	-0.000000	discard	3D grid u=0.20 amp=0.35 p=0.0	manual	memory	0	-0.000000
exp9506	1.88036672e-29	0.000000	0.000000	discard	cycle 67 u=0.0982	agent0	initial_cond	0	0.000000
exp9507	3.01844922e-16	0.070278	-0.000000	discard	3D grid u=0.20 amp=0.35 p=0.6	manual	memory	0	0.000097
exp9508	1.88036672e-29	0.000000	0.000000	discard	cycle 67 u=0.0982	agent0	initial_cond	1	0.000000
exp9509	4.90095147e-16	0.070278	0.000000	discard	3D grid u=0.20 amp=0.35 p=1.2	manual	memory	0	0.000097
exp9510	1.88036672e-29	0.000000	0.000000	discard	cycle 67 u=0.0982	agent0	initial_cond	0	0.000000
exp9511	1.49933859e-17	0.070278	-0.000000	discard	3D grid u=0.20 amp=0.35 p=1.8	manual	memory	0	0.000097
exp9511	1.91190259e-29	0.000000	-0.000000	discard	cycle 67 u=0.0982	agent0	initial_cond	0	0.000000
exp9512	1.91190259e-29	0.000000	-0.000000	discard	cycle 67 u=0.0982	agent0	initial_cond	1	0.000000
exp9512	6.25700727e-17	0.070278	-0.000000	discard	3D grid u=0.20 amp=0.35 p=2.4	manual	memory	0	0.000097
exp9513	1.91190259e-29	0.000000	-0.000000	discard	cycle 67 u=0.0982	agent0	initial_cond	0	0.000000
exp9514	2.13110580e-27	0.000000	-0.000000	discard	3D grid u=0.20 amp=0.40 p=0.0	manual	memory	0	-0.000000
exp9515	6.13049994e-29	0.000000	0.000000	discard	cycle 67 u=0.0985	agent0	initial_cond	1	0.000000
exp9516	1.38593211e-17	0.070278	-0.000000	discard	3D grid u=0.20 amp=0.40 p=0.6	manual	memory	1	0.000097
exp9517	6.13049994e-29	0.000000	0.000000	discard	cycle 67 u=0.0985	agent0	initial_cond	0	0.000000
exp9518	1.75198449e-17	0.070278	-0.000000	discard	3D grid u=0.20 amp=0.40 p=1.2	manual	memory	0	0.000097
exp9518	6.13049994e-29	0.000000	0.000000	discard	cycle 67 u=0.0985	agent0	initial_cond	0	0.000000
exp9519	5.49750971e-29	0.000000	0.000000	discard	cycle 67 u=0.0985	agent0	initial_cond	1	0.000000
exp9519	3.27544127e-16	0.070278	-0.000000	discard	3D grid u=0.20 amp=0.40 p=1.8	manual	memory	1	0.000097
exp9520	5.49750971e-29	0.000000	0.000000	discard	cycle 67 u=0.0985	agent0	initial_cond	0	0.000000
exp9521	6.24766082e-17	0.070278	-0.000000	discard	3D grid u=0.20 amp=0.40 p=2.4	manual	memory	0	0.000097
exp9522	5.49750971e-29	0.000000	0.000000	discard	cycle 67 u=0.0985	agent0	initial_cond	0	0.000000
exp9523	1.29011354e-24	0.000000	-0.000000	discard	3D grid u=0.20 amp=0.45 p=0.0	manual	memory	1	-0.000000
exp9524	4.15642452e-29	0.000000	0.000000	discard	cycle 67 u=0.0985	agent0	initial_cond	0	0.000000
exp9525	5.87320191e-17	0.070278	-0.000000	discard	3D grid u=0.20 amp=0.45 p=0.6	manual	memory	0	0.000097
exp9525	4.15642452e-29	0.000000	0.000000	discard	cycle 67 u=0.0985	agent0	initial_cond	0	0.000000
exp9526	4.15642452e-29	0.000000	0.000000	discard	cycle 67 u=0.0985	agent0	initial_cond	1	0.000000
exp9526	3.14425964e-17	0.070278	-0.000000	discard	3D grid u=0.20 amp=0.45 p=1.2	manual	memory	1	0.000097
exp9527	2.19292611e-29	0.000000	0.000000	discard	cycle 67 u=0.0985	agent0	initial_cond	0	-0.000000
exp9528	7.83206833e-17	0.070278	-0.000000	discard	3D grid u=0.20 amp=0.45 p=1.8	manual	memory	0	0.000097
exp9529	2.19292611e-29	0.000000	0.000000	discard	cycle 67 u=0.0985	agent0	initial_cond	0	-0.000000
exp9530	6.50651925e-17	0.070278	-0.000000	discard	3D grid u=0.20 amp=0.45 p=2.4	manual	memory	1	0.000097
exp9531	2.19292611e-29	0.000000	0.000000	discard	cycle 67 u=0.0985	agent0	initial_cond	0	-0.000000
exp9532	1.30405243e-19	0.000000	-0.000000	discard	3D grid u=0.20 amp=0.50 p=0.0	manual	memory	0	-0.000000
exp9533	4.22491788e-29	0.000000	0.000000	discard	cycle 67 u=0.0990	agent0	initial_cond	0	-0.000000
exp9534	4.22491788e-29	0.000000	0.000000	discard	cycle 67 u=0.0990	agent0	initial_cond	1	-0.000000
exp9534	7.12355821e-17	0.070278	-0.000000	discard	3D grid u=0.20 amp=0.50 p=0.6	manual	memory	1	0.000097
exp9535	4.22491788e-29	0.000000	0.000000	discard	cycle 67 u=0.0990	agent0	initial_cond	0	-0.000000
exp9536	1.16696637e-17	0.070278	-0.000000	discard	3D grid u=0.20 amp=0.50 p=1.2	manual	memory	0	0.000097
exp9537	3.22245147e-29	0.000000	0.000000	discard	cycle 67 u=0.0990	agent0	initial_cond	0	0.000000
exp9538	4.09047026e-17	0.070278	-0.000000	discard	3D grid u=0.20 amp=0.50 p=1.8	manual	memory	1	0.000097
exp9539	3.22245147e-29	0.000000	0.000000	discard	cycle 67 u=0.0990	agent0	initial_cond	1	0.000000
exp9540	8.24092926e-16	0.070278	-0.000000	discard	3D grid u=0.20 amp=0.50 p=2.4	manual	memory	0	0.000097
exp9541	3.22245147e-29	0.000000	0.000000	discard	cycle 67 u=0.0990	agent0	initial_cond	0	0.000000
exp9542	2.51289830e-28	0.000000	0.000000	discard	3D grid u=0.20 amp=0.55 p=0.0	manual	memory	1	0.000000
exp9542	4.50941488e-29	0.000000	-0.000000	discard	cycle 67 u=0.0990	agent0	initial_cond	1	0.000000
exp9543	4.50941488e-29	0.000000	-0.000000	discard	cycle 67 u=0.0990	agent0	initial_cond	0	0.000000
exp9543	8.05627723e-16	0.070278	-0.000000	discard	3D grid u=0.20 amp=0.55 p=0.6	manual	memory	0	0.000097
exp9544	4.50941488e-29	0.000000	-0.000000	discard	cycle 67 u=0.0990	agent0	initial_cond	0	0.000000
exp9545	5.94662464e-17	0.070278	-0.000000	discard	3D grid u=0.20 amp=0.55 p=1.2	manual	memory	0	0.000097
exp9546	4.88330883e-29	0.000000	-0.000000	discard	cycle 67 u=0.0990	agent0	initial_cond	1	0.000000
exp9547	7.92407404e-17	0.070278	0.000000	discard	3D grid u=0.20 amp=0.55 p=1.8	manual	memory	0	0.000097
exp9548	4.88330883e-29	0.000000	-0.000000	discard	cycle 67 u=0.0990	agent0	initial_cond	0	0.000000
exp9549	3.71432922e-17	0.070278	-0.000000	discard	3D grid u=0.20 amp=0.55 p=2.4	manual	memory	0	0.000097
exp9549	4.88330883e-29	0.000000	-0.000000	discard	cycle 67 u=0.0990	agent0	initial_cond	1	0.000000
exp9550	5.74085541e-29	0.000000	-0.000000	discard	cycle 67 u=0.0995	agent0	initial_cond	0	0.000000
exp9550	2.54086746e-25	0.000000	-0.000000	discard	3D grid u=0.25 amp=0.35 p=0.0	manual	memory	0	0.000000
exp9551	5.74085541e-29	0.000000	-0.000000	discard	cycle 67 u=0.0995	agent0	initial_cond	0	0.000000
exp9552	1.97475708e-17	0.070278	-0.000000	discard	3D grid u=0.25 amp=0.35 p=0.6	manual	memory	0	0.000097
exp9553	5.74085541e-29	0.000000	-0.000000	discard	cycle 67 u=0.0995	agent0	initial_cond	1	0.000000
exp9554	4.10499077e-17	0.070278	-0.000000	discard	3D grid u=0.25 amp=0.35 p=1.2	manual	memory	0	0.000097
exp9555	1.54984578e-28	0.000000	0.000000	discard	cycle 67 u=0.0995	agent0	initial_cond	0	-0.000000
exp9556	3.97312421e-15	0.070278	-0.000000	discard	3D grid u=0.25 amp=0.35 p=1.8	manual	memory	0	0.000097
exp9557	1.54984578e-28	0.000000	0.000000	discard	cycle 67 u=0.0995	agent0	initial_cond	0	-0.000000
exp9558	1.54984578e-28	0.000000	0.000000	discard	cycle 67 u=0.0995	agent0	initial_cond	0	-0.000000
exp9558	5.93754574e-17	0.070278	-0.000000	discard	3D grid u=0.25 amp=0.35 p=2.4	manual	memory	0	0.000097
exp9559	1.60328418e-29	0.000000	-0.000000	discard	cycle 67 u=0.0995	agent0	initial_cond	0	-0.000000
exp9560	1.76669748e-22	0.000000	-0.000000	discard	3D grid u=0.25 amp=0.40 p=0.0	manual	memory	0	-0.000000
exp9561	1.60328418e-29	0.000000	-0.000000	discard	cycle 67 u=0.0995	agent0	initial_cond	1	-0.000000
exp9562	2.95979061e-17	0.070278	-0.000000	discard	3D grid u=0.25 amp=0.40 p=0.6	manual	memory	0	0.000097
exp9563	1.60328418e-29	0.000000	-0.000000	discard	cycle 67 u=0.0995	agent0	initial_cond	0	-0.000000
exp9564	3.88310466e-17	0.070278	-0.000000	discard	3D grid u=0.25 amp=0.40 p=1.2	manual	memory	0	0.000097
exp9565	7.34590618e-29	0.000000	0.000000	discard	cycle 67 u=0.0995	agent0	initial_cond	0	0.000000
exp9566	7.34590618e-29	0.000000	0.000000	discard	cycle 67 u=0.0995	agent0	initial_cond	1	0.000000
exp9566	7.11607294e-17	0.070278	0.000000	discard	3D grid u=0.25 amp=0.40 p=1.8	manual	memory	1	0.000097
exp9567	7.34590618e-29	0.000000	0.000000	discard	cycle 67 u=0.0995	agent0	initial_cond	0	0.000000
exp9568	1.58872853e-16	0.070278	-0.000000	discard	3D grid u=0.25 amp=0.40 p=2.4	manual	memory	0	0.000097
exp9569	4.46546993e-29	0.000000	0.000000	discard	cycle 67 u=0.1000	agent0	initial_cond	1	-0.000000
exp9570	4.61300527e-18	0.000000	-0.000000	discard	3D grid u=0.25 amp=0.45 p=0.0	manual	memory	1	-0.000000
exp9571	4.46546993e-29	0.000000	0.000000	discard	cycle 67 u=0.1000	agent0	initial_cond	0	-0.000000
exp9572	3.66838022e-17	0.070278	-0.000000	discard	3D grid u=0.25 amp=0.45 p=0.6	manual	memory	0	0.000097
exp9573	4.46546993e-29	0.000000	0.000000	discard	cycle 67 u=0.1000	agent0	initial_cond	0	-0.000000
exp9574	6.64822587e-17	0.070278	-0.000000	discard	3D grid u=0.25 amp=0.45 p=1.2	manual	memory	1	0.000097
exp9574	4.08106752e-29	0.000000	0.000000	discard	cycle 67 u=0.1000	agent0	initial_cond	1	-0.000000
exp9575	4.08106752e-29	0.000000	0.000000	discard	cycle 67 u=0.1000	agent0	initial_cond	0	-0.000000
exp9575	2.63820776e-17	0.070278	-0.000000	discard	3D grid u=0.25 amp=0.45 p=1.8	manual	memory	0	0.000097
exp9576	4.08106752e-29	0.000000	0.000000	discard	cycle 67 u=0.1000	agent0	initial_cond	1	-0.000000
exp9577	3.70497176e-15	0.070278	-0.000000	discard	3D grid u=0.25 amp=0.45 p=2.4	manual	memory	1	0.000097
exp9578	4.58623706e-29	0.000000	0.000000	discard	cycle 67 u=0.1000	agent0	initial_cond	0	-0.000000
exp9579	1.78089317e-28	0.000000	-0.000000	discard	3D grid u=0.25 amp=0.50 p=0.0	manual	memory	0	-0.000000
exp9580	4.58623706e-29	0.000000	0.000000	discard	cycle 67 u=0.1000	agent0	initial_cond	0	-0.000000
exp9581	1.05544026e-15	0.070278	-0.000000	discard	3D grid u=0.25 amp=0.50 p=0.6	manual	memory	1	0.000097
exp9581	4.58623706e-29	0.000000	0.000000	discard	cycle 67 u=0.1000	agent0	initial_cond	1	-0.000000
exp9582	4.39794337e-29	0.000000	0.000000	discard	cycle 67 u=0.1000	agent0	initial_cond	0	-0.000000
exp9582	9.24695012e-17	0.070278	-0.000000	discard	3D grid u=0.25 amp=0.50 p=1.2	manual	memory	0	0.000097
exp9583	4.39794337e-29	0.000000	0.000000	discard	cycle 67 u=0.1000	agent0	initial_cond	0	-0.000000
exp9584	7.20529291e-17	0.070278	-0.000000	discard	3D grid u=0.25 amp=0.50 p=1.8	manual	memory	1	0.000097
exp9585	4.39794337e-29	0.000000	0.000000	discard	cycle 67 u=0.1000	agent0	initial_cond	0	-0.000000
exp9586	9.27187051e-18	0.070278	-0.000000	discard	3D grid u=0.25 amp=0.50 p=2.4	manual	memory	0	0.000097
exp9587	1.36727475e-28	0.000000	0.000000	discard	cycle 67 u=0.1050	agent0	initial_cond	0	-0.000000
exp9588	5.36705470e-25	0.000000	-0.000000	discard	3D grid u=0.25 amp=0.55 p=0.0	manual	memory	1	-0.000000
exp9589	1.36727475e-28	0.000000	0.000000	discard	cycle 67 u=0.1050	agent0	initial_cond	1	-0.000000
exp9590	1.36727475e-28	0.000000	0.000000	discard	cycle 67 u=0.1050	agent0	initial_cond	0	-0.000000
exp9590	2.03006162e-17	0.070278	-0.000000	discard	3D grid u=0.25 amp=0.55 p=0.6	manual	memory	0	0.000097
exp9591	6.14461376e-29	0.000000	0.000000	discard	cycle 67 u=0.1050	agent0	initial_cond	0	-0.000000
exp9592	8.19184473e-17	0.070278	-0.000000	discard	3D grid u=0.25 amp=0.55 p=1.2	manual	memory	1	0.000097
exp9593	6.14461376e-29	0.000000	0.000000	discard	cycle 67 u=0.1050	agent0	initial_cond	0	-0.000000
exp9594	2.53905646e-17	0.070278	-0.000000	discard	3D grid u=0.25 amp=0.55 p=1.8	manual	memory	0	0.000097
exp9595	6.14461376e-29	0.000000	0.000000	discard	cycle 67 u=0.1050	agent0	initial_cond	0	-0.000000
exp9596	3.81085822e-17	0.070278	0.000000	discard	3D grid u=0.25 amp=0.55 p=2.4	manual	memory	1	0.000097
exp9597	1.75906666e-28	0.000000	0.000000	discard	cycle 67 u=0.1050	agent0	initial_cond	1	-0.000000
exp9598	1.98662702e-19	0.000000	-0.000000	discard	3D grid u=0.30 amp=0.35 p=0.0	manual	memory	0	-0.000000
exp9598	1.75906666e-28	0.000000	0.000000	discard	cycle 67 u=0.1050	agent0	initial_cond	0	-0.000000
exp9599	1.75906666e-28	0.000000	0.000000	discard	cycle 67 u=0.1050	agent0	initial_cond	0	-0.000000
exp9600	9.99408755e-17	0.070278	-0.000000	discard	3D grid u=0.30 amp=0.35 p=0.6	manual	memory	0	0.000097
exp9601	1.11257917e-28	0.000000	0.000000	discard	cycle 67 u=0.1050	agent0	initial_cond	1	-0.000000
exp9602	4.94167427e-17	0.070278	-0.000000	discard	3D grid u=0.30 amp=0.35 p=1.2	manual	memory	0	0.000097
exp9603	1.11257917e-28	0.000000	0.000000	discard	cycle 67 u=0.1050	agent0	initial_cond	0	-0.000000
exp9604	8.58601030e-18	0.070278	-0.000000	discard	3D grid u=0.30 amp=0.35 p=1.8	manual	memory	0	0.000097
exp9605	1.11257917e-28	0.000000	0.000000	discard	cycle 67 u=0.1050	agent0	initial_cond	1	-0.000000
exp9606	1.00605675e-15	0.070278	-0.000000	discard	3D grid u=0.30 amp=0.35 p=2.4	manual	memory	0	0.000097
exp9606	8.58580947e-29	0.000000	0.000000	discard	cycle 68 u=0.0975	agent0	initial_cond	0	0.000000
exp9607	8.58580947e-29	0.000000	0.000000	discard	cycle 68 u=0.0975	agent0	initial_cond	0	0.000000
exp9607	4.68038135e-16	0.000000	-0.000000	discard	3D grid u=0.30 amp=0.40 p=0.0	manual	memory	0	-0.000000
exp9608	8.58580947e-29	0.000000	0.000000	discard	cycle 68 u=0.0975	agent0	initial_cond	1	0.000000
exp9609	8.39702524e-17	0.070278	-0.000000	discard	3D grid u=0.30 amp=0.40 p=0.6	manual	memory	0	0.000097
exp9610	5.23962023e-29	0.000000	0.000000	discard	cycle 68 u=0.0975	agent0	initial_cond	0	0.000000
exp9611	6.21912346e-17	0.070278	-0.000000	discard	3D grid u=0.30 amp=0.40 p=1.2	manual	memory	0	0.000097
exp9612	5.23962023e-29	0.000000	0.000000	discard	cycle 68 u=0.0975	agent0	initial_cond	1	0.000000
exp9613	2.39088648e-17	0.070278	-0.000000	discard	3D grid u=0.30 amp=0.40 p=1.8	manual	memory	0	0.000097
exp9613	5.23962023e-29	0.000000	0.000000	discard	cycle 68 u=0.0975	agent0	initial_cond	0	0.000000
exp9614	4.03266298e-29	0.000000	0.000000	discard	cycle 68 u=0.0975	agent0	initial_cond	0	0.000000
exp9614	1.72358711e-17	0.070278	-0.000000	discard	3D grid u=0.30 amp=0.40 p=2.4	manual	memory	0	0.000097
exp9615	4.03266298e-29	0.000000	0.000000	discard	cycle 68 u=0.0975	agent0	initial_cond	1	0.000000
exp9616	2.66886174e-27	0.000000	0.000000	discard	3D grid u=0.30 amp=0.45 p=0.0	manual	memory	0	0.000000
exp9617	4.03266298e-29	0.000000	0.000000	discard	cycle 68 u=0.0975	agent0	initial_cond	0	0.000000
exp9618	4.23653242e-15	0.070278	-0.000000	discard	3D grid u=0.30 amp=0.45 p=0.6	manual	memory	0	0.000097
exp9619	4.80015937e-29	0.000000	0.000000	discard	cycle 68 u=0.0975	agent0	initial_cond	0	0.000000
exp9620	3.26315403e-16	0.070278	-0.000000	discard	3D grid u=0.30 amp=0.45 p=1.2	manual	memory	1	0.000097
exp9621	4.80015937e-29	0.000000	0.000000	discard	cycle 68 u=0.0975	agent0	initial_cond	0	0.000000
exp9622	4.80015937e-29	0.000000	0.000000	discard	cycle 68 u=0.0975	agent0	initial_cond	0	0.000000
exp9622	1.85256283e-17	0.070278	-0.000000	discard	3D grid u=0.30 amp=0.45 p=1.8	manual	memory	0	0.000097
exp9623	2.68824537e-29	0.000000	0.000000	discard	cycle 68 u=0.0980	agent0	initial_cond	1	-0.000000
exp9624	3.49373511e-17	0.070278	-0.000000	discard	3D grid u=0.30 amp=0.45 p=2.4	manual	memory	1	0.000097
exp9625	2.68824537e-29	0.000000	0.000000	discard	cycle 68 u=0.0980	agent0	initial_cond	0	-0.000000
exp9626	2.50546645e-24	0.000000	-0.000000	discard	3D grid u=0.30 amp=0.50 p=0.0	manual	memory	0	-0.000000
exp9627	2.68824537e-29	0.000000	0.000000	discard	cycle 68 u=0.0980	agent0	initial_cond	0	-0.000000
exp9628	4.39400605e-17	0.070278	-0.000000	discard	3D grid u=0.30 amp=0.50 p=0.6	manual	memory	1	0.000097
exp9629	6.16758073e-29	0.000000	0.000000	discard	cycle 68 u=0.0980	agent0	initial_cond	0	-0.000000
exp9630	3.41648831e-17	0.070278	-0.000000	discard	3D grid u=0.30 amp=0.50 p=1.2	manual	memory	0	0.000097
exp9630	6.16758073e-29	0.000000	0.000000	discard	cycle 68 u=0.0980	agent0	initial_cond	0	-0.000000
exp9631	6.16758073e-29	0.000000	0.000000	discard	cycle 68 u=0.0980	agent0	initial_cond	1	-0.000000
exp9632	4.29762645e-17	0.070278	-0.000000	discard	3D grid u=0.30 amp=0.50 p=1.8	manual	memory	1	0.000097
exp9633	2.01926478e-29	0.000000	0.000000	discard	cycle 68 u=0.0980	agent0	initial_cond	0	0.000000
exp9634	2.44927748e-17	0.070278	-0.000000	discard	3D grid u=0.30 amp=0.50 p=2.4	manual	memory	0	0.000097
exp9635	2.01926478e-29	0.000000	0.000000	discard	cycle 68 u=0.0980	agent0	initial_cond	0	0.000000
exp9636	5.80329971e-16	0.000000	-0.000000	discard	3D grid u=0.30 amp=0.55 p=0.0	manual	memory	1	-0.000000
exp9637	2.01926478e-29	0.000000	0.000000	discard	cycle 68 u=0.0980	agent0	initial_cond	0	0.000000
exp9638	1.82845312e-17	0.070278	-0.000000	discard	3D grid u=0.30 amp=0.55 p=0.6	manual	memory	0	0.000097
exp9638	1.30310780e-28	0.000000	0.000000	discard	cycle 68 u=0.0980	agent0	initial_cond	0	-0.000000
exp9639	1.30310780e-28	0.000000	0.000000	discard	cycle 68 u=0.0980	agent0	initial_cond	1	-0.000000
exp9639	5.74473735e-17	0.070278	-0.000000	discard	3D grid u=0.30 amp=0.55 p=1.2	manual	memory	1	0.000097
exp9640	1.30310780e-28	0.000000	0.000000	discard	cycle 68 u=0.0980	agent0	initial_cond	0	-0.000000
exp9641	7.21717496e-16	0.070278	0.000000	discard	3D grid u=0.30 amp=0.55 p=1.8	manual	memory	0	0.000097
exp9642	5.45343271e-29	0.000000	0.000000	discard	cycle 68 u=0.0982	agent0	initial_cond	0	-0.000000
exp9643	2.49231472e-17	0.070278	-0.000000	discard	3D grid u=0.30 amp=0.55 p=2.4	manual	memory	1	0.000097
exp9644	5.45343271e-29	0.000000	0.000000	discard	cycle 68 u=0.0982	agent0	initial_cond	1	-0.000000
exp9645	2.79571111e-27	0.000000	-0.000000	discard	3D grid u=0.35 amp=0.35 p=0.0	manual	memory	0	-0.000000
exp9645	5.45343271e-29	0.000000	0.000000	discard	cycle 68 u=0.0982	agent0	initial_cond	0	-0.000000
exp9646	1.23429977e-28	0.000000	0.000000	discard	cycle 68 u=0.0982	agent0	initial_cond	1	0.000000
