exp_id	residual	solution_norm	solution_mean	status	description	agent	design	elapsed_s	solution_energy
exp8907	1.60328418e-29	0.000000	-0.000000	discard	cycle 62 u=0.0995	agent0	initial_cond	0	-0.000000
exp8908	1.60328418e-29	0.000000	-0.000000	discard	cycle 62 u=0.0995	agent0	initial_cond	1	-0.000000
exp8908	2.91235584e-17	0.070278	-0.000000	discard	3D fine u=0.243 amp=0.45 phase=1.20	manual	memory	1	0.000097
exp8909	7.34590618e-29	0.000000	0.000000	discard	cycle 62 u=0.0995	agent0	initial_cond	0	0.000000
exp8910	5.93369028e-17	0.070278	0.000000	discard	3D fine u=0.243 amp=0.45 phase=1.23	manual	memory	0	0.000097
exp8911	7.34590618e-29	0.000000	0.000000	discard	cycle 62 u=0.0995	agent0	initial_cond	0	0.000000
exp8912	4.37276621e-17	0.070278	-0.000000	discard	3D fine u=0.243 amp=0.45 phase=1.25	manual	memory	1	0.000097
exp8913	7.34590618e-29	0.000000	0.000000	discard	cycle 62 u=0.0995	agent0	initial_cond	1	0.000000
exp8914	2.53038767e-17	0.070278	-0.000000	discard	3D fine u=0.243 amp=0.46 phase=1.15	manual	memory	0	0.000097
exp8914	4.46546993e-29	0.000000	0.000000	discard	cycle 62 u=0.1000	agent0	initial_cond	0	-0.000000
exp8915	4.46546993e-29	0.000000	0.000000	discard	cycle 62 u=0.1000	agent0	initial_cond	0	-0.000000
exp8916	3.18903507e-17	0.070278	-0.000000	discard	3D fine u=0.243 amp=0.46 phase=1.17	manual	memory	1	0.000097
exp8917	4.46546993e-29	0.000000	0.000000	discard	cycle 62 u=0.1000	agent0	initial_cond	0	-0.000000
exp8918	2.40177606e-17	0.070278	-0.000000	discard	3D fine u=0.243 amp=0.46 phase=1.20	manual	memory	0	0.000097
exp8919	4.08106752e-29	0.000000	0.000000	discard	cycle 62 u=0.1000	agent0	initial_cond	0	-0.000000
exp8920	2.65206488e-17	0.070278	-0.000000	discard	3D fine u=0.243 amp=0.46 phase=1.23	manual	memory	1	0.000097
exp8921	4.08106752e-29	0.000000	0.000000	discard	cycle 62 u=0.1000	agent0	initial_cond	1	-0.000000
exp8922	4.08106752e-29	0.000000	0.000000	discard	cycle 62 u=0.1000	agent0	initial_cond	0	-0.000000
exp8922	6.87245679e-17	0.070278	-0.000000	discard	3D fine u=0.243 amp=0.46 phase=1.25	manual	memory	0	0.000097
exp8923	4.58623706e-29	0.000000	0.000000	discard	cycle 62 u=0.1000	agent0	initial_cond	0	-0.000000
exp8924	1.71699456e-17	0.070278	-0.000000	discard	3D fine u=0.244 amp=0.44 phase=1.15	manual	memory	1	0.000097
exp8925	4.58623706e-29	0.000000	0.000000	discard	cycle 62 u=0.1000	agent0	initial_cond	0	-0.000000
exp8926	6.06509591e-17	0.070278	-0.000000	discard	3D fine u=0.244 amp=0.44 phase=1.17	manual	memory	0	0.000097
exp8927	4.58623706e-29	0.000000	0.000000	discard	cycle 62 u=0.1000	agent0	initial_cond	0	-0.000000
exp8928	1.44454409e-17	0.070278	-0.000000	discard	3D fine u=0.244 amp=0.44 phase=1.20	manual	memory	1	0.000097
exp8928	4.39794337e-29	0.000000	0.000000	discard	cycle 62 u=0.1000	agent0	initial_cond	1	-0.000000
exp8929	4.39794337e-29	0.000000	0.000000	discard	cycle 62 u=0.1000	agent0	initial_cond	0	-0.000000
exp8930	6.91159813e-18	0.070278	-0.000000	discard	3D fine u=0.244 amp=0.44 phase=1.23	manual	memory	0	0.000097
exp8931	4.39794337e-29	0.000000	0.000000	discard	cycle 62 u=0.1000	agent0	initial_cond	0	-0.000000
exp8932	3.20293509e-17	0.070278	-0.000000	discard	3D fine u=0.244 amp=0.44 phase=1.25	manual	memory	1	0.000097
exp8933	1.36727475e-28	0.000000	0.000000	discard	cycle 62 u=0.1050	agent0	initial_cond	1	-0.000000
exp8934	8.70396439e-18	0.070278	-0.000000	discard	3D fine u=0.244 amp=0.45 phase=1.15	manual	memory	0	0.000097
exp8935	1.36727475e-28	0.000000	0.000000	discard	cycle 62 u=0.1050	agent0	initial_cond	0	-0.000000
exp8936	1.36727475e-28	0.000000	0.000000	discard	cycle 62 u=0.1050	agent0	initial_cond	1	-0.000000
exp8936	3.67911233e-17	0.070278	-0.000000	discard	3D fine u=0.244 amp=0.45 phase=1.17	manual	memory	1	0.000097
exp8937	6.14461376e-29	0.000000	0.000000	discard	cycle 62 u=0.1050	agent0	initial_cond	0	-0.000000
exp8938	2.47758985e-17	0.070278	-0.000000	discard	3D fine u=0.244 amp=0.45 phase=1.20	manual	memory	0	0.000097
exp8939	6.14461376e-29	0.000000	0.000000	discard	cycle 62 u=0.1050	agent0	initial_cond	0	-0.000000
exp8940	2.14394205e-17	0.070278	-0.000000	discard	3D fine u=0.244 amp=0.45 phase=1.23	manual	memory	1	0.000097
exp8941	6.14461376e-29	0.000000	0.000000	discard	cycle 62 u=0.1050	agent0	initial_cond	1	-0.000000
exp8942	3.63955875e-17	0.070278	-0.000000	discard	3D fine u=0.244 amp=0.45 phase=1.25	manual	memory	0	0.000097
exp8942	1.75906666e-28	0.000000	0.000000	discard	cycle 62 u=0.1050	agent0	initial_cond	0	-0.000000
exp8943	1.75906666e-28	0.000000	0.000000	discard	cycle 62 u=0.1050	agent0	initial_cond	0	-0.000000
exp8944	1.74768225e-17	0.070278	-0.000000	discard	3D fine u=0.244 amp=0.46 phase=1.15	manual	memory	1	0.000097
exp8945	1.75906666e-28	0.000000	0.000000	discard	cycle 62 u=0.1050	agent0	initial_cond	0	-0.000000
exp8946	6.54097499e-17	0.070278	-0.000000	discard	3D fine u=0.244 amp=0.46 phase=1.17	manual	memory	0	0.000097
exp8947	1.11257917e-28	0.000000	0.000000	discard	cycle 62 u=0.1050	agent0	initial_cond	0	-0.000000
exp8948	1.55904980e-17	0.070278	-0.000000	discard	3D fine u=0.244 amp=0.46 phase=1.20	manual	memory	1	0.000097
exp8949	1.11257917e-28	0.000000	0.000000	discard	cycle 62 u=0.1050	agent0	initial_cond	1	-0.000000
exp8950	1.11257917e-28	0.000000	0.000000	discard	cycle 62 u=0.1050	agent0	initial_cond	0	-0.000000
exp8950	8.53592075e-17	0.070278	-0.000000	discard	3D fine u=0.244 amp=0.46 phase=1.23	manual	memory	0	0.000097
exp8951	8.58580947e-29	0.000000	0.000000	discard	cycle 63 u=0.0975	agent0	initial_cond	0	0.000000
exp8952	3.09945735e-17	0.070278	0.000000	discard	3D fine u=0.244 amp=0.46 phase=1.25	manual	memory	1	0.000097
exp8953	8.58580947e-29	0.000000	0.000000	discard	cycle 63 u=0.0975	agent0	initial_cond	1	0.000000
exp8954	8.58580947e-29	0.000000	0.000000	discard	cycle 63 u=0.0975	agent0	initial_cond	0	0.000000
exp8955	5.23962023e-29	0.000000	0.000000	discard	cycle 63 u=0.0975	agent0	initial_cond	1	0.000000
exp8956	5.23962023e-29	0.000000	0.000000	discard	cycle 63 u=0.0975	agent0	initial_cond	0	0.000000
exp8957	5.23962023e-29	0.000000	0.000000	discard	cycle 63 u=0.0975	agent0	initial_cond	0	0.000000
exp8958	4.03266298e-29	0.000000	0.000000	discard	cycle 63 u=0.0975	agent0	initial_cond	1	0.000000
exp8959	4.03266298e-29	0.000000	0.000000	discard	cycle 63 u=0.0975	agent0	initial_cond	0	0.000000
exp8960	4.03266298e-29	0.000000	0.000000	discard	cycle 63 u=0.0975	agent0	initial_cond	0	0.000000
exp8961	4.80015937e-29	0.000000	0.000000	discard	cycle 63 u=0.0975	agent0	initial_cond	0	0.000000
exp8962	4.80015937e-29	0.000000	0.000000	discard	cycle 63 u=0.0975	agent0	initial_cond	0	0.000000
exp8963	4.80015937e-29	0.000000	0.000000	discard	cycle 63 u=0.0975	agent0	initial_cond	1	0.000000
exp8964	2.68824537e-29	0.000000	0.000000	discard	cycle 63 u=0.0980	agent0	initial_cond	0	-0.000000
exp8965	2.68824537e-29	0.000000	0.000000	discard	cycle 63 u=0.0980	agent0	initial_cond	0	-0.000000
exp8966	2.68824537e-29	0.000000	0.000000	discard	cycle 63 u=0.0980	agent0	initial_cond	0	-0.000000
exp8967	6.16758073e-29	0.000000	0.000000	discard	cycle 63 u=0.0980	agent0	initial_cond	0	-0.000000
exp8968	6.16758073e-29	0.000000	0.000000	discard	cycle 63 u=0.0980	agent0	initial_cond	1	-0.000000
exp8969	6.16758073e-29	0.000000	0.000000	discard	cycle 63 u=0.0980	agent0	initial_cond	0	-0.000000
exp8970	2.01926478e-29	0.000000	0.000000	discard	cycle 63 u=0.0980	agent0	initial_cond	0	0.000000
exp8971	2.01926478e-29	0.000000	0.000000	discard	cycle 63 u=0.0980	agent0	initial_cond	1	0.000000
exp8972	2.01926478e-29	0.000000	0.000000	discard	cycle 63 u=0.0980	agent0	initial_cond	0	0.000000
exp8973	1.30310780e-28	0.000000	0.000000	discard	cycle 63 u=0.0980	agent0	initial_cond	1	-0.000000
exp8974	1.30310780e-28	0.000000	0.000000	discard	cycle 63 u=0.0980	agent0	initial_cond	0	-0.000000
exp8975	1.30310780e-28	0.000000	0.000000	discard	cycle 63 u=0.0980	agent0	initial_cond	0	-0.000000
exp8976	5.45343271e-29	0.000000	0.000000	discard	cycle 63 u=0.0982	agent0	initial_cond	1	-0.000000
exp8977	5.45343271e-29	0.000000	0.000000	discard	cycle 63 u=0.0982	agent0	initial_cond	0	-0.000000
exp8978	5.45343271e-29	0.000000	0.000000	discard	cycle 63 u=0.0982	agent0	initial_cond	0	-0.000000
exp8979	1.23429977e-28	0.000000	0.000000	discard	cycle 63 u=0.0982	agent0	initial_cond	0	0.000000
exp8980	1.23429977e-28	0.000000	0.000000	discard	cycle 63 u=0.0982	agent0	initial_cond	0	0.000000
exp8981	1.23429977e-28	0.000000	0.000000	discard	cycle 63 u=0.0982	agent0	initial_cond	1	0.000000
exp8982	1.88036672e-29	0.000000	0.000000	discard	cycle 63 u=0.0982	agent0	initial_cond	0	0.000000
exp8983	1.48104335e-17	0.070278	-0.000000	discard	Ultra-3D u=0.242 amp=0.43 phase=1.20	manual	memory	0	0.000097
exp8983	1.88036672e-29	0.000000	0.000000	discard	cycle 63 u=0.0982	agent0	initial_cond	0	0.000000
exp8984	1.88036672e-29	0.000000	0.000000	discard	cycle 63 u=0.0982	agent0	initial_cond	1	0.000000
exp8984	3.66153995e-17	0.070278	-0.000000	discard	Ultra-3D u=0.242 amp=0.43 phase=1.21	manual	memory	0	0.000097
exp8985	1.91190259e-29	0.000000	-0.000000	discard	cycle 63 u=0.0982	agent0	initial_cond	0	0.000000
exp8986	5.74840895e-17	0.070278	-0.000000	discard	Ultra-3D u=0.242 amp=0.43 phase=1.22	manual	memory	0	0.000097
exp8987	1.91190259e-29	0.000000	-0.000000	discard	cycle 63 u=0.0982	agent0	initial_cond	1	0.000000
exp8988	1.20210298e-17	0.070278	0.000000	discard	Ultra-3D u=0.242 amp=0.43 phase=1.23	manual	memory	1	0.000097
exp8989	1.91190259e-29	0.000000	-0.000000	discard	cycle 63 u=0.0982	agent0	initial_cond	0	0.000000
exp8990	1.52817680e-17	0.070278	-0.000000	discard	Ultra-3D u=0.242 amp=0.43 phase=1.24	manual	memory	0	0.000097
exp8991	6.13049994e-29	0.000000	0.000000	discard	cycle 63 u=0.0985	agent0	initial_cond	0	0.000000
exp8992	6.13049994e-29	0.000000	0.000000	discard	cycle 63 u=0.0985	agent0	initial_cond	1	0.000000
exp8992	8.47776983e-18	0.070278	-0.000000	discard	Ultra-3D u=0.242 amp=0.43 phase=1.25	manual	memory	1	0.000097
exp8993	6.13049994e-29	0.000000	0.000000	discard	cycle 63 u=0.0985	agent0	initial_cond	0	0.000000
exp8994	3.22381434e-17	0.070278	-0.000000	discard	Ultra-3D u=0.242 amp=0.44 phase=1.20	manual	memory	0	0.000097
exp8995	5.49750971e-29	0.000000	0.000000	discard	cycle 63 u=0.0985	agent0	initial_cond	0	0.000000
exp8996	3.66474544e-17	0.070278	-0.000000	discard	Ultra-3D u=0.242 amp=0.44 phase=1.21	manual	memory	1	0.000097
exp8997	5.49750971e-29	0.000000	0.000000	discard	cycle 63 u=0.0985	agent0	initial_cond	0	0.000000
exp8998	2.53942580e-17	0.070278	-0.000000	discard	Ultra-3D u=0.242 amp=0.44 phase=1.22	manual	memory	0	0.000097
exp8999	5.49750971e-29	0.000000	0.000000	discard	cycle 63 u=0.0985	agent0	initial_cond	0	0.000000
exp9000	4.15642452e-29	0.000000	0.000000	discard	cycle 63 u=0.0985	agent0	initial_cond	1	0.000000
exp9000	4.46364432e-17	0.070278	-0.000000	discard	Ultra-3D u=0.242 amp=0.44 phase=1.23	manual	memory	1	0.000097
exp9001	4.15642452e-29	0.000000	0.000000	discard	cycle 63 u=0.0985	agent0	initial_cond	0	0.000000
exp9002	3.82969490e-17	0.070278	-0.000000	discard	Ultra-3D u=0.242 amp=0.44 phase=1.24	manual	memory	0	0.000097
exp9003	4.15642452e-29	0.000000	0.000000	discard	cycle 63 u=0.0985	agent0	initial_cond	0	0.000000
exp9004	5.61030385e-17	0.070278	-0.000000	discard	Ultra-3D u=0.242 amp=0.44 phase=1.25	manual	memory	1	0.000097
exp9005	2.19292611e-29	0.000000	0.000000	discard	cycle 63 u=0.0985	agent0	initial_cond	0	-0.000000
exp9006	7.15119071e-18	0.070278	-0.000000	discard	Ultra-3D u=0.242 amp=0.45 phase=1.20	manual	memory	0	0.000097
exp9007	2.19292611e-29	0.000000	0.000000	discard	cycle 63 u=0.0985	agent0	initial_cond	0	-0.000000
exp9008	3.20113250e-17	0.070278	-0.000000	discard	Ultra-3D u=0.242 amp=0.45 phase=1.21	manual	memory	1	0.000097
exp9008	2.19292611e-29	0.000000	0.000000	discard	cycle 63 u=0.0985	agent0	initial_cond	1	-0.000000
exp9009	4.22491788e-29	0.000000	0.000000	discard	cycle 63 u=0.0990	agent0	initial_cond	0	-0.000000
exp9010	1.50525191e-17	0.070278	-0.000000	discard	Ultra-3D u=0.242 amp=0.45 phase=1.22	manual	memory	0	0.000097
exp9011	4.22491788e-29	0.000000	0.000000	discard	cycle 63 u=0.0990	agent0	initial_cond	0	-0.000000
exp9012	3.41616978e-17	0.070278	-0.000000	discard	Ultra-3D u=0.242 amp=0.45 phase=1.23	manual	memory	1	0.000097
exp9013	4.22491788e-29	0.000000	0.000000	discard	cycle 63 u=0.0990	agent0	initial_cond	1	-0.000000
exp9014	2.10911596e-17	0.070278	-0.000000	discard	Ultra-3D u=0.242 amp=0.45 phase=1.24	manual	memory	0	0.000097
exp9015	3.22245147e-29	0.000000	0.000000	discard	cycle 63 u=0.0990	agent0	initial_cond	0	0.000000
exp9016	9.39503008e-18	0.070278	-0.000000	discard	Ultra-3D u=0.242 amp=0.45 phase=1.25	manual	memory	0	0.000097
exp9016	3.22245147e-29	0.000000	0.000000	discard	cycle 63 u=0.0990	agent0	initial_cond	1	0.000000
exp9017	3.22245147e-29	0.000000	0.000000	discard	cycle 63 u=0.0990	agent0	initial_cond	0	0.000000
exp9017	2.03679005e-17	0.070278	-0.000000	discard	Ultra-3D u=0.243 amp=0.43 phase=1.20	manual	memory	0	0.000097
exp9018	4.50941488e-29	0.000000	-0.000000	discard	cycle 63 u=0.0990	agent0	initial_cond	0	0.000000
exp9019	1.14348964e-16	0.070278	-0.000000	discard	Ultra-3D u=0.243 amp=0.43 phase=1.21	manual	memory	0	0.000097
exp9020	4.50941488e-29	0.000000	-0.000000	discard	cycle 63 u=0.0990	agent0	initial_cond	1	0.000000
exp9021	3.02341166e-17	0.070278	-0.000000	discard	Ultra-3D u=0.243 amp=0.43 phase=1.22	manual	memory	0	0.000097
exp9022	4.50941488e-29	0.000000	-0.000000	discard	cycle 63 u=0.0990	agent0	initial_cond	0	0.000000
exp9023	3.51998374e-17	0.070278	-0.000000	discard	Ultra-3D u=0.243 amp=0.43 phase=1.23	manual	memory	0	0.000097
exp9024	4.88330883e-29	0.000000	-0.000000	discard	cycle 63 u=0.0990	agent0	initial_cond	0	0.000000
exp9025	4.88330883e-29	0.000000	-0.000000	discard	cycle 63 u=0.0990	agent0	initial_cond	0	0.000000
exp9025	2.03668957e-17	0.070278	-0.000000	discard	Ultra-3D u=0.243 amp=0.43 phase=1.24	manual	memory	0	0.000097
exp9026	4.88330883e-29	0.000000	-0.000000	discard	cycle 63 u=0.0990	agent0	initial_cond	0	0.000000
exp9027	5.50453094e-17	0.070278	-0.000000	discard	Ultra-3D u=0.243 amp=0.43 phase=1.25	manual	memory	0	0.000097
exp9028	5.74085541e-29	0.000000	-0.000000	discard	cycle 63 u=0.0995	agent0	initial_cond	1	0.000000
exp9029	1.19441616e-17	0.070278	-0.000000	discard	Ultra-3D u=0.243 amp=0.44 phase=1.20	manual	memory	0	0.000097
exp9030	5.74085541e-29	0.000000	-0.000000	discard	cycle 63 u=0.0995	agent0	initial_cond	0	0.000000
exp9031	1.13500838e-17	0.070278	-0.000000	discard	Ultra-3D u=0.243 amp=0.44 phase=1.21	manual	memory	0	0.000097
exp9032	5.74085541e-29	0.000000	-0.000000	discard	cycle 63 u=0.0995	agent0	initial_cond	0	0.000000
exp9033	1.54984578e-28	0.000000	0.000000	discard	cycle 63 u=0.0995	agent0	initial_cond	0	-0.000000
exp9033	4.37005576e-17	0.070278	-0.000000	discard	Ultra-3D u=0.243 amp=0.44 phase=1.22	manual	memory	0	0.000097
exp9034	1.54984578e-28	0.000000	0.000000	discard	cycle 63 u=0.0995	agent0	initial_cond	0	-0.000000
exp9035	2.12287778e-17	0.070278	-0.000000	discard	Ultra-3D u=0.243 amp=0.44 phase=1.23	manual	memory	0	0.000097
exp9036	1.54984578e-28	0.000000	0.000000	discard	cycle 63 u=0.0995	agent0	initial_cond	1	-0.000000
exp9037	2.01091097e-17	0.070278	-0.000000	discard	Ultra-3D u=0.243 amp=0.44 phase=1.24	manual	memory	1	0.000097
exp9038	1.60328418e-29	0.000000	-0.000000	discard	cycle 63 u=0.0995	agent0	initial_cond	0	-0.000000
exp9039	4.61062128e-17	0.070278	-0.000000	discard	Ultra-3D u=0.243 amp=0.44 phase=1.25	manual	memory	0	0.000097
exp9040	1.60328418e-29	0.000000	-0.000000	discard	cycle 63 u=0.0995	agent0	initial_cond	0	-0.000000
exp9041	1.60328418e-29	0.000000	-0.000000	discard	cycle 63 u=0.0995	agent0	initial_cond	1	-0.000000
exp9041	2.91235584e-17	0.070278	-0.000000	discard	Ultra-3D u=0.243 amp=0.45 phase=1.20	manual	memory	1	0.000097
exp9042	7.34590618e-29	0.000000	0.000000	discard	cycle 63 u=0.0995	agent0	initial_cond	0	0.000000
exp9043	6.32017864e-17	0.070278	-0.000000	discard	Ultra-3D u=0.243 amp=0.45 phase=1.21	manual	memory	0	0.000097
exp9044	7.34590618e-29	0.000000	0.000000	discard	cycle 63 u=0.0995	agent0	initial_cond	1	0.000000
exp9045	2.50243349e-17	0.070278	-0.000000	discard	Ultra-3D u=0.243 amp=0.45 phase=1.22	manual	memory	1	0.000097
exp9046	7.34590618e-29	0.000000	0.000000	discard	cycle 63 u=0.0995	agent0	initial_cond	0	0.000000
exp9047	5.93369028e-17	0.070278	0.000000	discard	Ultra-3D u=0.243 amp=0.45 phase=1.23	manual	memory	0	0.000097
exp9048	4.46546993e-29	0.000000	0.000000	discard	cycle 63 u=0.1000	agent0	initial_cond	0	-0.000000
exp9049	2.02810081e-17	0.070278	-0.000000	discard	Ultra-3D u=0.243 amp=0.45 phase=1.24	manual	memory	1	0.000097
exp9049	4.46546993e-29	0.000000	0.000000	discard	cycle 63 u=0.1000	agent0	initial_cond	1	-0.000000
exp9050	4.46546993e-29	0.000000	0.000000	discard	cycle 63 u=0.1000	agent0	initial_cond	0	-0.000000
exp9051	4.37276621e-17	0.070278	-0.000000	discard	Ultra-3D u=0.243 amp=0.45 phase=1.25	manual	memory	0	0.000097
exp9052	4.08106752e-29	0.000000	0.000000	discard	cycle 63 u=0.1000	agent0	initial_cond	0	-0.000000
exp9053	1.04150571e-17	0.070278	-0.000000	discard	Ultra-3D u=0.244 amp=0.43 phase=1.20	manual	memory	1	0.000097
exp9054	4.08106752e-29	0.000000	0.000000	discard	cycle 63 u=0.1000	agent0	initial_cond	0	-0.000000
exp9055	3.69277234e-17	0.070278	-0.000000	discard	Ultra-3D u=0.244 amp=0.43 phase=1.21	manual	memory	0	0.000097
exp9056	4.08106752e-29	0.000000	0.000000	discard	cycle 63 u=0.1000	agent0	initial_cond	0	-0.000000
exp9057	1.89143127e-17	0.070278	-0.000000	discard	Ultra-3D u=0.244 amp=0.43 phase=1.22	manual	memory	1	0.000097
exp9057	4.58623706e-29	0.000000	0.000000	discard	cycle 63 u=0.1000	agent0	initial_cond	1	-0.000000
exp9058	4.58623706e-29	0.000000	0.000000	discard	cycle 63 u=0.1000	agent0	initial_cond	0	-0.000000
exp9058	6.20931552e-17	0.070278	-0.000000	discard	Ultra-3D u=0.244 amp=0.43 phase=1.23	manual	memory	0	0.000097
exp9059	4.58623706e-29	0.000000	0.000000	discard	cycle 63 u=0.1000	agent0	initial_cond	0	-0.000000
exp9060	1.74434884e-17	0.070278	-0.000000	discard	Ultra-3D u=0.244 amp=0.43 phase=1.24	manual	memory	1	0.000097
exp9061	4.39794337e-29	0.000000	0.000000	discard	cycle 63 u=0.1000	agent0	initial_cond	1	-0.000000
exp9062	1.92312280e-17	0.070278	-0.000000	discard	Ultra-3D u=0.244 amp=0.43 phase=1.25	manual	memory	0	0.000097
exp9063	4.39794337e-29	0.000000	0.000000	discard	cycle 63 u=0.1000	agent0	initial_cond	0	-0.000000
exp9064	1.44454409e-17	0.070278	-0.000000	discard	Ultra-3D u=0.244 amp=0.44 phase=1.20	manual	memory	0	0.000097
exp9064	4.39794337e-29	0.000000	0.000000	discard	cycle 63 u=0.1000	agent0	initial_cond	1	-0.000000
exp9065	1.36727475e-28	0.000000	0.000000	discard	cycle 63 u=0.1050	agent0	initial_cond	0	-0.000000
exp9065	1.60534178e-17	0.070278	-0.000000	discard	Ultra-3D u=0.244 amp=0.44 phase=1.21	manual	memory	0	0.000097
exp9066	1.36727475e-28	0.000000	0.000000	discard	cycle 63 u=0.1050	agent0	initial_cond	0	-0.000000
exp9067	4.05824992e-17	0.070278	-0.000000	discard	Ultra-3D u=0.244 amp=0.44 phase=1.22	manual	memory	0	0.000097
exp9068	1.36727475e-28	0.000000	0.000000	discard	cycle 63 u=0.1050	agent0	initial_cond	1	-0.000000
exp9069	6.91159813e-18	0.070278	-0.000000	discard	Ultra-3D u=0.244 amp=0.44 phase=1.23	manual	memory	0	0.000097
exp9070	6.14461376e-29	0.000000	0.000000	discard	cycle 63 u=0.1050	agent0	initial_cond	0	-0.000000
exp9071	1.23796409e-17	0.070278	-0.000000	discard	Ultra-3D u=0.244 amp=0.44 phase=1.24	manual	memory	0	0.000097
exp9072	6.14461376e-29	0.000000	0.000000	discard	cycle 63 u=0.1050	agent0	initial_cond	0	-0.000000
exp9073	6.14461376e-29	0.000000	0.000000	discard	cycle 63 u=0.1050	agent0	initial_cond	0	-0.000000
exp9073	3.20293509e-17	0.070278	-0.000000	discard	Ultra-3D u=0.244 amp=0.44 phase=1.25	manual	memory	0	0.000097
exp9074	1.75906666e-28	0.000000	0.000000	discard	cycle 63 u=0.1050	agent0	initial_cond	0	-0.000000
exp9075	2.47758985e-17	0.070278	-0.000000	discard	Ultra-3D u=0.244 amp=0.45 phase=1.20	manual	memory	0	0.000097
exp9076	1.75906666e-28	0.000000	0.000000	discard	cycle 63 u=0.1050	agent0	initial_cond	1	-0.000000
exp9077	1.01491094e-17	0.070278	-0.000000	discard	Ultra-3D u=0.244 amp=0.45 phase=1.21	manual	memory	0	0.000097
exp9078	1.75906666e-28	0.000000	0.000000	discard	cycle 63 u=0.1050	agent0	initial_cond	0	-0.000000
exp9079	3.80250345e-17	0.070278	-0.000000	discard	Ultra-3D u=0.244 amp=0.45 phase=1.22	manual	memory	0	0.000097
exp9080	1.11257917e-28	0.000000	0.000000	discard	cycle 63 u=0.1050	agent0	initial_cond	0	-0.000000
exp9081	2.14394205e-17	0.070278	-0.000000	discard	Ultra-3D u=0.244 amp=0.45 phase=1.23	manual	memory	0	0.000097
exp9081	1.11257917e-28	0.000000	0.000000	discard	cycle 63 u=0.1050	agent0	initial_cond	0	-0.000000
exp9082	1.11257917e-28	0.000000	0.000000	discard	cycle 63 u=0.1050	agent0	initial_cond	0	-0.000000
exp9083	4.24480437e-17	0.070278	-0.000000	discard	Ultra-3D u=0.244 amp=0.45 phase=1.24	manual	memory	0	0.000097
exp9084	8.58580947e-29	0.000000	0.000000	discard	cycle 64 u=0.0975	agent0	initial_cond	1	0.000000
exp9085	3.63955875e-17	0.070278	-0.000000	discard	Ultra-3D u=0.244 amp=0.45 phase=1.25	manual	memory	1	0.000097
exp9086	8.58580947e-29	0.000000	0.000000	discard	cycle 64 u=0.0975	agent0	initial_cond	0	0.000000
exp9087	1.94706703e-17	0.070278	0.000000	discard	Ultra-3D u=0.245 amp=0.43 phase=1.20	manual	memory	0	0.000097
exp9088	8.58580947e-29	0.000000	0.000000	discard	cycle 64 u=0.0975	agent0	initial_cond	0	0.000000
exp9089	1.78239373e-17	0.070278	-0.000000	discard	Ultra-3D u=0.245 amp=0.43 phase=1.21	manual	memory	1	0.000097
exp9089	5.23962023e-29	0.000000	0.000000	discard	cycle 64 u=0.0975	agent0	initial_cond	1	0.000000
exp9090	5.23962023e-29	0.000000	0.000000	discard	cycle 64 u=0.0975	agent0	initial_cond	0	0.000000
exp9091	2.90705368e-17	0.070278	-0.000000	discard	Ultra-3D u=0.245 amp=0.43 phase=1.22	manual	memory	0	0.000097
exp9092	5.23962023e-29	0.000000	0.000000	discard	cycle 64 u=0.0975	agent0	initial_cond	1	0.000000
