exp_id	residual	solution_norm	solution_mean	status	description	agent	design	elapsed_s	solution_energy
exp1884	1.96261557e-16	1.001296	1.000019	discard	Fourier mode=4 amp=0.170 u=1.0	agent1	memory	0	-1.520844
exp1885	2.01926478e-29	0.000000	0.000000	discard	cycle 3 u=0.0980	agent0	initial_cond	0	0.000000
exp1886	4.37535640e-16	1.001296	1.000019	discard	Fourier mode=4 amp=0.175 u=1.0	agent1	memory	0	-1.520844
exp1887	2.01926478e-29	0.000000	0.000000	discard	cycle 3 u=0.0980	agent0	initial_cond	0	0.000000
exp1888	5.02914270e-16	1.001296	1.000019	discard	Fourier mode=4 amp=0.180 u=1.0	agent1	memory	1	-1.520844
exp1889	2.01926478e-29	0.000000	0.000000	discard	cycle 3 u=0.0980	agent0	initial_cond	0	0.000000
exp1890	2.06774381e-16	1.001296	-1.000019	discard	Fourier neg mode=4 amp=0.19 u=-0.90	agent1	memory	0	-1.520844
exp1891	1.30310780e-28	0.000000	0.000000	discard	cycle 3 u=0.0980	agent0	initial_cond	0	-0.000000
exp1892	2.06774381e-16	1.001296	-1.000019	discard	Fourier neg mode=4 amp=0.19 u=-0.92	agent1	memory	1	-1.520844
exp1893	1.30310780e-28	0.000000	0.000000	discard	cycle 3 u=0.0980	agent0	initial_cond	1	-0.000000
exp1894	2.38073640e-12	1.001296	-1.000019	discard	Fourier neg mode=4 amp=0.19 u=-0.95	agent1	memory	0	-1.520844
exp1895	1.30310780e-28	0.000000	0.000000	discard	cycle 3 u=0.0980	agent0	initial_cond	0	-0.000000
exp1896	4.15864486e-14	1.001296	-1.000019	discard	Fourier neg mode=4 amp=0.19 u=-0.98	agent1	memory	0	-1.520844
exp1897	5.45343271e-29	0.000000	0.000000	discard	cycle 3 u=0.0982	agent0	initial_cond	0	-0.000000
exp1898	2.83292188e-15	1.001296	-1.000019	discard	Fourier neg mode=4 amp=0.19 u=-1.00	agent1	memory	1	-1.520844
exp1899	5.45343271e-29	0.000000	0.000000	discard	cycle 3 u=0.0982	agent0	initial_cond	1	-0.000000
exp1900	5.45343271e-29	0.000000	0.000000	discard	cycle 3 u=0.0982	agent0	initial_cond	0	-0.000000
exp1901	1.23429977e-28	0.000000	0.000000	discard	cycle 3 u=0.0982	agent0	initial_cond	1	0.000000
exp1902	1.23429977e-28	0.000000	0.000000	discard	cycle 3 u=0.0982	agent0	initial_cond	0	0.000000
exp1903	1.23429977e-28	0.000000	0.000000	discard	cycle 3 u=0.0982	agent0	initial_cond	0	0.000000
exp1904	1.88036672e-29	0.000000	0.000000	discard	cycle 3 u=0.0982	agent0	initial_cond	1	0.000000
exp1905	1.88036672e-29	0.000000	0.000000	discard	cycle 3 u=0.0982	agent0	initial_cond	0	0.000000
exp1906	1.88036672e-29	0.000000	0.000000	discard	cycle 3 u=0.0982	agent0	initial_cond	0	0.000000
exp1907	1.91190259e-29	0.000000	-0.000000	discard	cycle 3 u=0.0982	agent0	initial_cond	0	0.000000
exp1908	1.91190259e-29	0.000000	-0.000000	discard	cycle 3 u=0.0982	agent0	initial_cond	0	0.000000
exp1909	1.91190259e-29	0.000000	-0.000000	discard	cycle 3 u=0.0982	agent0	initial_cond	1	0.000000
exp1910	2.10383286e-12	0.070536	-0.000000	discard	symmetry breaking u=0.0 amp=0.5 mode=1 phase=1.5708	agent1_mem	branch_search	0	0.000099
exp1911	6.13049994e-29	0.000000	0.000000	discard	cycle 3 u=0.0985	agent0	initial_cond	0	0.000000
exp1912	6.34836782e-14	1.001296	-1.000019	discard	symmetry breaking u=0.5 amp=0.5 mode=1 phase=1.5708	agent1_mem	branch_search	0	-1.520844
exp1912	6.13049994e-29	0.000000	0.000000	discard	nano amp=0.0001	agent0	perturbation	0	0.000000
exp1913	6.13049994e-29	0.000000	0.000000	discard	cycle 3 u=0.0985	agent0	initial_cond	0	0.000000
exp1914	6.35768827e-14	1.001296	1.000019	discard	symmetry breaking u=-0.5 amp=0.5 mode=1 phase=1.5708	agent1_mem	branch_search	1	-1.520844
exp1914	6.13049994e-29	0.000000	0.000000	discard	nano amp=0.0002	agent0	perturbation	1	0.000000
exp1915	6.13049994e-29	0.000000	0.000000	discard	cycle 3 u=0.0985	agent0	initial_cond	1	0.000000
exp1916	1.75019607e-17	0.000000	-0.000000	discard	symmetry breaking u=0.0 amp=0.5 mode=2 phase=0.0	agent1_mem	branch_search	0	-0.000000
exp1916	5.49750971e-29	0.000000	0.000000	discard	nano amp=0.0003	agent0	perturbation	0	0.000000
exp1917	5.49750971e-29	0.000000	0.000000	discard	cycle 3 u=0.0985	agent0	initial_cond	0	0.000000
exp1918	1.17676416e-14	0.000000	-0.000000	discard	symmetry breaking u=0.0 amp=0.5 mode=3 phase=0.0	agent1_mem	branch_search	0	-0.000000
exp1918	5.49750971e-29	0.000000	0.000000	discard	nano amp=0.0004	agent0	perturbation	0	0.000000
exp1919	5.49750971e-29	0.000000	0.000000	discard	cycle 3 u=0.0985	agent0	initial_cond	1	0.000000
exp1920	5.49750971e-29	0.000000	0.000000	discard	nano amp=0.0005	agent0	perturbation	0	0.000000
exp1921	5.49750971e-29	0.000000	0.000000	discard	cycle 3 u=0.0985	agent0	initial_cond	0	0.000000
exp1922	4.15642452e-29	0.000000	0.000000	discard	cycle 3 u=0.0985	agent0	initial_cond	0	0.000000
exp1923	4.15642452e-29	0.000000	0.000000	discard	cycle 3 u=0.0985	agent0	initial_cond	1	0.000000
exp1924	4.15642452e-29	0.000000	0.000000	discard	cycle 3 u=0.0985	agent0	initial_cond	0	0.000000
exp1925	2.19292611e-29	0.000000	0.000000	discard	cycle 3 u=0.0985	agent0	initial_cond	0	-0.000000
exp1926	2.19292611e-29	0.000000	0.000000	discard	cycle 3 u=0.0985	agent0	initial_cond	0	-0.000000
exp1927	2.19292611e-29	0.000000	0.000000	discard	cycle 3 u=0.0985	agent0	initial_cond	0	-0.000000
exp1928	4.22491788e-29	0.000000	0.000000	discard	cycle 3 u=0.0990	agent0	initial_cond	1	-0.000000
exp1929	4.22491788e-29	0.000000	0.000000	discard	cycle 3 u=0.0990	agent0	initial_cond	0	-0.000000
exp1930	4.22491788e-29	0.000000	0.000000	discard	cycle 3 u=0.0990	agent0	initial_cond	0	-0.000000
exp1931	3.22245147e-29	0.000000	0.000000	discard	cycle 3 u=0.0990	agent0	initial_cond	1	0.000000
exp1932	1.86448479e-16	1.001296	1.000019	discard	BEST amp=0.19 mode=4 u=1.0	agent1	memory	0	-1.520844
exp1933	3.22245147e-29	0.000000	0.000000	discard	cycle 3 u=0.0990	agent0	initial_cond	0	0.000000
exp1934	1.86448479e-16	1.001296	1.000019	discard	BEST amp=0.19 mode=4 u=1.0	agent1	memory	0	-1.520844
exp1935	3.22245147e-29	0.000000	0.000000	discard	cycle 3 u=0.0990	agent0	initial_cond	1	0.000000
exp1936	1.86448479e-16	1.001296	1.000019	discard	BEST amp=0.19 mode=4 u=1.0	agent1	memory	0	-1.520844
exp1937	4.50941488e-29	0.000000	-0.000000	discard	cycle 3 u=0.0990	agent0	initial_cond	0	0.000000
exp1938	1.86448479e-16	1.001296	1.000019	discard	Fourier mode=4 amp=0.19 phase=0.0 u=1.0	agent1	memory	0	-1.520844
exp1939	4.50941488e-29	0.000000	-0.000000	discard	cycle 3 u=0.0990	agent0	initial_cond	0	0.000000
exp1940	5.10709374e-15	1.001296	1.000019	discard	Fourier mode=4 amp=0.19 phase=0.5 u=1.0	agent1	memory	1	-1.520844
exp1941	4.50941488e-29	0.000000	-0.000000	discard	cycle 3 u=0.0990	agent0	initial_cond	1	0.000000
exp1942	1.69122081e-12	1.001296	1.000019	discard	Fourier mode=4 amp=0.19 phase=1.0 u=1.0	agent1	memory	0	-1.520844
exp1943	4.88330883e-29	0.000000	-0.000000	discard	cycle 3 u=0.0990	agent0	initial_cond	0	0.000000
exp1944	6.07975414e-16	1.001296	1.000019	discard	Fourier mode=4 amp=0.19 phase=1.57 u=1.0	agent1	memory	0	-1.520844
exp1945	4.88330883e-29	0.000000	-0.000000	discard	cycle 3 u=0.0990	agent0	initial_cond	1	0.000000
exp1946	3.29101138e-15	1.001296	1.000019	discard	Fourier mode=4 amp=0.19 phase=3.14 u=1.0	agent1	memory	1	-1.520844
exp1947	4.88330883e-29	0.000000	-0.000000	discard	cycle 3 u=0.0990	agent0	initial_cond	0	0.000000
exp1948	5.74085541e-29	0.000000	-0.000000	discard	cycle 3 u=0.0995	agent0	initial_cond	0	0.000000
exp1949	5.74085541e-29	0.000000	-0.000000	discard	cycle 3 u=0.0995	agent0	initial_cond	1	0.000000
exp1950	5.74085541e-29	0.000000	-0.000000	discard	cycle 3 u=0.0995	agent0	initial_cond	0	0.000000
exp1951	1.54984578e-28	0.000000	0.000000	discard	cycle 3 u=0.0995	agent0	initial_cond	0	-0.000000
exp1952	1.54984578e-28	0.000000	0.000000	discard	cycle 3 u=0.0995	agent0	initial_cond	0	-0.000000
exp1953	1.54984578e-28	0.000000	0.000000	discard	cycle 3 u=0.0995	agent0	initial_cond	0	-0.000000
exp1954	1.60328418e-29	0.000000	-0.000000	discard	cycle 3 u=0.0995	agent0	initial_cond	1	-0.000000
exp1955	1.60328418e-29	0.000000	-0.000000	discard	cycle 3 u=0.0995	agent0	initial_cond	0	-0.000000
exp1956	1.60328418e-29	0.000000	-0.000000	discard	cycle 3 u=0.0995	agent0	initial_cond	0	-0.000000
exp1957	7.34590618e-29	0.000000	0.000000	discard	cycle 3 u=0.0995	agent0	initial_cond	1	0.000000
exp1958	7.34590618e-29	0.000000	0.000000	discard	cycle 3 u=0.0995	agent0	initial_cond	0	0.000000
exp1959	7.34590618e-29	0.000000	0.000000	discard	cycle 3 u=0.0995	agent0	initial_cond	0	0.000000
exp1960	4.46546993e-29	0.000000	0.000000	discard	cycle 3 u=0.1000	agent0	initial_cond	0	-0.000000
exp1961	4.46546993e-29	0.000000	0.000000	discard	cycle 3 u=0.1000	agent0	initial_cond	0	-0.000000
exp1962	4.46546993e-29	0.000000	0.000000	discard	cycle 3 u=0.1000	agent0	initial_cond	1	-0.000000
exp1963	4.08106752e-29	0.000000	0.000000	discard	cycle 3 u=0.1000	agent0	initial_cond	0	-0.000000
exp1964	4.08106752e-29	0.000000	0.000000	discard	cycle 3 u=0.1000	agent0	initial_cond	0	-0.000000
exp1965	4.08106752e-29	0.000000	0.000000	discard	cycle 3 u=0.1000	agent0	initial_cond	1	-0.000000
exp1966	4.58623706e-29	0.000000	0.000000	discard	cycle 3 u=0.1000	agent0	initial_cond	0	-0.000000
exp1967	4.58623706e-29	0.000000	0.000000	discard	cycle 3 u=0.1000	agent0	initial_cond	1	-0.000000
exp1968	1.34360442e-12	1.002503	1.000218	discard	cycle 3 u=0.1000	agent0	initial_cond	0	-1.523848
exp1969	1.34360442e-12	1.002503	1.000218	discard	mode compare m=1 a=0.01 r=1	agent0	perturbation	0	-1.523848
exp1970	1.34360442e-12	1.002503	1.000218	discard	cycle 3 u=0.1000	agent0	initial_cond	0	-1.523848
exp1971	1.34360442e-12	1.002503	1.000218	discard	mode compare m=1 a=0.01 r=2	agent0	perturbation	1	-1.523848
exp1972	1.34360442e-12	1.002503	1.000218	discard	cycle 3 u=0.1000	agent0	initial_cond	0	-1.523848
exp1973	1.34360442e-12	1.002503	1.000218	discard	mode compare m=1 a=0.01 r=3	agent0	perturbation	0	-1.523848
exp1974	1.34360442e-12	1.002503	1.000218	discard	cycle 3 u=0.1000	agent0	initial_cond	0	-1.523848
exp1975	1.34360442e-12	1.002503	1.000218	discard	mode compare m=1 a=0.05 r=1	agent0	perturbation	1	-1.523848
exp1976	9.62927195e-16	0.070536	0.000000	discard	refine unusual norm=0.07 solution 16modes	agent1_mem	branch_search	1	0.000099
exp1977	1.34360442e-12	1.002503	1.000218	discard	cycle 3 u=0.1050	agent0	initial_cond	0	-1.523848
exp1978	1.34360442e-12	1.002503	1.000218	discard	mode compare m=1 a=0.05 r=2	agent0	perturbation	0	-1.523848
exp1979	1.34360442e-12	1.002503	1.000218	discard	cycle 3 u=0.1050	agent0	initial_cond	0	-1.523848
exp1980	1.34360442e-12	1.002503	1.000218	discard	mode compare m=1 a=0.05 r=3	agent0	perturbation	0	-1.523848
exp1981	1.34357540e-12	1.002503	1.000218	discard	cycle 3 u=0.1050	agent0	initial_cond	1	-1.523848
exp1982	1.34357540e-12	1.002503	1.000218	discard	mode compare m=1 a=0.1 r=1	agent0	perturbation	0	-1.523848
exp1983	1.34357540e-12	1.002503	1.000218	discard	cycle 3 u=0.1050	agent0	initial_cond	0	-1.523848
exp1984	1.34357540e-12	1.002503	1.000218	discard	mode compare m=1 a=0.1 r=2	agent0	perturbation	0	-1.523848
exp1985	1.34357540e-12	1.002503	1.000218	discard	cycle 3 u=0.1050	agent0	initial_cond	1	-1.523848
exp1986	1.34357540e-12	1.002503	1.000218	discard	mode compare m=1 a=0.1 r=3	agent0	perturbation	0	-1.523848
exp1987	1.34360442e-12	1.002503	1.000218	discard	cycle 3 u=0.1050	agent0	initial_cond	0	-1.523848
exp1988	1.34360442e-12	1.002503	1.000218	discard	mode compare m=1 a=0.5 r=1	agent0	perturbation	0	-1.523848
exp1989	1.34360442e-12	1.002503	1.000218	discard	cycle 3 u=0.1050	agent0	initial_cond	1	-1.523848
exp1990	1.34360442e-12	1.002503	1.000218	discard	mode compare m=1 a=0.5 r=2	agent0	perturbation	1	-1.523848
exp1991	1.34360442e-12	1.002503	1.000218	discard	cycle 3 u=0.1050	agent0	initial_cond	0	-1.523848
exp1992	1.34360442e-12	1.002503	1.000218	discard	mode compare m=1 a=0.5 r=3	agent0	perturbation	0	-1.523848
exp1993	1.34357540e-12	1.002503	1.000218	discard	cycle 3 u=0.1050	agent0	initial_cond	1	-1.523848
exp1994	1.34357540e-12	1.002503	1.000218	discard	mode compare m=2 a=0.01 r=1	agent0	perturbation	1	-1.523848
exp1995	1.34357540e-12	1.002503	1.000218	discard	cycle 3 u=0.1050	agent0	initial_cond	0	-1.523848
exp1996	1.34357540e-12	1.002503	1.000218	discard	mode compare m=2 a=0.01 r=2	agent0	perturbation	0	-1.523848
exp1997	1.34357540e-12	1.002503	1.000218	discard	cycle 3 u=0.1050	agent0	initial_cond	1	-1.523848
exp1998	1.34357540e-12	1.002503	1.000218	discard	mode compare m=2 a=0.01 r=3	agent0	perturbation	1	-1.523848
exp1999	1.34360442e-12	1.002503	1.000218	discard	cycle 3 u=0.1050	agent0	initial_cond	0	-1.523848
exp2000	1.34360442e-12	1.002503	1.000218	discard	cycle 4 u=0.0975	agent0	initial_cond	0	-1.523848
exp2000	1.34360442e-12	1.002503	1.000218	discard	mode compare m=2 a=0.05 r=2	agent0	perturbation	1	-1.523848
exp2001	1.34360442e-12	1.002503	1.000218	discard	cycle 4 u=0.0975	agent0	initial_cond	0	-1.523848
exp2001	1.34360442e-12	1.002503	1.000218	discard	mode compare m=2 a=0.05 r=3	agent0	perturbation	0	-1.523848
exp2002	1.34360442e-12	1.002503	1.000218	discard	cycle 4 u=0.0975	agent0	initial_cond	0	-1.523848
exp2002	1.34360442e-12	1.002503	1.000218	discard	mode compare m=2 a=0.1 r=1	agent0	perturbation	0	-1.523848
exp2003	1.34360442e-12	1.002503	1.000218	discard	cycle 4 u=0.0975	agent0	initial_cond	1	-1.523848
exp2003	1.34360442e-12	1.002503	1.000218	discard	mode compare m=2 a=0.1 r=2	agent0	perturbation	0	-1.523848
exp2004	1.34360442e-12	1.002503	1.000218	discard	cycle 4 u=0.0975	agent0	initial_cond	0	-1.523848
exp2004	1.34360442e-12	1.002503	1.000218	discard	mode compare m=2 a=0.1 r=3	agent0	perturbation	0	-1.523848
exp2005	1.34360442e-12	1.002503	1.000218	discard	cycle 4 u=0.0975	agent0	initial_cond	1	-1.523848
exp2005	1.34360442e-12	1.002503	1.000218	discard	mode compare m=2 a=0.5 r=1	agent0	perturbation	1	-1.523848
exp2006	1.34360442e-12	1.002503	1.000218	discard	cycle 4 u=0.0975	agent0	initial_cond	0	-1.523848
exp2006	1.34360442e-12	1.002503	1.000218	discard	mode compare m=2 a=0.5 r=2	agent0	perturbation	0	-1.523848
exp2007	3.49181431e-15	0.070536	-0.000000	discard	verify 4th branch 32modes norm=0.07	agent1_mem	branch_search	1	0.000099
exp2008	1.34360442e-12	1.002503	1.000218	discard	cycle 4 u=0.0975	agent0	initial_cond	1	-1.523848
exp2008	1.34360442e-12	1.002503	1.000218	discard	mode compare m=2 a=0.5 r=3	agent0	perturbation	1	-1.523848
exp2009	1.34360442e-12	1.002503	1.000218	discard	cycle 4 u=0.0975	agent0	initial_cond	0	-1.523848
exp2009	1.34360442e-12	1.002503	1.000218	discard	mode compare m=3 a=0.01 r=1	agent0	perturbation	0	-1.523848
exp2010	1.34360442e-12	1.002503	1.000218	discard	cycle 4 u=0.0975	agent0	initial_cond	1	-1.523848
exp2010	1.34360442e-12	1.002503	1.000218	discard	mode compare m=3 a=0.01 r=2	agent0	perturbation	1	-1.523848
exp2011	1.34360442e-12	1.002503	1.000218	discard	cycle 4 u=0.0975	agent0	initial_cond	0	-1.523848
exp2011	1.34360442e-12	1.002503	1.000218	discard	mode compare m=3 a=0.01 r=3	agent0	perturbation	0	-1.523848
exp2012	1.34357540e-12	1.002503	1.000218	discard	cycle 4 u=0.0975	agent0	initial_cond	1	-1.523848
exp2012	1.34357540e-12	1.002503	1.000218	discard	mode compare m=3 a=0.05 r=1	agent0	perturbation	1	-1.523848
exp2013	1.34357540e-12	1.002503	1.000218	discard	cycle 4 u=0.0980	agent0	initial_cond	0	-1.523848
exp2013	1.34357540e-12	1.002503	1.000218	discard	mode compare m=3 a=0.05 r=2	agent0	perturbation	0	-1.523848
exp2014	1.34357540e-12	1.002503	1.000218	discard	cycle 4 u=0.0980	agent0	initial_cond	1	-1.523848
exp2014	1.34357540e-12	1.002503	1.000218	discard	mode compare m=3 a=0.05 r=3	agent0	perturbation	1	-1.523848
exp2015	1.34357540e-12	1.002503	1.000218	discard	cycle 4 u=0.0980	agent0	initial_cond	0	-1.523848
exp2015	1.34357540e-12	1.002503	1.000218	discard	mode compare m=3 a=0.1 r=1	agent0	perturbation	0	-1.523848
exp2016	1.34357540e-12	1.002503	1.000218	discard	cycle 4 u=0.0980	agent0	initial_cond	0	-1.523848
exp2016	1.34357540e-12	1.002503	1.000218	discard	mode compare m=3 a=0.1 r=2	agent0	perturbation	0	-1.523848
exp2017	1.34357540e-12	1.002503	1.000218	discard	cycle 4 u=0.0980	agent0	initial_cond	0	-1.523848
exp2017	1.34357540e-12	1.002503	1.000218	discard	mode compare m=3 a=0.1 r=3	agent0	perturbation	0	-1.523848
exp2018	1.34357540e-12	1.002503	1.000218	discard	cycle 4 u=0.0980	agent0	initial_cond	0	-1.523848
exp2018	1.34357540e-12	1.002503	1.000218	discard	mode compare m=3 a=0.5 r=1	agent0	perturbation	0	-1.523848
exp2019	1.34357540e-12	1.002503	1.000218	discard	cycle 4 u=0.0980	agent0	initial_cond	1	-1.523848
exp2020	1.34357540e-12	1.002503	1.000218	discard	mode compare m=3 a=0.5 r=2	agent0	perturbation	0	-1.523848
exp2021	1.34357540e-12	1.002503	1.000218	discard	cycle 4 u=0.0980	agent0	initial_cond	0	-1.523848
exp2021	1.34357540e-12	1.002503	1.000218	discard	mode compare m=3 a=0.5 r=3	agent0	perturbation	0	-1.523848
exp2022	2.01926478e-29	0.000000	0.000000	discard	cycle 4 u=0.0980	agent0	initial_cond	1	0.000000
exp2023	1.30310780e-28	0.000000	0.000000	discard	cycle 4 u=0.0980	agent0	initial_cond	0	-0.000000
exp2024	1.30310780e-28	0.000000	0.000000	discard	cycle 4 u=0.0980	agent0	initial_cond	0	-0.000000
exp2025	1.30310780e-28	0.000000	0.000000	discard	cycle 4 u=0.0980	agent0	initial_cond	0	-0.000000
exp2026	5.45343271e-29	0.000000	0.000000	discard	cycle 4 u=0.0982	agent0	initial_cond	0	-0.000000
exp2027	5.45343271e-29	0.000000	0.000000	discard	cycle 4 u=0.0982	agent0	initial_cond	1	-0.000000
exp2028	5.45343271e-29	0.000000	0.000000	discard	cycle 4 u=0.0982	agent0	initial_cond	0	-0.000000
exp2029	1.23429977e-28	0.000000	0.000000	discard	cycle 4 u=0.0982	agent0	initial_cond	0	0.000000
exp2030	1.23429977e-28	0.000000	0.000000	discard	cycle 4 u=0.0982	agent0	initial_cond	1	0.000000
exp2031	1.23429977e-28	0.000000	0.000000	discard	cycle 4 u=0.0982	agent0	initial_cond	0	0.000000
exp2032	1.88036672e-29	0.000000	0.000000	discard	cycle 4 u=0.0982	agent0	initial_cond	1	0.000000
exp2033	6.39248763e-17	0.070535	0.000000	discard	4th branch 4modes norm=0.07	agent1_mem	branch_search	0	0.000099
exp2034	1.88036672e-29	0.000000	0.000000	discard	cycle 4 u=0.0982	agent0	initial_cond	0	0.000000
exp2035	1.86456152e-16	0.070536	0.000000	discard	4th branch 8modes norm=0.07	agent1_mem	branch_search	0	0.000099
exp2036	1.88036672e-29	0.000000	0.000000	discard	cycle 4 u=0.0982	agent0	initial_cond	0	0.000000
exp2037	8.09772253e-16	0.070536	-0.000000	discard	4th branch 12modes norm=0.07	agent1_mem	branch_search	1	0.000099
exp2038	1.91190259e-29	0.000000	-0.000000	discard	cycle 4 u=0.0982	agent0	initial_cond	1	0.000000
exp2039	9.62927195e-16	0.070536	0.000000	discard	4th branch 16modes norm=0.07	agent1_mem	branch_search	0	0.000099
exp2040	1.91190259e-29	0.000000	-0.000000	discard	cycle 4 u=0.0982	agent0	initial_cond	0	0.000000
exp2041	1.91190259e-29	0.000000	-0.000000	discard	cycle 4 u=0.0982	agent0	initial_cond	0	0.000000
exp2042	6.13049994e-29	0.000000	0.000000	discard	cycle 4 u=0.0985	agent0	initial_cond	0	0.000000
exp2043	6.13049994e-29	0.000000	0.000000	discard	cycle 4 u=0.0985	agent0	initial_cond	0	0.000000
exp2044	6.13049994e-29	0.000000	0.000000	discard	cycle 4 u=0.0985	agent0	initial_cond	1	0.000000
exp2045	5.49750971e-29	0.000000	0.000000	discard	cycle 4 u=0.0985	agent0	initial_cond	0	0.000000
exp2046	5.49750971e-29	0.000000	0.000000	discard	cycle 4 u=0.0985	agent0	initial_cond	0	0.000000
exp2047	5.49750971e-29	0.000000	0.000000	discard	cycle 4 u=0.0985	agent0	initial_cond	1	0.000000
exp2048	4.15642452e-29	0.000000	0.000000	discard	cycle 4 u=0.0985	agent0	initial_cond	0	0.000000
exp2049	4.15642452e-29	0.000000	0.000000	discard	boundary mode=1 u=0.55	agent0	perturbation	0	0.000000
exp2050	4.15642452e-29	0.000000	0.000000	discard	cycle 4 u=0.0985	agent0	initial_cond	1	0.000000
exp2051	4.15642452e-29	0.000000	0.000000	discard	boundary mode=2 u=0.55	agent0	perturbation	0	0.000000
exp2052	4.15642452e-29	0.000000	0.000000	discard	cycle 4 u=0.0985	agent0	initial_cond	0	0.000000
exp2053	2.19292611e-29	0.000000	0.000000	discard	boundary mode=3 u=0.55	agent0	perturbation	0	-0.000000
exp2054	2.19292611e-29	0.000000	0.000000	discard	cycle 4 u=0.0985	agent0	initial_cond	0	-0.000000
exp2055	2.19292611e-29	0.000000	0.000000	discard	boundary mode=4 u=0.55	agent0	perturbation	1	-0.000000
exp2056	2.19292611e-29	0.000000	0.000000	discard	cycle 4 u=0.0985	agent0	initial_cond	1	-0.000000
exp2057	2.19292611e-29	0.000000	0.000000	discard	boundary mode=5 u=0.55	agent0	perturbation	0	-0.000000
exp2057	2.19292611e-29	0.000000	0.000000	discard	cycle 4 u=0.0985	agent0	initial_cond	0	-0.000000
exp2058	4.22491788e-29	0.000000	0.000000	discard	boundary mode=6 u=0.55	agent0	perturbation	0	-0.000000
exp2058	4.22491788e-29	0.000000	0.000000	discard	cycle 4 u=0.0990	agent0	initial_cond	0	-0.000000
exp2059	4.22491788e-29	0.000000	0.000000	discard	boundary mode=7 u=0.55	agent0	perturbation	1	-0.000000
exp2059	4.22491788e-29	0.000000	0.000000	discard	cycle 4 u=0.0990	agent0	initial_cond	1	-0.000000
exp2060	4.22491788e-29	0.000000	0.000000	discard	boundary mode=8 u=0.55	agent0	perturbation	0	-0.000000
exp2060	4.22491788e-29	0.000000	0.000000	discard	cycle 4 u=0.0990	agent0	initial_cond	0	-0.000000
exp2061	3.22245147e-29	0.000000	0.000000	discard	boundary mode=9 u=0.55	agent0	perturbation	1	0.000000
exp2061	3.22245147e-29	0.000000	0.000000	discard	cycle 4 u=0.0990	agent0	initial_cond	1	0.000000
exp2062	3.22245147e-29	0.000000	0.000000	discard	boundary mode=10 u=0.55	agent0	perturbation	0	0.000000
exp2062	3.22245147e-29	0.000000	0.000000	discard	cycle 4 u=0.0990	agent0	initial_cond	0	0.000000
exp2063	3.22245147e-29	0.000000	0.000000	discard	cycle 4 u=0.0990	agent0	initial_cond	0	0.000000
exp2064	4.50941488e-29	0.000000	-0.000000	discard	cycle 4 u=0.0990	agent0	initial_cond	1	0.000000
exp2065	4.50941488e-29	0.000000	-0.000000	discard	cycle 4 u=0.0990	agent0	initial_cond	0	0.000000
exp2066	4.50941488e-29	0.000000	-0.000000	discard	cycle 4 u=0.0990	agent0	initial_cond	1	0.000000
exp2067	4.88330883e-29	0.000000	-0.000000	discard	cycle 4 u=0.0990	agent0	initial_cond	0	0.000000
exp2068	4.88330883e-29	0.000000	-0.000000	discard	cycle 4 u=0.0990	agent0	initial_cond	0	0.000000
