exp_id	residual	solution_norm	solution_mean	status	description	agent	design	elapsed_s	solution_energy
r9_win_p1.4563_a0.43	2.31785647e-26	0.0	0.0	keep	Phase11 window p=1.4563 a=0.43	agent1	memory	0	0.0
r9_win_p1.4563_a0.44	4.99343039e-26	0.0	0.0	keep	Phase11 window p=1.4563 a=0.44	agent1	memory	0	0.0
exp16082	4.08106752e-29	0.000000	0.000000	discard	cycle 127 u=0.1000	agent0	initial_cond	0	-0.000000
r9_win_p1.4563_a0.45	3.85357566e-26	0.0	0.0	keep	Phase11 window p=1.4563 a=0.45	agent1	memory	0	0.0
exp16083	4.08106752e-29	0.000000	0.000000	discard	cycle 127 u=0.1000	agent0	initial_cond	1	-0.000000
r9_win_p1.4564_a0.43	1.67968146e-26	0.0	0.0	keep	Phase11 window p=1.4564 a=0.43	agent1	memory	0	0.0
r9_win_p1.4564_a0.44	1.33705381e-26	0.0	0.0	keep	Phase11 window p=1.4564 a=0.44	agent1	memory	0	0.0
exp16084	4.08106752e-29	0.000000	0.000000	discard	cycle 127 u=0.1000	agent0	initial_cond	0	-0.000000
r9_win_p1.4564_a0.45	8.60807547e-26	0.0	0.0	keep	Phase11 window p=1.4564 a=0.45	agent1	memory	0	0.0
exp16085	4.58623706e-29	0.000000	0.000000	discard	cycle 127 u=0.1000	agent0	initial_cond	0	-0.000000
r9_win_p1.4565_a0.43	2.25498001e-27	0.0	0.0	keep	Phase11 window p=1.4565 a=0.43	agent1	memory	0	0.0
r9_win_p1.4565_a0.44	4.73093134e-26	0.0	0.0	keep	Phase11 window p=1.4565 a=0.44	agent1	memory	0	0.0
exp16086	4.58623706e-29	0.000000	0.000000	discard	cycle 127 u=0.1000	agent0	initial_cond	0	-0.000000
r9_win_p1.4565_a0.45	8.88430113e-26	0.0	0.0	keep	Phase11 window p=1.4565 a=0.45	agent1	memory	0	0.0
exp16087	4.58623706e-29	0.000000	0.000000	discard	cycle 127 u=0.1000	agent0	initial_cond	0	-0.000000
exp16088	4.39794337e-29	0.000000	0.000000	discard	cycle 127 u=0.1000	agent0	initial_cond	1	-0.000000
exp16089	4.39794337e-29	0.000000	0.000000	discard	cycle 127 u=0.1000	agent0	initial_cond	0	-0.000000
exp16090	4.39794337e-29	0.000000	0.000000	discard	cycle 127 u=0.1000	agent0	initial_cond	1	-0.000000
exp16091	1.36727475e-28	0.000000	0.000000	discard	cycle 127 u=0.1050	agent0	initial_cond	0	-0.000000
exp16092	1.36727475e-28	0.000000	0.000000	discard	cycle 127 u=0.1050	agent0	initial_cond	0	-0.000000
exp16093	1.36727475e-28	0.000000	0.000000	discard	cycle 127 u=0.1050	agent0	initial_cond	0	-0.000000
exp16094	6.14461376e-29	0.000000	0.000000	discard	cycle 127 u=0.1050	agent0	initial_cond	0	-0.000000
exp16095	6.14461376e-29	0.000000	0.000000	discard	cycle 127 u=0.1050	agent0	initial_cond	1	-0.000000
exp16096	6.14461376e-29	0.000000	0.000000	discard	cycle 127 u=0.1050	agent0	initial_cond	0	-0.000000
exp16097	1.75906666e-28	0.000000	0.000000	discard	cycle 127 u=0.1050	agent0	initial_cond	0	-0.000000
exp16098	1.75906666e-28	0.000000	0.000000	discard	cycle 127 u=0.1050	agent0	initial_cond	0	-0.000000
exp16099	1.75906666e-28	0.000000	0.000000	discard	cycle 127 u=0.1050	agent0	initial_cond	0	-0.000000
r9_sf_p1.4563_a0.420	7.30814717e-15	0.0	0.0	keep	Phase12 sf p=1.4563 a=0.420	agent1	memory	0	0.0
exp16100	1.11257917e-28	0.000000	0.000000	discard	cycle 127 u=0.1050	agent0	initial_cond	1	-0.000000
r9_sf_p1.4563_a0.425	2.35045370e-26	0.0	0.0	keep	Phase12 sf p=1.4563 a=0.425	agent1	memory	0	0.0
r9_sf_p1.4563_a0.430	2.31785647e-26	0.0	0.0	keep	Phase12 sf p=1.4563 a=0.430	agent1	memory	0	0.0
exp16101	1.11257917e-28	0.000000	0.000000	discard	cycle 127 u=0.1050	agent0	initial_cond	0	-0.000000
r9_sf_p1.4563_a0.435	4.30555958e-26	0.0	0.0	keep	Phase12 sf p=1.4563 a=0.435	agent1	memory	0	0.0
exp16102	1.11257917e-28	0.000000	0.000000	discard	cycle 127 u=0.1050	agent0	initial_cond	1	-0.000000
r9_sf_p1.4563_a0.440	4.99343039e-26	0.0	0.0	keep	Phase12 sf p=1.4563 a=0.440	agent1	memory	0	0.0
r9_sf_p1.4564_a0.420	7.12195692e-15	0.0	0.0	keep	Phase12 sf p=1.4564 a=0.420	agent1	memory	0	0.0
exp16103	8.58580947e-29	0.000000	0.000000	discard	cycle 128 u=0.0975	agent0	initial_cond	0	0.000000
r9_sf_p1.4564_a0.425	1.88757101e-26	0.0	0.0	keep	Phase12 sf p=1.4564 a=0.425	agent1	memory	0	0.0
exp16104	8.58580947e-29	0.000000	0.000000	discard	cycle 128 u=0.0975	agent0	initial_cond	0	0.000000
r9_sf_p1.4564_a0.430	1.67968146e-26	0.0	0.0	keep	Phase12 sf p=1.4564 a=0.430	agent1	memory	0	0.0
r9_sf_p1.4564_a0.435	4.43840658e-26	0.0	0.0	keep	Phase12 sf p=1.4564 a=0.435	agent1	memory	0	0.0
exp16105	8.58580947e-29	0.000000	0.000000	discard	cycle 128 u=0.0975	agent0	initial_cond	0	0.000000
r9_sf_p1.4564_a0.440	1.33705381e-26	0.0	0.0	keep	Phase12 sf p=1.4564 a=0.440	agent1	memory	0	0.0
exp16106	5.23962023e-29	0.000000	0.000000	discard	cycle 128 u=0.0975	agent0	initial_cond	0	0.000000
r9_sf_p1.4565_a0.420	6.94013573e-15	0.0	0.0	keep	Phase12 sf p=1.4565 a=0.420	agent1	memory	0	0.0
r9_sf_p1.4565_a0.425	1.26146823e-26	0.0	0.0	keep	Phase12 sf p=1.4565 a=0.425	agent1	memory	0	0.0
exp16107	5.23962023e-29	0.000000	0.000000	discard	cycle 128 u=0.0975	agent0	initial_cond	1	0.000000
r9_sf_p1.4565_a0.430	2.25498001e-27	0.0	0.0	keep	Phase12 sf p=1.4565 a=0.430	agent1	memory	0	0.0
exp16108	5.23962023e-29	0.000000	0.000000	discard	cycle 128 u=0.0975	agent0	initial_cond	0	0.000000
r9_sf_p1.4565_a0.435	4.28029583e-26	0.0	0.0	keep	Phase12 sf p=1.4565 a=0.435	agent1	memory	0	0.0
r9_sf_p1.4565_a0.440	4.73093134e-26	0.0	0.0	keep	Phase12 sf p=1.4565 a=0.440	agent1	memory	0	0.0
exp16109	4.03266298e-29	0.000000	0.000000	discard	cycle 128 u=0.0975	agent0	initial_cond	1	0.000000
r9_sf_p1.4566_a0.420	6.76259021e-15	0.0	0.0	keep	Phase12 sf p=1.4566 a=0.420	agent1	memory	0	0.0
exp16110	4.03266298e-29	0.000000	0.000000	discard	cycle 128 u=0.0975	agent0	initial_cond	0	0.000000
r9_sf_p1.4566_a0.425	9.58936018e-15	0.0	0.0	keep	Phase12 sf p=1.4566 a=0.425	agent1	memory	0	0.0
r9_sf_p1.4566_a0.430	1.50301622e-26	0.0	0.0	keep	Phase12 sf p=1.4566 a=0.430	agent1	memory	0	0.0
exp16111	4.03266298e-29	0.000000	0.000000	discard	cycle 128 u=0.0975	agent0	initial_cond	0	0.000000
r9_sf_p1.4566_a0.435	4.30117396e-26	0.0	0.0	keep	Phase12 sf p=1.4566 a=0.435	agent1	memory	0	0.0
exp16112	4.80015937e-29	0.000000	0.000000	discard	cycle 128 u=0.0975	agent0	initial_cond	0	0.000000
r9_sf_p1.4566_a0.440	2.64050416e-26	0.0	0.0	keep	Phase12 sf p=1.4566 a=0.440	agent1	memory	0	0.0
r9_sf_p1.4567_a0.420	6.58922953e-15	0.0	0.0	keep	Phase12 sf p=1.4567 a=0.420	agent1	memory	0	0.0
exp16113	4.80015937e-29	0.000000	0.000000	discard	cycle 128 u=0.0975	agent0	initial_cond	0	0.000000
r9_sf_p1.4567_a0.425	9.34750514e-15	0.0	0.0	keep	Phase12 sf p=1.4567 a=0.425	agent1	memory	0	0.0
exp16114	4.80015937e-29	0.000000	0.000000	discard	cycle 128 u=0.0975	agent0	initial_cond	1	0.000000
r9_sf_p1.4567_a0.430	1.72207636e-26	0.0	0.0	keep	Phase12 sf p=1.4567 a=0.430	agent1	memory	0	0.0
r9_sf_p1.4567_a0.435	1.90452681e-26	0.0	0.0	keep	Phase12 sf p=1.4567 a=0.435	agent1	memory	0	0.0
exp16115	2.68824537e-29	0.000000	0.000000	discard	cycle 128 u=0.0980	agent0	initial_cond	0	-0.000000
r9_sf_p1.4567_a0.440	4.02432002e-26	0.0	0.0	keep	Phase12 sf p=1.4567 a=0.440	agent1	memory	0	0.0
exp16116	2.68824537e-29	0.000000	0.000000	discard	cycle 128 u=0.0980	agent0	initial_cond	1	-0.000000
exp16117	2.68824537e-29	0.000000	0.000000	discard	cycle 128 u=0.0980	agent0	initial_cond	0	-0.000000
exp16118	6.16758073e-29	0.000000	0.000000	discard	cycle 128 u=0.0980	agent0	initial_cond	0	-0.000000
exp16119	6.16758073e-29	0.000000	0.000000	discard	cycle 128 u=0.0980	agent0	initial_cond	0	-0.000000
exp16120	6.16758073e-29	0.000000	0.000000	discard	cycle 128 u=0.0980	agent0	initial_cond	0	-0.000000
exp16121	2.01926478e-29	0.000000	0.000000	discard	cycle 128 u=0.0980	agent0	initial_cond	1	0.000000
exp16122	2.01926478e-29	0.000000	0.000000	discard	cycle 128 u=0.0980	agent0	initial_cond	0	0.000000
exp16123	2.01926478e-29	0.000000	0.000000	discard	cycle 128 u=0.0980	agent0	initial_cond	1	0.000000
exp16124	1.30310780e-28	0.000000	0.000000	discard	cycle 128 u=0.0980	agent0	initial_cond	0	-0.000000
exp16125	1.30310780e-28	0.000000	0.000000	discard	cycle 128 u=0.0980	agent0	initial_cond	0	-0.000000
exp16126	1.30310780e-28	0.000000	0.000000	discard	cycle 128 u=0.0980	agent0	initial_cond	0	-0.000000
exp16127	5.45343271e-29	0.000000	0.000000	discard	cycle 128 u=0.0982	agent0	initial_cond	0	-0.000000
exp16128	5.45343271e-29	0.000000	0.000000	discard	cycle 128 u=0.0982	agent0	initial_cond	1	-0.000000
exp16129	5.45343271e-29	0.000000	0.000000	discard	cycle 128 u=0.0982	agent0	initial_cond	0	-0.000000
exp16130	1.23429977e-28	0.000000	0.000000	discard	cycle 128 u=0.0982	agent0	initial_cond	1	0.000000
exp16131	1.23429977e-28	0.000000	0.000000	discard	cycle 128 u=0.0982	agent0	initial_cond	0	0.000000
exp16132	1.23429977e-28	0.000000	0.000000	discard	cycle 128 u=0.0982	agent0	initial_cond	0	0.000000
exp16133	1.88036672e-29	0.000000	0.000000	discard	cycle 128 u=0.0982	agent0	initial_cond	0	0.000000
exp16134	1.88036672e-29	0.000000	0.000000	discard	cycle 128 u=0.0982	agent0	initial_cond	0	0.000000
exp16135	1.88036672e-29	0.000000	0.000000	discard	cycle 128 u=0.0982	agent0	initial_cond	1	0.000000
exp16136	1.91190259e-29	0.000000	-0.000000	discard	cycle 128 u=0.0982	agent0	initial_cond	0	0.000000
exp16137	1.91190259e-29	0.000000	-0.000000	discard	cycle 128 u=0.0982	agent0	initial_cond	0	0.000000
exp16138	1.91190259e-29	0.000000	-0.000000	discard	cycle 128 u=0.0982	agent0	initial_cond	0	0.000000
exp16139	6.13049994e-29	0.000000	0.000000	discard	cycle 128 u=0.0985	agent0	initial_cond	0	0.000000
exp16140	6.13049994e-29	0.000000	0.000000	discard	cycle 128 u=0.0985	agent0	initial_cond	1	0.000000
exp16141	6.13049994e-29	0.000000	0.000000	discard	cycle 128 u=0.0985	agent0	initial_cond	0	0.000000
exp16142	5.49750971e-29	0.000000	0.000000	discard	cycle 128 u=0.0985	agent0	initial_cond	1	0.000000
exp16143	5.49750971e-29	0.000000	0.000000	discard	cycle 128 u=0.0985	agent0	initial_cond	0	0.000000
exp16144	5.49750971e-29	0.000000	0.000000	discard	cycle 128 u=0.0985	agent0	initial_cond	0	0.000000
exp16145	4.15642452e-29	0.000000	0.000000	discard	cycle 128 u=0.0985	agent0	initial_cond	0	0.000000
exp16146	4.15642452e-29	0.000000	0.000000	discard	cycle 128 u=0.0985	agent0	initial_cond	0	0.000000
exp16147	4.15642452e-29	0.000000	0.000000	discard	cycle 128 u=0.0985	agent0	initial_cond	1	0.000000
exp16148	2.19292611e-29	0.000000	0.000000	discard	cycle 128 u=0.0985	agent0	initial_cond	0	-0.000000
exp16149	2.19292611e-29	0.000000	0.000000	discard	cycle 128 u=0.0985	agent0	initial_cond	1	-0.000000
exp16150	2.19292611e-29	0.000000	0.000000	discard	cycle 128 u=0.0985	agent0	initial_cond	0	-0.000000
exp16151	4.22491788e-29	0.000000	0.000000	discard	cycle 128 u=0.0990	agent0	initial_cond	0	-0.000000
exp16152	4.22491788e-29	0.000000	0.000000	discard	cycle 128 u=0.0990	agent0	initial_cond	0	-0.000000
exp16153	4.22491788e-29	0.000000	0.000000	discard	cycle 128 u=0.0990	agent0	initial_cond	0	-0.000000
exp16154	3.22245147e-29	0.000000	0.000000	discard	cycle 128 u=0.0990	agent0	initial_cond	1	0.000000
exp16155	3.22245147e-29	0.000000	0.000000	discard	cycle 128 u=0.0990	agent0	initial_cond	0	0.000000
exp16156	3.22245147e-29	0.000000	0.000000	discard	cycle 128 u=0.0990	agent0	initial_cond	0	0.000000
exp16157	4.50941488e-29	0.000000	-0.000000	discard	cycle 128 u=0.0990	agent0	initial_cond	0	0.000000
exp16158	4.50941488e-29	0.000000	-0.000000	discard	cycle 128 u=0.0990	agent0	initial_cond	0	0.000000
exp16159	4.50941488e-29	0.000000	-0.000000	discard	cycle 128 u=0.0990	agent0	initial_cond	1	0.000000
exp16160	4.88330883e-29	0.000000	-0.000000	discard	cycle 128 u=0.0990	agent0	initial_cond	0	0.000000
exp16161	4.88330883e-29	0.000000	-0.000000	discard	cycle 128 u=0.0990	agent0	initial_cond	1	0.000000
r9_m1_k0.005	3.78094344e-20	0.0	0.0	keep	Phase13 K=0.005 modes=1	agent1	memory	0	0.0
r9_m1_k0.0055	1.19636849e-23	0.0	0.0	keep	Phase13 K=0.0055 modes=1	agent1	memory	0	0.0
exp16162	4.88330883e-29	0.000000	-0.000000	discard	cycle 128 u=0.0990	agent0	initial_cond	0	0.000000
r9_m1_k0.006	2.43254748e-26	0.0	0.0	keep	Phase13 K=0.006 modes=1	agent1	memory	0	0.0
exp16163	5.74085541e-29	0.000000	-0.000000	discard	cycle 128 u=0.0995	agent0	initial_cond	0	0.000000
r9_m1_k0.0061	2.25498001e-27	0.0	0.0	keep	Phase13 K=0.0061 modes=1	agent1	memory	0	0.0
r9_m1_k0.0062	6.96984515e-15	0.0	0.0	keep	Phase13 K=0.0062 modes=1	agent1	memory	0	0.0
exp16164	5.74085541e-29	0.000000	-0.000000	discard	cycle 128 u=0.0995	agent0	initial_cond	0	0.000000
r9_m1_k0.0063	3.44447329e-15	0.0	0.0	keep	Phase13 K=0.0063 modes=1	agent1	memory	0	0.0
exp16165	5.74085541e-29	0.000000	-0.000000	discard	cycle 128 u=0.0995	agent0	initial_cond	0	0.000000
r9_m1_k0.0065	7.88820546e-16	0.0	0.0	keep	Phase13 K=0.0065 modes=1	agent1	memory	0	0.0
r9_m1_k0.007	1.34703485e-17	0.0	0.0	keep	Phase13 K=0.007 modes=1	agent1	memory	0	0.0
exp16166	1.54984578e-28	0.000000	0.000000	discard	cycle 128 u=0.0995	agent0	initial_cond	1	-0.000000
r9_m1_k0.0075	1.29862749e-19	0.0	0.0	keep	Phase13 K=0.0075 modes=1	agent1	memory	0	0.0
exp16167	1.54984578e-28	0.000000	0.000000	discard	cycle 128 u=0.0995	agent0	initial_cond	0	-0.000000
r9_m1_k0.008	6.87487696e-22	0.0	0.0	keep	Phase13 K=0.008 modes=1	agent1	memory	0	0.0
exp16168	1.54984578e-28	0.000000	0.000000	discard	cycle 128 u=0.0995	agent0	initial_cond	1	-0.000000
exp16169	1.60328418e-29	0.000000	-0.000000	discard	cycle 128 u=0.0995	agent0	initial_cond	0	-0.000000
exp16170	1.60328418e-29	0.000000	-0.000000	discard	cycle 128 u=0.0995	agent0	initial_cond	0	-0.000000
exp16171	1.60328418e-29	0.000000	-0.000000	discard	cycle 128 u=0.0995	agent0	initial_cond	0	-0.000000
exp16172	7.34590618e-29	0.000000	0.000000	discard	cycle 128 u=0.0995	agent0	initial_cond	0	0.000000
exp16173	7.34590618e-29	0.000000	0.000000	discard	cycle 128 u=0.0995	agent0	initial_cond	1	0.000000
exp16174	7.34590618e-29	0.000000	0.000000	discard	cycle 128 u=0.0995	agent0	initial_cond	0	0.000000
exp16175	4.46546993e-29	0.000000	0.000000	discard	cycle 128 u=0.1000	agent0	initial_cond	1	-0.000000
exp16176	4.46546993e-29	0.000000	0.000000	discard	cycle 128 u=0.1000	agent0	initial_cond	0	-0.000000
exp16177	4.46546993e-29	0.000000	0.000000	discard	cycle 128 u=0.1000	agent0	initial_cond	0	-0.000000
exp16178	4.08106752e-29	0.000000	0.000000	discard	cycle 128 u=0.1000	agent0	initial_cond	0	-0.000000
exp16179	4.08106752e-29	0.000000	0.000000	discard	cycle 128 u=0.1000	agent0	initial_cond	0	-0.000000
exp16180	4.08106752e-29	0.000000	0.000000	discard	cycle 128 u=0.1000	agent0	initial_cond	1	-0.000000
r9_k0.006050_m1	5.84036437e-26	0.0	0.0	keep	Phase14 K=0.006050 fine	agent1	memory	0	0.0
exp16181	4.58623706e-29	0.000000	0.000000	discard	cycle 128 u=0.1000	agent0	initial_cond	0	-0.000000
r9_k0.006053_m1	3.72492250e-26	0.0	0.0	keep	Phase14 K=0.006053 fine	agent1	memory	0	0.0
exp16182	4.58623706e-29	0.000000	0.000000	discard	cycle 128 u=0.1000	agent0	initial_cond	1	-0.000000
r9_k0.006056_m1	3.96220491e-26	0.0	0.0	keep	Phase14 K=0.006056 fine	agent1	memory	0	0.0
r9_k0.006059_m1	1.26434618e-26	0.0	0.0	keep	Phase14 K=0.006059 fine	agent1	memory	0	0.0
exp16183	4.58623706e-29	0.000000	0.000000	discard	cycle 128 u=0.1000	agent0	initial_cond	0	-0.000000
r9_k0.006060_m1	2.00171772e-26	0.0	0.0	keep	Phase14 K=0.006060 fine	agent1	memory	0	0.0
exp16184	4.39794337e-29	0.000000	0.000000	discard	cycle 128 u=0.1000	agent0	initial_cond	0	-0.000000
r9_k0.006061_m1	3.64371916e-26	0.0	0.0	keep	Phase14 K=0.006061 fine	agent1	memory	0	0.0
r9_k0.006062_m1	1.95459070e-26	0.0	0.0	keep	Phase14 K=0.006062 fine	agent1	memory	0	0.0
exp16185	4.39794337e-29	0.000000	0.000000	discard	cycle 128 u=0.1000	agent0	initial_cond	0	-0.000000
r9_k0.006065_m1	3.82901914e-26	0.0	0.0	keep	Phase14 K=0.006065 fine	agent1	memory	0	0.0
exp16186	4.39794337e-29	0.000000	0.000000	discard	cycle 128 u=0.1000	agent0	initial_cond	0	-0.000000
r9_k0.006070_m1	2.34751898e-26	0.0	0.0	keep	Phase14 K=0.006070 fine	agent1	memory	0	0.0
exp16187	1.36727475e-28	0.000000	0.000000	discard	cycle 128 u=0.1050	agent0	initial_cond	1	-0.000000
exp16188	1.36727475e-28	0.000000	0.000000	discard	cycle 128 u=0.1050	agent0	initial_cond	0	-0.000000
exp16189	1.36727475e-28	0.000000	0.000000	discard	cycle 128 u=0.1050	agent0	initial_cond	0	-0.000000
exp16190	6.14461376e-29	0.000000	0.000000	discard	cycle 128 u=0.1050	agent0	initial_cond	0	-0.000000
exp16191	6.14461376e-29	0.000000	0.000000	discard	cycle 128 u=0.1050	agent0	initial_cond	0	-0.000000
exp16192	6.14461376e-29	0.000000	0.000000	discard	cycle 128 u=0.1050	agent0	initial_cond	1	-0.000000
exp16193	1.75906666e-28	0.000000	0.000000	discard	cycle 128 u=0.1050	agent0	initial_cond	0	-0.000000
exp16194	1.75906666e-28	0.000000	0.000000	discard	cycle 128 u=0.1050	agent0	initial_cond	1	-0.000000
exp16195	1.75906666e-28	0.000000	0.000000	discard	cycle 128 u=0.1050	agent0	initial_cond	0	-0.000000
exp16196	1.11257917e-28	0.000000	0.000000	discard	cycle 128 u=0.1050	agent0	initial_cond	0	-0.000000
exp16197	1.11257917e-28	0.000000	0.000000	discard	cycle 128 u=0.1050	agent0	initial_cond	0	-0.000000
exp16198	1.11257917e-28	0.000000	0.000000	discard	cycle 128 u=0.1050	agent0	initial_cond	0	-0.000000
exp16199	8.58580947e-29	0.000000	0.000000	discard	cycle 129 u=0.0975	agent0	initial_cond	1	0.000000
exp16200	8.58580947e-29	0.000000	0.000000	discard	cycle 129 u=0.0975	agent0	initial_cond	0	0.000000
exp16201	8.58580947e-29	0.000000	0.000000	discard	cycle 129 u=0.0975	agent0	initial_cond	1	0.000000
exp16202	5.23962023e-29	0.000000	0.000000	discard	cycle 129 u=0.0975	agent0	initial_cond	0	0.000000
exp16203	5.23962023e-29	0.000000	0.000000	discard	cycle 129 u=0.0975	agent0	initial_cond	0	0.000000
exp16204	5.23962023e-29	0.000000	0.000000	discard	cycle 129 u=0.0975	agent0	initial_cond	0	0.000000
exp16205	4.03266298e-29	0.000000	0.000000	discard	cycle 129 u=0.0975	agent0	initial_cond	0	0.000000
exp16206	4.03266298e-29	0.000000	0.000000	discard	cycle 129 u=0.0975	agent0	initial_cond	1	0.000000
exp16207	4.03266298e-29	0.000000	0.000000	discard	cycle 129 u=0.0975	agent0	initial_cond	0	0.000000
exp16208	4.80015937e-29	0.000000	0.000000	discard	cycle 129 u=0.0975	agent0	initial_cond	1	0.000000
exp16209	4.80015937e-29	0.000000	0.000000	discard	cycle 129 u=0.0975	agent0	initial_cond	0	0.000000
exp16210	4.80015937e-29	0.000000	0.000000	discard	cycle 129 u=0.0975	agent0	initial_cond	0	0.000000
exp16211	2.68824537e-29	0.000000	0.000000	discard	cycle 129 u=0.0980	agent0	initial_cond	1	-0.000000
exp16212	2.68824537e-29	0.000000	0.000000	discard	cycle 129 u=0.0980	agent0	initial_cond	0	-0.000000
exp16213	2.68824537e-29	0.000000	0.000000	discard	cycle 129 u=0.0980	agent0	initial_cond	1	-0.000000
exp16214	6.16758073e-29	0.000000	0.000000	discard	cycle 129 u=0.0980	agent0	initial_cond	0	-0.000000
exp16215	6.16758073e-29	0.000000	0.000000	discard	cycle 129 u=0.0980	agent0	initial_cond	0	-0.000000
exp16216	6.16758073e-29	0.000000	0.000000	discard	cycle 129 u=0.0980	agent0	initial_cond	0	-0.000000
exp16217	2.01926478e-29	0.000000	0.000000	discard	cycle 129 u=0.0980	agent0	initial_cond	0	0.000000
exp16218	2.01926478e-29	0.000000	0.000000	discard	cycle 129 u=0.0980	agent0	initial_cond	1	0.000000
exp16219	2.01926478e-29	0.000000	0.000000	discard	cycle 129 u=0.0980	agent0	initial_cond	0	0.000000
exp16220	1.30310780e-28	0.000000	0.000000	discard	cycle 129 u=0.0980	agent0	initial_cond	1	-0.000000
exp16221	1.30310780e-28	0.000000	0.000000	discard	cycle 129 u=0.0980	agent0	initial_cond	0	-0.000000
exp16222	1.30310780e-28	0.000000	0.000000	discard	cycle 129 u=0.0980	agent0	initial_cond	0	-0.000000
exp16223	5.45343271e-29	0.000000	0.000000	discard	cycle 129 u=0.0982	agent0	initial_cond	0	-0.000000
exp16224	5.45343271e-29	0.000000	0.000000	discard	cycle 129 u=0.0982	agent0	initial_cond	0	-0.000000
exp16225	5.45343271e-29	0.000000	0.000000	discard	cycle 129 u=0.0982	agent0	initial_cond	1	-0.000000
exp16226	1.23429977e-28	0.000000	0.000000	discard	cycle 129 u=0.0982	agent0	initial_cond	0	0.000000
exp16227	1.23429977e-28	0.000000	0.000000	discard	cycle 129 u=0.0982	agent0	initial_cond	1	0.000000
exp16228	1.23429977e-28	0.000000	0.000000	discard	cycle 129 u=0.0982	agent0	initial_cond	0	0.000000
exp16229	1.88036672e-29	0.000000	0.000000	discard	cycle 129 u=0.0982	agent0	initial_cond	0	0.000000
exp16230	1.88036672e-29	0.000000	0.000000	discard	cycle 129 u=0.0982	agent0	initial_cond	0	0.000000
exp16231	1.88036672e-29	0.000000	0.000000	discard	cycle 129 u=0.0982	agent0	initial_cond	0	0.000000
exp16232	1.91190259e-29	0.000000	-0.000000	discard	cycle 129 u=0.0982	agent0	initial_cond	1	0.000000
exp16233	1.91190259e-29	0.000000	-0.000000	discard	cycle 129 u=0.0982	agent0	initial_cond	0	0.000000
exp16234	1.91190259e-29	0.000000	-0.000000	discard	cycle 129 u=0.0982	agent0	initial_cond	1	0.000000
exp16235	6.13049994e-29	0.000000	0.000000	discard	cycle 129 u=0.0985	agent0	initial_cond	0	0.000000
exp16236	6.13049994e-29	0.000000	0.000000	discard	cycle 129 u=0.0985	agent0	initial_cond	0	0.000000
exp16237	6.13049994e-29	0.000000	0.000000	discard	cycle 129 u=0.0985	agent0	initial_cond	0	0.000000
exp16238	5.49750971e-29	0.000000	0.000000	discard	cycle 129 u=0.0985	agent0	initial_cond	0	0.000000
exp16239	5.49750971e-29	0.000000	0.000000	discard	cycle 129 u=0.0985	agent0	initial_cond	1	0.000000
exp16240	5.49750971e-29	0.000000	0.000000	discard	cycle 129 u=0.0985	agent0	initial_cond	0	0.000000
exp16241	4.15642452e-29	0.000000	0.000000	discard	cycle 129 u=0.0985	agent0	initial_cond	0	0.000000
exp16242	4.15642452e-29	0.000000	0.000000	discard	cycle 129 u=0.0985	agent0	initial_cond	0	0.000000
exp16243	4.15642452e-29	0.000000	0.000000	discard	cycle 129 u=0.0985	agent0	initial_cond	0	0.000000
exp16244	2.19292611e-29	0.000000	0.000000	discard	cycle 129 u=0.0985	agent0	initial_cond	1	-0.000000
exp16245	2.19292611e-29	0.000000	0.000000	discard	cycle 129 u=0.0985	agent0	initial_cond	0	-0.000000
exp16246	2.19292611e-29	0.000000	0.000000	discard	cycle 129 u=0.0985	agent0	initial_cond	1	-0.000000
exp16247	4.22491788e-29	0.000000	0.000000	discard	cycle 129 u=0.0990	agent0	initial_cond	0	-0.000000
exp16248	4.22491788e-29	0.000000	0.000000	discard	cycle 129 u=0.0990	agent0	initial_cond	0	-0.000000
exp16249	4.22491788e-29	0.000000	0.000000	discard	cycle 129 u=0.0990	agent0	initial_cond	0	-0.000000
