exp_id	residual	solution_norm	solution_mean	status	description	agent	design	elapsed_s	solution_energy
exp9093	2.41016783e-17	0.070278	-0.000000	discard	Ultra-3D u=0.245 amp=0.43 phase=1.23	manual	memory	1	0.000097
exp9094	4.03266298e-29	0.000000	0.000000	discard	cycle 64 u=0.0975	agent0	initial_cond	0	0.000000
exp9095	1.44227367e-17	0.070278	-0.000000	discard	Ultra-3D u=0.245 amp=0.43 phase=1.24	manual	memory	0	0.000097
exp9096	4.03266298e-29	0.000000	0.000000	discard	cycle 64 u=0.0975	agent0	initial_cond	0	0.000000
exp9097	8.40651583e-17	0.070278	-0.000000	discard	Ultra-3D u=0.245 amp=0.43 phase=1.25	manual	memory	1	0.000097
exp9097	4.03266298e-29	0.000000	0.000000	discard	cycle 64 u=0.0975	agent0	initial_cond	1	0.000000
exp9098	4.80015937e-29	0.000000	0.000000	discard	cycle 64 u=0.0975	agent0	initial_cond	0	0.000000
exp9099	2.41621615e-17	0.070278	-0.000000	discard	Ultra-3D u=0.245 amp=0.44 phase=1.20	manual	memory	0	0.000097
exp9100	4.80015937e-29	0.000000	0.000000	discard	cycle 64 u=0.0975	agent0	initial_cond	0	0.000000
exp9101	7.31189618e-17	0.070278	0.000000	discard	Ultra-3D u=0.245 amp=0.44 phase=1.21	manual	memory	1	0.000097
exp9102	4.80015937e-29	0.000000	0.000000	discard	cycle 64 u=0.0975	agent0	initial_cond	0	0.000000
exp9103	2.48986937e-17	0.070278	-0.000000	discard	Ultra-3D u=0.245 amp=0.44 phase=1.22	manual	memory	0	0.000097
exp9104	2.68824537e-29	0.000000	0.000000	discard	cycle 64 u=0.0980	agent0	initial_cond	0	-0.000000
exp9105	2.66200809e-17	0.070278	-0.000000	discard	Ultra-3D u=0.245 amp=0.44 phase=1.23	manual	memory	1	0.000097
exp9105	2.68824537e-29	0.000000	0.000000	discard	cycle 64 u=0.0980	agent0	initial_cond	1	-0.000000
exp9106	2.68824537e-29	0.000000	0.000000	discard	cycle 64 u=0.0980	agent0	initial_cond	0	-0.000000
exp9106	3.62604279e-17	0.070278	-0.000000	discard	Ultra-3D u=0.245 amp=0.44 phase=1.24	manual	memory	0	0.000097
exp9107	6.16758073e-29	0.000000	0.000000	discard	cycle 64 u=0.0980	agent0	initial_cond	0	-0.000000
exp9108	3.69699392e-17	0.070278	-0.000000	discard	Ultra-3D u=0.245 amp=0.44 phase=1.25	manual	memory	1	0.000097
exp9109	6.16758073e-29	0.000000	0.000000	discard	cycle 64 u=0.0980	agent0	initial_cond	1	-0.000000
exp9110	1.62869650e-17	0.070278	-0.000000	discard	Ultra-3D u=0.245 amp=0.45 phase=1.20	manual	memory	0	0.000097
exp9111	6.16758073e-29	0.000000	0.000000	discard	cycle 64 u=0.0980	agent0	initial_cond	0	-0.000000
exp9112	2.93333755e-17	0.070278	-0.000000	discard	Ultra-3D u=0.245 amp=0.45 phase=1.21	manual	memory	0	0.000097
exp9112	2.01926478e-29	0.000000	0.000000	discard	cycle 64 u=0.0980	agent0	initial_cond	1	0.000000
exp9113	2.01926478e-29	0.000000	0.000000	discard	cycle 64 u=0.0980	agent0	initial_cond	0	0.000000
exp9113	1.89058079e-17	0.070278	-0.000000	discard	Ultra-3D u=0.245 amp=0.45 phase=1.22	manual	memory	0	0.000097
exp9114	2.01926478e-29	0.000000	0.000000	discard	cycle 64 u=0.0980	agent0	initial_cond	0	0.000000
exp9115	3.96412007e-17	0.070278	-0.000000	discard	Ultra-3D u=0.245 amp=0.45 phase=1.23	manual	memory	0	0.000097
exp9116	1.30310780e-28	0.000000	0.000000	discard	cycle 64 u=0.0980	agent0	initial_cond	1	-0.000000
exp9117	1.59420788e-17	0.070278	-0.000000	discard	Ultra-3D u=0.245 amp=0.45 phase=1.24	manual	memory	0	0.000097
exp9118	1.30310780e-28	0.000000	0.000000	discard	cycle 64 u=0.0980	agent0	initial_cond	0	-0.000000
exp9119	3.25688346e-17	0.070278	-0.000000	discard	Ultra-3D u=0.245 amp=0.45 phase=1.25	manual	memory	0	0.000097
exp9119	1.30310780e-28	0.000000	0.000000	discard	cycle 64 u=0.0980	agent0	initial_cond	0	-0.000000
exp9120	5.45343271e-29	0.000000	0.000000	discard	cycle 64 u=0.0982	agent0	initial_cond	0	-0.000000
exp9120	5.43070854e-17	0.070278	-0.000000	discard	Ultra-3D u=0.246 amp=0.43 phase=1.20	manual	memory	0	0.000097
exp9121	5.45343271e-29	0.000000	0.000000	discard	cycle 64 u=0.0982	agent0	initial_cond	0	-0.000000
exp9122	5.70555081e-17	0.070278	-0.000000	discard	Ultra-3D u=0.246 amp=0.43 phase=1.21	manual	memory	0	0.000097
exp9123	5.45343271e-29	0.000000	0.000000	discard	cycle 64 u=0.0982	agent0	initial_cond	1	-0.000000
exp9124	2.20747974e-17	0.070278	-0.000000	discard	Ultra-3D u=0.246 amp=0.43 phase=1.22	manual	memory	0	0.000097
exp9125	1.23429977e-28	0.000000	0.000000	discard	cycle 64 u=0.0982	agent0	initial_cond	0	0.000000
exp9126	2.23711654e-17	0.070278	-0.000000	discard	Ultra-3D u=0.246 amp=0.43 phase=1.23	manual	memory	0	0.000097
exp9127	1.23429977e-28	0.000000	0.000000	discard	cycle 64 u=0.0982	agent0	initial_cond	0	0.000000
exp9128	6.07786085e-17	0.070278	-0.000000	discard	Ultra-3D u=0.246 amp=0.43 phase=1.24	manual	memory	0	0.000097
exp9128	1.23429977e-28	0.000000	0.000000	discard	cycle 64 u=0.0982	agent0	initial_cond	0	0.000000
exp9129	1.88036672e-29	0.000000	0.000000	discard	cycle 64 u=0.0982	agent0	initial_cond	0	0.000000
exp9130	1.50082617e-17	0.070278	-0.000000	discard	Ultra-3D u=0.246 amp=0.43 phase=1.25	manual	memory	0	0.000097
exp9131	1.88036672e-29	0.000000	0.000000	discard	cycle 64 u=0.0982	agent0	initial_cond	1	0.000000
exp9132	5.00401412e-17	0.070278	-0.000000	discard	Ultra-3D u=0.246 amp=0.44 phase=1.20	manual	memory	1	0.000097
exp9133	1.88036672e-29	0.000000	0.000000	discard	cycle 64 u=0.0982	agent0	initial_cond	0	0.000000
exp9134	2.17048076e-17	0.070278	-0.000000	discard	Ultra-3D u=0.246 amp=0.44 phase=1.21	manual	memory	0	0.000097
exp9135	1.91190259e-29	0.000000	-0.000000	discard	cycle 64 u=0.0982	agent0	initial_cond	0	0.000000
exp9136	3.68253431e-17	0.070278	-0.000000	discard	Ultra-3D u=0.246 amp=0.44 phase=1.22	manual	memory	1	0.000097
exp9136	1.91190259e-29	0.000000	-0.000000	discard	cycle 64 u=0.0982	agent0	initial_cond	1	0.000000
exp9137	1.91190259e-29	0.000000	-0.000000	discard	cycle 64 u=0.0982	agent0	initial_cond	0	0.000000
exp9138	4.40251360e-17	0.070278	-0.000000	discard	Ultra-3D u=0.246 amp=0.44 phase=1.23	manual	memory	0	0.000097
exp9139	6.13049994e-29	0.000000	0.000000	discard	cycle 64 u=0.0985	agent0	initial_cond	1	0.000000
exp9140	2.09664876e-17	0.070278	-0.000000	discard	Ultra-3D u=0.246 amp=0.44 phase=1.24	manual	memory	1	0.000097
exp9141	6.13049994e-29	0.000000	0.000000	discard	cycle 64 u=0.0985	agent0	initial_cond	0	0.000000
exp9142	9.06869688e-18	0.070278	-0.000000	discard	Ultra-3D u=0.246 amp=0.44 phase=1.25	manual	memory	0	0.000097
exp9143	6.13049994e-29	0.000000	0.000000	discard	cycle 64 u=0.0985	agent0	initial_cond	0	0.000000
exp9144	3.17866069e-17	0.070278	-0.000000	discard	Ultra-3D u=0.246 amp=0.45 phase=1.20	manual	memory	1	0.000097
exp9144	5.49750971e-29	0.000000	0.000000	discard	cycle 64 u=0.0985	agent0	initial_cond	1	0.000000
exp9145	5.49750971e-29	0.000000	0.000000	discard	cycle 64 u=0.0985	agent0	initial_cond	0	0.000000
exp9145	7.23301065e-17	0.070278	-0.000000	discard	Ultra-3D u=0.246 amp=0.45 phase=1.21	manual	memory	0	0.000097
exp9146	5.49750971e-29	0.000000	0.000000	discard	cycle 64 u=0.0985	agent0	initial_cond	0	0.000000
exp9147	2.06260857e-17	0.070278	-0.000000	discard	Ultra-3D u=0.246 amp=0.45 phase=1.22	manual	memory	1	0.000097
exp9148	4.15642452e-29	0.000000	0.000000	discard	cycle 64 u=0.0985	agent0	initial_cond	0	0.000000
exp9149	5.74201205e-17	0.070278	-0.000000	discard	Ultra-3D u=0.246 amp=0.45 phase=1.23	manual	memory	0	0.000097
exp9150	4.15642452e-29	0.000000	0.000000	discard	cycle 64 u=0.0985	agent0	initial_cond	0	0.000000
exp9151	3.21679689e-17	0.070278	-0.000000	discard	Ultra-3D u=0.246 amp=0.45 phase=1.24	manual	memory	1	0.000097
exp9151	4.15642452e-29	0.000000	0.000000	discard	cycle 64 u=0.0985	agent0	initial_cond	1	0.000000
exp9152	2.19292611e-29	0.000000	0.000000	discard	cycle 64 u=0.0985	agent0	initial_cond	0	-0.000000
exp9152	2.12181106e-17	0.070278	-0.000000	discard	Ultra-3D u=0.246 amp=0.45 phase=1.25	manual	memory	0	0.000097
exp9153	2.19292611e-29	0.000000	0.000000	discard	cycle 64 u=0.0985	agent0	initial_cond	0	-0.000000
exp9154	2.19292611e-29	0.000000	0.000000	discard	cycle 64 u=0.0985	agent0	initial_cond	1	-0.000000
exp9155	4.22491788e-29	0.000000	0.000000	discard	cycle 64 u=0.0990	agent0	initial_cond	0	-0.000000
exp9156	4.22491788e-29	0.000000	0.000000	discard	cycle 64 u=0.0990	agent0	initial_cond	1	-0.000000
exp9157	4.22491788e-29	0.000000	0.000000	discard	cycle 64 u=0.0990	agent0	initial_cond	0	-0.000000
exp9158	3.22245147e-29	0.000000	0.000000	discard	cycle 64 u=0.0990	agent0	initial_cond	0	0.000000
exp9159	3.22245147e-29	0.000000	0.000000	discard	cycle 64 u=0.0990	agent0	initial_cond	1	0.000000
exp9160	3.22245147e-29	0.000000	0.000000	discard	cycle 64 u=0.0990	agent0	initial_cond	0	0.000000
exp9161	4.50941488e-29	0.000000	-0.000000	discard	cycle 64 u=0.0990	agent0	initial_cond	0	0.000000
exp9162	4.50941488e-29	0.000000	-0.000000	discard	cycle 64 u=0.0990	agent0	initial_cond	0	0.000000
exp9163	4.50941488e-29	0.000000	-0.000000	discard	cycle 64 u=0.0990	agent0	initial_cond	0	0.000000
exp9164	4.88330883e-29	0.000000	-0.000000	discard	cycle 64 u=0.0990	agent0	initial_cond	1	0.000000
exp9165	4.88330883e-29	0.000000	-0.000000	discard	cycle 64 u=0.0990	agent0	initial_cond	0	0.000000
exp9166	4.88330883e-29	0.000000	-0.000000	discard	cycle 64 u=0.0990	agent0	initial_cond	0	0.000000
exp9167	5.74085541e-29	0.000000	-0.000000	discard	cycle 64 u=0.0995	agent0	initial_cond	0	0.000000
exp9168	5.74085541e-29	0.000000	-0.000000	discard	cycle 64 u=0.0995	agent0	initial_cond	0	0.000000
exp9169	5.74085541e-29	0.000000	-0.000000	discard	cycle 64 u=0.0995	agent0	initial_cond	1	0.000000
exp9170	1.54984578e-28	0.000000	0.000000	discard	cycle 64 u=0.0995	agent0	initial_cond	0	-0.000000
exp9171	1.54984578e-28	0.000000	0.000000	discard	cycle 64 u=0.0995	agent0	initial_cond	0	-0.000000
exp9172	1.54984578e-28	0.000000	0.000000	discard	cycle 64 u=0.0995	agent0	initial_cond	1	-0.000000
exp9173	1.60328418e-29	0.000000	-0.000000	discard	cycle 64 u=0.0995	agent0	initial_cond	0	-0.000000
exp9174	1.60328418e-29	0.000000	-0.000000	discard	cycle 64 u=0.0995	agent0	initial_cond	1	-0.000000
exp_nueva_sota	6.91159813e-18	0.070278	-0.000000	keep	NEW SOTA: u=0.244 amp=0.44 phase=1.23 modes=3 4th branch	agent1	memory	0	-0.000000
exp9175	1.60328418e-29	0.000000	-0.000000	discard	cycle 64 u=0.0995	agent0	initial_cond	0	-0.000000
exp9176	7.34590618e-29	0.000000	0.000000	discard	cycle 64 u=0.0995	agent0	initial_cond	0	0.000000
exp9177	7.34590618e-29	0.000000	0.000000	discard	cycle 64 u=0.0995	agent0	initial_cond	1	0.000000
exp9178	7.34590618e-29	0.000000	0.000000	discard	cycle 64 u=0.0995	agent0	initial_cond	0	0.000000
exp9179	4.46546993e-29	0.000000	0.000000	discard	cycle 64 u=0.1000	agent0	initial_cond	0	-0.000000
exp9180	4.46546993e-29	0.000000	0.000000	discard	cycle 64 u=0.1000	agent0	initial_cond	0	-0.000000
exp9181	4.46546993e-29	0.000000	0.000000	discard	cycle 64 u=0.1000	agent0	initial_cond	0	-0.000000
exp9182	4.08106752e-29	0.000000	0.000000	discard	cycle 64 u=0.1000	agent0	initial_cond	1	-0.000000
exp9183	4.08106752e-29	0.000000	0.000000	discard	cycle 64 u=0.1000	agent0	initial_cond	0	-0.000000
exp9184	4.08106752e-29	0.000000	0.000000	discard	cycle 64 u=0.1000	agent0	initial_cond	0	-0.000000
exp9185	4.58623706e-29	0.000000	0.000000	discard	cycle 64 u=0.1000	agent0	initial_cond	0	-0.000000
exp9186	4.58623706e-29	0.000000	0.000000	discard	cycle 64 u=0.1000	agent0	initial_cond	0	-0.000000
exp9187	3.57727412e-17	0.070278	-0.000000	discard	Extreme u=0.2435 amp=0.435 p=1.220	manual	memory	1	0.000097
exp9187	4.58623706e-29	0.000000	0.000000	discard	cycle 64 u=0.1000	agent0	initial_cond	1	-0.000000
exp9188	4.39794337e-29	0.000000	0.000000	discard	cycle 64 u=0.1000	agent0	initial_cond	0	-0.000000
exp9188	5.98766994e-17	0.070278	-0.000000	discard	Extreme u=0.2435 amp=0.435 p=1.225	manual	memory	0	0.000097
exp9189	4.39794337e-29	0.000000	0.000000	discard	cycle 64 u=0.1000	agent0	initial_cond	0	-0.000000
exp9190	1.14589077e-17	0.070278	-0.000000	discard	Extreme u=0.2435 amp=0.435 p=1.230	manual	memory	0	0.000097
exp9191	4.39794337e-29	0.000000	0.000000	discard	cycle 64 u=0.1000	agent0	initial_cond	1	-0.000000
exp9192	1.45282096e-17	0.070278	-0.000000	discard	Extreme u=0.2435 amp=0.435 p=1.235	manual	memory	0	0.000097
exp9193	1.36727475e-28	0.000000	0.000000	discard	cycle 64 u=0.1050	agent0	initial_cond	0	-0.000000
exp9194	3.09177766e-17	0.070278	-0.000000	discard	Extreme u=0.2435 amp=0.435 p=1.240	manual	memory	0	0.000097
exp9195	1.36727475e-28	0.000000	0.000000	discard	cycle 64 u=0.1050	agent0	initial_cond	1	-0.000000
exp9196	1.36727475e-28	0.000000	0.000000	discard	cycle 64 u=0.1050	agent0	initial_cond	0	-0.000000
exp9196	1.44100413e-17	0.070278	-0.000000	discard	Extreme u=0.2435 amp=0.440 p=1.220	manual	memory	0	0.000097
exp9197	6.14461376e-29	0.000000	0.000000	discard	cycle 64 u=0.1050	agent0	initial_cond	0	-0.000000
exp9198	6.37553400e-17	0.070278	-0.000000	discard	Extreme u=0.2435 amp=0.440 p=1.225	manual	memory	0	0.000097
exp9199	6.14461376e-29	0.000000	0.000000	discard	cycle 64 u=0.1050	agent0	initial_cond	1	-0.000000
exp9200	3.97076933e-17	0.070278	-0.000000	discard	Extreme u=0.2435 amp=0.440 p=1.230	manual	memory	0	0.000097
exp9201	6.14461376e-29	0.000000	0.000000	discard	cycle 64 u=0.1050	agent0	initial_cond	0	-0.000000
exp9202	2.93640891e-17	0.070278	-0.000000	discard	Extreme u=0.2435 amp=0.440 p=1.235	manual	memory	0	0.000097
exp9203	1.75906666e-28	0.000000	0.000000	discard	cycle 64 u=0.1050	agent0	initial_cond	0	-0.000000
exp9204	1.75906666e-28	0.000000	0.000000	discard	cycle 64 u=0.1050	agent0	initial_cond	0	-0.000000
exp9204	1.05687316e-17	0.070278	-0.000000	discard	Extreme u=0.2435 amp=0.440 p=1.240	manual	memory	0	0.000097
exp9205	1.75906666e-28	0.000000	0.000000	discard	cycle 64 u=0.1050	agent0	initial_cond	0	-0.000000
exp9206	4.27929152e-17	0.070278	-0.000000	discard	Extreme u=0.2435 amp=0.445 p=1.220	manual	memory	0	0.000097
exp9207	1.11257917e-28	0.000000	0.000000	discard	cycle 64 u=0.1050	agent0	initial_cond	1	-0.000000
exp9208	2.60505091e-17	0.070278	-0.000000	discard	Extreme u=0.2435 amp=0.445 p=1.225	manual	memory	0	0.000097
exp9209	1.11257917e-28	0.000000	0.000000	discard	cycle 64 u=0.1050	agent0	initial_cond	0	-0.000000
exp9210	6.25686865e-17	0.070278	-0.000000	discard	Extreme u=0.2435 amp=0.445 p=1.230	manual	memory	0	0.000097
exp9211	1.11257917e-28	0.000000	0.000000	discard	cycle 64 u=0.1050	agent0	initial_cond	0	-0.000000
exp9212	8.58580947e-29	0.000000	0.000000	discard	cycle 65 u=0.0975	agent0	initial_cond	0	0.000000
exp9212	1.56449888e-17	0.070278	-0.000000	discard	Extreme u=0.2435 amp=0.445 p=1.235	manual	memory	0	0.000097
exp9213	8.58580947e-29	0.000000	0.000000	discard	cycle 65 u=0.0975	agent0	initial_cond	0	0.000000
exp9214	5.50597013e-17	0.070278	-0.000000	discard	Extreme u=0.2435 amp=0.445 p=1.240	manual	memory	0	0.000097
exp9215	8.58580947e-29	0.000000	0.000000	discard	cycle 65 u=0.0975	agent0	initial_cond	1	0.000000
exp9216	5.41334575e-17	0.070278	-0.000000	discard	Extreme u=0.2440 amp=0.435 p=1.220	manual	memory	0	0.000097
exp9217	5.23962023e-29	0.000000	0.000000	discard	cycle 65 u=0.0975	agent0	initial_cond	0	0.000000
exp9218	2.27014758e-17	0.070278	-0.000000	discard	Extreme u=0.2440 amp=0.435 p=1.225	manual	memory	0	0.000097
exp9219	5.23962023e-29	0.000000	0.000000	discard	cycle 65 u=0.0975	agent0	initial_cond	0	0.000000
exp9220	3.51634874e-17	0.070278	-0.000000	discard	Extreme u=0.2440 amp=0.435 p=1.230	manual	memory	1	0.000097
exp9220	5.23962023e-29	0.000000	0.000000	discard	cycle 65 u=0.0975	agent0	initial_cond	1	0.000000
exp9221	4.03266298e-29	0.000000	0.000000	discard	cycle 65 u=0.0975	agent0	initial_cond	0	0.000000
exp9222	2.22761230e-17	0.070278	-0.000000	discard	Extreme u=0.2440 amp=0.435 p=1.235	manual	memory	0	0.000097
exp9223	4.03266298e-29	0.000000	0.000000	discard	cycle 65 u=0.0975	agent0	initial_cond	1	0.000000
exp9224	4.08149721e-17	0.070278	-0.000000	discard	Extreme u=0.2440 amp=0.435 p=1.240	manual	memory	1	0.000097
exp9225	4.03266298e-29	0.000000	0.000000	discard	cycle 65 u=0.0975	agent0	initial_cond	0	0.000000
exp9226	4.05824992e-17	0.070278	-0.000000	discard	Extreme u=0.2440 amp=0.440 p=1.220	manual	memory	0	0.000097
exp9227	4.80015937e-29	0.000000	0.000000	discard	cycle 65 u=0.0975	agent0	initial_cond	0	0.000000
exp9228	1.44581225e-17	0.070278	-0.000000	discard	Extreme u=0.2440 amp=0.440 p=1.225	manual	memory	1	0.000097
exp9228	4.80015937e-29	0.000000	0.000000	discard	cycle 65 u=0.0975	agent0	initial_cond	1	0.000000
exp9229	4.80015937e-29	0.000000	0.000000	discard	cycle 65 u=0.0975	agent0	initial_cond	0	0.000000
exp9229	6.91159813e-18	0.070278	-0.000000	discard	Extreme u=0.2440 amp=0.440 p=1.230	manual	memory	0	0.000097
exp9230	2.68824537e-29	0.000000	0.000000	discard	cycle 65 u=0.0980	agent0	initial_cond	0	-0.000000
exp9231	2.07629367e-17	0.070278	-0.000000	discard	Extreme u=0.2440 amp=0.440 p=1.235	manual	memory	1	0.000097
exp9232	2.68824537e-29	0.000000	0.000000	discard	cycle 65 u=0.0980	agent0	initial_cond	0	-0.000000
exp9233	1.23796409e-17	0.070278	-0.000000	discard	Extreme u=0.2440 amp=0.440 p=1.240	manual	memory	0	0.000097
exp9234	2.68824537e-29	0.000000	0.000000	discard	cycle 65 u=0.0980	agent0	initial_cond	0	-0.000000
exp9235	1.99597850e-17	0.070278	-0.000000	discard	Extreme u=0.2440 amp=0.445 p=1.220	manual	memory	1	0.000097
exp9236	6.16758073e-29	0.000000	0.000000	discard	cycle 65 u=0.0980	agent0	initial_cond	1	-0.000000
exp9237	6.16758073e-29	0.000000	0.000000	discard	cycle 65 u=0.0980	agent0	initial_cond	0	-0.000000
exp9237	1.56878932e-17	0.070278	0.000000	discard	Extreme u=0.2440 amp=0.445 p=1.225	manual	memory	0	0.000097
exp9238	6.16758073e-29	0.000000	0.000000	discard	cycle 65 u=0.0980	agent0	initial_cond	0	-0.000000
exp9239	1.60627669e-17	0.070278	-0.000000	discard	Extreme u=0.2440 amp=0.445 p=1.230	manual	memory	1	0.000097
exp9240	2.01926478e-29	0.000000	0.000000	discard	cycle 65 u=0.0980	agent0	initial_cond	0	0.000000
exp9241	4.49743901e-17	0.070278	-0.000000	discard	Extreme u=0.2440 amp=0.445 p=1.235	manual	memory	0	0.000097
exp9242	2.01926478e-29	0.000000	0.000000	discard	cycle 65 u=0.0980	agent0	initial_cond	0	0.000000
exp9243	4.18720421e-17	0.070278	-0.000000	discard	Extreme u=0.2440 amp=0.445 p=1.240	manual	memory	1	0.000097
exp9244	2.01926478e-29	0.000000	0.000000	discard	cycle 65 u=0.0980	agent0	initial_cond	1	0.000000
exp9245	1.30310780e-28	0.000000	0.000000	discard	cycle 65 u=0.0980	agent0	initial_cond	0	-0.000000
exp9245	6.48426336e-17	0.070278	-0.000000	discard	Extreme u=0.2445 amp=0.435 p=1.220	manual	memory	0	0.000097
exp9246	1.30310780e-28	0.000000	0.000000	discard	cycle 65 u=0.0980	agent0	initial_cond	0	-0.000000
exp9247	5.43946827e-17	0.070278	-0.000000	discard	Extreme u=0.2445 amp=0.435 p=1.225	manual	memory	0	0.000097
exp9248	1.30310780e-28	0.000000	0.000000	discard	cycle 65 u=0.0980	agent0	initial_cond	0	-0.000000
exp9249	4.38556047e-17	0.070278	-0.000000	discard	Extreme u=0.2445 amp=0.435 p=1.230	manual	memory	0	0.000097
exp9250	5.45343271e-29	0.000000	0.000000	discard	cycle 65 u=0.0982	agent0	initial_cond	0	-0.000000
exp9251	1.88726203e-17	0.070278	-0.000000	discard	Extreme u=0.2445 amp=0.435 p=1.235	manual	memory	0	0.000097
exp9252	5.45343271e-29	0.000000	0.000000	discard	cycle 65 u=0.0982	agent0	initial_cond	1	-0.000000
exp9253	7.37427224e-17	0.070278	-0.000000	discard	Extreme u=0.2445 amp=0.435 p=1.240	manual	memory	0	0.000097
exp9253	5.45343271e-29	0.000000	0.000000	discard	cycle 65 u=0.0982	agent0	initial_cond	0	-0.000000
exp9254	1.23429977e-28	0.000000	0.000000	discard	cycle 65 u=0.0982	agent0	initial_cond	0	0.000000
exp9255	2.00047795e-17	0.070278	-0.000000	discard	Extreme u=0.2445 amp=0.440 p=1.220	manual	memory	0	0.000097
exp9256	1.23429977e-28	0.000000	0.000000	discard	cycle 65 u=0.0982	agent0	initial_cond	1	0.000000
exp9257	4.73443624e-17	0.070278	-0.000000	discard	Extreme u=0.2445 amp=0.440 p=1.225	manual	memory	0	0.000097
exp9258	1.23429977e-28	0.000000	0.000000	discard	cycle 65 u=0.0982	agent0	initial_cond	0	0.000000
exp9259	1.24498176e-17	0.070278	-0.000000	discard	Extreme u=0.2445 amp=0.440 p=1.230	manual	memory	0	0.000097
exp9260	1.88036672e-29	0.000000	0.000000	discard	cycle 65 u=0.0982	agent0	initial_cond	1	0.000000
exp9261	2.60889839e-17	0.070278	-0.000000	discard	Extreme u=0.2445 amp=0.440 p=1.235	manual	memory	0	0.000097
exp9261	1.88036672e-29	0.000000	0.000000	discard	cycle 65 u=0.0982	agent0	initial_cond	0	0.000000
exp9262	1.88036672e-29	0.000000	0.000000	discard	cycle 65 u=0.0982	agent0	initial_cond	0	0.000000
exp9262	2.00031494e-17	0.070278	-0.000000	discard	Extreme u=0.2445 amp=0.440 p=1.240	manual	memory	0	0.000097
exp9263	1.91190259e-29	0.000000	-0.000000	discard	cycle 65 u=0.0982	agent0	initial_cond	1	0.000000
exp9264	2.90029079e-17	0.070278	-0.000000	discard	Extreme u=0.2445 amp=0.445 p=1.220	manual	memory	0	0.000097
exp9265	1.91190259e-29	0.000000	-0.000000	discard	cycle 65 u=0.0982	agent0	initial_cond	0	0.000000
exp9266	7.40943549e-17	0.070278	-0.000000	discard	Extreme u=0.2445 amp=0.445 p=1.225	manual	memory	0	0.000097
exp9267	1.91190259e-29	0.000000	-0.000000	discard	cycle 65 u=0.0982	agent0	initial_cond	0	0.000000
exp9268	5.56458432e-17	0.070278	-0.000000	discard	Extreme u=0.2445 amp=0.445 p=1.230	manual	memory	0	0.000097
exp9269	6.13049994e-29	0.000000	0.000000	discard	cycle 65 u=0.0985	agent0	initial_cond	0	0.000000
exp9270	6.13049994e-29	0.000000	0.000000	discard	cycle 65 u=0.0985	agent0	initial_cond	0	0.000000
exp9270	1.87285362e-17	0.070278	-0.000000	discard	Extreme u=0.2445 amp=0.445 p=1.235	manual	memory	0	0.000097
exp9271	6.13049994e-29	0.000000	0.000000	discard	cycle 65 u=0.0985	agent0	initial_cond	1	0.000000
exp9272	2.50119374e-17	0.070278	-0.000000	discard	Extreme u=0.2445 amp=0.445 p=1.240	manual	memory	1	0.000097
exp9273	5.49750971e-29	0.000000	0.000000	discard	cycle 65 u=0.0985	agent0	initial_cond	0	0.000000
exp9274	2.89676303e-17	0.070278	-0.000000	discard	Extreme u=0.2450 amp=0.435 p=1.220	manual	memory	0	0.000097
exp9275	5.49750971e-29	0.000000	0.000000	discard	cycle 65 u=0.0985	agent0	initial_cond	0	0.000000
