exp_id	residual	solution_norm	solution_mean	status	description	agent	design	elapsed_s	solution_energy
exp11634	4.39794337e-29	0.000000	0.000000	discard	cycle 85 u=0.1000	agent0	initial_cond	0	-0.000000
exp11635	1.99375429e-17	0.081814	-0.000000	discard	Optimize around K=0.05	manual	k005_optimize	1	0.000212
exp11636	4.39794337e-29	0.000000	0.000000	discard	cycle 85 u=0.1000	agent0	initial_cond	0	-0.000000
exp11637	1.36727475e-28	0.000000	0.000000	discard	cycle 85 u=0.1050	agent0	initial_cond	0	-0.000000
exp11637	1.11152579e-15	0.093272	-0.000000	discard	Optimize around K=0.05	manual	k005_optimize	0	0.000394
exp11638	1.36727475e-28	0.000000	0.000000	discard	cycle 85 u=0.1050	agent0	initial_cond	1	-0.000000
exp11639	2.84094980e-16	0.102376	-0.000000	discard	Optimize around K=0.05	manual	k005_optimize	0	0.000602
exp11640	1.36727475e-28	0.000000	0.000000	discard	cycle 85 u=0.1050	agent0	initial_cond	0	-0.000000
exp11641	6.14461376e-29	0.000000	0.000000	discard	cycle 85 u=0.1050	agent0	initial_cond	0	-0.000000
exp11642	8.49879005e-17	0.115920	-0.000000	discard	Optimize around K=0.05	manual	k005_optimize	1	0.001044
exp11643	6.14461376e-29	0.000000	0.000000	discard	cycle 85 u=0.1050	agent0	initial_cond	0	-0.000000
exp11644	2.12214037e-17	0.081814	-0.000000	discard	Optimize around K=0.05	manual	k005_optimize	0	0.000212
exp11645	6.14461376e-29	0.000000	0.000000	discard	cycle 85 u=0.1050	agent0	initial_cond	0	-0.000000
exp11646	1.75906666e-28	0.000000	0.000000	discard	cycle 85 u=0.1050	agent0	initial_cond	1	-0.000000
exp11647	4.21562135e-17	0.093272	-0.000000	discard	Optimize around K=0.05	manual	k005_optimize	1	0.000394
exp11648	1.75906666e-28	0.000000	0.000000	discard	cycle 85 u=0.1050	agent0	initial_cond	0	-0.000000
exp11649	1.35951281e-17	0.102376	0.000000	discard	Optimize around K=0.05	manual	k005_optimize	0	0.000602
exp11649	1.75906666e-28	0.000000	0.000000	discard	cycle 85 u=0.1050	agent0	initial_cond	0	-0.000000
exp11650	1.11257917e-28	0.000000	0.000000	discard	cycle 85 u=0.1050	agent0	initial_cond	0	-0.000000
exp11651	5.19691675e-17	0.115920	-0.000000	discard	Optimize around K=0.05	manual	k005_optimize	0	0.001044
exp11652	1.11257917e-28	0.000000	0.000000	discard	cycle 85 u=0.1050	agent0	initial_cond	0	-0.000000
exp11653	3.79064414e-17	0.081814	-0.000000	discard	Optimize around K=0.05	manual	k005_optimize	1	0.000212
exp11653	1.11257917e-28	0.000000	0.000000	discard	cycle 85 u=0.1050	agent0	initial_cond	1	-0.000000
exp11654	8.58580947e-29	0.000000	0.000000	discard	cycle 86 u=0.0975	agent0	initial_cond	0	0.000000
exp11655	3.61254610e-17	0.093272	-0.000000	discard	Optimize around K=0.05	manual	k005_optimize	0	0.000394
exp11656	8.58580947e-29	0.000000	0.000000	discard	cycle 86 u=0.0975	agent0	initial_cond	0	0.000000
exp11657	8.58580947e-29	0.000000	0.000000	discard	cycle 86 u=0.0975	agent0	initial_cond	0	0.000000
exp11657	3.03977357e-17	0.102376	-0.000000	discard	Optimize around K=0.05	manual	k005_optimize	0	0.000602
exp11658	5.23962023e-29	0.000000	0.000000	discard	cycle 86 u=0.0975	agent0	initial_cond	0	0.000000
exp11659	7.11256678e-17	0.115920	-0.000000	discard	Optimize around K=0.05	manual	k005_optimize	0	0.001044
exp11660	5.23962023e-29	0.000000	0.000000	discard	cycle 86 u=0.0975	agent0	initial_cond	1	0.000000
exp11661	5.23962023e-29	0.000000	0.000000	discard	cycle 86 u=0.0975	agent0	initial_cond	0	0.000000
exp11661	9.26109708e-17	0.081814	-0.000000	discard	Optimize around K=0.05	manual	k005_optimize	0	0.000212
exp11662	4.03266298e-29	0.000000	0.000000	discard	cycle 86 u=0.0975	agent0	initial_cond	0	0.000000
exp11663	3.22017674e-17	0.093272	0.000000	discard	Optimize around K=0.05	manual	k005_optimize	1	0.000394
exp11664	4.03266298e-29	0.000000	0.000000	discard	cycle 86 u=0.0975	agent0	initial_cond	0	0.000000
exp11665	4.03266298e-29	0.000000	0.000000	discard	cycle 86 u=0.0975	agent0	initial_cond	0	0.000000
exp11666	5.24367656e-17	0.102376	-0.000000	discard	Optimize around K=0.05	manual	k005_optimize	0	0.000602
exp11667	4.80015937e-29	0.000000	0.000000	discard	cycle 86 u=0.0975	agent0	initial_cond	1	0.000000
exp11668	1.02951648e-16	0.115920	-0.000000	discard	Optimize around K=0.05	manual	k005_optimize	0	0.001044
exp11669	4.80015937e-29	0.000000	0.000000	discard	cycle 86 u=0.0975	agent0	initial_cond	0	0.000000
exp11670	4.80015937e-29	0.000000	0.000000	discard	cycle 86 u=0.0975	agent0	initial_cond	0	0.000000
exp11671	1.99375429e-17	0.081814	-0.000000	discard	Optimize around K=0.05	manual	k005_optimize	1	0.000212
exp11672	2.68824537e-29	0.000000	0.000000	discard	cycle 86 u=0.0980	agent0	initial_cond	0	-0.000000
exp11673	1.11152579e-15	0.093272	-0.000000	discard	Optimize around K=0.05	manual	k005_optimize	0	0.000394
exp11673	2.68824537e-29	0.000000	0.000000	discard	cycle 86 u=0.0980	agent0	initial_cond	0	-0.000000
exp11674	2.68824537e-29	0.000000	0.000000	discard	cycle 86 u=0.0980	agent0	initial_cond	1	-0.000000
exp11675	2.84094980e-16	0.102376	-0.000000	discard	Optimize around K=0.05	manual	k005_optimize	0	0.000602
exp11676	6.16758073e-29	0.000000	0.000000	discard	cycle 86 u=0.0980	agent0	initial_cond	0	-0.000000
exp11677	6.16758073e-29	0.000000	0.000000	discard	cycle 86 u=0.0980	agent0	initial_cond	0	-0.000000
exp11677	8.49879005e-17	0.115920	-0.000000	discard	Optimize around K=0.05	manual	k005_optimize	0	0.001044
exp11678	6.16758073e-29	0.000000	0.000000	discard	cycle 86 u=0.0980	agent0	initial_cond	0	-0.000000
exp11679	2.12214037e-17	0.081814	-0.000000	discard	Optimize around K=0.05	manual	k005_optimize	0	0.000212
exp11680	2.01926478e-29	0.000000	0.000000	discard	cycle 86 u=0.0980	agent0	initial_cond	0	0.000000
exp11681	2.01926478e-29	0.000000	0.000000	discard	cycle 86 u=0.0980	agent0	initial_cond	1	0.000000
exp11681	4.21562135e-17	0.093272	-0.000000	discard	Optimize around K=0.05	manual	k005_optimize	1	0.000394
exp11682	2.01926478e-29	0.000000	0.000000	discard	cycle 86 u=0.0980	agent0	initial_cond	0	0.000000
exp11683	1.35951281e-17	0.102376	0.000000	discard	Optimize around K=0.05	manual	k005_optimize	0	0.000602
exp11684	1.30310780e-28	0.000000	0.000000	discard	cycle 86 u=0.0980	agent0	initial_cond	0	-0.000000
exp11685	1.30310780e-28	0.000000	0.000000	discard	cycle 86 u=0.0980	agent0	initial_cond	0	-0.000000
exp11685	5.19691675e-17	0.115920	-0.000000	discard	Optimize around K=0.05	manual	k005_optimize	0	0.001044
exp11686	1.30310780e-28	0.000000	0.000000	discard	cycle 86 u=0.0980	agent0	initial_cond	0	-0.000000
exp11687	3.79064414e-17	0.081814	-0.000000	discard	Optimize around K=0.05	manual	k005_optimize	1	0.000212
exp11688	5.45343271e-29	0.000000	0.000000	discard	cycle 86 u=0.0982	agent0	initial_cond	1	-0.000000
exp11689	5.45343271e-29	0.000000	0.000000	discard	cycle 86 u=0.0982	agent0	initial_cond	0	-0.000000
exp11690	3.61254610e-17	0.093272	-0.000000	discard	Optimize around K=0.05	manual	k005_optimize	0	0.000394
exp11691	5.45343271e-29	0.000000	0.000000	discard	cycle 86 u=0.0982	agent0	initial_cond	0	-0.000000
exp11692	3.03977357e-17	0.102376	-0.000000	discard	Optimize around K=0.05	manual	k005_optimize	1	0.000602
exp11692	1.23429977e-28	0.000000	0.000000	discard	cycle 86 u=0.0982	agent0	initial_cond	0	0.000000
exp11693	1.23429977e-28	0.000000	0.000000	discard	cycle 86 u=0.0982	agent0	initial_cond	0	0.000000
exp11694	7.11256678e-17	0.115920	-0.000000	discard	Optimize around K=0.05	manual	k005_optimize	0	0.001044
exp11695	1.23429977e-28	0.000000	0.000000	discard	cycle 86 u=0.0982	agent0	initial_cond	1	0.000000
exp11696	9.26109708e-17	0.081814	-0.000000	discard	Optimize around K=0.05	manual	k005_optimize	0	0.000212
exp11696	1.88036672e-29	0.000000	0.000000	discard	cycle 86 u=0.0982	agent0	initial_cond	0	0.000000
exp11697	1.88036672e-29	0.000000	0.000000	discard	cycle 86 u=0.0982	agent0	initial_cond	0	0.000000
exp11698	3.22017674e-17	0.093272	0.000000	discard	Optimize around K=0.05	manual	k005_optimize	1	0.000394
exp11699	1.88036672e-29	0.000000	0.000000	discard	cycle 86 u=0.0982	agent0	initial_cond	0	0.000000
exp11700	1.91190259e-29	0.000000	-0.000000	discard	cycle 86 u=0.0982	agent0	initial_cond	0	0.000000
exp11700	5.24367656e-17	0.102376	-0.000000	discard	Optimize around K=0.05	manual	k005_optimize	0	0.000602
exp11701	1.91190259e-29	0.000000	-0.000000	discard	cycle 86 u=0.0982	agent0	initial_cond	1	0.000000
exp11702	1.02951648e-16	0.115920	-0.000000	discard	Optimize around K=0.05	manual	k005_optimize	0	0.001044
exp11703	1.91190259e-29	0.000000	-0.000000	discard	cycle 86 u=0.0982	agent0	initial_cond	0	0.000000
exp11704	6.13049994e-29	0.000000	0.000000	discard	cycle 86 u=0.0985	agent0	initial_cond	0	0.000000
exp11704	1.99375429e-17	0.081814	-0.000000	discard	Optimize around K=0.05	manual	k005_optimize	0	0.000212
exp11705	6.13049994e-29	0.000000	0.000000	discard	cycle 86 u=0.0985	agent0	initial_cond	0	0.000000
exp11706	1.11152579e-15	0.093272	-0.000000	discard	Optimize around K=0.05	manual	k005_optimize	0	0.000394
exp11707	6.13049994e-29	0.000000	0.000000	discard	cycle 86 u=0.0985	agent0	initial_cond	0	0.000000
exp11708	5.49750971e-29	0.000000	0.000000	discard	cycle 86 u=0.0985	agent0	initial_cond	1	0.000000
exp11708	2.84094980e-16	0.102376	-0.000000	discard	Optimize around K=0.05	manual	k005_optimize	1	0.000602
exp11709	5.49750971e-29	0.000000	0.000000	discard	cycle 86 u=0.0985	agent0	initial_cond	0	0.000000
exp11710	8.49879005e-17	0.115920	-0.000000	discard	Optimize around K=0.05	manual	k005_optimize	0	0.001044
exp11711	5.49750971e-29	0.000000	0.000000	discard	cycle 86 u=0.0985	agent0	initial_cond	0	0.000000
exp11712	4.15642452e-29	0.000000	0.000000	discard	cycle 86 u=0.0985	agent0	initial_cond	0	0.000000
exp11713	2.12214037e-17	0.081814	-0.000000	discard	Optimize around K=0.05	manual	k005_optimize	0	0.000212
exp11714	4.15642452e-29	0.000000	0.000000	discard	cycle 86 u=0.0985	agent0	initial_cond	0	0.000000
exp11715	4.21562135e-17	0.093272	-0.000000	discard	Optimize around K=0.05	manual	k005_optimize	1	0.000394
exp11715	4.15642452e-29	0.000000	0.000000	discard	cycle 86 u=0.0985	agent0	initial_cond	1	0.000000
exp11716	2.19292611e-29	0.000000	0.000000	discard	cycle 86 u=0.0985	agent0	initial_cond	0	-0.000000
exp11717	1.35951281e-17	0.102376	0.000000	discard	Optimize around K=0.05	manual	k005_optimize	0	0.000602
exp11718	2.19292611e-29	0.000000	0.000000	discard	cycle 86 u=0.0985	agent0	initial_cond	0	-0.000000
exp11719	5.19691675e-17	0.115920	-0.000000	discard	Optimize around K=0.05	manual	k005_optimize	0	0.001044
exp11719	2.19292611e-29	0.000000	0.000000	discard	cycle 86 u=0.0985	agent0	initial_cond	0	-0.000000
exp11720	4.22491788e-29	0.000000	0.000000	discard	cycle 86 u=0.0990	agent0	initial_cond	0	-0.000000
exp11721	3.79064414e-17	0.081814	-0.000000	discard	Optimize around K=0.05	manual	k005_optimize	0	0.000212
exp11722	4.22491788e-29	0.000000	0.000000	discard	cycle 86 u=0.0990	agent0	initial_cond	1	-0.000000
exp11723	4.22491788e-29	0.000000	0.000000	discard	cycle 86 u=0.0990	agent0	initial_cond	0	-0.000000
exp11723	3.61254610e-17	0.093272	-0.000000	discard	Optimize around K=0.05	manual	k005_optimize	0	0.000394
exp11724	3.22245147e-29	0.000000	0.000000	discard	cycle 86 u=0.0990	agent0	initial_cond	0	0.000000
exp11725	3.03977357e-17	0.102376	-0.000000	discard	Optimize around K=0.05	manual	k005_optimize	1	0.000602
exp11726	3.22245147e-29	0.000000	0.000000	discard	cycle 86 u=0.0990	agent0	initial_cond	0	0.000000
exp11727	3.22245147e-29	0.000000	0.000000	discard	cycle 86 u=0.0990	agent0	initial_cond	0	0.000000
exp11727	7.11256678e-17	0.115920	-0.000000	discard	Optimize around K=0.05	manual	k005_optimize	0	0.001044
exp11728	4.50941488e-29	0.000000	-0.000000	discard	cycle 86 u=0.0990	agent0	initial_cond	1	0.000000
exp11729	9.26109708e-17	0.081814	-0.000000	discard	Optimize around K=0.05	manual	k005_optimize	0	0.000212
exp11730	4.50941488e-29	0.000000	-0.000000	discard	cycle 86 u=0.0990	agent0	initial_cond	0	0.000000
exp11731	4.50941488e-29	0.000000	-0.000000	discard	cycle 86 u=0.0990	agent0	initial_cond	0	0.000000
exp11731	3.22017674e-17	0.093272	0.000000	discard	Optimize around K=0.05	manual	k005_optimize	0	0.000394
exp11732	4.88330883e-29	0.000000	-0.000000	discard	cycle 86 u=0.0990	agent0	initial_cond	0	0.000000
exp11733	5.24367656e-17	0.102376	-0.000000	discard	Optimize around K=0.05	manual	k005_optimize	0	0.000602
exp11734	4.88330883e-29	0.000000	-0.000000	discard	cycle 86 u=0.0990	agent0	initial_cond	0	0.000000
exp11735	4.88330883e-29	0.000000	-0.000000	discard	cycle 86 u=0.0990	agent0	initial_cond	1	0.000000
exp11736	1.02951648e-16	0.115920	-0.000000	discard	Optimize around K=0.05	manual	k005_optimize	1	0.001044
exp11737	5.74085541e-29	0.000000	-0.000000	discard	cycle 86 u=0.0995	agent0	initial_cond	0	0.000000
exp11738	1.99375429e-17	0.081814	-0.000000	discard	Optimize around K=0.05	manual	k005_optimize	0	0.000212
exp11739	5.74085541e-29	0.000000	-0.000000	discard	cycle 86 u=0.0995	agent0	initial_cond	0	0.000000
exp11740	5.74085541e-29	0.000000	-0.000000	discard	cycle 86 u=0.0995	agent0	initial_cond	0	0.000000
exp11741	1.11152579e-15	0.093272	-0.000000	discard	Optimize around K=0.05	manual	k005_optimize	0	0.000394
exp11742	1.54984578e-28	0.000000	0.000000	discard	cycle 86 u=0.0995	agent0	initial_cond	0	-0.000000
exp11743	2.84094980e-16	0.102376	-0.000000	discard	Optimize around K=0.05	manual	k005_optimize	1	0.000602
exp11743	1.54984578e-28	0.000000	0.000000	discard	cycle 86 u=0.0995	agent0	initial_cond	1	-0.000000
exp11744	1.54984578e-28	0.000000	0.000000	discard	cycle 86 u=0.0995	agent0	initial_cond	0	-0.000000
exp11745	8.49879005e-17	0.115920	-0.000000	discard	Optimize around K=0.05	manual	k005_optimize	0	0.001044
exp11746	1.60328418e-29	0.000000	-0.000000	discard	cycle 86 u=0.0995	agent0	initial_cond	0	-0.000000
exp11747	2.12214037e-17	0.081814	-0.000000	discard	Optimize around K=0.05	manual	k005_optimize	0	0.000212
exp11747	1.60328418e-29	0.000000	-0.000000	discard	cycle 86 u=0.0995	agent0	initial_cond	0	-0.000000
exp11748	1.60328418e-29	0.000000	-0.000000	discard	cycle 86 u=0.0995	agent0	initial_cond	0	-0.000000
exp11749	4.21562135e-17	0.093272	-0.000000	discard	Optimize around K=0.05	manual	k005_optimize	0	0.000394
exp11750	7.34590618e-29	0.000000	0.000000	discard	cycle 86 u=0.0995	agent0	initial_cond	1	0.000000
exp11751	7.34590618e-29	0.000000	0.000000	discard	cycle 86 u=0.0995	agent0	initial_cond	0	0.000000
exp11751	1.35951281e-17	0.102376	0.000000	discard	Optimize around K=0.05	manual	k005_optimize	0	0.000602
exp11752	7.34590618e-29	0.000000	0.000000	discard	cycle 86 u=0.0995	agent0	initial_cond	0	0.000000
exp11753	5.19691675e-17	0.115920	-0.000000	discard	Optimize around K=0.05	manual	k005_optimize	1	0.001044
exp11754	4.46546993e-29	0.000000	0.000000	discard	cycle 86 u=0.1000	agent0	initial_cond	0	-0.000000
exp11755	4.46546993e-29	0.000000	0.000000	discard	cycle 86 u=0.1000	agent0	initial_cond	0	-0.000000
exp11756	4.46546993e-29	0.000000	0.000000	discard	cycle 86 u=0.1000	agent0	initial_cond	1	-0.000000
exp11757	4.08106752e-29	0.000000	0.000000	discard	cycle 86 u=0.1000	agent0	initial_cond	0	-0.000000
exp11758	4.08106752e-29	0.000000	0.000000	discard	cycle 86 u=0.1000	agent0	initial_cond	1	-0.000000
exp11759	4.08106752e-29	0.000000	0.000000	discard	cycle 86 u=0.1000	agent0	initial_cond	0	-0.000000
exp11760	4.58623706e-29	0.000000	0.000000	discard	cycle 86 u=0.1000	agent0	initial_cond	0	-0.000000
exp11761	4.58623706e-29	0.000000	0.000000	discard	cycle 86 u=0.1000	agent0	initial_cond	1	-0.000000
exp11762	4.58623706e-29	0.000000	0.000000	discard	cycle 86 u=0.1000	agent0	initial_cond	0	-0.000000
exp11763	4.39794337e-29	0.000000	0.000000	discard	cycle 86 u=0.1000	agent0	initial_cond	0	-0.000000
exp11764	4.39794337e-29	0.000000	0.000000	discard	cycle 86 u=0.1000	agent0	initial_cond	0	-0.000000
exp11765	4.39794337e-29	0.000000	0.000000	discard	cycle 86 u=0.1000	agent0	initial_cond	0	-0.000000
exp11766	1.36727475e-28	0.000000	0.000000	discard	cycle 86 u=0.1050	agent0	initial_cond	1	-0.000000
exp11767	1.36727475e-28	0.000000	0.000000	discard	cycle 86 u=0.1050	agent0	initial_cond	0	-0.000000
exp11768	1.36727475e-28	0.000000	0.000000	discard	cycle 86 u=0.1050	agent0	initial_cond	1	-0.000000
exp11769	6.14461376e-29	0.000000	0.000000	discard	cycle 86 u=0.1050	agent0	initial_cond	0	-0.000000
exp11770	6.14461376e-29	0.000000	0.000000	discard	cycle 86 u=0.1050	agent0	initial_cond	0	-0.000000
exp11771	6.14461376e-29	0.000000	0.000000	discard	cycle 86 u=0.1050	agent0	initial_cond	1	-0.000000
exp11772	1.75906666e-28	0.000000	0.000000	discard	cycle 86 u=0.1050	agent0	initial_cond	0	-0.000000
exp11773	1.75906666e-28	0.000000	0.000000	discard	cycle 86 u=0.1050	agent0	initial_cond	1	-0.000000
exp11774	1.75906666e-28	0.000000	0.000000	discard	cycle 86 u=0.1050	agent0	initial_cond	0	-0.000000
exp11775	1.11257917e-28	0.000000	0.000000	discard	cycle 86 u=0.1050	agent0	initial_cond	0	-0.000000
exp11776	1.11257917e-28	0.000000	0.000000	discard	cycle 86 u=0.1050	agent0	initial_cond	1	-0.000000
exp11777	1.11257917e-28	0.000000	0.000000	discard	cycle 86 u=0.1050	agent0	initial_cond	0	-0.000000
exp11778	8.58580947e-29	0.000000	0.000000	discard	cycle 87 u=0.0975	agent0	initial_cond	1	0.000000
exp11779	8.58580947e-29	0.000000	0.000000	discard	cycle 87 u=0.0975	agent0	initial_cond	0	0.000000
exp11780	8.58580947e-29	0.000000	0.000000	discard	cycle 87 u=0.0975	agent0	initial_cond	0	0.000000
exp11781	5.23962023e-29	0.000000	0.000000	discard	cycle 87 u=0.0975	agent0	initial_cond	1	0.000000
exp11782	5.23962023e-29	0.000000	0.000000	discard	cycle 87 u=0.0975	agent0	initial_cond	0	0.000000
exp11783	5.23962023e-29	0.000000	0.000000	discard	cycle 87 u=0.0975	agent0	initial_cond	1	0.000000
exp11784	4.03266298e-29	0.000000	0.000000	discard	cycle 87 u=0.0975	agent0	initial_cond	0	0.000000
exp11785	4.03266298e-29	0.000000	0.000000	discard	cycle 87 u=0.0975	agent0	initial_cond	0	0.000000
exp11786	4.03266298e-29	0.000000	0.000000	discard	cycle 87 u=0.0975	agent0	initial_cond	1	0.000000
exp11787	4.80015937e-29	0.000000	0.000000	discard	cycle 87 u=0.0975	agent0	initial_cond	0	0.000000
exp11788	4.80015937e-29	0.000000	0.000000	discard	cycle 87 u=0.0975	agent0	initial_cond	1	0.000000
exp11789	4.80015937e-29	0.000000	0.000000	discard	cycle 87 u=0.0975	agent0	initial_cond	0	0.000000
exp11790	2.68824537e-29	0.000000	0.000000	discard	cycle 87 u=0.0980	agent0	initial_cond	0	-0.000000
exp11791	2.68824537e-29	0.000000	0.000000	discard	cycle 87 u=0.0980	agent0	initial_cond	1	-0.000000
exp11792	2.68824537e-29	0.000000	0.000000	discard	cycle 87 u=0.0980	agent0	initial_cond	0	-0.000000
exp11793	6.16758073e-29	0.000000	0.000000	discard	cycle 87 u=0.0980	agent0	initial_cond	1	-0.000000
exp11794	6.16758073e-29	0.000000	0.000000	discard	cycle 87 u=0.0980	agent0	initial_cond	0	-0.000000
exp11795	6.16758073e-29	0.000000	0.000000	discard	cycle 87 u=0.0980	agent0	initial_cond	0	-0.000000
exp11796	2.01926478e-29	0.000000	0.000000	discard	cycle 87 u=0.0980	agent0	initial_cond	0	0.000000
exp11797	2.01926478e-29	0.000000	0.000000	discard	cycle 87 u=0.0980	agent0	initial_cond	0	0.000000
exp11798	2.01926478e-29	0.000000	0.000000	discard	cycle 87 u=0.0980	agent0	initial_cond	1	0.000000
exp11799	1.30310780e-28	0.000000	0.000000	discard	cycle 87 u=0.0980	agent0	initial_cond	0	-0.000000
exp11800	1.30310780e-28	0.000000	0.000000	discard	cycle 87 u=0.0980	agent0	initial_cond	0	-0.000000
exp11801	1.30310780e-28	0.000000	0.000000	discard	cycle 87 u=0.0980	agent0	initial_cond	1	-0.000000
exp11802	5.45343271e-29	0.000000	0.000000	discard	cycle 87 u=0.0982	agent0	initial_cond	0	-0.000000
exp11803	5.45343271e-29	0.000000	0.000000	discard	cycle 87 u=0.0982	agent0	initial_cond	1	-0.000000
exp11804	5.45343271e-29	0.000000	0.000000	discard	cycle 87 u=0.0982	agent0	initial_cond	0	-0.000000
exp11805	1.23429977e-28	0.000000	0.000000	discard	cycle 87 u=0.0982	agent0	initial_cond	0	0.000000
exp11806	1.23429977e-28	0.000000	0.000000	discard	cycle 87 u=0.0982	agent0	initial_cond	0	0.000000
exp11807	1.23429977e-28	0.000000	0.000000	discard	cycle 87 u=0.0982	agent0	initial_cond	0	0.000000
exp11808	1.88036672e-29	0.000000	0.000000	discard	cycle 87 u=0.0982	agent0	initial_cond	1	0.000000
exp11809	1.88036672e-29	0.000000	0.000000	discard	cycle 87 u=0.0982	agent0	initial_cond	0	0.000000
exp11810	1.88036672e-29	0.000000	0.000000	discard	cycle 87 u=0.0982	agent0	initial_cond	0	0.000000
exp11811	1.91190259e-29	0.000000	-0.000000	discard	cycle 87 u=0.0982	agent0	initial_cond	0	0.000000
exp11812	1.91190259e-29	0.000000	-0.000000	discard	cycle 87 u=0.0982	agent0	initial_cond	0	0.000000
exp11813	1.91190259e-29	0.000000	-0.000000	discard	cycle 87 u=0.0982	agent0	initial_cond	1	0.000000
exp11814	6.13049994e-29	0.000000	0.000000	discard	cycle 87 u=0.0985	agent0	initial_cond	0	0.000000
exp11815	6.13049994e-29	0.000000	0.000000	discard	cycle 87 u=0.0985	agent0	initial_cond	0	0.000000
exp11816	6.13049994e-29	0.000000	0.000000	discard	cycle 87 u=0.0985	agent0	initial_cond	0	0.000000
exp11817	5.49750971e-29	0.000000	0.000000	discard	cycle 87 u=0.0985	agent0	initial_cond	0	0.000000
exp11818	5.49750971e-29	0.000000	0.000000	discard	cycle 87 u=0.0985	agent0	initial_cond	1	0.000000
exp11819	5.49750971e-29	0.000000	0.000000	discard	cycle 87 u=0.0985	agent0	initial_cond	0	0.000000
exp11820	4.15642452e-29	0.000000	0.000000	discard	cycle 87 u=0.0985	agent0	initial_cond	0	0.000000
exp11821	4.15642452e-29	0.000000	0.000000	discard	cycle 87 u=0.0985	agent0	initial_cond	0	0.000000
exp11822	4.15642452e-29	0.000000	0.000000	discard	cycle 87 u=0.0985	agent0	initial_cond	0	0.000000
exp11823	2.19292611e-29	0.000000	0.000000	discard	cycle 87 u=0.0985	agent0	initial_cond	1	-0.000000
exp11824	2.19292611e-29	0.000000	0.000000	discard	cycle 87 u=0.0985	agent0	initial_cond	0	-0.000000
exp11825	2.19292611e-29	0.000000	0.000000	discard	cycle 87 u=0.0985	agent0	initial_cond	0	-0.000000
exp11826	4.22491788e-29	0.000000	0.000000	discard	cycle 87 u=0.0990	agent0	initial_cond	0	-0.000000
exp11827	4.22491788e-29	0.000000	0.000000	discard	cycle 87 u=0.0990	agent0	initial_cond	0	-0.000000
