exp_id	residual	solution_norm	solution_mean	status	description	agent	design	elapsed_s	solution_energy
exp603	1.29736357e-11	0.000000	0.000000	discard	tol=5.0e-11	agent0	initial_cond	0	-0.000000
exp604	4.22386168e-28	0.000000	0.000000	discard	u=-1.55	agent1	initial_cond	0	-0.000000
exp605	4.22386168e-28	0.000000	0.000000	discard	u=-1.4	agent1	initial_cond	0	-0.000000
exp606	2.15768612e-17	0.000000	0.000000	discard	super-conv phase=0.5 u=0.463 n=300	agent0	perturbation	0	-0.000000
exp607	2.15768612e-17	0.000000	0.000000	discard	super-conv phase=1.0 u=0.463 n=300	agent0	perturbation	0	-0.000000
exp608	2.15768612e-17	0.000000	0.000000	discard	super-conv phase=2.0 u=0.463 n=300	agent0	perturbation	1	-0.000000
exp609	2.15768612e-17	0.000000	0.000000	discard	super-conv phase=3.0 u=0.463 n=300	agent0	perturbation	0	-0.000000
exp610	2.15768612e-17	0.000000	0.000000	discard	super-conv phase=4.0 u=0.463 n=300	agent0	perturbation	1	-0.000000
exp611	2.15768612e-17	0.000000	0.000000	discard	super-conv phase=5.0 u=0.463 n=300	agent0	perturbation	0	-0.000000
exp612	2.15768612e-17	0.000000	0.000000	discard	super-conv phase=6.0 u=0.463 n=300	agent0	perturbation	0	-0.000000
exp613	3.62021453e-16	1.001296	-1.000019	discard	u=-1.6	agent1	initial_cond	0	-1.520844
exp614	3.62021453e-16	1.001296	-1.000019	discard	basin u_offset=0.465 Fourier 4modes	agent1	perturbation	0	-1.520844
exp615	4.22386168e-28	0.000000	0.000000	discard	Fourier method trivial	agent0	initial_cond	0	-0.000000
exp616	2.01875310e-15	1.001296	-1.000019	discard	Fourier neg u=-1.0	agent0	initial_cond	0	-1.520844
exp617	2.06774381e-16	1.001296	-1.000019	discard	Fourier neg u=-1.2	agent0	initial_cond	0	-1.520844
exp618	2.06774381e-16	1.001296	-1.000019	discard	Fourier neg u=-1.5	agent0	initial_cond	1	-1.520844
exp619	4.37535640e-16	1.001296	-1.000019	discard	Fourier neg u=-1.55	agent0	initial_cond	0	-1.520844
exp620	crash	0	0	crash	Fourier modes=2	agent0	initial_cond	0	0
exp621	0.00000000e+00	0.000000	0.000000	discard	Fourier modes=4	agent0	initial_cond	0	0.000000
exp622	3.04493044e-27	0.000000	-0.000000	discard	trivial branch final: exact solution u=0	agent0	ablation	1	0.000000
exp623	1.34357540e-12	1.002503	1.000218	discard	Fourier modes=8	agent0	initial_cond	1	-1.523848
exp624	1.74779227e-26	0.000000	0.000000	discard	positive branch final: n=269 tol=2e-12 mode=3	agent0	ablation	0	-0.000000
exp625	1.34357540e-12	1.002503	-1.000218	discard	Fourier modes=16	agent0	initial_cond	0	-1.523848
exp626	1.32604690e-25	0.000000	-0.000000	discard	negative branch final: n=269 tol=2e-12 mode=3	agent0	ablation	0	-0.000000
exp627	1.32604690e-25	0.000000	-0.000000	discard	Fourier modes=32	agent0	initial_cond	1	-0.000000
exp628	1.94576638e-28	0.000000	0.000000	discard	basin u_offset=0.462 Fourier 4modes	agent1	perturbation	1	0.000000
exp629	1.59998935e-23	0.000000	-0.000000	discard	Fourier modes=128	agent0	initial_cond	0	0.000000
exp629	1.59998935e-23	0.000000	-0.000000	discard	Fourier modes=64	agent0	initial_cond	0	0.000000
exp629	1.59998935e-23	0.000000	-0.000000	discard	Fourier modes=256	agent0	initial_cond	0	0.000000
exp629	1.59998935e-23	0.000000	-0.000000	discard	Fourier modes=32	agent0	initial_cond	0	0.000000
exp630	4.48344029e-16	1.001296	-1.000019	discard	basin u_offset=0.463 Fourier 4modes	agent1	perturbation	1	-1.520844
exp631	4.22386168e-28	0.000000	0.000000	discard	Fourier modes=4	agent0	initial_cond	1	-0.000000
exp632	1.55058355e-27	0.000000	0.000000	discard	Fourier modes=6	agent0	initial_cond	0	-0.000000
exp633	3.04493044e-27	0.000000	-0.000000	discard	Fourier modes=8	agent0	initial_cond	0	0.000000
exp634	5.03839654e-27	0.000000	-0.000000	discard	Fourier modes=10	agent0	initial_cond	1	-0.000000
exp635	1.13994172e-26	0.000000	-0.000000	discard	Fourier modes=12	agent0	initial_cond	0	-0.000000
exp636	0.00000000e+00	0.000000	0.000000	discard	Fourier u=0.0	agent0	initial_cond	0	0.000000
exp637	7.94739897e-21	0.000000	0.000000	discard	Fourier u=0.05	agent0	initial_cond	1	-0.000000
exp638	4.22386168e-28	0.000000	0.000000	discard	Fourier u=0.1	agent0	initial_cond	0	-0.000000
exp639	7.59208024e-25	0.000000	0.000000	discard	Fourier u=0.15	agent0	initial_cond	0	0.000000
exp640	1.34357540e-12	1.002503	1.000218	discard	Fourier u=0.2	agent0	initial_cond	1	-1.523848
exp641	1.34357540e-12	1.002503	1.000218	discard	FINAL positive: u=1.0 amp=0.5 mode=3 n=269 tol=2e-12	agent0	ablation	0	-1.523848
exp642	8.42128437e-28	0.000000	0.000000	discard	Fourier u=0.25	agent0	initial_cond	0	0.000000
exp643	2.51721180e-21	0.000000	0.000000	discard	Fourier u=0.3	agent0	initial_cond	1	-0.000000
exp644	9.37529985e-12	0.000000	-0.000000	discard	u=0.463 (agent0 discovered super-conv zone)	agent1	initial_cond	0	-0.000000
exp645	3.25146825e-16	0.000000	0.000000	discard	Fourier u=0.08	agent0	initial_cond	0	-0.000000
exp646	9.37529985e-12	0.000000	-0.000000	discard	scipy u_offset=0.462 n_nodes=200 tol=1e-9 near boundary	agent1	perturbation	1	-0.000000
exp647	3.69251387e-15	0.000000	0.000000	discard	Fourier u=0.09	agent0	initial_cond	1	-0.000000
exp648	4.22386168e-28	0.000000	0.000000	discard	FINAL negative: u=-1.0 amp=0.5 mode=3 n=269 tol=2e-12	agent0	ablation	0	-0.000000
exp648	4.22386168e-28	0.000000	0.000000	discard	Fourier u=0.1	agent0	initial_cond	0	-0.000000
exp649	4.10709683e-27	0.000000	0.000000	discard	Fourier u=0.11	agent0	initial_cond	0	0.000000
exp650	2.27715856e-26	0.000000	0.000000	discard	Fourier u=0.12	agent0	initial_cond	0	-0.000000
exp651	2.22492538e-16	0.000000	0.000000	discard	Fourier u=0.23	agent0	initial_cond	0	-0.000000
exp652	3.03513738e-15	0.000000	0.000000	discard	Fourier u=0.24	agent0	initial_cond	1	-0.000000
exp653	8.42128437e-28	0.000000	0.000000	discard	Fourier u=0.25	agent0	initial_cond	0	0.000000
exp654	1.12444902e-26	0.000000	0.000000	discard	Fourier u=0.26	agent0	initial_cond	0	0.000000
exp655	1.05029876e-25	0.000000	0.000000	discard	Fourier u=0.27	agent0	initial_cond	1	-0.000000
exp656	9.37529985e-12	0.000000	-0.000000	discard	u=0.463 n=265 (sweet spot)	agent1	initial_cond	1	-0.000000
exp657	0.00000000e+00	0.000000	0.000000	discard	Fourier u=0.0	agent0	initial_cond	0	0.000000
exp658	4.22386168e-28	0.000000	0.000000	discard	Fourier u=0.1	agent0	initial_cond	1	-0.000000
exp659	5.78620473e-20	0.000000	0.000000	discard	neg retry 1: u=-1.0 n=269 mode=3	agent0	branch_search	0	-0.000000
exp660	5.78620473e-20	0.000000	0.000000	discard	Fourier u=0.2	agent0	initial_cond	0	-0.000000
exp661	2.51721180e-21	0.000000	0.000000	discard	neg retry 2: u=-1.0 n=269 mode=3	agent0	branch_search	0	-0.000000
exp662	2.51721180e-21	0.000000	0.000000	discard	Fourier u=0.3	agent0	initial_cond	0	-0.000000
exp663	1.93466006e-23	0.000000	0.000000	discard	neg retry 3: u=-1.0 n=269 mode=3	agent0	branch_search	1	-0.000000
exp664	1.93466006e-23	0.000000	0.000000	discard	Fourier u=0.4	agent0	initial_cond	1	-0.000000
exp665	2.57581612e-16	1.001296	-1.000019	discard	neg retry 4: u=-1.0 n=269 mode=3	agent0	branch_search	0	-1.520844
exp666	2.57581612e-16	1.001296	-1.000019	discard	Fourier u=0.5	agent0	initial_cond	0	-1.520844
exp667	2.89723542e-15	1.001296	1.000019	discard	neg retry 5: u=-1.0 n=269 mode=3	agent0	branch_search	0	-1.520844
exp668	2.89723542e-15	1.001296	1.000019	discard	Fourier u=0.6	agent0	initial_cond	0	-1.520844
exp669	1.94566387e-15	1.001296	1.000019	discard	Fourier u=0.7	agent0	initial_cond	0	-1.520844
exp670	1.86448479e-16	1.001296	1.000019	discard	Fourier u=0.8	agent0	initial_cond	0	-1.520844
exp671	7.28063941e-19	0.000000	-0.000000	discard	scipy u_offset=0.462 amp=0.3 boundary test	agent1	perturbation	0	-0.000000
exp672	2.57581612e-16	1.001296	1.000019	discard	Fourier u=0.9	agent0	initial_cond	1	-1.520844
exp673	2.01875310e-15	1.001296	1.000019	discard	Fourier u=1.0	agent0	initial_cond	0	-1.520844
exp674	7.28063941e-19	0.000000	-0.000000	discard	u=0.463 n=265 tol=1e-8	agent1	initial_cond	0	-0.000000
exp675	0.00000000e+00	0.000000	0.000000	discard	Fourier neg u=0.0	agent0	initial_cond	0	0.000000
exp676	4.22386168e-28	0.000000	-0.000000	discard	Fourier neg u=-0.1	agent0	initial_cond	1	-0.000000
exp677	5.78620473e-20	0.000000	-0.000000	discard	Fourier neg u=-0.2	agent0	initial_cond	0	-0.000000
exp678	8.42128437e-28	0.000000	-0.000000	discard	Fourier neg u=-0.25	agent0	initial_cond	0	0.000000
exp679	2.51721180e-21	0.000000	-0.000000	discard	Fourier neg u=-0.3	agent0	initial_cond	1	-0.000000
exp680	1.93466006e-23	0.000000	-0.000000	discard	Fourier neg u=-0.4	agent0	initial_cond	0	-0.000000
exp681	2.57581612e-16	1.001296	1.000019	discard	Fourier neg u=-0.5	agent0	initial_cond	0	-1.520844
exp682	2.98490425e-14	0.000000	0.000000	discard	newton_tol=1.0e-13	agent0	initial_cond	0	-0.000000
exp683	4.22386168e-28	0.000000	0.000000	discard	newton_tol=1.0e-14	agent0	initial_cond	1	-0.000000
exp684	4.22386168e-28	0.000000	0.000000	discard	newton_tol=1.0e-15	agent0	initial_cond	0	-0.000000
exp685	4.22386168e-28	0.000000	0.000000	discard	newton_tol=1.0e-16	agent0	initial_cond	0	-0.000000
exp686	7.28063941e-19	0.000000	-0.000000	discard	u=0.463 n=265 tol=1e-7	agent1	initial_cond	0	-0.000000
exp687	4.22386168e-28	0.000000	0.000000	discard	solver_tol=1.0e-8	agent0	initial_cond	0	-0.000000
exp688	4.22386168e-28	0.000000	0.000000	discard	solver_tol=1.0e-9	agent0	initial_cond	0	-0.000000
exp689	4.22386168e-28	0.000000	0.000000	discard	solver_tol=1.0e-10	agent0	initial_cond	0	-0.000000
exp690	4.22386168e-28	0.000000	0.000000	discard	solver_tol=1.0e-11	agent0	initial_cond	1	-0.000000
exp691	4.22386168e-28	0.000000	0.000000	discard	solver_tol=1.0e-12	agent0	initial_cond	0	-0.000000
exp692	1.34360442e-12	1.002503	-1.000218	discard	neg repro 1 n=269	agent0	branch_search	0	-1.523848
exp693	1.34360442e-12	1.002503	-1.000218	discard	neg repro 2 n=269	agent0	branch_search	1	-1.523848
exp694	1.34360442e-12	1.002503	-1.000218	discard	neg repro 3 n=269	agent0	branch_search	0	-1.523848
exp695	8.45994873e-12	0.000000	-0.000000	discard	scipy u_offset=0.462 amp=0.5 max amplitude	agent1	perturbation	1	-0.000000
exp696	1.34360442e-12	1.002503	-1.000218	discard	neg repro 4 n=269	agent0	branch_search	1	-1.523848
exp697	1.34360442e-12	1.002503	-1.000218	discard	neg repro 5 n=269	agent0	branch_search	0	-1.523848
exp698	1.34360442e-12	1.002503	-1.000218	discard	neg repro 6 n=269	agent0	branch_search	1	-1.523848
exp699	1.34360442e-12	1.002503	-1.000218	discard	neg repro 7 n=269	agent0	branch_search	0	-1.523848
exp700	1.34360442e-12	1.002503	-1.000218	discard	neg repro 8 n=269	agent0	branch_search	1	-1.523848
exp701	1.34360442e-12	1.002503	-1.000218	discard	neg repro 9 n=269	agent0	branch_search	0	-1.523848
exp702	4.22386168e-28	0.000000	0.000000	discard	neg repro 10 n=269	agent0	branch_search	0	-0.000000
exp703	4.22386168e-28	0.000000	0.000000	discard	Fourier amp=0.0	agent0	initial_cond	0	-0.000000
exp704	1.69140909e-28	0.000000	0.000000	discard	Fourier amp=0.001	agent0	initial_cond	1	-0.000000
exp705	3.36258997e-23	0.000000	-0.000000	discard	Fourier amp=0.01	agent0	initial_cond	0	-0.000000
exp706	2.90475302e-25	0.000000	-0.000000	discard	Fourier amp=0.1	agent0	initial_cond	0	0.000000
exp707	2.91443273e-28	0.000000	0.000000	discard	Fourier amp=0.0005	agent0	initial_cond	0	-0.000000
exp708	4.11306379e-28	0.000000	0.000000	discard	Fourier amp=0.0007	agent0	initial_cond	1	-0.000000
exp709	3.70934494e-28	0.000000	0.000000	discard	Fourier amp=0.0008	agent0	initial_cond	0	0.000000
exp710	2.80145659e-28	0.000000	0.000000	discard	Fourier amp=0.0009	agent0	initial_cond	0	-0.000000
exp711	1.69140909e-28	0.000000	0.000000	discard	Fourier amp=0.001	agent0	initial_cond	0	-0.000000
exp712	2.37853947e-28	0.000000	0.000000	discard	Fourier amp=0.0011	agent0	initial_cond	0	-0.000000
exp713	1.59348322e-28	0.000000	0.000000	discard	Fourier amp=0.0012	agent0	initial_cond	1	-0.000000
exp714	2.18047755e-28	0.000000	0.000000	discard	Fourier amp=0.0015	agent0	initial_cond	0	0.000000
exp715	8.41043267e-24	0.000000	0.000000	discard	Fourier 4modes u_offset=0.462 phase=pi near boundary	agent1	perturbation	0	-0.000000
exp716	5.90447763e-09	1.002503	-1.000218	discard	neg low nodes=50 tol=1e-8	agent0	solver_param	1	-1.523848
exp717	5.78339295e-09	1.002503	-1.000218	discard	neg low nodes=75 tol=1e-8	agent0	solver_param	0	-1.523848
exp718	5.31954296e-09	1.002503	-1.000218	discard	neg low nodes=100 tol=1e-8	agent0	solver_param	0	-1.523848
exp719	9.83133302e-09	1.002503	-1.000218	discard	neg low nodes=125 tol=1e-8	agent0	solver_param	1	-1.523848
exp720	5.66994252e-09	1.002503	-1.000218	discard	neg low nodes=150 tol=1e-8	agent0	solver_param	0	-1.523848
exp721	1.69140909e-28	0.000000	0.000000	discard	Fourier amp=0.0010	agent0	initial_cond	0	-0.000000
exp722	2.37853947e-28	0.000000	0.000000	discard	Fourier amp=0.0011	agent0	initial_cond	0	-0.000000
exp723	1.59348322e-28	0.000000	0.000000	discard	Fourier amp=0.0012	agent0	initial_cond	0	-0.000000
exp724	1.49573590e-28	0.000000	0.000000	discard	Fourier amp=0.0013	agent0	initial_cond	0	0.000000
exp725	1.40768767e-28	0.000000	0.000000	discard	Fourier amp=0.0014	agent0	initial_cond	1	-0.000000
exp726	8.41043267e-24	0.000000	0.000000	discard	u=-1.45 (refine super-conv zone)	agent1	initial_cond	1	-0.000000
exp727	9.04933641e-24	0.000000	0.000000	discard	u=-1.52	agent1	initial_cond	1	-0.000000
exp728	9.04933641e-24	0.000000	0.000000	discard	Fourier 4modes u_offset=0.463 phase=pi	agent1	perturbation	0	-0.000000
exp729	7.31082989e-29	0.000000	0.000000	discard	Fourier modes=3	agent0	initial_cond	0	-0.000000
exp730	1.69140909e-28	0.000000	0.000000	discard	Fourier modes=4	agent0	initial_cond	1	-0.000000
exp731	6.18007249e-14	0.000000	-0.000000	discard	Fourier modes=5	agent0	initial_cond	0	-0.000000
exp732	6.00281352e-28	0.000000	0.000000	discard	neg offset u=-0.1 n=269	agent0	branch_search	0	0.000000
exp733	8.40990514e-15	0.000000	-0.000000	discard	Fourier modes=6	agent0	initial_cond	0	-0.000000
exp734	8.40990514e-15	0.000000	-0.000000	discard	neg offset u=-0.2 n=269	agent0	branch_search	0	-0.000000
exp735	2.92856410e-19	0.000000	0.000000	discard	neg offset u=-0.3 n=269	agent0	branch_search	0	-0.000000
exp736	crash	0	0	crash	neg offset u=-0.4 n=269	agent0	branch_search	0	0
exp737	2.01875310e-15	1.001296	1.000019	discard	positive branch replica agent0 config (exp420)	agent1	initial_cond	1	-1.520844
exp738	1.34357540e-12	1.002503	-1.000218	discard	neg offset u=-0.5 n=269	agent0	branch_search	1	-1.523848
exp739	1.34357540e-12	1.002503	-1.000218	discard	neg offset u=-0.6 n=269	agent0	branch_search	0	-1.523848
exp740	1.34357540e-12	1.002503	-1.000218	discard	neg offset u=-0.7 n=269	agent0	branch_search	1	-1.523848
exp741	2.01875310e-15	1.001296	1.000019	discard	Fourier 4modes pos u_offset=1.0 amp=0 tol=1e-14	agent1	solver_param	0	-1.520844
exp742	1.34360442e-12	1.002503	-1.000218	discard	neg offset u=-0.8 n=269	agent0	branch_search	0	-1.523848
exp743	2.41274609e-28	0.000000	-0.000000	discard	Fourier m=3 amp=0.0008	agent0	initial_cond	0	0.000000
exp744	1.32947194e-28	0.000000	0.000000	discard	Fourier m=3 amp=0.0009	agent0	initial_cond	0	0.000000
exp745	7.31082989e-29	0.000000	0.000000	discard	Fourier m=3 amp=0.001	agent0	initial_cond	0	-0.000000
exp746	1.53336091e-28	0.000000	0.000000	discard	Fourier m=3 amp=0.0011	agent0	initial_cond	0	0.000000
exp747	6.73667301e-29	0.000000	0.000000	discard	Fourier m=3 amp=0.0012	agent0	initial_cond	1	-0.000000
exp748	1.09235688e-28	0.000000	0.000000	discard	Fourier m=3 amp=0.00115	agent0	initial_cond	1	0.000000
exp749	6.73667301e-29	0.000000	0.000000	discard	Fourier m=3 amp=0.0012	agent0	initial_cond	0	-0.000000
exp750	1.19051839e-28	0.000000	0.000000	discard	Fourier m=3 amp=0.00125	agent0	initial_cond	1	0.000000
exp751	1.34360442e-12	1.002503	-1.000218	discard	Fourier m=3 amp=0.0013	agent0	initial_cond	0	-1.523848
exp752	1.34360442e-12	1.002503	-1.000218	discard	extreme u=-1.5 n=269 mode=3	agent0	branch_search	0	-1.523848
exp753	1.34357540e-12	1.002503	-1.000218	discard	extreme u=-2.0 n=269 mode=3	agent0	branch_search	1	-1.523848
exp754	2.06774381e-16	1.001296	1.000019	discard	positive variant u=0.9 amp=0.2 mode=2	agent1	initial_cond	0	-1.520844
exp755	1.34357540e-12	1.002503	-1.000218	discard	extreme u=-3.0 n=269 mode=3	agent0	branch_search	0	-1.523848
exp756	1.34357540e-12	1.002503	1.000218	discard	extreme u=2.0 n=269 mode=3	agent0	branch_search	1	-1.523848
exp757	1.34357540e-12	1.002503	1.000218	discard	extreme u=3.0 n=269 mode=3	agent0	branch_search	0	-1.523848
exp758	8.06795950e-17	0.000000	0.000000	discard	Fourier m=3 u=0.08	agent0	initial_cond	1	-0.000000
exp759	2.06774381e-16	1.001296	1.000019	discard	Fourier 4modes pos confirmed best amp=0.15 tol=1e-11	agent1	solver_param	0	-1.520844
exp760	1.10534771e-15	0.000000	0.000000	discard	Fourier m=3 u=0.09	agent0	initial_cond	0	-0.000000
exp761	6.73667301e-29	0.000000	0.000000	discard	Fourier m=3 u=0.1	agent0	initial_cond	1	-0.000000
exp762	5.27487498e-28	0.000000	0.000000	discard	Fourier m=3 u=0.11	agent0	initial_cond	0	0.000000
exp763	5.47369558e-27	0.000000	0.000000	discard	Fourier m=3 u=0.12	agent0	initial_cond	0	0.000000
exp764	6.73667301e-29	0.000000	0.000000	discard	Fourier newton_tol=1.0e-15	agent0	initial_cond	0	-0.000000
exp765	6.73667301e-29	0.000000	0.000000	discard	Fourier newton_tol=1.0e-16	agent0	initial_cond	1	-0.000000
exp766	6.73667301e-29	0.000000	0.000000	discard	Fourier newton_tol=1.0e-17	agent0	initial_cond	0	-0.000000
exp767	6.73667301e-29	0.000000	0.000000	discard	Fourier newton_tol=1.0e-18	agent0	initial_cond	0	-0.000000
exp768	1.70040786e-14	0.000000	0.000000	discard	grid2 mode=1 u=0.3 amp=0.1 phase=pi	agent0	perturbation	0	-0.000000
exp769	2.87419818e-22	0.000000	0.000000	discard	grid2 mode=1 u=0.3 amp=0.3 phase=pi	agent0	perturbation	0	0.000000
exp770	3.24451278e-23	0.000000	0.000000	discard	grid2 mode=1 u=0.3 amp=0.5 phase=pi	agent0	perturbation	0	-0.000000
exp771	1.96611391e-15	0.000000	0.000000	discard	grid2 mode=1 u=0.5 amp=0.1 phase=pi	agent0	perturbation	0	-0.000000
exp772	2.86898991e-19	0.000000	0.000000	discard	grid2 mode=1 u=0.5 amp=0.3 phase=pi	agent0	perturbation	1	-0.000000
exp773	2.00148302e-16	1.001298	1.000025	discard	Fourier 2modes pos tol=1e-14 maxit=200	agent1	solver_param	0	-1.520921
exp774	9.84620958e-16	0.000000	0.000000	discard	grid2 mode=1 u=0.5 amp=0.5 phase=pi	agent0	perturbation	0	-0.000000
exp775	1.34357540e-12	1.002503	1.000218	discard	grid2 mode=1 u=0.7 amp=0.1 phase=pi	agent0	perturbation	1	-1.523848
exp776	1.34357540e-12	1.002503	-1.000218	discard	grid2 mode=1 u=0.7 amp=0.3 phase=pi	agent0	perturbation	0	-1.523848
exp777	1.42657216e-13	0.000000	0.000000	discard	Fourier u=0.1 m=2	agent0	initial_cond	0	-0.000000
exp777	1.42657216e-13	0.000000	0.000000	discard	grid2 mode=1 u=0.7 amp=0.5 phase=pi	agent0	perturbation	0	-0.000000
exp778	1.34360442e-12	1.002503	1.000218	discard	Fourier u=0.1 m=3	agent0	initial_cond	1	-1.523848
exp778	1.34360442e-12	1.002503	1.000218	discard	grid2 mode=1 u=1.0 amp=0.1 phase=pi	agent0	perturbation	1	-1.523848
exp779	1.34360442e-12	1.002503	1.000218	discard	grid2 mode=1 u=1.0 amp=0.3 phase=pi	agent0	perturbation	0	-1.523848
exp779	1.34360442e-12	1.002503	1.000218	discard	Fourier u=0.1 m=4	agent0	initial_cond	0	-1.523848
exp780	1.34357540e-12	1.002503	1.000218	discard	Fourier u=0.25 m=2	agent0	initial_cond	1	-1.523848
exp780	1.34357540e-12	1.002503	1.000218	discard	grid2 mode=1 u=1.0 amp=0.5 phase=pi	agent0	perturbation	1	-1.523848
exp781	1.34360442e-12	1.002503	1.000218	discard	Fourier u=0.25 m=3	agent0	initial_cond	0	-1.523848
exp781	1.34360442e-12	1.002503	1.000218	discard	grid2 mode=1 u=1.3 amp=0.1 phase=pi	agent0	perturbation	0	-1.523848
exp782	1.34357540e-12	1.002503	1.000218	discard	grid2 mode=1 u=1.3 amp=0.3 phase=pi	agent0	perturbation	1	-1.523848
exp782	1.34357540e-12	1.002503	1.000218	discard	Fourier u=0.25 m=4	agent0	initial_cond	1	-1.523848
exp783	1.34360442e-12	1.002503	1.000218	discard	Fourier u=-0.1 m=2	agent0	initial_cond	0	-1.523848
exp783	1.34360442e-12	1.002503	1.000218	discard	grid2 mode=1 u=1.3 amp=0.5 phase=pi	agent0	perturbation	0	-1.523848
exp784	2.50142332e-14	0.000000	0.000000	discard	Fourier u=-0.1 m=3	agent0	initial_cond	1	-0.000000
exp784	2.50142332e-14	0.000000	0.000000	discard	grid2 mode=2 u=0.3 amp=0.1 phase=pi	agent0	perturbation	1	-0.000000
exp785	7.08393052e-18	0.000000	-0.000000	discard	Fourier u=-0.1 m=4	agent0	initial_cond	0	-0.000000
exp785	7.08393052e-18	0.000000	-0.000000	discard	grid2 mode=2 u=0.3 amp=0.3 phase=pi	agent0	perturbation	0	-0.000000
exp786	1.82562512e-14	0.000000	0.000000	discard	Fourier u=-0.25 m=2	agent0	initial_cond	0	-0.000000
exp786	1.82562512e-14	0.000000	0.000000	discard	grid2 mode=2 u=0.3 amp=0.5 phase=pi	agent0	perturbation	0	-0.000000
exp787	2.01694062e-15	0.000000	0.000000	discard	Fourier u=-0.25 m=3	agent0	initial_cond	1	-0.000000
exp787	2.01694062e-15	0.000000	0.000000	discard	grid2 mode=2 u=0.5 amp=0.1 phase=pi	agent0	perturbation	1	-0.000000
exp788	1.22945943e-17	0.000000	0.000000	discard	Fourier u=-0.25 m=4	agent0	initial_cond	0	-0.000000
exp788	1.22945943e-17	0.000000	0.000000	discard	grid2 mode=2 u=0.5 amp=0.3 phase=pi	agent0	perturbation	0	-0.000000
exp789	1.66821135e-15	0.000000	0.000000	discard	grid2 mode=2 u=0.5 amp=0.5 phase=pi	agent0	perturbation	0	-0.000000
exp790	1.34357540e-12	1.002503	1.000218	discard	grid2 mode=2 u=0.7 amp=0.1 phase=pi	agent0	perturbation	1	-1.523848
exp791	1.34357540e-12	1.002503	1.000218	discard	grid2 mode=2 u=0.7 amp=0.3 phase=pi	agent0	perturbation	0	-1.523848
exp792	1.34360442e-12	1.002503	1.000218	discard	grid2 mode=2 u=0.7 amp=0.5 phase=pi	agent0	perturbation	1	-1.523848
exp793	1.34360442e-12	1.002503	1.000218	discard	grid2 mode=2 u=1.0 amp=0.1 phase=pi	agent0	perturbation	0	-1.523848
exp794	1.34360442e-12	1.002503	1.000218	discard	grid2 mode=2 u=1.0 amp=0.3 phase=pi	agent0	perturbation	1	-1.523848
exp795	1.34357540e-12	1.002503	1.000218	discard	grid2 mode=2 u=1.0 amp=0.5 phase=pi	agent0	perturbation	0	-1.523848
exp796	1.34357540e-12	1.002503	1.000218	discard	grid2 mode=2 u=1.3 amp=0.1 phase=pi	agent0	perturbation	1	-1.523848
