exp_id	residual	solution_norm	solution_mean	status	description	agent	design	elapsed_s	solution_energy
exp11233	3.99233561e-17	0.102376	-0.000000	discard	3D fine grid around SOTA	manual	3d_grid	0	0.000602
exp11233	1.30310780e-28	0.000000	0.000000	discard	cycle 82 u=0.0980	agent0	initial_cond	0	-0.000000
exp11234	5.45343271e-29	0.000000	0.000000	discard	cycle 82 u=0.0982	agent0	initial_cond	1	-0.000000
exp11235	4.14734287e-17	0.104643	-0.000000	discard	3D fine grid around SOTA	manual	3d_grid	0	0.000664
exp11236	5.45343271e-29	0.000000	0.000000	discard	cycle 82 u=0.0982	agent0	initial_cond	0	-0.000000
exp11237	5.45343271e-29	0.000000	0.000000	discard	cycle 82 u=0.0982	agent0	initial_cond	0	-0.000000
exp11238	3.05403469e-17	0.106907	-0.000000	discard	3D fine grid around SOTA	manual	3d_grid	1	0.000731
exp11239	1.23429977e-28	0.000000	0.000000	discard	cycle 82 u=0.0982	agent0	initial_cond	1	0.000000
exp11240	1.23429977e-28	0.000000	0.000000	discard	cycle 82 u=0.0982	agent0	initial_cond	0	0.000000
exp11241	7.87547131e-17	0.097831	-0.000000	discard	3D fine grid around SOTA	manual	3d_grid	0	0.000490
exp11242	1.23429977e-28	0.000000	0.000000	discard	cycle 82 u=0.0982	agent0	initial_cond	1	0.000000
exp11243	1.88036672e-29	0.000000	0.000000	discard	cycle 82 u=0.0982	agent0	initial_cond	0	0.000000
exp11243	7.09286322e-17	0.100106	-0.000000	discard	3D fine grid around SOTA	manual	3d_grid	0	0.000544
exp11244	1.88036672e-29	0.000000	0.000000	discard	cycle 82 u=0.0982	agent0	initial_cond	0	0.000000
exp11245	5.24367656e-17	0.102376	-0.000000	discard	3D fine grid around SOTA	manual	3d_grid	1	0.000602
exp11245	1.88036672e-29	0.000000	0.000000	discard	cycle 82 u=0.0982	agent0	initial_cond	1	0.000000
exp11246	1.91190259e-29	0.000000	-0.000000	discard	cycle 82 u=0.0982	agent0	initial_cond	0	0.000000
exp11247	2.10227642e-17	0.104643	-0.000000	discard	3D fine grid around SOTA	manual	3d_grid	0	0.000664
exp11248	1.91190259e-29	0.000000	-0.000000	discard	cycle 82 u=0.0982	agent0	initial_cond	1	0.000000
exp11249	1.91190259e-29	0.000000	-0.000000	discard	cycle 82 u=0.0982	agent0	initial_cond	0	0.000000
exp11250	6.81542365e-17	0.106907	-0.000000	discard	3D fine grid around SOTA	manual	3d_grid	0	0.000731
exp11251	6.13049994e-29	0.000000	0.000000	discard	cycle 82 u=0.0985	agent0	initial_cond	0	0.000000
exp11252	6.13049994e-29	0.000000	0.000000	discard	cycle 82 u=0.0985	agent0	initial_cond	1	0.000000
exp11253	2.95188736e-17	0.097831	-0.000000	discard	3D fine grid around SOTA	manual	3d_grid	0	0.000490
exp11254	6.13049994e-29	0.000000	0.000000	discard	cycle 82 u=0.0985	agent0	initial_cond	0	0.000000
exp11255	5.49750971e-29	0.000000	0.000000	discard	cycle 82 u=0.0985	agent0	initial_cond	1	0.000000
exp11255	2.30785610e-17	0.100106	-0.000000	discard	3D fine grid around SOTA	manual	3d_grid	1	0.000544
exp11256	5.49750971e-29	0.000000	0.000000	discard	cycle 82 u=0.0985	agent0	initial_cond	0	0.000000
exp11257	4.02434142e-17	0.102376	0.000000	discard	3D fine grid around SOTA	manual	3d_grid	0	0.000602
exp11258	5.49750971e-29	0.000000	0.000000	discard	cycle 82 u=0.0985	agent0	initial_cond	0	0.000000
exp11259	4.15642452e-29	0.000000	0.000000	discard	cycle 82 u=0.0985	agent0	initial_cond	1	0.000000
exp11260	1.92476550e-17	0.104643	-0.000000	discard	3D fine grid around SOTA	manual	3d_grid	0	0.000664
exp11261	4.15642452e-29	0.000000	0.000000	discard	cycle 82 u=0.0985	agent0	initial_cond	0	0.000000
exp11262	4.15642452e-29	0.000000	0.000000	discard	cycle 82 u=0.0985	agent0	initial_cond	1	0.000000
exp11263	2.98067223e-17	0.106907	-0.000000	discard	3D fine grid around SOTA	manual	3d_grid	1	0.000731
exp11264	2.19292611e-29	0.000000	0.000000	discard	cycle 82 u=0.0985	agent0	initial_cond	0	-0.000000
exp11265	2.19292611e-29	0.000000	0.000000	discard	cycle 82 u=0.0985	agent0	initial_cond	0	-0.000000
exp11265	4.20732633e-17	0.097831	-0.000000	discard	3D fine grid around SOTA	manual	3d_grid	0	0.000490
exp11266	2.19292611e-29	0.000000	0.000000	discard	cycle 82 u=0.0985	agent0	initial_cond	1	-0.000000
exp11267	5.25454391e-17	0.100106	-0.000000	discard	3D fine grid around SOTA	manual	3d_grid	0	0.000544
exp11267	4.22491788e-29	0.000000	0.000000	discard	cycle 82 u=0.0990	agent0	initial_cond	0	-0.000000
exp11268	4.22491788e-29	0.000000	0.000000	discard	cycle 82 u=0.0990	agent0	initial_cond	1	-0.000000
exp11269	2.42745501e-17	0.102376	-0.000000	discard	3D fine grid around SOTA	manual	3d_grid	0	0.000602
exp11270	4.22491788e-29	0.000000	0.000000	discard	cycle 82 u=0.0990	agent0	initial_cond	0	-0.000000
exp11271	3.22245147e-29	0.000000	0.000000	discard	cycle 82 u=0.0990	agent0	initial_cond	0	0.000000
exp11272	3.34853091e-17	0.104643	-0.000000	discard	3D fine grid around SOTA	manual	3d_grid	1	0.000664
exp11273	3.22245147e-29	0.000000	0.000000	discard	cycle 82 u=0.0990	agent0	initial_cond	1	0.000000
exp11274	3.22245147e-29	0.000000	0.000000	discard	cycle 82 u=0.0990	agent0	initial_cond	0	0.000000
exp11275	4.58626662e-17	0.106907	-0.000000	discard	3D fine grid around SOTA	manual	3d_grid	0	0.000731
exp11276	4.50941488e-29	0.000000	-0.000000	discard	cycle 82 u=0.0990	agent0	initial_cond	1	0.000000
exp11277	4.50941488e-29	0.000000	-0.000000	discard	cycle 82 u=0.0990	agent0	initial_cond	0	0.000000
exp11277	4.60502485e-17	0.097831	-0.000000	discard	3D fine grid around SOTA	manual	3d_grid	0	0.000490
exp11278	4.50941488e-29	0.000000	-0.000000	discard	cycle 82 u=0.0990	agent0	initial_cond	0	0.000000
exp11279	6.01129668e-17	0.100106	-0.000000	discard	3D fine grid around SOTA	manual	3d_grid	1	0.000544
exp11279	4.88330883e-29	0.000000	-0.000000	discard	cycle 82 u=0.0990	agent0	initial_cond	1	0.000000
exp11280	4.88330883e-29	0.000000	-0.000000	discard	cycle 82 u=0.0990	agent0	initial_cond	0	0.000000
exp11281	5.30407136e-17	0.102376	0.000000	discard	3D fine grid around SOTA	manual	3d_grid	0	0.000602
exp11282	4.88330883e-29	0.000000	-0.000000	discard	cycle 82 u=0.0990	agent0	initial_cond	1	0.000000
exp11283	5.74085541e-29	0.000000	-0.000000	discard	cycle 82 u=0.0995	agent0	initial_cond	0	0.000000
exp11284	2.62695658e-17	0.104643	-0.000000	discard	3D fine grid around SOTA	manual	3d_grid	0	0.000664
exp11285	5.74085541e-29	0.000000	-0.000000	discard	cycle 82 u=0.0995	agent0	initial_cond	0	0.000000
exp11286	5.74085541e-29	0.000000	-0.000000	discard	cycle 82 u=0.0995	agent0	initial_cond	1	0.000000
exp11287	1.28530972e-16	0.106907	-0.000000	discard	3D fine grid around SOTA	manual	3d_grid	0	0.000731
exp11288	1.54984578e-28	0.000000	0.000000	discard	cycle 82 u=0.0995	agent0	initial_cond	0	-0.000000
exp11289	1.54984578e-28	0.000000	0.000000	discard	cycle 82 u=0.0995	agent0	initial_cond	0	-0.000000
exp11289	1.17609436e-17	0.097831	-0.000000	discard	3D fine grid around SOTA	manual	3d_grid	1	0.000490
exp11290	1.54984578e-28	0.000000	0.000000	discard	cycle 82 u=0.0995	agent0	initial_cond	0	-0.000000
exp11291	2.64113498e-17	0.100106	-0.000000	discard	3D fine grid around SOTA	manual	3d_grid	0	0.000544
exp11291	1.60328418e-29	0.000000	-0.000000	discard	cycle 82 u=0.0995	agent0	initial_cond	0	-0.000000
exp11292	1.60328418e-29	0.000000	-0.000000	discard	cycle 82 u=0.0995	agent0	initial_cond	1	-0.000000
exp11293	3.99233561e-17	0.102376	-0.000000	discard	3D fine grid around SOTA	manual	3d_grid	0	0.000602
exp11294	1.60328418e-29	0.000000	-0.000000	discard	cycle 82 u=0.0995	agent0	initial_cond	0	-0.000000
exp11295	7.34590618e-29	0.000000	0.000000	discard	cycle 82 u=0.0995	agent0	initial_cond	0	0.000000
exp11296	4.14734287e-17	0.104643	-0.000000	discard	3D fine grid around SOTA	manual	3d_grid	1	0.000664
exp11297	7.34590618e-29	0.000000	0.000000	discard	cycle 82 u=0.0995	agent0	initial_cond	0	0.000000
exp11298	7.34590618e-29	0.000000	0.000000	discard	cycle 82 u=0.0995	agent0	initial_cond	0	0.000000
exp11299	3.05403469e-17	0.106907	-0.000000	discard	3D fine grid around SOTA	manual	3d_grid	0	0.000731
exp11300	4.46546993e-29	0.000000	0.000000	discard	cycle 82 u=0.1000	agent0	initial_cond	1	-0.000000
exp11301	4.46546993e-29	0.000000	0.000000	discard	cycle 82 u=0.1000	agent0	initial_cond	0	-0.000000
exp11302	4.46546993e-29	0.000000	0.000000	discard	cycle 82 u=0.1000	agent0	initial_cond	0	-0.000000
exp11303	4.08106752e-29	0.000000	0.000000	discard	cycle 82 u=0.1000	agent0	initial_cond	0	-0.000000
exp11304	4.08106752e-29	0.000000	0.000000	discard	cycle 82 u=0.1000	agent0	initial_cond	0	-0.000000
exp11305	4.08106752e-29	0.000000	0.000000	discard	cycle 82 u=0.1000	agent0	initial_cond	1	-0.000000
exp11306	4.58623706e-29	0.000000	0.000000	discard	cycle 82 u=0.1000	agent0	initial_cond	0	-0.000000
exp11307	4.58623706e-29	0.000000	0.000000	discard	cycle 82 u=0.1000	agent0	initial_cond	0	-0.000000
exp11308	4.58623706e-29	0.000000	0.000000	discard	cycle 82 u=0.1000	agent0	initial_cond	0	-0.000000
exp11309	4.39794337e-29	0.000000	0.000000	discard	cycle 82 u=0.1000	agent0	initial_cond	0	-0.000000
exp11310	4.39794337e-29	0.000000	0.000000	discard	cycle 82 u=0.1000	agent0	initial_cond	1	-0.000000
exp11311	4.39794337e-29	0.000000	0.000000	discard	cycle 82 u=0.1000	agent0	initial_cond	0	-0.000000
exp11312	1.36727475e-28	0.000000	0.000000	discard	cycle 82 u=0.1050	agent0	initial_cond	0	-0.000000
exp11313	1.36727475e-28	0.000000	0.000000	discard	cycle 82 u=0.1050	agent0	initial_cond	0	-0.000000
exp11314	1.36727475e-28	0.000000	0.000000	discard	cycle 82 u=0.1050	agent0	initial_cond	0	-0.000000
exp11315	6.14461376e-29	0.000000	0.000000	discard	cycle 82 u=0.1050	agent0	initial_cond	1	-0.000000
exp11316	6.14461376e-29	0.000000	0.000000	discard	cycle 82 u=0.1050	agent0	initial_cond	0	-0.000000
exp11317	6.14461376e-29	0.000000	0.000000	discard	cycle 82 u=0.1050	agent0	initial_cond	0	-0.000000
exp11318	1.75906666e-28	0.000000	0.000000	discard	cycle 82 u=0.1050	agent0	initial_cond	0	-0.000000
exp11319	1.75906666e-28	0.000000	0.000000	discard	cycle 82 u=0.1050	agent0	initial_cond	0	-0.000000
exp11320	1.75906666e-28	0.000000	0.000000	discard	cycle 82 u=0.1050	agent0	initial_cond	1	-0.000000
exp11321	1.11257917e-28	0.000000	0.000000	discard	cycle 82 u=0.1050	agent0	initial_cond	0	-0.000000
exp11322	1.11257917e-28	0.000000	0.000000	discard	cycle 82 u=0.1050	agent0	initial_cond	0	-0.000000
exp11323	1.11257917e-28	0.000000	0.000000	discard	cycle 82 u=0.1050	agent0	initial_cond	0	-0.000000
exp11324	8.58580947e-29	0.000000	0.000000	discard	cycle 83 u=0.0975	agent0	initial_cond	0	0.000000
exp11325	8.58580947e-29	0.000000	0.000000	discard	cycle 83 u=0.0975	agent0	initial_cond	1	0.000000
exp11326	8.58580947e-29	0.000000	0.000000	discard	cycle 83 u=0.0975	agent0	initial_cond	0	0.000000
exp11327	5.23962023e-29	0.000000	0.000000	discard	cycle 83 u=0.0975	agent0	initial_cond	0	0.000000
exp11328	5.23962023e-29	0.000000	0.000000	discard	cycle 83 u=0.0975	agent0	initial_cond	0	0.000000
exp11329	5.23962023e-29	0.000000	0.000000	discard	cycle 83 u=0.0975	agent0	initial_cond	0	0.000000
exp11330	4.03266298e-29	0.000000	0.000000	discard	cycle 83 u=0.0975	agent0	initial_cond	1	0.000000
exp11331	4.03266298e-29	0.000000	0.000000	discard	cycle 83 u=0.0975	agent0	initial_cond	0	0.000000
exp11332	4.03266298e-29	0.000000	0.000000	discard	cycle 83 u=0.0975	agent0	initial_cond	0	0.000000
exp11333	4.80015937e-29	0.000000	0.000000	discard	cycle 83 u=0.0975	agent0	initial_cond	0	0.000000
exp11334	4.80015937e-29	0.000000	0.000000	discard	cycle 83 u=0.0975	agent0	initial_cond	0	0.000000
exp11335	4.80015937e-29	0.000000	0.000000	discard	cycle 83 u=0.0975	agent0	initial_cond	1	0.000000
exp11336	2.68824537e-29	0.000000	0.000000	discard	cycle 83 u=0.0980	agent0	initial_cond	0	-0.000000
exp11337	2.68824537e-29	0.000000	0.000000	discard	cycle 83 u=0.0980	agent0	initial_cond	0	-0.000000
exp11338	2.68824537e-29	0.000000	0.000000	discard	cycle 83 u=0.0980	agent0	initial_cond	0	-0.000000
exp11339	6.16758073e-29	0.000000	0.000000	discard	cycle 83 u=0.0980	agent0	initial_cond	0	-0.000000
exp11340	6.16758073e-29	0.000000	0.000000	discard	cycle 83 u=0.0980	agent0	initial_cond	1	-0.000000
exp11341	6.16758073e-29	0.000000	0.000000	discard	cycle 83 u=0.0980	agent0	initial_cond	0	-0.000000
exp11342	2.01926478e-29	0.000000	0.000000	discard	cycle 83 u=0.0980	agent0	initial_cond	0	0.000000
exp11343	2.01926478e-29	0.000000	0.000000	discard	cycle 83 u=0.0980	agent0	initial_cond	1	0.000000
exp11344	2.01926478e-29	0.000000	0.000000	discard	cycle 83 u=0.0980	agent0	initial_cond	0	0.000000
exp11345	1.30310780e-28	0.000000	0.000000	discard	cycle 83 u=0.0980	agent0	initial_cond	1	-0.000000
exp11346	1.30310780e-28	0.000000	0.000000	discard	cycle 83 u=0.0980	agent0	initial_cond	0	-0.000000
exp11347	1.30310780e-28	0.000000	0.000000	discard	cycle 83 u=0.0980	agent0	initial_cond	0	-0.000000
exp11348	5.45343271e-29	0.000000	0.000000	discard	cycle 83 u=0.0982	agent0	initial_cond	1	-0.000000
exp11349	5.45343271e-29	0.000000	0.000000	discard	cycle 83 u=0.0982	agent0	initial_cond	0	-0.000000
exp11350	5.45343271e-29	0.000000	0.000000	discard	cycle 83 u=0.0982	agent0	initial_cond	1	-0.000000
exp11351	1.23429977e-28	0.000000	0.000000	discard	cycle 83 u=0.0982	agent0	initial_cond	0	0.000000
exp11352	1.23429977e-28	0.000000	0.000000	discard	cycle 83 u=0.0982	agent0	initial_cond	0	0.000000
exp11353	1.23429977e-28	0.000000	0.000000	discard	cycle 83 u=0.0982	agent0	initial_cond	1	0.000000
exp11354	1.88036672e-29	0.000000	0.000000	discard	cycle 83 u=0.0982	agent0	initial_cond	0	0.000000
exp11355	1.88036672e-29	0.000000	0.000000	discard	cycle 83 u=0.0982	agent0	initial_cond	1	0.000000
exp11356	1.88036672e-29	0.000000	0.000000	discard	cycle 83 u=0.0982	agent0	initial_cond	0	0.000000
exp11357	1.91190259e-29	0.000000	-0.000000	discard	cycle 83 u=0.0982	agent0	initial_cond	0	0.000000
exp11358	1.91190259e-29	0.000000	-0.000000	discard	cycle 83 u=0.0982	agent0	initial_cond	1	0.000000
exp11359	1.91190259e-29	0.000000	-0.000000	discard	cycle 83 u=0.0982	agent0	initial_cond	0	0.000000
exp11360	6.13049994e-29	0.000000	0.000000	discard	cycle 83 u=0.0985	agent0	initial_cond	1	0.000000
exp11361	6.13049994e-29	0.000000	0.000000	discard	cycle 83 u=0.0985	agent0	initial_cond	0	0.000000
exp11362	6.13049994e-29	0.000000	0.000000	discard	cycle 83 u=0.0985	agent0	initial_cond	0	0.000000
exp11363	5.49750971e-29	0.000000	0.000000	discard	cycle 83 u=0.0985	agent0	initial_cond	1	0.000000
exp11364	5.49750971e-29	0.000000	0.000000	discard	cycle 83 u=0.0985	agent0	initial_cond	0	0.000000
exp11365	5.49750971e-29	0.000000	0.000000	discard	cycle 83 u=0.0985	agent0	initial_cond	1	0.000000
exp11366	4.15642452e-29	0.000000	0.000000	discard	cycle 83 u=0.0985	agent0	initial_cond	0	0.000000
exp11367	4.15642452e-29	0.000000	0.000000	discard	cycle 83 u=0.0985	agent0	initial_cond	0	0.000000
exp11368	4.15642452e-29	0.000000	0.000000	discard	cycle 83 u=0.0985	agent0	initial_cond	1	0.000000
exp11369	2.19292611e-29	0.000000	0.000000	discard	cycle 83 u=0.0985	agent0	initial_cond	0	-0.000000
exp11370	2.19292611e-29	0.000000	0.000000	discard	cycle 83 u=0.0985	agent0	initial_cond	1	-0.000000
exp11371	2.19292611e-29	0.000000	0.000000	discard	cycle 83 u=0.0985	agent0	initial_cond	0	-0.000000
exp11372	4.22491788e-29	0.000000	0.000000	discard	cycle 83 u=0.0990	agent0	initial_cond	0	-0.000000
exp11373	4.22491788e-29	0.000000	0.000000	discard	cycle 83 u=0.0990	agent0	initial_cond	1	-0.000000
exp11374	4.22491788e-29	0.000000	0.000000	discard	cycle 83 u=0.0990	agent0	initial_cond	0	-0.000000
exp11375	3.22245147e-29	0.000000	0.000000	discard	cycle 83 u=0.0990	agent0	initial_cond	0	0.000000
exp11376	3.22245147e-29	0.000000	0.000000	discard	cycle 83 u=0.0990	agent0	initial_cond	0	0.000000
exp11377	3.22245147e-29	0.000000	0.000000	discard	cycle 83 u=0.0990	agent0	initial_cond	0	0.000000
exp11378	4.50941488e-29	0.000000	-0.000000	discard	cycle 83 u=0.0990	agent0	initial_cond	1	0.000000
exp11378	3.70478889e-16	1.004168	-1.003940	discard	K_frequency exploration	manual	k_freq_sweep	1	-1.514945
exp11379	4.50941488e-29	0.000000	-0.000000	discard	cycle 83 u=0.0990	agent0	initial_cond	0	0.000000
exp11380	2.45915026e-16	0.382012	0.000000	discard	K_frequency exploration	manual	k_freq_sweep	0	0.054529
exp11381	4.50941488e-29	0.000000	-0.000000	discard	cycle 83 u=0.0990	agent0	initial_cond	0	0.000000
exp11382	4.88330883e-29	0.000000	-0.000000	discard	cycle 83 u=0.0990	agent0	initial_cond	0	0.000000
exp11383	1.01980497e-16	0.382012	0.000000	discard	K_frequency exploration	manual	k_freq_sweep	0	0.054529
exp11384	4.88330883e-29	0.000000	-0.000000	discard	cycle 83 u=0.0990	agent0	initial_cond	0	0.000000
exp11385	4.88330883e-29	0.000000	-0.000000	discard	cycle 83 u=0.0990	agent0	initial_cond	1	0.000000
exp11386	7.65582590e-17	0.197572	0.000000	discard	K_frequency exploration	manual	k_freq_sweep	0	0.011108
exp11387	5.74085541e-29	0.000000	-0.000000	discard	cycle 83 u=0.0995	agent0	initial_cond	0	0.000000
exp11388	5.74085541e-29	0.000000	-0.000000	discard	cycle 83 u=0.0995	agent0	initial_cond	1	0.000000
exp11388	8.04014927e-17	0.197572	0.000000	discard	K_frequency exploration	manual	k_freq_sweep	1	0.011108
exp11389	5.74085541e-29	0.000000	-0.000000	discard	cycle 83 u=0.0995	agent0	initial_cond	0	0.000000
exp11390	1.11468662e-16	0.197572	-0.000000	discard	K_frequency exploration	manual	k_freq_sweep	0	0.011108
exp11390	1.54984578e-28	0.000000	0.000000	discard	cycle 83 u=0.0995	agent0	initial_cond	0	-0.000000
exp11391	1.54984578e-28	0.000000	0.000000	discard	cycle 83 u=0.0995	agent0	initial_cond	1	-0.000000
exp11392	2.31111352e-16	1.004168	-1.003940	discard	K_frequency exploration	manual	k_freq_sweep	0	-1.514945
exp11393	1.54984578e-28	0.000000	0.000000	discard	cycle 83 u=0.0995	agent0	initial_cond	0	-0.000000
exp11394	1.60328418e-29	0.000000	-0.000000	discard	cycle 83 u=0.0995	agent0	initial_cond	0	-0.000000
exp11395	2.16481628e-16	0.382012	-0.000000	discard	K_frequency exploration	manual	k_freq_sweep	1	0.054529
exp11396	1.60328418e-29	0.000000	-0.000000	discard	cycle 83 u=0.0995	agent0	initial_cond	0	-0.000000
exp11397	1.60328418e-29	0.000000	-0.000000	discard	cycle 83 u=0.0995	agent0	initial_cond	0	-0.000000
exp11398	7.01251818e-16	0.382012	-0.000000	discard	K_frequency exploration	manual	k_freq_sweep	0	0.054529
exp11399	7.34590618e-29	0.000000	0.000000	discard	cycle 83 u=0.0995	agent0	initial_cond	1	0.000000
exp11400	7.34590618e-29	0.000000	0.000000	discard	cycle 83 u=0.0995	agent0	initial_cond	0	0.000000
exp11401	7.34590618e-29	0.000000	0.000000	discard	cycle 83 u=0.0995	agent0	initial_cond	0	0.000000
exp11402	4.46546993e-29	0.000000	0.000000	discard	cycle 83 u=0.1000	agent0	initial_cond	0	-0.000000
exp11403	4.46546993e-29	0.000000	0.000000	discard	cycle 83 u=0.1000	agent0	initial_cond	0	-0.000000
exp11404	4.46546993e-29	0.000000	0.000000	discard	cycle 83 u=0.1000	agent0	initial_cond	1	-0.000000
exp11405	4.08106752e-29	0.000000	0.000000	discard	cycle 83 u=0.1000	agent0	initial_cond	0	-0.000000
exp11406	4.08106752e-29	0.000000	0.000000	discard	cycle 83 u=0.1000	agent0	initial_cond	0	-0.000000
exp11407	4.08106752e-29	0.000000	0.000000	discard	cycle 83 u=0.1000	agent0	initial_cond	0	-0.000000
exp11408	4.58623706e-29	0.000000	0.000000	discard	cycle 83 u=0.1000	agent0	initial_cond	0	-0.000000
exp11409	4.58623706e-29	0.000000	0.000000	discard	cycle 83 u=0.1000	agent0	initial_cond	1	-0.000000
exp11410	4.58623706e-29	0.000000	0.000000	discard	cycle 83 u=0.1000	agent0	initial_cond	0	-0.000000
exp11411	4.39794337e-29	0.000000	0.000000	discard	cycle 83 u=0.1000	agent0	initial_cond	0	-0.000000
exp11412	4.39794337e-29	0.000000	0.000000	discard	cycle 83 u=0.1000	agent0	initial_cond	0	-0.000000
exp11413	4.39794337e-29	0.000000	0.000000	discard	cycle 83 u=0.1000	agent0	initial_cond	0	-0.000000
exp11414	1.36727475e-28	0.000000	0.000000	discard	cycle 83 u=0.1050	agent0	initial_cond	1	-0.000000
exp11415	1.36727475e-28	0.000000	0.000000	discard	cycle 83 u=0.1050	agent0	initial_cond	0	-0.000000
exp11416	1.36727475e-28	0.000000	0.000000	discard	cycle 83 u=0.1050	agent0	initial_cond	0	-0.000000
exp11417	6.14461376e-29	0.000000	0.000000	discard	cycle 83 u=0.1050	agent0	initial_cond	0	-0.000000
exp11418	6.14461376e-29	0.000000	0.000000	discard	cycle 83 u=0.1050	agent0	initial_cond	0	-0.000000
exp11419	6.14461376e-29	0.000000	0.000000	discard	cycle 83 u=0.1050	agent0	initial_cond	1	-0.000000
exp11420	1.75906666e-28	0.000000	0.000000	discard	cycle 83 u=0.1050	agent0	initial_cond	0	-0.000000
exp11421	1.75906666e-28	0.000000	0.000000	discard	cycle 83 u=0.1050	agent0	initial_cond	0	-0.000000
exp11422	1.30885469e-17	0.081814	-0.000000	discard	n_mode exploration	manual	n_mode_sweep	1	0.000212
exp11423	1.75906666e-28	0.000000	0.000000	discard	cycle 83 u=0.1050	agent0	initial_cond	0	-0.000000
exp11424	3.04361456e-17	0.102376	-0.000000	discard	n_mode exploration	manual	n_mode_sweep	0	0.000602
exp11424	1.11257917e-28	0.000000	0.000000	discard	cycle 83 u=0.1050	agent0	initial_cond	0	-0.000000
exp11425	1.11257917e-28	0.000000	0.000000	discard	cycle 83 u=0.1050	agent0	initial_cond	1	-0.000000
exp11426	3.16010002e-16	0.127095	-0.000000	discard	n_mode exploration	manual	n_mode_sweep	0	0.001555
exp11427	1.11257917e-28	0.000000	0.000000	discard	cycle 83 u=0.1050	agent0	initial_cond	0	-0.000000
exp11428	8.58580947e-29	0.000000	0.000000	discard	cycle 84 u=0.0975	agent0	initial_cond	0	0.000000
exp11429	3.92839866e-26	0.000000	0.000000	discard	n_mode exploration	manual	n_mode_sweep	1	-0.000000
exp11430	8.58580947e-29	0.000000	0.000000	discard	cycle 84 u=0.0975	agent0	initial_cond	0	0.000000
exp11431	8.58580947e-29	0.000000	0.000000	discard	cycle 84 u=0.0975	agent0	initial_cond	0	0.000000
exp11432	3.20868313e-26	0.000000	-0.000000	discard	n_mode exploration	manual	n_mode_sweep	0	0.000000
exp11433	5.23962023e-29	0.000000	0.000000	discard	cycle 84 u=0.0975	agent0	initial_cond	1	0.000000
exp11434	5.23962023e-29	0.000000	0.000000	discard	cycle 84 u=0.0975	agent0	initial_cond	0	0.000000
exp11434	3.78727514e-26	0.000000	0.000000	discard	n_mode exploration	manual	n_mode_sweep	0	0.000000
exp11435	5.23962023e-29	0.000000	0.000000	discard	cycle 84 u=0.0975	agent0	initial_cond	0	0.000000
