exp_id	residual	solution_norm	solution_mean	status	description	agent	design	elapsed_s	solution_energy
exp16770	1.75906666e-28	0.000000	0.000000	discard	cycle 134 u=0.1050	agent0	initial_cond	0	-0.000000
r9_phase1.45585_ultra	1.40842443e-26	0.0	0.0	keep	Phase28 phase=1.45585 ultra	agent1	memory	0	0.0
exp16771	1.75906666e-28	0.000000	0.000000	discard	cycle 134 u=0.1050	agent0	initial_cond	1	-0.000000
exp16772	1.11257917e-28	0.000000	0.000000	discard	cycle 134 u=0.1050	agent0	initial_cond	0	-0.000000
exp16773	1.11257917e-28	0.000000	0.000000	discard	cycle 134 u=0.1050	agent0	initial_cond	0	-0.000000
exp16774	1.11257917e-28	0.000000	0.000000	discard	cycle 134 u=0.1050	agent0	initial_cond	0	-0.000000
exp16775	8.58580947e-29	0.000000	0.000000	discard	cycle 135 u=0.0975	agent0	initial_cond	0	0.000000
exp16776	8.58580947e-29	0.000000	0.000000	discard	cycle 135 u=0.0975	agent0	initial_cond	1	0.000000
exp16777	8.58580947e-29	0.000000	0.000000	discard	cycle 135 u=0.0975	agent0	initial_cond	0	0.000000
exp16778	5.23962023e-29	0.000000	0.000000	discard	cycle 135 u=0.0975	agent0	initial_cond	1	0.000000
exp16779	5.23962023e-29	0.000000	0.000000	discard	cycle 135 u=0.0975	agent0	initial_cond	0	0.000000
exp16780	5.23962023e-29	0.000000	0.000000	discard	cycle 135 u=0.0975	agent0	initial_cond	0	0.000000
exp16781	4.03266298e-29	0.000000	0.000000	discard	cycle 135 u=0.0975	agent0	initial_cond	0	0.000000
exp16782	4.03266298e-29	0.000000	0.000000	discard	cycle 135 u=0.0975	agent0	initial_cond	0	0.000000
exp16783	4.03266298e-29	0.000000	0.000000	discard	cycle 135 u=0.0975	agent0	initial_cond	1	0.000000
exp16784	4.80015937e-29	0.000000	0.000000	discard	cycle 135 u=0.0975	agent0	initial_cond	0	0.000000
exp16785	4.80015937e-29	0.000000	0.000000	discard	cycle 135 u=0.0975	agent0	initial_cond	1	0.000000
exp16786	4.80015937e-29	0.000000	0.000000	discard	cycle 135 u=0.0975	agent0	initial_cond	0	0.000000
exp16787	2.68824537e-29	0.000000	0.000000	discard	cycle 135 u=0.0980	agent0	initial_cond	0	-0.000000
exp16788	2.68824537e-29	0.000000	0.000000	discard	cycle 135 u=0.0980	agent0	initial_cond	0	-0.000000
exp16789	2.68824537e-29	0.000000	0.000000	discard	cycle 135 u=0.0980	agent0	initial_cond	0	-0.000000
exp16790	6.16758073e-29	0.000000	0.000000	discard	cycle 135 u=0.0980	agent0	initial_cond	1	-0.000000
exp16791	6.16758073e-29	0.000000	0.000000	discard	cycle 135 u=0.0980	agent0	initial_cond	0	-0.000000
exp16792	6.16758073e-29	0.000000	0.000000	discard	cycle 135 u=0.0980	agent0	initial_cond	1	-0.000000
exp16793	2.01926478e-29	0.000000	0.000000	discard	cycle 135 u=0.0980	agent0	initial_cond	0	0.000000
exp16794	2.01926478e-29	0.000000	0.000000	discard	cycle 135 u=0.0980	agent0	initial_cond	0	0.000000
exp16795	2.01926478e-29	0.000000	0.000000	discard	cycle 135 u=0.0980	agent0	initial_cond	0	0.000000
exp16796	1.30310780e-28	0.000000	0.000000	discard	cycle 135 u=0.0980	agent0	initial_cond	0	-0.000000
exp16797	1.30310780e-28	0.000000	0.000000	discard	cycle 135 u=0.0980	agent0	initial_cond	1	-0.000000
exp16798	1.30310780e-28	0.000000	0.000000	discard	cycle 135 u=0.0980	agent0	initial_cond	0	-0.000000
exp16799	5.45343271e-29	0.000000	0.000000	discard	cycle 135 u=0.0982	agent0	initial_cond	1	-0.000000
exp16800	5.45343271e-29	0.000000	0.000000	discard	cycle 135 u=0.0982	agent0	initial_cond	0	-0.000000
exp16801	5.45343271e-29	0.000000	0.000000	discard	cycle 135 u=0.0982	agent0	initial_cond	0	-0.000000
exp16802	1.23429977e-28	0.000000	0.000000	discard	cycle 135 u=0.0982	agent0	initial_cond	0	0.000000
exp16803	1.23429977e-28	0.000000	0.000000	discard	cycle 135 u=0.0982	agent0	initial_cond	0	0.000000
exp16804	1.23429977e-28	0.000000	0.000000	discard	cycle 135 u=0.0982	agent0	initial_cond	1	0.000000
exp16805	1.88036672e-29	0.000000	0.000000	discard	cycle 135 u=0.0982	agent0	initial_cond	0	0.000000
exp16806	1.88036672e-29	0.000000	0.000000	discard	cycle 135 u=0.0982	agent0	initial_cond	1	0.000000
exp16807	1.88036672e-29	0.000000	0.000000	discard	cycle 135 u=0.0982	agent0	initial_cond	0	0.000000
exp16808	1.91190259e-29	0.000000	-0.000000	discard	cycle 135 u=0.0982	agent0	initial_cond	0	0.000000
exp16809	1.91190259e-29	0.000000	-0.000000	discard	cycle 135 u=0.0982	agent0	initial_cond	0	0.000000
exp16810	1.91190259e-29	0.000000	-0.000000	discard	cycle 135 u=0.0982	agent0	initial_cond	0	0.000000
exp16811	6.13049994e-29	0.000000	0.000000	discard	cycle 135 u=0.0985	agent0	initial_cond	1	0.000000
exp16812	6.13049994e-29	0.000000	0.000000	discard	cycle 135 u=0.0985	agent0	initial_cond	0	0.000000
exp16813	6.13049994e-29	0.000000	0.000000	discard	cycle 135 u=0.0985	agent0	initial_cond	1	0.000000
exp16814	5.49750971e-29	0.000000	0.000000	discard	cycle 135 u=0.0985	agent0	initial_cond	0	0.000000
exp16815	5.49750971e-29	0.000000	0.000000	discard	cycle 135 u=0.0985	agent0	initial_cond	0	0.000000
exp16816	5.49750971e-29	0.000000	0.000000	discard	cycle 135 u=0.0985	agent0	initial_cond	0	0.000000
exp16817	4.15642452e-29	0.000000	0.000000	discard	cycle 135 u=0.0985	agent0	initial_cond	0	0.000000
exp16818	4.15642452e-29	0.000000	0.000000	discard	cycle 135 u=0.0985	agent0	initial_cond	1	0.000000
exp16819	4.15642452e-29	0.000000	0.000000	discard	cycle 135 u=0.0985	agent0	initial_cond	0	0.000000
exp16820	2.19292611e-29	0.000000	0.000000	discard	cycle 135 u=0.0985	agent0	initial_cond	1	-0.000000
exp16821	2.19292611e-29	0.000000	0.000000	discard	cycle 135 u=0.0985	agent0	initial_cond	0	-0.000000
exp16822	2.19292611e-29	0.000000	0.000000	discard	cycle 135 u=0.0985	agent0	initial_cond	0	-0.000000
exp16823	4.22491788e-29	0.000000	0.000000	discard	cycle 135 u=0.0990	agent0	initial_cond	0	-0.000000
exp16824	4.22491788e-29	0.000000	0.000000	discard	cycle 135 u=0.0990	agent0	initial_cond	0	-0.000000
exp16825	4.22491788e-29	0.000000	0.000000	discard	cycle 135 u=0.0990	agent0	initial_cond	1	-0.000000
exp16826	3.22245147e-29	0.000000	0.000000	discard	cycle 135 u=0.0990	agent0	initial_cond	0	0.000000
exp16827	3.22245147e-29	0.000000	0.000000	discard	cycle 135 u=0.0990	agent0	initial_cond	0	0.000000
exp16828	3.22245147e-29	0.000000	0.000000	discard	cycle 135 u=0.0990	agent0	initial_cond	0	0.000000
exp16829	4.50941488e-29	0.000000	-0.000000	discard	cycle 135 u=0.0990	agent0	initial_cond	0	0.000000
exp16830	4.50941488e-29	0.000000	-0.000000	discard	cycle 135 u=0.0990	agent0	initial_cond	0	0.000000
exp16831	4.50941488e-29	0.000000	-0.000000	discard	cycle 135 u=0.0990	agent0	initial_cond	0	0.000000
exp16832	4.88330883e-29	0.000000	-0.000000	discard	cycle 135 u=0.0990	agent0	initial_cond	1	0.000000
exp16833	4.88330883e-29	0.000000	-0.000000	discard	cycle 135 u=0.0990	agent0	initial_cond	0	0.000000
exp16834	4.88330883e-29	0.000000	-0.000000	discard	cycle 135 u=0.0990	agent0	initial_cond	0	0.000000
exp16835	5.74085541e-29	0.000000	-0.000000	discard	cycle 135 u=0.0995	agent0	initial_cond	0	0.000000
exp16836	5.74085541e-29	0.000000	-0.000000	discard	cycle 135 u=0.0995	agent0	initial_cond	0	0.000000
exp16837	5.74085541e-29	0.000000	-0.000000	discard	cycle 135 u=0.0995	agent0	initial_cond	1	0.000000
exp16838	1.54984578e-28	0.000000	0.000000	discard	cycle 135 u=0.0995	agent0	initial_cond	0	-0.000000
exp16839	1.54984578e-28	0.000000	0.000000	discard	cycle 135 u=0.0995	agent0	initial_cond	1	-0.000000
exp16840	1.54984578e-28	0.000000	0.000000	discard	cycle 135 u=0.0995	agent0	initial_cond	0	-0.000000
exp16841	1.60328418e-29	0.000000	-0.000000	discard	cycle 135 u=0.0995	agent0	initial_cond	0	-0.000000
exp16842	1.60328418e-29	0.000000	-0.000000	discard	cycle 135 u=0.0995	agent0	initial_cond	0	-0.000000
exp16843	1.60328418e-29	0.000000	-0.000000	discard	cycle 135 u=0.0995	agent0	initial_cond	0	-0.000000
exp16844	7.34590618e-29	0.000000	0.000000	discard	cycle 135 u=0.0995	agent0	initial_cond	1	0.000000
exp16845	7.34590618e-29	0.000000	0.000000	discard	cycle 135 u=0.0995	agent0	initial_cond	0	0.000000
exp16846	7.34590618e-29	0.000000	0.000000	discard	cycle 135 u=0.0995	agent0	initial_cond	1	0.000000
exp16847	4.46546993e-29	0.000000	0.000000	discard	cycle 135 u=0.1000	agent0	initial_cond	0	-0.000000
exp16848	4.46546993e-29	0.000000	0.000000	discard	cycle 135 u=0.1000	agent0	initial_cond	0	-0.000000
exp16849	4.46546993e-29	0.000000	0.000000	discard	cycle 135 u=0.1000	agent0	initial_cond	0	-0.000000
exp16850	4.08106752e-29	0.000000	0.000000	discard	cycle 135 u=0.1000	agent0	initial_cond	0	-0.000000
exp16851	4.08106752e-29	0.000000	0.000000	discard	cycle 135 u=0.1000	agent0	initial_cond	1	-0.000000
exp16852	4.08106752e-29	0.000000	0.000000	discard	cycle 135 u=0.1000	agent0	initial_cond	0	-0.000000
exp16853	4.58623706e-29	0.000000	0.000000	discard	cycle 135 u=0.1000	agent0	initial_cond	1	-0.000000
exp16854	4.58623706e-29	0.000000	0.000000	discard	cycle 135 u=0.1000	agent0	initial_cond	0	-0.000000
exp16855	4.58623706e-29	0.000000	0.000000	discard	cycle 135 u=0.1000	agent0	initial_cond	0	-0.000000
exp16856	4.39794337e-29	0.000000	0.000000	discard	cycle 135 u=0.1000	agent0	initial_cond	0	-0.000000
exp16857	4.39794337e-29	0.000000	0.000000	discard	cycle 135 u=0.1000	agent0	initial_cond	0	-0.000000
exp16858	4.39794337e-29	0.000000	0.000000	discard	cycle 135 u=0.1000	agent0	initial_cond	1	-0.000000
exp16859	1.36727475e-28	0.000000	0.000000	discard	cycle 135 u=0.1050	agent0	initial_cond	0	-0.000000
exp16860	1.36727475e-28	0.000000	0.000000	discard	cycle 135 u=0.1050	agent0	initial_cond	1	-0.000000
exp16861	1.36727475e-28	0.000000	0.000000	discard	cycle 135 u=0.1050	agent0	initial_cond	0	-0.000000
exp16862	6.14461376e-29	0.000000	0.000000	discard	cycle 135 u=0.1050	agent0	initial_cond	0	-0.000000
exp16863	6.14461376e-29	0.000000	0.000000	discard	cycle 135 u=0.1050	agent0	initial_cond	0	-0.000000
exp16864	6.14461376e-29	0.000000	0.000000	discard	cycle 135 u=0.1050	agent0	initial_cond	0	-0.000000
exp16865	1.75906666e-28	0.000000	0.000000	discard	cycle 135 u=0.1050	agent0	initial_cond	1	-0.000000
r9_solv_nt1e-15_st1e-12	7.10657943e-27	0.0	0.0	keep	Phase29 nt=1e-15 st=1e-12	agent1	memory	0	0.0
exp16866	1.75906666e-28	0.000000	0.000000	discard	cycle 135 u=0.1050	agent0	initial_cond	0	-0.000000
r9_solv_nt1e-15_st1e-14	7.10657943e-27	0.0	0.0	keep	Phase29 nt=1e-15 st=1e-14	agent1	memory	0	0.0
exp16867	1.75906666e-28	0.000000	0.000000	discard	cycle 135 u=0.1050	agent0	initial_cond	1	-0.000000
r9_solv_nt1e-15_st1e-15	7.10657943e-27	0.0	0.0	keep	Phase29 nt=1e-15 st=1e-15	agent1	memory	0	0.0
r9_solv_nt1e-16_st1e-12	7.10657943e-27	0.0	0.0	keep	Phase29 nt=1e-16 st=1e-12	agent1	memory	0	0.0
exp16868	1.11257917e-28	0.000000	0.000000	discard	cycle 135 u=0.1050	agent0	initial_cond	0	-0.000000
r9_solv_nt1e-16_st1e-14	7.10657943e-27	0.0	0.0	keep	Phase29 nt=1e-16 st=1e-14	agent1	memory	0	0.0
exp16869	1.11257917e-28	0.000000	0.000000	discard	cycle 135 u=0.1050	agent0	initial_cond	0	-0.000000
r9_solv_nt1e-16_st1e-15	7.10657943e-27	0.0	0.0	keep	Phase29 nt=1e-16 st=1e-15	agent1	memory	0	0.0
r9_solv_nt1e-17_st1e-12	7.10657943e-27	0.0	0.0	keep	Phase29 nt=1e-17 st=1e-12	agent1	memory	0	0.0
exp16870	1.11257917e-28	0.000000	0.000000	discard	cycle 135 u=0.1050	agent0	initial_cond	0	-0.000000
r9_solv_nt1e-17_st1e-14	7.10657943e-27	0.0	0.0	keep	Phase29 nt=1e-17 st=1e-14	agent1	memory	0	0.0
exp16871	8.58580947e-29	0.000000	0.000000	discard	cycle 136 u=0.0975	agent0	initial_cond	0	0.000000
r9_solv_nt1e-17_st1e-15	7.10657943e-27	0.0	0.0	keep	Phase29 nt=1e-17 st=1e-15	agent1	memory	0	0.0
r9_solv_nt1e-18_st1e-12	7.10657943e-27	0.0	0.0	keep	Phase29 nt=1e-18 st=1e-12	agent1	memory	0	0.0
