exp_id	residual	solution_norm	solution_mean	status	description	agent	design	elapsed_s	solution_energy
exp5182	5.19585156e-16	0.999035	1.000000	discard	positive_branch phase=0.0 amp=0.05 u=1.44	agent1	perturbation	0	-1.566349
exp5182	6.14461376e-29	0.000000	0.000000	discard	cycle 27 u=0.1050	agent0	initial_cond	0	-0.000000
exp5183	6.14461376e-29	0.000000	0.000000	discard	Fourier 3 u=1.0 a=0.8	agent0	solver_param	0	-0.000000
exp5184	crash	0	0	crash	positive_branch phase=0.0 amp=0.10 u=1.44	agent1	perturbation	0	0
exp5184	6.14461376e-29	0.000000	0.000000	discard	cycle 27 u=0.1050	agent0	initial_cond	0	-0.000000
exp5185	1.75906666e-28	0.000000	0.000000	discard	Fourier 3 u=1.5 a=0.3	agent0	solver_param	1	-0.000000
exp5185	4.00567146e-16	0.999523	1.000001	discard	positive_branch phase=0.0 amp=0.15 u=1.44	agent1	perturbation	1	-1.555918
exp5185	1.75906666e-28	0.000000	0.000000	discard	cycle 27 u=0.1050	agent0	initial_cond	1	-0.000000
exp5186	2.75466223e-16	0.999975	1.000004	discard	positive_branch phase=0.0 amp=0.20 u=1.44	agent1	perturbation	0	-1.546805
exp5186	2.48721681e-16	1.001296	1.000019	discard	cycle 27 u=0.1050	agent0	initial_cond	0	-1.520844
exp5186	2.48721681e-16	1.001296	1.000019	discard	Fourier 3 u=1.5 a=0.5	agent0	solver_param	0	-1.520844
exp5187	0.00000000e+00	0.998999	1.000000	discard	positive_branch phase=1.0 amp=0.0 u=1.44	agent1	perturbation	0	-1.567655
exp5187	8.43441851e-14	1.001296	1.000019	discard	cycle 27 u=0.1050	agent0	initial_cond	0	-1.520844
exp5188	8.43441851e-14	1.001296	1.000019	discard	Fourier 3 u=1.5 a=0.8	agent0	solver_param	0	-1.520844
exp5189	1.11257917e-28	0.000000	0.000000	discard	cycle 27 u=0.1050	agent0	initial_cond	0	-0.000000
exp5189	5.19585156e-16	0.999035	1.000000	discard	positive_branch phase=1.0 amp=0.05 u=1.44	agent1	perturbation	0	-1.566349
exp5190	crash	0	0	crash	positive_branch phase=1.0 amp=0.10 u=1.44	agent1	perturbation	0	0
exp5190	1.11257917e-28	0.000000	0.000000	discard	cycle 27 u=0.1050	agent0	initial_cond	0	-0.000000
exp5191	4.92025806e-16	0.999523	1.000001	discard	positive_branch phase=1.0 amp=0.15 u=1.44	agent1	perturbation	1	-1.555918
exp5191	1.11257917e-28	0.000000	0.000000	discard	cycle 27 u=0.1050	agent0	initial_cond	1	-0.000000
exp5192	2.75466223e-16	0.999975	1.000004	discard	positive_branch phase=1.0 amp=0.20 u=1.44	agent1	perturbation	0	-1.546805
exp5192	8.58580947e-29	0.000000	0.000000	discard	cycle 28 u=0.0975	agent0	initial_cond	0	0.000000
exp5193	0.00000000e+00	0.998999	1.000000	discard	positive_branch phase=2.0 amp=0.0 u=1.44	agent1	perturbation	0	-1.567655
exp5193	8.58580947e-29	0.000000	0.000000	discard	cycle 28 u=0.0975	agent0	initial_cond	0	0.000000
exp5194	8.58580947e-29	0.000000	0.000000	discard	cycle 28 u=0.0975	agent0	initial_cond	1	0.000000
exp5194	5.46669143e-16	0.999035	1.000000	discard	positive_branch phase=2.0 amp=0.05 u=1.44	agent1	perturbation	1	-1.566349
exp5195	crash	0	0	crash	positive_branch phase=2.0 amp=0.10 u=1.44	agent1	perturbation	0	0
exp5195	5.23962023e-29	0.000000	0.000000	discard	cycle 28 u=0.0975	agent0	initial_cond	0	0.000000
exp5196	4.85747351e-16	0.999523	1.000001	discard	positive_branch phase=2.0 amp=0.15 u=1.44	agent1	perturbation	0	-1.555918
exp5196	5.23962023e-29	0.000000	0.000000	discard	cycle 28 u=0.0975	agent0	initial_cond	0	0.000000
exp5197	crash	0	0	crash	positive_branch phase=2.0 amp=0.20 u=1.44	agent1	perturbation	1	0
exp5198	5.23962023e-29	0.000000	0.000000	discard	cycle 28 u=0.0975	agent0	initial_cond	0	0.000000
exp5199	0.00000000e+00	0.998999	1.000000	discard	positive_branch phase=3.0 amp=0.0 u=1.44	agent1	perturbation	0	-1.567655
exp5200	4.03266298e-29	0.000000	0.000000	discard	cycle 28 u=0.0975	agent0	initial_cond	0	0.000000
exp5201	crash	0	0	crash	positive_branch phase=3.0 amp=0.05 u=1.44	agent1	perturbation	0	0
exp5202	4.03266298e-29	0.000000	0.000000	discard	cycle 28 u=0.0975	agent0	initial_cond	1	0.000000
exp5203	crash	0	0	crash	positive_branch phase=3.0 amp=0.10 u=1.44	agent1	perturbation	0	0
exp5204	4.03266298e-29	0.000000	0.000000	discard	cycle 28 u=0.0975	agent0	initial_cond	0	0.000000
exp5205	4.92025806e-16	0.999523	1.000001	discard	positive_branch phase=3.0 amp=0.15 u=1.44	agent1	perturbation	0	-1.555918
exp5206	4.80015937e-29	0.000000	0.000000	discard	cycle 28 u=0.0975	agent0	initial_cond	0	0.000000
exp5207	3.00863292e-16	0.999975	1.000004	discard	positive_branch phase=3.0 amp=0.20 u=1.44	agent1	perturbation	1	-1.546805
exp5208	4.80015937e-29	0.000000	0.000000	discard	cycle 28 u=0.0975	agent0	initial_cond	1	0.000000
exp5209	0.00000000e+00	0.998999	-1.000000	discard	negative_branch phase=0.0 amp=0.0 u=-1.44	agent1	perturbation	0	-1.567655
exp5210	4.80015937e-29	0.000000	0.000000	discard	cycle 28 u=0.0975	agent0	initial_cond	0	0.000000
exp5211	5.27106226e-16	0.999035	-1.000000	discard	negative_branch phase=0.0 amp=0.05 u=-1.44	agent1	perturbation	0	-1.566349
exp5212	2.68824537e-29	0.000000	0.000000	discard	cycle 28 u=0.0980	agent0	initial_cond	0	-0.000000
exp5213	crash	0	0	crash	negative_branch phase=0.0 amp=0.10 u=-1.44	agent1	perturbation	1	0
exp5214	2.68824537e-29	0.000000	0.000000	discard	cycle 28 u=0.0980	agent0	initial_cond	1	-0.000000
exp5215	4.92025806e-16	0.999523	-1.000001	discard	negative_branch phase=0.0 amp=0.15 u=-1.44	agent1	perturbation	0	-1.555918
exp5216	2.68824537e-29	0.000000	0.000000	discard	cycle 28 u=0.0980	agent0	initial_cond	0	-0.000000
exp5217	2.75466223e-16	0.999975	-1.000004	discard	negative_branch phase=0.0 amp=0.20 u=-1.44	agent1	perturbation	0	-1.546805
exp5218	6.16758073e-29	0.000000	0.000000	discard	cycle 28 u=0.0980	agent0	initial_cond	1	-0.000000
exp5219	0.00000000e+00	0.998999	-1.000000	discard	negative_branch phase=1.0 amp=0.0 u=-1.44	agent1	perturbation	1	-1.567655
exp5220	6.16758073e-29	0.000000	0.000000	discard	cycle 28 u=0.0980	agent0	initial_cond	0	-0.000000
exp5221	4.53802634e-16	0.999035	-1.000000	discard	negative_branch phase=1.0 amp=0.05 u=-1.44	agent1	perturbation	0	-1.566349
exp5222	6.16758073e-29	0.000000	0.000000	discard	cycle 28 u=0.0980	agent0	initial_cond	0	-0.000000
exp5223	crash	0	0	crash	negative_branch phase=1.0 amp=0.10 u=-1.44	agent1	perturbation	1	0
exp5224	2.01926478e-29	0.000000	0.000000	discard	cycle 28 u=0.0980	agent0	initial_cond	1	0.000000
exp5225	4.92025806e-16	0.999523	-1.000001	discard	negative_branch phase=1.0 amp=0.15 u=-1.44	agent1	perturbation	0	-1.555918
exp5226	2.01926478e-29	0.000000	0.000000	discard	cycle 28 u=0.0980	agent0	initial_cond	0	0.000000
exp5227	2.75466223e-16	0.999975	-1.000004	discard	negative_branch phase=1.0 amp=0.20 u=-1.44	agent1	perturbation	0	-1.546805
exp5228	2.01926478e-29	0.000000	0.000000	discard	cycle 28 u=0.0980	agent0	initial_cond	0	0.000000
exp5229	0.00000000e+00	0.998999	-1.000000	discard	negative_branch phase=2.0 amp=0.0 u=-1.44	agent1	perturbation	1	-1.567655
exp5230	1.30310780e-28	0.000000	0.000000	discard	cycle 28 u=0.0980	agent0	initial_cond	1	-0.000000
exp5231	crash	0	0	crash	negative_branch phase=2.0 amp=0.05 u=-1.44	agent1	perturbation	0	0
exp5232	1.30310780e-28	0.000000	0.000000	discard	cycle 28 u=0.0980	agent0	initial_cond	0	-0.000000
exp5233	crash	0	0	crash	negative_branch phase=2.0 amp=0.10 u=-1.44	agent1	perturbation	0	0
exp5234	1.30310780e-28	0.000000	0.000000	discard	cycle 28 u=0.0980	agent0	initial_cond	0	-0.000000
exp5235	4.00567146e-16	0.999523	-1.000001	discard	negative_branch phase=2.0 amp=0.15 u=-1.44	agent1	perturbation	1	-1.555918
exp5236	5.45343271e-29	0.000000	0.000000	discard	cycle 28 u=0.0982	agent0	initial_cond	0	-0.000000
exp5237	2.75466223e-16	0.999975	-1.000004	discard	negative_branch phase=2.0 amp=0.20 u=-1.44	agent1	perturbation	0	-1.546805
exp5238	5.45343271e-29	0.000000	0.000000	discard	cycle 28 u=0.0982	agent0	initial_cond	0	-0.000000
exp5239	0.00000000e+00	0.998999	-1.000000	discard	negative_branch phase=3.0 amp=0.0 u=-1.44	agent1	perturbation	0	-1.567655
exp5240	7.16287468e-16	1.001298	1.000025	discard	cycle 28 u=0.0982	agent0	initial_cond	1	-1.520921
exp5241	5.19585156e-16	0.999035	-1.000000	discard	negative_branch phase=3.0 amp=0.05 u=-1.44	agent1	perturbation	0	-1.566349
exp5241	1.23429977e-28	0.000000	0.000000	discard	precise u=1.0000 amp=0.003 r1	agent0	solver_param	0	0.000000
exp5242	1.23429977e-28	0.000000	0.000000	discard	cycle 28 u=0.0982	agent0	initial_cond	0	0.000000
exp5243	crash	0	0	crash	negative_branch phase=3.0 amp=0.10 u=-1.44	agent1	perturbation	0	0
exp5244	1.23429977e-28	0.000000	0.000000	discard	precise u=1.0000 amp=0.003 r2	agent0	solver_param	0	0.000000
exp5245	1.23429977e-28	0.000000	0.000000	discard	cycle 28 u=0.0982	agent0	initial_cond	0	0.000000
exp5246	6.34292334e-16	0.999523	-1.000001	discard	negative_branch phase=3.0 amp=0.15 u=-1.44	agent1	perturbation	1	-1.555918
exp5247	1.23429977e-28	0.000000	0.000000	discard	precise u=1.0001 amp=0.003 r1	agent0	solver_param	1	0.000000
exp5247	1.23429977e-28	0.000000	0.000000	discard	cycle 28 u=0.0982	agent0	initial_cond	1	0.000000
exp5248	crash	0	0	crash	negative_branch phase=3.0 amp=0.20 u=-1.44	agent1	perturbation	0	0
exp5249	1.88036672e-29	0.000000	0.000000	discard	cycle 28 u=0.0982	agent0	initial_cond	0	0.000000
exp5249	1.88036672e-29	0.000000	0.000000	discard	precise u=1.0001 amp=0.003 r2	agent0	solver_param	0	0.000000
exp5250	7.16287468e-16	1.001298	1.000025	discard	cycle 28 u=0.0982	agent0	initial_cond	1	-1.520921
exp5250	7.16287468e-16	1.001298	1.000025	discard	precise u=1.0002 amp=0.003 r1	agent0	solver_param	1	-1.520921
exp5251	7.16287468e-16	1.001298	1.000025	discard	cycle 28 u=0.0982	agent0	initial_cond	0	-1.520921
exp5252	7.16287468e-16	1.001298	1.000025	discard	precise u=1.0003 amp=0.003 r1	agent0	solver_param	0	-1.520921
exp5253	4.85524279e-16	1.001298	1.000025	discard	cycle 28 u=0.0982	agent0	initial_cond	0	-1.520921
exp5254	1.91190259e-29	0.000000	-0.000000	discard	precise u=1.0005 amp=0.003 r1	agent0	solver_param	0	0.000000
exp5255	4.85524279e-16	1.001298	1.000025	discard	cycle 28 u=0.0982	agent0	initial_cond	1	-1.520921
exp5256	1.91190259e-29	0.000000	-0.000000	discard	precise u=1.0005 amp=0.003 r2	agent0	solver_param	0	0.000000
exp5257	7.16287468e-16	1.001298	1.000025	discard	cycle 28 u=0.0982	agent0	initial_cond	0	-1.520921
exp5258	6.13049994e-29	0.000000	0.000000	discard	precise u=1.001 amp=0.003 r1	agent0	solver_param	0	0.000000
exp5259	7.16287468e-16	1.001298	1.000025	discard	cycle 28 u=0.0985	agent0	initial_cond	0	-1.520921
exp5260	6.13049994e-29	0.000000	0.000000	discard	precise u=1.001 amp=0.003 r2	agent0	solver_param	1	0.000000
exp5261	6.13049994e-29	0.000000	0.000000	discard	cycle 28 u=0.0985	agent0	initial_cond	1	0.000000
exp5262	6.13049994e-29	0.000000	0.000000	discard	cycle 28 u=0.0985	agent0	initial_cond	0	0.000000
exp5263	5.49750971e-29	0.000000	0.000000	discard	cycle 28 u=0.0985	agent0	initial_cond	1	0.000000
exp5264	5.49750971e-29	0.000000	0.000000	discard	cycle 28 u=0.0985	agent0	initial_cond	0	0.000000
exp5265	5.49750971e-29	0.000000	0.000000	discard	cycle 28 u=0.0985	agent0	initial_cond	0	0.000000
exp5266	4.15642452e-29	0.000000	0.000000	discard	cycle 28 u=0.0985	agent0	initial_cond	1	0.000000
exp5267	4.15642452e-29	0.000000	0.000000	discard	cycle 28 u=0.0985	agent0	initial_cond	0	0.000000
exp5268	4.15642452e-29	0.000000	0.000000	discard	cycle 28 u=0.0985	agent0	initial_cond	0	0.000000
exp5269	2.19292611e-29	0.000000	0.000000	discard	cycle 28 u=0.0985	agent0	initial_cond	1	-0.000000
exp5270	2.19292611e-29	0.000000	0.000000	discard	cycle 28 u=0.0985	agent0	initial_cond	0	-0.000000
exp5271	2.19292611e-29	0.000000	0.000000	discard	cycle 28 u=0.0985	agent0	initial_cond	0	-0.000000
exp5272	4.22491788e-29	0.000000	0.000000	discard	cycle 28 u=0.0990	agent0	initial_cond	0	-0.000000
exp5273	4.22491788e-29	0.000000	0.000000	discard	cycle 28 u=0.0990	agent0	initial_cond	0	-0.000000
exp5274	4.22491788e-29	0.000000	0.000000	discard	cycle 28 u=0.0990	agent0	initial_cond	1	-0.000000
exp5275	3.22245147e-29	0.000000	0.000000	discard	cycle 28 u=0.0990	agent0	initial_cond	0	0.000000
exp5276	3.22245147e-29	0.000000	0.000000	discard	cycle 28 u=0.0990	agent0	initial_cond	0	0.000000
exp5277	3.22245147e-29	0.000000	0.000000	discard	cycle 28 u=0.0990	agent0	initial_cond	1	0.000000
exp5278	4.50941488e-29	0.000000	-0.000000	discard	cycle 28 u=0.0990	agent0	initial_cond	0	0.000000
exp5279	4.50941488e-29	0.000000	-0.000000	discard	cycle 28 u=0.0990	agent0	initial_cond	0	0.000000
exp5280	4.50941488e-29	0.000000	-0.000000	discard	cycle 28 u=0.0990	agent0	initial_cond	0	0.000000
exp5281	4.88330883e-29	0.000000	-0.000000	discard	cycle 28 u=0.0990	agent0	initial_cond	0	0.000000
exp5282	4.88330883e-29	0.000000	-0.000000	discard	cycle 28 u=0.0990	agent0	initial_cond	1	0.000000
exp5283	4.88330883e-29	0.000000	-0.000000	discard	cycle 28 u=0.0990	agent0	initial_cond	0	0.000000
exp5284	5.74085541e-29	0.000000	-0.000000	discard	cycle 28 u=0.0995	agent0	initial_cond	0	0.000000
exp5285	5.74085541e-29	0.000000	-0.000000	discard	cycle 28 u=0.0995	agent0	initial_cond	1	0.000000
exp5286	5.74085541e-29	0.000000	-0.000000	discard	cycle 28 u=0.0995	agent0	initial_cond	0	0.000000
exp5287	1.54984578e-28	0.000000	0.000000	discard	cycle 28 u=0.0995	agent0	initial_cond	0	-0.000000
exp5288	1.54984578e-28	0.000000	0.000000	discard	cycle 28 u=0.0995	agent0	initial_cond	1	-0.000000
exp5289	1.54984578e-28	0.000000	0.000000	discard	cycle 28 u=0.0995	agent0	initial_cond	0	-0.000000
exp5290	1.60328418e-29	0.000000	-0.000000	discard	cycle 28 u=0.0995	agent0	initial_cond	0	-0.000000
exp5291	1.60328418e-29	0.000000	-0.000000	discard	cycle 28 u=0.0995	agent0	initial_cond	0	-0.000000
exp5292	1.60328418e-29	0.000000	-0.000000	discard	cycle 28 u=0.0995	agent0	initial_cond	0	-0.000000
exp5293	2.00148302e-16	1.001298	1.000025	discard	cycle 28 u=0.0995	agent0	initial_cond	1	-1.520921
exp5294	7.34590618e-29	0.000000	0.000000	discard	batch trial 1	agent0	solver_param	0	0.000000
exp5295	7.34590618e-29	0.000000	0.000000	discard	cycle 28 u=0.0995	agent0	initial_cond	0	0.000000
exp5296	7.34590618e-29	0.000000	0.000000	discard	batch trial 2	agent0	solver_param	0	0.000000
exp5297	7.34590618e-29	0.000000	0.000000	discard	cycle 28 u=0.0995	agent0	initial_cond	0	0.000000
exp5298	4.46546993e-29	0.000000	0.000000	discard	batch trial 3	agent0	solver_param	1	-0.000000
exp5298	4.46546993e-29	0.000000	0.000000	discard	cycle 28 u=0.1000	agent0	initial_cond	1	-0.000000
exp5299	2.00148302e-16	1.001298	1.000025	discard	cycle 28 u=0.1000	agent0	initial_cond	0	-1.520921
exp5299	2.00148302e-16	1.001298	1.000025	discard	batch trial 4	agent0	solver_param	0	-1.520921
exp5300	2.00148302e-16	1.001298	1.000025	discard	cycle 28 u=0.1000	agent0	initial_cond	0	-1.520921
exp5300	2.00148302e-16	1.001298	1.000025	discard	batch trial 5	agent0	solver_param	1	-1.520921
exp5301	2.00148302e-16	1.001298	1.000025	discard	cycle 28 u=0.1000	agent0	initial_cond	0	-1.520921
exp5302	2.00148302e-16	1.001298	1.000025	discard	batch trial 6	agent0	solver_param	0	-1.520921
exp5303	2.00148302e-16	1.001298	1.000025	discard	cycle 28 u=0.1000	agent0	initial_cond	0	-1.520921
exp5304	4.08106752e-29	0.000000	0.000000	discard	batch trial 7	agent0	solver_param	0	-0.000000
exp5305	2.00148302e-16	1.001298	1.000025	discard	cycle 28 u=0.1000	agent0	initial_cond	1	-1.520921
exp5306	4.58623706e-29	0.000000	0.000000	discard	batch trial 8	agent0	solver_param	1	-0.000000
exp5307	2.00148302e-16	1.001298	1.000025	discard	cycle 28 u=0.1000	agent0	initial_cond	0	-1.520921
exp5308	4.58623706e-29	0.000000	0.000000	discard	batch trial 9	agent0	solver_param	0	-0.000000
exp5309	2.00148302e-16	1.001298	1.000025	discard	cycle 28 u=0.1000	agent0	initial_cond	0	-1.520921
exp5310	4.58623706e-29	0.000000	0.000000	discard	batch trial 10	agent0	solver_param	1	-0.000000
exp5311	4.58623706e-29	0.000000	0.000000	discard	cycle 28 u=0.1000	agent0	initial_cond	1	-0.000000
exp5312	4.39794337e-29	0.000000	0.000000	discard	batch trial 11	agent0	solver_param	0	-0.000000
exp5313	4.39794337e-29	0.000000	0.000000	discard	cycle 28 u=0.1000	agent0	initial_cond	0	-0.000000
exp5314	4.39794337e-29	0.000000	0.000000	discard	batch trial 12	agent0	solver_param	0	-0.000000
exp5314	4.39794337e-29	0.000000	0.000000	discard	cycle 28 u=0.1000	agent0	initial_cond	0	-0.000000
exp5315	4.39794337e-29	0.000000	0.000000	discard	cycle 28 u=0.1000	agent0	initial_cond	0	-0.000000
exp5315	4.39794337e-29	0.000000	0.000000	discard	batch trial 13	agent0	solver_param	0	-0.000000
exp5316	2.00148302e-16	1.001298	1.000025	discard	cycle 28 u=0.1050	agent0	initial_cond	0	-1.520921
exp5316	2.00148302e-16	1.001298	1.000025	discard	batch trial 14	agent0	solver_param	0	-1.520921
exp5317	2.00148302e-16	1.001298	1.000025	discard	cycle 28 u=0.1050	agent0	initial_cond	1	-1.520921
exp5318	2.00148302e-16	1.001298	1.000025	discard	batch trial 15	agent0	solver_param	1	-1.520921
exp5319	2.00148302e-16	1.001298	1.000025	discard	cycle 28 u=0.1050	agent0	initial_cond	0	-1.520921
exp5320	6.14461376e-29	0.000000	0.000000	discard	batch trial 16	agent0	solver_param	0	-0.000000
exp5321	2.00148302e-16	1.001298	1.000025	discard	cycle 28 u=0.1050	agent0	initial_cond	0	-1.520921
exp5322	6.14461376e-29	0.000000	0.000000	discard	batch trial 17	agent0	solver_param	0	-0.000000
exp5323	2.00148302e-16	1.001298	1.000025	discard	cycle 28 u=0.1050	agent0	initial_cond	1	-1.520921
exp5324	6.14461376e-29	0.000000	0.000000	discard	batch trial 18	agent0	solver_param	0	-0.000000
exp5325	2.00148302e-16	1.001298	1.000025	discard	cycle 28 u=0.1050	agent0	initial_cond	0	-1.520921
exp5326	1.75906666e-28	0.000000	0.000000	discard	batch trial 19	agent0	solver_param	0	-0.000000
exp5327	1.75906666e-28	0.000000	0.000000	discard	cycle 28 u=0.1050	agent0	initial_cond	0	-0.000000
exp5328	1.75906666e-28	0.000000	0.000000	discard	batch trial 20	agent0	solver_param	1	-0.000000
exp5329	1.75906666e-28	0.000000	0.000000	discard	cycle 28 u=0.1050	agent0	initial_cond	0	-0.000000
exp5330	1.75906666e-28	0.000000	0.000000	discard	batch trial 21	agent0	solver_param	0	-0.000000
exp5330	1.75906666e-28	0.000000	0.000000	discard	cycle 28 u=0.1050	agent0	initial_cond	0	-0.000000
exp5331	1.11257917e-28	0.000000	0.000000	discard	cycle 28 u=0.1050	agent0	initial_cond	1	-0.000000
exp5331	1.11257917e-28	0.000000	0.000000	discard	batch trial 22	agent0	solver_param	1	-0.000000
exp5332	2.00148302e-16	1.001298	1.000025	discard	cycle 28 u=0.1050	agent0	initial_cond	0	-1.520921
exp5332	2.00148302e-16	1.001298	1.000025	discard	batch trial 23	agent0	solver_param	0	-1.520921
exp5333	2.00148302e-16	1.001298	1.000025	discard	cycle 28 u=0.1050	agent0	initial_cond	0	-1.520921
exp5334	2.00148302e-16	1.001298	1.000025	discard	batch trial 24	agent0	solver_param	0	-1.520921
exp5335	2.00148302e-16	1.001298	1.000025	discard	cycle 29 u=0.0975	agent0	initial_cond	1	-1.520921
exp5336	8.58580947e-29	0.000000	0.000000	discard	batch trial 25	agent0	solver_param	1	0.000000
exp5337	2.00148302e-16	1.001298	1.000025	discard	cycle 29 u=0.0975	agent0	initial_cond	0	-1.520921
exp5338	8.58580947e-29	0.000000	0.000000	discard	batch trial 26	agent0	solver_param	0	0.000000
exp5339	2.00148302e-16	1.001298	1.000025	discard	cycle 29 u=0.0975	agent0	initial_cond	0	-1.520921
exp5340	5.23962023e-29	0.000000	0.000000	discard	batch trial 27	agent0	solver_param	1	0.000000
exp5341	2.00148302e-16	1.001298	1.000025	discard	cycle 29 u=0.0975	agent0	initial_cond	1	-1.520921
exp5342	5.23962023e-29	0.000000	0.000000	discard	batch trial 28	agent0	solver_param	0	0.000000
exp5343	2.00148302e-16	1.001298	1.000025	discard	cycle 29 u=0.0975	agent0	initial_cond	0	-1.520921
exp5344	5.23962023e-29	0.000000	0.000000	discard	batch trial 29	agent0	solver_param	0	0.000000
exp5345	5.23962023e-29	0.000000	0.000000	discard	cycle 29 u=0.0975	agent0	initial_cond	1	0.000000
exp5346	4.03266298e-29	0.000000	0.000000	discard	batch trial 30	agent0	solver_param	0	0.000000
exp5347	4.03266298e-29	0.000000	0.000000	discard	cycle 29 u=0.0975	agent0	initial_cond	0	0.000000
exp5348	4.03266298e-29	0.000000	0.000000	discard	batch trial 31	agent0	solver_param	0	0.000000
exp5348	4.03266298e-29	0.000000	0.000000	discard	cycle 29 u=0.0975	agent0	initial_cond	0	0.000000
exp5349	2.00148302e-16	1.001298	1.000025	discard	cycle 29 u=0.0975	agent0	initial_cond	1	-1.520921
exp5349	2.00148302e-16	1.001298	1.000025	discard	batch trial 32	agent0	solver_param	1	-1.520921
exp5350	2.00148302e-16	1.001298	1.000025	discard	cycle 29 u=0.0975	agent0	initial_cond	0	-1.520921
exp5351	2.00148302e-16	1.001298	1.000025	discard	batch trial 33	agent0	solver_param	0	-1.520921
exp5352	2.00148302e-16	1.001298	1.000025	discard	cycle 29 u=0.0975	agent0	initial_cond	0	-1.520921
exp5353	2.00148302e-16	1.001298	1.000025	discard	batch trial 34	agent0	solver_param	0	-1.520921
exp5354	2.00148302e-16	1.001298	1.000025	discard	cycle 29 u=0.0975	agent0	initial_cond	1	-1.520921
exp5355	2.68824537e-29	0.000000	0.000000	discard	batch trial 35	agent0	solver_param	0	-0.000000
exp5356	2.00148302e-16	1.001298	1.000025	discard	cycle 29 u=0.0980	agent0	initial_cond	0	-1.520921
exp5357	2.68824537e-29	0.000000	0.000000	discard	batch trial 36	agent0	solver_param	0	-0.000000
exp5358	2.00148302e-16	1.001298	1.000025	discard	cycle 29 u=0.0980	agent0	initial_cond	1	-1.520921
exp5359	2.68824537e-29	0.000000	0.000000	discard	batch trial 37	agent0	solver_param	1	-0.000000
exp5360	2.00148302e-16	1.001298	1.000025	discard	cycle 29 u=0.0980	agent0	initial_cond	0	-1.520921
exp5361	6.16758073e-29	0.000000	0.000000	discard	batch trial 38	agent0	solver_param	0	-0.000000
exp5362	6.16758073e-29	0.000000	0.000000	discard	cycle 29 u=0.0980	agent0	initial_cond	0	-0.000000
exp5363	6.16758073e-29	0.000000	0.000000	discard	batch trial 39	agent0	solver_param	1	-0.000000
exp5364	6.16758073e-29	0.000000	0.000000	discard	cycle 29 u=0.0980	agent0	initial_cond	1	-0.000000
exp5365	6.16758073e-29	0.000000	0.000000	discard	batch trial 40	agent0	solver_param	0	-0.000000
exp5365	6.16758073e-29	0.000000	0.000000	discard	cycle 29 u=0.0980	agent0	initial_cond	0	-0.000000
