exp_id	residual	solution_norm	solution_mean	status	description	agent	design	elapsed_s	solution_energy
exp156	5.01823570e-15	1.006329	1.000225	discard	K_amplitude=0.35 bracketing anomaly, positive branch	agent7	problem_formulation	0	-1.426107
exp157	1.38713397e-12	1.011275	1.000598	discard	K_amplitude=0.45 testing recovery, positive branch	agent7	problem_formulation	0	-1.336072
exp158	9.63482347e-16	1.005094	1.000158	discard	K_amplitude=0.32 narrowing lower boundary, positive branch	agent7	problem_formulation	0	-1.449018
exp159	3.52452098e-16	1.013008	1.000766	discard	K_amplitude=0.48 narrowing upper boundary, positive branch	agent7	problem_formulation	1	-1.305091
exp160	9.34670194e-14	1.008642	-1.000379	discard	K_amplitude=0.4 negative branch, testing bifurcation symmetry	agent7	problem_formulation	0	-1.383677
exp161	2.62079662e-14	1.073040	1.072111	discard	K_frequency=0.5 subharmonic, K_amplitude=0.3	agent7	problem_formulation	0	-1.481736
exp162	3.61888431e-16	1.004334	1.000123	discard	K_frequency=1.0 baseline, K_amplitude=0.3	agent7	problem_formulation	0	-1.463212
exp163	3.61888431e-16	1.004334	1.000123	discard	K_frequency=1.5 superharmonic, K_amplitude=0.3	agent7	problem_formulation	0	-1.463212
exp164	5.68820034e-16	1.002066	1.000582	discard	K_frequency=2.0 second harmonic, K_amplitude=0.3	agent7	problem_formulation	0	-1.511631
exp165	3.53270803e-16	1.004334	1.000123	discard	K_frequency=3.0 third harmonic, K_amplitude=0.3	agent7	problem_formulation	1	-1.463212
exp166	2.62079662e-14	1.073040	1.072111	discard	K_frequency=0.75 between subharmonic and baseline, K_amplitude=0.3	agent7	problem_formulation	0	-1.481736
exp167	2.62079662e-14	1.073040	1.072111	discard	K_frequency=0.9 approaching baseline, K_amplitude=0.3	agent7	problem_formulation	0	-1.481736
exp168	2.62079662e-14	1.073040	1.072111	discard	K_frequency=0.95 near boundary, K_amplitude=0.3	agent7	problem_formulation	0	-1.481736
exp169	2.62079662e-14	1.073040	1.072111	discard	K_frequency=0.99 very close to boundary, K_amplitude=0.3	agent7	problem_formulation	0	-1.481736
exp170	1.97178508e-14	1.073038	1.072106	discard	K_frequency=0.5 + fourier_modes=4 rescue test, K_amplitude=0.3	agent7	problem_formulation	1	-1.481673
exp171	1.98040493e-14	1.073038	1.072106	discard	K_frequency=0.5 + fourier_modes=8 aggressive rescue test, K_amplitude=0.3	agent7	problem_formulation	1	-1.481673
